ORDER	SENTENCE	STATUS	WORD	RANK	COUNT	COUNT_REL	INDEX	ID
5740	ويقول المسؤولون إن الاجتماع كان إيجابيا، لكن الفتاة رغم ذلك تقول إنها لا تريد أن تعود إلى المدرسة العام المقبل.	Y	المدرسة	1120	    7,026	0.0107	895.6	arabic_news_2017_00968708
5741	و في هذا العام يختلف الحفل من حيث المكان.	Y	المكان	1121	    7,024	0.0107	620.4444	arabic_news_2016_00770400
5742	ولم يكن هناك أي مسلح في المكان.	Y	المكان	1121	    7,024	0.0107	804.2857	arabic_news_2015_00885484
5743	وكانت القوات الحكومية أعلنت الأحد الماضي أنها دخلت المدينة، وأشار شاهد في المكان إلى أنها أحكمت كما يبدو السيطرة عليها.	Y	المكان	1121	    7,024	0.0107	823.7895	arabic_news_2017_00844668
5744	أنا كتبت عنها فى نفس هذا المكان.	Y	المكان	1121	    7,024	0.0107	832.1429	arabic_news_2017_00134830
5745	وليس هناك التفكير في الإنسان المناسب في المكان المناسب.	Y	المكان	1121	    7,024	0.0107	847.8571	arabic_news_2015_00889355
5746	عرض فيلم «صباح الليل» في مدينة الطائف التعليقات المنشورة لا تعبر عن رأي «الرياض» الإلكتروني ولا تتحمل أي مسؤولية قانونية حيال ذلك، ويتحمل كاتبها مسؤولية النشر.	Y	فيلم	1122	    7,023	0.0107	771.24	arabic_news_2016_00273243
5747	أفضل فيلم عربي في «روتردام» التعليقات المنشورة لا تعبر عن رأي «الرياض» الإلكتروني ولا تتحمل أي مسؤولية قانونية حيال ذلك، ويتحمل كاتبها مسؤولية النشر.	Y	فيلم	1122	    7,023	0.0107	849	arabic_news_2017_00042333
5748	صراع مع الحياة فيلم Polytechnique لابد من قتل النساء التعليقات المنشورة لا تعبر عن رأي «الرياض» الإلكتروني ولا تتحمل أي مسؤولية قانونية حيال ذلك، ويتحمل كاتبها مسؤولية النشر.	Y	فيلم	1122	    7,023	0.0107	862.7407	arabic_news_2016_00264463
5749	فيلم تصبح على خير ان شاء الله.	Y	فيلم	1122	    7,023	0.0107	885.2857	arabic_news_2017_00336798
5750	من بينها فيلم ل«سكورسيزي» التعليقات المنشورة لا تعبر عن رأي «الرياض» الإلكتروني ولا تتحمل أي مسؤولية قانونية حيال ذلك، ويتحمل كاتبها مسؤولية النشر.	Y	فيلم	1122	    7,023	0.0107	911.7391	arabic_news_2017_00463370
5751	ودعا جولين في بيان له اليوم الأربعاء الحكومة الأمريكية إلى..	Y	ودعا	1123	    7,022	0.0107	745.7	arabic_news_2016_00692629
5752	ودعا العربي فى بيان له مساء الأحد المجتمع الدولي لتجريم هذا العمل الإرهابي.	Y	ودعا	1123	    7,022	0.0107	796.6923	arabic_news_2016_00691881
5753	ودعا خبراء التعليم إلى مزيد من وقت التعليم.	Y	ودعا	1123	    7,022	0.0107	804.8571	arabic_news_2017_00704873
5754	ودعا المواطنين الى عدم الخوف لا سيما بعد الحوادث الأمنية التي حصلت قبل يومين في المنطقة.	Y	ودعا	1123	    7,022	0.0107	811.5	arabic_news_2016_00692213
5755	كما دعا إلى وضع دستور جديد ودعا الولايات المتحدة إلى موقف واضح من الأحداث التي تجري في بلاده.	Y	ودعا	1123	    7,022	0.0107	843.7059	arabic_news_2017_00375629
5756	خدمة القارئ الصوتي لأخبار جريدة الرياض مقدمة من شركة اسجاتك وصلت الرسالة.	Y	وصلت	1123	    7,022	0.0107	760	arabic_news_2017_00234256
5757	أعتقد أن الرسالة قد وصلت يا حكومة.	Y	وصلت	1123	    7,022	0.0107	773.8571	arabic_news_2016_00038919
5758	وبالفعل بعد يوم واحد فقط كانت مجموعة صغيرة قد وصلت.	Y	وصلت	1123	    7,022	0.0107	785.1	arabic_news_2015_00593422
5759	وقد ‏وصلت وزيرة خارجية الاتحاد الأوروبي إلى غزة صباح أمس، في ثاني زيارة لها للقطاع.	Y	وصلت	1123	    7,022	0.0107	787.5333	arabic_news_2016_00834845
5760	وقال: إنه لدى روسيا ما يكفي من الأدوية لمعالجة هذا المرض، وأضاف لقد وصلت الأدوية إلى هناك.	Y	وصلت	1123	    7,022	0.0107	807.4375	arabic_news_2016_00787138
5761	على ما أعتقد أن هذا هو السبب الرئيسي.	Y	السبب	1124	    7,016	0.0107	523.375	arabic_news_2015_00259998
5762	هذا هو السبب في أنه من الأفضل أن نعمل الآن.	Y	السبب	1124	    7,016	0.0107	680.5	arabic_news_2017_00497743
5763	هل يعني هذا أن ذاك الغاز هو السبب؟.	Y	السبب	1124	    7,016	0.0107	704	arabic_news_2015_00456015
5764	هذا هو السبب الأول, فماذا عن الثاني؟	Y	السبب	1124	    7,016	0.0107	733.7143	arabic_news_2017_00497733
5765	وقال الفالح اليوم الأحد إن السبب في ذلك هو عدم التوصل بعد إلى اتفاق داخل أوبك.	Y	السبب	1124	    7,016	0.0107	759.5625	arabic_news_2017_00785824
5766	وذكرت المستشارة أن الحكومة الألمانية تعمل على تحقيق ذلك ومن الممكن أن يلعب هذا الأمر دورا كبيرا خلال المحادثات الاقتصادية مع الولايات المتحدة.	Y	كبيرا	1125	    7,015	0.0107	851	arabic_news_2016_00697753
5767	في الحقيقة، دور الأمم المتحدة والقوى الخارجية لن يكون كبيرا في ظل الوضع الذي آلت إليه سوريا.	Y	كبيرا	1125	    7,015	0.0107	859.25	arabic_news_2016_00316497
5768	رغم انه مبلغ لا يشكل شيئا كبيرا من المال.	Y	كبيرا	1125	    7,015	0.0107	891.7778	arabic_news_2016_00247241
5769	، و مع أن هناك تحاملا كبيرا على المملكة العربية السعودية في كثير من المواضع محل الحوار ، على الأقل من قبل «د.	Y	كبيرا	1125	    7,015	0.0107	897.1579	arabic_news_2016_00897064
5770	كما يعتبر وجود النساء في قطاع الصحة كبيرا جدا، إذ تشكل نسبتهن أكثر من ٦٠ بالمائة من مجموع العاملين بهذا القطاع.	Y	كبيرا	1125	    7,015	0.0107	932.3684	arabic_news_2015_00347339
5771	وتابع يجب ان يلعب مع برشلونة في الاول قبل باقي الفرق.	Y	برشلونة	1126	    7,012	0.0107	747	arabic_news_2015_00616866
5772	بداية برشلونة للدفاع عن اللقب الأوروبي التعليقات المنشورة لا تعبر عن رأي «الرياض» الإلكتروني ولا تتحمل أي مسؤولية قانونية حيال ذلك، ويتحمل كاتبها مسؤولية النشر.	Y	برشلونة	1126	    7,012	0.0107	773.5217	arabic_news_2016_00164070
5773	حان الآن وقت العمل من أجل برشلونة.	Y	برشلونة	1126	    7,012	0.0107	783.5714	arabic_news_2015_00209877
5774	كما سجل ميسي اليوم الهدف ٤٠٠ له مع برشلونة في مختلف البطولات.	Y	برشلونة	1126	    7,012	0.0107	793.7273	arabic_news_2017_00376637
5775	ورفع برشلونة رصيده إلى ٢٦ نقطة من عشر مباريات بفارق نقطة واحدة أمام ريال مدريد.	Y	برشلونة	1126	    7,012	0.0107	860.6923	arabic_news_2017_00719482
5776	مشيرا إلى أن عملية التسجيل جرت خلال الأيام الست الماضية وفقا لما هو مخطط لها من قبل وزارة الإدارة المحلية.	Y	وفقا	1127	    7,011	0.0107	828.4	arabic_news_2017_00450929
5777	وكانت قذيفة سورية قد سقطت على الأراضي التركية بعد ظهر اليوم (السبت)، على بعد حوالي ١٢٠٠ م من الحدود السورية، وفقا لما ذكر بيان رسمي صدر عن الجانب التركي.	Y	وفقا	1127	    7,011	0.0107	844.9231	arabic_news_2015_00845037
5778	وأضاف لي أن الصين تحترم حق كافة الدول في اختيار طريق التنمية الخاص بها وفقا للظروف الوطنية الخاصة.	Y	وفقا	1127	    7,011	0.0107	856.4444	arabic_news_2017_00564432
5779	وبالتالي وفقا للربعي »لا يجب ان تتحمل مجموعة واحدة او دولة واحدة مسؤولية الفشل« في عقد القمة العربية.	Y	وفقا	1127	    7,011	0.0107	898.2941	arabic_news_2015_00592640
5780	كما وصلت الثقة الاستراتيجية المتبادلة بين البلدين إلى أعلى مستوى، وفقا لما قال.	Y	وفقا	1127	    7,011	0.0107	903	arabic_news_2016_00367923
5781	لم يتم الاعلان عن اي منها حتى الان.	Y	الان	1128	    7,002	0.0107	675	arabic_news_2015_00382595
5782	وقال انه الان «أقوى شخص في السودان.	Y	الان	1128	    7,002	0.0107	692.2857	arabic_news_2015_00777710
5783	لكن حتى الان ليس هناك أي دلائل على ذلك.	Y	الان	1128	    7,002	0.0107	706.7778	arabic_news_2015_00372349
5784	غير ان اللقاء لم يعقد حتى الان.	Y	الان	1128	    7,002	0.0107	712.4286	arabic_news_2015_00265250
5785	الدستور: ما هو العدد المتضرر الان من هذا القرار؟	Y	الان	1128	    7,002	0.0107	755.6667	arabic_news_2015_00068404
5786	وأوضح أن الرأي العام هو الذي يقود مصر في الوقت الراهن.	Y	الرأي	1129	    6,999	0.0107	645	arabic_news_2017_00619749
5787	ويجب أن يكون هناك تدخل من أصحاب الرأي.	Y	الرأي	1129	    6,999	0.0107	705.75	arabic_news_2016_00950494
5788	كل ذلك كان له دور في تغيير الرأي الحاصل.	Y	الرأي	1129	    6,999	0.0107	744.1111	arabic_news_2015_00325501
5789	لكن أوباما يحتاج بقوة إلى الدعم المحلي من الرأي العام الأميركي أولا.	Y	الرأي	1129	    6,999	0.0107	775.5833	arabic_news_2017_00411748
5790	الرد رقم ١٥.. و الله و نعم الرأي.	Y	الرأي	1129	    6,999	0.0107	794.6667	arabic_news_2017_00077732
5791	وقال سليمان بعد اللقاء أنه من الطبيعي أن يزور سلام من وقت الى آخر، «من..	Y	سليمان	1130	    6,998	0.0107	624.4615	arabic_news_2017_00807194
5792	عمر سليمان لا يريد أن يقترب من السياسة، يريد، على ما يبدو، أن يكون صوت كل السوريين.	Y	سليمان	1130	    6,998	0.0107	752	arabic_news_2016_00279860
5793	وقال مصدر في الحركة لـ  الحياة» إن لقاء الوفد مع رئيس الاستخبارات المصرية عمر سليمان استمر ساعتين أمس.	Y	سليمان	1130	    6,998	0.0107	848.9444	arabic_news_2015_00808690
5794	وقال الرئيس سليمان في كلمة ألقاها خلال لقاء رجال الاعمال اللبنانيين في المملكة العربية السعودية ليس في لبنان مناطق إرهابية.	Y	سليمان	1130	    6,998	0.0107	853.3333	arabic_news_2015_00766149
5795	وهو ليس في أفضل حال مع سليمان فرنجيه.	Y	سليمان	1130	    6,998	0.0107	881.375	arabic_news_2017_00935169
5796	وغير المنضبط لا مكان له في الفريق التعليقات المنشورة لا تعبر عن رأي «الرياض» الإلكتروني ولا تتحمل أي مسؤولية قانونية حيال ذلك، ويتحمل كاتبها مسؤولية النشر.	Y	وغير	1130	    6,998	0.0107	767.0833	arabic_news_2016_00748000
5797	مشيرا إلى انه في (إسرائيل) هناك يهود وغير يهود.	Y	وغير	1130	    6,998	0.0107	829.25	arabic_news_2016_00430893
5798	وأعلنت الشرطة عن نشر مزيد من رجال الأمن المسلحين وغير المسلحين في لندن.	Y	وغير	1130	    6,998	0.0107	855.8333	arabic_news_2017_00574095
5799	وقال ان «على دول التحالف وغير دول التحالف ان تنهي «داعش».	Y	وغير	1130	    6,998	0.0107	869.5	arabic_news_2017_00791793
5800	وفي ختام جلسة له في مقر الجامعة العربية في القاهرة، أكد البرلمان العربي، وفق بيان صادر عنه مساء اليوم، “رفضه التدخل الخارجي الإيراني المباشر، وغير المباشر، عن طريق “حزب الله” في شؤون الدول العربية”.	Y	وغير	1130	    6,998	0.0107	888.5333	arabic_news_2016_00761078
5801	ومن المنتظر أن تبدأ هذه الجولة في وقت لاحق من العام الحالي.	Y	الجولة	1131	    6,994	0.0106	793.6667	arabic_news_2015_00901698
5802	ومن المقرر أن تنطلق الجولة الجديدة من مفاوضات السلام السورية في جنيف يوم ٢٠ فبراير/شباط الجاري.	Y	الجولة	1131	    6,994	0.0106	810.3125	arabic_news_2017_00903372
5803	وقد جاءت زيارة الرئيس كارتر ضمن جدول الجولة التي يقوم بها حاليا في منطقة الشرق الأوسط.	Y	الجولة	1131	    6,994	0.0106	812.9375	arabic_news_2016_00827985
5804	من جانبه، أعلن نائب وزير الخارجية السوري فيصل المقداد أمس ان الجولة الثانية من مفاوضات جنيف-٢ مع وفد المعارضة، لم تحقق اي تقدم.	Y	الجولة	1131	    6,994	0.0106	831.1364	arabic_news_2016_00442945
5805	وفي الساعة الرابعة من مساء اليوم تقام فعاليات الجولة الثالثة من البطولة.	Y	الجولة	1131	    6,994	0.0106	837	arabic_news_2015_00741474
5806	خصوصا إذا كان على أحد المكاتب في الوزارة.	Y	خصوصا	1132	    6,992	0.0106	730.875	arabic_news_2015_00220837
5807	بكلام أوضح، لا يمكن التوفيق بين دعم الجيش اللبناني وبين تدمير مؤسسات الدولة اللبنانية، على رأسها رئاسة الجمهورية، خصوصا أن على الجيش اللبناني الآن مواجهة «داعش» الذي جاء به «حزب الله»، ولا أحد آخر غيره إلى لبنان.	Y	خصوصا	1132	    6,992	0.0106	785.6176	arabic_news_2015_00154333
5808	وهذا ما يفسر خصوصا وجود ١٥ مليون شخص (في الشارع).	Y	خصوصا	1132	    6,992	0.0106	854.6667	arabic_news_2015_00923658
5809	خصوصا ان بعض البنوك سجل خسائر في الربع الرابع من ٢٠٠٨.	Y	خصوصا	1132	    6,992	0.0106	887.7	arabic_news_2015_00220857
5810	وقال ان «الكثير من الدول الاوروبية ان لم تكن معظمها لا ترغب في مواجهة مع روسيا خصوصا في المستوى الاقتصادي.	Y	خصوصا	1132	    6,992	0.0106	898.3333	arabic_news_2016_00784858
5811	حيث ارتفع عدد الشركات الرياضية المحلية بنسبة ٣٠٠٪ في الأربع سنوات الماضية.	Y	الرياضية	1133	    6,988	0.0106	810	arabic_news_2017_00228165
5812	وكانت اللجنة الأولمبية الدولية قررت تعليق عمل اللجنة الأولمبية الكويتية بعد التدخل السياسي من الحكومة الكويتية في الحركة الرياضية.	Y	الرياضية	1133	    6,988	0.0106	830.9375	arabic_news_2016_00844936
5813	وكان ما كان من دخول معترك الصحافة الرياضية عبر هذه الصحيفة.	Y	الرياضية	1133	    6,988	0.0106	868.8182	arabic_news_2016_00853319
5814	هل هذا يخدم الرياضة السعودية خصوصا مع عهد القيادة الرياضية الجديدة؟	Y	الرياضية	1133	    6,988	0.0106	898.5455	arabic_news_2017_00509957
5815	وتقام المباراة النهائية مساء هذا اليوم في صالة مدينة الأمير محمد بن عبدالعزيز الرياضية.	Y	الرياضية	1133	    6,988	0.0106	935.8571	arabic_news_2015_00642088
5816	الى الآن لم يتم الدخول في تفاصيل آلية التصويت.	Y	تفاصيل	1133	    6,988	0.0106	764.2222	arabic_news_2017_00114599
5817	ومن المقرر إعلان تفاصيل هذا القانون في وقت لاحق.	Y	تفاصيل	1133	    6,988	0.0106	780.6667	arabic_news_2015_00900684
5818	غير أن الشركة لم تعط تفاصيل أخرى بشأن النظام.	Y	تفاصيل	1133	    6,988	0.0106	800.7778	arabic_news_2015_00265164
5819	من جهة اخرى قال أحد سكان قرية قريبة ، إن احد عناصر الدولة الإسلامية من نفس المنطقة روى له تفاصيل العملية.	Y	تفاصيل	1133	    6,988	0.0106	806.5263	arabic_news_2015_00418680
5820	ولم يكن من الممكن الاتصال بأي من المتحدث باسم الجيش أو المتحدث باسم الحكومة الفدرالية مساء الأحد للحصول على تفاصيل حول هذه المعلومات.	Y	تفاصيل	1133	    6,988	0.0106	806.7	arabic_news_2016_00887169
5821	هذا هو السؤال الذي يجب أن يطرح اليوم!	Y	السؤال	1134	    6,987	0.0106	568.5	arabic_news_2015_00445143
5822	لكن السؤال الذي يطرح، هو: كيف يتم ذلك؟	Y	السؤال	1134	    6,987	0.0106	603.5	arabic_news_2016_00393728
5823	أما في الداخل الأردني ، فقد ظل السؤال: من هو الأردني؟	Y	السؤال	1134	    6,987	0.0106	648.3333	arabic_news_2015_00114119
5824	ان السؤال بالطبع هو كيف يمكن الخروج من العراق؟	Y	السؤال	1134	    6,987	0.0106	682.1111	arabic_news_2016_00136740
5825	هذا هو السؤال الذي لا جواب عليه حتى الآن.	Y	السؤال	1134	    6,987	0.0106	682.2222	arabic_news_2015_00445140
5826	خدمة القارئ الصوتي لأخبار جريدة الرياض مقدمة من شركة اسجاتك في مصر الخلاف سياسي.	Y	سياسي	1135	    6,985	0.0106	720.7143	arabic_news_2017_00233704
5827	خدمة القارئ الصوتي لأخبار جريدة الرياض مقدمة من شركة اسجاتك الأمن الوطني مفهوم سياسي للدولة الحديثة التعليقات المنشورة لا تعبر عن رأي «الرياض» الإلكتروني ولا تتحمل أي مسؤولية قانونية حيال ذلك، ويتحمل كاتبها مسؤولية النشر.	Y	سياسي	1135	    6,985	0.0106	744.2424	arabic_news_2016_00232954
5828	ومن غير ذلك، لا أعتقد أن كل هذا الحراك سيؤدي إلى حل سياسي.	Y	سياسي	1135	    6,985	0.0106	768.4615	arabic_news_2016_00908392
5829	وهذا مؤشر كبير، نعم مؤشر سياسي كبير”.	Y	سياسي	1135	    6,985	0.0106	785.2	arabic_news_2017_00924957
5830	نحو مشروع سياسي عربي تقوده المملكة التعليقات المنشورة لا تعبر عن رأي «الرياض» الإلكتروني ولا تتحمل أي مسؤولية قانونية حيال ذلك، ويتحمل كاتبها مسؤولية النشر.	Y	سياسي	1135	    6,985	0.0106	789.0833	arabic_news_2016_00463065
5831	«الإرهاب»، منذ حينه، لم يكن ضد الاحتلال – بل ضد مجرد وجود إسرائيل.	Y	مجرد	1136	    6,984	0.0106	721.3636	arabic_news_2015_00050077
5832	كان يصعب مجرد التفكير في هذا الأمر منذ ٣٠ عام”.	Y	مجرد	1136	    6,984	0.0106	757.8889	arabic_news_2017_00357929
5833	هذا مجرد مثل واحد بين العديد من الأمثلة الأخرى.	Y	مجرد	1136	    6,984	0.0106	770	arabic_news_2015_00444850
5834	وأضاف العربي بأن المطلوب حاليا ليس مجرد وقف العدوان، وإنما العمل على إنهاء الاحتلال الإسرائيلي.	Y	مجرد	1136	    6,984	0.0106	791.2667	arabic_news_2016_00526261
5835	فيما وصف زعيم المعارضة قرار المحكمة بأنه مجرد بداية.	Y	مجرد	1136	    6,984	0.0106	824.5556	arabic_news_2016_00326704
5836	ومن المقرر عقده في ٣١ الحالي في مدينة الكويت.	Y	المقرر	1137	    6,981	0.0106	672.5714	arabic_news_2017_00903865
5837	ومن المقرر إعلان مشروع ميزانية العام الجديد في ٤ مارس المقبل.	Y	المقرر	1137	    6,981	0.0106	675.8	arabic_news_2016_00902122
5838	وتابع «من المقرر تحويل كل هذه الإجراءات..	Y	المقرر	1137	    6,981	0.0106	741.7143	arabic_news_2017_00649879
5839	ومن المقرر استكمال المشروع في بداية عام ٢٠١٦.	Y	المقرر	1137	    6,981	0.0106	744.4286	arabic_news_2016_00902118
5840	ومن المقرر إجراء الانتخابات التشريعية في النصف الأول من عام ٢٠١٧.	Y	المقرر	1137	    6,981	0.0106	777.1	arabic_news_2016_00902104
5841	ان شاء الله في هذا القرار كل خير للمواطن.	Y	خير	1138	    6,977	0.0106	811.8889	arabic_news_2016_00141918
5842	وفق الله الجميع لما فيه خير البلاد و العباد.	Y	خير	1138	    6,977	0.0106	829.2222	arabic_news_2017_00758811
5843	لا خير لنا إن بقي الجيش فقط بخير في الجزائر.	Y	خير	1138	    6,977	0.0106	843.5	arabic_news_2017_00392606
5844	حفظ الله الشيخ محمد بن راشد وأعاد على سموه هذه المناسبة وهو في خير وعلى خير.	Y	خير	1138	    6,977	0.0106	863.2667	arabic_news_2017_00225055
5845	‏ على كل حال كل عام وجميع الناس بكل خير.	Y	خير	1138	    6,977	0.0106	895.4444	arabic_news_2015_00259901
5846	ومن ذلك ما ذكره في ص١٦٨ من هذا الجزء الأول.	Y	ص	1139	    6,976	0.0106	712.9	arabic_news_2016_00907689
5847	والذي يتحقق من خلال ثلاثة مسارات كما جاء في ص: ٤ من نظام البرنامج.	Y	ص	1139	    6,976	0.0106	909.0833	arabic_news_2016_00581346
5848	رجال الكشي ص٢١٣ وكذلك روي عن عمر بن يزيد قال قال لي ابو عبد الله (عليه السلام): يا ابن يزيد أنت والله منا أهل البيت قلت له جعلت فداك من آل محمد؟	Y	ص	1139	    6,976	0.0106	1142.5	arabic_news_2015_00229093
5849	ـ محمد الطاهر محمد، المصدر السابق، ص٦١.	Y	ص	1139	    6,976	0.0106	1148.3333	arabic_news_2015_00398517
5850	كما قال نبينا الكريم (ص)الخير في وفي أمتي الى يوم الدين.	Y	ص	1139	    6,976	0.0106	1192.25	arabic_news_2016_00364967
5851	إذا كان نعم فما هو هذا الموقف؟	Y	نعم	1140	    6,972	0.0106	543.7143	arabic_news_2016_00026221
5852	نعم هذا هو الحب ليس لنا سيطرة عليه.	Y	نعم	1140	    6,972	0.0106	666.125	arabic_news_2016_00467095
5853	ـ نعم يسمح به في بداية شهر ثمانية.	Y	نعم	1140	    6,972	0.0106	736.125	arabic_news_2017_00489667
5854	نعم، كان في زيارة، ولكن الرئيس بومدين لم يكن على علم بذلك وأنا أيضا.	Y	نعم	1140	    6,972	0.0106	767.1429	arabic_news_2016_00466759
5855	نعم، ولكن ما هو النور وما هو العلم ؟	Y	نعم	1140	    6,972	0.0106	785.1429	arabic_news_2017_00489598
5856	ولكن هل يتم اتخاذ الاجراءات اللازمة من قبل أصحاب القرار ؟	Y	أصحاب	1141	    6,968	0.0106	696.8	arabic_news_2015_00878375
5857	٭ ولكن الفريق حتى الآن لم يضم لاعبين أصحاب أسماء كبيرة؟	Y	أصحاب	1141	    6,968	0.0106	829.4	arabic_news_2016_00876610
5858	ما عاد الملك حاكم السعودية، نحن أصحاب القرار.	Y	أصحاب	1141	    6,968	0.0106	834.375	arabic_news_2016_00417904
5859	لن يكون سوق الأسهم هو المكان الوحيد الذي يجب الاستثمار فيه وعلى أصحاب القرار استغلال هذه الفرصة التي لن تتكرر.	Y	أصحاب	1141	    6,968	0.0106	864.2632	arabic_news_2016_00409515
5860	لافتا إلى أن أصحاب هذه الأرض موجودون عليها منذ خمسة آلاف عاما.	Y	أصحاب	1141	    6,968	0.0106	882.8333	arabic_news_2017_00393814
5861	وقال في بيان «أحببت كل ثانية من العمل مع إن.	Y	ثانية	1142	    6,959	0.0106	657.9	arabic_news_2017_00810017
5862	وفي العلم لا يمكن المرور من الثالث إلى الأول دون المرور بالثاني مرة ثانية أين هو ؟	Y	ثانية	1142	    6,959	0.0106	774.7333	arabic_news_2015_00742716
5863	من جهة ثانية، دعا لافروف الى مشاركة ايران وسوريا في عملية السلام في الشرق الأوسط.	Y	ثانية	1142	    6,959	0.0106	834.8571	arabic_news_2016_00447066
5864	ولكن لماذا تم نقل هذا النفط عبر ناقلة ثانية؟	Y	ثانية	1142	    6,959	0.0106	850.5556	arabic_news_2015_00876811
