ORDER	SENTENCE	STATUS	WORD	RANK	COUNT	COUNT_REL	INDEX	ID
5494	الحد من النووي الإيراني مقابل تخفيف العقوبات التعليقات المنشورة لا تعبر عن رأي «الرياض» الإلكتروني ولا تتحمل أي مسؤولية قانونية حيال ذلك، ويتحمل كاتبها مسؤولية النشر.	Y	النووي	1075	    7,298	0.0111	820.08	arabic_news_2016_00070363
5495	شكرا لك ماذا يعني أن ما تحقق من مكاسب في ملف إيران النووي خلال عام أكثر مما تحقق في عشرة أعوام؟	Y	النووي	1075	    7,298	0.0111	847.9474	arabic_news_2015_00243151
5496	ولكن من هو الغرب الذي نتحدث عنه ؟	Y	الغرب	1076	    7,296	0.0111	743.4286	arabic_news_2017_00879138
5497	طبعا الوضع مختلف إلى حد ما في الغرب.	Y	الغرب	1076	    7,296	0.0111	768	arabic_news_2016_00267650
5498	يقول بعضهم في الغرب‏:‏ لا‏,‏ بل هؤلاء هم العرب المسلمون‏!	Y	الغرب	1076	    7,296	0.0111	775.3	arabic_news_2016_00995747
5499	الوعي: واضح تماما أن الغرب هو الذي شكل هذه الحكومة.	Y	الغرب	1076	    7,296	0.0111	782	arabic_news_2017_00114040
5500	لأن الغرب وكما هو الحال في سورية.	Y	الغرب	1076	    7,296	0.0111	826.2857	arabic_news_2017_00395139
5501	ولكن ما هو واقع أنه ليس هناك هذه المراقبة الدقيقة.	Y	الدقيقة	1077	    7,290	0.0111	647.9	arabic_news_2017_00878787
5502	لا يمكن لأحد أن يصف ما حدث في هذا الموقف وفي هذه الدقيقة.	Y	الدقيقة	1077	    7,290	0.0111	805.7692	arabic_news_2015_00359780
5503	وأكد أن ذلك قد عكس حرص المملكة العربية السعودية من خلال تلك الجهود على دعم اليمن خصوصا في هذه المرحلة الانتقالية الدقيقة والحساسة.	Y	الدقيقة	1077	    7,290	0.0111	807.2609	arabic_news_2016_00566819
5504	الدقيقة التي شهدت هدف المباراة الأول لمصلحة فريق الإمارات.	Y	الدقيقة	1077	    7,290	0.0111	840.5556	arabic_news_2016_00075315
5505	سجل هدف المباراة الوحيد اللاعب علي قاسم عند الدقيقة ٢٠ من المباراة.	Y	الدقيقة	1077	    7,290	0.0111	863.3	arabic_news_2016_00253425
5506	وكان الاعلام في السعودية ما عنده قضايا غير المرأة.	Y	قضايا	1078	    7,277	0.0111	707.6667	arabic_news_2016_00838755
5507	خدمة القارئ الصوتي لأخبار جريدة الرياض مقدمة من شركة اسجاتك قضايا لا تنتهي.	Y	قضايا	1078	    7,277	0.0111	722.4615	arabic_news_2017_00233733
5508	أين يقف النظام المصري من قضايا العرب؟	Y	قضايا	1078	    7,277	0.0111	740.8571	arabic_news_2017_00158149
5509	ولكن ذلك لا يعني أنه واحد من تلك الأفلام التي تتبنى قضايا المرأة بشكل سياسي مباشر.	Y	قضايا	1078	    7,277	0.0111	805.375	arabic_news_2016_00877687
5510	وعن قوة الواجب القطرية التي تشارك ضمن التحالف العربي في اليمن بقيادة السعودية، أكد رئيس تحرير «الشرق» أن» قطر كانت دائما مع أشقائها في الدفاع عن قضايا الأمة وعن قضايا مجلس التعاون.	Y	قضايا	1078	    7,277	0.0111	839	arabic_news_2016_00746700
5511	كم عدد الجرائم التي تحدث في البحرين؟	Y	كم	1079	    7,274	0.0111	758.7143	arabic_news_2017_00383763
5512	وأشار إلى أن أول رد فعل له على هذا النبأ هو سؤال الطبيب «كم تبقى لي في الحياة؟»	Y	كم	1079	    7,274	0.0111	812.3889	arabic_news_2016_00514586
5513	كم عدد الذي تم تنفيذ القصاص بهم في هذا الشهر ؟	Y	كم	1079	    7,274	0.0111	814	arabic_news_2016_00370197
5514	• كم استمر العمل على هذا الجهاز في التلفزيون؟	Y	كم	1079	    7,274	0.0111	844.625	arabic_news_2015_00340445
5515	وذلك من خلال: ـ كم ممارسة تعلمية تستحق أن تكون في مستوى أعلى مما هي عليه.	Y	كم	1079	    7,274	0.0111	852.9375	arabic_news_2016_00702236
5516	، وأضاف: “بعد عامين ثورة ضد جماعة الإخوان في كل مكان.”	Y	جماعة	1080	    7,273	0.0111	680.2	arabic_news_2016_00535211
5517	سوريا: ما هي خلفية عقد المؤتمر الأول لـ» جماعة الإخوان المسلمين» منذ ثلاثين عاما؟	Y	جماعة	1080	    7,273	0.0111	720.3571	arabic_news_2017_00258772
5518	وكانت جماعة الإخوان المسلمين في المقدمة منها.	Y	جماعة	1080	    7,273	0.0111	740.5714	arabic_news_2017_00846158
5519	وهذه لا يمكن أن تصدر إلا عن جماعة بوتفليقة في الرئاسة.	Y	جماعة	1080	    7,273	0.0111	751.2727	arabic_news_2017_00927270
5520	، مضيفا «بعد عامين هناك ثورة ضد جماعة الإخوان في كل مكان».	Y	جماعة	1080	    7,273	0.0111	752	arabic_news_2015_00405630
5521	أ.)، فإن الولايات المتحدة لا تزال تطالب به حتى الآن.	Y	تزال	1081	    7,270	0.0111	611.7	arabic_news_2016_00041676
5522	الا ان التحديات على الارض لا تزال كبيرة.	Y	تزال	1081	    7,270	0.0111	666.75	arabic_news_2016_00049646
5523	حيث ان هذه الدار لا تزال تعمل حتى الان.	Y	تزال	1081	    7,270	0.0111	728.2222	arabic_news_2017_00228527
5524	وما تزال تأتي في هذا الواقع الجديد لمن أراد المزيد!	Y	تزال	1081	    7,270	0.0111	763.4	arabic_news_2015_00890333
5525	وذكرت الوكالة أن العملية الأمنية لا تزال مستمرة.	Y	تزال	1081	    7,270	0.0111	780.625	arabic_news_2015_00682520
5526	ويتوقع أن يتم تنظيم لقاء جديد الاثنين في مقر المحافظة لتحديد الخطوات التي سيتم القيام بها من أجل حل هذه المشكلة.	Y	مقر	1082	    7,253	0.011	803.0476	arabic_news_2017_00950689
5527	وذكر بيان صدر عن الجامعة العربية اليوم السبت، أن اللقاء الذي عقد في مقر الجامعة العربية، بحث تطورات الاوضاع في الارض الفلسطينية وخاصة الوضع في غزة.	Y	مقر	1082	    7,253	0.011	812.3636	arabic_news_2015_00681345
5528	كما تم وضع صورة الشيخ عيسى في مقر الأسود.	Y	مقر	1082	    7,253	0.011	818.1111	arabic_news_2016_00360302
5529	٭٭ رغم أن مقر الاتحاد العربي لكرة القدم بمدينة الرياض إلا أنه من النادر جدا اجتماع لجان الاتحاد هنا.	Y	مقر	1082	    7,253	0.011	839	arabic_news_2017_00247824
5530	وكان الرئيس باراك أوباما رئيس الولايات المتحدة الأمريكية قد عقد مساء أمس الأول قمة بشأن اللاجئين وتمويل العمليات الإنسانية، وذلك في مقر الأمم المتحدة بنيويورك.	Y	مقر	1082	    7,253	0.011	843	arabic_news_2016_00840016
5531	ماذا يجب أن نتوقع من قمة هذا العام؟	Y	قمة	1083	    7,250	0.011	737.125	arabic_news_2017_00435655
5532	ماذا عن الدور الأردني في نجاح قمة الكويت الاقتصادية؟	Y	قمة	1083	    7,250	0.011	740.3333	arabic_news_2015_00391006
5533	ماذا تريد الشعوب العربية من قمة القاهرة ؟	Y	قمة	1083	    7,250	0.011	749.1429	arabic_news_2017_00434610
5534	واوضح ان هذا اللقاء »ليس قمة بل اجتماع يشارك فيه كبار الخبراء«.	Y	قمة	1083	    7,250	0.011	778.1667	arabic_news_2015_00583880
5535	خلال زيارته المرتقبة إلى منطقة الشرق الأوسط في مارس المقبل)، وهي (قمة).	Y	قمة	1083	    7,250	0.011	786.5	arabic_news_2016_00237612
5536	لماذا لا يظهر لبنان في الداخل، كما ظهر في الخارج؟	Y	الخارج	1084	    7,239	0.011	717.5556	arabic_news_2016_00404511
5537	‏ ‏٢‏ ـ كيف نريد هذا التغيير من الداخل أم الخارج؟	Y	الخارج	1084	    7,239	0.011	732.8889	arabic_news_2016_00003945
5538	ماذا عن مجالات التعاون العلمي مع الجامعات في الخارج؟	Y	الخارج	1084	    7,239	0.011	749.4444	arabic_news_2017_00435240
5539	وأضاف: «إن النظام في سورية يواجه مسلحين من الخارج وليس الشعب السوري».	Y	الخارج	1084	    7,239	0.011	845	arabic_news_2015_00504939
5540	ونقلت عنه قوله ان ما يقوم به هو ‘رد على فشل المعارضة المدعومة من الخارج، الائتلاف الوطني السوري’.	Y	الخارج	1084	    7,239	0.011	867.3889	arabic_news_2015_00917808
5541	لو كنت انا من الباحثين في اي مجال.	Y	انا	1085	    7,237	0.011	733	arabic_news_2015_00386223
5542	انا مع جبهة النصرة ضد النظام السوري.	Y	انا	1085	    7,237	0.011	799.5714	arabic_news_2017_00137907
5543	انا مع الحرية و المراء لها دور كبير في المجتمع.	Y	انا	1085	    7,237	0.011	851.8	arabic_news_2016_00138137
5544	انا لا أرى إلا الضغط في العمل.	Y	انا	1085	    7,237	0.011	853.8571	arabic_news_2016_00135522
5545	انا هنا حتى لا يعود نظام حسني مبارك.	Y	انا	1085	    7,237	0.011	855.5	arabic_news_2016_00138461
5546	ومن جانب آخر، يمكن ان تمثل المواد النووية اكبر خطورة على العالم.	Y	المواد	1086	    7,235	0.011	680.9167	arabic_news_2016_00905011
5547	وتقدر الأمم المتحدة أن أسعار المواد الغذائية الدولية بلغت أعلى مستوى لها على الإطلاق في شباط/ فبراير من العام ٢٠١١.	Y	المواد	1086	    7,235	0.011	831.5789	arabic_news_2016_00660468
5548	وأكد وزير الخارجية أن المساعدات البحرينية يتم الترتيب لها بين أهل الشأن، لنقل كل المواد الإنسانية إلى اليمن.	Y	المواد	1086	    7,235	0.011	855.1667	arabic_news_2017_00589912
5549	وأشار إلى أن تلك المواد ستصدر الى كل من: كندا، الإمارات العربية، سوريا، لبنان، الهند، والصين.	Y	المواد	1086	    7,235	0.011	954.6875	arabic_news_2015_00486061
5550	لكن هذه ايضا هي المواد التي يستخدمها سكان غزة في بناء منازلهم.	Y	المواد	1086	    7,235	0.011	955.6667	arabic_news_2015_00376833
5551	وما هي حدود تدخل الأسرة في هذا المجال؟	Y	حدود	1087	    7,220	0.011	642.625	arabic_news_2015_00892497
5552	واعتبر نتنياهو أن «الإرهاب لا يعرف الحدود وهذا هو السبب الذي يجعل تعاوننا في الحرب على الإرهاب من دون حدود أيضا.	Y	حدود	1087	    7,220	0.011	732.95	arabic_news_2017_00570206
5553	ويشير أيضا إلى حدود سوريا مع لبنان.	Y	حدود	1087	    7,220	0.011	753	arabic_news_2016_00959613
5554	هذا مع ما قيل، وما كتب من مقالات لا حدود لها.	Y	حدود	1087	    7,220	0.011	769.5455	arabic_news_2015_00444907
5555	في ظل هذا الاستيراد الذي لا حدود له؟	Y	حدود	1087	    7,220	0.011	778.5	arabic_news_2015_00302597
5556	وقتل يوم الاثنين في سوريا نحو ١٠٠ شخص بحسب المرصد السوري لحقوق الانسان.	Y	الانسان	1088	    7,218	0.011	700	arabic_news_2016_00821512
5557	لكن لدى الانسان جوع اكبر، انه في حاجة الى اكثر من ذلك.	Y	الانسان	1088	    7,218	0.011	793.6667	arabic_news_2015_00374177
5558	وقال المركز الفلسطيني لحقوق الانسان: إن ٥٤٠ ألف شخص شردوا في قطاع غزة.	Y	الانسان	1088	    7,218	0.011	825.5833	arabic_news_2017_00787863
5559	وبحسب الاتحاد الدولي لحقوق الانسان، فإن ما لا يقل عن ٨٠ شخصا قتلوا منذ بداية حركة الاحتجاج في البحرين.	Y	الانسان	1088	    7,218	0.011	836.3333	arabic_news_2015_00595369
5560	وقالت المنظمة المدافعة عن حقوق الانسان، في بيان ان «الحكومة اللبنانية بدأت في ٦ آب..	Y	الانسان	1088	    7,218	0.011	840.9231	arabic_news_2015_00784610
5561	وكان «داعش» يسيطر على القاعدة «اللواء ٩٣» منذ استيلائه عليها من الجيش السوري العام الماضي.	Y	اللواء	1089	    7,216	0.011	772.3571	arabic_news_2017_00849718
5562	وأشار إلى أن «مسار الحوار الجاري الآن تم الاتفاق عليه في مكة بين (مدير جهاز الاستخبارات المصرية العامة) اللواء عمر سليمان ومشعل».	Y	اللواء	1089	    7,216	0.011	861.7273	arabic_news_2015_00486715
5563	وكان مدير الأمن اللواء محمد قاسم قد تلقى..	Y	اللواء	1089	    7,216	0.011	863.125	arabic_news_2017_00852825
5564	فرد عليه اللواء منصور التركي: «مع البعض، ليس هناك أي علاج.	Y	اللواء	1089	    7,216	0.011	873	arabic_news_2017_00304333
5565	خدمة القارئ الصوتي لأخبار جريدة الرياض مقدمة من شركة اسجاتك والدة اللواء المهوس إلى رحمة الله التعليقات المنشورة لا تعبر عن رأي «الرياض» الإلكتروني ولا تتحمل أي مسؤولية قانونية حيال ذلك، ويتحمل كاتبها مسؤولية النشر.	Y	اللواء	1089	    7,216	0.011	894.3939	arabic_news_2016_00235992
5566	اذا كانت حاجة إلى عملية اخرى ضد حماس، فستكون هي العملية الرابعة في السنوات الاخيرة.	Y	الاخيرة	1090	    7,206	0.011	817.6667	arabic_news_2017_00023007
5567	ربما تكون الفرصة الاخيرة قبل اتخاذ قرارات في اطار مجلس الامن».	Y	الاخيرة	1090	    7,206	0.011	839.0909	arabic_news_2015_00228423
5568	وما حدث في الايام الاخيرة خير شاهد على ذلك.	Y	الاخيرة	1090	    7,206	0.011	843.7778	arabic_news_2015_00890450
5569	كيف ترى نمو الاقتصاد السعودي خلال الفترة الاخيرة، خاصة بعد تذبذب أسعار النفط؟	Y	الاخيرة	1090	    7,206	0.011	871.6154	arabic_news_2016_00372441
5570	وقال الوزير الايراني «في (جولة) التفاوض الاخيرة، تقرر عقد اجتماع جديد مع نهاية تشرين الثاني/نوفمبر، ولكن لم يحدد حتى الان اي موعد او مكان».	Y	الاخيرة	1090	    7,206	0.011	885	arabic_news_2016_00783324
5571	أين حرية الكلام التي نص عليها القانون الأمريكي في المادة الأولى!	Y	المادة	1091	    7,199	0.011	808.4545	arabic_news_2016_00155785
5572	جاء ذلك خلال مناقشة المادة ٢١ من مشروع لائحة..	Y	المادة	1091	    7,199	0.011	834.75	arabic_news_2016_00204451
5573	كما توضح المادة ١٤ بأن جميع المواطنين لهم حق المساواة في المشاركة في العمل العام.	Y	المادة	1091	    7,199	0.011	839.8462	arabic_news_2015_00338233
5574	وتابع  أن المادة (٥٤) من الدستور أوجبت على رئيس الجمهورية (.	Y	المادة	1091	    7,199	0.011	845.1111	arabic_news_2015_00613596
5575	وأضافت الامانة: ان هذا الحكم جاء وفق المادة ٣٤٠ من قانون العقوبات العراقي.	Y	المادة	1091	    7,199	0.011	847.9167	arabic_news_2015_00510699
5576	ولكن كل عام نجد أن معرض الكتاب في الكويت يذهب أدنى من مستوى..	Y	معرض	1091	    7,199	0.011	763.7692	arabic_news_2016_00878492
5577	تفاصيل امرأة من المتوقع له أن يحظى بحضور أكبر أيضا خلال فعاليات معرض الرياض القادم بعد ثلاثة أشهر تقريبا.	Y	معرض	1091	    7,199	0.011	832.1579	arabic_news_2016_00191485
5578	وسيكون هذا هو أول معرض يقام له في منطقة الخليج.	Y	معرض	1091	    7,199	0.011	856.5	arabic_news_2015_00706870
5579	خدمة القارئ الصوتي لأخبار جريدة الرياض مقدمة من شركة اسجاتك خطوات في معرض فرانكفورت الدولي للكتاب التعليقات المنشورة لا تعبر عن رأي «الرياض» الإلكتروني ولا تتحمل أي مسؤولية قانونية حيال ذلك، ويتحمل كاتبها مسؤولية النشر.	Y	معرض	1091	    7,199	0.011	871.7576	arabic_news_2017_00233311
5580	وأشار صاحب إحدى الدور إلى أن غياب معرض القاهرة الدولي للكتاب كان مؤثرا إلى حد ما على الدور السورية.	Y	معرض	1091	    7,199	0.011	874.7647	arabic_news_2015_00491997
5581	ودعا في الوقت ذاته الآخرين إلى عدم التدخل في شؤون المملكة.	Y	الآخرين	1092	    7,194	0.011	738.5	arabic_news_2016_00692916
5582	لماذا دائما ما يتم الحديث عن أن هناك في هذا العالم من لا يتعلم من تجارب الآخرين؟	Y	الآخرين	1092	    7,194	0.011	747.5	arabic_news_2017_00421311
5583	حيث يوجد في غزة وحدها اكثر من قائد على خلاف مع الآخرين وكذلك في الضفة.	Y	الآخرين	1092	    7,194	0.011	791.7143	arabic_news_2015_00218819
5584	وتابع: «أنا شخص أفضل مما كنت عليه، يجب على المرء أن يتعلم من الآخرين، وأن يعمل على تجربة كل شيء، لا يستطيع كل الناس أن يفعلوا هذا».	Y	الآخرين	1092	    7,194	0.011	862.0833	arabic_news_2015_00613377
5585	فهو لا يمتلك إسقاط الحق الذي له في الكثير من الأمور فضلا عن حقوق الآخرين.	Y	الآخرين	1092	    7,194	0.011	893	arabic_news_2017_00323753
5586	هل يمكن أن نعرف ما هو مصير المنطقة العربية جراء تطبيق الاقتصاد الأخضر؟	Y	جراء	1093	    7,190	0.0109	772.6154	arabic_news_2017_00511881
5587	إلى من يقول أن هذا جراء الكبت و..	Y	جراء	1093	    7,190	0.0109	824.375	arabic_news_2015_00105321
5588	وفي دمشق، قتل ثلاثة اشخاص جراء انفجار في حي ركن الدين شمال العاصمة، من دون ان تعرف تفاصيل عنه، بحسب المرصد.	Y	جراء	1093	    7,190	0.0109	886.3333	arabic_news_2015_00749582
5589	وأكد وكيل المحافظة على أهمية المشاركة في حملة دعم البنك المركزي خاصة في هذه الظروف التي يمر بها الوطن جراء العدوان والحصار.	Y	جراء	1093	    7,190	0.0109	886.381	arabic_news_2016_00573659
5590	وينتظر أن يتم نقل الأمير السعودي إلى بلاده نهاية العام الجاري بعد أن حكم عليه بالسجن مدى الحياة جراء جريمته في بريطانيا.	Y	جراء	1093	    7,190	0.0109	916.7143	arabic_news_2016_00973121
5591	وأكد صاحب السمو الملكي الأمير سلطان بن عبد العزيز.	Y	العزيز	1094	    7,174	0.0109	704.2222	arabic_news_2015_00549856
5592	إن سلطان بن عبد العزيز ليس وزير دفاع فقط.	Y	العزيز	1094	    7,174	0.0109	719.2222	arabic_news_2015_00126868
5593	بينما كان عبد العزيز يقول: من معي؟	Y	العزيز	1094	    7,174	0.0109	724.4286	arabic_news_2015_00160041
5594	الملك عبدالله بن عبد العزيز يدخل المستشفى عدة مرات.	Y	العزيز	1094	    7,174	0.0109	743.8889	arabic_news_2017_00107697
5595	ـ هو بدون شك الأمير نايف بن عبد العزيز.	Y	العزيز	1094	    7,174	0.0109	786.8889	arabic_news_2017_00515805
5596	وأشارت الوكالة إلى أنه لم يتم الكشف عن تفاصيل الحادث، ولم تؤكد أيضا..	Y	الحادث	1095	    7,160	0.0109	677.9231	arabic_news_2016_00517842
5597	وبحسب الشرطة كانت زوجته في العمل وقت وقوع الحادث.	Y	الحادث	1095	    7,160	0.0109	727.3333	arabic_news_2016_00616703
5598	ولم يصدر حتى هذه اللحظة أي تعليق من القوات الامريكية عن الحادث.	Y	الحادث	1095	    7,160	0.0109	788.75	arabic_news_2016_00886243
5599	واضافت الوكالة ان الحادث وقع يوم الخميس في..	Y	الحادث	1095	    7,160	0.0109	789.5	arabic_news_2017_00557934
5600	ولم يكشف المتحدث أي تفاصيل بشأن موقع الحادث أو المكان الذي شن منه الهجوم.	Y	الحادث	1095	    7,160	0.0109	798.5	arabic_news_2016_00886862
5601	صاحب السمو الشيخ خليفة بن زايد آل نهيان رئيس دولة الإمارات العربية المتحدة.	Y	السمو	1095	    7,160	0.0109	751.4615	arabic_news_2015_00244402
5602	وأكد صاحب السمو الشيخ محمد بن راشد آل مكتوم نائب رئيس الدولة رئيس مجلس الوزراء حاكم دبي.	Y	السمو	1095	    7,160	0.0109	765.375	arabic_news_2017_00587982
5603	صاحب السمو الملكي الأمير سلطان بن عبدالعزيز.	Y	السمو	1095	    7,160	0.0109	782.7143	arabic_news_2016_00262409
5604	وكان صاحب السمو الشيخ تميم بن حمد آل ثاني أمير دولة قطر قد وصل أمس إلى الرياض، في زيارة للمملكة.	Y	السمو	1095	    7,160	0.0109	787.85	arabic_news_2017_00850760
5605	ومثل المملكة فيه صاحب السمو الملكي الأمير عبدالعزيز بن عبدالله نائب وزير الخارجية.	Y	السمو	1095	    7,160	0.0109	800.3077	arabic_news_2016_00894627
5606	ثم مئات ثم عشرات ثم لا أحد..	Y	عشرات	1095	    7,160	0.0109	554.8	arabic_news_2015_00181813
5607	وتأتي العملية بعد إطلاق حركة حماس عشرات الصواريخ على جنوب إسرائيل.	Y	عشرات	1095	    7,160	0.0109	802.8182	arabic_news_2015_00617105
5608	وقال رئيس فريق البحث انه يعتقد بوجود «عشرات» المدن الاخرى في المنطقة.	Y	عشرات	1095	    7,160	0.0109	803.0833	arabic_news_2017_00806263
5609	ويجيء هذا بعد أيام من مقتل عشرات في العاصمة..	Y	عشرات	1095	    7,160	0.0109	828.7778	arabic_news_2017_00951949
5610	وكان عشرات الناخبين تدفقوا على هذا المركز نفسه في الدورة الثانية من الانتخابات الرئاسية في تشرين الثاني/نوفمبر ٢٠١٠ عند بدء الاقتراع.	Y	عشرات	1095	    7,160	0.0109	876.4	arabic_news_2017_00851070
5611	لكن معالجة ما جرى بحاجة إلى بعض الوقت».	Y	جرى	1096	    7,158	0.0109	582.125	arabic_news_2015_00375088
5612	حيث قال أوسيليفان : إن ما جرى فى العراق جاء دون توقعات كل من الولايات المتحدة والعراق.	Y	جرى	1096	    7,158	0.0109	784.6875	arabic_news_2017_00229211
5613	جرى خلال الاتصال بحث آخر التطورات في قطاع غزة.	Y	جرى	1096	    7,158	0.0109	787.2222	arabic_news_2015_00185354
5614	من واقع قام هنا أو جرى هناك أو كان يوما هنالك.	Y	جرى	1096	    7,158	0.0109	788.7	arabic_news_2016_00454362
5615	وقال المسؤول «لا نملك حتى الآن تفاصيل حول ما جرى».	Y	جرى	1096	    7,158	0.0109	798.7	arabic_news_2017_00788220
5616	بدون أن يعلم أن محطة النهاية له لا عنوان لها..!	Y	عنوان	1097	    7,156	0.0109	808.7778	arabic_news_2016_00165506
5617	ـ في عام ١٤١٥هـ بدأت بمقر الجامعة العربية في القاهرة أعمال الندوة الدولية حول مدينة القدس الشريف تحت عنوان (القدس مدينة السلام) التي تنظمها منظمة المؤتمر الإسلامي.	Y	عنوان	1097	    7,156	0.0109	845.5417	arabic_news_2015_00302662
5618	اليوم الثاني لن يتم نشر عنوان بريدك الإلكتروني.	Y	عنوان	1097	    7,156	0.0109	881.625	arabic_news_2016_00119670
5619	مشيرا الى ان عنوان هذا المهرجان لهذا العام سيكون تحت شعار (فرحة عيد ٣غير).	Y	عنوان	1097	    7,156	0.0109	888.4286	arabic_news_2016_00430663
5620	عنوان لمؤتمر الاتحاد من أجل المتوسط الذي عقد في مدينة برشلونة… الاتحاد من أجل المتوسط.	Y	عنوان	1097	    7,156	0.0109	890.8182	arabic_news_2016_00282601
