ORDER	SENTENCE	STATUS	WORD	RANK	COUNT	COUNT_REL	INDEX	ID
5239	من جهة اخرى، قال وزير الخارجية العراقي ان تحديد موعد خروج القوات الامريكية من العراق سيكون من اختصاص الحكومة العراقية.	Y	تحديد	1027	    7,548	0.0115	798.0556	arabic_news_2015_00418860
5240	وأضاف المكتب في بيان أنه يعمل مع وزارة الدفاع “من أجل تحديد طبيعة ونطاق الهجوم”.	Y	تحديد	1027	    7,548	0.0115	825.8	arabic_news_2015_00501177
5241	وأضاف المركزي عبر موقعه الإلكتروني اليوم الثلاثاء أن..	Y	المركزي	1028	    7,547	0.0115	696.875	arabic_news_2017_00550213
5242	إن السؤال المركزي الذي يفرض نفسه: لماذا حدث كل هذا؟	Y	المركزي	1028	    7,547	0.0115	723.5	arabic_news_2017_00136409
5243	سيكون هذا هو الموضوع المركزي الذي لا يوجد غيره تقريبا.	Y	المركزي	1028	    7,547	0.0115	766.2	arabic_news_2016_00258203
5244	والسبب ايران هذا ما دار في اجتماع مجلس الأمن المركزي..	Y	المركزي	1028	    7,547	0.0115	798.7	arabic_news_2017_00598590
5245	وحسب المجلس، فإنه حتى مثل هذا الوقت من العام الماضي، حافظ المركزي السوري على هذه الحيازة من الذهب خلال السنوات الـ١٤ الماضية دون تغيير.	Y	المركزي	1028	    7,547	0.0115	817.8696	arabic_news_2017_00694007
5246	مدينة تخرج من تحت الماء بعد ٢٥ عاما - البيان$content.	Y	content	1029	    7,545	0.0115	761.1111	arabic_news_2017_00446245
5247	أفضل ١٠ لاعبين في تاريخ الإمارات - البيان$content.	Y	content	1029	    7,545	0.0115	771.2857	arabic_news_2017_00042231
5248	دعم التواصل على كافة المستويات - البيان$content.	Y	content	1029	    7,545	0.0115	837.5714	arabic_news_2017_00239702
5249	قطر ستظل إلى جانب الشعب السوري - البيان$content.	Y	content	1029	    7,545	0.0115	884.125	arabic_news_2017_00349769
5250	حتى لا يسرق اليمن من جديد - البيان$content.	Y	content	1029	    7,545	0.0115	925.625	arabic_news_2017_00220771
5251	سؤال: ما هي الجوانب الأكثر أهمية في هذا الاتفاق الجديد؟	Y	الأكثر	1030	    7,536	0.0115	691	arabic_news_2017_00258447
5252	من هو الشعب العربي الأكثر عاطفة بين الدول العربية ؟	Y	الأكثر	1030	    7,536	0.0115	738.6667	arabic_news_2017_00474561
5253	هذا الهجوم هو الأكثر دموية في بغداد منذ العام ٢٠٠٩.	Y	الأكثر	1030	    7,536	0.0115	775.4444	arabic_news_2017_00495235
5254	ومن بين الأكثر شهرة مجموعة تضم أكثر من ٤٢ ألف عضو.	Y	الأكثر	1030	    7,536	0.0115	823.5	arabic_news_2016_00904047
5255	تعرف عليها من هو السياسي الأكثر ثراء في العالم؟	Y	الأكثر	1030	    7,536	0.0115	860.4444	arabic_news_2017_00197190
5256	وقال المسؤول الفلسطيني الذي طلب عدم كشف هويته لوكالة فرانس برس: إن «الاجتماع الثالث الذي عقد في عمان (.	Y	عمان	1031	    7,534	0.0115	768.4118	arabic_news_2015_00771012
5257	هل بدأت عمان بتنفيذ القرار ٢١١٨ حول سوريا؟	Y	عمان	1031	    7,534	0.0115	773.4286	arabic_news_2015_00451355
5258	المجموعة الثانية: إيران، الهند، البحرين، عمان، لبنان، باكستان.	Y	عمان	1031	    7,534	0.0115	776.875	arabic_news_2017_00102127
5259	وقد وصل الى عمان امس جميع الوفود المشاركة في المؤتمر.	Y	عمان	1031	    7,534	0.0115	784.2	arabic_news_2017_00835117
5260	ـ المستوى الثاني: السعودية، عمان، قطر، الأردن، البحرين، فيتنام، سوريا، الكويت.	Y	عمان	1031	    7,534	0.0115	807.8182	arabic_news_2016_00104383
5261	لقد أدى ذلك في الواقع الى حالة عميقة من عدم الثقة.	Y	أدى	1032	    7,527	0.0115	697.0909	arabic_news_2016_00388615
5262	وأضاف أن ذلك أدى بالفعل إلى الحد من تقديم المساعدات لهذه الفئة وقد يؤدي إلى المزيد من انخفاض تلك المساعدات المقدمة في منتصف عام ٢٠١٤.	Y	أدى	1032	    7,527	0.0115	776.9048	arabic_news_2015_00506009
5263	مما أدى إلى تدخل مدرعات قوات الأمن المصرية بحسب مسؤول في وزارة الصحة المصرية.	Y	أدى	1032	    7,527	0.0115	785.4615	arabic_news_2016_00438122
5264	وهو ما أدى إلى التأثير على عمل ٢٠ ألف مشترك لديها.	Y	أدى	1032	    7,527	0.0115	828.8	arabic_news_2017_00935189
5265	ما أدى الى مقتل أكثر من ٢٠ مدنيا”.	Y	أدى	1032	    7,527	0.0115	836.2857	arabic_news_2017_00432248
5266	و فعلا الفقر هو السياسي الوحيد في اليمن.	Y	الوحيد	1033	    7,526	0.0115	734.75	arabic_news_2016_00749733
5267	رئيس شاب و الدكتور الوحيد بين رؤساء العرب.	Y	الوحيد	1033	    7,526	0.0115	793.875	arabic_news_2016_00249312
5268	ثم البيان المعتاد من النادي، وربما يكون التغيير الوحيد في هذا البيان هو التاريخ.	Y	الوحيد	1033	    7,526	0.0115	796.3077	arabic_news_2015_00179601
5269	لكن الفوز هو ليس الهدف الوحيد لهذه القبائل.	Y	الوحيد	1033	    7,526	0.0115	802.125	arabic_news_2016_00394148
5270	البلد الوحيد الذي توجد فيه سلطة من غير شعب.	Y	الوحيد	1033	    7,526	0.0115	806.7778	arabic_news_2017_00060581
5271	عبد الله عبد الله: في محكمة وطنية.	Y	محكمة	1034	    7,519	0.0114	567.4	arabic_news_2016_00271905
5272	واضاف المصدر ان النيابة قدمت قرار الاتهام ظهر الخميس الى محكمة الشرطة في القدس.	Y	محكمة	1034	    7,519	0.0114	836.5	arabic_news_2016_00527709
5273	وقالت الوزارة في بيان إن أول ظهور للرجل أمام محكمة أمريكية كان يوم الجمعة.	Y	محكمة	1034	    7,519	0.0114	873.5	arabic_news_2017_00797686
5274	وتم تخفيف الحكم الاول الى السجن عشر سنوات في محكمة استئناف في ٢٠٠٧ في حين تم تثبيت الحكم الثاني في العام ذاته من قبل محكمة استئناف ثانية.	Y	محكمة	1034	    7,519	0.0114	889.5	arabic_news_2015_00647196
5275	ومثل امام محكمة في تموز من العام الحالي مع عشرة من كبار المسؤولين في حكومة صدام.	Y	محكمة	1034	    7,519	0.0114	923.5	arabic_news_2015_00893253
5276	هل نريد المشاركة أم أننا نريد البقاء في المعارضة؟»	Y	أننا	1035	    7,511	0.0114	763.875	arabic_news_2015_00454513
5277	وأضاف “يبدو لي أننا لعبنا في البطولة الحالية أفضل مما كنا في كأس العالم”.	Y	أننا	1035	    7,511	0.0114	847.8462	arabic_news_2015_00523355
5278	بما أننا لا نرى أي شيء إلا من الداخل، وما دام ليست هناك نهاية للعالم.	Y	أننا	1035	    7,511	0.0114	858.2667	arabic_news_2016_00175213
5279	نحن الآن كما تعرف في حالة حرب مع الإرهاب، وهذا الإرهاب مدعوم من قوى خارجية، فهذا يعني أننا في حالة حرب كاملة اليوم.	Y	أننا	1035	    7,511	0.0114	878.8947	arabic_news_2016_00461580
5280	إنها المرحلة الحالية التي ستثبت أننا أهل لما من الله به علينا.	Y	أننا	1035	    7,511	0.0114	885.1667	arabic_news_2016_00146177
5281	لقد تغير العالم بعد القرار لصالح دولة فلسطين حقا نحن أمام عالم جديد.	Y	عالم	1036	    7,493	0.0114	796.1538	arabic_news_2015_00366004
5282	@ هل هذه أول مشاركة لك في عالم المصادر المفتوحة؟	Y	عالم	1036	    7,493	0.0114	830	arabic_news_2015_00454800
5283	وأضاف «يتم نسيان كل شيء في عالم كرة القدم.	Y	عالم	1036	    7,493	0.0114	839.7778	arabic_news_2016_00546948
5284	نريد مسيرة دولية من أجل عالم بدون إسرائيل.	Y	عالم	1036	    7,493	0.0114	849	arabic_news_2016_00463734
5285	الإنسان هو عالم الإنسان، هو الدولة، والمجتمع..	Y	عالم	1036	    7,493	0.0114	867.4	arabic_news_2015_00053741
5286	وقال مصدر في الرئاسة الفرنسية السبت «لا تعليق» على مقتل ابو زيد.	Y	ابو	1037	    7,491	0.0114	764.0833	arabic_news_2016_00814263
5287	وتابع : كان الله في عون ابو علاء.	Y	ابو	1037	    7,491	0.0114	841.1429	arabic_news_2015_00615895
5288	واضافت مصادر أمنية في محافظة الشرقية، أن مسلحين قتلوا أمس أمين شرطة في قطاع الأمن الوطني المسؤول عن أمن الدولة بوزارة الداخلية في هجوم بمدينة ابو كبير.	Y	ابو	1037	    7,491	0.0114	883.56	arabic_news_2015_00514812
5289	ورد النائب عيسى ابو الفتح ان مداخلة الوزير لا تعبر عن رأي الحكومة وهذا دليل على عدم الرغبة في التعاون مع مجلس النواب.	Y	ابو	1037	    7,491	0.0114	1007.1739	arabic_news_2016_00705718
5290	ابو فهد الرجل المناسب في المكان المناسب.	Y	ابو	1037	    7,491	0.0114	1011.6667	arabic_news_2016_00014676
5291	قناة دبي: لكن في غير مسألة العمالة؟	Y	قناة	1038	    7,488	0.0114	797.4286	arabic_news_2016_00337338
5292	من جانبه، أكد مدير قناة الجزيرة أن الجزيرة تقوم بدورها الذي تقوم به كل وسائل الإعلام، و«الصحافة ليست جريمة» لكن اعتقال أي صحفي في الجزيرة يعد جريمة.	Y	قناة	1038	    7,488	0.0114	816.125	arabic_news_2017_00465056
5293	فيما أكد مراسل قناة «العربية» أن مجموعة من عناصر القاعدة تسللت إلى داخل الحدود السعودية مع عناصر الحوثيين.	Y	قناة	1038	    7,488	0.0114	825.2353	arabic_news_2015_00304510
5294	ونقلت قناة «روسيا اليوم» على موقعها الإلكتروني أن عمليات البحث لا تزال مستمرة.	Y	قناة	1038	    7,488	0.0114	827.3077	arabic_news_2016_00918309
5295	في شهر يناير عام ٢٠٠٥ من خلال برنامج “تلفزيون الأطفال” الذي مازال يعرض على قناة الكويت الأولى.	Y	قناة	1038	    7,488	0.0114	840.8125	arabic_news_2017_00334692
5296	وقالت اللجنة الانتخابية إن نسبة الإقبال على الانتخابات العراقية التاريخية بلغت ٥٩ في المئة.	Y	الانتخابية	1039	    7,483	0.0114	781.3077	arabic_news_2015_00783688
5297	وقال «لا توجد اي نتيجة طالما ان اللجنة الانتخابية لم تعلن النتائج.	Y	الانتخابية	1039	    7,483	0.0114	795.9167	arabic_news_2015_00803230
5298	وفي الموصل ايضا قتل موظف في اللجنة الانتخابية.	Y	الانتخابية	1039	    7,483	0.0114	825.125	arabic_news_2015_00744409
5299	ولفت المصري الى أنه بعد عام ٢٠٠٣ أصبح هناك قضية مهمة أيضا، حيث أصبحت الدوائر الانتخابية صغيرة جدا، وهذا أضعف النواب بسبب القوة الانتخابية الصغيرة.	Y	الانتخابية	1039	    7,483	0.0114	834.0435	arabic_news_2015_00870820
5300	وبدأت وزارة الداخلية اليوم تطبيق نظام التصويت الإلكتروني في مختلف المراكز الانتخابية.	Y	الانتخابية	1039	    7,483	0.0114	852.0833	arabic_news_2017_00634471
5301	ولم تذكر المصادر، حتى الآن، أي تفاصيل أخرى عن الحادث الرابع من نوعه خلال أكثر من شهر.	Y	الرابع	1040	    7,482	0.0114	745.0625	arabic_news_2016_00883480
5302	كان ذلك قبيل الرابع عشر من شهر آب ٢٠٠٦.	Y	الرابع	1040	    7,482	0.0114	792.75	arabic_news_2017_00355897
5303	يذكر ان المسابقة ستنطلق يوم السبت في الرابع عشر من هذا الشهر.	Y	الرابع	1040	    7,482	0.0114	795.75	arabic_news_2017_00985527
5304	وتابع بيان الرئيس الأميركي «في هذا الرابع عشر من تموز/يوليو (العيد الوطني الفرنسي)، نتذكر (.	Y	الرابع	1040	    7,482	0.0114	853.6	arabic_news_2017_00648064
5305	وحصل النصر على المركز الثاني وجاء العين في المركز الثالث ثم الأهلي في المركز الرابع.	Y	الرابع	1040	    7,482	0.0114	882.0833	arabic_news_2015_00665972
5306	القرارات في مجلس الأمن ضد العدل و الحق.	Y	الحق	1041	    7,475	0.0114	596.5	arabic_news_2017_00095034
5307	‏ فإن محمد نجيب لم يكن له هذا الحق‏.	Y	الحق	1041	    7,475	0.0114	642.5	arabic_news_2016_00292781
5308	ومن له الحق في حسم هذه القضية؟	Y	الحق	1041	    7,475	0.0114	746.1429	arabic_news_2016_00908607
5309	بيد أن كل يوم من أيام السنة يشهد اعتداء على هذا الحق.	Y	الحق	1041	    7,475	0.0114	779.0833	arabic_news_2015_00158579
5310	وأشار إلى أن هؤلاء الناس لهم الحق في طلب اللجوء دون أي شكل من أشكال التمييز.	Y	الحق	1041	    7,475	0.0114	795.875	arabic_news_2016_00515871
5311	وعلى الرغم من ذلك فإن الجميع يسعى بشكل مباشر أو غير مباشر إلى الحفاظ على الحجم الحالي للحكومة.	Y	الرغم	1042	    7,471	0.0114	771.8824	arabic_news_2016_00740237
5312	وأوضح أنه على الرغم من أن السياسة ستكون حاضرة في العمل إلا أنها لن تكون مسيطرة على العمل بشكل كامل.	Y	الرغم	1042	    7,471	0.0114	774.5	arabic_news_2016_00605639
5313	وعلى الرغم من أن الأمر كان يحصل طيلة الفترة الماضية، كان من الممكن التعامل معه بطريقة أفضل.	Y	الرغم	1042	    7,471	0.0114	790.2	arabic_news_2016_00739952
5314	قد يظهر حب الشباب لدى المرأة جراء التوتر في العمل على الرغم من تجاوز مرحلة الشباب!	Y	الرغم	1042	    7,471	0.0114	802.0667	arabic_news_2015_00313622
5315	وعلى الرغم من أن هذه الزيارة تأتي في الوقت الضائع من رئاسة بوش إلا أنها مهمة.	Y	الرغم	1042	    7,471	0.0114	821.4	arabic_news_2015_00727142
5316	فهل هي أزمة سياسة يعاني منها العالم العربي؟	Y	سياسة	1043	    7,470	0.0114	654	arabic_news_2016_00312440
5317	وتابع «لنا تحفظ على سياسة إيران الخارجية خاصة في منطقة الخليج وفي الملف الفلسطيني».	Y	سياسة	1043	    7,470	0.0114	724.2143	arabic_news_2015_00616213
5318	وقال «نحن بحاجة الى سياسة تعاون خارجية حقيقية بين دول الاتحاد الاوروبي وتركيا التي لها من التأثير على سوريا اكثر من عدد كبير من الدول الغربية».	Y	سياسة	1043	    7,470	0.0114	766	arabic_news_2016_00816233
5319	ان وكالة الطاقة الدولية تلعب سياسة لصالح الولايات المتحدة».	Y	سياسة	1043	    7,470	0.0114	771.7778	arabic_news_2015_00134298
5320	هل نقول إن سياسة الحكومة الاقتصادية كاملة؟	Y	سياسة	1043	    7,470	0.0114	779.5714	arabic_news_2016_00484633
5321	والتي تعتبر في الوقت الحالي في وضع أقرب إلى الفوضى.	Y	تعتبر	1044	    7,461	0.0114	770.7778	arabic_news_2015_00557143
5322	حتى الآن كانت تعتبر شخصا يركز على وزارة الداخلية».	Y	تعتبر	1044	    7,461	0.0114	772.7778	arabic_news_2016_00221574
5323	وقال «إن الحكومة تعتبر أن أهم مسألة هي الإرهاب في حين ترى المعارضة أن الأهم هو سلطة الحكومة الانتقالية..	Y	تعتبر	1044	    7,461	0.0114	805.8235	arabic_news_2016_00784403
5324	مشيرا إلى أن الصين تعتبر قوة اقتصادية كبيرة ولها أسواق في كثير من دول العالم.	Y	تعتبر	1044	    7,461	0.0114	823.4	arabic_news_2017_00450715
5325	وهي تعتبر أن «السؤال لم يعد متى ومن يكون رئيس لبنان، بل هل ستكون الحدود اللبنانية على ما هي عليه في حال فرض التقسيم على البلدان المحيطة؟	Y	تعتبر	1044	    7,461	0.0114	831.5769	arabic_news_2016_00935695
5326	أين هي القنوات العربية من كل هذا ؟	Y	أين	1045	    7,453	0.0113	585.5714	arabic_news_2017_00158069
5327	خدمة القارئ الصوتي لأخبار جريدة الرياض مقدمة من شركة اسجاتك أين هي المرأة من ميزانية العام الجديد؟	Y	أين	1045	    7,453	0.0113	672.6875	arabic_news_2016_00234128
5328	ثم أين هو دعم مجلس التعاون المفترض.	Y	أين	1045	    7,453	0.0113	699.7143	arabic_news_2015_00180065
5329	لكن أين لبنان من كل هذه المهام؟	Y	أين	1045	    7,453	0.0113	700	arabic_news_2016_00395315
5330	لا أحد اليوم يملك أن يقول اليمن بعد ١٠ سنوات إلى أين هي ذاهبة.	Y	أين	1045	    7,453	0.0113	704.4615	arabic_news_2015_00352008
5331	واتهمت وزارة الخارجية الأميركية سوريا بأنها وراء المواجهات في الجولان، وقالت في بيان إن من حق إسرائيل الدفاع عن نفسها.	Y	بأنها	1046	    7,452	0.0113	874.4737	arabic_news_2015_00464277
5332	‏ هكذا تعيش هذه الدولة‏,‏ وهي تشعر بأنها فوق القانون بل وان من حقها أن تكون فوق القانون‏.	Y	بأنها	1046	    7,452	0.0113	930.8	arabic_news_2016_00479436
5333	وكانت المحكمة الوطنية اتهمت في وقت سابق بأنها نظرت الكثير من قضايا حقوق الإنسان خارج الحدود.	Y	بأنها	1046	    7,452	0.0113	958.75	arabic_news_2015_00842115
5334	فيما وصف وزير الخارجية الكويتي الشيخ صباح الخالد الصباح زيارة السيسي بأنها مهمة للغاية «على ضوء المخاطر التي تواجهها الأمة العربية، سواء كانت في سوريا أو العراق أو اليمن أو ليبيا».	Y	بأنها	1046	    7,452	0.0113	1000.6552	arabic_news_2015_00305932
5335	وعن الأوضاع في اليمن ، وصفها العربي بأنها غير واضحة ، وذكر أن الجامعة العربية تقف إلى جانب الشرعية وتنتظر ما سيسفر عنه اجتماع دول مجلس التعاون الخليجي السبت المقبل.	Y	بأنها	1046	    7,452	0.0113	1010.3571	arabic_news_2015_00731334
5336	خدمة القارئ الصوتي لأخبار جريدة الرياض مقدمة من شركة اسجاتك انطلاق فعاليات حفل جائزة الصحافة العربية في دبي.	Y	حفل	1047	    7,447	0.0113	749.2222	arabic_news_2016_00234053
5337	وقد جاء هذا الإعلان ضمن حفل توقيع..	Y	حفل	1047	    7,447	0.0113	759	arabic_news_2017_00828486
5338	وهناك حفل آخر في القاهرة في العيد.	Y	حفل	1047	    7,447	0.0113	779.6667	arabic_news_2015_00930473
5339	وقال نتنياهو، في كلمة له خلال حفل إطلاق برنامج لتطوير المجتمع والاقتصاد في منطقة.	Y	حفل	1047	    7,447	0.0113	802.0769	arabic_news_2017_00817246
5340	الأحد المقبل الأمير فهد بن سلطان يرعى اليوم حفل جامعة تبوك التعليقات المنشورة لا تعبر عن رأي «الرياض» الإلكتروني ولا تتحمل أي مسؤولية قانونية حيال ذلك، ويتحمل كاتبها مسؤولية النشر.	Y	حفل	1047	    7,447	0.0113	873.931	arabic_news_2016_00052900
5341	إذ يمكن قراءة المسألة من باب آخر.	Y	باب	1048	    7,439	0.0113	798.8571	arabic_news_2015_00030280
5342	ومن أي باب للتاريخ يمكن أن تدخل هذه الحكومة ؟	Y	باب	1048	    7,439	0.0113	814.4444	arabic_news_2016_00903851
5343	السلام عليكم من باب العلم الولايات المتحدة الأمريكية لم توقع على الاتفاقية.	Y	باب	1048	    7,439	0.0113	856.5833	arabic_news_2016_00080392
5344	ولكن تأتي من باب حماية النفس البشرية.	Y	باب	1048	    7,439	0.0113	873.7143	arabic_news_2016_00877349
5345	ومن باب أولى فإنه لا يمكن إلا أن يكون عبدالله بن عبدالعزيز أولا وأخيرا.	Y	باب	1048	    7,439	0.0113	900.7143	arabic_news_2016_00903897
5346	وأفاد بيان لوزارة الدفاع الوطني اليوم الأحد ، بأن بالفيديو.	Y	بالفيديو	1049	    7,437	0.0113	777.8889	arabic_news_2017_00576887
5347	وقالت الممثلة ذات الـ٤١ عاما قبل بالفيديو.	Y	بالفيديو	1049	    7,437	0.0113	826.4286	arabic_news_2017_00797222
5348	الاتفاق يفوز على الخليج في الدوري السعودي بالفيديو..	Y	بالفيديو	1049	    7,437	0.0113	844.375	arabic_news_2017_00048938
5349	من جهتها، أعلنت، اليوم الثلاثاء، السلطات الألمانية بالفيديو.	Y	بالفيديو	1049	    7,437	0.0113	859.125	arabic_news_2017_00467782
5350	أجمل ١٠ أهداف في أوروبا الموسم الماضي بالفيديو.	Y	بالفيديو	1049	    7,437	0.0113	921.4286	arabic_news_2017_00015994
5351	وعلى صعيد أشمل هناك مبادرة الملك عبد الله بن عبد العزيز في قمة بيروت في العام ٢٠٠٢ من أجل السلام في الشرق الأوسط.	Y	بيروت	1050	    7,427	0.0113	720.7895	arabic_news_2017_00750461
5352	وقد حصل الاعتراف من جانب المملكة العربية السعودية منذ قمة بيروت عام ٢٠٠٢.	Y	بيروت	1050	    7,427	0.0113	751	arabic_news_2016_00828459
5353	وكانت بيروت أول هزيمة إسرائيل في لبنان.	Y	بيروت	1050	    7,427	0.0113	772.5714	arabic_news_2015_00843190
5354	ولكن الانتخابات البلدية، ولا سيما في بيروت، لها معنى سياسي.	Y	بيروت	1050	    7,427	0.0113	780.3	arabic_news_2016_00876107
5355	وقال الحريري في اجتماع لقادة قوى ١٤ آذار في بيروت إن انتخاب الرئيس هو مسؤولية كل شخص.	Y	بيروت	1050	    7,427	0.0113	832.4667	arabic_news_2016_00775448
5356	وأضاف” يجب أن نثني على جهود اليمن في مكافحة الإرهاب خاصة خلال الأشهر الماضية”.	Y	جهود	1051	    7,424	0.0113	807.2857	arabic_news_2016_00546975
5357	وقال “هناك جهود كبيرة لتوفير هذه السلع من قبل الجميع، ولا يوجد ارتفاع أسعار خلال الشهر الفضيل”.	Y	جهود	1051	    7,424	0.0113	831.5882	arabic_news_2015_00811964
5358	وأضاف أن الاجتماع بحث آخر تطورات جهود تحقيق السلام في الشرق الأوسط والنزاع الفلسطيني الإسرائيلي بشكل عام.	Y	جهود	1051	    7,424	0.0113	844	arabic_news_2016_00528981
5359	وأضاف أن عملية الإفراج هذه هي نتيجة جهود بذلت منذ أكثر من ثلاثة أسابيع.	Y	جهود	1051	    7,424	0.0113	880.2143	arabic_news_2015_00506508
5360	ولم تستأنف جهود البحث حتى الآن صباح أمس الأحد.	Y	جهود	1051	    7,424	0.0113	882.6667	arabic_news_2015_00881551
5361	وكما هو الحال في العراق وسوريا، ففي اليمن ايضا فإن الحرب هناك ليس فقط بين الحوثيون والنظام، الذي يعمل الآن من مدينة عدن.	Y	عدن	1051	    7,424	0.0113	815.4348	arabic_news_2015_00859735
5362	بل الذي أعلمه أن الولايات المتحدة كان لها موقف من ضرب عدن.	Y	عدن	1051	    7,424	0.0113	852.8333	arabic_news_2015_00154717
5363	وعن وضع سلطات صنعاء في عدن اليوم ؟	Y	عدن	1051	    7,424	0.0113	855	arabic_news_2015_00734598
5364	يأتي هذا الانفجار بعد اسابيع من قرار الحكومة نقل البنك المركزي الى عدن.	Y	عدن	1051	    7,424	0.0113	870.0769	arabic_news_2017_00977919
