ORDER	SENTENCE	STATUS	WORD	RANK	COUNT	COUNT_REL	INDEX	ID
13361	Sen; hak ne ise onu kabul et, onun üzerinde ol, çünkü hakkın üzerinde nur vardır.	Y	nur	2174	    1,886	0.0046	797.9286	tur_news_2014_00815247
13362	‘Evet ya, normal gazete gibi değil, hatta Risale-i Nur ders gazetesi.	Y	nur	2174	    1,886	0.0046	810	tur_news_2014_00434061
13363	ABD, Türk Okulu ve bir de Milli Görüş’ün desteklediği Nur Enstitüsü.	Y	nur	2174	    1,886	0.0046	856.1667	tur_news_2014_00035813
13364	Bu vesile ile ülkemiz için Risâle-i Nur eğitim metodunun ne kadar etkili olduğu ve başarılı olduğunu da fark ettik.	Y	nur	2174	    1,886	0.0046	858.2	tur_news_2014_00306080
13365	Gerçekten size Allah’tan bir nur ve apaçık bir kitap geldi.	Y	nur	2174	    1,886	0.0046	862.5	tur_news_2005_00184977
13366	Yönetici eğitimi diğer alanlarda olduğu gibi, spor alanı içinde çok önemlidir.	Y	yönetici	2174	    1,886	0.0046	622.3636	tur_news_2005_00014913
13367	Yani dünyada en gelişmiş ülkelerde bile kadın çalışan sayısı çok olduğu halde üst düzey yönetici kadın sayısı çok düşük.	Y	yönetici	2174	    1,886	0.0046	674.1875	tur_news_2018_00947158
13368	Ben bir yerel yönetici olarak bunu bilmiyorum.	Y	yönetici	2174	    1,886	0.0046	752.2857	tur_news_2018_00125479
13369	Yönetici olmak için beden sağlığı şart değil ama tercih edilir.	Y	yönetici	2174	    1,886	0.0046	882.7	tur_news_2018_00982008
13370	Bir sürü üst düzey yönetici de gelip eşya satın alıyor.	Y	yönetici	2174	    1,886	0.0046	1329.8	tur_news_2014_00198522
13371	Bu kez dünyayı başka bir savaş bekliyor.	Y	dünyayı	2175	    1,884	0.0046	658.4286	tur_news_2005_00782762
13372	Değişen dünyayı, Türkiye’yi ve Kıbrıs’ı anlamak lazım.	Y	dünyayı	2175	    1,884	0.0046	824.5556	tur_news_2018_00334135
13373	Bu kriz dünyayı ve Avrupa’yı nasıl etkiler?	Y	dünyayı	2175	    1,884	0.0046	826.375	tur_news_2014_00258431
13374	Zaten genç yaşta da bu dünyayı terk etti.	Y	dünyayı	2175	    1,884	0.0046	848.375	tur_news_2014_00994852
13375	İkinci husus; tüm dünyayı etkisi altına alan ve AB’de de etkisini gösteren hızlı ulus-devlet sürecine dönüş idi.	Y	dünyayı	2175	    1,884	0.0046	1134.9444	tur_news_2018_00519702
13376	İşte bu halde olan birisi de, tam bir fakir olduğu halde, hiç kimseye ve hiç kimseye karşı ihtiyaç hissetmez.	Y	kimseye	2175	    1,884	0.0046	751.125	tur_news_2014_00574621
13377	Ama, şu bir gerçek ki, tek jandarmalı bir dünyada kimseye rahat yoktur.	Y	kimseye	2175	    1,884	0.0046	769.4545	tur_news_2005_00404749
13378	Biz burada hiç kimseye özel bir haber vermiyoruz.	Y	kimseye	2175	    1,884	0.0046	848.25	tur_news_2018_00165009
13379	Ali, Cihan’a karşı daha önce kimseye hissetmediği şeyler hissettiğini, çok yakın olduklarını iddia etmektedir ama Cihan’ın neler yaşadığı ya da yaşamak üzere olduğu konusunda hiçbir fikri yoktur.	Y	kimseye	2175	    1,884	0.0046	870.1429	tur_news_2018_00026557
13380	Tabiat, toprak, hava ve su kimseye ait değil.	Y	kimseye	2175	    1,884	0.0046	914.5	tur_news_2018_00854574
13381	Bu şehir büyük bir kültür ve tarih şehri.	Y	şehri	2175	    1,884	0.0046	451.25	tur_news_2018_00263384
13382	Ve artık şimdi İstanbul bir Dünya kongre şehri.	Y	şehri	2175	    1,884	0.0046	522.125	tur_news_2014_00938489
13383	Konya’da bu devletin baş şehri idi.	Y	şehri	2175	    1,884	0.0046	745.8571	tur_news_2005_00394103
13384	Devamlı olarak buraya gelip, bu güzel şehri, bu güzel insanları görmek ayrı bir mutluluk.	Y	şehri	2175	    1,884	0.0046	927	tur_news_2005_00214680
13385	Toplam 449 Dünyanın En Kalabalık Şehri haberi bulunmuştur.	Y	şehri	2175	    1,884	0.0046	1303.4286	tur_news_2018_00879099
13386	Çünkü ara seçim meclis üye sayısının % 5’ini bulduğu zaman gerekir.	Y	ini	2176	    1,883	0.0046	927.4	tur_news_2005_00478506
13387	Ayrıca yüzde 80’ini Avrupa’ya ihraç ediyorlar.	Y	ini	2176	    1,883	0.0046	934.8571	tur_news_2014_00132252
13388	Ben bunun devam edeceÃ¯Â¿Â½ini dÃ¯Â¿Â½Ã¯Â¿Â½Ã¯Â¿Â½nÃ¯Â¿Â½yorum.	Y	ini	2176	    1,883	0.0046	937.6	tur_news_2014_00167189
13389	Geri kalan yüzde 15’ini de Nisan ayında bitireceğiz.	Y	ini	2176	    1,883	0.0046	977.5	tur_news_2018_00446697
13390	O yılların İzmit’ini yaşayanların “kötü insan” olması pek mümkün değildir.	Y	ini	2176	    1,883	0.0046	992.6364	tur_news_2018_00732373
13391	Türkiye’de ve Avrupa’da ne kadar kamu güvenliği personeli var?	Y	personeli	2176	    1,883	0.0046	408.8182	tur_news_2018_00896309
13392	Yönetim Kurulu başkanı ve üyeleri Kurumun sürekli personeli değildir.	Y	personeli	2176	    1,883	0.0046	695.6667	tur_news_2005_00817903
13393	İl Özel İdaresi’nin bütün personeli Aydın Belediyesi’ne gelmiştir.	Y	personeli	2176	    1,883	0.0046	795.5	tur_news_2018_00530478
13394	Sağlık ocağı ve sağlık evi vardır,ancak sağlık personeli yoktur.	Y	personeli	2176	    1,883	0.0046	910.375	tur_news_2014_00794665
13395	Denetim Kurulu üyeleri Kurumun sürekli personeli değildir.	Y	personeli	2176	    1,883	0.0046	1042.1429	tur_news_2005_00387796
13396	Neden farklı isimler değil de bu on bir?	Y	isimler	2177	    1,882	0.0046	394.25	tur_news_2014_00695506
13397	Ama bu isimler kullanıcı için genellikle uygun değildir.	Y	isimler	2177	    1,882	0.0046	559.375	tur_news_2005_00724770
13398	Hem bizim taraftan hem karşı taraftan vardı böyle yıldız isimler.	Y	isimler	2177	    1,882	0.0046	659.875	tur_news_2018_00487829
13399	Enerji ve Tabii Kaynaklar Bakanlığı’nda ise neredeyse gidecek ve gelecek isimler hazır.	Y	isimler	2177	    1,882	0.0046	866.9167	tur_news_2014_00417067
13400	Üstelik ikisi de sağ siyasete çok yakın isimler.	Y	isimler	2177	    1,882	0.0046	1216.375	tur_news_2018_00921099
13401	Kamu görevlisi ya da özel hekim olabilir.	Y	görevlisi	2178	    1,881	0.0046	699.1429	tur_news_2005_00296505
13402	Daha sonra Anadolu Üniversitesi ve Mimar Sinan Üniversitesi’nde öğretim görevlisi olarak çalıştı.	Y	görevlisi	2178	    1,881	0.0046	828.3333	tur_news_2018_00327857
13403	Polis bölgesinde polis, jandarma bölgesinde jandarma olmak üzere her okula bir emniyet görevlisi tahsis edilmiş durumda.	Y	görevlisi	2178	    1,881	0.0046	896.9231	tur_news_2018_00759000
13404	Öğretim Görevlisi, İnönü Üniversitesi Tıp Fakültesi Genel Cerrahi Anabilim Dalı, Malatya, 1991.	Y	görevlisi	2178	    1,881	0.0046	1130.8182	tur_news_2005_00669411
13405	Araştırma ve Öğretim Görevlisi - Öğretim Üyeliği yapmaktadır.	Y	görevlisi	2178	    1,881	0.0046	1385.1667	tur_news_2005_00403387
13406	Başka Türkiye yok, başka Kocaeli yok, Başka Körfez yok.	Y	körfez	2178	    1,881	0.0046	619.4	tur_news_2018_00110909
13407	Önceki gün CHP Körfez’den biri bana bir fotoğraf gönderdi…	Y	körfez	2178	    1,881	0.0046	713.2	tur_news_2018_00707652
13408	Körfez ülkeleri ABD’nin, Mısır İsrail’in etkisi altında.	Y	körfez	2178	    1,881	0.0046	785.1111	tur_news_2018_00614416
13409	Para sorunu olmayan Suudi Arabistan ve diğer Körfez ülkelerinde ise değişim başladı bile.	Y	körfez	2178	    1,881	0.0046	1014.1538	tur_news_2014_00761584
13410	Çelik, “ AK Parti Körfez Kadın Kolları teşkilatı olarak seçim çalışmalarına başladık.	Y	körfez	2178	    1,881	0.0046	1157.0909	tur_news_2014_00321850
13411	Duygusal olarak benim için çok yoğun ve değerli bir şarkı.	Y	şarkı	2178	    1,881	0.0046	607.5	tur_news_2018_00368716
13412	Onun söylediği her şarkı artık başka bir şarkı olur.	Y	şarkı	2178	    1,881	0.0046	661	tur_news_2005_00811028
13413	Bizim için şarkı yapmak önemli olan ve onu bir albüm içinde sunmak da çok keyifli oluyor.	Y	şarkı	2178	    1,881	0.0046	729.875	tur_news_2005_00355767
13414	Bir de şu şarkı meselesi vardı tabii.	Y	şarkı	2178	    1,881	0.0046	746.8571	tur_news_2018_00148500
13415	Hastanede tedavi olduğu günlerde sürekli şarkı söyler.	Y	şarkı	2178	    1,881	0.0046	1259.4286	tur_news_2018_00476929
13416	Bunların çoğu, gençlik yıllarında da çok sayıda doğum yapmış kadınlar.	Y	yıllarında	2178	    1,881	0.0046	812.1	tur_news_2014_00271373
13417	Gelişmiş ülkelerde yapılan bir araştırmaya göre 1985 yıllarında C.E.O.	Y	yıllarında	2178	    1,881	0.0046	846.2	tur_news_2005_00295113
13418	Bu arada üniversite yıllarında da müzik çalışmalarını sürdürdü.	Y	yıllarında	2178	    1,881	0.0046	985.5	tur_news_2018_00192991
13419	Üniversite yıllarında Tayyip Erdoğan’la ilişki içinde olduğu belirtiliyor.	Y	yıllarında	2178	    1,881	0.0046	1034.3333	tur_news_2005_00893244
13420	Lise yıllarında futbol oynadı. 1947 yılında Ankara Üniversitesi Hukuk Fakültesi 'ni bitirdi.	Y	yıllarında	2178	    1,881	0.0046	1150.6364	tur_news_2014_00652978
13421	Başbakan ile gazeteciler arasında konu ile ilgili en son konuşma yukarıdaki gibi..	Y	yukarıdaki	2178	    1,881	0.0046	602.9091	tur_news_2014_00146741
13422	Bu nedenle yukarıdaki haber iki duruma işaret ediyor.	Y	yukarıdaki	2178	    1,881	0.0046	645.5	tur_news_2014_00268418
13423	Yukarıdaki ifade yalnız Emniyet hizmetleri için değil bütün kurum ve kuruluşları için de geçerlidir.	Y	yukarıdaki	2178	    1,881	0.0046	786.7692	tur_news_2005_00507050
13424	Yukarıdaki gibi birçok örnek var neredeyse her gün yaşadığım.	Y	yukarıdaki	2178	    1,881	0.0046	847.8889	tur_news_2018_00984878
13425	Sadece yukarıdaki görevler tam ve zamanında yapılmış olsaydı, şu anda çok daha iyi bir durumda olacaktık diye düşünüyorum.”	Y	yukarıdaki	2178	    1,881	0.0046	899.2778	tur_news_2018_00778934
13426	'ya imza attığı için bu konuda problem yok.	Y	attığı	2179	    1,880	0.0046	662.75	tur_news_2018_00941746
13427	Şu an onun milli takım forması altında attığı ilk, tek ve son golü oldu.	Y	attığı	2179	    1,880	0.0046	717.7857	tur_news_2014_00857361
13428	Galatasaray’ın Avrupa’da aldığı başarılı sonuçlar ve attığı goller beni mutlu ediyor şeklinde konuştu.	Y	attığı	2179	    1,880	0.0046	730.7333	tur_news_2014_00455538
13429	Azerbaycan’ın da her geçen gün güçlü devlet olma yolunda attığı emin adımları takip ediyoruz” dedi.	Y	attığı	2179	    1,880	0.0046	804.4375	tur_news_2018_00093552
13430	Özel sektör bu işe el attığı zaman hareket yeteneğiniz daha fazla oluyor.	Y	attığı	2179	    1,880	0.0046	819	tur_news_2005_00728535
13431	Üzerinde çalıştığı çok sayıda değişik konu vardır.	Y	çalıştığı	2180	    1,879	0.0046	608.8571	tur_news_2014_00932550
13432	Belediye bünyesinde çalıştığı süre içerisinde çok değerli hizmetleri olmuştur.	Y	çalıştığı	2180	    1,879	0.0046	709	tur_news_2014_00163146
13433	Ancak Türkiye’de 6 milyon çocuğun çalıştığı tahmin ediliyor.	Y	çalıştığı	2180	    1,879	0.0046	727.25	tur_news_2005_00625235
13434	Yalnız çalıştığı ve oynadığı zaman başarılı olur.	Y	çalıştığı	2180	    1,879	0.0046	848.2857	tur_news_2005_00285839
13435	Babam il dışında çalıştığı için evde değildi.	Y	çalıştığı	2180	    1,879	0.0046	1211.7143	tur_news_2018_00094831
13436	Türkiye’de de böyle bir tehlike yok.	Y	tehlike	2180	    1,879	0.0046	394.6667	tur_news_2018_00894219
13437	Fakat yüzde 10 seçim barajı onlar için de ciddi bir tehlike.	Y	tehlike	2180	    1,879	0.0046	650	tur_news_2018_00414948
13438	Ama şu an öyle bir tehlike kalmadı.	Y	tehlike	2180	    1,879	0.0046	767.4286	tur_news_2018_00043896
13439	Kıbrıs Türk halkının karşı karşıya olduğu büyük tehlike budur.	Y	tehlike	2180	    1,879	0.0046	824.8889	tur_news_2018_00594213
13440	İslam dünyası için asıl tehlike de budur.	Y	tehlike	2180	    1,879	0.0046	1093.1429	tur_news_2014_00567017
13441	Bunların arasından en çok neler mi tercih ediliyor?	Y	arasından	2181	    1,878	0.0046	624.375	tur_news_2018_00238199
13442	Başkan MADDE 5. Yükseköğretim Kurulu Başkanı Cumhurbaşkanı tarafından Kurul üyeleri arasından dört yıl süre ile seçilir.	Y	arasından	2181	    1,878	0.0046	725.8667	tur_news_2005_00146358
13443	Yönetim Kurulu Başkanı (a) grubu üyeleri arasından seçilir.	Y	arasından	2181	    1,878	0.0046	854.375	tur_news_2005_00926825
13444	Öğrenciler arasından seçilen şube ve sınıf temsilcileri bir öğretim yılı için seçilir.	Y	arasından	2181	    1,878	0.0046	1064.4167	tur_news_2005_00587334
13445	Genel Müdür en az dört yıllık yüksek tahsil görmüş olanlar arasından tayin olunur.	Y	arasından	2181	    1,878	0.0046	1148.1538	tur_news_2005_00720864
13446	Fakat şu anda bu şekilde devam etmeyi düşünüyoruz.	Y	etmeyi	2181	    1,878	0.0046	675.375	tur_news_2014_00440366
13447	Sarı, Mustafa’nın genel durumunun şu anda iyi olduğunu ve bir iki gün içinde taburcu etmeyi düşündüklerini kaydetti.	Y	etmeyi	2181	    1,878	0.0046	864.8889	tur_news_2018_00790144
13448	Her geçen sene üzerine biraz daha katarak devam etmeyi düşünüyoruz.	Y	etmeyi	2181	    1,878	0.0046	950.4	tur_news_2018_00494490
13449	O gün bir melek olup, yardım etmeyi çok istedim..	Y	etmeyi	2181	    1,878	0.0046	992.2222	tur_news_2005_00275845
13450	Onu çok mutlu etmeyi ve hayatımın bir parçası olmasını istiyorum.	Y	etmeyi	2181	    1,878	0.0046	995.7	tur_news_2018_00715422
13451	Kılıçdaroğlu’nun ne bir fikri var ne de programı.	Y	fikri	2181	    1,878	0.0046	541.75	tur_news_2014_00615492
13452	Bana verecek akıllı bir fikri olan var mı?	Y	fikri	2181	    1,878	0.0046	706.625	tur_news_2018_00102585
13453	Peki, okul açma fikri nasıl ortaya çıktı?	Y	fikri	2181	    1,878	0.0046	961.1429	tur_news_2018_00753712
13454	Bu iki tarafa fikri kullanmak aynı yerden geldi.	Y	fikri	2181	    1,878	0.0046	1020.375	tur_news_2018_00217193
13455	Ama bu konudaki proje henüz fikri aşamada.	Y	fikri	2181	    1,878	0.0046	1130	tur_news_2014_00068949
13456	Sakarya Üniversitesi Fizik Bölümü’nden 2003 yılında mezun oldu.	Y	fizik	2181	    1,878	0.0046	889.125	tur_news_2014_00796792
13457	Fırat Üniversitesi Fizik Bölümü Öğretim üyesi Prof.	Y	fizik	2181	    1,878	0.0046	950.7143	tur_news_2018_00422356
13458	Ama fizik olarak daha istenilen seviyede değil.	Y	fizik	2181	    1,878	0.0046	1008.7143	tur_news_2018_00038900
13459	Fizik binası ile Elektrik Mühendisliği binası arasında.	Y	fizik	2181	    1,878	0.0046	1192.1667	tur_news_2005_00289473
13460	Yeni Fizik Yolda! google haber ara Bu habere ilk yorumu siz ekleyin.	Y	fizik	2181	    1,878	0.0046	1257.8333	tur_news_2014_00972675
13461	Ancak, heyecan verici olan bir başka şey de çok sessiz olması.	Y	sessiz	2181	    1,878	0.0046	611.1818	tur_news_2014_00088335
13462	Şimdi herkes sessiz, herkes sakin, herkes rahat ama en çok ‘mutlu’.	Y	sessiz	2181	    1,878	0.0046	763.4444	tur_news_2014_00825427
13463	O’nun köyü sessiz, -sadece O’nun köyü mü?	Y	sessiz	2181	    1,878	0.0046	901	tur_news_2005_00453232
13464	Büyük olduðunu iddia eden ülkeler, hala daha sessiz mi kalacak?	Y	sessiz	2181	    1,878	0.0046	984.8	tur_news_2018_00281094
13465	Bunun üzerine sivil üyeler de sessiz kalıyor.	Y	sessiz	2181	    1,878	0.0046	1094.4286	tur_news_2005_00783973
13466	Bir yıl içerisinde bu konuda somut gelişmeler olması gerektiğini söyledi.	Y	somut	2181	    1,878	0.0046	498.9	tur_news_2018_00162085
13467	Bunun öğrenciler üzerinde somut birçok olumsuz sonucu olacak.	Y	somut	2181	    1,878	0.0046	556.375	tur_news_2018_00247827
13468	Ya da alınan somut tedbirler yeterli oluyor mu?	Y	somut	2181	    1,878	0.0046	851.625	tur_news_2005_00902164
13469	Ancak ellerinde bir tek somut belge yok.	Y	somut	2181	    1,878	0.0046	962.1429	tur_news_2018_00053290
13470	Şimdi, doğrusu ya, ortada somut bir değişiklik görüyorum.	Y	somut	2181	    1,878	0.0046	1184.375	tur_news_2018_00813114
13471	Arkadaşlar ne için vardır; zor günlerde birlik ve dayanışma içinde olmak için.	Y	dayanışma	2182	    1,877	0.0046	631.9091	tur_news_2014_00107001
13472	Böylece hem istihdam hem dayanışma hem de ekonomik anlamda iyi işler ortaya çıkacak.	Y	dayanışma	2182	    1,877	0.0046	727.5455	tur_news_2018_00185179
13473	Anadolu tarihinde ilk defa bir uyum ve dayanışma görüldü.	Y	dayanışma	2182	    1,877	0.0046	785.2222	tur_news_2005_00785437
13474	İzmit Kent Merkezi Dayanışma Derneği Başkanı Murat Barış.	Y	dayanışma	2182	    1,877	0.0046	878	tur_news_2014_00583704
13475	Evrensel’e destek ve dayanışma etkinlikleri sürüyor.	Y	dayanışma	2182	    1,877	0.0046	1263.1429	tur_news_2018_00409414
13476	Ama bizim belediye, hangi akla hizmet böyle bir şey yapmış anlamak çok zor.	Y	akla	2183	    1,876	0.0046	500	tur_news_2014_00068133
13477	En azından daha akla yakın bir ifade ile.	Y	akla	2183	    1,876	0.0046	532.625	tur_news_2018_00387996
13478	Amacımız, e-iş konusunda ilk akla gelen firma olmak.	Y	akla	2183	    1,876	0.0046	712.4444	tur_news_2005_00977627
13479	“isyan” akla geliyor şimdi dünyanın her yerinde!.	Y	akla	2183	    1,876	0.0046	942.1429	tur_news_2014_00578683
13480	Bizde bir adet vardır “olmadan” önlem almak akla gelmez.	Y	akla	2183	    1,876	0.0046	1245.1111	tur_news_2014_00203415
13481	Bir de o ‘açık’ arkadaşları yok mu?	Y	arkadaşları	2183	    1,876	0.0046	425.8571	tur_news_2014_00187909
13482	İyi bir çalışma yeri ve iyi iş arkadaşları varsa sorun yok.	Y	arkadaşları	2183	    1,876	0.0046	497.2727	tur_news_2018_00557937
13483	Ali Oğuz (İstanbul) ve arkadaşları BAŞKAN - Sayın Komisyon?..	Y	arkadaşları	2183	    1,876	0.0046	910.375	tur_news_2005_00829780
13484	Onu görmek lazım. Onu inşallah bu sene arkadaşları davet edeceğiz.	Y	arkadaşları	2183	    1,876	0.0046	1031.1111	tur_news_2005_00577505
13485	Okulda öğretmeni ile veya arkadaşları ile problem yaşayan bir çocuk düşünün.	Y	arkadaşları	2183	    1,876	0.0046	1252.2	tur_news_2018_00700000
13486	Çünkü başarılı olması için gerekli tüm kaynaklar var.	Y	kaynaklar	2183	    1,876	0.0046	388.25	tur_news_2005_00104551
13487	Enerji ve Tabii kaynaklar Bakanlığı T.C.	Y	kaynaklar	2183	    1,876	0.0046	647	tur_news_2005_00081530
13488	Bu ülke hepimizin, bu devlet hepimizin, bu kaynaklar, bu insanlar, bu millet bizim.	Y	kaynaklar	2183	    1,876	0.0046	772.375	tur_news_2014_00304914
13489	Tarım ve Doğal Kaynaklar Bakanlığı altında kurulan Tarım ve Kırsal Kalkınma Merkezi, dün düzenlenen törenle açıldı.	Y	kaynaklar	2183	    1,876	0.0046	1050.7143	tur_news_2018_00864218
13490	Bağımsız yargı, özgür basın. Zengin doğal kaynaklar.	Y	kaynaklar	2183	    1,876	0.0046	1156.1429	tur_news_2005_00960476
13491	Geçen yıl ilk kez kuruldu ve etkili oldu.	Y	kuruldu	2183	    1,876	0.0046	404.25	tur_news_2018_00433613
13492	O zamanlar proje aşamasında olan İzmir Üniversitesi kuruldu ve yol aldı.	Y	kuruldu	2183	    1,876	0.0046	687.9091	tur_news_2014_00754003
13493	Tüm maddi sıkıntılar arasında Beşiktaş’ın ilk futbol takımı kuruldu.	Y	kuruldu	2183	    1,876	0.0046	877.3	tur_news_2014_00899466
13494	Gençlik merkezleri ve kadın yaşam merkezleri kuruldu.	Y	kuruldu	2183	    1,876	0.0046	1043.8333	tur_news_2018_00441077
13495	Jandarma Genel Komutanlığı bünyesinde ‘Sosyal Medya Şube Müdürlüğü’ kuruldu.	Y	kuruldu	2183	    1,876	0.0046	1157.1111	tur_news_2018_00562777
13496	Yine de tarih boyunca birçok farklı şekli var olmuştur.	Y	şekli	2183	    1,876	0.0046	449.2222	tur_news_2014_00981633
13497	Kaldı ki bizi bir başka devlet şekli daha bekliyor.	Y	şekli	2183	    1,876	0.0046	572.6667	tur_news_2014_00590694
13498	Artık bu büyük aile şekli hemen hemen hiç kalmadı.	Y	şekli	2183	    1,876	0.0046	697.25	tur_news_2005_00934495
13499	Şirketler için ise en iyi yönetim şekli stratejik yönetim.	Y	şekli	2183	    1,876	0.0046	808.875	tur_news_2005_00613773
13500	Çünkü en ekonomik ve en çabuk ulaşım şekli budur.	Y	şekli	2183	    1,876	0.0046	1027	tur_news_2014_00345818
13501	Ancak bunun için ileri klinik çalışmalar gerekli olacaktır.	Y	klinik	2184	    1,873	0.0046	544.875	tur_news_2005_00373846
13502	“Aslında bu konuda büyük ilerlemeler de kaydedildi ama daha fazla klinik araştırmaya da ihtiyaç olduğu kesin.	Y	klinik	2184	    1,873	0.0046	852.9375	tur_news_2018_00076548
13503	Eğer bu özel klinik ve hastaneleri tescillemek gibi bir görevi varsa ki böyle bir görevi de var o zaman bunu bilmemek çok ciddi bir eksikliktir” dedi.	Y	klinik	2184	    1,873	0.0046	876.3043	tur_news_2018_00373722
13504	Son konuşmacı olarak söz alan Ankara Üniversitesi Tıp Fakültesi Farmakoloji ve Klinik Farmakoloji Anabilim Dalı öğretim üyesi Prof.Dr.	Y	klinik	2184	    1,873	0.0046	903.5556	tur_news_2014_00841239
13505	Çünkü klinik tecrübem gösterdi ki bir çocuk ne kadar dikkatli ise o kadar derslerde başarılı oluyor.	Y	klinik	2184	    1,873	0.0046	936.4667	tur_news_2018_00320524
13506	Güzel başarılar elde ettik ama bu bizim için yeterli değil.	Y	başarılar	2185	    1,871	0.0046	471.9	tur_news_2018_00462660
13507	Rum heyeti bu süre içinde bazı başarılar da elde etmiştir.	Y	başarılar	2185	    1,871	0.0046	691.2	tur_news_2005_00527144
13508	Ülkenin daha büyük başarılar layık olduğunu biliyoruz.	Y	başarılar	2185	    1,871	0.0046	981.4286	tur_news_2018_00912664
13509	Spor Bilimleri Fakülte olarak daha güzel işleri yapmak üzere başarılar dilerim.	Y	başarılar	2185	    1,871	0.0046	1102	tur_news_2018_00842150
13510	Kısacası iki takıma da başarılar diliyorum diye konuştu.	Y	başarılar	2185	    1,871	0.0046	1215.625	tur_news_2018_00600313
13511	Sizin için Allah’tan başka ne bir dost vardır ne de bir yardımcı.”	Y	dost	2185	    1,871	0.0046	427.8182	tur_news_2018_00823762
13512	Zaman içinde de dost olduk diye konuştu.	Y	dost	2185	    1,871	0.0046	612.7143	tur_news_2014_00992783
13513	Dost değil, daha fazla düşman kazanmak mı?”	Y	dost	2185	    1,871	0.0046	1000.5714	tur_news_2014_00389517
13514	Eski dost Kütahya bizim gibi ligin yeni takımı.	Y	dost	2185	    1,871	0.0046	1094.125	tur_news_2018_00402116
13515	Bunu bir dost, bir arkadaş olarak söylüyorum.	Y	dost	2185	    1,871	0.0046	1237.1667	tur_news_2018_00241784
13516	Ama, yasa büyük bir çoğunlukla kabul edildi.	Y	çoğunlukla	2186	    1,869	0.0046	532.5714	tur_news_2005_00833209
13517	Sınav kurulu, üye tam sayısı ile toplanır ve çoğunlukla karar verir.	Y	çoğunlukla	2186	    1,869	0.0046	812.2727	tur_news_2005_00121424
13518	Bu da Mustafa Kemal’in çoğunlukla konusundaki yönleminin samimi ve gerçek olduğunu ve birçok kişi tarafından da öyle kabul edildiğini gösterir.	Y	çoğunlukla	2186	    1,869	0.0046	864.4211	tur_news_2005_00176147
13519	Ve maalesef çoğunlukla çok değerli ve insani şeyler değil bunlar.	Y	çoğunlukla	2186	    1,869	0.0046	872.3333	tur_news_2014_00941663
13520	AKP iktidarda, hem de büyük bir çoğunlukla.	Y	çoğunlukla	2186	    1,869	0.0046	887	tur_news_2014_00053448
13521	CTP’nin ilk Cumhurbaşkanı adayı değil ama.	Y	ctp	2186	    1,869	0.0046	552.2857	tur_news_2018_00311418
13522	Kuzey’den ise CTP Genel Baþkaný ile bir araya gelecek…	Y	ctp	2186	    1,869	0.0046	688.1	tur_news_2018_00626315
13523	Cevap: Hayır CTP, birçok defa açıklama yaptı.	Y	ctp	2186	    1,869	0.0046	800.5714	tur_news_2018_00294131
13524	Bu durumda Talat ve CTP ne yapacak?	Y	ctp	2186	    1,869	0.0046	905.4286	tur_news_2014_00237769
13525	CTP’nin Lefkoşa Türk Belediyesi meclis üyeliği adayları, Kamu Görevlileri Sendikası’nı (Kamu-Sen) ziyaret etti.	Y	ctp	2186	    1,869	0.0046	1204.0667	tur_news_2018_00311427
13526	Tıpkı 8 yıllık belediye başkanlığı döneminde olduğu gibi.	Y	tıpkı	2186	    1,869	0.0046	570.2857	tur_news_2014_00888984
13527	Tıpkı bu iki bayan tarafından olduğu gibi.	Y	tıpkı	2186	    1,869	0.0046	650.2857	tur_news_2005_00705683
13528	Tıpkı 2004’te Kıbrıs Ada’sı üzerinde yapılan gibi.	Y	tıpkı	2186	    1,869	0.0046	957	tur_news_2018_00876999
13529	Tıpkı Bosna gibi Suriye de BM üyesi.	Y	tıpkı	2186	    1,869	0.0046	1047.5714	tur_news_2014_00889051
13530	Tıpkı, Batı ülkelerinde de askerî yargı sistemi olduğunu iddia edenler gibi.	Y	tıpkı	2186	    1,869	0.0046	1176.0909	tur_news_2014_00889019
13531	e-Cumhuriyet halen biri Türkiye’den ve diğeri A.B.D.'	Y	diğeri	2187	    1,868	0.0046	413.1818	tur_news_2005_00885195
13532	Biri iyi de diğeri niye kötü olsun?	Y	diğeri	2187	    1,868	0.0046	643.4286	tur_news_2014_00191106
13533	Aynı konuda biri başka karar verirken diğeri başka karar veriyor.	Y	diğeri	2187	    1,868	0.0046	802.25	tur_news_2018_00086341
13534	Birincisi, her şeyi doğru kabul edenler; diğeri ise, duyduğu her şeyi yanlış kabul edenler.	Y	diğeri	2187	    1,868	0.0046	1057.4	tur_news_2018_00152778
13535	Birine destek gerektiğinde diğeri hemen hazır durumda bekliyor.	Y	diğeri	2187	    1,868	0.0046	1246.625	tur_news_2018_00153124
13536	Kıbrıs,bugüne kadar hep “bir ada” oldu, şimdi neden iki olsun?	Y	ada	2188	    1,867	0.0046	373.1818	tur_news_2018_00592894
13537	“Hiç kimse tek başına bir ada değildir.	Y	ada	2188	    1,867	0.0046	498.2857	tur_news_2005_00207446
13538	“Kıbrıs’ın sadece bir ada olduğunu biliyorum” dedi.	Y	ada	2188	    1,867	0.0046	591.125	tur_news_2014_00614246
13539	Maçta dikkat çeken bir başka isim de Onur Can Ada oldu.	Y	ada	2188	    1,867	0.0046	781.5455	tur_news_2018_00635436
13540	Mesela bir yetkili “Kýbrýs’ýn sadece bir ada olduðunu biliyorum” dedi.	Y	ada	2188	    1,867	0.0046	1216.9	tur_news_2018_00653107
13541	AKP`de böyle şeyleri görmek mümkün değil.	Y	şeyleri	2188	    1,867	0.0046	544.5714	tur_news_2014_00053138
