ORDER	SENTENCE	STATUS	WORD	RANK	COUNT	COUNT_REL	INDEX	ID
13720	Twitter’ı sanal bir şehir olarak düşünün.	Y	sanal	2206	    1,846	0.0045	1218.1429	tur_news_2018_00906526
13721	Bu değerler, o kadar önemlidir ki, onlar olmadan yaşamak mümkün değildir.	Y	değerler	2207	    1,845	0.0045	668.0909	tur_news_2018_00200922
13722	Üretim ve kapasite bundan bir kaç yıl önce önemli değerler iken günümüzde mutlak olması gereken değerler arasında yer alıyor.	Y	değerler	2207	    1,845	0.0045	711.6111	tur_news_2005_00531439
13723	Anadolu’yu Anadolu yapan işte bu tür değerler.	Y	değerler	2207	    1,845	0.0045	840.1429	tur_news_2014_00080828
13724	“Hayatı paylaşmak, aile olmak” gibi değerler yok oluyor!	Y	değerler	2207	    1,845	0.0045	911.75	tur_news_2018_00482341
13725	Bir ülke inanılmaz ucuz değerler ülkesi haline geldi.	Y	değerler	2207	    1,845	0.0045	1275.75	tur_news_2005_00423303
13726	On yıl önce, Polonya’da büyük bir dönüşüm başladı.	Y	dönüşüm	2207	    1,845	0.0045	609.4444	tur_news_2005_00874736
13727	Çünkü AB süreci bir siyaset aracı değil, toplumsal bir dönüşüm projesi..	Y	dönüşüm	2207	    1,845	0.0045	749.7	tur_news_2014_00343101
13728	CHP Gebze İlçe eski Başkanı Recep Dursun ise Gebze’de kentsel dönüşüm ile ilgili açıklama yaptı.	Y	dönüşüm	2207	    1,845	0.0045	899.5333	tur_news_2018_00296392
13729	Benzer bir sıkıntı kentsel dönüşüm süreci için de geçerli.	Y	dönüşüm	2207	    1,845	0.0045	1062.6667	tur_news_2014_00173783
13730	Kentsel dönüşüm kolay değil ama yapmak zorundayız.	Y	dönüşüm	2207	    1,845	0.0045	1203.1429	tur_news_2014_00612075
13731	Geri Daha fazla bilgi için tıklayınız ©2001 T.C.	Y	tıklayınız	2208	    1,844	0.0045	453	tur_news_2005_00677785
13732	Ayrıntılı bilgi ve kayıt olmak için buraya tıklayınız..	Y	tıklayınız	2208	    1,844	0.0045	796.375	tur_news_2005_00693073
13733	Kablo-internet hakkında daha detaylı bilgi almak için tıklayınız.	Y	tıklayınız	2208	    1,844	0.0045	908.2222	tur_news_2005_00708214
13734	Daha detaylı bilgi ve görüntüler için lütfen tıklayınız.	Y	tıklayınız	2208	    1,844	0.0045	1060.625	tur_news_2014_00351969
13735	Tüm i-CAN yarışma tarihleri ile detaylı bilgiye ulaşmak için tıklayınız.	Y	tıklayınız	2208	    1,844	0.0045	1154.2727	tur_news_2005_00214855
13736	Hem de çok daha pratik ve ekonomik bir şekilde.	Y	pratik	2209	    1,843	0.0045	286.2222	tur_news_2014_00512863
13737	Bunun daha kolay ve pratik bir yolu yok mu?	Y	pratik	2209	    1,843	0.0045	407.4444	tur_news_2018_00244237
13738	Ne teorik ne de pratik olarak başka çözüm mevcut değil….	Y	pratik	2209	    1,843	0.0045	658.4444	tur_news_2018_00682211
13739	Bölümde yalnız teorik olarak değil, aynı zamanda pratik olarak eğitim verilmektedir.	Y	pratik	2209	    1,843	0.0045	1004.2	tur_news_2005_00865751
13740	Kulüp olarak haftada 2 gün teorik eğitim alıp, pratik çalışmaları yapıyoruz.”	Y	pratik	2209	    1,843	0.0045	1166.8	tur_news_2014_00642254
13741	Şimdi ister misiniz bir 'Son dakika' haberi de bizim için olsun.	Y	misiniz	2210	    1,842	0.0045	522.0909	tur_news_2014_00825724
13742	Personel Müdürlüğü ve personel sayısı hakkında bilgi verir misiniz?	Y	misiniz	2210	    1,842	0.0045	639.75	tur_news_2005_00789434
13743	Siz de NATO’nun Libya’da ne işi var der misiniz?	Y	misiniz	2210	    1,842	0.0045	844	tur_news_2014_00834732
13744	Kutsal Kitap Com’a üye olmak ister misiniz?	Y	misiniz	2210	    1,842	0.0045	1049	tur_news_2014_00647564
13745	Bana bir bilet parası verir misiniz dedi.	Y	misiniz	2210	    1,842	0.0045	1269.7143	tur_news_2018_00101699
13746	Turkcell Süper Lig’de gelecek sezon yer alacak 3. ve son takım bugün belli olacak.	Y	turkcell	2210	    1,842	0.0045	516.4286	tur_news_2014_00902031
13747	Turkcell’in resim yarışması, bu yıl, ilköğretim ve üniversite öğrencileri arasında yapılacak.	Y	turkcell	2210	    1,842	0.0045	928.5833	tur_news_2005_00884123
13748	Fenerbahçe, Turkcell Süper Lig’in 20. haftasında son sırada bulunan Hacettepe’yi konuk etti.	Y	turkcell	2210	    1,842	0.0045	1009.4615	tur_news_2014_00445087
13749	Kuzey Kıbrıs Turkcell’e lisans devri yapıldı.	Y	turkcell	2210	    1,842	0.0045	1070.7143	tur_news_2014_00648385
13750	Turkcell Gol' Turkcell İletişim Hizmetleri A.Ş.	Y	turkcell	2210	    1,842	0.0045	1131.3333	tur_news_2005_00456809
13751	Bu arada atılan bir çok da adım var.	Y	atılan	2211	    1,841	0.0045	439.5	tur_news_2014_00225422
13752	2- Son atılan iki adım Türkiye adına tarihi önem taşıyor.	Y	atılan	2211	    1,841	0.0045	702.3333	tur_news_2014_00021723
13753	“Birlik ve beraberlik İngiltere’ye karşı atılan bir adım değil.	Y	atılan	2211	    1,841	0.0045	753.8	tur_news_2018_00156804
13754	Girne Belediyesi ile ortak atılan adımlar da önemli.	Y	atılan	2211	    1,841	0.0045	947.5	tur_news_2018_00448724
13755	Genç oyuncu kendine atılan her topu kaybetti.	Y	atılan	2211	    1,841	0.0045	1172.7143	tur_news_2014_00468251
13756	Bu da bana göre doğru bir yaklaşım.	Y	yaklaşım	2211	    1,841	0.0045	376.5714	tur_news_2005_00836013
13757	Bu konuda farklı görüş var mı bilmiyorum ama genel olarak yaklaşım böyle.	Y	yaklaşım	2211	    1,841	0.0045	558.5	tur_news_2005_00626749
13758	Karşı taraf ise, daha değişik bir yaklaşım sunuyor.	Y	yaklaşım	2211	    1,841	0.0045	793.75	tur_news_2005_00785907
13759	Peki bu gerçekçi bir yaklaşım olabilir mi?	Y	yaklaşım	2211	    1,841	0.0045	864.1429	tur_news_2018_00752011
13760	Günümüz dünyasında her konuda profesyonel destek almak hızla taraf bulan bir yaklaşım.	Y	yaklaşım	2211	    1,841	0.0045	1205	tur_news_2014_00488408
13761	Geçen yıl da yapıldı ama bu yıl daha kapsamlı oldu.	Y	kapsamlı	2212	    1,840	0.0045	341.3333	tur_news_2018_00433529
13762	Bu yüzden kapsamlı bir değerlendirme yapmak mümkün değildir.	Y	kapsamlı	2212	    1,840	0.0045	609.625	tur_news_2014_00314296
13763	Bu program, dünyadaki en kapsamlı eğitim programı.	Y	kapsamlı	2212	    1,840	0.0045	780.2857	tur_news_2018_00253657
13764	Dışarıda örnekleri var ama Türkiye’de ilk kez bu denli kapsamlı yapılıyor.	Y	kapsamlı	2212	    1,840	0.0045	999.5	tur_news_2005_00485378
13765	Yakın bir zamanda kapsamlı bir bilgilendirme yapacağız.	Y	kapsamlı	2212	    1,840	0.0045	1263.8333	tur_news_2018_00941952
13766	Yıldız Teknik Üniversitesi Madde 15 - İstanbul’da Yıldız Teknik Üniversitesi adı ile yeni bir üniversite kurulmuştur.	Y	kurulmuştur	2213	    1,839	0.0045	395.5	tur_news_2005_00219223
13767	Elektrik Proje ve Danışmanlık hizmetleri vermek amacıyla 1991 yılında kurulmuştur.	Y	kurulmuştur	2213	    1,839	0.0045	837.4444	tur_news_2005_00812410
13768	Dr. Kemal Özkan tarafından Eylül 1974 tarihinde kurulmuştur.	Y	kurulmuştur	2213	    1,839	0.0045	866.4286	tur_news_2005_00889168
13769	Trakya Üniversitesi Merkezi 1982 yılında Edirne’de kurulmuştur.	Y	kurulmuştur	2213	    1,839	0.0045	1090.5714	tur_news_2005_00250914
13770	Bilindiği üzere, bu fon 1986’da Özal tarafından kurulmuştur.	Y	kurulmuştur	2213	    1,839	0.0045	1252	tur_news_2005_00542680
13771	Bu yanlış da kabul edilemez bir şey.	Y	edilemez	2214	    1,838	0.0045	432.5714	tur_news_2014_00306608
13772	Birisi bir şey yaptığı zaman hiçbir şey takip edilemez.	Y	edilemez	2214	    1,838	0.0045	505.125	tur_news_2014_00192931
13773	Tabi bu hiçbir zaman sabit oran olarak kabul edilemez.	Y	edilemez	2214	    1,838	0.0045	783.6667	tur_news_2005_00780266
13774	Bu çerçevede Başkanlık sistemi de kabul edilemez.	Y	edilemez	2214	    1,838	0.0045	946.4286	tur_news_2018_00197886
13775	Bu bana tarif edilemez bir mutluluk verdi.	Y	edilemez	2214	    1,838	0.0045	1032.1429	tur_news_2018_00194677
13776	Aynı durum, AK Parti milletvekilleri için de geçerli.	Y	milletvekilleri	2215	    1,836	0.0045	535.75	tur_news_2018_00085955
13777	İşte CHP adına 24. Dönemde Meclis’te yer alacak milletvekilleri listesi..	Y	milletvekilleri	2215	    1,836	0.0045	723.7	tur_news_2014_00575319
13778	Oluşuyor ama buna bazı iktidar Milletvekilleri karşı çıkıyor.	Y	milletvekilleri	2215	    1,836	0.0045	943.375	tur_news_2014_00722019
13779	Milletvekilleri adına konuşan AK Parti Konya Milletvekili Sami Güçlü…”	Y	milletvekilleri	2215	    1,836	0.0045	991.7778	tur_news_2014_00678901
13780	Değerli milletvekilleri, biraz da yüzde 36 meselesi üzerinde konuşmak istiyorum.	Y	milletvekilleri	2215	    1,836	0.0045	1025.6667	tur_news_2005_00454350
13781	Ünal Erdoğan da orada başbakan olabilir, yardımcısı olabilir, şu, bu olabilir.	Y	ünal	2215	    1,836	0.0045	490.5556	tur_news_2005_00338275
13782	Dr. Hasan Ünal Kıbrıs’ta ilk kez doğru bağlantı AKP Lideri Tayyip Erdoğan, Kıbrıs Avrupa Birliği’ne girerken Türkiye’ye de tarih verilmesi gerektiğini söyledi.	Y	ünal	2215	    1,836	0.0045	637.4167	tur_news_2005_00185095
13783	Mustafa Ünal ve yönetim kurulu üyeleri, Melikgazi Belediye Başkanı ve AK Parti Büyükşehir Belediye Başkan Adayı Dr.	Y	ünal	2215	    1,836	0.0045	668.8667	tur_news_2018_00671948
13784	Ünal, Türkiye’ye performans yönetim sistemi geliyor.	Y	ünal	2215	    1,836	0.0045	713.7143	tur_news_2018_00916402
13785	Mahir Ünal- AK Parti tarafından 2002 yılından beri devam eden bir süreç var.	Y	ünal	2215	    1,836	0.0045	804.6667	tur_news_2014_00659038
13786	Bir hafta içinde üç ayrı toplantı ve üçünün de konusu aynı: Ar-Ge.	Y	ar	2216	    1,834	0.0045	830.3077	tur_news_2014_00190524
13787	Ülkeler tarafından öncelikli ilk konu olarak en çok belirtilen diğer iki başlık ise, Ar-Ge’ye finansal destek ve KOBİ’ler.	Y	ar	2216	    1,834	0.0045	928.6667	tur_news_2018_00911021
13788	Onu yüzde 10’ar ile “Ülkenin geleceği için” ve “Cumhuriyet/Atatürk değerlerinin korunması için”	Y	ar	2216	    1,834	0.0045	937.8333	tur_news_2018_00719598
13789	Henüz yükseklerde ar var ve su sorunu yok.	Y	ar	2216	    1,834	0.0045	963	tur_news_2005_00047510
13790	Erzurum İl Milli Eğitim Müdürlüğü AR-GE Şube Müdürlüğü, öğrenciler için sanat açılımı yapıyor.	Y	ar	2216	    1,834	0.0045	973.7692	tur_news_2014_00425948
13791	Son yapılan bir araştırma ortaya koyuyor ki, bu bilgilerin en önemli kaynağı basın.	Y	bilgilerin	2216	    1,834	0.0045	589.0769	tur_news_2014_00846334
13792	Eğer kişi ya da kurum, bu bilgilerin açıklanmasına karşı değil ve bunu açıkça bildirmiş ise bir sorun yoktur.	Y	bilgilerin	2216	    1,834	0.0045	778.3889	tur_news_2005_00045274
13793	Ancak, aynı anda, bu bilgilerin bir kopyası da22.	Y	bilgilerin	2216	    1,834	0.0045	794.125	tur_news_2005_00838010
13794	Her türlü bilgilerin tutulabileceği, detaylı fakat kullanımı da bir o kadar basit bir program.	Y	bilgilerin	2216	    1,834	0.0045	899.8462	tur_news_2005_00534379
13795	Başvuruda bulunan kişi, kurum ya da kuruluş, verdiği bilgilerin doğru olduğunu taahhüt eder.	Y	bilgilerin	2216	    1,834	0.0045	899.9231	tur_news_2005_00046758
13796	Türkiye Suriye için düşman ülke haline geldi.	Y	düşman	2217	    1,833	0.0045	513.7143	tur_news_2014_00912448
13797	Türkiye’nin karşısında ABD hep düşman idi.	Y	düşman	2217	    1,833	0.0045	573.5714	tur_news_2018_00900641
13798	Rusya bir taraftan, İran bir taraftan, Irak bir taraftan bizi düşman ilan etmeye başladı.	Y	düşman	2217	    1,833	0.0045	804.3	tur_news_2014_00787999
13799	Peki; biri düşman biri dost mu oluyor?	Y	düşman	2217	    1,833	0.0045	1006	tur_news_2014_00765661
13800	Neden, niçin, nasıl dost mu düşman mı?	Y	düşman	2217	    1,833	0.0045	1089.8571	tur_news_2005_00860771
13801	Yıllardır IMF’den kredi alan Türkiye artık IMF kredi veren ülke oldu.	Y	imf	2217	    1,833	0.0045	500.4	tur_news_2014_00979710
13802	IMF ve Dünya Bankası da burada çalışıyor.	Y	imf	2217	    1,833	0.0045	654.8571	tur_news_2018_00531309
13803	IMF’nin bugün bu noktaya gelmiş olması önemli.	Y	imf	2217	    1,833	0.0045	710.75	tur_news_2018_00531282
13804	Şimdi ise IMF’ye borç verir hale geldik.	Y	imf	2217	    1,833	0.0045	927.125	tur_news_2018_00813835
13805	Bir de kaynak kullanımı gerektiren bir IMF anlaşması geliyor.	Y	imf	2217	    1,833	0.0045	1243.25	tur_news_2014_00187655
13806	Serdar, 'Yüzde 56 ile Ankara ilk sırada geliyor.	Y	serdar	2217	    1,833	0.0045	531.5714	tur_news_2018_00804549
13807	Çünkü tahmin ediyorum Serdar hoca bir şekilde vesile oldu.	Y	serdar	2217	    1,833	0.0045	860.5556	tur_news_2018_00322588
13808	Galatasaray, Serdar Aziz’den 900 bin euro istiyor!	Y	serdar	2217	    1,833	0.0045	964.2857	tur_news_2018_00427599
13809	Serdar Denktaş’ın şöyle de bir yönü vardır.	Y	serdar	2217	    1,833	0.0045	1031.125	tur_news_2018_00804404
13810	Serdar TURGUT - Tüm Köşe Yazıları - Sayfa 1Uygulamada okumaya devam et.	Y	serdar	2217	    1,833	0.0045	1708.7	tur_news_2018_00804538
13811	Hiçbir şey, sahip olması yük olmayan tek şey çünkü.	Y	yük	2217	    1,833	0.0045	399.5	tur_news_2018_00504899
13812	Bunlar Maliye Bakanı’nın üzerine büyük bir yük getirdi.	Y	yük	2217	    1,833	0.0045	608.5556	tur_news_2005_00726117
13813	Zira bunlar büyük bir yük teşkil ediyor.”	Y	yük	2217	    1,833	0.0045	819.5714	tur_news_2018_00995780
13814	Böylece SSK da büyük bir yük altına girdi.	Y	yük	2217	    1,833	0.0045	889.75	tur_news_2014_00219374
13815	Bu fazla yük bir şekilde açığa çıkmak zorundadır.	Y	yük	2217	    1,833	0.0045	1281.75	tur_news_2014_00240163
13816	Etnik siyaset yapan bir parti var bu bölgede.	Y	etnik	2218	    1,832	0.0045	527.375	tur_news_2014_00431595
13817	Kürt sorunu, sadece bir terör sorunu değildir; etnik, ekonomik, sosyal, kültürel ve terör gibi pek çok boyutları olan bir sorundur.	Y	etnik	2218	    1,832	0.0045	783.1765	tur_news_2005_00828268
13818	Osmanlı’yı paramparça eden bu etnik milliyetçilik bugün Türkiye’yi de çok ciddi olarak tehdit etmektedir.	Y	etnik	2218	    1,832	0.0045	816.875	tur_news_2014_00743433
13819	Yerel ve genel seçimlerde Türkiye mozaiği içinde yer alan, hangi etnik ve inanç mensubu olursa olsun herkesin AK Parti’de siyaset yapma hakkı var.	Y	etnik	2218	    1,832	0.0045	867.3043	tur_news_2014_00975293
13820	Çok sayıda farklı etnik topluluğa sahip olmak gibi.	Y	etnik	2218	    1,832	0.0045	880	tur_news_2014_00337941
13821	Daha önce işaret ettiğimiz gibi öyle de olmuştur.	Y	ettiğimiz	2218	    1,832	0.0045	515.25	tur_news_2014_00353593
13822	Ama zaman zaman ihmal ettiğimiz bir şey var.	Y	ettiğimiz	2218	    1,832	0.0045	667.8571	tur_news_2014_00077872
13823	FETÖ diye tarif ettiğimiz bu yapı, yaklaşık 50 yıllık bir hareket.	Y	ettiğimiz	2218	    1,832	0.0045	872.8	tur_news_2018_00419621
13824	Böyle kullanan yalnızca söz konusu ettiğimiz bayan değil.	Y	ettiğimiz	2218	    1,832	0.0045	955.625	tur_news_2005_00604941
13825	Bu bizim tercih ettiğimiz yöntem değildi biliyorsunuz.	Y	ettiğimiz	2218	    1,832	0.0045	1275	tur_news_2018_00196498
13826	Bu öyle bir tüketim ki içine her şeyi alıyor.	Y	tüketim	2218	    1,832	0.0045	536.3333	tur_news_2005_00001839
13827	Ama Rusya’da tam tersi tüketim çok yüksek.	Y	tüketim	2218	    1,832	0.0045	788.625	tur_news_2018_00042931
13828	Öyle ki, bir yanımız tüketim sisteminin parçası olarak kabul ederken, diğer yanımız ise bu sisteme bir şekilde dahil olmak istiyor.	Y	tüketim	2218	    1,832	0.0045	837.0556	tur_news_2014_00748452
13829	Dolayısı ile üretim ile tüketim arasında her zaman bir açık söz konusudur.	Y	tüketim	2218	    1,832	0.0045	843.6364	tur_news_2018_00355753
13830	Genel olarak tüm müşterilerimin bu dönemde ortak tüketim sebebi sağlık.	Y	tüketim	2218	    1,832	0.0045	851.3	tur_news_2018_00443098
13831	Özellikle son 10 yıldır Türkiye’nin çevresinde bir yeniden yapılanma söz konusu.	Y	çevresinde	2219	    1,830	0.0045	635.5455	tur_news_2014_00757474
13832	İzmir ve çevresinde yerel yönetimlerin “çok kötü” olduğu konusunda, herkes fikir birliği yapmış.	Y	çevresinde	2219	    1,830	0.0045	783.6923	tur_news_2014_00583422
13833	Özellikle Genel Başkan çevresinde oluşan bir grubuz biz, diyor (Cumhuriyet, 22 Ekim).	Y	çevresinde	2219	    1,830	0.0045	785.3636	tur_news_2014_00756555
13834	İl Milli Eğitim Müdürlüğü`nde şube müdür olarak Görev yapan Süleyman Yıldırım`ın oğlu olan Burak yıldırım`ın çevresinde oldukça sevilen ve örnek gösterilen bir öğrenci olduğu belirtildi.	Y	çevresinde	2219	    1,830	0.0045	785.4231	tur_news_2014_00553043
13835	Örnek: İzmir aynı zamanda yalnız Türkiye veya Akdeniz çevresinde değil belki de dünyada art bölgesi en geniş ve en güzel yerleşim birimidir.	Y	çevresinde	2219	    1,830	0.0045	810.0476	tur_news_2005_00895865
13836	Önce Ankara Üniversitesi Gıda Mühendisliği Fakültesi’nden Prof.	Y	mühendisliği	2219	    1,830	0.0045	646.5	tur_news_2014_00723606
13837	Boğaziçi Üniversitesi Elektrik- Elektronik Mühendisliği, Sistem Mühendisliği Ana Bilim Dalı’ndan 1985 yılında mezun oldu.	Y	mühendisliği	2219	    1,830	0.0045	893.7692	tur_news_2005_00692847
13838	Anadolu Üniversitesi Kimya Mühendisliği Bölümü Öğretim Üyesi Yrd.	Y	mühendisliği	2219	    1,830	0.0045	1033.875	tur_news_2018_00047927
13839	Bu yüzyılda önde gelen teknoloji, genetik mühendisliği olacak gibi görünüyor.	Y	mühendisliği	2219	    1,830	0.0045	1199.6	tur_news_2005_00701610
13840	ODTÜ Gıda Mühendisliği Bölümü öğretim görevlisi Dr.	Y	mühendisliği	2219	    1,830	0.0045	1359.2857	tur_news_2014_00710828
13841	Tasarruf edilecek o kadar çok şey var ki.	Y	tasarruf	2219	    1,830	0.0045	455.625	tur_news_2018_00864932
13842	Türkiye Birleşik Tasarruf ve Kredi Bankası A.Ş.	Y	tasarruf	2219	    1,830	0.0045	819.125	tur_news_2005_00514618
13843	Balıkesir’de bu yolla yapılacak tasarruf, yılda ortalama 4 milyon lira olacaktır.	Y	tasarruf	2219	    1,830	0.0045	974.6364	tur_news_2014_00141404
13844	Bakan üç tasarruf kaynağı gösterdi: Konut politikası, meslek eğitimi ve sosyal politika.	Y	tasarruf	2219	    1,830	0.0045	1016	tur_news_2018_00099120
13845	Bazı okullarda Tasarruf Haftası kapsamında çocuklara eğitim verildi.	Y	tasarruf	2219	    1,830	0.0045	1278.25	tur_news_2018_00117289
13846	Ardından 1993 yılında Türkiye’nin ilk kadın başbakanı oldu.	Y	başbakanı	2220	    1,829	0.0045	362.125	tur_news_2018_00068160
13847	Çünkü yine tek başına iktidar olan, başbakanı belli Ak Parti görevine devam ediyor olacaktır.	Y	başbakanı	2220	    1,829	0.0045	588.9286	tur_news_2018_00323341
13848	Partinin genel başkanı ve hükümetin başbakanı benim.	Y	başbakanı	2220	    1,829	0.0045	766.1429	tur_news_2018_00748989
13849	Acaba PKK terör örgütü ile İsrail Başbakanı’nın gizli bir anlaşması mı var.	Y	başbakanı	2220	    1,829	0.0045	798.6154	tur_news_2018_00005373
13850	Diyor ki, ‘Laik ülkenin Başbakanı gibi konuşmak zor mu?	Y	başbakanı	2220	    1,829	0.0045	1106.1111	tur_news_2014_00381987
13851	Bugün Türkiye’yi Hindistan’da temsil ediyor.	Y	hindistan	2221	    1,828	0.0045	509.4286	tur_news_2014_00247046
13852	İkinci en fazla göç veren ülke ise Hindistan.	Y	hindistan	2221	    1,828	0.0045	652.125	tur_news_2018_00519558
13853	Rusya, Çin, Hindistan ve İran başta olmak üzere dünyanın yarısı Prof.	Y	hindistan	2221	    1,828	0.0045	754.4545	tur_news_2018_00773150
13854	Irak ile Hindistan arasında 74 ayrı alanda işbirliği anlaşması yapıldı.	Y	hindistan	2221	    1,828	0.0045	880.5556	tur_news_2005_00601107
13855	Hindistan da hızlı büyüyen ülkelerin başında geliyor.	Y	hindistan	2221	    1,828	0.0045	1115.2857	tur_news_2014_00528940
13856	Bunu İnönü de yaptı, CHP de yapıyor.	Y	i̇nönü	2221	    1,828	0.0045	598.8333	tur_news_2014_00275110
13857	Başkanlık için Malatya’dan İnönü Üniversitesi Öğretim Üyesi Prof.	Y	i̇nönü	2221	    1,828	0.0045	656.4444	tur_news_2018_00109852
13858	Kadınlar bir süre sonra İnönü Parkı’na geldi.	Y	i̇nönü	2221	    1,828	0.0045	759.875	tur_news_2014_00588177
13859	Mektup ise,Mustafa Kemal Atatürk’ün İsmet İnönü’ye yazdığı mektup!	Y	i̇nönü	2221	    1,828	0.0045	1123.1	tur_news_2018_00649071
13860	İnönü Üniversitesi Kimya Mühendisliği Öğretim Üyesi Doç.	Y	i̇nönü	2221	    1,828	0.0045	1287.2857	tur_news_2018_00534125
13861	İTO’dan AB’ye Özel Çalışma İTO Avrupa Topluluğu’nun Türkiye için önemini her zaman dikkate aldı.	Y	önemini	2221	    1,828	0.0045	694.75	tur_news_2005_00765111
13862	Bu da Türkiye’nin GE için önemini gösteriyor.	Y	önemini	2221	    1,828	0.0045	746.625	tur_news_2018_00200377
13863	Tabii ki günlük olaylar çok önemli ve günlük gelişmeler önemini muhafaza edecek.	Y	önemini	2221	    1,828	0.0045	845.0909	tur_news_2005_00051184
13864	Dolayısıyla bütün bu olaylar AB’ye Türkiye’nin üye yapılmasının önemini göstermektedir.	Y	önemini	2221	    1,828	0.0045	864.9167	tur_news_2014_00386783
13865	Konya’da bu işin önemini fark ederek harekete geçen sanayiciler de var.	Y	önemini	2221	    1,828	0.0045	883.75	tur_news_2014_00631852
13866	Bugün Türkiye’de üç çeşit siyasi parti var.	Y	çeşit	2222	    1,827	0.0045	366.125	tur_news_2014_00247010
13867	İş yapıyoruz tabi ki hem de çok fazla, çok çeşit.	Y	çeşit	2222	    1,827	0.0045	613.2222	tur_news_2018_00556650
13868	Eskiden, bir alanda, sadece bir iki çeşit ürün varken şimdi seçenek o kadar çok ki..	Y	çeşit	2222	    1,827	0.0045	799.9286	tur_news_2014_00428311
13869	Alanya’da üç-dört çeşit esnaf tipi var.	Y	çeşit	2222	    1,827	0.0045	885.875	tur_news_2018_00024984
13870	Her çeşit katkı için gerekli destek sözlerini verdiler.	Y	çeşit	2222	    1,827	0.0045	1090.25	tur_news_2005_00982893
13871	Barcelona’ya gidip bir ay sonra geri gönderilen futbolcu bile yok olup gitti.	Y	gönderilen	2222	    1,827	0.0045	816.8462	tur_news_2018_00103566
13872	Eğitim amacıyla Avrupa’ya gönderilen öğrencilerin bir bölümü ressam olarak geri döndü.	Y	gönderilen	2222	    1,827	0.0045	827.75	tur_news_2014_00405465
13873	Zaten buna ilişkin olarak Türkiye Cumhuriyeti tarafından bize gönderilen geniş çaplı bir taslak vardır.	Y	gönderilen	2222	    1,827	0.0045	835.1429	tur_news_2018_00992562
13874	Okulumuzda iki yıl önce bakanlık tarafından gönderilen beş bilgisayar var.	Y	gönderilen	2222	    1,827	0.0045	909.2	tur_news_2014_00717202
13875	Bana yazarları tarafından gönderilen her kitap için bir telefon açar ve teşekkür ederim.	Y	gönderilen	2222	    1,827	0.0045	912	tur_news_2018_00102614
13876	Hem de yazılı ve görsel basın tarafından.	Y	görsel	2222	    1,827	0.0045	502.2857	tur_news_2018_00488447
13877	Bu hem görsel hem de sağlıkla ilgili bir konu.	Y	görsel	2222	    1,827	0.0045	810.125	tur_news_2014_00249499
13878	Çünkü o dönemde görsel bilgi kaynakları çok yaygın değildi.	Y	görsel	2222	    1,827	0.0045	814	tur_news_2014_00347954
13879	Görsel brifing öncesi cenazesi olan bir aileyi ziyaret ettiğini de hatırlatan Başkan Çelik, İstanbul’dan gelen aile İstanbul’da bile böyle hizmet olmadığını söyledi diye konuştu.	Y	görsel	2222	    1,827	0.0045	848.04	tur_news_2018_00452904
13880	Bu yazılı basında da, görsel basında da böyle olmak zorunda.	Y	görsel	2222	    1,827	0.0045	853.375	tur_news_2005_00376337
13881	Büyükşehir Belediye Başkanı Hacı Uğur Polat, devam eden çalışmaları yerinde inceleyerek, yapılan çalışmalar ile ilgili açıklamalarda bulundu.	Y	hacı	2222	    1,827	0.0045	938.5882	tur_news_2018_00281304
13882	Turnuva Komitesi Başkanı Hacı Mustafa Özkan, “15 Mayıs’a kadar bu turnuva devam edecek.	Y	hacı	2222	    1,827	0.0045	968	tur_news_2018_00905320
13883	Kültür Merkezi çalışmalarına hızla devam eden Körfez Belediyesi, Hacı Osman Mahallesi’nden çıkan yolu da duble hale getiriyor.	Y	hacı	2222	    1,827	0.0045	977.8333	tur_news_2018_00620220
13884	Hacı Ömer Sabancı Holding her biri kendi sektöründe lider olan sahip olduğu 50’den fazla şirketiyle Türkiye’deki en büyük iki gruptan biridir.	Y	hacı	2222	    1,827	0.0045	993.7273	tur_news_2005_00518161
13885	Hacı olmak kolay ama zor olan hacı kalmaktır.	Y	hacı	2222	    1,827	0.0045	1003.4286	tur_news_2014_00491975
13886	Artık her biri için standart bir hayat kalitesi var.	Y	kalitesi	2222	    1,827	0.0045	518.2222	tur_news_2018_00071876
13887	Toplam kayıt süresi en az 45 dakika olmalıdır. Kayıt kalitesi çok önemlidir.	Y	kalitesi	2222	    1,827	0.0045	728.6	tur_news_2005_00054320
13888	Eğitimin kalitesi ve arz-talep gibi sorunlar ayrı bir konu.	Y	kalitesi	2222	    1,827	0.0045	884.5	tur_news_2014_00405911
13889	Bir işin popüler olmasına engel değil ki kalitesi.	Y	kalitesi	2222	    1,827	0.0045	997.25	tur_news_2014_00193005
13890	Bilgi alımı adet olarak artıyor ancak bilginin kalitesi düşüyor.	Y	kalitesi	2222	    1,827	0.0045	1507.2222	tur_news_2014_00178676
13891	Bu sadece Sivas’a özgü bir şey değil.	Y	özgü	2222	    1,827	0.0045	549.125	tur_news_2014_00291954
13892	Bu gerçek sadece bu yıla özgü de değildir.	Y	özgü	2222	    1,827	0.0045	645	tur_news_2014_00242038
13893	ABD yönetiminin bu anlamda kendine özgü bir durumu var.	Y	özgü	2222	    1,827	0.0045	769.7778	tur_news_2014_00036597
13894	Bu anlayış bize özgü bir şey değildi.	Y	özgü	2222	    1,827	0.0045	953.7143	tur_news_2018_00191466
13895	Şüphesiz her ülkenin, bölgenin, hatta kentin kendine özgü bazı özellikleri var.	Y	özgü	2222	    1,827	0.0045	1028	tur_news_2014_00860720
13896	Ancak bu ağırlık her geçen yıl hem ilk hem de ikinci yılda artış gösterdi.	Y	ağırlık	2223	    1,826	0.0045	433.8462	tur_news_2018_00050957
