ORDER	SENTENCE	STATUS	WORD	RANK	COUNT	COUNT_REL	INDEX	ID
9373	Bakan, Bunun, siyasi fayda sağlamak isteyen bir grup insanın almış olduğu daha çok siyasi bir karar olduğunu söylemek isterim.	Y	söylemek	1681	    2,654	0.0065	650.1176	tur_news_2014_00138608
9374	Fakat Batı dünyası için aynı şeyleri söylemek mümkün değildir.	Y	söylemek	1681	    2,654	0.0065	812.6667	tur_news_2014_00437814
9375	Saadet iktidar olsaydı sonuç ne olurdu onu size söylemek istiyorum.	Y	söylemek	1681	    2,654	0.0065	1179.2	tur_news_2014_00789203
9376	EVET Hasta beslenme açısından kötü durumda mı?	Y	beslenme	1682	    2,653	0.0065	607.2857	tur_news_2005_00474812
9377	'Az az ve sık sık beslenme çok önemli' dedik.	Y	beslenme	1682	    2,653	0.0065	702.1429	tur_news_2018_00093407
9378	Peki nedir, Akdeniz Beslenme Modeli’nin temel özellikleri?	Y	beslenme	1682	    2,653	0.0065	923.75	tur_news_2005_00826763
9379	ALANYA Kent Konseyi Kadın Meclisi Kültür-Sanat Grubu tarafından 'Sağlıklı Beslenme' adlı panel gerçekleştirildi.	Y	beslenme	1682	    2,653	0.0065	1020.9286	tur_news_2014_00057219
9380	Kendilerinin de çocuklarının da beslenme koşulları çok kötü.	Y	beslenme	1682	    2,653	0.0065	1223.5	tur_news_2018_00587195
9381	Yani bu kadar balık olacak canlı yok oluyor.	Y	balık	1683	    2,652	0.0065	435.375	tur_news_2018_00946571
9382	Balık ve Yükselen Balık Bir Balık ile mücadele etmek oldukça zor!	Y	balık	1683	    2,652	0.0065	605.7778	tur_news_2018_00101223
9383	Bu arada İzmit’in balık pazarı sorunu var.	Y	balık	1683	    2,652	0.0065	853.75	tur_news_2018_00192417
9384	Genel olarak ülkemizde fiyatlar yüksek olduğu için balık fiyatları da yüksek geliyor vatandaşlara.	Y	balık	1683	    2,652	0.0065	910.6667	tur_news_2018_00443103
9385	Balık tutan onlar, burada keyif yapan onlar.	Y	balık	1683	    2,652	0.0065	1229.1667	tur_news_2018_00101210
9386	İstanbul Eğitim ve Araştırma Hastanesi’nde görevli olan Dr.	Y	görevli	1683	    2,652	0.0065	388.7778	tur_news_2018_00549340
9387	Görevli var mı, yok mu belli değil.	Y	görevli	1683	    2,652	0.0065	396	tur_news_2018_00452605
9388	Ya orada görevli veya İzmir’de gelecek adresi yok..	Y	görevli	1683	    2,652	0.0065	607.5556	tur_news_2014_00958825
9389	Tıp Fakültesi’nde yapılmaktadır. Dersler programda görevli öğretim üyeleri ve İ.Ü Tıp Fakültesi öğretim üyeleri tarafından verilmektedir.	Y	görevli	1683	    2,652	0.0065	1064.7143	tur_news_2005_00108406
9390	Programda Görevli Öğretim Üye ve Elemanları ¨Yrd.	Y	görevli	1683	    2,652	0.0065	1378	tur_news_2005_00776229
9391	Çevre Bakanlığı’nın bu konuda karar alması ve uygulaması gerekiyor dedi.	Y	alması	1684	    2,647	0.0065	468.7273	tur_news_2018_00294413
9392	Bunun için de kadınların da askerlik eğitimi alması mutlaka gerekiyor.	Y	alması	1684	    2,647	0.0065	720	tur_news_2014_00277435
9393	İzmir’in hükümet desteğini alması lazım” diye konuştu.	Y	alması	1684	    2,647	0.0065	789.625	tur_news_2014_00582735
9394	Bu süreçte Kocaeli’deki kurumların görev alması gerekir.	Y	alması	1684	    2,647	0.0065	935.125	tur_news_2014_00298504
9395	Romanya’nın böyle bir tavır alması normal.	Y	alması	1684	    2,647	0.0065	1131	tur_news_2014_00786309
9396	O yüzden bunun Türk çocuğu değil de çocuk olması önemli.	Y	çocuğu	1684	    2,647	0.0065	287.7	tur_news_2005_00278012
9397	Bu aile, ilk okula giden tek çocuğu olan bir aile idi.	Y	çocuğu	1684	    2,647	0.0065	567	tur_news_2005_00764599
9398	Benden başka, şimdi hayatta olmayan iki çocuğu daha vardı.	Y	çocuğu	1684	    2,647	0.0065	763.5556	tur_news_2005_00296202
9399	Bülent Arınç da benim gibi bir asker çocuğu.	Y	çocuğu	1684	    2,647	0.0065	902.75	tur_news_2014_00259075
9400	Çiftçi bir ailenin çocuğu olarak dünyaya geldi.	Y	çocuğu	1684	    2,647	0.0065	1113.1429	tur_news_2005_00746948
9401	Eğitim, sağlık, ulaşım, inşaat birçok konuda yatırım yapılacak.	Y	inşaat	1685	    2,643	0.0065	634	tur_news_2014_00406186
9402	Türkiye Çin’den sonra inşaat sektörünün en güçlü olduğu ülkelerden biri.	Y	inşaat	1685	    2,643	0.0065	770.9091	tur_news_2014_00904299
9403	Şu anda da bilindiği üzere artık inşaat başlamış durumda.	Y	inşaat	1685	    2,643	0.0065	823.5556	tur_news_2014_00856422
9404	Biz biliyoruz ki bu konuda çok tecrübeli inşaat şirketleri var.	Y	inşaat	1685	    2,643	0.0065	906	tur_news_2018_00163936
9405	Fakat sadece inşaat çalışmaları görsel sorunlara neden olmuyor.	Y	inşaat	1685	    2,643	0.0065	1228.875	tur_news_2018_00414335
9406	Bu noktada, Başbakan Tayyip Erdoğan’a da hakkını teslim etmek gerekiyor.	Y	hakkını	1686	    2,641	0.0065	530.3636	tur_news_2014_00273291
9407	Ancak 12. adamın da hakkını teslim etmek gerek.	Y	hakkını	1686	    2,641	0.0065	793.2857	tur_news_2018_00049312
9408	Malatya’nın hakkını alması ve daha fazla yatırım yapılması için elimizden geleni yapıyoruz” diye konuştu.	Y	hakkını	1686	    2,641	0.0065	852.1333	tur_news_2018_00640619
9409	Haydar Baş’ın hakkını dile getirmek gerekiyor.	Y	hakkını	1686	    2,641	0.0065	1088.2857	tur_news_2014_00508819
9410	Devlet, protesto hakkını güvence altına almak zorundadır.	Y	hakkını	1686	    2,641	0.0065	1474.5714	tur_news_2018_00343183
9411	Yurt içinden en fazla Ankara ve İstanbul’dan turist geliyor.	Y	içinden	1686	    2,641	0.0065	576.3	tur_news_2014_00990551
9412	“Yeni CHP”de oyun içinden oyun çıkıyor.	Y	içinden	1686	    2,641	0.0065	622.6667	tur_news_2014_00972103
9413	Özellikle içinden geçtiğimiz dönem için birlik ve beraberlik ülkemiz için çok önemli.	Y	içinden	1686	    2,641	0.0065	769.9091	tur_news_2018_00742222
9414	Bir kentin içinden denize gerek büyük bir keyif olsa gerek.	Y	içinden	1686	    2,641	0.0065	1188.75	tur_news_2014_00194148
9415	Son dört yıldan beri düzenlenen başarıyla düzenlenen fuar hem yurt içinden hem de yurt dışından hayli ilgi görüyor.	Y	içinden	1686	    2,641	0.0065	1211	tur_news_2014_00840515
9416	Türkiye’de ise bir Türk şirketi olarak çalışıyoruz.	Y	şirketi	1686	    2,641	0.0065	443.75	tur_news_2014_00905967
9417	Ve üç yeni film şirketi çalışmalarına başladı.	Y	şirketi	1686	    2,641	0.0065	621.2857	tur_news_2005_00434055
9418	O da tek dağıtım şirketi değildi o zaman.	Y	şirketi	1686	    2,641	0.0065	806	tur_news_2005_00262316
9419	İlk milli sigorta şirketi olan Anadolu Sigorta faaliyete geçti.	Y	şirketi	1686	    2,641	0.0065	917.75	tur_news_2018_00528416
9420	Tepe Mobilya Tepe Mobilya, Tepe Grubu’nun ilk şirketi olarak 1969 yılında kurulmuştur.	Y	şirketi	1686	    2,641	0.0065	1152.4444	tur_news_2005_00140730
9421	Bu hizmet ikinci bir emre kadar T.C.	Y	emre	1687	    2,640	0.0065	385.625	tur_news_2005_00769908
9422	Teknik Direktör Ahmet Yıldırım da Emre’nin çok deneyimli bir oyuncu olduğunu söyledi.	Y	emre	1687	    2,640	0.0065	715.6923	tur_news_2018_00869591
9423	Yunus Emre’ye göre dört bilgi düzeyi vardır.	Y	emre	1687	    2,640	0.0065	966.375	tur_news_2014_00989860
9424	Emre, “3 Temmuz’la Fenerbahçe merkezli bir süreç yaşandı.	Y	emre	1687	    2,640	0.0065	1076.875	tur_news_2014_00414854
9425	Emre Aşık Eski Futbolcu olarak görev yapmaktadır.	Y	emre	1687	    2,640	0.0065	1332	tur_news_2018_00387462
9426	Kadın-erkek, yaşlı-genç hep birlikte mücadele edeceğiz, güzel bir Türkiye’yi yeniden inşa etmek için diye konuştu.	Y	yaşlı	1688	    2,639	0.0065	407.3333	tur_news_2018_00565726
9427	O günlerde yaşlı olanlar için de durum aynı idi.	Y	yaşlı	1688	    2,639	0.0065	496.8889	tur_news_2014_00714211
9428	“Eski, yaşlı insanlar halen daha talep gösteriyor.	Y	yaşlı	1688	    2,639	0.0065	694.7143	tur_news_2018_00403388
9429	Sorun yaşlı öğretmen genç öğretmen sorunu mu?	Y	yaşlı	1688	    2,639	0.0065	775.6667	tur_news_2018_00837558
9430	Yaşlı kadının yakınları; Daha yeni ameliyat olmuştu.	Y	yaşlı	1688	    2,639	0.0065	1465.1429	tur_news_2014_00966260
9431	Türkiye’nin ilk büyük karşı kültürü nı Koç Üniversitesi Tarih Bölümü öğretim üyesi Prof.	Y	koç	1689	    2,637	0.0065	524.2857	tur_news_2018_00900490
9432	Ali Koç, belki Türkiye’nin en zengin, maddi açıdan en güçlü adamı.	Y	koç	1689	    2,637	0.0065	724.7273	tur_news_2018_00026862
9433	Ali Koç bunu borç olarak gösteriyor, Aziz Yıldırım 'Borç değil' diyor.	Y	koç	1689	    2,637	0.0065	780	tur_news_2018_00026865
9434	M.Emin Koç Yeni Mesaj’da yazdı.	Y	koç	1689	    2,637	0.0065	988.2857	tur_news_2018_00649519
9435	Toplantının sonunda Salı Grubu Başkanı Muharrem Koç, Deniz Baykal’a teşekkür etti.	Y	koç	1689	    2,637	0.0065	1134.75	tur_news_2018_00880147
9436	Ne diye her şey Türkiye’den bekleniyor.	Y	bekleniyor	1690	    2,636	0.0065	291	tur_news_2014_00696356
9437	Hafta sonuna doğru Ankara, Bursa, Kocaeli ve Konya’da kar yağışı bekleniyor.	Y	bekleniyor	1690	    2,636	0.0065	788.6667	tur_news_2018_00466330
9438	Benzer bir yasa Hollanda’da da bekleniyor.	Y	bekleniyor	1690	    2,636	0.0065	922.5	tur_news_2014_00173797
9439	İlk seri üretim grubunun 2019’da Rusya Hava-Uzay Kuvvetleri’ne teslim edilmesi bekleniyor.	Y	bekleniyor	1690	    2,636	0.0065	1095.9231	tur_news_2018_00529287
9440	Pazartesi ve Salı günleri de yağış bekleniyor.	Y	bekleniyor	1690	    2,636	0.0065	1451.8571	tur_news_2018_00750754
9441	Ne oldu sonuçta Kıbrıs bugün AB üyesi bir ülke.	Y	sonuçta	1690	    2,636	0.0065	354	tur_news_2014_00698015
9442	Birkaç hafta sonuçta az bir değişiklik yapar.	Y	sonuçta	1690	    2,636	0.0065	642.7143	tur_news_2005_00293071
9443	Sonuçta sportif bir olay ama arkasında bilinen bir gerçek de var işin.	Y	sonuçta	1690	    2,636	0.0065	848.8182	tur_news_2018_00834836
9444	Sonuçta tüm partiler için geçerli olan budur…	Y	sonuçta	1690	    2,636	0.0065	1006.8571	tur_news_2018_00834867
9445	Sonuçta maçı kaybetti Fenerbahçe ancak turu Kadıköy’de kaybetti.	Y	sonuçta	1690	    2,636	0.0065	1261.75	tur_news_2018_00834735
9446	Birincisi Türkiye’nin tarihinden dolayı bir ilgi var.	Y	tarihinden	1690	    2,636	0.0065	596.5	tur_news_2018_00152978
9447	Verilen karar, başvuru tarihinden itibaren en çok on beş gün içinde öğrenciye bildirilir.	Y	tarihinden	1690	    2,636	0.0065	821.5385	tur_news_2005_00979991
9448	Sınav sonuçları, sınav tarihinden itibaren 2 yıl geçerli olacak.	Y	tarihinden	1690	    2,636	0.0065	828.5714	tur_news_2005_00240585
9449	d) Genel Kurul Üyeleri Listesi’ne itiraz Genel Kurul tarihinden 20 (yirmi) gün öncesine kadar Yönetim Kurulu’na yapılabilir.	Y	tarihinden	1690	    2,636	0.0065	969	tur_news_2005_00252516
9450	Çıkış tarihinden önce İngiltere’de yaşayan insanları düşünüyoruz.	Y	tarihinden	1690	    2,636	0.0065	1057.375	tur_news_2018_00299718
9451	Bunun dışında bu yıla özel bir durum var.	Y	yıla	1690	    2,636	0.0065	304.125	tur_news_2018_00244462
9452	Yaklaşık %50 civarında bir önceki yıla göre artış var.	Y	yıla	1690	    2,636	0.0065	608.875	tur_news_2018_00943208
9453	Her dört yıla bir büyük hareket denk geliyor.	Y	yıla	1690	    2,636	0.0065	670.125	tur_news_2014_00517783
9454	Biz bu yıl geçen yıla oranla daha çok hazırlık yapıyoruz.	Y	yıla	1690	    2,636	0.0065	762.3	tur_news_2014_00203095
9455	Araştırmaya göre, geçen yıla göre iş arayan yabancı aday sayısı yüzde 40 arttı.	Y	yıla	1690	    2,636	0.0065	1044.6364	tur_news_2014_00104242
9456	Ancak kalkınma bölge ile birlikte olursa daha güzel olur.	Y	kalkınma	1691	    2,632	0.0065	345.5556	tur_news_2014_00089087
9457	Antalya’da halka hitap eden Adalet ve Kalkınma Partisi (AK Parti) Genel Başkanı ve Başbakan Recep Tayyip Erdoğan, “Artık Türkiye’de yan gelip yatan bir iktidar yok.	Y	kalkınma	1691	    2,632	0.0065	656.6538	tur_news_2014_00098560
9458	Çok nüfus çok beyin, çok beyin çok enerji, çok enerji çok üretim, çok üretim çok kalkınma demektir.	Y	kalkınma	1691	    2,632	0.0065	901.1429	tur_news_2014_00337642
9459	Ekonomik gelişme ve kalkınma sosyal ve kültürel değişimi de içerir.	Y	kalkınma	1691	    2,632	0.0065	1074.2222	tur_news_2014_00408300
9460	İkinci olarak seçmen istikrar ve kalkınma istiyor.	Y	kalkınma	1691	    2,632	0.0065	1340.8571	tur_news_2014_00543037
9461	Yatırımlar konusunda da Kara Elbistan Belediyesi’nin olumlu, güzel ve örnek uygulamaları var.	Y	uygulamaları	1691	    2,632	0.0065	675.3077	tur_news_2014_00966808
9462	Bu üç alanda ürünün çeşitli uygulamaları söz konusu.	Y	uygulamaları	1691	    2,632	0.0065	707.75	tur_news_2005_00751868
9463	Özellikle bu tarz uygulamaları erkekler de çok fazla tercih ediyor.	Y	uygulamaları	1691	    2,632	0.0065	756.3	tur_news_2018_00741243
9464	e-İş Ödülü İnternet üzerine kurulu iş çözümü projeleri ve uygulamaları.	Y	uygulamaları	1691	    2,632	0.0065	877.6364	tur_news_2005_00165736
9465	Bunlardan en kapsamlı olanı ise SSK’nın uygulamaları.	Y	uygulamaları	1691	    2,632	0.0065	1327.125	tur_news_2005_00317348
9466	Bu arada Millî Eğitim Bakanlığı’na da bir uyarı yapmak lazım.	Y	millî	1692	    2,631	0.0065	574.5455	tur_news_2014_00226530
9467	Millî Lig dönemi 1959 yılında, Millî Lig adı altında ulusal bir lig kuruldu.	Y	millî	1692	    2,631	0.0065	740.4444	tur_news_2014_00679727
9468	Millî Takım’a giden bir oyuncusu vardı orta sahada.	Y	millî	1692	    2,631	0.0065	897.7778	tur_news_2014_00679996
9469	Atatürk’ten günümüze yerli ve millî olmak?	Y	millî	1692	    2,631	0.0065	938.8571	tur_news_2018_00079637
9470	Adalet Bakanı Millî Savunma Bakanı İçişleri Bakanı İ.	Y	millî	1692	    2,631	0.0065	1270.6667	tur_news_2005_00343966
9471	Onlara göre, bölgede Rusya’dan daha büyük bir ülkenin olması Rusya’nın ulusal çıkarlarına aykırı.	Y	aykırı	1693	    2,630	0.0065	632.8571	tur_news_2005_00850724
9472	“Anayasa’ya aykırı mı, Anayasa’ya aykırı.	Y	aykırı	1693	    2,630	0.0065	640.5	tur_news_2014_00082330
9473	Belki bazı insanlar için, Zaman’da yazmam aykırı gibi gelebilir ama hiç de öyle değil.	Y	aykırı	1693	    2,630	0.0065	651.7333	tur_news_2014_00164589
9474	“Bu, ülke için tamamen haksız ve kötü olduğu gibi hukuka da aykırı.”	Y	aykırı	1693	    2,630	0.0065	698.5	tur_news_2018_00274405
9475	Göze aykırı gelen bir şey yok sanki.	Y	aykırı	1693	    2,630	0.0065	761.7143	tur_news_2014_00481830
9476	Reklam işi başkan ve yönetim için zor bir iş.	Y	reklam	1693	    2,630	0.0065	360.7778	tur_news_2018_00768646
9477	Ama günümüzde hani bir reklam var ya, 'Biz yaptık.	Y	reklam	1693	    2,630	0.0065	716.1111	tur_news_2018_00039347
9478	İlk reklam filmi teklifi bu şekilde geldi.	Y	reklam	1693	    2,630	0.0065	866.2857	tur_news_2018_00529214
9479	Genelde “problem” olan aslında reklam değil, televizyon.	Y	reklam	1693	    2,630	0.0065	951.4286	tur_news_2005_00833699
9480	Bu site Ata Reklam A.Ş. tarafından yapılmıştır.	Y	reklam	1693	    2,630	0.0065	1189.375	tur_news_2005_00027043
9481	Dolayısıyla her yere girip çıkan bir hanım.	Y	hanım	1694	    2,629	0.0065	800.2857	tur_news_2014_00387144
9482	Bu nedenle Ömür Hanım’a çok teşekkür ederim.	Y	hanım	1694	    2,629	0.0065	826.625	tur_news_2018_00234911
9483	Ömür Hanım var Ankara’dan oraya sürekli gelen.	Y	hanım	1694	    2,629	0.0065	866	tur_news_2005_00750469
9484	Akşam eve gelince; “Hanım, para lazım oldu.	Y	hanım	1694	    2,629	0.0065	962.8571	tur_news_2018_00022596
9485	Her iki seçimde de Fatma Hanım milletvekili seçildi…	Y	hanım	1694	    2,629	0.0065	1253.125	tur_news_2018_00496068
9486	Avrupa’da ise çok önem verilen bir spor dalı.	Y	dalı	1695	    2,628	0.0065	333.8889	tur_news_2014_00119655
9487	Sorular, uzmanlık dalı ile ilgili çeşitli konularda da olabilir.	Y	dalı	1695	    2,628	0.0065	902.2222	tur_news_2005_00682217
9488	Dokuz Eylül Üniversitesi Hastanesi, Acil Tıp Anabilim Dalı Öğretim Üyesi Doç.	Y	dalı	1695	    2,628	0.0065	1036.8182	tur_news_2014_00385898
9489	Hacettepe Üniversitesi Tıp Fakültesi Halk Sağlığı Anabilim Dalı.	Y	dalı	1695	    2,628	0.0065	1178.625	tur_news_2005_00285493
9490	İç Hastalıkları Anabilim Dalı Başkanlığı’na Yrd.	Y	dalı	1695	    2,628	0.0065	1440.5714	tur_news_2014_00536762
9491	Okullarda da bu dil Ã¶ÄŸretilir ve kullanÄ±lÄ±r.	Y	kullanä	1695	    2,628	0.0065	954.5	tur_news_2014_00716737
9492	4. Daha bÃ¼yÃ¼k bir su bardaÄŸÄ± kullanÄ±n, her lokmadan sonra bir yudum su iÃ§in.	Y	kullanä	1695	    2,628	0.0065	1040.6	tur_news_2014_00025520
9493	Bu Ã¼rÃ¼nÃ¼mÃ¼z, tek kiÅŸiyle seri kullanÄ±m iÃ§in tasarlanmÄ±ÅŸtÄ±r.	Y	kullanä	1695	    2,628	0.0065	1084.6875	tur_news_2014_00222610
9494	Bu ekonomik bir Ã¼retimde tam bir gÃ¼venlik ve kullanÄ±m emniyeti demektir.	Y	kullanä	1695	    2,628	0.0065	1126.9231	tur_news_2014_00239263
9495	Ortak kullanÄ±mÄ± olan malzemeler: Birden fazla nihai Ã¼rÃ¼n bileÅŸiminde yer alan yarÄ± Ã¼rÃ¼n ve malzemeleri ifade eder.	Y	kullanä	1695	    2,628	0.0065	1132.2632	tur_news_2014_00740675
9496	Başka iş yok biz de, bunu yapıyoruz.	Y	yapıyoruz	1695	    2,628	0.0065	309.8571	tur_news_2014_00150088
9497	“Burada aslında çok basit bir şey yapıyoruz.	Y	yapıyoruz	1695	    2,628	0.0065	488	tur_news_2018_00254403
9498	Biz ne yapıyoruz ve ne yapmaya çalışıyoruz?	Y	yapıyoruz	1695	    2,628	0.0065	746.8333	tur_news_2005_00787357
9499	Buna rağmen çok önemli yatırımlar yaptık, yapıyoruz.	Y	yapıyoruz	1695	    2,628	0.0065	895.4286	tur_news_2018_00230595
9500	Yani günlük yumurta yerine saatlik yumurta üretimi yapıyoruz.	Y	yapıyoruz	1695	    2,628	0.0065	1263.8571	tur_news_2018_00947581
9501	Bölgenin en önemli sorunu merkezi olması nedeniyle trafik.	Y	bölgenin	1696	    2,624	0.0064	471.125	tur_news_2005_00080851
9502	Bu gün bölgenin en güçlü ülkesi Türkiye artık!	Y	bölgenin	1696	    2,624	0.0064	616.375	tur_news_2014_00243820
9503	Tabii, bir de, tüm bölgenin düzeni var.	Y	bölgenin	1696	    2,624	0.0064	684.2857	tur_news_2018_00855106
9504	Bölgenin kent ve ülke ekonomisi için katkısı büyük.	Y	bölgenin	1696	    2,624	0.0064	948.5	tur_news_2018_00179390
9505	Adı: Açılacak bölgenin adres bilgisi için gereklidir.	Y	bölgenin	1696	    2,624	0.0064	1427.7143	tur_news_2005_00506180
9506	Ama Amerika’da da her yerde de esnaf var.	Y	esnaf	1697	    2,622	0.0064	346.375	tur_news_2018_00033414
9507	Peki bu işleri yapan esnaf ne olacak.	Y	esnaf	1697	    2,622	0.0064	602.5714	tur_news_2014_00765843
9508	Ayrıca alışveriş merkezleri de esnaf için çok büyük bir problem.	Y	esnaf	1697	    2,622	0.0064	792	tur_news_2018_00088583
9509	İlk ders, öğretmen tarafından değil, esnaf bir veli tarafından gerçekleştirildi.	Y	esnaf	1697	    2,622	0.0064	925.8889	tur_news_2018_00527206
9510	Esnaf olmazsa bankalar da yok olur” ifadesini kullandı.	Y	esnaf	1697	    2,622	0.0064	1273.125	tur_news_2018_00403868
9511	Bunun için de bu alanda yapmalarï¿½ gerekli çok iï¿½ var.	Y	iï	1698	    2,619	0.0064	663.8	tur_news_2014_00277344
9512	Gruba ï¿½ye olmak iï¿½in herhangi bir ï¿½n ï¿½art yoktur.	Y	iï	1698	    2,619	0.0064	799.5455	tur_news_2014_00482929
9513	Onun iï¿½in onu da unutmayalï¿½m.	Y	iï	1698	    2,619	0.0064	902.8571	tur_news_2014_00733195
9514	Alanya da keyifli bir tatil yapmak iï¿½in.	Y	iï	1698	    2,619	0.0064	921.5	tur_news_2014_00057043
9515	Bir ï¿½ok websayfalarï¿½ iï¿½in tamamen yeterli.	Y	iï	1698	    2,619	0.0064	988.5	tur_news_2014_00190842
9516	Kadının hayatta sosyal ve ekonomik açıdan var olması için önemli bir adım	Y	kadının	1699	    2,614	0.0064	512.25	tur_news_2018_00565896
9517	Pakistan’da ne kadın olmak kolay, ne de bir kadının spor yapması.	Y	kadının	1699	    2,614	0.0064	628.1818	tur_news_2018_00746297
9518	Ekonomik Paket haberleri / Sayfa 1Halkın Partisi’nde kadının adı yok!	Y	kadının	1699	    2,614	0.0064	832.2	tur_news_2018_00379745
9519	Bence 10 hafta bir kadının karar verme süresi için yeterlidir.	Y	kadının	1699	    2,614	0.0064	953.2222	tur_news_2018_00126343
9520	Ancak ailenin temelinde, kadın ve kadının eğitimi bulunur.	Y	kadının	1699	    2,614	0.0064	1093	tur_news_2005_00629468
9521	Aksine Türkiye’de çok ciddi vergi sorunları var.	Y	aksine	1700	    2,613	0.0064	490.5	tur_news_2018_00023549
9522	Aksine daha da teşvik edilir hale geldi.	Y	aksine	1700	    2,613	0.0064	551.2857	tur_news_2014_00055282
9523	Tam aksine bunlar, onların düşmanı ve bugüne kadar o bölgede yaptıkları hiçbir şey de yok.	Y	aksine	1700	    2,613	0.0064	592.3333	tur_news_2018_00859859
9524	Ancak iki yıl önce alınan bu kararın aksine ülkede durum şu an tamamen değişmiş durumda.	Y	aksine	1700	    2,613	0.0064	709.2	tur_news_2018_00054581
9525	Ancak satış yapmak kimilerimiz için   o kadar da kolay değil, aksine bazen binlerce ton üretim ya da tasarım   yapmaktan çok daha zor.	Y	aksine	1700	    2,613	0.0064	747.0952	tur_news_2005_00635716
9526	Ama sinema sektöründe öyle bir şey yok.	Y	sektöründe	1701	    2,612	0.0064	521.5714	tur_news_2018_00043424
9527	Temizlik sektöründe artık sağlıklı, kolay ve etkili temizlik yapan ürünler tercih ediliyor.	Y	sektöründe	1701	    2,612	0.0064	784.3636	tur_news_2014_00883721
9528	Özellikle sektöründe lider bir şirket ise hisse performansı çok daha fazla olur.	Y	sektöründe	1701	    2,612	0.0064	830.8333	tur_news_2018_00743185
9529	Katma değeri yüksek ürün aynı zamanda turizm sektöründe de karşımıza çıkıyor.	Y	sektöründe	1701	    2,612	0.0064	983	tur_news_2018_00581515
9530	Bunlardan en önemlisi bankacılık sektöründe hızlı tepki alınması.	Y	sektöründe	1701	    2,612	0.0064	1239.375	tur_news_2005_00698149
9531	O da bizim için önemli bir futbolcu.'	Y	futbolcu	1702	    2,611	0.0064	271.5714	tur_news_2018_00691773
9532	Bu da futbolcu için iyi olmayan bir durum dur.	Y	futbolcu	1702	    2,611	0.0064	466.3333	tur_news_2014_00233667
9533	´Transfer olan futbolcu bir şeyler yapmak zorunda.	Y	futbolcu	1702	    2,611	0.0064	647.2857	tur_news_2014_00896468
9534	Burada da birçok minik futbolcu eğitim görüyor.	Y	futbolcu	1702	    2,611	0.0064	992.8571	tur_news_2018_00254949
9535	Teknik Direktör Erol Bulut hakkında da konuşan 27 yaşındaki futbolcu, Futbol sonuç oyunu.	Y	futbolcu	1702	    2,611	0.0064	1183.5833	tur_news_2018_00869633
9536	Ayrıca oyun başına ödeme de çok geçerli bir uygulama olarak görülmektedir.	Y	görülmektedir	1703	    2,609	0.0064	549.6364	tur_news_2005_00351536
9537	Oysa şiddet sadece güvenlik sorunu değildir, öyle olmadığı yaşanan her yeni olayda da bir kez daha görülmektedir.	Y	görülmektedir	1703	    2,609	0.0064	584.0588	tur_news_2014_00751142
9538	Bu konu önümüzdeki 10 yıl içerisinde popüler bir konu olmaya aday görülmektedir.	Y	görülmektedir	1703	    2,609	0.0064	696.8	tur_news_2018_00224347
9539	Ancak, bu kişiler Kamu Görevlisi olarak görülmektedir.	Y	görülmektedir	1703	    2,609	0.0064	760.7143	tur_news_2005_00281642
9540	İngiltere’de özel eğitime büyük önem verildiği görülmektedir.	Y	görülmektedir	1703	    2,609	0.0064	1023.375	tur_news_2005_00432326
9541	Amerika ve İsrail’in de burada ciddi etkileri var.	Y	etkileri	1704	    2,608	0.0064	380	tur_news_2018_00046980
9542	Etkileri tüm dünyada üstelik iki yüz yıldır devam ediyor.	Y	etkileri	1704	    2,608	0.0064	590.6667	tur_news_2005_00893241
9543	Bir tarafta dünyada bir küresel bir kriz var ve bunun etkileri devam ediyor.	Y	etkileri	1704	    2,608	0.0064	668.9091	tur_news_2018_00160157
9544	Sadece siyasi ve askeri sonuçlar değil, ekonomik sonuçlar açısından da alınacak kararın ülke ve özellikle Güneydoğuya doğrudan etkileri olacak.	Y	etkileri	1704	    2,608	0.0064	704.3889	tur_news_2014_00792762
9545	Kuşkusuz Güney Asya’da yaşanan krizin dünya ekonomisi üzerinde önemli olumsuz etkileri olmuştur.	Y	etkileri	1704	    2,608	0.0064	1025.3846	tur_news_2005_00365618
9546	Bu vergi neden beş yıl sonra alınacak?	Y	alınacak	1705	    2,603	0.0064	466.5714	tur_news_2014_00305953
9547	Bireysel olarak alınacak önlemler var elbette; ama kanser gibi önemli bir sağlık sorunu için devletin daha fazla tedbir alması gerekiyor.	Y	alınacak	1705	    2,603	0.0064	740.5	tur_news_2014_00189287
9548	Hastanede alınacak tek bir örnek yeterli olacaktır.	Y	alınacak	1705	    2,603	0.0064	837.2857	tur_news_2014_00503006
9549	Haziran ayında yapılacak sınav ile 2 bin hâkim ve savcı alınacak.	Y	alınacak	1705	    2,603	0.0064	994.3	tur_news_2018_00484686
9550	Bu tutar, her bir vergi dairesi itibarıyla dikkate alınacak.	Y	alınacak	1705	    2,603	0.0064	1121.2222	tur_news_2014_00304326
9551	O ana kadar ki Hakan, Galatasaray’ın en iyi oyuncusu..	Y	hakan	1706	    2,602	0.0064	525.3	tur_news_2014_00707641
9552	Önce Ahmet Hakan ne dedi ona bakalım.	Y	hakan	1706	    2,602	0.0064	688.8571	tur_news_2018_00706789
9553	Ahmet Hakan’ın samimi olduğunu da düşünüyorum.	Y	hakan	1706	    2,602	0.0064	796.8571	tur_news_2014_00047216
9554	Ancak gerçek ismini Yaşar Hakan Yıldırım olarak biliyorum.	Y	hakan	1706	    2,602	0.0064	1118.625	tur_news_2014_00087713
9555	G.Saray’dan Hakan’a müthiş teklif!	Y	hakan	1706	    2,602	0.0064	1152.1429	tur_news_2018_00455809
9556	Şu an için İzmir’de su sıkıntı yok.	Y	sıkıntı	1706	    2,602	0.0064	323	tur_news_2014_00857181
9557	O yüzden sıkıntı yaratan bir durum yok diye konuştu.	Y	sıkıntı	1706	    2,602	0.0064	624.8889	tur_news_2014_00753003
9558	Bu sıkıntı para veya yolla ilgili olabilir.	Y	sıkıntı	1706	    2,602	0.0064	705.2857	tur_news_2018_00264979
