ORDER	SENTENCE	STATUS	WORD	RANK	COUNT	COUNT_REL	INDEX	ID
13001	Biz de Türkiye’yi görünce, bir daha geri dönemedik.	Y	görünce	2136	    1,932	0.0047	738.4444	tur_news_2005_00753035
13002	O yüzden teşkilat ile ilgili bir olumsuz yargı var ama bunları görünce 'bir dakika' diyorlar.	Y	görünce	2136	    1,932	0.0047	851.1429	tur_news_2018_00738065
13003	Ben de bunun dil ile ilgisi olduğunu görünce Atatürk’e götürdüm.	Y	görünce	2136	    1,932	0.0047	870.5455	tur_news_2005_00443213
13004	O yüzden bu eğitim programını görünce çok mutlu olduk.	Y	görünce	2136	    1,932	0.0047	897.4444	tur_news_2018_00737519
13005	Eğer sistem takımı olmak bu ise, Dünya’da sistem takımı olmak FIFA tarafından yasaklanmalı; Zira, hiç bir takım sistem takımı olmak istemez, bu futbolu görünce!	Y	görünce	2136	    1,932	0.0047	1040.1667	tur_news_2018_00375529
13006	Görüşmeler sırasında Halil Bey’e bir iki kişi daha katıldı.	Y	halil	2136	    1,932	0.0047	656.1	tur_news_2005_00950317
13007	 Eroğlu’nun basın toplantısında AK Parti Milletvekili Halil Ürün, AK Parti İl Başkanı Mehmet Zeybek, İl Gençlik Kolları Başkanı ve Kadın Kolları Başkanı da yer aldı.	Y	halil	2136	    1,932	0.0047	824.45	tur_news_2014_00424268
13008	Halil’in bundan sonra Milli Takım’da en azından artık onbirde başlaması çok zor.	Y	halil	2136	    1,932	0.0047	854.6429	tur_news_2014_00496995
13009	Ardından açılan oyun da Halil ile ikinci golü getirdi.	Y	halil	2136	    1,932	0.0047	871	tur_news_2018_00068187
13010	Bu anlamda her zaman amatör sporcuların yanında yer alan, destek veren Belediye Başkanımız Halil İbrahim Şenol’a çok teşekkür ediyorum.	Y	halil	2136	    1,932	0.0047	880.05	tur_news_2018_00191161
13011	Ardından Eskişehir Anadolu Üniversitesi’nde Lisans tamamladı.	Y	tamamladı	2136	    1,932	0.0047	779.2857	tur_news_2005_00799964
13012	Gazi Eğitim Fakültesi Kimya Eğitimi Bölümünde başladı ve 1990 yılında tamamladı.	Y	tamamladı	2136	    1,932	0.0047	902.4	tur_news_2005_00646708
13013	Çünkü Ligi Galatasaray, play-off’u ise o sezon Fenerbahçe lider tamamladı.	Y	tamamladı	2136	    1,932	0.0047	1070.4167	tur_news_2018_00320738
13014	İzmir’de CHP ve cumhurbaşkanı adayı Muharrem İnce seçimi önde tamamladı.	Y	tamamladı	2136	    1,932	0.0047	1149.7273	tur_news_2018_00560423
13015	Altın fiyatları, Çeyrek altın ve gram altın kaç TL’den günü tamamladı?	Y	tamamladı	2136	    1,932	0.0047	1220	tur_news_2018_00032040
13016	Türkiye, kişi başına yıllık 16 dolar ile bilgi teknolojisi harcamasında Avrupa ülkeleri arasında en son sırada bulunuyor.	Y	teknolojisi	2136	    1,932	0.0047	709.75	tur_news_2014_00909148
13017	Onlar artık elektronik, iletişim teknolojisi, diyagnostik konularında da en az otomotiv konusunda olduğu kadar bilgi sahibi olmak zorunda.	Y	teknolojisi	2136	    1,932	0.0047	833.5556	tur_news_2005_00166831
13018	Çünkü teknoloji ve özellikle iletişim teknolojisi çok hızlı değişiyor.	Y	teknolojisi	2136	    1,932	0.0047	847.4444	tur_news_2018_00322681
13019	Türkiye’de kısa sürede büyük gelişme Dünyada Internet ve Internet teknolojisi hızla gelişirken, Türkiye’de insanların çok az bir kısmı Internet’le tanışmıştı.	Y	teknolojisi	2136	    1,932	0.0047	890.5789	tur_news_2005_00343471
13020	Ancak, İran’ın bu konuda denetlenmiş ve uluslararası kurallara uygun teknolojisi yok.	Y	teknolojisi	2136	    1,932	0.0047	897.0833	tur_news_2014_00088822
13021	Fakat aynı zamanda bu gerçek, çok büyük bir fırsatı da beraberinde getiriyor.”	Y	fırsatı	2137	    1,931	0.0047	599.3333	tur_news_2018_00411915
13022	Çünkü Allah kendisine bu fırsatı verdi, başarılı olmadı.	Y	fırsatı	2137	    1,931	0.0047	628.625	tur_news_2005_00465368
13023	Bu da bize daha çok tanıtım yapma fırsatı verdi.	Y	fırsatı	2137	    1,931	0.0047	657.2222	tur_news_2014_00233356
13024	Bence Avrupa’nın öne geçmek için yeni bir şansı, yeni bir fırsatı var artık.	Y	fırsatı	2137	    1,931	0.0047	768.0833	tur_news_2018_00126391
13025	Deniz Baykal’ın elinde de bir Özal olma fırsatı vardı.	Y	fırsatı	2137	    1,931	0.0047	950.1	tur_news_2014_00364969
13026	CHP Kocaeli teşkilatı için “tarihi” bir gün.	Y	teşkilatı	2137	    1,931	0.0047	482.2857	tur_news_2014_00327860
13027	Elazığ İl Emniyet Müdürlüğü tarafından Türk Polis Teşkilatı’nın 171. Yılı nedeniyle çeşitli etkinlikler düzenlendi.	Y	teşkilatı	2137	    1,931	0.0047	791.1429	tur_news_2018_00381188
13028	Projenin Devlet Planlama Teşkilatı tarafından 2011 Yılı Yatırım Programına alınması ile ilgili çalışmalar sürüyor.	Y	teşkilatı	2137	    1,931	0.0047	988	tur_news_2018_00763027
13029	İlçe teşkilatı olarak genel seçim çalışmalarına başladık.	Y	teşkilatı	2137	    1,931	0.0047	1051	tur_news_2014_00547260
13030	HAS Parti İl Teşkilatı`nın haftalık olağan yönetim kurulu toplantısı önceki akşam parti binasında yapıldı.	Y	teşkilatı	2137	    1,931	0.0047	1177.6429	tur_news_2014_00502248
13031	Geriye kalan maddeler ise oy birliği ile kabul edildi.	Y	maddeler	2138	    1,930	0.0047	590	tur_news_2005_00071171
13032	İşte bu, onların ne kadar önemli ve sürekli tedarik edilmesi gereken maddeler olduğunu gösterir.	Y	maddeler	2138	    1,930	0.0047	674.5714	tur_news_2005_00889007
13033	Bakanlar Kurulu kararı dışında gelen maddeler arasında İzmir’de yapılacak yatırım ve çalışmaları zorlaştıracak maddeler var.	Y	maddeler	2138	    1,930	0.0047	688.5333	tur_news_2014_00139129
13034	Fakat içinde başka ne tür maddeler var, bilinmemektedir.	Y	maddeler	2138	    1,930	0.0047	823.625	tur_news_2018_00413491
13035	AKP tarafından hazırlanmış olan Anayasa değişiklik teklifinde çok az olumlu maddeler arasında yer alan 2. Madde değişikliği “Özel yaşam” alanı ile ilgilidir.	Y	maddeler	2138	    1,930	0.0047	880	tur_news_2014_00054190
13036	Bugün için Türkiye’ye yönelik en önemli tehdit merkezi Kuzey Irak’tir.	Y	tir	2139	    1,929	0.0047	443.8333	tur_news_2005_00351149
13037	Bu da Kocaeli tarihinde bir “ilk”tir.	Y	tir	2139	    1,929	0.0047	461.1429	tur_news_2014_00234039
13038	Çalışma ve yayın sistemi de daha modern hale getirilmiş-tir.	Y	tir	2139	    1,929	0.0047	813.9	tur_news_2018_00286965
13039	tir, ancak yine de pazar ekonomisinin i?	Y	tir	2139	    1,929	0.0047	859	tur_news_2005_00934718
13040	TIR önce Marmara-Ege ve Akdeniz’i,daha sonra diğer bölgelerimizi ziyaret edecek.	Y	tir	2139	    1,929	0.0047	861	tur_news_2014_00889482
13041	Kişinin başından geçen ya da sadece yarattığı bir şey olabilir ama tamamen ona ait oluyor.	Y	başından	2140	    1,928	0.0047	476.0667	tur_news_2014_00621060
13042	İşte insan, en başından en güçlü olmaya teşvik edilir.	Y	başından	2140	    1,928	0.0047	721.875	tur_news_2018_00553380
13043	Ortadoğu, özellikle 20. yüzyılın başından beri dünyanın en önemli stratejik bölgesi olarak kabul edilmiştir.	Y	başından	2140	    1,928	0.0047	888.1538	tur_news_2014_00740414
13044	Ama Aziz Yıldırım yönetiminde değil, Fenerbahçe başından beri böyle.	Y	başından	2140	    1,928	0.0047	945.5556	tur_news_2014_00066912
13045	Yoksa Hikmet Sami Türk başından beri böyle biri miydi?	Y	başından	2140	    1,928	0.0047	1307.4444	tur_news_2005_00576437
13046	Sonuç: bir dünya asker öldü ya da yaralandı…	Y	öldü	2140	    1,928	0.0047	793	tur_news_2018_00833712
13047	İstanbul haberleri / Sayfa 370 yıllık çift aynı gün öldü.	Y	öldü	2140	    1,928	0.0047	794.375	tur_news_2018_00549496
13048	Yunanistan öldü, ancak kendisinin bile haberi yok.	Y	öldü	2140	    1,928	0.0047	922.5714	tur_news_2018_00986531
13049	Bir emekli öğretmen kalp krizi sonucu öldü.	Y	öldü	2140	    1,928	0.0047	1050.8571	tur_news_2014_00188962
13050	Hapis Cezası haberleri / Sayfa 170 yıllık çift aynı gün öldü.	Y	öldü	2140	    1,928	0.0047	1075.6667	tur_news_2018_00474692
13051	Hem evin erkeği için hem de diğer eş için zor bir durum” diye konuştu.	Y	evin	2141	    1,926	0.0047	734.1667	tur_news_2014_00513987
13052	Her evin aynı zamanda bir okul misyonu vardır ve eğitim evde başlar.	Y	evin	2141	    1,926	0.0047	762.75	tur_news_2018_00494254
13053	Kiralayacağı evin parti genel merkezi ya da TBMM’ye yakın bir bölgede olmasını isteyen Güven, şöyle konuştu: İzmir’i boş bırakmamız mümkün değil.	Y	evin	2141	    1,926	0.0047	773	tur_news_2014_00618628
13054	Fakat bu evin ilginç bir özelliği bulunuyor.	Y	evin	2141	    1,926	0.0047	819	tur_news_2018_00412398
13055	O da Bizim evin üzerinde boş bir dairemiz var.	Y	evin	2141	    1,926	0.0047	826.7778	tur_news_2018_00691768
13056	Zaten daha sonra da çok üst düzeyde bir göreve tayin ediliyor.	Y	tayin	2141	    1,926	0.0047	616.4545	tur_news_2014_00994672
13057	Partinin genel başkanı olursa cumhurbaşkanı hakim de tayin edecek.	Y	tayin	2141	    1,926	0.0047	771.5556	tur_news_2018_00748987
13058	Bunu da ilim tayin ve tespit eder.	Y	tayin	2141	    1,926	0.0047	838	tur_news_2005_00780694
13059	Bir süre sonra, babası yakın bir köye tayin olmuş.	Y	tayin	2141	    1,926	0.0047	940.625	tur_news_2005_00823550
13060	Genel Müdür en az dört yıllık tahsil görmüş olanlar arasından tayin olunur.	Y	tayin	2141	    1,926	0.0047	1236.4167	tur_news_2005_00069140
13061	Bir de şu anda ne İYİ Parti’ye ne de CHP’ye zarar vermek adına bu konuda çok açıklamada bulunmak da istemiyorum.	Y	bulunmak	2142	    1,924	0.0047	611.4737	tur_news_2018_00148468
13062	Batı Avrupa ülkelerine, özellikle de İngiltere’ye vize almak ve bu ülkede bulunmak Türk vatandaşları için büyük sorun.	Y	bulunmak	2142	    1,924	0.0047	795.6111	tur_news_2014_00154057
13063	İş ve siyaset hayatımda hiç bir zaman bir işi yapmış olmak için ya da orada bulunmak için olmadım.	Y	bulunmak	2142	    1,924	0.0047	848.8125	tur_news_2018_00556499
13064	Öyle bir kalabalık oluştu ki ‘Biz de bulunmak istiyoruz’ diye.	Y	bulunmak	2142	    1,924	0.0047	860.8	tur_news_2018_00732819
13065	Bu konuda genel bir yargıda bulunmak için erken.	Y	bulunmak	2142	    1,924	0.0047	866.375	tur_news_2005_00611364
13066	Her geçen yılın ardından, “ne çabuk geçti” diye hayıflanırız ya; bu yıl öyle olmadı…	Y	çabuk	2142	    1,924	0.0047	706.8571	tur_news_2018_00494504
13067	Bu yüzden Türkiye AB’ye ne kadar çabuk girerse o kadar iyi olacağını düşünüyorum.	Y	çabuk	2142	    1,924	0.0047	709.6923	tur_news_2014_00314658
13068	Ancak dediğim gibi biz her şeyi çok çabuk kabul ediyoruz.	Y	çabuk	2142	    1,924	0.0047	736.2	tur_news_2018_00052883
13069	İnanıyorum ki o zaman çözüm yolu daha çabuk bulunur” diye konuştu.	Y	çabuk	2142	    1,924	0.0047	759.5455	tur_news_2018_00532220
13070	Çabuk hasta olan bir bünyesi de yok diye konuştu.	Y	çabuk	2142	    1,924	0.0047	795.4444	tur_news_2018_00284849
13071	Hastalık ilk olarak 1981 yılında New York ve California’da tespit edildi.	Y	york	2142	    1,924	0.0047	912.1818	tur_news_2018_00476657
13072	New York’un yakın tarihinde ilk kez bir gün boyunca şiddet içeren suç işlenmedi.	Y	york	2142	    1,924	0.0047	925.6429	tur_news_2014_00700561
13073	Bu sene içinde York’ta, gelecek sene Londra ve Berlin’de düşünüyoruz.	Y	york	2142	    1,924	0.0047	938.0909	tur_news_2018_00264190
13074	EVET biliyorum, New York’u ziyaret etmek için hiç de tercih edilecek bir zaman dilimi değil yaz ayları.	Y	york	2142	    1,924	0.0047	949.2222	tur_news_2014_00432905
13075	Kısa süre önce bulunduğu New York’ta Princeton Üniversitesi’nde yaptığı bir konuşmada Kürt açılımıyla ilgili olarak ne diyordu Sayın Başbakan?	Y	york	2142	    1,924	0.0047	972.2381	tur_news_2014_00620520
13076	G.O.R.A.’da Cem Yılmaz yaptı işte..	Y	cem	2143	    1,923	0.0047	577.3333	tur_news_2014_00479191
13077	Cem Yılmaz’ın oğlu Kemal’in renkli bir tarzı var.	Y	cem	2143	    1,923	0.0047	890.9	tur_news_2014_00322586
13078	Cem Yılmaz neden bu kadar çabuk geri döndü?	Y	cem	2143	    1,923	0.0047	912.25	tur_news_2018_00292268
13079	Kullanıcı adı veya şifremi unuttum Cem Yılmaz’ın yeni projesi ne?	Y	cem	2143	    1,923	0.0047	996.0909	tur_news_2014_00639951
13080	Küçük oğlu Kadir, Cem Sultan’ın arkadaşı.	Y	cem	2143	    1,923	0.0047	1373.5714	tur_news_2014_00638704
13081	En fazla ihraç Ankara Üniversite’den geldi.	Y	ihraç	2143	    1,923	0.0047	471.1429	tur_news_2018_00389962
13082	AK Parti’den ihraç edildiğini hatırlatan Geçen, şöyle devam etti: “Bunun en güzel örneği benim.	Y	ihraç	2143	    1,923	0.0047	742.8667	tur_news_2014_00051819
13083	Türkiye’de falan kişi mısır ithal etmiş, falan ihraç etmiş, bunlar önemli değil.	Y	ihraç	2143	    1,923	0.0047	841.2727	tur_news_2014_00905548
13084	Türkiye de petrol ihraç ettiğimiz ülkeler arasında.	Y	ihraç	2143	    1,923	0.0047	967	tur_news_2014_00907008
13085	Üretilen ürünün yaklaşık l/3’ü ihraç edilmektedir.	Y	ihraç	2143	    1,923	0.0047	1324.4286	tur_news_2005_00357059
13086	Allah’ın izni ile başarılı olmaya devam edeceğiz dedi.	Y	izni	2144	    1,922	0.0047	599.7778	tur_news_2018_00028913
13087	Verilen tesis izni üç yıl için geçerlidir.	Y	izni	2144	    1,922	0.0047	977.7143	tur_news_2005_00411987
13088	Gece çalışma izni verilmesi bizi mağdur ediyor.	Y	izni	2144	    1,922	0.0047	1029.4286	tur_news_2014_00459781
13089	Çalışma izni verilen hayvan pazarı için gerçek ve tüzel kişiler ile kamu kuruluşları adına ruhsat düzenlenir.	Y	izni	2144	    1,922	0.0047	1178.75	tur_news_2005_00110487
13090	Taşıma izni adı geçen Yönetmelik hükümlerine göre verilir.	Y	izni	2144	    1,922	0.0047	1297.75	tur_news_2005_00825617
13091	Buna göre önümüzdeki dönemde Avrupa Birliği’ne sekiz ülke daha katılacak.	Y	sekiz	2144	    1,922	0.0047	628.1818	tur_news_2014_00262630
13092	Onun dışında çok keyifli bir sekiz yıl geçti.	Y	sekiz	2144	    1,922	0.0047	768.625	tur_news_2014_00732150
13093	Bolu’da sekiz mahalle vardı, D-100 Karayolu’nun üzerinde hiç mahalle yoktu.	Y	sekiz	2144	    1,922	0.0047	883.4545	tur_news_2018_00180464
13094	Sanırım ki, en az sekiz maç alır.	Y	sekiz	2144	    1,922	0.0047	928.5714	tur_news_2018_00788011
13095	Sekiz arkadaş oy birliği ile kabul dedik.	Y	sekiz	2144	    1,922	0.0047	1133.8571	tur_news_2005_00342466
13096	Ama bu takdir edilecek bir şey değil.	Y	takdir	2144	    1,922	0.0047	505.8571	tur_news_2014_00069651
13097	Bunu Antalya, Alanya halkı en iyi şekilde takdir eder.	Y	takdir	2144	    1,922	0.0047	629.7778	tur_news_2018_00241440
13098	Bu konuda Kayseri’yi takdir etmek lazım.	Y	takdir	2144	    1,922	0.0047	732.2857	tur_news_2014_00256971
13099	Tabii ki UEFA’dan büyük takdir gördük.”	Y	takdir	2144	    1,922	0.0047	1029.2857	tur_news_2018_00856262
13100	Takdir haklarını hep Altay’dan yana kullandı.	Y	takdir	2144	    1,922	0.0047	1298.1429	tur_news_2014_00868182
13101	Kocaeli, kişi başına düşen yıllık milli gelir açısından son 10 yıldır ülke genelinde birinci sırada yer almaktadır.	Y	almaktadır	2145	    1,921	0.0047	586.75	tur_news_2018_00606455
13102	Bu alanda Türkiye, dünyanın gelişmiş ülkeleri arasında yer almaktadır.	Y	almaktadır	2145	    1,921	0.0047	706.5556	tur_news_2018_00190275
13103	3. Bu ülkede kamu sektöründe çalışan insanların çok büyük çoğunluğu, bir üretim karşılığı maaş almaktadır.	Y	almaktadır	2145	    1,921	0.0047	940.7143	tur_news_2014_00023541
13104	Burada sadece Ticari Entegre’ye özel açıklamalar yer almaktadır.	Y	almaktadır	2145	    1,921	0.0047	957.5556	tur_news_2014_00288411
13105	Coğrafya Bölge ülkenin orta bölümünde yer almaktadır.	Y	almaktadır	2145	    1,921	0.0047	1094.2857	tur_news_2014_00335065
13106	Onun dï¿½ï¿½ï¿½nda da bir mevkute yok.	Y	dï	2145	    1,921	0.0047	827.125	tur_news_2014_00732109
13107	Bu ï¿½ok ciddi bir baï¿½arï¿½dï¿½r.	Y	dï	2145	    1,921	0.0047	1126	tur_news_2014_00250123
13108	Bunlar, bu ülke için tehlike çanlarï¿½dï¿½r.	Y	dï	2145	    1,921	0.0047	1126.75	tur_news_2014_00269328
13109	Biz de dedik ki size dï¿½nyadaki ï¿½ok..	Y	dï	2145	    1,921	0.0047	1137.7778	tur_news_2014_00203726
13110	En yakï¿½n zamanda ziyaret etmeyi dï¿½ï¿½ï¿½nï¿½yorum.	Y	dï	2145	    1,921	0.0047	1214.8	tur_news_2014_00419869
13111	Sadece siyasi partiler değil tabii ki, halk içinde bu seçim son de.	Y	partiler	2145	    1,921	0.0047	312.5	tur_news_2018_00778558
13112	İlk bir yıl içinde demokratik bir siyasi partiler kanunu yapmak.	Y	partiler	2145	    1,921	0.0047	577.6667	tur_news_2018_00526921
13113	Malatya’da da kaybeden bazı partiler oldu ama kazanan Malatya oldu.	Y	partiler	2145	    1,921	0.0047	850	tur_news_2018_00639635
13114	Siyasi partiler için seçim barajı yüzde 5 olarak belirlendi.	Y	partiler	2145	    1,921	0.0047	984.375	tur_news_2018_00821534
13115	CHP’si, MHP’si, o minik sol partiler falan.	Y	partiler	2145	    1,921	0.0047	1294.75	tur_news_2018_00297968
13116	Ama bu da ne işe yarar ki?	Y	yarar	2145	    1,921	0.0047	453.5714	tur_news_2005_00144166
13117	Internet nasıl bir şey ki, ne işe yarar ki?	Y	yarar	2145	    1,921	0.0047	467.375	tur_news_2005_00145749
13118	Ancak dünyanın içinde bulunduğu mali ve ekonomik kriz döneminde bundan Türkiye de büyük yarar sağladı.	Y	yarar	2145	    1,921	0.0047	600.1333	tur_news_2014_00086995
13119	Kesin bende de işe yarar diye düşünüyorum.	Y	yarar	2145	    1,921	0.0047	1096	tur_news_2018_00591489
13120	Burada bir konuya daha temas etmekte yarar vardır.	Y	yarar	2145	    1,921	0.0047	1129.625	tur_news_2014_00286232
13121	O nedenle burası bizim için özel bir yer.	Y	burası	2146	    1,920	0.0047	344.25	tur_news_2014_00726464
13122	Burası bir Film Evi olarak devam eder.	Y	burası	2146	    1,920	0.0047	673.5714	tur_news_2018_00258669
13123	Sert, Burası Türkiye Cumhuriyeti, özgür bir ülke.	Y	burası	2146	    1,920	0.0047	833.7143	tur_news_2018_00805464
13124	Burası Kıbrıslı Rum ve Türklerin birlikte yaşadığı bir bölgede.	Y	burası	2146	    1,920	0.0047	1005.2222	tur_news_2018_00258837
13125	Mali Kural’ın en zayıf tarafı da burası.	Y	burası	2146	    1,920	0.0047	1208.5	tur_news_2014_00661226
13126	Fetö ile en fazla ABD’deki Türkler mücadele ediyor.	Y	fetö	2147	    1,919	0.0047	531.4444	tur_news_2018_00419643
13127	FETÖ ve PKK’ya yönelik mücadele belki önümüzdeki yıllarda da sürecek.	Y	fetö	2147	    1,919	0.0047	707.2727	tur_news_2018_00419904
13128	FETÖ’ye dünyayı dar ediyoruz karşı cevap CHP’den geliyor	Y	fetö	2147	    1,919	0.0047	837.4	tur_news_2018_00419912
13129	FETÖ insanlara ve devlete çok zarar verdi.	Y	fetö	2147	    1,919	0.0047	969.8571	tur_news_2018_00419674
13130	Tıpkı FETÖ ve FETÖ’nün yan kolları gibi.	Y	fetö	2147	    1,919	0.0047	1226.2857	tur_news_2018_00877102
13131	Bu noktada birinci ya da dördüncü olmak çok fazla önemli değil.	Y	dördüncü	2148	    1,918	0.0047	368.0909	tur_news_2005_00057149
13132	ALANYA’NIN tek kitap fuarı olan “Hüseyin Baba” bu yıl dördüncü kez düzenlendi.	Y	dördüncü	2148	    1,918	0.0047	809.3846	tur_news_2014_00057320
13133	Bakın bunu nasıl dile getiriyor, “Bursa Türkiye’nin dördüncü büyük kenti.	Y	dördüncü	2148	    1,918	0.0047	870.7273	tur_news_2005_00104744
13134	Bu süre dördüncü bölüm hükümleri için geçerli değildir.	Y	dördüncü	2148	    1,918	0.0047	905.75	tur_news_2005_00928804
13135	Mustafa Akıncı, artık resmen KKTC’nin dördüncü Cumhurbaşkanı.	Y	dördüncü	2148	    1,918	0.0047	1199.75	tur_news_2018_00671021
13136	Bu kadar basit ve Ergenekon’a karşı mücadele de bu kadar önemli.	Y	ergenekon	2148	    1,918	0.0047	379.1	tur_news_2014_00252991
13137	Bir Kürt Ergenekon’u var mı ben emin değilim.	Y	ergenekon	2148	    1,918	0.0047	774.5556	tur_news_2014_00195021
13138	İşte O polis şimdi Ergenekon’da tanık!	Y	ergenekon	2148	    1,918	0.0047	821.8571	tur_news_2014_00576619
13139	Kılıçdaroğlu Ergenekon’un kaç numaralı üyesi olacak?	Y	ergenekon	2148	    1,918	0.0047	1056.1429	tur_news_2014_00615263
13140	Ergenekon sürecinin tüm hızı ile devam etmesini istiyor.	Y	ergenekon	2148	    1,918	0.0047	1387.375	tur_news_2014_00422397
13141	Devlet, herkesi eşit şekilde temsil ve ifade eder.	Y	herkesi	2149	    1,917	0.0047	642	tur_news_2005_00944562
13142	Herkesi. konu ile ilgili olarak,  tutum almaya davet ediyoruz.	Y	herkesi	2149	    1,917	0.0047	908.8889	tur_news_2005_00603135
13143	Osmanlı Devleti, Müslüman olan herkesi vatandaşı olarak kabul etmiştir.	Y	herkesi	2149	    1,917	0.0047	946.5556	tur_news_2005_00903186
13144	Başta Öztürk bey olmak üzere herkesi tebrik ediyorum.	Y	herkesi	2149	    1,917	0.0047	1024.5	tur_news_2018_00112491
13145	Çözüm isteyen, demokrasi isteyen herkesi düşman ilan ediyor.	Y	herkesi	2149	    1,917	0.0047	1046.7143	tur_news_2014_00339746
13146	Peki Obama neden bu kadar zor durumda?	Y	obama	2150	    1,915	0.0047	520.7143	tur_news_2014_00766794
13147	“Başkan Obama’nın en önemli özelliği nedir?	Y	obama	2150	    1,915	0.0047	645.8571	tur_news_2014_00151262
13148	Aslında bu yazı Obama yazısı da değil.	Y	obama	2150	    1,915	0.0047	851.1429	tur_news_2014_00114043
13149	Galiba Başkan Obama’nın ilk sınavı Türkiye olacak..	Y	obama	2150	    1,915	0.0047	938.25	tur_news_2014_00456218
13150	Yani Obama veya Trump, hiç fark etmiyor.	Y	obama	2150	    1,915	0.0047	1182.1429	tur_news_2018_00949028
13151	Bir de herkes mutlu olsun isterim ama öyle bir şey mümkün değil olmaz.	Y	isterim	2151	    1,914	0.0047	391.4167	tur_news_2014_00187587
13152	Belki öncelikle küçük de bir katkı yapmak isterim.	Y	isterim	2151	    1,914	0.0047	597.375	tur_news_2005_00852920
13153	Sektör adına çok önemli bir yatırım olduğunu belirtmek isterim.	Y	isterim	2151	    1,914	0.0047	854.7778	tur_news_2018_00800156
13154	Beni destekleyen herkese teşekkür etmek isterim yalnızca.	Y	isterim	2151	    1,914	0.0047	1219	tur_news_2018_00129480
13155	Trabzonspor şampiyon olsun TRABZONSPOR’un şampiyon olmasını isterim.	Y	isterim	2151	    1,914	0.0047	1276.3333	tur_news_2014_00895620
13156	Tabii bu böylece bin yıllarca devam etmiş.	Y	yıllarca	2151	    1,914	0.0047	606.4286	tur_news_2018_00855197
13157	Böylece iki alan sağlıklı bir şekilde yıllarca devam etsin diye konuştu.	Y	yıllarca	2151	    1,914	0.0047	614.8182	tur_news_2018_00185261
13158	Doğan Bey bu böbrek hastalığı ile yıllarca mücadele etti.	Y	yıllarca	2151	    1,914	0.0047	943.5556	tur_news_2018_00352694
13159	Yıllarca ihmal ettiğimiz bu alanda herkesin bir şeyler yapması gerekmektedir.	Y	yıllarca	2151	    1,914	0.0047	1118.1	tur_news_2018_00973188
13160	Biri mimar diğer işletme eğitimi almış yıllarca.	Y	yıllarca	2151	    1,914	0.0047	1225.7143	tur_news_2018_00152292
13161	Gerçek şu ki Kaynak Yayınları’nın çalışmaları gerçekten çok önemli.	Y	yayınları	2152	    1,912	0.0047	476.4	tur_news_2018_00444327
13162	Osmanlı Tarihi Araştırma ve Uygulama Merkezi Yayınları.	Y	yayınları	2152	    1,912	0.0047	571.8571	tur_news_2005_00099697
13163	Milli Mücadelede Yeşil Ordu; Kültür ve Turizm Bakanlığı Yayınları; Ankara 1987.	Y	yayınları	2152	    1,912	0.0047	897.1	tur_news_2014_00679777
13164	Marmara Üniversitesi Teknik Eğitim Fakültesi Yayınları, Göztepe, İstanbul.	Y	yayınları	2152	    1,912	0.0047	969.5	tur_news_2005_00252246
13165	Fen Bilimleri Enstitüsü Yayınları, Yayın No:6, İstanbul.	Y	yayınları	2152	    1,912	0.0047	1230.7143	tur_news_2005_00710305
13166	Şu anda Avrupa’daki döner Türkiye’nin de önünde.	Y	döner	2153	    1,910	0.0047	386.5556	tur_news_2018_00845551
13167	Üniversitesi’nde Uluslararası Ekonomi eğitimi görür. 1957 yılında Türkiye’ye döner.	Y	döner	2153	    1,910	0.0047	709.3	tur_news_2005_00286737
13168	Bu görev de onu tatmin etmez ve tekrar Istanbul´a döner.	Y	döner	2153	    1,910	0.0047	913.6364	tur_news_2005_00504949
13169	Neyse inşallah Ağustos’a doğru herkes geri döner.	Y	döner	2153	    1,910	0.0047	1090.125	tur_news_2014_00701461
13170	Yoksa herkese baş ağrısı olarak geri döner.	Y	döner	2153	    1,910	0.0047	1125.8571	tur_news_2018_00980043
13171	Çöp ve atık yönetimi aslında çok önemli.	Y	atık	2154	    1,908	0.0047	829.1429	tur_news_2018_00310123
13172	Bolu da günlük 180 ton atık elde ediliyor.	Y	atık	2154	    1,908	0.0047	850	tur_news_2018_00180371
13173	Ancak akan suyun farklı bir atık su sistemine alınması gerekir.	Y	atık	2154	    1,908	0.0047	1083.7	tur_news_2005_00428627
13174	Emniyet ve Atık Yönetimi Komisyonu Yrd.Doç.	Y	atık	2154	    1,908	0.0047	1120.1429	tur_news_2005_00684037
13175	Son olarak da Atık Toplama Merkezleri kurulacak.	Y	atık	2154	    1,908	0.0047	1414.4286	tur_news_2014_00841540
13176	Sadece daha iyi oynayan bir takım görmek istiyoruz.	Y	oynayan	2154	    1,908	0.0047	534.375	tur_news_2014_00791822
13177	Tüm ilk yarı boyunca kötü oynayan yoktu.	Y	oynayan	2154	    1,908	0.0047	782	tur_news_2018_00887983
13178	Bir sene önce final oynayan bir takım.	Y	oynayan	2154	    1,908	0.0047	855.6667	tur_news_2018_00158664
13179	Oynayan arkadaşlar güzel mücadele etti, güzel şeyler yaptı.	Y	oynayan	2154	    1,908	0.0047	904.1429	tur_news_2018_00734341
13180	Kolay değil, geçtiğimiz yıl başa oynayan kadro tamamen değişti.	Y	oynayan	2154	    1,908	0.0047	1206.5556	tur_news_2018_00607969
13181	Ve bunun yok edilmesi gerektiğini kendine ikna etti.	Y	ikna	2155	    1,907	0.0047	548.75	tur_news_2014_00939493
13182	Onları buna ikna etmek zaman alacak bir olay.	Y	ikna	2155	    1,907	0.0047	625.875	tur_news_2014_00728865
