ORDER	SENTENCE	STATUS	WORD	RANK	COUNT	COUNT_REL	INDEX	ID
9185	1990’lı yıllar dünyanın yeni bir şekil almaya başladığı yıllar oldu.	Y	şekil	1653	    2,704	0.0066	881.8889	tur_news_2014_00009225
9186	Yani ekonomik olarak da buradaki Türkiye’nin yarısı kadar Avrupa’da bir Türkiye var.	Y	buradaki	1654	    2,703	0.0066	375.5833	tur_news_2014_00955707
9187	Buradaki futbol anlayışı bize göre biraz daha farklı´´ diye konuştu.	Y	buradaki	1654	    2,703	0.0066	524.7	tur_news_2014_00287362
9188	Buradaki son Dünya’nın sonu anlamında değildir.	Y	buradaki	1654	    2,703	0.0066	754.8571	tur_news_2014_00287529
9189	“Dolayısıyla buradaki uzmanlık orada yapılacak işler için çok büyük önem taşıyor.	Y	buradaki	1654	    2,703	0.0066	872.4545	tur_news_2005_00561206
9190	Evet doğru ama buradaki kritik kelime “zamanında”.	Y	buradaki	1654	    2,703	0.0066	1114.5714	tur_news_2018_00407031
9191	“Karşı Mahalle” diye bir yer yok aslında.	Y	mahalle	1655	    2,702	0.0066	321	tur_news_2018_00578919
9192	Merkeze daha uzak ya da daha yakın bir mahalle yok.	Y	mahalle	1655	    2,702	0.0066	625.3333	tur_news_2005_00132843
9193	Bu sayede her üç mahalle de birleşmiş olacak.	Y	mahalle	1655	    2,702	0.0066	795.75	tur_news_2018_00262019
9194	Beykoz’da yeni bir 'Mahalle Evi' mi?	Y	mahalle	1655	    2,702	0.0066	908.4286	tur_news_2005_00232945
9195	Mahalle halkına uygulanacak olan bu anket internet üzerinden yapılacak.	Y	mahalle	1655	    2,702	0.0066	1207.4444	tur_news_2005_00655575
9196	Bu son derece önemli bir iddia ve meydan okuma bana göre.	Y	okuma	1656	    2,700	0.0066	507.7273	tur_news_2018_00265793
9197	Öğrenciler için yeterli okuma alanları var mı?	Y	okuma	1656	    2,700	0.0066	658.7143	tur_news_2005_00489585
9198	Okuma yazma oranı yüzde 101 olsa ne çıkar?	Y	okuma	1656	    2,700	0.0066	920.4286	tur_news_2018_00701227
9199	Kur’an-ı Kerim okuma için de aynı husus geçerlidir.	Y	okuma	1656	    2,700	0.0066	1066.2	tur_news_2018_00621800
9200	Köyün okuma yazma oranı yüksek, 800 nüfusu var.	Y	okuma	1656	    2,700	0.0066	1302.2857	tur_news_2014_00636453
9201	Türkiye başta olmak üzere birçok ülkeye de hizmet veriyoruz.	Y	ülkeye	1657	    2,699	0.0066	589.8889	tur_news_2018_00892408
9202	Böylece aynı anda tüm ülkeye haber oldular.	Y	ülkeye	1657	    2,699	0.0066	748.8571	tur_news_2014_00218000
9203	Türkiye, bu dönemde Rusya, Irak, Romanya, Almanya başta olmak üzere toplam 143 ülkeye meyve ve sebze gönderdi.	Y	ülkeye	1657	    2,699	0.0066	916.4375	tur_news_2018_00892691
9204	Kendilerinin sıradan bir şirket olmadığını, ülkeye çok büyük bir yatırım yaptıklarını söyledi.	Y	ülkeye	1657	    2,699	0.0066	1069.7273	tur_news_2014_00609000
9205	Bu durumdan ülkeye yarar çıkması mümkün mü?	Y	ülkeye	1657	    2,699	0.0066	1518.7143	tur_news_2014_00237637
9206	Zaten bir hafta sonra 19 Mayıs Gençlik ve Spor Bayramı.	Y	bayramı	1658	    2,698	0.0066	410.8889	tur_news_2005_00277729
9207	Ordu’da dün bir futbol bayramı vardı.	Y	bayramı	1658	    2,698	0.0066	633.2857	tur_news_2014_00736360
9208	Bu tarihten itibaren 1 Mayıs İşçi Bayramı olarak kabul edildi.	Y	bayramı	1658	    2,698	0.0066	842.6667	tur_news_2005_00324946
9209	Cumhuriyet Bayramı nedeniyle Malatya’da konser düzenlendi.	Y	bayramı	1658	    2,698	0.0066	1014.4286	tur_news_2018_00314533
9210	Çünkü Ramazan Bayramı cuma gününe, hafta sonuna denk geliyor.	Y	bayramı	1658	    2,698	0.0066	1219	tur_news_2018_00321946
9211	Ne de bir şey yapmak için hareket ettim.	Y	ettim	1659	    2,696	0.0066	305.125	tur_news_2005_00445890
9212	Elbette bu arada resim yapmaya her zaman devam ettim.	Y	ettim	1659	    2,696	0.0066	566.7778	tur_news_2018_00381697
9213	Daha sonra Hollanda’da bir süre ikamet ettim.	Y	ettim	1659	    2,696	0.0066	857.25	tur_news_2005_00933853
9214	Vatandaş diyor ki, ben kabul ettim kardeşim.	Y	ettim	1659	    2,696	0.0066	965.5714	tur_news_2018_00928801
9215	Hakan Şükür’ü her zaman takdir ettim.	Y	ettim	1659	    2,696	0.0066	1292.2857	tur_news_2014_00493581
9216	Evet KKTC’nin bizzat kendisine bir tepki var.	Y	bizzat	1660	    2,695	0.0066	592.5	tur_news_2018_00407449
9217	Daha sonra çalışmalarını bizzat kendisi yakından takip etti.	Y	bizzat	1660	    2,695	0.0066	678.375	tur_news_2018_00328127
9218	Çünkü olayların içinde Türk’ün bizzat kendisi var.	Y	bizzat	1660	    2,695	0.0066	684.75	tur_news_2018_00321295
9219	Hatta bizzat CHP Genel Başkanı Kemal Kılıçdaroğlu’nun beklediği de oldu.	Y	bizzat	1660	    2,695	0.0066	697	tur_news_2018_00478541
9220	Başbakan Erdoğan tarafından oluşturulması için bizzat talimat verilen 5 kişilik Deprem Danışma Kurulu’nun en genç ve tek kadın üyesi olan Prof.	Y	bizzat	1660	    2,695	0.0066	730.5714	tur_news_2014_00146561
9221	Çoğu tür bir grup içinde, birkaç tür ise yalnız yaşar.	Y	yaşar	1660	    2,695	0.0066	503.4444	tur_news_2014_00335781
9222	1980 'e kadar yerel banka olarak faaliyet gösterdi ve bu tarihte Yaşar Topluluğu’na dahil oldu.	Y	yaşar	1660	    2,695	0.0066	738.9333	tur_news_2014_00008501
9223	Tabii yaş olarak ta Yaşar Çelik 87 yaşında.	Y	yaşar	1660	    2,695	0.0066	808.7143	tur_news_2018_00856619
9224	Yaşar Yavuz tarafından babası Ali özen’e verildi.	Y	yaşar	1660	    2,695	0.0066	1040.25	tur_news_2005_00042965
9225	Yaşar Kemal ERDEM Mühendislik Gıda Mühendisliği 20 Prof.Dr.	Y	yaşar	1660	    2,695	0.0066	1347.25	tur_news_2005_00560445
9226	Gerçekten de Batmanda okul ihtiyacı çok büyük.	Y	batman	1661	    2,693	0.0066	471.75	tur_news_2014_00472029
9227	Ticaret ve Sanayi Odası Batman için önemli bir kuruluş.	Y	batman	1661	    2,693	0.0066	523.8889	tur_news_2014_00888355
9228	Biz Batman Üniversitesi ve okul öncesi eğitime de destek olmak istiyoruz.	Y	batman	1661	    2,693	0.0066	578.5455	tur_news_2014_00202215
9229	Bir aydır Batman’da görev yapan Vali nasıl?	Y	batman	1661	    2,693	0.0066	766.375	tur_news_2014_00183745
9230	Yakın bir gelecekte Batman’da da düşünüyoruz mesela böyle bir etkinliği.	Y	batman	1661	    2,693	0.0066	1157.3333	tur_news_2014_00950801
9231	Para var, işi güzel, vakit sorunu da yok.	Y	vakit	1661	    2,693	0.0066	447.5	tur_news_2014_00761612
9232	Acaba ve gerçekten… Vakit çok mu geç?	Y	vakit	1661	    2,693	0.0066	688.8571	tur_news_2018_00005448
9233	Ne kadar kuvvet ve ne vakit gelecek?	Y	vakit	1661	    2,693	0.0066	752.5	tur_news_2005_00814069
9234	Bu şekilde vakit çabuk geçiyor” diye konuştu.	Y	vakit	1661	    2,693	0.0066	855.2857	tur_news_2018_00263855
9235	O vakit bunun arkasında ne var, düşünmek zorundayız.	Y	vakit	1661	    2,693	0.0066	1156.75	tur_news_2014_00747156
9236	Ama bu kez de ışık sorunu başladı.	Y	ışık	1662	    2,692	0.0066	388	tur_news_2014_00068916
9237	Olabilir mi peki, öyle bir ışık var mı?	Y	ışık	1662	    2,692	0.0066	401.75	tur_news_2018_00701628
9238	Yücel ‘’CHP Türkiye’ye ışık tutan bir noktada.	Y	ışık	1662	    2,692	0.0066	1002.875	tur_news_2018_00984556
9239	Böyle bir şehirde Arapça eğitim programı Ortadoğu’ya da güzel bir ışık tutar.	Y	ışık	1662	    2,692	0.0066	1004.75	tur_news_2018_00184015
9240	Bunun ilk üç haftası sokakta ışık bile yoktu.	Y	ışık	1662	    2,692	0.0066	1059.5	tur_news_2018_00246633
9241	Ben bir spor adamı olarak çok istiyorum.	Y	adamı	1663	    2,690	0.0066	381.2857	tur_news_2018_00125459
9242	Bir spor adamı olarak Malatya’yı Yeni Malatya Spor’u yakından biliyorum ve takip ediyorum.	Y	adamı	1663	    2,690	0.0066	590.1538	tur_news_2018_00159268
9243	Peki bu kadar iş adamı neden sahneye çıktı.	Y	adamı	1663	    2,690	0.0066	705.5	tur_news_2018_00752081
9244	Evli adamı bu kadar çekici yapan şey ne?	Y	adamı	1663	    2,690	0.0066	838.375	tur_news_2018_00408987
9245	Ayhan için 'Maçın en iyi adamı' diyorlar.	Y	adamı	1663	    2,690	0.0066	1237.4286	tur_news_2014_00123010
9246	Böyle bir ülke Milli Eğitim Bakanlığı yapmak zor değil derken.	Y	derken	1663	    2,690	0.0066	330.7	tur_news_2018_00184268
9247	Üzerine bir de et derken hesap ortada!	Y	derken	1663	    2,690	0.0066	717.2857	tur_news_2014_00932730
9248	Hayırlı olsun derken…Bir seçim hükümeti talep ettik, ama olmadı!	Y	derken	1663	    2,690	0.0066	861.1	tur_news_2018_00483555
9249	Uluslar arası çalışmalar iyi gider derken nitelikli öğrenci almak için tüm çalışmayı yaptık, yapmaya devam ediyoruz.	Y	derken	1663	    2,690	0.0066	1019	tur_news_2018_00914268
9250	Ama sana aşık değilim… derken, Birisi mi var?	Y	derken	1663	    2,690	0.0066	1156.5	tur_news_2005_00820088
9251	O zaman yapılması en doğru olan şey buldu.	Y	buldu	1664	    2,688	0.0066	321.625	tur_news_2014_00754309
9252	Bu kadar insanın arasından başkanı nasıl buldu?	Y	buldu	1664	    2,688	0.0066	692.8571	tur_news_2005_00587595
9253	ABD’nin Suriye’ye yardımı böylece 130 milyon doları buldu.	Y	buldu	1664	    2,688	0.0066	870.7778	tur_news_2014_00035519
9254	Olay yerine kısa sürede ulaşan polis ekipleri, genç kızı ağır yaralı halde buldu.	Y	buldu	1664	    2,688	0.0066	1056	tur_news_2014_00720032
9255	Hatta bu mesajlar anında karşılık bile buldu.	Y	buldu	1664	    2,688	0.0066	1163.1429	tur_news_2014_00505041
9256	Ancak bilgi ve çalışmak bu konuda son derecede önemli.	Y	derecede	1665	    2,687	0.0066	446.8889	tur_news_2018_00050476
9257	Ama, onların bakış açısından aynı derecede güzel görünüyor mu?	Y	derecede	1665	    2,687	0.0066	787.3333	tur_news_2005_00744577
9258	Kazanç: Çalışan herkes kendisine rahat bir yaşam sağlayacak derecede kazanç elde etmek ister.	Y	derecede	1665	    2,687	0.0066	849.6667	tur_news_2005_00970738
9259	Evli, üç çocuğu var ve iyi derecede İngilizce biliyor.	Y	derecede	1665	    2,687	0.0066	958.8889	tur_news_2018_00409178
9260	Deprem Durumu: Birinci derecede tehlikeli deprem bölgesinde bulunur.	Y	derecede	1665	    2,687	0.0066	1140.1429	tur_news_2014_00366305
9261	ABD ve Rusya’nın Ortadoğu’da işi ne?	Y	ortadoğu	1666	    2,686	0.0066	405.375	tur_news_2018_00004131
9262	Yine ne oldu CHP’nin şu meşhur 'Büyük Ortadoğu Projesi’ne.	Y	ortadoğu	1666	    2,686	0.0066	568.3	tur_news_2014_00982173
9263	Ardından Ortadoğu Teknik Üniversitesi İnşaat Fakültesi’nden mezun oldu.	Y	ortadoğu	1666	    2,686	0.0066	772.1111	tur_news_2018_00068729
9264	Özellikle Irak ve Ortadoğu’daki sıcak ve kritik gelişmeler itibariyle..	Y	ortadoğu	1666	    2,686	0.0066	900.8889	tur_news_2014_00756771
9265	TERÖR, ORTADOĞU ve TERÖR - Radikal Yahudi Gruplar Terör Nedir?	Y	ortadoğu	1666	    2,686	0.0066	1459.1429	tur_news_2005_00238566
9266	Devleti ve hükümeti idare eden tek bir kişi vardır o da Başbakan Recep Tayyip Erdoğan?	Y	idare	1667	    2,685	0.0066	475	tur_news_2014_00370622
9267	Üniversite için gelmiş geçmiş en kötü idare.	Y	idare	1667	    2,685	0.0066	726.4286	tur_news_2014_00925797
9268	Ama o her zaman yaptığı gibi tavır koymak yerine idare yoluna gitti.	Y	idare	1667	    2,685	0.0066	883.8333	tur_news_2014_00074698
9269	Dünyayı ve devletleri ise küresel sermaye idare ediyor.	Y	idare	1667	    2,685	0.0066	1148.125	tur_news_2018_00366570
9270	Seçim kurulunun kullandığı araçlar ve tüm malzemeler seçim yasası uyarınca idare tarafından hazır edilir.	Y	idare	1667	    2,685	0.0066	1322.8462	tur_news_2014_00809654
9271	Böylece hemen bütün Batı’da belki İtalya’da da olacak bu.	Y	i̇talya	1667	    2,685	0.0066	392.8889	tur_news_2018_00185173
9272	Başbakan Recep Tayyip Erdoğan, üç günlük resmi ziyaret için İtalya’nın başkenti Roma’ya geldi.	Y	i̇talya	1667	    2,685	0.0066	707.3333	tur_news_2014_00147844
9273	İspanya, İtalya ya da İngiltere Ligi olabilir.	Y	i̇talya	1667	    2,685	0.0066	817	tur_news_2014_00568864
9274	İspanya’da olsa, İtalya’da olsa haber olmayacak mı?	Y	i̇talya	1667	    2,685	0.0066	918.2857	tur_news_2014_00568813
9275	İtalya’daki 'Zeytin Dalı' hareketi bizde olabilir mi?..	Y	i̇talya	1667	    2,685	0.0066	1226.375	tur_news_2005_00610905
9276	Bunu er ya da geç tüm dünya kabul edecek.”	Y	er	1668	    2,684	0.0066	393.6667	tur_news_2018_00242640
9277	'Türkiye er veya geç AB üyesi olacak'	Y	er	1668	    2,684	0.0066	516.1429	tur_news_2014_00907829
9278	Her canlı için ölüm bir gün er geç gelecektir.	Y	er	1668	    2,684	0.0066	849.4444	tur_news_2005_00380889
9279	Ama her dönüp geleni er ya da geç bekleyen bir şey.	Y	er	1668	    2,684	0.0066	938.4545	tur_news_2014_00072391
9280	Kurtuluş Savaşı’ndan önce Türk Ordusu’nda er olarak askerlik görevine başladı.	Y	er	1668	    2,684	0.0066	1068.1667	tur_news_2018_00624004
9281	Bunun altında da olabilir ama üstünde de olabilir.	Y	üstünde	1669	    2,683	0.0066	319.4286	tur_news_2018_00243571
9282	Şu an Türkiye’deki oranı yüzde 40’ın üstünde.	Y	üstünde	1669	    2,683	0.0066	420.25	tur_news_2018_00847240
9283	Bunun da üstünde 10 kişilik bir asıl idare yeri vardır.	Y	üstünde	1669	    2,683	0.0066	676.2222	tur_news_2018_00244352
9284	Buna göre, Türkiye’de bebek ölüm oranları AB ülkelerinin çok üstünde.	Y	üstünde	1669	    2,683	0.0066	946.5455	tur_news_2014_00262718
9285	Nereye gitti bu para, kağıt üstünde var.	Y	üstünde	1669	    2,683	0.0066	1056.4286	tur_news_2018_00681749
9286	Sözleşmesi devam eden bu iki oyuncu ile sorun olmadığı öğrenildi.	Y	öğrenildi	1670	    2,680	0.0066	653.5	tur_news_2014_00852343
9287	Gelişmeler hakkında bilgi alan Gül’ün konuyu yakından takip ettiği öğrenildi.	Y	öğrenildi	1670	    2,680	0.0066	766.4545	tur_news_2014_00466359
9288	Mağdur olan vatandaş sayısının ise 600 kişi olduğu öğrenildi.	Y	öğrenildi	1670	    2,680	0.0066	966.375	tur_news_2014_00658586
9289	Futbolcular sahada mücadele etmiyor, Bundan sonra herkes kendine dikkat edecek dediği öğrenildi.	Y	öğrenildi	1670	    2,680	0.0066	1156.75	tur_news_2018_00426006
9290	Erdoğan’ın sözleri karşısında Yüce’nin sessiz kaldığı öğrenildi.	Y	öğrenildi	1670	    2,680	0.0066	1186.8889	tur_news_2014_00421486
9291	Önceki gün, grup toplantısında yine böyle bir şey yaptı.	Y	toplantısında	1671	    2,678	0.0066	355.8889	tur_news_2018_00707680
9292	Çünkü basın toplantısında en az 15 kere söylediği gibi o bir aile babası.	Y	toplantısında	1671	    2,678	0.0066	675.25	tur_news_2018_00316279
9293	CHP Genel Başkanı Kemal Kılıçdaroğlu, partisinin TBMM grup toplantısında konuştu.	Y	toplantısında	1671	    2,678	0.0066	821.3	tur_news_2018_00296473
9294	Maçın ardından her iki takımın teknik direktörü basın toplantısında açıklamalarda bulundu.	Y	toplantısında	1671	    2,678	0.0066	946.6364	tur_news_2018_00634857
9295	MHP lideri Bahçeli, partisinin TBMM grup toplantısında konuştu.	Y	toplantısında	1671	    2,678	0.0066	1210.75	tur_news_2018_00658269
9296	İstanbul Büyükşehir Belediyesi Kültür A.Ş.nin her yaz düzenlediği “İstanbul Kültür Gezileri” devam ediyor.	Y	düzenlediği	1672	    2,669	0.0066	624.8462	tur_news_2014_00571408
9297	Cumhuriyet Halk Partisi İstanbul İl Başkanlığı’nın düzenlediği “ Hedefe… Tam 12’ den!	Y	düzenlediği	1672	    2,669	0.0066	679.6364	tur_news_2014_00342196
9298	Milli Eğitim ve Kültür Bakanlığı’na bağlı Kültür Dairesi’nin her yıl düzenlediği yarışma için Kültür Dairesi’ne bağlı Atatürk Kültür Merkezi’ne yapılacak başvurular 25 Mayıs’ta sona erecek.	Y	düzenlediği	1672	    2,669	0.0066	702.0435	tur_news_2018_00661301
9299	Uluslararası Felsefe Enstitüsü’nün her yıl farklı bir ülkede düzenlediği Uluslararası Felsefe Günleri bu kez İstanbul’da gerçekleşti.	Y	düzenlediği	1672	    2,669	0.0066	741.375	tur_news_2018_00914330
9300	Milli Eğitim ve Kültür Bakanlığı’na bağlı Kültür Dairesi’nin düzenlediği XXVI.	Y	düzenlediği	1672	    2,669	0.0066	768.0909	tur_news_2018_00661300
9301	Konuyla ilgili başka bir çalışma yok ki!	Y	konuyla	1672	    2,669	0.0066	304.8571	tur_news_2014_00631410
9302	Konuyla ilgili HDP’den de ilk açıklama geldi.	Y	konuyla	1672	    2,669	0.0066	639.375	tur_news_2018_00612366
9303	Sonra da konuyla ilgili olumsuz durumu yazın.	Y	konuyla	1672	    2,669	0.0066	761.7143	tur_news_2014_00842684
9304	Bir haftalık süreç içinde konuyla ilgili birçok iddia ortaya atıldı.	Y	konuyla	1672	    2,669	0.0066	948.3	tur_news_2014_00190541
9305	Milletin büyük çoğunluğu medyada büyük bir kısım bu konuyla ilgili görüşlerini ortaya koydu.	Y	konuyla	1672	    2,669	0.0066	1255.4167	tur_news_2014_00678419
9306	Bu bizim için büyük bir onur oldu.	Y	onur	1672	    2,669	0.0066	270	tur_news_2018_00196409
9307	Bu benim için onur olur' dediği ortaya çıktı.	Y	onur	1672	    2,669	0.0066	563.875	tur_news_2014_00229582
9308	Bu durum bize ayrÄ± bir onur verdi.	Y	onur	1672	    2,669	0.0066	710	tur_news_2014_00236992
9309	Şimdi bazıları Onur senin işin yok mu?	Y	onur	1672	    2,669	0.0066	891.4286	tur_news_2018_00811730
9310	Onun adına Kemal Yücel Araştırma Onur Ödülü düzenlendi.	Y	onur	1672	    2,669	0.0066	1211.625	tur_news_2018_00716772
9311	En azından Türkiye’de bu pek de mümkün olmaz.	Y	azından	1673	    2,667	0.0066	350.875	tur_news_2018_00388154
9312	Ama yine de, en azından insanlar “Acaba öyle mi oldu?” diye sordu kendisine.	Y	azından	1673	    2,667	0.0066	548.6154	tur_news_2018_00045298
9313	Türklerin en azından fiyatı bu kadar yüksek değil.	Y	azından	1673	    2,667	0.0066	747.625	tur_news_2014_00913892
9314	En azından bir taraftan bize bağlı olun diyorlar.	Y	azından	1673	    2,667	0.0066	978.75	tur_news_2018_00387948
9315	Hepimiz değilse bile en azından ben biliyorum.	Y	azından	1673	    2,667	0.0066	1189.4286	tur_news_2014_00515759
9316	İslâm tarihinde 661 yılından itibaren yeni bir dönem başladı.	Y	i̇slâm	1673	    2,667	0.0066	572.875	tur_news_2005_00771946
9317	Fakat bu Türk devletleri tam bir İslâm devleti de değildir.	Y	i̇slâm	1673	    2,667	0.0066	588.4	tur_news_2005_00828632
9318	Türkiye’nin yanı sıra, diğer İslâm ülkeleri de savaşın dışında kaldı.	Y	i̇slâm	1673	    2,667	0.0066	708.1818	tur_news_2014_00911778
9319	Bunun için adım adım İslâm devletleri ile temas ediyoruz.	Y	i̇slâm	1673	    2,667	0.0066	1030.5	tur_news_2014_00277102
9320	Sergi, 24 Eylül’e kadar Türk İslâm Eserleri Müzesi’nde görülebilir.	Y	i̇slâm	1673	    2,667	0.0066	1186.8	tur_news_2014_00816774
9321	AK Parti’nin en başarılı belediye başkanları yüzde 80’in üzerinde destek alan Kayseri ve Konya oldu.	Y	kayseri	1674	    2,665	0.0065	393.1875	tur_news_2014_00052673
9322	Adana, Ankara, Antalya, Bursa, İstanbul, İzmir, Kayseri,..	Y	kayseri	1674	    2,665	0.0065	713	tur_news_2014_00041829
9323	Kayseri Lisesi’nin tarihi binasında yapılacak olan Milli Mücadele Müzesi için proje çalışmaları sürüyor.	Y	kayseri	1674	    2,665	0.0065	838.5714	tur_news_2018_00583390
9324	Kayseri Büyükşehir Belediye Başkanı dava açtı, mahkum oldu.	Y	kayseri	1674	    2,665	0.0065	944.625	tur_news_2018_00583220
9325	Kullanıcı adı veya şifremi unuttum 1965’te Kayseri’de doğdu.	Y	kayseri	1674	    2,665	0.0065	1294	tur_news_2014_00639696
9326	Bu konuda Türkiye’de de çok sınırlı sayıda araştırma olduğu görülmektedir.	Y	sınırlı	1674	    2,665	0.0065	476.4	tur_news_2005_00170257
9327	Ama bu sınırlı bir özgürlük değil işte.	Y	sınırlı	1674	    2,665	0.0065	665.8571	tur_news_2014_00069600
9328	Ancak sadece uyumlu olanlar ve sınırlı sayıda..	Y	sınırlı	1674	    2,665	0.0065	778.1429	tur_news_2014_00091201
9329	Ancak Filistin’deki sorun Gazze ile sınırlı değil.	Y	sınırlı	1674	    2,665	0.0065	878.875	tur_news_2014_00087423
9330	Evren sonsuz değildir ama sınırlı da değildir.	Y	sınırlı	1674	    2,665	0.0065	1256.8333	tur_news_2018_00409454
9331	Çünkü o sadece internet için değil aynı zamanda bilgisayar ve iletişim dünyası için de son derece önemli ve yetişmesi zor değerlerden biridir.	Y	biridir	1675	    2,663	0.0065	728.45	tur_news_2005_00105850
9332	Eğitim ve Öğretim hizmetleri tüm dünya milletlerinin en önemli sorunu ve her devletin de en başta gelen görevlerinden biridir.	Y	biridir	1675	    2,663	0.0065	749.3529	tur_news_2005_00432797
9333	Bugün, bölgedeki en büyük kültür, eğitim ve iş merkezlerinden biridir.	Y	biridir	1675	    2,663	0.0065	771.1	tur_news_2014_00243818
9334	Ankara, İstanbul, İzmir gibi büyük şehirler dışında Anadolu’da Araştırma Üniversitesi olarak seçilen iki üniversiteden biridir.	Y	biridir	1675	    2,663	0.0065	771.8125	tur_news_2018_00060191
9335	Bu AKP’nin yaptığı en büyük yanlışlardan biridir.	Y	biridir	1675	    2,663	0.0065	786	tur_news_2018_00190053
9336	Bu özel ekonomik bölgeye bir çok yeni uluslararası şirket geliyor.	Y	bölgeye	1675	    2,663	0.0065	372.3	tur_news_2018_00252824
9337	Türk Telekom, şu anda bir şehir içi telefon kadar yakın bölgeye.	Y	bölgeye	1675	    2,663	0.0065	597.8182	tur_news_2005_00748892
9338	İki yıl önce 13. Bölgeye bir sağlık ocağı yapıldı.	Y	bölgeye	1675	    2,663	0.0065	748.125	tur_news_2018_00521936
9339	Bunun üzerine bölgeye çok sayıda arama kurtarma ekibi sevk edildi.	Y	bölgeye	1675	    2,663	0.0065	946.7	tur_news_2014_00280297
9340	Peki, işletme bölgeye ve ülkeye bir yarar getirecek mi?	Y	bölgeye	1675	    2,663	0.0065	1213.6667	tur_news_2005_00080320
9341	Yani, kendileri de her zaman ifade ediyorlar.	Y	kendileri	1676	    2,662	0.0065	552.8571	tur_news_2005_00611862
9342	Bu hem kendileri hem de ülke için yararlı olacaktır.	Y	kendileri	1676	    2,662	0.0065	604.625	tur_news_2014_00249505
9343	Kendileri de bana benzer bir karşılık verdiler.	Y	kendileri	1676	    2,662	0.0065	920.5714	tur_news_2005_00677295
9344	Kendileri dediler ki “Bu yasa zaten vardı, bu hüküm vardı.	Y	kendileri	1676	    2,662	0.0065	977.5	tur_news_2005_00064104
9345	İnsanlar ancak kendileri de engelli olduğunda durumu anlar.	Y	kendileri	1676	    2,662	0.0065	1327.625	tur_news_2018_00537260
9346	İstanbul’da son on yılda dünya çapında önemli yüzlerce proje yapıldı.	Y	yüzlerce	1677	    2,660	0.0065	572.3636	tur_news_2014_00572151
9347	Tatil için Türkiye’ye giden yüzlerce araç vardı.	Y	yüzlerce	1677	    2,660	0.0065	637.25	tur_news_2014_00876865
9348	Görüyoruz Savaşı ile ilgili yüzlerce film yaptı.	Y	yüzlerce	1677	    2,660	0.0065	744.4286	tur_news_2018_00453812
9349	Bugüne kadar devam eden çalışmalar süresince yüzlerce genç bu çalışmalara katıldı.	Y	yüzlerce	1677	    2,660	0.0065	794.5455	tur_news_2005_00325114
9350	Genel merkeze Kayseri’den yüzlerce kurban gitti.	Y	yüzlerce	1677	    2,660	0.0065	1286.8571	tur_news_2014_00470175
9351	O da başka bir heyecan olur ama çalışmaya devam tabi ki.	Y	çalışmaya	1678	    2,658	0.0065	464.3636	tur_news_2014_00709419
9352	Her merkez çalışmaya dört hasta dahil etmiştir.	Y	çalışmaya	1678	    2,658	0.0065	719	tur_news_2005_00246484
9353	1965’te TRT’de program uzmanı olarak çalışmaya başladı.	Y	çalışmaya	1678	    2,658	0.0065	855.375	tur_news_2014_00007760
9354	1990 sonuna doğru Amerika’ya gittim ve çalışmaya başladım.	Y	çalışmaya	1678	    2,658	0.0065	1102.25	tur_news_2014_00009242
9355	 sorusuna, Onunla ilgili çalışmaya 2 ay önce başladık.	Y	çalışmaya	1678	    2,658	0.0065	1273.7143	tur_news_2014_00848781
9356	Ekonomi, ABD, Avrupa ve Japonya merkezli olarak ortaya çıktı.	Y	merkezli	1678	    2,658	0.0065	600	tur_news_2005_00512141
9357	'Samsun için artık değişim zamanı’Samsun merkezli, bölge gazetesi.	Y	merkezli	1678	    2,658	0.0065	895.75	tur_news_2018_00785682
9358	O da Lübnan merkezli ve faaliyet alanı Filistin.	Y	merkezli	1678	    2,658	0.0065	1018.5	tur_news_2014_00709818
9359	Genelde Amerika ve İngiltere merkezli bu şirketlerin bazıları..	Y	merkezli	1678	    2,658	0.0065	1044.5	tur_news_2014_00468813
9360	Öğrenci merkezli eğitime bir bakalım…Öğrenci merkezli eğitime bir bakalım…	Y	merkezli	1678	    2,658	0.0065	1265.8	tur_news_2018_00695897
9361	İşte Milli Eğitim Bakanlığı’nın yeni uygulaması.	Y	uygulaması	1679	    2,656	0.0065	395.5714	tur_news_2018_00553781
9362	Sosyal medyanın da kendi içinde 2 farklı uygulaması mevcut.	Y	uygulaması	1679	    2,656	0.0065	676.875	tur_news_2018_00838790
9363	Bu çok basit bir cümle ama uygulaması çok zor.	Y	uygulaması	1679	    2,656	0.0065	741.625	tur_news_2014_00232791
9364	Beyaz kimlik uygulaması hafta başından itibaren başladı.	Y	uygulaması	1679	    2,656	0.0065	986.4286	tur_news_2018_00136524
9365	Bunlardan en önemlisi, zorunlu göç uygulaması olmuştur.	Y	uygulaması	1679	    2,656	0.0065	1159.2857	tur_news_2005_00425454
9366	Bir diğer nokta da; çocuklara şu çok iyi geliyor.	Y	çocuklara	1680	    2,655	0.0065	401.4444	tur_news_2018_00148941
9367	Hem bize hem de gelecek çocuklara yazık olacaktır.	Y	çocuklara	1680	    2,655	0.0065	626.1429	tur_news_2018_00487817
9368	Tek tip eğitim vermek çocuklara zarar verir.	Y	çocuklara	1680	    2,655	0.0065	722.5714	tur_news_2014_00882025
9369	Bu nedenle diyorum ki çocuklara hediye edilecek olan bu kitaplar çocuklar bir ömür boyu mutlu edecek.	Y	çocuklara	1680	    2,655	0.0065	1028.4	tur_news_2018_00234150
9370	Şimdiki çocuklara göre ayakkabı almak sıradan bir şey gibi gelebilir.	Y	çocuklara	1680	    2,655	0.0065	1331.7	tur_news_2018_00814105
9371	Yeni bir şey olduğunu söylemek çok zor.	Y	söylemek	1681	    2,654	0.0065	317.1429	tur_news_2014_00971877
9372	Cumhurbaşkanı Erdoğan, burada yaptığı konuşmada şöyle devam etti: Bir defa şunu çok açık ve net söylemek istiyorum.	Y	söylemek	1681	    2,654	0.0065	553.4118	tur_news_2018_00312506
