ORDER	SENTENCE	STATUS	WORD	RANK	COUNT	COUNT_REL	INDEX	ID
13183	Bunun için onu sıkıntılar ile ilgili profesyonel bir yardım almaya ikna etmek gerekiyor.	Y	ikna	2155	    1,907	0.0047	698.4615	tur_news_2014_00277919
13184	O ikna olursa gel beni de ikna et.	Y	ikna	2155	    1,907	0.0047	972.5714	tur_news_2018_00698497
13185	Denktaş’ın sözlerine kaç Kıbrıs Türk’ü kulak verip ikna oldu?	Y	ikna	2155	    1,907	0.0047	1148.0909	tur_news_2014_00366003
13186	Evrensel olarak böyle bir eğitim sistemi de mevcut değildir.	Y	evrensel	2156	    1,906	0.0047	363.4444	tur_news_2005_00946521
13187	Çocuk gerçekten insanlar arasında evrensel bir dil.	Y	evrensel	2156	    1,906	0.0047	569.1429	tur_news_2005_00697468
13188	Yine, yeni, yeniden: Barış - Zeki GÜL - Evrensel.	Y	evrensel	2156	    1,906	0.0047	941	tur_news_2018_00976689
13189	Bilindiği gibi, Kalite nin evrensel bir tanımı yok.	Y	evrensel	2156	    1,906	0.0047	1068.875	tur_news_2005_00318335
13190	Evrensel’e yönelik saldırı bize de yapılmıştır” demiş oldular.	Y	evrensel	2156	    1,906	0.0047	1291.3333	tur_news_2014_00435351
13191	Her an ölüm riski ile karşı karşıya olan insanlar onlar.	Y	riski	2156	    1,906	0.0047	572.8	tur_news_2014_00516845
13192	Sorumluluğu çok fazla, riski ondan da fazla.	Y	riski	2156	    1,906	0.0047	993	tur_news_2014_00847677
13193	Ülkemizin Karşı Karşıya Bulunduğu Deprem Riski Nedir?	Y	riski	2156	    1,906	0.0047	1033.2857	tur_news_2005_00013755
13194	Aksi halde SSK’dan değil, Bağ-Kur’dan emekli olma riski vardır.	Y	riski	2156	    1,906	0.0047	1138.2727	tur_news_2014_00055177
13195	Ne kadar fazla stok, o kadar fazla nakit sıkıntısı riski.	Y	riski	2156	    1,906	0.0047	1319.125	tur_news_2014_00697275
13196	Tabi ki arazilerin tamamı Belediye’ye ait değil, Gençlik Spor’a ait değil ve Devlete de ait değil.	Y	tamamı	2156	    1,906	0.0047	760.1429	tur_news_2018_00856677
13197	Arap halkının tamamı için geçerli olan bir şey değildir.	Y	tamamı	2156	    1,906	0.0047	763.3333	tur_news_2018_00066886
13198	İsveç ve Almanya örneğinde olduğu gibi Avrupa Birliği’nin tamamı Türkiye’ye karşı FETÖ’nün yanında yer aldı.	Y	tamamı	2156	    1,906	0.0047	765.9444	tur_news_2018_00556351
13199	Geri kalan yüzde 70’in tamamı aynı bölgede doğup da buraya gelip yerleşmiş olsa, yine çok fazla sorun olmaz.	Y	tamamı	2156	    1,906	0.0047	825.9444	tur_news_2018_00446698
13200	Tamamı ABD’de çekilen ilk Türk sinema olacak	Y	tamamı	2156	    1,906	0.0047	837.875	tur_news_2018_00860218
13201	Türkiye’nin her yerinde duran insanlar var.	Y	duran	2157	    1,904	0.0047	479.4286	tur_news_2018_00900368
13202	Bu projenin önünde duran güç Türkiye’dir.	Y	duran	2157	    1,904	0.0047	825.4286	tur_news_2014_00285673
13203	Üçüncü yapının hemen arkasında yola paralel gibi duran bir yapı daha.	Y	duran	2157	    1,904	0.0047	989.2727	tur_news_2005_00919744
13204	Daha sonrasında hareketli araçlar gelir, en son duran araçlar gelir.	Y	duran	2157	    1,904	0.0047	1057	tur_news_2014_00356260
13205	Sivil toplum örgütü olmak şık duran birşey çünkü.	Y	duran	2157	    1,904	0.0047	1290.125	tur_news_2014_00832450
13206	Atatürk Eğitim Fakültesi İlköğretim Bölümü Araştırma Görevlisi 1998-devam ediyor M.Ü.	Y	i̇lköğretim	2157	    1,904	0.0047	660	tur_news_2005_00962378
13207	Yoksa Bolu Milli Eğitim Müdürlüğü Sadece İlköğretim okulları için mi görev yapıyor.	Y	i̇lköğretim	2157	    1,904	0.0047	666.5	tur_news_2014_00983647
13208	Cumhuriyet İlköğretim Okulu, Kültür-Edebiyat Kulübü ilçedeki özel ve kamu hizmeti veren kurumları ziyaret etmeye devam ediyor.	Y	i̇lköğretim	2157	    1,904	0.0047	915.4118	tur_news_2014_00342279
13209	Milli Eğitim ve Kültür Bakanlığı’na bağlı İlköğretim Dairesi ile Genel Orta Öğretim Dairesi ve Mesleki Teknik Öğretim Dairesi’ne bağlı okullarda öğrenim görenler öğrenciler 31 Ocak Çarşamba günü karna alacak.	Y	i̇lköğretim	2157	    1,904	0.0047	963.12	tur_news_2018_00661296
13210	Milli Eğitim, Gençlik ve Spor Bakanlığı İlköğretim Dairesi tarafından bu yıl 3’üncüsü düzenlenen “Uluslararası Özel Atletizm Oyunları” başladı ve bitti.	Y	i̇lköğretim	2157	    1,904	0.0047	964.2632	tur_news_2014_00679371
13211	Bunun içinde AB’nin fazla bir rolü yok.	Y	rolü	2157	    1,904	0.0047	344.125	tur_news_2014_00277300
13212	Bu konuda Türkiye’nin, Irak’ın rolü büyük.	Y	rolü	2157	    1,904	0.0047	383	tur_news_2018_00223976
13213	Burada Rusya’nın rolü ne olacak önemli bunlar.	Y	rolü	2157	    1,904	0.0047	435	tur_news_2014_00288396
13214	Bu noktada Türkiye de benzer bir rolü kesinlikle istiyor.	Y	rolü	2157	    1,904	0.0047	703.4444	tur_news_2018_00241157
13215	Bu rolü uzun zamandır istediğini, onu az çok izleyen herkes bilir.	Y	rolü	2157	    1,904	0.0047	1118.4545	tur_news_2014_00290696
13216	ABD finans yönetimi bundan ders aldı mı?	Y	finans	2158	    1,903	0.0047	606.4286	tur_news_2018_00002483
13217	Finans Bank’a da bu vesile ile çok teşekkür etmek istiyorum.	Y	finans	2158	    1,903	0.0047	806.2727	tur_news_2014_00448672
13218	Finans sektörü ve aynı zamanda da devlet denetimi bu işi yapabilir.	Y	finans	2158	    1,903	0.0047	939.2727	tur_news_2018_00422046
13219	Devletin sahibi olduğu bu şirketler arasında medya, sigorta, finans, pazarlama, danışmanlık şirketleri de bulunuyor.	Y	finans	2158	    1,903	0.0047	1085.7143	tur_news_2014_00370462
13220	Pazarlama personel yönetimi, muhasebe yönetimi, üretim yönetimi ve finans.	Y	finans	2158	    1,903	0.0047	1231.5714	tur_news_2005_00772366
13221	Bu taş uzaktan da, en yakından da geliyor.	Y	uzaktan	2158	    1,903	0.0047	754.5714	tur_news_2018_00269161
13222	Almanya’da yaşayan biz Türkler, halen daha burada yapılacak seçimleri sadece uzaktan takip etmek zorundayız.	Y	uzaktan	2158	    1,903	0.0047	790.3333	tur_news_2014_00063635
13223	Ben Lefkoşa’dan geliyorum pek sıkıntı yok ama uzaktan gelen insanlar var ve onlar için işkence oluyor.	Y	uzaktan	2158	    1,903	0.0047	822.2941	tur_news_2018_00132483
13224	Aynı şekilde uzaktan ölçüm konusunda çalışmalar olabilir.	Y	uzaktan	2158	    1,903	0.0047	934.5714	tur_news_2005_00118283
13225	Şu halde ismi ne olursa olsun, terör, şiddet ve anarşinin İslam’la uzaktan yakından ilişkisi yoktur; Bu şiddet hareketlerini her hangi bir dine, özellikle İslâm’a mâl etmek hiçbir şekilde mümkün değildir.	Y	uzaktan	2158	    1,903	0.0047	974.1613	tur_news_2005_00737544
13226	Ve bu tedavi artÄ±k standart tedavi olarak ortaya Ã§Ä±kmÄ±ÅŸtÄ±r.	Y	åÿtä	2159	    1,902	0.0047	940.6923	tur_news_2014_00939626
13227	Bununla birlikte 2003 yÄ±lÄ± itibariyle A.B.D.â€™de bu uygulamalar gÃ¶rÃ¼len pek Ã§ok yan etki nedeniyle kesilmeye baÅŸlanmÄ±ÅŸtÄ±r.	Y	åÿtä	2159	    1,902	0.0047	1028.12	tur_news_2014_00278486
13228	Genel MÃ¼dÃ¼r YardÄ±mcÄ±sÄ± olarak Ã§alÄ±ÅŸtÄ±.	Y	åÿtä	2159	    1,902	0.0047	1077.4545	tur_news_2014_00470140
13229	Bu nedenle anlatÄ±m genel olarak yapÄ±lmÄ±ÅŸtÄ±r.	Y	åÿtä	2159	    1,902	0.0047	1103.7	tur_news_2014_00266388
13230	Ne var ki bu da, o akrabalarÄ±n insafÄ±na kalmÄ±ÅŸtÄ±.	Y	åÿtä	2159	    1,902	0.0047	1195.5833	tur_news_2005_00182909
13231	Ancak o konuda da adil bir Ã§Ã¶zÃ¼m bulmak gerek.	Y	adil	2160	    1,901	0.0047	643	tur_news_2014_00090389
13232	Bu durum hiç adil bir davranış değil.	Y	adil	2160	    1,901	0.0047	698.7143	tur_news_2018_00203825
13233	Hızlı gitmek kadar adil olmak da önemlidir.	Y	adil	2160	    1,901	0.0047	787.5714	tur_news_2014_00530093
13234	Adil olmayan hukuk adil olmayan devlet demektir.	Y	adil	2160	    1,901	0.0047	828	tur_news_2018_00010784
13235	Adil bir yaşam ancak Saadet iktidarı ile mümkündür.	Y	adil	2160	    1,901	0.0047	1196.5	tur_news_2014_00043124
13236	Her ikisi de bir kurum için çok önemli.	Y	ikisi	2160	    1,901	0.0047	363.5	tur_news_2018_00496095
13237	Bir tarafta onların ikisi, diğer tarafta CHP ve ben.	Y	ikisi	2160	    1,901	0.0047	675	tur_news_2018_00160366
13238	“Efendim, hata ediyoruz, o ikisi aynı şey değil.	Y	ikisi	2160	    1,901	0.0047	905.375	tur_news_2018_00372174
13239	Bugün her ikisi de almış başını gidiyor.	Y	ikisi	2160	    1,901	0.0047	1083.1429	tur_news_2018_00211372
13240	Halen ikisi tez aşamasında, biri ders aşamasında 3 yüksek lisans öğrencisi bulunmaktadır.	Y	ikisi	2160	    1,901	0.0047	1224.1	tur_news_2005_00428282
13241	Bu dönem Yürütme Kurulu’nda üç Genel Sekreter Yardımcısı görev alacak.	Y	yürütme	2160	    1,901	0.0047	721.6364	tur_news_2005_00723177
13242	Sandık Başkanı aynı zamanda Yürütme Kurulu’na da Başkanlık eder.	Y	yürütme	2160	    1,901	0.0047	740.5	tur_news_2005_00266631
13243	Madde 8. Etik Kurul tarafından belirlenen görevleri yerine getiren bir Yürütme Kurulu bulunur.	Y	yürütme	2160	    1,901	0.0047	1003.6667	tur_news_2005_00243174
13244	Yürütme Madde 50 - Bu Kanun Bakanlar Kurulu yürütür.	Y	yürütme	2160	    1,901	0.0047	1103.2857	tur_news_2005_00671848
13245	Polonya Cumhuriyeti’nde yürütme görevi Bakanlar Kurulu’na aittir.	Y	yürütme	2160	    1,901	0.0047	1164.1111	tur_news_2005_00289276
13246	Başbakan Yıldırım, “Dünyanın her bir ilçesi dünyada bir marka.	Y	ilçesi	2161	    1,900	0.0047	705	tur_news_2018_00106624
13247	Beykoz ilçesi ve halkı için önemli projeleri olduğunu söyleyen Murat Aydın, Ben şöyle bir Beykoz hayal ediyorum.	Y	ilçesi	2161	    1,900	0.0047	836.875	tur_news_2018_00136951
13248	Fakat şimdi Erzurum, neredeyse Kayseri’nin bir ilçesi halini aldı.	Y	ilçesi	2161	    1,900	0.0047	894.2	tur_news_2005_00551681
13249	Nedeni ise şu: Bilindiği üzere geçtiğimiz sene İzmit ilçesi kuruldu.	Y	ilçesi	2161	    1,900	0.0047	1077	tur_news_2014_00695612
13250	Elbistan, Kahramanmaraş’ın en önde gelen ilçesi.	Y	ilçesi	2161	    1,900	0.0047	1157.5714	tur_news_2014_00410518
13251	Türkiye’nin yönetim sistemine yarın o karar verecek.	Y	sistemine	2161	    1,900	0.0047	602.5	tur_news_2018_00901517
13252	AKP’nin içinde yüzde 38 başkanlık sistemine karşı gelen bir kesim var.”	Y	sistemine	2161	    1,900	0.0047	622	tur_news_2018_00022046
13253	Peki, e-Devlet sistemine giriş nasıl yapılır?	Y	sistemine	2161	    1,900	0.0047	681.1429	tur_news_2018_00752599
13254	Türkler buraya ve sistemine çok iyi uyum sağladı.	Y	sistemine	2161	    1,900	0.0047	1105.5	tur_news_2014_00913789
13255	Yüzde 51’le yeni Cumhurbaşkanlığı sistemine ‘Evet’ dedik.	Y	sistemine	2161	    1,900	0.0047	1162.5714	tur_news_2018_00988554
13256	Ak Parti Bolu İl Başkanlığı 4’üncü Olağan Kongresi’nde mevcut İl Başkanı Ömer Sayın ile Belediye Meclisi Üyesi İsmail Gezgin karşı karşıya geldi.	Y	üncü	2162	    1,899	0.0047	861.7727	tur_news_2018_00019032
13257	Sadece ABD’nin en yoğun 13’üncü havaalanı.	Y	üncü	2162	    1,899	0.0047	865.2857	tur_news_2014_00791287
13258	Seviyesi daha yüksek ve zor olan bu yarışmada 3’üncü oldu.	Y	üncü	2162	    1,899	0.0047	890.5	tur_news_2018_00807322
13259	Fatih Mahallesi’ndeki Yeni Kültür Merkezi’nin ardından Kültür Mahallesi’nde de açılacak olan Kültür Merkeziyle 3’üncü Kültür Merkezine sahip oluyor.	Y	üncü	2162	    1,899	0.0047	923.0588	tur_news_2014_00442281
13260	Bu tür olaylar, bizi 3’üncü Dünya ülkesi olarak gösteriyor…	Y	üncü	2162	    1,899	0.0047	932	tur_news_2018_00273471
13261	Bu nedenle yeni bir özel tüketim vergisi kanunu ihdas etmek isteyen Türkiye açısından konu çok önemli hale gelmiştir.	Y	vergisi	2162	    1,899	0.0047	737.5	tur_news_2005_00801085
13262	Verginin adı ne olursa olsun vatandaşa hizmet olarak döndüğü belirten AK Parti Genel Başkan Yardımcısı Çelik, “Deprem vergisi diye bir vergi yok” dedi.	Y	vergisi	2162	    1,899	0.0047	828.1304	tur_news_2014_00942704
13263	Kurumlar Vergisi Kanunu’na göre; Kanuni merkezi ya da iş merkezi Türkiye’de bulunan mükellefleri ifade etmektedir.	Y	vergisi	2162	    1,899	0.0047	851.6875	tur_news_2014_00646480
13264	Aslında yalnız emlak vergisi için değil, tüm vergiler için aynı durum söz konusu.	Y	vergisi	2162	    1,899	0.0047	860.75	tur_news_2018_00077749
13265	Ali Bey, o zaman “Esnaf Vergisi İzahnamesi’ni Orhan sen yaz.” dedi ve o görevi bana verdi.	Y	vergisi	2162	    1,899	0.0047	884	tur_news_2005_00923241
13266	Bir kişi hem Türk, hem de Yahudi olabilir mi?	Y	yahudi	2162	    1,899	0.0047	351.75	tur_news_2014_00194596
13267	Ayrıca 2003’ten beri hizmet veren bir de Yahudi okulu bulunmaktadır.	Y	yahudi	2162	    1,899	0.0047	602.3	tur_news_2014_00127342
13268	Kürt-İsrail Dostluk Birliği Başkanı ve Kürt-Yahudi Kültür Merkezi’nin kurucusu Dr.	Y	yahudi	2162	    1,899	0.0047	859.3333	tur_news_2014_00644741
13269	Peygamber (s.a.v.) Yahudi olan Hz.	Y	yahudi	2162	    1,899	0.0047	1080.5714	tur_news_2018_00756563
13270	Yahudi seçilmiş olmanın da verdiği birçok sorumluluk vardır.	Y	yahudi	2162	    1,899	0.0047	1137.25	tur_news_2014_00950316
13271	Yani Türkiye’yi bugün Avrupa Birliği’ne tam üye aldıkları zaman, yüzyılın sonunda Türkiye’nin AB’nin en büyük ülkesi olmasını da kabul etmeleri gerekecektir.	Y	aldıkları	2163	    1,898	0.0047	751.6087	tur_news_2005_00118800
13272	Aldıkları son cevap ise şöyle; “Allah kerim..	Y	aldıkları	2163	    1,898	0.0047	817.4286	tur_news_2014_00058350
13273	Birlik Genel Kurulu’nda en çok oy alan aday asıl, diğerleri ise aldıkları oy sayısına göre birinci yedek ve ikinci yedek olarak seçilirler.	Y	aldıkları	2163	    1,898	0.0047	867.3333	tur_news_2005_00766365
13274	Bazı firmalar üç işçi alır, bazı firmalar hiç alamayabilir ama ortalama bir işçi aldıkları takdirde bir milyon 300 bin kişi yapıyor.	Y	aldıkları	2163	    1,898	0.0047	885.375	tur_news_2014_00158414
13275	Aldıkları ücretler de öyle yüksek değil ortalama 2 bin lira.	Y	aldıkları	2163	    1,898	0.0047	888.1111	tur_news_2018_00025869
13276	Ama bize güç veren Türkiye`nin koşulları olacak.	Y	koşulları	2163	    1,898	0.0047	445.625	tur_news_2014_00068086
13277	Ki o dönemin koşulları çok da zor değildi.	Y	koşulları	2163	    1,898	0.0047	687.625	tur_news_2014_00618499
13278	Müzik anlamında değil de ekonomik ve yaşam koşulları açısından.	Y	koşulları	2163	    1,898	0.0047	713.3333	tur_news_2018_00673627
13279	Bugün Türkiye’nin içinde bulunduğu koşulları ben de biliyorum, siz de biliyorsunuz.	Y	koşulları	2163	    1,898	0.0047	740.8182	tur_news_2018_00213507
13280	Doktora Eğitimi Öğrenci Alımı ve Koşulları Madde 7.	Y	koşulları	2163	    1,898	0.0047	1104.8571	tur_news_2005_00457005
13281	Devletin birkaç yıl önce haberdar olduğu Zeugma ile ilgili olarak bundan tam 30 yıl önce bir tez hazırlanmış.	Y	tez	2164	    1,897	0.0047	872.6	tur_news_2014_00370194
13282	Eğitim Süresi ve Dili: Uluslararası İlişkiler Yüksek Lisans Programı’nın süresi, bir yılı dersler, bir yılı tez aşaması olmak üzere iki yıldır. Eğitim dili İngilizce’dir.	Y	tez	2164	    1,897	0.0047	880.3333	tur_news_2005_00020777
13283	Tez canlı ve bir o kadar da acelecidirler.	Y	tez	2164	    1,897	0.0047	904.875	tur_news_2014_00887023
13284	Bu zaman içerisinde tez yazımı devam eder.	Y	tez	2164	    1,897	0.0047	906.4286	tur_news_2005_00869088
13285	Tez ile ilgili tüm haberleri ve son dakika Tez haber ve gelişmelerini bu sayfamızdan takip edebilirsiniz.	Y	tez	2164	    1,897	0.0047	961.5	tur_news_2018_00875554
13286	Ama ortada bir şey var ki o da Fatih Çekirge’nin bugün Hürriyet’te yazdığı gibi kendi ile savaşan bir ülke gerçeği.	Y	yazdığı	2164	    1,897	0.0047	784.8571	tur_news_2018_00042499
13287	AB’nin üye ülkelerle ilgili ilk kez bu kadar sert bir rapor yazdığı belirtiliyor.	Y	yazdığı	2164	    1,897	0.0047	832.1429	tur_news_2014_00037197
13288	Bir de benim için yazdığı bir şiiri var.	Y	yazdığı	2164	    1,897	0.0047	835	tur_news_2018_00147492
13289	Bu gazetenin Bediüzzaman’dan başka yazdığı bir şey yok ki	Y	yazdığı	2164	    1,897	0.0047	856	tur_news_2018_00206634
13290	Galatasaray’ın Türkiye ve Avrupa’da tarih yazdığı zamanlarda Ali Şen çıkıp 'bu Galatasaray’ı durdurmamız lazım' dedi.	Y	yazdığı	2164	    1,897	0.0047	893.2941	tur_news_2018_00427326
13291	Bu yıl daha bir ilk, bakalım neler olacak..	Y	bakalım	2165	    1,896	0.0047	408.75	tur_news_2014_00310123
13292	Bakalım bu kez nasıl bir sonuç çıkacak ortaya.	Y	bakalım	2165	    1,896	0.0047	582.625	tur_news_2018_00097408
13293	Bakalım o zaman karşımıza nasıl bir tablo çıkacak.	Y	bakalım	2165	    1,896	0.0047	943.625	tur_news_2014_00138418
13294	Siz kadınlara 50 yıl daha verin bakalım ne olacak?	Y	bakalım	2165	    1,896	0.0047	1000	tur_news_2014_00836164
13295	Hadi gelin bir de 400 sene ileriye bakalım.	Y	bakalım	2165	    1,896	0.0047	1460.1429	tur_news_2014_00492232
13296	Eğitim Bakanlığı’na bu konuda bilgi verdik.	Y	verdik	2166	    1,895	0.0047	445.8571	tur_news_2018_00376343
13297	Ve sonra büyük bir değişiklik yapmaya karar verdik.	Y	verdik	2166	    1,895	0.0047	559.75	tur_news_2018_00936197
13298	Daha dün İstanbul- Beşiktaş’ta 44 şehit verdik.	Y	verdik	2166	    1,895	0.0047	699.2857	tur_news_2018_00325259
13299	Şimdiye kadar pek çok şey verdik bunlara.	Y	verdik	2166	    1,895	0.0047	872.8571	tur_news_2018_00815839
13300	Hayvancılık yardımı olarak toplam 14 trilyon destek verdik.	Y	verdik	2166	    1,895	0.0047	1461.1429	tur_news_2014_00509764
13301	Bunu gönüllü olarak değil, zorunlu olarak yapan insanlar var diye konuştu.	Y	gönüllü	2167	    1,894	0.0047	443.3	tur_news_2014_00274878
13302	Tabii ki de gönüllü olarak herhangi bir dernek değiliz.	Y	gönüllü	2167	    1,894	0.0047	740.4444	tur_news_2018_00855939
13303	◊ Bu gönüllü yaptığınız bir çalışma değil mi?	Y	gönüllü	2167	    1,894	0.0047	775.8571	tur_news_2018_00207770
13304	Fakat Türk uzmanlar için Uluslararası Gönüllü Uzman olma imkanı devam etmektedir.	Y	gönüllü	2167	    1,894	0.0047	826.3636	tur_news_2005_00305009
13305	Bu eylem artık gönüllü bir eylem olmaktan çıkmıştır.	Y	gönüllü	2167	    1,894	0.0047	1174.2857	tur_news_2014_00239944
13306	Buna o gün yardım eden birileri var.	Y	birileri	2168	    1,893	0.0047	430.4286	tur_news_2018_00230413
13307	Fakat birileri bize destek oldu da biz mi, (sen uzak dur) dedik.	Y	birileri	2168	    1,893	0.0047	739.5833	tur_news_2018_00412156
13308	Birileri de bunu öğrencilerin demokratik tepki hakkı olarak görüyor.	Y	birileri	2168	    1,893	0.0047	847.2222	tur_news_2018_00152029
13309	Dünya böyle işte, birileri geliyor birileri gidiyor.	Y	birileri	2168	    1,893	0.0047	869	tur_news_2018_00362737
13310	Bir zamanlar bir yerlerde birileri de bir hayat yaşadı, tıpkı bugün bizim yaşadığımız gibi.	Y	birileri	2168	    1,893	0.0047	1093.75	tur_news_2005_00735902
13311	‘Yok öyle şey mi olur’ dediler şeklinde konuştu.	Y	dediler	2169	    1,892	0.0046	447.75	tur_news_2018_00979460
13312	Böyle önemli bir davet için bir saat önceden mi haber verilir” dediler.	Y	dediler	2169	    1,892	0.0046	541.5455	tur_news_2014_00220560
13313	“Aile olduğu sürece hiçbir sorun yok” dediler.	Y	dediler	2169	    1,892	0.0046	718.5714	tur_news_2018_00015806
13314	Yaşam yok, Yol, huzur yok dediler orada.	Y	dediler	2169	    1,892	0.0046	884.1667	tur_news_2005_00285106
13315	Birçok kez doktora gittim ama “Psikolojik” dediler.	Y	dediler	2169	    1,892	0.0046	1187.8571	tur_news_2018_00146514
13316	Batı, her zaman bir ve bütün olarak Türkiye’nin karşısına çıktı.	Y	karşısına	2170	    1,890	0.0046	306.1818	tur_news_2018_00113178
13317	Rusya, Çin, Almanya ve İngiltere ABD’nin karşısına geçti.	Y	karşısına	2170	    1,890	0.0046	668.2222	tur_news_2018_00773149
13318	Bu bağlamda bir mesele de, önümüzdeki birkaç ay içinde Türkiye’nin karşısına gelebilir.	Y	karşısına	2170	    1,890	0.0046	857.9231	tur_news_2005_00092560
13319	Yalan ifade veren kişi yargı karşısına çıkar.	Y	karşısına	2170	    1,890	0.0046	1018	tur_news_2018_00943901
13320	İl başkanlığı, ya da ilçede mevcut yönetimin karşısına çıkacak olan ekip şimdiden mahalle mahalle üye bazında çalışma yapıyor..	Y	karşısına	2170	    1,890	0.0046	1181.5294	tur_news_2014_00546545
13321	Uzak metastaz daha çok şu sıra ile olur: akciğer, kemik ve diğer.	Y	kemik	2170	    1,890	0.0046	880.75	tur_news_2005_00776554
13322	Kaldı ki insan bir et-kemik yığını değildir, bir hayvan hiç değildir.	Y	kemik	2170	    1,890	0.0046	929.3	tur_news_2014_00590827
13323	Son bir ay içerisinde 500 kemik ölçümü yapıldı.	Y	kemik	2170	    1,890	0.0046	977.7143	tur_news_2018_00828204
13324	Kıbrıs’ın hangi yeri “kan” veya “kemik” kokmuyor?	Y	kemik	2170	    1,890	0.0046	980.5	tur_news_2018_00593128
13325	Kara-Kemik ise, halk tabakasından başka bir şey değildi.	Y	kemik	2170	    1,890	0.0046	995.4444	tur_news_2005_00882327
13326	Ama gel gör ki yolu yok, yolu.	Y	gör	2171	    1,889	0.0046	890.8333	tur_news_2014_00071818
13327	Gör. Hacettepe üniversitesi Tıp Fakültesi Halk Sağlığı A.D.	Y	gör	2171	    1,889	0.0046	944.3333	tur_news_2005_00201683
13328	Gör., Hacettepe Üniversitesi Tıp Fakültesi Halk Sağlığı, Anabilim Dalı, Ankara Sağlık Müdürlüğü, Eski Sağlık Müdür Yardımcısı.	Y	gör	2171	    1,889	0.0046	961.0667	tur_news_2005_00886397
13329	 Gör işte bak, bu ülke sana yapmış.	Y	gör	2171	    1,889	0.0046	1198.8571	tur_news_2014_00480019
13330	Gör., Hacettepe Üniversitesi Tıp Fakültesi Halk Sağlığı Anabilim Dalı.	Y	gör	2171	    1,889	0.0046	1288.8889	tur_news_2005_00617395
13331	Aslında ilk gelen bilgilere göre başarılı oldu bile.	Y	bilgilere	2172	    1,888	0.0046	396.625	tur_news_2005_00215460
13332	Ancak benim edindiğim bilgilere göre böyle bir çalışma yok.	Y	bilgilere	2172	    1,888	0.0046	744.7778	tur_news_2018_00050395
13333	Gelen bilgilere göre, 57 DEHAP’lı belediye başkanı en geç iki ay içinde yeni partinin bünyesinde yer alacak.	Y	bilgilere	2172	    1,888	0.0046	801.9412	tur_news_2014_00465093
13334	Edinilen bilgilere göre, iki parti 18 ilde daha iş birliği kararı aldı.	Y	bilgilere	2172	    1,888	0.0046	847.2727	tur_news_2018_00371053
13335	Temel İslami bilgilere sahip olan bir kimse bu soruya hemen cevap verir.	Y	bilgilere	2172	    1,888	0.0046	868.4167	tur_news_2018_00872005
13336	Allah’ı var; geçen yaklaşık 5 yıllık sürede iyi işler ortaya çıkardı.	Y	çıkardı	2172	    1,888	0.0046	523.7273	tur_news_2018_00029138
13337	Yani, biz gazeteciler için tam bir tatil ortamı ortaya çıkardı.	Y	çıkardı	2172	    1,888	0.0046	858.2	tur_news_2018_00946326
13338	Diğer taraftan 1409da Çelebi Mehmet yeni bir strateji ortaya çıkardı.	Y	çıkardı	2172	    1,888	0.0046	975.9	tur_news_2014_00373622
13339	Yaşanan acı olaylar, Türkiye’yi haklı çıkardı.	Y	çıkardı	2172	    1,888	0.0046	1072.7143	tur_news_2018_00957697
13340	Bunun üzerine Kerim bir tane çek çıkardı.	Y	çıkardı	2172	    1,888	0.0046	1166.1429	tur_news_2018_00248959
13341	Deniz zor bir tercih yapmak zorunda kalır.	Y	kalır	2172	    1,888	0.0046	614.2857	tur_news_2014_00365945
13342	İnsan orada her şeyden önce Allah’ı ile baş başa kalır.	Y	kalır	2172	    1,888	0.0046	866.2727	tur_news_2014_00560554
13343	Size sadece Şu turu istiyorum demek kalır.	Y	kalır	2172	    1,888	0.0046	984.2857	tur_news_2005_00946223
13344	Ne bütçe kalır, ne üretici, ne de sağlık kalır.	Y	kalır	2172	    1,888	0.0046	1032.1667	tur_news_2018_00676895
13345	O kol Saray tarafından bir çekildi mi geriye, o zaman kala kala Serdar Denktaş ve belki bir-iki adamı kalır DP’de…	Y	kalır	2172	    1,888	0.0046	1228.7895	tur_news_2018_00699378
13346	“Devlet Planlama Dairesi’nin su konusunda ciddi bir çalışma yapması lazım.”	Y	planlama	2172	    1,888	0.0046	641.8182	tur_news_2018_00343164
13347	Şehir ve Bölge Planlama ABD --- İ.T.Ü.	Y	planlama	2172	    1,888	0.0046	784.25	tur_news_2005_00305199
13348	Şehir ve Bölge Planlama Şehir Tasarımı Yüksek Lisans., Şehir Planlama Yüksek Lisans.	Y	planlama	2172	    1,888	0.0046	938.2857	tur_news_2005_00523973
13349	Ankara Büyükşehir Belediyesi, Ulus Tarihi Kent Merkezi Planlama Projesi konulu bir yarışma açtı.	Y	planlama	2172	    1,888	0.0046	1104.8462	tur_news_2005_00129137
13350	Şehir ve Bölge Planlama Bölümü’nü bitirdi.	Y	planlama	2172	    1,888	0.0046	1335.4286	tur_news_2005_00252210
13351	O ki biz Avrupa Birliği’ne girmek istiyoruz.	Y	girmek	2173	    1,887	0.0046	447	tur_news_2005_00283173
13352	Meclis´e girmek için erkek olmak şart mı?	Y	girmek	2173	    1,887	0.0046	717	tur_news_2014_00666297
13353	Artık şu ülkede adil bir sınava girmek bile mümkün değil.	Y	girmek	2173	    1,887	0.0046	813.7	tur_news_2014_00109709
13354	Ben kesinlikle Avrupa Birliği’ne girmek istemiyorum.	Y	girmek	2173	    1,887	0.0046	973.4286	tur_news_2014_00172206
13355	Suriye’de savaşa girmek için verdiği kararın etkisi nedir?	Y	girmek	2173	    1,887	0.0046	1112.2222	tur_news_2018_00851913
13356	Böyle bir ligde 20 bin çok iyi bir rakam.	Y	ligde	2174	    1,886	0.0046	683.8571	tur_news_2014_00217246
13357	İzmir’in sahası yok ki takımı olsun ligde.	Y	ligde	2174	    1,886	0.0046	799.875	tur_news_2018_00561238
13358	Bu takım, bu şehir süper ligde olmalı.”	Y	ligde	2174	    1,886	0.0046	911	tur_news_2018_00268449
13359	Bu ligde kalmak da ayrı bir heyecan.	Y	ligde	2174	    1,886	0.0046	1020.7143	tur_news_2018_00226247
13360	Spor Toto Süper Ligde ilk yarı sona erdi.	Y	ligde	2174	    1,886	0.0046	1258	tur_news_2018_00842916
