ORDER	SENTENCE	STATUS	WORD	RANK	COUNT	COUNT_REL	INDEX	ID
8001	Ancak burada da yargı süreci devam ediyor.	Y	yargı	1468	    3,070	0.0075	406.5714	tur_news_2018_00052021
8002	Adli yargı bir gün herkese lazım olur dedi.	Y	yargı	1468	    3,070	0.0075	677.875	tur_news_2014_00043766
8003	Şimdi, soruşturma devam ediyor, hem yargı hem idari yönden.	Y	yargı	1468	    3,070	0.0075	996.75	tur_news_2018_00815308
8004	Kimin ne kadar şüpheli olup olmadığına yargı karar verir.	Y	yargı	1468	    3,070	0.0075	1163.2222	tur_news_2018_00596569
8005	Kendi lehine bir karar verildiği zaman ‘Yargı kararını vermiştir.	Y	yargı	1468	    3,070	0.0075	1337.2222	tur_news_2018_00586804
8006	Bana göre Türkiye’nin marka olması her şeyden daha önemli.	Y	marka	1469	    3,068	0.0075	432.6	tur_news_2014_00142502
8007	Erzurum’da bu yılın dört ayında marka başvuru sayısı 83’e yükseldi.	Y	marka	1469	    3,068	0.0075	700.7273	tur_news_2018_00398669
8008	Ağırlıklı olarak bu iki marka üzerinde çalışıyoruz.	Y	marka	1469	    3,068	0.0075	800	tur_news_2005_00042191
8009	Onun dışında birkaç marka yüzü teklifi oldu.	Y	marka	1469	    3,068	0.0075	987.5714	tur_news_2018_00717154
8010	İzmir organik hazır giyim üretiminde marka şehir haline geldi.	Y	marka	1469	    3,068	0.0075	1292.2222	tur_news_2018_00561543
8011	Bu test bütün dünyada şu an sorun.	Y	test	1470	    3,067	0.0075	426.2857	tur_news_2018_00269945
8012	Test etmek için güzel bir fırsat var.	Y	test	1470	    3,067	0.0075	484.8571	tur_news_2014_00886649
8013	Ne yazık ki çok az sürücü onları test edecek.	Y	test	1470	    3,067	0.0075	760.2222	tur_news_2018_00683976
8014	10 dakika ise iki takımın birbirini test etmesi şeklinde geçti.	Y	test	1470	    3,067	0.0075	944.4444	tur_news_2014_00001125
8015	Tüm altyapı kuruldu ve test çalışmaları tamamlandı.	Y	test	1470	    3,067	0.0075	1258.5714	tur_news_2014_00898209
8016	A101’de bu hafta hangi ürünler var?	Y	ürünler	1470	    3,067	0.0075	285.5714	tur_news_2018_00001145
8017	Hem spor hem de şık ürünler var.	Y	ürünler	1470	    3,067	0.0075	775.5	tur_news_2014_00514788
8018	Bu ürünler tarım ürünleri olabileceği gibi günlük tüketim ürünleri de olabilir.	Y	ürünler	1470	    3,067	0.0075	891.5	tur_news_2005_00592164
8019	Yaptığım bu ürünler de çok ilgi görüyor.	Y	ürünler	1470	    3,067	0.0075	989.7143	tur_news_2018_00953573
8020	Bu husus isimler, ürünler, hizmetler, vs. için de geçerlidir.	Y	ürünler	1470	    3,067	0.0075	1421.3333	tur_news_2005_00138486
8021	Ya da; daha başka bir yerden bir başka emir gelmiştir.	Y	yerden	1470	    3,067	0.0075	686.5	tur_news_2018_00940337
8022	Heyecan bu hafta da kaldığı yerden devam ediyor.	Y	yerden	1470	    3,067	0.0075	768.5	tur_news_2018_00503749
8023	Cumhurbaşkanı Erdoğan haklı olarak ABD’yi yerden yere vurdu.	Y	yerden	1470	    3,067	0.0075	840	tur_news_2018_00312594
8024	Bir sene sonra dönüp de geriye bir bakmak istiyorum aynı yerden..	Y	yerden	1470	    3,067	0.0075	987.2	tur_news_2014_00197420
8025	Ancak bu hak sahiplerine başka yerden öncelikle arsa tahsis edilir.	Y	yerden	1470	    3,067	0.0075	1127.6	tur_news_2005_00245557
8026	Herkesin A ve B planı var bizim de olmalı.	Y	planı	1471	    3,066	0.0075	437.5556	tur_news_2014_00521061
8027	Ancak Fransa’yı önümüzdeki üç sene içerisinde 50 milyar Euro’nun üzerinde bir tasarruf planı bekliyor.	Y	planı	1471	    3,066	0.0075	689.4	tur_news_2018_00053591
8028	Cumhurbaşkanı Eroğlu’nun bize bir yılı aşkın bir zamandır söz verdiği “B Planı” da tamamen boş çıktı.	Y	planı	1471	    3,066	0.0075	819.8125	tur_news_2014_00341192
8029	Karar vermeden önce ortaya çıkacak olan planı görmek istiyorlar.	Y	planı	1471	    3,066	0.0075	1066.7778	tur_news_2018_00576709
8030	Ve stratejik hedef planı denen bir planlama içine girer.	Y	planı	1471	    3,066	0.0075	1298.2222	tur_news_2014_00943700
8031	Profesyonel olarak çok uzun bir zaman olmadı.	Y	profesyonel	1472	    3,064	0.0075	439.4286	tur_news_2018_00761314
8032	Çok iyi profesyonel olduğunu biliyorum ama dün Beşiktaş’a büyük katkısı oldu.	Y	profesyonel	1472	    3,064	0.0075	654.8333	tur_news_2018_00307794
8033	Bunun sebebi ise Standart’ta bir telefon numarası varken, Profesyonel’de üç ayrı telefon numarası olması.	Y	profesyonel	1472	    3,064	0.0075	791.0714	tur_news_2005_00403331
8034	Yine çalışanların hepsi profesyonel özel güvenlik eğitimi gördü.	Y	profesyonel	1472	    3,064	0.0075	986.75	tur_news_2014_00981256
8035	Yüksek lisans programları kişiye, kendi alanında profesyonel olma özelliklerini geliştirme olanağı verir.	Y	profesyonel	1472	    3,064	0.0075	1255.5833	tur_news_2005_00372502
8036	Yeni 11, ilk maçında futbol adına iyi şeyler yaptı.	Y	maçında	1473	    3,063	0.0075	448.75	tur_news_2014_00971202
8037	Çin-Türkiye maçında hedef sadece Türkler değildi.	Y	maçında	1473	    3,063	0.0075	902.2857	tur_news_2005_00768441
8038	Göztepe’nin ligin bu son maçında hiç.	Y	maçında	1473	    3,063	0.0075	1008	tur_news_2018_00454814
8039	Süper ligin dördüncü hafta maçında Girne’de Türk Ocağı’na, konuk olacak olan Gençler Birliği’nde tek hedef galibiyet.	Y	maçında	1473	    3,063	0.0075	1053.5263	tur_news_2018_00850414
8040	Ziraat Türkiye Kupası son 16 turu ilk maçında sahasında Balık.	Y	maçında	1473	    3,063	0.0075	1351.8889	tur_news_2018_00995503
8041	Her zaman için MHP’nin içinde bir parça CHP ve CHP’nin içinde bir parça MHP bulmak mümkündür.	Y	mümkündür	1473	    3,063	0.0075	524.5	tur_news_2018_00503049
8042	Bu ise ancak proje sahibi olmakla mümkündür.	Y	mümkündür	1473	    3,063	0.0075	596.1429	tur_news_2018_00218131
8043	Kurumun gelişimi, ancak o kurum için çalışan kişilerin gelişimi ile mümkündür.	Y	mümkündür	1473	    3,063	0.0075	853.3	tur_news_2005_00474353
8044	Ne gerçek uyum ne de gerçek çatışma mümkündür.	Y	mümkündür	1473	    3,063	0.0075	1004.6667	tur_news_2014_00696776
8045	Bu soruya kuşkusuz, rahatlıkla hayır diye cevap vermek mümkündür.	Y	mümkündür	1473	    3,063	0.0075	1304.5556	tur_news_2005_00914042
8046	Emniyet Genel Müdürlüğü’nün PKK terör örgütü ile ilgili olarak yaptığı araştırma ve çeşitli çalışmalar çok ilginç sonuçlar verdi.	Y	sonuçlar	1474	    3,061	0.0075	483.2632	tur_news_2018_00387064
8047	Sonuçlar en geç Nisan ayı başında ilan edilir.	Y	sonuçlar	1474	    3,061	0.0075	714.5	tur_news_2014_00844798
8048	• Sonuçlar, Dünya Kitap’ın Ocak sayısında ilan edilir…	Y	sonuçlar	1474	    3,061	0.0075	832.875	tur_news_2018_00833859
8049	Aldığımız sonuçlar ise bizleri oldukça mutlu etmektedir“ dedi.	Y	sonuçlar	1474	    3,061	0.0075	995.75	tur_news_2018_00025804
8050	Beykoz Belediyesi Fen İşleri Müdürlüğü’yle Büyükşehir Belediyesi Ulaşım Koordinasyon Müdürlüğü’nün işbirliği olumlu sonuçlar verdi.	Y	sonuçlar	1474	    3,061	0.0075	1272.3571	tur_news_2005_00598470
8051	Türkiye’de birçok alanda güzel gelişmeler oldu.	Y	gelişmeler	1475	    3,060	0.0075	357	tur_news_2018_00893870
8052	Son gelişmeler ABD’yi de rahatsız ediyor.	Y	gelişmeler	1475	    3,060	0.0075	519.4286	tur_news_2018_00829247
8053	Sonra Kuzey Afrika ve Ortadoğu’daki siyasi gelişmeler var.	Y	gelişmeler	1475	    3,060	0.0075	656.7778	tur_news_2014_00843470
8054	Balıkesir’de turizm alanında büyük gelişmeler olmuştur.	Y	gelişmeler	1475	    3,060	0.0075	840	tur_news_2005_00670629
8055	Sonuçta, 2016’da potansiyel tüm negatif gelişmeler yaşandı.	Y	gelişmeler	1475	    3,060	0.0075	1549.4286	tur_news_2018_00834316
8056	KKTC’de kadın olmak herhangi bir yerde kadın olmaktan çok da farklı değil.	Y	olmaktan	1476	    3,058	0.0075	314.1667	tur_news_2018_00604438
8057	Demek ki AB’ye üye olmak, sadece “AB’ye üye” olmaktan ibaret değil.	Y	olmaktan	1476	    3,058	0.0075	613.3	tur_news_2014_00362124
8058	Hiçbir şey yaşıyor olmaktan, nefes alıyor olmaktan değerli değildir ama.	Y	olmaktan	1476	    3,058	0.0075	824	tur_news_2018_00504936
8059	Bu mesele artık trafik meselesi olmaktan çıktı.	Y	olmaktan	1476	    3,058	0.0075	1007.1429	tur_news_2014_00260833
8060	Mevcut yönetim anlayışı yerel seçim sürecinde umut olmaktan çıkmıştır.	Y	olmaktan	1476	    3,058	0.0075	1201.3333	tur_news_2018_00656315
8061	Bunun yanında da daha fazla hareket edeceğiz.'	Y	edeceğiz	1477	    3,056	0.0075	336.2857	tur_news_2014_00281092
8062	Daha iyi bir takım kurmak için mücadele edeceğiz.	Y	edeceğiz	1477	    3,056	0.0075	552.375	tur_news_2014_00352697
8063	Biz sizin için yapıyoruz, yapmaya devam edeceğiz	Y	edeceğiz	1477	    3,056	0.0075	682.5714	tur_news_2018_00176469
8064	Aksi takdirde, Gökhan’la sezon sonuna kadar devam edeceğiz şeklinde konuştu.	Y	edeceğiz	1477	    3,056	0.0075	873.9091	tur_news_2014_00055528
8065	İnşallah bu coğrafya ile uyumlu kenti hep beraber inşa edeceğiz.	Y	edeceğiz	1477	    3,056	0.0075	1253.8	tur_news_2018_00534836
8066	Bu istediği de yerine getirildi ve kaya haline geldi.	Y	kaya	1478	    3,055	0.0075	609.1111	tur_news_2018_00218839
8067	Bugün niye Başbakan, Ahmet Kaya’ya, Yılmaz Güney’e referans veriyor?	Y	kaya	1478	    3,055	0.0075	830.0909	tur_news_2014_00246460
8068	Murat KAYA (Cerrahi Tıp Bilimleri Bölüm Başkanı) Prof.Dr.	Y	kaya	1478	    3,055	0.0075	1012	tur_news_2005_00778404
8069	İyi derecede İngilizce bilen Aziz Kaya, evli ve iki çocuk babası.	Y	kaya	1478	    3,055	0.0075	1137.6364	tur_news_2018_00558311
8070	İşin içinde Kaya varsa işlem tamam demek!	Y	kaya	1478	    3,055	0.0075	1257	tur_news_2018_00543787
8071	Bu söz hemen her yerde herkes tarafından kullanılır.	Y	kullanılır	1479	    3,051	0.0075	338.125	tur_news_2018_00266725
8072	Devlet, insanı korumak için mi, yoksa yok etmek için mi kullanılır?	Y	kullanılır	1479	    3,051	0.0075	626.3333	tur_news_2014_00370466
8073	Özel sektörde çalışanlar 5 gün izin kullanılır diye tahmin ediyorum.	Y	kullanılır	1479	    3,051	0.0075	968.4444	tur_news_2018_00744097
8074	Aynı zamanda elektronik öğrenme ortamında da kullanılır.	Y	kullanılır	1479	    3,051	0.0075	1039.4286	tur_news_2014_00126107
8075	Biraz daha fazla oranda cam üretiminde kullanılır.	Y	kullanılır	1479	    3,051	0.0075	1175.5714	tur_news_2018_00143804
8076	Peki, bu Güvenlik Konseyi neden bu kadar önemli?	Y	konseyi	1480	    3,050	0.0075	381	tur_news_2018_00752035
8077	Ekim / Kasım ayında yapılan ilk Genel Kurul’da Öğrenci Konseyi Başkanı seçilir.	Y	konseyi	1480	    3,050	0.0075	636	tur_news_2014_00407409
8078	Yücel, düzenlediği basın toplantısında, ilk olarak Dünya Enerji Konseyi Türk Milli Komitesi hakkında bilgi verdi.	Y	konseyi	1480	    3,050	0.0075	778.3333	tur_news_2018_00984561
8079	Toplantıya sivil toplum örgütleri ve kent konseyi üyeleri büyük ilgi gösterdi.	Y	konseyi	1480	    3,050	0.0075	971.3636	tur_news_2014_00892534
8080	Çevre için uluslararası işbirliği. Birleşmiş Milletler, NATO, Avrupa Birliği, Avrupa Konseyi ve benzeri kuruluşların çevre için bölgesel politikaları.	Y	konseyi	1480	    3,050	0.0075	1242.2667	tur_news_2005_00044284
8081	Ancak iyi şeyler yaptığımız da oldu diye konuştu.	Y	yaptığımız	1480	    3,050	0.0075	336.125	tur_news_2014_00088986
8082	Yaptığımız araştırmaya göre, İstanbul’da bu şekilde çok sayıda kadın var.	Y	yaptığımız	1480	    3,050	0.0075	503.1818	tur_news_2014_00961297
8083	Böyle bir şey olmadığını, Cuma günü yaptığımız Belediyeler Birliği Meclis Toplantısı’nda ifade ettik.	Y	yaptığımız	1480	    3,050	0.0075	720.7143	tur_news_2018_00184088
8084	Bence burada yaptığımız hizmetlerin korunması da çok önemli.	Y	yaptığımız	1480	    3,050	0.0075	970.125	tur_news_2018_00126536
8085	·Yaptığımız işin önem ve değerini kabul edelim.	Y	yaptığımız	1480	    3,050	0.0075	1269.5714	tur_news_2014_00961354
8086	Ve bu bakanlar ile idare edilen bir devlet.	Y	bakanlar	1481	    3,049	0.0075	430.25	tur_news_2018_00931269
8087	Bakanlar Kurulu’na daha sık başkanlık edecek mesela.	Y	bakanlar	1481	    3,049	0.0075	683.125	tur_news_2018_00098252
8088	Bir kaç hafta süre içinde Bakanlar Kurulu kararını bekliyoruz.	Y	bakanlar	1481	    3,049	0.0075	776	tur_news_2014_00193541
8089	Bugünkü sistemde Başbakan Bakanlar Kurulu’na başkanlık yapıyor.	Y	bakanlar	1481	    3,049	0.0075	1050	tur_news_2018_00212213
8090	Yürütme Madde 13- Bu yönetmelik hükümleri Bakanlar Kurulu yürütür.	Y	bakanlar	1481	    3,049	0.0075	1399.125	tur_news_2005_00174908
8091	Seçim sürecinde ise aday olarak belirlenen Prof.	Y	belirlenen	1482	    3,047	0.0075	607.8571	tur_news_2018_00797318
8092	Türkiye artık gündemi belirlenen bir ülke değil.	Y	belirlenen	1482	    3,047	0.0075	696.8571	tur_news_2014_00903624
8093	Belirlenen süre sonunda lisans geriye otomatik iade edilir.	Y	belirlenen	1482	    3,047	0.0075	982.625	tur_news_2005_00635203
8094	Buna karşılık, proje çalışmaları sırasında belirlenen bu etkiler, çevresel analiz açısından oldukça önemlidir.	Y	belirlenen	1482	    3,047	0.0075	996.5385	tur_news_2005_00717002
8095	Yatay geçiş yapmak istediği program tarafından belirlenen diğer koşulları (varsa) sağlamak.	Y	belirlenen	1482	    3,047	0.0075	1069.9091	tur_news_2005_00662460
8096	Böyle bir yasal düzenleme yok ki diye konuştu.	Y	düzenleme	1483	    3,045	0.0075	371.75	tur_news_2018_00184333
8097	Peki kısa dönem askerlik için bir düzenleme olacak mı?	Y	düzenleme	1483	    3,045	0.0075	615.3333	tur_news_2018_00753196
8098	Bununla ilgili bir yasal düzenleme mümkün müdür?	Y	düzenleme	1483	    3,045	0.0075	751.2857	tur_news_2018_00247357
8099	Piyasada yapılacak herhangi bir düzenleme fırsat ve sorunları birlikte getirir.	Y	düzenleme	1483	    3,045	0.0075	975.1	tur_news_2005_00138385
8100	Özelleştirme programına yönelik ilk hukuki düzenleme 1984 yılında gerçekleşti.	Y	düzenleme	1483	    3,045	0.0075	1379.5	tur_news_2014_00755420
8101	Bir çok lider gibi o da kendi halkı için bir tehdit.	Y	lider	1484	    3,044	0.0075	390.4	tur_news_2018_00146666
8102	MHP ve CHP’de ise lider oldukça geri düzeyde.	Y	lider	1484	    3,044	0.0075	501.4444	tur_news_2018_00658656
8103	Ama şimdi ligde lider ve hafta sonu Fenerbahçe maçı var.	Y	lider	1484	    3,044	0.0075	696	tur_news_2018_00043376
8104	Geçen hafta tam 8 takıma lider olma şansı geldi.	Y	lider	1484	    3,044	0.0075	958.875	tur_news_2018_00432476
8105	İki lider törende Diyanet İşleri Başkanı Prof.	Y	lider	1484	    3,044	0.0075	1346	tur_news_2014_00541996
8106	A.Ş ( et ve et ürünleri ) Yavuz Gıda San. Tic.	Y	tic	1485	    3,042	0.0075	919.4444	tur_news_2005_00621384
8107	Enerji Grup Mühendislik San ve Tic Ltd.	Y	tic	1485	    3,042	0.0075	993.7143	tur_news_2014_00416858
8108	ADA-NET İnternet ve İletişim Hizmetleri Tic.	Y	tic	1485	    3,042	0.0075	1271.2857	tur_news_2005_00222967
8109	Dergi, Koç Kültür Sanat Tanıtım Hizmetleri Tic.	Y	tic	1485	    3,042	0.0075	1319.2857	tur_news_2005_00320975
8110	Dost Boya İnşaat ve Otomotiv San. Tic.	Y	tic	1485	    3,042	0.0075	1673.4286	tur_news_2005_00686552
8111	CHP son bir ay içinde iki kongre yaptı.	Y	kongre	1486	    3,041	0.0075	290.5	tur_news_2018_00297974
8112	Bu yıl yapılacak kongre benim için çok anlamlı olacaktır.	Y	kongre	1486	    3,041	0.0075	498.1111	tur_news_2014_00310789
8113	Fen Fakültesi Kimya Bölümü Öğretim Üyesi ve Kongre Başkanı Prof.	Y	kongre	1486	    3,041	0.0075	759.3	tur_news_2014_00445312
8114	Bunun için kongre temsil heyeti ile kendiliğinden karşı karşıya gelmiş oldu.	Y	kongre	1486	    3,041	0.0075	917.2727	tur_news_2005_00247157
8115	Kültür ve Kongre Merkezi Osmanlı Salonunda gerçekleşen programa Rektör Vekili Prof.	Y	kongre	1486	    3,041	0.0075	1262.1818	tur_news_2018_00620352
8116	Benim için yeni bir dönem başlıyor diye konuştu.	Y	başlıyor	1487	    3,039	0.0075	312.875	tur_news_2014_00171124
8117	Ülkemizde ilk kez 4 siyasi partinin yer aldığı hükümet bugün göreve başlıyor.	Y	başlıyor	1487	    3,039	0.0075	639.3636	tur_news_2018_00911460
8118	Avrupa askeri açıdan Amerika ile rekabet etmeye başlıyor.	Y	başlıyor	1487	    3,039	0.0075	794.75	tur_news_2005_00975374
8119	Bu süre her gece yarısı baştan başlıyor.	Y	başlıyor	1487	    3,039	0.0075	991.2857	tur_news_2018_00267908
8120	İşin dikkat çekici kısmı da burada başlıyor.	Y	başlıyor	1487	    3,039	0.0075	1153.1429	tur_news_2018_00543644
8121	Ve o takımın bir parçası olarak devam etmek gerekiyor.	Y	takımın	1488	    3,038	0.0075	406	tur_news_2014_00942250
8122	Ancak takımın daha alacak yolu var gibi görünüyor.	Y	takımın	1488	    3,038	0.0075	652.375	tur_news_2014_00092131
8123	Bu kadar üst düzey bir takımın bu kadar basit ve bireysel..	Y	takımın	1488	    3,038	0.0075	738.7778	tur_news_2014_00253392
8124	Söz konusu takımın üyeleri ve lideri belirlenir.	Y	takımın	1488	    3,038	0.0075	853.1429	tur_news_2005_00905248
8125	İki takımın ilk yarıda ortaya koyduğu mücadelede büyük bir heyecan yaşandı.	Y	takımın	1488	    3,038	0.0075	1335.8182	tur_news_2014_00544639
8126	Türkiye’de çok şükür 2004 yılından bu yana hiç kimse yok.	Y	yılından	1489	    3,037	0.0075	562.4	tur_news_2014_00905229
8127	Yeni İstanbul, 1949 yılından itibaren İstanbul’da yayınlanan Türkçe gazete.	Y	yılından	1489	    3,037	0.0075	684.25	tur_news_2014_00972994
8128	2004 yılından daha zor geçecek bir yıl gibi görünüyor.	Y	yılından	1489	    3,037	0.0075	818.75	tur_news_2014_00013171
8129	Marmara Denizi’nde 1766 yılından bu yana büyük deprem olmadı.	Y	yılından	1489	    3,037	0.0075	1004.5556	tur_news_2014_00663809
8130	Mısır’da 1981 yılından bu yana uygulamada olan olağanüstü hal kaldırıldı.	Y	yılından	1489	    3,037	0.0075	1250.3	tur_news_2014_00681549
8131	Eğitim çok verimli bir şekilde devam ediyor.	Y	verimli	1490	    3,033	0.0075	266.2857	tur_news_2018_00376477
8132	Dolayısıyla aynı alanda daha verimli bir üretim olacak.	Y	verimli	1490	    3,033	0.0075	402.875	tur_news_2018_00355910
8133	Çok verimli, güzel bir ziyaret oldu. ifadesini kullandı.	Y	verimli	1490	    3,033	0.0075	720.375	tur_news_2018_00309426
8134	Vatandaş daha verimli, daha hızlı hizmet alacak.	Y	verimli	1490	    3,033	0.0075	819.6667	tur_news_2014_00937297
8135	Toprak verimli, su geldiğinde burası cennet gibi olacak.	Y	verimli	1490	    3,033	0.0075	1238.75	tur_news_2018_00882011
8136	Ancak en az bunun kadar önemli bir amaç daha vardı.	Y	amaç	1491	    3,031	0.0074	213.5	tur_news_2018_00053317
8137	Yalnızca kabul değil, 'devletin temel amaç ve görevleri’nin de buna göre belirlenmesi gerekir.	Y	amaç	1491	    3,031	0.0074	628.5714	tur_news_2005_00517221
8138	Arkasında hangi amaç vardır, onu görmek lazım.	Y	amaç	1491	    3,031	0.0074	771.4286	tur_news_2018_00070252
8139	Amaç güvenlik amacıyla takip değil, turist sayısını kontrol etmek.	Y	amaç	1491	    3,031	0.0074	916.6667	tur_news_2018_00037173
8140	AMAÇ 35. Futbol Yarışma ve Oyun Kuralları Bilgisi.	Y	amaç	1491	    3,031	0.0074	1389.8571	tur_news_2005_00890275
8141	Belediye Başkanı bu hizmeti niye size yaptı?	Y	niye	1492	    3,028	0.0074	477.1429	tur_news_2018_00120908
8142	Kayseri’ye var da Kocaelispor’a niye yok?	Y	niye	1492	    3,028	0.0074	745	tur_news_2014_00605201
8143	Niye bir sonraki seçimlerde bu partiler yok.	Y	niye	1492	    3,028	0.0074	917.8571	tur_news_2014_00704256
8144	Bu kız niye video çekiyor, amacı ne? diyoruz ya.	Y	niye	1492	    3,028	0.0074	1057.4444	tur_news_2018_00222482
8145	İş adamı ‘beni niye rahatsız etsin ki?’ der.	Y	niye	1492	    3,028	0.0074	1277	tur_news_2018_00541622
8146	Sadece teşhis değil tedavi 2014’te açılan ve ücretsiz olarak hizmet veren Kadıköy Belediyesi Prof.	Y	ücretsiz	1493	    3,026	0.0074	643.8571	tur_news_2018_00778693
8147	Erzurum’da Ramazan Bayramı’nın birinci gününde toplu taşıma ücretsiz olacak.	Y	ücretsiz	1493	    3,026	0.0074	997.7273	tur_news_2018_00398844
8148	Öğrenciler ve öğretim görevlileri için ücretsiz servis olanağı mevcuttur.	Y	ücretsiz	1493	    3,026	0.0074	1099.8889	tur_news_2014_00712928
8149	Sanal Gazete’ye ücretsiz abone olmak istiyorum.	Y	ücretsiz	1493	    3,026	0.0074	1197	tur_news_2005_00653830
8150	Çocukluk döneminde yapılan ücretsiz aşı sayısı 13’e yükseldi.	Y	ücretsiz	1493	    3,026	0.0074	1359.25	tur_news_2018_00304851
8151	Ancak bu konuda genel bir standart yoktur.	Y	standart	1494	    3,021	0.0074	313.2857	tur_news_2005_00113512
8152	Ama bunun bütün Almanya’da standart olarak uygulanması hemen olmuyor.	Y	standart	1494	    3,021	0.0074	682.8	tur_news_2014_00069260
8153	Uluslar tarafından genel kabul görmüş bir standart.	Y	standart	1494	    3,021	0.0074	958.4286	tur_news_2014_00924131
8154	Standart hizmet düzeyinde, analiz sonuçları iki iş günü içerisinde bildirilir.	Y	standart	1494	    3,021	0.0074	1048.8	tur_news_2005_00809009
8155	Standart Kurallar,  Disiplin ve Ceza  başlığı altında kuralları da göstermektedir.	Y	standart	1494	    3,021	0.0074	1381.1	tur_news_2005_00788187
8156	Cezası kaç ay, ya da kaç yıl?	Y	cezası	1495	    3,017	0.0074	435	tur_news_2018_00295623
8157	Yoksa ABD’de idam cezası var da demokrasi yok mu?	Y	cezası	1495	    3,017	0.0074	654.2	tur_news_2005_00058709
8158	Konuyla ilgili Bakan’ye göre bu yılın eylül sonu itibarıyla 257 kişiye uygulanan sadece para cezası.	Y	cezası	1495	    3,017	0.0074	794.2	tur_news_2018_00612270
8159	Batman Demokrasi Platformu, ölüm cezası ile ilgili basın açıklaması yaptı.	Y	cezası	1495	    3,017	0.0074	1049.1	tur_news_2014_00154994
8160	Burada getirilen yeni hüküm hapis cezası olmaktadır.	Y	cezası	1495	    3,017	0.0074	1434.5714	tur_news_2014_00286834
8161	Hatta bu bir ilk diye de altını çizdik.	Y	altını	1496	    3,015	0.0074	725.375	tur_news_2018_00478566
8162	Standart gazetesi ise, AK Parti’nin bir kez daha tek başına iktidar olduğunun altını çizdi.	Y	altını	1496	    3,015	0.0074	743.5333	tur_news_2018_00843544
8163	O kimsenin söylediği kadar altını kendisine verdi.	Y	altını	1496	    3,015	0.0074	861.2857	tur_news_2018_00699270
8164	Ankara’yı ve Türk basketbolunu en iyi şekilde temsil etmek üzere yola çıktıklarının altını çizen Gören, Belki salonda iyi sayıda seyirci vardı ama bu takım daha çok desteği hak ediyor.	Y	altını	1496	    3,015	0.0074	882.6897	tur_news_2018_00060709
8165	Bunun özellikle altını çizmek istiyorum” diye konuştu.	Y	altını	1496	    3,015	0.0074	897.5714	tur_news_2018_00247974
8166	Her şey ne eksik ne fazla, sadece olması gerektiği ölçüde vardır.	Y	gerektiği	1496	    3,015	0.0074	472.9	tur_news_2014_00524108
8167	Allah yolunda kişi olduğu gibi değil olması gerektiği gibi olacaktır ve dönüş Allah’a dır.	Y	gerektiği	1496	    3,015	0.0074	651.6923	tur_news_2014_00062443
8168	Tıpkı geriye kalan 364 günün de olması gerektiği gibi!	Y	gerektiği	1496	    3,015	0.0074	899.875	tur_news_2014_00889120
8169	Ayrıca bu analiz çalışmalarının kimler tarafından yapılması gerektiği de önemlidir.	Y	gerektiği	1496	    3,015	0.0074	1019.1	tur_news_2005_00304671
8170	Gerektiği hallerde eğitim ve kültür merkezleri kurmak.	Y	gerektiği	1496	    3,015	0.0074	1287	tur_news_2005_00502782
8171	Her yüzde neden iki göz, iki kulak, bir ağız olduğunu düşünüyorum.	Y	kulak	1497	    3,014	0.0074	577.5	tur_news_2005_00146303
8172	Çünkü kulak, göz ve kalp bunların hepsi ondan sorumludur.”	Y	kulak	1497	    3,014	0.0074	934.6667	tur_news_2018_00320627
8173	Çanakkale 18 Mart Üniversitesi Tıp Fakültesi Kulak Burun Boğaz ana bilim dalı öğretim üyesi Prof.	Y	kulak	1497	    3,014	0.0074	985.7857	tur_news_2018_00287901
8174	Bu tarihten itibaren Marmara Üniversitesi Hastanesi Kulak-Burun-Boğaz Anabilim Dalı’nda Öğretim Üyesi olarak çalışmalarına devam etmektedir.	Y	kulak	1497	    3,014	0.0074	1026.2222	tur_news_2005_00163106
8175	Kulak, burun ve boğaz hastalıkları uzmanı Prof.	Y	kulak	1497	    3,014	0.0074	1514.5714	tur_news_2018_00619455
8176	Şehir merkezinde belki pek o kadar olmadı.	Y	merkezinde	1498	    3,011	0.0074	595.7143	tur_news_2018_00798588
8177	Bu konu ile ilgili ilk toplantı Yunus Emre Kültür Merkezinde yapıldı.	Y	merkezinde	1498	    3,011	0.0074	725.8182	tur_news_2005_00649601
8178	İş Eğitim Merkezinde üst yaş sınırı yoktur.	Y	merkezinde	1498	    3,011	0.0074	924	tur_news_2018_00542697
8179	Hastanesi, Göğüs Hastalıkları Hastanesi, Askeri Hastane ve ayrıca 12 İlçe merkezinde de hastane mevcuttur.	Y	merkezinde	1498	    3,011	0.0074	1085	tur_news_2005_00814657
8180	Sporcu eğitim merkezinde kaç tane sporcu eğitim gördü?	Y	merkezinde	1498	    3,011	0.0074	1292.6667	tur_news_2018_00842181
8181	“Baş” kim, “ayak” kim; o da belli değil!.	Y	ayak	1499	    3,009	0.0074	453	tur_news_2014_00152199
8182	O da iki ayak üzerinde yaşamak değil, tek ayak üzerinde.	Y	ayak	1499	    3,009	0.0074	471.375	tur_news_2014_00709678
8183	Ancak ne isterse olsun, bu iş ayak oyunları ile ele alınacak bir iş değildir.	Y	ayak	1499	    3,009	0.0074	711.3846	tur_news_2018_00055830
8184	Türkiye, bölgesel işbirliği yapılması için ön ayak olmuş tecrübeli bir ülke.	Y	ayak	1499	    3,009	0.0074	837.2727	tur_news_2014_00903947
8185	Bu nedenle gerilim ve ayak oyunları öne çıkıyor.	Y	ayak	1499	    3,009	0.0074	1080.875	tur_news_2018_00234349
8186	Bundan sonra işleri daha da zor olacak.	Y	işleri	1500	    3,005	0.0074	330	tur_news_2018_00232705
8187	Şimdi bu işleri Başbakan’a yakın gazeteciler yapıyor.	Y	işleri	1500	    3,005	0.0074	678.25	tur_news_2014_00824436
