ORDER	SENTENCE	STATUS	WORD	RANK	COUNT	COUNT_REL	INDEX	ID
8378	Hele de bu sistemin oyuncusu hiç değil…	Y	sistemin	1528	    2,938	0.0072	795.1429	tur_news_2018_00486946
8379	Bize bu sistemin maliyeti ortalama 30 bin lira civarında oldu.	Y	sistemin	1528	    2,938	0.0072	839.8889	tur_news_2018_00167806
8380	Bugün Türkiye’de onlarca partinin faaliyet gösteriyor olması sistemin demokratik olduğu anlamına gelmiyor.	Y	sistemin	1528	    2,938	0.0072	989.4615	tur_news_2005_00388071
8381	Proje, bölgeye 60 milyon TL’lik bir ekonomik katkı sağlayacak.	Y	sağlayacak	1529	    2,937	0.0072	677.3333	tur_news_2018_00762365
8382	Burası Malatya’ya büyük bir katma değer sağlayacak şeklinde konuştu.	Y	sağlayacak	1529	    2,937	0.0072	829.9	tur_news_2018_00258855
8383	Bu seçimde İzmir’den aday olursa fayda sağlayacak.	Y	sağlayacak	1529	    2,937	0.0072	947.625	tur_news_2014_00293825
8384	Yıldırım, Fenerbahçe’de heyecan herkese katkı sağlayacak.	Y	sağlayacak	1529	    2,937	0.0072	1103.4286	tur_news_2014_00978611
8385	UEFA Uluslar Ligi nasıl bir fayda sağlayacak?	Y	sağlayacak	1529	    2,937	0.0072	1352.2857	tur_news_2018_00909305
8386	Sonradan bu hale geldi ve nasıl geldiğini çok iyi biliyorum.	Y	geldiğini	1530	    2,935	0.0072	633.8	tur_news_2018_00831518
8387	Ramazan’dan önceki Pazar günü ise 44 bin kişinin merkeze geldiğini dile getiren yetkililer, şunları kaydetti: ‘’Cumartesi günü de buna yakın bir rakam.	Y	geldiğini	1530	    2,935	0.0072	835.3333	tur_news_2014_00780431
8388	Bu da Türkiye’nin nereden nereye geldiğini göstermek bakımından önem arz ediyor.	Y	geldiğini	1530	    2,935	0.0072	970.75	tur_news_2014_00234490
8389	Bunun somut adımlar açısından ne anlama geldiğini söylemek için henüz çok erken.	Y	geldiğini	1530	    2,935	0.0072	1027.25	tur_news_2005_00398954
8390	Kısacası, “saha”nın ne anlama geldiğini iyi biliyor, Mustafa.	Y	geldiğini	1530	    2,935	0.0072	1193.2222	tur_news_2018_00600430
8391	Ne yedi?, Gün içinde spor yaptı mı ya da yürüyüş yaptı mı?	Y	yedi	1530	    2,935	0.0072	488	tur_news_2018_00684265
8392	Bir Amerika, iki Çin, üç Japonya, dört Almanya, beş İngiltere, altı Fransa, yedi Türkiye.	Y	yedi	1530	    2,935	0.0072	660.2857	tur_news_2018_00142690
8393	Yedi tane de Bodrum’da var zaten.	Y	yedi	1530	    2,935	0.0072	710.8571	tur_news_2018_00962919
8394	Ne de olsa bu teknoloji üzerinde çalışmalar yedi yıldan fazla bir zamandır sürüyor.	Y	yedi	1530	    2,935	0.0072	787.7692	tur_news_2005_00030062
8395	Bir kişinin dünyaya yedi ağaç borcu vardır.	Y	yedi	1530	    2,935	0.0072	1107	tur_news_2018_00155506
8396	Bu konuda 60 yıldır başı çeken sevgili Prof.	Y	sevgili	1531	    2,934	0.0072	761.7143	tur_news_2018_00222718
8397	Bu nereye kadar devam edecek sevgili Levent Başkan?.	Y	sevgili	1531	    2,934	0.0072	842.125	tur_news_2018_00235646
8398	Sevgili gençler, o yüzden size çok iş düşüyor.	Y	sevgili	1531	    2,934	0.0072	845	tur_news_2018_00806514
8399	Sevgili Öğrenciler, Bir akademik yılın daha sonuna geldik.	Y	sevgili	1531	    2,934	0.0072	924.875	tur_news_2005_00860176
8400	Buna hazır ol sevgili dünya, sevgili insanlık.	Y	sevgili	1531	    2,934	0.0072	1230.6667	tur_news_2005_00023221
8401	Çünkü içerisinde yüksek oranda yağ ve biraz da su katıyorlar.	Y	yağ	1531	    2,934	0.0072	802.6	tur_news_2018_00319784
8402	Şimdi öyle değil ki, bir zamanlar yağ ve peynirin merkezi olan bu şehir, artık bu ürünleri dışarıdan getirtmeye başladı.	Y	yağ	1531	    2,934	0.0072	913.8889	tur_news_2005_00602463
8403	Son olarak da yağ ve vanilya ilave edilir.	Y	yağ	1531	    2,934	0.0072	932.5	tur_news_2005_00219774
8404	Yemekle alınan yağ da bunun için yeterli.	Y	yağ	1531	    2,934	0.0072	932.7143	tur_news_2018_00963290
8405	Bu nedenle de uzmanlar tarafından yeni yağ yakan meyve olarak kabul gördü.	Y	yağ	1531	    2,934	0.0072	963	tur_news_2018_00234087
8406	Kuşkusuz dünya açısından en önemli konu, İran’ın nükleer sorunu.	Y	nükleer	1532	    2,933	0.0072	658.7	tur_news_2014_00647020
8407	Ahmet Aydın ile Nükleer Tıp Uzmanı Dr.	Y	nükleer	1532	    2,933	0.0072	812.8571	tur_news_2014_00047042
8408	Erdoğan, şöyle konuştu: Dünyada 442 nükleer santral bulunuyor.	Y	nükleer	1532	    2,933	0.0072	940.5714	tur_news_2014_00421796
8409	Türkiye’de son dönemin en popüler sorusu: Nükleer şart mı?	Y	nükleer	1532	    2,933	0.0072	1047.5	tur_news_2014_00907183
8410	Peki Mersin’e nükleer santral kurulacak mı?	Y	nükleer	1532	    2,933	0.0072	1346.5714	tur_news_2018_00753338
8411	O günden bu yana da yaşam size çok zor geliyor olabilir.	Y	günden	1533	    2,932	0.0072	366.4545	tur_news_2005_00370129
8412	O günden bu yana bilim alanında büyük gelişmeler oldu.	Y	günden	1533	    2,932	0.0072	548.8889	tur_news_2018_00697169
8413	O günden bugüne sorunlar daha başka sanki.	Y	günden	1533	    2,932	0.0072	686	tur_news_2018_00697158
8414	Peki, o günden bu yana ne değişti?	Y	günden	1533	    2,932	0.0072	787.5714	tur_news_2014_00766806
8415	Belediye başkanı olduğum günden bu yana sizlerle daima sıkı ilişkiler içerisinde olduk.	Y	günden	1533	    2,932	0.0072	1310	tur_news_2018_00121110
8416	O nu birkaç kişi daha takip etti.	Y	nu	1533	    2,932	0.0072	364	tur_news_2018_00715350
8417	Onun çok yaşlı bir babası var ve O’nu bize emanet etti.	Y	nu	1533	    2,932	0.0072	663.8333	tur_news_2018_00717001
8418	O’nu böyle çalışırken görmek Bize büyük mutluluk veriyor”	Y	nu	1533	    2,932	0.0072	865.3333	tur_news_2018_00715368
8419	• Orta Doğu Teknik Üniversitesi’nde İngilizce Dil Hazırlık Okulu’nu bitirdi.	Y	nu	1533	    2,932	0.0072	918.3636	tur_news_2005_00802930
8420	Ak Internet Elektronik Ticaret Platformu’nu kullanmak için..	Y	nu	1533	    2,932	0.0072	969.5	tur_news_2005_00364517
8421	Samsun’un bu konuda da daha zamanı var.	Y	zamanı	1534	    2,931	0.0072	405.5	tur_news_2018_00786019
8422	Şimdi ders zamanı ders çalışıyor, sonra normal hayata devam ediyorum.	Y	zamanı	1534	    2,931	0.0072	604.3333	tur_news_2018_00813004
8423	Ve bize yine bir muhasebe yapma zamanı geldi.	Y	zamanı	1534	    2,931	0.0072	741.375	tur_news_2018_00931097
8424	Zamanı gelince, Amerikan Başkanı kimse, çıkar bir konuşma yapar.	Y	zamanı	1534	    2,931	0.0072	884.6667	tur_news_2014_00992836
8425	Tercih Zamanı google haber ara Bu habere ilk yorumu siz ekleyin.	Y	zamanı	1534	    2,931	0.0072	1216.1818	tur_news_2014_00884708
8426	Bu da Türkiye için büyük bir fırsat.	Y	fırsat	1535	    2,930	0.0072	226.8571	tur_news_2018_00200373
8427	Onun için her zaman bu imkan, bu fırsat var.	Y	fırsat	1535	    2,930	0.0072	517.875	tur_news_2014_00732918
8428	Bu durumu bir fırsat olarak kullanmaya karar verir yani.	Y	fırsat	1535	    2,930	0.0072	668	tur_news_2018_00204248
8429	Genel sağlık sigortası prim borcu bulunan kişiler için fırsat halen devam ediyor.	Y	fırsat	1535	    2,930	0.0072	960.9167	tur_news_2018_00443151
8430	Biz işin tek sahibi değiliz, biz işin gerçek sahiplerine vesile olmak, fırsat yaratmak istiyoruz.	Y	fırsat	1535	    2,930	0.0072	1222.0833	tur_news_2005_00647328
8431	Sektör için çok iyi bir haber bu.	Y	sektör	1536	    2,929	0.0072	275.7143	tur_news_2014_00812709
8432	Ayrıca, Türkiye’nin İran’da önemli miktarda özel sektör yatırımları var.	Y	sektör	1536	    2,929	0.0072	669	tur_news_2014_00131768
8433	Bu durum, şu anda reel sektör ile bankacılık sektörü arasında yaşanan bir sorun.	Y	sektör	1536	    2,929	0.0072	809.9231	tur_news_2005_00753856
8434	İtalya’da sıkıntısı en büyük olan sektör, bankacılık.	Y	sektör	1536	    2,929	0.0072	1083.875	tur_news_2014_00579083
8435	Biz de sektör olarak elimizden geleni yapacağız.'	Y	sektör	1536	    2,929	0.0072	1292.8571	tur_news_2014_00204455
8436	1977 yılında İstanbul Yüksek İslam Enstitüsü ’nden mezun oldu.	Y	enstitüsü	1537	    2,925	0.0072	571.75	tur_news_2014_00008328
8437	Sağlık Bilimleri Enstitüsü, Çocuk Sağlığı ve Eğitimi Programı, Ankara.	Y	enstitüsü	1537	    2,925	0.0072	767.8889	tur_news_2005_00524301
8438	Emin Işık İstanbul Yüksek İslâm Enstitüsü’nden 1964 yılında mezun oldu.	Y	enstitüsü	1537	    2,925	0.0072	925.8	tur_news_2014_00414086
8439	Köy Hizmetleri Samsun Araştırma Enstitüsü Müdürlüğü Yayınları.	Y	enstitüsü	1537	    2,925	0.0072	1040.8571	tur_news_2005_00436153
8440	Sosyal Bilimler Enstitüsü, Coğrafya Anabilim Dalı İzmir.	Y	enstitüsü	1537	    2,925	0.0072	1522.1429	tur_news_2005_00840243
8441	Sayın Adalet Bakanı da kendi görevini yapıyor.	Y	görevini	1537	    2,925	0.0072	567.1429	tur_news_2005_00590308
8442	Halen İstanbul Büyükşehir Belediyesi Kontrol Daire Başkanlığı görevini yapıyor.	Y	görevini	1537	    2,925	0.0072	720.4444	tur_news_2005_00723984
8443	Ancak hakkını vermek lazım, görevini başarılı bir şekilde sürdürüyor.	Y	görevini	1537	    2,925	0.0072	818.5556	tur_news_2014_00088005
8444	Askerlik görevini İstanbul 1. Ordu Komutanlığı Askeri Mahkemesi’nde askeri hakim olarak yaptı.	Y	görevini	1537	    2,925	0.0072	1052.0909	tur_news_2005_00302572
8445	Bilindiği üzere Başbakan Yardımcısı Mehmet Şimşek Hazine’nin başında görevini sürdürüyor.	Y	görevini	1537	    2,925	0.0072	1213.6364	tur_news_2018_00140076
8446	Bu ara dönemin de süresi zaten 10 ay.	Y	dönemin	1538	    2,924	0.0072	507.8571	tur_news_2018_00193105
8447	Dolayısıyla bu dönemin çok çok iyi değerlendirilmesi gerekiyor.	Y	dönemin	1538	    2,924	0.0072	693	tur_news_2014_00386630
8448	Önümüzdeki dönemin en büyük sıkıntısı bu olacak gibi görünüyor.	Y	dönemin	1538	    2,924	0.0072	841.7778	tur_news_2018_00716079
8449	Yeni dönemin güçlü meclis, güçlü hükümet dönemi olacağı açıklandı.	Y	dönemin	1538	    2,924	0.0072	940.25	tur_news_2018_00965258
8450	Diyelim ki, o borç eski dönemin borcu…	Y	dönemin	1538	    2,924	0.0072	1271.1429	tur_news_2018_00350992
8451	O kadar çok cevabı var ki bu sorunun.	Y	sorunun	1538	    2,924	0.0072	493.5	tur_news_2018_00698742
8452	Bu bir önceki sorunun cevabı ile aynı yere çıkıyor.	Y	sorunun	1538	    2,924	0.0072	665.3333	tur_news_2005_00283971
8453	Sorunun çözümü için eğitim ve denetim büyük önem taşıyor.	Y	sorunun	1538	    2,924	0.0072	814.3333	tur_news_2018_00837458
8454	Ben, BM temsilcisi olarak, sorunun çözümü için oldukça ciddi çalışmalara başladım” dedi.	Y	sorunun	1538	    2,924	0.0072	999.25	tur_news_2014_00166842
8455	Bu sorunun cevabını özellikle yerel siyasetin temsilcileri vermek zorundadır.	Y	sorunun	1538	    2,924	0.0072	1456	tur_news_2018_00266401
8456	Efendim durum şu: Sadece İstanbul’un değil, Türkiye’nin en bilinen otellerinden biri olan The Marmara’nın 'turizm işletme belgesi’ni Turizm Bakanlığı iptal etmiş.	Y	the	1539	    2,922	0.0072	784.0417	tur_news_2014_00401323
8457	Öncelikle dünyanın en etkin gazetesi The Washington Post, 2 Ekim’den itibaren daha da etkin oldu.	Y	the	1539	    2,922	0.0072	834	tur_news_2018_00708380
8458	The Guide İstanbul iki ayda bir olmak üzere yılda altı kez, The Guide Ankara Ocak ayında, The Guide Antalya Mayıs, The Guide Bodrum ise Haziran ayında yayımlanıyor.	Y	the	1539	    2,922	0.0072	883.25	tur_news_2005_00648545
8459	Gelen haber son derece ilginç: Eski dünya liderlerinin yer aldığı The Elders, “çözüm sürecine destek belirtmek ve uluslararası toplumun yeni sürece desteğini teşvik etmek” için Kıbrıs’a geliyor.	Y	the	1539	    2,922	0.0072	940.1429	tur_news_2014_00465379
8460	Bazı ülkelerde The Fame ile aynı albüm olarak listelere giren bu ikinci albüm, ABD, Kanada ve Japonya gibi ülkelerde ayrı bir albüm olarak yer aldı.	Y	the	1539	    2,922	0.0072	976.7143	tur_news_2014_00159875
8461	Bu filmi o kadar çok gördük ki..	Y	filmi	1540	    2,920	0.0072	526.2857	tur_news_2014_00240407
8462	Ben bu filmi geçen sene de gördüm.	Y	filmi	1540	    2,920	0.0072	623.8571	tur_news_2014_00166966
8463	Bu filmi yaşamak isteyen ne kadar çok kadın varmış.	Y	filmi	1540	    2,920	0.0072	801.1111	tur_news_2014_00240411
8464	Bu arada, yarışma programına alınan “Büyük Adam, Küçük Aşk” filmi için açıklama yapıldı.	Y	filmi	1540	    2,920	0.0072	881.3846	tur_news_2005_00925028
8465	Ayrıca “Suyun Sesi” gerçekten tam bir yönetmen filmi.	Y	filmi	1540	    2,920	0.0072	1118.875	tur_news_2018_00091693
8466	Bu işe sert bir şekilde en çok maruz kalan ülke ise Mısır.	Y	maruz	1540	    2,920	0.0072	462.0833	tur_news_2018_00218227
8467	Kısa bir süre önce cinsel tacize maruz kalmış kişiyle işbirliği yapmak için ,özel psikolojik eğitim ve uygun psikolojik destek gerekir.	Y	maruz	1540	    2,920	0.0072	863	tur_news_2005_00319856
8468	Spor ya da başka herhangi bir alanda başarılı olan insanlar bu tarz saldırılara hep maruz kalmışlardır.	Y	maruz	1540	    2,920	0.0072	892.5	tur_news_2014_00853991
8469	Bu durum her gün yaklaşık iki kişinin işkence ve kötü muameleye maruz kaldığını da göstermektedir.	Y	maruz	1540	    2,920	0.0072	927.3333	tur_news_2005_00518379
8470	İstanbul dün günü çok sayıda terörsaldırısına maruz kaldı.	Y	maruz	1540	    2,920	0.0072	935.5	tur_news_2018_00549329
8471	Bu yapılan üç beş kilo et yardımı çok bir şey değil.	Y	kilo	1541	    2,918	0.0072	523.8182	tur_news_2014_00306735
8472	Buna bağlı olarak da kilo alımı daha rahat hale geliyor.	Y	kilo	1541	    2,918	0.0072	652.4	tur_news_2005_00372374
8473	Kilo vermek istiyoruz fakat bir türlü olmuyor.	Y	kilo	1541	    2,918	0.0072	807.4286	tur_news_2018_00595503
8474	Stres, uyku ve kilo arasında çok güçlü bir bağlantı var.	Y	kilo	1541	    2,918	0.0072	937.7	tur_news_2014_00855588
8475	Türkiye’de bunların tüketimi bir buçuk kilo civarında.	Y	kilo	1541	    2,918	0.0072	1137.375	tur_news_2014_00905106
8476	Gün-Er İnşaat Ticaret ve Sanayi Ltd.	Y	ltd	1542	    2,916	0.0072	882.1429	tur_news_2014_00486221
8477	Ltd. Şirketi, Türkiye ve çevre ülkelere hizmet vermek amacıyla 1997 sonunda kuruldu.	Y	ltd	1542	    2,916	0.0072	914.9091	tur_news_2005_00616049
8478	1996 yılından itibaren de Emre Eğitim ve Danışmanlık Ltd.	Y	ltd	1542	    2,916	0.0072	934.875	tur_news_2014_00009819
8479	D-T Kurumsal Risk ve Bilgi Teknolojileri Danışmanlık Hizmetleri Ticaret Ltd.	Y	ltd	1542	    2,916	0.0072	1068.0909	tur_news_2005_00939513
8480	Bugün bir dönüm noktasına gelmiş olan Birim LTD.'	Y	ltd	1542	    2,916	0.0072	1310.25	tur_news_2005_00287877
8481	Her insanın sesi olduğu gibi her şehrin de sesi var.	Y	şehrin	1542	    2,916	0.0072	547.125	tur_news_2014_00520191
8482	Bu noktada tüm şehrin sahip çıkması gerekiyor.	Y	şehrin	1542	    2,916	0.0072	743.8571	tur_news_2018_00241155
8483	Bu şehrin yaklaşık her yıl nüfusu 41 bin artıyor.	Y	şehrin	1542	    2,916	0.0072	814	tur_news_2018_00263536
8484	On üçüncü yüzyılda şehrin, kendisine ait bir yasal kodu vardı.	Y	şehrin	1542	    2,916	0.0072	950.1	tur_news_2014_00730773
8485	Bu noktada şehrin desteğini bekliyoruz şeklinde konuştu.	Y	şehrin	1542	    2,916	0.0072	1167.2857	tur_news_2018_00241105
8486	Her şey Gaziantep için, her şey Türkiye için.”	Y	gaziantep	1543	    2,913	0.0072	340.6	tur_news_2018_00500849
8487	Gaziantep’te asıl heyecan bir önceki dönem gibi Gaziantep Ticaret Odası’nda.	Y	gaziantep	1543	    2,913	0.0072	659.4545	tur_news_2018_00430237
8488	Genç, polis ekipleri tarafından Gaziantep’te yaşayan ailesine teslim edildi.	Y	gaziantep	1543	    2,913	0.0072	812	tur_news_2018_00441420
8489	Milliyetçi Hareket Partisi (MHP) Gaziantep milletvekili adayı Prof.	Y	gaziantep	1543	    2,913	0.0072	920.625	tur_news_2018_00662267
8490	Antalya Emniyet Müdürü Ali Yılmaz ve Gaziantep Emniyet Müdürü Süleyman Oğuz merkeze alındı.	Y	gaziantep	1543	    2,913	0.0072	1148.5455	tur_news_2014_00098676
8491	Önümüzdeki süreçte her şey daha güzel olacak dedi.	Y	süreçte	1543	    2,913	0.0072	355	tur_news_2018_00716490
8492	Bu konu son süreçte bu kadar popüler oldu.	Y	süreçte	1543	    2,913	0.0072	629	tur_news_2018_00224403
8493	Bu süreçte Türkiye tarafından ilginç açıklamalar geliyor.	Y	süreçte	1543	    2,913	0.0072	844.2857	tur_news_2018_00267829
8494	Firmaların birer kişiyi istihdam edecek bir şekilde yaklaşım içinde olmaları aslında bu süreçte anlamlı olur.	Y	süreçte	1543	    2,913	0.0072	1030.3333	tur_news_2014_00449215
8495	Bu süreçte, savaşa verilen halk desteği arttı.	Y	süreçte	1543	    2,913	0.0072	1189.7143	tur_news_2014_00298551
8496	Orman ve Su İşleri İl MÜdürlüğü de olmaz.	Y	i̇şleri	1544	    2,911	0.0072	506.625	tur_news_2018_00723225
8497	Büyükşehir Belediyesi’nin eski Fen İşleri Daire Başkanı.	Y	i̇şleri	1544	    2,911	0.0072	687.125	tur_news_2018_00281718
8498	Bursa’da din görevlileri ile bir araya gelen Diyanet İşleri Başkanı Prof.	Y	i̇şleri	1544	    2,911	0.0072	769	tur_news_2018_00260162
8499	Konuya ilişkin açıklama yapan Diyanet İşleri Başkan Yardımcısı Dr.	Y	i̇şleri	1544	    2,911	0.0072	931.6667	tur_news_2014_00631285
8500	Hacettepe Üniversitesi Mesleki Teknoloji Yüksek Okulu, Ağaç İşleri Endüstri Mühendisliği Bölümü.	Y	i̇şleri	1544	    2,911	0.0072	1411.8182	tur_news_2005_00521986
8501	Büyük bir ekonomik, sosyal ve psikolojik sorun ortaya çıkıyor.	Y	psikolojik	1545	    2,910	0.0071	409.1111	tur_news_2018_00280082
8502	Zaten bölge insanı ne nüfus ne de psikolojik olarak karşı gelecek durumda değildir.	Y	psikolojik	1545	    2,910	0.0071	485.5	tur_news_2014_00994428
8503	Bu, işin belki de psikolojik bir boyutu.	Y	psikolojik	1545	    2,910	0.0071	819.5714	tur_news_2005_00618763
8504	Psikolojik Danışma ve Rehberlik Araştırma Merkezi de aynı çatı altında hizmet vermektedir.	Y	psikolojik	1545	    2,910	0.0071	1056.25	tur_news_2005_00029079
8505	Hayır efendim, sıkıntılar psikolojik değil, sıkıntılar ekonomik’’ diyerek tepki gösteriyor.	Y	psikolojik	1545	    2,910	0.0071	1231.3333	tur_news_2018_00483455
8506	Daha başka şekilde ifade ederim fakat çok fazla ağır olur.	Y	ederim	1546	    2,909	0.0071	280.3	tur_news_2018_00324383
8507	O zaman ben de bunun için dua ederim sana.	Y	ederim	1546	    2,909	0.0071	594.4444	tur_news_2018_00738414
8508	Bunca yıl açık vermeden bana yardım ettiği için kendisine çok teşekkür ederim.	Y	ederim	1546	    2,909	0.0071	787.5833	tur_news_2014_00264328
8509	Her konuda duyarlı olduğunuz için öncelikle size teşekkür ederim.	Y	ederim	1546	    2,909	0.0071	932.5556	tur_news_2014_00522021
8510	. - Teşekkür ederim sayın Cumhurbaşkanı, şimdilik size veda ediyorum.	Y	ederim	1546	    2,909	0.0071	1146	tur_news_2005_00621893
8511	Spor Dairesi yönetim kurulu da ayni şekilde görev yapar.	Y	dairesi	1547	    2,907	0.0071	589.7778	tur_news_2018_00842319
8512	Geçen hafta içinde Danıştay 10. Dairesi Bakanlar Kurulu’nun aldığı bir kararı iptal etti.	Y	dairesi	1547	    2,907	0.0071	692.3846	tur_news_2014_00460507
8513	Vergi Dairesi için Körfez Mahallesi’nde yeni bina yapılıyor.	Y	dairesi	1547	    2,907	0.0071	932.2222	tur_news_2018_00935223
8514	Proje, Yatırımları Değerlendirme ve Analiz Dairesi, Haziran 1999.	Y	dairesi	1547	    2,907	0.0071	1200.4286	tur_news_2005_00906100
8515	Genel Müdürlüğü Pazarlama Dairesi Başkanlığına teslim edilecektir.	Y	dairesi	1547	    2,907	0.0071	1364.1429	tur_news_2005_00738700
8516	Konu, basit bir terör olayı ve terör örgütü işi değildir.	Y	olayı	1547	    2,907	0.0071	639.7778	tur_news_2014_00629630
8517	Kendisi bana burada çok tarihi bir olayı yerinde görme fırsatı verdi.	Y	olayı	1547	    2,907	0.0071	732.7273	tur_news_2018_00588615
8518	Kardeşim bu olayı ona da haber vermiş doğal olarak.	Y	olayı	1547	    2,907	0.0071	790.1111	tur_news_2005_00682727
8519	İşte böyle bir olayı paylaşmak istiyorum bugün sizlerle.	Y	olayı	1547	    2,907	0.0071	1073.5	tur_news_2005_00705874
8520	Trabzonspor’da ikinci Burak Yılmaz olayı yaşanıyor.	Y	olayı	1547	    2,907	0.0071	1356.1429	tur_news_2018_00883530
8521	Önce dedim ki, belki de başka kimlik olabilir.	Y	kimlik	1548	    2,904	0.0071	470.75	tur_news_2005_00109447
8522	Burada doğan üçüncü nesil ise bir kimlik ve temsil sorunu yaşıyor.	Y	kimlik	1548	    2,904	0.0071	848.5455	tur_news_2014_00286648
8523	Bu kimlik kartı bir öğretim yılı geçerlidir.	Y	kimlik	1548	    2,904	0.0071	966.4286	tur_news_2005_00286360
8524	Fakat, maalesef bu bölgede kimlik siyaseti ön plana çıktı.	Y	kimlik	1548	    2,904	0.0071	1051.8889	tur_news_2014_00439703
8525	Sorunun tarihsel boyutu ile birlikte etnik ve kimlik yönü var.	Y	kimlik	1548	    2,904	0.0071	1357.8	tur_news_2018_00837501
8526	Seçim günü oy verme ile ilgili bilgiler.	Y	verme	1548	    2,904	0.0071	447.5714	tur_news_2018_00796356
8527	Kilo verme işlemi hemen olacak olan bir durum değil.	Y	verme	1548	    2,904	0.0071	596.6667	tur_news_2014_00615996
8528	Atatürk Havalimanı’nda, Cumhurbaşkanı ve 27. Dönem Milletvekili Genel Seçimi’nde oy verme işlemi sona erdi.	Y	verme	1548	    2,904	0.0071	847.6667	tur_news_2018_00079441
8529	Bu konuda haber verme yetkisi veya görevi kime aittir?	Y	verme	1548	    2,904	0.0071	1193.3333	tur_news_2018_00223371
8530	Milletler karar verme hakkını peki nasıl kullanıyor?	Y	verme	1548	    2,904	0.0071	1299.2857	tur_news_2018_00660010
8531	Genel Başkan,Genel Merkez Kurulu ve Genel Merkez Yönetim Kurulu’na başkanlık eder.	Y	başkanlık	1549	    2,903	0.0071	320.1111	tur_news_2005_00674179
8532	Genel Başkan Birliği temsil ve Merkez Yönetim Kuruluna Başkanlık eder.	Y	başkanlık	1549	    2,903	0.0071	653	tur_news_2005_00194845
8533	Erdoğan, 9 Ağustos Pazartesi günü ise Bakanlar Kurulu Toplantısı’na başkanlık edecek.	Y	başkanlık	1549	    2,903	0.0071	750.9091	tur_news_2014_00420867
8534	Birlik yönetim kuruluna birlik başkanı başkanlık eder.	Y	başkanlık	1549	    2,903	0.0071	956	tur_news_2005_00831556
8535	İlk soru; Başkanlık sistemine evet der misiniz?	Y	başkanlık	1549	    2,903	0.0071	1286.2857	tur_news_2018_00529357
8536	Ancak bu kez de sağlık sorunları sebebiyle tahliye edildi.	Y	sebebiyle	1549	    2,903	0.0071	662.6667	tur_news_2014_00085156
8537	Bu konuyla ilgili Türkiye’de yapılacak ilk proje olması sebebiyle çalışmalarımıza TÜBİTAK da destek verdi.	Y	sebebiyle	1549	    2,903	0.0071	748.6667	tur_news_2018_00224555
8538	Bu madde sebebiyle aynı yıl içinde iki ayrı sınava girmem mümkün değil.	Y	sebebiyle	1549	    2,903	0.0071	749.3333	tur_news_2018_00226926
8539	En yakın konserler olması sebebiyle bu iki konserin önemi bizim için çok büyük.	Y	sebebiyle	1549	    2,903	0.0071	841.7692	tur_news_2018_00392894
8540	Türkiye’de ilk defa olması sebebiyle IBCA bu yarışmaya ayrı bir önem veriyor.	Y	sebebiyle	1549	    2,903	0.0071	854	tur_news_2005_00457523
8541	Benim geriye dönüşüm diye bir şey söz konusu değil.	Y	geriye	1550	    2,897	0.0071	508.7778	tur_news_2018_00130572
8542	Geriye kalan yüzde 51 ise sadece satış ve pazarlama.	Y	geriye	1550	    2,897	0.0071	608.5	tur_news_2014_00474363
8543	Ancak yüzde 25 oranında bir para kalıyor geriye.	Y	geriye	1550	    2,897	0.0071	765.1429	tur_news_2014_00093394
8544	Hayır çıktığı anda ülke 20 yıl geriye gidecek.	Y	geriye	1550	    2,897	0.0071	1064.2857	tur_news_2018_00483371
8545	İkinci aşamada geriye 3 ülke kalacak: Bulgaristan-Romanya ve Türkiye.	Y	geriye	1550	    2,897	0.0071	1395.6667	tur_news_2005_00308857
8546	Şimdi bu sürece pek çok kurum, kuruluş ve devlet de sahip çıkıyor.	Y	sürece	1550	    2,897	0.0071	439.6667	tur_news_2014_00824600
8547	Ama söz konusu kadınlar olduğu sürece bu hiçbir zaman böyle olmayacak.	Y	sürece	1550	    2,897	0.0071	498.5455	tur_news_2018_00043807
8548	Ve böylece bu sürece dikkat çekmek istiyorum.	Y	sürece	1550	    2,897	0.0071	747.4286	tur_news_2014_00939033
8549	Bu oyun iyi gidiyor, öyle olduğu sürece oynanacak.	Y	sürece	1550	    2,897	0.0071	864	tur_news_2005_00409603
8550	Genel Sekreter hangi aşamada sürece daha fazla katılacak?	Y	sürece	1550	    2,897	0.0071	1214.875	tur_news_2018_00443229
8551	Ama her zaman kazanan yeni olmuştur dedi.	Y	kazanan	1551	    2,894	0.0071	328.8571	tur_news_2014_00072535
8552	Ne olursa olsun, bu yönü ile kazanan Konya olacak.	Y	kazanan	1551	    2,894	0.0071	702	tur_news_2018_00680966
8553	Nur’un madalya kazanan tek kadın sporcu olması, hem onun hem bizler için ayrı bir onur kaynağı.	Y	kazanan	1551	    2,894	0.0071	904.75	tur_news_2018_00689702
8554	“Kazanan taraf olmak istiyoruz”“Kazanan taraf olmak istiyoruz”	Y	kazanan	1551	    2,894	0.0071	957	tur_news_2018_00584140
8555	Seçimler yapıldı ve hükümeti, seçimi kazanan AKP kurdu.	Y	kazanan	1551	    2,894	0.0071	1294.125	tur_news_2014_00809923
8556	Ama artık yok, bunu Ak parti çok iyi biliyor.	Y	biliyor	1552	    2,893	0.0071	264	tur_news_2014_00066671
8557	Halbuki bunun bir parti sorunu değil devlet sorunu olduğunu biliyor.	Y	biliyor	1552	    2,893	0.0071	549.6667	tur_news_2014_00495682
8558	Bolu Valisi de bu olayı çok iyi biliyor.	Y	biliyor	1552	    2,893	0.0071	715.25	tur_news_2018_00181626
8559	Onların samimi olmadığını CHP milletvekilleri çok iyi biliyor.	Y	biliyor	1552	    2,893	0.0071	931.25	tur_news_2018_00713957
8560	Mustafa Kılıç bizim Diyanet görevlisi, dört dil biliyor.	Y	biliyor	1552	    2,893	0.0071	1210.875	tur_news_2014_00689803
8561	Bir Alman, Fransız veya Japon onu öyle kabul eder.	Y	fransız	1553	    2,891	0.0071	712.4444	tur_news_2005_00533396
8562	Sergi 10 Haziran’a kadar Fransız Kültür Merkezi’nde görülebilir.	Y	fransız	1553	    2,891	0.0071	830.5556	tur_news_2014_00816762
