ORDER	SENTENCE	STATUS	WORD	RANK	COUNT	COUNT_REL	INDEX	ID
8188	Burada spor, el işleri gibi her türlü faaliyete giriyor.	Y	işleri	1500	    3,005	0.0074	883.3333	tur_news_2018_00257397
8189	Son birkaç yıldır ağaç işleri sektöründe belli bir oranda büyüme söz konusudur.	Y	işleri	1500	    3,005	0.0074	1049.0833	tur_news_2005_00229296
8190	Dünyada bu tür işleri bilim adamları yaparlar.	Y	işleri	1500	    3,005	0.0074	1167.5714	tur_news_2014_00393110
8191	Tabii ki itiraz edeceğiz hukuki süreci takip edeceğiz ama yanı sıra bunun aslında hukuki dayanağı olmayan karar olduğunu yukarıda ifade ettiğimiz gibi burada da tekrar ifade ediyoruz.	Y	yukarıda	1501	    3,004	0.0074	739.2083	tur_news_2018_00856090
8192	Hazine Dış Ticaret; o bir parça daha yukarıda.	Y	yukarıda	1501	    3,004	0.0074	810.5	tur_news_2005_00811627
8193	Bu kadar hızlı göç alan bir yerde eğitimin kalitesini yukarıda tutmak çok zor oluyor.	Y	yukarıda	1501	    3,004	0.0074	881.7857	tur_news_2018_00219484
8194	Amerikan ekonomisi ise yine de yukarıda saydığımız tedbirlerin yardımı ile bu yılın ilk üç aylık döneminde % 6 gibi büyük bir büyüme gösterdi.	Y	yukarıda	1501	    3,004	0.0074	927.3333	tur_news_2014_00079108
8195	Alıştığımız için şimdi yerde nasıl yürüyorsak yukarıda da aynı şekilde hareket ediyoruz.	Y	yukarıda	1501	    3,004	0.0074	936.6667	tur_news_2018_00027677
8196	Bu geçiş süreci içerisinde de çok büyük önem ifade edecek.	Y	geçiş	1502	    3,002	0.0074	400.3	tur_news_2014_00241510
8197	Güvenli bir geçiş için, çok önemli bir proje.	Y	geçiş	1502	    3,002	0.0074	474.5714	tur_news_2014_00489427
8198	Türkiye yeni yönetim sistemine resmen geçiş yaptı.	Y	geçiş	1502	    3,002	0.0074	965.1429	tur_news_2018_00902836
8199	’nin şu anda bir şeye karar vermesi lazım, Refah Partisi adil düzen getirecek, bu kesin şart, geçiş dönemi yumuşak mı olacak sert mi olacak, tatlı mı olacak kanlı mı olacak, 60 milyon buna karar verecek.	Y	geçiş	1502	    3,002	0.0074	1147.1786	tur_news_2014_00702941
8200	Muhalefet 1990’da çok partili sisteme geçiş için bir kampanya başlattı.	Y	geçiş	1502	    3,002	0.0074	1271.5	tur_news_2014_00686019
8201	Yani gidip onlara bir haber vermek lazım.	Y	gidip	1503	    2,999	0.0074	575.7143	tur_news_2018_00947522
8202	Oraya gidip onları ziyaret etmesi kadar normal hiçbir şey yok.	Y	gidip	1503	    2,999	0.0074	668.6	tur_news_2014_00736221
8203	Emekli de niye gidip AKP’ye oy veriyor.	Y	gidip	1503	    2,999	0.0074	726	tur_news_2014_00413392
8204	Yurt dışına (Almanya,Hollanda ) işçi olarak gidip yaşayan yaklaşık on aile vardır.	Y	gidip	1503	    2,999	0.0074	816.75	tur_news_2014_00990191
8205	Hollanda’ya gidip geri dönen arkadaşlarımız da oldu.	Y	gidip	1503	    2,999	0.0074	1152	tur_news_2018_00508807
8206	Ancak bu göreve uygun sadece bir isim var diye konuştu.	Y	göreve	1504	    2,998	0.0074	313.2	tur_news_2014_00084898
8207	Başbakan ve yardımcısı dışında 11 kişilik Yürütme Kurulu, Bakanlar Kurulu olarak göreve başladı.	Y	göreve	1504	    2,998	0.0074	712.2727	tur_news_2005_00650854
8208	1976’da TRT’de Genel Müdür Program Uzmanı olarak göreve başladı.	Y	göreve	1504	    2,998	0.0074	784.8	tur_news_2014_00008272
8209	Yaşadığımız bu olay nedeniyle yetkilileri göreve davet ediyorum.”	Y	göreve	1504	    2,998	0.0074	1001.5	tur_news_2014_00964255
8210	Sekiz yıl önce Ukrayna’da göreve başladım.	Y	göreve	1504	    2,998	0.0074	1327.5714	tur_news_2018_00799987
8211	Türkiye’de bu ülkelerin ardından 7’inci sırada yer alıyor.	Y	inci	1505	    2,997	0.0074	520.2222	tur_news_2014_00905154
8212	Bunlara ek olarak duygusal bir bağ da vardı kadın ile inci arasında.	Y	inci	1505	    2,997	0.0074	749.5	tur_news_2018_00235849
8213	Bu sene üniversite olarak burada 5’inci sempozyumu yapıyoruz.	Y	inci	1505	    2,997	0.0074	942.25	tur_news_2018_00264345
8214	Bu grup, ligin 5’inci haftasında sonrasında en çok olan olan grup olmuştu.	Y	inci	1505	    2,997	0.0074	982.3	tur_news_2018_00208163
8215	Play-Off’un 5’inci haftasında pazar günü çok önemli bir maça sahne olacak.	Y	inci	1505	    2,997	0.0074	1136.5385	tur_news_2018_00758546
8216	Bugün için Karanlık Madde’nin ne olduğundan çok ne olmadığını daha iyi biliyoruz.	Y	olduğundan	1506	    2,986	0.0073	523.4167	tur_news_2018_00211452
8217	O günün hangi gün olduğundan çok emin değilim yine de.	Y	olduğundan	1506	    2,986	0.0073	685.1	tur_news_2018_00697644
8218	Onun sizin için doğru insan olduğundan emin misiniz?	Y	olduğundan	1506	    2,986	0.0073	738.625	tur_news_2005_00215831
8219	Ancak ilaç çok pahalı olduğundan yaygın bir kullanımı yoktur.	Y	olduğundan	1506	    2,986	0.0073	944.3333	tur_news_2005_00737767
8220	Şimdi motor konusunda çok daha tecrübeli olduğundan dolayı daha rahat kullanıyor.	Y	olduğundan	1506	    2,986	0.0073	1069.2	tur_news_2018_00814612
8221	Bunun sonucu olarak da göç alan bir ilçe.	Y	göç	1507	    2,984	0.0073	373.375	tur_news_2014_00279880
8222	Oradan da Türkiye’ye göç etti” dedi.	Y	göç	1507	    2,984	0.0073	542.2857	tur_news_2018_00721070
8223	Yine 2 bin kişiden bir çoğu Erzurum’dan göç etmiş durumda.	Y	göç	1507	    2,984	0.0073	682.5	tur_news_2005_00359563
8224	Daha sonra köye birkaç aile daha göç etmiştir.	Y	göç	1507	    2,984	0.0073	917.4286	tur_news_2014_00355830
8225	I Ve İç Göç; Konut Üretimi Ve Toplu Konut; Yeni Politikalar Ve Kentsel Hizmetler.	Y	göç	1507	    2,984	0.0073	1270.0909	tur_news_2005_00711172
8226	Cevap: kÄ±rÄ±k bir cam ile.	Y	kä	1508	    2,982	0.0073	858.8571	tur_news_2014_00324609
8227	Son ameliyattan sonra, hastaneden tamamen yeni bir insan gibi Ã§Ä±kÄ±yor.	Y	kä	1508	    2,982	0.0073	955.3846	tur_news_2014_00839551
8228	Eskiden de Ã§Ä±karlardÄ± ama sadece kÄ±ÅŸÄ±n.	Y	kä	1508	    2,982	0.0073	972.3	tur_news_2014_00428396
8229	Deniz kÄ±yÄ±sÄ±nda kaliteli bir tatil dileyenler iÃ§in.	Y	kä	1508	    2,982	0.0073	998.8182	tur_news_2014_00365328
8230	Bu kÄ±sÄ±m Ã§ok hoÅŸuma gitti.	Y	kä	1508	    2,982	0.0073	1068.5	tur_news_2014_00254551
8231	Ama AKP de CHP de yanlış üstüne yanlış yapıyor.	Y	üstüne	1508	    2,982	0.0073	511	tur_news_2018_00033303
8232	Ve her geçen yıl üstüne daha da koyuyor.	Y	üstüne	1508	    2,982	0.0073	583.75	tur_news_2014_00940816
8233	E bunun üstüne biz daha ne diyelim.	Y	üstüne	1508	    2,982	0.0073	653.2857	tur_news_2018_00370125
8234	Bunun için de görev herkesin üstüne düşüyor.	Y	üstüne	1508	    2,982	0.0073	757.2857	tur_news_2018_00245627
8235	Türkiye’de Hatay, Adana ve Manisa’da, bir önceki yerel seçimlerde aldığımız oyun üstüne çıkarak tarihi bir başarıya imza atıldı.	Y	üstüne	1508	    2,982	0.0073	1186.5789	tur_news_2018_00894606
8236	Gençlik ve Spor Bakanlığı bünyesinde yer aldı.	Y	bünyesinde	1509	    2,977	0.0073	465.5714	tur_news_2014_00468064
8237	Bir ayda grup bünyesinde bin 500 farklı tasarım yapılıyor.	Y	bünyesinde	1509	    2,977	0.0073	803	tur_news_2018_00143541
8238	Türkiye’de ilk kez Büyükşehir Belediyesi bünyesinde Tarımsal Hizmetler Daire Başkanlığı kuruldu.	Y	bünyesinde	1509	    2,977	0.0073	908.25	tur_news_2018_00894774
8239	Hazırlık Programı: Üniversite bünyesinde hazırlık eğitimi verilmektedir.	Y	bünyesinde	1509	    2,977	0.0073	1141.5	tur_news_2005_00397957
8240	Üniversitenin Edebiyat Fakültesi bünyesinde ise bir psikolojik danışmanlık birimi vardır.	Y	bünyesinde	1509	    2,977	0.0073	1274.7	tur_news_2005_00387414
8241	Kamu-Net de E-Devlet’in bir parçası.	Y	parçası	1509	    2,977	0.0073	353.125	tur_news_2018_00571653
8242	Daha sonra herkese bir yurt parçası verildi.	Y	parçası	1509	    2,977	0.0073	615.7143	tur_news_2018_00328457
8243	Çalışmak benim için hayatın önemli bir parçası..	Y	parçası	1509	    2,977	0.0073	778	tur_news_2014_00316924
8244	Bu takımın bir parçası olmak mutluluk verici.	Y	parçası	1509	    2,977	0.0073	961.1429	tur_news_2014_00299242
8245	Güneydoğu sorununun önemli bir parçası Kürt sorunu.	Y	parçası	1509	    2,977	0.0073	1144.4286	tur_news_2014_00486876
8246	Türkiye devleti hangi bir yanlış yaptı da, döviz arttı.	Y	döviz	1510	    2,973	0.0073	654	tur_news_2018_00896335
8247	Türkiye’ye hala büyük miktarda döviz geliyor.	Y	döviz	1510	    2,973	0.0073	654.8571	tur_news_2005_00863500
8248	Ne döviz yükseldi, ne siyasi kriz çıktı.	Y	döviz	1510	    2,973	0.0073	968.3333	tur_news_2014_00696455
8249	Maddi olarak ülkemize giren döviz miktarı aynı oldu.	Y	döviz	1510	    2,973	0.0073	1023.625	tur_news_2018_00635892
8250	Bazı özel sektörün dışarıda döviz hesabı olabilir.	Y	döviz	1510	    2,973	0.0073	1319.8571	tur_news_2018_00117352
8251	“Bu, Komisyon ve Almanya’ya karşı olacak.”	Y	komisyon	1511	    2,971	0.0073	329.5714	tur_news_2018_00222584
8252	Sayın Komisyon üyelerine de şunları ifade etmek istiyorum.	Y	komisyon	1511	    2,971	0.0073	909.25	tur_news_2005_00132164
8253	”Umarım ki bu komisyon başarılı bir çalışma yürütür.	Y	komisyon	1511	    2,971	0.0073	959.25	tur_news_2018_00915242
8254	Komisyon hazırladığı raporu Üniversite Yönetim Kurulu’na sunar.	Y	komisyon	1511	    2,971	0.0073	1114.5	tur_news_2005_00891952
8255	Komisyon, 11 Ocak salı günü Hacettepe Üniversitesi Rektörü Prof.	Y	komisyon	1511	    2,971	0.0073	1340	tur_news_2018_00608600
8256	Bu iki eylem arasında ne fark var?	Y	eylem	1512	    2,970	0.0073	338.8571	tur_news_2018_00216900
8257	PKK’nın bu yıl içinde eylem sayısında artış oldu.	Y	eylem	1512	    2,970	0.0073	684.3333	tur_news_2014_00771014
8258	Zaten 2018 yılı için acil eylem planı yapıyoruz.	Y	eylem	1512	    2,970	0.0073	925.8571	tur_news_2018_00992170
8259	Kadınların sokağa çıkması ve eylem yapması sonuç verir mi?	Y	eylem	1512	    2,970	0.0073	1233.5556	tur_news_2014_00588489
8260	Eylem olmadan çok fazla yorum getirmek istemiyorum.	Y	eylem	1512	    2,970	0.0073	1280.8571	tur_news_2014_00436244
8261	Kurban edilen Anadolu takımı ne de olsa.	Y	kurban	1513	    2,968	0.0073	459.5714	tur_news_2018_00622234
8262	Önümüzdeki hafta sonu Kurban Bayramı nedeniyle maç yok.	Y	kurban	1513	    2,968	0.0073	782.875	tur_news_2014_00731458
8263	Kurban Bayramı Konya’da bir başka geçer.	Y	kurban	1513	    2,968	0.0073	840	tur_news_2018_00622079
8264	Malatya bu hedef için “kurban şehir” seçildi.	Y	kurban	1513	    2,968	0.0073	903	tur_news_2018_00639324
8265	Kesim ücreti alınan kurban, 4 parça olarak teslim edilecektir.	Y	kurban	1513	    2,968	0.0073	1399.625	tur_news_2014_00612720
8266	Bugün ortaya çıkan görüntüler aslında yeni bir görüntü değildir.	Y	görüntü	1514	    2,967	0.0073	594.1111	tur_news_2014_00246560
8267	O zaman daha iyi bir görüntü mü olacaktı?	Y	görüntü	1514	    2,967	0.0073	795.25	tur_news_2014_00753536
8268	Öncü, Görüntü itibariyle bir şey söz konusu.	Y	görüntü	1514	    2,967	0.0073	872.2857	tur_news_2014_00725866
8269	Bizde sanatçı- cami pek popüler bir görüntü değil.	Y	görüntü	1514	    2,967	0.0073	1160.25	tur_news_2014_00204445
8270	Ortada bir sorun varmış gibi görüntü verdiler.	Y	görüntü	1514	    2,967	0.0073	1258.8571	tur_news_2014_00740050
8271	Türkiye Futbol Federasyonu’nun yeni başkanı belli oldu.	Y	federasyonu	1515	    2,965	0.0073	337.25	tur_news_2014_00907934
8272	Türkiye Futbol Federasyonu ve Galatasaray Kulübü’nün eski başkanı Prof.	Y	federasyonu	1515	    2,965	0.0073	547.2	tur_news_2014_00907964
8273	Söz konusu birlik, Kıbrıs Türk Kurumları Federasyonu adı altında 1949 yılında kurulmuştur.	Y	federasyonu	1515	    2,965	0.0073	742.4545	tur_news_2005_00082996
8274	Rusya Federasyonu’nda iş yapan firmaların halen 2 milyar dolara yakın devam eden işleri söz konusudur.	Y	federasyonu	1515	    2,965	0.0073	889.4	tur_news_2005_00679996
8275	Cengiz Arslan ile Üniversiteler Federasyonu Başkanı Prof.	Y	federasyonu	1515	    2,965	0.0073	1351	tur_news_2018_00292744
8276	İstanbul uluslararası bir tasarım merkezi olmayı hak ediyor.	Y	tasarım	1516	    2,963	0.0073	554.625	tur_news_2018_00550136
8277	İzmir’i kültür sanat ve tasarım kenti yapmak istiyoruz.	Y	tasarım	1516	    2,963	0.0073	669.2222	tur_news_2014_00582533
8278	Tabii tasarım için de üniversite-sanayi işbirliği kaçınılmaz.	Y	tasarım	1516	    2,963	0.0073	855.375	tur_news_2014_00866859
8279	Örnek: Bilgisayar dergisi alımı vb. 2.Basın Yayın ve Tasarım Komisyonu: Web Tasarımı.	Y	tasarım	1516	    2,963	0.0073	1153	tur_news_2005_00019734
8280	Bilgi için tıklayınız 3 Boyutlu Türkçe Mobilya Tasarım programı.	Y	tasarım	1516	    2,963	0.0073	1335.75	tur_news_2005_00746431
8281	Uzun mu kısa mı çıkacak o zaman belli olacak.	Y	çıkacak	1517	    2,962	0.0073	336.6667	tur_news_2018_00924985
8282	Bundan 20 sene önce Amerika’da yaşayan bir arkadaşım, Türkiye’ye geldiğinde bana 'İnternet, diye bir şey çıkacak' dedi.	Y	çıkacak	1517	    2,962	0.0073	624.7059	tur_news_2018_00231401
8283	İşte o zaman asıl sürpriz ortaya çıkacak.	Y	çıkacak	1517	    2,962	0.0073	763.1429	tur_news_2005_00546450
8284	Bir de böyle hesap yapın bakalım, ne çıkacak?	Y	çıkacak	1517	    2,962	0.0073	913.5	tur_news_2018_00147543
8285	Aynı şekilde çıkacak kültür değerleri, değerli eşya ve sanat eserleri Devlete aittir.	Y	çıkacak	1517	    2,962	0.0073	1253.6667	tur_news_2005_00647317
8286	Erken seçim AKP’nin seçimi değil, Erdoğan’ın seçimi olur.	Y	seçimi	1517	    2,962	0.0073	384.4444	tur_news_2018_00396597
8287	Küçük yaşta meslek seçimi ise daha yanlış bir şey.	Y	seçimi	1517	    2,962	0.0073	641.7778	tur_news_2014_00638912
8288	Avrupa Bölge Yönetim Kurulu asil ve yedek üye seçimi yapıldı.	Y	seçimi	1517	    2,962	0.0073	840	tur_news_2005_00828247
8289	Yönetim kurulu, onur kurulu, denetim kurulu üyelerinin seçimi.	Y	seçimi	1517	    2,962	0.0073	1114.3333	tur_news_2005_00067545
8290	Buna rağmen iklim koşulları bu seçimi etkiler.	Y	seçimi	1517	    2,962	0.0073	1322.5714	tur_news_2005_00576547
8291	O haklı, bu haklı, “e sen da haklı”…	Y	haklı	1518	    2,960	0.0073	351.6667	tur_news_2018_00697885
8292	Ne kadar haklı olduğumuz o zaman ortaya çıkmış olacak…	Y	haklı	1518	    2,960	0.0073	603.7778	tur_news_2014_00697308
8293	Burada haklı ve yerinde tek bir itiraz yapılabilir.	Y	haklı	1518	    2,960	0.0073	752.125	tur_news_2018_00255437
8294	Bu yüzden bu talep haklı olmakla birlikte gerçekçi değil.	Y	haklı	1518	    2,960	0.0073	954	tur_news_2014_00313862
8295	Kaç tane haklı haksız, kaç tane haksız haklı olmuş?	Y	haklı	1518	    2,960	0.0073	1289	tur_news_2018_00564688
8296	Elbette küçük ekranda tüm işlemleri yapmak mümkün değil.	Y	işlemleri	1519	    2,955	0.0073	732.5	tur_news_2018_00382341
8297	Yeniden üye olmak isteyenler için ilk kez üye olma işlemleri aynen uygulanır.	Y	işlemleri	1519	    2,955	0.0073	910.1818	tur_news_2005_00577684
8298	Liste ile ilgili işlemleri buradan da yapabilirsiniz.	Y	işlemleri	1519	    2,955	0.0073	1029.2857	tur_news_2005_00488159
8299	Şu anda Yunanistan’da ihracat gümrük işlemleri aşağı yukarı 20 gün sürüyor.	Y	işlemleri	1519	    2,955	0.0073	1090.9091	tur_news_2014_00857079
8300	6- Sürücü belgesi ve Araç tescil işlemleri için gerekli bilgi ve belgeler nelerdir.?	Y	işlemleri	1519	    2,955	0.0073	1226.3636	tur_news_2005_00222062
8301	Daha sonra olay yerine çok sayıda polis ekipleri sevk edildi.	Y	sevk	1519	    2,955	0.0073	501.1	tur_news_2014_00356063
8302	Olay yerine polis ve 112 Acil Servis ekipleri sevk edildi.	Y	sevk	1519	    2,955	0.0073	705.3333	tur_news_2018_00703129
8303	ALANYA’DA özel bir hastanede dünyaya gelen kız bebek, şeker eksikliği nedeniyle Devlet Hastanesi’ne sevk edilerek tedavi altına alındı.	Y	sevk	1519	    2,955	0.0073	899.7	tur_news_2014_00057069
8304	Bunun üzerine, önce Bursa Devlet Hastanesi Kulak Burun ve Boğaz ile Plastik Cerrahi Servisi’ne sevk edildi.	Y	sevk	1519	    2,955	0.0073	969.0588	tur_news_2018_00249032
8305	de Sevk ve İdare Sorumlusu olarak görev yapmaktadır.	Y	sevk	1519	    2,955	0.0073	1202.75	tur_news_2005_00958110
8306	Gazi Üniversitesi Kadın Sorunları Araştırma Merkezi, Ankara, 1998.	Y	gazi	1520	    2,954	0.0073	549.5714	tur_news_2005_00096725
8307	Ankara Gazi Eğitim Enstitüsü Resim-İş Bölümü’nden 1948 yılında mezun oldu.	Y	gazi	1520	    2,954	0.0073	715.3636	tur_news_2005_00947435
8308	Gazi Eğitim Enstitüsü Resim Bölümü’ne girdi.	Y	gazi	1520	    2,954	0.0073	847.7143	tur_news_2005_00453833
8309	Yusuf, İstanbul Üniversitesi’ne, İlhan ise Gazi Üniversitesi’ne gitti.	Y	gazi	1520	    2,954	0.0073	939	tur_news_2018_00988075
8310	Sahibi Gazi Üniversitesi Rektörü Prof. Dr. Rıza AYHAN Yazı İşleri Müdürü Doç.	Y	gazi	1520	    2,954	0.0073	1236.3333	tur_news_2005_00773404
8311	Bu ödül tam da zamanında tam da 12’den çok iyi geldi.	Y	zamanında	1521	    2,952	0.0073	407.8889	tur_news_2018_00251315
8312	Her ne kadar kendisi “seçimler zamanında yapılacak.	Y	zamanında	1521	    2,952	0.0073	704.7143	tur_news_2018_00499447
8313	Dolayısıyla, Atatürk döneminde ne varsa, İnönü zamanında aynen devam ediyor.	Y	zamanında	1521	    2,952	0.0073	801.3	tur_news_2014_00386441
8314	Bizden evvel ki iktidar, yani askeri idare zamanında bu seçim kanunu yapılmış.	Y	zamanında	1521	    2,952	0.0073	1000.9167	tur_news_2005_00474080
8315	Ne, “Biz de zamanında oradan geldik” falan.	Y	zamanında	1521	    2,952	0.0073	1151.1429	tur_news_2018_00676863
8316	Her gün bir kaza, her gün bir olay.	Y	kaza	1522	    2,950	0.0072	433.6	tur_news_2014_00518327
8317	Kaza ile ilgili soruşturma ve inceleme devam ediyor.	Y	kaza	1522	    2,950	0.0072	649.75	tur_news_2018_00583946
8318	Kaza, Malatya merkez Eski Hal Binası’nın yanında meydana geldi.	Y	kaza	1522	    2,950	0.0072	777	tur_news_2018_00584053
8319	Dünyada her geçen dakikada bir kaza yaşanıyor.	Y	kaza	1522	    2,950	0.0072	914.1429	tur_news_2014_00393230
8320	Edinilen bilgilere göre, kaza sabah saatlerinde meydana geldi.	Y	kaza	1522	    2,950	0.0072	1203.25	tur_news_2018_00371060
8321	Bu uygulama belli bir tesis ve bölge için olabileceği gibi, bütün ülke için de olabilir.	Y	tesis	1522	    2,950	0.0072	424.7857	tur_news_2005_00040631
8322	Sadece mahalle bazında değil bölge bazında çok önemli bir sosyal tesis oldu.	Y	tesis	1522	    2,950	0.0072	592.5455	tur_news_2018_00778148
8323	71. AT-Türkiye Gümrük Birliği ne zaman tesis edilmiştir?	Y	tesis	1522	    2,950	0.0072	834.25	tur_news_2014_00029143
8324	Tahsis edilen tesis varsa tahsis izin belgesi.	Y	tesis	1522	    2,950	0.0072	1031.3333	tur_news_2005_00034122
8325	Tesis izni verildiği tarihten itibaren üç yıl için geçerlidir.	Y	tesis	1522	    2,950	0.0072	1312.3333	tur_news_2005_00058243
8326	Kemal Kılıçdaroğlu, bir dizi ziyaret için Ankara’dan İstanbul’a geldi.	Y	dizi	1523	    2,948	0.0072	397.2727	tur_news_2014_00607359
8327	Çünkü artık Türkiye’deki dizi kalitesi gerçekten yüksek.	Y	dizi	1523	    2,948	0.0072	617	tur_news_2014_00343466
8328	Hafta sonu bu konuyla ilgili bir dizi eylem düzenlendi.	Y	dizi	1523	    2,948	0.0072	867.5556	tur_news_2018_00466261
8329	AK Parti Kahramanmaraş Milletvekili aday adayı Mutlu Kaya, Elbistan’da bir dizi ziyaret gerçekleştirdi.	Y	dizi	1523	    2,948	0.0072	950.7857	tur_news_2018_00020100
8330	Bunun üzerine bir dizi ameliyat geçiren Erol, 2 ay hastanede tedavi gördü.	Y	dizi	1523	    2,948	0.0072	1235.0909	tur_news_2014_00280287
8331	Ancak burada bir tane bile doktor yok.	Y	doktor	1523	    2,948	0.0072	407.8571	tur_news_2018_00052006
8332	Elbistan Devlet Hastanesi var ama doktor yok.	Y	doktor	1523	    2,948	0.0072	621.5714	tur_news_2018_00382892
8333	Doktor Uğur Yakın, daha sonra özel bir hastaneye sevk edildi.	Y	doktor	1523	    2,948	0.0072	783.2	tur_news_2014_00385621
8334	Bir aralık sağlık memuru, Osman’a -Doktor bey.	Y	doktor	1523	    2,948	0.0072	851.125	tur_news_2005_00869926
8335	Fen Bilimleri Enstitüsü Doktor a -1992 İ.Ü.	Y	doktor	1523	    2,948	0.0072	1301.4286	tur_news_2005_00092004
8336	Herhangi bir şiddet yoksa sorun yok dedi.	Y	şiddet	1523	    2,948	0.0072	433.8571	tur_news_2014_00519243
8337	Aile içi şiddet yüzde yüz bir neden olarak çıktı karşımıza.	Y	şiddet	1523	    2,948	0.0072	684.7	tur_news_2005_00200787
8338	Çünkü şiddet zaten binlerce insanın hayatına mal oldu.”	Y	şiddet	1523	    2,948	0.0072	868	tur_news_2018_00322280
8339	Yolda, Kemal’e şiddet uygulamaya devam ettiler.	Y	şiddet	1523	    2,948	0.0072	945.2857	tur_news_2014_00985036
8340	Bu nedenle şiddet gören kadınlara danışmanlık hizmeti veriliyor.	Y	şiddet	1523	    2,948	0.0072	1382.875	tur_news_2018_00235166
8341	Bugün silahlı bir işgal söz konusu değil.	Y	silahlı	1524	    2,945	0.0072	567.7143	tur_news_2018_00213171
8342	İşte Mesut Yılmaz’ın geçen hafta Türk Silahlı Kuvvetleri’ne karşı açtığı kampanya tam da bu noktada başlıyor.	Y	silahlı	1524	    2,945	0.0072	851.7222	tur_news_2005_00949397
8343	Biri Emniyet Genel Müdürlüğü, 8’i Türk Silahlı Kuvvetleri (TSK) personeli.	Y	silahlı	1524	    2,945	0.0072	989.6	tur_news_2014_00191019
8344	Ankara ve Türk silahlı kuvvetleri kararlı bir tutum içinde.	Y	silahlı	1524	    2,945	0.0072	1017	tur_news_2014_00095817
8345	O zamanlar Azerbaycan’ın silahlı kuvvetleri şimdiki gibi değildi.	Y	silahlı	1524	    2,945	0.0072	1286.6667	tur_news_2018_00739022
8346	Aksi de her zaman tartışma konusu olur.	Y	aksi	1525	    2,943	0.0072	514.8571	tur_news_2018_00023102
8347	Burada sistem aksi gibi değil, aynen böyle çalışıyor.’	Y	aksi	1525	    2,943	0.0072	705.75	tur_news_2018_00257325
8348	Aksi halde Kýbrýs’ta çözüm hayal olur.	Y	aksi	1525	    2,943	0.0072	802.7143	tur_news_2018_00023269
8349	Aksi halde Türkiye 20 yıl geriye gider ifadesini kullandı.	Y	aksi	1525	    2,943	0.0072	1096.25	tur_news_2018_00023334
8350	Oysa bizde tam aksi bir davranış moda.	Y	aksi	1525	    2,943	0.0072	1238.8571	tur_news_2018_00734708
8351	Belli ki bu “bazıları” beş çocuk sahibi değil.	Y	bazıları	1525	    2,943	0.0072	382.25	tur_news_2018_00124530
8352	Bazıları Çanakkale’de o kadar çok Kürt yoktu diyor.	Y	bazıları	1525	    2,943	0.0072	639.2222	tur_news_2014_00158996
8353	Bazıları çıkıyor diyor ki AB noktasında ne oldu?	Y	bazıları	1525	    2,943	0.0072	701	tur_news_2018_00116865
8354	Oysa maalesef bazıları bu kadar şansı değil!	Y	bazıları	1525	    2,943	0.0072	827.8571	tur_news_2005_00163312
8355	Bazıları için yazın fotoğraf çekmek zordur, çünkü ışık çok dik gelir.	Y	bazıları	1525	    2,943	0.0072	1170.1667	tur_news_2005_00068333
8356	Un var, şeker var ama kötü bir usta var.	Y	şeker	1525	    2,943	0.0072	593.4286	tur_news_2018_00918775
8357	Aslında, şeker sektöründe yanlış bir yapı vardı.	Y	şeker	1525	    2,943	0.0072	723.2857	tur_news_2018_00077548
8358	Şeker hastalığı ile ilgili son yıllarda büyük gelişmeler yaşanıyor.	Y	şeker	1525	    2,943	0.0072	896.2222	tur_news_2014_00811980
8359	Bu şehirde un var, yağ var, şeker var.	Y	şeker	1525	    2,943	0.0072	955.8333	tur_news_2018_00263431
8360	Sanırım önümüzdeki yıllarda şeker hastalığı oldukça moda olacak.	Y	şeker	1525	    2,943	0.0072	1214.25	tur_news_2005_00496451
8361	Bu da şunu gösteriyor; 12 Eylül hala devam ediyor.	Y	şunu	1526	    2,941	0.0072	505.125	tur_news_2014_00234427
8362	Ama şunu biliyoruz ki, hayatta çok daha önemli şeyler var.	Y	şunu	1526	    2,941	0.0072	590	tur_news_2018_00043969
8363	Bir kere şunu herkesin kabul etmesi gerekiyor.	Y	şunu	1526	    2,941	0.0072	736.1429	tur_news_2005_00491301
8364	!son olarak da sana şunu söylemek isterim.	Y	şunu	1526	    2,941	0.0072	956.4286	tur_news_2014_00841572
8365	33 yıldan beri şunu söylüyorum: Dünyada değil futbolcu, vazgeçilmez insan bile yoktur!	Y	şunu	1526	    2,941	0.0072	1145.9091	tur_news_2014_00022787
8366	Meclis üyeleri çalışmaya destek vererek, madde oy birliği ile kabul edildi.	Y	vererek	1526	    2,941	0.0072	548.3636	tur_news_2018_00646814
8367	Bunu da hep beraber el ele vererek yapacağız” şeklinde konuştu.	Y	vererek	1526	    2,941	0.0072	575.8	tur_news_2018_00242214
8368	“İnsanlar buraya son dakika karar vererek geldi.	Y	vererek	1526	    2,941	0.0072	799	tur_news_2018_00537479
8369	Mustafa Ramazan projeleri hakkında bilgiler vererek, destek istedi.	Y	vererek	1526	    2,941	0.0072	876	tur_news_2014_00689900
8370	 şeklinde çok daha sağlıklı bir tepki vererek işin içinden yara almadan çıkmış olurdu.	Y	vererek	1526	    2,941	0.0072	1237.9231	tur_news_2014_00812273
8371	Ama hiçbir şey hayal edildiği kadar kolay ve duygusal değildir.	Y	edildiği	1527	    2,940	0.0072	613.2	tur_news_2014_00072589
8372	Madde 2 Bu karar kabul edildiği tarihten bir ay sonra yürürlüğe girer.	Y	edildiği	1527	    2,940	0.0072	699.5455	tur_news_2005_00943262
8373	Şimşek, sevk edildiği Ankara Eğitim ve Araştırma Hastanesi’nde önceki gün öldü.	Y	edildiği	1527	    2,940	0.0072	824.75	tur_news_2014_00827592
8374	Bunlardan birisi, Kur’an-ı Kerim’de ifade edildiği gibi, Ramazan’ ın Kur’an ayı olmasıdır.	Y	edildiği	1527	    2,940	0.0072	854.3571	tur_news_2018_00236868
8375	Bugün Adnan Menderes’in idam edildiği tarih.	Y	edildiği	1527	    2,940	0.0072	1390.1429	tur_news_2018_00208458
8376	Bu sistemin daha uygun olduğunu düşünüyorum” dedi.	Y	sistemin	1528	    2,938	0.0072	407.4286	tur_news_2018_00265466
8377	Dünyada bu sistemin başka bir örneği var mı?	Y	sistemin	1528	    2,938	0.0072	544.375	tur_news_2005_00050886
