ORDER	SENTENCE	STATUS	WORD	RANK	COUNT	COUNT_REL	INDEX	ID
9001	Şu anda oran yüzde yarım gibi bir şey.	Y	yarım	1623	    2,754	0.0068	568.5	tur_news_2014_00856839
9002	Körfez’de yarım yok, ağır yol gider.	Y	yarım	1623	    2,754	0.0068	846.2857	tur_news_2018_00614281
9003	Haftada sadece yarım saat sıcak su veriliyor.	Y	yarım	1623	    2,754	0.0068	999.4286	tur_news_2005_00297527
9004	Aradan yarım yüzyıl kadar bir zaman geçti.	Y	yarım	1623	    2,754	0.0068	1063	tur_news_2005_00364413
9005	Tam bilet, yarım bilet, çeyrek bilet fiyatı ne kadar?	Y	yarım	1623	    2,754	0.0068	1376.7143	tur_news_2018_00860456
9006	Önceki yapılan çalışmaları da dikkate almak suretiyle bir çalışma yapılıyor.	Y	suretiyle	1624	    2,750	0.0068	564.6	tur_news_2018_00707900
9007	Bizler AK Parti olarak insanı esas almak suretiyle hizmete devam ediyoruz.	Y	suretiyle	1624	    2,750	0.0068	747.4545	tur_news_2018_00174024
9008	Almanya şu ana kadar kendi iç siyasi çekişmelerini sürekli olarak Türkiye ile ve diğer bazı AB ülkelerini de yanına almak suretiyle bu sürece taşımıştır.	Y	suretiyle	1624	    2,750	0.0068	801.75	tur_news_2018_00031136
9009	Ekonomi kavram olarak ise şu şekilde açıklanmaktadır: “Belli bir işi mümkün olduğu kadar az para, emek, mal, zaman harcamak suretiyle, mümkün olan en yüksek sonucu elde etmek anlamında kullanılır.”	Y	suretiyle	1624	    2,750	0.0068	804.0357	tur_news_2018_00379465
9010	Kendisine 20 milyon dolar vermek suretiyle destek oldum.	Y	suretiyle	1624	    2,750	0.0068	826.5714	tur_news_2018_00589025
9011	Olan biten her şey bir dakikada oldu diye konuştu.	Y	dakikada	1625	    2,748	0.0068	590	tur_news_2014_00718256
9012	İlk 45 dakikada çok fazla pozisyon da yok.	Y	dakikada	1625	    2,748	0.0068	727.7143	tur_news_2018_00526362
9013	İlk 20 dakikada iki takım da çok fazla etkili olamadı.	Y	dakikada	1625	    2,748	0.0068	741.1111	tur_news_2018_00526317
9014	Bu gol zamanlama olarak aslında çok iyi dakikada geldi.	Y	dakikada	1625	    2,748	0.0068	781	tur_news_2014_00242538
9015	Birkaç dakikada da “Galatasaray üzerine” sohbet ettik.	Y	dakikada	1625	    2,748	0.0068	824.2857	tur_news_2018_00153955
9016	Türkiye’de de bu konuda bir konferans yapıldı.	Y	konferans	1626	    2,747	0.0067	352	tur_news_2014_00905290
9017	Elbistan Belediyesi Kent Konseyi tarafından düzenlenen, 1. Kültür Eğitim ve Kitap Fuarı’nda, öğrencilere yönelik özel bir konferans düzenlendi.	Y	konferans	1626	    2,747	0.0067	736.5556	tur_news_2014_00410330
9018	Ancak, talep edilmesi halinde, tepe yönetim için özel ve 1 gün süreli konferans/seminer yapılmaktadır.	Y	konferans	1626	    2,747	0.0067	928.7857	tur_news_2005_00972275
9019	Hastanede 200 kişilik bir konferans salonu da bulunuyor.	Y	konferans	1626	    2,747	0.0067	1040.7143	tur_news_2005_00516355
9020	Gönüllü ise vereceği konferans ve ziyareti için Prof.	Y	konferans	1626	    2,747	0.0067	1204.125	tur_news_2014_00478854
9021	Onun da kısa bir süre içinde Türkiye’ye gelmesi bekleniyor.	Y	gelmesi	1627	    2,746	0.0067	405.4	tur_news_2014_00732029
9022	O yüzden buraya gelmesi beni çok mutlu etti.	Y	gelmesi	1627	    2,746	0.0067	555	tur_news_2018_00737567
9023	Büyük firmaların Malatya’ya gelmesi Malatya’nın geleceği içinde önemli.	Y	gelmesi	1627	    2,746	0.0067	748.5556	tur_news_2018_00280613
9024	Bu güne denk gelmesi çok iyi oldu.	Y	gelmesi	1627	    2,746	0.0067	825.4286	tur_news_2014_00244520
9025	Tarımsal Danışmanlık sistemi tekrar gündeme gelmesi gerekmektedir.	Y	gelmesi	1627	    2,746	0.0067	1250.1429	tur_news_2018_00864080
9026	Ve bu iki sorun da birbirinden bağımsız değildir.	Y	birbirinden	1628	    2,745	0.0067	433.125	tur_news_2014_00939275
9027	Bu iki proje, iki farklı güç tarafından birbirinden destek alarak hayata geçirildi.	Y	birbirinden	1628	    2,745	0.0067	679.7273	tur_news_2014_00250876
9028	Birbirinden ayrı gibi görünen bütün bu şiddet haberleri arasında bir ilişki var.	Y	birbirinden	1628	    2,745	0.0067	750.5833	tur_news_2014_00185290
9029	Çözüm olacak ama insanlar birbirinden nefret edecek.	Y	birbirinden	1628	    2,745	0.0067	849.4286	tur_news_2018_00310670
9030	Ticari hayatı boyunca birbirinden farklı birçok projeyi tamamladı.	Y	birbirinden	1628	    2,745	0.0067	1178.75	tur_news_2005_00829939
9031	Bunun için ayrıca bir program uygulamaya da gerek yoktur.	Y	uygulamaya	1628	    2,745	0.0067	342.2222	tur_news_2018_00245279
9032	Uygulamaya tepki gösteren hayvan sahipleri ise, 'Herkesin Türkiye’nin her yerinde satış hakkı olması lazım.'	Y	uygulamaya	1628	    2,745	0.0067	706.9333	tur_news_2014_00931545
9033	Programı KKTC hükümeti kabul ederek Temmuz ayında açıkladı ve uygulamaya koydu.	Y	uygulamaya	1628	    2,745	0.0067	832	tur_news_2005_00495560
9034	Milletvekilleri de buna benzer bir uygulamaya maruz kalıyor.	Y	uygulamaya	1628	    2,745	0.0067	1056.25	tur_news_2018_00660424
9035	Artık sistemler tüm Çelebi Hava Servisi’nde uygulamaya geçiyor.	Y	uygulamaya	1628	    2,745	0.0067	1322.1111	tur_news_2005_00271593
9036	“Bu okul 13 yıldır eğitim ve öğretim vermektedir.	Y	vermektedir	1629	    2,744	0.0067	461.5714	tur_news_2018_00251429
9037	Bize bu konuda tüm siyasi partiler destek vermektedir.	Y	vermektedir	1629	    2,744	0.0067	599.25	tur_news_2014_00204851
9038	Makedonya üzerinde hak iddia eden Yunanistan ve Bulgaristan, Makedonya’ya tam destek vermektedir.	Y	vermektedir	1629	    2,744	0.0067	802.75	tur_news_2018_00638728
9039	Kadir Has Üniversitesi’nde de ders vermektedir.	Y	vermektedir	1629	    2,744	0.0067	1057.7143	tur_news_2014_00588891
9040	Üniversite ayrıca bir kısım öğrenciye ücretsiz yemek vermektedir.	Y	vermektedir	1629	    2,744	0.0067	1223.75	tur_news_2005_00381816
9041	Yani ailenin hem iş hem de özel amaçlı tek aracı oluyor.	Y	amaçlı	1630	    2,743	0.0067	591.1	tur_news_2014_00954380
9042	Yani çok amaçlı, çok faydalı bir proje.	Y	amaçlı	1630	    2,743	0.0067	677.3333	tur_news_2018_00946886
9043	Dört tip lise bulunmaktadır: Genel, Çok Amaçlı, Mesleki ve Teknik, Klasik.	Y	amaçlı	1630	    2,743	0.0067	839.1818	tur_news_2005_00958788
9044	Fakat bu bir yarış amaçlı değil, bir rekabet amaçlı değil.	Y	amaçlı	1630	    2,743	0.0067	892.1429	tur_news_2018_00412341
9045	Haber, hava durumu gibi bilgilendirme ve reklam amaçlı kullanılır.	Y	amaçlı	1630	    2,743	0.0067	979.3333	tur_news_2014_00491026
9046	Bir şehit ailesi olarak çok mu şey istiyoruz?'	Y	ailesi	1631	    2,741	0.0067	512.5	tur_news_2014_00197339
9047	Hem ailesi, hem Konya, hem de Türkiye için büyük gurur kaynağı.	Y	ailesi	1631	    2,741	0.0067	676.1111	tur_news_2018_00487640
9048	Bu hepimiz için önemli, Yozgat ailesi için önemli sorunlar dedi.	Y	ailesi	1631	    2,741	0.0067	926.125	tur_news_2018_00215957
9049	Ama bu yaşta olması ailesi için sorun teşkil etmiyor.	Y	ailesi	1631	    2,741	0.0067	1083.5556	tur_news_2014_00069796
9050	Ailesi 1978 yılında Japonya’dan Brezilya’ya göç etmiştir.	Y	ailesi	1631	    2,741	0.0067	1179.75	tur_news_2014_00048804
9051	Sayın Başkan ve Yönetim Kurulu Üyelerinin eskiden beri çalışmaları var.	Y	eskiden	1631	    2,741	0.0067	540.7	tur_news_2018_00793182
9052	Bir yasal hak olan avukat görüşü eskiden olduğu gibi devam edecek.	Y	eskiden	1631	    2,741	0.0067	779	tur_news_2014_00200359
9053	Bunu en iyi Sayın Davutoğlu eskiden Başbakanlık yapmış bir isim olarak iyi bilir.	Y	eskiden	1631	    2,741	0.0067	880.8333	tur_news_2018_00242624
9054	Eskiden devamlı su yoktu şimdi devamlı su var.	Y	eskiden	1631	    2,741	0.0067	952.5	tur_news_2018_00401764
9055	Bu sayede tarım eskiden beri rahatlıkla yapılmaktadır.	Y	eskiden	1631	    2,741	0.0067	1351.1429	tur_news_2014_00292945
9056	Şu anda Türkiye AB sürecinde tam olarak nerede?	Y	sürecinde	1631	    2,741	0.0067	483.375	tur_news_2014_00856970
9057	Çözüm sürecinde son duruma ilişkin soru üzerine Yılmaz, Çözüm süreci ekonomik açıdan da kalkınma açısından da mutlaka değerlendirilmesi gereken bir süreç olduğunu söyledi.	Y	sürecinde	1631	    2,741	0.0067	684.0952	tur_news_2018_00310756
9058	Çözüm sürecinde PKK’ya demek suç haline gelmişti.	Y	sürecinde	1631	    2,741	0.0067	962.875	tur_news_2018_00310755
9059	Bütün dünya çok yönlü bir çatışma sürecinde.	Y	sürecinde	1631	    2,741	0.0067	1056.2857	tur_news_2018_00271734
9060	Soru: Yeni anayasa hazırlanması sürecinde neler yaşandı?	Y	sürecinde	1631	    2,741	0.0067	1259.4286	tur_news_2018_00837867
9061	Son olarak Bolu için şunları söylemek istiyorum.	Y	şunları	1632	    2,738	0.0067	682.8571	tur_news_2018_00830169
9062	Onlara cevap olarak da şunları söylemek istiyorum.	Y	şunları	1632	    2,738	0.0067	757.5714	tur_news_2018_00711542
9063	Yıldırım şunları dedi: “Kocaeli’de eğitime çok önem verdik.	Y	şunları	1632	    2,738	0.0067	912.5556	tur_news_2018_00972521
9064	Şunları söylüyor: Son on yıldır yapılar daha sağlam.	Y	şunları	1632	    2,738	0.0067	1061	tur_news_2014_00859702
9065	İlhan, şunları söyledi: “Ülkemizde yılda 200 milyon ton atık ortaya çıktığı tahmin ediliyor.	Y	şunları	1632	    2,738	0.0067	1130.5	tur_news_2018_00525597
9066	2 Şubat’ta Kriz var alternatif yok mu?	Y	alternatif	1633	    2,737	0.0067	632.4286	tur_news_2014_00021749
9067	Haziran’da herkesin rahat bir nefes alması için tek alternatif CHP.	Y	alternatif	1633	    2,737	0.0067	687.0909	tur_news_2014_00510327
9068	Türkiye, CHP’yi ya da MHP’yi iktidara alternatif olarak düşünüyor mu?	Y	alternatif	1633	    2,737	0.0067	745.9091	tur_news_2018_00892994
9069	Mutlaka şehir içinde “Doğu-Batı” yönlü trafik için bir alternatif geliştirmek lazım.	Y	alternatif	1633	    2,737	0.0067	921.3333	tur_news_2018_00672810
9070	Boğaziçi Üniversitesi 1995’te alternatif bir bağlantı sağladı.	Y	alternatif	1633	    2,737	0.0067	1313.1429	tur_news_2005_00719805
9071	Halk ekmek benim için en önemli proje diye konuştu.	Y	ekmek	1634	    2,735	0.0067	314.2222	tur_news_2018_00471009
9072	Günde en az 10 ekmek alan, almak zorunda olan aileler var.	Y	ekmek	1634	    2,735	0.0067	671.1	tur_news_2018_00457981
9073	Ekmek ve su gibi hayati oldu kitaplar bizim için.	Y	ekmek	1634	    2,735	0.0067	774.6667	tur_news_2018_00379037
9074	Bakın artık ekmek silah, su silah, gıda silah, ilaç silah olabilir.	Y	ekmek	1634	    2,735	0.0067	930.25	tur_news_2018_00099435
9075	Cevap olarak “İşte ekmek parası ne yapalım” demişti.	Y	ekmek	1634	    2,735	0.0067	1371.75	tur_news_2018_00294177
9076	Ama sadece bu kadar da değil: Vatandaş da işin içinde.	Y	vatandaş	1635	    2,732	0.0067	319	tur_news_2018_00042954
9077	Kendisi 1993 yılında Bulgaristan’dan Türkiye’ye gelmiş ve Türkiye’de kalmış, daha sonra da Türkiye Cumhuriyeti kimliği almış bir vatandaş.	Y	vatandaş	1635	    2,732	0.0067	714.7778	tur_news_2014_00610026
9078	Öztürk’ün ardından birçok vatandaş da konuyla ilgili dava açtı.	Y	vatandaş	1635	    2,732	0.0067	888.5	tur_news_2018_00745804
9079	Halil Hasar, Fırat Üniversitesi yöneticileri, öğretim üyeleri, öğrenciler ve çok sayıda vatandaş katıldı.	Y	vatandaş	1635	    2,732	0.0067	1067.6154	tur_news_2018_00470266
9080	Ancak yüksel altın fiyatları nedeniyle vatandaş çeyrek ya da gram altın alıyor.	Y	vatandaş	1635	    2,732	0.0067	1286.7273	tur_news_2018_00058629
9081	Tamamen bir ekip işi bu, gönül işi yani.	Y	gönül	1636	    2,730	0.0067	608.4286	tur_news_2005_00781079
9082	Bunların arasında Gönül’ün fotoğrafı da var.	Y	gönül	1636	    2,730	0.0067	752.1429	tur_news_2014_00271161
9083	Bu arada Gökhan Gönül için iyi haberler geliyor.	Y	gönül	1636	    2,730	0.0067	887.25	tur_news_2014_00226070
9084	Yani hem akıl tatmin oldu hem de gönül.	Y	gönül	1636	    2,730	0.0067	932.1429	tur_news_2014_00956075
9085	Buna bir Türk vatandaşı olarak hepimizin gönül vermesi gerektiğine inanıyorum.	Y	gönül	1636	    2,730	0.0067	1315.3	tur_news_2005_00552618
9086	Çünkü Türkiye’nin başka çıkış yolu yoktur.	Y	çıkış	1637	    2,728	0.0067	376.7143	tur_news_2005_00659398
9087	Bu yüzden Türkiye’nin tek çıkış yolu Bağımsız Türkiye Partisi’dir.	Y	çıkış	1637	    2,728	0.0067	532.9	tur_news_2018_00283807
9088	Farklı bir biçimde olsa da, onlara çıkış yolunu sunuyor.	Y	çıkış	1637	    2,728	0.0067	838.8889	tur_news_2014_00441412
9089	Aile ve Sosyal Politikalar Bakanı Fatma Şahin’den Doğal çıkış!	Y	çıkış	1637	    2,728	0.0067	993.1	tur_news_2014_00049053
9090	Mahmut Kaya: Borsa’da çıkış başladı mı?	Y	çıkış	1637	    2,728	0.0067	1237.8571	tur_news_2005_00337613
9091	Tarih boyunca plan ve projesi bu olmuştur.	Y	plan	1638	    2,727	0.0067	532.1429	tur_news_2018_00862637
9092	Yoksa plan program konusunda biraz daha rahat olduğunuz bir dönem mi?	Y	plan	1638	    2,727	0.0067	662.8182	tur_news_2018_00980398
9093	Osmanlı, Almanya ile ittifak içinde olduğu için, İngiltere muhteşem bir plan yaptı.	Y	plan	1638	    2,727	0.0067	737.3333	tur_news_2018_00727829
9094	Sağlık varsa geleceğe ait plan, hayal vardır.	Y	plan	1638	    2,727	0.0067	904.7143	tur_news_2018_00781100
9095	Arka plan ve orta planda karakter oluyor.	Y	plan	1638	    2,727	0.0067	1298.8571	tur_news_2018_00070220
9096	Burada Bolu halkının bize çok büyük destek olması gerekiyor.	Y	halkının	1639	    2,726	0.0067	393.5556	tur_news_2018_00254730
9097	Bolu halkının da aynı düşünce de olduğuna inanıyorum.	Y	halkının	1639	    2,726	0.0067	804.5	tur_news_2018_00180621
9098	Yıldırım, ilk olarak Kıbrıs Türk halkının özgürlük mücadelesi lideri Dr.	Y	halkının	1639	    2,726	0.0067	856.9	tur_news_2018_00972397
9099	Bodrum halkının dayanışma ve birlik içerisinde olması gerekmektedir.	Y	halkının	1639	    2,726	0.0067	993	tur_news_2014_00212318
9100	Halkının geleceği için barış için çalışıyorlar” diyor.	Y	halkının	1639	    2,726	0.0067	1274	tur_news_2014_00498018
9101	İşte bu sorunun cevabı hemen aşağıda yazılı.	Y	aşağıda	1640	    2,725	0.0067	976.7143	tur_news_2014_00575073
9102	Yönetim Kurulu üyelerinin listesi aşağıda yer almaktadır.	Y	aşağıda	1640	    2,725	0.0067	1131.2857	tur_news_2005_00750060
9103	Bu çerçevede yapılan çalışmalara aşağıda ayrıntılı olarak yer verilmiştir.	Y	aşağıda	1640	    2,725	0.0067	1147.2222	tur_news_2005_00719812
9104	Enstitü’de halen devam etmekte olan projelerin bir listesi aşağıda verilmiştir.	Y	aşağıda	1640	    2,725	0.0067	1243.3636	tur_news_2005_00704648
9105	Çetin, Yukarıda bir değer var zeytin, aşağıda bir değer var maden.	Y	aşağıda	1640	    2,725	0.0067	1312.25	tur_news_2018_00293983
9106	Olay, önceki gün akşam saatlerinde meydana geldi.	Y	saatlerinde	1641	    2,724	0.0067	582.4286	tur_news_2014_00719574
9107	Bunların başında günün sıcak saatlerinde güneş altında uzun süre kalmak geliyor.	Y	saatlerinde	1641	    2,724	0.0067	831.6364	tur_news_2018_00238270
9108	Gece etkili olan kar yağışı nedeniyle bir süre ara verilen çalışmalara dün saatlerinde yeniden başlandı.	Y	saatlerinde	1641	    2,724	0.0067	860.2	tur_news_2018_00431505
9109	Bununla birlikte yukarıdaki uygulamalar çoğu zaman işletme saatlerinde bir azalma sağlamak için yeterli değildir.	Y	saatlerinde	1641	    2,724	0.0067	1022.2857	tur_news_2005_00080143
9110	Sürekli bir şekilde günün belli saatlerinde veya haftanın belli günlerinde gündem oluşturmak gerekiyor.	Y	saatlerinde	1641	    2,724	0.0067	1199.0833	tur_news_2014_00861160
9111	Türkiye, Avrupa’da en çok internet kullanan ülke olarak dikkat çekiyor.	Y	kullanan	1642	    2,723	0.0067	422	tur_news_2014_00903667
9112	Yolu ilk kez kullanan vatandaşlar da, Son derece düzgün bir yol yapıldı.	Y	kullanan	1642	    2,723	0.0067	599.3333	tur_news_2014_00985367
9113	Yeni Anayasa’nın verdiği hakkı kullanan ve kurucusu olduğu partisi AK Parti’ye dönen Recep Tayyip Erdoğan, bugün yeniden partisinin Genel Başkanı oluyor.	Y	kullanan	1642	    2,723	0.0067	676.3478	tur_news_2018_00963955
9114	Toplam oy kullanan seçmen sayısı ise 41 milyon.	Y	kullanan	1642	    2,723	0.0067	837.7143	tur_news_2014_00891506
9115	Uyuşturucu kullanan her insan intihar mı eder?	Y	kullanan	1642	    2,723	0.0067	984.7143	tur_news_2018_00923156
9116	Kim bilir, 2018 yılı sonunda bu borç durumu ne olacak?	Y	borç	1643	    2,721	0.0067	602.1111	tur_news_2018_00595585
9117	Ama daha çok Almanya ve Avrupa ülkeleri Yunanistan’a borç verdiler.	Y	borç	1643	    2,721	0.0067	698	tur_news_2018_00037931
9118	Ki bu borç ilişkisi 2008 yılına kadar devam etti.	Y	borç	1643	    2,721	0.0067	769.125	tur_news_2014_00614843
9119	Dünya Savaşı’ndan sonraki en büyük borç sorununu yaşıyor.	Y	borç	1643	    2,721	0.0067	950	tur_news_2014_00395447
9120	Hadi bakalım ALLAH’a kim borç verecek…?	Y	borç	1643	    2,721	0.0067	1215.4286	tur_news_2018_00465039
9121	Mayıs ayında en fazla ihracat yapılan ülke İran oldu.	Y	ihracat	1644	    2,719	0.0067	437.7778	tur_news_2014_00665483
9122	Üretim böyle iken peki ihracat ne durumda?	Y	ihracat	1644	    2,719	0.0067	612.5714	tur_news_2018_00919169
9123	Daha fazla üretim daha fazla yatırım ve daha fazla ihracat yapalım.	Y	ihracat	1644	    2,719	0.0067	817.2857	tur_news_2018_00325482
9124	Güçlü bir kadro ile ciddi ihracat gerçekleştirdi.	Y	ihracat	1644	    2,719	0.0067	973.7143	tur_news_2014_00484104
9125	Gelin o iki ülkeye de ihracat yapalım.	Y	ihracat	1644	    2,719	0.0067	1164	tur_news_2014_00465964
9126	Bu ödülü onun kadar hak eden yoktur…”	Y	ödülü	1644	    2,719	0.0067	385.4286	tur_news_2018_00251328
9127	Selçuk, dergi tarafından bu yıl 3. kez verilen ödülü bugüne kadar sahip en genç kadın oldu.	Y	ödülü	1644	    2,719	0.0067	533.4	tur_news_2014_00813040
9128	Uluslararası Başarı Ödülü Yurt dışındaki uygulamalar için her türlü bilgi teknolojisi çözümü ve hizmet.	Y	ödülü	1644	    2,719	0.0067	848.3571	tur_news_2005_00281359
9129	Ayrıca Bir kişiye de Onur ödülü verilecektir.	Y	ödülü	1644	    2,719	0.0067	1097.4286	tur_news_2014_00128121
9130	Malatya Uluslararası Film Festivali Onur Ödülü takdim edildi.	Y	ödülü	1644	    2,719	0.0067	1224.125	tur_news_2018_00640918
9131	CHP Kongresi bana göre çok güzel olmuştur.	Y	kongresi	1645	    2,718	0.0067	414.2857	tur_news_2014_00327866
9132	CHP İl Kongresi öncesi mevcut başkan ve başkan adayı Av.	Y	kongresi	1645	    2,718	0.0067	729.3333	tur_news_2014_00327646
9133	Geçen hafta muhteşem bir İl Gençlik Kolları Kongresi oldu.	Y	kongresi	1645	    2,718	0.0067	835	tur_news_2018_00432391
9134	Türk Akciğer Kanseri Derneği tarafından, bu yıl 5.si gerçekleşen Ulusal Akciğer Kanseri Kongresi’nin basın toplantısı Prof Dr.	Y	kongresi	1645	    2,718	0.0067	874.125	tur_news_2014_00901444
9135	AK Parti Bolu İl Gençlik Kolları 5. Olağan Kongresi yapıldı.	Y	kongresi	1645	    2,718	0.0067	1019.3333	tur_news_2018_00019035
9136	Dünya’da en çok Japonya, Türkiye ve İsrail’de görülür.	Y	görülür	1646	    2,717	0.0067	446.7	tur_news_2005_00499048
9137	Aynı özellik Anadolu’nun pek çok yerinde de görülür.	Y	görülür	1646	    2,717	0.0067	652.1111	tur_news_2005_00107408
9138	Geri planda biri yaşlı iki kadın görülür.	Y	görülür	1646	    2,717	0.0067	944	tur_news_2005_00603813
9139	O dönem doğan çocuklarda aynı isimler sık görülür.	Y	görülür	1646	    2,717	0.0067	1040.25	tur_news_2014_00710644
9140	Nüfusun yaklaşık üçte biri ile yarısı arasında görülür.	Y	görülür	1646	    2,717	0.0067	1274.375	tur_news_2018_00689084
9141	Erzurum da ne zaman açıldı bu okul.	Y	açıldı	1647	    2,715	0.0067	368	tur_news_2018_00398802
9142	Erzurum’da Türkiye’nin ikinci Çocuk Müzesi açıldı.	Y	açıldı	1647	    2,715	0.0067	601	tur_news_2014_00425603
9143	Daha sonra da sağlık ocağı hizmete açıldı.	Y	açıldı	1647	    2,715	0.0067	888.5714	tur_news_2005_00851109
9144	Yapılan dua sonrasında iftar hep birlikte açıldı.	Y	açıldı	1647	    2,715	0.0067	1096.5714	tur_news_2018_00952130
9145	Bu kapsamda merkezde çocuklar için temel bilgisayar kursu açıldı.	Y	açıldı	1647	    2,715	0.0067	1268	tur_news_2018_00220545
9146	İnternet de bu oyun için iyi bir ortam.	Y	i̇nternet	1648	    2,714	0.0067	531.25	tur_news_2005_00325913
9147	S. Peki İnternet Kurulu, İnternet Haftası ile ne yapmak istiyor?	Y	i̇nternet	1648	    2,714	0.0067	744	tur_news_2014_00852872
9148	· Kurul’un hemen gerçekleştirdiği en önemli olay İnternet Haftası oldu.	Y	i̇nternet	1648	    2,714	0.0067	897.7	tur_news_2005_00085491
9149	İnternet ve WEB’in kullanımı hakkında yararlı bilgiler içerir.	Y	i̇nternet	1648	    2,714	0.0067	1043.2222	tur_news_2005_00991572
9150	Ayrıca canlı İnternet radyo bağlantısı da bulunuyor.	Y	i̇nternet	1648	    2,714	0.0067	1206.5714	tur_news_2005_00422034
9151	1939’da ise Çanakkale milletvekili olarak TBMM 'de bulundu.	Y	çanakkale	1649	    2,712	0.0067	467.625	tur_news_2014_00006857
9152	İstanbul, Çanakkale ve Bursa’dan sonra Eskişehir’e geldi.	Y	çanakkale	1649	    2,712	0.0067	527	tur_news_2018_00548532
9153	Bu seçim bir Kurtuluş Savaşı, bir Çanakkale Savaşı kadar önemlidir.	Y	çanakkale	1649	    2,712	0.0067	761.625	tur_news_2014_00293801
9154	Cumhurbaşkanı Erdoğan, AK Parti grup toplantısında partisinin Çanakkale Belediye başkan adayı olarak Ayhan Gider ismini açıkladı.	Y	çanakkale	1649	    2,712	0.0067	1009.1875	tur_news_2018_00312447
9155	Eskişehir ve Çanakkale’de de bu okulları bekliyoruz.	Y	çanakkale	1649	    2,712	0.0067	1151.5714	tur_news_2018_00403113
9156	TRT Türk’te hafta içi her gün yayınlanan kültür ve sanat programı Bu Ülke, Türkiye’nin önemli best.	Y	yayınlanan	1649	    2,712	0.0067	609.1111	tur_news_2014_00897087
9157	Bu konuda son haber, İspanya’da yayınlanan AS Gazetesi’nde çıktı.	Y	yayınlanan	1649	    2,712	0.0067	757.3636	tur_news_2014_00257335
9158	TV’de yayınlanan bir de birkaç bölüm küçük bir rol ile başladım.	Y	yayınlanan	1649	    2,712	0.0067	797.2	tur_news_2018_00906382
9159	Eskiden olduğu gibi yine 2 ayda bir yayınlanan derginin yeni döneminde ilk sayısı “Anayasa Özel Sayısı” olarak hazırlanmış.	Y	yayınlanan	1649	    2,712	0.0067	805.0625	tur_news_2018_00401947
9160	Ankara’da yayınlanan Yeni Kervan Dergisi’nin de sahibi idi.	Y	yayınlanan	1649	    2,712	0.0067	817.6	tur_news_2005_00976041
9161	Ancak bu kez daha farklı bir maç bizi bekliyor olacak.	Y	bekliyor	1650	    2,709	0.0067	350.8	tur_news_2018_00051508
9162	Türkiye’yi yeni bir bölgesel kriz bekliyor olabilir mi?	Y	bekliyor	1650	    2,709	0.0067	592.4444	tur_news_2014_00913476
9163	Her iki takımı oldukça zorlu bir puan savaşı bekliyor.	Y	bekliyor	1650	    2,709	0.0067	780	tur_news_2014_00519942
9164	MHP alıcı kuş gibi AK Parti’nin başında bekliyor.	Y	bekliyor	1650	    2,709	0.0067	942.4444	tur_news_2014_00676530
9165	'Türkiye, AB’den terörle mücadelede somut işbirliği bekliyor'	Y	bekliyor	1650	    2,709	0.0067	1339.125	tur_news_2018_00892049
9166	İki partinin seçim programında Türkiye’ye yine ayrı bir yer verildi.	Y	partinin	1650	    2,709	0.0067	566.9091	tur_news_2018_00521006
9167	Bir siyasi partinin yeri elbette ki Meclis’tir..	Y	partinin	1650	    2,709	0.0067	726.875	tur_news_2014_00197779
9168	Partinin etki alanında olduğu halde yanlış veya eksik yaptığı işler.	Y	partinin	1650	    2,709	0.0067	799.6	tur_news_2018_00748984
9169	Bahçeli, Erdoğan’ın partinin başında kalması için dua ediyor.	Y	partinin	1650	    2,709	0.0067	1016.2222	tur_news_2014_00137695
9170	Bu yeni Partinin önümüzdeki ilk seçimlerde hedefleri nelerdir?	Y	partinin	1650	    2,709	0.0067	1233.75	tur_news_2005_00623789
9171	Parti içinde bu konuda yoğun bir tartışma var.	Y	tartışma	1651	    2,707	0.0067	324.5	tur_news_2018_00748557
9172	Bu sefer de Güven ile genç kadın arasında tartışma çıktı.	Y	tartışma	1651	    2,707	0.0067	569.2	tur_news_2014_00293973
9173	İyi bir tartışma ülke için faydalı da olur.	Y	tartışma	1651	    2,707	0.0067	644.625	tur_news_2014_00580313
9174	Üzerinde tartışma hiç eksik olmayacak bir konu.”	Y	tartışma	1651	    2,707	0.0067	827.4286	tur_news_2018_00923769
9175	Yine aynı tartışma, yine aşağı yukarı aynı sözler.	Y	tartışma	1651	    2,707	0.0067	1336.5	tur_news_2014_00980915
9176	Kurumsal sosyal sorumluluk, iş hayatı için iyi!	Y	kurumsal	1652	    2,706	0.0066	655.4286	tur_news_2005_00274100
9177	Son olarak söz alan Cumhurbaşkanlığı Kurumsal İletişim Başkanı Dr.	Y	kurumsal	1652	    2,706	0.0066	690.6667	tur_news_2018_00830531
9178	Bu noktada kurumsal iletişim ve eğitim devreye girer.	Y	kurumsal	1652	    2,706	0.0066	906.5	tur_news_2005_00767774
9179	A.Ş.'nin kurumsal baskı işleri tamamlandı.	Y	kurumsal	1652	    2,706	0.0066	1101.4286	tur_news_2014_00115254
9180	D-T Kurumsal Risk ve Bilgi Teknolojileri Danışmanlık Hizmetleri Tic.	Y	kurumsal	1652	    2,706	0.0066	1130.3	tur_news_2005_00833449
9181	Doğal olarak bu iki şekil de istenilen sonuç değildir.	Y	şekil	1653	    2,704	0.0066	585.6667	tur_news_2005_00944542
9182	Orta ve Doğu Avrupa ülkeleri ile ekonomik ilişkiler de yeni ve değişik bir şekil kazanmıştır.	Y	şekil	1653	    2,704	0.0066	779.6429	tur_news_2005_00628024
9183	İnsanın sahip olduğu medeniyet ne ise devlet de ona göre şekil alır.	Y	şekil	1653	    2,704	0.0066	799	tur_news_2014_00558692
9184	Teknoloji nin gelişmesiyle birlikte birçok sektörde iş olanakları çok daha rahat ve kolay bir şekil aldı.	Y	şekil	1653	    2,704	0.0066	851.6875	tur_news_2014_00881387
