ORDER	SENTENCE	STATUS	WORD	RANK	COUNT	COUNT_REL	INDEX	ID
8750	e) Yönetim Kurulu toplantı yeter sayısı 6 (altı) olup, kararlar katılan üyelerin çoğunluğu ile alınır.	Y	yeter	1584	    2,837	0.007	1045.7857	tur_news_2005_00364744
8751	Dün 'Başbakan’ın son katıldığı Milli Güvenlik Kurulu' dediler.	Y	katıldığı	1585	    2,836	0.007	579.2222	tur_news_2018_00361444
8752	Tayyip, katıldığı bir toplantıda ifade ettiği bir cümle ile kendisini tamamen ele vermiştir.	Y	katıldığı	1585	    2,836	0.007	957.3333	tur_news_2014_00877628
8753	Trabzon’da katıldığı bir programda konuşan Prof.	Y	katıldığı	1585	    2,836	0.007	998.2857	tur_news_2018_00883354
8754	Cumhurbaşkanı Recep Tayyip Erdoğan bugün katıldığı aday tanıtım toplantısında açıklamalarda bulundu.	Y	katıldığı	1585	    2,836	0.007	1054.7273	tur_news_2018_00313389
8755	Maliye Bakanı Serdar Denktaş, katıldığı bir televizyon programında gündeme ilişkin önemli açıklamalarda bulundu.	Y	katıldığı	1585	    2,836	0.007	1221.8462	tur_news_2018_00641490
8756	Eğitim ve Araştırma Hastanesi hizmete devam ediyor.	Y	hizmete	1586	    2,832	0.007	452.1429	tur_news_2014_00406381
8757	Bunlar olsun ki AK Parti’de hizmete devam etsin.	Y	hizmete	1586	    2,832	0.007	617.4444	tur_news_2018_00240132
8758	Web sitesi üzerinden bu yıl hizmete sunulan Canlı Destek Hattı da altı ayda yüzlerce vatandaş tarafından tercih edildi.	Y	hizmete	1586	    2,832	0.007	902.7222	tur_news_2018_00938988
8759	Salı ve Çarşamba günleri süren ücretsiz hizmete bugün son verildi.	Y	hizmete	1586	    2,832	0.007	1089.4	tur_news_2018_00784297
8760	Atatürk Orman Parkı’nda bulunan Çok Amaçlı Salon hizmete giriyor.	Y	hizmete	1586	    2,832	0.007	1267.4	tur_news_2018_00079574
8761	Burada yaklaşık bir dakika kadar ayakta duruyor.	Y	ayakta	1587	    2,831	0.007	734	tur_news_2014_00288787
8762	Bizi son 5 yıldır ayakta tutan da bu” ifadelerini kullandı.	Y	ayakta	1587	    2,831	0.007	770.8889	tur_news_2018_00173402
8763	Böyle bir düşünce tarzı takımı ne kadar ayakta tutar.	Y	ayakta	1587	    2,831	0.007	1002.8889	tur_news_2018_00183448
8764	Onun ayakta kalma başarısı kendine ait değil.	Y	ayakta	1587	    2,831	0.007	1114.4286	tur_news_2014_00731816
8765	Özel sektör varsa Türk ekonomisi ayakta kalır.	Y	ayakta	1587	    2,831	0.007	1152.5714	tur_news_2018_00744185
8766	Türkiye’ye bağlı biri olunca daha da zor geliyor.	Y	olunca	1587	    2,831	0.007	311.6667	tur_news_2018_00902646
8767	Bir þey çok olunca iyi mi oluyor demek?	Y	olunca	1587	    2,831	0.007	676.125	tur_news_2018_00162556
8768	Yasal olarak mümkün olunca Dernek merkezi Ankara veya Hacettepe Ü.	Y	olunca	1587	    2,831	0.007	780.4	tur_news_2005_00126500
8769	Fakat, böyle olunca da, genel durumu, olayların iç yüzünü ve gerçek şartları görüş ve anlayış bakımından.	Y	olunca	1587	    2,831	0.007	1052.2667	tur_news_2005_00775304
8770	Ama burun farkı olunca diğer tarafı da düşünmek lazım.	Y	olunca	1587	    2,831	0.007	1213.5556	tur_news_2014_00069530
8771	Geçtiğimiz ay kabul edilerek yürürlüğe giren 5302 sayılı İl Özel İdaresi Kanunu’nda yapılan değişiklik sonrası, İl Genel Meclisi üyelerinin oy birliği ile İl Genel Meclisi Başkanlığı’na seçilen Halit Yıldız çalışmalarına hızlı başladı.	Y	edilerek	1588	    2,829	0.0069	869.2414	tur_news_2014_00463224
8772	Ortadoğu’nun ne kadar hastalığı varsa transfer edilerek bir iç sorun haline getiriliyor.	Y	edilerek	1588	    2,829	0.0069	894.9231	tur_news_2018_00725465
8773	İyi veya kötü huylu olması ya da erken fark edilerek önlem alınması son derece önemlidir.	Y	edilerek	1588	    2,829	0.0069	917.3333	tur_news_2014_00581054
8774	Batı’dan devşirilen, olduğu gibi tercüme edilerek alınan birçok meselede olduğu gibi, yerel veya genel yönetim konusu da öyle.	Y	edilerek	1588	    2,829	0.0069	918.2353	tur_news_2018_00113089
8775	İzmit Belediyesi’ne soruyorum…-2003 yılında çok yararlı bir yasa TBMM’de kabul edilerek yürürlüğe girdi.	Y	edilerek	1588	    2,829	0.0069	921.6	tur_news_2014_00583541
8776	Daha sonra Atatürk’ün Evi ziyaret edildi.	Y	evi	1588	    2,829	0.0069	440.4286	tur_news_2005_00434667
8777	İkinci program ise İzmit Polis Evi’nde yapıldı.	Y	evi	1588	    2,829	0.0069	684.125	tur_news_2018_00520017
8778	Sağlık ocağı yoktur;fakat sağlık evi vardır.	Y	evi	1588	    2,829	0.0069	880	tur_news_2014_00794682
8779	Haftada bir gün veya yarım gün gönüllü olarak 'Umut Evi’nde çalışıyorlar.	Y	evi	1588	    2,829	0.0069	1066.1818	tur_news_2014_00492750
8780	Ankara Sergi Evi jüri çalışmaları için tahsis edildi.	Y	evi	1588	    2,829	0.0069	1231.25	tur_news_2005_00192777
8781	Galatasaray için zor bir hafta iyi bir şekilde geride kaldı.	Y	geride	1588	    2,829	0.0069	402.1111	tur_news_2014_00455469
8782	O da, ailesi de geride kaldı artık.	Y	geride	1588	    2,829	0.0069	575.4286	tur_news_2018_00691625
8783	Ama bu devir artık geride kaldı dedi.	Y	geride	1588	    2,829	0.0069	739.7143	tur_news_2014_00068581
8784	Hiç olmaması daha iyi olurdu ama, olanlar artık geride kaldı.	Y	geride	1588	    2,829	0.0069	753.3	tur_news_2018_00505940
8785	'Yunanistan’ın Euro Bölgesi’nden çıkma riski tamamen geride kaldı'	Y	geride	1588	    2,829	0.0069	1174.4	tur_news_2018_00986463
8786	O akşam o iki gazeteci eve geldi.	Y	eve	1589	    2,826	0.0069	706	tur_news_2018_00689925
8787	Eve bu nedenle en çok yumurta ve ekmek giriyor.	Y	eve	1589	    2,826	0.0069	950.4444	tur_news_2018_00406236
8788	Onların çoğu bence eve mahkum olan insanlar.	Y	eve	1589	    2,826	0.0069	984.1429	tur_news_2014_00729232
8789	İlk operasyon Kadıköy Moda’da bir eve yönelik gerçekleştirildi.	Y	eve	1589	    2,826	0.0069	1147.3333	tur_news_2014_00551848
8790	Eve daha çok para girer, refah seviyesi artar.	Y	eve	1589	    2,826	0.0069	1510.5	tur_news_2014_00432579
8791	Buna bir de 'Irak’ta kimyasal silah var.	Y	kimyasal	1589	    2,826	0.0069	470.125	tur_news_2018_00228800
8792	Kimyasal madde olduğu için şu anda söndürme çalışmaları devam ediyor dedi.	Y	kimyasal	1589	    2,826	0.0069	601.8182	tur_news_2014_00618345
8793	Cumhurbaşkanı Gül’ün Suriye’de bulunan kimyasal silahlarla ilgili uyarısından sonra ABD Savunma Bakanlığı’nın planı ortaya çıktı.	Y	kimyasal	1589	    2,826	0.0069	849.8333	tur_news_2014_00341372
8794	Loctite her zaman, uygulama sistemlerinin de kimyasal ürün kadar önemli olduğunu kabul etmiştir.	Y	kimyasal	1589	    2,826	0.0069	850.8462	tur_news_2005_00156387
8795	Her tür kimyasal madde zehirlenmeye neden olabilir.	Y	kimyasal	1589	    2,826	0.0069	928.5714	tur_news_2005_00498301
8796	Bu alana da son derece dikkat etmek gerekiyor.	Y	alana	1590	    2,825	0.0069	360.75	tur_news_2018_00190153
8797	Çalışma alanları ise sağlık sektöründe çok önemli ve geniş bir alana sahiptir.	Y	alana	1590	    2,825	0.0069	559.3333	tur_news_2005_00585441
8798	Bu alana yapılacak uygulamalar da çok önemlidir.	Y	alana	1590	    2,825	0.0069	703.7143	tur_news_2018_00190161
8799	Kültür - Yaşam Alana ilişkin yayınları takip etmek.	Y	alana	1590	    2,825	0.0069	787.4286	tur_news_2005_00569303
8800	Konunun ikinci yönü olan askeri alana gelince…	Y	alana	1590	    2,825	0.0069	1283.5714	tur_news_2014_00630202
8801	O da bir iki ay sonra başlayacak.	Y	başlayacak	1591	    2,824	0.0069	269.7143	tur_news_2005_00852771
8802	Başbakan Yıldırım ayrıca Seçim süreci hemen başlayacak.	Y	başlayacak	1591	    2,824	0.0069	622	tur_news_2018_00106604
8803	Kadın dizisi yeni sezon ne zaman başlayacak?	Y	başlayacak	1591	    2,824	0.0069	808.7143	tur_news_2018_00565651
8804	Yarın başlayacak olan üniversite kayıtları nasıl yapılacak?	Y	başlayacak	1591	    2,824	0.0069	937.5714	tur_news_2018_00955506
8805	Üç haftalık kampanya dönemi 3 Kasım’da başlayacak.	Y	başlayacak	1591	    2,824	0.0069	1178.5714	tur_news_2014_00918092
8806	'nın tedavisi Antalya Eğitim ve Araştırma Hastanesi’nde devam ediyor.	Y	tedavisi	1592	    2,823	0.0069	403.1	tur_news_2018_00686328
8807	Eğer bu tür bir sorunu varsa öncelikle o sorunun tedavisi gerekir.	Y	tedavisi	1592	    2,823	0.0069	555.7273	tur_news_2014_00403115
8808	Henüz bu hastalığın kesin tedavisi tespit edilmiş değil” dedi.	Y	tedavisi	1592	    2,823	0.0069	781.7778	tur_news_2018_00490878
8809	Hastalığın kesin bir teşhis yöntemi olmadığı gibi kesin bir tedavisi de yoktur.	Y	tedavisi	1592	    2,823	0.0069	1059.9	tur_news_2014_00502769
8810	Alkol tedavisi uzun bir süreç gerektirir ve hastaya büyük görev düşer.	Y	tedavisi	1592	    2,823	0.0069	1308.5455	tur_news_2014_00061147
8811	Konu hakkında Sağlık Bakanlığı çalışmalarına devam etmektedir.	Y	çalışmalarına	1593	    2,820	0.0069	486.4286	tur_news_2005_00252664
8812	Halen emekli olarak resim çalışmalarına devam etmektedir.	Y	çalışmalarına	1593	    2,820	0.0069	769.7143	tur_news_2005_00103577
8813	Öte yandan Göztepe 5 Temmuz’da İzmir’de çalışmalarına başlayacak.	Y	çalışmalarına	1593	    2,820	0.0069	932.7778	tur_news_2014_00745134
8814	Adana’da faaliyet gösteren Umut Der Gıda Bankası, Ramazan Bayramı sonrası çalışmalarına ara vermeden devam ediyor.	Y	çalışmalarına	1593	    2,820	0.0069	1014.4375	tur_news_2014_00041927
8815	Kurum, çalışmalarına Ankara’daki Türk Ocağı Halk Evleri binasında başlamıştı.	Y	çalışmalarına	1593	    2,820	0.0069	1436.9	tur_news_2014_00646352
8816	Seçimlerden sonra da, bu yeni dönemde de artık iyice ortaya çıktı ki, bu ülkenin çoğunluğu Müslüman ve Müslüman hayatı yaşıyor.	Y	iyice	1594	    2,819	0.0069	717.6111	tur_news_2018_00796740
8817	Ama dün iyice belli oldu ki bu imkânsız.	Y	iyice	1594	    2,819	0.0069	752.25	tur_news_2014_00071143
8818	Son zamanlarda ekonomik ve siyasi alanda gösterilen başarı ile de bu durum iyice pekiştirilmiş durumda.	Y	iyice	1594	    2,819	0.0069	778.1333	tur_news_2005_00425041
8819	İşte, AB’nin rengi gerçekten de bayrağındaki gibi mavi mi; yoksa kırmızı mı bu hafta içinde iyice ortaya çıkmış olacak.	Y	iyice	1594	    2,819	0.0069	779.3	tur_news_2014_00573907
8820	Ben de tanımadığım Mustafa’ya yardım ettim ve iki kişi o üç kişiyi iyice bir dövdük.	Y	iyice	1594	    2,819	0.0069	897.5625	tur_news_2018_00128395
8821	İngilizce eğitim veren ilk özel lise ve yine Almanya’da ilk özel Amerikan Üniversitesi de burada kurulmuş.	Y	lise	1595	    2,817	0.0069	493.5333	tur_news_2014_00555658
8822	Açık Lise kayıt işlemleri ne zaman başlıyor?	Y	lise	1595	    2,817	0.0069	807.7143	tur_news_2018_00006608
8823	Bu şartlar arasında Türkiye Cumhuriyeti vatandaşı olmak en az lise mezunu olmak gerekiyor.	Y	lise	1595	    2,817	0.0069	896	tur_news_2018_00261633
8824	İlçe Milli Eğitim Müdür Vekili, Lise Müdürü Oldu google ara İlçe Milli Eğitim Müdür Vekili, Lise Müdürü Oldu google haber ara İlçe Milli Eğitim Müdür Vekili, Lise Müdürü Oldu haberi Bu habere ilk yorumu siz ekleyin.	Y	lise	1595	    2,817	0.0069	1076.5556	tur_news_2014_00547000
8825	Gerçi Türkiye’de şimdiki üniversite öğrencisi bir zamanın lise öğrencisi gibi.	Y	lise	1595	    2,817	0.0069	1290.3	tur_news_2014_00472816
8826	E-mail: E-mail finali o kadar zor bir iş ki.	Y	mail	1596	    2,812	0.0069	633.2222	tur_news_2018_00385580
8827	Dün gelen onlarca mail’den biri de Prof.	Y	mail	1596	    2,812	0.0069	642.5	tur_news_2018_00361910
8828	Her şey bir yana bir bakan bunu e-mail’le neden yapsın?	Y	mail	1596	    2,812	0.0069	676.4545	tur_news_2014_00523379
8829	“Sayın Kılıçdaroğlu size Amerika’dan bir mail geldi mi gelmedi mi?	Y	mail	1596	    2,812	0.0069	780.4	tur_news_2018_00793784
8830	Bana gelen bir mail’i paylaşmak istiyorum.	Y	mail	1596	    2,812	0.0069	793	tur_news_2005_00086799
8831	Burada güzel bir sohbet etmek için bir araya geldik.	Y	sohbet	1597	    2,811	0.0069	595.875	tur_news_2018_00255426
8832	Önce babası ve annesi ile kısa bir süre sohbet ettik.	Y	sohbet	1597	    2,811	0.0069	663	tur_news_2014_00723630
8833	Görevli personel ile sohbet eden Başkan Cemal Akın yapılan çalışmalar hakkında bilgiler aldı.	Y	sohbet	1597	    2,811	0.0069	852.3846	tur_news_2018_00452594
8834	Dün bir sohbet toplantısında kısaca “ekonomi” konusu açıldı.	Y	sohbet	1597	    2,811	0.0069	1077.125	tur_news_2018_00361509
8835	Kur’an-ı kerim okudum, sohbet ettim.	Y	sohbet	1597	    2,811	0.0069	1296.7143	tur_news_2018_00621798
8836	Doğru dürüst bir caddesi, sosyal ve ekonomik bir yapısı yok.	Y	caddesi	1598	    2,810	0.0069	652.6667	tur_news_2018_00353342
8837	Atatürk Caddesi üzerinde bir basın açıklaması yapan Sirkeli’ye çok sayıda kadın da destek verdi.	Y	caddesi	1598	    2,810	0.0069	676.6667	tur_news_2014_00116629
8838	Bunun için ilk çalışma Cumhuriyet Caddesi üzerinde başlatıldı.	Y	caddesi	1598	    2,810	0.0069	700	tur_news_2014_00277740
8839	Alınan bilgiye göre kaza, Saray Mahallesi Spor Caddesi’nde meydana geldi.	Y	caddesi	1598	    2,810	0.0069	788.7273	tur_news_2014_00060082
8840	Kocaeli Sivil Anayasa Platformu üyeleri, her hafta olduğu gibi bu hafta da Yürüyüş Yolu’nun Fethiye Caddesi başında basın açıklaması yaparak, nasıl bir.	Y	caddesi	1598	    2,810	0.0069	808.0909	tur_news_2014_00625295
8841	Çünkü o zaman ne olur o bebek?	Y	bebek	1599	    2,805	0.0069	319.5	tur_news_2018_00321788
8842	O ise hep bebek hep küçük kaldı.	Y	bebek	1599	    2,805	0.0069	454.6667	tur_news_2018_00698608
8843	İkinci bebek ise sağlıklı olarak dünyaya gelmiş.	Y	bebek	1599	    2,805	0.0069	767.7143	tur_news_2014_00542278
8844	Karşılıklı sevgi ve saygı… Bir de bebek… En güzel mutluluk…	Y	bebek	1599	    2,805	0.0069	775.2	tur_news_2018_00578888
8845	Bir din adamı tarafından bebek 8 günlük iken gündüz sünnet edilir.	Y	bebek	1599	    2,805	0.0069	1127.6	tur_news_2005_00223266
8846	Bu sahne böyle daha iyi olurdu gibi.	Y	sahne	1599	    2,805	0.0069	555.2857	tur_news_2005_00778071
8847	Her sahne için bazen 70 tekrar yapan bir yönetmen.	Y	sahne	1599	    2,805	0.0069	685.125	tur_news_2018_00500072
8848	Baba Sahne’nin nasıl bir tiyatro anlayışı olacak?	Y	sahne	1599	    2,805	0.0069	778.625	tur_news_2018_00095104
8849	İstanbul’da nasıl bir sahne karşımıza çıkacak?	Y	sahne	1599	    2,805	0.0069	825.4286	tur_news_2018_00549030
8850	Spor Toto Süper Lig bugün dev bir maça sahne olacak.	Y	sahne	1599	    2,805	0.0069	1048.6	tur_news_2014_00853652
8851	Bu yüzden aynı işlemi tekrar etmek gerekiyor.	Y	işlemi	1600	    2,802	0.0069	453.1429	tur_news_2018_00282744
8852	Satış işlemi için bir gün tayin edilir.	Y	işlemi	1600	    2,802	0.0069	725.1429	tur_news_2005_00377432
8853	Yaşlı insanlar var ve oy verme işlemi çok uzun sürdü.	Y	işlemi	1600	    2,802	0.0069	795.8	tur_news_2018_00958869
8854	Sabah saatlerinde başlayan oy kullanma işlemi devam ediyor.	Y	işlemi	1600	    2,802	0.0069	891.125	tur_news_2018_00775896
8855	Kayıt işlemi sonrası her hastaya bir protokol numarası verilir.	Y	işlemi	1600	    2,802	0.0069	1258.8889	tur_news_2005_00307981
8856	Devreye almak çok daha kısa zaman alır.	Y	devreye	1601	    2,799	0.0069	491.7143	tur_news_2005_00600259
8857	Bu iki sistem birbirinden bağımsız olarak ayni anda devreye girer.	Y	devreye	1601	    2,799	0.0069	885.8	tur_news_2005_00189871
8858	Son adım olarak ise beyin devreye giriyor.	Y	devreye	1601	    2,799	0.0069	951.7143	tur_news_2018_00827921
8859	Aksi halde Bakanlık olarak devreye giriyor ve müdahale ediyoruz.	Y	devreye	1601	    2,799	0.0069	1114.7778	tur_news_2014_00055005
8860	2000 başından beri de doğrudan yabancı sermaye yatırımları devreye girdi.	Y	devreye	1601	    2,799	0.0069	1207.6667	tur_news_2014_00012246
8861	Küçük Sanayi Sitesi Yönetim Kurulu Başkanlığı Bursa S.S.	Y	sitesi	1601	    2,799	0.0069	544.625	tur_news_2005_00479363
8862	İzmit Sanayi Sitesi’nin çok ciddi ulaşım sorunu var.	Y	sitesi	1601	    2,799	0.0069	674.8889	tur_news_2018_00562184
8863	Soru: İnternet sitesi fikri nasıl ortaya çıktı?	Y	sitesi	1601	    2,799	0.0069	956.7143	tur_news_2018_00836776
8864	Bu haftanın süper sitesi herkes için eğlenceli olabilir.	Y	sitesi	1601	    2,799	0.0069	1105.875	tur_news_2018_00214753
8865	Türkiye Ulusal Referans Noktası web sitesi için tıklayınız.	Y	sitesi	1601	    2,799	0.0069	1241	tur_news_2014_00912615
8866	O kadar ciddi iddia var, soruşturma yok mu?	Y	soruşturma	1602	    2,797	0.0069	416.5	tur_news_2018_00698732
8867	Hem askeri hem de sivil soruşturma devam etmektedir.	Y	soruşturma	1602	    2,797	0.0069	535	tur_news_2014_00512501
8868	Üniversite yönetimi geçtiğimiz günlerde öğrenciler hakkında soruşturma başlattı.	Y	soruşturma	1602	    2,797	0.0069	931.375	tur_news_2018_00917592
8869	d) Hakkında soruşturma yapılan öğrenciye sözlü veya yazılı savunma hakkı verilir.	Y	soruşturma	1602	    2,797	0.0069	989.7273	tur_news_2005_00001988
8870	Polis ekipleri yaşanan olayın ardından soruşturma başlattı.	Y	soruşturma	1602	    2,797	0.0069	1215.7143	tur_news_2018_00759135
8871	Ancak Jandarma bu konuda ne bir tedbir aldı, ne de bir işlem yaptı diye konuştu.	Y	jandarma	1603	    2,794	0.0069	505.2308	tur_news_2014_00089003
8872	JANDARMA Rüyada jandarma gören kişiyi, kısa bir zaman içinde büyük bazı işler bekliyor demektir.	Y	jandarma	1603	    2,794	0.0069	857.5385	tur_news_2005_00729595
8873	Jandarma Genel Komutanlığı Konya İl Jandarma Komutanlığı, ¨ T.C.	Y	jandarma	1603	    2,794	0.0069	925.5714	tur_news_2005_00609261
8874	Kocaeli Jandarma Komutanlığı’ndan 2 kişi ihraç edildi.	Y	jandarma	1603	    2,794	0.0069	1147.8571	tur_news_2018_00606438
8875	Şehit olan 3 asker için yarın İl Jandarma Komutanlığı’nda tören düzenlenecek.	Y	jandarma	1603	    2,794	0.0069	1179.3636	tur_news_2014_00811498
8876	Bu şekilde ilk başta hızlı kullanmak mümkün değil.	Y	kullanmak	1603	    2,794	0.0069	392.375	tur_news_2005_00326036
8877	Fakat Bu yöntemleri de doğru kullanmak gerekir.	Y	kullanmak	1603	    2,794	0.0069	605.4286	tur_news_2014_00438610
8878	Bu kaynağı etkin ve verimli kullanmak önemli.	Y	kullanmak	1603	    2,794	0.0069	801.7143	tur_news_2018_00221341
8879	Biz de bu potansiyeli yurt dışında kullanmak istiyoruz. 6 ülkede birden çalışmalar yapıyoruz.	Y	kullanmak	1603	    2,794	0.0069	861.4167	tur_news_2014_00203606
8880	Ülkemiz elindeki potansiyeli etkili bir şekilde kullanmak zorunda.	Y	kullanmak	1603	    2,794	0.0069	1335.875	tur_news_2018_00911897
8881	Ödül almak çok güzel bir şey herkes için.	Y	ödül	1604	    2,791	0.0069	340.625	tur_news_2014_00710900
8882	Eğitim 3 ay sürecek ve sonunda büyük ödül var.	Y	ödül	1604	    2,791	0.0069	601.875	tur_news_2018_00376262
8883	'Bana kim ödül verecek, olmaz ya, ama sen al o zaman,' dedim.	Y	ödül	1604	    2,791	0.0069	685.5	tur_news_2014_00142636
8884	Bundan daha büyük ödül ve onur olmaz ifadesini kullandı.	Y	ödül	1604	    2,791	0.0069	876.7778	tur_news_2018_00231690
8885	Olası bir galibiyet ve tur; ona daha üçüncü görev gününde erken ödül verebilir.	Y	ödül	1604	    2,791	0.0069	1185.1538	tur_news_2014_00718344
8886	İnsan kaynakları ile ilgili böyle bir durum olabilir.	Y	kaynakları	1605	    2,790	0.0069	388.625	tur_news_2014_00558842
8887	Bir ordusu ya da askeri kaynakları yoktur.	Y	kaynakları	1605	    2,790	0.0069	692.4286	tur_news_2005_00570103
8888	Aksine aynı zamanda haber kaynakları olduğu için sıcak ilişkiler içinde olmayı tercih ederiz.	Y	kaynakları	1605	    2,790	0.0069	858.0769	tur_news_2018_00023399
8889	Yani artık finansman kaynakları da sadece bankalar değil.	Y	kaynakları	1605	    2,790	0.0069	948.25	tur_news_2018_00945732
8890	Biri organik tarım, öteki ise alternatif enerji kaynakları.	Y	kaynakları	1605	    2,790	0.0069	1186.75	tur_news_2018_00153465
8891	Çünkü bu ülke her şeyi mevcut bir ülke haline gelmiştir.	Y	gelmiştir	1606	    2,785	0.0068	400.4444	tur_news_2005_00057512
8892	Bir başka örnek; belki sizlere de gelmiştir.	Y	gelmiştir	1606	    2,785	0.0068	650.7143	tur_news_2005_00325037
8893	Kasım/1992’de, bir Ermenistan hükümet heyeti Türkiye’ye gelmiştir.	Y	gelmiştir	1606	    2,785	0.0068	808	tur_news_2005_00586812
8894	Onun için diyorum ki, devlet idare edilemez hale gelmiştir.”	Y	gelmiştir	1606	    2,785	0.0068	927.4444	tur_news_2018_00717994
8895	Bir takım çalışmalar ile pazar yerlerinde bazı düzenlemeler gözle görülür hale gelmiştir.	Y	gelmiştir	1606	    2,785	0.0068	1155.5833	tur_news_2005_00983206
8896	Herkese eşit şekilde verilen bu hak size daha mı fazla verilmiştir?	Y	eşit	1607	    2,784	0.0068	558.9091	tur_news_2018_00497180
8897	İsrail vardır, Türkiye’de İsrail ile eşit şartlar altında işbirliği yapabilir.	Y	eşit	1607	    2,784	0.0068	836.3	tur_news_2014_00570444
8898	Özgür, eşit ve adil bir eğitim istiyoruz.	Y	eşit	1607	    2,784	0.0068	870.1429	tur_news_2014_00758832
8899	Eşit fırsat: Anne-çocuk eğitim programı’nın değerlendirilmesi.	Y	eşit	1607	    2,784	0.0068	896.25	tur_news_2005_00446373
8900	Biz diyoruz ki eşit işe eşit ücret.	Y	eşit	1607	    2,784	0.0068	1048	tur_news_2018_00167558
8901	Önce devam kararı aldı bir gün sonra istifa etti.	Y	istifa	1608	    2,782	0.0068	295.7778	tur_news_2014_00723941
8902	AKP’ye bir istifa da Ankara’dan!	Y	istifa	1608	    2,782	0.0068	348.4286	tur_news_2018_00022323
8903	Başkan Arslan ve meclis üyeleri Akp’den istifa etti.	Y	istifa	1608	    2,782	0.0068	675.1111	tur_news_2018_00108726
8904	İsrail’de 22 Ocak’ta yapılacak seçimler öncesi sürpriz bir istifa yaşandı.	Y	istifa	1608	    2,782	0.0068	975.9091	tur_news_2014_00569452
8905	Selim, Kerim’in gerçek yüzünü görünce istifa etmeye karar verir.	Y	istifa	1608	    2,782	0.0068	1363.2	tur_news_2018_00801093
8906	Bu da beyin üzerinde bir etki yapar mı?	Y	beyin	1609	    2,779	0.0068	529.5	tur_news_2018_00199088
8907	Ancak her kurulan devlet ya bir beyin ya da bir boyun devleti olmuştur.	Y	beyin	1609	    2,779	0.0068	614.1818	tur_news_2005_00603484
8908	Oktay Beyin de benim de aynı kişi.	Y	beyin	1609	    2,779	0.0068	830.6667	tur_news_2018_00699561
8909	Ya da Tayyip beyin iki tarafa da.	Y	beyin	1609	    2,779	0.0068	907.6667	tur_news_2018_00940733
8910	Ancak bir süre sonra kadının beyin ölümü gerçekleşti.	Y	beyin	1609	    2,779	0.0068	1026.125	tur_news_2018_00050685
8911	Belediye nedir, nasıl hizmet verilir bunlar hakkında yeterli bilgisi bile yoktu.	Y	bilgisi	1609	    2,779	0.0068	551.1818	tur_news_2005_00165768
8912	Türkçe’nin ses özellikleri ve ses bilgisi ile ilgili kurallar.	Y	bilgisi	1609	    2,779	0.0068	781.4444	tur_news_2005_00084962
8913	Sayın Demirel benim için bir hayat bilgisi öğretmeni gibidir.	Y	bilgisi	1609	    2,779	0.0068	1099.8889	tur_news_2014_00807191
8914	Ek ve değişiklikler Türk Telekom’un bilgisi dahilinde ücreti karşılığı yapılır.	Y	bilgisi	1609	    2,779	0.0068	1254.1818	tur_news_2014_00409269
8915	Site/Apt.Adı: Açılacak bölgenin adres bilgisi için gereklidir.	Y	bilgisi	1609	    2,779	0.0068	1641.7778	tur_news_2005_00922455
8916	Yüzde yüz yerli ve yeni bir yazılım.	Y	yazılım	1609	    2,779	0.0068	513	tur_news_2018_00988727
8917	Enerji kullanımı ve çevre eğitimi için bir yazılım mevcuttur.	Y	yazılım	1609	    2,779	0.0068	648.8889	tur_news_2005_00140338
8918	Yazılım paketi ile ilgili çalışmalar devam ediyor.	Y	yazılım	1609	    2,779	0.0068	772.4286	tur_news_2005_00352710
8919	Destek hizmeti yazılım sektöründe en az program kalitesi kadar önemlidir.	Y	yazılım	1609	    2,779	0.0068	855.6	tur_news_2005_00775931
8920	Yazılım, Donanım, İnternet, Eğitim, Yatırım ve Politika konusunda ayrıntılı bilgi verildi.	Y	yazılım	1609	    2,779	0.0068	1060.3636	tur_news_2005_00620710
8921	Bu dosya Ankara’dan neden buraya alındı.	Y	dosya	1610	    2,777	0.0068	596.5714	tur_news_2018_00202451
8922	İlk açılması gereken dosya belki de bu!	Y	dosya	1610	    2,777	0.0068	702	tur_news_2018_00526452
8923	Program her şirket için dört değişik dosya açar.	Y	dosya	1610	    2,777	0.0068	868.125	tur_news_2005_00394990
8924	Dosya buradan yine Van 3. Ağır Ceza Mahkemesi’ne gönderildi.	Y	dosya	1610	    2,777	0.0068	1016	tur_news_2014_00389685
8925	Bu dosya staj sonunda Eğitim Merkezi Başkanlığına gönderilir.	Y	dosya	1610	    2,777	0.0068	1264	tur_news_2005_00459907
8926	Bu nedenle projeler daha çok kadınlar ve çocuklar üzerine.	Y	projeler	1611	    2,776	0.0068	421	tur_news_2018_00235019
8927	Bakan Kurum burada Belediye Başkanı Sami Aydın’dan projeler hakkında bilgi aldı.	Y	projeler	1611	    2,776	0.0068	654.8333	tur_news_2018_00098117
8928	Her zaman Alanya’da örnek projeler yapıyoruz.	Y	projeler	1611	    2,776	0.0068	733.4286	tur_news_2018_00502866
8929	Gerçekten de ileri vadede güzel ve anlamlı projeler.	Y	projeler	1611	    2,776	0.0068	944.875	tur_news_2018_00444668
8930	Nitekim bu projeler bu sayede hayata geçiyor.	Y	projeler	1611	    2,776	0.0068	1316.6667	tur_news_2005_00671924
8931	Ardından İçişleri Bakanlığı Personel Genel Müdürlüğü’nde Şube Müdürü, Daire Başkanı ve Genel Müdür olarak görev yapmış.	Y	daire	1612	    2,771	0.0068	612.4375	tur_news_2005_00294292
8932	Aynı yıl içinde Kültür İşleri Daire Başkanlığı’na tayin edildi.	Y	daire	1612	    2,771	0.0068	691.7	tur_news_2005_00054181
8933	5. Mali konularda Daire Başkanı tarafından verilen diğer görevleri yapmak.	Y	daire	1612	    2,771	0.0068	771.2222	tur_news_2014_00027480
8934	Gelen bilgilere göre Daire Başkanlığı, kendi başına da karar verebilir.’	Y	daire	1612	    2,771	0.0068	806.3	tur_news_2018_00437890
