ORDER	SENTENCE	STATUS	WORD	RANK	COUNT	COUNT_REL	INDEX	ID
9747	Aynı zamanda ödeme sistemleri, e-ticaret hizmetleri ile ilgili danışmanlık ve yazılım geliştirme hizmetleri.	Y	geliştirme	1730	    2,561	0.0063	746.9231	tur_news_2005_00276923
9748	Oksijen Teknoloji Geliştirme ve Bilişim Sistemleri A.Ş., kısaca Oksijen, Eylül 2000’de İstanbul’da kurulmuştur.	Y	geliştirme	1730	    2,561	0.0063	1020.0714	tur_news_2005_00185498
9749	Dolayısıyla iş geliştirme birimi projesi kurulması gerekiyor, bizim Yalova Projesi’nde.	Y	geliştirme	1730	    2,561	0.0063	1065.5	tur_news_2005_00046533
9750	‘Araştırma geliştirme’ olan Ar-Ge’nin, ‘araştırma’ kısmı iyi, ‘geliştirme’ kısmı zayıf.	Y	geliştirme	1730	    2,561	0.0063	1120.6667	tur_news_2018_00067276
9751	Bu durum Kýbrýs’ýn her iki tarafý içinde geçerli.	Y	ýn	1731	    2,560	0.0063	954.8889	tur_news_2018_00203966
9752	Tam da Fazýl Say’ýn daha önce anlattýðý gibi, “güzel oldu, hem de çok güzel.”	Y	ýn	1731	    2,560	0.0063	973.2857	tur_news_2018_00860719
9753	Hem de Yunanistan’ýn tam desteði ile!	Y	ýn	1731	    2,560	0.0063	981.2857	tur_news_2018_00488453
9754	Ama siyasi Ýslam ilk devrilerinden bu yana Ýslam’ýn büyük bir sorunu.	Y	ýn	1731	    2,560	0.0063	1001.5455	tur_news_2018_00043479
9755	UBP kuzey Kýbrýs’ýn en önemli, en büyük siyasi partilerinden biri.	Y	ýn	1731	    2,560	0.0063	1011.3	tur_news_2018_00907041
9756	‘Genç ve teknik bilen biri olsun’ dedi.	Y	bilen	1732	    2,557	0.0063	376.8571	tur_news_2018_00441532
9757	Türkçe’den başka bir dil bilen kişi oranı ise % 8’dir.	Y	bilen	1732	    2,557	0.0063	533.3	tur_news_2014_00901799
9758	Ne istediğini bilen bir siyasî parti olarak ortaya çıktı.	Y	bilen	1732	    2,557	0.0063	814.5556	tur_news_2005_00933221
9759	Şanlıurfa karşısında ne yaptığını bilen bir takım vardı.	Y	bilen	1732	    2,557	0.0063	941.5	tur_news_2018_00788832
9760	“Malatya play-off’u bilen bir şehir.	Y	bilen	1732	    2,557	0.0063	1239.4286	tur_news_2018_00640741
9761	Trabzonspor’un durumu ise daha da zor.	Y	trabzonspor	1732	    2,557	0.0063	382.5714	tur_news_2014_00895708
9762	Beşiktaş ile Trabzonspor bugün İnönü’de karşı karşıya geliyor.	Y	trabzonspor	1732	    2,557	0.0063	766.2222	tur_news_2014_00175180
9763	Biz de çok iyi çıkacak olan oyuncular Trabzonspor’a gidecek.	Y	trabzonspor	1732	    2,557	0.0063	823.6	tur_news_2018_00166145
9764	Süper Lig’in 14. haftasında Trabzonspor, Kayseri’ye konuk oldu.	Y	trabzonspor	1732	    2,557	0.0063	1068.6667	tur_news_2018_00850373
9765	Yöneticiler, parayı önce Trabzonspor Kulübü’ne veriyor.	Y	trabzonspor	1732	    2,557	0.0063	1283.4286	tur_news_2018_00981979
9766	Ama şimdi görüyoruz ki ‘olsun’ diye, büyük bir çaba gösteriyor.	Y	çaba	1733	    2,556	0.0063	500.1	tur_news_2018_00043349
9767	Bunun üzerinde ciddi bir çaba sarf ediyoruz diye konuştu.	Y	çaba	1733	    2,556	0.0063	642.3333	tur_news_2014_00280126
9768	En küçük bir şiddet olmaması için de çaba sarf edeceğiz.	Y	çaba	1733	    2,556	0.0063	933.4	tur_news_2018_00391493
9769	Öğrencilere ve eğitim sistemine her zaman katkıda bulunmak istediğini, yaşamı boyunca bu yönde çaba sarf ettiğini belirten Prof.	Y	çaba	1733	    2,556	0.0063	1114.6111	tur_news_2018_00695080
9770	BM kararını harekete geçirmek için olağanüstü bir çaba var.	Y	çaba	1733	    2,556	0.0063	1245.6667	tur_news_2014_00211870
9771	Çay, bir zamanlar yakın ilişkiler içinde olduğu Dr.	Y	çay	1734	    2,555	0.0063	758.75	tur_news_2014_00320718
9772	Tabii meyve suyu ve çay su yerine geçer.	Y	çay	1734	    2,555	0.0063	882.75	tur_news_2014_00866674
9773	Aynı durum çay ve kahve için de geçerlidir.	Y	çay	1734	    2,555	0.0063	899.375	tur_news_2018_00085965
9774	Geçen yıl çay fiyatı prim dahil 1 lira oldu.	Y	çay	1734	    2,555	0.0063	967.5	tur_news_2014_00461534
9775	Fakat köy ismini köyde bulunan Çay’dan almaktadır.	Y	çay	1734	    2,555	0.0063	1176.875	tur_news_2014_00439654
9776	Sadece Kadıköy’de var ve bir şubesi daha yok.	Y	kadıköy	1734	    2,555	0.0063	409.7778	tur_news_2018_00777929
9777	Kadıköy’ün bir kültür merkezi olma özelliği vardır.	Y	kadıköy	1734	    2,555	0.0063	606.125	tur_news_2018_00565301
9778	Kadıköy de bu açıdan zengin bir ilçe.	Y	kadıköy	1734	    2,555	0.0063	700.2857	tur_news_2014_00587419
9779	Kadıköy’deki bir başka anma da CHP Kadıköy Gençlik Örgütü tarafından gerçekleştirildi.	Y	kadıköy	1734	    2,555	0.0063	846.8182	tur_news_2018_00565111
9780	Son dönemlerde Kadıköy kültür alanında yükseldi iyice.	Y	kadıköy	1734	    2,555	0.0063	1251.2857	tur_news_2018_00829055
9781	Yani iki ya da daha fazla kişi tarafından karşılıklı olarak yapılabilir.	Y	yapılabilir	1734	    2,555	0.0063	365.0909	tur_news_2018_00947914
9782	Bu analiz bir proje paketi veya tüm yatırım programı için de yapılabilir.	Y	yapılabilir	1734	    2,555	0.0063	686.0833	tur_news_2005_00050144
9783	T.C. kimlik numarası ve öğrenci numarası ile e-Okul sistemine giriş yapılabilir.	Y	yapılabilir	1734	    2,555	0.0063	867	tur_news_2018_00867101
9784	Hasar talebi sadece adına kredi kart hesabı bulunan kart sahibi tarafından yapılabilir.	Y	yapılabilir	1734	    2,555	0.0063	1011.7273	tur_news_2005_00376598
9785	KOBİ’lerin ihtiyaç duyduğu bilimsel ve teknolojik her türlü araştırma yapılabilir.	Y	yapılabilir	1734	    2,555	0.0063	1190.0909	tur_news_2005_00128426
9786	Toplumun en üst ve en popüler kesimini oluşturan insanların arasında bile bu insanlar vardır.	Y	oluşturan	1735	    2,553	0.0063	808.3846	tur_news_2018_00881456
9787	Niye, gerçekten büyük bir iş başaran ya da yeni bir düşünce oluşturan her insanın öyküsüdür bu.	Y	oluşturan	1735	    2,553	0.0063	893.5333	tur_news_2018_00687619
9788	Geçen yıl bütçeye en fazla net gelir oluşturan illerin başında İstanbul geldi.	Y	oluşturan	1735	    2,553	0.0063	932.8333	tur_news_2014_00461527
9789	Ama Avrupa’ya gelince, bunlar, her ne kadar ayrı ayrı devletler olarak, yani AB’yi oluşturan milletler ayrı ayrı devletler olarak görülmüş olsa bile neticede bunlar bir millettir.	Y	oluşturan	1735	    2,553	0.0063	951.2727	tur_news_2014_00066823
9790	Toplumu oluşturan bütün fertlerin, içinde bulunduğu durum aynı değildir.	Y	oluşturan	1735	    2,553	0.0063	955.1111	tur_news_2005_00674842
9791	Bu o kadar da zor bir durum deðil.	Y	deðil	1736	    2,551	0.0063	297.5	tur_news_2018_00251419
9792	Çok yüksek bir rakam deðil mi bu?	Y	deðil	1736	    2,551	0.0063	621.1429	tur_news_2018_00309627
9793	Sonuçta herkes insan deðil mi, hepsi insan dedi.	Y	deðil	1736	    2,551	0.0063	738.2857	tur_news_2018_00834630
9794	Ama bu maalesef bizim ülkemiz için geçerli deðil.	Y	deðil	1736	    2,551	0.0063	778.625	tur_news_2018_00036098
9795	Zira bu konu sadece parti içi bir mesele dizisi deðil.	Y	deðil	1736	    2,551	0.0063	930.7	tur_news_2018_00995766
9796	Bu işin tek çözümü var. iki ayrı devlet.	Y	çözümü	1737	    2,549	0.0063	414.25	tur_news_2014_00252226
9797	Güvenlik ile ilgili sorunlar ile çözümü konusunda Genel Sekreter’e bilgi vermek.	Y	çözümü	1737	    2,549	0.0063	653.6364	tur_news_2005_00993035
9798	Ya da çözümü Obama’dan mı bekliyor?	Y	çözümü	1737	    2,549	0.0063	837.7143	tur_news_2014_00949068
9799	Sorunu tespit ederken, çözümü de beraberinde getirdi.	Y	çözümü	1737	    2,549	0.0063	1037.5714	tur_news_2005_00688831
9800	Bu sorunların çözümü yine TFF’ye aittir.	Y	çözümü	1737	    2,549	0.0063	1288.7143	tur_news_2018_00266283
9801	Kendileri de onu bize açıkça ifade etti.	Y	açıkça	1738	    2,548	0.0063	590.5714	tur_news_2014_00608652
9802	Bu da açıkça göstermektedir ki. 2000 yılı aynı zamanda özelleştirme yılı olacaktır.	Y	açıkça	1738	    2,548	0.0063	750.1	tur_news_2005_00851762
9803	Eğitim alanında da açıkça fark edilen uygulamalar yapılıyor.	Y	açıkça	1738	    2,548	0.0063	854.125	tur_news_2014_00405446
9804	Bu maçta G.Saray’da bunu açıkça gördük.	Y	açıkça	1738	    2,548	0.0063	990.375	tur_news_2014_00260017
9805	Bu husus Kuran’da açıkça ifade edilmiştir.	Y	açıkça	1738	    2,548	0.0063	1121.1429	tur_news_2018_00216445
9806	Çünkü Türkiye aynı zamanda bir bölgesel güç.	Y	bölgesel	1738	    2,548	0.0063	404.7143	tur_news_2014_00349442
9807	2. Türkiye şu anda Ortadoğu’da bölgesel güç olma yolunda.	Y	bölgesel	1738	    2,548	0.0063	741.1111	tur_news_2014_00021850
9808	Kulübün futbol takımı şu anda Bölgesel Amatör Lig’de mücadele etmektedir.	Y	bölgesel	1738	    2,548	0.0063	957.5455	tur_news_2014_00641914
9809	Bölgesel Gelişme ve Yapısal Uyum Genel Müdürlüğü, Şubat 1999.	Y	bölgesel	1738	    2,548	0.0063	1049.625	tur_news_2005_00636717
9810	Bölgesel gerçek: AB AB, bu nedenlerle kurulmuştur.	Y	bölgesel	1738	    2,548	0.0063	1219.5	tur_news_2005_00738977
9811	İstanbul Üniversitesi, İstanbul Tıp Fakültesi, Adli Tıp Ana Bilim Dalı Başkanı Prof.	Y	adli	1739	    2,546	0.0063	618	tur_news_2018_00550337
9812	Bundan sonra adli süreci takip edeceğiz.” dedi.	Y	adli	1739	    2,546	0.0063	700.4286	tur_news_2014_00265331
9813	Bu konunun adli ve idari süreci devam ediyor.	Y	adli	1739	    2,546	0.0063	826.5	tur_news_2014_00257754
9814	Adli Tıp Kurumu Eğitim ve Bilimsel Araştırma Komisyonu Kuruldu.	Y	adli	1739	    2,546	0.0063	913	tur_news_2005_00173993
9815	O hem adli yargı, hem idari yargı anlamında.	Y	adli	1739	    2,546	0.0063	1229.5	tur_news_2014_00714909
9816	Onun için bir öğretmen çok büyük önem arz eder.	Y	arz	1739	    2,546	0.0063	427.6667	tur_news_2014_00732557
9817	Bu toplantı iki açıdan da önem arz ediyor.	Y	arz	1739	    2,546	0.0063	619	tur_news_2014_00301107
9818	Dolayısıyla din ve medya ilişkisi hem yaşanan hayat hem de iletişim alanı açısından göz ardı edilemez bir durum arz etmektedir. diye konuştu.	Y	arz	1739	    2,546	0.0063	776.2857	tur_news_2018_00356610
9819	Halka arz sermaye için diğer bir yöntem.	Y	arz	1739	    2,546	0.0063	893.2857	tur_news_2005_00311359
9820	Bilindiği gibi sunmak, “arz etmek” anlamında da geçiyor.	Y	arz	1739	    2,546	0.0063	1450.125	tur_news_2005_00331407
9821	Ulaşım-iletişim konusunda da yeni bir şey yok.	Y	ulaşım	1739	    2,546	0.0063	383.25	tur_news_2005_00065185
9822	Kent içi ulaşım, sürekli kar edilmesi gereken bir kamu hizmeti değildir.	Y	ulaşım	1739	    2,546	0.0063	647.9091	tur_news_2014_00611671
9823	Bu sorunların başında ulaşım ve trafik sorunu bulunmaktadır.	Y	ulaşım	1739	    2,546	0.0063	846.5	tur_news_2005_00157002
9824	Sorunları yakından biliyoruz, ulaşım sorunu çöp büyük bir sorun teşkil ediyor.	Y	ulaşım	1739	    2,546	0.0063	1067.3636	tur_news_2018_00837304
9825	Işık yok, su yok, yiyecek yok, ulaşım yok.	Y	ulaşım	1739	    2,546	0.0063	1420.4	tur_news_2018_00543324
9826	Türkiye’de bu ameliyat 275 ile en çok Denizli’de yapıldı.	Y	denizli	1740	    2,544	0.0062	491.5556	tur_news_2014_00905036
9827	İşte Mustafa Denizli’nin Galatasaray’a cevabı!	Y	denizli	1740	    2,544	0.0062	788.4286	tur_news_2018_00553838
9828	Denizli’ye şimdiden hayırlı olsun diye konuştu.	Y	denizli	1740	    2,544	0.0062	923.7143	tur_news_2014_00365777
9829	Daha sonra Denizli Büyükşehir Belediyesi halk oyunları ekibi bir gösteri düzenledi.	Y	denizli	1740	    2,544	0.0062	1041.1818	tur_news_2018_00328273
9830	Denizli ayrıca takıma yönelik de görüşlerini açıkladı.	Y	denizli	1740	    2,544	0.0062	1185.7143	tur_news_2014_00365431
9831	İlk üç gün için kötü bir açılış yaptı.	Y	açılış	1741	    2,542	0.0062	378.25	tur_news_2018_00529523
9832	Açılış öncesi konuşan Gençlik ve Spor Bakanı Kılıç, yapılacak tesis ile Konya’nın İç Anadolu’nun en büyük spor kenti haline geleceğini dile getirdi.	Y	açılış	1741	    2,542	0.0062	818.7826	tur_news_2014_00040123
9833	Açılış konuşmasını yapan İl Sağlık Müdürü Dr.	Y	açılış	1741	    2,542	0.0062	847.4286	tur_news_2014_00040089
9834	Cumhurbaşkanı Erdoğan, Dokuz Eylül Üniversitesi Akademik Yıl Açılış Töreni’nde açıklamalarda bulundu.	Y	açılış	1741	    2,542	0.0062	1001.8333	tur_news_2018_00312561
9835	Toplantı açılış konuşmasını İl Milli Eğitim Müdürü Mehmet Bulut gerçekleştirdi.	Y	açılış	1741	    2,542	0.0062	1227.3	tur_news_2018_00879581
9836	Bir de ilçe olduğu için yaptığı tek hastane var.	Y	hastane	1742	    2,541	0.0062	331.1111	tur_news_2018_00147969
9837	Bir başka hastane projesi de spor hastanesi olsun.	Y	hastane	1742	    2,541	0.0062	484.75	tur_news_2018_00144708
9838	Emeği geçen herkese hastane yönetimi adına teşekkür ediyorum diye konuştu.	Y	hastane	1742	    2,541	0.0062	780.7	tur_news_2018_00385672
9839	Bugün yılda 45 bin hastaya hizmet veren hastane.	Y	hastane	1742	    2,541	0.0062	844.7143	tur_news_2018_00214002
9840	Mahkum, hastane olmayan yerlerde ise hastane bulunan yere gönderilir.	Y	hastane	1742	    2,541	0.0062	1165.875	tur_news_2005_00560078
9841	Ancak geçtiğimiz gün bana gelerek, kendisine bir teklif yapıldığını ifade etti.	Y	gelerek	1743	    2,537	0.0062	637.1818	tur_news_2018_00053665
9842	Bu arada polis ise olay yerine gelerek inceleme başlattı.	Y	gelerek	1743	    2,537	0.0062	853.7778	tur_news_2018_00192723
9843	Biz de bu sayede, sizler sayesinde 1999’dan beri göreve gelerek sizlere hizmet etmeye devam ediyoruz.	Y	gelerek	1743	    2,537	0.0062	854.2667	tur_news_2018_00166050
9844	Partinin önde gelen isimleri Kocaeli’ye gelerek bir dizi ziyaret yapacak.	Y	gelerek	1743	    2,537	0.0062	992.9091	tur_news_2018_00749026
9845	Sırf Fransa’dan değil çeşitli ülkelerden gelerek destek verdiler.	Y	gelerek	1743	    2,537	0.0062	1287	tur_news_2018_00818034
9846	Tabi bu da lazım ama önemli olan katılım” diye konuştu.	Y	katılım	1744	    2,535	0.0062	353.8	tur_news_2018_00854686
9847	İki-üç toplantı yaptık. Çok büyük katılım oldu.	Y	katılım	1744	    2,535	0.0062	652.875	tur_news_2005_00481170
9848	Katılım ücreti olarak; her bir paket için 400 dolar karşılığı TL.	Y	katılım	1744	    2,535	0.0062	917.3	tur_news_2005_00766111
9849	Sürpriz bir durum olmazsa pek katılım olmaz.	Y	katılım	1744	    2,535	0.0062	1030	tur_news_2018_00852514
9850	Katılım koşulları ve ayrıntılı bilgi için tıklayınız.	Y	katılım	1744	    2,535	0.0062	1195	tur_news_2018_00581286
9851	İş Türkiye’ye gelince, durumun hiç de öyle olmadığı ise hemen fark ediliyor.	Y	gelince	1745	    2,534	0.0062	554.4615	tur_news_2014_00578303
9852	Devletin önem verdiği bir sektör haline gelince, kamu da önem vermeye başladı.	Y	gelince	1745	    2,534	0.0062	669.4545	tur_news_2014_00370426
9853	Bu tip şeyler üst üste gelince, bir de Galatasaray’dan teklif gelince yeni bir sayfa açmak istedim.	Y	gelince	1745	    2,534	0.0062	984.1333	tur_news_2018_00270137
9854	Bütün bunlar üst üste gelince, bir çatışma da kaçınılmaz oldu.	Y	gelince	1745	    2,534	0.0062	1052.8	tur_news_2018_00271373
9855	İki şair bir araya gelince elbette bir dergi fikri çıkar ortaya.	Y	gelince	1745	    2,534	0.0062	1227.5	tur_news_2018_00521073
9856	Şu bahçe gibi her türlü meyve var.	Y	meyve	1746	    2,533	0.0062	600.4286	tur_news_2018_00847456
9857	Ancak daha önce hiç görmediğimiz meyve mi, sebze mi olduğunu bile seçemediğimiz o kadar çok şey var ki.	Y	meyve	1746	    2,533	0.0062	747.1765	tur_news_2014_00086593
9858	Meyve toplamaksa iyi ve güzel bir iş yapıp, büyük para sahibi olacağını işaret eder.	Y	meyve	1746	    2,533	0.0062	780.5714	tur_news_2005_00157651
9859	Bu yüzden kiraz son yıllarda Türkiye’de en popüler meyve oldu.	Y	meyve	1746	    2,533	0.0062	814.1818	tur_news_2005_00690122
9860	Toplantıda Osmaniye Belediyesi Yeni Sebze ve Meyve Hali ile ilgili bilgi de veren Kara, “Burası için 1 milyon TL.	Y	meyve	1746	    2,533	0.0062	817	tur_news_2014_00892003
9861	Bir yıl sonra Eylül 1980’de Irak, İran’a savaş açtı.	Y	açtı	1747	    2,532	0.0062	416	tur_news_2005_00152506
9862	Bu yeniden büyük Türkiye’nin yolunu açtı.	Y	açtı	1747	    2,532	0.0062	575.5714	tur_news_2018_00277753
9863	Yolu demokrasi açtı Bu, İspanya’nın AB üyesi olduğu 1986 yılından beri üçüncü başkanlığı.	Y	açtı	1747	    2,532	0.0062	699.9231	tur_news_2005_00459814
9864	15 yıldır hizmet veren Ege Sanat Merkezi de sezonu açtı.	Y	açtı	1747	    2,532	0.0062	848.1111	tur_news_2014_00004552
9865	Deneyimli olduğu için de sezonu erken açtı.	Y	açtı	1747	    2,532	0.0062	1162.5714	tur_news_2018_00337368
9866	Bizden önce de burada yaşayan insanlar vardı.	Y	bizden	1748	    2,531	0.0062	458.2857	tur_news_2005_00302987
9867	Bu konularda Amerika bizden ileri değil, Avrupa bizden ileri değil.	Y	bizden	1748	    2,531	0.0062	617.4286	tur_news_2005_00567861
9868	Bunun üzerine yönetim işi bizden rica etti.	Y	bizden	1748	    2,531	0.0062	786	tur_news_2014_00280922
9869	Tabii, bizden evvel başlamış olabilir; ama 39 tane baraj bu dönemde yapıldı.	Y	bizden	1748	    2,531	0.0062	1077.7273	tur_news_2005_00890441
9870	Olacak ya bizden önce de Amerikalı gazeteciler varmış.	Y	bizden	1748	    2,531	0.0062	1233.375	tur_news_2014_00718116
9871	Birlikte pek ï¿½ok yer, insan gï¿½rdï¿½k.	Y	gï	1749	    2,530	0.0062	825	tur_news_2014_00195706
9872	Bunlar Mayï¿½s baï¿½ï¿½ndan itibaren her gï¿½n kontrol edilir.	Y	gï	1749	    2,530	0.0062	889	tur_news_2014_00272648
9873	Bilinen tek gerï¿½ek o gï¿½nden sonra Dr.	Y	gï	1749	    2,530	0.0062	898.2222	tur_news_2014_00180570
9874	Her gï¿½n yeni bir ï¿½ey gï¿½rï¿½yoruz.	Y	gï	1749	    2,530	0.0062	1139.1111	tur_news_2014_00518210
9875	Her gï¿½n yï¿½kamak iyi gelir!	Y	gï	1749	    2,530	0.0062	1143.8571	tur_news_2014_00518211
9876	Bunun da beklenen bir durum olması lazım.	Y	beklenen	1750	    2,529	0.0062	407.4286	tur_news_2018_00244175
9877	Bu yaş için kadın ve erkek arasındaki beklenen yaşam süresi farkı 5 yıl.	Y	beklenen	1750	    2,529	0.0062	608	tur_news_2018_00276718
9878	Şahin, seçim sonrası beklenen konuşmasını bir kez daha yaptı…	Y	beklenen	1750	    2,529	0.0062	811.7778	tur_news_2014_00795626
9879	Gerçekten onlardan beklenen bu kadar basit mi?	Y	beklenen	1750	    2,529	0.0062	880.1429	tur_news_2014_00472346
9880	Yaşına uygun şekilde yapması beklenen ne varsa kendisinin yapması için ona şans verin.	Y	beklenen	1750	    2,529	0.0062	1205.4167	tur_news_2018_00958587
9881	Başkan Öz’den, Türkiye’de Bir İlk!	Y	öz	1751	    2,528	0.0062	347.7143	tur_news_2014_00151314
9882	Bolu’ya ulaşım İzmir’den tek bir firma ile oluyor, Öz Bolu Seyahat.	Y	öz	1751	    2,528	0.0062	672.9167	tur_news_2014_00214934
9883	Evet para gider, gelir ama öz aynı kalır.	Y	öz	1751	    2,528	0.0062	806.875	tur_news_2005_00975144
9884	Mehmet ÖZ Edebiyat Tarih 92 Y.Doç.Dr.	Y	öz	1751	    2,528	0.0062	972.5714	tur_news_2005_00619804
9885	Mehmet ÖZ - Tüm Köşe Yazıları - Sayfa 5Uygulamada okumaya devam et.	Y	öz	1751	    2,528	0.0062	1439.8	tur_news_2018_00648469
9886	Bu gün Kürt sorunu diye bi sorun var mı Türkiye’de?	Y	bi	1752	    2,527	0.0062	376.1818	tur_news_2014_00246095
9887	Ama sadece “adam” gibi bi yandan da.	Y	bi	1752	    2,527	0.0062	426.1429	tur_news_2018_00042949
9888	Ancak artık “Bir tek ev ve iş demek” övünülecek bi şey değildir.	Y	bi	1752	    2,527	0.0062	616.5833	tur_news_2014_00083249
9889	Asıl iş onu geçirmek zaten o ayrı bi iş ki.	Y	bi	1752	    2,527	0.0062	705.7778	tur_news_2018_00074226
9890	Bi insanın cumhurbaşkanı olması demek onun her konuda bilirkişi olması anlamına mı gelir?	Y	bi	1752	    2,527	0.0062	783.4167	tur_news_2018_00137725
9891	Bunun üzerine söz konusu kararlar ile, İ.Ü.	Y	i̇	1752	    2,527	0.0062	608.75	tur_news_2005_00690608
9892	Terk 351 Sevgi TÜRK İzmir Özel Ege İ.Ö.O.	Y	i̇	1752	    2,527	0.0062	845.7778	tur_news_2005_00565614
9893	Sağlık Bilimleri Enstitüsü yönetim kurulu üyeliği, Kasım 2001 tarihinden itibaren de İ.Ü.	Y	i̇	1752	    2,527	0.0062	999.3333	tur_news_2005_00614369
9894	Mimar Atatürk Kız Lisesi, 1956 İ.T.Ü.	Y	i̇	1752	    2,527	0.0062	1122.1429	tur_news_2005_00325576
9895	Hz. MUHAMMED’İ ÖRNEK ALMAK: Müslümanlar için şüphesiz ki en güzel ahlak örneği Hz. Muhammed’dir.	Y	i̇	1752	    2,527	0.0062	1285	tur_news_2005_00382801
9896	Yani Bakan sayısının 16 olması bir şey ifade etmiyor.	Y	sayısının	1753	    2,525	0.0062	713.125	tur_news_2018_00945868
9897	Toplam sporcu sayısının yüzde 20’si üzerinde yapıldı.	Y	sayısının	1753	    2,525	0.0062	928.1429	tur_news_2018_00879472
9898	Ancak toplantı yeter sayısının üçte bir, yani 134’ün üzerinde olması gerektiği konusunu gündeme getiren olmadı.	Y	sayısının	1753	    2,525	0.0062	1042.9333	tur_news_2014_00092363
9899	Öğrenci sayısının ilerleyen günlerde 100’ün üzerinde olacağı tahmin ediliyor.	Y	sayısının	1753	    2,525	0.0062	1065	tur_news_2018_00695965
9900	Kararlar üye tam sayısının çoğunluğu ile alınır.	Y	sayısının	1753	    2,525	0.0062	1227.8571	tur_news_2005_00631708
9901	Sonuç olarak Turizm sektörü hem Türkiye, hem Bursa için çok önemli.	Y	sektörü	1754	    2,524	0.0062	404.7	tur_news_2018_00834246
9902	Türkiye’de de mobil iletişim sektörü 1994’ten bu yana büyük bir gelişme göstermektedir.	Y	sektörü	1754	    2,524	0.0062	727.3333	tur_news_2005_00032276
9903	Biri inşaat sektörü, diğeri de eğitim sektörü.	Y	sektörü	1754	    2,524	0.0062	973.6667	tur_news_2014_00191095
9904	Burası sanayi bölgesi ve tekstil sektörü yoğun.	Y	sektörü	1754	    2,524	0.0062	1091.7143	tur_news_2014_00289705
9905	Telekomünikasyon sektörü bence her zaman heyecan veriyor.	Y	sektörü	1754	    2,524	0.0062	1286.5714	tur_news_2005_00226635
9906	Tabii bu daha da tehlikeli bir soru.	Y	tehlikeli	1754	    2,524	0.0062	429	tur_news_2018_00855202
9907	Hatta belki şu an Afganistan Irak’tan da tehlikeli bir hal aldı.	Y	tehlikeli	1754	    2,524	0.0062	699.8333	tur_news_2014_00504741
9908	Ya da bence de en doğrusu, Teknik Direktörü olmayan bir takımın tehlikeli bir takım olabileceği.	Y	tehlikeli	1754	    2,524	0.0062	849	tur_news_2018_00940188
9909	Maalesef, programda çok tehlikeli bir yol almıştır dünyada.	Y	tehlikeli	1754	    2,524	0.0062	1004	tur_news_2005_00892559
9910	Bu beton ekonomisi orta ve uzun vadede tehlikeli!	Y	tehlikeli	1754	    2,524	0.0062	1215.875	tur_news_2014_00229667
9911	Yani iyi iş yapan bir takımı korumak bir anlamda iyi transfer yapmak demektir.	Y	korumak	1755	    2,522	0.0062	562.6364	tur_news_2018_00948117
9912	Sorumlu olduğu koyu korumak onun için her şeyden önce gelmektedir.	Y	korumak	1755	    2,522	0.0062	992.7	tur_news_2018_00837049
9913	Sadece kendimi korumak adına ateş ettim.” dedi.	Y	korumak	1755	    2,522	0.0062	1022.8571	tur_news_2018_00778031
9914	Polisin görevi tek bir adamı mı korumak.	Y	korumak	1755	    2,522	0.0062	1025	tur_news_2014_00772755
9915	O zaman vatandaşın hakkını korumak bize düşüyor.	Y	korumak	1755	    2,522	0.0062	1245.7143	tur_news_2014_00754293
9916	Dünyanın dört bir yanında pek çok engelli yaşıyor.	Y	engelli	1756	    2,517	0.0062	638.375	tur_news_2014_00394415
9917	Engelli olan kişi bir çocuk olduğunda ailesinin bu konuda ikna ve teşvik edilmesi gerekir.	Y	engelli	1756	    2,517	0.0062	818.3571	tur_news_2005_00929854
9918	Peki iş bekleyen engelli sayısında artış var mı yok mu?	Y	engelli	1756	    2,517	0.0062	914.3	tur_news_2018_00753042
9919	İnşallah bu maç engelli arkadaşlarımız için bir ses getirir dedi.	Y	engelli	1756	    2,517	0.0062	1055.1	tur_news_2014_00557344
9920	Dün engelli vatandaşlarımızın bir tespiti bile yoktu.	Y	engelli	1756	    2,517	0.0062	1319.7143	tur_news_2018_00361817
9921	Bu idari yapı 2017’ye kadar devam eder.	Y	idari	1757	    2,516	0.0062	398.5714	tur_news_2018_00216588
9922	Sağlık ocağı ve sağlık evi vardır ama idari ekip yoktur.	Y	idari	1757	    2,516	0.0062	898.8889	tur_news_2014_00794661
9923	Türkiye’nin idari teşkilatı: Merkez teşkilatı ve yerinden yönetim kuruluşları.	Y	idari	1757	    2,516	0.0062	979.2222	tur_news_2005_00725889
9924	Kamu sektöründe idari organizasyon çalışmaları yol ve yöntemleri.	Y	idari	1757	    2,516	0.0062	1114.25	tur_news_2005_00676824
9925	Gebze Yüksek Teknoloji Enstitüsü’nün ilk “idari personeli”	Y	idari	1757	    2,516	0.0062	1198	tur_news_2014_00459696
9926	Bugün Türkiye’de 67 milyon mobil kullanıcı var.	Y	mobil	1758	    2,515	0.0062	475.1429	tur_news_2014_00246982
9927	Çin’de ise her ay 5 milyon kişi mobil telefon alıyor.	Y	mobil	1758	    2,515	0.0062	478.1	tur_news_2005_00266810
9928	Üçüncü sırada yer alan Amerika’da ise yaklaşık 150 milyon kişi mobil telefon kullanıyor.	Y	mobil	1758	    2,515	0.0062	623.6923	tur_news_2005_00575086
9929	Türkiye’de mobil pazarlama dönemi başladı Mobil pazarlama hem dünyada hem de Türkiye’de yepyeni bir kavram.	Y	mobil	1758	    2,515	0.0062	1014	tur_news_2005_00764376
9930	“E–Kocaeli” mobil uygulaması vatandaşlara ücretsiz olarak hizmet veriyor.	Y	mobil	1758	    2,515	0.0062	1067.6667	tur_news_2018_00379090
9931	En iyi sonucu elde etmek için haftada bir gün bunu iki kez yapın.	Y	haftada	1759	    2,514	0.0062	423.3077	tur_news_2018_00391209
9932	Olay ve ölüm sayısı en az haftada bir kez bildirilir.	Y	haftada	1759	    2,514	0.0062	687.5	tur_news_2005_00804455
9933	Bu yüzden haftada bir kere de olsa vatandaşın balık alması gerekiyor.	Y	haftada	1759	    2,514	0.0062	919.1818	tur_news_2018_00283273
9934	Bugün sahaya çıkacak kadro var. gelecek haftada.	Y	haftada	1759	    2,514	0.0062	1154	tur_news_2018_00213057
