ORDER	SENTENCE	WORD	RANK	COUNT	COUNT_REL	INDEX	ID
14001	Das sind zwei Prozent weniger als 2014, aber vier Prozent mehr als im Durchschnitt der letzten sechs Jahre.	durchschnitt	2213	    1,604	0.0034	239	german_de_news_2015_00200897
14002	Und wie viel Geld werden die Betroffenen im Durchschnitt weniger bekommen?	durchschnitt	2213	    1,604	0.0034	400.3636	german_de_news_2015_00844463
14003	Im internationalen Vergleich bewegt sich die Schweiz aber immer noch über dem Durchschnitt.	durchschnitt	2213	    1,604	0.0034	469	german_de_news_2014_00568199
14004	Das ist doppelt so viel wie im EU-Durchschnitt.	durchschnitt	2213	    1,604	0.0034	533.7778	german_de_news_2014_00183404
14005	«Kein anderer Kanton ist näher beim Durchschnitt als der Kanton Bern.»	durchschnitt	2213	    1,604	0.0034	809.8	german_de_news_2013_00653014
14006	Dann schaut sich der Helmut das an und sagt: „Ja, ja, das ist gut!	helmut	2214	    1,603	0.0034	407.4167	german_de_news_2013_00160754
14007	Das hätte ich von Helmut nie erwartet.	helmut	2214	    1,603	0.0034	466.2857	german_de_news_2015_00179012
14008	Das ist einfach so, hat Helmut Schmidt gesagt.	helmut	2214	    1,603	0.0034	584.75	german_de_news_2014_00183954
14009	Helmut Schmidt geht es offenbar wieder besser.	helmut	2214	    1,603	0.0034	658.1429	german_de_news_2015_00529132
14010	Helmut Schmidt „Gott sei Dank, es ist vorbei!	helmut	2214	    1,603	0.0034	917.75	german_de_news_2015_00529133
14011	Die sind nicht erst in diesem Jahr eingeführt worden.	eingeführt	2215	    1,602	0.0034	305.7778	german_de_news_2015_00362225
14012	Denn wenn der Zoll in Deutschland Waren findet, die nicht eingeführt werden dürfen, kann das teuer werden.	eingeführt	2215	    1,602	0.0034	422.4375	german_de_news_2013_00235418
14013	Im März dieses Jahres waren den Angaben zufolge ganze 125 Tonnen eingeführt worden.	eingeführt	2215	    1,602	0.0034	533.4167	german_de_news_2015_00565122
14014	Das heisst, dass diese Steuer durchaus in einer anderen Form eingeführt werden kann.	eingeführt	2215	    1,602	0.0034	598.9231	german_de_news_2014_00180315
14015	Die CDU alleine hätte diesen niemals eingeführt.	eingeführt	2215	    1,602	0.0034	945.7143	german_de_news_2014_00301326
14016	Wir stellen Ihnen drei Alternativen vor, die es in sich haben.	alternativen	2216	    1,601	0.0034	280	german_de_news_2013_00968018
14017	Und er sei richtig, weil es Alternativen gebe.	alternativen	2216	    1,601	0.0034	450.375	german_de_news_2013_00872400
14018	Weshalb sich auf den Seiten die Frage nach den Alternativen stellt.	alternativen	2216	    1,601	0.0034	563.1	german_de_news_2013_00947036
14019	In einer solchen Situation haben linke Alternativen keine guten Chancen.	alternativen	2216	    1,601	0.0034	672.4	german_de_news_2015_00587806
14020	Bahn und Bund müssten andere Alternativen prüfen.	alternativen	2216	    1,601	0.0034	948.8571	german_de_news_2013_00095126
14021	Je besser es den Menschen geht, desto weniger Kinder haben sie.	desto	2216	    1,601	0.0034	333.5455	german_de_news_2013_00641362
14022	Je mehr Wohnungen, desto mehr Menschen in der Stadt und desto mehr Autos auf den Straßen.	desto	2216	    1,601	0.0034	509.3846	german_de_news_2014_00613981
14023	Je länger wir warten würden, desto schwerer wäre es für uns alle.	desto	2216	    1,601	0.0034	598.6667	german_de_news_2014_00613833
14024	Je höher die Zahl, desto höher der Gewinn.	desto	2216	    1,601	0.0034	745.2857	german_de_news_2013_00643773
14025	Je mehr ArbeitGEBER, desto MEHR Arbeitsplätze.	desto	2216	    1,601	0.0034	1294.2	german_de_news_2014_00613904
14026	Vor allem, wenn die es auch noch drauf haben.	drauf	2217	    1,600	0.0034	287	german_de_news_2015_00873264
14027	Aber ich bin gut drauf und ich freue mich schon, dass es los geht.	drauf	2217	    1,600	0.0034	463.9231	german_de_news_2013_00015069
14028	Ein Konto ist wichtig, macht aber nur Sinn, wenn auch etwas „drauf“ ist.	drauf	2217	    1,600	0.0034	555.3333	german_de_news_2015_00423832
14029	Wer nichts weiß und nichts wissen will, zahlt drauf.	drauf	2217	    1,600	0.0034	675	german_de_news_2014_00916477
14030	Trotzdem zahlt der Staat kräftig drauf.	drauf	2217	    1,600	0.0034	1256.3333	german_de_news_2013_00853827
14031	Es geht um Menschen, die wegen Krankheit nicht mehr arbeiten können.	krankheit	2217	    1,600	0.0034	290.2727	german_de_news_2013_00484987
14032	Dennoch ging er die Krankheit aktiv an: «Ich wollte kein Opfer sein.»	krankheit	2217	    1,600	0.0034	466	german_de_news_2015_00227555
14033	Unklar ist, um welche Krankheit es sich handelt.	krankheit	2217	    1,600	0.0034	551	german_de_news_2014_00855549
14034	Insgesamt waren bislang 119 Fälle der Krankheit bekannt.	krankheit	2217	    1,600	0.0034	686.4286	german_de_news_2014_00601705
14035	Manchmal steckt auch eine Krankheit dahinter.	krankheit	2217	    1,600	0.0034	1141.5	german_de_news_2013_00679988
14036	Das liege daran, dass sie immer wieder mit der Sprache zu tun hatte.	liege	2217	    1,600	0.0034	374.3077	german_de_news_2015_00189425
14037	In Berlin liege sie künftig bei sechs.	liege	2217	    1,600	0.0034	477.4286	german_de_news_2013_00606562
14038	Es liege im Interesse des Unternehmens, dem Kunden eine Rechnung zu stellen.	liege	2217	    1,600	0.0034	595.6667	german_de_news_2014_00470271
14039	Das Ergebnis liege im Rahmen der Erwartungen.	liege	2217	    1,600	0.0034	707.7143	german_de_news_2014_00172595
14040	Der Focus liege auf der Ausbildung der Jugend.	liege	2217	    1,600	0.0034	1132.8333	german_de_news_2013_00256220
14041	Aber was ist denn dann der Inhalt, wenn nicht die Personen, um die es geht?	inhalt	2218	    1,599	0.0034	235.7857	german_de_news_2014_00017066
14042	Der neue Inhalt steht dann zur Verfügung.	inhalt	2218	    1,599	0.0034	457.8571	german_de_news_2014_00261536
14043	Dieser werde den Inhalt über die Medien erfahren.	inhalt	2218	    1,599	0.0034	543.5	german_de_news_2014_00360025
14044	Zu Anlass und Inhalt machte der Sprecher keine Angaben.	inhalt	2218	    1,599	0.0034	653	german_de_news_2013_00979035
14045	Für Text und Inhalt ist ausschließlich die Börsen-Zeitung verantwortlich.	inhalt	2218	    1,599	0.0034	889.4	german_de_news_2014_00507564
14046	Das ist auch immer wieder das Ergebnis von Studien.	studien	2218	    1,599	0.0034	369.25	german_de_news_2013_00184549
14047	Das Ergebnis muss durch weitere Studien bestätigt werden.	studien	2218	    1,599	0.0034	494.75	german_de_news_2013_00174068
14048	Auch die Grünen geben Studien in Auftrag.	studien	2218	    1,599	0.0034	635.8571	german_de_news_2014_00071195
14049	Mich erinnern diese Studien stark an früher.	studien	2218	    1,599	0.0034	791	german_de_news_2013_00693774
14050	Nicht jeden Forscher überzeugen diese Studien.	studien	2218	    1,599	0.0034	985.3333	german_de_news_2014_00705464
14051	Das geht sich auf Dauer mit mehr Menschen nicht aus.	dauer	2219	    1,598	0.0034	257	german_de_news_2015_00175243
14052	Muss auf Dauer aber wirklich nicht sein.	dauer	2219	    1,598	0.0034	393.1429	german_de_news_2013_00714279
14053	Die Schweiz, sagt sie, werde auf Dauer eher nicht die dritte Heimat werden.	dauer	2219	    1,598	0.0034	479.3333	german_de_news_2013_00370842
14054	Die Polizei könne dieses Problem auf Dauer nicht lösen.	dauer	2219	    1,598	0.0034	580	german_de_news_2015_00342166
14055	Die Dauer der Förderung könne auf 15 Jahre verlängert werden.	dauer	2219	    1,598	0.0034	789.2222	german_de_news_2014_00302644
14056	Das Foto zeigt Jens vor zehn Jahren in seinem Haus.	jens	2220	    1,597	0.0034	385.7	german_de_news_2013_00176052
14057	Mit Jens Keller die Saison zu Ende zu spielen wäre richtig.	jens	2220	    1,597	0.0034	553.7	german_de_news_2014_00676314
14058	Ob er sich auf Weihnachten freue, wurde Jens Keller gefragt und was es zu essen gebe.	jens	2220	    1,597	0.0034	728.3125	german_de_news_2013_00752217
14059	Man hätte Jens Keller weiter vertrauen müssen.	jens	2220	    1,597	0.0034	849.8571	german_de_news_2014_00651621
14060	Nachfolger Jens Keller (bislang Coach de.	jens	2220	    1,597	0.0034	1215.5	german_de_news_2013_00724544
14061	Was muss ich also tun, dass die Leute mit dem Herzen dabei sind?	herzen	2221	    1,595	0.0034	276.6154	german_de_news_2013_00923336
14062	Er kam langsam auf mich zu, und ich sah, dass ihm etwas auf dem Herzen lag.	herzen	2221	    1,595	0.0034	422	german_de_news_2015_00442064
14063	»Sie folgt einfach ihrem Herzen«, heißt es über Merkel an einer Stelle.	herzen	2221	    1,595	0.0034	490.5	german_de_news_2015_00768113
14064	Man wächst mit diesem Verein im Herzen auf», sagt Lang.	herzen	2221	    1,595	0.0034	564.6	german_de_news_2015_00648354
14065	Wir sitzen mitten im Herzen von Europa.	herzen	2221	    1,595	0.0034	837.1429	german_de_news_2013_00967674
14066	Unter dem Strich stehen aber immer noch 403 Millionen Euro.	strich	2222	    1,594	0.0034	317.8889	german_de_news_2013_00886864
14067	Es kam nur noch ein Mini-Gewinn von unter dem Strich 181 Millionen Dollar heraus.	strich	2222	    1,594	0.0034	486.5	german_de_news_2014_00469316
14068	Das Buch hat den Strich über die Grenzen Deutschlands hinaus bekannt gemacht.	strich	2222	    1,594	0.0034	566.25	german_de_news_2015_00168522
14069	Der Gewinn unter dem Strich legte sogar überraschend zu.	strich	2222	    1,594	0.0034	670.4444	german_de_news_2014_00250651
14070	Ein Schuss wie ein Strich.	strich	2222	    1,594	0.0034	1109	german_de_news_2015_00427006
14071	Wie kommt ihr denn alle darauf, dass der Typ keine Antwort bekommen hat.	typ	2222	    1,594	0.0034	304.2308	german_de_news_2013_00953432
14072	Ich weiss nicht, dazu ist er eigentlich nicht der Typ spieler.	typ	2222	    1,594	0.0034	492.4	german_de_news_2013_00582450
14073	Er ist nicht mein Typ. Oder irgendwie doch.	typ	2222	    1,594	0.0034	569.625	german_de_news_2014_00446319
14074	Das Bild mag vielen gefallen, der Typ dahinter gehört aber dazu.	typ	2222	    1,594	0.0034	683.3636	german_de_news_2013_00169898
14075	Was passt zu meinem Typ?	typ	2222	    1,594	0.0034	1053.6	german_de_news_2014_00896229
14076	Das hatte dieser allerdings auch nicht behauptet.	behauptet	2223	    1,593	0.0034	365.1429	german_de_news_2013_00181588
14077	Das habe man „schon immer so“ gefordert“, behauptet er.	behauptet	2223	    1,593	0.0034	450	german_de_news_2014_00178617
14078	Das behauptet nun zumindest der Hersteller.	behauptet	2223	    1,593	0.0034	578.1667	german_de_news_2013_00168579
14079	Antwort schreiben weitere Kommentare (10) Ständig wird behauptet, der Kampf gegen Terroristen sei Krieg.	behauptet	2223	    1,593	0.0034	695.7692	german_de_news_2015_00061610
14080	Hatte das vorher jemand behauptet?	behauptet	2223	    1,593	0.0034	879.2	german_de_news_2014_00532353
14081	Und jetzt will gerade der auf „digital“?	digital	2223	    1,593	0.0034	380	german_de_news_2014_00847816
14082	Mit der Kleinen DIGITAL sind Sie am Ball!	digital	2223	    1,593	0.0034	478.625	german_de_news_2014_00672219
14083	Der Film soll allerdings irgendwann später auch über andere Digital-Dienste verfügbar gemacht werden.	digital	2223	    1,593	0.0034	626.1429	german_de_news_2015_00247176
14084	In den letzten zehn Jahren lag sein Fokus auf Digital Media und Technologie.	digital	2223	    1,593	0.0034	669.5385	german_de_news_2014_00582180
14085	Alles ist alles, sämtliche Medien sind digital.	digital	2223	    1,593	0.0034	815	german_de_news_2013_00031331
14086	Da sieht man auch, wie schnell der „österreichische Film“ auch wieder weg ist.	österreichische	2223	    1,593	0.0034	327.5	german_de_news_2013_00183251
14087	Ja es gibt dort auch österreichische Firmen und es gibt eine österreichische Botschaft.	österreichische	2223	    1,593	0.0034	530.8	german_de_news_2013_00639664
14088	Die österreichische Polizei erwartet für Montag erneut Tausende von Flüchtlingen aus Ungarn.	österreichische	2223	    1,593	0.0034	719.8333	german_de_news_2015_00339823
14089	Das österreichische Team hat Gold verdient.	österreichische	2223	    1,593	0.0034	793	german_de_news_2013_00196618
14090	Österreichische Käufer haben sich nicht gemeldet.	österreichische	2223	    1,593	0.0034	1071.6667	german_de_news_2014_00729284
14091	Aber wir müssen unsere Spieler immer auf den Positionen bringen, wo sie am besten sind.	positionen	2223	    1,593	0.0034	289.2667	german_de_news_2014_00018012
14092	Da geht der Überblick verloren und das gilt etwa auch für die Positionen der einzelnen Spieler.	positionen	2223	    1,593	0.0034	422.9333	german_de_news_2014_00147292
14093	Am Nachmittag haben wir ein paar Positionen verloren, dafür aber einen Platz in den Top 15 behauptet.	positionen	2223	    1,593	0.0034	512.3125	german_de_news_2013_00048581
14094	Dazu haben auch die Grünen klare Positionen.	positionen	2223	    1,593	0.0034	667	german_de_news_2015_00216226
14095	Vorher war der Österreicher in verschiedenen Positionen bei Red Bull tätig.	positionen	2223	    1,593	0.0034	977.2727	german_de_news_2013_00910387
14096	Und das sollte im 21. Jahrhundert doch nicht mehr sein!	jahrhundert	2224	    1,592	0.0034	289.8889	german_de_news_2013_00868664
14097	Und dann fiel einem wieder ein, dass man ja nicht im Film, sondern im 21. Jahrhundert lebt.	jahrhundert	2224	    1,592	0.0034	387.3333	german_de_news_2015_00830615
14098	Dort muss es um Ideen für das 22. Jahrhundert gehen.	jahrhundert	2224	    1,592	0.0034	493.7778	german_de_news_2014_00399410
14099	Italien hatte im 6. Jahrhundert etwa fünf bis sechs Millionen Einwohner.	jahrhundert	2224	    1,592	0.0034	606.2	german_de_news_2015_00603405
14100	Die Häuser entstanden im 17. Jahrhundert.	jahrhundert	2224	    1,592	0.0034	1195	german_de_news_2013_00337961
14101	Doch nach dem 31. August habe sich kein Mitarbeiter des Konzerns mehr sehen lassen.	konzerns	2224	    1,592	0.0034	307.2308	german_de_news_2015_00391698
14102	Mehr als die Hälfte der Investitionen des Konzerns gingen von April bis Juni 2014 in dieses Projekt.	konzerns	2224	    1,592	0.0034	474.75	german_de_news_2014_00658536
14103	Damit ist der Gewinn in etwa doppelt so groß wie der des Volkswagen-Konzerns im zweiten Quartal des laufenden Jahres.	konzerns	2224	    1,592	0.0034	609.9444	german_de_news_2014_00152436
14104	Porsche-Chef Matthias Müller kann sich durchaus vorstellen, mal an der Spitze des VW-Konzerns zu stehen.	konzerns	2224	    1,592	0.0034	672	german_de_news_2015_00728503
14105	Die Geschichte des Konzerns in Bildern.	konzerns	2224	    1,592	0.0034	810.8333	german_de_news_2015_00316769
14106	Ich war nicht so schnell wie Andrea und Jorge, aber morgen will ich mich noch etwas verbessern.	andrea	2225	    1,591	0.0034	542.1875	german_de_news_2015_00551655
14107	Andrea verlässt sich auf die Kommentare und sagt nur einmal kurz: „Ich schaue dann jetzt auch mal grad noch in den Spiegel.	andrea	2225	    1,591	0.0034	555.6364	german_de_news_2014_00052654
14108	Ob und wann es wie kommt, kann man derzeit nicht sagen“, sagt seine Sprecherin Andrea Heigl.	andrea	2225	    1,591	0.0034	607.1875	german_de_news_2014_00721010
14109	Dennoch hatte Andrea eine Beziehung mit einem verheirateten Mann – jedoch ohne es zu wissen.	andrea	2225	    1,591	0.0034	681.5714	german_de_news_2015_00227638
14110	Hätte schon in der dritten staffel sterben sollen, zusammen mit andrea.	andrea	2225	    1,591	0.0034	682.2727	german_de_news_2013_00554996
14111	Bei der UBS geht man dagegen immer noch davon aus, dass sich die Euro-Länder und Griechenland einigen können.	ubs	2225	    1,591	0.0034	272.7368	german_de_news_2015_00104277
14112	Wer jetzt noch sein Geld auf der UBS liegen hat, ist selber schuld!	ubs	2225	    1,591	0.0034	453.8462	german_de_news_2013_00944281
14113	Er war bei der UBS für das Amerika-Geschäft verantwortlich.	ubs	2225	    1,591	0.0034	621.5	german_de_news_2014_00455476
14114	«UBS-Aktie wird nun über 20 Franken steigen»	ubs	2225	    1,591	0.0034	674	german_de_news_2013_00859481
14115	Themen UBS Diskussion Selber kommentieren?	ubs	2225	    1,591	0.0034	1444.2	german_de_news_2014_00820480
14116	Da ist die andere Seite besser ausgestattet.“	ausgestattet	2226	    1,590	0.0034	443.5714	german_de_news_2013_00149687
14117	Auch sonst ist es recht gut ausgestattet.	ausgestattet	2226	    1,590	0.0034	482.2857	german_de_news_2013_00076415
14118	Leichter als Luft soll es sein und doch voll ausgestattet.	ausgestattet	2226	    1,590	0.0034	632.7	german_de_news_2014_00642356
14119	Beide dürften ab Werk mit Windows 10 ausgestattet sein.	ausgestattet	2226	    1,590	0.0034	724.25	german_de_news_2015_00100223
14120	Ansonsten ist das Tablet mit der gleichen Hardware ausgestattet.	ausgestattet	2226	    1,590	0.0034	907.1111	german_de_news_2014_00057551
14121	Die Geschichte von Karlsruhe und seinem Stadion: sie ist noch lange nicht zu Ende!	karlsruhe	2226	    1,590	0.0034	342.2857	german_de_news_2014_00318566
14122	Da ist beispielsweise der Mann aus Karlsruhe.	karlsruhe	2226	    1,590	0.0034	456	german_de_news_2014_00149298
14123	Es gibt auch Menschen außerhalb von Karlsruhe, die jeden Tag in die Stadt rein fahren.	karlsruhe	2226	    1,590	0.0034	537.2143	german_de_news_2013_00485474
14124	Bayern hatte bereits im Juli eine Klage in Karlsruhe angekündigt.	karlsruhe	2226	    1,590	0.0034	620.7	german_de_news_2013_00096987
14125	Frankfurt, Stuttgart, Karlsruhe – überall verlor die CDU zuletzt Bürgermeister-Wahlen.	karlsruhe	2226	    1,590	0.0034	971	german_de_news_2013_00514922
14126	Diese stellten sich dem Mann in den Weg.	stellten	2226	    1,590	0.0034	347.625	german_de_news_2015_00359302
14127	Stadt und Land stellten je 6000 Euro zur Verfügung.	stellten	2226	    1,590	0.0034	470	german_de_news_2013_00838516
14128	Solche Fragen also stellten sich in der Pause.	stellten	2226	    1,590	0.0034	585.125	german_de_news_2015_00787641
14129	Zuletzt stellten sie 2012 einen entsprechenden Antrag, doch dieser wurde deutlich abgelehnt.	stellten	2226	    1,590	0.0034	768.3636	german_de_news_2015_00949225
14130	Auch SVP-Vertreter stellten sich offen dagegen.	stellten	2226	    1,590	0.0034	891.2857	german_de_news_2014_00078009
14131	In den kommenden Jahren werden es nicht mehr Beamte werden als bisher.	beamte	2227	    1,589	0.0034	284.8182	german_de_news_2014_00581883
14132	Rund 350 Beamte sollten im Einsatz sein.	beamte	2227	    1,589	0.0034	518.5	german_de_news_2013_00779269
14133	Etwa 100 Beamte sind vor Ort.	beamte	2227	    1,589	0.0034	599.2	german_de_news_2013_00502738
14134	Insgesamt wurden fünf Beamte verletzt.	beamte	2227	    1,589	0.0034	666.6	german_de_news_2014_00601923
14135	Beamte nahmen den Mann fest.	beamte	2227	    1,589	0.0034	970	german_de_news_2014_00098095
14136	Die endet bei fast allen Menschen in dem, was wir jetzt haben.	endet	2227	    1,589	0.0034	262.0833	german_de_news_2014_00307108
14137	Der Tag endet um 17 Uhr.	endet	2227	    1,589	0.0034	523.6	german_de_news_2013_00282061
14138	Am Freitag endet die Abstimmung der SPD-Mitglieder über die große Koalition.	endet	2227	    1,589	0.0034	614.9091	german_de_news_2013_00046214
14139	Mit dem heutigen Beitrag endet diese Serie.	endet	2227	    1,589	0.0034	793.7143	german_de_news_2015_00662967
14140	Ein Drittel der Beziehungen endet nach Weihnachten.	endet	2227	    1,589	0.0034	1081.2857	german_de_news_2014_00411259
14141	Man muss sie dann fragen: Ja, aber was hast du mit ihr gemacht?	hast	2227	    1,589	0.0034	302.1538	german_de_news_2014_00653269
14142	Ich wurde oft gefragt: Hast du es nötig, so viel zu arbeiten?	hast	2227	    1,589	0.0034	521.3333	german_de_news_2015_00553295
14143	Was hast du eigentlich gegen die Polen?	hast	2227	    1,589	0.0034	670	german_de_news_2013_00921173
14144	Und vielleicht hast du Glück..	hast	2227	    1,589	0.0034	781.6	german_de_news_2014_00851688
14145	Du hast gebaut und zerstört.	hast	2227	    1,589	0.0034	1284.6	german_de_news_2014_00403174
14146	Das liegt wohl unter anderem an der Beziehung zu Marcel, die für viele nicht abgeschlossen ist.	marcel	2227	    1,589	0.0034	428.6875	german_de_news_2013_00192798
14147	27 Punkte Vorsprung auf Marcel sind zu wenig.	marcel	2227	    1,589	0.0034	694.2857	german_de_news_2014_00004007
14148	Bei Marcel ist das ähnlich, zumindest ist das mein Eindruck.	marcel	2227	    1,589	0.0034	697.875	german_de_news_2013_00108377
14149	Foto: dpa Marcel Müller erzielte das einzige Tor fürs deutsche Team.	marcel	2227	    1,589	0.0034	797.5455	german_de_news_2013_00512566
14150	Auch Marcel K. ist zur See gefahren.	marcel	2227	    1,589	0.0034	973.5714	german_de_news_2013_00074819
14151	Ein Zuckerberg hat Milliarden und geht jeden Morgen ins Büro, als ob es um sein Leben geht, weil er wirklich die Welt verändern will und sein Unternehmen für das Beste hält, was ihm je passiert ist, sodass er für kein Geld der Welt da aufhören würde.	sodass	2227	    1,589	0.0034	482.5	german_de_news_2014_00434471
14152	Mehr war von der Neuhaus-Elf aber auch nicht zu sehen, sodass es beim 3:0 blieb.	sodass	2227	    1,589	0.0034	527.0667	german_de_news_2013_00689843
14153	Zwei Gegner laufen auf den Ball zu, einer kann ihn gerade noch wegspitzeln sodass der andere ihn nicht mehr erreicht.	sodass	2227	    1,589	0.0034	533.3684	german_de_news_2013_00997518
14154	Für uns ist es das Wichtigste, so viele Punkte wie möglich zu sammeln, sodass wir uns den zweiten Platz in der Teamwertung Ende des Jahres sichern können.	sodass	2227	    1,589	0.0034	543.1154	german_de_news_2013_00528922
14155	Auch wer sein iPhone nach 2 Jahren durch ein neues ersetzt, wirft es nicht weg sondern verkauft oder verschenkt es in der Regel. Sodass man auch noch viele iPhone 4 von 2010 sieht.	sodass	2227	    1,589	0.0034	549.2593	german_de_news_2015_00080195
14156	Das Problem ist doch, wenn die anderen es eh haben, dann möchte ich es schon auch wissen.	eh	2228	    1,588	0.0034	249.6875	german_de_news_2013_00197819
14157	Die sind ja eh eine Stadt.	eh	2228	    1,588	0.0034	438.6667	german_de_news_2014_00364810
14158	Bis dann ist das eh vorbei!»	eh	2228	    1,588	0.0034	545.3333	german_de_news_2015_00122701
14159	Aber ist ja eh egal.	eh	2228	    1,588	0.0034	690	german_de_news_2014_00014413
14160	Was anderes behauptet eh niemand..	eh	2228	    1,588	0.0034	1239.6	german_de_news_2014_00892372
14161	Aber kaufen kann man sich von der Tradition überhaupt nichts.“	tradition	2228	    1,588	0.0034	404.4	german_de_news_2013_00016219
14162	War das Tradition in der Familie?	tradition	2228	    1,588	0.0034	458.5	german_de_news_2013_00916241
14163	Eine alte Tradition ist in Gefahr.	tradition	2228	    1,588	0.0034	613.6667	german_de_news_2013_00433757
14164	Das hängt mit der Tradition zusammen.	tradition	2228	    1,588	0.0034	731.8333	german_de_news_2015_00178200
14165	Weihnachten, Tradition wird groß geschrieben!	tradition	2228	    1,588	0.0034	1272.2	german_de_news_2013_00926964
14166	Wenn die sich nicht an Gesetze halten müssen, braucht Ihr das auch nicht.	gesetze	2229	    1,587	0.0034	302.1667	german_de_news_2013_00935316
14167	Aber wie gesagt, Gesetze gibt es schon genug.	gesetze	2229	    1,587	0.0034	473	german_de_news_2014_00017667
14168	Die Gesetze gelten dann in allen EU-Ländern.	gesetze	2229	    1,587	0.0034	562.125	german_de_news_2014_00318738
14169	Das gelang nicht, weil auch der Glaube die Gesetze der Natur nicht außer Kraft setzen kann.	gesetze	2229	    1,587	0.0034	686.8571	german_de_news_2013_00177748
14170	In Europa haben einzelne Länder inzwischen ähnliche Gesetze eingeführt.	gesetze	2229	    1,587	0.0034	1068.8889	german_de_news_2013_00622598
14171	Kritik übrigens gibt es nicht nur in eine Richtung, also von Bayern an die Adresse Österreichs.	österreichs	2229	    1,587	0.0034	378.375	german_de_news_2015_00627543
14172	Was ist denn jetzt mit Österreichs Nummer 1 los?	österreichs	2229	    1,587	0.0034	542.625	german_de_news_2013_00922278
14173	» Kommentar melden » antworten Und was meinen die anderen 2500 Bürgermeister Österreichs?	österreichs	2229	    1,587	0.0034	620.1	german_de_news_2015_00623318
14174	Österreichs Fußball bewegt sich gerade auf zwei sehr unterschiedlichen Wege nach Europa.	österreichs	2229	    1,587	0.0034	755.9167	german_de_news_2015_00721403
14175	Mehr Ausgaben als Einnahmen - gegen diesen Zustand kämpfen Österreichs Gemeinden.	österreichs	2229	    1,587	0.0034	1091.4	german_de_news_2014_00658845
14176	«Auch das, was wir hier machen ist Marketing», stellte er klar.	marketing	2230	    1,586	0.0034	346	german_de_news_2015_00070038
14177	Das ist in erster Linie für das Marketing gut.	marketing	2230	    1,586	0.0034	537.375	german_de_news_2015_00183922
14178	Da sieht man mal, was Marketing + Soziale Medien für Auswirkungen haben.	marketing	2230	    1,586	0.0034	606.0909	german_de_news_2015_00180475
14179	Thema dieses Mal: „Marketing-Opfer?	marketing	2230	    1,586	0.0034	690	german_de_news_2013_00848861
14180	Nennt sich glaube ich Marketing..	marketing	2230	    1,586	0.0034	925.6	german_de_news_2013_00733775
14181	Bei der Swiss sind es momentan drei Jahre.	swiss	2230	    1,586	0.0034	538.75	german_de_news_2014_00104197
14182	Die Aktien der Swiss Re geben nach.	swiss	2230	    1,586	0.0034	562.4286	german_de_news_2013_00299562
14183	Swiss im zweiten Quartal zurück in den schwarzen Zahlen»	swiss	2230	    1,586	0.0034	613.8889	german_de_news_2013_00845064
14184	Der neue Swiss-CEO arbeitet seit über 25 Jahren im Lufthansa-Konzern.	swiss	2230	    1,586	0.0034	705.2727	german_de_news_2015_00260752
14185	Ab morgen ist Fliegen mit der Swiss teurer.	swiss	2230	    1,586	0.0034	916.75	german_de_news_2015_00019767
14186	Nun wurden die besten von ihnen ausgezeichnet.	ausgezeichnet	2231	    1,585	0.0034	445	german_de_news_2015_00706543
14187	Und der 64-Jährige lebt ja ausgezeichnet damit.	ausgezeichnet	2231	    1,585	0.0034	570.8571	german_de_news_2013_00869282
14188	Die Schüler wurden dafür ausgezeichnet.	ausgezeichnet	2231	    1,585	0.0034	697.4	german_de_news_2014_00352089
14189	Auch dieser Beitrag wurde ausgezeichnet.	ausgezeichnet	2231	    1,585	0.0034	742	german_de_news_2015_00072669
