ORDER	SENTENCE	STATUS	WORD	RANK	COUNT	COUNT_REL	INDEX	ID
24001	لیکن فیصل آباد کی زرعی یونیورسٹی میں،طلبہ نے ہی انڈے کے عالمی دن کو بھرپور انداز سے منایا۔	Y	انڈے	2676	      418	0.0017	506.1053	urd_news_2016_00827531
24002	انسان کے جسم میں داخل کر یہ انڈے دیتے ہیں.	Y	انڈے	2676	      418	0.0017	747	urd_news_2016_00175400
24003	سردی کے موسم میں انڈے کی مانگ میں تیزی سے ہوتا ہے اضافہ.	Y	انڈے	2676	      418	0.0017	787.0833	urd_news_2016_00630872
24004	تین منٹ بعد چار انڈے توڑ کر ڈالیں۔	Y	انڈے	2676	      418	0.0017	952.5	urd_news_2016_00438520
24005	انڈے کے ٹکڑے بڑے بڑے ٹکڑے بڑے بڑے اور خوبصورت دکھائی دینے چاہئیں ۔	Y	انڈے	2676	      418	0.0017	1269.7778	urd_news_2016_00174617
24006	پاکستان نے ایران پر عائد اقتصادی پابندیاں اٹھا لیں اُردو پوائنٹ دنیاکی سب سے بڑی اُردو ویب سائیٹ ہے، جو پچھلے 15سال سے اُردو کی خدمت میں مصروف ہے۔	Y	پابندیاں	2676	      418	0.0017	276.88	urd_news_2016_00360007
24007	مسلم لیگ کے کچھ اراکین اپوزیشن سے ملے ہوئے یا انہوں نے خاموشی اختیار کر رکھی ہے، وزیراعظم،حکومت میڈیا پر پابندیاں لگانے کا کوئی ارادہ نہیں رکھتی لیکن میڈیا کو بھی ذمہ داری کا مظاہرہ کرنا چاہیے، شوکت عزیز کا اعلیٰ سطحی اجلاس سے خطاب ۔	Y	پابندیاں	2676	      418	0.0017	508.2143	urd_news_2016_00871913
24008	خیال رہے کہ امریکا نے گذشتہ برس ایران کے سرکاری ٹیلی ویژن چینل اور اس سے متعلق کئی کمپنیوں پر پابندیاں عائد کر دی تھیں۔	Y	پابندیاں	2676	      418	0.0017	610.6	urd_news_2016_00525266
24009	بین الاقوامی پابندیاں ایرانی گیس کی برآمد پر ہیں۔	Y	پابندیاں	2676	      418	0.0017	680.5556	urd_news_2016_00332997
24010	میڈیا پر پابندیاں لگانے کا ارادہ نہیں، بابر اعوان ۔	Y	پابندیاں	2676	      418	0.0017	1063.8889	urd_news_2016_00857794
24011	انہوں نے کہا کہ پنجاب میں کوئی روپے کی بھی کرپشن نہیں ہو رہی اگر کسی کے پاس کر پشن کے ثبوت ہیں تو وہ عدالتوں میں جائے ہم سامنا کرنے کیلئے تیار ہیں۔	Y	پشن	2676	      418	0.0017	255.4194	urd_news_2016_00226005
24012	انہوں نے کہا کہ ”داعش ‘حکمران اور کر پشن “تینوں ملک کیلئے بڑا خطرہ بن چکے ہیں اور موجودہ حکمرانوں خود نیشنل ایکشن پلان میں رکاوٹ بن چکے ہیں۔	Y	پشن	2676	      418	0.0017	561.32	urd_news_2016_00234449
24013	انہوں نے کہا کہ عمران خان نے قوم کو شعور دیدیا ہے اب قوم پر فرض ہے وہ کر پشن ‘لوٹ مار ُمہنگائی اور بے روزگاری کا تحفہ دینے والے حکمرانوں کے خلاف تبدیلی کی جنگ میں تحر یک انصاف کا ساتھ دیں ۔	Y	پشن	2676	      418	0.0017	637.4872	urd_news_2016_00243734
24014	لاہور،وزیر اعلیٰ ٹاسک فورس برائے انسداد جعلی ادویات کی ملتان روڈ پر کارروائی ’’کر پشن لیگ ‘‘انصاف کی راہ میں’’دیوار چین ‘‘بننا چاہتی ہے ‘چوہدری محمدسرور چیف جسٹس آف پاکستان نجی دورے پر متحدہ عرب امارات جائینگے ایبٹ آباد، ڈی سیٹ ریفرنس ۔	Y	پشن	2676	      418	0.0017	772.4048	urd_news_2016_00822399
24015	”کر پشن لیگ “انصاف کی راہ میں”دیوار چین “بننا چاہتی ہے ‘چوہدری محمدسرور ۔	Y	پشن	2676	      418	0.0017	936.0714	urd_news_2016_00773858
24016	انھوں نے واضح کیا کہ کراچی میں فورسز کے آپریشن سے حتمی نتائج حاصل نہیں کیے جاسکتے اور اس کے لیے صوبائی حکومت کو اپنا کردار ادا کرنے کی ضرورت ہے۔	Y	جاسکتے	2676	      418	0.0017	283.2667	urd_news_2016_00269284
24017	خبر رساں ادارے کو ذرائع نے یہ بھی بتایا ہے کہ حکومت نے مولانا فضل الرحمان کو یہ بھی مینڈیٹ دیا ہے کہ متحدہ ارکان اگر الطاف حسین سے ملاقات کے حوالے سے کہیں تو مولانا فضل الرحمان لندن میں ان سے ملاقات کیلئے بھی جاسکتے ہیں ۔	Y	جاسکتے	2676	      418	0.0017	475.6471	urd_news_2016_00528595
24018	وزیراعلیٰ نے کہا کہ جنوبی پنجاب میں ہوا سے بجلی پیدا کرنے کے مواقع موجود ہیں اوران علاقوں کی نشاندہی کرلی گئی ہے جہاں ہوا سے بجلی کے حصول کے پلانٹ لگائے جاسکتے ہیں ۔	Y	جاسکتے	2676	      418	0.0017	572.7857	urd_news_2016_00979050
24019	کراچی میں قانون نافذ کرنے والے اداروں کی ٹارگٹڈ کارروائیاں،48ملزمان گرفتار قرآن و سنت کے بغیر آزادی کے مقاصد حاصل نہیں کئے جاسکتے، پیر اعجاز ہاشمی شہداء پاکستان کے مقدس خون سے وفا کا عہد کیا جائے۔	Y	جاسکتے	2676	      418	0.0017	748.6667	urd_news_2016_00771778
24020	اچھی کوالٹی کے آم برآمد کئے جاسکتے ہیں۔	Y	جاسکتے	2676	      418	0.0017	1179.25	urd_news_2016_00031913
24021	ڈی سی او ملتان کا کہنا تھا کہ ان کے پاس تحریک انصاف کے رہنما اعجاز حسین جنجوعہ کی تحریر موجود ہے جس میں انہوں نے سکیورٹی اور بجلی کی فراہمی کی ذمہ داری قبول کی۔	Y	جنجوعہ	2676	      418	0.0017	336.1562	urd_news_2016_00571295
24022	جنرل ناصر جنجوعہ نے کہا کہ پوری قوم دہشتگردی کے خاتمے کیلئے متحد ہے ۔	Y	جنجوعہ	2676	      418	0.0017	514.3571	urd_news_2016_00480315
24023	کمانڈر جنرل کمانڈر لیفٹیننٹ جنرل ناصر خان جنجوعہ اور آئی جی ایف سی بلوچستان میجر جنرل محمد اعجاز شاہد بھی ان کے ہمراہ تھے ۔	Y	جنجوعہ	2676	      418	0.0017	615.7143	urd_news_2016_00782181
24024	بتایا جائے کہ مسعود جنجوعہ کہاں ہیں ہمیں انصاف دینا ہے ۔	Y	جنجوعہ	2676	      418	0.0017	697.2727	urd_news_2016_00309624
24025	کمانڈر سدرن کمانڈ ناصر جنجوعہ نے بھی شرکت کی۔	Y	جنجوعہ	2676	      418	0.0017	1169.7778	urd_news_2016_00782214
24026	خواجہ محمد اسلام مسلم لیگ (ن) کے رکن صوبائی اسمبلی ہیں اور وہ پی پی 72 سے الیکشن جیتے تھے ۔	Y	جیتے	2676	      418	0.0017	287.3333	urd_news_2016_00532961
24027	انہوں نے کہا کہ دوسرے دھاندلی کے ذریعے جیتے تو غلط اور تحریک انصاف دھاندلی کے ذریعے الیکشن جیتے تو ٹھیک ہے الیکشن ٹریبونل ان کے خلاف فیصلہ دے تو غلط اور کسی اور کے بارے میں فیصلہ دے تو ٹھیک ہے ۔	Y	جیتے	2676	      418	0.0017	445.96	urd_news_2016_00235893
24028	انہوں نے کہا کہ دہشتگردی سے لوگوں کا سکون تباہ ہوا ہے ملک کی معیشت دہشتگردی کیخلاف جنگ جیتے بغیر بہتر نہیں کی جاسکتی ۔	Y	جیتے	2676	      418	0.0017	516.5	urd_news_2016_00234846
24029	یہ ایک سخت مقابلہ ہو گا جس میں جیتنے والا بہت کم ووٹوں سے جیتے گا۔	Y	جیتے	2676	      418	0.0017	632	urd_news_2016_00131927
24030	بیٹنگ ، باؤلنگ کلک ہوئی تو میچز جیتے جا سکتے ہیں ۔	Y	جیتے	2676	      418	0.0017	1050.6	urd_news_2016_00311553
24031	انہوں نے کہا کہ قواعد و ضوابط میں اس بات کو یقینی بنایا جائے کہ پارٹی میں شامل ہونے والے ہر نوجوان اور ہر خاتون کا ہر سطح پر پارٹی کی ترقی اور فروغ میں اہم کام ہو۔	Y	ضوابط	2676	      418	0.0017	320.4194	urd_news_2016_00245741
24032	انہوں نے کہا کہ سینٹ میں قواعد و ضوابط 1988میں ترامیم پر مشاورت جاری ہے جس پر قائمہ کمیٹی میں کئی اہم امور کو طے کر لیا گیا ہے۔	Y	ضوابط	2676	      418	0.0017	527.24	urd_news_2016_00239760
24033	رانا ثناء اﷲ خان نے میاں محمود الرشید کے مطالبہ کو مسترد کرتے ہوئے کہا کہ آئین و قواعد و ضوابط اس بات کی اجازت دیتے ہیں کہ وزیراعلی یا کوئی بھی دوسرا وزیر پنجاب اسمبلی میں آکر حکومتی موقف بیان کرسکتا ہے۔	Y	ضوابط	2676	      418	0.0017	577.6098	urd_news_2016_00586674
24034	یہ معاہدہ اسلحہ کی سپلائی کے متعلق ضوابط ہیں جن کا مقصد ہتھیاروں کی فراہمی میں بین الاقوامی قوانین کی خلاف ورزی کو روکنا ہے۔	Y	ضوابط	2676	      418	0.0017	724.8261	urd_news_2016_00880063
24035	انہوں نے اتنی مہنگی گاڑی خرید کر قواعد و ضوابط کی خلاف ورزی کی۔	Y	ضوابط	2676	      418	0.0017	987.6154	urd_news_2016_00192121
24036	پاکستان پیپلزپارٹی آزادکشمیر میں اختلافات شدت اختیار کرگئے اُردو پوائنٹ دنیاکی سب سے بڑی اُردو ویب سائیٹ ہے، جو پچھلے 15سال سے اُردو کی خدمت میں مصروف ہے۔	Y	کرگئے	2676	      418	0.0017	374	urd_news_2016_00345855
24037	کراچی میں ٹارگٹ کلنگ اور امن و امان کی خراب صورتحال پر ایم کیو ایم، اے این پی، ن لیگ اور بلوچ قوم پرست جماعتوں کے اراکین ایوان سے واک آوٴٹ کرگئے۔	Y	کرگئے	2676	      418	0.0017	648.8667	urd_news_2016_00771022
24038	جہاں وہ دل کا دورہ پڑنے سے انتقال کرگئے۔	Y	کرگئے	2676	      418	0.0017	878.3333	urd_news_2016_00450316
24039	پشاور بم دھماکہ ،رکن سرحد اسمبلی عالم زیب خان زخموں کی تاب نہ لاتے ہوئے انتقال کرگئے ۔	Y	کرگئے	2676	      418	0.0017	1043.8235	urd_news_2016_00381779
24040	سینئر صحافی ، بابر خیل اعوان انتقال کرگئے ۔	Y	کرگئے	2676	      418	0.0017	1627.2857	urd_news_2016_00656278
24041	وزیر اعظم،اسلام امن و آشتی کا مذہب ہے اس کا دہشتگردی سے کوئی تعلق نہیں، میرے دورہ سے پاک سعودی تعلقات مزید مستحکم ہوں گے۔	Y	آشتی	2677	      417	0.0017	399.75	urd_news_2016_00961601
24042	پاکستان مسئلہ کشمیر سمیت تمام تنازعات بھارت کے ساتھ پر امن طورپر حل کر نا چاہتا ہے تاکہ دونوں ملک امن و آشتی کے ماحول میں ترقی اور استحکام حاصل کر سکیں ۔	Y	آشتی	2677	      417	0.0017	520.4483	urd_news_2016_00357458
24043	ان کے نزدیک اسلام برداشت، امن آشتی اور محبت کرنے کا طریقہ زندگی ہے۔	Y	آشتی	2677	      417	0.0017	660.1429	urd_news_2016_00186774
24044	اسلام محبت امن و آشتی کا مذہب ہے۔	Y	آشتی	2677	      417	0.0017	743.75	urd_news_2016_00094594
24045	اسلام امن و آشتی اور بھائی چارے کا درس دیتا ہے ،ڈی سی او سیالکوٹ سندھ طاس معاہدے کی یکطرفہ معطلی عالمی قوانین کی خلاف ورزی ہے۔	Y	آشتی	2677	      417	0.0017	878.76	urd_news_2016_00093846
24046	انہوں نے کہاکہ انسانی اعضاء کی فروخت کے حوالے سے وزارت صحت کا متعلقہ ادارہ ”ہوتا“ غیر قانونی کام کرنے والوں کے خلاف کارروائی کررہا ہے اور ذمہ دار افراد کو سخت سزا دی جائے گی۔	Y	اعضاء	2677	      417	0.0017	365.2857	urd_news_2016_00216389
24047	اسحاق ڈار انسانی اعضاء کی سمگلنگ,ایف آئی اے نے تحقیقات کا آغاز کردیا پاکستان میں عراق سے بھی زیادہ دہشتگردی کے حملے ہوئے۔	Y	اعضاء	2677	      417	0.0017	478.5833	urd_news_2016_00062597
24048	موقع پر خودکش حملہ آور کا سر اور دیگر جسمانی اعضاء پولیس نے قبضہ میں لے لئے۔	Y	اعضاء	2677	      417	0.0017	591.0588	urd_news_2016_00916019
24049	وزیر اعلیٰ سندھ سید مراد علی شاہ کا لیاری کا دورہ، اہل علاقہ کا احتجاج انسانی اعضاء کی سمگلنگ,ایف آئی اے نے تحقیقات کا آغاز کردیا اسلام آباد: بارہ کہو سے مشکوک افغانی باشندہ گرفتار۔	Y	اعضاء	2677	      417	0.0017	704.2424	urd_news_2016_00974554
24050	رقص کو اعضاء کی شاعری بھی کہا جاتا ہے۔	Y	اعضاء	2677	      417	0.0017	911.7778	urd_news_2016_00596340
24051	واضح رہے کہ پریمیئر ٹی 20 لیگ سعودی عرب کی ڈومیسٹک کرکٹ لیگ ہے جس میں ملک بھر کے تمام کرکٹ کلب حصہ لے رہے ہیں۔	Y	پریمیئر	2677	      417	0.0017	397.9091	urd_news_2016_00944896
24052	پاکستان پریمیئر فٹ بال لیگ کے مزید دو میچ (کل) کھیلے جائیں گے ۔	Y	پریمیئر	2677	      417	0.0017	564.6154	urd_news_2016_00346300
24053	انڈین پریمیئر لیگ کے دوران سب ہی دیکھ چکے ہیں۔	Y	پریمیئر	2677	      417	0.0017	692.7	urd_news_2016_00174334
24054	پاکستان پریمیئر فٹ بال لیگ، دفاعی چیمپئن کے آر ایل کا مقابلہ افغان کلب چمن سے(کل) ہوگا ۔	Y	پریمیئر	2677	      417	0.0017	731.3333	urd_news_2016_00346294
24055	ہالی ووڈ فلم نائٹ اینڈ ڈے کا لندن میں شاندار پریمیئر۔	Y	پریمیئر	2677	      417	0.0017	1150.2727	urd_news_2016_00150772
24056	وزیر اعظم آفس میں ای گورنمنٹ نظام کی تنصیب شروع اُردو پوائنٹ دنیاکی سب سے بڑی اُردو ویب سائیٹ ہے، جو پچھلے 15سال سے اُردو کی خدمت میں مصروف ہے۔	Y	تنصیب	2677	      417	0.0017	294.125	urd_news_2016_00961623
24057	وفاقی وزیر کو بتایا گیا کہ اس ہسپتال کا تعمیراتی کام مکمل ہو چکا ہے اور ضروری آلات کی تنصیب کا کام تیزی سے جاری ہے، ہسپتال آئندہ چند دن میں طبی سہولیات فراہم کرنے کی پوزیشن میں ہو گا۔	Y	تنصیب	2677	      417	0.0017	487.8788	urd_news_2016_00990465
24058	اگر کوئلے کی بات کریں تو ایک کوئلے سے بجلی پیدا کرنے والے پلانٹ کی تنصیب کیلئے بھی 30 ماہ کا عرصہ درکار ہے۔	Y	تنصیب	2677	      417	0.0017	599.4286	urd_news_2016_00140643
24059	عدالت نے سی این جی اسٹیشن کی تنصیب کو روکنے کے احکامات جاری کردئیے ہیں۔	Y	تنصیب	2677	      417	0.0017	641.4	urd_news_2016_00701096
24060	افغانستان کی مخالفت کے باوجود 37کلومیٹر اندر گیٹ کی تنصیب کردی ہے۔	Y	تنصیب	2677	      417	0.0017	968.9091	urd_news_2016_00123433
24061	سندھ اسمبلی ، وزیر اعلی نے جوابات دے کر نئی روایت ڈال دی پی آئی اے کا بعد از حج آپریشن کامیابی سے جاری ہے،ترجمان نواز شریف کی جگہ کسی اور کو وزیر اعظم بنا دیا جائے تو کوئی اعتراض نہیں۔	Y	جوابات	2677	      417	0.0017	346.075	urd_news_2016_00652485
24062	اجلاس میں آئی ڈی پیز کے مسائل کے علاوہ اراکین پارلیمنٹ کی طرف سے جمع کرائے گئے سوالات کے جوابات جبکہ قومی امور پر بحث کی جائے گی۔	Y	جوابات	2677	      417	0.0017	508.12	urd_news_2016_00026877
24063	غیر پیشہ وارانہ جوابات دینے ہیں تو ہم سینیٹ کارروائی کا حصہ نہیں بنیں گے،میں انجینئر نہیں ہوں لیکن جواب تو دے سکتا ہوں۔	Y	جوابات	2677	      417	0.0017	606.9545	urd_news_2016_00720512
24064	سندھ اسمبلی کے سوالات کے غلط جوابات بھیجنے والے افسران کیخلاف کارروائی کی جائے، اسپیکر آغا سراج درانی کی صوبائی وزیر کو ہدایت ۔	Y	جوابات	2677	      417	0.0017	752.6667	urd_news_2016_00652291
24065	جسکے متعلق ابھی تک تسلی بخش جوابات نہیں دئے گئے۔	Y	جوابات	2677	      417	0.0017	1251.5	urd_news_2016_00467972
24066	انہوں نے راحت علی کے نام پر ٹیم انتظامیہ کو اعتماد میں لیا ہے۔	Y	راحت	2677	      417	0.0017	332.3571	urd_news_2016_00202855
24067	راحت کا کہنا ہے کہ مجھے انصاف نہیں ملے گا پولیس نے مقدمے میں فائرنگ کو ہوائی فائرنگ قرار دیا ہے، با اثر افراد نے اقدام قتل کیا ، مجھے مارنے کی دھمکیاں دی جا رہی ہیں۔	Y	راحت	2677	      417	0.0017	550	urd_news_2016_00584952
24068	نقصان زدہ علاقوں کا محکمہ کی طرف سے سروے کیاگیا ہے جہاں راحت کے طورپر کچھ امداد کی گئی ہے۔	Y	راحت	2677	      417	0.0017	724.3889	urd_news_2016_00930775
24069	اس دورے کے دوران سینیٹر سلیم ضیاء ،ایم ایل اے ملک کامران اور ملٹری سیکریٹری ٹو گورنر خیبرپختونخوا کرنل راحت صدیقی بھی ان کے ہمراہ رہے۔	Y	راحت	2677	      417	0.0017	837.68	urd_news_2016_00067657
24070	تکلیف اور راحت دینا اللہ کا اختیار بہادر پورہ میں جلسہ اصلاح معاشرہ۔	Y	راحت	2677	      417	0.0017	1370.5385	urd_news_2016_00434890
24071	چیف جسٹس لاہور ہائیکورٹ نے کہا کہ سائلین کا حق ہے کہ انہیں فوری اور جلد انصاف فراہم کیا جائے۔	Y	سائلین	2677	      417	0.0017	290.6316	urd_news_2016_00492722
24072	محکمہ موسمیات جو ججز سائلین کو انصاف کی فراہمی کے لیے اپنا کردار ادا نہیں کرسکتے وہ گھر جا سکتے ہیں‘ چیف جسٹس لاہور ہائیکورٹ قندیل بلوچ کو گلہ دبا کر قتل کیا گیا ۔	Y	سائلین	2677	      417	0.0017	511.3939	urd_news_2016_00852834
24073	روابط کو بہتر بنائے بغیر ادارے مضبوط نہیں ہوتے، سائلین کو جلد انصاف کی فراہمی اولین مقصد ہے جو ہر صورت پورا ہوگا’سید منصور علی پنجاب حکومت اور عالمی بینک کے مابین زرعی شعبہ کی پائیدار ترقی کیلئے معاہدہ سائنس و ٹیکنالوجی سے متعلق پاک۔	Y	سائلین	2677	      417	0.0017	629.4773	urd_news_2016_00600310
24074	بلاول بھٹو سائلین اور شہریوں کے ساتھ اخلاق کے ساتھ پیش آیا جائے، ایس ایس پی آپریشنز ساجد کیانی کی پولیس افسروں کو ہدایت امجد صابری کے جانے سے پیدا ہونے والے خلا کو پر کرنے میں عشرے لگیں گے۔	Y	سائلین	2677	      417	0.0017	764.3429	urd_news_2016_00327898
24075	ٹوبہ ٹیک سنگھ،مجوزہ فوجی عدالتوں کے قیام کے خلاف ڈسٹرکٹ بار کی مکمل ہڑتال ، سائلین کو سخت پریشانی کا سامنا ۔	Y	سائلین	2677	      417	0.0017	1000.75	urd_news_2016_00445244
24076	کسٹمز پولیس نے ملزم کو موقع پر ہی گرفتار کر لیا۔	Y	کسٹمز	2677	      417	0.0017	322.3636	urd_news_2016_00777064
24077	کسٹمز کی گاڑی کے کھائی میں گر نے سے چار اہلکار جاں بحق ، ایک شدید زخمی وزیر اعظم نواز شریف کی زیر صدارت نیشنل ایکشن پلان اور ملکی سکیورٹی سے متعلق اجلاس، محکمہ صحت بونیر کو جدید خطوط پر استوار کیا جارہا ہے۔	Y	کسٹمز	2677	      417	0.0017	517.0244	urd_news_2016_00777100
24078	کسٹمز کی گاڑی کے کھائی میں گر نے سے چار اہلکار جاں بحق ، ایک شدید زخمی قومی اتحاد ہی شیطانی قوتوں کو بھرپورجواب دے سکتا ہے۔	Y	کسٹمز	2677	      417	0.0017	644.8077	urd_news_2016_00777091
24079	کسٹمز حکام کی ائیرپورٹ پر کارروائی ،موبائل فون سمگلنگ کی کوشش ناکام بنا دی، 519فون ضبط کر لیے گئے ۔	Y	کسٹمز	2677	      417	0.0017	714	urd_news_2016_00777069
24080	کسٹمز کی کارروائی، کروڑوں روپے کا اسمگل شدہ سامان برآمد ۔	Y	کسٹمز	2677	      417	0.0017	1004.8	urd_news_2016_00777082
24081	کشمیر میں اگر وہ جہاد کرتے تھے تو سن دو ہزار میں میرے سامنے ایک محفل میں جنرل مشرف نے اس جہاد کو دہشت گردی کہہ کر بند کرنے کے عزم کااظہار کیا۔	Y	محفل	2677	      417	0.0017	503.7	urd_news_2016_00779467
24082	ضلعی انتظامیہ نے اجازت کے بغیر دن میں دو شو کرنے کی کوشش پر محفل تھیٹر کو سیل کر دیا ۔	Y	محفل	2677	      417	0.0017	572	urd_news_2016_00688379
24083	انہوں نے برادران اسلام بالخصوص نوجوانوں سے اپیل کی کہ اس محفل میں شرکت کریں۔	Y	محفل	2677	      417	0.0017	629.4	urd_news_2016_00199202
24084	اراکین اسمبلی کی ’پرائیویٹ محفل‘ پر پولیس کا چھاپہ ، مقدمہ درج ۔	Y	محفل	2677	      417	0.0017	757.5455	urd_news_2016_00042150
24085	محفل موسیقی کا انعقاد استاد فتح علی خاں اور شریف خان کو خراج عقیدت ۔	Y	محفل	2677	      417	0.0017	1143.5714	urd_news_2016_00850717
24086	ان کی نیند بھی متاثر ہو رہی ہے۔	Y	نیند	2677	      417	0.0017	465.875	urd_news_2016_00184708
24087	دو دن سے پروازیں منسوخ ہونے کے باعث لوگ ائیر پورٹ پر ہی اپنی نیند پوری کرنے لگے۔	Y	نیند	2677	      417	0.0017	629.9444	urd_news_2016_00551079
24088	بچوں میں رات دیر تک ٹی وی دیکھتے رہنے سے نیند کی کمی بیماری کا باعث بن سکتی ہے ‘ تحقیق ۔	Y	نیند	2677	      417	0.0017	691.7	urd_news_2016_00314130
24089	ایک ہفتے کی کم نیند بھی انسانی زندگی’جسم اور دماغ کو شدید متاثر کرسکتی ہے۔	Y	نیند	2677	      417	0.0017	808	urd_news_2016_00135522
24090	تھوڑی ہی دیر میں وہ گہری نیند میں چلا گیا۔	Y	نیند	2677	      417	0.0017	1160.7778	urd_news_2016_00439738
24091	انہوں نے ڈی جی رینجرز سے اپیل کی کہ رینجرز بنیادی مسائل کو حل کرنے میں بھی اپنا کردار ادا کرے تاکہ کراچی آپریشن کے مزید بہترین نتائج حاصل ہوسکیں ۔	Y	ہوسکیں	2677	      417	0.0017	323.7586	urd_news_2016_00202750
24092	انہوں نے بتایا کہ چار لاکھ اسی ہزار روپے کی رقم بس کے اندر ہی مل گئی تھی انکوائری رپورٹ آنے پر حقائق معلوم ہوسکیں گے۔	Y	ہوسکیں	2677	      417	0.0017	482.2692	urd_news_2016_00197405
24093	اس طرح مملکت کے شہریوں کو فوجی معاہدوں کے بارے میں واضح معلومات حاصل ہوسکیں گی۔	Y	ہوسکیں	2677	      417	0.0017	615.6	urd_news_2016_00077812
24094	پولیس کے مطابق ابھی تک حادثے کی وجوہات معلوم نہیں ہوسکیں۔	Y	ہوسکیں	2677	      417	0.0017	728.2727	urd_news_2016_00399769
24095	تاکہ اصل ذمہ داران بے نقاب ہوسکیں ۔	Y	ہوسکیں	2677	      417	0.0017	1322	urd_news_2016_00406017
24096	اس کے بعد دل کو پرنٹ ہونے میں بھی ایک سے دو گھنٹے ہی لگیں گے۔	Y	پرنٹ	2678	      416	0.0016	425.9375	urd_news_2016_00083599
24097	وزیراعظم نواز شریف کے نجی دورہ کی سعودی عرب کے الیکٹرانک اور پرنٹ میڈیا میں بھرپور کوریج جدہ /ریاض (اُردو پوائنٹ اخبار تازہ ترین۔	Y	پرنٹ	2678	      416	0.0016	625.3913	urd_news_2016_00967851
