ORDER	SENTENCE	STATUS	WORD	RANK	COUNT	COUNT_REL	INDEX	ID
2507	اجلاس میں وزیر اعلیٰ سندھ نے وزیر اعظم کو قومی ایکشن پلان کے حوالے سے بھی آگاہ کیا ۔	Y	ایکشن	492	    7,184	0.0285	159.4118	urd_news_2016_00030573
2508	انہوں نے کہا کہ میں نے سب سے پہلے کہا کہ الطاف دہشت گرد ہے اور اس پر 234 کیس ہیں، ایم کیو ایم دہشت گردی میں ملوث ہے اور اس پر کوئی ایکشن نہیں لیا گیا۔	Y	ایکشن	492	    7,184	0.0285	161.3846	urd_news_2016_00258319
2509	انہوں نے کہا کہ ان عناصر کو گرفتار کر کے ان کیخلاف سخت ایکشن لیا جائے۔	Y	ایکشن	492	    7,184	0.0285	177.6667	urd_news_2016_00216571
2510	انہوں نے کہا کہ فوج سوات میں رہے گی تاہم ایکشن نہیں لے گی۔	Y	ایکشن	492	    7,184	0.0285	181.4615	urd_news_2016_00245106
2511	گاڑی کو نقصان اُردو پوائنٹ دنیاکی سب سے بڑی اُردو ویب سائیٹ ہے، جو پچھلے 15سال سے اُردو کی خدمت میں مصروف ہے۔	Y	نقصان	493	    7,164	0.0284	105.3684	urd_news_2016_00796906
2512	اس سے سندھ کو مالی طور پر نقصان ہو گا ۔	Y	نقصان	493	    7,164	0.0284	135.5	urd_news_2016_00072862
2513	اس موقع پر ان کا کہنا تھا کہ ڈاکٹر محمد علی شاہ کا انتقال ایک قومی نقصان ہے۔	Y	نقصان	493	    7,164	0.0284	146.4706	urd_news_2016_00101085
2514	جس سے سندھ حکومت کو فی ایم ایم بی ٹی یو پر 64روپے کا نقصان ہوگا۔	Y	نقصان	493	    7,164	0.0284	172.9333	urd_news_2016_00464787
2515	اسلام آباد میں جاری دھرنوں کے خلاف ہیں ان سے ملک کا نقصان ہو رہا ہے، مولانا یوسف شاہ اُردو پوائنٹ دنیاکی سب سے بڑی اُردو ویب سائیٹ ہے، جو پچھلے 15سال سے اُردو کی خدمت میں مصروف ہے۔	Y	نقصان	493	    7,164	0.0284	176.5	urd_news_2016_00092391
2516	ایف آئی اے مزید تحقیقات کر رہی ہے۔	Y	تحقیقات	494	    7,144	0.0283	139.25	urd_news_2016_00120412
2517	اس لئے مزید تحقیقات ملزم کو 90 روز کے لئے رینجرز کے حوالے کیا جائے۔	Y	تحقیقات	494	    7,144	0.0283	143.5833	urd_news_2016_00095986
2518	ملزم سے تحقیقات کی جا رہی ہے۔	Y	تحقیقات	494	    7,144	0.0283	158.4286	urd_news_2016_00895162
2519	حکومت بی بی سی کی رپورٹ کی تحقیقات کرے ۔	Y	تحقیقات	494	    7,144	0.0283	174.2857	urd_news_2016_00516066
2520	آصف علی زرداری کا تحقیقات پر احتجاج۔	Y	تحقیقات	494	    7,144	0.0283	279.1429	urd_news_2016_00115803
2521	اس موقع پر پیپلز پارٹی کی مقامی قیادت بھی موجود تھی ۔	Y	مقامی	495	    7,129	0.0283	174.0909	urd_news_2016_00102404
2522	کہ یہ صرف مقامی شہریوں کے لیے ہے۔	Y	مقامی	495	    7,129	0.0283	176.25	urd_news_2016_00779970
2523	مقامی لوگوں نے سندھ کے وزیر اعلیٰ اور چیف جسٹس پاکستان سے فوری نوٹس لینے کا مطالبہ کیا ہے۔	Y	مقامی	495	    7,129	0.0283	180.6842	urd_news_2016_00885241
2524	مقامی امن کمیٹی نے تصدیق کی ہے کہ گرفتار کئے جانے والے تمام افراد مقامی ہیں جو تمام امن پسند ہیں جس کے بعد سکیورٹی فورسز نے انہیں رہا کیا ہے ۔	Y	مقامی	495	    7,129	0.0283	183.92	urd_news_2016_00884605
2525	دوسری جانب مقامی طالبان نے کہا ہے کہ وہ انتظامیہ کے ساتھ مذاکرات کے لئے تیار ہیں ۔	Y	مقامی	495	    7,129	0.0283	185.1875	urd_news_2016_00555695
2526	پی ایم ڈی سی کو بھی یونیورسٹی میں تبدیل کیا جا سکتا ہے۔	Y	یونیورسٹی	496	    7,116	0.0282	156.6154	urd_news_2016_00362470
2527	سرگودھا یونیورسٹی ترجمان اُردو پوائنٹ دنیاکی سب سے بڑی اُردو ویب سائیٹ ہے، جو پچھلے 15سال سے اُردو کی خدمت میں مصروف ہے۔	Y	یونیورسٹی	496	    7,116	0.0282	161.4737	urd_news_2016_00633108
2528	ان خیالات کا اظہار انہوں نے گزشتہ روز نجی یونیورسٹی کی تقریب سے خطاب اور میڈیا سے گفتگو کرتے ہوئے کیا ۔	Y	یونیورسٹی	496	    7,116	0.0282	164.2	urd_news_2016_00170964
2529	بتایا جا رہا ہے کہ یونیورسٹی میں 4 دہشت گرد موجود ہیں جن کی جانب سے شدید فائرنگ کی جا رہی ہے۔	Y	یونیورسٹی	496	    7,116	0.0282	168.3889	urd_news_2016_00309600
2530	جی نہیں، یہ ہماری یونیورسٹی کی پارٹی ہے۔	Y	یونیورسٹی	496	    7,116	0.0282	169.375	urd_news_2016_00482219
2531	وزیراعظم نواز شریف نے راولپنڈی میں سی ایم ایچ کا دورہ کیا ۔	Y	راولپنڈی	497	    7,113	0.0282	160.6667	urd_news_2016_00968121
2532	وہ بدھ کو راولپنڈی میں ایک اجلاس کی صدارت کرتے ہوئے خطاب کر رہے تھے ۔	Y	راولپنڈی	497	    7,113	0.0282	164.4667	urd_news_2016_00951599
2533	﻿﻿راولپنڈی میں کرفیو ختم کرنے کا فیصلہ اُردو پوائنٹ دنیاکی سب سے بڑی اُردو ویب سائیٹ ہے، جو پچھلے 15سال سے اُردو کی خدمت میں مصروف ہے۔	Y	راولپنڈی	497	    7,113	0.0282	173.9091	urd_news_2016_00589250
2534	نواز شریف کا راولپنڈی بار سے خطاب ۔	Y	راولپنڈی	497	    7,113	0.0282	174.7143	urd_news_2016_00935291
2535	یاد رہے کہ ان تمام بچوں کا تعلق راولپنڈی اور اسلام آباد سے تھا۔	Y	راولپنڈی	497	    7,113	0.0282	178.1429	urd_news_2016_00039386
2536	وفاقی وزیر نے کہا کہ اس وقت بجلی 15 روپے فی یونٹ تیار ہو رہی ہے۔	Y	فی	498	    7,086	0.0281	208.6667	urd_news_2016_00990832
2537	سی این جی کی فی کلو قیمت میں ایک روپے کا اضافہ کردیا گیا ۔	Y	فی	498	    7,086	0.0281	210.2857	urd_news_2016_00614766
2538	ایل پی جی کی قیمت میں 15 روپے فی کلو کمی کر دی گئی ہے۔	Y	فی	498	    7,086	0.0281	221.2143	urd_news_2016_00144112
2539	انہوں نے کہا کہ ایل پی جی کو 250 روپے کلو تک پہنچا دیا گیا جس کو زیادہ سے زیادہ سو روپے فی کلو ہونا چاہیے تھا۔	Y	فی	498	    7,086	0.0281	239.8182	urd_news_2016_00214449
2540	ملک بھر میں ایل پی جی کی قیمت میں 7روپے فی کلو اضافہ کردیا گیا ۔	Y	فی	498	    7,086	0.0281	241.9286	urd_news_2016_00896505
2541	وہ گزشتہ روز لاہور میں نجی ٹی وی سے گفتگو کر رہے تھے ۔	Y	نجی	499	    7,082	0.0281	149.6923	urd_news_2016_00995014
2542	وہ نجی ٹی وی سے گفتگو کر رہے تھے ۔	Y	نجی	499	    7,082	0.0281	159.1111	urd_news_2016_00997680
2543	وفاقی وزیر قانون کی نجی ٹی وی سے گفتگو ۔	Y	نجی	499	    7,082	0.0281	190.5556	urd_news_2016_00990388
2544	ایک نجی ٹی وی پروگرام میں اظہار خیال کرتے ہوئے کیا۔	Y	نجی	499	    7,082	0.0281	196.3636	urd_news_2016_00136808
2545	آج وہ مقامی نجی یونیورسٹی میں جائیں گے۔	Y	نجی	499	    7,082	0.0281	242.375	urd_news_2016_00031448
2546	پیر کے روز عمران خان اور پی ٹی آئی کے ساتھ کیا ہونے والا ہے۔	Y	والا	500	    7,075	0.0281	126.4286	urd_news_2016_00375987
2547	ان کا تو اجلاس ہونے والا ہے، کیا مودی اور نواز شریف کی ملاقات ہو گی۔	Y	والا	500	    7,075	0.0281	130.9375	urd_news_2016_00178498
2548	اور ایک دن بعد اس میں منتقل ہونے والا تھا۔	Y	والا	500	    7,075	0.0281	152.8	urd_news_2016_00274192
2549	کچھ لوگ کوشش کر رہے ہیں لیکن ان کا ساتھ دینے والا کوئی نہیں۔	Y	والا	500	    7,075	0.0281	157.0714	urd_news_2016_00761022
2550	الطاف حسین نے کہا کہ ایم کیو ایم کو ختم کرنے کی بات کرنے والا خود ختم ہو جائے گا ۔	Y	والا	500	    7,075	0.0281	169.8235	urd_news_2016_00146182
2551	جبکہ دو سو سے زائد زخمی ہیں ۔	Y	سو	501	    7,067	0.028	175.1429	urd_news_2016_00455835
2552	صحت میں سو فیصد اضافہ کیا جائے گا۔	Y	سو	501	    7,067	0.028	189.5	urd_news_2016_00676713
2553	نیشنل ایکشن پلان پر سو فیصد عمل درآمد کو یقینی بنانے کی ہدایت اُردو پوائنٹ دنیاکی سب سے بڑی اُردو ویب سائیٹ ہے، جو پچھلے 15سال سے اُردو کی خدمت میں مصروف ہے۔	Y	سو	501	    7,067	0.028	194.4286	urd_news_2016_00928522
2554	تاہم اسے اب تک چند سو افراد نے ہی استعمال کیا ہے۔	Y	سو	501	    7,067	0.028	195.1667	urd_news_2016_00407122
2555	مہم کے دوران مختلف علاقوں سے سو مشتبہ افراد کو گرفتار کیا گیا ہے اور ان سے نامعلوم مقام پر تحقیقات کی جا رہی ہیں۔	Y	سو	501	    7,067	0.028	211.0417	urd_news_2016_00902624
2556	پولیس کے مطابق دھماکے سے ملزم بھی ہلاک ہوا۔	Y	دھماکے	502	    7,023	0.0279	153.1111	urd_news_2016_00400329
2557	دھماکے کی تحقیقات شروع کر دی گئی۔	Y	دھماکے	502	    7,023	0.0279	176.1429	urd_news_2016_00548180
2558	دھماکے میں تین افراد جاں بحق اور 30سے زائد زخمی ہوگئے ۔	Y	دھماکے	502	    7,023	0.0279	189.8182	urd_news_2016_00548586
2559	دھماکے میں ایک شخص جاں بحق جبکہ تین زخمی ہوگئے۔	Y	دھماکے	502	    7,023	0.0279	215.5	urd_news_2016_00548567
2560	آئے روز بم دھماکے ہو رہے تھے۔	Y	دھماکے	502	    7,023	0.0279	237.7143	urd_news_2016_00292930
2561	اجلاس میں ملک کی سیاسی اور سیکورٹی کی صورتحال پر بھی غور کیا جائے گا۔	Y	سیکورٹی	503	    7,017	0.0278	157.6429	urd_news_2016_00030150
2562	تاہم تحریک انصاف کو مکمل سیکورٹی فراہم کی جائے گی۔	Y	سیکورٹی	503	    7,017	0.0278	160.5	urd_news_2016_00408018
2563	اور اگر انہوں نے سیکورٹی طلب کی تو اس بارے میں غور کیا جائے گا ۔	Y	سیکورٹی	503	    7,017	0.0278	165.2667	urd_news_2016_00274264
2564	انہوں نے کہا کہ یہ سب کچھ بھارت کو اپنے مفادات اور سیکورٹی کے لئے ہے۔	Y	سیکورٹی	503	    7,017	0.0278	168.75	urd_news_2016_00238555
2565	حکومت پنجاب کا طاہر القادری کو وطن واپسی پر سیکورٹی فراہم کرنے کا اعلان اُردو پوائنٹ دنیاکی سب سے بڑی اُردو ویب سائیٹ ہے، جو پچھلے 15سال سے اُردو کی خدمت میں مصروف ہے۔	Y	سیکورٹی	503	    7,017	0.0278	170.4138	urd_news_2016_00516909
2566	جب تک یہ دو بڑے کام نہیں ہو ں گے۔	Y	بڑے	504	    7,014	0.0278	169.8	urd_news_2016_00452131
2567	وہ یہاں کارکنوں کے ایک بڑے اجلاس سے خطاب کر رہے تھے۔	Y	بڑے	504	    7,014	0.0278	176.0833	urd_news_2016_00950236
2568	انہوں نے کہا کہ ہمارے دور میں جاری تمام بڑے منصوبوں پر کام روک دیا گیا اور گزشتہ ایک سال میں پنجاب حکومت نے ایک بھی نیا منصوبہ شروع نہیں کیا ۔	Y	بڑے	504	    7,014	0.0278	181.9643	urd_news_2016_00250748
2569	انہوں نے کہا کہ دہشتگردی کے خاتمے کیلئے بڑے فوجی آپریشن کی ضرورت تھی جو کامیابی سے جاری ہے۔	Y	بڑے	504	    7,014	0.0278	184.4737	urd_news_2016_00234997
2570	پنجاب کے 10 بڑے منصوبے وفاقی حکومت خود مکمل کرے گی ۔	Y	بڑے	504	    7,014	0.0278	186.8	urd_news_2016_00391374
2571	وزیراعظم ، وزیر یا سیکرٹری وفاقی حکومت کا اختیار استعمال نہیں کر سکتا ۔	Y	اختیار	505	    7,005	0.0278	166.9167	urd_news_2016_00971011
2572	یہ بہت ہی متعلقہ فیصلہ ہے کہ جس میں سپریم کورٹ نے اپنا اختیار استعمال کیا ۔	Y	اختیار	505	    7,005	0.0278	168.9375	urd_news_2016_00311135
2573	پاکستانی قوم کے حوالے سے جو بھی موقف اختیار کیا گیا ہے اس کے حوالے سے بھی آگاہ کریں گے ۔	Y	اختیار	505	    7,005	0.0278	173.4375	urd_news_2016_00351221
2574	انہوں نے مزید کہا کہ آئی جی پنجاب نے وفاق میں کوئی اور بیان دیا جبکہ صوبائی اسمبلی میں حکومت نے کوئی اور موقف اختیار کیا۔	Y	اختیار	505	    7,005	0.0278	174.8571	urd_news_2016_00265941
2575	چین نے موقف اختیار کیا کہ بھارت اور پاکستان کو ایک ساتھ گروپ میں شامل کیا جائے۔	Y	اختیار	505	    7,005	0.0278	175.0625	urd_news_2016_00497873
2576	پاکستان میں یہ مقابلے لاہور اور فیصل آباد میں ہوں گے۔	Y	فیصل	506	    7,003	0.0278	154	urd_news_2016_00359480
2577	میں بھی فیصل آباد سے آیا ہوا تھا ۔	Y	فیصل	506	    7,003	0.0278	172	urd_news_2016_00909880
2578	انہوں نے کہا کہ فیصل آباد کے عوام نے آپ کو کبھی قبول نہیں کیا۔	Y	فیصل	506	    7,003	0.0278	186.1429	urd_news_2016_00244841
2579	رہنماء پی ٹی آئی فیصل جاوید خان اُردو پوائنٹ دنیاکی سب سے بڑی اُردو ویب سائیٹ ہے، جو پچھلے 15سال سے اُردو کی خدمت میں مصروف ہے۔	Y	فیصل	506	    7,003	0.0278	188.087	urd_news_2016_00600069
2580	انہوں نے کہا کہ فیصل آباد مذہبی لوگوں کا شہر ہے ۔	Y	فیصل	506	    7,003	0.0278	190.0909	urd_news_2016_00244844
2581	نواز شریف پاکستان کے وزیراعظم ہیں اور امریکا ان کے ساتھ کام کرتا رہے گا۔	Y	کرتا	507	    6,980	0.0277	164.6429	urd_news_2016_00934914
2582	ترجمان نے کہا کہ پاکستان دہشت گردی کی مذمت کرتا ہے ۔	Y	کرتا	507	    6,980	0.0277	168.1818	urd_news_2016_00420034
2583	اس لئے بی پی کو کنٹرول بھی کرتا ہے۔	Y	کرتا	507	    6,980	0.0277	179.1111	urd_news_2016_00095517
2584	کسی بھی سیاسی تحریک کو شروع کرنا سب سے بڑا مسئلہ ہوا کرتا ہے۔	Y	کرتا	507	    6,980	0.0277	179.3571	urd_news_2016_00776596
2585	ایک سوال کے جواب میں وزیر نے کہا کہ الیکشن کے معاملات الیکشن کمیشن ہی حل کرتا ہے۔	Y	کرتا	507	    6,980	0.0277	179.75	urd_news_2016_00134446
2586	اس کیلئے ایک بل پارلیمنٹ میں پیش کیا جائے گا۔..	Y	پارلیمنٹ	508	    6,957	0.0276	130.1	urd_news_2016_00081590
2587	اس لئے پارلیمنٹ ان کے خلاف کارروائی کرے۔	Y	پارلیمنٹ	508	    6,957	0.0276	131.5	urd_news_2016_00095549
2588	اسلام آباد، وزیراعظم نواز شریف پارلیمنٹ کے مشترکہ اجلاس سے خطاب کر رہے ہیں۔	Y	پارلیمنٹ	508	    6,957	0.0276	142.7143	urd_news_2016_00093362
2589	انہوں نے کہا کہ پارلیمنٹ سے منظوری کے بعد اس پر عملدرآمد کیا جائے گا۔	Y	پارلیمنٹ	508	    6,957	0.0276	159.1333	urd_news_2016_00220822
2590	پیپلز پارٹی اور اے این پی کا جمہوریت، پارلیمنٹ اور عدلیہ کی بحالی کے لئے مل کر کام کرنے کا فیصلہ اُردو پوائنٹ دنیاکی سب سے بڑی اُردو ویب سائیٹ ہے، جو پچھلے 15سال سے اُردو کی خدمت میں مصروف ہے۔	Y	پارلیمنٹ	508	    6,957	0.0276	161.4706	urd_news_2016_00366334
2591	اس حوالے سے بات چیت جاری ہے۔	Y	چیت	509	    6,954	0.0276	119.2857	urd_news_2016_00063529
2592	ہم بھی مسائل کے حل کے لیے بات چیت کریں گے ۔	Y	چیت	509	    6,954	0.0276	149.5	urd_news_2016_00843027
2593	بات چیت کی تفصیلات جاری نہیں کی گئی۔	Y	چیت	509	    6,954	0.0276	159.4286	urd_news_2016_00296019
2594	وہ گزشتہ روز نجی ٹی وی سے بات چیت کرتے ہوئے کیا۔	Y	چیت	509	    6,954	0.0276	180	urd_news_2016_00995052
2595	تمام مسائل بات چیت سے حل کیے جا سکتے ہیں۔	Y	چیت	509	    6,954	0.0276	217.2	urd_news_2016_00436876
2596	میں تمام دہشت گردوں کے خلاف ہوں۔	Y	گردوں	510	    6,953	0.0276	130.8571	urd_news_2016_00910127
2597	دہشت گردوں کے خلاف آپریشن جاری ہے۔	Y	گردوں	510	    6,953	0.0276	136	urd_news_2016_00545038
2598	دہشت گردوں کے خلاف سخت کارروائی کی جائے۔	Y	گردوں	510	    6,953	0.0276	174.125	urd_news_2016_00545110
2599	دوسری جانب رینجرز نے کراچی کے مختلف علاقوں میں کارروائی کرکے 10 دہشت گردوں کو گرفتار کرلیا۔	Y	گردوں	510	    6,953	0.0276	184.0625	urd_news_2016_00554505
2600	ہلاک دہشت گردوں کا تعلق تحریک طالبان پاکستان سے ہے۔	Y	گردوں	510	    6,953	0.0276	201.2	urd_news_2016_00812343
2601	پاکستان ہے تو ہم ہیں اور ہماری سیاست بھی۔	Y	سیاست	511	    6,944	0.0275	137.8889	urd_news_2016_00360936
2602	وزیراعظم کو کچھ ہوا تو عمران خان کی سیاست تباہ ہو جائے گی۔	Y	سیاست	511	    6,944	0.0275	154.1538	urd_news_2016_00964616
2603	ذرائع کے مطابق ملاقات میں سندھ کی سیاست کیلئے اہم فیصلے کئے جائیں گے۔	Y	سیاست	511	    6,944	0.0275	156.4286	urd_news_2016_00580708
2604	انہوں نے کہا کہ آج میاں محمد نواز شریف اور مسلم لیگ (ن) جی ٹی روڈ اور لاہور کی سیاست کررہے ہیں۔	Y	سیاست	511	    6,944	0.0275	157.7143	urd_news_2016_00208794
2605	انہوں نے کہا کہ حکومت ہر سیاسی جماعت کو موقع فراہم کر رہی ہے کہ وہ ملکی سیاست میں اپنا کردار ادا کر سکے۔	Y	سیاست	511	    6,944	0.0275	162.1364	urd_news_2016_00232699
2606	دہشت گردی کے خلاف جنگ ہماری نہیں ہے ۔	Y	ہماری	512	    6,940	0.0275	164.625	urd_news_2016_00544077
2607	بات چیت تو ہماری نواز شریف سے بھی ہوئی تھی ۔	Y	ہماری	512	    6,940	0.0275	173.7	urd_news_2016_00296011
2608	دہشت گردی کے خلاف جنگ ہماری جنگ ہے۔	Y	ہماری	512	    6,940	0.0275	185.7143	urd_news_2016_00544076
2609	یہاں تو کوئی ہماری مدد کیلئے بھی نہیں آئے گا۔	Y	ہماری	512	    6,940	0.0275	197.3	urd_news_2016_00270779
2610	ہماری جنگ صرف آزادی کی جنگ ہے۔	Y	ہماری	512	    6,940	0.0275	250	urd_news_2016_00833506
2611	ملزم کے خلاف 2012 میں مقدمہ قائم کیا گیا تھا۔	Y	مقدمہ	513	    6,936	0.0275	140.4444	urd_news_2016_00895518
2612	پولیس نے مقدمہ درج کر کے ملزم کو گرفتار کر لیا ۔	Y	مقدمہ	513	    6,936	0.0275	161	urd_news_2016_00403534
2613	صدر پولیس نے مقدمہ درج کر لیا۔	Y	مقدمہ	513	    6,936	0.0275	175	urd_news_2016_00678091
2614	پولیس نے ملزم کے خلاف مقدمہ درج کرلیا ہے ۔	Y	مقدمہ	513	    6,936	0.0275	203.4444	urd_news_2016_00403676
2615	مقامی انتظامیہ نے مقدمہ درج کرکے تحقیقات شروع کردی ۔	Y	مقدمہ	513	    6,936	0.0275	348.6667	urd_news_2016_00884655
2616	کراچی آپریشن ستمبر2013میں شروع کیا گیا۔	Y	ستمبر	514	    6,933	0.0275	132.5714	urd_news_2016_00761419
2617	قومی اسمبلی کا اجلاس 2 ستمبر کو طلب ۔	Y	ستمبر	514	    6,933	0.0275	168.8571	urd_news_2016_00747450
2618	پاکستان کیلئے پروگرام کی منظوری ستمبر2013ء میں دی گئی تھی۔	Y	ستمبر	514	    6,933	0.0275	173.8182	urd_news_2016_00353848
2619	الطاف حسین کو ستمبر میں گرفتار کر لیا جائے گا، عمران خان ۔	Y	ستمبر	514	    6,933	0.0275	176.5	urd_news_2016_00145959
2620	اس کے ساتھ ہی واپس کیس کی سماعت 16 ستمبر تک ملتوی کر دی.	Y	ستمبر	514	    6,933	0.0275	181.2308	urd_news_2016_00084865
2621	اس لئے عدالت کی ذمہ داری زیادہ ہے ۔	Y	داری	515	    6,930	0.0275	154.125	urd_news_2016_00095813
2622	چیف جسٹس نے کہا رپورٹ میں ذمہ داری سی سی پی او پر ڈال دی گئی ہے ۔	Y	داری	515	    6,930	0.0275	164.25	urd_news_2016_00493058
2623	عوام نے مسلم لیگ(ن) پر بھاری ذمہ داری عائد کی ہے ،عوام کے مسائل کے حل کے لیے دن رات ایک کرنے ہوں گے اُردو پوائنٹ دنیاکی سب سے بڑی اُردو ویب سائیٹ ہے، جو پچھلے 15سال سے اُردو کی خدمت میں مصروف ہے۔	Y	داری	515	    6,930	0.0275	165.1944	urd_news_2016_00719467
2624	وزیر اعظم نے کہا کہ کراچی سمیت پورے ملک میں دہشت گردی کا خاتمہ حکومت کی ذمہ داری ہے۔	Y	داری	515	    6,930	0.0275	169	urd_news_2016_00970263
2625	آئی ایس آئی کے سابق سربراہ کا کہنا تھا کہ انہوں نے جو کیا وہ اس کی ذمہ داری قبول کر چکے ہیں۔	Y	داری	515	    6,930	0.0275	172.9091	urd_news_2016_00280615
2626	کلب موبائل کے مزید موبائل فون اُردو پوائنٹ دنیاکی سب سے بڑی اُردو ویب سائیٹ ہے، جو پچھلے 15سال سے اُردو کی خدمت میں مصروف ہے۔	Y	فون	516	    6,916	0.0274	141.1429	urd_news_2016_00780578
2627	ان خیالات کا اظہار انہوں نے فون پر بات چیت کے دوران کیا۔	Y	فون	516	    6,916	0.0274	156.6923	urd_news_2016_00170316
2628	میں نے کہا کہ مجھے فون کریں۔	Y	فون	516	    6,916	0.0274	177.5714	urd_news_2016_00912516
2629	ایک سوال پر انہوں نے کہا کہ سابق وزیر اعظم نواز شریف نے سانحہ کراچی کے بعد تعزیت کے لئے فون کیا تھا۔	Y	فون	516	    6,916	0.0274	185.4762	urd_news_2016_00132277
2630	امریکی صدر کا وزیر اعظم نواز شریف کو فون، مجوزہ دورہ بھارت پر اعتماد میں لیا اُردو پوائنٹ دنیاکی سب سے بڑی اُردو ویب سائیٹ ہے، جو پچھلے 15سال سے اُردو کی خدمت میں مصروف ہے۔	Y	فون	516	    6,916	0.0274	195.8065	urd_news_2016_00156780
2631	ہر سال حکومت کی طرف سے قیمتوں میں کمی کا اعلان کیا جاتا ہے مگر اس کے باوجود ہر سال قیمتوں میں اضافہ ہوتا ہے ۔	Y	باوجود	517	    6,915	0.0274	185.9	urd_news_2016_00594238
2632	پولیس کی کارروائی کے باوجود دہشت گرد 22 سعودی اور غیر ملکی شہریوں کو قتل کرنے میں میں کامیاب رہے تھے۔	Y	باوجود	517	    6,915	0.0274	193.0526	urd_news_2016_00399253
2633	انہوں نے کہا کہ سندھ کے عوام بجلی کے بل ادا کررہے ہیں اس کے باوجود سندھ میں زیادہ سے زیادہ لوڈشیڈنگ کی جارہی ہے۔	Y	باوجود	517	    6,915	0.0274	206.4762	urd_news_2016_00239953
2634	تاہم عدالتی حکم کے باوجود آئی جی پنجاب نے درخواست پر کوئی فیصلہ نہیں کیا۔	Y	باوجود	517	    6,915	0.0274	206.7333	urd_news_2016_00408839
2635	لیکن امید سے ہونے کے باوجود بھی انہوں نے کام کا سلسلہ جاری رکھا ہوا ہے۔	Y	باوجود	517	    6,915	0.0274	206.75	urd_news_2016_00826385
2636	اس لئے اس صوبے کے ساتھ تعاون کی ضرورت ہے۔	Y	صوبے	518	    6,890	0.0273	153.2222	urd_news_2016_00095323
2637	انہوں نے کہا کہ یہاں صوبے کی بات ہوئی ہے آصف زرداری نے صوبے کی بات کی تھی۔	Y	صوبے	518	    6,890	0.0273	175.6154	urd_news_2016_00217213
2638	نئے صوبے کا قیام،کمیشن کا اجلاس آج ہو گا ۔	Y	صوبے	518	    6,890	0.0273	210.7778	urd_news_2016_00940283
2639	وفاقی حکومت صوبے میں اپنی ذمہ داری پوری کرنے میں ناکام رہی ہے۔	Y	صوبے	518	    6,890	0.0273	214.8333	urd_news_2016_00986710
2640	صوبے کو اسی ارب کا نقصان ہوا ہے۔	Y	صوبے	518	    6,890	0.0273	224	urd_news_2016_00686676
2641	پاکستان میں بھارتی ایجنسی کے خلاف احتجاج۔	Y	ایجنسی	519	    6,866	0.0272	170.8571	urd_news_2016_00358075
