ORDER	SENTENCE	STATUS	WORD	RANK	COUNT	COUNT_REL	INDEX	ID
7463	ایوان صدر میں مقبوضہ کشمیر میں بھارتی مظالم کیخلاف ”یوم سیاہ “ وزیر اعظم نواز شریف آئندہ کل لاہور سے اسلام آباد آئیں گے۔	Y	سیاہ	1360	    2,211	0.0088	338.1364	urd_news_2016_00271737
7464	مولانا فضل الرحمن ایوان صدر میں مقبوضہ کشمیر میں بھارتی مظالم کیخلاف ”یوم سیاہ “ وزیر اعظم نواز شریف کی آج شام قوم سے خطاب کی خبر بے بنیاد ہے۔	Y	سیاہ	1360	    2,211	0.0088	383.5926	urd_news_2016_00917403
7465	مولانا فضل الرحمن ایوان صدر میں مقبوضہ کشمیر میں بھارتی مظالم کیخلاف ”یوم سیاہ “ کے۔	Y	سیاہ	1360	    2,211	0.0088	514.7857	urd_news_2016_00917402
7466	انہوں نے کہا کہ ہم نے بھارتی قیادت اور حکومت کو پاکستان کی طرف سے مسئلہ کشمیر کے حل کیلئے جاری کوششوں سے آگاہ کیا ہے۔	Y	کوششوں	1360	    2,211	0.0088	168.2917	urd_news_2016_00256962
7467	وزیراعظم نواز شریف نے کہاکہ پاکستان علاقے میں امن اور استحکام کیلئے کوششوں کی حمایت جاری رکھے گا۔	Y	کوششوں	1360	    2,211	0.0088	285.7778	urd_news_2016_00968229
7468	دیگر غیر سرکاری اور نجی اداروں کو چاہئے وہ اس قسم کی کوششوں میں حصہ لیں۔	Y	کوششوں	1360	    2,211	0.0088	323.0625	urd_news_2016_00547002
7469	روس کی مشترکہ کوششوں سے متعلق مسائل پر بات چیت کریں گے۔	Y	کوششوں	1360	    2,211	0.0088	374.1667	urd_news_2016_00602982
7470	مشیر خزانہ نے فاٹا میں قیام امن کی کوششوں سے آگاہ کیا۔	Y	کوششوں	1360	    2,211	0.0088	487.5833	urd_news_2016_00875342
7471	یہ اس ملک کو واپس کچھ دینے کا ایک طریقہ ہے۔‘	Y	طریقہ	1361	    2,209	0.0088	217.4545	urd_news_2016_00098384
7472	اس نظام میں کسی اور طریقہ کار کو شریک نہیں کیا جا سکتا۔	Y	طریقہ	1361	    2,209	0.0088	280.9231	urd_news_2016_00110044
7473	طاقت کا استعمال کیا جائے تو اس کا طریقہ کار کیا ہو؟	Y	طریقہ	1361	    2,209	0.0088	326.2	urd_news_2016_00690852
7474	سب سے پہلے غیر ملکی افواج کی افغانستان سے واپسی پر اتفاق ہوا ہے جس کے طریقہ کار پر ابھی بحث نہیں ہوئی ہے۔	Y	طریقہ	1361	    2,209	0.0088	387.8571	urd_news_2016_00618492
7475	ملاقات کے دوران وفاقی دارالحکومت میں بلدیاتی اداروں کے طریقہ کار پر تفصیلی تبادلہ خیال کیا۔	Y	طریقہ	1361	    2,209	0.0088	449.7333	urd_news_2016_00890732
7476	حکومت کے سامنے اس کرپشن کو ختم کرنے کا کوئی واضح ہدف موجود نہیں ہے۔	Y	ہدف	1362	    2,208	0.0088	211.7333	urd_news_2016_00520542
7477	خدمات کے شعبہ بھی ترقی کا ہدف حاصل کرنے میں ناکام رہا۔	Y	ہدف	1362	    2,208	0.0088	330.5833	urd_news_2016_00529134
7478	انگلینڈ نے پاکستان کو جیت کیلئے 161 رنز کا ہدف دے دیا ہے۔	Y	ہدف	1362	    2,208	0.0088	356.1667	urd_news_2016_00187706
7479	انگلینڈ نے ون ڈے تاریخ میں بڑا ہدف حاصل کر کے نیا ملکی ریکارڈ قائم کر دیا ۔	Y	ہدف	1362	    2,208	0.0088	467	urd_news_2016_00187748
7480	اُردو پوائنٹ پاکستان سوات کے تصاویری البم سوات کے سیاحتی مقامات سوات میں گورنمنٹ دفاتر واقعہ سوات، میڈیا کا اصل ہدف!	Y	ہدف	1362	    2,208	0.0088	623.7059	urd_news_2016_00047276
7481	اس لئے رات کو بھی کھانے کے بعد نہ لیں تو بہتر۔	Y	کھانے	1363	    2,207	0.0088	267.1667	urd_news_2016_00095710
7482	اور آپ اسے کھانے پر بھی استعمال کر سکتے ہیں۔	Y	کھانے	1363	    2,207	0.0088	274	urd_news_2016_00273221
7483	تفصیلات کے مطابق ترجمان پی آئی اے نے بتایا کہ قومی ائیر لائن میں مسافروں کو مختلف قسم کے کھانے فراہم کیے جائیں گے۔	Y	کھانے	1363	    2,207	0.0088	315.3913	urd_news_2016_00427956
7484	اور اسی کھانے میں آزاد گروپ کے قیام کا اعلان کر دیا جائیگا۔	Y	کھانے	1363	    2,207	0.0088	319.9231	urd_news_2016_00273782
7485	ملتان میں تحریک انصاف کے کارکنوں نے کھانے پر دھاوا بول دیا، اُردو پوائنٹ دنیاکی سب سے بڑی اُردو ویب سائیٹ ہے، جو پچھلے 15سال سے اُردو کی خدمت میں مصروف ہے۔	Y	کھانے	1363	    2,207	0.0088	338.3704	urd_news_2016_00893450
7486	سندھ ہائی کورٹ نے اساتذہ تنظیموں پر عائد پابندی ختم کرنے کا حکم جاری کر دیا اُردو پوائنٹ دنیاکی سب سے بڑی اُردو ویب سائیٹ ہے، جو پچھلے 15سال سے اُردو کی خدمت میں مصروف ہے۔	Y	تنظیموں	1364	    2,200	0.0087	190.4375	urd_news_2016_00653043
7487	انہوں نے کہا کہ کالعدم تنظیموں کے سلسلے میں کام جاری ہے اس وقت62 تنظیموں پر پابندی عائد ہے۔	Y	تنظیموں	1364	    2,200	0.0087	278.2941	urd_news_2016_00246413
7488	سندھ ہائی کورٹ نے اساتذہ تنظیموں پر عائد پابندی ختم کرنے کا حکم جاری کر دیا ۔	Y	تنظیموں	1364	    2,200	0.0087	328.25	urd_news_2016_00653042
7489	ن لیگ کا کبھی بھی کالعدم تنظیموں سے تعلق نہیں رہا۔	Y	تنظیموں	1364	    2,200	0.0087	367.4545	urd_news_2016_00932310
7490	زیر حراست افراد میں داعش اور دیگر کالعدم تنظیموں کے کارکن شامل ہیں۔	Y	تنظیموں	1364	    2,200	0.0087	510.3846	urd_news_2016_00606076
7491	اسٹیٹ بنک اُردو پوائنٹ دنیاکی سب سے بڑی اُردو ویب سائیٹ ہے، جو پچھلے 15سال سے اُردو کی خدمت میں مصروف ہے۔	Y	بنک	1365	    2,199	0.0087	184.7222	urd_news_2016_00060217
7492	انہوں نے مطالبہ کیا کہ نیشنل بنک کے امور پر بھی نظر رکھی جائے۔	Y	بنک	1365	    2,199	0.0087	292.7857	urd_news_2016_00268381
7493	نیشنل بنک میں عید کے بعد سیاسی دفاتر بند کرنے کے لئے مزید منصوبہ بندی کی جائے گی۔	Y	بنک	1365	    2,199	0.0087	345.3529	urd_news_2016_00929032
7494	خفیہ اداروں کی رپورٹ پر اسٹیٹ بنک نے کارروائی کے احکامات جاری کئے تھے۔	Y	بنک	1365	    2,199	0.0087	417.2143	urd_news_2016_00531010
7495	دوسری جانب انٹر بنک مارکیٹ میں ڈالر کی قدر میں دو پیسے کمی ہوئی۔	Y	بنک	1365	    2,199	0.0087	525.5385	urd_news_2016_00553429
7496	اے این پی ذرائع نے بتایا کہ تحریک انصاف سے سوال کیا جائیگا کہ عمران خان کا بیان پارٹی کی پالیسی ہے یا ان کا ذاتی خیال ہے ؟	Y	ذاتی	1365	    2,199	0.0087	206.76	urd_news_2016_00293433
7497	تحریک انصاف کے چیئرمین عمران خان نے کہاکہ نواز شریف نے بھارتی وزیراعظم مودی سے ذاتی تعلقات قائم کیے۔	Y	ذاتی	1365	    2,199	0.0087	264	urd_news_2016_00413640
7498	عدالت نے الطاف حسین کو نوٹس جاری کرتے ہوئے ذاتی حیثیت میں 7 جنوری کو پیش ہونے کا حکم بھی دیا۔	Y	ذاتی	1365	    2,199	0.0087	288.1579	urd_news_2016_00700163
7499	انہوں نے کہا کہ کسی کی ذاتی زندگی پر بات نہیں کرنی چاہئے،پاکستان میں خواتین عدم تحفظ کا شکار ہیں۔	Y	ذاتی	1365	    2,199	0.0087	303.7619	urd_news_2016_00247497
7500	پرویز مشرف نے کہا کہ عدالتی مسئلے کو کبھی ذاتی نہیں بنایا۔	Y	ذاتی	1365	    2,199	0.0087	484.25	urd_news_2016_00378413
7501	سرگودھا یونیورسٹی ترجمان اُردو پوائنٹ دنیاکی سب سے بڑی اُردو ویب سائیٹ ہے، جو پچھلے 15سال سے اُردو کی خدمت میں مصروف ہے۔	Y	سرگودھا	1366	    2,198	0.0087	161.4737	urd_news_2016_00633108
7502	ان خیالات کا اظہار انہوں نے بلاول ہاؤس لاہور میں سرگودھا ڈویژن کے اجلاس سے خطاب کرتے ہوئے کیا ۔	Y	سرگودھا	1366	    2,198	0.0087	274.1053	urd_news_2016_00168808
7503	وزیراعلیٰ پنجاب نے ہدایت کی کہ سرگودھا واقعے کی تحقیقات کی جائے۔	Y	سرگودھا	1366	    2,198	0.0087	378.1	urd_news_2016_00973466
7504	سماعت کے بعد انہیں ڈسٹرکٹ جیل سرگودھا منتقل کردیا گیا۔	Y	سرگودھا	1366	    2,198	0.0087	417.3	urd_news_2016_00645001
7505	سرگودھا پولیس کی جرائم پیشہ عناصر کیخلاف کارروائی ،22ملزمان گرفتار ۔	Y	سرگودھا	1366	    2,198	0.0087	568.2	urd_news_2016_00632719
7506	مذکورہ کمیٹی اجلاس میں پچھلے اجلاس کے حوالے سے بھی جائزہ لیا گیا ۔	Y	مذکورہ	1367	    2,195	0.0087	213.0833	urd_news_2016_00861531
7507	نوٹس میں مذکورہ کمپنی کا نام بھی دیا گیا ہے ۔	Y	مذکورہ	1367	    2,195	0.0087	276.4	urd_news_2016_00936545
7508	مذکورہ بھارتی خاتون اس وقت ہسپتال میں زیر علاج ہے اور پولیس کی جانب سے واقع کی تحقیقات کی جارہی ہیں۔	Y	مذکورہ	1367	    2,195	0.0087	327	urd_news_2016_00861189
7509	مذکورہ یونیورسٹی نجی شعبے کے تحت قائم کی جائے گی ۔	Y	مذکورہ	1367	    2,195	0.0087	391.1	urd_news_2016_00861646
7510	مذکورہ عناصر طلباء اور نوجوانوں کو منشیات کی فراہمی میں ملوث تھے۔	Y	مذکورہ	1367	    2,195	0.0087	585.5	urd_news_2016_00861461
7511	ان خیالات کا اظہار انہوں نے اپنے ایک بیان میں کرتے ہو ئے کیا ۔	Y	ئے	1368	    2,194	0.0087	185.2143	urd_news_2016_00168115
7512	انہوں نے یقین کا اظہار کیا کہ جلد ہی سوات میں امن قائم ہو جا ئے گا۔	Y	ئے	1368	    2,194	0.0087	247.1765	urd_news_2016_00205420
7513	انہوں نے کہا کہ سندھ میں بھی سیلاب کا خطرہ بڑھ چکا ہے سندھ حکومت کو چاہیے کہ وہ جلد از جلد اقدام کر ئے اگر وقت پر فیصلے نہ کئے گئے تو نقصان ہو سکتا ہے ۔	Y	ئے	1368	    2,194	0.0087	302.4545	urd_news_2016_00239996
7514	خیبر پختونخوا کے لئے 404 ارب روپے کا بجٹ تیار،کل پیش کیا جا ئے گا ۔	Y	ئے	1368	    2,194	0.0087	329.3333	urd_news_2016_00528106
7515	برطانیہ خود طالبان سے خفیہ بات چیت جاری رکھے ہو ئے ہے ۔	Y	ئے	1368	    2,194	0.0087	500.4167	urd_news_2016_00318716
7516	انہوں نے کہا کہ کراچی آپریشن کے دوران ایم کیو ایم کو بھی مختلف مسائل کا سامنا کرنا پڑا ۔	Y	پڑا	1369	    2,193	0.0087	201.4444	urd_news_2016_00246697
7517	گزشتہ روز کا اجلاس بھی کراچی واقعات کے خلاف متحدہ اپوزیشن کے احتجاج کے باعث منگل تک کیلئے ملتوی کرنا پڑا تھا۔	Y	پڑا	1369	    2,193	0.0087	310.4	urd_news_2016_00802485
7518	شہر آنے اور جانے والے لوگوں کو شدید مشکلات کا سامنا کرنا پڑا ۔	Y	پڑا	1369	    2,193	0.0087	353.1538	urd_news_2016_00668011
7519	جس سے ریلوے کو 10ارب روپے کا نقصان برداشت کرنا پڑا۔	Y	پڑا	1369	    2,193	0.0087	391.4545	urd_news_2016_00464745
7520	تاہم دھاندلی کے باعث انہیں شکست کا سامنا کرنا پڑا۔	Y	پڑا	1369	    2,193	0.0087	498.2	urd_news_2016_00408359
7521	وزارت داخلہ نے ای سی ایل میں نام شامل کرنے سے متعلق نیا فارم جاری کر دیا اُردو پوائنٹ دنیاکی سب سے بڑی اُردو ویب سائیٹ ہے، جو پچھلے 15سال سے اُردو کی خدمت میں مصروف ہے۔	Y	فارم	1370	    2,192	0.0087	177.9032	urd_news_2016_00959869
7522	نئے فارم کا استعمال 1 اپریل سے شروع ہو رہے نئے مالی سال سے ہوگا.	Y	فارم	1370	    2,192	0.0087	301.4167	urd_news_2016_00940300
7523	یکم جولائی ہی سے بلدیاتی امیدواروں کو درخواست فارم جاری کرنے کا اعلان کیا گیا۔	Y	فارم	1370	    2,192	0.0087	355.8	urd_news_2016_00784840
7524	وفاقی تعلیمی بورڈ کے مطابق یہ ایس ایم ایس امیدواروں کے داخلہ فارم پر درج موبائل نمبر پر کیے گئے ہیں۔	Y	فارم	1370	    2,192	0.0087	372.5	urd_news_2016_00986452
7525	ٹیم ورلڈ کپ کیلئے تیار اور بھر پور فارم میں ہے۔	Y	فارم	1370	    2,192	0.0087	383.2727	urd_news_2016_00444658
7526	انہوں نے کہا کہ پاکستان کی کاروباری برادری بھی ان منصوبوں کی تکمیل کیلئے حکومت سے بھرپور تعاون کر رہی ہے۔	Y	کاروباری	1371	    2,188	0.0087	270.1	urd_news_2016_00222651
7527	انہوں نے کہا کہ ہر چھوٹے بڑے کاروباری افراد کو چاہیے کہ وہ ٹیکس ادا کریں تاکہ ملک کو قوم کی ترقی ممکن ہو سکے۔	Y	کاروباری	1371	    2,188	0.0087	299.9565	urd_news_2016_00236976
7528	اس سلسلہ میں کاروباری برادری حکومت سے ہر ممکن تعاون کرے گی۔	Y	کاروباری	1371	    2,188	0.0087	357.75	urd_news_2016_00070064
7529	ملاقات میں کاروباری اور معاشی سرگرمیوں کے فروغ پر تبادلہ خیال کیا گیا۔	Y	کاروباری	1371	    2,188	0.0087	424.2308	urd_news_2016_00891573
7530	گزشتہ کاروباری ہفتے کے دوران ڈالر کے مسلسل عدم استحکام کے باعث تیل کی قیمتوں میں واضح کمی ہوئی تھی۔	Y	کاروباری	1371	    2,188	0.0087	473.0556	urd_news_2016_00803307
7531	انہوں نے کہا کہ قوم نے عمران خان کو اسمبلی کے لیے منتخب کیا جو وہ نہیں کررہے لیکن جس کام کے لیے انہیں منتخب نہیں کیا گیا وہ پچھلے 3 سالوں سے سڑکوں پر کررہے ہیں۔	Y	سالوں	1372	    2,187	0.0087	191.4286	urd_news_2016_00246047
7532	اپنے ایک بیان میں انہوں نے کہا کہ ہمیں دوبارہ موقع ملا تو اگلے پانچ سالوں میں جی ڈی پی کی شرح کو 12 فیصد تک لے کر جائیں گے۔	Y	سالوں	1372	    2,187	0.0087	270.0357	urd_news_2016_00017030
7533	اور پچھلے دس سالوں میں کی گئی سرمایہ کاری کی رپورٹ بھی طلب کر لی۔	Y	سالوں	1372	    2,187	0.0087	310.2143	urd_news_2016_00275293
7534	وہ گذشتہ چار سالوں سے تبدیلی کا مطالبہ کر رہے ہیں۔	Y	سالوں	1372	    2,187	0.0087	381.7273	urd_news_2016_00994661
7535	گذشتہ کئی سالوں سے یہی علاقے مسلسل سیلاب سے متاثر ہوتے ہیں۔	Y	سالوں	1372	    2,187	0.0087	680.9091	urd_news_2016_00798437
7536	انہوں نے کہا کہ وزیر اعلیٰ سندھ کو آئی جی سندھ نے یقین دہانی کرائی ہے کہ اس واقعہ کی مکمل رپورٹ جلد پیش کردی جائے گی ۔	Y	دہانی	1373	    2,182	0.0087	236.6667	urd_news_2016_00261944
7537	ہائی کورٹ کے حکم کے بعد ڈی سی او لاہور نے کارروائی کی یقین دہانی کرائی۔	Y	دہانی	1373	    2,182	0.0087	323.1333	urd_news_2016_00290856
7538	انہوں نے اس سلسلے میں پاکستان کے بھر پور کردار کی یقین دہانی کرائی۔	Y	دہانی	1373	    2,182	0.0087	347.2143	urd_news_2016_00193038
7539	سینئر وفاقی وزیر چوہدری نثار علی خان،حکومت کی حمایت جاری رکھیں گے ، سینئر وفاقی وزیر کی وزیر اعظم سید یوسف رضا گیلانی سے ملاقات یقین دہانی۔	Y	دہانی	1373	    2,182	0.0087	414.9091	urd_news_2016_00656684
7540	چینی حکام نے توانائی کے شعبے میں ہر ممکن تعاون کی یقین دہانی کرائی۔	Y	دہانی	1373	    2,182	0.0087	513.2857	urd_news_2016_00495909
7541	انہوں نے کہا کہ موجود ہ حکومت کی توجہ پارلیمنٹ پر نہیں ہے انہیں پارلیمنٹ کو مضبوط کرنا چاہئے ۔	Y	ہ	1373	    2,182	0.0087	260	urd_news_2016_00258758
7542	ہ انہوں نے کہا کہ افغانستان اور پاکستان دونوں ملکوں میں تشدد کے خاتمے کے لیے اقدامات کی ضرورت ہے۔	Y	ہ	1373	    2,182	0.0087	295.6842	urd_news_2016_00212609
7543	و ہ منگل کو مختلف اضلاع سے تعلق رکھنے والے ارکان اسمبلی سے ملاقات کے دوران گفتگو کر رہے تھے ۔	Y	ہ	1373	    2,182	0.0087	318.0526	urd_news_2016_00997260
7544	انہوں نے کہاکہ ہ اگر اس ملک میں علماء محفوظ نہیں تو پھر کون محفوظ ہوگا ۔	Y	ہ	1373	    2,182	0.0087	371.8	urd_news_2016_00213442
7545	و ہ فوج کے ساتھ معاملات کرنے کو ترجیح دیتا ہے۔	Y	ہ	1373	    2,182	0.0087	477.2727	urd_news_2016_00992496
7546	انہوں نے کہا کہ پاکستان عوامی تحریک نے وزیراعظم کے خلاف ’’استعفیٰ دو تحریک‘‘ شروع کی ہے جو وزیراعظم کے استعفیٰ تک جاری رہے گی۔	Y	استعفیٰ	1374	    2,173	0.0086	132.1	urd_news_2016_00222200
7547	انہوں نے کہا کہ ہم مطالبہ کرتے ہیں کہ میاں محمد نواز شریف استعفیٰ دے دیں نہیں تو دھرنا ختم نہیں ہوگا ۔	Y	استعفیٰ	1374	    2,173	0.0086	242.7	urd_news_2016_00256504
7548	گورنر سندھ نے وزیراعلیٰ سندھ قائم علی شاہ کا استعفیٰ منظور کرلیا رینجرز کے قانونی اختیارات صرف کراچی تک ہیں۔	Y	استعفیٰ	1374	    2,173	0.0086	291.6842	urd_news_2016_00808826
7549	جبکہ ان کا استعفیٰ بھی تاخیر کا شکار ہو گیا ہے۔	Y	استعفیٰ	1374	    2,173	0.0086	347.1	urd_news_2016_00454031
7550	کارکنوں کا الطاف حسین سے استعفیٰ واپس لینے کا مطالبہ ۔	Y	استعفیٰ	1374	    2,173	0.0086	519.4444	urd_news_2016_00754057
7551	اس ملک میں الیکشن کے نام پر ڈرامہ ہوتا ہے ۔	Y	ڈرامہ	1375	    2,172	0.0086	221.5	urd_news_2016_00098411
7552	انہوں نے کہا کہ 2008ء کے انتخابات کے دوران بائیکاٹ ڈرامہ میں بھی عمران خان کا اہم کردار تھا۔	Y	ڈرامہ	1375	    2,172	0.0086	249.5556	urd_news_2016_00206777
7553	الطاف بھائی نے یہ فیصلہ اس لیے نہیں کیا تھا کہ اس کے بعد انہیں واپس لینے کی تحریک کا ڈرامہ شروع ہو جائے گا اور نہ ہی ارکان نے یہ استعفے اس خیال کے پیش نظر دیئے تھے کہ منظور تو ہونے نہیں۔	Y	ڈرامہ	1375	    2,172	0.0086	262.3784	urd_news_2016_00145637
7554	آئی این پی۔10مارچ۔ 2013ء) پی ٹی وی لاہور سنٹر نے یوم پاکستان 23 مارچ کے حوالے سے خصوصی ڈرامہ مکمل کر لیا۔	Y	ڈرامہ	1375	    2,172	0.0086	282.1	urd_news_2016_00282414
7555	ہماری ڈرامہ انڈسٹری سے کسی سے کوئی مقابلہ نہیں ، صائمہ خان اُردو پوائنٹ دنیاکی سب سے بڑی اُردو ویب سائیٹ ہے، جو پچھلے 15سال سے اُردو کی خدمت میں مصروف ہے۔	Y	ڈرامہ	1375	    2,172	0.0086	299.44	urd_news_2016_00833886
7556	تاہم پولیس کی جانب سے بتایا گیا ہے کہ وسیم اکرم نے جس گاڑی اے ای جی 061 کا بتایا تھا وہ کئی ماہ سے زیر استعمال نہیں ہے۔	Y	اکرم	1376	    2,171	0.0086	230.48	urd_news_2016_00407961
7557	اکرم شیخ نے کہا کہ وفاقی حکومت سے متعلقہ مقدمات کے حوالے سے وزارت قانون و انصاف ذمہ دار ہے،عدالتی قیام کا عمل وزارت قانون نے مکمل کیا۔	Y	اکرم	1376	    2,171	0.0086	292.88	urd_news_2016_00131340
7558	پولیس نے وسیم اکرم پر فائرنگ کرنے والے شخص کی گاڑی برآمد کرلی ۔	Y	اکرم	1376	    2,171	0.0086	390.4615	urd_news_2016_00403937
7559	وسیم اکرم کے کیمپ سے بہت فائدہ ہو رہا ہے۔	Y	اکرم	1376	    2,171	0.0086	456.9	urd_news_2016_00984724
7560	وسیم اکرم نے سلمان بٹ کو کپتان بنانے کی حمایت کردی ۔	Y	اکرم	1376	    2,171	0.0086	612.0909	urd_news_2016_00984754
7561	واضح رہے کہ پاکستانی ٹیم 1986ء اس سے اس چیمپئن شپ میں حصہ لے رہی ہے۔	Y	چیمپئن	1376	    2,171	0.0086	251.6	urd_news_2016_00944734
7562	واضح رہے کہ عالمی چیمپئن کا فیصلہ 6 اپریل کو فائنل میں ہو گا۔	Y	چیمپئن	1376	    2,171	0.0086	320.1538	urd_news_2016_00946065
7563	افغان ٹیم نے نیشنل چیمپئن شپ میں اعلیٰ کارکردگی کا مظاہرہ کیا تھا۔	Y	چیمپئن	1376	    2,171	0.0086	361.8462	urd_news_2016_00122977
7564	اس چیمپئن شپ میں بچے بھی حصہ لے سکیں گے اور ٹیمیں بھی۔	Y	چیمپئن	1376	    2,171	0.0086	472.75	urd_news_2016_00062503
7565	اردو پوائنٹ پاکستان ۔ 18ویں نیشنل بیس بال چیمپئن شپ آج شروع ہوگی ۔	Y	چیمپئن	1376	    2,171	0.0086	577.25	urd_news_2016_00046380
7566	ہر جماعت کو کراچی میں کسی بھی جگہ جلسہ کرنے کا مکمل حق حاصل ہے : چوہدری نثار اُردو پوائنٹ دنیاکی سب سے بڑی اُردو ویب سائیٹ ہے، جو پچھلے 15سال سے اُردو کی خدمت میں مصروف ہے۔	Y	جلسہ	1377	    2,169	0.0086	168.3871	urd_news_2016_00592595
7567	ان خیالات کا اظہار انھوں نے آج یہاں باغ میں پی ٹی آئی کشمیر کے زیر اہتمام ایک بہت بڑے جلسہ عام سے خطاب کرتے ہوئے کیا۔	Y	جلسہ	1377	    2,169	0.0086	272.3333	urd_news_2016_00168297
7568	وہ منگل کو کراچی میں جلسہ عام سے خطاب کررہے تھے ۔	Y	جلسہ	1377	    2,169	0.0086	322.6364	urd_news_2016_00997242
7569	وہ اتوار کو یہاں ایم کیو ایم کی تنظیم نو کے سلسلے میں جلسہ سے خطاب کررہے تھے ۔	Y	جلسہ	1377	    2,169	0.0086	375.4706	urd_news_2016_00941747
7570	جلسہ کی تیاری کے سلسلہ کارکنوں کو ہدایات کی گئیں ۔	Y	جلسہ	1377	    2,169	0.0086	660.5556	urd_news_2016_00472134
7571	اس موقع پر این اے 122میں کامیابی کے لئے دعا بھی کی گئی ۔	Y	دعا	1378	    2,165	0.0086	185.7692	urd_news_2016_00101001
7572	ان کا کہنا تھا کہ 12سال کی جنگ ختم ہونے میں وقت لگے گا، قوم دعا کرے کہ مذاکرات کامیاب ہوں۔	Y	دعا	1378	    2,165	0.0086	259	urd_news_2016_00178976
7573	بچوں نے بھی قومی ٹیم کی جیت کے لئے دعا کی۔	Y	دعا	1378	    2,165	0.0086	284.7	urd_news_2016_00314141
7574	انہوں نے کہا کہ میرے ہم وطن رمضان میں ہماری کامیابی کیلئے دعا کرتے رہے۔	Y	دعا	1378	    2,165	0.0086	328.2667	urd_news_2016_00253574
7575	پاکستانی فلم انڈسٹری کے بحران کے خاتمے کا کوئی امکان نہیں‘ دعا قریشی۔	Y	دعا	1378	    2,165	0.0086	524.5	urd_news_2016_00350827
7576	انہوں نے کہا کہ میں نے کبھی یہ نہیں کہا کہ پاکستان میں دہشتگردی کی کارروائیاں طالبان کر رہے ہیں ۔	Y	کارروائیاں	1379	    2,164	0.0086	200.375	urd_news_2016_00258361
7577	ذرائع کے مطابق کراچی میں دہشت گردوں کے خلاف سیکیورٹی فورسز بھرپور کارروائیاں کریں گی۔	Y	کارروائیاں	1379	    2,164	0.0086	303	urd_news_2016_00580082
7578	کراچی، رینجرز کی مختلف علاقوں میں کارروائیاں،چار ملزمان گرفتار، اسلحہ برآمد ۔	Y	کارروائیاں	1379	    2,164	0.0086	333.4167	urd_news_2016_00765676
7579	دھماکے کے بعد امدادی کارروائیاں شروع کر دی گئیں اور زخمیوں اور جاں بحق افراد کو سول اسپتال منتقل کیا گیا ۔	Y	کارروائیاں	1379	    2,164	0.0086	404.2	urd_news_2016_00548247
