ORDER	SENTENCE	STATUS	WORD	RANK	COUNT	COUNT_REL	INDEX	ID
24395	امریکی بمبار طیاروں کا کوریا میں طاقت کا مظاہرہ 6 گھنٹے پہلے..	Y	بمبار	2687	      407	0.0016	981.8	urd_news_2016_00155595
24396	ہم سب کو تمام اختلافات بھلا کر ملک کی ترقی کیلئے اپنا اپنا کردار ادا کرنا چاہیے۔	Y	بھلا	2687	      407	0.0016	392.625	urd_news_2016_00869524
24397	اس سے زیادہ ظلم بھلا کیا ہو سکتا ہے۔	Y	بھلا	2687	      407	0.0016	530.2222	urd_news_2016_00072831
24398	حکومت اگر کسانوں کا کوئی بھلا چاہتی ہے تو انہیں ان کی محنت کا پورا معاوضہ دیا جائے ۔	Y	بھلا	2687	      407	0.0016	636.5294	urd_news_2016_00515506
24399	جیسے ہی بلدیاتی الیکشن کے مراحل مکمل ہوئے شریف برادران نے کسانوں سے کیے گئے تمام وعدے بھلا دئیے۔	Y	بھلا	2687	      407	0.0016	798.8421	urd_news_2016_00470273
24400	بدقسمتی سے مسلمان یہ پیغام بھلا چکے ہیں۔	Y	بھلا	2687	      407	0.0016	1036.25	urd_news_2016_00315440
24401	انہوں نے کہاکہ حکومت کے اس اقدام سے تین نومبر 2007 کی بو آ رہی ہے۔	Y	بو	2687	      407	0.0016	353.6	urd_news_2016_00233277
24402	آزاد خارجہ پالیسی بنا کر ملک میں انصاف اور قانون کا بو ل بالا ہو گا۔	Y	بو	2687	      407	0.0016	508.5625	urd_news_2016_00050885
24403	ناظم پنجاب شمالی سید بو علی شاہ نے گوجرانوالہ میں خطاب کرتے ہوئے کہا کہ بھارت نے خود کشی کا راستہ چن لیا ہے۔	Y	بو	2687	      407	0.0016	633.8261	urd_news_2016_00920363
24404	فیصل آباد: کاشتکار چاول کی فصل بو رہے ہیں۔	Y	بو	2687	      407	0.0016	1095.2222	urd_news_2016_00731262
24405	امانت اللہ خان کا دہلی وقف بو..	Y	بو	2687	      407	0.0016	1430.2857	urd_news_2016_00151550
24406	وفاقی وزیر نے کہا کہ اب تو بھارتی میڈیا نے بھی بھارت کی اس جارحانہ پالیسی پر تنقید شروع کر دی ہے۔	Y	جارحانہ	2687	      407	0.0016	261.3333	urd_news_2016_00990800
24407	انہوں نے کہا کہ برآمدات کی جارحانہ مہم اور نجی شعبے کی جانب سے کئے جانے والے اقدامات سے ملک کو پائیدار ترقی کی راہ پر گامزن کیا جاسکے گا۔	Y	جارحانہ	2687	      407	0.0016	533.5926	urd_news_2016_00219368
24408	انھوں نے عراق میں غیرملکی فوج کی تعیناتی کو ایک جارحانہ اقدام قرار دیا ہے۔	Y	جارحانہ	2687	      407	0.0016	638.3333	urd_news_2016_00204736
24409	خبر ایجنسی مودی اور اسکے دفاعی منصوبہ ساز شدید خواہش کے باوجود پاکستان کے خلاف ممکنہ جارحانہ کارروائی سے گریز کرنے پر مجبور مقبوضہ کشمیر میں 74 ویں روز بھی صورتحال کشیدہ ہے۔	Y	جارحانہ	2687	      407	0.0016	736.7742	urd_news_2016_00527133
24410	کپتان اظہر علی کی باؤلنگ کے دوران جارحانہ کی بجائے دفاعی حکمت ِعملی انگلینڈ کی فتح کا سبب بنی۔	Y	جارحانہ	2687	      407	0.0016	1089.7059	urd_news_2016_00758999
24411	کراچی ،جیل چورنگی پر فائرنگ،کانسٹیبل سمیت تین افراد ہلاک اُردو پوائنٹ دنیاکی سب سے بڑی اُردو ویب سائیٹ ہے، جو پچھلے 15سال سے اُردو کی خدمت میں مصروف ہے۔	Y	چورنگی	2687	      407	0.0016	296.0769	urd_news_2016_00764769
24412	ان خیالات کا اظہار انھوں نے بدھ کی صبح نمائش چورنگی پر قائد تحریک الطاف حسین سے اظہار یکجہتی کے لیے گزشتہ روز سے جاری اظہار یکجہتی مظاہرے کے مقام پر میڈیا کو بریفنگ دیتے ہوئے کیا ۔	Y	چورنگی	2687	      407	0.0016	503.2903	urd_news_2016_00168674
24413	کراچی ،جیل چورنگی پر فائرنگ،کانسٹیبل سمیت تین افراد ہلاک ۔	Y	چورنگی	2687	      407	0.0016	685.6	urd_news_2016_00764768
24414	مقتول کی تاحال شناخت نہیں ہوسکی نیو کراچی دو منٹ چورنگی کے قریب فائرنگ کے ایک اور واقعہ میں ایک شخص زخمی ہوگیا۔	Y	چورنگی	2687	      407	0.0016	756.619	urd_news_2016_00886171
24415	سائٹ ایریا کے ہی علاقے غنی چورنگی سے بوری بند تشدد زدہ لاش ملی۔	Y	چورنگی	2687	      407	0.0016	1166.4286	urd_news_2016_00617350
24416	ان خیالات کا اظہار انہوں نے پیر کے روز یہاں وزیر اعظم ہاؤس میں سندھی میڈیا کے ایک وفد سے ملاقات کے دوران گفتگو کرتے ہوئے کیا۔	Y	سندھی	2687	      407	0.0016	278.92	urd_news_2016_00169005
24417	سندھی زبان کی ترقی کے لیے قائم کیے گئے اس ادارے میں آ کر انہیں بہت خوشی ہوئی ہے، وزیر ثقافت سید سردار علی شاہ کراچی،قانون نافذ کرنیوالے اداروں کی کارروائیاں، 5 ملزمان گرفتار پاکستان نے کشمیر کا معاملہ اقوام متحدہ میں اٹھا دیا ہے۔	Y	سندھی	2687	      407	0.0016	472.0952	urd_news_2016_00654158
24418	سندھی قوم پرست رہنما کی بازیابی کیلئے سپریم کورٹ میں درخواست دائر کر دی گئی ۔	Y	سندھی	2687	      407	0.0016	575.8667	urd_news_2016_00654328
24419	یوں، انگریزی زبان اور اردو زبان کے بعد، اب امریکی قونصل خانہ کراچی کی ویب سائٹ سندھی زبان میں بھی دستیاب ہو گئی ہے۔	Y	سندھی	2687	      407	0.0016	681.5909	urd_news_2016_00999108
24420	جنہیں اورنگی ٹاوٴن، بلدیہ ٹاوٴن، گلشن سکندر، خاموش کالونی، سندھی مسلم سوسائٹی، کریم آباد اور کورنگی کے مختلف مقامات میں فائرنگ کا نشانہ بنایا گیا۔	Y	سندھی	2687	      407	0.0016	1133.5	urd_news_2016_00482112
24421	ڈی پی او کوہستان اُردو پوائنٹ دنیاکی سب سے بڑی اُردو ویب سائیٹ ہے، جو پچھلے 15سال سے اُردو کی خدمت میں مصروف ہے۔	Y	کوہستان	2687	      407	0.0016	194.5	urd_news_2016_00566394
24422	چینی قونصل جنرل اُردو پوائنٹ پاکستان کوہستان کے تصاویری البم کوہستان کے سیاحتی مقامات کوہستان میں گورنمنٹ دفاتر اُردو پوائنٹ دنیاکی سب سے بڑی اُردو ویب سائیٹ ہے، جو پچھلے 15سال سے اُردو کی خدمت میں مصروف ہے۔	Y	کوہستان	2687	      407	0.0016	455.8929	urd_news_2016_00496726
24423	کوہستان سے قومی اسمبلی کی ایک اور صوبائی اسمبلی کی تین نشستوں پر 115امیدوار سامنے آگئے ۔	Y	کوہستان	2687	      407	0.0016	620.1429	urd_news_2016_00790050
24424	کوہستان میں ضلع کی تقسیم ، 3ہفتوں سے جاری تنازع ختم نہ ہو سکا ۔	Y	کوہستان	2687	      407	0.0016	785.9231	urd_news_2016_00790069
24425	سو سے زائد چینی باشندے کوہستان سے مانسہرہ منتقل کردئیے گئے۔	Y	کوہستان	2687	      407	0.0016	1232.4	urd_news_2016_00658883
24426	جسٹس گلزار نے کہا کہ آپ نے اس حوالے سے عدالت کو جائزہ لینے کا کیوں نہیں کہا اگر کہا تھا تو اس حوالے سے کیا بنا ۔	Y	گلزار	2687	      407	0.0016	280.2857	urd_news_2016_00464008
24427	اس کے ساتھ ہی اپوزیشن کے اراکین ایوان سے باہر چلے گئے تاہم تحریک انصاف کے رکن گلزار خان نے پی آئی اے کے حوالے سے صدارتی آرڈیننس پر اپوزیشن کے واک آؤٹ کا ساتھ نہیں دیا۔	Y	گلزار	2687	      407	0.0016	500.6333	urd_news_2016_00084509
24428	بدھ کو چیف جسٹس افتخار محمد چوہدری کی صدارت میں جسٹس گلزار احمد اور جسٹس شیخ عظمت سعید پر مشتمل 3 رکنی بنچ نے مقدمہ کی سماعت کی ۔	Y	گلزار	2687	      407	0.0016	625.6957	urd_news_2016_00315961
24429	جسٹس گلزار نے کہا کہ چار گنا سبسڈی بڑھا کر بھی آپ غریب لوگوں تک نہیں پہنچ سکتے۔	Y	گلزار	2687	      407	0.0016	688.1667	urd_news_2016_00464015
24430	گلزار ایک نامور شاعر اور ہدایت کار ہیں۔	Y	گلزار	2687	      407	0.0016	1008.125	urd_news_2016_00804265
24431	لیسکو حکام اُردو پوائنٹ دنیاکی سب سے بڑی اُردو ویب سائیٹ ہے، جو پچھلے 15سال سے اُردو کی خدمت میں مصروف ہے۔	Y	لیسکو	2687	      407	0.0016	214.7222	urd_news_2016_00824853
24432	لیسکو کا پنجاب حکومت کے تعاون سے بجلی چوروں کیخلاف گرینڈ آپریشن کا فیصلہ، پنجاب پولیس بھی لیسکو کیساتھ تعاون کریگی،ذرائع لاہور (اُردو پوائنٹ اخبار تازہ ترین۔	Y	لیسکو	2687	      407	0.0016	517.2917	urd_news_2016_00824873
24433	لیسکو نے چند روز قبل لاہور کے نصف سے زائد علاقوں میں مسلسل 10 گھنٹے کی طویل لوڈشیڈنگ کی تھی۔	Y	لیسکو	2687	      407	0.0016	608.9444	urd_news_2016_00824934
24434	عدالت نے چیف ایگزیکٹو لیسکو قیصر زمان سے 15 روز میں جواب طلب کرلیا۔	Y	لیسکو	2687	      407	0.0016	737.3846	urd_news_2016_00700595
24435	لیسکو کی سفارش پر سپیشل آڈٹ کرایا گیا۔	Y	لیسکو	2687	      407	0.0016	1281.875	urd_news_2016_00824877
24436	امریکہ کے سفیر نے ماحولیاتی تبدیلی کے حوالے بات کرتے ہوئے کہا کہ امریکہ ماحولیاتی تبدیلی کے متعلق ہر طرح کی امداد کرنے کے لئے تیار ہے ۔	Y	ماحولیاتی	2687	      407	0.0016	338.5714	urd_news_2016_00157642
24437	نیوزی لینڈ کے وزیر تجارت نے مزید کہا کہ ہم ماحولیاتی اشیاء کے بارے میں معاہدے کی حمایت کرتے ہیں ۔	Y	ماحولیاتی	2687	      407	0.0016	518.6316	urd_news_2016_00937926
24438	وزیر انچارج برائے ماحولیاتی تبدیلی زاہد حامد نے کہا کہ ماحولیاتی تبدیلی ملک کے لئے ایک اہم مسئلہ ہے ۔	Y	ماحولیاتی	2687	      407	0.0016	577	urd_news_2016_00979812
24439	اس موقع پر گورنر پنجاب چوہدری سرور نے 70نمایاں صنعتی و تجارتی اداروں میں بہترین ماحولیاتی سرگرمیوں ، ماحولیاتی معیار کی پابندی اور قوانین کے نفاذ پر معیاری کوششوں پر ایوارڈ تقسیم کئے گئے اور ان کی کوششوں اور این ایف ای ایچ کی کارکردگی کو سراہا۔	Y	ماحولیاتی	2687	      407	0.0016	659.7632	urd_news_2016_00107258
24440	جلد شوگر ملز کے کیس ماحولیاتی ٹریبونل میں بھیجے جائیں گے ۔	Y	ماحولیاتی	2687	      407	0.0016	1168.9091	urd_news_2016_00471944
24441	اس بات کا فیصلہ اسلام آباد میں ن لیگ کے اجلاس میں کیا گیا، جس میں نواز کے کے وفاقی وزرا اور دیگر رہنما شریک تھے ۔	Y	وزرا	2687	      407	0.0016	257.6364	urd_news_2016_00055900
24442	گورنر پنجاب اور پیپلز پارٹی کے وزرا کی طرف سے غیر ذمہ دارانہ بیانات کا سلسلہ جاری رہا تو ن لیگ اپنی پالیسی پر نظر ثانی کرے گی۔	Y	وزرا	2687	      407	0.0016	464.8214	urd_news_2016_00807599
24443	ہمیں سندھ حکومت سے کوئی امید نہیں،اس کے وزرا نااہل ہیں۔	Y	وزرا	2687	      407	0.0016	555.3333	urd_news_2016_00910886
24444	قومی اسمبلی ، اپوزیشن کا حکومتی وزرا کی عدم شرکت اور وفاقی وزیر رانا تنویر کے متنازعہ بیان کے خلاف واک آؤٹ ۔	Y	وزرا	2687	      407	0.0016	690.05	urd_news_2016_00747038
24445	چمپئن شپ میں مہمان خصوصی وفاقی وزرا ہونگے۔	Y	وزرا	2687	      407	0.0016	1044.375	urd_news_2016_00494819
24446	آسٹریلین اے کرکٹ ٹیم کا دورہ پاکستان قومی ٹیم کے لئے امتحان ثابت ہوگا اُردو پوائنٹ دنیاکی سب سے بڑی اُردو ویب سائیٹ ہے، جو پچھلے 15سال سے اُردو کی خدمت میں مصروف ہے۔	Y	آسٹریلین	2688	      406	0.0016	252.3103	urd_news_2016_00061766
24447	پاکستان اے کرکٹ ٹیم کی آسٹریلین ٹیم کیخلاف کامیابی سلیکشن کمیٹی کی میرٹ پر سلیکشن کے باعث ہوئی ہے ۔	Y	آسٹریلین	2688	      406	0.0016	543.875	urd_news_2016_00345200
24448	آسٹریلین اے کرکٹ ٹیم کا دورہ پاکستان قومی ٹیم کے لئے امتحان ثابت ہوگا انڈین کرکٹ لیگ کھیلنے سے انکار نہیں کیا۔	Y	آسٹریلین	2688	      406	0.0016	573.65	urd_news_2016_00061767
24449	آسٹریلین اوپن ٹینس ۲۰۱٦ کے نام سے کوئی خبر موجود نہیں ہے۔	Y	آسٹریلین	2688	      406	0.0016	641.2727	urd_news_2016_00061724
24450	انڈر19 ورلڈکپ آسٹریلین ٹیم تین مرتبہ جیت چکی ہے۔	Y	آسٹریلین	2688	      406	0.0016	1108.5556	urd_news_2016_00173903
24451	وزیراعظم نے کہا کہ آج کا پاکستان اس پاکستان سے مختلف ہے جو ہمیں اڑھائی سال قبل ملا تھا۔	Y	اڑھائی	2688	      406	0.0016	271.7222	urd_news_2016_00969495
24452	انہوں نے کہا کہ آزاد کشمیر کی حکومت کے ساتھ ایک معاہدہ کیا گیا ہے کہ اسے اڑھائی روپے فی یونٹ کے حساب سے بجلی فراہم کی جائے گی اور باقی بوجھ حکومت برداشت کرے گی۔	Y	اڑھائی	2688	      406	0.0016	449.871	urd_news_2016_00209588
24453	تقریب سے خطاب کرتے ہوئے ڈاکٹر امجد ثاقب نے کہا کہ بدقسمتی یہ ہے کہ ملک میں اڑھائی کروڑ بچے سکول نہیں جاتے ۔	Y	اڑھائی	2688	      406	0.0016	553.1818	urd_news_2016_00433134
24454	زراعت ، جنگلات اور لیبر انتہائی اہمیت کے حامل ہیں ان پر کوئی خاص قانون سازی نہیں کی گئی اڑھائی ماہ میں دھرنے کی وجہ سے خیبر پختونخوا اسمبلی غیر فعال ہو کر دھرنا متاثرہ اسمبلی ہو گئی ہے ۔	Y	اڑھائی	2688	      406	0.0016	649.1471	urd_news_2016_00605794
24455	میٹرو ٹرین منصوبے کے آغاز سے روزانہ تقریباً اڑھائی لاکھ شہری مستفید ہوں گے۔	Y	اڑھائی	2688	      406	0.0016	933.7857	urd_news_2016_00846106
24456	مسئلہ کشمیر پر کل جماعتی کانفرنس( آج) ہوگی ، اُردو پوائنٹ دنیاکی سب سے بڑی اُردو ویب سائیٹ ہے، جو پچھلے 15سال سے اُردو کی خدمت میں مصروف ہے۔	Y	جماعتی	2688	      406	0.0016	217.8333	urd_news_2016_00873856
24457	انہوں نے کہا کہ ہم نے پنجاب کے غیر جماعتی بلدیاتی نظام کے خلاف عدالت سے رجوع کیا ہے اور ہم عدالت سے درخواست کر رہے ہیں کہ وہ پنجاب حکو مت کو غیر جماعتی کی بجائے جماعتی بنیادوں پر بلدیاتی انتخابات کروانے کا حکم دیں ۔	Y	جماعتی	2688	      406	0.0016	441.1714	urd_news_2016_00257002
24458	اس موقع پر درخواست گزار کے وکیل شعیب شاہین نے عدالت کو بتایا کہ اسلام آباد میں ہونے والے بلدیاتی انتخابات غیر جماعتی بنیاد پر منعقد کروائے جارہے ہیں جو کہ غیر قانونی اور غیر آئینی ہے۔	Y	جماعتی	2688	      406	0.0016	521.303	urd_news_2016_00104000
24459	دہشتگردی کے واقعات، کل جماعتی کانفرنس کے انعقاد کا مطالبہ ۔	Y	جماعتی	2688	      406	0.0016	643.4444	urd_news_2016_00544382
24460	حریت کانفرنس 26 جنوری کو کل جماعتی کانفرنس منعقد کریگی۔	Y	جماعتی	2688	      406	0.0016	1055	urd_news_2016_00510488
24461	انہوں نے کہا کہ ریاست کی تشکیل نو کے قانون کے مطابق، ہر اصل حالت کا اپنی دارالحکومت کے شہر پر واحد حق ہے، لیکن اس ریاست کو چندی گڑھ کو دینے سے انکار کر پنجاب کے ساتھ بھاری ظلم کیا گیا تھا.	Y	چندی	2688	      406	0.0016	474.3421	urd_news_2016_00236781
24462	خبر ایجنسی قائم علی شاہ سندھ اسمبلی میں ایک بار پھر اپنی نشست بھول گئے صدر سے وزیر تجارت خرم دستگیر کی ملاقات ،وزارت سے متعلق بریفنگ دی بھارت کا چندی پور ٹیسٹ رینج سے باراک میزائل کا تجربہ۔	Y	چندی	2688	      406	0.0016	761.8611	urd_news_2016_00526863
24463	آئی ایس پی آر سوشل میڈیا پر 200سے زائد خواتین ڈاکٹرز کو بلیک میل کرنے کا الزام بھارت کا چندی پور ٹیسٹ رینج سے باراک میزائل کا تجربہ۔	Y	چندی	2688	      406	0.0016	836.84	urd_news_2016_00281169
24464	ٹیوٹا سٹی ٹریفک پولیس کے اشتراک سے سالانہ 15سو افراد کو ڈرائیونگ کی تربیت فراہم کرے گی‘ عرفان قیصر شیخ رائے ونڈ مارچ عمران خان کی سیاست ختم کردے گا ‘ رانا بابر حسین بھارت کا چندی پور ٹیسٹ رینج سے باراک میزائل کا تجربہ۔	Y	چندی	2688	      406	0.0016	908.5366	urd_news_2016_00445385
24465	فاروق ستار بھارت کا چندی پور ٹیسٹ رینج سے باراک میزائل کا تجربہ۔	Y	چندی	2688	      406	0.0016	1271.5833	urd_news_2016_00724233
24466	پنجاب میں سی این جی اسٹیشنوں کی رجسٹریشن کا کام مکمل کر لیا گیا اُردو پوائنٹ دنیاکی سب سے بڑی اُردو ویب سائیٹ ہے، جو پچھلے 15سال سے اُردو کی خدمت میں مصروف ہے۔	Y	اسٹیشنوں	2689	      405	0.0016	221.3214	urd_news_2016_00392486
24467	انہوں نے بتایا کہ جن اضلاع یا پولنگ اسٹیشنوں پر صورتحال انتہائی خراب ہوئی تو وہاں پر فوج تعینات کی جائے گی۔	Y	اسٹیشنوں	2689	      405	0.0016	472.7619	urd_news_2016_00197371
24468	مختلف وفود سے گفتگو کرتے ہوئے انہوں نے کہاکہ بلدیاتی انتخابات کے باقی مراحل میں پولنگ اسٹیشنوں پر فوج تعینات کی جائے۔	Y	اسٹیشنوں	2689	      405	0.0016	568.0455	urd_news_2016_00856507
24469	الیکشن کمیشن فوری طور مقامی حکومتیں ختم کر کے جعلی پولنگ اسٹیشنوں کا نوٹس لے ۔	Y	اسٹیشنوں	2689	      405	0.0016	640.9333	urd_news_2016_00147804
24470	برفباری کے باوجود پولنگ اسٹیشنوں پر لوگوں کا رش ہے۔	Y	اسٹیشنوں	2689	      405	0.0016	991.7	urd_news_2016_00320006
24471	انہوں نے کہا کہ حکومت ملک میں جاری بجلی و دیگر بحرانوں کے خاتمے کیلئے اپنا کردار ادا کر رہی ہے ۔	Y	بحرانوں	2689	      405	0.0016	242.0476	urd_news_2016_00233454
24472	اس موقع پر سیکرٹری جنرل ڈاکٹر محمد امجد نے ان کا پارٹی میں شمولیت پر خیر مقدم کرتے ہوئے کہا کہ اس وقت ملک کو درپیش سنگین بحرانوں سے صرف اور صرف جنرل(ر)پرویز مشرف ہی نکال سکتے ہیں۔	Y	بحرانوں	2689	      405	0.0016	473.1944	urd_news_2016_00105273
24473	انہوں نے کہا کہ حکمرانوں نے ملک کو بحرانوں سے نہ نکالنے اور عوام کو ریلیف نہ دینے کی قسم کھا رکھی ہے ۔	Y	بحرانوں	2689	      405	0.0016	585.4	urd_news_2016_00232117
24474	یہ شہر طویل مدت سے بحرانوں کا شکار ہے ۔	Y	بحرانوں	2689	      405	0.0016	655.5556	urd_news_2016_00668778
24475	جس کا نتیجہ مارشل لاء اور سیاسی بحرانوں کی صورت میں نکلا۔	Y	بحرانوں	2689	      405	0.0016	938	urd_news_2016_00465678
24476	انہوں نے کہا کہ وفاقی وزیر مذہبی امور نے ہمیں کہا کہ اگر مذاکرات ناکام ہو گئے تو 111 بریگیڈ کارروائی کرے گا۔	Y	بریگیڈ	2689	      405	0.0016	338.9474	urd_news_2016_00262550
24477	محکمہ فائر بریگیڈ کا کہنا ہے مزید عملہ طلب کیا گیا ہے۔	Y	بریگیڈ	2689	      405	0.0016	642.3636	urd_news_2016_00852507
24478	تا کہ کسی بھی حادثے کی صورت میں حادثے کی صورت میں فائر بریگیڈ کے عملے اور گاڑیوں کو پہنچنے میں آسانی ہو ۔	Y	بریگیڈ	2689	      405	0.0016	722.6667	urd_news_2016_00406310
24479	واقعہ کی اطلاع ملتے ہی ریسکیو کی ٹیمیں، نیوی کے اہلکار اور فائر بریگیڈ کی گاڑیاں جائے حادثہ پر پہنچ گئیں اور امدادی کارروائیاں شروع کر دیں۔	Y	بریگیڈ	2689	      405	0.0016	885.125	urd_news_2016_00947937
24480	فائر بریگیڈ عملہ نے آگ پر تقریبا 2 گھنٹے بعد قابو پایا۔	Y	بریگیڈ	2689	      405	0.0016	1222.3636	urd_news_2016_00725594
24481	، چیئرمین سی ڈی اے معروف افضل غیر معینہ مدت کی رخصت پر چلے گئے اُردو پوائنٹ دنیاکی سب سے بڑی اُردو ویب سائیٹ ہے، جو پچھلے 15سال سے اُردو کی خدمت میں مصروف ہے۔	Y	رخصت	2689	      405	0.0016	418.2069	urd_news_2016_00504017
24482	کونسل کا اجلاس طلب کرنے کے بعد پی او 27 کے تحت کس طرح لازمی رخصت پر جج کو بھیجا جا سکتا ہے۔	Y	رخصت	2689	      405	0.0016	505.4286	urd_news_2016_00790887
24483	میں پوری خوشی کے ساتھ رخصت لے سکتا ہوں۔	Y	رخصت	2689	      405	0.0016	578.3333	urd_news_2016_00910051
24484	ڈاکٹر مختار احمد نے اپنے افتتاحی خطاب میں رخصت ہونے والے چیئرپرسن کی خدمات کی تعریف کی اور پاکستان میں اجلاس منعقد کرنے اور ممبران ممالک کے نمائندوں کی میزبانی کرنے پر مسرت کا اظہار کیا۔	Y	رخصت	2689	      405	0.0016	723.8	urd_news_2016_00564111
24485	لیجنڈ فنکار معین اختر کو دنیا سے رخصت ہوئے 3 برس بیت گئے ۔	Y	رخصت	2689	      405	0.0016	1199.4167	urd_news_2016_00823316
24486	وزیر اعظم نے سیوریج منصوبے کے لیے 4 کروڑ روپے کا اعلان کرتے ہوئے کہا کہ سیوریج منصوبہ جلد ہی شروع کیا جائے گا.	Y	سیوریج	2689	      405	0.0016	236.7273	urd_news_2016_00969302
24487	ذرائع کے مطابق لاہور اور راولپنڈی کے سیوریج پانی میں پولیو وائرس پایا گیا ہے۔	Y	سیوریج	2689	      405	0.0016	579.6429	urd_news_2016_00580333
24488	شیخ آفتاب احمد کی اٹک میں بجلی، گیس، سڑکوں، سیوریج، سکول اور کالجز بارے تمام ترقیاتی سکیموں کو جلد مکمل کرنے کی ہدایت پارلیمانی کمیٹی نے الیکشن کمیشن کے ممبران کے ناموں کی منظوری دیدی ہے۔	Y	سیوریج	2689	      405	0.0016	695.8788	urd_news_2016_00665378
24489	اُنہوں نے سیکرٹری ہاؤسنگ و پبلک ہیلتھ اور لوکل گورنمنٹ کو پینے کے پانی اور سیوریج کے بارے میں تین دن میں جامع بریفنگ دینے کی ہدایت کی۔	Y	سیوریج	2689	      405	0.0016	819	urd_news_2016_00203601
24490	دنیا بھر میں سیوریج سے ملنے والی حیرت انگیز چیزیں۔	Y	سیوریج	2689	      405	0.0016	1099.3	urd_news_2016_00549118
24491	انہوں نے کہا کہ پیپلز پارٹی سیلاب پر سیاست ہر گز نہیں کرے گی ۔	Y	گز	2689	      405	0.0016	364.5714	urd_news_2016_00224317
24492	چیئرمین کمیٹی نے کہا کہ میرٹ پر سمجھوتہ ہر گز نہ کیا جائے ملک میں ٹیلنٹ کی کوئی کمی نہیں ہے ۔	Y	گز	2689	      405	0.0016	474.3333	urd_news_2016_00504812
