ORDER	SENTENCE	STATUS	WORD	RANK	COUNT	COUNT_REL	INDEX	ID
24683	سلیم سیف اللہ خان اور میاں محمد آصف نے کہا کہ موجودہ حکمرانوں کی پالیسیوں کی وجہ سے ملک کی سالمیت اور خود مختاری خطرات سے دو چار ہو چکی ہے اور اگر فوری طور پر موجودہ حکومت کا راستہ نہ روکا گیا تو حالات مزید خراب ہو جائیں گے۔	Y	مختاری	2695	      399	0.0016	533.093	urd_news_2016_00644450
24684	حکومت پاکستان نے اسٹیٹ بینک کی خود مختاری کیلئے اسی ماہ قانون سازی کی یقین دہانی کرا دی۔	Y	مختاری	2695	      399	0.0016	610.5882	urd_news_2016_00516580
24685	عائشہ شبیر نے کہا کہ ملک کی خود مختاری بیچ دی گئی ۔	Y	مختاری	2695	      399	0.0016	872.9167	urd_news_2016_00696595
24686	ذرائع کے مطابق گرفتار افراد کا تعلق ملائیشیا سے ہے ۔	Y	ملائیشیا	2695	      399	0.0016	361.6	urd_news_2016_00580194
24687	ملائیشیا کے فوجی قیادت کے ساتھ ملاقات میں فوجیوں کے درمیان تعلقات مشترکہ فوجی تربیت اور دفاعی تعاون پر تبادلہ خیال کیا گیا ۔	Y	ملائیشیا	2695	      399	0.0016	564.7	urd_news_2016_00892172
24688	ٹورنامنٹ میں پاکستان کے علاوہ بھارت‘ نیوزی لینڈ‘ مصر اور میزبان ملائیشیا کی ٹیمیں شرکت کریں گی۔	Y	ملائیشیا	2695	      399	0.0016	741.1176	urd_news_2016_00445877
24689	ٹورنامنٹ میں پاکستان سمیت آسٹریلیا، نیوزی لینڈ، بھارت، جنوبی کوریا اور میزبان ملائیشیا کی ٹیمیں حصہ لیں گی۔	Y	ملائیشیا	2695	      399	0.0016	850.0556	urd_news_2016_00445870
24690	اداکارہ ثناء اگلے ماہ ملائیشیا روانہ ہونگی ۔	Y	ملائیشیا	2695	      399	0.0016	1381	urd_news_2016_00035460
24691	ملبے سے ہلاک اور زخمی ہونے والوں کو نکالنے کا کام جاری ہے۔	Y	ملبے	2695	      399	0.0016	440.5385	urd_news_2016_00892318
24692	دھماکے کے فوری بعد مقامی لوگوں نے اپنی مدد آپ کے تحت امدادی کارروائیاں شروع کردیں اور درجنوں لاشوں کو ملبے سے نکال لیا مرنے والوں میں چھ بچے بھی شامل ہیں ۔	Y	ملبے	2695	      399	0.0016	630.6452	urd_news_2016_00548434
24693	واقعہ کے بعد علاقہ مکینوں نے اپنی مدد آپ کے تحت ملبے سے لاشوں اور زخمی کو نکالا۔	Y	ملبے	2695	      399	0.0016	744.1176	urd_news_2016_00948198
24694	بدھ کو بھی سارا دن ملبے کو ٹھکانے لگانے کا عمل جاری رکھا گیا۔	Y	ملبے	2695	      399	0.0016	830.5385	urd_news_2016_00315765
24695	زخمیوں کو ملبے تلے سے نکالا اور انھیں ہسپتال پہنچایا۔	Y	ملبے	2695	      399	0.0016	1202.5	urd_news_2016_00605545
24696	انہوں نے کئی ملکی اور غیر ملکی ٹورنامنٹ میں شرکت کی اور کئی میڈل حاصل کرکے ملک و قوم کا نام روشن کیا۔	Y	میڈل	2695	      399	0.0016	374.3	urd_news_2016_00264158
24697	حکومت انکی سپورٹ کرے تو وہ دن دور نہیں جب پاکستان بھی ہاکی میں گولڈ میڈل جیت کر ملک کا نام روشن کرے گا۔	Y	میڈل	2695	      399	0.0016	595.7391	urd_news_2016_00515605
24698	قومی ٹیم اس سے پہلے اولمپکس میں تین بار گولڈ میڈل جیت چکی ہے تاہم اس بار کوالیفائی ہی نہ کر پائی۔	Y	میڈل	2695	      399	0.0016	757.8	urd_news_2016_00749835
24699	سرگودھا: میٹرک کے امتحانات میں پوزیشن حاصل کرنے والے طالبعلم اپنے میڈل دکھا رہے ہیں۔	Y	میڈل	2695	      399	0.0016	976.4667	urd_news_2016_00633015
24700	یوں لگتا تھاکہ اہلیت کی شرط صرف گولڈ میڈل ہے۔	Y	میڈل	2695	      399	0.0016	1701.6	urd_news_2016_00999315
24701	اس لیے تمام لوگ یہ چاہتے ہیں کہ وہ حکومت کو گندم فروخت کریں ، جو کہ ناممکن ہے ۔	Y	ناممکن	2695	      399	0.0016	363	urd_news_2016_00096373
24702	دونوں صوبوں میں بلدیاتی انتخابات کے شیڈول میں تین روز کی توسیع کے بعد انتخابی عمل ناممکن ہو چکا ہے۔	Y	ناممکن	2695	      399	0.0016	543.2222	urd_news_2016_00559400
24703	انہوں نے کہا کہ دنیا میں کوئی بھی چیز ناممکن نہیں ،ہمیں یہ سوچ پیدا کرنا ہو گی کہ کیا وجہ ہے کہ ہم اتنے سال گزرنے کے باوجود انڈسٹری کو دوبارہ اپنے پاؤں پر کھڑا نہیں کرسکے۔	Y	ناممکن	2695	      399	0.0016	620.7429	urd_news_2016_00235714
24704	ادویات کی قیمتوں میں مسلسل اضافہ سے غریب آدمی کیلئے علاج ناممکن ہوگیا ۔	Y	ناممکن	2695	      399	0.0016	783.6154	urd_news_2016_00040666
24705	بلدیاتی انتخابات 18جنوری کو کرانا ناممکن ہوگئے،شرجیل میمن ۔	Y	ناممکن	2695	      399	0.0016	1249.5556	urd_news_2016_00329069
24706	تفصیلات کے مطابق آئی سی سی کی جانب سے نیپال کرکٹ بورڈ کی رکنیت کو معطل کر دیا گیا ہے۔	Y	نیپال	2695	      399	0.0016	399.1667	urd_news_2016_00426509
24707	تفصیلات کے مطابق وزیراعظم نواز شریف کی نیپال روانگی سے قبل انور بیگ نے ان کے ساتھ ملاقات کی اور اپنا استعفیٰ پیش کیا۔	Y	نیپال	2695	      399	0.0016	533.0455	urd_news_2016_00432097
24708	پول اے میں بھارت، افغانستان، سر ی لنکا اور پول بی میں ایران، نیپال اور پاکستان شامل ہیں۔	Y	نیپال	2695	      399	0.0016	637.8	urd_news_2016_00394906
24709	بھارت اور نیپال میں زلزلے سے ہلاکتوں کا خدشہ بھی ظاہر کیا جارہا ہے۔	Y	نیپال	2695	      399	0.0016	709.8571	urd_news_2016_00298263
24710	انٹرنیشنل سپورٹس فیسٹیول، پاکستان نے نیپال کو بیس بال میچ میں ہرا دیا ۔	Y	نیپال	2695	      399	0.0016	973.3846	urd_news_2016_00166192
24711	اس میں مال وئیر شامل کرے گا اور یہ ویڈیو آپ کو بھیج دے گا۔	Y	وئیر	2695	      399	0.0016	547.7143	urd_news_2016_00099692
24712	کوئی نہ کوئی حکومت یا سافٹ وئیر ہم سب کی آن لائن سرگرمیوں پر نظر رکھے ہوئے ہے۔	Y	وئیر	2695	      399	0.0016	602.4118	urd_news_2016_00795155
24713	جو بھی اس کو استعمال کرنا چاہیں وہ ایپل بیٹا سافٹ وئیر پروگرام میں ایپل آئی ڈی سے شامل ہو جائیں۔	Y	وئیر	2695	      399	0.0016	682.3	urd_news_2016_00484354
24714	کراچی، حج عمرہ سے متعلق مجلس آئی نے نیا موبائل سافٹ وئیر متعارف کرایا دیا ،دعوت اسلامی ۔	Y	وئیر	2695	      399	0.0016	976.9412	urd_news_2016_00764962
24715	پاکستانی طالبعلم کا قابل فخر کارنامہ ،دلچسپ سافٹ وئیر تیار کر لیا ۔	Y	وئیر	2695	      399	0.0016	1332.8333	urd_news_2016_00350087
24716	خفیہ ایجنسیوں کو بھی آخری وارننگ دی ہے کہ معاملہ حل نہیں کیا گیا تو ان کے خلاف کارروائی کی جائے گی۔	Y	وارننگ	2695	      399	0.0016	382.4091	urd_news_2016_00531002
24717	تفصیلات کے مطابق وفاقی وزیر اطلاعات پرویز رشید کا کہنا ہے کہ محکمہ موسمیات نے خیبر پختونخواہ میں 25 اپریل کو ہی خراب موسم کی وارننگ جاری کر دی تھی۔	Y	وارننگ	2695	      399	0.0016	455.5172	urd_news_2016_00432266
24718	پاکستان کرکٹ بورڈ نے شاہد آفریدی کو سخت وارننگ جاری کردی ۔	Y	وارننگ	2695	      399	0.0016	557.7273	urd_news_2016_00353052
24719	کام کریں ،نتائج دیں ورنہ عہدے چھوڑ دیں،وزیراعلیٰ پنجاب کی زرعی اداروں کے حکام اور ماہرین کو وارننگ پنجاب میں مخصوص نشستوں پر ضمنی الیکشن عارضی طور پر ملتوی 6 ستمبر کو عام تعطیل کا اعلان کیا جائے ۔	Y	وارننگ	2695	      399	0.0016	703.3824	urd_news_2016_00756821
24720	رانا ثناء اللہ نے ریحام خان کو وارننگ دیدی، رانا ثناء اللہ ویڈیوز ۔	Y	وارننگ	2695	      399	0.0016	972.5	urd_news_2016_00586761
24721	پاکستان (KSF Pakistan)کی جانب سے کیا گیا۔	Y	pakistan	2696	      398	0.0016	745.125	urd_news_2016_00342314
24722	اس پروگرام کے تحت Kaymu Pakistan کی ایک پوری ٹیم پاکستان میں لوگوں کو آن لائن کاروبار کو شروع کرنے کے طریقہ کار، فوائد اور چیلنجز کے حوالے سے رہنمائی فراہم کرنے کے لئے مختلف ٹیوٹوریل، ورکشاپس اور سیشنز sessions کا انعقاد کرے گی۔	Y	pakistan	2696	      398	0.0016	878.4737	urd_news_2016_00058110
24723	Pakistan Exclusive and HD Videos - UrduPoint Videosٹینکنالوجی اور گیجیٹس یوم دفاع پاکستان پر اس جنگ کے دوران شہید ہونے والے شہداء کو عوام کس طرح یاد کرتی ہے؟	Y	pakistan	2696	      398	0.0016	1074.3571	urd_news_2016_00004067
24724	Pakistan Porsche میں مارکینٹنگ مینجر کی حیثیت سے کام کر رہی ہیں۔	Y	pakistan	2696	      398	0.0016	1077.3333	urd_news_2016_00004069
24725	ان خیالات کا اظہار انہوں نے گلوبل میڈیا لنکس اور بیٹر پاکستان فورم(Better Pakistan Forum)کے تحت بزنس لیڈر شپ سمٹ اور چوتھے بین الاقوامی گلوبل سی ای او ایکسیلینس ایوارڈز اور ملٹی نیشنل سی ای او ایکسیلینس ایوارڈز کے موقع پر کیا۔	Y	pakistan	2696	      398	0.0016	1143.4	urd_news_2016_00171004
24726	جس پر صوبائی وزیر نے کہا کہ وہ ٹریفک مسائل کی وجہ سے نہیں آسکے لیکن انہیں یہاں ہونا چاہیے تھا ۔	Y	آسکے	2696	      398	0.0016	283.5714	urd_news_2016_00461606
24727	عمران خان متوقع شکست کی اطلاعات کی وجہ سے لاہور نہ آسکے ‘ذرائع ۔	Y	آسکے	2696	      398	0.0016	532.1667	urd_news_2016_00713602
24728	فاٹا میں تعمیراتی مرحلہ مکمل ہونے کے تین ماہ کے اندر بلدیاتی انتخابات کرائے جائیں تاکہ حکومت اور فاٹا کے عوام کے درمیان تعلقات میں بہتری آسکے، فاٹا میں بلدیاتی انتخابات کا مقصد خطے میں سیاسی قانونی اور آئینی اصلاحات کے ذریعے حکومتی رٹ قائم کرنا ہے۔	Y	آسکے	2696	      398	0.0016	656.6571	urd_news_2016_00723760
24729	انکے مشکلات اور مسائل میں کمی آسکے ۔	Y	آسکے	2696	      398	0.0016	798.1429	urd_news_2016_00186530
24730	تمام صارفین کو یکساں صاف پینے کا پانی میسر آسکے ۔	Y	آسکے	2696	      398	0.0016	1133.7	urd_news_2016_00436489
24731	ڈی جی اسپورٹس بورڈ نے پی ایچ ایف کے سیکریٹری کو اس بات کی یقین دہانی کرائی کہ وہ اس مسئلے کو ترجیح بنیاد پر حل کریں گے اور مالی تعاون بھی کریں گے۔	Y	اسپورٹس	2696	      398	0.0016	446.7	urd_news_2016_00567333
24732	انہوں نے مزید کہا کہ خیرپور یوتھ کونسل کا پلیٹ فارم یہاں کے نوجوانوں کو اسپورٹس، صحت، کلچر اور دیگر معلومات کی فراہمی کے لئے مثبت کردار پیش کرے گا۔	Y	اسپورٹس	2696	      398	0.0016	633.2069	urd_news_2016_00266633
24733	سپورٹس پالیسی کے نفاذ پر اسپورٹس بورڈ اور پاکستان اولمپک ایسوسی ایشن کے درمیان جھگڑا ڈیڑھ سال سے جاری ہے۔	Y	اسپورٹس	2696	      398	0.0016	784.2632	urd_news_2016_00624304
24734	دریں اثناء ینگ بلوچ اور اعظم اسپورٹس نے پاکستان رینجرز سندھ لیجنڈ فٹ بال ٹورنامنٹ میں اپنے اپنے میچز جیت لئے۔	Y	اسپورٹس	2696	      398	0.0016	925.95	urd_news_2016_00541661
24735	دبئی اسپورٹس سٹی رواں ماہ دو میگا ٹوئنٹی 20 میچز کی میزبانی کریگا ۔	Y	اسپورٹس	2696	      398	0.0016	1272.9167	urd_news_2016_00536610
24736	وزیراعلیٰ سندھ نے کہا کہ کراچی پولیس نے 555 ایسے افراد کو بھی گرفتار کیا ہے جو اسٹریٹ کرائم اور دیگر جرائم میں ملوث ہیں۔	Y	اسٹریٹ	2696	      398	0.0016	345.8696	urd_news_2016_00975916
24737	رینجرز اور پولیس کی کاروائیوں میں تیزی کے بعد اسٹریٹ میں واضح کمی آگئی تھی مگر جرائم پیشہ عناصر ایک مرتبہ پھر سر گرم عمل ہوگئے ہیں ڈی رینجرز اور ایڈیشنل آئی جی اسٹریٹ کرائم کے واقعات میں اضافے کا فوری نوٹس لیں۔	Y	اسٹریٹ	2696	      398	0.0016	650.7838	urd_news_2016_00599278
24738	ایس ایس پی سینٹرل کے مطابق ملزم ڈکیتی اور اسٹریٹ کرائم کی متعدد وارداتوں میں ملوث ہے۔	Y	اسٹریٹ	2696	      398	0.0016	774.5	urd_news_2016_00053785
24739	ملزمان کی اسٹریٹ کرائم کی بھی متعدد وارداتوں میں ملوث تھے ۔	Y	اسٹریٹ	2696	      398	0.0016	844.7	urd_news_2016_00894347
24740	ڈائریکٹر پنجاب فوڈ اتھارٹی عائشہ ممتاز کا لاہور فوڈ اسٹریٹ پر چھاپہ ۔	Y	اسٹریٹ	2696	      398	0.0016	1118	urd_news_2016_00565558
24741	ممتاز عالم دین حافظ عبد السلام اُردو پوائنٹ دنیاکی سب سے بڑی اُردو ویب سائیٹ ہے، جو پچھلے 15سال سے اُردو کی خدمت میں مصروف ہے۔	Y	السلام	2696	      398	0.0016	425	urd_news_2016_00902151
24742	مریم نواز حج کرپشن کیس ٗ اسلام آباد ہائی کورٹ نے راؤ شکیل اور آفتاب السلام کی ضمانت کی درخواستوں پر فیصلہ محفوظ کرلیا وزیر اعظم نواز شریف آج شام قوم سے خطاب کریں گے۔	Y	السلام	2696	      398	0.0016	567.375	urd_news_2016_00865815
24743	برطانوی ہائی کمشنر کی وزیر داخلہ چوہدری نثار سے ملاقات حج کرپشن کیس ٗ اسلام آباد ہائی کورٹ نے راؤ شکیل اور آفتاب السلام کی ضمانت کی درخواستوں پر فیصلہ محفوظ کرلیا ایبٹ آباد، ڈی سیٹ ریفرنس ۔	Y	السلام	2696	      398	0.0016	691.5625	urd_news_2016_00319161
24744	حضرت یوسف علیہ السلام کو خریدنے والے مصری جنہوں نے بیک نظر حضرت یوسف علیہ السلام کو پہچان لیا اور گھر جا کر اپنی بیوی کو حضرت یوسف کا خیال رکھنے کا کہا۔	Y	السلام	2696	      398	0.0016	889.4167	urd_news_2016_00512066
24745	لہٰذا حضرت صالح علیہ السلام نے اللہ کے حضور دعا مانگی۔	Y	السلام	2696	      398	0.0016	1626.1818	urd_news_2016_00823926
24746	اس پر عدالت نے کہا کہ آپ دلائل نہ دیں پھر کسی وقت دے دیجئے گا ۔	Y	دیجئے	2696	      398	0.0016	394.5	urd_news_2016_00057745
24747	پھر اس میں چینی شامل کر دیجئے۔	Y	دیجئے	2696	      398	0.0016	559.7143	urd_news_2016_00372337
24748	دودھ خشک ہو جائے تو چینی ڈال دیجئے۔	Y	دیجئے	2696	      398	0.0016	971	urd_news_2016_00550981
24749	اور ایک گھنٹہ تک پڑا رہنے دیجئے۔	Y	دیجئے	2696	      398	0.0016	1099.2857	urd_news_2016_00274204
24750	ایک جوش آجائے تو چاول ڈال دیجئے۔	Y	دیجئے	2696	      398	0.0016	1496.5714	urd_news_2016_00130350
24751	ان کے حالیہ بیان سے معلوم ہوتا ہے کہ وہ ایک عدد دل بھی رکھتے ہیں۔	Y	عدد	2696	      398	0.0016	477.625	urd_news_2016_00185745
24752	آفریدی کا عدد سات کے ساتھ تعلق ہے جبکہ ورلڈ کپ کا تعلق عدد 8 سے ہے۔	Y	عدد	2696	      398	0.0016	579.5833	urd_news_2016_00121988
24753	دو عدد مو ٹر سائیکل قبضہ پولیس میں لیے گئے ۔	Y	عدد	2696	      398	0.0016	983.5	urd_news_2016_00557785
24754	ہر ٹماٹر کے چار عدد ٹکڑے کر لیں۔	Y	عدد	2696	      398	0.0016	1098.25	urd_news_2016_00592410
24755	پیاز دو عدد باریک کاٹ لیں اور آلو بھی چھوٹے چھوٹے ٹکڑے کاٹ لیں۔	Y	عدد	2696	      398	0.0016	1485.6364	urd_news_2016_00339775
24756	ان میں دو چار کے علاوہ سب نے کہا کہ میچ فکسنگ ہوتی ہے۔	Y	فکسنگ	2696	      398	0.0016	322.5	urd_news_2016_00188920
24757	انہوں نے امید ظاہر کی کہ ٹینس افسر اس بات کا یقین کرے گا کہ جدید ٹینس میں بھی میچ فکسنگ نہیں ہو.	Y	فکسنگ	2696	      398	0.0016	466.8571	urd_news_2016_00194557
24758	فکسنگ کے الزامات پر تشویش ہے،پی سی بی ۔	Y	فکسنگ	2696	      398	0.0016	615.2222	urd_news_2016_00733119
24759	فکسنگ کیس ‘سلمان بٹ کی آئی سی سی اینٹی کرپشن حکام سے جلد ملاقات متوقع ۔	Y	فکسنگ	2696	      398	0.0016	702.2857	urd_news_2016_00733117
24760	اظہر الدین 2000 میں میچ فکسنگ کے معاملے میں پھنسے تھے.	Y	فکسنگ	2696	      398	0.0016	1010.2222	urd_news_2016_00117316
24761	بلوچستان حکومت کا آئینی اختیار کھو چکی، سپریم کورٹ کا تفصیلی فیصلہ جا ری اُردو پوائنٹ دنیاکی سب سے بڑی اُردو ویب سائیٹ ہے، جو پچھلے 15سال سے اُردو کی خدمت میں مصروف ہے۔	Y	کھو	2696	      398	0.0016	331.9655	urd_news_2016_00330850
24762	کمزور قیادت کی وجہ سے ایف پی سی سی آئی اپنا مقام کھو چکی ہے ۔	Y	کھو	2696	      398	0.0016	513.1429	urd_news_2016_00785452
24763	اگر عوام دشمنی کا یہی حال رہا تو (ن) لیگ بھی پیپلز پارٹی کی طرح عوام کے اندر اپنا سیاسی وجود کھو بیٹھے گی‘ یاسر گیلانی ، وزیراعظم کو طالبان سے مذاکرات کیلئے فوری اور ہنگامی بنیادوں پر اقدامات اٹھانا چاہئیں‘ صدر تحریک انصاف لاہور ۔	Y	کھو	2696	      398	0.0016	614.7907	urd_news_2016_00140108
24764	مولانا عبدالعزیز کا خاندان پہلے ہی اس نظام سے مایوس ہوکر ان عدالتوں سے انصاف کی امید کھو چکا ہے۔	Y	کھو	2696	      398	0.0016	735.3684	urd_news_2016_00916978
24765	رو ز روز کا آنا قدر کھو دیتا ہے ۔	Y	کھو	2696	      398	0.0016	1291.3333	urd_news_2016_00602373
24766	لاہور: وزیر اعلیٰ پنجاب محمد شہباز شریف کی زیر صدارت کابینہ کمیٹی برائے امن و امان کے اجلاس میں لاہور اور فیصل آباد میں فائرنگ کے واقعات میں شہید پولیس اہلکاروں کے ایصال ثواب کے لیے دعا کی جا رہی ہے۔	Y	ایصال	2697	      397	0.0016	438.1471	urd_news_2016_00822377
24767	تقریب میں ملک بھر میں دہشتگردی میں شہید ہونے والوں کی روح کے ایصال ثواب کے لئے فاتحہ خوانی بھی کی گئی۔	Y	ایصال	2697	      397	0.0016	757.7222	urd_news_2016_00434615
24768	لاہور: تحریک انصاف کے مرکزی رہنما جمشید اقبال چیمہ حلقہ این اے 124کے مرکزی دفتر میں سماجی شخصیت عبدالستار ایدھی کے ایصال ثواب کے لیے دعا کر رہے ہیں۔	Y	ایصال	2697	      397	0.0016	865.28	urd_news_2016_00817089
24769	پیپلز پارٹی لاہور کے زیر اہتمام ڈیفنس میں سانحہ کے شہداء کی روح کے ایصال ثواب کے لئے قرآن خوانی اور فاتحہ خوانی کی گئی ۔	Y	ایصال	2697	      397	0.0016	940.45	urd_news_2016_00368100
24770	سپیکر کے کہنے پر صاحبزادہ طارق اللہ نے ایصال ثواب کے لئے فاتحہ خوانی کرائی۔	Y	ایصال	2697	      397	0.0016	1191.8571	urd_news_2016_00623779
24771	ان کا کہنا تھا کہ آئی سی سی کو 2013 میں بذریعہ خط کھلاڑیوں کی کرپشن کے حوالے سے تمام تفصیلات سے آگاہ کردیا تھا لیکن اس کے باوجود کوئی ایکشن نہیں لیا گیا۔	Y	بذریعہ	2697	      397	0.0016	280	urd_news_2016_00179673
24772	لیکن امریکہ میں اسے ڈالر کی قیمت میں بذریعہ کنٹریکٹ حاصل کیا جا سکتا ہے۔	Y	بذریعہ	2697	      397	0.0016	530.3571	urd_news_2016_00826399
24773	اسلام آباد : خراب موسم کے باعث عمران خان بنوں نہیں جا سکے، ریحام خان بذریعہ کار روانہ، سیکرٹری اطلاعات پی ٹی آئی نعیم الحق ۔	Y	بذریعہ	2697	      397	0.0016	631.6522	urd_news_2016_00090201
24774	عوام اپنی شکایات بذریعہ ٹیلی فون بھی درج کروا سکتے ہیں۔	Y	بذریعہ	2697	      397	0.0016	756	urd_news_2016_00716584
24775	احتجاجی اجتماع سے ڈاکٹر طاہر القادری لندن سے بذریعہ ویڈیو لنک براہ راست خطاب کرینگے۔	Y	بذریعہ	2697	      397	0.0016	1113.6429	urd_news_2016_00032021
24776	تاجر برادری نے اس بات کا اظہار یہاں ہونے والے ایک اجلاس میں تقاریر کرتے ہوئے کیا۔	Y	تقاریر	2697	      397	0.0016	358.4118	urd_news_2016_00404924
24777	لاہور ہائیکورٹ نے وزیر اعظم نواز شریف کے خلاف نفرت انگیز تقاریر کرنے پر تحریک انصاف کے سربراہ عمران خان کو قومی اسمبلی کی رکنیت کے حلف کا پابند کرانے کی درخواست کے قابل سماعت ہونے پر فیصلہ محفوظ کر لیا ۔	Y	تقاریر	2697	      397	0.0016	508.6389	urd_news_2016_00816022
24778	عمران خان کو اشتعال انگیز تقاریر سے روکنے کی درخواست پر وفاق اور وزارت قانون سے جواب طلب ۔	Y	تقاریر	2697	      397	0.0016	607.1765	urd_news_2016_00712995
24779	دریں اثناء ڈی جی رینجرز سندھ میجر جنرل بلال اکبر نے کہا ہے کہ جن افراد کو نائن زیرو سے پکڑا گیا، وہ کراچی کے امن کے خلاف نفرت انگیز تقاریر کا انتظام اور سہولت کار کا کردار ادا کر رہے تھے۔	Y	تقاریر	2697	      397	0.0016	747.05	urd_news_2016_00541280
24780	نظریہ پاکستان قومی سلامتی اور خود مختاری کیخلاف تقاریر جرم تصور ہونگی۔	Y	تقاریر	2697	      397	0.0016	1249.25	urd_news_2016_00930023
24781	عمران خان نے کہا کہ پارٹی الیکشن بہت عزیز ہیں مگر وقت کا تقاضا کچھ اور ہے۔	Y	تقاضا	2697	      397	0.0016	291.2353	urd_news_2016_00714418
24782	اس کے باوجود حالات کا تقاضا ہے کہ اس مسئلے پر ایوان میں بات ہو۔	Y	تقاضا	2697	      397	0.0016	430.9286	urd_news_2016_00082704
24783	ہم نے قانونی تقاضا پورا کر دیا گیا۔	Y	تقاضا	2697	      397	0.0016	530.125	urd_news_2016_00908369
24784	یہ ہمارے ایمان اور ملک کی سلامتی کا تقاضا ہے۔	Y	تقاضا	2697	      397	0.0016	651.1	urd_news_2016_00836483
24785	جبکہ ترجیحی بنیادوں پر کمیونٹی سطح کے قرضہ جات کی فراہمی وقت کا تقاضا ہے۔	Y	تقاضا	2697	      397	0.0016	878	urd_news_2016_00454958
24786	یہ مشقیں انسداد دہشتگردی کے حوالے سے کی جا رہی ہیں۔	Y	مشقیں	2697	      397	0.0016	383.5455	urd_news_2016_00876143
24787	ان کا خیال ہے کہ مشقیں ملک کی تقریباً تمام وفاقی ریاستوں میں کی جائیں گی۔	Y	مشقیں	2697	      397	0.0016	528.9333	urd_news_2016_00178562
