ORDER	SENTENCE	STATUS	WORD	RANK	COUNT	COUNT_REL	INDEX	ID
7691	اجلاس کے بعد گفتگو کرتے ہوئے عمران خان نے کہا کہ پاناما لیکس کے حوالے سے ایک مہم شروع کر رہے ہیں۔	Y	پاناما	1397	    2,118	0.0084	184.5714	urd_news_2016_00025630
7692	پاناما لیکس میں جن 8عالمی رہنماؤں کے نام آئے ہیں ان میں نواز شریف کا نام بھی شامل ہے ۔	Y	پاناما	1397	    2,118	0.0084	292.5294	urd_news_2016_00362812
7693	انہوں نے پاناما لیکس کی تحقیقات کا بھی مطالبہ کیا ۔	Y	پاناما	1397	    2,118	0.0084	336.2	urd_news_2016_00199865
7694	انہوں نے بتایا کہ اسحاق ڈار سے ملاقات میں پاناما لیکس معاملے پر بھی نیا قانون بنانے پر اتفاق ہوا ہے۔	Y	پاناما	1397	    2,118	0.0084	395.45	urd_news_2016_00196359
7695	پاناما لیکس کا مسئلہ جلد از جلد حل کیا جائے۔	Y	پاناما	1397	    2,118	0.0084	494.3333	urd_news_2016_00362725
7696	پشاور : ن لیگ انتخابات میں واپڈا کو استعمال کر رہی ہے، پی ٹی آئی کا الزام ۔	Y	واپڈا	1398	    2,115	0.0084	213.8125	urd_news_2016_00384935
7697	انہوں نے کہاکہ آج جس بحران کا ملک کو سامنا ہے اس کے ذمہ دار واپڈا اور دوسرے متعلقہ ادارے ہیں۔	Y	واپڈا	1398	    2,115	0.0084	276.0952	urd_news_2016_00208505
7698	انھوں نے کہا کہ واپڈا وفاق کی ذمہ داری ہے ہماری نہیں وفاقی حکومت کو چاہئے کہ واپڈا کے معاملات کو درست کرے ۔	Y	واپڈا	1398	    2,115	0.0084	362.5	urd_news_2016_00260547
7699	اس موقع پر واپڈا کے وکیل شاہد حامد نے کہا کہ حکومت وقت معاشی امور طے کرتی ہے۔	Y	واپڈا	1398	    2,115	0.0084	417.3333	urd_news_2016_00108773
7700	دوسرا میچ واپڈا اور پی ٹی وی کی ٹیموں کے مابین ہوا۔	Y	واپڈا	1398	    2,115	0.0084	507	urd_news_2016_00552795
7701	اسلام آباد میں دو تین نئے بڑے ہسپتالوں کی ضرورت ہے۔	Y	ہسپتالوں	1399	    2,113	0.0084	273	urd_news_2016_00092488
7702	تعلیمی اداروں، ہسپتالوں اور دیگر سرکاری اداروں کی تعمیر کے حوالے سے کوئی منصوبہ بندی نہیں ہے۔	Y	ہسپتالوں	1399	    2,113	0.0084	313.875	urd_news_2016_00424205
7703	انہوں نے کہا کہ ضلعی انتظامیہ کی ٹیمیں زخمیوں کو سہولیات فراہم کرنے کے لئے ہر وقت ہسپتالوں میں موجود ہیں۔	Y	ہسپتالوں	1399	    2,113	0.0084	343.9524	urd_news_2016_00242080
7704	زخمیوں کو طبی امداد کے لئے ہسپتالوں میں منتقل کر دیا گیا ہے۔	Y	ہسپتالوں	1399	    2,113	0.0084	407.0769	urd_news_2016_00605385
7705	یہی حال ضلع بھر کے تباہ شدہ ہسپتالوں، سرکاری دفاتر اور سڑکوں کا ہے۔	Y	ہسپتالوں	1399	    2,113	0.0084	608.8571	urd_news_2016_00507867
7706	اس پر اے جی نے کہا کہ وہ ابھی بیان دینے کی پوزیشن میں نہیں ہے ۔	Y	پوزیشن	1400	    2,111	0.0084	184.375	urd_news_2016_00057358
7707	تحریک انصاف اور پیپلز پارٹی میں دوسری پوزیشن پر مقابلہ ہو رہا ہے۔	Y	پوزیشن	1400	    2,111	0.0084	276.6154	urd_news_2016_00412079
7708	انہوں نے ملکی سیاست میں اپنی پوزیشن بنا لی ہے ۔	Y	پوزیشن	1400	    2,111	0.0084	309.2	urd_news_2016_00268572
7709	انہوں نے سول سروس میں اہم پوزیشن کے باوجود استعفیٰ دے دیا تھا۔	Y	پوزیشن	1400	    2,111	0.0084	417.3846	urd_news_2016_00203881
7710	سوات میں مختلف مقامات پر فورسز نے پوزیشن مستحکم کرلی۔	Y	پوزیشن	1400	    2,111	0.0084	564.7	urd_news_2016_00657636
7711	مارے گئے طالبان کی اس تعداد کو جنوری کے بعد سے سب سے بڑی تعداد کہا جا رہا ہے۔	Y	مارے	1400	    2,111	0.0084	201.1765	urd_news_2016_00837345
7712	دوسری جانب اقوام متحدہ کا کہنا ہے کہ رواں سال کے دوران چھ ہزار سے زائد افراد مارے گئے۔	Y	مارے	1400	    2,111	0.0084	278.3158	urd_news_2016_00553230
7713	گزشتہ برس دسمبر میں بھی اسی علاقے میں رینجرز کی ایک گاڑی پر فائرنگ کی گئی تھی اور اس واقعے میں بھی متعدد اہلکار مارے گئے تھے۔	Y	مارے	1400	    2,111	0.0084	348.1304	urd_news_2016_00801148
7714	کئی مبینہ دہشت گرد مارے گئے ہیں اور کئی مشتبہ افراد گرفتار ہوئے۔	Y	مارے	1400	    2,111	0.0084	395.6667	urd_news_2016_00795557
7715	جبکہ مارے گئے شدت پسندوں کا تعلق کالعدم تنظیم سے تھا۔	Y	مارے	1400	    2,111	0.0084	510.0909	urd_news_2016_00457377
7716	ایک اغواء کار گرفتار اُردو پوائنٹ دنیاکی سب سے بڑی اُردو ویب سائیٹ ہے، جو پچھلے 15سال سے اُردو کی خدمت میں مصروف ہے۔	Y	اغواء	1401	    2,108	0.0084	135.6	urd_news_2016_00126895
7717	لاہور ہائیکورٹ نے لڑکی کے اغواء کے مقدمے میں ملزم کی درخواست ضمانت مسترد کر دی اُردو پوائنٹ دنیاکی سب سے بڑی اُردو ویب سائیٹ ہے، جو پچھلے 15سال سے اُردو کی خدمت میں مصروف ہے۔	Y	اغواء	1401	    2,108	0.0084	265.3793	urd_news_2016_00815909
7718	سرچ آپریشن کے دوران ایف سی نے 4اغواء کاروں کو بھی گرفتار کیا۔	Y	اغواء	1401	    2,108	0.0084	316.8462	urd_news_2016_00629529
7719	واضح رہے کہ پاکستانی سفیر کو 11فروری کو خیبر ایجنسی سے اغواء کیا گیا تھا ۔	Y	اغواء	1401	    2,108	0.0084	352.2143	urd_news_2016_00944755
7720	سندھ کے ایڈووکیٹ جنرل نے کہاکہ نوازشریف کے خلاف طیارہ اغواء کیس درست ہے۔	Y	اغواء	1401	    2,108	0.0084	492.3077	urd_news_2016_00654526
7721	عدالت کے فیصلے بعد میڈیا سے بات کرتے ہوئے تحریک انصاف کے وکیل احمد اویس نے کہا کہ عدالت نے تحریک انصاف کے آزادی مارچ کو غیر آئینی قرار نہیں دیا ۔	Y	اویس	1402	    2,103	0.0083	257.84	urd_news_2016_00699674
7722	اویس شاہ کے اغوا کی تحقیقات سے متعلق میڈیا کو تفصیلات دی جائیں گی ۔	Y	اویس	1402	    2,103	0.0083	304.9286	urd_news_2016_00279066
7723	پاکستان رینجرز سندھ کا اویس علی شاہ کے اغواء کے سلسلے میں کراچی کے مختلف علاقوں میں سرچ آپریشن ۔	Y	اویس	1402	    2,103	0.0083	361.9375	urd_news_2016_00348521
7724	سندھ کے صوبائی وزراء اویس علی شاہ کی بازیابی پر چیف جسٹس سندھ ہائی کورٹ کو مبارکباد چیف جسٹس سندھ ہائیکورٹ کے بیٹے کی بازیابی کیسے ہوئی؟	Y	اویس	1402	    2,103	0.0083	449.25	urd_news_2016_00654647
7725	اویس شاہ کی بازیابی پر پتہ چل گیا کہ کس نے اغواء کیا تھا۔	Y	اویس	1402	    2,103	0.0083	539.3571	urd_news_2016_00279058
7726	ترجمان ایدھی سنٹر اُردو پوائنٹ دنیاکی سب سے بڑی اُردو ویب سائیٹ ہے، جو پچھلے 15سال سے اُردو کی خدمت میں مصروف ہے۔	Y	ایدھی	1403	    2,102	0.0083	235	urd_news_2016_00416859
7727	بلقیس ایدھی اُردو پوائنٹ دنیاکی سب سے بڑی اُردو ویب سائیٹ ہے، جو پچھلے 15سال سے اُردو کی خدمت میں مصروف ہے۔	Y	ایدھی	1403	    2,102	0.0083	292.8889	urd_news_2016_00329815
7728	عبدالستار ایدھی اللہ کو پیارے ہو گئے اُردو پوائنٹ دنیاکی سب سے بڑی اُردو ویب سائیٹ ہے، جو پچھلے 15سال سے اُردو کی خدمت میں مصروف ہے۔	Y	ایدھی	1403	    2,102	0.0083	332.2609	urd_news_2016_00697161
7729	ایدھی نے جو کام کیے وہ ریاست کی ذمہ داری ہے ۔	Y	ایدھی	1403	    2,102	0.0083	333.1818	urd_news_2016_00040596
7730	ایدھی صاحب کا ہزاروں افراد نے آخری دیدارکیا اُردو پوائنٹ دنیاکی سب سے بڑی اُردو ویب سائیٹ ہے، جو پچھلے 15سال سے اُردو کی خدمت میں مصروف ہے۔	Y	ایدھی	1403	    2,102	0.0083	347.6667	urd_news_2016_00040422
7731	امکان ہے کہ ایک دو روز میں صوبائی حکومت کی طرف سے گندم کی فروخت کی پالیسی کا اعلان کر دیا جائے گا۔	Y	گندم	1403	    2,102	0.0083	209.619	urd_news_2016_00159161
7732	وزیراعلیٰ سندھ کا کہنا تھا کہ سندھ میں گندم کا بحران ختم ہو چکا ہے ۔	Y	گندم	1403	    2,102	0.0083	304.9231	urd_news_2016_00975079
7733	اگر وفاقی حکومت گندم درآمد نہ کرتی تو ہمارے لیے یہ مسئلہ پیدا نہ ہوتا ۔	Y	گندم	1403	    2,102	0.0083	378.1429	urd_news_2016_00141630
7734	انہوں نے کہا کہ صوبے میں گندم کی بہترین پیداوار کیلئے محکمہ زراعت تمام تر سہولیات فراہم کرے گا۔	Y	گندم	1403	    2,102	0.0083	396	urd_news_2016_00241957
7735	رواں سال 46 لاکھ ٹن گندم کا ہدف مقرر کیا گیا ۔	Y	گندم	1403	    2,102	0.0083	592.6	urd_news_2016_00600574
7736	انہیں ڈی این اے ٹیسٹ کے بعد اس کے والدین کے حوالے کر دیا جائے گا ۔	Y	والدین	1404	    2,101	0.0083	201.0714	urd_news_2016_00190151
7737	شادی کے پانچ روز بعد آزاد کشمیر کے پولیس نے اسے گرفتار کر کے والدین کے حوالے کر دیا۔	Y	والدین	1404	    2,101	0.0083	253	urd_news_2016_00661829
7738	انہوں نے کہا کہ یہ ہماری ذمہ داری تھی کہ دورے کے اعلان سے قبل ہم اپنے کمیشن کے ذریعے کھلاڑیوں، ان کے والدین اور حکومت کو کھلاڑیوں کی حفاظت بنائیں۔	Y	والدین	1404	    2,101	0.0083	312.5185	urd_news_2016_00250439
7739	کراچی: سکول فیس میں اضافے کی وجہ سے والدین نے احتجاج شروع کردیا۔	Y	والدین	1404	    2,101	0.0083	375.6154	urd_news_2016_00766277
7740	اساتذہ ، والدین بچوں کی کردار سازی پر خصوصی توجہ دیں ۔	Y	والدین	1404	    2,101	0.0083	552.7	urd_news_2016_00052890
7741	آصف علی زرداری کا کراچی کے واقعات پر شدید تشویش کا اظہار اُردو پوائنٹ دنیاکی سب سے بڑی اُردو ویب سائیٹ ہے، جو پچھلے 15سال سے اُردو کی خدمت میں مصروف ہے۔	Y	تشویش	1405	    2,096	0.0083	169.4074	urd_news_2016_00115837
7742	اے این پی کے سربراہ نے کراچی میں امن و امان کے حوالے سے بھی اپنی تشویش سے آگاہ کیا۔	Y	تشویش	1405	    2,096	0.0083	262.5	urd_news_2016_00293545
7743	سابق صدر نے کہا کہ میرے خلاف الزامات سے پوری فوج کو تشویش ہے۔	Y	تشویش	1405	    2,096	0.0083	307.3571	urd_news_2016_00609676
7744	اجلاس میں اویس شاہ کی عدم بازیابی پر تشویش کا اظہار کیا گیا۔	Y	تشویش	1405	    2,096	0.0083	399.6923	urd_news_2016_00026849
7745	ٹیلی کام کمپنیوں کی کارکردگی پر سینیٹ کمیٹی کا اظہار تشویش ۔	Y	تشویش	1405	    2,096	0.0083	454.2727	urd_news_2016_00444043
7746	انہوں نے کہا کہ اشیاء کی قیمتوں میں کمی کے لئے بھی اقدامات کئے جارہے ہیں۔	Y	اشیاء	1406	    2,092	0.0083	261.5	urd_news_2016_00212159
7747	انہوں نے کہا کہ جدید ٹیکنالوجی کے استعمال سے اشیاء کا معیار عالمی معیار کے مطابق بنایا جا سکتا ہے۔	Y	اشیاء	1406	    2,092	0.0083	327.1667	urd_news_2016_00229245
7748	جس کی وجہ سے چینی سے بننے والی اشیاء کی قیمتوں میں بھی اضافہ ہوگیا ہے ۔	Y	اشیاء	1406	    2,092	0.0083	351.8571	urd_news_2016_00466299
7749	اس سے ممبران پوسٹ کرنے کی طرح ہی اپنی اشیاء فروخت بھی کر سکیں گے۔	Y	اشیاء	1406	    2,092	0.0083	407.5333	urd_news_2016_00074188
7750	ابھی کالج کے لئے کئی اشیاء کی سخت ضرورت ہے۔	Y	اشیاء	1406	    2,092	0.0083	441.1	urd_news_2016_00009434
7751	مسلم لیگ(ن) کے صدر اور وزیراعلیٰ پنجاب میاں شہباز شریف وزیراعظم سے ملاقات کیلئے آج اسلام آباد پہنچے ہیں۔	Y	پہنچے	1407	    2,091	0.0083	204.7	urd_news_2016_00872869
7752	اگر حکومت نے دہشت گردی کے خلاف ایکشن نہیں لیا تو حکمرانوں کے اقتدار اور ملک کو نقصان پہنچے گا۔	Y	پہنچے	1407	    2,091	0.0083	273.2632	urd_news_2016_00139490
7753	واضح رہے کہ امریکی وزیر دفاع بھارت کے دورے کے بعد پاکستان پہنچے ہیں۔	Y	پہنچے	1407	    2,091	0.0083	304	urd_news_2016_00944326
7754	یہ جنگ ہے لیکن ہماری کوشش ہے کہ یہ جنگ جلد اپنے اختتام کو پہنچے ۔	Y	پہنچے	1407	    2,091	0.0083	379.6667	urd_news_2016_00481449
7755	ہفتہ کو چیف الیکشن کمشنر سردار رضا خان انتخابی عمل کا جائزہ لینے پہنچے ہیں۔	Y	پہنچے	1407	    2,091	0.0083	462.8667	urd_news_2016_00726637
7756	اس میں 100 ارب روپے سالانہ گیس استعمال کرنے والوں سے وصول کئے جائیں گے۔	Y	وصول	1407	    2,091	0.0083	303.6429	urd_news_2016_00098913
7757	پی ٹی سی ایل کے ذمہ وفاق کے 800 ملین ڈالر ہیں اب تک وصول کیوں نہیں کئے گئے ۔	Y	وصول	1407	    2,091	0.0083	333.1176	urd_news_2016_00370883
7758	کراچی: اغوا کے بعد رقم وصول کرنے کے الزام میں تین پولیس اہلکار گرفتار ۔	Y	وصول	1407	    2,091	0.0083	377.4615	urd_news_2016_00762363
7759	یہ ٹیکس درآمد اور برآمد ہونے والے سامان پر وصول کیا جاتا ہے ۔	Y	وصول	1407	    2,091	0.0083	400.6154	urd_news_2016_00443570
7760	امدادی چیک وصول کئے بغیر متاثرین واپس اپنے علاقوں کو لوٹ گئے۔	Y	وصول	1407	    2,091	0.0083	597.8333	urd_news_2016_00152734
7761	انہوں نے یہ بات کمیٹی کے اجلاس سے خطاب کرتے ہوئے کہی۔	Y	کہی	1408	    2,088	0.0083	171.1667	urd_news_2016_00195754
7762	یہ بات انہوں نے ایک نجی ٹی وی سے گفتگو کرتے ہوئے کہی ۔	Y	کہی	1408	    2,088	0.0083	225.6923	urd_news_2016_00295097
7763	یہ بات انہوں نے لاہور میں صحافیوں سے گفتگو میں کہی۔	Y	کہی	1408	    2,088	0.0083	276.5	urd_news_2016_00295608
7764	یہ بات انہوں نے پاکستان کے دورے پر آئے ہوئے سری لنکا کے وزیر خارجہ سے ملاقات کے دوران کہی۔	Y	کہی	1408	    2,088	0.0083	322.1111	urd_news_2016_00295204
7765	یہ بات انھوں نے ہفتہ وار پریس بریفنگ کے دوران کہی۔	Y	کہی	1408	    2,088	0.0083	532.7273	urd_news_2016_00295466
7766	انہوں نے یہ بھی بتایا کہ ایم پی پی ایس سی نے اپنی ویب سائٹ کو نئے انداز میں پیش کیا ہے۔	Y	سائٹ	1409	    2,086	0.0083	167.6	urd_news_2016_00196021
7767	کل صحافیوں نے یونین کے دفتر کے اندر دھرنا دیا تھا اور ان میں سے دو کو جو اپوزیشن کی ویب سائٹ کے لیے کام کرتے ہیں، گرفتار کیا گیا تھا۔	Y	سائٹ	1409	    2,086	0.0083	264.9643	urd_news_2016_00780900
7768	اس کے علاوہ کمیشن نے ایس ای سی پی کی اردو زبان میں سرکاری ویب سائٹ بنانے کے بھی منظوری دی۔	Y	سائٹ	1409	    2,086	0.0083	296.65	urd_news_2016_00086514
7769	ان خیالات کا اظہار انہوں نے ہفتہ کو سائٹ ایسوسی ایشن کے مرکزی دفتر کے دورے کے دوران خطاب اور میڈیا سے بات چیت کرتے ہوئے کیا۔	Y	سائٹ	1409	    2,086	0.0083	312.48	urd_news_2016_00170202
7770	چیئرمین سینیٹ نے پورے ایوان کمیٹی کے اجلاس کی کارروائی ویب سائٹ پر اپ لوڈ نہ کرنے پر ڈائریکٹر آئی ٹی کو معطل کردیا ۔	Y	سائٹ	1409	    2,086	0.0083	374.8261	urd_news_2016_00504337
7771	بلاول بھٹو نے سیاسی معاملات پر بڑے اقدامات اٹھانے کا فیصلہ کر لیا ہے جن کی سی ای سی کے اجلاس میں منظوری لی جائے گی۔	Y	اٹھانے	1410	    2,085	0.0083	259.56	urd_news_2016_00328513
7772	ان خیالات کا اظہار انہوں نے گورنر ہاؤس لاہور میں گورنر پنجاب کے عہدے کا حلف اٹھانے کے بعد میڈیا سے گفتگو کرتے ہوئے کیا۔	Y	اٹھانے	1410	    2,085	0.0083	305.6364	urd_news_2016_00171017
7773	ڈی سی نے حکام کو عملی اقدامات اٹھانے کی ہدایت کردی۔	Y	اٹھانے	1410	    2,085	0.0083	332.3636	urd_news_2016_00572064
7774	عمران خان نے ڈرون متاثرین کا معاملہ قومی اسمبلی میں اٹھانے کا فیصلہ کرلیا ۔	Y	اٹھانے	1410	    2,085	0.0083	394.6923	urd_news_2016_00714199
7775	دونوں ممالک کے رہنماؤں کو باہمی تجارت میں اضافہ کیلئے اقدامات اٹھانے ہونگے ۔	Y	اٹھانے	1410	    2,085	0.0083	500.8462	urd_news_2016_00560177
7776	آغاز ذوالفقار خان اُردو پوائنٹ دنیاکی سب سے بڑی اُردو ویب سائیٹ ہے، جو پچھلے 15سال سے اُردو کی خدمت میں مصروف ہے۔	Y	ذوالفقار	1410	    2,085	0.0083	144.0526	urd_news_2016_00119372
7777	ذوالفقار عباسی اُردو پوائنٹ دنیاکی سب سے بڑی اُردو ویب سائیٹ ہے، جو پچھلے 15سال سے اُردو کی خدمت میں مصروف ہے۔	Y	ذوالفقار	1410	    2,085	0.0083	200.3333	urd_news_2016_00583359
7778	جس طرح ذوالفقار علی بھٹو شہید نے 1974ء میں اسلامی سربراہی کانفرنس لاہور میں منعقد کی تھی آج بھی اسلامی سربراہی کانفرنس منعقد کرنے کی ضرورت ہے ۔	Y	ذوالفقار	1410	    2,085	0.0083	290.9524	urd_news_2016_00465240
7779	یہ اسپتال شہید ذوالفقار علی بھٹو کے دور میں تعمیر کیا گیا تھا۔	Y	ذوالفقار	1410	    2,085	0.0083	352.5385	urd_news_2016_00057009
7780	ذوالفقار آباد منصوبہ کسی بھی صورت میں قبول نہیں کرینگے ۔	Y	ذوالفقار	1410	    2,085	0.0083	423.1	urd_news_2016_00583310
7781	بورڈ حکام جاوید ہاشمی نواز شریف سے ملاقات کے لئے دبئی روانہ ہو گئے اُردو پوائنٹ دنیاکی سب سے بڑی اُردو ویب سائیٹ ہے، جو پچھلے 15سال سے اُردو کی خدمت میں مصروف ہے۔	Y	ہاشمی	1411	    2,084	0.0083	203.4828	urd_news_2016_00335728
7782	جاوید ہاشمی سمیت تمام سیاسی کارکنوں کو رہا کیا جائے، قومی معاملات میں اپوزیشن حکومت کے ساتھ تعاون کرے ۔	Y	ہاشمی	1411	    2,084	0.0083	294.8421	urd_news_2016_00450505
7783	ملتان میں ضمنی انتخاب کے حلقہ این اے 149 میں پاکستان مسلم لیگ نواز نے جاوید ہاشمی کی حمایت کا اعلان کر دیا ہے ۔	Y	ہاشمی	1411	    2,084	0.0083	350.0909	urd_news_2016_00893580
7784	جمعہ کو میڈیا سیل کی طرف سے جاری بیان میں پیر اعجاز ہاشمی نے کہا کہ پاکستان کو بھارتی جارحیت کا مسلسل سامنا ہے۔	Y	ہاشمی	1411	    2,084	0.0083	406.2609	urd_news_2016_00477212
7785	بالی ووڈ اداکار عمران ہاشمی حادثے میں بال بال بچے۔	Y	ہاشمی	1411	    2,084	0.0083	877.5556	urd_news_2016_00307280
7786	اس سوال پر کہ کیا صوبائی اسمبلی کے اجلاس کے لئے گورنر سندھ سے رابطہ کریں گے تو انہوں نے کہا کہ مرکز میں قومی اسمبلی کے اجلاس کے بعد اس کی ضرورت پیش آئی تو دیکھا جائے گا۔	Y	مرکز	1412	    2,083	0.0083	188.4839	urd_news_2016_00071554
7787	کراچی میں کے ای ایس سی کی کارکردگی پر تنقید کرتے ہوئے انہوں نے کہا کہ” کراچی پاکستان کا سب سے بڑا معاشی مرکز ہے ۔	Y	مرکز	1412	    2,083	0.0083	235.2083	urd_news_2016_00771897
7788	رواں سال ستمبر میں پارٹی کی تنظیم سازی کا کام مکمل ہو جائے گا جب کہ صوبوں اور مرکز کے انتخابات ستمبر میں ہو ں گے۔	Y	مرکز	1412	    2,083	0.0083	319.1304	urd_news_2016_00600757
7789	انہوں نے کہا ہ کارکن پیپلز پارٹی کا سرمایہ ہیں آئندہ الیکشن میں مرکز اور پنجاب سمیت تمام صوبوں میں پیپلز پارٹی کی حکومت بنے گی۔	Y	مرکز	1412	    2,083	0.0083	362.5652	urd_news_2016_00209457
7790	ملک کا معاشی دارالحکومت ایک بار پھر سے سماجی سرگرمیوں کا مرکز بن چکا ہے۔	Y	مرکز	1412	    2,083	0.0083	564.7857	urd_news_2016_00898003
7791	انہوں نے کہا کہ اسمبلی کا اجلاس آج سے شروع ہو رہا ہے جو کہ 26یا 27مئی تک جا ری رہے گا۔	Y	ری	1413	    2,082	0.0083	156.3333	urd_news_2016_00211380
7792	ان کا کہنا تھا کہ جے یو آئی کے پیپلز پارٹی سے بھی مذاکرات جا ری ہیں۔	Y	ری	1413	    2,082	0.0083	260.8235	urd_news_2016_00180450
7793	راولپنڈی : چیک ری پبلک کے نائب وزیر دفاع کی آرمی چیف جنرل راحیل شریف سے ملاقات اُردو پوائنٹ دنیاکی سب سے بڑی اُردو ویب سائیٹ ہے، جو پچھلے 15سال سے اُردو کی خدمت میں مصروف ہے۔	Y	ری	1413	    2,082	0.0083	280.2	urd_news_2016_00588258
7794	انہوں نے کہا کہ دنیا میں پانی ری سائیکل کر کے دوبارہ استعمال کیا جاتا ہے۔	Y	ری	1413	    2,082	0.0083	287.625	urd_news_2016_00235682
7795	الیکشن کمیشن نے خیبرپختونخوا کے 352پولنگ اسٹیشنز پر ری پولنگ میں توسیع کر دی، بلدیاتی انتخابات 5جولائی کے بجائے 30جولائی کو ہوں گے اُردو پوائنٹ دنیاکی سب سے بڑی اُردو ویب سائیٹ ہے، جو پچھلے 15سال سے اُردو کی خدمت میں مصروف ہے۔	Y	ری	1413	    2,082	0.0083	302.7143	urd_news_2016_00148893
7796	وزارت داخلہ نے کہا ہے کہ لاپتہ افراد میں سے کسی کے بارے میں کوئی اطلاع ہو تو وہ وزارت داخلہ کو دی جائے۔	Y	لاپتہ	1413	    2,082	0.0083	189.8095	urd_news_2016_00959941
7797	انہوں نے چیف جسٹس سندھ سے اپیل کی ہے کہ وہ ان کے لاپتہ بیٹے کی بازیابی کے لئے اپنا کردار ادا کرتے ہوئے انصاف فراہم کریں۔	Y	لاپتہ	1413	    2,082	0.0083	258.64	urd_news_2016_00201226
7798	وفاقی سیکرٹری داخلہ کی زیر صدارت بلوچستان کے لاپتہ افراد کی بازیابی کیلئے اہم اجلاس کل کوئٹہ میں ہوگا ۔	Y	لاپتہ	1413	    2,082	0.0083	315.6111	urd_news_2016_00987588
7799	لاپتہ افراد کی بازیابی کے حکم پر عملدرآمد کیوں نہیں کیا گیا۔	Y	لاپتہ	1413	    2,082	0.0083	400.4167	urd_news_2016_00810662
7800	افسر معطل کر کے تفتیش ہو تو لاپتہ افراد کا پتہ چل جائیگا، عدالت ۔	Y	لاپتہ	1413	    2,082	0.0083	560.1429	urd_news_2016_00122398
7801	پولیس کے مطابق ڈی آئی جی کے حکم پر کارروائی عمل میں لائی گئی ہے۔	Y	لائی	1414	    2,080	0.0082	192	urd_news_2016_00400406
7802	منگل کو وزیراعلیٰ نے ہدایت کی کہ واقعہ کے ملزم کو جلد گرفتار کر کے قانون کے تحت کارروائی عمل میں لائی جائے ۔	Y	لائی	1414	    2,080	0.0082	265.75	urd_news_2016_00906865
