ORDER	SENTENCE	STATUS	WORD	RANK	COUNT	COUNT_REL	INDEX	ID
7228	ملک میں امن کے قیام کے لئے وزیر اعظم کو انتہائی پر امید دیکھا ہے۔	Y	دیکھا	1320	    2,318	0.0092	275.2143	urd_news_2016_00899616
7229	حکومت کے پاس معاہدہ موجود ہے، میں نے خود دیکھا ہے، وفاقی وزیر کی صحافیوں سے گفتگو ۔	Y	دیکھا	1320	    2,318	0.0092	298.125	urd_news_2016_00520437
7230	ورلڈ کپ 2015ء سب سے زیادہ دیکھا جانے والا ٹورنامنٹ۔	Y	دیکھا	1320	    2,318	0.0092	493.8	urd_news_2016_00958004
7231	بنگلہ دیش کے خلاف سیریز کیلئے پروگرام کا اعلان کردیا گیا اُردو پوائنٹ دنیاکی سب سے بڑی اُردو ویب سائیٹ ہے، جو پچھلے 15سال سے اُردو کی خدمت میں مصروف ہے۔	Y	دیش	1321	    2,314	0.0092	189.4074	urd_news_2016_00334694
7232	دورہ بنگلہ دیش کے لئے قومی کرکٹ ٹیم کا اعلان آج کیے جانے کا اعلان ۔	Y	دیش	1321	    2,314	0.0092	332.4615	urd_news_2016_00551736
7233	بنگلہ دیش اے کرکٹ ٹیم رواں ماہ بھارت کا دورہ کرے گی ۔	Y	دیش	1321	    2,314	0.0092	388.75	urd_news_2016_00334433
7234	پاکستان اور بنگلہ دیش کے درمیان ٹیسٹ سیریز کا پہلا میچ 28اپریل سے شروع ہوگا ۔	Y	دیش	1321	    2,314	0.0092	434.0667	urd_news_2016_00344349
7235	بھارت ، بنگلہ دیش اور سری لنکا میں یہی سیاست ہو رہی ہے جو ہمارے معاشرے کا حصہ ہے۔	Y	دیش	1321	    2,314	0.0092	513.4706	urd_news_2016_00298431
7236	اور نہ ہی اس کے بعد یونیورسٹی میں ایسا کوئی اضافہ دیکھنے میں آیا ہے۔	Y	دیکھنے	1322	    2,312	0.0092	264.2143	urd_news_2016_00278138
7237	بچوں کا کہنا ہے کہ وہ اپنے کام سے دیکھنے والوں کو امن کا پیغام دینا چاہتے ہیں۔	Y	دیکھنے	1322	    2,312	0.0092	288.5294	urd_news_2016_00313693
7238	ان کا معاہدہ قابل توسیع ہو گا جس کا فیصلہ ان کی ایک برس کی کارکردگی دیکھنے کے بعد کیا جائے گا ۔	Y	دیکھنے	1322	    2,312	0.0092	345.2778	urd_news_2016_00183183
7239	پاکستانی ہائی کمشنر سمیت 4اہلکاروں کو پاک بھارت مقابلہ دیکھنے کی اجازت مل گئی ۔	Y	دیکھنے	1322	    2,312	0.0092	395.9286	urd_news_2016_00345137
7240	بھارت کی جانب سے جارحیت کا مظاہرہ جمعرات کی شام دیکھنے میں آیا۔	Y	دیکھنے	1322	    2,312	0.0092	470.75	urd_news_2016_00300916
7241	پاکستان اور بھارت اگر دو ملک بنے تو وہ بھی مذاکرات سے ہی بنے۔	Y	بنے	1323	    2,311	0.0092	187.3846	urd_news_2016_00344009
7242	وہ وقت دور نہیں جب کشمیر آزاد ہو کر پاکستان کا حصہ بنے گا ۔	Y	بنے	1323	    2,311	0.0092	222	urd_news_2016_00999761
7243	آئین نہیں ہے تو ملک نہیں ہے ۔ 1973 ء کے آئین سے پہلے دو آئین بنے تھے لیکن وہ دو دو سال بھی نہیں چل سکے ۔	Y	بنے	1323	    2,311	0.0092	251.8889	urd_news_2016_00292779
7244	تحریک انصاف کی تحریک کے باعث جوڈیشل کمیشن بھی بنے گا ۔	Y	بنے	1323	    2,311	0.0092	326.3	urd_news_2016_00412919
7245	پختونخوا کی کی موٹر وے کرپشن کے لئے نہیں بنے گے۔	Y	بنے	1323	    2,311	0.0092	495.6	urd_news_2016_00371756
7246	تاہم ایم کیو ایم اور جے یو آئی (ف) میں سے کوئی جماعت بھی تحریک واپس لینے کو تیار نہیں ہے.	Y	ف	1324	    2,309	0.0092	281.2	urd_news_2016_00407269
7247	وہ جمعہ کو کراچی میں الیکشن کمیشن کے کیمپ آفس میں پیپلز پارٹی، ، مسلم لیگ (ف) اور نیشنل پیپلز پارٹی کے رہنماؤں سے ملاقات میں گفتگو کررہے تھے۔	Y	ف	1324	    2,309	0.0092	337	urd_news_2016_00955185
7248	ان خیالات کا اظہار انہوں نے منگل کے روز جے یو آئی (ف) سربراہ مولانا فضل الرحمن سے ملاقات کے بعد مشترکہ پریس کانفرنس کرتے ہوئے کیا ۔	Y	ف	1324	    2,309	0.0092	362.3846	urd_news_2016_00171479
7249	ان خیالات کا اظہار انہوں نے جے یو آئی (ف) کے سربراہ مولانا فضل الرحمن کی صدارت میں تین روزہ اجلاس کے آغاز سے قبل بریفنگ دیتے ہوئے کیا ۔	Y	ف	1324	    2,309	0.0092	366.1786	urd_news_2016_00169641
7250	سوات آپریشن کے خلاف جے یو آئی( ف) کا سپریم کورٹ کے باہر احتجاجی مظاہرہ ۔	Y	ف	1324	    2,309	0.0092	482.1429	urd_news_2016_00656746
7251	وزیراعظم نواز شریف نے وفاقی کابینہ کا اجلاس پیر کے روز بلا لیا اُردو پوائنٹ دنیاکی سب سے بڑی اُردو ویب سائیٹ ہے، جو پچھلے 15سال سے اُردو کی خدمت میں مصروف ہے۔	Y	بلا	1325	    2,305	0.0091	160.1379	urd_news_2016_00968442
7252	پیپلز پارٹی کی پارلیمانی کمیٹی کا اجلاس پیر کو اسلام آباد میں بلا لیا گیا ۔	Y	بلا	1325	    2,305	0.0091	252.3333	urd_news_2016_00367038
7253	نیب جن لوگوں کو بلا رہی تھی اس نے اس کا گروپ بنا لیا۔	Y	بلا	1325	    2,305	0.0091	302.3077	urd_news_2016_00922038
7254	کوئٹہ میں فوج بلا کر حالات پر کنٹرول کیا جائے۔	Y	بلا	1325	    2,305	0.0091	339.1	urd_news_2016_00794426
7255	وہ اجازت دے تو فون کرکے اپنے والد کو بلا لے۔	Y	بلا	1325	    2,305	0.0091	408.9091	urd_news_2016_00942091
7256	اس نے لڑکی کو جا نے دیا اور مجھے تھا نے لے گیا ۔	Y	لڑکی	1326	    2,301	0.0091	213.4545	urd_news_2016_00110920
7257	پولیس کے مطابق لڑکی کو ایک لاکھ روپے میں فروخت کیا گیا اور واقعے کی تفتیش شروع کر دی گئی ہے۔	Y	لڑکی	1326	    2,301	0.0091	228.0952	urd_news_2016_00400949
7258	لڑکی کے والد نے اس واقعہ کی اطلاع پولیس کو دی جس نے ملزم کو گرفتار کر لیا۔	Y	لڑکی	1326	    2,301	0.0091	312.25	urd_news_2016_00824604
7259	لیکن اس کے علاوہ وہ نوجوان لڑکی ہے اور ہمارے لئے ان کی اچھی امکان ہے.	Y	لڑکی	1326	    2,301	0.0091	323	urd_news_2016_00826172
7260	ایک لڑکی نے چودھری نثار کے خلاف پریس کانفرنس بلا لی۔	Y	لڑکی	1326	    2,301	0.0091	527.2727	urd_news_2016_00136051
7261	انہوں نے حضرت مولانا کو کشمیر کمیٹی کا چیئرمین بنایا ہے اور چودھری نثار کو وزیر داخلہ بنایا ہے۔	Y	حضرت	1327	    2,300	0.0091	316.5	urd_news_2016_00201438
7262	حضرت شاہ رکن عالم کے سالانہ تین روزہ عرس کل سے شروع ہوگا اُردو پوائنٹ دنیاکی سب سے بڑی اُردو ویب سائیٹ ہے، جو پچھلے 15سال سے اُردو کی خدمت میں مصروف ہے۔	Y	حضرت	1327	    2,300	0.0091	316.8929	urd_news_2016_00511816
7263	یکم دسمبر 2009ء) چیف جسٹس سندھ ہائی کورٹ نے کراچی سے لاپتہ ہونے والے حضرت علی اور سید عابد حسین کی بازیابی سے متعلق درخواست کی سماعت کرتے ہوئے وفاقی و صوبائی حکومت، حساس اداروں اور پولیس سمیت متعلقہ حکام سے جواب طلب کرلیا ہے۔	Y	حضرت	1327	    2,300	0.0091	336.2927	urd_news_2016_00785062
7264	سینیٹر سراج الحق نے کہا کہ جماعت اسلامی کی جدوجہد کا مقصد ملک میں حضرت محمد کے دیئے ہوئے نظام زندگی کا نفاذ ہے ۔	Y	حضرت	1327	    2,300	0.0091	410.1304	urd_news_2016_00649161
7265	حضور کے فرزند کا نام حضرت قاسم، قاسم محمود، قاسم علی، قاسم فاروق اُردو پوائنٹ دنیاکی سب سے بڑی اُردو ویب سائیٹ ہے، جو پچھلے 15سال سے اُردو کی خدمت میں مصروف ہے۔	Y	حضرت	1327	    2,300	0.0091	428.1538	urd_news_2016_00512168
7266	حکومت نے ان کی آمد اور سرگرمیوں پر پابندی کے حوالے سے کوئی واضح اعلان نہیں کیا۔	Y	سرگرمیوں	1327	    2,300	0.0091	211.5882	urd_news_2016_00521454
7267	اس موقع پر موجود صوبائی حکام نے وفد کو صوبے میں امریکی امداد سے جاری ترقیاتی سرگرمیوں کے بارے میں آگاہ کیا۔	Y	سرگرمیوں	1327	    2,300	0.0091	301.5238	urd_news_2016_00108471
7268	وہاں سے پاکستان اور افغانستان میں داعش کی سرگرمیوں کا آغاز ہوا۔	Y	سرگرمیوں	1327	    2,300	0.0091	361.3333	urd_news_2016_00950188
7269	جس میں ملک میں اقتصادی سرگرمیوں کے فروغ سے قومی معیشت کے استحکام میں مدد ملے گی۔	Y	سرگرمیوں	1327	    2,300	0.0091	428.0714	urd_news_2016_00469808
7270	پاکستان نے کبھی ’را‘ کی سرگرمیوں کے ثبوت نہیں دئیے: افغان صدر ۔	Y	سرگرمیوں	1327	    2,300	0.0091	491.1667	urd_news_2016_00360519
7271	انہوں نے سندھ اسمبلی میں میڈیا سے گفتگو کرتے ہوئے کہا کہ نئے وزیراعلیٰ ثابت کریں کہ وہ شہری آبادی کے بھی وزیراعلیٰ ہیں۔	Y	آبادی	1328	    2,299	0.0091	184.1818	urd_news_2016_00203739
7272	ان کے آبادی کنٹرول کرنے کی دوسری اہم وجہ تعلیم ہے۔	Y	آبادی	1328	    2,299	0.0091	302.8182	urd_news_2016_00185202
7273	انہوں نے کہا کہ متاثرہ آبادی کی تعمیر نو کا کام ہفتہ کے اندر اندر شروع کیا جائے گا۔	Y	آبادی	1328	    2,299	0.0091	316.8889	urd_news_2016_00251607
7274	انہوں نے کہاکہ پاکستان کی 60فیصد آبادی نوجوانوں پر مشتمل ہے ۔	Y	آبادی	1328	    2,299	0.0091	345.0909	urd_news_2016_00222305
7275	وسائل کی تقسیم آبادی کی بنیاد پر نہیں کی جارہی۔	Y	آبادی	1328	    2,299	0.0091	520.625	urd_news_2016_00983769
7276	پنجاب میں بلدیاتی انتخابات میں ایک ماہ کی تاخیر کے لیے لاہور ہائیکورٹ میں درخواست دائر اُردو پوائنٹ دنیاکی سب سے بڑی اُردو ویب سائیٹ ہے، جو پچھلے 15سال سے اُردو کی خدمت میں مصروف ہے۔	Y	تاخیر	1328	    2,299	0.0091	177.8929	urd_news_2016_00392158
7277	ان کا کہنا تھا کہ طالبان سے مذاکرات میں تاخیر مشکلات پیدا کر رہی ہیں۔	Y	تاخیر	1328	    2,299	0.0091	259.8	urd_news_2016_00181123
7278	شیخ رشید احمد نے کہا کہ اگر انتخابات جنوری کی بجائے مارچ تک مکمل ہوں تو اس کو زیادہ تاخیر نہیں کہا جاسکتا۔	Y	تاخیر	1328	    2,299	0.0091	300.8636	urd_news_2016_00665579
7279	مذاکرات میں تاخیر حکومت نہیں طالبان قیادت میں تبدیلی کے باعث ہوئی ، وزیر مملکت برائے داخلہ ۔	Y	تاخیر	1328	    2,299	0.0091	375.7333	urd_news_2016_00860806
7280	اپوزیشن جماعتوں کو اب متحد ہونے میں مزید تاخیر نہیں کرنی چاہیے ۔	Y	تاخیر	1328	    2,299	0.0091	469.25	urd_news_2016_00018707
7281	وزیراعلی پنجاب اُردو پوائنٹ دنیاکی سب سے بڑی اُردو ویب سائیٹ ہے، جو پچھلے 15سال سے اُردو کی خدمت میں مصروف ہے۔	Y	وزیراعلی	1329	    2,297	0.0091	124.6667	urd_news_2016_00971783
7282	گزشتہ روز وفاقی وزیر پانی و بجلی خواجہ محمد آصف نے وزیراعلی پنجاب محمد شہباز شریف سے ملاقات کی۔	Y	وزیراعلی	1329	    2,297	0.0091	252.2222	urd_news_2016_00802850
7283	اس حوالے سے وزیراعلی شہباز شریف کا بیان سامنے آیا ہے۔	Y	وزیراعلی	1329	    2,297	0.0091	304.2727	urd_news_2016_00064341
7284	لاہور، وزیراعلی پنجاب میاں شہباز شریف دبئی سے واپسی پر ایئر پورٹ پر میڈیا سے گفتگو کر رہے ہیں۔	Y	وزیراعلی	1329	    2,297	0.0091	418.1176	urd_news_2016_00822344
7285	وزیراعلی سندھ نے شکار پور واقعہ کی تحقیقات کا حکم دیدیا ۔	Y	وزیراعلی	1329	    2,297	0.0091	485.7273	urd_news_2016_00975776
7286	ایک سوال کے جواب میں انہوں نے کہا کہ سندھ کے ٹیکس جمع کرنے والے اداروں کی کارکردگی قابل تحسین ہے ۔	Y	تحسین	1330	    2,295	0.0091	237.05	urd_news_2016_00133379
7287	جس کے لئے ان کا کیا جانے والا اقدام قابل تحسین ہے۔	Y	تحسین	1330	    2,295	0.0091	301.75	urd_news_2016_00467872
7288	تعلیم کے شعبے میں پنجاب حکومت کے اقدامات قابل تحسین ہیں۔	Y	تحسین	1330	    2,295	0.0091	366.6	urd_news_2016_00424711
7289	تحریک انصاف کا جمہوریت کے استحکام اور فروغ کے لئے عملی اقدامات قابل تحسین ہیں ۔	Y	تحسین	1330	    2,295	0.0091	390.7857	urd_news_2016_00412686
7290	سپریم کورٹ کا فوجی عدالتوں کے حق میں فیصلہ قابل تحسین ۔	Y	تحسین	1330	    2,295	0.0091	440.9091	urd_news_2016_00621251
7291	انہوں نے کہا کہ ڈی جی آئی ایس آئی آرمی چیف کے بغیر کوئی کام نہیں کر سکتا، ان پر الزام کے مطابق اگر ڈی جی آئی ایس آئی اس میں ملوث ہیں تو پھر ضرور آرمی چیف بھی ہوں گے۔	Y	ضرور	1331	    2,290	0.0091	168.0625	urd_news_2016_00236372
7292	اگر پرویز مشرف اپنے علاج کے بعد ملک واپس نہ آئے تو اس حوالے سے حکومت اقدامات ضرور کرے گی۔	Y	ضرور	1331	    2,290	0.0091	253.35	urd_news_2016_00138733
7293	‫افغانستان میں انتخابات کے موقع پر سرحد کو بند نہیں کیا جائے گا لیکن سیکیورٹی انتظامات کو سخت ضرور کیا جائے گا۔	Y	ضرور	1331	    2,290	0.0091	302	urd_news_2016_00123703
7294	نواز شریف عام انتخابات سے قبل ضرور پاکستان آئیں گے ۔	Y	ضرور	1331	    2,290	0.0091	361.8	urd_news_2016_00935191
7295	دورہ انگلینڈ مشکل ضرور ہے لیکن کامیاب حاصل کرنا نا ممکن نہیں ۔	Y	ضرور	1331	    2,290	0.0091	515.75	urd_news_2016_00551654
7296	انہوں نے کہا کہ دہشت گردی عالمی مسئلے ہے اس کے خلاف سب کو مل کر کام کرنا ہو گا۔	Y	مسئلے	1332	    2,284	0.0091	149.95	urd_news_2016_00234865
7297	آئی جی اور دیگر حکام اس اہم مسئلے پر رپورٹ پیش کریں۔	Y	مسئلے	1332	    2,284	0.0091	225.1667	urd_news_2016_00288151
7298	ماضی میں بھی دونوں ممالک نے مسئلے حل کئے ہیں اور امید ہے کہ اب بھی وہ اسے حل کر لیں گے۔	Y	مسئلے	1332	    2,284	0.0091	278.85	urd_news_2016_00838357
7299	عراق کے مسئلے کو فوجی نہیں بلکہ سیاسی طریقے سے حل کرنے کی ضرورت ہے ۔	Y	مسئلے	1332	    2,284	0.0091	324.5333	urd_news_2016_00704108
7300	دہشتگردی کے مسئلے پر امریکا بھارت کے موقف سے اتفاق کرتا ہے۔	Y	مسئلے	1332	    2,284	0.0091	469.1818	urd_news_2016_00544321
7301	وزیراعظم نواز شریف نے کہا کہ پاکستان خود دہشتگردی کا شکار ہے ، دہشتگردی کی ہر شکل کی مذمت کرتے ہیں ۔	Y	شکل	1333	    2,279	0.009	214.1111	urd_news_2016_00968228
7302	اب یہ کی رنگ کل شکل کے ہو جائیں گے ۔	Y	شکل	1333	    2,279	0.009	312.9	urd_news_2016_00009498
7303	الیکشن کمیشن کا اہم اجلاس ،سیکیورٹی پلان کو حتمی شکل دی جائے گی ۔	Y	شکل	1333	    2,279	0.009	336.3846	urd_news_2016_00147831
7304	کانفرنس کے انتظامات کو حتمی شکل دی جا رہی ہے۔	Y	شکل	1333	    2,279	0.009	374.3	urd_news_2016_00757524
7305	ورلڈ کپ 2015ء:قومی ٹیم کو حتمی شکل دیدی گئی ۔	Y	شکل	1333	    2,279	0.009	515.5	urd_news_2016_00958011
7306	انہوں نے کہا کہ قرآن میں تمام مسائل کا حل موجود ہے۔	Y	قرآن	1334	    2,278	0.009	189.4167	urd_news_2016_00245632
7307	7)نجی اور سرکاری تعلیمی اداروں میں قرآن پاک کی تعلیم۔	Y	قرآن	1334	    2,278	0.009	372.1	urd_news_2016_00003220
7308	افسوس کہ آج قرآن اور ریاست کو الگ الگ کر دیا گیا ہے۔	Y	قرآن	1334	    2,278	0.009	382.25	urd_news_2016_00122596
7309	ہم اس کا قرآن کی روشنی میں حل تجویز کرتے ہیں۔	Y	قرآن	1334	    2,278	0.009	386.0909	urd_news_2016_00837880
7310	حافظ محمد سعید نے کہاکہ مسلمانوں کا اصل آئین اللہ کا قرآن ہے۔	Y	قرآن	1334	    2,278	0.009	528.9167	urd_news_2016_00507041
7311	اجلاس میں فیصلہ کیا گیا کہ اسلام آباد میں بھی بلدیاتی انتخابات کرائے جائیں گے۔	Y	کرائے	1335	    2,273	0.009	206.7857	urd_news_2016_00029192
7312	تحریک انصاف موجودہ الیکشن کمیشن اور 2013 کے انتخابات کو مسترد کر چکی ہے اور اگر موجودہ الیکشن کمیشن کے ذریعے انتخابات کرائے گئے تو وہ کسی صورت قابل قبول نہیں ہوں گے۔	Y	کرائے	1335	    2,273	0.009	282.2692	urd_news_2016_00414322
7313	سپریم کورٹ نے ڈاکٹر طاہر القادری کی طرف سے جمع کرائے گئے جواب کا جائزہ لیا۔	Y	کرائے	1335	    2,273	0.009	326.375	urd_news_2016_00622515
7314	یہ الیکشن فوج اور عدلیہ کی نگرانی میں کرائے جائیں۔	Y	کرائے	1335	    2,273	0.009	428.5	urd_news_2016_00147452
7315	فاٹا کے سینیٹ انتخابات 19 مارچ کو کرائے جانے کی تجویز ۔	Y	کرائے	1335	    2,273	0.009	518	urd_news_2016_00723618
7316	جاں بحق ہونے والوں میں ایک ہی خاندان کے میاں بیوی سمیت تین افراد بھی شامل ہیں۔	Y	بیوی	1336	    2,272	0.009	242.4118	urd_news_2016_00449481
7317	حکام کا کہنا ہے کہ ملزم امجد نے اس واقعے سے چند گھنٹے قبل اپنی بیوی کو بھی قتل کر دیا تھا۔	Y	بیوی	1336	    2,272	0.009	305.0455	urd_news_2016_00513113
7318	پولیس نے ملزم میاں بیوی کو حراست میں لے لیا۔	Y	بیوی	1336	    2,272	0.009	350.8	urd_news_2016_00403688
7319	اگر عمران خان کی بیوی نہ ہوتی تو بھی مجھے سفیر مقرر کیا جاتا۔	Y	بیوی	1336	    2,272	0.009	376.6429	urd_news_2016_00140081
7320	دوسری شادی: پہلی بیوی کے بجائے یونین کونسل کی اجازت کافی ۔	Y	بیوی	1336	    2,272	0.009	607.6364	urd_news_2016_00556137
7321	ان خیالات کا اظہار انہوں نے جمعرات کے روز گورنر پنجاب چوہدری محمد سرور سے ملاقات کے دوران گفتگو کرتے ہوئے کیا ۔	Y	سرور	1336	    2,272	0.009	220.6667	urd_news_2016_00169482
7322	ان خیالات کا اظہار غلام سرور خان نے اجلاس سے خطاب کرتے ہوئے کیا۔	Y	سرور	1336	    2,272	0.009	239.5	urd_news_2016_00172374
7323	اس حوالے سے چوہدری سرور نے تحقیقات کیلئے حکومت سے جوڈیشل کمیشن کے قیام کا مطالبہ کیا ہے۔	Y	سرور	1336	    2,272	0.009	266	urd_news_2016_00063762
7324	چوہدری محمد سرور نے یہ انکشاف اپنے ایک انٹرویو میں کیا۔	Y	سرور	1336	    2,272	0.009	365.1818	urd_news_2016_00501032
7325	طاہر القادری کے ساتھ کافی حد تک معاملات طے پا گئے ہیں :گورنر سرور ۔	Y	سرور	1336	    2,272	0.009	604.6429	urd_news_2016_00690010
7326	انہوں نے کہاکہ صدر زرداری کے خلاف کسی بھی سازش کو کامیاب نہیں ہونے دیا جائے گا۔	Y	سازش	1337	    2,271	0.009	167.1765	urd_news_2016_00241257
7327	اسلام کے خلاف ہونے والی ہر سازش ناکام بنا دی جائے۔	Y	سازش	1337	    2,271	0.009	241.9091	urd_news_2016_00094539
7328	ہم بھی یہی کہ رہے ہیں کہ یہ امریکی سازش ہے۔	Y	سازش	1337	    2,271	0.009	288.2	urd_news_2016_00843006
7329	اس پروگرام کے ذریعے یہ کوشش کی گئی ہے کہ یہ اساتذہ ملک میں عدم استحکام پیدا کرنے کی سازش میں ملوث ہیں۔	Y	سازش	1337	    2,271	0.009	326.2	urd_news_2016_00058143
7330	سپریم کورٹ،لندن طیارہ سازش کے الزام کی غیر قانونی حراست کی درخواست واپس کرنے کے فیصلے کیخلاف اپیل دائر ۔	Y	سازش	1337	    2,271	0.009	530.8333	urd_news_2016_00621795
7331	انہوں نے کہا کہ ہمارے اقدامات کو عالمی اور قومی اداروں نے تسلیم کیا۔	Y	تسلیم	1338	    2,267	0.009	211.8462	urd_news_2016_00250623
7332	وزیر اعظم نے کہا کہ عالمی برادری ہماری ترقی کو تسلیم کر لیا ہے۔	Y	تسلیم	1338	    2,267	0.009	253.7143	urd_news_2016_00970195
7333	انہوں نے کہا کہ عدالت نے ہمارے موقف کو تسلیم کرتے ہوئے ڈپٹی کمشنر اسلام آباد کو ریکارڈ سمیت (آج) بدھ کو طلب کیا ہے۔	Y	تسلیم	1338	    2,267	0.009	293.1364	urd_news_2016_00242861
7334	پارلیمنٹ کے باہر بننے والی کسی خارجہ پالیسی کو تسلیم نہیں کریں گے۔	Y	تسلیم	1338	    2,267	0.009	338.9231	urd_news_2016_00339427
7335	اردو پوائنٹ پاکستان ۔ 18فروری کے انتخابات کے جو بھی نتائج ہونگے  تسلیم کرینگے۔	Y	تسلیم	1338	    2,267	0.009	491	urd_news_2016_00046356
7336	یہ ایک احمد کا مسئلہ ہی نہیں بلکہ ہر چھوٹے کا بڑے سے اور بڑے کا چھوٹے سے مسئلہ ہے ۔	Y	چھوٹے	1338	    2,267	0.009	230.6429	urd_news_2016_00126648
7337	انہوں نے کہا کہ چھوٹے ملازمین کے مسائل کا خاتمہ اور انہیں سہولیات فراہم کرنے کے لئے مزید اقدامات کئے جائیں گے۔	Y	چھوٹے	1338	    2,267	0.009	251.1905	urd_news_2016_00231342
7338	ان کے ساتھ خواتین اور چھوٹے چھوٹے بچے بھی ہوتے ہیں۔	Y	چھوٹے	1338	    2,267	0.009	299	urd_news_2016_00186029
7339	پولیس چھوٹے علاقے کو کنٹرول نہیں کر سکتی، شہر کو کیسے کنٹرول کرے گی؟	Y	چھوٹے	1338	    2,267	0.009	383.5	urd_news_2016_00396909
7340	ظاہر بڑے لوگ چھوٹے بچوں کو ہمیشہ پوری توجہ دیتے ہیں۔	Y	چھوٹے	1338	    2,267	0.009	522.4545	urd_news_2016_00692762
7341	وہ ہفتہ کو پوسٹ بجٹ پریس کانفرنس سے خطاب کر رہے تھے۔	Y	پوسٹ	1339	    2,265	0.009	346.5	urd_news_2016_00991503
7342	اسلام آباد: وفاقی وزیر خزانہ سینیٹر اسحاق ڈار پوسٹ بجٹ پریس کانفرنس سے خطاب کر رہے ہیں۔	Y	پوسٹ	1339	    2,265	0.009	412.0588	urd_news_2016_00093703
7343	دھماکے کے وقت چیک پوسٹ میں دس اہلکار موجود تھے ۔	Y	پوسٹ	1339	    2,265	0.009	465.9	urd_news_2016_00548519
7344	میاں والی - فیس بک کی پوسٹ موت کے منہ میں لے گئی۔	Y	پوسٹ	1339	    2,265	0.009	525.5833	urd_news_2016_00841977
7345	شمالی وزیرستان: چیک پوسٹ پر خودکش حملہ، 4 سیکورٹی اہلکار شہید ۔	Y	پوسٹ	1339	    2,265	0.009	756.3	urd_news_2016_00673116
7346	پاکستان بیس بال فیڈریشن کی جنرل کونسل کا اجلاس کل لاہور میں ہوگا اُردو پوائنٹ دنیاکی سب سے بڑی اُردو ویب سائیٹ ہے، جو پچھلے 15سال سے اُردو کی خدمت میں مصروف ہے۔	Y	فیڈریشن	1339	    2,265	0.009	203.7037	urd_news_2016_00345542
7347	ان کا کہنا تھا کہ ہاکی فیڈریشن کو جاری کیے گئے فنڈز کسی بھی دوسری فیڈریشن کو جاری کیے گئے فنڈز سے کہیں زیادہ ہیں۔	Y	فیڈریشن	1339	    2,265	0.009	316.0526	urd_news_2016_00179335
7348	پاکستان ہاکی فیڈریشن کے صدر اور سیکرٹری بدھ کو بھارت جائیں گے ۔	Y	فیڈریشن	1339	    2,265	0.009	352.4167	urd_news_2016_00343329
