ORDER	SENTENCE	STATUS	WORD	RANK	COUNT	COUNT_REL	INDEX	ID
7001	انہوں نے کہا کہ گیس کی بنیاد پر بجلی کے منصوبوں کو 2017 کے اختتام تک مکمل کیا جائے گا۔	Y	اختتام	1284	    2,410	0.0096	206	urd_news_2016_00248994
7002	وزیراعظم کا لندن میں کامیاب آپریشن ہوا ہے ٗرمضان کے اختتام سے قبل وطن واپسی کا امکان اُردو پوائنٹ دنیاکی سب سے بڑی اُردو ویب سائیٹ ہے، جو پچھلے 15سال سے اُردو کی خدمت میں مصروف ہے۔	Y	اختتام	1284	    2,410	0.0096	262.2414	urd_news_2016_00963623
7003	انہوں نے کہا کہ دہشتگردی کے خلاف طویل جنگ اختتام کے قریب ہے ۔	Y	اختتام	1284	    2,410	0.0096	317.5	urd_news_2016_00235101
7004	انھوں نے صبح ہم سے موبائل فون لے لیے اور دن کے اختتام پر واپس کر دیئے۔	Y	اختتام	1284	    2,410	0.0096	330.7647	urd_news_2016_00204141
7005	جن میں سے 1178ملین روپے رواں مالی کے اختتام سے قبل خرچ کیے جائیں گے ۔	Y	اختتام	1284	    2,410	0.0096	415	urd_news_2016_00481835
7006	اب یہ مسئلہ آپریشن سے نہیں بلکہ سیاسی بنیادوں پر حل کرنا ہوگا ۔	Y	بنیادوں	1285	    2,409	0.0096	253.7692	urd_news_2016_00009927
7007	صدر زرداری نے پنجاب میں بلدیاتی انتخابات غیر سیاسی بنیادوں پر کرانے کا فیصلہ مسترد کر دیا ۔	Y	بنیادوں	1285	    2,409	0.0096	295.1176	urd_news_2016_00678676
7008	سعودی عرب کی طرف سے انسانی بنیادوں پر امداد کی فراہمی کی تاریخ اس عرب ریاست کے قیام کے وقت سے جاری ہے۔	Y	بنیادوں	1285	    2,409	0.0096	359.5556	urd_news_2016_00636760
7009	اس آئین کے تحت مذہبی بنیادوں پر سیاسی جماعتوں کی تشکیل پر پابندی عائد کی گئی ہے۔	Y	بنیادوں	1285	    2,409	0.0096	405.4	urd_news_2016_00055617
7010	وزیر اعظم ہفتہ وار بنیادوں پر توانائی کی صورتحال کا خود جائزہ لیں گے ۔	Y	بنیادوں	1285	    2,409	0.0096	441.5	urd_news_2016_00963167
7011	انہوں نے آج یہاں میڈیا سے گفتگو کرتے ہوئے کہا کہ رینجرز کو سندھ میں مکمل اختیارات دیے جارہے ہیں۔	Y	دیے	1285	    2,409	0.0096	250.9	urd_news_2016_00192177
7012	وزیراعظم نواز شریف کی وزارت پانی و بجلی کو 21جولائی کو آزاد کشمیر میں انتخابات کے روز لوڈشیڈنگ نہ کرنے کی ہدایت رینجرز کو کراچی کے علاوہ کہیں اختیارات نہیں دیے گئے۔	Y	دیے	1285	    2,409	0.0096	280.7143	urd_news_2016_00967723
7013	وزیر اعلی پنجاب شہباز شریف اور آرمی چیف راحیل شریف کے درمیان اہم ملاقات رینجرز کو کراچی کے علاوہ کہیں اختیارات نہیں دیے گئے۔	Y	دیے	1285	    2,409	0.0096	318.5	urd_news_2016_00972003
7014	دھماکے کے بعد علاقے میں سیکیورٹی انتظامات سخت کر دیے گئے ۔	Y	دیے	1285	    2,409	0.0096	359.8182	urd_news_2016_00548353
7015	جسٹس جاوید اقبال اپنے حصہ کا کام کرکے چل دیے۔	Y	دیے	1285	    2,409	0.0096	466.5	urd_news_2016_00462825
7016	ایس ایم ظفر اُردو پوائنٹ دنیاکی سب سے بڑی اُردو ویب سائیٹ ہے، جو پچھلے 15سال سے اُردو کی خدمت میں مصروف ہے۔	Y	ظفر	1286	    2,406	0.0095	122.1053	urd_news_2016_00055211
7017	راجہ ظفر الحق نے کہا کہ سپریم کورٹ پہلے ہی نواز شریف کو انتخابات میں حصہ لینے کا اہل قرار دے چکی ہے ۔	Y	ظفر	1286	    2,406	0.0095	297.2609	urd_news_2016_00584512
7018	جس کی صدارت جماعت کے چیئرمین راجہ ظفر الحق نے کی۔	Y	ظفر	1286	    2,406	0.0095	364.2	urd_news_2016_00465934
7019	یکم مارچ۔2016ء) پاکستان مسلم لیگ (ن) کی سینٹ میں پارلیمانی پارٹی کا اجلاس راجہ ظفر الحق کی صدارت میں پارلیمنٹ ہاؤس میں منعقد ہوا۔	Y	ظفر	1286	    2,406	0.0095	413.0455	urd_news_2016_00786722
7020	وزیراعظم سے راجہ ظفر الحق سے ملاقات ‘ مجموعی سیاسی صورتحال پر تبادلہ خیال ۔	Y	ظفر	1286	    2,406	0.0095	460.1667	urd_news_2016_00962763
7021	ان کا کہنا تھا کہ دہشت گردی کے خلاف جنگ میں کامیابی حاصل کرنے میں وقت لگے گا۔	Y	لگے	1287	    2,405	0.0095	187.8824	urd_news_2016_00180693
7022	جب وہ پارلیمنٹ کی طرف جانے لگے تو سینئر افسران سے رابطہ کیا گیا۔	Y	لگے	1287	    2,405	0.0095	317.8571	urd_news_2016_00458670
7023	اگر مسئلہ کشمیر کا حل تلاش کرلیا جائے تو دیگر مسائل کا حل تلاش کرنے میں دیر نہیں لگے گی۔	Y	لگے	1287	    2,405	0.0095	348.9412	urd_news_2016_00141102
7024	سکول کو موجودہ حالت میں آنے کے لیے پانچ سال لگے۔	Y	لگے	1287	    2,405	0.0095	372.9091	urd_news_2016_00642482
7025	اب شہر میں بچے بھی ڈینگی سے متاثر ہونے لگے ۔	Y	لگے	1287	    2,405	0.0095	438	urd_news_2016_00009113
7026	عدالت نے کہا کہ حکومت میں صرف وزیر اعظم ہی نہیں بلکہ وفاقی وزراء بھی شامل ہوتے ہیں۔	Y	وزراء	1287	    2,405	0.0095	191.5	urd_news_2016_00701532
7027	اس کمیٹی کے قیام کا فیصلہ چیئرمین سینٹ نے اراکین کی جانب سے وزراء کی مسلسل اجلاس میں عدم شرکت پر کئے گئے شدید احتجاج کے بعد کیا تھا ۔	Y	وزراء	1287	    2,405	0.0095	278.3333	urd_news_2016_00081762
7028	وزیر اعظم نواز شریف، کابینہ وزراء اور سروس چیف نے سخت سیکورٹی کے درمیان ہوئی تقریب میں شرکت کی۔	Y	وزراء	1287	    2,405	0.0095	300.1053	urd_news_2016_00966877
7029	حکومت کے وزراء کا ایوان میں شریک نہ ہو نا غیر ذمہ داری کا ثبوت ہے ۔	Y	وزراء	1287	    2,405	0.0095	379.2	urd_news_2016_00520610
7030	پشاور، سرحد کابینہ میں توسیع ،5 نئے وزراء شامل کیے جارہے ہیں۔	Y	وزراء	1287	    2,405	0.0095	602.2727	urd_news_2016_00382882
7031	بھارتی فوج نے اس بات کی بھی تصدیق کی ہے کہ پاکستانی فوج نے اعلیٰ سطح پر بھارت سے رابطہ کرکے شہید ہونے والے فوجی کی لاش واپس کرنے کا مطالبہ کیا ہے۔	Y	لاش	1288	    2,402	0.0095	238.6786	urd_news_2016_00300512
7032	پولیس نے لاش ضروری کارروائی کے لئے ہسپتال منتقل کر دی ۔	Y	لاش	1288	    2,402	0.0095	288.8182	urd_news_2016_00403246
7033	دوسری جانب بچے کی لاش برآمد کرنے کے بعد پولیس نے واقعے کی تفتیش شروع کردی ہے۔	Y	لاش	1288	    2,402	0.0095	338.6875	urd_news_2016_00553596
7034	پولیس کے مطابق لاش قبضے میں لے کر تفتیش شروع کردی۔	Y	لاش	1288	    2,402	0.0095	365.4545	urd_news_2016_00400891
7035	پولیس نے لاش قبضے میں لیکر قانونی کارروائی کا آغاز کردیا۔	Y	لاش	1288	    2,402	0.0095	453.3636	urd_news_2016_00403249
7036	آپریشن کے دوران 4 دہشتگرد ہلاک جبکہ ایک کو زخمی حالت میں گرفتار کرلیا گیا ہے جس سے تفتیش کی جاری ہے۔	Y	دہشتگرد	1289	    2,400	0.0095	219.5	urd_news_2016_00012510
7037	آپریشن میں اب تک تین ہزار چار سو دہشتگرد ہلاک ہوئے۔	Y	دہشتگرد	1289	    2,400	0.0095	292.0909	urd_news_2016_00012677
7038	ایک سوال کے جواب میں انہوں نے کہا کہ یہ اتحاد صرف داعش کیخلاف نہیں بلکہ ہر دہشتگرد تنظیم ہمارا نشانہ ہے جس کا ہمیں سامنا ہے ۔	Y	دہشتگرد	1289	    2,400	0.0095	338.4231	urd_news_2016_00132835
7039	ملتان،انسداد دہشت گردی محکمہ کی کارروائی، کالعدم تنظیم سے تعلق رکھنے والے 8 دہشتگرد مقابلے کے بعد ہلاک ۔	Y	دہشتگرد	1289	    2,400	0.0095	396.7222	urd_news_2016_00892440
7040	ترکی کی سول ہسپتال کوئٹہ پر دہشتگرد حملے کی مذمت ۔	Y	دہشتگرد	1289	    2,400	0.0095	496.1111	urd_news_2016_00422030
7041	انہوں نے کہا کہ 2018ء میں عوام فیصلہ کریں گے کہ کون سی جماعت بہتر ہے ۔	Y	کون	1289	    2,400	0.0095	167.8	urd_news_2016_00206920
7042	انہوں نے کہا کہ اس خط میں واضح نہیں ہے کہ ہم ان کے کون سے مسائل میں کس طرح ان کی مدد کریں۔	Y	کون	1289	    2,400	0.0095	232.5238	urd_news_2016_00210285
7043	ابھی یہ واضح نہیں ہے کہ ان کی جگہ کون لے گا۔	Y	کون	1289	    2,400	0.0095	281	urd_news_2016_00010252
7044	ایسے میں یہ بحث اہم نہیں ہے کہ کون زیادہ حصہ ڈال رہا ہے۔	Y	کون	1289	    2,400	0.0095	373.6923	urd_news_2016_00113858
7045	کس ملک نے دئیے ہیں اور کون ہمارا دشمن ہے ؟	Y	کون	1289	    2,400	0.0095	503.3	urd_news_2016_00778034
7046	بھارت کی طرف سے جارحیت کی گئی تو اس کا بھرپور جواب دیا جائے گا۔	Y	جارحیت	1290	    2,398	0.0095	194.1429	urd_news_2016_00301305
7047	ایک بیان میں انہوں نے کہا کہ عالمی برادری بھارتی جارحیت کا فوری نوٹس لے ۔	Y	جارحیت	1290	    2,398	0.0095	266.2	urd_news_2016_00128954
7048	بھارت نے جارحیت بند نہ کی تو پاک فوج منہ توڑ جواب دے گی ، پوری قوم پاک فوج کے ساتھ ہے۔	Y	جارحیت	1290	    2,398	0.0095	293.2105	urd_news_2016_00304109
7049	پولیس عالمی برادری مقبوضہ کشمیر میں بھارتی جارحیت کا نوٹس لے،وزیراعظم آزاد کشمیر انتخابات۔	Y	جارحیت	1290	    2,398	0.0095	343	urd_news_2016_00398151
7050	بھارتی جارحیت ، مشیر خارجہ کا اقوام متحدہ کے سیکریٹری جنرل کو خط ۔	Y	جارحیت	1290	    2,398	0.0095	542.3333	urd_news_2016_00298862
7051	مفتی عبد القوی اُردو پوائنٹ دنیاکی سب سے بڑی اُردو ویب سائیٹ ہے، جو پچھلے 15سال سے اُردو کی خدمت میں مصروف ہے۔	Y	القوی	1291	    2,396	0.0095	193.1053	urd_news_2016_00883508
7052	مفتی عبد القوی پاکستان کے تصاویری البم پاکستان کے سیاحتی مقامات اُردو پوائنٹ دنیاکی سب سے بڑی اُردو ویب سائیٹ ہے، جو پچھلے 15سال سے اُردو کی خدمت میں مصروف ہے۔	Y	القوی	1291	    2,396	0.0095	298.28	urd_news_2016_00883635
7053	پولیس نے بتایا کہ مفتی عبد القوی کو قندیل بلوچ کے والد کی درخواست میں نامزد کیا گیا ہے۔	Y	القوی	1291	    2,396	0.0095	334.6842	urd_news_2016_00402226
7054	مفتی عبد القوی قندیل بلوچ نے 18روز قبل پریس کانفرنس کر کے وزارت داخلہ سے سکیورٹی فراہم کا مطالبہ کیا تھا آئی جی پنجاب پولیس کا ماڈل قندیل بلوچ کے قتل کا نوٹس ، تفصیلی رپورٹ طلب ترکی میں بغاوت ناکام ہوئی ، عوام نے جمہوریت کا ساتھ دیا۔	Y	القوی	1291	    2,396	0.0095	336.4	urd_news_2016_00883893
7055	مفتی عبد القوی پاکستان سمیت دوسرے ممالک کی ترکی میں بغاوت کی مذمت قندیل بلوچ کو مبینہ طور پر ان کے بھائی نے قتل کیا ۔	Y	القوی	1291	    2,396	0.0095	363.4583	urd_news_2016_00883627
7056	تحریک طالبان پاکستان ترکی میں فوجی بغاوت اُردو پوائنٹ دنیاکی سب سے بڑی اُردو ویب سائیٹ ہے، جو پچھلے 15سال سے اُردو کی خدمت میں مصروف ہے۔	Y	بغاوت	1292	    2,393	0.0095	179.5455	urd_news_2016_00414949
7057	آئی جی پنجاب نے قندیل بلوچ کے قتل کی رپورٹ طلب کر لی ترکی میں فوج کی اقتدار حاصل کرنے کی کوشش ناکام ترکی میں بغاوت ناکام ہوئی ، عوام نے جمہوریت کا ساتھ دیا۔	Y	بغاوت	1292	    2,393	0.0095	255.3929	urd_news_2016_00288368
7058	قندیل بلوچ کے قتل میں ملوث بھائی وسیم گرفتار کر لیا گیا ترکی میں بغاوت ناکام ہوئی ، عوام نے جمہوریت کا ساتھ دیا۔	Y	بغاوت	1292	    2,393	0.0095	295.7727	urd_news_2016_00746481
7059	پرویز رشید ترکی میں بغاوت ناکام ہوئی ، عوام نے جمہوریت کا ساتھ دیا۔	Y	بغاوت	1292	    2,393	0.0095	329.5385	urd_news_2016_00377248
7060	ریاست کیخلاف بغاوت کی سزا ہمارے آئین میں طے ہے۔	Y	بغاوت	1292	    2,393	0.0095	505.4	urd_news_2016_00585379
7061	پولیس کسی شخص کو حراست میں لے تو اس کے اہل خانہ کو آگاہ کرے،سیکرٹری داخلہ سندھ اُردو پوائنٹ دنیاکی سب سے بڑی اُردو ویب سائیٹ ہے، جو پچھلے 15سال سے اُردو کی خدمت میں مصروف ہے۔	Y	خانہ	1293	    2,390	0.0095	206	urd_news_2016_00399172
7062	اہل خانہ نے پولیس کے خلاف احتجاج کرتے ہوئے اعلی حکام سے انصاف کا مطالبہ کیا ہے۔	Y	خانہ	1293	    2,390	0.0095	256.0588	urd_news_2016_00144730
7063	عوام کو تحفظ دیتے ہوئے نشانہ بننے والے ان سیکورٹی اہلکاروں کے اہل خانہ کے لیے ممکن ہے حکومت کی جانب سے چند لاکھ روپے امداد کا اعلان کردیا ہو۔	Y	خانہ	1293	    2,390	0.0095	324.2069	urd_news_2016_00718386
7064	اس بل کے تحت ستمبر 11کے حملوں میں ہلاک ہونے والوں کے اہل خانہ امریکی عدالت میں سعودی عرب کی حکومت پر مقدمہ کر سکیں گے۔	Y	خانہ	1293	    2,390	0.0095	341.2174	urd_news_2016_00056579
7065	پابندی کے دنوں میں اہل خانہ اور کچھ دوست ساتھ رہے۔	Y	خانہ	1293	    2,390	0.0095	487	urd_news_2016_00337662
7066	علی اعجاز اُردو پوائنٹ دنیاکی سب سے بڑی اُردو ویب سائیٹ ہے، جو پچھلے 15سال سے اُردو کی خدمت میں مصروف ہے۔	Y	اعجاز	1294	    2,389	0.0095	124.7222	urd_news_2016_00706404
7067	اعجاز بٹ اُردو پوائنٹ دنیاکی سب سے بڑی اُردو ویب سائیٹ ہے، جو پچھلے 15سال سے اُردو کی خدمت میں مصروف ہے۔	Y	اعجاز	1294	    2,389	0.0095	189.2778	urd_news_2016_00118318
7068	لاہور، تحریک انصاف پنجاب کے صدر اعجاز چوہدری دیگر کے ہمراہ پریس کانفرنس کر رہے ہیں۔	Y	اعجاز	1294	    2,389	0.0095	268.2	urd_news_2016_00817035
7069	ایک گروپ نے اعجاز چوہدری کے خلاف بغاوت کر دی ۔	Y	اعجاز	1294	    2,389	0.0095	360.5	urd_news_2016_00135930
7070	جعلی چیک کیس ، اعجاز احمد کی درخواست پر سماعت ملتوی ۔	Y	اعجاز	1294	    2,389	0.0095	493.9	urd_news_2016_00470909
7071	انہوں نے کہا کہ وزیراعلیٰ پنجاب محمد شہباز شریف صوبے کے عوام کیلئے شاندار اقدامات کر رہے ہیں۔	Y	شاندار	1295	    2,387	0.0095	192	urd_news_2016_00261876
7072	ان کا کہنا تھا کہ پاکستان کا مستقبل شاندار ہے ۔	Y	شاندار	1295	    2,387	0.0095	271.1111	urd_news_2016_00179961
7073	ان کی شاندار کارکردگی پر انہیں میچ کا بہترین کھلاڑی قرار دیا گیا۔	Y	شاندار	1295	    2,387	0.0095	345.9231	urd_news_2016_00184062
7074	انہوں نے کہا کہ میرا خیال تھا کہ عامر کو 5 سال کرکٹ سے دور رہنے کے بعد مشکلات پیش آئیں گی تاہم عامر نے شاندار کارکردگی کا مظاہرہ کیا۔	Y	شاندار	1295	    2,387	0.0095	355.4231	urd_news_2016_00253076
7075	وزیراعلیٰ شہباز شریف صوبے میں تعلیم، صحت اور دیگر سماجی شعبوں کی بہتری کیلئے شاندار کام کر رہے ہیں۔	Y	شاندار	1295	    2,387	0.0095	377.3158	urd_news_2016_00976247
7076	تحریک انصاف کے آزادی مارچ کے حوالے سے انہوں نے کہا کہ اگست میں موسم گرم ہوگا۔	Y	گرم	1295	    2,387	0.0095	253.75	urd_news_2016_00413425
7077	ملک بھر میں موسم خشک اور گرم رہے گا نیب حکام ہمیش خان کو لے کر پاکستان پہنچ رہے ہیں اُردو پوائنٹ دنیاکی سب سے بڑی اُردو ویب سائیٹ ہے، جو پچھلے 15سال سے اُردو کی خدمت میں مصروف ہے۔	Y	گرم	1295	    2,387	0.0095	292.9118	urd_news_2016_00896898
7078	ملک میں لوٹ مار کار بازار گرم ہے،شہباز شریف اُردو پوائنٹ دنیاکی سب سے بڑی اُردو ویب سائیٹ ہے، جو پچھلے 15سال سے اُردو کی خدمت میں مصروف ہے۔	Y	گرم	1295	    2,387	0.0095	293.875	urd_news_2016_00900655
7079	گزشتہ تین ماہ سے خبر گرم تھی کہ پاکستان اور امریکہ کے تعلقات خراب ہو رہے ہیں۔	Y	گرم	1295	    2,387	0.0095	303.7059	urd_news_2016_00801278
7080	ان خیالات کا اظہار انہوں نے گزشتہ روز پارٹی کے سر گرم کارکنوں کے اعزاز میں منعقدہ تقریب کے موقع پر خطاب کرتے ہوئے کیا ۔	Y	گرم	1295	    2,387	0.0095	319.8696	urd_news_2016_00170694
7081	انہوں نے کہا کہ امریکہ میں مسئلہ کشمیر پر آواز بلند کرنے والوں کو پہلے پاکستان میں آواز بلند کرنا چاہئے تھی جو کہ انہوں نے نہیں کی۔	Y	بلند	1296	    2,384	0.0095	236.0909	urd_news_2016_00215379
7082	تاکہ دنیا میں پاکستان کا نام سر بلند کیا جا سکے ۔	Y	بلند	1296	    2,384	0.0095	320.9091	urd_news_2016_00406171
7083	پاکستان پیپلز پارٹی کشمیری عوام کی حمایت جاری رکھے گی اور کشمیر میں بھارتی جارحیت کے خلاف آواز بلند کرتی رہے گی۔	Y	بلند	1296	    2,384	0.0095	399.4762	urd_news_2016_00345984
7084	ہماری سیاسی قیادت کو متحد ہو کر کشمیریوں کی حمایت میں آواز بلند کرنا ہو گی۔	Y	بلند	1296	    2,384	0.0095	440.1333	urd_news_2016_00833951
7085	اقوام عالم بھارتی افواج کے مظالم کو روکنے کے لیے آواز حق بلند کرے۔	Y	بلند	1296	    2,384	0.0095	662	urd_news_2016_00125846
7086	سری لنکا کیخلاف پہلے ٹیسٹ میں کامیابی پر چیئرمین پی سی بی کی قومی ٹیم کو مبارکباد اُردو پوائنٹ دنیاکی سب سے بڑی اُردو ویب سائیٹ ہے، جو پچھلے 15سال سے اُردو کی خدمت میں مصروف ہے۔	Y	لنکا	1297	    2,380	0.0094	207.5161	urd_news_2016_00633266
7087	ذرائع کے مطابق انہیں سری لنکا کیخلاف سیریز میں بھی شامل نہ کئے جانے کا امکان ہے۔	Y	لنکا	1297	    2,380	0.0094	300.5294	urd_news_2016_00577728
7088	سری لنکا کے خلاف گزشتہ سیریز میں قومی ٹیم نے اچھی کارکردگی کا مظاہرہ کیا تھا۔	Y	لنکا	1297	    2,380	0.0094	373.6875	urd_news_2016_00633384
7089	سری لنکا کی کرکٹ ٹیم مئی انگلینڈ کا دورہ کرے گی ۔	Y	لنکا	1297	    2,380	0.0094	455.4545	urd_news_2016_00633303
7090	سری لنکا اور آسٹریلیا کے درمیان پہلا ٹیسٹ (منگل) شروع ہوگا ۔	Y	لنکا	1297	    2,380	0.0094	592.7273	urd_news_2016_00633144
7091	چیئرمین ایجوکیشن بورڈ اُردو پوائنٹ دنیاکی سب سے بڑی اُردو ویب سائیٹ ہے، جو پچھلے 15سال سے اُردو کی خدمت میں مصروف ہے۔	Y	ایجوکیشن	1298	    2,376	0.0094	145.5789	urd_news_2016_00502873
7092	ان کا کہنا تھا کہ وزیر تعلیم اور سیکریٹری ایجوکیشن کا معاملہ بھی حل ہو جائے گا۔	Y	ایجوکیشن	1298	    2,376	0.0094	261.25	urd_news_2016_00182244
7093	محکمہ ایجوکیشن پنجاب کا بی اے اور بی ایس سی کے نتائج پر اظہار افسوس ۔	Y	ایجوکیشن	1298	    2,376	0.0094	303.1429	urd_news_2016_00850839
7094	محکمہ نے ایجوکیشن پالیسی مکمل کر لی ہے لیکن فنڈز کی کمی کے باعث اس پر عمل درآمد میں مشکلات آ رہی ہیں ۔	Y	ایجوکیشن	1298	    2,376	0.0094	322.913	urd_news_2016_00853703
7095	صوبائی وزیر تعلیم کا متعلقہ ایجوکیشن افسران سے موبائل فون پر رابطہ ۔	Y	ایجوکیشن	1298	    2,376	0.0094	393.1667	urd_news_2016_00684577
7096	اس موقع پر مسلم لیگ (ن) کے امیدوار ملک ناصر خان نے بھی خطاب کیا۔	Y	ناصر	1298	    2,376	0.0094	206.2	urd_news_2016_00108023
7097	وزیر اعلیٰ پنجاب سے مسلم لیگ (ن) برطانیہ کے سینئر نائب صدر ناصر بٹ کی ملاقات ،ملکی سیاسی صورتحال پر تبادلہ خیال اُردو پوائنٹ دنیاکی سب سے بڑی اُردو ویب سائیٹ ہے، جو پچھلے 15سال سے اُردو کی خدمت میں مصروف ہے۔	Y	ناصر	1298	    2,376	0.0094	267.75	urd_news_2016_00971978
7098	منگل کے روز لاہور ہائیکورٹ کے جسٹس ناصر سعید شیخ نے کیس کی سماعت کی ۔	Y	ناصر	1298	    2,376	0.0094	368.6154	urd_news_2016_00907037
7099	پولیس نے چوہدری ناصر عباس کی درخواست پر مقدمہ درج کرلیا۔	Y	ناصر	1298	    2,376	0.0094	392	urd_news_2016_00402560
7100	قوم کی آخری امید ناصر اقبال بھارتی کھلاڑی کے ہاتھوں شکست کے بعد ٹورنامنٹ سے باہر ہوگئے۔	Y	ناصر	1298	    2,376	0.0094	527.5625	urd_news_2016_00750924
7101	انہوں نے کہا کہ جس معاشرے میں انصاف ختم ہو جائے وہ کبھی بھی ترقی نہیں کر سکتا۔	Y	معاشرے	1299	    2,375	0.0094	179	urd_news_2016_00229459
7102	ایک سوال کے جواب میں انہوں نے کہا کہ معاشرے میں میڈیا کا مثبت کردار ہے۔	Y	معاشرے	1299	    2,375	0.0094	249.8	urd_news_2016_00133647
7103	انہوں نے کہا کہ خصوصی بچے معاشرے کا اہم حصہ ہیں ان کو کسی صورت نظر انداز نہیں کیا جاسکتا۔	Y	معاشرے	1299	    2,375	0.0094	288.2	urd_news_2016_00234152
7104	چیف جسٹس کا کہنا تھا کہ آئین کے بغیر معاشرے قائم نہیں رہ سکتے۔	Y	معاشرے	1299	    2,375	0.0094	319.9286	urd_news_2016_00492348
7105	تا کہ معاشرے میں مثبت تبدیلی کی بنیاد رکھی جا سکے۔	Y	معاشرے	1299	    2,375	0.0094	604	urd_news_2016_00406389
7106	انہوں نے بتایا کہ حکومت ملک میں غیر ملکی سرمایہ کاری بڑھانے کی کوشش کر رہی ہے۔	Y	بڑھانے	1300	    2,374	0.0094	209.1176	urd_news_2016_00197530
7107	انہوں نے کہا کہ بہت سے منصوبوں کیلئے معاملات کو آگے بڑھانے اور ان پر بات چیت کے لئے اراکین اسمبلی اور افسران نے چین اور ترکی سمیت دیگر ممالک کے دورے کئے ہیں ۔	Y	بڑھانے	1300	    2,374	0.0094	291.9333	urd_news_2016_00218922
7108	نئے مالی سال میں ٹیکس بڑھانے کے لئے 7 اقدامات تجویز کئے گئے ہیں۔	Y	بڑھانے	1300	    2,374	0.0094	342	urd_news_2016_00940496
7109	وزارت دفاع نے اس یقین کا اظہار کیا ہے کہ برطانوی وفد کے دورے سے دونوں ملکوں کے درمیان مختلف شعبوں میں تعاون بڑھانے اور تعلقات کو مستحکم کر نے میں مدد ملے گی ۔	Y	بڑھانے	1300	    2,374	0.0094	386.3871	urd_news_2016_00960083
7110	دونوں ملکوں کے مابین تجارت بڑھانے کیلئے اقدامات کئے جائیں۔	Y	بڑھانے	1300	    2,374	0.0094	569.3	urd_news_2016_00560005
7111	منشیات برآمد اُردو پوائنٹ دنیاکی سب سے بڑی اُردو ویب سائیٹ ہے، جو پچھلے 15سال سے اُردو کی خدمت میں مصروف ہے۔	Y	منشیات	1301	    2,373	0.0094	141.7222	urd_news_2016_00904280
