ORDER	SENTENCE	STATUS	WORD	RANK	COUNT	COUNT_REL	INDEX	ID
2251	سی آئی اے نے اس پر فوری ایکشن لیا۔	Y	فوری	443	    7,886	0.0313	142.7778	urd_news_2016_00617227
2252	انہوں نے کہا کہ تحقیقات مکمل کرکے رپورٹ فوری پیش کی جائے ۔	Y	فوری	443	    7,886	0.0313	149.3333	urd_news_2016_00227091
2253	فوری طور پر مقدمات ختم کر کے گرفتار افراد کو رہا کیا جائے۔	Y	فوری	443	    7,886	0.0313	152.6154	urd_news_2016_00737534
2254	انہوں نے مطالبہ کیا کہ ملوث افراد کو فوری گرفتار کیا جائے۔	Y	فوری	443	    7,886	0.0313	153.3636	urd_news_2016_00268371
2255	صدر نے بلوچستان حکومت کو فوری طور پر دھماکے کی تحقیقات کا حکم دے دیا ہے ۔	Y	فوری	443	    7,886	0.0313	163.625	urd_news_2016_00681151
2256	وزیراعلیٰ محمد شہباز شریف نے اس موقع پر گفتگو کرتے ہوئے کہا کہ سانحہ پشاور نے ہر پاکستانی کا دل زخمی کیا ہے ۔	Y	سانحہ	444	    7,877	0.0312	167.1364	urd_news_2016_00977494
2257	سانحہ راولپنڈی کی تحقیقات کے لئے عدالتی کمیشن قائم،کل سے تحقیقات کا آغاز اُردو پوائنٹ دنیاکی سب سے بڑی اُردو ویب سائیٹ ہے، جو پچھلے 15سال سے اُردو کی خدمت میں مصروف ہے۔	Y	سانحہ	444	    7,877	0.0312	170.5185	urd_news_2016_00615393
2258	ایک اور سوال کے جواب میں انہوں نے کہا کہ پاکستان اپنے طور پر سانحہ ممبئی کی تحقیقات کر رہا ہے۔	Y	سانحہ	444	    7,877	0.0312	173.8095	urd_news_2016_00128277
2259	سانحہ پشاور قومی سانحہ نہیں بلکہ یہ ایک عالمی سانحہ تھا ۔	Y	سانحہ	444	    7,877	0.0312	174.4444	urd_news_2016_00615175
2260	سانحہ ماڈل ٹاؤن : جے آئی ٹی نے عوامی تحریک کو نوٹس جاری کردیا ، اُردو پوائنٹ دنیاکی سب سے بڑی اُردو ویب سائیٹ ہے، جو پچھلے 15سال سے اُردو کی خدمت میں مصروف ہے۔	Y	سانحہ	444	    7,877	0.0312	178.6552	urd_news_2016_00616110
2261	ان کی مدد کی جائے، کمشنر کراچی اُردو پوائنٹ دنیاکی سب سے بڑی اُردو ویب سائیٹ ہے، جو پچھلے 15سال سے اُردو کی خدمت میں مصروف ہے۔	Y	مدد	445	    7,860	0.0312	96.3333	urd_news_2016_00184534
2262	انہوں نے کہا کہ اس وقت (ن) لیگ پی ٹی آئی پر آئی ایس آئی کی مدد کا الزام لگا رہی تھی۔	Y	مدد	445	    7,860	0.0312	143.15	urd_news_2016_00212046
2263	اس کے لئے پاکستان کی مدد بہت ضروری ہے ۔	Y	مدد	445	    7,860	0.0312	150.8889	urd_news_2016_00087107
2264	انہوں نے کہاکہ وفاقی حکومت کی طرف سے صوبائی حکومت کی ہر ممکن مدد کی جائے گی۔	Y	مدد	445	    7,860	0.0312	156	urd_news_2016_00262400
2265	انہوں نے مزید کہا کہ ہم ایک خاندان کی طرح ہیں اور مل کر کام کرتے ہوئے شہریوں کی مدد کریں گے ۔	Y	مدد	445	    7,860	0.0312	156.0952	urd_news_2016_00267319
2266	انہوں نے یہ مطالبہ تنظیم کے ایک اجلاس کے موقع پر کیا ۔	Y	مطالبہ	446	    7,834	0.0311	141.5455	urd_news_2016_00268044
2267	کمیٹی ارکان نے پی ٹی بی کو ختم کرنے کا مطالبہ کر دیا۔	Y	مطالبہ	446	    7,834	0.0311	145.5385	urd_news_2016_00783035
2268	پاکستان پیپلزپارٹی پنجاب کے صدر شاہ محمود قریشی کا مطالبہ اُردو پوائنٹ دنیاکی سب سے بڑی اُردو ویب سائیٹ ہے، جو پچھلے 15سال سے اُردو کی خدمت میں مصروف ہے۔	Y	مطالبہ	446	    7,834	0.0311	146.8077	urd_news_2016_00345897
2269	انہوں نے تحفظ فراہم کرنے کا مطالبہ کیا ہے۔	Y	مطالبہ	446	    7,834	0.0311	155.5556	urd_news_2016_00200424
2270	وزیر خارجہ نے کہا کہ پاکستان نے بھارت سے مطالبہ کیا ہے کہ وہ واقعہ کی تحقیقات اور ملوث افراد کیخلاف کارروائی کرے۔	Y	مطالبہ	446	    7,834	0.0311	161.0476	urd_news_2016_00980472
2271	وفاقی وزیر پرویز رشید کے بیان پر وزیراعظم سے کہا ہے کہ وہ اس بیان کا نوٹس لیں۔	Y	لیں	447	    7,826	0.031	156.4118	urd_news_2016_00989000
2272	کے پی کے میں جا کر دیکھ لیں کہ پولیس غیر سیاسی ہے۔	Y	لیں	447	    7,826	0.031	163.5833	urd_news_2016_00796325
2273	اور امید ہے کہ وہ ان ملزمان کو جلد سے جلد گرفتار کر لیں گے۔	Y	لیں	447	    7,826	0.031	166.5	urd_news_2016_00274401
2274	انہوں نے مطالبہ کیا کہ آئی جی پنجاب نوٹس لیں۔	Y	لیں	447	    7,826	0.031	167.7	urd_news_2016_00268117
2275	پیپلز پارٹی کی قیادت کی جانب سے درخواست کی گئی ہے کہ وزیراعظم اس تمام صورتحال پر نوٹس لیں۔	Y	لیں	447	    7,826	0.031	168.1176	urd_news_2016_00367336
2276	دہشتگردی کے خلاف پاکستان کے ساتھ ہیں، آسٹریلیا اُردو پوائنٹ دنیاکی سب سے بڑی اُردو ویب سائیٹ ہے، جو پچھلے 15سال سے اُردو کی خدمت میں مصروف ہے۔	Y	دہشتگردی	448	    7,825	0.031	118.2609	urd_news_2016_00543963
2277	دہشتگردی کا اسلام سے کوئی تعلق نہیں ہے۔	Y	دہشتگردی	448	    7,825	0.031	138.875	urd_news_2016_00543266
2278	انہوں نے کہا کہ ہم نے دہشتگردی کو شکست دی ہے ۔	Y	دہشتگردی	448	    7,825	0.031	141.2	urd_news_2016_00257058
2279	بھارت پاکستان میں ہونے والی دہشتگردی میں بھی ملوث ہے۔	Y	دہشتگردی	448	    7,825	0.031	147	urd_news_2016_00298569
2280	کراچی میں تمام جماعتوں اور میڈیا نے دہشتگردی کے خلاف ایکشن کا کہا ۔	Y	دہشتگردی	448	    7,825	0.031	152.3846	urd_news_2016_00770986
2281	وہ جمعہ کو لاہور میں پنجاب اسمبلی کے باہر میڈیا سے گفتگو کر رہے تھے۔	Y	باہر	449	    7,824	0.031	146.3333	urd_news_2016_00955204
2282	انہوں نے مزید کہا کہ پاکستان کا سرمایہ خفیہ طور پر ملک سے باہر گیا ہے۔	Y	باہر	449	    7,824	0.031	158.5	urd_news_2016_00266128
2283	باہر کے لوگوں کا کوئی ریکارڈ نہیں ہے۔	Y	باہر	449	    7,824	0.031	160.5	urd_news_2016_00305447
2284	عمران خان نے کہا کہ تحریک انصاف حکومت کے اس فیصلے کے خلاف قومی اسمبلی کے اندر اور باہر احتجاج کرے گی۔	Y	باہر	449	    7,824	0.031	163.65	urd_news_2016_00714460
2285	ان خیالات کا اظہار انہوں نے پنجاب اسمبلی کے باہر صحافیوں سے گفتگو کرتے ہوئے کیا۔	Y	باہر	449	    7,824	0.031	163.9375	urd_news_2016_00169110
2286	یہ بھی امکان ہے کہ وہ پاکستان کے بعد افغانستان کا دورہ بھی کریں ۔	Y	افغانستان	450	    7,801	0.0309	140.2308	urd_news_2016_00307719
2287	ترجمان نے کہا کہ اس موقع پر افغانستان میں تعاون کے حوالے سے تبادلہ خیال کیا جائے گا۔	Y	افغانستان	450	    7,801	0.0309	155.6111	urd_news_2016_00419956
2288	انہوں نے مزید کہا کہ پاکستان، افغانستان میں قیام امن کی حمایت کرتا ہے جبکہ بھارت کے ساتھ مذاکرات جاری ہیں۔	Y	افغانستان	450	    7,801	0.0309	155.7143	urd_news_2016_00266096
2289	پر امن افغانستان خود پاکستان کے حق میں ہے۔	Y	افغانستان	450	    7,801	0.0309	158.4444	urd_news_2016_00372607
2290	انہوں نے کہا کہ پیپلز پارٹی کی حکومت نے سب سے زیادہ توجہ افغانستان کے ساتھ تعلقات بہتر بنانے پر دی۔	Y	افغانستان	450	    7,801	0.0309	160.3	urd_news_2016_00224409
2291	مضبوط آغاز اُردو پوائنٹ دنیاکی سب سے بڑی اُردو ویب سائیٹ ہے، جو پچھلے 15سال سے اُردو کی خدمت میں مصروف ہے۔	Y	آغاز	451	    7,800	0.0309	118.7222	urd_news_2016_00877975
2292	انہوں نے اپنی سیاسی زندگی کا آغاز مسلم لیگ (ن) سے کیا ہے۔	Y	آغاز	451	    7,800	0.0309	138.0769	urd_news_2016_00191742
2293	سماعت کا دوبارہ آغاز پیر سے ہوگا اُردو پوائنٹ دنیاکی سب سے بڑی اُردو ویب سائیٹ ہے، جو پچھلے 15سال سے اُردو کی خدمت میں مصروف ہے۔	Y	آغاز	451	    7,800	0.0309	138.4545	urd_news_2016_00644980
2294	آغاز ذوالفقار خان اُردو پوائنٹ دنیاکی سب سے بڑی اُردو ویب سائیٹ ہے، جو پچھلے 15سال سے اُردو کی خدمت میں مصروف ہے۔	Y	آغاز	451	    7,800	0.0309	144.0526	urd_news_2016_00119372
2295	کیونکہ ان کی جانب سے فائرنگ کا آغاز کیا گیا ۔	Y	آغاز	451	    7,800	0.0309	147.6	urd_news_2016_00791237
2296	یہ مسئلہ اب خود ان کو حل کرنا ہوگا ۔	Y	مسئلہ	452	    7,758	0.0308	165	urd_news_2016_00873713
2297	مسئلہ کشمیر کا حل وقت کی اہم ترین ضرورت ہے ۔	Y	مسئلہ	452	    7,758	0.0308	167.6	urd_news_2016_00873946
2298	بھارت اور پاکستان میں آئندہ جنگ پانی کے مسئلہ پر ہوگی۔	Y	مسئلہ	452	    7,758	0.0308	172	urd_news_2016_00298221
2299	یہ مسئلہ جلد حل کرنے کی کوشش کریں گے۔	Y	مسئلہ	452	    7,758	0.0308	173.1111	urd_news_2016_00873734
2300	مسئلہ کشمیر پاکستان، بھارت مذاکرات کا حصہ ہے۔	Y	مسئلہ	452	    7,758	0.0308	193.25	urd_news_2016_00873803
2301	پنجاب کے وکیل سے عدالت نے کہاکہ آپ کا بیان ریکارڈ کیا جائے یا نہیں تو انہوں نے کہا کہ نہیں۔	Y	ریکارڈ	453	    7,750	0.0307	148.5789	urd_news_2016_00391804
2302	اس کے بعد کاروائی کرتے ہوئے تمام ریکارڈ اپنے ساتھ لے گئے ۔	Y	ریکارڈ	453	    7,750	0.0307	148.75	urd_news_2016_00083845
2303	انہوں نے کہاکہ سندھ کو 1992ء کے ریکارڈ کے تحت پانی فراہم نہیں کیا جارہا۔	Y	ریکارڈ	453	    7,750	0.0307	172.6429	urd_news_2016_00239925
2304	انہوں نے وزیراعظم کو مبارکباد پیش کی اور کہا کہ یہ اس بات کا ثبوت ہے کہ ملک میں ریکارڈ ترقیاتی کام ہوئے۔	Y	ریکارڈ	453	    7,750	0.0307	173.2273	urd_news_2016_00269576
2305	پورے ملک کے شہریوں کا کوئی ڈی این اے ریکارڈ ملک میں نہیں ہے۔	Y	ریکارڈ	453	    7,750	0.0307	182.3846	urd_news_2016_00394704
2306	اس سوال کا بھی کوئی جواب نہیں۔	Y	سوال	454	    7,701	0.0305	124.1429	urd_news_2016_00071569
2307	عمران خان کے چار سوال یہ تھے.	Y	سوال	454	    7,701	0.0305	157.4286	urd_news_2016_00713293
2308	آپ نے اپنے سوال کا جواب خود ہی دے دیا۔	Y	سوال	454	    7,701	0.0305	160.4	urd_news_2016_00016455
2309	میں میڈیا کے ہر سوال کا جواب دینے کے لئے تیار ہوں۔	Y	سوال	454	    7,701	0.0305	165.9091	urd_news_2016_00911659
2310	بار بار ایک ہی سوال نہ کریں۔	Y	سوال	454	    7,701	0.0305	168.5	urd_news_2016_00297613
2311	صدر مشرف کی شیخ رشید سے ملاقات اُردو پوائنٹ دنیاکی سب سے بڑی اُردو ویب سائیٹ ہے، جو پچھلے 15سال سے اُردو کی خدمت میں مصروف ہے۔	Y	مشرف	455	    7,687	0.0305	129.8095	urd_news_2016_00679344
2312	مشرف کے خلاف جنوبی پنجاب سے تحریک شروع ہو گئی ہے۔	Y	مشرف	455	    7,687	0.0305	140	urd_news_2016_00875688
2313	صدر مشرف نے کہا کہ حکومت ہر وہ اقدام کر رہی ہے جس سے ملک میں امن اور عوام کی ترقی ممکن ہو سکے۔	Y	مشرف	455	    7,687	0.0305	153.75	urd_news_2016_00679509
2314	ایک سوال کے جواب میں انہوں نے کہا کہ پرویز مشرف کا معاملہ عدالت میں ہے ۔	Y	مشرف	455	    7,687	0.0305	160	urd_news_2016_00133155
2315	انہوں نے کہا کہ صدر مشرف اپنے انتخاب کا فیصلہ خود کریں گے۔	Y	مشرف	455	    7,687	0.0305	162.0769	urd_news_2016_00241294
2316	میں آپ کے بغیر کچھ بھی نہیں ہوں.	Y	بغیر	456	    7,673	0.0304	149.875	urd_news_2016_00908699
2317	اور اس منصوبے کو بھارت کے بغیر بھی پورا کیا جائے گا ۔	Y	بغیر	456	    7,673	0.0304	164.0833	urd_news_2016_00273995
2318	انہوں نے بغیر کسی کمپنی کا نام لئے کہا کہ اس معاملے میں صرف کچھ ملازمین کو گرفتار کیا گیا۔	Y	بغیر	456	    7,673	0.0304	167.05	urd_news_2016_00199326
2319	اسلام آباد: قومی اسمبلی کی قائمہ کمیٹی برائے پانی و بجلی کا اجلاس بغیر کاروائی کے ملتوی اُردو پوائنٹ دنیاکی سب سے بڑی اُردو ویب سائیٹ ہے، جو پچھلے 15سال سے اُردو کی خدمت میں مصروف ہے۔	Y	بغیر	456	    7,673	0.0304	167.625	urd_news_2016_00091077
2320	انہوں نے کہا کہ ڈی جی آئی ایس آئی آرمی چیف کے بغیر کوئی کام نہیں کر سکتا، ان پر الزام کے مطابق اگر ڈی جی آئی ایس آئی اس میں ملوث ہیں تو پھر ضرور آرمی چیف بھی ہوں گے۔	Y	بغیر	456	    7,673	0.0304	168.0625	urd_news_2016_00236372
2321	تاہم اس کیلئے سخت اقدامات کی ضرورت ہے۔	Y	سخت	457	    7,651	0.0303	177.125	urd_news_2016_00407006
2322	میاں نواز شریف اس وقت قوم کی سخت ضرورت ہیں ۔	Y	سخت	457	    7,651	0.0303	177.3	urd_news_2016_00841662
2323	مگر یہ سخت کارروائی کا وقت ہے۔	Y	سخت	457	    7,651	0.0303	186.5714	urd_news_2016_00889407
2324	ہمیں اس کے خلاف سخت احتجاج کرنا چاہیے۔	Y	سخت	457	    7,651	0.0303	224.875	urd_news_2016_00909169
2325	اسے سخت جواب دینے کی ضرورت ہے۔	Y	سخت	457	    7,651	0.0303	233.7143	urd_news_2016_00113377
2326	آصف زرداری اُردو پوائنٹ دنیاکی سب سے بڑی اُردو ویب سائیٹ ہے، جو پچھلے 15سال سے اُردو کی خدمت میں مصروف ہے۔	Y	آصف	458	    7,626	0.0302	98.3889	urd_news_2016_00115414
2327	خواجہ آصف اُردو پوائنٹ دنیاکی سب سے بڑی اُردو ویب سائیٹ ہے، جو پچھلے 15سال سے اُردو کی خدمت میں مصروف ہے۔	Y	آصف	458	    7,626	0.0302	101.7778	urd_news_2016_00532064
2328	وفاقی وزیر دفاع خواجہ آصف اُردو پوائنٹ دنیاکی سب سے بڑی اُردو ویب سائیٹ ہے، جو پچھلے 15سال سے اُردو کی خدمت میں مصروف ہے۔	Y	آصف	458	    7,626	0.0302	133.8571	urd_news_2016_00990080
2329	کیا آصف علی زرداری کو گرفتار کیا جائے گا۔	Y	آصف	458	    7,626	0.0302	155	urd_news_2016_00752288
2330	وفاقی وزیر دفاع خواجہ آصف اسلام آباد : وزیر اعظم نواز شریف سے آرمی چیف جنرل راحیل شریف کی ملاقات اُردو پوائنٹ دنیاکی سب سے بڑی اُردو ویب سائیٹ ہے، جو پچھلے 15سال سے اُردو کی خدمت میں مصروف ہے۔	Y	آصف	458	    7,626	0.0302	155.7742	urd_news_2016_00990083
2331	جس میں کیا گیا ہے چھ بچوں کی زندگی کو بیان۔	Y	زندگی	459	    7,622	0.0302	166.3636	urd_news_2016_00469547
2332	اسے اپنے طور سے زندگی کے فیصلے کرنے کا اختیار دیا ہے۔	Y	زندگی	459	    7,622	0.0302	180	urd_news_2016_00112837
2333	یہ زندگی بھر جنگ کرنے والی قوم ہے ۔	Y	زندگی	459	    7,622	0.0302	183.75	urd_news_2016_00607825
2334	نواز شریف کی زندگی کا بھی یہ اہم وقت ہے امید ہے کہ وہ قوم کو اعلی قیادت فراہم کریں گے۔	Y	زندگی	459	    7,622	0.0302	188.05	urd_news_2016_00935442
2335	اس کے بعد ان کی زندگی مشکل بنا دی گئی۔	Y	زندگی	459	    7,622	0.0302	202	urd_news_2016_00083239
2336	محمد اعجاز الحق اُردو پوائنٹ دنیاکی سب سے بڑی اُردو ویب سائیٹ ہے، جو پچھلے 15سال سے اُردو کی خدمت میں مصروف ہے۔	Y	الحق	460	    7,584	0.0301	140.7895	urd_news_2016_00854056
2337	نعیم الحق اُردو پوائنٹ دنیاکی سب سے بڑی اُردو ویب سائیٹ ہے، جو پچھلے 15سال سے اُردو کی خدمت میں مصروف ہے۔	Y	الحق	460	    7,584	0.0301	169.3889	urd_news_2016_00930217
2338	مصباح الحق اُردو پوائنٹ دنیاکی سب سے بڑی اُردو ویب سائیٹ ہے، جو پچھلے 15سال سے اُردو کی خدمت میں مصروف ہے۔	Y	الحق	460	    7,584	0.0301	170.1667	urd_news_2016_00876549
2339	حکومت کو فوری طور پر مذاکرات شروع کرنے چاہئیں: سراج الحق اُردو پوائنٹ دنیاکی سب سے بڑی اُردو ویب سائیٹ ہے، جو پچھلے 15سال سے اُردو کی خدمت میں مصروف ہے۔	Y	الحق	460	    7,584	0.0301	198.8889	urd_news_2016_00520269
2340	سراج الحق نے مزید کہا کہ حکمران عوام کے مسائل حل نہیں کرتے تو انہیں حکومت کرنے کو کوئی حق نہیں۔	Y	الحق	460	    7,584	0.0301	203.15	urd_news_2016_00628701
2341	حکومت کے خلاف او پی سی او نا منظور کے نعرے اُردو پوائنٹ دنیاکی سب سے بڑی اُردو ویب سائیٹ ہے، جو پچھلے 15سال سے اُردو کی خدمت میں مصروف ہے۔	Y	منظور	461	    7,578	0.0301	155.56	urd_news_2016_00520498
2342	اس لیے یہ بل نہ تو منظور کیا گیا ہے اور نہ ہی مسترد کیا گیا ہے ۔	Y	منظور	461	    7,578	0.0301	166.4615	urd_news_2016_00096338
2343	سپریم کورٹ نے ان کی درخواست منظور کرتے ہوئے سی پی او ملتان کو قانون کے مطابق کارروائی کی ہدایت کردی۔	Y	منظور	461	    7,578	0.0301	167.95	urd_news_2016_00622258
2344	تو صرف اپنے منظور نظر لوگوں کے لئے ۔	Y	منظور	461	    7,578	0.0301	177.25	urd_news_2016_00439844
2345	پی سی ون منظور ہو چکا ہے اور کام بھی شروع کر دیا گیا ہے۔	Y	منظور	461	    7,578	0.0301	180.2143	urd_news_2016_00380848
2346	مختلف امور پر تبادلہ خیال اُردو پوائنٹ دنیاکی سب سے بڑی اُردو ویب سائیٹ ہے، جو پچھلے 15سال سے اُردو کی خدمت میں مصروف ہے۔	Y	خیال	462	    7,555	0.03	130.8095	urd_news_2016_00856025
2347	وہ پیر کو قومی اسمبلی کے اجلاس میں اظہار خیال کر رہے تھے۔	Y	خیال	462	    7,555	0.03	131.3077	urd_news_2016_00953283
2348	وہ جمعہ کو قومی اسمبلی کے اجلاس میں اظہار خیال کر رہے تھے۔	Y	خیال	462	    7,555	0.03	147	urd_news_2016_00955171
2349	ان خیالات کا اظہار انہوں نے جمعرات کے روز قومی اسمبلی کے اجلاس میں اظہار خیال کرتے ہوئے کیا ۔	Y	خیال	462	    7,555	0.03	155.5882	urd_news_2016_00169476
2350	اس دوران کراچی اور بلوچستان کی صورتحال پر بھی تبادلہ خیال ہو گا۔	Y	خیال	462	    7,555	0.03	164.1538	urd_news_2016_00067223
2351	انہوں نے کہا کہ عمران خان چاہتے تھے کہ ملک میں تحریک کا آغاز کیا جائے تاکہ ملک میں شفاف انتخابات ہوں۔	Y	تاکہ	463	    7,547	0.0299	198.3684	urd_news_2016_00243428
2352	اس لئے ہم ایم کیو ایم سے بات کررہے ہیں تاکہ معاملہ حل ہو۔	Y	تاکہ	463	    7,547	0.0299	200.3846	urd_news_2016_00095965
2353	انہوں نے کہا کہ حکومت ملک میں سیاسی استحکام کے لئے کام کر رہی ہے تاکہ اداروں کو بہتر اور مستحکم بنایا جا سکے۔	Y	تاکہ	463	    7,547	0.0299	210.0417	urd_news_2016_00233456
2354	ججز ہائیکورٹ نے مطالبہ کیا کہ اسلام آباد ہائی کورٹ کو بند کرنے کا اختیار پارلیمنٹ کو دیا جائے تاکہ وہ اس حوالے سے کوئی فیصلہ کرے۔	Y	تاکہ	463	    7,547	0.0299	212.9231	urd_news_2016_00459041
2355	تاکہ عوام کی خدمت کی جا سکے ۔	Y	تاکہ	463	    7,547	0.0299	214	urd_news_2016_00406269
2356	جس پر عدالت نے وفاقی حکومت کو 6 جون کے لئے نوٹس جاری کرتے ہوئے جواب طلب کر لیا۔	Y	نوٹس	464	    7,542	0.0299	139.6667	urd_news_2016_00461906
2357	جس کے لئے انہیں نوٹس جاری کر دیئے گئے ہیں۔	Y	نوٹس	464	    7,542	0.0299	148	urd_news_2016_00467873
2358	عدالت نے الیکشن کمیشن پنجاب کو نوٹس کرتے ہوئے جواب طلب کر لیا۔	Y	نوٹس	464	    7,542	0.0299	151.3846	urd_news_2016_00700169
2359	عدالت نے درخواست پر وفاقی حکومت اور الیکشن کمیشن کو نوٹس جاری کر دیئے ۔	Y	نوٹس	464	    7,542	0.0299	151.7143	urd_news_2016_00700745
2360	انہوں نے اس کا نوٹس لیا ہے، پیر تک آگاہ کر دیا جائے گا۔	Y	نوٹس	464	    7,542	0.0299	151.7857	urd_news_2016_00193216
2361	شعیب شیخ اُردو پوائنٹ دنیاکی سب سے بڑی اُردو ویب سائیٹ ہے، جو پچھلے 15سال سے اُردو کی خدمت میں مصروف ہے۔	Y	شیخ	465	    7,505	0.0298	129.8889	urd_news_2016_00671601
2362	تنویر احمد شیخ اُردو پوائنٹ دنیاکی سب سے بڑی اُردو ویب سائیٹ ہے، جو پچھلے 15سال سے اُردو کی خدمت میں مصروف ہے۔	Y	شیخ	465	    7,505	0.0298	174.2632	urd_news_2016_00438576
2363	شیخ رشید احمد نے کہا کہ حکومت کہیں بھی نہیں جا رہی الیکشن ہونے والے ہیں۔	Y	شیخ	465	    7,505	0.0298	182.4375	urd_news_2016_00665606
2364	غلام حیدر شیخ کی زیر صدارت پاکستان پیپلز پارٹی (شہید بھٹو ) لاہور کا اجلاس اُردو پوائنٹ دنیاکی سب سے بڑی اُردو ویب سائیٹ ہے، جو پچھلے 15سال سے اُردو کی خدمت میں مصروف ہے۔	Y	شیخ	465	    7,505	0.0298	190.6207	urd_news_2016_00722819
2365	عمران خان نے پرویز رشید اور شیخ رشید کے سوال کا جواب نہ دیا۔	Y	شیخ	465	    7,505	0.0298	193.9231	urd_news_2016_00714029
2366	منصوبہ 18 ماہ میں مکمل کیا جائے گا۔	Y	منصوبہ	466	    7,477	0.0297	147.5714	urd_news_2016_00904523
2367	یہ منصوبہ کامیابی سے جاری ہے اور جون 2021ء میں مکمل ہو گا۔	Y	منصوبہ	466	    7,477	0.0297	159.1538	urd_news_2016_00904662
2368	گزشتہ حکومت نے اس حوالے سے کوئی بھی منصوبہ بندی نہیں کی۔	Y	منصوبہ	466	    7,477	0.0297	159.6667	urd_news_2016_00801404
2369	انہوں نے کہا کہ اس منصوبہ پر مارچ کے پہلے ہفتہ میں کام شروع ہو جائے گا اور یہ 2010ء میں پیداوار دینا شروع کر دے گا۔	Y	منصوبہ	466	    7,477	0.0297	178.5	urd_news_2016_00211542
2370	انہوں نے کہاکہ ساڑھے تین سال میں کے پی کے میں ایک بھی منصوبہ مکمل نہیں ہوا ۔	Y	منصوبہ	466	    7,477	0.0297	179.1333	urd_news_2016_00238032
2371	کراچی میں سب کو سیاست کا حق ہے۔	Y	حق	467	    7,468	0.0296	140.125	urd_news_2016_00771445
2372	انہوں نے کہا کہ پاکستان مسلم لیگ ن نے نوجوانوں کو ان کا حق دیا ہے ۔	Y	حق	467	    7,468	0.0296	141.6	urd_news_2016_00223216
2373	اس لئے ایم ایم اے کو حکومت پر تنقید کرنے کا کوئی حق نہیں ہے۔	Y	حق	467	    7,468	0.0296	151.5714	urd_news_2016_00095403
2374	اس حوالے سے پنجاب اسمبلی میں میڈیا کے حق میں بھی ایک قرارداد پیش کی جائے گی۔	Y	حق	467	    7,468	0.0296	154	urd_news_2016_00063652
2375	اس موقع پر میڈیا سے گفتگو کرتے ہوئے انہوں نے کہا کہ پاکستان میں شفاف اور آزاد انتخابات کے حق میں ہیں ۔	Y	حق	467	    7,468	0.0296	155.2857	urd_news_2016_00107779
