ORDER	SENTENCE	STATUS	WORD	RANK	COUNT	COUNT_REL	INDEX	ID
2642	خیبر ایجنسی میں دہشت گردوں کے خلاف شروع کی گئی کارروائی کا بھی جائزہ لیا گیا۔	Y	ایجنسی	519	    6,866	0.0272	183.25	urd_news_2016_00527076
2643	جبکہ خیبر ایجنسی میں دو افراد کو فائرنگ کرکے قتل کردیا گیا۔	Y	ایجنسی	519	    6,866	0.0272	184.25	urd_news_2016_00455474
2644	یہ بات بھارت پر واضح کی جا چکی ہے کہ کوئی پاکستانی ایجنسی بھارت میں دہشتگردی میں ملوث نہیں۔	Y	ایجنسی	519	    6,866	0.0272	197.1765	urd_news_2016_00295745
2645	آرمی چیف سے ملاقات میں بھارتی ایجنسی ’’را‘‘ کے ایجنٹ سے متعلق کوئی بات نہیں ہوئی اُردو پوائنٹ دنیاکی سب سے بڑی اُردو ویب سائیٹ ہے، جو پچھلے 15سال سے اُردو کی خدمت میں مصروف ہے۔	Y	ایجنسی	519	    6,866	0.0272	206.8621	urd_news_2016_00049287
2646	انہوں نے کہا کہ انہوں نے ہمیشہ اپوزیشن کو زیادہ وقت دیا ہے۔	Y	اپوزیشن	520	    6,857	0.0272	155.3636	urd_news_2016_00217144
2647	چوہدری نثار نے کہا کہ اپوزیشن کی جانب سے کہا گیا کہ ایف آئی اے کچھ کیوں نہیں کر رہی؟	Y	اپوزیشن	520	    6,857	0.0272	162.7778	urd_news_2016_00502081
2648	ذرائع کے مطابق حکومت اور اپوزیشن میں چیئرمین نیب کے نام پر اتفاق ہو گیا ہے تاہم ان کا نام عدالت میں بتایا جائے گا۔	Y	اپوزیشن	520	    6,857	0.0272	163.3182	urd_news_2016_00578775
2649	سندھ میں ایف آئی اے اور نیب کا کردار نہیں ہونا چاہیے اپوزیشن لیڈر اُردو پوائنٹ دنیاکی سب سے بڑی اُردو ویب سائیٹ ہے، جو پچھلے 15سال سے اُردو کی خدمت میں مصروف ہے۔	Y	اپوزیشن	520	    6,857	0.0272	165.1379	urd_news_2016_00654945
2650	انہوں نے مزید کہا کہ ٹی آر او اپوزیشن کے ہوتے ہیں ملزم کے نہیں۔	Y	اپوزیشن	520	    6,857	0.0272	174.7857	urd_news_2016_00266374
2651	پاکستان میں جمہوریت اور میڈیا دونوں آزاد ہیں۔	Y	جمہوریت	521	    6,850	0.0272	165.5	urd_news_2016_00358561
2652	جمہوریت ہی تمام مسائل کا حل ہے ۔	Y	جمہوریت	521	    6,850	0.0272	180.2857	urd_news_2016_00477737
2653	اب جمہوریت ختم ہوئی تو ذمہ داری عمران خان پر ہوگی۔	Y	جمہوریت	521	    6,850	0.0272	221.9091	urd_news_2016_00008265
2654	یہاں دونوں ممالک میں جمہوریت ہے جبکہ ایران میں میڈیا آزاد نہیں۔	Y	جمہوریت	521	    6,850	0.0272	233.6364	urd_news_2016_00270870
2655	احتجاج اور مذاکرات جمہوریت کا حصہ ہیں۔	Y	جمہوریت	521	    6,850	0.0272	255.5714	urd_news_2016_00032037
2656	آپریشن کے دوران ایک ایف سی اہلکار شہید جبکہ دو زخمی بھی ہوئے ہیں۔	Y	شہید	522	    6,826	0.0271	147.2143	urd_news_2016_00012527
2657	جس میں ایک اہلکار شہید جبکہ ایک زخمی ہو گیا۔	Y	شہید	522	    6,826	0.0271	159.6667	urd_news_2016_00468650
2658	ایک سوال کے جواب میں وزیراعلیٰ سندھ نے کہا کہ اس سال 142 پولیس اہلکاروں مختلف واقعات میں شہید ہوئے ہیں۔	Y	شہید	522	    6,826	0.0271	177.0526	urd_news_2016_00134405
2659	ان خیالات کا اظہار انہوں نے سینیٹ میں اظہار خیال کے موقع پر کیا انہوں نے کہا کہ ایم کیو ایم کراچی میں سب سے زیادہ دہشت گردی کی شکار ہے اے این پی کے کارکنوں کی طرح ایم کیو ایم کے کارکنوں کو بھی شہید کیا جارہا ہے۔	Y	شہید	522	    6,826	0.0271	185.5429	urd_news_2016_00169975
2660	کارروائی میں دو سیکورٹی شہید اور تین زخمی ہوئے۔	Y	شہید	522	    6,826	0.0271	190.6667	urd_news_2016_00753733
2661	گورنر خیبرپختونخوا اُردو پوائنٹ دنیاکی سب سے بڑی اُردو ویب سائیٹ ہے، جو پچھلے 15سال سے اُردو کی خدمت میں مصروف ہے۔	Y	گورنر	523	    6,821	0.0271	144.7778	urd_news_2016_00808036
2662	اسلام آباد:اے پی سی میں وزیراعظم ، وزیر اعلیٰ اور گورنر سرحد بریفنگ دیں گے اُردو پوائنٹ دنیاکی سب سے بڑی اُردو ویب سائیٹ ہے، جو پچھلے 15سال سے اُردو کی خدمت میں مصروف ہے۔	Y	گورنر	523	    6,821	0.0271	145.6	urd_news_2016_00089038
2663	ایک سوال پر انہوں نے کہا کہ گورنر سندھ کے حوالے سے فیصلہ میاں محمد نوازشریف کو ہی کرنا ہوگا۔	Y	گورنر	523	    6,821	0.0271	148.1	urd_news_2016_00132319
2664	تقریب میں گورنر سندھ نے بھی شرکت کی۔	Y	گورنر	523	    6,821	0.0271	158.375	urd_news_2016_00434562
2665	اس بات کا فیصلہ گورنر ہاؤس میں ایک اعلیٰ سطح کے اجلاس میں کیا گیا۔	Y	گورنر	523	    6,821	0.0271	171.2857	urd_news_2016_00055933
2666	ملزم تین افراد کے قتل میں ملوث ہے۔	Y	ملوث	523	    6,821	0.0271	159.75	urd_news_2016_00895057
2667	بھارت پاکستان میں ہونے والی دہشتگردی میں ملوث ہے۔	Y	ملوث	523	    6,821	0.0271	163.5	urd_news_2016_00298570
2668	بلوچستان کراچی میں بھارت دہشتگردی میں ملوث ہے ۔	Y	ملوث	523	    6,821	0.0271	204	urd_news_2016_00331110
2669	ایران پاکستان میں ہونے والی دہشتگردی میں ملوث نہیں ۔	Y	ملوث	523	    6,821	0.0271	212.5	urd_news_2016_00042603
2670	لاہور ہائیکورٹ کا پرویز مشرف پر حملے میں ملوث ملزم کو رہا کرنے کا حکم ۔	Y	ملوث	523	    6,821	0.0271	223.8571	urd_news_2016_00814902
2671	جان شیر خان اُردو پوائنٹ دنیاکی سب سے بڑی اُردو ویب سائیٹ ہے، جو پچھلے 15سال سے اُردو کی خدمت میں مصروف ہے۔	Y	جان	524	    6,813	0.027	122.7895	urd_news_2016_00448676
2672	انہوں نے کہاکہ اس وقت ملک میں کسی کی بھی جان محفوظ نہیں ہے ۔	Y	جان	524	    6,813	0.027	131	urd_news_2016_00212032
2673	بھارت جان لے کہ کشمیری کل ان کے ساتھ تھے اور نہ ہی آج ان کے ساتھ ہیں۔	Y	جان	524	    6,813	0.027	183.8	urd_news_2016_00298899
2674	ہمارے گھر والے جان ہی نہ سکے کہ وہ کیا کچھ کر سکتا تھا۔	Y	جان	524	    6,813	0.027	190.3571	urd_news_2016_00837331
2675	وزیر اعلیٰ سندھ کا کہنا ہے کہ صوبے کے عوام نے پیپلز پارٹی کی حکومت پر اپنے اعتماد کا اظہار کیا ہے اس لئے وہ ان کی جان و مال اور آزادی کا ہر قیمت پر تحفظ کرے گی۔	Y	جان	524	    6,813	0.027	192.0294	urd_news_2016_00975083
2676	انہوں نے سوال کیا کہ کیا ان کے قائم کرنے کی قانونی طور پر اجازت ہے؟	Y	قانونی	525	    6,791	0.0269	142.4667	urd_news_2016_00203832
2677	آئی بی فنڈ کا غیر قانونی استعمال ،کیس کی سماعت آج ہو گی اُردو پوائنٹ دنیاکی سب سے بڑی اُردو ویب سائیٹ ہے، جو پچھلے 15سال سے اُردو کی خدمت میں مصروف ہے۔	Y	قانونی	525	    6,791	0.0269	162	urd_news_2016_00287682
2678	وہ کسی غیر قانونی کام میں ملوث نہیں تھے ۔	Y	قانونی	525	    6,791	0.0269	175.1111	urd_news_2016_00993696
2679	اگر کسی نے ایسا کیا تو پھر اس کے خلاف سخت قانونی کارروائی کی جائے گی۔	Y	قانونی	525	    6,791	0.0269	177.3125	urd_news_2016_00140435
2680	جسٹس آصف نے کہا کہ یہ سوال قانونی ہے اس کا تعلق کسی کے خوش ہونے یا نہ ہونے پر نہیں ہے ۔	Y	قانونی	525	    6,791	0.0269	178	urd_news_2016_00462368
2681	ڈی آئی جی آپریشن کا پریس کانفرنس سے خطاب ۔	Y	پریس	526	    6,754	0.0268	171.4444	urd_news_2016_00565154
2682	آزاد کشمیر کے سابق وزیر اعظم کا پریس کانفرنس سے خطاب ۔	Y	پریس	526	    6,754	0.0268	178.0909	urd_news_2016_00051671
2683	وہ گزشتہ روز یہاں پریس کانفرنس سے خطاب کر رہے تھے ۔	Y	پریس	526	    6,754	0.0268	184.8182	urd_news_2016_00994817
2684	سی ایم سندھ سید قائم علی شاہ کی پریس کانفرنس۔	Y	پریس	526	    6,754	0.0268	194.5	urd_news_2016_00614044
2685	بھارتی وزیر خارجہ کی پریس کانفرنس کے بعد صورتحال واضح ہوگی۔	Y	پریس	526	    6,754	0.0268	241.7273	urd_news_2016_00304644
2686	انہوں نے کہا کہ دہشت گردی کے خاتمے کیلئے آپریشن کامیابی سے جاری ہے۔	Y	کامیابی	527	    6,735	0.0267	136.7857	urd_news_2016_00234992
2687	انہوں نے کہا کہ خیبرپختونخوا میں تحریک انصاف کی کامیابی کا اعلان ہم سے بھی پہلے کر دیا گیا تھا۔	Y	کامیابی	527	    6,735	0.0267	137.25	urd_news_2016_00234046
2688	پاکستان کی تحریک پر کانفرنس کو شروع کیا گیا تھا اور اب23 سال بعد کانفرنس کا پاکستان میں انعقاد ہماری بہت بڑی کامیابی ہے۔	Y	کامیابی	527	    6,735	0.0267	142.0455	urd_news_2016_00352194
2689	ان کا کہنا تھا کہ پنجاب سے پیپلز پارٹی اور مسلم لیگ ن انتخابات میں بھرپور کامیابی حاصل کریں گے ۔	Y	کامیابی	527	    6,735	0.0267	150.6	urd_news_2016_00180139
2690	ذرائع کے مطابق کراچی آپریشن میں بڑی کامیابی مل رہی ہے۔	Y	کامیابی	527	    6,735	0.0267	156.9091	urd_news_2016_00580046
2691	انہوں نے کہا کہ اس آپریشن کے لیے پاک فوج سے مدد لینے کے لیے بھی غور ہو رہا ہے۔	Y	لینے	528	    6,714	0.0266	156.1667	urd_news_2016_00209726
2692	انہوں نے کہا کہ کراچی آپریشن تمام سیاسی جماعتوں کو اعتماد میں لینے کے شروع کیا گیا ۔	Y	لینے	528	    6,714	0.0266	161.9412	urd_news_2016_00246675
2693	انہوں نے حکومت سے نوٹس لینے اور انصاف کی فراہمی کا بھی مطالبہ کیا ۔	Y	لینے	528	    6,714	0.0266	163.0714	urd_news_2016_00201734
2694	ذرائع کے مطابق وزیراعظم نواز شریف نے دہشتگردی سے متعلق قوم کو اعتماد میں لینے کا فیصلہ کیا ہے۔	Y	لینے	528	    6,714	0.0266	165.1053	urd_news_2016_00581168
2695	اس سے قبل وزیر اعظم نواز شریف سے وزیر اعلیٰ پنجاب نے ملاقات کی ہے جس میں تحریک انصاف اور عوامی تحریک کے احتجاج پر بات چیت ہوئی ، شہباز شریف کا کہنا ہے کسی کو قانون ہاتھ میں نہیں لینے دیں گے۔	Y	لینے	528	    6,714	0.0266	167.8889	urd_news_2016_00073979
2696	وکلاء رہنما اُردو پوائنٹ دنیاکی سب سے بڑی اُردو ویب سائیٹ ہے، جو پچھلے 15سال سے اُردو کی خدمت میں مصروف ہے۔	Y	رہنما	529	    6,712	0.0266	122.4444	urd_news_2016_00993854
2697	ان کا کہنا تھا کہ مسلم لیگ نواز کے کسی رہنما نے ایسا کوئی بیان نہیں دیا ۔	Y	رہنما	529	    6,712	0.0266	143.7647	urd_news_2016_00181811
2698	پی ٹی آئی رہنما عمران اسماعیل اُردو پوائنٹ دنیاکی سب سے بڑی اُردو ویب سائیٹ ہے، جو پچھلے 15سال سے اُردو کی خدمت میں مصروف ہے۔	Y	رہنما	529	    6,712	0.0266	146.3182	urd_news_2016_00369281
2699	جس میں ملک کی تمام سیاسی جماعتوں کے رہنما شرکت کریں گے۔	Y	رہنما	529	    6,712	0.0266	160.9167	urd_news_2016_00469793
2700	ایک سوال کے جواب میں انہوں نے کہا کہ زیادہ امکان اس بات کا ہے کہ مسلم لیگ (ن )کا کوئی رہنما اس ٹیم میں نہیں لیا جائیگا۔	Y	رہنما	529	    6,712	0.0266	167.0833	urd_news_2016_00133331
2701	انہوں نے کہا ہم تعمیر کی سیاست کرتے ہیں اور عوام تعمیر کی سیاست کرنے والے کو ووٹ دیتے ہیں۔	Y	تعمیر	530	    6,708	0.0266	163	urd_news_2016_00263208
2702	انھوں نے کہا کہ کراچی کی تعمیر و ترقی میں ملک کے ہر شہری نے اپنا کردار ادا کیا ہے ۔	Y	تعمیر	530	    6,708	0.0266	167.3684	urd_news_2016_00246818
2703	بیان میں کہا گیا ہے کہ چین کی مدد سے ان بجلی گھروں پر تعمیر کا کام فوری طور پر شروع کر دیا جائے گا اور 2018 تک یہ پیداوار بھی شروع کر دیں گے۔	Y	تعمیر	530	    6,708	0.0266	168.3226	urd_news_2016_00308284
2704	مسلم لیگ (ن) کا پاکستان کی تعمیر و ترقی میں بڑا کردار ہے۔	Y	تعمیر	530	    6,708	0.0266	182.1538	urd_news_2016_00872261
2705	اس کی تعمیر سے علاقے میں ترقی کے نئے دور کا آغاز ہوگا۔	Y	تعمیر	530	    6,708	0.0266	184.7692	urd_news_2016_00080934
2706	، مولانا فضل الرحمن اُردو پوائنٹ دنیاکی سب سے بڑی اُردو ویب سائیٹ ہے، جو پچھلے 15سال سے اُردو کی خدمت میں مصروف ہے۔	Y	مولانا	531	    6,673	0.0265	154.5789	urd_news_2016_00917371
2707	مولانا امیر حسین گیلانی اُردو پوائنٹ دنیاکی سب سے بڑی اُردو ویب سائیٹ ہے، جو پچھلے 15سال سے اُردو کی خدمت میں مصروف ہے۔	Y	مولانا	531	    6,673	0.0265	159.3	urd_news_2016_00916453
2708	مولانا سید امیر حسین گیلانی اُردو پوائنٹ دنیاکی سب سے بڑی اُردو ویب سائیٹ ہے، جو پچھلے 15سال سے اُردو کی خدمت میں مصروف ہے۔	Y	مولانا	531	    6,673	0.0265	168.7619	urd_news_2016_00916649
2709	مولانا حنیف اللہ اُردو پوائنٹ دنیاکی سب سے بڑی اُردو ویب سائیٹ ہے، جو پچھلے 15سال سے اُردو کی خدمت میں مصروف ہے۔	Y	مولانا	531	    6,673	0.0265	183.6316	urd_news_2016_00916600
2710	بھارت کے نئے ہائی کمشنر کی مولانا فضل الرحمن سے ملاقات ،پاک بھارت تعلقات اور مسئلہ کشمیر پر جاری مذاکرات پر بات چیت اُردو پوائنٹ دنیاکی سب سے بڑی اُردو ویب سائیٹ ہے، جو پچھلے 15سال سے اُردو کی خدمت میں مصروف ہے۔	Y	مولانا	531	    6,673	0.0265	198.4286	urd_news_2016_00302030
2711	خواجہ آصف نے کہا کہ میں عدالت کے ساتھ ہوں کہ کوئی قانون سے بڑا نہیں۔	Y	خواجہ	532	    6,664	0.0264	159.6667	urd_news_2016_00532255
2712	اس موقع پر وفاقی وزیر پانی و بجلی خواجہ محمد آصف بھی موجود تھے۔	Y	خواجہ	532	    6,664	0.0264	164.3571	urd_news_2016_00109479
2713	اسلام آباد، وزیر دفاع خواجہ آصف قومی اسمبلی اجلاس کے بعد میڈیا سے گفتگو کر رہے ہیں۔	Y	خواجہ	532	    6,664	0.0264	166.0588	urd_news_2016_00093595
2714	حکومت سندھ کی جانب سے تعلیمی اداروں کی سکیورٹی کے لیے کوئی اقدامات نہیں کیے گئے ہیں،خواجہ اظہار الحسن اُردو پوائنٹ دنیاکی سب سے بڑی اُردو ویب سائیٹ ہے، جو پچھلے 15سال سے اُردو کی خدمت میں مصروف ہے۔	Y	خواجہ	532	    6,664	0.0264	175.7576	urd_news_2016_00518244
2715	خواجہ آصف نے کہا کہ افغانستان کو ثابت کرنا ہوگا کہ وہ دہشت گردی کے خلاف ہے۔	Y	خواجہ	532	    6,664	0.0264	178.75	urd_news_2016_00532207
2716	گورنر نے کہا کہ یہ بات ان کے لئے اعزاز ہے کہ وہ آئی سی سی آئی کے رکن رہے ہیں اور انہوں نے اس کی بہتری میں بھر پور حصہ لیا ہے۔	Y	پور	533	    6,660	0.0264	179.037	urd_news_2016_00809116
2717	انہوں نے کہا کہ اس منصوبے کیلئے بھر پور وسائل فراہم کئے جا رہے ہیں۔	Y	پور	533	    6,660	0.0264	184.1333	urd_news_2016_00211577
2718	اس کا علاج ہم سب نے اپنی اپنی سطح پر بھر پور کردار ادا کرتے ہوئے کرنا ہے ۔	Y	پور	533	    6,660	0.0264	186.1765	urd_news_2016_00080188
2719	اور تبدیلی کے لئے پاکستان تحریک انصاف کا بھر پور ساتھ دیں۔	Y	پور	533	    6,660	0.0264	187.0833	urd_news_2016_00275498
2720	سی ٹی او نے کہا کہ اس مہم کو بھر پور طریقے سے جاری رکھا جائے گا ۔	Y	پور	533	    6,660	0.0264	192.7647	urd_news_2016_00624887
2721	میں اب بھی ن لیگ کا رکن ہوں ۔	Y	رکن	534	    6,658	0.0264	146.625	urd_news_2016_00908643
2722	وہ 1970میں پاکستان پیپلزپارٹی کے رکن سندھ اسمبلی بھی رہے ۔	Y	رکن	534	    6,658	0.0264	151.9	urd_news_2016_00940885
2723	انہوں نے ارکان اسمبلی سے کہا کہ وہ ایک کمیٹی تشکیل دیں ،جس میں ہر سیاسی جماعت کا ایک رکن ہو ۔	Y	رکن	534	    6,658	0.0264	164.35	urd_news_2016_00192419
2724	اس لئے آپ سب دوسری پارٹی کے رکن ہو.	Y	رکن	534	    6,658	0.0264	170	urd_news_2016_00095276
2725	کم اخراجات کے پیش نظر صرف چیف الیکشن کمشنر اور ایک رکن کوئٹہ گئے اُردو پوائنٹ دنیاکی سب سے بڑی اُردو ویب سائیٹ ہے، جو پچھلے 15سال سے اُردو کی خدمت میں مصروف ہے۔	Y	رکن	534	    6,658	0.0264	174.7667	urd_news_2016_00781660
2726	ٹیسٹ سیریز کیلئے ٹیم کا اعلان بعد میں کیا جائے گا۔	Y	ٹیسٹ	535	    6,656	0.0264	166.1818	urd_news_2016_00443048
2727	انہیں ڈی این اے ٹیسٹ کے بعد اس کے والدین کے حوالے کر دیا جائے گا ۔	Y	ٹیسٹ	535	    6,656	0.0264	201.0714	urd_news_2016_00190151
2728	سری لنکا کیخلاف پہلے ٹیسٹ میں کامیابی پر چیئرمین پی سی بی کی قومی ٹیم کو مبارکباد اُردو پوائنٹ دنیاکی سب سے بڑی اُردو ویب سائیٹ ہے، جو پچھلے 15سال سے اُردو کی خدمت میں مصروف ہے۔	Y	ٹیسٹ	535	    6,656	0.0264	207.5161	urd_news_2016_00633266
2729	ان کا کہنا تھا کہ ٹیسٹ کرکٹ میں یونس نے جو کچھ حاصل کیا ہے اس کو میں بھی حاصل کرنا چاہتا ہوں۔	Y	ٹیسٹ	535	    6,656	0.0264	217.9048	urd_news_2016_00180271
2730	انہوں نے کہا کہ متاثرہ خاندان کو انصاف کی فراہمی یقینی بنانے کے لئے ڈی این اے ٹیسٹ سمیت تمام اقدامات کئے جائیں گے ۔	Y	ٹیسٹ	535	    6,656	0.0264	221.9583	urd_news_2016_00251616
2731	علاقے میں فورسز کی جانب سے فائرنگ کا سلسلہ جاری ہے ۔	Y	فورسز	536	    6,655	0.0264	169.0909	urd_news_2016_00706850
2732	سیکورٹی فورسز کے ملک بھر میں دہشت گردوں کے خلاف آپریشن میں مزید تیز ی اُردو پوائنٹ دنیاکی سب سے بڑی اُردو ویب سائیٹ ہے، جو پچھلے 15سال سے اُردو کی خدمت میں مصروف ہے۔	Y	فورسز	536	    6,655	0.0264	172.3929	urd_news_2016_00641921
2733	تحریک انصاف کی طرف سے کالعدم تحریک طالبان پاکستان کی مذمت، فورسز کی حمایت کا اعلان اُردو پوائنٹ دنیاکی سب سے بڑی اُردو ویب سائیٹ ہے، جو پچھلے 15سال سے اُردو کی خدمت میں مصروف ہے۔	Y	فورسز	536	    6,655	0.0264	178.9259	urd_news_2016_00413161
2734	وزیر اعظم نے کہا کہ اب پھر راولپنڈی اور لاہور میں فورسز کو نشانہ بنایا گیا ہے۔	Y	فورسز	536	    6,655	0.0264	186.6471	urd_news_2016_00969465
2735	پاکستان کی سیکورٹی فورسز کا دہشت گردی کے خلاف جنگ میں سب سے زیادہ نقصان ہوا ہے اور عام شہری بھی متاثر ہوئے ہیں۔	Y	فورسز	536	    6,655	0.0264	193.0833	urd_news_2016_00353500
2736	عمران خان کانفرنس میں پاک بھارت تعلقات پر خطاب کریں گے.	Y	تعلقات	537	    6,648	0.0264	149.0909	urd_news_2016_00712400
2737	آرمی چیف نے کہا کہ افغانستان کے ساتھ ہمارے تعلقات بہتر ہو رہے ہیں۔	Y	تعلقات	537	    6,648	0.0264	175.7857	urd_news_2016_00049813
2738	مسئلہ کشمیر کے حل تک بھارت سے تمام تعلقات ختم کئے جائیں۔	Y	تعلقات	537	    6,648	0.0264	185.5833	urd_news_2016_00874001
2739	دونوں ممالک کے درمیان تعلقات مزید بہتر ہوں گے۔	Y	تعلقات	537	    6,648	0.0264	229.4444	urd_news_2016_00560142
2740	آرمی چیف کا دورہ اور پاک سعودی تعلقات۔	Y	تعلقات	537	    6,648	0.0264	240.625	urd_news_2016_00049374
2741	کراچی پولیس چیف کا کہنا ہے کہ اہلکار کے خلاف سخت کارروائی کی جائے گی ۔	Y	اہلکار	538	    6,645	0.0264	117.7333	urd_news_2016_00764122
2742	ہلاک ہونے والوں میں 4پولیس اہلکار بھی شامل ہیں۔	Y	اہلکار	538	    6,645	0.0264	163.8889	urd_news_2016_00812462
2743	کراچی میں فائرنگ، پولیس اہلکار سمیت 5 افراد جاں بحق ۔	Y	اہلکار	538	    6,645	0.0264	174.3333	urd_news_2016_00771680
2744	تین اہلکار جاں بحق جبکہ 6 شدید زخمی ہو گئے۔	Y	اہلکار	538	    6,645	0.0264	201.6667	urd_news_2016_00437559
2745	دھماکے میں ایک اہلکار جاں بحق ‘ پانچ زخمی ہوگئے۔	Y	اہلکار	538	    6,645	0.0264	265.6667	urd_news_2016_00548565
2746	ذرائع کا کہنا ہے کہ وزیراعظم نواز شریف اور آرمی چیف جنرل راحیل شریف کے درمیان ملاقات میں انتہائی اہم امور پر بات چیت کی گئی ہے اور اس حوالے سے وزیر اعظم قوم سے خطاب میں آگاہ کریں گے۔	Y	امور	539	    6,623	0.0263	172.6857	urd_news_2016_00576548
2747	وفاقی وزیر برائے امور کشمیر نے بتایا کہ کشمیر کے صدر اور وزیراعظم کو اس حوالے سے کام کرنا چاہئے انہیں مکمل اختیارات حاصل ہیں۔	Y	امور	539	    6,623	0.0263	175.1667	urd_news_2016_00988612
2748	ملکی سیاسی صورت حال سمیت دیگر اہم امور پر تبادلہ خیال اُردو پوائنٹ دنیاکی سب سے بڑی اُردو ویب سائیٹ ہے، جو پچھلے 15سال سے اُردو کی خدمت میں مصروف ہے۔	Y	امور	539	    6,623	0.0263	178.1111	urd_news_2016_00897500
2749	وزیر اعظم سے مسلم لیگ(ن) خیبرپختونخوا کے وفد کی ملاقات ‘سیاسی امور پر تبادلہ خیال اُردو پوائنٹ دنیاکی سب سے بڑی اُردو ویب سائیٹ ہے، جو پچھلے 15سال سے اُردو کی خدمت میں مصروف ہے۔	Y	امور	539	    6,623	0.0263	182.5333	urd_news_2016_00962808
2750	انہوں نے کہا کہ افغانستان کے حوالے سے پاکستان اور امریکا کے درمیان اہم امور پر بات چیت جاری ہے۔	Y	امور	539	    6,623	0.0263	183.8947	urd_news_2016_00212665
2751	جبکہ جبکہ زخمی کو ہسپتال منتقل کردیا گیا ہے ۔	Y	منتقل	540	    6,620	0.0263	170.5	urd_news_2016_00455142
2752	جاں بحق اور زخمی ہونے والوں کو ہسپتال منتقل کردیا گیا ۔	Y	منتقل	540	    6,620	0.0263	194.9091	urd_news_2016_00449374
2753	سندھ ہائیکورٹ نے مشرف کی ای سی ایل میں نام درج ہونے کیخلاف درخواست چیف جسٹس سندھ ہائیکورٹ کو منتقل کر دی ۔	Y	منتقل	540	    6,620	0.0263	200.1	urd_news_2016_00653329
2754	عمران خان 15 روز بعد ہسپتال سے گھر منتقل ۔	Y	منتقل	540	    6,620	0.0263	200.75	urd_news_2016_00709697
2755	دو روز قبل مقدمہ واپس اسی عدالت میں منتقل ہوا۔	Y	منتقل	540	    6,620	0.0263	272.5	urd_news_2016_00552053
2756	فیصلہ آنے تک بل کو منظور نہ کیا جائے.	Y	بل	541	    6,586	0.0261	187.8889	urd_news_2016_00731939
