ORDER	SENTENCE	STATUS	WORD	RANK	COUNT	COUNT_REL	INDEX	ID
24200	علمائے کرام نے امت مسلمہ پر زور دیا کہ باہمی اختلافات اور فرقہ واریت سے باہر نکل کر متحد اور متفق ہو کر خلافت کے قیام اور حرمین شریفین کو اپنا حقیقی مرکز بنانے کیلئے اپنا کردار ادا کریں۔	Y	خلافت	2680	      414	0.0016	998.8	urd_news_2016_00708986
24201	اس سمٹ سے پاکستان اور چین کے درمیان بزنس سے بزنس کی سطح پر تعلقات کو مضبوط کرنے میں مدد ملے گی۔	Y	سمٹ	2680	      414	0.0016	395.6	urd_news_2016_00071423
24202	انہوں نے کہا کہ نومبر میں سارک سمٹ ہو رہی ہے جس دوران تمام ممالک کو غربت کے بجائے ترقی پر توجہ مرکوز کرنے کی ضرورت ہے۔	Y	سمٹ	2680	      414	0.0016	484.8462	urd_news_2016_00260375
24203	کچھ عرصے بعد یہ تعلق فون تک سمٹ گیا۔	Y	سمٹ	2680	      414	0.0016	638.3333	urd_news_2016_00760841
24204	تین روزہ یوتھ سمٹ میں ملک بھر سے سینکڑوں طلباء و طالبات نے شرکت کی۔	Y	سمٹ	2680	      414	0.0016	670.3333	urd_news_2016_00437933
24205	نیو کلیئر سمٹ میں وزیراعظم اپنے ایٹمی اثاثوں کی حفاظت کے لئے پالیسی بیان دیں گے ۔	Y	سمٹ	2680	      414	0.0016	863.3125	urd_news_2016_00938707
24206	کترینہ کیف کا سلمان خان کے ساتھ کام کرنے سے انکار کترینہ کیف کا سلمان خان کے ساتھ کام کرنے سے انکار ممبئی( اُردو پوائنٹ تازہ ترین اخبار۔	Y	کیف	2680	      414	0.0016	570.1765	urd_news_2016_00759742
24207	ان میں سر فہرست کترینہ کیف اور سلمان خان ہیں۔	Y	کیف	2680	      414	0.0016	836.4	urd_news_2016_00188968
24208	کترینہ کیف اپنی سالگرہ کے دن سوشل میڈیا پر انٹری دیں گی ۔	Y	کیف	2680	      414	0.0016	977.9167	urd_news_2016_00759711
24209	اداکار سیف علی خان اور کترینہ کیف فلم ”ریس “میں اداکاری کرینگے۔	Y	کیف	2680	      414	0.0016	1171.0833	urd_news_2016_00035742
24210	نوجوان نسل کی پسندیدہ اداکارہ ”کترینہ کیف“۔	Y	کیف	2680	      414	0.0016	1574	urd_news_2016_00937056
24211	ایڈیشنل سیکرٹری نے بتایا کہ ہم جو آٹا دیتے ہیں اس سے لوگوں کو دس روپے کا فائدہ حاصل ہوتا ہے۔	Y	آٹا	2681	      413	0.0016	375.381	urd_news_2016_00041555
24212	انہوں نے کہاکہ حکومت کی جانب سے سستا آٹا کی فراہمی سے غریب افراد کو کم قیمت پر آٹا مل سکے گا اور اس پیکج سے رمضان المبارک میں زیادہ سے زیادہ لوگ مستفید ہوں گے۔	Y	آٹا	2681	      413	0.0016	569.1	urd_news_2016_00233042
24213	حکومت کی جانب سے انہیں صرف 40کلو آٹا پہلے ملتا تھا مگر مظلوم لوگوں سے یہ سہولت بھی چھین لی گئی ہے۔	Y	آٹا	2681	      413	0.0016	673.7143	urd_news_2016_00519365
24214	دسمبر سے اب تک فی کلو آٹا چھ سے سات روپے مہنگا ہوچکا ہے۔	Y	آٹا	2681	      413	0.0016	860.0769	urd_news_2016_00542531
24215	ہم پانچ ضروری اشیاء آٹا، دال ، چینی، چائے اور چاول پر سبسڈی دیں گے۔	Y	آٹا	2681	      413	0.0016	1120.5	urd_news_2016_00843227
24216	پیر کو یہاں صحافیوں سے گفتگو کرتے ہوئے انہوں نے کہا کہ پاکستان کے عوام لوڈ شیڈنگ، بے روزگاری، غربت اور دہشتگردی کے ہاتھوں پہلے ہی تنگ تھے تو ایسے میں تحریک انصا ف نے ایک اور سیاسی بحران کی بنیاد رکھنے کی کوشش کی۔	Y	انصا	2681	      413	0.0016	514.35	urd_news_2016_00375049
24217	بھارتی وزیر اعظم کیخلاف اندراج مقدمہ کی درخواست پر ہائیکورٹ آفس کا اعتراض برقرار افغان صدر کے بیان پر واضح رائے رکھتے ہیں، پہلے مہاجرین کو واپس لیا جائے ،خواجہ آصف ن لیگ کی حکو مت کو تحریک انصا ف کا راستہ روکنا مہنگا پڑے گا۔	Y	انصا	2681	      413	0.0016	717.0476	urd_news_2016_00304512
24218	میگا کرپشن کیس میں سابق سیکرٹری خزانہ بلوچستان مشتاق رئیسانی اور ندیم اقبال احتساب عدالت میں پیش ،مزید ریمانڈ پر نیب کے حوالے ن لیگ کی حکو مت کو تحریک انصا ف کا راستہ روکنا مہنگا پڑے گا۔	Y	انصا	2681	      413	0.0016	807.9459	urd_news_2016_00888577
24219	بلوچستان میگا کرپشن کیس میں گرفتار مشتاق رئیسانی 10 روزہ ریمانڈ پر نیب کے حوالے ن لیگ کی حکو مت کو تحریک انصا ف کا راستہ روکنا مہنگا پڑے گا۔	Y	انصا	2681	      413	0.0016	891.6897	urd_news_2016_00331663
24220	بھارتی سیکیورٹی فورسز کا نامعلوم بھارتی ہندو باشندے کی نعش کی وصولی سے انکار ن لیگ کی حکو مت کو تحریک انصا ف کا راستہ روکنا مہنگا پڑے گا۔	Y	انصا	2681	      413	0.0016	1144.16	urd_news_2016_00299766
24221	مسلم لیگ نواز وزیر اعظم کی تقریب حلف برداری میں شریک نہیں ہو گی اُردو پوائنٹ دنیاکی سب سے بڑی اُردو ویب سائیٹ ہے، جو پچھلے 15سال سے اُردو کی خدمت میں مصروف ہے۔	Y	برداری	2681	      413	0.0016	246.8571	urd_news_2016_00873397
24222	حلف برداری کی تقریب ایوان صدر اسلام آباد میں ہوئی۔	Y	برداری	2681	      413	0.0016	545.5	urd_news_2016_00522582
24223	انصاف کی فراہمی مسائل کا حل ہے، چیف جسٹس، سوات کے جج گھر بیٹھے ہیں، ہم پر جنگ مسلط ہے، سکھر میں ہائی کورٹ بار کے عہدیداران کی تقریب حلف برداری میں وکلاء سے خطاب ۔	Y	برداری	2681	      413	0.0016	604.0323	urd_news_2016_00177379
24224	اس حلف برداری کی تقریب میں بی جے پی کے نامور قائدین ‘اور کارکنوں نے شرکت کی۔	Y	برداری	2681	      413	0.0016	684.625	urd_news_2016_00063113
24225	خیرپور یوتھ کونسل کی تقریب حلف برداری کا انعقاد ۔	Y	برداری	2681	      413	0.0016	1099.8889	urd_news_2016_00529513
24226	چیئرپرسن بی آئی ایس پی بورڈ کی سربراہ جبکہ سیکرٹری بی آئی ایس پی بورڈ کے سیکرٹری کے طور پر کام کرتے ہیں۔	Y	چیئرپرسن	2681	      413	0.0016	302.5625	urd_news_2016_00502736
24227	قومی کمیشن برائے حیثیت خواتین کی چیئرپرسن کی تقرری کے لئے پارلیمانی کمیٹی کا اجلاس 5 اکتوبر کو طلب بھارت کا پاکستان کے لیے فضائی حدود بند کرنے پر غور۔	Y	چیئرپرسن	2681	      413	0.0016	503.2692	urd_news_2016_00751408
24228	جبکہ پیپلز پارٹی کی چیئرپرسن بینظیر بھٹو نے کہا کہ ان کی جماعت ایک آئینی پٹیشن دائر کرے گی کہ آیا کہ جنرل مشرف صدارتی الیکشن لڑ سکتے ہیں یا نہیں۔	Y	چیئرپرسن	2681	      413	0.0016	584.75	urd_news_2016_00454686
24229	کمیٹی کو بے نظیر انکم سپورٹ پروگرام کی چیئرپرسن ماروی میمن نے گزشتہ سال کمیٹی کی جانب سے پروگرام کے حوالے سے دی گئی سفارشات پر بریفنگ دی۔	Y	چیئرپرسن	2681	      413	0.0016	718.9565	urd_news_2016_00783498
24230	پیپلزپارٹی کی چیئرپرسن بینظیر بھٹو سے سفارت کاروں کی ملاقاتیں ۔	Y	چیئرپرسن	2681	      413	0.0016	1224.5556	urd_news_2016_00367089
24231	ایک سوال کے جواب میں انہوں نے کہا کہ وہ سید ہیں اور انہیں اللہ کی ذات پر یقین ہے۔	Y	ذات	2681	      413	0.0016	249.95	urd_news_2016_00133787
24232	ذات برادری کی بنیاد پر ووٹ دینے کی سب سے زیادہ شرح پنجاب میں ہے۔	Y	ذات	2681	      413	0.0016	461.5	urd_news_2016_00573693
24233	اپنی ذات کی قربانی دینے کو کوئی تیار نہیں۔	Y	ذات	2681	      413	0.0016	543.5556	urd_news_2016_00014786
24234	اس لیے ذات حق نے فرمایا میں صبر کرنے والوں کے ساتھ ہوں ۔	Y	ذات	2681	      413	0.0016	668	urd_news_2016_00096437
24235	میری ذات ، میرے محکمے اور افسران کے خلاف نفرت انگیز مہم چلائی گئی ۔	Y	ذات	2681	      413	0.0016	1083.3846	urd_news_2016_00864149
24236	آپریشن سست ہونے کے بارے میں ان کا کہنا تھا کہ اس کی وجہ یہ ہے کہ ہم چاہتے تھے کہ بڑا نقصان نہ ہو ۔	Y	سست	2681	      413	0.0016	247.3913	urd_news_2016_00012156
24237	اس کے ساتھ جی ٹی روڈ پر ٹریفک انتہائی سست روی کا شکار ہے ۔	Y	سست	2681	      413	0.0016	567.4286	urd_news_2016_00084591
24238	پاکستان میں دہشت گرد تنظیموں کے اثاثے ضبط کرنے کی مہم سست ہے ، امریکی محکمہ خارجہ ۔	Y	سست	2681	      413	0.0016	684.875	urd_news_2016_00358705
24239	اداکارہ ثناء کام کی رفتار سست ہو سکتی ہے مگر فلمی صنعت کبھی ختم نہیں ہو سکتی ۔	Y	سست	2681	      413	0.0016	840.7333	urd_news_2016_00035473
24240	ایجوکیشن یونیورسٹی لوئر مال میں تعمیراتی کاموں میں سست روی سے طلباء پریشان ۔	Y	سست	2681	      413	0.0016	1493.1667	urd_news_2016_00031437
24241	بتایا گیا ہے کہ پہلے اس فلم میں کرینہ کو کاسٹ کیا گیا تھا ۔	Y	کرینہ	2681	      413	0.0016	430.0769	urd_news_2016_00309859
24242	معلوم نہیں لوگوں کو میرا اور شاہد کا ایک ساتھ کام کرنا عجیب کیوں لگ رہا ہے، کرینہ کپور ۔	Y	کرینہ	2681	      413	0.0016	672.3684	urd_news_2016_00882537
24243	اداکار سیف علی اور کرینہ کپور نئے کردار میں میں ایک بار پھر عشق کرنا چاہتا ہوں۔	Y	کرینہ	2681	      413	0.0016	809.875	urd_news_2016_00035741
24244	شاہد کپور چھٹی والے دن مجھے اور کرینہ کو گھر پر رہنا اچھا لگتا ہے ۔	Y	کرینہ	2681	      413	0.0016	936.6	urd_news_2016_00661641
24245	کرینہ کپور جیسی اداکارہ بننا چاہتی ہوں۔	Y	کرینہ	2681	      413	0.0016	1570.4286	urd_news_2016_00775538
24246	ایسے میں عدالتوں کے لیے فیصلہ کرنا مشکل ہے کہ کسے بجلی فراہم کریں اور کس کو نہ کریں ۔	Y	کسے	2681	      413	0.0016	415.6111	urd_news_2016_00113927
24247	پنجاب پولیس نے ماڈل قندیل بلوچ کے قتل کے مقدمے میں مقامی مذہبی رہنماء مفتی عبدالقوی کو نامزد کردیا سیالکوٹ میں سی ٹی ڈی نے کارروائی کرکے کالعدم تنظیم کا اہم رکن عزت اللہ کو گرفتار کرلیا قوم کو لوڈشیڈنگ سے نجات دلانے کی فکر مجھ سے زیادہ کسے ہوگی؟	Y	کسے	2681	      413	0.0016	686.5	urd_news_2016_00389730
24248	ترجمان ایف سی اقتصادی راہداری کے نتیجے میں پاکستان میں ملازمتوں کے 8 لاکھ نئے مواقع پیدا ہوں گے ، قوم کو لوڈشیڈنگ سے نجات دلانے کی فکر مجھ سے زیادہ کسے ہوگی؟	Y	کسے	2681	      413	0.0016	738.1786	urd_news_2016_00416944
24249	پاکستان تحریک انصاف کا پندرہ اگست کو وزیراعظم کیخلاف ریفرنس دائر کرنیکا اعلان قوم کو لوڈشیڈنگ سے نجات دلانے کی فکر مجھ سے زیادہ کسے ہوگی؟	Y	کسے	2681	      413	0.0016	795.5	urd_news_2016_00346556
24250	قومی اسمبلی میں لیجنڈ کرکٹر حنیف محمد کی وفات پر فاتحہ خوانی کرائی گئی قوم کو لوڈشیڈنگ سے نجات دلانے کی فکر مجھ سے زیادہ کسے ہوگی؟	Y	کسے	2681	      413	0.0016	1028.72	urd_news_2016_00748841
24251	ان کا کہنا تھا کہ ’میں ایک بے اختیار وزیر ہوں اور صحت ویسے بھی صوبائی معاملہ ہے‘۔	Y	ویسے	2681	      413	0.0016	282.9444	urd_news_2016_00181969
24252	لیکن ویسے بھی اسے کوئی بھی اس طرح ہی یاد رکھے گا کہ میں نے غلطی کی تھی.	Y	ویسے	2681	      413	0.0016	454.4118	urd_news_2016_00828169
24253	احتجاج ویسے بھی جمہوریت کا حسن اور شہریوں کا حق ہے۔	Y	ویسے	2681	      413	0.0016	565.4	urd_news_2016_00032415
24254	ویسے بھی سیاست میں کچھ دو کچھ لو ہوتا ہے۔	Y	ویسے	2681	      413	0.0016	679.3333	urd_news_2016_00985012
24255	ویسے بعد میں ریاستی کانگریس نے اس ٹویٹ کو ہٹا دیا۔	Y	ویسے	2681	      413	0.0016	1040.5455	urd_news_2016_00985019
24256	وزیراعظم نواز شریف سے ترک صدر طیب اردگان کی ملاقات یہ صفحہ موبائل سائیٹ پر دیکھیں اُردو پوائنٹ دنیاکی سب سے بڑی اُردو ویب سائیٹ ہے، جو پچھلے 15سال سے اُردو کی خدمت میں مصروف ہے۔	Y	اردگان	2682	      412	0.0016	424.4483	urd_news_2016_00966634
24257	بلاول بھٹو اسلام آباد ایئرپورٹ کی تکمیل پھر تاخیر کا شکار جماعت اسلامی کی ترکی میں فوجی بغاوت ناکام بنانے پر طیب اردگان اور ترک عوام کو مبارکباد ترک عوام نے ثابت کیا کہ عوام جمہوریت کو مذاق نہیں بننے دے سکتی۔	Y	اردگان	2682	      412	0.0016	597.3784	urd_news_2016_00326774
24258	گرین ٹاؤن میں معمولی جھگڑا دو افراد کی جان لے گیا، کشیدہ صورتحال کے باعث پولیس کی بھاری نفری تعینات جماعت اسلامی کی ترکی میں فوجی بغاوت ناکام بنانے پر طیب اردگان اور ترک عوام کو مبارکباد ترکی میں بغاوت ناکام ہوئی ، عوام نے جمہوریت کا ساتھ دیا۔	Y	اردگان	2682	      412	0.0016	663.675	urd_news_2016_00800198
24259	اپنے دورے میں نواز شریف امریکی وزیر خارجہ جان کیری' ترکی کے صدر طیب اردگان ' چین ' جاپان اور نیوزی لینڈ کے وزراء اعظم اور سعودی عرب کے ولی عہد سے ملاقات کریں گے۔	Y	اردگان	2682	      412	0.0016	726.8333	urd_news_2016_00017953
24260	امور مملکت سنبھالنے پر شاہ سلمان کی اردگان کو مبارکباد http://sonews.	Y	اردگان	2682	      412	0.0016	1062.8333	urd_news_2016_00161690
24261	ایف آئی اے اور ملزم کے وکلا نے عدالت کو درخواست دی کہ ملزم شدید بیمار ہے۔	Y	بیمار	2682	      412	0.0016	360.3125	urd_news_2016_00119853
24262	اس موقع پر جسٹس خواجہ فیاض کا کہنا تھا کہ اگر وہ اتنے ہی شدید بیمار تھے تو انہیں یہ عہدہ قبول ہی نہیں کرنا چاہیے تھا ۔	Y	بیمار	2682	      412	0.0016	528.24	urd_news_2016_00103071
24263	صدر پاکستان نے ضرورت مند اور بیمار فنکاروں کی امداد کیلئے 20کروڑ روپے کی امداد مختص کردی ۔	Y	بیمار	2682	      412	0.0016	651.4667	urd_news_2016_00677866
24264	پاک آرمی کے آفیسرز اور جوانوں نے متاثرہ علاقوں میں بیمار افراد کو طبی سہولیات اور ادویات بھی فراہم کیں۔	Y	بیمار	2682	      412	0.0016	748.5789	urd_news_2016_00340533
24265	اداکار حبیب طویل عرصے سے بیمار تھے۔	Y	بیمار	2682	      412	0.0016	1241.5714	urd_news_2016_00035546
24266	انہوں نے کہا کہ انہیں حق پرستی کی سزا دی گئی ہے۔	Y	پرستی	2682	      412	0.0016	357.3333	urd_news_2016_00217021
24267	ان کوششوں نے اب صوبہ پرستی کو ہوا دینے کی صورت اختیار کر لی ہے۔	Y	پرستی	2682	      412	0.0016	448.8	urd_news_2016_00185019
24268	شخصیت پرستی کی سیاست کو عوام کئی بار مسترد کر چکی ہے۔	Y	پرستی	2682	      412	0.0016	623.1667	urd_news_2016_00666047
24269	پاکستان سے محبت وطن پرستی نہیں بلکہ نظریہ اور دین پرستی ہے۔	Y	پرستی	2682	      412	0.0016	775.1818	urd_news_2016_00349847
24270	کرن جوہر ہم جنس پرستی کے الزام پر برہم ۔	Y	پرستی	2682	      412	0.0016	1374.8889	urd_news_2016_00775417
24271	جس سے شہر کے مختلف علاقوں میں فائرنگ سے ایک شخص ہلاک اور ایک درجن سے زائد زخمی ہو گئے۔	Y	درجن	2682	      412	0.0016	292.7647	urd_news_2016_00464801
24272	ذرائع کا کہنا تھا کہ ان حملوں میں تین درجن سے زائد عسکریت پسندوں کے مارے جانے کی اطلاعات ہیں جن میں تین اہم کمانڈر بھی شامل ہیں۔	Y	درجن	2682	      412	0.0016	466.28	urd_news_2016_00575784
24273	احسن اقبال کا مزید کہنا تھا کہ ان چند درجن منصوبوں میں گوادر ایئرپورٹ، گوادر ایکسپریس وے، پانی، توانائی، ریلوے اور اس جیسے کئی ترقیاتی منصوبے شامل ہیں۔	Y	درجن	2682	      412	0.0016	620.8889	urd_news_2016_00032830
24274	شمالی وزیرستان میں خاندانوں کے ہاں بچوں کی تعداد ایک درجن سے زائد ہونا معمول ہے،انکشاف ۔	Y	درجن	2682	      412	0.0016	767.0588	urd_news_2016_00673405
24275	ہڑتال کے باعث ڈیڑھ درجن پروازیں منسوخ ۔	Y	درجن	2682	      412	0.0016	1417.8571	urd_news_2016_00603825
24276	دوسری جانب ڈی آئی جی ویسٹ فیروز شاہ نے واقعہ کی تحقیقات کے لیے ایک خصوصی کمیٹی بھی تشکیل دے دی ہے۔	Y	فیروز	2682	      412	0.0016	352.1364	urd_news_2016_00554395
24277	واضح رہے کہ گزشتہ برس بھارتی اداکار فیروز خان نے پاکستان اور مسلمانوں کے خلاف لاہور میں جو تقریر کی تھی اس کے بعد بھارتی فنکاروں کی آمد بارے سختی کر دی گئی تھی ۔	Y	فیروز	2682	      412	0.0016	481.3333	urd_news_2016_00946525
24278	جس پر اہل علاقہ نے بچی کی لاش کو سڑک پر رکھ کر انتظامیہ کے خلاف زبردست احتجاج کیا اور فیروز پور روڈ کو آگ لگا کر بند کر دیا۔	Y	فیروز	2682	      412	0.0016	608.1538	urd_news_2016_00461051
24279	صدر نے رشید جونیئر کو نیشنل سلیکشن کمیٹی کا چیئرمین بنایا اور اس کمیٹی کے ممبران میں وسیم فیروز ، فرحت خان ، سعید خان اور شہباز جونیئر شامل ہیں ۔	Y	فیروز	2682	      412	0.0016	653.1667	urd_news_2016_00681224
24280	انہوں نے کہا کہ انوار فیروز صحافت کے بادشاہ تھے۔	Y	فیروز	2682	      412	0.0016	1055	urd_news_2016_00217062
24281	صدر مملکت نے قومی اسمبلی کا اجلاس 8اگست کو طلب کرلیا قندیل بلوچ قتل کیس میں شامل تفتیش کیا جانا مضحکہ خیز ہے۔	Y	مضحکہ	2682	      412	0.0016	415.1304	urd_news_2016_00680384
24282	عمران خان جمہوری نظام کے خاتمہ کیلئے ہر کوشش کرچکے مگر عوام نے ان کا ساتھ نہیں دیا‘ رانا بابر حسین بچوں کی فٹ بال ٹیم میں3جعلی کھلاڑیوں کا انکشاف قندیل بلوچ قتل کیس میں شامل تفتیش کیا جانا مضحکہ خیز ہے۔	Y	مضحکہ	2682	      412	0.0016	508.1463	urd_news_2016_00710817
24283	قندیل بلوچ کے قتل میں مفتی عبد القوی ملوث ہے، والدہ کا الزام بنوں میں نامعلوم افراد نے فائرنگ کرکے سب انسپکٹر کو قتل کردیا اور فرار ہوگئے قندیل بلوچ قتل کیس میں شامل تفتیش کیا جانا مضحکہ خیز ہے۔	Y	مضحکہ	2682	      412	0.0016	591.3939	urd_news_2016_00746471
24284	ایم کیو ایم رہنماؤں کے خلاف درج مقدمات مضحکہ خیز ہیں۔	Y	مضحکہ	2682	      412	0.0016	687.9	urd_news_2016_00159525
24285	طاہر القادری کے مطالبات مضحکہ خیز ہیں، قمر زمان کائرہ ۔	Y	مضحکہ	2682	      412	0.0016	1323.9	urd_news_2016_00690020
24286	ایک سوال کے جواب میں انہوں نے کہا کہ پاکستان مسلم لیگ ایم ایم اے کے ساتھ استعفوں کے اعلان کے بعد اس کے ساتھ کوئی رابطہ نہیں کرے گی۔	Y	استعفوں	2683	      411	0.0016	220.6667	urd_news_2016_00133109
24287	ملاقات میں ایم کیو ایم کے استعفوں پر تبادلہ خیال کیا گیا.	Y	استعفوں	2683	      411	0.0016	413.1818	urd_news_2016_00890878
24288	جمعہ کو چیف جسٹس آف پاکستان جسٹس انور ظہیر جمالی کی سربراہی میں سپریم کورٹ کے تین رکنی بینچ نے پاکستان مسلم لیگ (ن) کے رہنما ظفر علی شاہ کی پی ٹی آئی اور ایم کیو ایم کے استعفوں کے حوالے سے درخواست کی سماعت کی۔	Y	استعفوں	2683	      411	0.0016	504.8919	urd_news_2016_00476851
24289	ایم ایم اے کی طرف سے استعفوں کا فیصلہ موخر کر نے پر خوشی ہوئی ، مجلس عمل کو اپنا موقف اسمبلی کے فلور پر پیش کر نا چاہیے ، چوہدری شجاعت ۔	Y	استعفوں	2683	      411	0.0016	593.8148	urd_news_2016_00151214
24290	ساجد احمد اور شیخ صلاح الدین نے 22 ارکان کے استعفوں کی واپسی کی درخواست قائم مقام اسپیکر چیمبر میں جمع کروائی۔	Y	استعفوں	2683	      411	0.0016	848.8	urd_news_2016_00611104
24291	اس سے قبل نیوزی لینڈ کی ٹیم پاکستان کے خلاف پہلی اننگز میں 690 رنز بنا کر آوٴٹ ہو گئی جو ان کا ٹیسٹ کرکٹ میں سب سے زیادہ اسکور ہے۔	Y	اسکور	2683	      411	0.0016	473.9643	urd_news_2016_00073956
24292	دلچسپ اعداد و شمار یہ ہے کہ اب تک صرف دو ٹیموں آسٹریلیا اور سری لنکا کے نام پر ہی سب سے زیادہ اسکور کا ریکارڈ درج رہا ہے۔	Y	اسکور	2683	      411	0.0016	554.6429	urd_news_2016_00547306
24293	جب یہ واقعہ ہوا اس وقت آسٹریلیا کا اسکور دو وکٹ پر 21 رن تھا.	Y	اسکور	2683	      411	0.0016	682.3571	urd_news_2016_00458654
24294	وہاب ریاض نے کچھ ہمت دکھائی اور مجموعی اسکور میں32رنز کا اضافہ کرنے میں کامیاب رہے۔	Y	اسکور	2683	      411	0.0016	831.75	urd_news_2016_00941102
24295	فیصلہ کن گول انور سعید نے اسکور کیا۔	Y	اسکور	2683	      411	0.0016	1036.875	urd_news_2016_00732237
24296	پی سی بی کی جانب سے اشتہار دیکھ کر ہی اس بارے میں کوئی فیصلہ کروں گا۔	Y	اشتہار	2683	      411	0.0016	349.8824	urd_news_2016_00379937
24297	ان اختلافات کے بعد اب نیا ایم ڈی کمپنی لگایا جائے گا اس مقصد کے لئے وزارت پٹرولیم نے باقاعدہ میڈیا میں اشتہار بھی دے دیا ہے تاکہ قانون کا سہارا لیکر من پسند شخص کو ایم ڈی تعینات کیا جا سکے۔	Y	اشتہار	2683	      411	0.0016	537.5128	urd_news_2016_00161907
24298	عمران خان اسحاق قتل کیس،تین ملزم اشتہار قرار،ایک بری رائے ونڈ مارچ کے دوران ایک پیغام وزیراعظم نواز شریف اور دوسرا ہندوستانی وزیراعظم نریندر مودی کے لیے ہو گا۔	Y	اشتہار	2683	      411	0.0016	609.1786	urd_news_2016_00709886
24299	قائم مقام چیئرمین پیمرا نے اخبارات میں اشتہار جاری کیا ہے جس میں کہا گیا ہے کہ نئے ٹی وی چینل کے لائسنس کیلئے درخواستیں مطلوب ہیں۔	Y	اشتہار	2683	      411	0.0016	688.28	urd_news_2016_00740859
24300	وہ ہندوستانی اشتہار جسے نشر ہونے کا ‘موقع’ نہ مل سکا ، سامنے آگیا ۔	Y	اشتہار	2683	      411	0.0016	1005.8462	urd_news_2016_00997691
