ORDER	SENTENCE	STATUS	WORD	RANK	COUNT	COUNT_REL	INDEX	ID
2001	انھوں نے کہا کہ اسی لیے دہشت گردی کا جواب دہشت گردی سے نہ دیا جائے۔	Y	اسی	394	    8,856	0.0351	129.5714	urd_news_2016_00211360
2002	تاریخ میں سب سے زیادہ کام اسی حکومت میں ہوئے ہیں۔	Y	اسی	394	    8,856	0.0351	139.2	urd_news_2016_00405556
2003	اس لئے پی ٹی آئی کی بہتری اسی میں ہے ۔	Y	اسی	394	    8,856	0.0351	149	urd_news_2016_00095574
2004	ہماری حکومت نے گزشتہ 7 ماہ میں اسی حوالے سے کام کیا ہے ۔	Y	اسی	394	    8,856	0.0351	149.5	urd_news_2016_00833760
2005	یہ منصوبہ اسی سال مکمل ہو جائے گی۔	Y	اسی	394	    8,856	0.0351	151	urd_news_2016_00904543
2006	انہوں نے کہا کہ یہ منصوبہ چین کے مالی تعاون سے مکمل کیا جائے گا۔	Y	چین	395	    8,851	0.0351	143.8	urd_news_2016_00256691
2007	وزیر اعلیٰ شہباز شریف چین کے دورے پر (کل )روانہ ہوں گے اُردو پوائنٹ دنیاکی سب سے بڑی اُردو ویب سائیٹ ہے، جو پچھلے 15سال سے اُردو کی خدمت میں مصروف ہے۔	Y	چین	395	    8,851	0.0351	151.3571	urd_news_2016_00976179
2008	وزیر اعظم دورہ چین کے بعد پالیسی کا اعلان کریں گے۔	Y	چین	395	    8,851	0.0351	156.8182	urd_news_2016_00962396
2009	انہوں نے کہا کہ چین دہشت گردوں کے خلاف پاکستان کے آپریشن کی مکمل حمایت کرتا ہے ۔	Y	چین	395	    8,851	0.0351	167.625	urd_news_2016_00231099
2010	امریکی پہلے بھارت کو چین، پاکستان سے مقابلہ کرنے کیلئے تیار کر رہا تھا۔	Y	چین	395	    8,851	0.0351	168.2857	urd_news_2016_00155687
2011	کارروائی کے دوران 39افراد کو گرفتار کرلیا گیا ۔	Y	کرلیا	396	    8,849	0.0351	115.25	urd_news_2016_00753603
2012	پولیس نے ایک ملزم کو گرفتار کرلیا۔	Y	کرلیا	396	    8,849	0.0351	136.1429	urd_news_2016_00402083
2013	کمیٹی نے ان کے اجلاس میں سیکرٹری الیکشن کمیشن کو طلب کرلیا۔	Y	کرلیا	396	    8,849	0.0351	145.6667	urd_news_2016_00784006
2014	عدالت نے درخواست پر ڈی جی رینجرز، آئی جی سندھ ،محکمہ داخلہ سمیت دیگر سے جواب طلب کرلیا ہے ۔	Y	کرلیا	396	    8,849	0.0351	175.6667	urd_news_2016_00700737
2015	ملزم کو جلد گرفتار کرلیا جائے گا۔	Y	کرلیا	396	    8,849	0.0351	185.1429	urd_news_2016_00895439
2016	جولائی 2014ء سے ایم سی سی کرکٹ کمیٹی کے رکن ہیں۔	Y	جولائی	397	    8,743	0.0347	156.6	urd_news_2016_00486330
2017	کیس کی سماعت بارہ جولائی تک ملتوی اُردو پوائنٹ دنیاکی سب سے بڑی اُردو ویب سائیٹ ہے، جو پچھلے 15سال سے اُردو کی خدمت میں مصروف ہے۔	Y	جولائی	397	    8,743	0.0347	171.1364	urd_news_2016_00777572
2018	جس کے تحت اسلام آباد میں بلدیاتی انتخابات 25 جولائی کو نہیں ہو ں گے.	Y	جولائی	397	    8,743	0.0347	175.7857	urd_news_2016_00467504
2019	ملزم کو ریمانڈ پر پولیس کے حوالے کیا جائے ،جس پر عدالت نے ملزم کا ریمانڈ منظور کرتے ہوئے 22جولائی تک پولیس کے حوالے کردیا ۔	Y	جولائی	397	    8,743	0.0347	186.0526	urd_news_2016_00895448
2020	کیس کی مزید سماعت 25 جولائی کو ہوگی۔	Y	جولائی	397	    8,743	0.0347	186.4286	urd_news_2016_00777689
2021	انہوں نے کہا کہ آئی ایس ایک دہشت گرد تنظیم ہے اور اس میں کوئی دو رائے نہیں ہو سکتی۔	Y	رائے	398	    8,676	0.0344	151.55	urd_news_2016_00217426
2022	انہوں نے کہا کہ کراچی آپریشن تمام جماعتوں کے اتفاق رائے سے شروع کیا گیا تھا ۔	Y	رائے	398	    8,676	0.0344	156.25	urd_news_2016_00246674
2023	اتفاق رائے کے بغیر وزیرستان میں آپریشن نہیں ہوگا، صدر، وزیراعظم اُردو پوائنٹ دنیاکی سب سے بڑی اُردو ویب سائیٹ ہے، جو پچھلے 15سال سے اُردو کی خدمت میں مصروف ہے۔	Y	رائے	398	    8,676	0.0344	166.0769	urd_news_2016_00020083
2024	انہوں نے کہا کہ کشمیر کے مسئلے کا حل کشمیر کی عوام کی رائے کے علاوہ کوئی اور نہیں ہو سکتا۔	Y	رائے	398	    8,676	0.0344	168.3333	urd_news_2016_00247722
2025	پاکستان کے بارے میں میری بھی ایک رائے ہے۔	Y	رائے	398	    8,676	0.0344	170.8889	urd_news_2016_00355025
2026	الیکشن کمیشن پاکستان نہیں بلکہ الیکشن کمیشن ن لیگ ہے۔	Y	بلکہ	399	    8,671	0.0344	148.625	urd_news_2016_00147666
2027	انہوں نے کہا کہ ہم نے اس وقت کی سیاسی صورت حال میں وزیراعظم کا نہیں بلکہ پارلیمنٹ کا ساتھ دیا۔	Y	بلکہ	399	    8,671	0.0344	152.3684	urd_news_2016_00256910
2028	دہشت گردی کے خلاف جنگ ختم نہیں ہوئی بلکہ جاری ہے۔	Y	بلکہ	399	    8,671	0.0344	153.7273	urd_news_2016_00544044
2029	انہوں نے کہا کہ فوج صرف اسلام آباد میں ہی نہیں بلکہ پورے پاکستان میں آئے گی ۔	Y	بلکہ	399	    8,671	0.0344	156.5625	urd_news_2016_00245110
2030	انہوں نے کہا کہ وزیر اعظم کا بیان نہیں بلکہ سخت کارروائی ضروری ہے۔	Y	بلکہ	399	    8,671	0.0344	156.9286	urd_news_2016_00261427
2031	انہوں نے کہا کہ پاکستان عوامی تحریک نے وزیراعظم کے خلاف ’’استعفیٰ دو تحریک‘‘ شروع کی ہے جو وزیراعظم کے استعفیٰ تک جاری رہے گی۔	Y	عوامی	400	    8,660	0.0343	132.1	urd_news_2016_00222200
2032	عوامی مسلم لیگ کے سربراہ شیخ رشید اُردو پوائنٹ دنیاکی سب سے بڑی اُردو ویب سائیٹ ہے، جو پچھلے 15سال سے اُردو کی خدمت میں مصروف ہے۔	Y	عوامی	400	    8,660	0.0343	146.2174	urd_news_2016_00718956
2033	اس لئے عوامی تحریک کو ان سے انصاف کی امید نہیں ہے۔	Y	عوامی	400	    8,660	0.0343	149.25	urd_news_2016_00095830
2034	پاکستان میں تحریک انصاف کی حکومت ہی عوامی مسائل حل کر سکتی ہے ۔	Y	عوامی	400	    8,660	0.0343	150.5385	urd_news_2016_00358386
2035	انہوں نے کہا کہ بلوچستان میں عوامی حکومت قائم ہے ہم عوام کی مشکلات دور کرنے کے لئے ہر ممکن کوشش کریں گے ۔	Y	عوامی	400	    8,660	0.0343	163.6087	urd_news_2016_00220290
2036	کراچی ، محمود آباد میں نامعلوم افراد کی فائرنگ سے ایک شخص زخمی اُردو پوائنٹ دنیاکی سب سے بڑی اُردو ویب سائیٹ ہے، جو پچھلے 15سال سے اُردو کی خدمت میں مصروف ہے۔	Y	شخص	401	    8,653	0.0343	127.12	urd_news_2016_00769828
2037	انہوں نے کہا کہ گرفتار شخص کو قانون کے مطابق سخت سے سخت سزا دی جائے گی۔	Y	شخص	401	    8,653	0.0343	140.4375	urd_news_2016_00248698
2038	جس میں2خواتین اور ایک شخص جاں بحق ہوا۔	Y	شخص	401	    8,653	0.0343	153.1111	urd_news_2016_00468498
2039	فائرنگ سے خان محمد ،عمران شاہ اور ایک نامعلوم شخص سمیت تین افراد موقع پر جاں بحق ہو گئے اور 9 زخمی ہو گئے۔	Y	شخص	401	    8,653	0.0343	155.15	urd_news_2016_00725745
2040	انہوں نے کہا یہ صرف ایک شخص کی بات نہیں ہے یہ ایک پورے ادارے کی بات ہے۔	Y	شخص	401	    8,653	0.0343	162.6154	urd_news_2016_00206324
2041	فیصل اقبال اُردو پوائنٹ دنیاکی سب سے بڑی اُردو ویب سائیٹ ہے، جو پچھلے 15سال سے اُردو کی خدمت میں مصروف ہے۔	Y	اقبال	402	    8,646	0.0343	97.2222	urd_news_2016_00731916
2042	احسن اقبال اُردو پوائنٹ دنیاکی سب سے بڑی اُردو ویب سائیٹ ہے، جو پچھلے 15سال سے اُردو کی خدمت میں مصروف ہے۔	Y	اقبال	402	    8,646	0.0343	122.3333	urd_news_2016_00032787
2043	لاہور ہائیکورٹ کے جسٹس چوہدری محمد اقبال نے کیس کی سماعت کی۔	Y	اقبال	402	    8,646	0.0343	168.7273	urd_news_2016_00815035
2044	ان خیالات کا اظہار مسلم لیگ کے سیکرٹری جنرل احسن اقبال کی طرف سے جاری کئے گئے بیان میں کیا گیا۔	Y	اقبال	402	    8,646	0.0343	176.619	urd_news_2016_00172569
2045	اس موقع پر این سی ایچ ڈی کے ڈائریکٹر محمد اقبال نے این سی ایچ ڈی کے 2002ء میں قیام سے اب تک کی کارکردگی کی تفصیلات سے بھی میڈیا کو آگاہ کیا۔	Y	اقبال	402	    8,646	0.0343	186.9231	urd_news_2016_00101058
2046	اس کی قیمت 100 ڈالر سے بھی کم ہوگی۔	Y	ڈالر	403	    8,616	0.0342	173.75	urd_news_2016_00081443
2047	انہوں نے کہا کہ اسحاق ڈالر ڈالر مین ہیں جن کو ڈالر کی ضرورت ہے وہ ان سے حاصل کریں۔	Y	ڈالر	403	    8,616	0.0342	175.6667	urd_news_2016_00210216
2048	اجلاس کے دوران وزیراعظم نواز شریف نے کہا کہ ایک ارب 60 کروڑ ڈالر بلوچستان کی ترقی پر خرچ کئے جائیں گے۔	Y	ڈالر	403	    8,616	0.0342	176.2381	urd_news_2016_00026015
2049	بھارت میں اس فون کی قیمت 70 ڈالر ہے۔	Y	ڈالر	403	    8,616	0.0342	185	urd_news_2016_00303579
2050	جبکہ ڈالر کی قیمت پر فروخت کیا جائے گا۔	Y	ڈالر	403	    8,616	0.0342	188.5556	urd_news_2016_00455879
2051	بلاول بھٹو زرداری اُردو پوائنٹ دنیاکی سب سے بڑی اُردو ویب سائیٹ ہے، جو پچھلے 15سال سے اُردو کی خدمت میں مصروف ہے۔	Y	بھٹو	404	    8,560	0.0339	125.8947	urd_news_2016_00327230
2052	ممتاز علی بھٹو اُردو پوائنٹ دنیاکی سب سے بڑی اُردو ویب سائیٹ ہے، جو پچھلے 15سال سے اُردو کی خدمت میں مصروف ہے۔	Y	بھٹو	404	    8,560	0.0339	156.7368	urd_news_2016_00902168
2053	بینظیر بھٹو اُردو پوائنٹ دنیاکی سب سے بڑی اُردو ویب سائیٹ ہے، جو پچھلے 15سال سے اُردو کی خدمت میں مصروف ہے۔	Y	بھٹو	404	    8,560	0.0339	169.7778	urd_news_2016_00333637
2054	پیپلزپارٹی کے چیئرمین بلاول بھٹو زرداری پنجاب کا دورہ کرینگے اُردو پوائنٹ دنیاکی سب سے بڑی اُردو ویب سائیٹ ہے، جو پچھلے 15سال سے اُردو کی خدمت میں مصروف ہے۔	Y	بھٹو	404	    8,560	0.0339	172.9231	urd_news_2016_00367599
2055	اے پی پی کے مطابق پاکستان پیپلز پارٹی کے چیئرمین بلاول بھٹو زرداری نے واقعہ کی مذمت کی ہے اور کے پی کے حکام سے کہا ہے کہ اس قتل میں ملوث ملزمان کو گرفتار کیا جائے۔	Y	بھٹو	404	    8,560	0.0339	173.3333	urd_news_2016_00293800
2056	انہوں نے کہا کہ اس معاملے پر ہر سطح پر احتجاج کیا جائے گا ۔	Y	احتجاج	405	    8,524	0.0338	133.8462	urd_news_2016_00211454
2057	انہوں نے عدالت کو بتایا کو دونوں جماعتوں نے این او سی کے مطابق احتجاج نہیں کیا۔	Y	احتجاج	405	    8,524	0.0338	143.4	urd_news_2016_00204684
2058	کراچی میں 12 دسمبر کو تحریک انصاف کے احتجاج پر ان کو مکمل سیکورٹی فراہم کی جائے گی۔	Y	احتجاج	405	    8,524	0.0338	151.25	urd_news_2016_00770315
2059	ہم کسی کے گھر احتجاج کیلئے جانے کو تیار نہیں۔	Y	احتجاج	405	    8,524	0.0338	151.7	urd_news_2016_00887921
2060	انہوں نے کہا کہ اگر سندھ کے عوام کو ان کے حقوق نہ دیئے گئے تو ہم بھرپور احتجاج کریں گے۔	Y	احتجاج	405	    8,524	0.0338	152.35	urd_news_2016_00213904
2061	بم دھماکے کے الزام میں بھی تین افراد گرفتار کر لئے گئے ہیں۔	Y	بم	406	    8,515	0.0338	155.6923	urd_news_2016_00332529
2062	پشاور میں بم دھماکے سے 7افراد زخمی ہو گئے ۔	Y	بم	406	    8,515	0.0338	164	urd_news_2016_00384278
2063	کوئٹہ میں عید کے روز دو بم دھماکے کوئی جانی نقصان نہیں ہوا اُردو پوائنٹ دنیاکی سب سے بڑی اُردو ویب سائیٹ ہے، جو پچھلے 15سال سے اُردو کی خدمت میں مصروف ہے۔	Y	بم	406	    8,515	0.0338	189.4643	urd_news_2016_00794404
2064	پیپلز پارٹی کے آٹھ کارکن گزشتہ روز کے بم حملے میں جاں بحق اُردو پوائنٹ دنیاکی سب سے بڑی اُردو ویب سائیٹ ہے، جو پچھلے 15سال سے اُردو کی خدمت میں مصروف ہے۔	Y	بم	406	    8,515	0.0338	195.037	urd_news_2016_00367475
2065	یہ رپورٹ اسلام آباد اور کراچی میں بم دھماکوں کے بعد تیار کی گئی ہے ۔	Y	بم	406	    8,515	0.0338	195.2	urd_news_2016_00590336
2066	عوام سے اپیل کرتے ہیں کہ پولیس کے ساتھ تعاون کیا جائے۔	Y	تعاون	407	    8,512	0.0338	135.75	urd_news_2016_00717740
2067	آئی جی اسلام آباد اور پنجاب پولیس تعاون کررہے ہیں۔	Y	تعاون	407	    8,512	0.0338	135.8	urd_news_2016_00288051
2068	انہوں نے کہا زیادہ سے زیادہ تعاون اور زیادہ سے زیادہ مذاکرات پاکستان اور بھارت دونوں کے لئے ضروری ہیں۔	Y	تعاون	407	    8,512	0.0338	139.6667	urd_news_2016_00206211
2069	اور اس سلسلے میں ہر طرح کا تعاون کرنے کے لئے تیار ہے ۔	Y	تعاون	407	    8,512	0.0338	141.6154	urd_news_2016_00273632
2070	وزیر اعلیٰ سندھ کو آگاہ کردیا ہے کہ سندھ پولیس تعاون نہیں کر رہی ہے ۔	Y	تعاون	407	    8,512	0.0338	146.3077	urd_news_2016_00975240
2071	حکومت کے خاتمے تک اسلام آباد سے واپس نہیں جائیں گے ۔	Y	واپس	407	    8,512	0.0338	142.8182	urd_news_2016_00520485
2072	لاہور: ارکان پنجاب اسمبلی ، پنجاب اسمبلی کے اجلاس میں شرکت کے بعد واپس جا رہے ہیں۔	Y	واپس	407	    8,512	0.0338	145.3077	urd_news_2016_00813909
2073	سپریم کورٹ نے عمران خان کے خلاف توہین عدالت کا نوٹس واپس لے لیا اُردو پوائنٹ دنیاکی سب سے بڑی اُردو ویب سائیٹ ہے، جو پچھلے 15سال سے اُردو کی خدمت میں مصروف ہے۔	Y	واپس	407	    8,512	0.0338	149.9	urd_news_2016_00622739
2074	انہوں نے مطالبہ کیا کہ حکومت اس بل کو فوری واپس لے یا اس کے خلاف ایک اور بل لے کر آئے۔	Y	واپس	407	    8,512	0.0338	150.5789	urd_news_2016_00268196
2075	میاں نواز شریف کے حوالے سے انہوں نے کہا کہ وہ خود ہی واپس نہیں آئیں گے۔	Y	واپس	407	    8,512	0.0338	152.9412	urd_news_2016_00841830
2076	پولیس کا کہنا ہے کہ آپریشن کے دوران اسلحہ بھی برآمد ہوا ہے۔	Y	برآمد	408	    8,496	0.0337	139	urd_news_2016_00398459
2077	پولیس نے کارروائی کے دوران اسلحہ بھی برآمد کر لیا ہے۔	Y	برآمد	408	    8,496	0.0337	139.9091	urd_news_2016_00403088
2078	انہوں نے بتایا کہ انتظامیہ نے ایک چوری کو برآمد کیا ہے اور ان کے خلاف کارروائی کی جا رہی ہے۔	Y	برآمد	408	    8,496	0.0337	140.8421	urd_news_2016_00196693
2079	منشیات برآمد اُردو پوائنٹ دنیاکی سب سے بڑی اُردو ویب سائیٹ ہے، جو پچھلے 15سال سے اُردو کی خدمت میں مصروف ہے۔	Y	برآمد	408	    8,496	0.0337	141.7222	urd_news_2016_00904280
2080	ذرائع کے مطابق گرفتار ملزمان سے اسلحہ بھی برآمد کیا گیا ہے ۔	Y	برآمد	408	    8,496	0.0337	146.25	urd_news_2016_00580216
2081	میں جب پیدا تو پاکستان کی عمر 5 سال تھی۔	Y	پیدا	409	    8,476	0.0336	159	urd_news_2016_00910286
2082	جون میں ہوا سے بجلی پیدا کرنے کے منصوبے مکمل ہو رہے ہیں ۔	Y	پیدا	409	    8,476	0.0336	165.4615	urd_news_2016_00487117
2083	ان کا کہنا تھا کہ جب حکومت عوام کو سہولیات فراہم نہیں کرے گی تو دہشت گرد ہی پیدا ہوں گے۔	Y	پیدا	409	    8,476	0.0336	167.7143	urd_news_2016_00180317
2084	گزشتہ تین روز سے آپریشن کی صورتحال پیدا کی جا رہی ہے۔	Y	پیدا	409	    8,476	0.0336	167.8182	urd_news_2016_00801250
2085	مزید یہ کہ گیس سے بجلی پیدا کرنے کی اجازت دی جائے۔	Y	پیدا	409	    8,476	0.0336	171.6667	urd_news_2016_00868537
2086	اس کے باوجود ہمیں ہی قتل کیا جا رہا ہے۔	Y	ہمیں	410	    8,467	0.0336	139.7	urd_news_2016_00082779
2087	انہوں نے کہا کہ ہمیں بتایا جائے کہ کیا لوگ کرپشن میں ملوث نہیں ہیں؟	Y	ہمیں	410	    8,467	0.0336	149.6429	urd_news_2016_00257565
2088	انھوں نے کہا کہ ہمیں بہت سے اقدامات کرنے کی ضرورت ہے۔	Y	ہمیں	410	    8,467	0.0336	157.0833	urd_news_2016_00257576
2089	انہوں نے کہا کہ ہمیں ملک سے کرپشن کے خاتمے کی ذمہ داری دی گئی ہے۔	Y	ہمیں	410	    8,467	0.0336	161	urd_news_2016_00258128
2090	انہوں نے کہا کہ اگر ہمیں ترقی کرنی ہے تو اس کے لیے ملک میں امن کی ضرورت ہے۔	Y	ہمیں	410	    8,467	0.0336	163.7778	urd_news_2016_00214259
2091	انہوں نے کہا، 'کسی بھی ٹی 20 میچ میں ایسا ہو سکتا ہے.	Y	میچ	411	    8,454	0.0335	144.5	urd_news_2016_00238504
2092	پاکستان نے اس میچ میں ایک تبدیلی کی ۔	Y	میچ	411	    8,454	0.0335	163.75	urd_news_2016_00360041
2093	فروری 2015ء ) وزیر اعظم نواز شریف نے پاک بھارت میچ کے موقع پر ملک بھر میں لوڈشیڈنگ نہ کر نے کی ہدایت کی ہے ۔	Y	میچ	411	    8,454	0.0335	177.0455	urd_news_2016_00729738
2094	محمد یوسف میچ کے بہترین کھلاڑی قرار اُردو پوائنٹ دنیاکی سب سے بڑی اُردو ویب سائیٹ ہے، جو پچھلے 15سال سے اُردو کی خدمت میں مصروف ہے۔	Y	میچ	411	    8,454	0.0335	179.7826	urd_news_2016_00855445
2095	اس طرح میچ میں ایم سی پشاور نے 53رنز سے کامیابی حاصل کی ۔	Y	میچ	411	    8,454	0.0335	183.7692	urd_news_2016_00077654
2096	جس میں بڑا حصہ سندھ اور کراچی کیلئے تھا۔	Y	حصہ	412	    8,440	0.0335	149	urd_news_2016_00468855
2097	یہ سب دہشت گردی کے خلاف اسی جنگ کا حصہ تھا۔	Y	حصہ	412	    8,440	0.0335	156.8182	urd_news_2016_00618084
2098	وہ پی کے چار سے انتخابات میں حصہ لیں گے۔	Y	حصہ	412	    8,440	0.0335	157.3	urd_news_2016_00953426
2099	انہوں نے کہا کہ انتخابات میں حصہ نہ لینے والی جماعتوں کو کوئی نقصان نہیں ہو گا۔	Y	حصہ	412	    8,440	0.0335	159.4706	urd_news_2016_00216021
2100	انہوں نے ہماری گفتگو میں کوئی حصہ نہ لیا۔	Y	حصہ	412	    8,440	0.0335	165.6667	urd_news_2016_00264480
2101	سکیورٹی ادارے اُردو پوائنٹ دنیاکی سب سے بڑی اُردو ویب سائیٹ ہے، جو پچھلے 15سال سے اُردو کی خدمت میں مصروف ہے۔	Y	سکیورٹی	413	    8,432	0.0334	93.7222	urd_news_2016_00641090
2102	جبکہ اس موقع پر جیل کی سکیورٹی کو مزید سخت کر دیا گیا ہے.	Y	سکیورٹی	413	    8,432	0.0334	134.5	urd_news_2016_00453642
2103	پاکستان میں سکیورٹی سب سے اہم مسئلہ ہے۔	Y	سکیورٹی	413	    8,432	0.0334	146.625	urd_news_2016_00358975
2104	انہوں نے کہا کہ پولیس کی طرف سے ان کو بتایا گیا کہ وہ سکیورٹی فراہم نہیں کر سکتے جس کی وجہ سے تقریب کا انعقاد روک دیا گیا ۔	Y	سکیورٹی	413	    8,432	0.0334	160.08	urd_news_2016_00226373
2105	انہوں نے اعلان کیا کہ عوام کو سکیورٹی کی فراہمی کے لئے فوج سوات میں موجود رہے گی۔	Y	سکیورٹی	413	    8,432	0.0334	161.8333	urd_news_2016_00193682
2106	انہوں نے کہا کہ دوسری جانب سے بات چیت بھی کی جا رہی ہے اور فائرنگ کا سلسلہ بھی جاری ہے۔	Y	دوسری	414	    8,421	0.0334	126.5789	urd_news_2016_00235881
2107	وزیر اعظم نے کہا کہ بلوچستان کی جماعتوں سے مذاکرات جاری ہیں عید کے بعد دوسری جماعتوں سے بھی مذاکرات کریں گے۔	Y	دوسری	414	    8,421	0.0334	156.6842	urd_news_2016_00969703
2108	دوسری جانب پی آئی اے حکام کا کہنا ہے کہ واقعہ کی تحقیقات کا آغاز کر دیا گیا ہے۔	Y	دوسری	414	    8,421	0.0334	164.5882	urd_news_2016_00553825
2109	خورشید شاہ ،ایک طرف مذاکرات دوسری طرف دھماکے جاری ہیں،پشاور میں دھماکے کی مذمت اُردو پوائنٹ دنیاکی سب سے بڑی اُردو ویب سائیٹ ہے، جو پچھلے 15سال سے اُردو کی خدمت میں مصروف ہے۔	Y	دوسری	414	    8,421	0.0334	165.0741	urd_news_2016_00533824
2110	دوسری طرف اپوزیشن نے وزیر اعظم کی اسمبلی آمد پر احتجاج نہ کرنے کا فیصلہ کیا ہے۔	Y	دوسری	414	    8,421	0.0334	167.1765	urd_news_2016_00556162
2111	اسلام آباد میں نجی ٹی وی سے خصوصی گفتگو کرتے ہوئے انہوں نے کہا کہ لائن آف کنٹرول پر فائرنگ کا کوئی واقعہ پیش نہیں آیا۔	Y	لائن	415	    8,385	0.0333	190.7692	urd_news_2016_00092976
2112	ایران گیس پائپ لائن کی تعمیر کے لیے کام شروع کردیا اُردو پوائنٹ دنیاکی سب سے بڑی اُردو ویب سائیٹ ہے، جو پچھلے 15سال سے اُردو کی خدمت میں مصروف ہے۔	Y	لائن	415	    8,385	0.0333	196.3077	urd_news_2016_00043866
2113	پولیس کو ملزمان کی گرفتاری کیلئے تین دن کی ڈیڈ لائن اُردو پوائنٹ دنیاکی سب سے بڑی اُردو ویب سائیٹ ہے، جو پچھلے 15سال سے اُردو کی خدمت میں مصروف ہے۔	Y	لائن	415	    8,385	0.0333	208.52	urd_news_2016_00399539
2114	پاک فوج کے ڈی جی ایم او کا بھارتی ہم منصب سے رابطہ، کنٹرول لائن کی خلاف ورزی پر احتجاج اُردو پوائنٹ دنیاکی سب سے بڑی اُردو ویب سائیٹ ہے، جو پچھلے 15سال سے اُردو کی خدمت میں مصروف ہے۔	Y	لائن	415	    8,385	0.0333	216.9118	urd_news_2016_00361875
2115	ان کا کہنا تھا کہ کراچی کے لئے گرین لائن منصوبہ شروع کر رہے ہیں۔	Y	لائن	415	    8,385	0.0333	218.2667	urd_news_2016_00181428
2116	اس حوالے سے تحقیقات کا حکم دے دیا ہے۔	Y	حکم	416	    8,376	0.0332	136.2222	urd_news_2016_00063683
2117	عدالت نے کمیشن کو 90 دن میں تحقیقات کرکے رپورٹ پیش کرنے کا حکم دے دیا ہے ۔	Y	حکم	416	    8,376	0.0332	149.375	urd_news_2016_00701718
2118	جبکہ ڈی ایس پی کے قتل کی مذمت کرتے ہوئے پولیس کو ملزمان کی فوری گرفتاری کا حکم دے دیا ہے.	Y	حکم	416	    8,376	0.0332	155.2	urd_news_2016_00455865
2119	عدالت نے تمام رہنماؤں کو پیش کرنے کا حکم بھی دے دیا۔	Y	حکم	416	    8,376	0.0332	160.5833	urd_news_2016_00700516
2120	انہوں نے کہا کہ مشرف کیخلاف مقدمہ سپریم کورٹ کے حکم پر قائم کیا تھا۔	Y	حکم	416	    8,376	0.0332	163.0667	urd_news_2016_00254476
2121	انہوں نے کہا کہ اسی طرح صحت کے شعبے میں بھی کام ہو رہا ہے۔	Y	صحت	417	    8,346	0.0331	154.6	urd_news_2016_00210732
2122	ایک سوال کے جواب میں انہوں نے کہا کہ وزیراعظم نواز شریف کی صحت پہلے کے مقابلے میں بہت بہتر ہے ۔	Y	صحت	417	    8,346	0.0331	160.9474	urd_news_2016_00133775
