ORDER	SENTENCE	STATUS	WORD	RANK	COUNT	COUNT_REL	INDEX	ID
16678	Czyli skoro Rosjanie prowadzą śledztwo, o którym, jak pan powiedział, niewiele wiemy, to znaczy że nie ma żadnej współpracy obu stron.	Y	prowadzą	2423	    1,521	0.0034	683.4762	pol_news_2016_00119038
16679	Tylko niektóre z nich prowadzą do sukcesu.	Y	prowadzą	2423	    1,521	0.0034	816.5714	pol_news_2016_00788326
16680	Najlepiej wiedzą o tym ci, którzy prowadzą własny biznes.	Y	prowadzą	2423	    1,521	0.0034	934.3333	pol_news_2018_00400035
16681	"""""""Czy coś znowu się tworzy, tego nie wiem""""""""."""""""	Y	tworzy	2423	    1,521	0.0034	534.75	pol_news_2016_00117198
16682	Ale temu, kto tworzy prawo, nie wszystko wolno.	Y	tworzy	2423	    1,521	0.0034	585.375	pol_news_2017_00018730
16683	Dziś tworzy się inna Litwa, w której powinno się znaleźć miejsce dla każdego.	Y	tworzy	2423	    1,521	0.0034	726.6667	pol_news_2017_00166093
16684	Obecnie Michał mieszka i tworzy we Francji.	Y	tworzy	2423	    1,521	0.0034	796.5714	pol_news_2017_00466300
16685	Przecież każdy naród sam tworzy swój język.	Y	tworzy	2423	    1,521	0.0034	1110.8571	pol_news_2017_00613556
16686	Nagrody im. Andrzeja Bączkowskiego dla Anny Streżyńskiej - Puls Biznesu - pb.pl Z ostatniej chwili subskrypcja Pulsu Biznesu Wybierz pakiet dla siebie Bądź na bieżąco, gdziekolwiek jesteś!	Y	anny	2424	    1,520	0.0034	627.2083	pol_news_2018_00396909
16687	W taki sposób po raz pierwszy trafiùam do domu pani Anny.	Y	anny	2424	    1,520	0.0034	680.6364	pol_news_2017_00903762
16688	Anny w Piasecznie) Ten artykuł nie ma jeszcze komentarzy, możesz być pierwszy!	Y	anny	2424	    1,520	0.0034	802.5	pol_news_2018_00027941
16689	Także to, że Marek usunął z mieszkania zdjęcia i rzeczy Anny.	Y	anny	2424	    1,520	0.0034	811.2727	pol_news_2017_00724382
16690	Dla Anny (28 l., imię zostało zmienione) to miała być miłość do końca życia.	Y	anny	2424	    1,520	0.0034	839.3077	pol_news_2018_00122187
16691	Jego realizację zapowiedział w 2007 r. Jarosław Kaczyński, prezes PiS.	Y	realizację	2424	    1,520	0.0034	584.8889	pol_news_2016_00272693
16692	Jest 10 proc. szans na realizację tego projektu.	Y	realizację	2424	    1,520	0.0034	637.8571	pol_news_2018_00272535
16693	Na realizację tych działań zaplanowano ponad 63 mln euro.	Y	realizację	2424	    1,520	0.0034	761.75	pol_news_2017_00405277
16694	Jakie jeszcze projekty mają szansę na realizację?	Y	realizację	2424	    1,520	0.0034	793.7143	pol_news_2016_00243176
16695	Dodała, że UE potrzebuje wzrostu gospodarczego, który pozwoli na realizację jej celów.	Y	realizację	2424	    1,520	0.0034	1116.1667	pol_news_2018_00133851
16696	Dobre programy do nauki już od 20 zł.	Y	programy	2425	    1,519	0.0034	584.7143	pol_news_2018_00131497
16697	Obecnie takie programy będą miały szanse na pieniądze.	Y	programy	2425	    1,519	0.0034	622.625	pol_news_2016_00479004
16698	"""""""PO chce """"""""debaty na programy"""""""" z PiS."""""""	Y	programy	2425	    1,519	0.0034	695.8571	pol_news_2017_00536126
16699	Jakie filmy i programy będą w telewizji w święta?	Y	programy	2425	    1,519	0.0034	762.375	pol_news_2016_00243076
16700	Przecież za darmo ich programy nie stały się nagle 'bardzo podobne'.	Y	programy	2425	    1,519	0.0034	894.9091	pol_news_2018_00621133
16701	Bo jeśli nie, to nowy rząd nie zrobił w tej sprawie nic ponad to, co zrobił stary.	Y	stary	2425	    1,519	0.0034	361.6429	pol_news_2016_00070093
16702	Ale również dlatego, że jest on stary.	Y	stary	2425	    1,519	0.0034	404.2857	pol_news_2017_00017961
16703	A stary człowiek, jak się okazuje, też może.	Y	stary	2425	    1,519	0.0034	524.375	pol_news_2018_00034075
16704	Najważniejsze w 2014 r. Stary rok za nami.	Y	stary	2425	    1,519	0.0034	661.1429	pol_news_2017_00392020
16705	Ukraina ma nowego prezydenta, ale stary parlament i mnóstwo problemów.	Y	stary	2425	    1,519	0.0034	945.3	pol_news_2018_00798315
16706	Papież do księży: nie proście wiernych o pieniądze za sakramenty - Puls Biznesu - pb.pl Z ostatniej chwili subskrypcja Pulsu Biznesu Wybierz pakiet dla siebie Bądź na bieżąco, gdziekolwiek jesteś!	Y	wiernych	2426	    1,518	0.0034	639.5357	pol_news_2017_00517585
16707	Niech to jednak czyni z pieniędzy swoich wiernych, ale nie z budżetu Państwa.	Y	wiernych	2426	    1,518	0.0034	660.5833	pol_news_2016_00441300
16708	Mamy wiernych Czytelników i jest ich coraz więcej.	Y	wiernych	2426	    1,518	0.0034	665.375	pol_news_2017_00340407
16709	Wśród wiernych nie zabrakło osób z Litwy.	Y	wiernych	2426	    1,518	0.0034	717.2857	pol_news_2017_00895172
16710	Kościół katolicki w Niemczech utracił rekordową liczbę wiernych - Puls Biznesu - pb.pl Z ostatniej chwili subskrypcja Pulsu Biznesu Wybierz pakiet dla siebie Bądź na bieżąco, gdziekolwiek jesteś!	Y	wiernych	2426	    1,518	0.0034	793	pol_news_2017_00309660
16711	W spotkaniu tym bramek nie by³o.	Y	bramek	2427	    1,517	0.0034	466	pol_news_2016_00894617
16712	Do realizacji tego celu brakuje mu jeszcze 16 bramek.	Y	bramek	2427	    1,517	0.0034	669.125	pol_news_2018_00143052
16713	Straci³o w tym sezonie tylko 26 bramek.	Y	bramek	2427	    1,517	0.0034	722.8571	pol_news_2016_00702748
16714	Bramek w tym spotkaniu mog³o byæ znacznie wiêcej.	Y	bramek	2427	    1,517	0.0034	793.7778	pol_news_2017_00059781
16715	43. minuty - Niedługo koniec pierwszej połowy, ale bramek nadal nie widać.	Y	bramek	2427	    1,517	0.0034	988.9	pol_news_2016_00011174
16716	Duda na Jasnej Górze o rządzie - Puls Biznesu - pb.pl Z ostatniej chwili subskrypcja Pulsu Biznesu Wybierz pakiet dla siebie Bądź na bieżąco, gdziekolwiek jesteś!	Y	górze	2428	    1,516	0.0034	513.8261	pol_news_2018_00153676
16717	Tyle że na górze wszystko wygląda inaczej.	Y	górze	2428	    1,516	0.0034	585.8571	pol_news_2018_00787154
16718	Ale problem tkwi w tym, że na górze nic nie ma.	Y	górze	2428	    1,516	0.0034	586.0909	pol_news_2017_00017577
16719	Test PPP w Jastrzębiej Górze - Puls Biznesu - pb.pl Z ostatniej chwili subskrypcja Pulsu Biznesu Wybierz pakiet dla siebie Bądź na bieżąco, gdziekolwiek jesteś!	Y	górze	2428	    1,516	0.0034	677.3043	pol_news_2018_00746536
16720	Przez decyzje ludzi na górze nie wolno mi by³o w tym wszystkim uczestniczyæ.	Y	górze	2428	    1,516	0.0034	691.1429	pol_news_2018_00630157
16721	Są one dobre właśnie dlatego, że i Niemcy, i Polacy mówią prawdę o tym, jak było w czasie wojny.	Y	prawdę	2428	    1,516	0.0034	351.8333	pol_news_2018_00673082
16722	A dziś te media wiedzą już, że muszą walczyć o prawdę.	Y	prawdę	2428	    1,516	0.0034	609.4545	pol_news_2017_00004615
16723	Wystarczy mówić prawdę, jaka by ona nie była.	Y	prawdę	2428	    1,516	0.0034	732.875	pol_news_2017_00928984
16724	Prawdę mówiąc, nie wiem, skąd wzięło się to słowo i co oznacza.	Y	prawdę	2428	    1,516	0.0034	914	pol_news_2018_00604871
16725	Prawdę mówiąc słów brakuje na takie zachowanie.	Y	prawdę	2428	    1,516	0.0034	1163.1429	pol_news_2016_00603042
16726	Galeria: Przegląd aut do miasta - zdjęcie 4 - Dziennik WschodniPrzeglądarka, z której korzystasz jest przestarzała.	Y	przegląd	2428	    1,516	0.0034	672.9231	pol_news_2017_00182158
16727	Już w czwartek razem z Przegląd Sportowy!	Y	przegląd	2428	    1,516	0.0034	742.1429	pol_news_2018_00288671
16728	Przegląd prasy -- 26 maja i gazu w UE.	Y	przegląd	2428	    1,516	0.0034	893.1429	pol_news_2016_00624761
16729	Przegląd Sportowy: Chce się panu jeszcze grać w piłkę?	Y	przegląd	2428	    1,516	0.0034	1175.5556	pol_news_2018_00625600
16730	Źródło: TVN24 Wrocław, Radio Wrocław Przegląd prasy.	Y	przegląd	2428	    1,516	0.0034	1400.3333	pol_news_2017_00991807
16731	Na szczê¶cie wtedy nie by³a sama.	Y	szczê	2429	    1,514	0.0034	499	pol_news_2016_00424653
16732	Na szczê¶cie uda³o nam siê..	Y	szczê	2429	    1,514	0.0034	578.5714	pol_news_2016_00424645
16733	Na szczê¶cie na miejscu jest bardzo du¿o Polonii.	Y	szczê	2429	    1,514	0.0034	728.2222	pol_news_2016_00424608
16734	W pierwszej serii mia³ du¿o szczê¶cia.	Y	szczê	2429	    1,514	0.0034	899.625	pol_news_2017_00874586
16735	Zobaczymy na boisku- Czasami brakuje nam szczê¶cia.	Y	szczê	2429	    1,514	0.0034	1290.5	pol_news_2016_00986484
16736	Wśród nich jest m.in. ambasador Polski przy Unii Europejskiej Marek Prawda.	Y	ambasador	2430	    1,513	0.0034	427.9167	pol_news_2017_00894408
16737	Przyznał, że ambasador jest już od tak dawna w Polsce, że zna nasz kraj, nie potrzebuje pomocy.	Y	ambasador	2430	    1,513	0.0034	622.9375	pol_news_2016_00637570
16738	Agencja nie podaje, czy ambasador poinformował, gdzie doszło do takiego zdarzenia.	Y	ambasador	2430	    1,513	0.0034	707.1818	pol_news_2016_00019652
16739	Widać nie wszystkim się to podoba - powiedział rosyjski ambasador.	Y	ambasador	2430	    1,513	0.0034	800.4444	pol_news_2018_00840346
16740	Rosyjski ambasador w Turcji zginął w zamachu.	Y	ambasador	2430	    1,513	0.0034	1506.1667	pol_news_2016_00657417
16741	Poza tym, jako jedyna miała możliwość pracy przez cały rok.	Y	jedyna	2430	    1,513	0.0034	438.5	pol_news_2017_00590315
16742	To jest jedyna w tej chwili droga.	Y	jedyna	2430	    1,513	0.0034	541.1429	pol_news_2017_00746973
16743	A jest jaka¶ jedna jedyna, która ma ten numer?	Y	jedyna	2430	    1,513	0.0034	640.2222	pol_news_2017_00007888
16744	Dla niektórych naszych piłkarzy, a może i dla większości, to jedyna taka okazja w życiu.	Y	jedyna	2430	    1,513	0.0034	728.8571	pol_news_2018_00125475
16745	Przypomnijmy, że to nie jedyna nowa inwestycja.	Y	jedyna	2430	    1,513	0.0034	1081.8571	pol_news_2018_00637043
16746	Zobacz więcej na temat: Waldemar Modestowicz Ten artykuł nie ma jeszcze komentarzy, możesz być pierwszy!	Y	waldemar	2430	    1,513	0.0034	675.1333	pol_news_2016_00985823
16747	NIK: Waldemar Pawlak źle negocjował - Puls Biznesu - pb.pl Z ostatniej chwili subskrypcja Pulsu Biznesu Wybierz pakiet dla siebie Bądź na bieżąco, gdziekolwiek jesteś!	Y	waldemar	2430	    1,513	0.0034	703.1304	pol_news_2018_00467986
16748	Natomiast wicepremier Waldemar Pawlak powiedział wprost, że to nie jest program rządu, bo nikt się z nim nie konsultował.	Y	waldemar	2430	    1,513	0.0034	810.5	pol_news_2018_00425995
16749	Waldemar Paruch - Wiadomości z Lublina i regionu - Dziennik WschodniPrzeglądarka, z której korzystasz jest przestarzała.	Y	waldemar	2430	    1,513	0.0034	843.9231	pol_news_2017_00810821
16750	Waldemar Jakson - Wiadomości z Lublina i regionu - Dziennik WschodniPrzeglądarka, z której korzystasz jest przestarzała.	Y	waldemar	2430	    1,513	0.0034	845.7692	pol_news_2017_00810811
16751	Okazało się, że w naszym sondażu udział wzięło 34 tys. osób.	Y	sondażu	2431	    1,512	0.0034	646.7	pol_news_2016_00500080
16752	Takie zachowanie władzy nie podoba się blisko połowie Polaków - wynika z sondażu dla se.	Y	sondażu	2431	    1,512	0.0034	718.2857	pol_news_2016_00724722
16753	A tę można zmienić tylko drogą sondażu mieszkańców.	Y	sondażu	2431	    1,512	0.0034	798.25	pol_news_2017_00034541
16754	Wskazują na to wyniki sondażu Centrum Badania Opinii Społecznej.	Y	sondażu	2431	    1,512	0.0034	939.1111	pol_news_2017_00889391
16755	Partia Jarosława Kaczyńskiego zdobyła w sondażu głosów.	Y	sondażu	2431	    1,512	0.0034	1387	pol_news_2016_00526564
16756	Liczba ta w ciągu ostatnich 25 tygodni spadła tylko raz - pod koniec czerwca.	Y	spadła	2431	    1,512	0.0034	502.9167	pol_news_2017_00325968
16757	W tym czasie cena akcji spadła o ponad 70%.	Y	spadła	2431	    1,512	0.0034	513.5	pol_news_2017_00909567
16758	Cena ropy spadła o ok. 20 proc. od początku czerwca.	Y	spadła	2431	    1,512	0.0034	680.6667	pol_news_2018_00075996
16759	Cena ropy spadła o ok. 20 proc. od sierpnia.	Y	spadła	2431	    1,512	0.0034	735	pol_news_2016_00088081
16760	W tym czasie spadła też cena złota.	Y	spadła	2431	    1,512	0.0034	860.5714	pol_news_2017_00909803
16761	Tyle osób ocenia komentarz pozytywnieZaloguj się aby oceniać Tyle osób ocenia komentarz negatywnieZaloguj się aby oceniać Ach!	Y	ach	2432	    1,511	0.0034	382.6	pol_news_2016_00781676
16762	Ach, to panu się tylko nie wydaje, ale to na szczęście nie jest do końca tak, jak pan mówi.	Y	ach	2432	    1,511	0.0034	411.2941	pol_news_2017_00002177
16763	Pokazuje trochê, jak my¶l± tam o tych zespo³ach.	Y	ach	2432	    1,511	0.0034	791	pol_news_2017_00553050
16764	Natomiast w innych szko³ach jest ró¿nie.	Y	ach	2432	    1,511	0.0034	811.25	pol_news_2017_00415019
16765	Polscy zawodnicy w fina³ach swoich konkurencji!	Y	ach	2432	    1,511	0.0034	1202.1429	pol_news_2018_00569399
16766	Przedstawiciel związku dodał, że nie chodzi tylko o podwyżki, których nie było od 9 lat.	Y	podwyżki	2432	    1,511	0.0034	467.3846	pol_news_2018_00624788
16767	J.K.: Żeby te podwyżki, te 30%, zostały.	Y	podwyżki	2432	    1,511	0.0034	715.1667	pol_news_2016_00292961
16768	Zwrócił uwagę, że zdaje sobie sprawę, iż podwyżki są wciąż za małe.	Y	podwyżki	2432	    1,511	0.0034	846.4167	pol_news_2018_00997103
16769	Podwyżki czekają nas jeszcze w tym miesiącu.	Y	podwyżki	2432	    1,511	0.0034	933.1429	pol_news_2018_00558164
16770	Re:Będą wielkie podwyżki dla urzędników Kancelarii Premiera.	Y	podwyżki	2432	    1,511	0.0034	1224.5	pol_news_2018_00647514
16771	PO na czele rządu, ale rośnie poparcie dla PiS - SONDAŻ - Super ExpressO mnie się nie martw Sprawiedliwi - Wydział Kryminalny Wybory 2011.	Y	kryminalny	2433	    1,510	0.0034	1034.7	pol_news_2018_00575170
16772	Morawiecki zapewnia: Chcemy zgody z Rosją - Super ExpressO mnie się nie martw Sprawiedliwi - Wydział Kryminalny Morawiecki zapewnia: Chcemy zgody z Rosją Już w 2022 r. do Polski trafią pierwsze systemy Patriot, a kolejne dwa lata później.	Y	kryminalny	2433	    1,510	0.0034	1106.8276	pol_news_2018_00378958
16773	ANNA MUCHA DZIECI - wiadomości, informacje - Super ExpressO mnie się nie martw Sprawiedliwi - Wydział Kryminalny Anna Mucha chce mieć trzecie dziecko?	Y	kryminalny	2433	    1,510	0.0034	1115.2778	pol_news_2018_00027768
16774	Hanna Gronkiewicz-Waltz - wiadomości, informacje - Super ExpressO mnie się nie martw Sprawiedliwi - Wydział Kryminalny Nie będzie drugiej linii metra na Euro To już pewne.	Y	kryminalny	2433	    1,510	0.0034	1127.2174	pol_news_2018_00203562
16775	"""""""Serial z Jennifer Lopez w TV Puls już od stycznia Serial kryminalny """"""""Uwikłana"""""""", to nowa pozycja TV Puls, która pojawi się już na początku 2017 roku."""""""	Y	kryminalny	2433	    1,510	0.0034	1128.8095	pol_news_2017_00672326
16776	Tak można powiedzieć o każdym rządzie w każdym kraju.	Y	rządzie	2433	    1,510	0.0034	536.5	pol_news_2018_00726101
16777	W nowym rządzie tego problemu być nie powinno.	Y	rządzie	2433	    1,510	0.0034	627.875	pol_news_2018_00867545
16778	To znaczy, niby działa nadal, ale mało kto w rządzie zwraca na to uwagę.	Y	rządzie	2433	    1,510	0.0034	779.7692	pol_news_2018_00771187
16779	Zaznaczył, że nie przewiduje w najbliższym czasie zmian w rządzie.	Y	rządzie	2433	    1,510	0.0034	885.3333	pol_news_2016_00958401
16780	Wiceminister sprawiedliwości w rządzie premiera Jarosława Kaczyńskiego.	Y	rządzie	2433	    1,510	0.0034	1115.7143	pol_news_2018_00839415
16781	Bo jak pan się z nim spotka, to się wszystko zmieni”.	Y	spotka	2433	    1,510	0.0034	428.6	pol_news_2018_00057498
16782	Co zrobić, kiedy spotka nas taka sytuacja?	Y	spotka	2433	    1,510	0.0034	587.2857	pol_news_2016_00109582
16783	Sejm spotka się jeszcze tylko na jednym posiedzeniu.	Y	spotka	2433	    1,510	0.0034	716.875	pol_news_2018_00676616
16784	Prezydent Turcji spotka się z prezydentem Rosji.	Y	spotka	2433	    1,510	0.0034	799	pol_news_2017_00603449
16785	Chcia³oby siê, ¿eby i Monika kogo¶ takiego spotka³a.	Y	spotka	2433	    1,510	0.0034	1058.7	pol_news_2018_00079132
16786	Bydgoszcz - Puls Biznesu - pb.pl - strona 2 Z ostatniej chwili subskrypcja Pulsu Biznesu Wybierz pakiet dla siebie Bądź na bieżąco, gdziekolwiek jesteś!	Y	bydgoszcz	2434	    1,509	0.0034	300.8	pol_news_2017_00065136
16787	Bydgoszcz będzie walczyć o kolejne imprezy, w tym o..	Y	bydgoszcz	2434	    1,509	0.0034	663.375	pol_news_2016_00079450
16788	"""""""Bydgoszcz - informacje na tematy """"""""Bydgoszcz"""""""" oraz """"""""wybory"""""""" - Tagi - znajdź treść po hasłach."""""""	Y	bydgoszcz	2434	    1,509	0.0034	705.9091	pol_news_2018_00067070
16789	"""""""Bydgoszcz - informacje na tematy """"""""Bydgoszcz"""""""" oraz """"""""koncert"""""""" - Tagi - znajdź treść po hasłach."""""""	Y	bydgoszcz	2434	    1,509	0.0034	728.9091	pol_news_2018_00067067
16790	"""""""Bydgoszcz - informacje na tematy """"""""Bydgoszcz"""""""" oraz """"""""prokurator"""""""" - Tagi - znajdź treść po hasłach."""""""	Y	bydgoszcz	2434	    1,509	0.0034	794.1818	pol_news_2018_00067069
16791	Jej syn chyba nie jest z tego powodu zadowolony, mimo, że pani Elżbieta pewnie chce dla niego jak najlepiej.	Y	elżbieta	2434	    1,509	0.0034	521.1579	pol_news_2018_00266312
16792	Elżbieta Rafalska (minister rodziny, pracy i polityki społecznej) Zobacz więcej na temat: Ministerstwo Pracy i Polityki Społecznej Ten artykuł nie ma jeszcze komentarzy, możesz być pierwszy!	Y	elżbieta	2434	    1,509	0.0034	603.1818	pol_news_2016_00182079
16793	Zobacz więcej na temat: Elżbieta Szczerbak Ten artykuł nie ma jeszcze komentarzy, możesz być pierwszy!	Y	elżbieta	2434	    1,509	0.0034	673.2667	pol_news_2016_00984758
16794	"""""""Teraz wszystko jest w rękach parlamentu - powiedziała w """"""""Jeden na jeden"""""""" Elżbieta Rafalska, minister rodziny, pracy i polityki społecznej."""""""	Y	elżbieta	2434	    1,509	0.0034	754.1765	pol_news_2018_00743551
16795	Pod koniec życia matki pani Elżbieta przez rok przebywała w USA.	Y	elżbieta	2434	    1,509	0.0034	758.2727	pol_news_2016_00550530
16796	W taki razie te procedury są do zmiany.	Y	procedury	2434	    1,509	0.0034	426	pol_news_2017_00903736
16797	Tyle osób ocenia komentarz pozytywnieZaloguj się aby oceniać Tyle osób ocenia komentarz negatywnieZaloguj się aby oceniać Procedury są po to żeby ich przestrzegać.	Y	procedury	2434	    1,509	0.0034	478.9375	pol_news_2018_00786366
16798	"""""""Zdaniem ministra nawet """"""""gdyby okazało się, że wszystkie procedury są spełnione, to jest pytanie o te procedury"""""""" oraz """"""""czy to prawo naprawdę może na takie rzeczy pozwalać""""""""."""""""	Y	procedury	2434	    1,509	0.0034	574.6	pol_news_2016_00962078
16799	Tyle osób ocenia komentarz pozytywnieZaloguj się aby oceniać Tyle osób ocenia komentarz negatywnieZaloguj się aby oceniać Niech wdrazaja procedury jakie I'm sie podoba.	Y	procedury	2434	    1,509	0.0034	640.8235	pol_news_2017_00781158
16800	MRR chce przyspieszyć procedury dotyczące dużych inwestycji - Puls Biznesu - pb.pl Z ostatniej chwili subskrypcja Pulsu Biznesu Wybierz pakiet dla siebie Bądź na bieżąco, gdziekolwiek jesteś!	Y	procedury	2434	    1,509	0.0034	652.36	pol_news_2018_00386130
16801	Tylko że to już było i takich mieszkań w Polsce jest wiele i każdy ich mieszkaniec zadowolony nie jest.	Y	mieszkaniec	2435	    1,508	0.0034	456.9412	pol_news_2016_00789338
16802	Mieszkaniec Warszawy ma teraz problem - Dziennik Wschodni Przeglądarka, z której korzystasz jest przestarzała.	Y	mieszkaniec	2435	    1,508	0.0034	563.4615	pol_news_2018_00366735
16803	Miasta, w którym co piąty mieszkaniec wciąż uważa się za Polaka.	Y	mieszkaniec	2435	    1,508	0.0034	766.0909	pol_news_2017_00351488
16804	Prezydent stolicy napisała, że każdy mieszkaniec miasta ma jednak prawo krytycznie oceniać jej działania.	Y	mieszkaniec	2435	    1,508	0.0034	770.2857	pol_news_2016_00609149
16805	Kierowca jechał sam. To mieszkaniec tej samej miejscowości, w której doszło do wypadku.	Y	mieszkaniec	2435	    1,508	0.0034	779.1538	pol_news_2016_00308827
16806	Nawet do sklepu nie chce i¶æ.	Y	sklepu	2435	    1,508	0.0034	404	pol_news_2017_00418360
16807	Takiego sklepu w tym miejscu już nie będzie – tłumaczył.	Y	sklepu	2435	    1,508	0.0034	575.4444	pol_news_2016_00723570
16808	Dzisiaj można po prostu iść do sklepu.	Y	sklepu	2435	    1,508	0.0034	816.8571	pol_news_2017_00163823
16809	W pobliżu bowiem nie ma żadnego sklepu.	Y	sklepu	2435	    1,508	0.0034	841.8571	pol_news_2018_00877167
16810	Ktoś jeszcze mieszka na wsi, ma daleko do lekarza, sklepu, kościoła.	Y	sklepu	2435	    1,508	0.0034	902.0909	pol_news_2017_00316875
16811	Najpierw biała księga, potem ustawa - Puls Biznesu - pb.pl Z ostatniej chwili subskrypcja Pulsu Biznesu Wybierz pakiet dla siebie Bądź na bieżąco, gdziekolwiek jesteś!	Y	biała	2436	    1,507	0.0034	474.087	pol_news_2018_00401638
16812	Do roku 1991 była to biała plama w polskiej historii.	Y	biała	2436	    1,507	0.0034	758.2222	pol_news_2016_00152799
16813	"""""""Będą wnioski do sądu - Wiadomości - polskieradio.pl polskie radio dzieciom """"""""Biała magia""""""""."""""""	Y	biała	2436	    1,507	0.0034	786.9167	pol_news_2016_00060361
16814	Tyle osób ocenia komentarz pozytywnieZaloguj się aby oceniać Tyle osób ocenia komentarz negatywnieZaloguj się aby oceniać To jest dacia duster, biała.	Y	biała	2436	    1,507	0.0034	829.8571	pol_news_2016_00786062
16815	Biała Samorządowa - Wiadomości z Lublina i regionu - Dziennik WschodniPrzeglądarka, z której korzystasz jest przestarzała.	Y	biała	2436	    1,507	0.0034	835.3077	pol_news_2017_00050871
16816	Czym w takim razie są dla nas te dzieła?	Y	dzieła	2436	    1,507	0.0034	431.6667	pol_news_2016_00120087
16817	Można wręcz powiedzieć, że są to małe dzieła sztuki.	Y	dzieła	2436	    1,507	0.0034	796.4444	pol_news_2018_00385842
16818	Skąd dzieła sztuki znalazły się w Rosji?	Y	dzieła	2436	    1,507	0.0034	1021.8571	pol_news_2017_00674796
16819	Wszystkie karty to tutaj małe dzieła sztuki.	Y	dzieła	2436	    1,507	0.0034	1064.5714	pol_news_2018_00900166
16820	Dzieła jakich artystów można oglądać w Krakowie?	Y	dzieła	2436	    1,507	0.0034	1262.8571	pol_news_2017_00160967
16821	KW: do Polskiej Grupy Górniczej trafi 11 kopalń - Puls Biznesu - pb.pl Z ostatniej chwili subskrypcja Pulsu Biznesu Wybierz pakiet dla siebie Bądź na bieżąco, gdziekolwiek jesteś!	Y	kw	2436	    1,507	0.0034	557	pol_news_2018_00329355
16822	Ekonomiści: wzrost PKB w II kw. nadal wysoki, ale niższy niż w pierwszym - Puls Biznesu - pb.pl Z ostatniej chwili subskrypcja Pulsu Biznesu Wybierz pakiet dla siebie Bądź na bieżąco, gdziekolwiek jesteś!	Y	kw	2436	    1,507	0.0034	596.8667	pol_news_2018_00169556
16823	Zysk netto PZU spadł w III kw. - Puls Biznesu - pb.pl Z ostatniej chwili subskrypcja Pulsu Biznesu Wybierz pakiet dla siebie Bądź na bieżąco, gdziekolwiek jesteś!	Y	kw	2436	    1,507	0.0034	598.48	pol_news_2018_00999122
16824	Sondaż Reutersa: podwyżka stóp w Polsce w II kw. 2018 r. - Puls Biznesu - pb.pl Z ostatniej chwili subskrypcja Pulsu Biznesu Wybierz pakiet dla siebie Bądź na bieżąco, gdziekolwiek jesteś!	Y	kw	2436	    1,507	0.0034	642.1852	pol_news_2017_00682147
16825	I dlaczego dopominasz się o to tu, na forum KW a nie w sądzie?	Y	kw	2436	    1,507	0.0034	662.5714	pol_news_2018_00210516
16826	Tyle osób ocenia komentarz pozytywnieZaloguj się aby oceniać Tyle osób ocenia komentarz negatywnieZaloguj się aby oceniać Ale dał radę - o co chodzi?	Y	radę	2436	    1,507	0.0034	387.3333	pol_news_2016_00781838
16827	Mamy nowy rok i nowego ministra finansów, więc może da radę coś zmienić w tej kwestii?	Y	radę	2436	    1,507	0.0034	513.375	pol_news_2016_00354982
16828	Trzeba będzie sobie dać z tym radę.	Y	radę	2436	    1,507	0.0034	615.5714	pol_news_2018_00777046
16829	Można liczyć na ich wsparcie i radę.	Y	radę	2436	    1,507	0.0034	687.8571	pol_news_2018_00385008
16830	Najwyższy czas zmienić Radę Miasta i Zarząd.	Y	radę	2436	    1,507	0.0034	1028.8571	pol_news_2018_00405507
16831	Naszej spółki na inwestycje tej wielkości na pewno nie będzie stać.	Y	wielkości	2436	    1,507	0.0034	592.6	pol_news_2016_00425466
16832	To trzeci pod względem wielkości wynik w historii.	Y	wielkości	2436	    1,507	0.0034	690.375	pol_news_2017_00758524
16833	Wszystko zależy oczywiście od samorządu i wielkości oraz rodzaju produkcji.	Y	wielkości	2436	    1,507	0.0034	729.8	pol_news_2016_00904067
16834	Drugim co do wielkości, ale chyba pierwszym co do znaczenia.	Y	wielkości	2436	    1,507	0.0034	734	pol_news_2016_00161917
16835	"""""""""""""""Ustawa przewiduje dla różnych wielkości miast różne stawki."""""""	Y	wielkości	2436	    1,507	0.0034	1295.375	pol_news_2016_00804788
16836	Bez wiadomości z Ameryki, Polski i świata.	Y	ameryki	2437	    1,506	0.0034	429	pol_news_2018_00052245
16837	"""""""""""""""Jest to bardzo ważne dla NATO, dla UE i dla mieszkańców Europy i Ameryki Północnej"""""""" – mówił sekretarz generalny."""""""	Y	ameryki	2437	    1,506	0.0034	733	pol_news_2016_00286935
16838	Są Stany Zjednoczone Ameryki - powiedział szef państwa.	Y	ameryki	2437	    1,506	0.0034	1027.4286	pol_news_2016_00673293
16839	Jakiś czas pracował w Niemczech dla Głosu Ameryki.	Y	ameryki	2437	    1,506	0.0034	1110.5	pol_news_2018_00235645
16840	Oczywiście chodzi o Stany Zjednoczone Ameryki Północnej.	Y	ameryki	2437	    1,506	0.0034	1247.1429	pol_news_2017_00472995
16841	Spółka zakłada w tym roku przychody na poziomie ok. 32 mln zł.	Y	przychody	2437	    1,506	0.0034	534.4545	pol_news_2016_00691130
16842	Przychody Commerzbanku najniższe od trzech lat - Puls Biznesu - pb.pl Z ostatniej chwili subskrypcja Pulsu Biznesu Wybierz pakiet dla siebie Bądź na bieżąco, gdziekolwiek jesteś!	Y	przychody	2437	    1,506	0.0034	549	pol_news_2017_00626293
16843	Są to jednak jakieś przychody dla miasta.	Y	przychody	2437	    1,506	0.0034	551.1429	pol_news_2016_00673644
