ORDER	SENTENCE	STATUS	WORD	RANK	COUNT	COUNT_REL	INDEX	ID
16001	Drzewa - Puls Biznesu - pb.pl Z ostatniej chwili subskrypcja Pulsu Biznesu Wybierz pakiet dla siebie Bądź na bieżąco, gdziekolwiek jesteś!	Y	drzewa	2361	    1,591	0.0036	274.9474	pol_news_2017_00151497
16002	Drzewa - Puls Biznesu - pb.pl - strona 2 Z ostatniej chwili subskrypcja Pulsu Biznesu Wybierz pakiet dla siebie Bądź na bieżąco, gdziekolwiek jesteś!	Y	drzewa	2361	    1,591	0.0036	297.15	pol_news_2017_00151496
16003	Drzewa w mieście - Wiadomości z Lublina i regionu - Dziennik Wschodni Przeglądarka, z której korzystasz jest przestarzała.	Y	drzewa	2361	    1,591	0.0036	648.2667	pol_news_2018_00153370
16004	Ta są drzewa, to koło kościoła pewnie.	Y	drzewa	2361	    1,591	0.0036	842	pol_news_2016_00732354
16005	Drzewa bezpośrednio przy drogach to poważne zagrożenie.	Y	drzewa	2361	    1,591	0.0036	1512.7143	pol_news_2018_00153354
16006	Jest to zmiana nazwy części tej ulicy.	Y	nazwy	2362	    1,590	0.0036	659.5714	pol_news_2016_00288256
16007	Którego polskiej nazwy nie znamy, ale wiemy, że ma liście.	Y	nazwy	2362	    1,590	0.0036	717.5	pol_news_2018_00325720
16008	Podkreśliła, że informuje o tym już sama zmiana nazwy resortu pracy na Ministerstwo Rodziny, Pracy i Polityki Społecznej.	Y	nazwy	2362	    1,590	0.0036	719.6471	pol_news_2016_00551006
16009	I zawsze te dwie nazwy się pojawiają.	Y	nazwy	2362	    1,590	0.0036	741.7143	pol_news_2016_00237849
16010	W tym kontekście pojawiają się nazwy dwóch firm.	Y	nazwy	2362	    1,590	0.0036	958.375	pol_news_2016_00910077
16011	Szkoda tylko, że w sprawie bezpieczeństwa Polski absolutnie nic dobrego z tego nie wynika.	Y	absolutnie	2363	    1,589	0.0036	477.0714	pol_news_2017_00710445
16012	Ten człowiek nie miał z tym absolutnie nic wspólnego.	Y	absolutnie	2363	    1,589	0.0036	526.6667	pol_news_2018_00736688
16013	Przez ostatnie 7 lat nic, absolutnie nic nie zrobi³.	Y	absolutnie	2363	    1,589	0.0036	674.5714	pol_news_2018_00630861
16014	Moim zdanie nie jest to absolutnie pewne!	Y	absolutnie	2363	    1,589	0.0036	892.8571	pol_news_2016_00381489
16015	Nie, absolutnie nie, żadnej dyskusji, żadnej debaty.	Y	absolutnie	2363	    1,589	0.0036	1559.6	pol_news_2017_00424679
16016	Widać było, że dla wielu osób takie kwestie są ważne.	Y	kwestie	2363	    1,589	0.0036	407.9	pol_news_2017_00837793
16017	S± to kwestie ma³e i du¿e.	Y	kwestie	2363	    1,589	0.0036	468	pol_news_2017_00696687
16018	Wszystkie inne kwestie są to sprawy dodatkowe.	Y	kwestie	2363	    1,589	0.0036	701.5714	pol_news_2017_00900409
16019	Kwestie te już kilka razy były tematem rozmów podczas spotkań przedstawicieli UE i Białorusi.	Y	kwestie	2363	    1,589	0.0036	826.1429	pol_news_2017_00320080
16020	Jak się później okazało, głównym problemem były kwestie finansowe.	Y	kwestie	2363	    1,589	0.0036	870	pol_news_2017_00237074
16021	Tyle osób ocenia komentarz pozytywnieZaloguj się aby oceniać Tyle osób ocenia komentarz negatywnieZaloguj się aby oceniać Więc albo nie ma pojęcia o czym mówi albo brak mózgu!	Y	mózgu	2363	    1,589	0.0036	410.5789	pol_news_2016_00786495
16022	Wiele osób nie wie np. czym jest śmierć mózgu.	Y	mózgu	2363	    1,589	0.0036	537.2222	pol_news_2018_00845628
16023	Tyle osób ocenia komentarz pozytywnieZaloguj się aby oceniać Tyle osób ocenia komentarz negatywnieZaloguj się aby oceniać ale ktoś im zrobił pranie mózgu!	Y	mózgu	2363	    1,589	0.0036	629.6	pol_news_2016_00781846
16024	Są jak części jednego mózgu, które nie mogą się ze sobą porozumieć.	Y	mózgu	2363	    1,589	0.0036	648.9167	pol_news_2018_00669901
16025	I tłumaczy, co dzieje się w mózgu sześciolatka, który po raz pierwszy idzie do szkoły.	Y	mózgu	2363	    1,589	0.0036	665.8	pol_news_2016_00235090
16026	Ci panowie swoje najlepsze lata mają już za sobą.	Y	panowie	2363	    1,589	0.0036	503	pol_news_2016_00101567
16027	Tyle osób ocenia komentarz pozytywnieZaloguj się aby oceniać Tyle osób ocenia komentarz negatywnieZaloguj się aby oceniać Może tym razem,panowie usłyszą.	Y	panowie	2363	    1,589	0.0036	556.3571	pol_news_2016_00783949
16028	W tej sytuacji innych argumentów niż te, które wszyscy znamy i wszyscy o nich wiemy, o których wie również minister Tomasz Siemoniak i inni panowie z Platformy po prostu nie ma.	Y	panowie	2363	    1,589	0.0036	616.9286	pol_news_2017_00906445
16029	Tyle osób ocenia komentarz pozytywnieZaloguj się aby oceniać Tyle osób ocenia komentarz negatywnieZaloguj się aby oceniać Czas na stworzenie jednego bloku panowie.	Y	panowie	2363	    1,589	0.0036	634.3333	pol_news_2017_00780555
16030	Jednak na tym się nie kończy, bo i później panowie są bardziej chorowici.	Y	panowie	2363	    1,589	0.0036	644.3077	pol_news_2017_00248504
16031	Ma się zakończyć już w ten czwartek.	Y	zakończyć	2363	    1,589	0.0036	409.5714	pol_news_2018_00354420
16032	I muszą one się zakończyć do 30 kwietnia.	Y	zakończyć	2363	    1,589	0.0036	525.2857	pol_news_2016_00225701
16033	Bez Rosji nie da się zakończyć konfliktu w Syrii.	Y	zakończyć	2363	    1,589	0.0036	695.8889	pol_news_2017_00050092
16034	Sama inwestycja ma zakończyć się w 2018 roku.	Y	zakończyć	2363	    1,589	0.0036	762.4286	pol_news_2016_00669965
16035	W grudniu ma zakończyć się budowa nowoczesnej stacji Warszawa Stadion,..	Y	zakończyć	2363	    1,589	0.0036	1136.2	pol_news_2016_00838810
16036	A może to wina systemu oświaty, który po raz kolejny ma się zmienić?	Y	oświaty	2364	    1,588	0.0036	564.0769	pol_news_2016_00037255
16037	Może warto by było przeprowadzić przy tej okazji referendum w sprawie likwidacji publicznej oświaty?	Y	oświaty	2364	    1,588	0.0036	766.0714	pol_news_2016_00388802
16038	Kuratorium Oświaty w Lublinie - Wiadomości z Lublina i regionu - Dziennik WschodniPrzeglądarka, z której korzystasz jest przestarzała.	Y	oświaty	2364	    1,588	0.0036	775.1333	pol_news_2017_00319259
16039	A co ma kościół do reformy oświaty?	Y	oświaty	2364	    1,588	0.0036	778.1429	pol_news_2016_00016444
16040	Galeria: Dzień Nauczyciela: nagrody dla pracowników oświaty - zdjęcie 13 - Dziennik Wschodni Przeglądarka, z której korzystasz jest przestarzała.	Y	oświaty	2364	    1,588	0.0036	831.3125	pol_news_2018_00186162
16041	USA nie chcą pamiętać o PortorykoSerwisy Spółek Grupy INFOR korzystają z plików cookie Mają Państwo możliwość samodzielnej zmiany ustawień dotyczących cookies w swojej przeglądarce internetowej.	Y	cookie	2365	    1,587	0.0036	1108.32	pol_news_2018_00803305
16042	Ukraina: Minister o tzw. liście Putina: więcej niż ostrzeżenieSerwisy Spółek Grupy INFOR korzystają z plików cookie Mają Państwo możliwość samodzielnej zmiany ustawień dotyczących cookies w swojej przeglądarce internetowej.	Y	cookie	2365	    1,587	0.0036	1108.8571	pol_news_2018_00798316
16043	Kaczyński podczas miesięcznicy: Przed nami jeszcze trzy takie marszeSerwisy Spółek Grupy INFOR korzystają z plików cookie Mają Państwo możliwość samodzielnej zmiany ustawień dotyczących cookies w swojej przeglądarce internetowej.	Y	cookie	2365	    1,587	0.0036	1111.3214	pol_news_2018_00289718
16044	Trzeba wrócić do rozmowy o roli państwaSerwisy Spółek Grupy INFOR korzystają z plików cookie Mają Państwo możliwość samodzielnej zmiany ustawień dotyczących cookies w swojej przeglądarce internetowej.	Y	cookie	2365	    1,587	0.0036	1119.6923	pol_news_2018_00778487
16045	Ministerstwo Rodziny ma projekt ustawySerwisy Spółek Grupy INFOR korzystają z plików cookie Mają Państwo możliwość samodzielnej zmiany ustawień dotyczących cookies w swojej przeglądarce internetowej.	Y	cookie	2365	    1,587	0.0036	1125.75	pol_news_2018_00371269
16046	Pod względem liczby ludności Polska znajduje się na 34 miejscu wśród krajów świata.	Y	ludności	2365	    1,587	0.0036	570.8333	pol_news_2017_00549455
16047	Łukaszenko zapowiada wzrost dochodów ludności - Puls Biznesu - pb.pl Z ostatniej chwili subskrypcja Pulsu Biznesu Wybierz pakiet dla siebie Bądź na bieżąco, gdziekolwiek jesteś!	Y	ludności	2365	    1,587	0.0036	589.2174	pol_news_2018_00342476
16048	Sejm uchwalił nowe Prawo wodne; rząd - nie będzie podwyżek dla ludności - Puls Biznesu - pb.pl Z ostatniej chwili subskrypcja Pulsu Biznesu Wybierz pakiet dla siebie Bądź na bieżąco, gdziekolwiek jesteś!	Y	ludności	2365	    1,587	0.0036	614.6786	pol_news_2017_00670800
16049	Liczba ludności tego kraju wynosi 37 tysięcy osób.	Y	ludności	2365	    1,587	0.0036	650	pol_news_2018_00335958
16050	Ludności cały czas tyle samo, a nawet trochę mniej, dreptanie w miejscu.	Y	ludności	2365	    1,587	0.0036	731.6667	pol_news_2017_00331642
16051	A gdzie jest na to najbardziej odpowiednie miejsce?	Y	odpowiednie	2365	    1,587	0.0036	353.25	pol_news_2017_00005297
16052	Bank obecnie czeka na odpowiednie zmiany w prawie.	Y	odpowiednie	2365	    1,587	0.0036	571.25	pol_news_2018_00044004
16053	Jesteśmy w stanie zapewnić mu odpowiednie warunki do rozwoju.	Y	odpowiednie	2365	    1,587	0.0036	762.4444	pol_news_2016_00283976
16054	Udało mi się stworzyć odpowiednie warunki aby takie miejsce prowadzić.	Y	odpowiednie	2365	    1,587	0.0036	850.8	pol_news_2018_00796528
16055	Jednocześnie musi zapewnić warunki drogi odpowiednie do jej..	Y	odpowiednie	2365	    1,587	0.0036	871.625	pol_news_2016_00268462
16056	Chodzi o przyjęcie Jezusa w miejsce swojego „ja”.	Y	jezusa	2366	    1,586	0.0036	736.625	pol_news_2017_00082573
16057	Jest to jak gdyby program szkoły dla chrześcijan – po nim da się sprawdzić, czy żyjemy jak uczniowie Jezusa.	Y	jezusa	2366	    1,586	0.0036	800.2941	pol_news_2017_00271502
16058	Następnie Papież wyjaśnił: „Jeżeli ktoś mówi ci to, co Jezus tam mówi, jest to głos Jezusa”.	Y	jezusa	2366	    1,586	0.0036	809.7143	pol_news_2018_00419944
16059	Okazuje się jednak, że ten kto zobaczył Jezusa, może z tego poznać także i Ojca, bo „Ojciec i Syn to jedność”.	Y	jezusa	2366	    1,586	0.0036	825.15	pol_news_2018_00501259
16060	Jeśli tylko chcesz, możesz być blisko Jezusa.	Y	jezusa	2366	    1,586	0.0036	847.7143	pol_news_2017_00265234
16061	Tylko w mieście nikt nie myśli, że można w ten sposób zdobyć tak potrzebne teraz pieniądze.	Y	zdobyć	2366	    1,586	0.0036	455	pol_news_2016_00788999
16062	Przez ponad 10 kolejnych minut nie byli w stanie zdobyć bramki.	Y	zdobyć	2366	    1,586	0.0036	541.9	pol_news_2018_00631066
16063	Mamy nadzieję zdobyć kilka w przyszłym roku.	Y	zdobyć	2366	    1,586	0.0036	695.1429	pol_news_2018_00349671
16064	Czy uda ci się zdobyć chociaż połowę punktów?	Y	zdobyć	2366	    1,586	0.0036	871.375	pol_news_2018_00114434
16065	Mieszkania: Jak kupić własne M? Jak zdobyć kredyt?	Y	zdobyć	2366	    1,586	0.0036	1183.2857	pol_news_2016_00371274
16066	Ma talent, 217 cm wzrostu, bardzo dużo już potrafi, ale może i..	Y	cm	2367	    1,585	0.0036	684	pol_news_2016_00360390
16067	To musi mieć kilkanaście cm żeby było stabilnr i na lata.	Y	cm	2367	    1,585	0.0036	783.0909	pol_news_2018_00758862
16068	Do najlepszego w historii kraju wyniku brakuje mu 44 cm.	Y	cm	2367	    1,585	0.0036	783.7778	pol_news_2018_00139996
16069	Warunkując, że nie każdy ma 190 cm wzrostu i jest raczej duży miejsca jest sporo.	Y	cm	2367	    1,585	0.0036	859.4615	pol_news_2017_00814626
16070	Tyle osób ocenia komentarz pozytywnieZaloguj się aby oceniać Tyle osób ocenia komentarz negatywnieZaloguj się aby oceniać a jakie są normy na wysokość takich płotów w Niemczech? i kto aprobował 160 cm? nikt nie oponował?	Y	cm	2367	    1,585	0.0036	880.7308	pol_news_2016_00781772
16071	Mogą iść do pracy, bo jest jej dużo.	Y	iść	2367	    1,585	0.0036	389.375	pol_news_2018_00376019
16072	Za tym muszą iść jednak kolejne działania.	Y	iść	2367	    1,585	0.0036	549.4286	pol_news_2016_00955556
16073	Na co warto iść do kina w 2016 roku?	Y	iść	2367	    1,585	0.0036	596.625	pol_news_2018_00392883
16074	Ani jutro, bo jutro trzeba iść do pracy.	Y	iść	2367	    1,585	0.0036	669.1429	pol_news_2018_00027176
16075	Złoty syn premiera Tuska Chciał iść własną drogą.	Y	iść	2367	    1,585	0.0036	1440	pol_news_2017_00977584
16076	Tyle osób ocenia komentarz pozytywnieZaloguj się aby oceniać Tyle osób ocenia komentarz negatywnieZaloguj się aby oceniać Bo król to za mało.	Y	król	2367	    1,585	0.0036	319.7857	pol_news_2016_00782139
16077	Nowy król Tajlandii dopiero za rok - Puls Biznesu - pb.pl Z ostatniej chwili subskrypcja Pulsu Biznesu Wybierz pakiet dla siebie Bądź na bieżąco, gdziekolwiek jesteś!	Y	król	2367	    1,585	0.0036	396.0417	pol_news_2018_00473724
16078	Król zupek uskrzydli polskie firmy - Puls Biznesu - pb.pl Z ostatniej chwili subskrypcja Pulsu Biznesu Wybierz pakiet dla siebie Bądź na bieżąco, gdziekolwiek jesteś!	Y	król	2367	    1,585	0.0036	587.1739	pol_news_2017_00312610
16079	Jego się nie da lubić, ale z drugiej strony to jest przecież król imprezy!	Y	król	2367	    1,585	0.0036	602.3571	pol_news_2016_00272825
16080	Ale król jest tylko jeden i jest nim Tusk, który coraz częściej sugeruje, że wróci do polskiej polityki!	Y	król	2367	    1,585	0.0036	628.6471	pol_news_2018_00014487
16081	PiS znów przed PO, tylko cztery partie w Sejmie.	Y	partie	2367	    1,585	0.0036	488.7778	pol_news_2017_00532550
16082	"""""""Jarosław Kaczyński - informacje na tematy """"""""Jarosław Kaczyński"""""""" oraz """"""""partie"""""""" - Tagi - znajdź treść po hasłach."""""""	Y	partie	2367	    1,585	0.0036	700.4167	pol_news_2017_00244430
16083	"""""""PSL - informacje na tematy """"""""PSL"""""""" oraz """"""""partie"""""""" - Tagi - znajdź treść po hasłach."""""""	Y	partie	2367	    1,585	0.0036	733.0909	pol_news_2017_00633943
16084	Ale partie te nie mają dobrych kandydatów.	Y	partie	2367	    1,585	0.0036	780.2857	pol_news_2018_00017102
16085	Zobacz, na jakich miejscach znalazły się partie.	Y	partie	2367	    1,585	0.0036	1111.8571	pol_news_2016_00983826
16086	To nie są cztery-pięć na mecz, ale jedna-dwie, gdy musi trafić.	Y	trafić	2367	    1,585	0.0036	391.4615	pol_news_2018_00760902
16087	Samochód ma trafić do sprzedaży pod koniec roku.	Y	trafić	2367	    1,585	0.0036	537.625	pol_news_2016_00670902
16088	Pieniądze mają trafić na konta klientów już dzisiaj.	Y	trafić	2367	    1,585	0.0036	647	pol_news_2016_00533067
16089	Wkrótce do NIK ma trafić wniosek w tej sprawie.	Y	trafić	2367	    1,585	0.0036	720.6667	pol_news_2017_00855547
16090	Napastnik takiej klasy powinien trafić do bramki.	Y	trafić	2367	    1,585	0.0036	1107.5714	pol_news_2018_00410909
16091	Przed nami jeszcze trochê pracy, by byæ na ich poziomie.	Y	trochê	2367	    1,585	0.0036	471	pol_news_2016_00622277
16092	Czy to znaczy, ¿e tam by³o trochê l¿ej?	Y	trochê	2367	    1,585	0.0036	510.4	pol_news_2018_00114213
16093	To bêdzie trochê si³a z³ego na jednego.	Y	trochê	2367	    1,585	0.0036	688.8889	pol_news_2018_00749025
16094	Bramkarz, który nie gra na co dzieñ traci trochê pewno¶ci siebie.	Y	trochê	2367	    1,585	0.0036	770.0833	pol_news_2018_00061748
16095	Trochê gorzej to wygl±da Koncert Polaków.	Y	trochê	2367	    1,585	0.0036	1107.5714	pol_news_2018_00774474
16096	Często są to właśnie pracownicy z — dodaje rzeczniczka.	Y	rzeczniczka	2368	    1,584	0.0036	591.5	pol_news_2018_00104135
16097	Jak mówi nam rzeczniczka banku, takiej awarii nie ma i problem z pewnością nie leży po stronie banku.	Y	rzeczniczka	2368	    1,584	0.0036	742.5	pol_news_2018_00237123
16098	Ich zdaniem reforma już się toczy, a rzeczniczka Prawa i Sprawiedliwości zapowiada, że politycy PiS są jednak gotowi do dyskusji.	Y	rzeczniczka	2368	    1,584	0.0036	760.5	pol_news_2017_00204566
16099	"""""""Tym razem będzie to mężczyzna - polityk i poseł PO - więcej nie mogę powiedzieć - powiedziała w programie """"""""Jeden na jeden"""""""" w TVN24 rzeczniczka rządu Małgorzata Kidawa-Błońska."""""""	Y	rzeczniczka	2368	    1,584	0.0036	776.0417	pol_news_2018_00791962
16100	Dla nas, to znaczy dla młodych ludzi, którzy od wielu miesięcy w Krakowie i całej Polsce przygotowują się do tego spotkania - mówi Dorota Abdelmoula, rzeczniczka Światowych Dni Młodzieży.	Y	rzeczniczka	2368	    1,584	0.0036	783.7407	pol_news_2016_00134120
16101	Naprawdę, nie ma u nas starego rynku.	Y	starego	2368	    1,584	0.0036	467.1429	pol_news_2018_00414563
16102	Powrót do starego i dobrego makro - Puls Biznesu - pb.pl Z ostatniej chwili subskrypcja Pulsu Biznesu Wybierz pakiet dla siebie Bądź na bieżąco, gdziekolwiek jesteś!	Y	starego	2368	    1,584	0.0036	478.375	pol_news_2018_00595176
16103	Jest tu dużo starego, ale też sporo nowego.	Y	starego	2368	    1,584	0.0036	535.125	pol_news_2016_00288311
16104	X-Trade Brokers DM ma nowego-starego prezesa - Puls Biznesu - pb.pl Z ostatniej chwili subskrypcja Pulsu Biznesu Wybierz pakiet dla siebie Bądź na bieżąco, gdziekolwiek jesteś!	Y	starego	2368	    1,584	0.0036	703	pol_news_2017_00934739
16105	A morze teraz Tyle osób ocenia komentarz pozytywnieZaloguj się aby oceniać Tyle osób ocenia komentarz negatywnieZaloguj się aby oceniać Czy jak ktoś z nas złapie gumę mówi, że to wina starego samochodu i musi go zmienić na nowszy?	Y	starego	2368	    1,584	0.0036	766.9032	pol_news_2016_00036794
16106	To jest znak, że Polska zmienia się na lepsze.	Y	znak	2368	    1,584	0.0036	582.5556	pol_news_2018_00755956
16107	Jeśli zdecydowanie wygra tu była sekretarz stanu, będzie to dla niej bardzo dobry znak.	Y	znak	2368	    1,584	0.0036	604.0714	pol_news_2016_00281586
16108	Uważam że to dobry znak dla świata.	Y	znak	2368	    1,584	0.0036	695.8571	pol_news_2017_00803693
16109	Znak pokoju w czasie mszy nie dla prezydent Warszawy?	Y	znak	2368	    1,584	0.0036	759.8889	pol_news_2018_00978443
16110	Gościem audycji będzie – autor książki „Znak miłości.	Y	znak	2368	    1,584	0.0036	1279.2857	pol_news_2016_00208181
16111	Nie wiadomo te¿ na ile zmieni siê sytuacja Polaków ju¿ obecnych w Wielkiej Brytanii.	Y	obecnych	2369	    1,583	0.0036	491.2857	pol_news_2016_00461370
16112	Wielu obecnych przyznało się, że są tu po raz pierwszy.	Y	obecnych	2369	    1,583	0.0036	653.5	pol_news_2017_00845479
16113	W obecnych eliminacjach do mistrzostw świata ma ich na koncie już dwa.	Y	obecnych	2369	    1,583	0.0036	701.1667	pol_news_2018_00867805
16114	"""""""""""""""A jeśli chodzi o eksport broni, to nie może go być w obecnych okolicznościach"""""""" - powiedziała."""""""	Y	obecnych	2369	    1,583	0.0036	707.2667	pol_news_2018_00007815
16115	Nie rozumiem wielu moich obecnych wyborów, a co dopiero tych sprzed lat.	Y	obecnych	2369	    1,583	0.0036	740.5	pol_news_2016_00455653
16116	Chodzi o wojsko, którego naprawdę jeszcze nie ma.	Y	wojsko	2369	    1,583	0.0036	426.75	pol_news_2018_00085096
16117	W zeszłym roku nie udało nam się tego zrobić, bo wojsko nie miało ich na stanie.	Y	wojsko	2369	    1,583	0.0036	453.4667	pol_news_2016_00929561
16118	"""""""Trump - informacje na tematy """"""""Trump"""""""" oraz """"""""wojsko"""""""" - Tagi - znajdź treść po hasłach."""""""	Y	wojsko	2369	    1,583	0.0036	732.6364	pol_news_2018_00776000
16119	"""""""MON - informacje na tematy """"""""MON"""""""" oraz """"""""wojsko"""""""" - Tagi - znajdź treść po hasłach."""""""	Y	wojsko	2369	    1,583	0.0036	790.0909	pol_news_2017_00367903
16120	Ma już prawie milion żołnierzy Rosyjskie wojsko rośnie w siłę.	Y	wojsko	2369	    1,583	0.0036	1105	pol_news_2016_00351234
16121	Teraz mamy byæ dru¿yn±, jak w tym filmie o nas.	Y	yn	2369	    1,583	0.0036	526	pol_news_2018_00741169
16122	Fina³y Ligi Mistrzów nie dla polskich dru¿yn.	Y	yn	2369	    1,583	0.0036	614	pol_news_2017_00176494
16123	Która z dru¿yn zagra w finale Ligi Mistrzów?	Y	yn	2369	    1,583	0.0036	653.3333	pol_news_2018_00325669
16124	Na jego ruch czeka³o kilkunastu zawodników i przynajmniej tyle samo dru¿yn.	Y	yn	2369	    1,583	0.0036	684.3077	pol_news_2017_00387781
16125	Chodzi³o bowiem o punkty dla swoich dru¿yn narodowych.	Y	yn	2369	    1,583	0.0036	711.2222	pol_news_2017_00081745
16126	Jakie są jego obowiązki w razie wypadku na terenie zakładu?	Y	zakładu	2369	    1,583	0.0036	668.1	pol_news_2017_00227923
16127	Poza tym to forum na temat tego zakładu pracy więc nie wiem skąd ta gawora o budowie.	Y	zakładu	2369	    1,583	0.0036	713.2941	pol_news_2016_00597102
16128	Wciąż więc nie wiadomo, ile mieszkańcy mają czekać na przenosiny zakładu w inne miejsce.	Y	zakładu	2369	    1,583	0.0036	766.7143	pol_news_2018_00821133
16129	Jakie informacje na temat tego zakładu musi mieć, żeby odnaleźć te dokumenty w archiwum?	Y	zakładu	2369	    1,583	0.0036	781.0714	pol_news_2016_00243123
16130	To już trzeci prezes Zakładu Gospodarki Lokalowej w tym roku.	Y	zakładu	2369	    1,583	0.0036	832.6	pol_news_2018_00756502
16131	No tak przepraszamy PO było u władzy.	Y	przepraszamy	2370	    1,582	0.0036	504.7143	pol_news_2016_00471351
16132	Przepraszamy Nie ma jeszcze komentarzy do tego artykułu.	Y	przepraszamy	2370	    1,582	0.0036	581.5	pol_news_2017_00621260
16133	Trump i Duda - spotkanie w cztery oczy - Wizyta Donalda Trumpa w Polsce Przepraszamy.	Y	przepraszamy	2370	    1,582	0.0036	926.25	pol_news_2017_00767779
16134	Minister infrastruktury wyjaśnia - Jeden na jeden Przepraszamy.	Y	przepraszamy	2370	    1,582	0.0036	1007.5	pol_news_2017_00359781
16135	"""""""""""""""Skok mojej kariery"""""""" - """"""""Fakty"""""""" z 7 sierpnia Przepraszamy."""""""	Y	przepraszamy	2370	    1,582	0.0036	1369.1429	pol_news_2017_00676153
16136	To pierwszy taki przypadek w finale WTA od 2006 roku.	Y	wta	2370	    1,582	0.0036	653.2222	pol_news_2017_00754353
16137	I jeszcze to zagranie roku WTA (po raz kolejny)!	Y	wta	2370	    1,582	0.0036	733.1111	pol_news_2017_00207511
16138	"""""""WTA - informacje na tematy """"""""WTA"""""""" - Tagi - znajdź treść po hasłach."""""""	Y	wta	2370	    1,582	0.0036	795	pol_news_2017_00903290
16139	Wciąż jednak nie mogę uwierzyć w to, co się stało – powiedziała Puig, która do tej pory wygrała tylko jeden turniej WTA – dwa lata temu w Strasburgu.	Y	wta	2370	    1,582	0.0036	839.16	pol_news_2017_00819209
16140	To ¿e jest trzecia w rankingu WTA nie wziê³o siê z nik±d.	Y	wta	2370	    1,582	0.0036	865	pol_news_2017_00745136
16141	Był z nią związany do 21. roku życia.	Y	związany	2370	    1,582	0.0036	482.4286	pol_news_2017_00070081
16142	To było ponad 30 lat temu, jednak wciąż jestem z GOPR-em bardzo mocno związany.	Y	związany	2370	    1,582	0.0036	591.5	pol_news_2018_00750218
16143	Ale jest też jeszcze jeden problem z tym związany, a który jest Panu znany osobiście.	Y	związany	2370	    1,582	0.0036	591.6429	pol_news_2017_00014193
16144	Michał był z nim bardzo związany teraz jest zupełnie sam. Nigdy nie założył rodziny.	Y	związany	2370	    1,582	0.0036	606.7143	pol_news_2018_00363173
16145	Od dawna jest związany z PiS-em.	Y	związany	2370	    1,582	0.0036	617.5714	pol_news_2018_00488205
16146	Tyle osób ocenia komentarz pozytywnieZaloguj się aby oceniać Tyle osób ocenia komentarz negatywnieZaloguj się aby oceniać jakie to amerykańskie..	Y	amerykańskie	2371	    1,581	0.0036	334.5833	pol_news_2016_00783152
16147	Może dzięki temu nie wszystko na świecie będzie amerykańskie.	Y	amerykańskie	2371	    1,581	0.0036	359.5556	pol_news_2018_00381638
16148	To również ważne, zwłaszcza w czasach kryzysu, lecz nie wszystko piękne, co amerykańskie.	Y	amerykańskie	2371	    1,581	0.0036	743.1538	pol_news_2018_00765006
16149	Okazało się też, że zbyt duży dostęp do danych europejskich klientów mają amerykańskie służby specjalne.	Y	amerykańskie	2371	    1,581	0.0036	801.2667	pol_news_2016_00499603
16150	Amerykańskie sankcje wobec Rosji - Polska i Świat Przepraszamy.	Y	amerykańskie	2371	    1,581	0.0036	998.375	pol_news_2017_00023118
16151	O sprawie poinformował nas jeden z Czytelników.	Y	czytelników	2371	    1,581	0.0036	473	pol_news_2018_00513058
16152	Przy okazji dobra wiadomo¶æ dla czytelników.	Y	czytelników	2371	    1,581	0.0036	604.2857	pol_news_2017_00629673
16153	Zdjęcia czytelników - zdjęcie 6 - Dziennik Wschodni Przeglądarka, z której korzystasz jest przestarzała.	Y	czytelników	2371	    1,581	0.0036	674.8182	pol_news_2018_00963221
16154	A większości czytelników nie chce się go sprawdzić.	Y	czytelników	2371	    1,581	0.0036	707.625	pol_news_2018_00040042
16155	W połowie sierpnia trafi do rąk czytelników.	Y	czytelników	2371	    1,581	0.0036	1035.4286	pol_news_2016_00879893
16156	Wisła - Puls Biznesu - pb.pl Z ostatniej chwili subskrypcja Pulsu Biznesu Wybierz pakiet dla siebie Bądź na bieżąco, gdziekolwiek jesteś!	Y	wisła	2371	    1,581	0.0036	275.4737	pol_news_2017_00850031
16157	"""""""Wisła - informacje na tematy """"""""Wisła"""""""" oraz """"""""ruch"""""""" - Tagi - znajdź treść po hasłach."""""""	Y	wisła	2371	    1,581	0.0036	731.3636	pol_news_2017_00849979
16158	"""""""Wisła - informacje na tematy """"""""Wisła"""""""" oraz """"""""lech"""""""" - Tagi - znajdź treść po hasłach."""""""	Y	wisła	2371	    1,581	0.0036	761.8182	pol_news_2017_00849974
16159	Nie możemy tak długo czekać na system Wisła.	Y	wisła	2371	    1,581	0.0036	841.625	pol_news_2016_00451284
16160	Fundacja Ja Wisła zapowiada kolejną akcję za tydzień.	Y	wisła	2371	    1,581	0.0036	1292.125	pol_news_2016_00195507
16161	Zobacz więcej na temat: Witold Waszczykowski Ten artykuł nie ma jeszcze komentarzy, możesz być pierwszy!	Y	witold	2371	    1,581	0.0036	593.9333	pol_news_2017_00984963
16162	Zobacz więcej na temat: Komisja Europejska Witold Waszczykowski Ten artykuł nie ma jeszcze komentarzy, możesz być pierwszy!	Y	witold	2371	    1,581	0.0036	621.5882	pol_news_2016_00985159
