ORDER	SENTENCE	STATUS	WORD	RANK	COUNT	COUNT_REL	INDEX	ID
16341	Jest to pierwszy raz w historii, kiedy zapisany został w ten sposób cały album muzyczny.	Y	album	2388	    1,562	0.0035	753.6429	pol_news_2018_00278943
16342	Jednak - co ważniejsze dla wszystkich jego fanów - dodał też, że trzeci album jest w drodze i jest to najlepsze, co dotąd stworzył.	Y	album	2388	    1,562	0.0035	756.3	pol_news_2016_00263265
16343	Czy trudno było wybrać piosenki na ten album?	Y	album	2388	    1,562	0.0035	775.125	pol_news_2018_00114271
16344	Jarosław Kaczyński: Ten album jest bardzo ważny!	Y	album	2388	    1,562	0.0035	833.7143	pol_news_2016_00260410
16345	Tym razem w albumie Była już wystawa, teraz będzie album.	Y	album	2388	    1,562	0.0035	841.1	pol_news_2018_00793002
16346	"""""""""""""""To nie oznacza, że nie mamy możliwości wymiany na rynku, zawsze ją mamy."""""""	Y	wymiany	2388	    1,562	0.0035	392.1818	pol_news_2016_00757767
16347	W pierwszy do wymiany zawsze jest bowiem trener.	Y	wymiany	2388	    1,562	0.0035	457	pol_news_2017_00874731
16348	Gdy dojdzie do wymiany premiera, to i dla ciebie może być nowe otwarcie.	Y	wymiany	2388	    1,562	0.0035	660.2308	pol_news_2018_00189127
16349	Na początku lipca otwarte zostaną punkty wymiany.	Y	wymiany	2388	    1,562	0.0035	1006.2857	pol_news_2017_00401168
16350	Petru: Niemal cała Rada Ministrów do wymiany.	Y	wymiany	2388	    1,562	0.0035	1248.4286	pol_news_2017_00522347
16351	Historia ma więcej niż 100 lat - Forum - Polityka.pl Polityka.pl – strefa wolna od hejtu!	Y	hejtu	2389	    1,561	0.0035	656.1667	pol_news_2018_00204785
16352	To już niemal pewne: będzie kolejny rekord - Forum - Polityka.pl Polityka.pl – strefa wolna od hejtu!	Y	hejtu	2389	    1,561	0.0035	769.6429	pol_news_2018_00756333
16353	W rankingu Warszawa - Forum - Polityka.pl Polityka.pl – strefa wolna od hejtu!	Y	hejtu	2389	    1,561	0.0035	872.8	pol_news_2018_00884848
16354	W tle spór o uchodźców - Forum - Polityka.pl Polityka.pl – strefa wolna od hejtu!	Y	hejtu	2389	    1,561	0.0035	999.5	pol_news_2017_00907629
16355	Trudne relacje polsko-rosyjskie - Forum - Polityka.pl Polityka.pl – strefa wolna od hejtu!	Y	hejtu	2389	    1,561	0.0035	1176.2727	pol_news_2018_00774987
16356	Wynagrodzenia - Puls Biznesu - pb.pl - strona 2 Z ostatniej chwili subskrypcja Pulsu Biznesu Wybierz pakiet dla siebie Bądź na bieżąco, gdziekolwiek jesteś!	Y	wynagrodzenia	2389	    1,561	0.0035	298.55	pol_news_2017_00924494
16357	Pracownicy za czas, w którym nie wykonują z tego powodu pracy, mają prawo do wynagrodzenia.	Y	wynagrodzenia	2389	    1,561	0.0035	553.2667	pol_news_2016_00602045
16358	BBC ujawni wynagrodzenia swoich gwiazd - Puls Biznesu - pb.pl Z ostatniej chwili subskrypcja Pulsu Biznesu Wybierz pakiet dla siebie Bądź na bieżąco, gdziekolwiek jesteś!	Y	wynagrodzenia	2389	    1,561	0.0035	567.5217	pol_news_2017_00045597
16359	Wynagrodzenia rosną szybciej od oczekiwań - Puls Biznesu - pb.pl Z ostatniej chwili subskrypcja Pulsu Biznesu Wybierz pakiet dla siebie Bądź na bieżąco, gdziekolwiek jesteś!	Y	wynagrodzenia	2389	    1,561	0.0035	567.8696	pol_news_2018_00923293
16360	Wzrosną wynagrodzenia pracowników administracji rządowej - Puls Biznesu - pb.pl Z ostatniej chwili subskrypcja Pulsu Biznesu Wybierz pakiet dla siebie Bądź na bieżąco, gdziekolwiek jesteś!	Y	wynagrodzenia	2389	    1,561	0.0035	604.8696	pol_news_2017_00933457
16361	W Gdyni pojawi się z tej okazji aż kilkadziesiąt tysięcy osób.	Y	gdyni	2390	    1,560	0.0035	620.6364	pol_news_2016_00838086
16362	W Gdyni rośnie jedna z największych inwestycji ostatnich lat.	Y	gdyni	2390	    1,560	0.0035	723.6667	pol_news_2018_00836034
16363	W Polsce wystąpi jeszcze dwukrotnie - w czwartek w Warszawie oraz w sobotę w Gdyni.	Y	gdyni	2390	    1,560	0.0035	769.6	pol_news_2016_00880692
16364	Przypomniał, że chciał on wrócić do Gdyni, gdy Polska będzie wolna.	Y	gdyni	2390	    1,560	0.0035	801.7273	pol_news_2018_00636423
16365	Rusza festiwal w Gdyni Odtwórz: Osiem premier w konkursie głównym.	Y	gdyni	2390	    1,560	0.0035	1285.2222	pol_news_2018_00663789
16366	Pytań jest wiele, ale miejsce w którym znajdziesz na nie odpowiedzi tylko jedno.	Y	pytań	2391	    1,558	0.0035	483.3077	pol_news_2017_00636515
16367	W tej sprawie pytań jest wiele, a odpowiedzi wcale nie są proste.	Y	pytań	2391	    1,558	0.0035	570.5833	pol_news_2017_00906375
16368	U mnie, bowiem, pojawia się kilka pytań.	Y	pytań	2391	    1,558	0.0035	693.5714	pol_news_2016_00799922
16369	Przy okazji tego typu spotkań zapewne pojawia się wiele pytań.	Y	pytań	2391	    1,558	0.0035	851.1	pol_news_2017_00629849
16370	Chcesz poznać więcej pytań i szczegóły akcji?	Y	pytań	2391	    1,558	0.0035	1312.1429	pol_news_2016_00090984
16371	Oczywiście pod warunkiem, że się tego naprawdę chce.	Y	warunkiem	2392	    1,557	0.0035	441.25	pol_news_2017_00473542
16372	Niektórzy mówią, że jak najbardziej, pod warunkiem że jest to miłość do samego siebie.	Y	warunkiem	2392	    1,557	0.0035	529	pol_news_2017_00433088
16373	Pod warunkiem, że zna się na rzeczy.	Y	warunkiem	2392	    1,557	0.0035	653.4286	pol_news_2018_00557824
16374	Pod warunkiem jednak, ýe dostanie za sezon 2 mln dolarów.	Y	warunkiem	2392	    1,557	0.0035	768.2222	pol_news_2017_00549002
16375	Prezydent o Ukrainie: warunkiem dobrych relacji jest prawda.	Y	warunkiem	2392	    1,557	0.0035	920	pol_news_2017_00602960
16376	Tyle osób ocenia komentarz pozytywnieZaloguj się, aby oceniać Tyle osób ocenia komentarz negatywnieZaloguj się, aby oceniać kilku rzeczy nie jestem w stanie zrozumieć.	Y	zrozumieć	2393	    1,556	0.0035	324.1875	pol_news_2018_00785924
16377	Czy ktoś jest w stanie to zrozumieć.	Y	zrozumieć	2393	    1,556	0.0035	439.7143	pol_news_2016_00118451
16378	Jest wiele rzeczy, których nie możemy zrozumieć - podkreślił papież.	Y	zrozumieć	2393	    1,556	0.0035	615	pol_news_2018_00279838
16379	To mogę zrozumieć,przecież to tylko człowiek.	Y	zrozumieć	2393	    1,556	0.0035	795.3333	pol_news_2016_00755629
16380	Czasem jednak ciężko zrozumieć niektóre jej pomysły.	Y	zrozumieć	2393	    1,556	0.0035	1188	pol_news_2016_00111412
16381	W drugiej po³owie sytuacji by³o mniej.	Y	owie	2394	    1,555	0.0035	427.5	pol_news_2017_00825187
16382	Gra Polaków, szczególnie w pierwszej po³owie, nie wygl±da³a najlepiej.	Y	owie	2394	    1,555	0.0035	612.0833	pol_news_2016_00210604
16383	W drugiej po³owie by³ najlepszy na boisku.	Y	owie	2394	    1,555	0.0035	674.75	pol_news_2016_00827260
16384	Jest teraz mniej wiêcej w po³owie pierwszej setki rankingu.	Y	owie	2394	    1,555	0.0035	760.6	pol_news_2017_00270914
16385	Real Madryt da³ koncert w pierwszej po³owie!	Y	owie	2394	    1,555	0.0035	868.75	pol_news_2016_00645825
16386	Jednak wiele osób nie zdaje sobie sprawy, że są to rzeczy na które..	Y	zdaje	2394	    1,555	0.0035	293.3846	pol_news_2016_00266239
16387	Niestety, nie każdy zdaje sobie z tego sprawę.	Y	zdaje	2394	    1,555	0.0035	486.25	pol_news_2018_00456098
16388	Więc to jest jasne, że on sobie nie zdaje sprawy.	Y	zdaje	2394	    1,555	0.0035	548.1	pol_news_2018_00843413
16389	Tylko on sam zdaje się być innego zdania.	Y	zdaje	2394	    1,555	0.0035	689.625	pol_news_2017_00783482
16390	Taki polityk zdaje się nie mieć własnego zdania.	Y	zdaje	2394	    1,555	0.0035	1048.25	pol_news_2017_00719507
16391	Pierwsza z nich to Narodowe Centrum Badań i Rozwoju.	Y	narodowe	2395	    1,553	0.0035	525.7778	pol_news_2018_00535556
16392	Zobacz więcej na temat: mniejszości narodowe Ten artykuł nie ma jeszcze komentarzy, możesz być pierwszy!	Y	narodowe	2395	    1,553	0.0035	535.6	pol_news_2017_00984788
16393	Zobacz więcej na temat: Narodowe Odrodzenie Polski Ten artykuł nie ma jeszcze komentarzy, możesz być pierwszy!	Y	narodowe	2395	    1,553	0.0035	623.8125	pol_news_2016_00985448
16394	Zobacz więcej na temat: Muzeum Narodowe w Warszawie Dorota Kołodziejczyk Ten artykuł nie ma jeszcze komentarzy, możesz być pierwszy!	Y	narodowe	2395	    1,553	0.0035	713.7895	pol_news_2018_00984792
16395	Tego już za wiele jak na narodowe standardy.	Y	narodowe	2395	    1,553	0.0035	736	pol_news_2017_00729036
16396	Zdobyła nie tylko więcej procent głosów niż..	Y	zdobyła	2395	    1,553	0.0035	634.7143	pol_news_2016_00965756
16397	Tytuł ten aktorka zdobyła już po raz drugi.	Y	zdobyła	2395	    1,553	0.0035	768.875	pol_news_2018_00794292
16398	Moja ekipa młodzieży ze szkoły nr 19 zdobyła pierwsze miejsce.	Y	zdobyła	2395	    1,553	0.0035	912.5556	pol_news_2017_00366428
16399	Po wielu latach oczekiwania Polska zdobyła złoty medal.	Y	zdobyła	2395	    1,553	0.0035	1030.875	pol_news_2016_00591502
16400	W sumie PO zdobyła 8 miejsc w radzie.	Y	zdobyła	2395	    1,553	0.0035	1093	pol_news_2018_00896904
16401	Ale tak naprawdę wszystko zależy od nas, od tego co mamy w głowie.	Y	głowie	2396	    1,551	0.0035	374.3333	pol_news_2017_00018561
16402	Tyle osób ocenia komentarz pozytywnieZaloguj się aby oceniać Tyle osób ocenia komentarz negatywnieZaloguj się aby oceniać Tatuś też ma chyba nie po kolei w głowie.	Y	głowie	2396	    1,551	0.0035	469.7222	pol_news_2018_00786555
16403	A tak naprawdę wszystko zaczyna się w głowie i tam też się kończy.	Y	głowie	2396	    1,551	0.0035	474.75	pol_news_2018_00034702
16404	Tyle osób ocenia komentarz pozytywnieZaloguj się aby oceniać Tyle osób ocenia komentarz negatywnieZaloguj się aby oceniać To się w głowie nie mieści.	Y	głowie	2396	    1,551	0.0035	485.3571	pol_news_2017_00781810
16405	"""""""Tyle osób ocenia komentarz pozytywnieZaloguj się aby oceniać Tyle osób ocenia komentarz negatywnieZaloguj się aby oceniać To jest wszystko """"""""na głowie"""""""" postawione."""""""	Y	głowie	2396	    1,551	0.0035	502.1333	pol_news_2017_00781782
16406	Nikt nie powiedział, że nie może być ta liczba większa.	Y	większa	2397	    1,550	0.0035	405.7778	pol_news_2017_00456863
16407	Przecież Warszawa jest kilka razy większa od Wilna.	Y	większa	2397	    1,550	0.0035	601.875	pol_news_2017_00614096
16408	Teraz okazuje się, że kwota ta jest znacznie większa.	Y	większa	2397	    1,550	0.0035	699.1111	pol_news_2016_00741281
16409	Stwierdził, że we Francji kwota, która wchodzi w grę, jest znacznie większa.	Y	większa	2397	    1,550	0.0035	905.8333	pol_news_2016_00705424
16410	Byłaby trzy razy większa od obecnej stolicy.	Y	większa	2397	    1,550	0.0035	1141	pol_news_2018_00067250
16411	I dlatego Wielka Brytania nie chce być już dalej w Unii.	Y	brytania	2398	    1,549	0.0035	406.8182	pol_news_2018_00210632
16412	"""""""Wielka Brytania - informacje na tematy """"""""Wielka Brytania"""""""" oraz """"""""USA"""""""" - Tagi - znajdź treść po hasłach."""""""	Y	brytania	2398	    1,549	0.0035	684.3333	pol_news_2017_00843762
16413	Tego nie są w stanie zapewnić ani Francja, ani nawet Wielka Brytania.	Y	brytania	2398	    1,549	0.0035	727.0909	pol_news_2017_00729173
16414	Wielka Brytania i Rosja daleko z ty³u.	Y	brytania	2398	    1,549	0.0035	810.5	pol_news_2017_00843765
16415	Na kolejnych miejscach znalazły się Chiny, Wielka Brytania i Francja.	Y	brytania	2398	    1,549	0.0035	1160.3	pol_news_2018_00405964
16416	Tyle osób ocenia komentarz pozytywnieZaloguj się aby oceniać Tyle osób ocenia komentarz negatywnieZaloguj się aby oceniać nic nie dzieje się bez przyczyny!	Y	przyczyny	2399	    1,548	0.0035	344.2857	pol_news_2016_00784132
16417	"""""""""""""""Nie wiem, jakie są przyczyny tego wypadku."""""""	Y	przyczyny	2399	    1,548	0.0035	557.1429	pol_news_2016_00462408
16418	Na razie nie znane są przyczyny jego śmierci.	Y	przyczyny	2399	    1,548	0.0035	618.625	pol_news_2016_00419627
16419	Na razie nie są znane przyczyny wypadku.	Y	przyczyny	2399	    1,548	0.0035	722.5714	pol_news_2017_00404684
16420	Policja wyjaśnia przyczyny i okoliczności tego zdarzenia.	Y	przyczyny	2399	    1,548	0.0035	1114.4286	pol_news_2018_00567058
16421	Najlepsze spółki na GPW (RANKING) - Puls Biznesu - pb.pl Z ostatniej chwili subskrypcja Pulsu Biznesu Wybierz pakiet dla siebie Bądź na bieżąco, gdziekolwiek jesteś!	Y	ranking	2400	    1,547	0.0035	400.8182	pol_news_2018_00400468
16422	Niestety ma to też wpływ na jego ranking.	Y	ranking	2400	    1,547	0.0035	489.375	pol_news_2018_00455810
16423	Nasz ranking TOP 10 - Dziennik WschodniPrzeglądarka, z której korzystasz jest przestarzała.	Y	ranking	2400	    1,547	0.0035	714	pol_news_2017_00411538
16424	Ranking miejsc w których żyje się najlepiej.	Y	ranking	2400	    1,547	0.0035	716.8571	pol_news_2016_00643895
16425	Terminarz Najpopularniejsze imiona dla dzieci 2019 w Polsce Umowa kupna sprzeda¿y samochodu Ranking najlepszych pi³karzy tej edycji Ligi Mistrzów.	Y	ranking	2400	    1,547	0.0035	866.4	pol_news_2018_00745455
16426	Data - Puls Biznesu - pb.pl Z ostatniej chwili subskrypcja Pulsu Biznesu Wybierz pakiet dla siebie Bądź na bieżąco, gdziekolwiek jesteś!	Y	data	2401	    1,546	0.0035	277.0526	pol_news_2017_00115994
16427	Data - Dziennik WschodniPrzeglądarka, z której korzystasz jest przestarzała.	Y	data	2401	    1,546	0.0035	544.875	pol_news_2017_00115968
16428	Poza tym 11 listopada to dla nas bardzo ważna data.	Y	data	2401	    1,546	0.0035	634.2222	pol_news_2016_00596358
16429	Czym właściwie jest dla Polaków ta data?	Y	data	2401	    1,546	0.0035	679.7143	pol_news_2018_00110392
16430	Data posiedzenia sądu nie jest na razie znana.	Y	data	2401	    1,546	0.0035	931.75	pol_news_2017_00115992
16431	Fed podwyższył główną stopę - Puls Biznesu - pb.pl Z ostatniej chwili subskrypcja Pulsu Biznesu Wybierz pakiet dla siebie Bądź na bieżąco, gdziekolwiek jesteś!	Y	główną	2402	    1,545	0.0035	690.4091	pol_news_2017_00175027
16432	Główną rolę odgrywa w niej Krzysztof C. Mężczyzna może już nigdy nie wyjść z więzienia.	Y	główną	2402	    1,545	0.0035	824.0667	pol_news_2018_00194336
16433	Nie wiadomo jeszcze, kto będzie grał główną rolę.	Y	główną	2402	    1,545	0.0035	824.625	pol_news_2016_00461279
16434	Być może się okazało, że jako prezes wcale nie był główną osobą w tym banku, tylko miał swojego zastępcę, który był człowiekiem zaufania właścicieli.	Y	główną	2402	    1,545	0.0035	836.1304	pol_news_2018_00066768
16435	Stało się to między innymi główną przyczyną..	Y	główną	2402	    1,545	0.0035	857.5714	pol_news_2016_00698463
16436	Justyna pewnie wie po nim du¿o wiêcej.	Y	justyna	2402	    1,545	0.0035	751.875	pol_news_2018_00286254
16437	Justyna kolejny raz zrobi³a co¶ wielkiego.	Y	justyna	2402	    1,545	0.0035	796.8571	pol_news_2018_00286168
16438	"""""""Justyna Kowalczyk - informacje na tematy """"""""Justyna Kowalczyk"""""""" oraz """"""""medal"""""""" - Tagi - znajdź treść po hasłach."""""""	Y	justyna	2402	    1,545	0.0035	896.9167	pol_news_2016_00294941
16439	Po ostatnim starcie ja powiedzia³em swoje, Justyna swoje.	Y	justyna	2402	    1,545	0.0035	942.75	pol_news_2018_00579079
16440	Chyba po prostu akurat tego dziennikarza Justyna lubi.	Y	justyna	2402	    1,545	0.0035	1129.5	pol_news_2018_00086807
16441	Tyle osób ocenia komentarz pozytywnieZaloguj się aby oceniać Tyle osób ocenia komentarz negatywnieZaloguj się aby oceniać jeszcze nie udał się na leczenie do swojej drugiej ojczyzny?	Y	ojczyzny	2403	    1,544	0.0035	578.4444	pol_news_2016_00783414
16442	"""""""W Krakowie w 1967 r. - """"""""Ten jest z Ojczyzny mojej."""""""	Y	ojczyzny	2403	    1,544	0.0035	628.625	pol_news_2016_00858923
16443	Sierpniówka: śmierć zdrajcom Ojczyzny - Puls Biznesu - pb.pl Z ostatniej chwili subskrypcja Pulsu Biznesu Wybierz pakiet dla siebie Bądź na bieżąco, gdziekolwiek jesteś!	Y	ojczyzny	2403	    1,544	0.0035	646.9091	pol_news_2017_00673974
16444	Może zatem dziś premierem Polski naszej Ojczyzny jest ktoś inny, np. Kaczyński?	Y	ojczyzny	2403	    1,544	0.0035	709.25	pol_news_2018_00384112
16445	Rozumiem dobrze, że ta wartość, którą w Polsce reprezentuję, nie należy do mnie, lecz do Ojczyzny całej.	Y	ojczyzny	2403	    1,544	0.0035	711.25	pol_news_2017_00656487
16446	Teraz te obawy są już za nami.	Y	obawy	2404	    1,542	0.0035	492.2857	pol_news_2016_00742192
16447	Mam jednak wielkie obawy co do polityki polskiego rządu, polityki Jarosława Kaczyńskiego.	Y	obawy	2404	    1,542	0.0035	655.0909	pol_news_2017_00338223
16448	To jest początek, to jest pierwszy krok, ale to potwierdza nasze obawy - powiedział natomiast Grzegorz Schetyna (PO).	Y	obawy	2404	    1,542	0.0035	777	pol_news_2018_00755332
16449	Pamiętam siebie z tego okresu, pamiętam swoje obawy.	Y	obawy	2404	    1,542	0.0035	991.5714	pol_news_2018_00523677
16450	Ekspert wyjaśnił, że rozwiązanie to budzi obawy.	Y	obawy	2404	    1,542	0.0035	1349.1429	pol_news_2016_00181053
16451	Od 2002 roku jest to także Dzień Polonii i Polaków za Granicą.	Y	polonii	2404	    1,542	0.0035	416.3636	pol_news_2017_00474936
16452	"""""""Jak podkreślił, """"""""dla nas jest to rok ważny zarówno tutaj w Polsce, jak i dla Polaków i Polonii w Stanach Zjednoczonych""""""""."""""""	Y	polonii	2404	    1,542	0.0035	567.8235	pol_news_2017_00234321
16453	Jest to postać bardzo dobrze znana w Polsce, ale także wśród Polonii amerykańskiej.	Y	polonii	2404	    1,542	0.0035	710.9231	pol_news_2016_00287742
16454	Sprawą Polonii jeszcze raz za dwa tygodnie zajmie się komisja sportu.	Y	polonii	2404	    1,542	0.0035	855.2727	pol_news_2017_00688390
16455	Złożył całej Polonii życzenia z tej okazji.	Y	polonii	2404	    1,542	0.0035	1085.4286	pol_news_2017_00977695
16456	To nie powinno stać tak blisko budynków.	Y	budynków	2405	    1,541	0.0035	675.8571	pol_news_2018_00760825
16457	Robią to nie dla ludzi, jak większość państwowych budynków.	Y	budynków	2405	    1,541	0.0035	777.2222	pol_news_2018_00653600
16458	Dużo nowych budynków powstaje m.in. w Krakowie, Łodzi i Wrocławiu.	Y	budynków	2405	    1,541	0.0035	881.6364	pol_news_2018_00154581
16459	Wokół nas powstaje coraz więcej nowych budynków.	Y	budynków	2405	    1,541	0.0035	903.5714	pol_news_2018_00870874
16460	PR mają obecnie pięć budynków, ale żadnego..	Y	budynków	2405	    1,541	0.0035	1020.2857	pol_news_2016_00609723
16461	Należy jednak wziąć pod uwagę i inne konsekwencje programu.	Y	konsekwencje	2405	    1,541	0.0035	604.8889	pol_news_2016_00411135
16462	Zawsze w ataku, bez względu na skutki i konsekwencje.	Y	konsekwencje	2405	    1,541	0.0035	730.2222	pol_news_2016_00957510
16463	Miało to konsekwencje przez całe moje życie.	Y	konsekwencje	2405	    1,541	0.0035	818.1429	pol_news_2017_00350957
16464	Konsekwencje wyjścia Wielkiej Brytanii z UE - strona 10011589 - WPROST.	Y	konsekwencje	2405	    1,541	0.0035	1031.75	pol_news_2017_00307222
16465	Poważne konsekwencje może mieć też starcie w Szczecinie.	Y	konsekwencje	2405	    1,541	0.0035	1152	pol_news_2018_00592392
16466	Ustawa zniechęci przedsiębiorców do sądów - Puls Biznesu - pb.pl Z ostatniej chwili subskrypcja Pulsu Biznesu Wybierz pakiet dla siebie Bądź na bieżąco, gdziekolwiek jesteś!	Y	sądów	2405	    1,541	0.0035	516.8261	pol_news_2017_00801921
16467	PO, PSL i Nowoczesna chcą dialogu z KE ws. sądów; Kukiz15: to nasze wewnętrzne sprawy - Puls Biznesu - pb.pl Z ostatniej chwili subskrypcja Pulsu Biznesu Wybierz pakiet dla siebie Bądź na bieżąco, gdziekolwiek jesteś!	Y	sądów	2405	    1,541	0.0035	618.25	pol_news_2017_00573669
16468	Jednak nie jest to takie jasne i logiczne dla sądów w Polsce.	Y	sądów	2405	    1,541	0.0035	721.4167	pol_news_2017_00248601
16469	Trzeba go bronić jak sądów, jak naszego prawa do życia w wolnym kraju.	Y	sądów	2405	    1,541	0.0035	738.6667	pol_news_2017_00769265
16470	Tyle osób ocenia komentarz pozytywnieZaloguj się aby oceniać Tyle osób ocenia komentarz negatywnieZaloguj się aby oceniać Na tym przykładzie widać niezależność naszych sądów.	Y	sądów	2405	    1,541	0.0035	743.25	pol_news_2016_00784106
16471	Mo¿na by³o u¿yæ ich w tej sprawie.	Y	yæ	2405	    1,541	0.0035	294.8	pol_news_2016_00382359
16472	Ale i tak uda³o nam siê jako¶ z¿yæ.	Y	yæ	2405	    1,541	0.0035	355.6	pol_news_2016_00027245
16473	Czy ludzie nie potrafi± ¿yæ bez przepisów?	Y	yæ	2405	    1,541	0.0035	712.8571	pol_news_2017_00106807
16474	Z IV ligi nie da siê wy¿yæ.	Y	yæ	2405	    1,541	0.0035	740.75	pol_news_2017_00974272
16475	Pytanie brzmi jednak, czy prze¿yæ znaczy ¿yæ?	Y	yæ	2405	    1,541	0.0035	1186.2857	pol_news_2018_00641751
16476	ZDJĘCIA” Co to za ogrody, w których nie ma drzew?	Y	drzew	2406	    1,540	0.0035	675.7	pol_news_2018_00963216
16477	Jednak dodała, że takich specjalistów od drzew jest na Litwie niewiele.	Y	drzew	2406	    1,540	0.0035	764.6364	pol_news_2017_00247327
16478	Włosi stworzyli rejestr najstarszych drzew - Puls Biznesu - pb.pl Z ostatniej chwili subskrypcja Pulsu Biznesu Wybierz pakiet dla siebie Bądź na bieżąco, gdziekolwiek jesteś!	Y	drzew	2406	    1,540	0.0035	824.9565	pol_news_2018_00861557
16479	Jak tak dalej pójdzie,to w Polsce będziemy mieć więcej pomników Lecha Kaczyńskiego niż drzew.	Y	drzew	2406	    1,540	0.0035	833.8667	pol_news_2016_00253376
16480	Tam jest kilkanaście tysięcy drzew, ale nie wszystkie do wycięcia.	Y	drzew	2406	    1,540	0.0035	834.1	pol_news_2018_00730520
16481	Brakuje dokumentu - Dziennik WschodniPrzeglądarka, z której korzystasz jest przestarzała.	Y	dokumentu	2407	    1,539	0.0035	590.2222	pol_news_2017_00059419
16482	Nie brakuje też klientów po zdjęcie do dokumentu.	Y	dokumentu	2407	    1,539	0.0035	626.875	pol_news_2017_00425859
16483	Tylko ten Kraków, przecież nie przeprowadzę się tam na rok, bo takiego dokumentu nie da się zrobić w tydzień.	Y	dokumentu	2407	    1,539	0.0035	657	pol_news_2018_00788691
16484	Mamy już prawie październik, a nie mamy żadnego dokumentu i nic nie wskazuje na to, żeby o powstał” - powiedział.	Y	dokumentu	2407	    1,539	0.0035	662.5294	pol_news_2016_00354665
16485	Nie ma innego pomysłu dla tego dokumentu jak to co jest właśnie robione.	Y	dokumentu	2407	    1,539	0.0035	751.6923	pol_news_2018_00444857
16486	Mówi, że jest do dyspozycji prezesa PiS.	Y	dyspozycji	2407	    1,539	0.0035	466.2857	pol_news_2016_00386327
16487	Teraz pewnie cieszy się pan, że wreszcie ma cały zespół do dyspozycji?	Y	dyspozycji	2407	    1,539	0.0035	551.5833	pol_news_2018_00741982
16488	W piątek do dyspozycji trenera mają być wszyscy zawodnicy.	Y	dyspozycji	2407	    1,539	0.0035	642.3333	pol_news_2018_00875012
16489	Obecnie, urzędnicy do dyspozycji mają jeszcze dwa samochody.	Y	dyspozycji	2407	    1,539	0.0035	789.75	pol_news_2016_00479120
16490	Oba kluby maj± do dyspozycji wszystkich zawodników.	Y	dyspozycji	2407	    1,539	0.0035	1237.4286	pol_news_2018_00475709
16491	Te obchody są ważne dla nas wszystkich.	Y	obchody	2407	    1,539	0.0035	499.2857	pol_news_2017_00734116
16492	Bardzo dobrze byłoby, żeby te obchody były wspólne.	Y	obchody	2407	    1,539	0.0035	738.375	pol_news_2018_00045045
16493	Zobacz więcej na temat: Święto Niepodległości Obchody Święta Niepodległości.	Y	obchody	2407	    1,539	0.0035	824.625	pol_news_2018_00984945
16494	Tego samego roku odbyły się pierwsze obchody tego święta.	Y	obchody	2407	    1,539	0.0035	842.875	pol_news_2016_00734641
16495	Kliknij tutaj, aby zaakceptować Obchody 8. rocznicy Katastrofy Smoleńskiej w Lublinie.	Y	obchody	2407	    1,539	0.0035	1314	pol_news_2018_00305336
16496	Bo większość Rosjan uważa, że takiego przywódcy nie miała od dawna.	Y	przywódcy	2407	    1,539	0.0035	721.8182	pol_news_2016_00072404
16497	Oby wszyscy przywódcy świata mogli to powiedzieć!	Y	przywódcy	2407	    1,539	0.0035	827.1429	pol_news_2016_00483396
16498	Przywódcy poszczególnych krajów mają pewnie różne na ten temat zdanie.	Y	przywódcy	2407	    1,539	0.0035	848.5	pol_news_2018_00638530
16499	Były prezydent mówił w radiowej Jedynce, że jest to błąd rosyjskiego przywódcy.	Y	przywódcy	2407	    1,539	0.0035	851.75	pol_news_2017_00069485
16500	Przywódcy UE mają rozmawiać o Ukrainie w piątek, drugiego dnia szczytu UE.	Y	przywódcy	2407	    1,539	0.0035	876.6364	pol_news_2017_00632979
16501	Szczecin - Puls Biznesu - pb.pl Z ostatniej chwili subskrypcja Pulsu Biznesu Wybierz pakiet dla siebie Bądź na bieżąco, gdziekolwiek jesteś!	Y	szczecin	2407	    1,539	0.0035	277.3684	pol_news_2017_00706772
16502	Poza tym, przecież na stronie Radia Szczecin było jego zdjęcia.	Y	szczecin	2407	    1,539	0.0035	459.2	pol_news_2018_00598298
16503	"""""""Szczecin - informacje na tematy """"""""Szczecin"""""""" oraz """"""""dziecko"""""""" - Tagi - znajdź treść po hasłach."""""""	Y	szczecin	2407	    1,539	0.0035	704.9091	pol_news_2016_00711947
16504	"""""""Szczecin - informacje na tematy """"""""Szczecin"""""""" oraz """"""""wybory samorządowe"""""""" - Tagi - znajdź treść po hasłach."""""""	Y	szczecin	2407	    1,539	0.0035	776.1667	pol_news_2016_00711948
16505	Tego problemu nie maj± Kraków i Szczecin.	Y	szczecin	2407	    1,539	0.0035	885.4286	pol_news_2018_00734427
16506	Na Uniwersytecie Rzeszowskim powstanie platforma e-usług - Puls Biznesu - pb.pl Z ostatniej chwili subskrypcja Pulsu Biznesu Wybierz pakiet dla siebie Bądź na bieżąco, gdziekolwiek jesteś!	Y	uniwersytecie	2408	    1,538	0.0035	539.2083	pol_news_2017_00417689
16507	W domu też nie, ponieważ mama pracowała na uniwersytecie i nie miała czasu.	Y	uniwersytecie	2408	    1,538	0.0035	727.5	pol_news_2016_00826884
16508	Nauka nie kończy się w szkole lub na uniwersytecie.	Y	uniwersytecie	2408	    1,538	0.0035	785	pol_news_2016_00430687
16509	Bez wzglêdu na to, celem tej pracy by³o zaakcentowanie tylko tego, co siê wi±¿e z prac± na Uniwersytecie i polonistyk±.	Y	uniwersytecie	2408	    1,538	0.0035	849	pol_news_2017_00050567
