ORDER	SENTENCE	STATUS	WORD	RANK	COUNT	COUNT_REL	INDEX	ID
16163	Zobacz więcej na temat: Witold Modzelewski Ten artykuł nie ma jeszcze komentarzy, możesz być pierwszy!	Y	witold	2371	    1,581	0.0036	666.6667	pol_news_2018_00984979
16164	Witold Waszczykowski mówi wprost, że od Polski mało zależy w tej sprawie.	Y	witold	2371	    1,581	0.0036	696.9167	pol_news_2016_00854387
16165	Zobacz więcej na temat: imigranci w Europie Ministerstwo Spraw Zagranicznych Witold Waszczykowski Ten artykuł nie ma jeszcze komentarzy, możesz być pierwszy!	Y	witold	2371	    1,581	0.0036	710	pol_news_2016_00984934
16166	Tym razem na południe - Dziennik WschodniPrzeglądarka, z której korzystasz jest przestarzała.	Y	południe	2372	    1,580	0.0036	412	pol_news_2017_00787995
16167	Świat w Południe w Polskim Radiu 24 - wszystkie audycje Zobacz więcej na temat: Komisja Europejska Ten artykuł nie ma jeszcze komentarzy, możesz być pierwszy!	Y	południe	2372	    1,580	0.0036	612.8636	pol_news_2017_00702257
16168	I to już nie tylko Kraków i południe kraju, zaczyna dusić też inne miasta w Polsce.	Y	południe	2372	    1,580	0.0036	629.5333	pol_news_2018_00226608
16169	Świat w południe w Polskim Radio 24 - wszystkie audycje Ten artykuł nie ma jeszcze komentarzy, możesz być pierwszy!	Y	południe	2372	    1,580	0.0036	653.4375	pol_news_2016_00707882
16170	Świat w Południe w Polskim Radiu 24 - wszystkie audycje Zobacz więcej na temat: wybory prezydenckie wybory prezydenckie we Francji Ten artykuł nie ma jeszcze komentarzy, możesz być pierwszy!	Y	południe	2372	    1,580	0.0036	668.8333	pol_news_2016_00707886
16171	Są to przecież tylko plany i życzenia.	Y	życzenia	2372	    1,580	0.0036	597	pol_news_2018_00674160
16172	Prezydent Duda złożył życzenia z okazji Dnia Kobiet Prezydent Andrzej Duda złożył życzenia z okazji Dnia Kobiet na swojej stronie internetowej.	Y	życzenia	2372	    1,580	0.0036	633	pol_news_2018_00609818
16173	Oto najlepsze życzenia z okazji Dnia Kobiet.	Y	życzenia	2372	    1,580	0.0036	748.5714	pol_news_2016_00516529
16174	Najlepsze życzenia od redakcji Se.pl na NOWY ROK!	Y	życzenia	2372	    1,580	0.0036	804.3333	pol_news_2017_00389003
16175	W Polsce życzenia składa się przecież głównie najbliższym.	Y	życzenia	2372	    1,580	0.0036	1005.375	pol_news_2018_00878930
16176	To jego jedyne słowa na temat Polski.	Y	jedyne	2373	    1,579	0.0036	451.1429	pol_news_2018_00754492
16177	To w końcu chyba jedyne takie miejsce,..	Y	jedyne	2373	    1,579	0.0036	528	pol_news_2016_00765476
16178	To jedyne takie święto w tej gminie i bardzo jest nam potrzebne.	Y	jedyne	2373	    1,579	0.0036	622.5833	pol_news_2017_00746483
16179	Ale to nie jedyne, istotne rzeczy, których nam brakuje.	Y	jedyne	2373	    1,579	0.0036	712.6667	pol_news_2018_00019325
16180	Jak dotychczas sà one jedyne na Litwie.	Y	jedyne	2373	    1,579	0.0036	850.8571	pol_news_2017_00226771
16181	Tyle że miasto tego na razie nie potwierdza.	Y	potwierdza	2374	    1,577	0.0036	416.5	pol_news_2017_00782361
16182	Choć oficjalnie nikt nie potwierdza, chodzi o nowe centrum..	Y	potwierdza	2374	    1,577	0.0036	568.5556	pol_news_2016_00094846
16183	"""""""Jego zdaniem potwierdza to, że Unia Europejska stanowi """"""""rozwiązanie problemów"""""""", ale i to, że musi się ona zmienić, by być bliżej obywateli."""""""	Y	potwierdza	2374	    1,577	0.0036	666.8	pol_news_2017_00258750
16184	Potwierdza to sondaż wśród członków jego organizacji.	Y	potwierdza	2374	    1,577	0.0036	929.8571	pol_news_2018_00591345
16185	Opinię tę z pewnością potwierdza każdy gość hotelu.	Y	potwierdza	2374	    1,577	0.0036	1271.625	pol_news_2018_00507205
16186	Szukana fraza została znaleziona Polacy chcą pracować w kraju.	Y	szukana	2374	    1,577	0.0036	1061.5556	pol_news_2016_00718399
16187	Szukana fraza została znaleziona Na co do kina.	Y	szukana	2374	    1,577	0.0036	1159.75	pol_news_2016_00718259
16188	Szukana fraza została znaleziona Nie do wiary!	Y	szukana	2374	    1,577	0.0036	1305.2857	pol_news_2016_00718296
16189	Szukana fraza została znaleziona Top Model 6 - pierwsze zdjęcia z planu!	Y	szukana	2374	    1,577	0.0036	1386.8	pol_news_2016_00718664
16190	Szukana fraza została znaleziona SUPER EXPRESS najlepszy!	Y	szukana	2374	    1,577	0.0036	1592.4286	pol_news_2017_00712595
16191	Trzeba dwa elementy w tym wszystkim wziąć pod uwagę.	Y	elementy	2375	    1,576	0.0036	546.5556	pol_news_2018_00777358
16192	Ważne żeby wszystkie elementy zdjęcia były w jednym stylu.	Y	elementy	2375	    1,576	0.0036	614.6667	pol_news_2016_00818351
16193	A wszystkie pozostałe elementy będą mniej ważne.	Y	elementy	2375	    1,576	0.0036	787.8571	pol_news_2017_00039546
16194	Myślę, że trzy elementy były bardzo istotne.	Y	elementy	2375	    1,576	0.0036	861	pol_news_2016_00395461
16195	Wskazuje złe z punktu widzenia Polski elementy propozycji..	Y	elementy	2375	    1,576	0.0036	1342.125	pol_news_2016_00891621
16196	Nikt publicznie jeszcze się do tego nie przyznał.	Y	publicznie	2375	    1,576	0.0036	468	pol_news_2017_00457168
16197	Trzeba więc było aż tak wielkiej ofiary, żeby o tym publicznie w Telewizji Polskiej powiedzieć?	Y	publicznie	2375	    1,576	0.0036	485	pol_news_2017_00770300
16198	Po dwóch, trzech latach ju¿ wiêcej publicznie nie gra³em.	Y	publicznie	2375	    1,576	0.0036	545.2	pol_news_2017_00549216
16199	Tych jednak publicznie jak dotąd jeszcze nie było.	Y	publicznie	2375	    1,576	0.0036	546.375	pol_news_2017_00776322
16200	Chcą też, by Schetyna publicznie odpowiedział na pytania dotyczące jego związku z tą sprawą.	Y	publicznie	2375	    1,576	0.0036	801.9286	pol_news_2016_00089783
16201	Zobacz pakiet zaufania - Puls Biznesu - pb.pl Z ostatniej chwili subskrypcja Pulsu Biznesu Wybierz pakiet dla siebie Bądź na bieżąco, gdziekolwiek jesteś!	Y	zaufania	2375	    1,576	0.0036	271.15	pol_news_2018_00983233
16202	Nie miał zaufania do policji i prokuratury.	Y	zaufania	2375	    1,576	0.0036	568.1429	pol_news_2016_00449604
16203	Podkreśla, że nie ma zaufania do Putina.	Y	zaufania	2375	    1,576	0.0036	704.2857	pol_news_2016_00550875
16204	Liderem rankingu zaufania już po raz kolejny został prezydent Bronisław Komorowski (60 l.).	Y	zaufania	2375	    1,576	0.0036	827.8333	pol_news_2018_00336844
16205	To plan posiedzenia rządu Komorowski liderem rankingu zaufania.	Y	zaufania	2375	    1,576	0.0036	1261	pol_news_2016_00760205
16206	To o ponad 18 proc. więcej niż w poprzednim roku.	Y	poprzednim	2376	    1,575	0.0035	307.5556	pol_news_2018_00762336
16207	To tylko o dwie mniej niż w całym poprzednim.	Y	poprzednim	2376	    1,575	0.0035	439.3333	pol_news_2018_00767802
16208	Ju¿ w poprzednim sezonie by³o blisko.	Y	poprzednim	2376	    1,575	0.0035	527.7143	pol_news_2017_00279929
16209	Oznacza to wzrost o 70 proc. w porównaniu z poprzednim rokiem.	Y	poprzednim	2376	    1,575	0.0035	661.3	pol_news_2018_00521601
16210	Chelsea wygrała 13 meczów z rzędu w poprzednim sezonie.	Y	poprzednim	2376	    1,575	0.0035	1332.75	pol_news_2018_00080330
16211	Polski i jej potrzeb jako państwa nie widać.	Y	potrzeb	2376	    1,575	0.0035	419	pol_news_2018_00572079
16212	Poza tym jest nas zbyt mało w stosunku do potrzeb.	Y	potrzeb	2376	    1,575	0.0035	544	pol_news_2018_00597909
16213	Dobry zwyczaj: wypożyczaj, ale według potrzeb - Puls Biznesu - pb.pl Z ostatniej chwili subskrypcja Pulsu Biznesu Wybierz pakiet dla siebie Bądź na bieżąco, gdziekolwiek jesteś!	Y	potrzeb	2376	    1,575	0.0035	564.2083	pol_news_2018_00131872
16214	Szkolnictwo zawodowe bliżej potrzeb rynku pracy - Puls Biznesu - pb.pl Z ostatniej chwili subskrypcja Pulsu Biznesu Wybierz pakiet dla siebie Bądź na bieżąco, gdziekolwiek jesteś!	Y	potrzeb	2376	    1,575	0.0035	583.875	pol_news_2018_00716693
16215	Nie oznacza to, że w dalszym ciągu nie ma takich potrzeb.	Y	potrzeb	2376	    1,575	0.0035	621.2	pol_news_2016_00453264
16216	To już trzeci przetarg - Dziennik Wschodni Przeglądarka, z której korzystasz jest przestarzała.	Y	przetarg	2377	    1,574	0.0035	607.25	pol_news_2018_00756504
16217	Taki był nasz wpływ na ten przetarg.	Y	przetarg	2377	    1,574	0.0035	609.4286	pol_news_2017_00717134
16218	To, kto wygra przetarg to akurat mało ważne dla większości mieszkańców.	Y	przetarg	2377	    1,574	0.0035	805.1	pol_news_2016_00754235
16219	Kiedy ostatnio był przetarg na prowadzenie kina?	Y	przetarg	2377	    1,574	0.0035	955.5714	pol_news_2016_00307109
16220	Urząd Miasta ogłosił wczoraj przetarg na sprzedaż nieruchomości.	Y	przetarg	2377	    1,574	0.0035	1059.125	pol_news_2016_00802966
16221	Wniosek trzeba będzie składać raz w roku.	Y	składać	2377	    1,574	0.0035	482.1429	pol_news_2018_00866823
16222	Nowe wnioski o 500 zł na dziecko można składać już od początku miesiąca.	Y	składać	2377	    1,574	0.0035	600.3333	pol_news_2017_00461801
16223	Swoje oferty firmy mogą składać do 30 maja.	Y	składać	2377	    1,574	0.0035	672	pol_news_2018_00709351
16224	Obecnie trwa ocena wniosków, które można było składać do 26. kwietnia.	Y	składać	2377	    1,574	0.0035	761.9	pol_news_2017_00467121
16225	Strony postępowania mogą składać wnioski do końca miesiąca.	Y	składać	2377	    1,574	0.0035	1056.625	pol_news_2016_00704399
16226	Ale możliwe jest wszystko — w nasze czasy ludzie już się nie boją Boga, dla nich nie ma nic świętego!	Y	świętego	2377	    1,574	0.0035	585.8333	pol_news_2018_00015234
16227	Tak że bez względu na to, czy te opinie były przekazywane w ostatniej dobie, czy też nie, bo o tym tak na dobre nie wiemy, to decyzja jest Ojca Świętego.	Y	świętego	2377	    1,574	0.0035	652.56	pol_news_2016_00729244
16228	Świętego spokoju od tego meczu nie miał już nigdy.	Y	świętego	2377	    1,574	0.0035	666.2222	pol_news_2018_00708263
16229	Tyle osób ocenia komentarz pozytywnieZaloguj się aby oceniać Tyle osób ocenia komentarz negatywnieZaloguj się aby oceniać A czy w końcu wojsko coś im też puści dla świętego spokoju.	Y	świętego	2377	    1,574	0.0035	671.7143	pol_news_2016_00781729
16230	Bankowcy uczcili Dzień Świętego Patryka - Puls Biznesu - pb.pl Z ostatniej chwili subskrypcja Pulsu Biznesu Wybierz pakiet dla siebie Bądź na bieżąco, gdziekolwiek jesteś!	Y	świętego	2377	    1,574	0.0035	717.2609	pol_news_2018_00044041
16231	Za to wielu naszych zawodników może w przyszłości zostać gwiazdami.	Y	gwiazdami	2378	    1,573	0.0035	537.3	pol_news_2018_00953428
16232	Już dziś kolejny odcinek Tańca z gwiazdami.	Y	gwiazdami	2378	    1,573	0.0035	892.5714	pol_news_2016_00295758
16233	Przed nami kolejny odcinek Tańca z Gwiazdami.	Y	gwiazdami	2378	    1,573	0.0035	994.4286	pol_news_2017_00616312
16234	Na Se.pl jak zwykle relacja na żywo z finału Tańca z gwiazdami.	Y	gwiazdami	2378	    1,573	0.0035	1064.7273	pol_news_2016_00421463
16235	Za nami czwarty odcinek Tańca z Gwiazdami.	Y	gwiazdami	2378	    1,573	0.0035	1269.4286	pol_news_2018_00944330
16236	New funds - Puls Biznesu - pb.pl Z ostatniej chwili subskrypcja Pulsu Biznesu Wybierz pakiet dla siebie Bądź na bieżąco, gdziekolwiek jesteś!	Y	new	2378	    1,573	0.0035	457.4	pol_news_2017_00423194
16237	To, co u innych już było, w przypadku New New jest zapowiedzią nowego..	Y	new	2378	    1,573	0.0035	593.75	pol_news_2016_00748650
16238	Hines kupił New City - Puls Biznesu - pb.pl Z ostatniej chwili subskrypcja Pulsu Biznesu Wybierz pakiet dla siebie Bądź na bieżąco, gdziekolwiek jesteś!	Y	new	2378	    1,573	0.0035	625.4091	pol_news_2018_00204595
16239	New Connect wabi firmy finansowe - Puls Biznesu - pb.pl Z ostatniej chwili subskrypcja Pulsu Biznesu Wybierz pakiet dla siebie Bądź na bieżąco, gdziekolwiek jesteś!	Y	new	2378	    1,573	0.0035	637.8696	pol_news_2018_00433424
16240	New Connect - wiadomości, notowania, inwestycje, giełda, rynek, akcje, spółki - pb.pl - strona 3 Z ostatniej chwili subskrypcja Pulsu Biznesu Wybierz pakiet dla siebie Bądź na bieżąco, gdziekolwiek jesteś!	Y	new	2378	    1,573	0.0035	659.5556	pol_news_2017_00423189
16241	Zrobi³em to, co uwa¿a³em za najlepsze Z³e informacje z Wis³y.	Y	uwa	2378	    1,573	0.0035	585.8462	pol_news_2018_00991178
16242	Uwa¿am, ¿e w tej lidze bêdzie siê jeszcze du¿o dzia³o.	Y	uwa	2378	    1,573	0.0035	586.1667	pol_news_2016_00805814
16243	Uwa¿am wiêc, ¿e to nie jest problem.	Y	uwa	2378	    1,573	0.0035	668.875	pol_news_2018_00805419
16244	Uwa¿am, ¿e to jest dobra decyzja.	Y	uwa	2378	    1,573	0.0035	736.4286	pol_news_2017_00802943
16245	Uwa¿am, ¿e nie maj± swojego zdania.	Y	uwa	2378	    1,573	0.0035	989.7143	pol_news_2017_00802916
16246	Od lutego 2012 r. był w stanie likwidacji.	Y	likwidacji	2379	    1,572	0.0035	490.1429	pol_news_2016_00489962
16247	Od kilku miesięcy znajduje się w stanie likwidacji.	Y	likwidacji	2379	    1,572	0.0035	529.625	pol_news_2016_00489318
16248	Mówi się coraz częściej nawet o likwidacji stanowiska prezydenta.	Y	likwidacji	2379	    1,572	0.0035	616.1111	pol_news_2016_00386160
16249	W poniedziałek na stronie internetowej Amber Gold pojawiła się informacja o decyzji o likwidacji spółki.	Y	likwidacji	2379	    1,572	0.0035	936.4286	pol_news_2017_00877781
16250	Platforma chce likwidacji spraw wewnętrznych i administracji.	Y	likwidacji	2379	    1,572	0.0035	1185.8571	pol_news_2017_00534045
16251	A wszystko przez kilka lat, po kilka razy w miesiącu.	Y	miesiącu	2380	    1,571	0.0035	350.3333	pol_news_2018_00040677
16252	"""""""Według """"""""Pulsu Biznesu"""""""", jeszcze w tym miesiącu ma ona trafić do Sejmu."""""""	Y	miesiącu	2380	    1,571	0.0035	517.1667	pol_news_2018_00831076
16253	Wszystko rozpoczyna się już w tym miesiącu.	Y	miesiącu	2380	    1,571	0.0035	675	pol_news_2018_00902146
16254	Można tę decyzję zmienić w kolejny miesiącu.	Y	miesiącu	2380	    1,571	0.0035	739.7143	pol_news_2016_00390539
16255	Ma on zacząć obowiązywać po około miesiącu.	Y	miesiącu	2380	    1,571	0.0035	875.1429	pol_news_2016_00356419
16256	Więc jak to jest – chcemy innego życia, ale bez ryzyka?	Y	ryzyka	2380	    1,571	0.0035	448.6	pol_news_2016_00845308
16257	Deweloperzy nie boją się ryzyka - Puls Biznesu - pb.pl Z ostatniej chwili subskrypcja Pulsu Biznesu Wybierz pakiet dla siebie Bądź na bieżąco, gdziekolwiek jesteś!	Y	ryzyka	2380	    1,571	0.0035	501.3478	pol_news_2018_00121524
16258	Mecze Polski meczami wysokiego ryzyka - Puls Biznesu - pb.pl Z ostatniej chwili subskrypcja Pulsu Biznesu Wybierz pakiet dla siebie Bądź na bieżąco, gdziekolwiek jesteś!	Y	ryzyka	2380	    1,571	0.0035	578.3478	pol_news_2018_00357212
16259	Prognoza ryzyka recesji w USA najwyższa od 2 lat - Puls Biznesu - pb.pl Z ostatniej chwili subskrypcja Pulsu Biznesu Wybierz pakiet dla siebie Bądź na bieżąco, gdziekolwiek jesteś!	Y	ryzyka	2380	    1,571	0.0035	595.5385	pol_news_2018_00614168
16260	Awersja do ryzyka tak niska, jak przed kryzysem - Puls Biznesu - pb.pl Z ostatniej chwili subskrypcja Pulsu Biznesu Wybierz pakiet dla siebie Bądź na bieżąco, gdziekolwiek jesteś!	Y	ryzyka	2380	    1,571	0.0035	604.6154	pol_news_2017_00038584
16261	• Czy widzi Pan dla Ukrainy inną drogę do Europy niż przez Polskę?	Y	inną	2381	    1,570	0.0035	632.75	pol_news_2016_00124289
16262	Inną sprawą jest jakość i to, czy to są dokładnie te filmy, jakie dzieci chcą oglądać.	Y	inną	2381	    1,570	0.0035	752.8	pol_news_2018_00218738
16263	Jednak być może teraz zobaczymy jej inną twarz.	Y	inną	2381	    1,570	0.0035	762.5	pol_news_2017_00247120
16264	Jednak każdy z nas miał inną siłę, inne umiejętności.	Y	inną	2381	    1,570	0.0035	853.6667	pol_news_2018_00254400
16265	Teraz jej się udało zdobyć inną rolę.	Y	inną	2381	    1,570	0.0035	909.5714	pol_news_2018_00740624
16266	A może tak jeszcze raz do przedszkola?	Y	przedszkola	2381	    1,570	0.0035	376.5714	pol_news_2016_00037188
16267	Na dzieci was po prostu nie stać, a nie na przedszkola.	Y	przedszkola	2381	    1,570	0.0035	578.2222	pol_news_2016_00399771
16268	“Co powstanie na miejscu przedszkola na Nowym Mieście?”	Y	przedszkola	2381	    1,570	0.0035	702.4286	pol_news_2018_00094298
16269	Bo pieniądze, bo mieszkanie, bo przedszkola, szkoły.	Y	przedszkola	2381	    1,570	0.0035	875.2	pol_news_2016_00071237
16270	Samorząd szykuje się też do budowy przedszkola.	Y	przedszkola	2381	    1,570	0.0035	1091.4286	pol_news_2017_00666375
16271	To o 4 proc. więcej niż średnia europejska.	Y	średnia	2381	    1,570	0.0035	531.2857	pol_news_2017_00752751
16272	To więcej niż wynosi średnia dla krajów Unii Europejskiej.	Y	średnia	2381	    1,570	0.0035	551.8889	pol_news_2016_00765337
16273	Średnia kosztów dla tej grupy wyniosła ok. 78 tys. zł.	Y	średnia	2381	    1,570	0.0035	770.4444	pol_news_2016_00696823
16274	Jest to średnia wartość w skali światowej.	Y	średnia	2381	    1,570	0.0035	864.2857	pol_news_2016_00287905
16275	W styczniu średnia wartość kredytu wyniosła 210 tys. zł.	Y	średnia	2381	    1,570	0.0035	1214.125	pol_news_2018_00896472
16276	To ponad dwa razy mniej od kibiców z Ameryki Południowej.	Y	południowej	2382	    1,569	0.0035	683.1	pol_news_2018_00763603
16277	Dotyczy to szczególnie południowej części naszego kraju.	Y	południowej	2382	    1,569	0.0035	695.2857	pol_news_2018_00148176
16278	I tak też było z wyprawą do Ameryki Południowej, jaką odbył w tym roku, od lutego do czerwca.	Y	południowej	2382	    1,569	0.0035	743.8235	pol_news_2018_00225796
16279	Najwięcej problemów mogą mieć mieszkańcy południowej części kraju.	Y	południowej	2382	    1,569	0.0035	752.25	pol_news_2018_00404072
16280	Zaznacza, że 65 lat temu w południowej Anglii były warunki bardzo podobne do tych, które w ostatnich dniach panowały w Polsce.	Y	południowej	2382	    1,569	0.0035	787.7778	pol_news_2016_00957893
16281	I w związku z tym wiedział także o tym.	Y	wiedział	2382	    1,569	0.0035	350.75	pol_news_2018_00228853
16282	Zawsze wiedział co, kiedy i dlaczego chce powiedzieć.	Y	wiedział	2382	    1,569	0.0035	489.625	pol_news_2017_00958469
16283	Samochód to była tylko nasza decyzja - on o niczym nie wiedział.	Y	wiedział	2382	    1,569	0.0035	597.6364	pol_news_2018_00671407
16284	Zginął człowiek, który wiedział dużo, może za dużo.	Y	wiedział	2382	    1,569	0.0035	745.1429	pol_news_2017_00971042
16285	Nie wiedział, że syn zginął w walce z Niemcami w kwietniu 1943 roku.	Y	wiedział	2382	    1,569	0.0035	1007.5455	pol_news_2018_00460734
16286	Nikt nie wie, ile ich jest i jak jeszcze mogą wyglądać.	Y	wyglądać	2382	    1,569	0.0035	348.1818	pol_news_2016_00468340
16287	Jednak w każdym meczu może to inaczej wyglądać.	Y	wyglądać	2382	    1,569	0.0035	523.25	pol_news_2016_00266263
16288	Czy tak ma wyglądać polska szkoła w przyszłości?	Y	wyglądać	2382	    1,569	0.0035	623	pol_news_2018_00113088
16289	No i niby jak ma wyglądać porozumienie w sprawie TK?	Y	wyglądać	2382	    1,569	0.0035	747.8	pol_news_2016_00470095
16290	A szkoda, bo mogli wyglądać całkiem inaczej.	Y	wyglądać	2382	    1,569	0.0035	1013.8571	pol_news_2017_00033696
16291	W górnictwie działa ponad 240 związków zawodowych - Puls Biznesu - pb.pl Z ostatniej chwili subskrypcja Pulsu Biznesu Wybierz pakiet dla siebie Bądź na bieżąco, gdziekolwiek jesteś!	Y	zawodowych	2383	    1,568	0.0035	528.9583	pol_news_2018_00836403
16292	Francja zakładniczką związków zawodowych - Puls Biznesu - pb.pl Z ostatniej chwili subskrypcja Pulsu Biznesu Wybierz pakiet dla siebie Bądź na bieżąco, gdziekolwiek jesteś!	Y	zawodowych	2383	    1,568	0.0035	624.1818	pol_news_2017_00179829
16293	Część z nich to uczniowie szkół zawodowych.	Y	zawodowych	2383	    1,568	0.0035	652.5714	pol_news_2016_00114225
16294	W naszym regionie mają miejsce ciekawe wydarzenia, jest wiele spraw, o których warto napisać, ale nie sposób zaangażować we wszystko zawodowych dziennikarzy.	Y	zawodowych	2383	    1,568	0.0035	696.4545	pol_news_2018_00865175
16295	Jednak to nie koniec jej zawodowych planów.	Y	zawodowych	2383	    1,568	0.0035	734.2857	pol_news_2018_00256211
16296	Co oni maja powiedzieć jak żyją z dnia na dzień.	Y	żyją	2383	    1,568	0.0035	432.3	pol_news_2016_00105465
16297	Czego oni chcą i dlaczego oni tak żyją?	Y	żyją	2383	    1,568	0.0035	549.4286	pol_news_2017_00099589
16298	Dwie osoby nie żyją Śmierć Polaków w Niemczech!	Y	żyją	2383	    1,568	0.0035	680.5	pol_news_2018_00156070
16299	Szkoda, że w ogóle tacy żyją na świecie.	Y	żyją	2383	    1,568	0.0035	867.75	pol_news_2018_00716322
16300	Mężczyźni w Rosji żyją średnio około 57 lat.	Y	żyją	2383	    1,568	0.0035	974.2857	pol_news_2016_00365435
16301	Stawki i przepisy w Polsce s± inne.	Y	stawki	2384	    1,567	0.0035	529.4286	pol_news_2017_00695854
16302	Dlaczego stawki podatku od nieruchomości są tu wyższe niż w Warszawie?	Y	stawki	2384	    1,567	0.0035	659.7273	pol_news_2018_00123395
16303	Pierwsza jest taka, że na wiele produktów są różne stawki VAT na produkty bardzo podobne.	Y	stawki	2384	    1,567	0.0035	751.2143	pol_news_2016_00533889
16304	Według niego bez zmiany stawki VAT utrzymanie takiego wzrostu nie jest możliwe.	Y	stawki	2384	    1,567	0.0035	755.4167	pol_news_2018_00829786
16305	Podatek od handlu: Dwie stawki i kwota wolna.	Y	stawki	2384	    1,567	0.0035	1217.5	pol_news_2018_00548460
16306	Tak nie by³o ostatnio, wiêc moje dwa gole nie da³y zbyt wiele.	Y	gole	2385	    1,566	0.0035	512.9231	pol_news_2018_00726429
16307	Prawda jest jednak taka, że Tusk powinien w tym meczu strzelić nie dwa, ale co najmniej cztery gole.	Y	gole	2385	    1,566	0.0035	551.2778	pol_news_2018_00604661
16308	Pierwszy strzeli³ cztery gole a drugi tylko o jednego mniej.	Y	gole	2385	    1,566	0.0035	656.5	pol_news_2017_00528786
16309	Ju¿ wiemy, dlaczego w tym sezonie strzeli³ tylko dwa gole.	Y	gole	2385	    1,566	0.0035	703.9	pol_news_2018_00286601
16310	Trzy gole w siedem minut wszystko jednak zmieni³y.	Y	gole	2385	    1,566	0.0035	705.4444	pol_news_2018_00779524
16311	W tej ostatniej zdobyli¶my I miejsce.	Y	zdobyli	2385	    1,566	0.0035	414.8571	pol_news_2016_00906814
16312	Polacy zdobyli do tej pory jednego gola, a Niemcy dwa.	Y	zdobyli	2385	    1,566	0.0035	597.1	pol_news_2016_00562055
16313	Ostatni raz Puchar Polski zdobyli w 1972 roku.	Y	zdobyli	2385	    1,566	0.0035	684.1429	pol_news_2016_00514607
16314	Niemcy zdobyli mistrzostwo Europy już trzy razy.	Y	zdobyli	2385	    1,566	0.0035	892.1429	pol_news_2017_00436825
16315	Podczas pierwszego dnia zawodów zdobyli dwa medale.	Y	zdobyli	2385	    1,566	0.0035	1095.1429	pol_news_2018_00549910
16316	Zespó³ zajmuje 11. miejsce na Wschodzie, które prawa do w play-off nie daje.	Y	off	2386	    1,565	0.0035	771.6923	pol_news_2017_00969087
16317	Na play-off bêdzie jednak w formie »	Y	off	2386	    1,565	0.0035	895.2857	pol_news_2018_00412522
16318	"""""""NBA - informacje na tematy """"""""NBA"""""""" oraz """"""""play off"""""""" - Tagi - znajdź treść po hasłach."""""""	Y	off	2386	    1,565	0.0035	917.3333	pol_news_2017_00422669
16319	Kto z kim w 1. rundzie play-off?	Y	off	2386	    1,565	0.0035	1039.4286	pol_news_2016_00332506
16320	Jego zespó³ straci³ szanse na awans do play-off.	Y	off	2386	    1,565	0.0035	1186.5556	pol_news_2018_00265009
16321	Sprawdź, czy nie masz w domu tych leków.	Y	leków	2387	    1,564	0.0035	653.25	pol_news_2018_00695126
16322	A co to oznacza dla producentów leków?	Y	leków	2387	    1,564	0.0035	741.1429	pol_news_2016_00016632
16323	Poza tym, ceny leków są zbyt wysokie.	Y	leków	2387	    1,564	0.0035	783.5714	pol_news_2018_00597704
16324	Zobacz W środę (16 listopada) pacjentów czekają zmiany cen leków.	Y	leków	2387	    1,564	0.0035	944.4444	pol_news_2018_00985257
16325	Wiesz, brakuje w zasadzie wszystkiego, przede wszystkim leków.	Y	leków	2387	    1,564	0.0035	1261.375	pol_news_2017_00847377
16326	Jak zostać mistrzem świata w ciągu dwóch lat?	Y	mistrzem	2387	    1,564	0.0035	466.5	pol_news_2017_00242088
16327	Nadal nie wiadomo, kto zostanie mistrzem Polski.	Y	mistrzem	2387	    1,564	0.0035	506	pol_news_2017_00381778
16328	We wtorek po raz drugi w karierze został mistrzem Europy.	Y	mistrzem	2387	    1,564	0.0035	577.6	pol_news_2018_00834935
16329	Warto wiedzieć, że w 1972 roku został mistrzem Europy.	Y	mistrzem	2387	    1,564	0.0035	617.625	pol_news_2018_00816066
16330	Najważniejsze jednak, że za chwilę City zostaną mistrzem Anglii.	Y	mistrzem	2387	    1,564	0.0035	957	pol_news_2018_00403448
16331	Zawsze coś się znajdzie – jak nie na niego, to na rodzinę.	Y	rodzinę	2387	    1,564	0.0035	492.6	pol_news_2017_00957990
16332	Dzisiaj każdy z nich ma swoją rodzinę.	Y	rodzinę	2387	    1,564	0.0035	495.8571	pol_news_2017_00163700
16333	Dodaj komentarz do artykułu, aby dodać komentarz ukryj najgorzej ocenianepokaż wszystkie komentarze Miała rodzinę, syna czy kogo tam jeszcze więc miała za co żyć.	Y	rodzinę	2387	    1,564	0.0035	774.5	pol_news_2017_00131511
16334	Jest to miejsce, które łączy całą naszą rodzinę.	Y	rodzinę	2387	    1,564	0.0035	886.75	pol_news_2018_00278636
16335	Też bym chciała mieć tak dużą rodzinę.	Y	rodzinę	2387	    1,564	0.0035	1109.4286	pol_news_2017_00739621
16336	Może właśnie z tego się to wzięło.	Y	wzięło	2387	    1,564	0.0035	378	pol_news_2017_00372680
16337	Wzięło w niej udział kilka tysięcy osób.	Y	wzięło	2387	    1,564	0.0035	488.5714	pol_news_2017_00932995
16338	Wzięło w nim udział 18 zespołów z Polski i Ukrainy.	Y	wzięło	2387	    1,564	0.0035	636	pol_news_2018_00931372
16339	Kilku piłkarzy nie wzięło w nim udziału.	Y	wzięło	2387	    1,564	0.0035	833.8571	pol_news_2018_00303272
16340	W sumie w imprezie wzięło udział około 1000 zawodników.	Y	wzięło	2387	    1,564	0.0035	1024.2857	pol_news_2018_00897015
