ORDER	SENTENCE	STATUS	WORD	RANK	COUNT	COUNT_REL	INDEX	ID
24583	Er habe bereits beim Rat im Juni diese Frage angesprochen, weil sie natürlich eine ganz wesentliche Frage für Österreich darstellt, so Gusenbauer.	Y	darstellt	1910	    293	0.0018	413.5238	german_at_news_2012_00436053
24584	Es ist klar, dass eine große Lösung auch eine große Herausforderung darstellt.	Y	darstellt	1910	    293	0.0018	469.5	german_at_news_2012_00462567
24585	Was für die Kinder “ein Abenteuer” darstellt, ist für viele Erwachsene eine Rückkehr in die Kindheit.	Y	darstellt	1910	    293	0.0018	666.8571	german_at_news_2012_00924994
24586	So seien diese bei den über 60-jährigen um zwölf Prozent gesenkt worden.	Y	gesenkt	1910	    293	0.0018	326.25	german_at_news_2012_00830745
24587	Geht es nach der ÖVP, soll der Satz von 50 auf 42 Prozent gesenkt werden.	Y	gesenkt	1910	    293	0.0018	330.25	german_at_news_2012_00507079
24588	Bei den Wiener Linien geht man davon aus, dass dadurch die Energiekosten um etwa 60 % gesenkt werden können.	Y	gesenkt	1910	    293	0.0018	422.6471	german_at_news_2012_00096489
24589	Hier heißt es zusätzlich schnell sein und noch dieses Jahr starten, denn ab 2011 wird die staatliche Prämie von derzeit 3,5 Prozent auf dann 3 Prozent gesenkt.	Y	gesenkt	1910	    293	0.0018	422.7391	german_at_news_2012_00539175
24590	Die Forderungen an Kunden wurden um 2,8 Prozent auf 76,4 Milliarden Euro gesenkt (2001: 78,6 Milliarden Euro).	Y	gesenkt	1910	    293	0.0018	434.9091	german_at_news_2012_00302426
24591	Die besten neuen iOS 6-Funktionen Geben Sie hier die E-Mail-Adresse des Empfängers ein (z.B. xy@z.com). Mehrere Empfänger werden durch Kommata getrennt.	Y	ios	1910	    293	0.0018	364.125	german_at_news_2012_00286894
24592	Sie können die Geräte, die bereits mit iOS 5 laufen, also schon voll nutzen.	Y	ios	1910	    293	0.0018	495.1667	german_at_news_2012_00809928
24593	Anna brachte zwar einige Verbesserungen mit sich, konnte aber im Vergleich zu Android oder iOS noch immer nicht überzeugen.	Y	ios	1910	    293	0.0018	540.4211	german_at_news_2012_00052905
24594	Apples iOS 6 wird voraussichtlich erst im Herbst auf den Markt kommen.	Y	ios	1910	    293	0.0018	636.5455	german_at_news_2012_00056027
24595	Denn diese Version wird (wie Apples iOS ) auf Smartphones und Tablets laufen.	Y	ios	1910	    293	0.0018	770.5	german_at_news_2012_00219892
24596	Ich habe ein klares Bild davon, wie unser Land sein soll.	Y	klares	1910	    293	0.0018	320.2727	german_at_news_2012_00553082
24597	Es gehe in jedem Fall darum, ein klares Signal zu setzen, dass Kärnten auch für die vielen kleinen Unternehmen da sei.	Y	klares	1910	    293	0.0018	390.9524	german_at_news_2012_00455079
24598	Das Museum hat fünf Jahre hinter sich, in denen es ein klares Profil gewonnen hat und wieder zu einem kulturellen Faktor in der Stadt wurde.	Y	klares	1910	    293	0.0018	408.087	german_at_news_2012_00186249
24599	Scheibner: Es ist ein klares Signal an alle in der Partei.	Y	klares	1910	    293	0.0018	543.1818	german_at_news_2012_00780212
24600	Deshalb haben wir ein klares Konzept für die neue Bundesregierung erarbeitet.	Y	klares	1910	    293	0.0018	570.0909	german_at_news_2012_00271249
24601	Er selbst sei diesmal zwar nicht dabei gewesen, dafür aber ein Kollege.	Y	kollege	1910	    293	0.0018	325.3333	german_at_news_2012_00444066
24602	Sein Kollege aus Berlin ist anderer Meinung: Johannes G. hatte drei Kinder aus seiner Ehe, weitere wollte er nicht.	Y	kollege	1910	    293	0.0018	481.3889	german_at_news_2012_00794010
24603	Nur wenige Tage später kommt der Kollege mit seinen größten Hits ins Zentrum von Tirol.	Y	kollege	1910	    293	0.0018	528.4	german_at_news_2012_00736087
24604	Dann kam sein 20-jähriger Kollege nach, um sich an die Hände des Älteren zu hängen.	Y	kollege	1910	    293	0.0018	561.4667	german_at_news_2012_00152995
24605	Ausgerechnet am Tag der Frau, also gestern, überrascht der Kollege mit der Nachricht, nichts mehr zu rauchen.	Y	kollege	1910	    293	0.0018	711	german_at_news_2012_00083309
24606	Abgeordnete PFEFFER (S) räumte ein, dass es sich die SPÖ nicht leicht gemacht habe.	Y	pfeffer	1910	    293	0.0018	456.2143	german_at_news_2012_00012583
24607	Wie weit die Zone dann geht, „wird auch eine Frage sein, wo hoffentlich auch noch die Bürger Antworten geben“, so Pfeffer.	Y	pfeffer	1910	    293	0.0018	482	german_at_news_2012_00960702
24608	Bei Pfeffer macht es sich gut, dass er eine prägnante Stimme hat, mit der er umzugehen weiß.	Y	pfeffer	1910	    293	0.0018	500.625	german_at_news_2012_00104882
24609	Im Jahr 1999 war Pfeffer auch beim 0:9-Debakel der österreichischen Nationalmannschaft gegen Spanien dabei.	Y	pfeffer	1910	    293	0.0018	595.2308	german_at_news_2012_00573237
24610	Nur zweieinhalb Wochen vor der Präsidentenwahl am 25. April kommt endlich Pfeffer in den Wahlkampf.	Y	pfeffer	1910	    293	0.0018	622.3571	german_at_news_2012_00736392
24611	Bisher war das nur am Flughafen in Wien Schwechat möglich.	Y	schwechat	1910	    293	0.0018	398.4	german_at_news_2012_00118378
24612	Nach Mord in Schwechat: Verdächtige festgenommen Geben Sie hier die E-Mail-Adresse des Empfängers ein (z.B. xy@z.com). Mehrere Empfänger werden durch Kommata getrennt.	Y	schwechat	1910	    293	0.0018	466.6923	german_at_news_2012_00710070
24613	Am nächsten Tag in der Früh fuhr die Familie mit der Frau zum Flughafen Wien-Schwechat.	Y	schwechat	1910	    293	0.0018	467.8667	german_at_news_2012_00043458
24614	Berichten der Tageszeitung “Österreich” zufolge soll George Michael bereits auf dem Weg zum Flughafen Wien-Schwechat sein.	Y	schwechat	1910	    293	0.0018	581.4706	german_at_news_2012_00109297
24615	Am folgenden Morgen fuhr die Familie mit ihr zum Flughafen Wien-Schwechat.	Y	schwechat	1910	    293	0.0018	671.3333	german_at_news_2012_00041604
24616	Ob Man das nun gut finden soll, oder nicht, bleibt jedem selbst überlassen.	Y	überlassen	1910	    293	0.0018	299.6154	german_at_news_2012_00739142
24617	Das Thema Pensionen sei viel zu wichtig, um es ÖVP und FPÖ zu überlassen.	Y	überlassen	1910	    293	0.0018	368	german_at_news_2012_00200135
24618	Das muss man den Leuten in jedem Land selbst überlassen.	Y	überlassen	1910	    293	0.0018	462.6	german_at_news_2012_00186497
24619	Im Hotel der Zukunft wird nichts mehr dem Zufall überlassen.	Y	überlassen	1910	    293	0.0018	508.6	german_at_news_2012_00572710
24620	Man dürfe Qualität nicht dem Zufall überlassen, sondern müsse sie gezielt produzieren.	Y	überlassen	1910	    293	0.0018	847.0833	german_at_news_2012_00664658
24621	Aber dann kommt in der Bevölkerung wieder das Bedürfnis nach mehr Sicherheit und Stabilität durch, und die üblichen Themen des Populismus werden weniger wichtig.	Y	üblichen	1910	    293	0.0018	478.087	german_at_news_2012_00003253
24622	Auf die Kunst aus Südost setzt er nicht etwa deshalb, weil sie billiger sei (was sie nicht ist), „sondern weil es so spannend ist, sich nicht in den üblichen Bahnen zu bewegen“.	Y	üblichen	1910	    293	0.0018	491.2963	german_at_news_2012_00076864
24623	Für den letzten Kilometer brauchte ich über sieben Minuten statt der üblichen 4:15!	Y	üblichen	1910	    293	0.0018	520.5	german_at_news_2012_00492993
24624	So werden Sie fit für die Bikini-Saison Was tun, wenn ein Mensch so dick ist, dass er im Krankenhaus nicht mehr mit den üblichen Geräten behandelt werden kann?	Y	üblichen	1910	    293	0.0018	520.8889	german_at_news_2012_00833074
24625	Früher oder später finden alle Kinder heraus, dass ihre Eltern nicht vollkommen sind, aber Chelsea wurde mit etwas konfrontiert, das den Rahmen des Üblichen sprengte.	Y	üblichen	1910	    293	0.0018	540.68	german_at_news_2012_00489522
24626	Das wurde zwar nicht so direkt ausgesprochen, aber es wurde gesagt, dass man eine Diskussion zur Vergabe nicht brauchen kann.	Y	vergabe	1910	    293	0.0018	390.4444	german_at_news_2012_00206520
24627	Über die Vergabe von Regierungsämtern sei nicht gesprochen worden, sagte Gusenbauer auf den Hinweis eines Journalisten, dass die ÖVP bereits den Finanzminister gefordert haben soll.	Y	vergabe	1910	    293	0.0018	510.8696	german_at_news_2012_00860310
24628	Neu: Flug Klagenfurt - Wien ab 20 Euro und in nur 25 Minuten Die Vergabe der neuen Linienflugverbindung Klagenfurt - Wien wird in den nächsten Tagen erfolgen.	Y	vergabe	1910	    293	0.0018	515.95	german_at_news_2012_00720330
24629	Doch er erinnert sich an ein früheres Treffen mit AKH-Beamten, als es um eine andere Vergabe ging.	Y	vergabe	1910	    293	0.0018	540.9444	german_at_news_2012_00385346
24630	Ja die werden uns bald überlaufen,bzw es dauert nicht mehr lang.sieht man ja an der gemeindewohnungs vergabe.	Y	vergabe	1910	    293	0.0018	549.7778	german_at_news_2012_00617519
24631	In Österreich tragen 0,4 – 0,5 Prozent der Bevölkerung das Virus, das sind rund 40.000 Menschen.	Y	virus	1910	    293	0.0018	337.8182	german_at_news_2012_00605295
24632	In Europa oder den USA sei der Virus bisher nicht entdeckt worden.	Y	virus	1910	    293	0.0018	354.8333	german_at_news_2012_00599424
24633	Die Hintermänner des Super-Virus Geben Sie hier die E-Mail-Adresse des Empfängers ein (z.B. xy@z.com). Mehrere Empfänger werden durch Kommata getrennt.	Y	virus	1910	    293	0.0018	438	german_at_news_2012_00312544
24634	Doch der Virus Handball ist immer noch so tief in mir drin und nach den ersten Trainings mit der Mannschaft war mir klar, dass ich so richtig heiß bin, wieder spielen zu können“, erklärt der 34-Jährige.	Y	virus	1910	    293	0.0018	463.4375	german_at_news_2012_00384222
24635	Obama ordnete Virus-Attacke auf Iran an Geben Sie hier die E-Mail-Adresse des Empfängers ein (z.B. xy@z.com). Mehrere Empfänger werden durch Kommata getrennt.	Y	virus	1910	    293	0.0018	489.7778	german_at_news_2012_00736961
24636	In absoluten Zahlen waren im Vorjahr in Salzburg um rund 1.050 und in Österreich um mehr als 15.700 Personen mehr in Beschäftigung als ein Jahr zuvor.	Y	absoluten	1911	    292	0.0018	351.4444	german_at_news_2012_00584648
24637	Auch in Österreich gibt es eine Partei, die den absoluten Ausstieg aus allem will, ohne auch nur im Geringsten Ahnung davon zu haben, was das wirklich bedeutet.	Y	absoluten	1911	    292	0.0018	396	german_at_news_2012_00069156
24638	In absoluten Zahlen bedeutet dies eine Budget-Erhöhung seit 2001 von 167,3 Millionen Euro auf 229,2 Millionen Euro im Jahr 2012.	Y	absoluten	1911	    292	0.0018	419.6	german_at_news_2012_00584635
24639	Bei seiner ersten Kommunalwahl 1987 wurde diese Politik mit einer absoluten Mehrheit von fast 55 Prozent für die SPÖ belohnt.	Y	absoluten	1911	    292	0.0018	451.2222	german_at_news_2012_00105279
24640	Die ÖVP ist eine Machtpartei, die noch mehr als durch die absoluten Alleinregierungen der SPÖ dadurch gekränkt wurde, dass sie 13 Jahre lang die Nummer zwei in jener Koalition sein musste, die am Ende niemand mehr haben wollte.	Y	absoluten	1911	    292	0.0018	462.125	german_at_news_2012_00334047
24641	Das Problem bestehe später einfach darin, dass die Kinder „online“ sind.	Y	bestehe	1911	    292	0.0018	408	german_at_news_2012_00189392
24642	Die Regierung gehe daher den richtigen Weg, und genau darin bestehe ihre Qualität.	Y	bestehe	1911	    292	0.0018	488.2308	german_at_news_2012_00339494
24643	Es bestehe aber die Gefahr, dass der Konsum zu einer Art Religion wird.	Y	bestehe	1911	    292	0.0018	541.4615	german_at_news_2012_00452599
24644	Dieses Problem bestehe vor allem an kleinen Schulen im ländlichen Raum.	Y	bestehe	1911	    292	0.0018	604.2727	german_at_news_2012_00354805
24645	Der Botschafter strich die gute Freundschaft und Kooperation hervor, welche zwischen Kärnten und Slowenien bestehe.	Y	bestehe	1911	    292	0.0018	879.2857	german_at_news_2012_00233320
24646	Nur keiner von denen hat die Eier selbst in die Politik zu gehen und zu versuchen es wirklich besser zu machen.	Y	eier	1911	    292	0.0018	310.3333	german_at_news_2012_00734966
24647	Dann muss ich aber auch verlangen können, dass sie die Eier in die Hand nehmen und ums Leben laufen.“	Y	eier	1911	    292	0.0018	404.3333	german_at_news_2012_00153467
24648	Die Eier waren immer in der Mitten, das hat passen müssen.	Y	eier	1911	    292	0.0018	499.1818	german_at_news_2012_00293946
24649	Sie legen innerhalb ihres drei Wochen langen Lebens bis zu 2000 Eier.	Y	eier	1911	    292	0.0018	647.7273	german_at_news_2012_00810583
24650	Hauptsächlich werden Milch aber auch Fleisch, Eier, Gemüse und Obst geliefert.	Y	eier	1911	    292	0.0018	1101.3636	german_at_news_2012_00531256
24651	Der Handel wird sich nicht nur auf die Bedürfnisse seiner Kunden sondern vor allem auch auf die seiner Mitarbeiter einstellen müssen.	Y	einstellen	1911	    292	0.0018	377.1667	german_at_news_2012_00243440
24652	Je mehr Daten das System erhält, desto besser kann es auch selbst lernen und sich auf die Menschen in der Umgebung einstellen.	Y	einstellen	1911	    292	0.0018	429.4091	german_at_news_2012_00622129
24653	Das BZÖ wird sich klein aber fein auf diese Koalition einstellen.	Y	einstellen	1911	    292	0.0018	592.5455	german_at_news_2012_00163850
24654	Dadurch würden Betriebe auch mehr ältere Arbeitnehmer einstellen und sie im Betrieb behalten.	Y	einstellen	1911	    292	0.0018	757.6154	german_at_news_2012_00137385
24655	Das heißt, die MA 13 könnte die Förderung praktisch jederzeit einstellen.	Y	einstellen	1911	    292	0.0018	939.8889	german_at_news_2012_00174338
24656	Ja, mit der Zeit hat er das ein bisschen weniger oft erwähnt.	Y	erwähnt	1911	    292	0.0018	313.5833	german_at_news_2012_00618347
24657	Erwähnt wurde auch, dass 99 Prozent der Besucher die Ausstellung mit „sehr gut“ oder „gut“ bewertet haben.	Y	erwähnt	1911	    292	0.0018	321.2667	german_at_news_2012_00449502
24658	OÖN: Sie haben bereits die Steuerreform erwähnt, Was sollen die Leute mit dem Geld tun?	Y	erwähnt	1911	    292	0.0018	423.3571	german_at_news_2012_00746576
24659	Seit mehreren Wochen werden sie mit keinem Wort mehr erwähnt!	Y	erwähnt	1911	    292	0.0018	598.7	german_at_news_2012_00799001
24660	Obwohl er die nächste iPhone-Generation nicht direkt erwähnt, wissen alle welches Gerät er damit meint.	Y	erwähnt	1911	    292	0.0018	630.2	german_at_news_2012_00740222
24661	Ich halte das für nicht sehr fair und bin davon auch überrascht worden.	Y	fair	1911	    292	0.0018	435.2308	german_at_news_2012_00554953
24662	Hart aber fair“-Kritik: Wenn Stress kein Spaß mehr ist Und überhaupt: Stress ist nicht gleich Stress.	Y	fair	1911	    292	0.0018	547.6429	german_at_news_2012_00529107
24663	Hundstorfer: Alles andere als fair Sozialminister Rudolf Hundstorfer (SPÖ) gab am Samstag mit dem Kärntner SPÖ-Chef Peter Kaiser eine Pressekonferenz.	Y	fair	1911	    292	0.0018	632.6842	german_at_news_2012_00546381
24664	Ich würde an seiner Stelle die Angelegenheit fair und korrekt regeln.	Y	fair	1911	    292	0.0018	729.0909	german_at_news_2012_00562388
24665	Angesichts der Ausstattung scheinen die Preise durchaus fair zu sein.	Y	fair	1911	    292	0.0018	796.1	german_at_news_2012_00051176
24666	Es gibt keine Orgasmusmedizin“, sagt Gruber, „und die ist auch nicht in Sicht.	Y	gruber	1911	    292	0.0018	412.6154	german_at_news_2012_00457526
24667	Heute arbeiten unter der Leitung von Maria Gruber 33 Personen mit.	Y	gruber	1911	    292	0.0018	496.8	german_at_news_2012_00535095
24668	Ich gehe davon aus, dass er die Politik und seine Arbeit in der Behörde strikt zu trennen weiß“, sagt Gruber.	Y	gruber	1911	    292	0.0018	498.85	german_at_news_2012_00551319
24669	Das Land muss umdenken, wenn wir durch die Fusion eine starke Gemeinde werden sollen“, so Gruber.	Y	gruber	1911	    292	0.0018	524.5	german_at_news_2012_00183640
24670	Als Wahlziel nennt Gruber bisher lediglich, die ÖVP in Innsbruck wolle bei der Wahl im April „stärker werden“.	Y	gruber	1911	    292	0.0018	556	german_at_news_2012_00036429
24671	Dabei war der 52-Jährige mehr als sein halbes Leben bei der SPÖ.	Y	halbes	1911	    292	0.0018	248.8182	german_at_news_2012_00134558
24672	Auch diese mussten erst produziert werden, kamen daher erst ein halbes Jahr später, also erst im Herbst 2006, in den Handel.	Y	halbes	1911	    292	0.0018	443.0556	german_at_news_2012_00064668
24673	In 14 Monaten wird Österreich für ein halbes Jahr den Vorsitz in der Europäischen Union übernehmen.	Y	halbes	1911	    292	0.0018	489.7857	german_at_news_2012_00584462
24674	Das heißt: Tritt das Urteil in Kraft, muss Scheuch für ein halbes Jahr ins Gefängnis.	Y	halbes	1911	    292	0.0018	601.4286	german_at_news_2012_00174574
24675	Bereits sein halbes Leben wird Sebastian Vettel (24) von Red Bull unterstützt.	Y	halbes	1911	    292	0.0018	770.3636	german_at_news_2012_00108784
24676	Die SPÖ hatte bei der Wahl einen Verlust von 5,1 Prozentpunkten hinnehmen müssen und war nur mehr auf 14,5 Prozent gekommen.	Y	hinnehmen	1911	    292	0.0018	387.5263	german_at_news_2012_00361187
24677	Die ÖVP will aus dem ORF einen Parteifunk machen und das können wir nicht hinnehmen“, so Van der Bellen bei einer Pressekonferenz am 28.06.	Y	hinnehmen	1911	    292	0.0018	394.9565	german_at_news_2012_00334360
24678	Auch wenn ihr Nutzen für uns alle Alltag geworden ist, sollten wir ihn nicht als selbstverständlich hinnehmen.	Y	hinnehmen	1911	    292	0.0018	415.7647	german_at_news_2012_00072933
24679	Nach einem 5:3 gegen Ungarn und einem 3:1-Sieg gegen Italien musste das Team Österreich jedoch im Abschluss-Spiel eine 1:5-Niederlage hinnehmen, berichtet der ÖEHV in einer So., 13. Februar 2005 - 17:13 Uhr Das war es!	Y	hinnehmen	1911	    292	0.0018	431.8929	german_at_news_2012_00707520
24680	Für die Zeit ab 2012 hat die Hypo den Provisionsvertrag mit dem Land gekündigt, auch das will die Landesregierung nicht einfach so hinnehmen.	Y	hinnehmen	1911	    292	0.0018	460.25	german_at_news_2012_00496441
24681	Jetzt würden mehr Akteure als noch vor drei Jahren in der HLA spielen wollen, es sei nun attraktiv, bei uns zu spielen.	Y	hla	1911	    292	0.0018	359.0952	german_at_news_2012_00626335
24682	HLA: Favoriten setzen sich durch So., 01. Februar 2009 - 13:41 Uhr In den drei Spielen der HLA setzten sich am Samstag die Favoriten durch.	Y	hla	1911	    292	0.0018	448.1765	german_at_news_2012_00543281
24683	Sie haben seit dem 31:34 zum HLA-Auftakt bei den Fivers in Wien am 4. September kein Match mehr verloren.	Y	hla	1911	    292	0.0018	479.6111	german_at_news_2012_00807225
24684	So., 09. November 2008 - 16:08 Uhr In der 10. Runde der HLA war es soweit.	Y	hla	1911	    292	0.0018	503.9	german_at_news_2012_00820002
24685	Der Erfolg dürfte zur rechten Zeit gekommen sein, denn in der HLA ist es für die Margaretner nicht nach Wunsch gelaufen.	Y	hla	1911	    292	0.0018	526.35	german_at_news_2012_00237816
24686	Das Problem ist wie immer, dass Europa immer in die Knie geht wenn Druck von Außen kommt.	Y	knie	1911	    292	0.0018	336.3125	german_at_news_2012_00189577
24687	Er geht sogar auf die Knie und macht ihr einen Antrag.	Y	knie	1911	    292	0.0018	352.8182	german_at_news_2012_00435614
24688	Abgesehen davon, war es ein Schuss ins Knie, denn der Euro ist auch nach der Griechenland-Hilfe weiter nach unten gegangen.	Y	knie	1911	    292	0.0018	541.7368	german_at_news_2012_00013214
24689	Das Ergebnis: Bewegen sich die Knie gerade nach unten, ist alles in Ordnung.	Y	knie	1911	    292	0.0018	558.4615	german_at_news_2012_00166385
24690	"""Wie tief kann Minister Pröll eigentlich noch vor der Industrie und Minister Bartenstein in die Knie gehen?"""" fragt Glawischnig."""	Y	knie	1911	    292	0.0018	640.5	german_at_news_2012_00959881
24691	Sie wurden von der Rettung in das LKH Villach gebracht.	Y	lkh	1911	    292	0.0018	585.2	german_at_news_2012_00817768
24692	Der 40-Jährige erlitt schwere Verletzungen an der Hand und wurde ins LKH Graz gebracht.	Y	lkh	1911	    292	0.0018	628.4615	german_at_news_2012_00227482
24693	Eines der größten Vorhaben sei laut Voves das Projekt LKH 2020.	Y	lkh	1911	    292	0.0018	682.6	german_at_news_2012_00413537
24694	Der Verletzte wurde von der Rettung in das LKH Villach gebracht.	Y	lkh	1911	    292	0.0018	739.1	german_at_news_2012_00265251
24695	Die Verletzten wurden ins LKH Graz eingeliefert, der Amerikaner angezeigt.	Y	lkh	1911	    292	0.0018	954.3	german_at_news_2012_00372382
24696	Das ist mir sehr wichtig, das gibt mir den nötigen Halt.	Y	nötigen	1911	    292	0.0018	398.2222	german_at_news_2012_00179433
24697	Hochegger sagt, dass er alle dafür nötigen Informationen von Ihnen hatte.	Y	nötigen	1911	    292	0.0018	431.4545	german_at_news_2012_00543496
24698	Seine Chancen, die für den Wiedereinzug ins Europäische Parlament nötigen 5,6 Prozent der Stimmen in Österreich zu erreichen, stehen nicht schlecht.	Y	nötigen	1911	    292	0.0018	471.9	german_at_news_2012_00791474
24699	All das kann den nötigen Halt geben, um mit der neuen Situation umzugehen.	Y	nötigen	1911	    292	0.0018	501.4615	german_at_news_2012_00020866
24700	Auf Twitter und Facebook bekomme ich hingegen wirklich viele Reaktionen - wobei ich ja der ganz große Twitter-Fan bin, zu Facebook habe ich mich eher nötigen lassen.	Y	nötigen	1911	    292	0.0018	551.913	german_at_news_2012_00080703
24701	Das Power-Paar hielt es nur zwei Jahre miteinander aus, doch seit der Scheidung 1991 sind sie noch gut befreundet.	Y	power	1911	    292	0.0018	466.5789	german_at_news_2012_00189169
24702	Finanzielle Sorgen muss sich die Power-Frau aus Russland auch nicht machen.	Y	power	1911	    292	0.0018	479.8333	german_at_news_2012_00481828
24703	Das gibt dem Kreislauf neue Power und das Gefühl, nicht mehr so erhitzt zu sein.	Y	power	1911	    292	0.0018	545.5714	german_at_news_2012_00171425
24704	Albano & Romina Power: Rosenkrieg Geben Sie hier die E-Mail-Adresse des Empfängers ein (z.B. xy@z.com). Mehrere Empfänger werden durch Kommata getrennt.	Y	power	1911	    292	0.0018	553.5417	german_at_news_2012_00019937
24705	Bisher noch alle überlebt hat das schon seit über 10 Jahren existierende Power Team.	Y	power	1911	    292	0.0018	555.0769	german_at_news_2012_00118236
24706	Und so haben wir uns eigentlich auch an die Bücher herangetastet, damit jeder das findet, was er braucht und alles was dazugehört“, so Renate Jeblinger.	Y	renate	1911	    292	0.0018	550	german_at_news_2012_00881703
24707	Bis sieben wollte ihn Ehefrau Renate schlafen lassen, dann wusste sie, dass etwas nicht in Ordnung sein konnte.	Y	renate	1911	    292	0.0018	561.0556	german_at_news_2012_00119335
24708	Auch die Österreicherin Renate Götschl, die nach dem ersten Lauf Dritte war, dann aber auf dem achten Platz landete, ist zufrieden, unter den ersten zehn zu sein.	Y	renate	1911	    292	0.0018	576.1667	german_at_news_2012_00064334
24709	Die BHS-Schüler können in den 27 EU-Ländern und auch in der Türkei ihr Praktikum mit einem Zuschuss von 500 bis 1500 Euro machen“, sagt Renate Kanovsky-Wintermann.	Y	renate	1911	    292	0.0018	638.28	german_at_news_2012_00287948
24710	Adresse, Postleitzahl, Ort oder Bezirk Renate Braun hat noch keine Favoriten.	Y	renate	1911	    292	0.0018	644.2727	german_at_news_2012_00017659
24711	Ich bin jetzt 44 Jahre alt, da habe ich einiges erlebt in diesen Jahren und da geht der Stoff nicht so schnell aus.	Y	stoff	1911	    292	0.0018	341.25	german_at_news_2012_00548433
24712	Ja, Leute, das ist der Stoff, aus dem in der FPK Politik gemacht wird.	Y	stoff	1911	    292	0.0018	364.3846	german_at_news_2012_00618254
24713	Aber ich hatte zunächst auch die Sprache und den Stoff verloren.	Y	stoff	1911	    292	0.0018	418	german_at_news_2012_00007349
24714	Das gibt zwar der Opposition von Sozialdemokraten und Grünen Stoff für Kritik: etwa die Pensionsreform.	Y	stoff	1911	    292	0.0018	523.6667	german_at_news_2012_00171510
24715	Tatsächlich: Dieser hier handelt – in jeder Beziehung – mit gutem Stoff.	Y	stoff	1911	    292	0.0018	667.2	german_at_news_2012_00848590
24716	Weil Österreich das beste Wasser der Welt hat und die besten Berge der Welt hat.	Y	berge	1912	    291	0.0018	318	german_at_news_2012_00931443
24717	In die Berge führt ihr Weg sie viel zu selten.	Y	berge	1912	    291	0.0018	402.8	german_at_news_2012_00594997
24718	Im Mittelpunkt stehen die Berge und ihr Einfluss auf die Kultur, die Menschen und die Umwelt.	Y	berge	1912	    291	0.0018	579.1667	german_at_news_2012_00577564
24719	Innsbruck: Mit den Forderungen am Boden bleiben Hohe Berge bieten eine klare Sicht auf die Dinge.	Y	berge	1912	    291	0.0018	594.375	german_at_news_2012_00604433
24720	Manche Entscheidungen würden einem „die Haare zu Berge stehen lassen“, meinte sie.	Y	berge	1912	    291	0.0018	601.25	german_at_news_2012_00663378
24721	Deswegen will ich sie in ein paar Jahren zu mir nehmen – mein Bruder macht mit ihr vielleicht schon dasselbe wie mit mir damals.	Y	dasselbe	1912	    291	0.0018	340.619	german_at_news_2012_00273077
24722	Es sei dasselbe Theater wie schon in den letzten Monaten.	Y	dasselbe	1912	    291	0.0018	369.9	german_at_news_2012_00466637
24723	Für einen Freund tut ein Krebs alles, er muss sich aber von dem Freund dasselbe erwarten können.	Y	dasselbe	1912	    291	0.0018	428.125	german_at_news_2012_00496832
24724	Also wäre es genau dasselbe nur die Farbe wäre anders!	Y	dasselbe	1912	    291	0.0018	534.3333	german_at_news_2012_00034486
24725	Doch daran denkt die Justizministerin, die einst dasselbe forderte, nicht mehr.	Y	dasselbe	1912	    291	0.0018	827.7	german_at_news_2012_00383442
24726	Wir können immer nur unterstützen, was die Eltern machen, wir können das nie ersetzen.“	Y	ersetzen	1912	    291	0.0018	343.75	german_at_news_2012_00967570
24727	Frauen mussten die Soldaten an der Front ersetzen - und zwar in allen Bereichen.	Y	ersetzen	1912	    291	0.0018	584	german_at_news_2012_00487368
24728	Die „Maschine“ werde also den Menschen diesbezüglich nicht so bald ersetzen.	Y	ersetzen	1912	    291	0.0018	614.0909	german_at_news_2012_00324905
