ORDER	SENTENCE	STATUS	WORD	RANK	COUNT	COUNT_REL	INDEX	ID
22294	Kogler: Aus der jetzigen Perspektive betrachtet muss ich sagen: Es war ein Risiko.	Y	jetzigen	1874	    329	0.002	699.2308	german_at_news_2012_00639767
22295	Man solle beim jetzigen Plan bleiben, meinte eine Sprecherin der Ministerin.	Y	jetzigen	1874	    329	0.002	781.7273	german_at_news_2012_00668813
22296	Hier sollen künftig vor allem die kleineren Unternehmen gefördert werden.	Y	kleineren	1874	    329	0.002	479.4	german_at_news_2012_00540439
22297	Und einen kleineren Aufsichtsrat mit Menschen, die sich dem ORF verpflichtet fühlen.	Y	kleineren	1874	    329	0.002	580.6667	german_at_news_2012_00874572
22298	Das ist momentan nicht möglich, daher müssen wir mit kleineren Flammen kochen.	Y	kleineren	1874	    329	0.002	656.8333	german_at_news_2012_00179477
22299	Und wären da nicht die vielen Vorarlberger, die uns mit größeren oder kleineren Spenden unterstützen würden – so hätte „Ma hilft“ kurze Beine.	Y	kleineren	1874	    329	0.002	723.1429	german_at_news_2012_00883108
22300	An kleineren Filmen zeige sich zudem, wie erfolgreiche Filme auch billig produziert werden können.	Y	kleineren	1874	    329	0.002	846.9286	german_at_news_2012_00052401
22301	Dazu kommt: Fast 60 Prozent unserer Kosten werden dort von der ungarischen Regierung bestimmt.	Y	ungarischen	1874	    329	0.002	407.3077	german_at_news_2012_00210987
22302	Das Land scheint immer noch geprägt von der ungarischen Art.	Y	ungarischen	1874	    329	0.002	486.7	german_at_news_2012_00183745
22303	Auf Einladung des Ungarischen Handballverbandes gab es bereits in der vergangenen Woche die ersten Gespräche mit den Verantwortlichen.	Y	ungarischen	1874	    329	0.002	529.0556	german_at_news_2012_00077853
22304	Abschluss der Beitrittsverhandlungen bis Ende Juni Spindelegger rechnet außerdem damit, dass die Beitrittsverhandlungen - so wie von der ungarischen EU-Ratspräsidentschaft geplant - noch im Juni abgeschlossen werden.	Y	ungarischen	1874	    329	0.002	559.087	german_at_news_2012_00014160
22305	Und zwar für den ungarischen Partner, der auch vorgetäuscht haben soll, er brauche Lösegeld, so die Staatsanwaltschaft.	Y	ungarischen	1874	    329	0.002	567.5882	german_at_news_2012_00886120
22306	Und welcher Hit war eigentlich vor 25 Jahren um diese Zeit angesagt oder am Geburtstag von einem Freund 1979 oder 1984 oder 1989?	Y	angesagt	1875	    328	0.002	456.8824	german_at_news_2012_00883960
22307	Was also angesagt scheint ist die Führung durch Profis, wie mir der neue Vorstand der Bahn einer zu sein scheint.	Y	angesagt	1875	    328	0.002	457.3333	german_at_news_2012_00923210
22308	Aber nicht nur in den USA ist Adele derzeit schwer angesagt.	Y	angesagt	1875	    328	0.002	458.5455	german_at_news_2012_00009313
22309	Die Frauen entschieden sich, nach Berlin zu gehen, „einmal weil Revolution angesagt war, und zum anderen, weil es Betriebskindergärten gab“.	Y	angesagt	1875	    328	0.002	476.2632	german_at_news_2012_00303946
22310	Denn was heute angesagt ist, kann morgen schon wieder out sein.	Y	angesagt	1875	    328	0.002	480.8182	german_at_news_2012_00224336
22311	Becker: Das hat sehr großen Spaß gemacht, es war allerdings auch viel Arbeit.	Y	becker	1875	    328	0.002	317.2308	german_at_news_2012_00092199
22312	Becker: Seine Villa soll unter den Hammer Geben Sie hier die E-Mail-Adresse des Empfängers ein (z.B. xy@z.com). Mehrere Empfänger werden durch Kommata getrennt.	Y	becker	1875	    328	0.002	399.2593	german_at_news_2012_00092230
22313	Ben Becker freut sich auf den Jedermann Geben Sie hier die E-Mail-Adresse des Empfängers ein (z.B. xy@z.com). Mehrere Empfänger werden durch Kommata getrennt.	Y	becker	1875	    328	0.002	444.0741	german_at_news_2012_00107087
22314	Ich glaube aber, dass der neue ‘Jedermann’ ganz anders wird”, so Becker.	Y	becker	1875	    328	0.002	460.4167	german_at_news_2012_00551478
22315	Lilly Becker & Sohn Amadeus unterwegs in Berlin Geben Sie hier die E-Mail-Adresse des Empfängers ein (z.B. xy@z.com). Mehrere Empfänger werden durch Kommata getrennt.	Y	becker	1875	    328	0.002	491.4815	german_at_news_2012_00658870
22316	Vom Bildschirm lesen konnte er auch, aber das kann jeder.	Y	bildschirm	1875	    328	0.002	325.6	german_at_news_2012_00904840
22317	Und in den letzten Wochen natürlich auch bei der Fußball-Europameisterschaft vor dem Bildschirm.	Y	bildschirm	1875	    328	0.002	401.8571	german_at_news_2012_00877711
22318	Mit nur zwei Klicks gibt es in diesem Fall die Information auf dem Bildschirm.	Y	bildschirm	1875	    328	0.002	441.8571	german_at_news_2012_00693776
22319	Es vergisst die Zeit und hat keine Idee, wie lange es wirklich vor dem Bildschirm sitzt.	Y	bildschirm	1875	    328	0.002	463.8667	german_at_news_2012_00469220
22320	Damals war der „Bildschirm ohne Tastatur“ aber nicht nur zu schwer, sondern auch zu teuer.	Y	bildschirm	1875	    328	0.002	470.5	german_at_news_2012_00144061
22321	Das Land verfügt mit rund 152 Millionen Menschen über eine Bevölkerung, die annähernd doppelt so groß wie jene Deutschlands ist.	Y	deutschlands	1875	    328	0.002	474.9474	german_at_news_2012_00183821
22322	Dazu kommt noch, dass Österreichs Exporte in die EU-15 um 128 Prozent stiegen, Deutschlands Exporte 110 Prozent.	Y	deutschlands	1875	    328	0.002	476.5385	german_at_news_2012_00211007
22323	Genau das ist auch im 21. Jahrhundert die Stärke Deutschlands, Österreichs und der Schweiz.	Y	deutschlands	1875	    328	0.002	488.5385	german_at_news_2012_00509263
22324	Aufgrund der Nachfrage wurde es aber bald nach Gründung auf ganz Deutschland ausgeweitet und wird heute mehr oder weniger in allen Regionen Deutschlands genutzt.	Y	deutschlands	1875	    328	0.002	492.25	german_at_news_2012_00078665
22325	Besser wird die religiöse Situation dadurch zwar nicht, wie man in den evangelischen Landeskirchen Deutschlands sieht, aber darum geht es ja auch nicht.	Y	deutschlands	1875	    328	0.002	512.2273	german_at_news_2012_00112058
22326	Es ist ganz gut, eine Distanz zum eigenen Text zu entwickeln, die es einem ermöglicht, diesen fast so zu lesen, als wäre er von einem anderen geschrieben.	Y	distanz	1875	    328	0.002	365.7917	german_at_news_2012_00462011
22327	Schon im Sommer hatte er Distanz gezeigt: „Ich will mich mehr um meine Familie kümmern.“	Y	distanz	1875	    328	0.002	406.3333	german_at_news_2012_00785368
22328	Da sie aus sich selbst Figuren machten und nichts zur Sprache bringen wollten, ist eine Distanz entstanden.	Y	distanz	1875	    328	0.002	564.7059	german_at_news_2012_00175257
22329	Sie muss außerdem zu den Familien der Opfer Distanz wahren.	Y	distanz	1875	    328	0.002	570.9	german_at_news_2012_00811173
22330	Zum Kärntner FPK-Chef Uwe Scheuch geht Strache hingegen deutlich auf Distanz.	Y	distanz	1875	    328	0.002	735.9167	german_at_news_2012_00990160
22331	Österreich könne ein Ort der Begegnung sein, wenn es um die Zukunft des Kosovo und die Region geht.	Y	kosovo	1875	    328	0.002	335.4118	german_at_news_2012_00749878
22332	So hat sie es im Kosovo gelernt, als dort Krieg war.	Y	kosovo	1875	    328	0.002	435	german_at_news_2012_00823968
22333	Diese Woche beginnen in Wien die Verhandlungen über den Status des Kosovo.	Y	kosovo	1875	    328	0.002	517.1667	german_at_news_2012_00356934
22334	Das Argument für die Anerkennung des Kosovo sei die Hoffnung gewesen, damit einen Beitrag für den Frieden zu leisten.	Y	kosovo	1875	    328	0.002	611.8235	german_at_news_2012_00160174
22335	Im Kosovo ist das Österreichische Bundesheer mit einer Stärke von 442 Bundesheer-Angehörigen vertreten.	Y	kosovo	1875	    328	0.002	710.0833	german_at_news_2012_00574723
22336	Wer beim Gestalten lieber ganz auf die eigene Kreativität setzt, kann dies natürlich auch.	Y	kreativität	1875	    328	0.002	448.8571	german_at_news_2012_00945315
22337	Darin liegt auch eine Gefahr für unsere Gesellschaft, die Kreativität braucht.	Y	kreativität	1875	    328	0.002	482	german_at_news_2012_00156427
22338	Und dazu brauche man keinen Computer, sondern nur ein bisschen Kreativität und ein paar Freunde.	Y	kreativität	1875	    328	0.002	540.7692	german_at_news_2012_00871747
22339	Besonders Kreativität sollte so früh wie möglich vermittelt und gefördert werden.	Y	kreativität	1875	    328	0.002	631.5455	german_at_news_2012_00111326
22340	Gefordert ist auch mehr Kreativität bei der Finanzierung der Universitäten.	Y	kreativität	1875	    328	0.002	653.1111	german_at_news_2012_00505068
22341	Wie das mit dem Messer passiert ist, weiß ich nicht“, behauptete der 24-Jährige am Mittwoch beim Prozess.	Y	messer	1875	    328	0.002	400.4706	german_at_news_2012_00952666
22342	Dort zog einer der Gäste ein Messer und stach damit auf die zwei Männer im Alter von 20 und 29 Jahren ein.	Y	messer	1875	    328	0.002	419.6667	german_at_news_2012_00391858
22343	Ich frage mich warum er sich nicht gleich mit einem Messer abbilden lässt.	Y	messer	1875	    328	0.002	428.5385	german_at_news_2012_00550749
22344	Er habe zwar Blut gesehen, will aber nicht bemerkt haben, dass ein Messer im Spiel war oder dass der Mann im Sterben lag.	Y	messer	1875	    328	0.002	465.7143	german_at_news_2012_00436641
22345	Wieder nur zwei Tage später, am 30. April, ist neuerlich eine Tankstelle an der Wienerstraße in Linz das Ziel: Bei dieser Tat hat einer der beiden Täter ein Messer als Waffe mit.	Y	messer	1875	    328	0.002	483.4	german_at_news_2012_00953263
22346	Es sei derzeit einfach zu wenig Geld für die Forschung da, und auch die Oesterreichische Nationalbank werde heuer weniger unterstützen können als in den letzten Jahren.	Y	nationalbank	1875	    328	0.002	330.32	german_at_news_2012_00466698
22347	Außerdem dürfte es besser sein, wenn Sie mit Ihrem Anliegen bei der Nationalbank vorstellig werden.“	Y	nationalbank	1875	    328	0.002	456.1333	german_at_news_2012_00085032
22348	Wie berichtet, musste sich die Bank damals einer Prüfung durch die Nationalbank stellen.	Y	nationalbank	1875	    328	0.002	487.4167	german_at_news_2012_00952330
22349	Auch für die Österreichische Nationalbank, die einen Prüfbericht zur Rolle Grasser verfasst, dürfte das E-Mail von Interesse sein.	Y	nationalbank	1875	    328	0.002	517.5556	german_at_news_2012_00066623
22350	Wo es Sonderrechte gibt, wie bei den ÖBB und der Nationalbank und auch dem ORF, muss wohl ein höherer Pensionssicherungsbeitrag kommen.	Y	nationalbank	1875	    328	0.002	519.6	german_at_news_2012_00974770
22351	Mehr als 100 Mann waren bei der Suche nach Opfern im Einsatz.	Y	opfern	1875	    328	0.002	337.7273	german_at_news_2012_00673437
22352	Wir werden den Opfern helfen, über die erste schwere Zeit hinweg zu kommen.	Y	opfern	1875	    328	0.002	470.2308	german_at_news_2012_00972012
22353	Das Ziel der Täter ist, egal mit welcher Methode, am Ende ein Treffen mit ihren Opfern.	Y	opfern	1875	    328	0.002	540.6667	german_at_news_2012_00207037
22354	Der Weg der Spenden zu den Opfern Helfen Sie jetzt - alle Infos!	Y	opfern	1875	    328	0.002	560.9091	german_at_news_2012_00267047
22355	Die Ermittler suchen nun nach weiteren möglichen Opfern des Mannes.	Y	opfern	1875	    328	0.002	817.8	german_at_news_2012_00297259
22356	Wie die aussehen wird, ist heute bereits klar: Der neue Premier wird die Macht in seinen Händen konzentrieren.	Y	premier	1875	    328	0.002	499.625	german_at_news_2012_00953485
22357	Sharon, der 2001 im Alter von 73 Jahren zum Premier gewählt und 2003 im Amt bestätigt worden war, hätte im März zum dritten Mal die Wahl gewonnen, daran besteht kaum ein Zweifel.	Y	premier	1875	    328	0.002	551	german_at_news_2012_00802198
22358	Der Ex-Premier will in wenigen Tagen den neuen Namen seiner Partei bekanntgeben.	Y	premier	1875	    328	0.002	556.6154	german_at_news_2012_00238922
22359	Er hat gesagt: 'Ich bin weder Premier, noch Präsident, noch König.	Y	premier	1875	    328	0.002	564.1	german_at_news_2012_00437274
22360	Einen Kalten Krieg haben wir nur als Land mit dem Politbüro und dem Premier.	Y	premier	1875	    328	0.002	575.4615	german_at_news_2012_00410595
22361	In zehn Jahren werden wir Probleme haben, Schneider zu finden.	Y	schneider	1875	    328	0.002	321.9	german_at_news_2012_00613537
22362	Schneider war schon etwas früher vor Ort als die anderen.	Y	schneider	1875	    328	0.002	331.9	german_at_news_2012_00783717
22363	Und mit der kommt auch ein neuer Schneider an Bord.	Y	schneider	1875	    328	0.002	426.6	german_at_news_2012_00879225
22364	Warum das so sei, könne bisher niemand erklären, so Schneider.	Y	schneider	1875	    328	0.002	544.6667	german_at_news_2012_00921601
22365	Das Interview mit Wolfgang Schneider lesen Sie in voller Länge im neuen „profil“!	Y	schneider	1875	    328	0.002	592.5385	german_at_news_2012_00176105
22366	Aber das können sie trotz allem, das sind zwei verschiedene paar Schuhe.	Y	schuhe	1875	    328	0.002	376.9091	german_at_news_2012_00003698
22367	Und siehe da, hier kann man viele kleine Schuhe kaufen.	Y	schuhe	1875	    328	0.002	495.9	german_at_news_2012_00881284
22368	Gast1448: Florian, Ich habe gehört, dass sie in einer Saison nur ein Paar Schuhe verwenden.	Y	schuhe	1875	    328	0.002	513.4667	german_at_news_2012_00503479
22369	Also musste Daniel in einigen Szenen hohe Schuhe tragen, aber er hat es sehr gut aufgenommen.	Y	schuhe	1875	    328	0.002	585.8125	german_at_news_2012_00034136
22370	Mit zwölf zog er die großen Schuhe des Vaters an.	Y	schuhe	1875	    328	0.002	611.7	german_at_news_2012_00697566
22371	Denn mit der Unabhängigkeit ist die Arbeit nicht getan, sie beginnt dann erst.	Y	unabhängigkeit	1875	    328	0.002	356.3077	german_at_news_2012_00221886
22372	Er wurde der neue Chef und gewährte tatsächlich jene Unabhängigkeit, die sich nun gegen ihn selbst richtet.	Y	unabhängigkeit	1875	    328	0.002	456.2941	german_at_news_2012_00451779
22373	Der ORF musste sich einmal mehr einer Diskussion über Unabhängigkeit und Objektivität stellen.	Y	unabhängigkeit	1875	    328	0.002	480.0769	german_at_news_2012_00254036
22374	Dieser solle das Recht haben, gegen ein Land zu klagen, wenn die Unabhängigkeit der Justiz gefährdet sei.	Y	unabhängigkeit	1875	    328	0.002	481.7059	german_at_news_2012_00352080
22375	Es gehe nicht nur um das Budget, sagte Fischer, sondern um die Unabhängigkeit der Senatsmitglieder.	Y	unabhängigkeit	1875	    328	0.002	497.7857	german_at_news_2012_00455122
22376	Sie bekommen dann aber einen Teil von ihrer Versicherung zurück.	Y	versicherung	1875	    328	0.002	309.9	german_at_news_2012_00803612
22377	Der Grund: Die Versicherung würde die Amerikaner so viel kosten, dass sich nur wenige sie leisten könnten.	Y	versicherung	1875	    328	0.002	425.8125	german_at_news_2012_00242877
22378	Ich hoffe die Versicherung holt sich das Geld auch von den Eltern!	Y	versicherung	1875	    328	0.002	465.6667	german_at_news_2012_00555818
22379	Das kann u.U. zu Problemen mit der Versicherung führen.	Y	versicherung	1875	    328	0.002	501.5556	german_at_news_2012_00181440
22380	Davor fürchten sich Spanien und Italien, die ohne Versicherung mehr Zinsen zahlen müssten.	Y	versicherung	1875	    328	0.002	792.6154	german_at_news_2012_00208494
22381	Jetzt haben wir das zum ersten Mal seit vielen Jahren ins Positive wenden können.“	Y	wenden	1875	    328	0.002	307.8571	german_at_news_2012_00623953
22382	Sie wenden sich vor allem an Jugendliche und haben mit ihrer Werbung Erfolg.	Y	wenden	1875	    328	0.002	383	german_at_news_2012_00816225
22383	Sollte darüber hinaus noch etwas offen sein, bitte sich direkt an mich wenden.	Y	wenden	1875	    328	0.002	392.5385	german_at_news_2012_00826930
22384	Doch am besten wenden Sie sich zunächst persönlich an das Personal.	Y	wenden	1875	    328	0.002	511.4545	german_at_news_2012_00382490
22385	Kleiner Tipp: Wenden Sie die Methode nicht im Freien an.	Y	wenden	1875	    328	0.002	772.8	german_at_news_2012_00638192
22386	Die Regierung nimmt auf Basis von Wifo-Prognosen an, dass es 2012 rund 256.000 Arbeitslose geben wird, etwa so viele wie 2015 (249.000).	Y	wifo	1875	    328	0.002	433.3684	german_at_news_2012_00339664
22387	Kramer hat als Chef des Wifo von 1981 bis 2005 viele Finanzminister kommen und gehen sehen.	Y	wifo	1875	    328	0.002	435.5714	german_at_news_2012_00643324
22388	Und für 2012 erwartet das Wifo auch nur ein mikroskopisches Plus von 0,3 Prozent.	Y	wifo	1875	    328	0.002	439	german_at_news_2012_00876098
22389	Doch für 2008 rechnet das Wifo nur noch mit 2,3 Prozent Wachstum, 2009 mit 1,4 Prozent.	Y	wifo	1875	    328	0.002	460.3	german_at_news_2012_00385674
22390	Für den Euro-Raum erwartet das Wifo heuer noch ein BIP-Wachstum von 2,7 Prozent, 2008 dann eine Abschwächung auf 1,9 Prozent.	Y	wifo	1875	    328	0.002	466.7778	german_at_news_2012_00492687
22391	Was oder wer gibt dir eigentlich das Recht hier über richtig und falsch zu bestimmen?	Y	bestimmen	1876	    327	0.002	397.6	german_at_news_2012_00927339
22392	Angebot und Nachfrage bestimmen den Preis Schon mal was gehört dafür?	Y	bestimmen	1876	    327	0.002	489.3636	german_at_news_2012_00050647
22393	Deswegen bin ich auch bei der Austria gescheitert, weil Stronach alles selbst bestimmen wollte.	Y	bestimmen	1876	    327	0.002	558	german_at_news_2012_00272764
22394	Sie bestimmen nach wie vor selbst, welche Daten Sie teilen möchten.	Y	bestimmen	1876	    327	0.002	598.2	german_at_news_2012_00804095
22395	Da machen wir Erfahrungen, die den Rest unseres Lebens bestimmen.	Y	bestimmen	1876	    327	0.002	753.7	german_at_news_2012_00143479
22396	Aber wenn die Freiheitlichen an der Macht sind, werden sie es genau so machen wie ihre Roten und Schwarzen Brüder.	Y	brüder	1876	    327	0.002	319.5	german_at_news_2012_00011277
22397	NEWS: Wenn man Sie so sieht, würde man nie vermuten, dass Sie Brüder sind.	Y	brüder	1876	    327	0.002	413.8333	german_at_news_2012_00722661
22398	Ob die beiden Brüder noch die Zeit für einen ordentlichen Schulabschluß bleiben, bzw. eine Berufsausbildung, damit sie zu Hause eine Chance auf Arbeit haben, sollte Österreich bzw. die EU das Geld wert sein.	Y	brüder	1876	    327	0.002	434.4138	german_at_news_2012_00737616
22399	Diese Frage rührt natürlich immer auch an den Gedanken, ob wir denn verantwortlich sind für Menschen, die wir unsere Brüder nennen oder die tatsächlich unsere Brüder sind.	Y	brüder	1876	    327	0.002	450.2727	german_at_news_2012_00346438
22400	Die Brüder hatten mit Facebook vor zwei Jahren einen Vergleich in Höhe von rund 65 Millionen Dollar geschlossen, zogen aber erneut vor Gericht.	Y	brüder	1876	    327	0.002	467.5238	german_at_news_2012_00289396
22401	Auch die Polizei war mit mehr als einem Dutzend Beamte an Ort und Stelle.	Y	dutzend	1876	    327	0.002	361.7857	german_at_news_2012_00064433
22402	Dort stehen aber fast ein Dutzend Fahrer um einen der beiden Arbeitsplätze an.	Y	dutzend	1876	    327	0.002	418.8462	german_at_news_2012_00391170
22403	Das seien für den Einzelnen nur ein paar Dutzend oder einige wenige Hundert Euro im Monat.	Y	dutzend	1876	    327	0.002	436.875	german_at_news_2012_00193987
22404	Bis Ende Juli wollen sie durch ein Dutzend Städte der USA ziehen.	Y	dutzend	1876	    327	0.002	443.75	german_at_news_2012_00117575
22405	Zudem sei aber mehr als ein Dutzend weiterer Länder betroffen, inklusive Deutschland, Italien, Frankreich, Großbritannien, Kanada, Indien und Australien.	Y	dutzend	1876	    327	0.002	784.0526	german_at_news_2012_00983483
22406	Nur zehn Prozent aller Waren und Dienstleistungen der EU gingen 2003 in den Export.	Y	export	1876	    327	0.002	449.9231	german_at_news_2012_00736339
22407	Die andere ist eine Export-Geschichte, sie beginnt in Österreich und endet in der Ukraine.	Y	export	1876	    327	0.002	481	german_at_news_2012_00277926
22408	Export: Ich bin ja froh, dass ich die Aktionen gemacht habe.	Y	export	1876	    327	0.002	604.2	german_at_news_2012_00475894
22409	Wir haben im vergangenen Jahr eine tolle Export-Performance gehabt.	Y	export	1876	    327	0.002	669.5	german_at_news_2012_00965857
22410	Am Export in die Eurozone alleine hängen in Österreich eine halbe Million Arbeitsplätze.	Y	export	1876	    327	0.002	884	german_at_news_2012_00041528
22411	Am Sonntag sind die Bulldogs in Kapfenberg gleich noch einmal im Einsatz.	Y	kapfenberg	1876	    327	0.002	453.9167	german_at_news_2012_00044557
22412	SPÖ-Landeshauptmann Franz Voves kündigte für Anfang April ein „Treffen von Spitzenfunktionären“ in Kapfenberg an, das dafür sorgen soll, „dass wir wieder so aufgestellt sind wie 2005“.	Y	kapfenberg	1876	    327	0.002	491.7692	german_at_news_2012_00837938
22413	Wenn wir eine ähnlich gute Leistung bringen, wie wir in Spiel eins und drei gebracht haben, dann glaube ich, dass wir durchaus Chancen haben, Kapfenberg zu schlagen“, sagt Trainer Langer.	Y	kapfenberg	1876	    327	0.002	510.4815	german_at_news_2012_00944603
22414	Fr., 16. April 2010 - 15:25 Uhr Das 1:1 gegen die Wiener Austria am Mittwoch war bereits die achte Bundesliga-Partie, in der Kapfenberg nicht gewinnen konnte.	Y	kapfenberg	1876	    327	0.002	510.7619	german_at_news_2012_00485972
22415	Tatsächlich sind aber erst 90 Minuten der neuen Saison gespielt, mit einem Heimsieg über Altach kann Kapfenberg wieder einiges richtig stellen.	Y	kapfenberg	1876	    327	0.002	550.05	german_at_news_2012_00848989
22416	Ich sehe kommen, dass es in ein paar Jahren noch viel schlimmer wird als 2008.	Y	schlimmer	1876	    327	0.002	286.7143	german_at_news_2012_00559095
22417	Es wäre noch viel schlimmer, wenn das, was wir schreiben, überhaupt keine Auswirkungen hätte.	Y	schlimmer	1876	    327	0.002	368.7857	german_at_news_2012_00470322
22418	Oder schlimmer noch für jene: Sie treten auf der Stelle.	Y	schlimmer	1876	    327	0.002	449.9	german_at_news_2012_00741867
22419	Eigentlich ist die Situation noch schlimmer als Sie es darstellen.	Y	schlimmer	1876	    327	0.002	473.9	german_at_news_2012_00401086
22420	Es gibt italienische Regionen, deren Zustand schlimmer als unserer ist.	Y	schlimmer	1876	    327	0.002	714.1	german_at_news_2012_00457255
22421	Es gehe aber nicht nur um Erträge, sondern auch um die Sicherung dieser Erträge.	Y	sicherung	1876	    327	0.002	424.8333	german_at_news_2012_00454957
22422	Haider hatte gesagt, in manchen Bereichen wie „der Frage der Sicherung der Grundrechte für Menschen“ und im sozialen Bereich „ist die FPÖ wahrscheinlich näher bei der SPÖ“.	Y	sicherung	1876	    327	0.002	510.9167	german_at_news_2012_00526955
22423	Es gehe dabei auch um die Sicherung einer annähernd gleichwertigen Entwicklung in allen Regionen, so der Landeshauptmann.	Y	sicherung	1876	    327	0.002	537.4706	german_at_news_2012_00454978
22424	Wir können aber auch auf diese Art zum Ausbau von Wirtschaftsbeziehungen und zur Sicherung von Arbeitsplätzen in Österreich beitragen.	Y	sicherung	1876	    327	0.002	543.8889	german_at_news_2012_00967450
22425	Es geht nicht um Einsparungen, sondern entscheidend ist die Sicherung der Sozialsysteme für die Zukunft“, sagte Bundeskanzler Dr. Wolfgang Schüssel im Pressefoyer nach dem Ministerrat am Dienstag (01. 04.).	Y	sicherung	1876	    327	0.002	561.4615	german_at_news_2012_00455737
22426	Zunächst habe er mit etwa 80 Personen gerechnet - auch wenn es 200 gewesen wären, hätte er die Feier veranstaltet, so der 16-Jährige.	Y	veranstaltet	1876	    327	0.002	438.7368	german_at_news_2012_00991341
22427	Sie wird auch heuer wieder für einen guten Zweck veranstaltet.	Y	veranstaltet	1876	    327	0.002	470.2	german_at_news_2012_00816805
22428	Bei dem Wettbwerb, der über Facebook veranstaltet wird, sind auch 25 Kandidatinnen aus Österreich mit dabei.	Y	veranstaltet	1876	    327	0.002	473.6	german_at_news_2012_00095030
22429	Am 8. Juni findet von 19 bis 2 Uhr eine „Lange Nacht der Musik“ statt, die der ORF in Zusammenarbeit mit den Wiener Festwochen veranstaltet und die wieder ein vielfältiges Programm an den verschiedensten Orten quer durch die ganze Stadt bietet.	Y	veranstaltet	1876	    327	0.002	492.9412	german_at_news_2012_00039235
22430	Bereits am 9. Februar gibt es in Lilienfeld ein weiters Tourenskirennen, das ebenfalls zum ersten Mal veranstaltet wird.	Y	veranstaltet	1876	    327	0.002	503	german_at_news_2012_00107859
22431	Die SPÖ ist gut beraten, wenn sie dieses Thema ernst nimmt und sich nicht auf eine Zeitung oder auf den ORF verlässt.	Y	verlässt	1876	    327	0.002	325.8095	german_at_news_2012_00361238
22432	Er schlägt sie, sie verlässt ihn und versucht es mit einem zweiten.	Y	verlässt	1876	    327	0.002	420.3636	german_at_news_2012_00443258
22433	Wenn ein Partner die Regierung verlässt, müsse es nicht automatisch Neuwahlen geben, sagte der SPÖ-Klubobmann.	Y	verlässt	1876	    327	0.002	528.1875	german_at_news_2012_00939578
22434	Jung verheiratet zu werden, bedeutet gleichzeitig, dass ein Mädchen die Schule verlässt.	Y	verlässt	1876	    327	0.002	661.9167	german_at_news_2012_00628562
22435	Die große Schwester, Victoria, verlässt erst jetzt das Hotel de Paris.	Y	verlässt	1876	    327	0.002	724.1818	german_at_news_2012_00309352
22436	Und zur Haltung der ÖVP meinte der SPÖ-Vize, die ÖVP sei eben derzeit die einzige Partei, die der Regierung angehören werde, es sei daher anzunehmen, dass sie bei diesem Thema aus dieser Rolle agiere.	Y	vize	1876	    327	0.002	494.9655	german_at_news_2012_00886000
22437	Dann hat er gesagt, als Vize sei er nicht geeignet.	Y	vize	1876	    327	0.002	496.7778	german_at_news_2012_00152606
22438	Auch LH-Vize Schützenhöfer ist stolz, dass man viel auf den Weg gebracht habe: Man habe schon im ersten vollen Jahr der Reformpartnerschaft mehr erreicht als 30 Jahre lang zuvor geschehen sei.	Y	vize	1876	    327	0.002	529.6897	german_at_news_2012_00069930
22439	Peter Koits als Bürgermeister, Wimmer sein Vize und das wird wahrscheinlich so bis zur nächsten Wahl bleiben.	Y	vize	1876	    327	0.002	549.6471	german_at_news_2012_00755918
