ORDER	SENTENCE	STATUS	WORD	RANK	COUNT	COUNT_REL	INDEX	ID
24437	König Carl Gustaf im Familien-Abseits Geben Sie hier die E-Mail-Adresse des Empfängers ein (z.B. xy@z.com). Mehrere Empfänger werden durch Kommata getrennt.	Y	carl	1908	    295	0.0018	504.4615	german_at_news_2012_00640974
24438	Carl Gustaf hatte dazu erklärt: „Nein, die kann es nicht geben.	Y	carl	1908	    295	0.0018	521.7273	german_at_news_2012_00127718
24439	Auf Staatsbesuchen bekommt Carl Gustav, der sein Land jährlich zehn Millionen Euro kostet, seit 2004 von der Regierung einen Aufpasser zur Seite gestellt.	Y	carl	1908	    295	0.0018	608.3333	german_at_news_2012_00080510
24440	König Carl Gustaf im Familien-Abseits Seine Frau spricht kaum noch mit ihm, die Kinder wenden sich von ihm ab.	Y	carl	1908	    295	0.0018	628.8947	german_at_news_2012_00640975
24441	Wann das der Fall sein wird, ist noch nicht fixiert.	Y	fixiert	1908	    295	0.0018	334.4	german_at_news_2012_00919954
24442	So seien momentan 67 Mio. Euro für die nächsten sieben Jahre vorgesehen aber noch nicht fixiert.	Y	fixiert	1908	    295	0.0018	437.3333	german_at_news_2012_00830767
24443	Dass vorerst nur die Termine bis Sommer fixiert sind, habe nichts damit zu tun, dass der Ausschuss beendet werde.	Y	fixiert	1908	    295	0.0018	503.1667	german_at_news_2012_00199071
24444	Die entsprechenden Verhandlungen laufen, wie man hört, fixiert sei aber bislang noch nichts.	Y	fixiert	1908	    295	0.0018	619.9231	german_at_news_2012_00296103
24445	Konkret ist bis jetzt fixiert: „Dieses umfangreiche Programm soll in erster Linie die historische Dimension der Erweiterung deutlich machen.	Y	fixiert	1908	    295	0.0018	672.2105	german_at_news_2012_00641390
24446	Und sind die Franzosen nun Mann und Frau oder Mutter und Sohn?	Y	franzosen	1908	    295	0.0018	371.4	german_at_news_2012_00881528
24447	Am 29. Mai stimmen die Franzosen über die neue EU-Verfassung ab.	Y	franzosen	1908	    295	0.0018	470.4	german_at_news_2012_00038761
24448	Die Franzosen machten sich Sorgen, dass sie weniger Soldaten haben werden als die Deutschen.	Y	franzosen	1908	    295	0.0018	474.7692	german_at_news_2012_00303835
24449	Ein Jahr später wurde Venedig von den Franzosen wieder an Österreich abgegeben.	Y	franzosen	1908	    295	0.0018	498.8333	german_at_news_2012_00420085
24450	Er hat offenbar fest angenommen, dass eine große Mehrheit der Franzosen der Verfassung zustimmen würde.	Y	franzosen	1908	    295	0.0018	636.6429	german_at_news_2012_00437569
24451	Den Führerschein will er nicht machen, das zahlt sich mit seinen 60 Jahren nicht mehr aus, meint er.	Y	führerschein	1908	    295	0.0018	339.4667	german_at_news_2012_00216551
24452	Ich gäbe ihm zumindest die nächsten fünf Jahre keinen Führerschein mehr und den müsste er neu machen.	Y	führerschein	1908	    295	0.0018	406.6471	german_at_news_2012_00551199
24453	Dabei sind Kinder viel wichtiger als Hunde - und Eltern brauchen keinen „Führerschein“.	Y	führerschein	1908	    295	0.0018	527.6667	german_at_news_2012_00133880
24454	Wer auf dem Boden bleibt, darf mit einem normalen Führerschein hinter das Steuer.	Y	führerschein	1908	    295	0.0018	577.7692	german_at_news_2012_00945169
24455	Laut Polizei fuhr der 17-jährige Lenker, der keinen Führerschein besitzt, vermutlich zu schnell.	Y	führerschein	1908	    295	0.0018	771	german_at_news_2012_00653440
24456	Das erste Fahrzeug geht in diesen Tagen in Betrieb, die drei weiteren werden in den nächsten Monaten geliefert.	Y	geliefert	1908	    295	0.0018	428.5625	german_at_news_2012_00167217
24457	Geliefert wird aus dem Online-Shop in die ganze Welt.	Y	geliefert	1908	    295	0.0018	498.4	german_at_news_2012_00507776
24458	Dafür werden die Lebensmittel direkt von den Produzenten aus der Umgebung geliefert.	Y	geliefert	1908	    295	0.0018	627.3333	german_at_news_2012_00139183
24459	Im übrigen hat auch Österreich waffen an beiden seiten geliefert.	Y	geliefert	1908	    295	0.0018	638.3	german_at_news_2012_00581577
24460	Im Vorjahr wurden Weine im Wert von fast 70 Millionen Euro dorthin geliefert.	Y	geliefert	1908	    295	0.0018	656.9091	german_at_news_2012_00583101
24461	Im Gegenteil: Es könnte damit zu einem neuen kalten Krieg kommen.	Y	kalten	1908	    295	0.0018	453.0909	german_at_news_2012_00571409
24462	Diese große Zeit der Atombombe, meinte man lange, sei seit dem Ende des Kalten Kriegs vorbei und mit ihr die Angst.	Y	kalten	1908	    295	0.0018	460.1905	german_at_news_2012_00346834
24463	Das Team von „Guten Morgen Salzburg“ meldet sich bei Ihnen, wenn Sie an einer besonders kalten Stelle wohnen.	Y	kalten	1908	    295	0.0018	501.5	german_at_news_2012_00199671
24464	Dennoch kann es keinen Zweifel daran geben, dass die europäische Einigung ohne den Kalten Krieg nicht, oder zumindest nicht in dieser Form stattgefunden hätte.	Y	kalten	1908	    295	0.0018	508.8261	german_at_news_2012_00222799
24465	Als könnte es der Winter nach ihm nicht erwarten, die Zeit seines kalten Vergnügens zu beginnen.	Y	kalten	1908	    295	0.0018	517.625	german_at_news_2012_00032388
24466	Kommen wir kurz zu den Konservativen … … für die bin ich aber nicht zuständig!	Y	konservativen	1908	    295	0.0018	332.2308	german_at_news_2012_00640563
24467	Bei Obama habe ich aber erstmals das Gefühl, dass er es wirklich schaffen kann, weil er auch die Konservativen begeistert.	Y	konservativen	1908	    295	0.0018	387.7368	german_at_news_2012_00104789
24468	Nicht wenige Unternehmer befinden sich – auch in dieser Frage – auf einer Linie mit der konservativen Partei.	Y	konservativen	1908	    295	0.0018	454.625	german_at_news_2012_00725827
24469	In Österreich wird der Ermittler (Staatsanwalt) angezeigt, wenn er gegen einen konservativen Politiker ermittelt.	Y	konservativen	1908	    295	0.0018	647.4286	german_at_news_2012_00605413
24470	Abgeordnete der konservativen Opposition schien das nachhaltig aus dem Konzept zu bringen.	Y	konservativen	1908	    295	0.0018	763.9167	german_at_news_2012_00012439
24471	Damit bereitet man es darauf vor, dass es in der Schule nicht nur Lob geben wird.	Y	lob	1908	    295	0.0018	346.7333	german_at_news_2012_00144516
24472	Er erklärt, dass bei den Besuchen immer das Lob für die Kinder im Vordergrund zu stehen habe.	Y	lob	1908	    295	0.0018	363.9412	german_at_news_2012_00433944
24473	In den letzten Wochen hätten wir dafür von vielen Seiten Lob und Anerkennung erhalten.	Y	lob	1908	    295	0.0018	435.7857	german_at_news_2012_00587816
24474	Wünsche, Kritik oder Lob zum Programm und der Musik von Radio Wien?	Y	lob	1908	    295	0.0018	481.5	german_at_news_2012_00977362
24475	Lob gab es für die Teilnahme der Anrainer an den Vorbereitungen.	Y	lob	1908	    295	0.0018	685.3636	german_at_news_2012_00659790
24476	Frau Dr. Ilse Bauer aus Graz wurde ab diesem Lied auf der Bühne von Lied zu Lied immer mehr zu Monika Martin.	Y	monika	1908	    295	0.0018	544.0526	german_at_news_2012_00487183
24477	Monika Martin über ihre Passion: „Ich habe es einfach in meinem Leben bisher so gahalten, dass ist das tue, was mir von Herzen Freude macht.	Y	monika	1908	    295	0.0018	552.76	german_at_news_2012_00699199
24478	Es geht weiter mit einigen anderen Namen, von denen Meischberger Monika Langthaler bekannt ist.	Y	monika	1908	    295	0.0018	571	german_at_news_2012_00456121
24479	Im NEWS-Interview zieht er eine erste Bilanz: NEWS: Vor einem Jahr sind Sie gegen Monika Lindner als ORF-General angetreten.	Y	monika	1908	    295	0.0018	581.9	german_at_news_2012_00578215
24480	Inhaltlich geht es um die Liebe, um diese von Sehnsucht durchzogene Form der Liebe, wie sie durch Monika Martin einen ganz bestimmten Stellenwert bekommen hat.	Y	monika	1908	    295	0.0018	600.5217	german_at_news_2012_00600865
24481	Daher stand ich vor der Wahl zwischen den Niederlanden und Österreich.	Y	niederlanden	1908	    295	0.0018	307.1818	german_at_news_2012_00141746
24482	Bis dahin sei das zwar nicht in Österreich, aber in EU-Staaten wie Großbritannien, Italien und den Niederlanden der Fall gewesen.	Y	niederlanden	1908	    295	0.0018	376.7	german_at_news_2012_00117212
24483	Ein Deutscher und ein US-Amerikaner, die sich in den Niederlanden das Ja-Wort gaben, wollen künftig in Österreich leben.	Y	niederlanden	1908	    295	0.0018	508.1111	german_at_news_2012_00403964
24484	Während einer Woche werden jeden Abend aktuelle Filme aus Deutschland, Finnland, den Niederlanden, Österreich, der Tschechischen Republik und der Schweiz gezeigt.	Y	niederlanden	1908	    295	0.0018	622.85	german_at_news_2012_00917968
24485	Neben Österreich dürfte die Gruppe auch in Belgien, Italien, den Niederlanden, Spanien und Brasilien aktiv gewesen.	Y	niederlanden	1908	    295	0.0018	644.25	german_at_news_2012_00716972
24486	So bekam er auch an sehr vielen Orten, die Chance zu spielen.	Y	orten	1908	    295	0.0018	410.5	german_at_news_2012_00820749
24487	Es hat bei uns eine lange Tradition, dass wir bei unseren Fans zu Hause und an privaten Orten spielen.	Y	orten	1908	    295	0.0018	424.3333	german_at_news_2012_00459344
24488	Ich fühle mich an vielen Orten der Welt sehr wohl.	Y	orten	1908	    295	0.0018	486.5	german_at_news_2012_00551046
24489	Wenn das Rauchen in der Gastronomie verboten werden soll, dann müsste es auch an allen anderen Orten verboten werden.	Y	orten	1908	    295	0.0018	523.7059	german_at_news_2012_00937850
24490	Die Grünen zeigen die Ermittler an und orten Verbindungen zur FPÖ.	Y	orten	1908	    295	0.0018	655.6	german_at_news_2012_00310327
24491	Für Österreich kann man sicher sein: Es wird der rechte Rand sein.	Y	rand	1908	    295	0.0018	344.4545	german_at_news_2012_00499593
24492	Es kann nicht so weiter gehen, dass manche Schulden machen, als gäbe es kein Morgen und damit ganz Europa an den Rand der Möglichkeiten bringen.	Y	rand	1908	    295	0.0018	389.75	german_at_news_2012_00464397
24493	Derzeit kann man in derselben Zeit bis zu 50.000 Rand (4800 Euro) machen.	Y	rand	1908	    295	0.0018	414.9091	german_at_news_2012_00269214
24494	Es braucht aber einen Perspektivwechsel: Die Gefahr kommt nicht vom Rand, sondern aus der Mitte.	Y	rand	1908	    295	0.0018	453.2	german_at_news_2012_00452991
24495	Nur am Rand, wie gesagt, hatte die Sache auch mit Moral zu tun.	Y	rand	1908	    295	0.0018	453.3077	german_at_news_2012_00733194
24496	Er gehe davon aus, dass das in Vorarlberg nicht stattgefunden habe.	Y	stattgefunden	1908	    295	0.0018	334	german_at_news_2012_00435493
24497	Es war das erste Mal in der Geschichte der EU, dass eine solche Sitzung im Beisein der Öffentlichkeit stattgefunden hat.	Y	stattgefunden	1908	    295	0.0018	429.0556	german_at_news_2012_00469425
24498	Das habe ich in Paris gesagt, wo das Interview stattgefunden hat.	Y	stattgefunden	1908	    295	0.0018	430.1	german_at_news_2012_00172551
24499	In den zehn Jahren vor ihm hat nur eine einzige Sonderausstellung stattgefunden.	Y	stattgefunden	1908	    295	0.0018	448.75	german_at_news_2012_00589332
24500	Ich habe dann eine Oper auf die Beine gestellt, die vielleicht deshalb so besonders war, weil sie ungeschützt stattgefunden hat.	Y	stattgefunden	1908	    295	0.0018	492.4211	german_at_news_2012_00552564
24501	Es ist so typisch, dass die die Geld haben alles zahlen sollen.	Y	typisch	1908	    295	0.0018	286.5455	german_at_news_2012_00463488
24502	Was für diese Parks typisch ist und was sie für die Besucher so besonders macht, das zeigte zuletzt eine Serie in „Wien heute“ in fünf Teilen.	Y	typisch	1908	    295	0.0018	393.087	german_at_news_2012_00924997
24503	Das ist typisch für das Neue: man muss die Bedingungen schaffen, damit es hervor treten kann.	Y	typisch	1908	    295	0.0018	447.6667	german_at_news_2012_00180148
24504	Jetzt so zu tun als ob man nichts wüßte ist typisch.	Y	typisch	1908	    295	0.0018	449.4545	german_at_news_2012_00625636
24505	Geld hat da zu sein, woher es kommt hat Leute wie ihn noch nie interessiert, typisch Kirche!	Y	typisch	1908	    295	0.0018	454.375	german_at_news_2012_00507568
24506	Beach Party: So feiert die Society Geben Sie hier die E-Mail-Adresse des Empfängers ein (z.B. xy@z.com). Mehrere Empfänger werden durch Kommata getrennt.	Y	beach	1909	    294	0.0018	439.44	german_at_news_2012_00091945
24507	Es war Zeit, dass wir uns entschieden haben, ob wir Beach- oder Hallenvolleyball spielen.	Y	beach	1909	    294	0.0018	483.6923	german_at_news_2012_00471011
24508	Auch wenn von Sommer und Sonne leider ab und an nicht viel zu spüren ist, so kann man sich das Urlaubsfeeling doch nach Wien und in den Alltag holen – beim Indoor-Beach-Volleyball.	Y	beach	1909	    294	0.0018	517.871	german_at_news_2012_00073187
24509	Österreichs Beach- Stars: „Wir wollen Helden sein“ Die österreichischen Hoffnungsträger in Klagenfurt sprechen über ihre ganz persönlichen Helden und in welcher Rolle sie sich selbst sehen.	Y	beach	1909	    294	0.0018	531.0833	german_at_news_2012_00750223
24510	Zum Beach-Event komme ich jedes Jahr, weil hier eine richtig gute Stimmung ist.	Y	beach	1909	    294	0.0018	558.5714	german_at_news_2012_00988455
24511	Da die drei zur Zusammenarbeit bereit waren, wurden sie damit beauftragt, gemeinsam eine gute Lösung zu entwickeln.	Y	beauftragt	1909	    294	0.0018	382.2941	german_at_news_2012_00136211
24512	Im Juni wurde die Kommission vom Europäischen Rat mit der Entwicklung dieser Strategie bis 2010 beauftragt.	Y	beauftragt	1909	    294	0.0018	453.0667	german_at_news_2012_00574280
24513	Er war einst in Nordkorea für eine Organisation tätig, die mit dem Schutz der Kim-Familie beauftragt war, und hat immer noch gute Kontakte in das Land.	Y	beauftragt	1909	    294	0.0018	507.16	german_at_news_2012_00449817
24514	Dazu sei man (die Abgeordneten, Anm.) von der österreichischen Bevölkerung beauftragt.	Y	beauftragt	1909	    294	0.0018	533	german_at_news_2012_00211485
24515	Weiters wurde die Europäische Kommission beauftragt, bis Ende des Jahres eine Studie zur Aufnahmefähigkeit der Union zu präsentieren.	Y	beauftragt	1909	    294	0.0018	547.4444	german_at_news_2012_00934570
24516	Das kann dazu führen, dass sie sich eine Woche lang nur mit Mathematik beschäftigen.	Y	mathematik	1909	    294	0.0018	368.0714	german_at_news_2012_00181109
24517	Doch ich war nie sehr interessiert an der Mathematik an sich.	Y	mathematik	1909	    294	0.0018	369.8	german_at_news_2012_00386010
24518	Nach den Ergebnissen der letzten PISA-Studie aus dem Jahr 2000 sind die österreichischen Buben zwar nach wie vor besser in Mathematik als die Mädchen.	Y	mathematik	1909	    294	0.0018	455.2727	german_at_news_2012_00705662
24519	Ich möchte diesen Lehrstuhl in eine völlig neue Richtung führen, und Mathematik ist genau das Richtige dafür.	Y	mathematik	1909	    294	0.0018	468.1176	german_at_news_2012_00557800
24520	In diesem Sinn ist Mathematik die beste Grundlage für Management und gerade etwas für Menschen, die mit beiden Beinen im Leben stehen (wollen).	Y	mathematik	1909	    294	0.0018	474.3333	german_at_news_2012_00595872
24521	Und dann ist da vor allem noch dieser Fahrschein der Münchner U-Bahn.	Y	münchner	1909	    294	0.0018	465	german_at_news_2012_00869554
24522	Die 74-Jährige sei am Sonntag bei einem Unfall ums Leben gekommen, teilte die Münchner Polizei am 3. Juli mit.	Y	münchner	1909	    294	0.0018	484.25	german_at_news_2012_00275729
24523	Die 74-Jährige sei am Montag bei einem Unfall ums Leben gekommen, teilte die Münchner Polizei am Dienstag mit.	Y	münchner	1909	    294	0.0018	494.625	german_at_news_2012_00275728
24524	Die 74-Jährige sei bei einem Unfall ums Leben gekommen, teilte die Münchner Polizei am Dienstag mit.	Y	münchner	1909	    294	0.0018	499.4667	german_at_news_2012_00275730
24525	Bei den Freiheitlichen geht’s dafür von Anfang an zu wie auf der Münchner Wies’n beim Oktoberfest.	Y	münchner	1909	    294	0.0018	504.7778	german_at_news_2012_00095580
24526	Nun schickt ihr die Justiz auch noch das Geld nach.	Y	schickt	1909	    294	0.0018	336.2	german_at_news_2012_00732110
24527	Wie arm muss man sein, dass man seine kleinen Kinder weit weg zum arbeiten schickt?	Y	schickt	1909	    294	0.0018	398	german_at_news_2012_00951774
24528	Und schickt dafür ab März alle seine Minister quer durch Österreich.	Y	schickt	1909	    294	0.0018	511.1818	german_at_news_2012_00880619
24529	Die Kraft, die dich jeden Tag in die Arbeit schickt.	Y	schickt	1909	    294	0.0018	568.5	german_at_news_2012_00320369
24530	Die VP schickt mit Sicherheit ein neues Gesicht ins Rennen.	Y	schickt	1909	    294	0.0018	640	german_at_news_2012_00375172
24531	Ich weiß nicht mehr, wie und wo das Leben stattfindet.	Y	stattfindet	1909	    294	0.0018	268	german_at_news_2012_00560977
24532	Ob das, was jetzt stattfindet, der Anfang vom Ende des Euro ist, weiß keiner.	Y	stattfindet	1909	    294	0.0018	296.9286	german_at_news_2012_00737445
24533	Heute, Mittwoch, wurde die Ausstellung zum erfolgreichen Wettbewerb eröffnet, der bereits zum dritten Mal stattfindet.	Y	stattfindet	1909	    294	0.0018	550.2143	german_at_news_2012_00536265
24534	Allerdings ist im Interesse der jüngeren Generation darauf Wert zu legen, dass die Reform jetzt stattfindet.	Y	stattfindet	1909	    294	0.0018	557	german_at_news_2012_00024519
24535	Schauen Sie sich selbst an, in welchen Räumen der Unterricht stattfindet.	Y	stattfindet	1909	    294	0.0018	786.6364	german_at_news_2012_00779781
24536	Gerade weil wir die Verantwortung für Europa besonders ernst nehmen, haben wir eine Verpflichtung, wieder viel tiefer zu gehen.	Y	tiefer	1909	    294	0.0018	392.1667	german_at_news_2012_00512300
24537	Allerdings liegt die Stimmung noch immer deutlich tiefer als im September 2002.	Y	tiefer	1909	    294	0.0018	392.9091	german_at_news_2012_00024682
24538	Man kann natürlich in diesen Dingen noch tiefer gehen, genauer werden.	Y	tiefer	1909	    294	0.0018	583.7273	german_at_news_2012_00666357
24539	Männer greifen dabei ein bisschen tiefer in die Tasche als Frauen.	Y	tiefer	1909	    294	0.0018	651.7273	german_at_news_2012_00668109
24540	Denn für die Gesundheit, fürs Wohnen und Sparen wollen die ÖsterreicherInnen heuer tiefer in die Tasche greifen.	Y	tiefer	1909	    294	0.0018	878.5333	german_at_news_2012_00220757
24541	Doch dann kam der Touch-Computer aus dem Hause Apple auf den Markt und verkaufte sich innerhalb weniger Monate bereits mehr als drei Millionen Mal!	Y	touch	1909	    294	0.0018	366.2	german_at_news_2012_00383373
24542	Das hat den Touch einer Extremfrauenpolitik, wo es schon wieder gegen die Männer geht.	Y	touch	1909	    294	0.0018	368.2857	german_at_news_2012_00173148
24543	Photoshop Touch für das iPad 2 ist da Geben Sie hier die E-Mail-Adresse des Empfängers ein (z.B. xy@z.com). Mehrere Empfänger werden durch Kommata getrennt.	Y	touch	1909	    294	0.0018	370.8889	german_at_news_2012_00757065
24544	Amazon bringt Kindle Touch nach Österreich Geben Sie hier die E-Mail-Adresse des Empfängers ein (z.B. xy@z.com). Mehrere Empfänger werden durch Kommata getrennt.	Y	touch	1909	    294	0.0018	435.7308	german_at_news_2012_00039685
24545	Zune HD startet gegen den iPod Touch Geben Sie hier die E-Mail-Adresse des Empfängers ein (z.B. xy@z.com). Mehrere Empfänger werden durch Kommata getrennt.	Y	touch	1909	    294	0.0018	505.4815	german_at_news_2012_00991642
24546	Beim Spiel zwischen Österreich und Deutschland am vergangenen Montag war der Verbund gleich mit drei Vorständen vertreten.	Y	verbund	1909	    294	0.0018	426.2353	german_at_news_2012_00104087
24547	"""Daher ist es nur vernünftig, mit diesen das Gespräch zu suchen,"""" so der Verbund-Vorstand in NEWS."""	Y	verbund	1909	    294	0.0018	429.1176	german_at_news_2012_00141087
24548	Schon jetzt ist fix, dass der Verbund vor allem über den Preis angreifen wird.	Y	verbund	1909	    294	0.0018	471.1429	german_at_news_2012_00785619
24549	Gleichzeitig ist dem Verbund zu danken, dass es ein Beispiel dafür gibt, dass Unternehmen auch neue Wege bei der Wahrnehmung ihrer Verantwortung für Natur- und Umweltschutz gehen können und müssen.	Y	verbund	1909	    294	0.0018	473.5357	german_at_news_2012_00517333
24550	Am Mittwoch hat auch der Verbund eine Senkung des Strompreises um etwa fünf Prozent bekannt gegeben.	Y	verbund	1909	    294	0.0018	487.4375	german_at_news_2012_00042811
24551	Dies werde die SPÖ nicht tun - denn: „Das ist ein ganz wesentlicher Unterschied.	Y	wesentlicher	1909	    294	0.0018	339.6923	german_at_news_2012_00365680
24552	Das ist für uns im Prozess der Aufarbeitung der Vergangenheit ein ganz wesentlicher und wichtiger Schritt, aber nicht nur für uns, sondern auch für die betroffenen Personen.	Y	wesentlicher	1909	    294	0.0018	395.913	german_at_news_2012_00178699
24553	Die Caritas sei wesentlicher Teil seiner Seelsorgearbeit: „Ich kann nicht Mensch sein, wenn es andere nicht auch können.	Y	wesentlicher	1909	    294	0.0018	452.7059	german_at_news_2012_00290293
24554	Auch weniger Landesstudios kann ich mir schwer vorstellen, sie sind ein wesentlicher Bestandteil des ORF und der Grund für die starke Bindung der Österreicher an den ORF.	Y	wesentlicher	1909	    294	0.0018	493.52	german_at_news_2012_00072463
24555	Ein wesentlicher Schwerpunkt bei den Investitionen ist nach wie vor der „Wellness“-Bereich.	Y	wesentlicher	1909	    294	0.0018	527.6923	german_at_news_2012_00427174
24556	Bei einem unserer Workshops ist auf jeden Fall das Richtige für jeden dabei.	Y	workshops	1909	    294	0.0018	363.25	german_at_news_2012_00100208
24557	Am 28. Februar, werden die Ergebnisse im Rahmen eines Workshops präsentiert.	Y	workshops	1909	    294	0.0018	440	german_at_news_2012_00038676
24558	Workshops finden das ganze Jahr in verschiedenen deutschen Städten statt.	Y	workshops	1909	    294	0.0018	586.9	german_at_news_2012_00976606
24559	Bei uns werden jedoch ab heuer Workshops für ältere Lenker angeboten.	Y	workshops	1909	    294	0.0018	612.0909	german_at_news_2012_00106160
24560	In Salzburg und St. Johann fanden zwei Workshops mit 20 Teilnehmer/innen statt.	Y	workshops	1909	    294	0.0018	700.5833	german_at_news_2012_00606142
24561	Amazon soll sechs neue Tablets bringen Geben Sie hier die E-Mail-Adresse des Empfängers ein (z.B. xy@z.com). Mehrere Empfänger werden durch Kommata getrennt.	Y	amazon	1910	    293	0.0018	367.9615	german_at_news_2012_00039729
24562	Das Amazon-Tablet wird es in Zukunft ziemlich schwer haben.	Y	amazon	1910	    293	0.0018	497.2	german_at_news_2012_00159596
24563	Mit rund 70 Mrd. Dollar wäre Facebook etwas geringer als Amazon.	Y	amazon	1910	    293	0.0018	555.9	german_at_news_2012_00694167
24564	Amazon will seine Software-Plattform für Android-Programme noch in diesem Sommer nach Europa bringen.	Y	amazon	1910	    293	0.0018	566.8	german_at_news_2012_00039747
24565	Das ist um 10 Euro günstiger als das Smartphone beim Online-Händler Amazon kostet.	Y	amazon	1910	    293	0.0018	720.1667	german_at_news_2012_00180169
24566	Ohne Steve - Apples Leben nach der Ära Jobs Geben Sie hier die E-Mail-Adresse des Empfängers ein (z.B. xy@z.com). Mehrere Empfänger werden durch Kommata getrennt.	Y	apples	1910	    293	0.0018	422.3929	german_at_news_2012_00744701
24567	Am Freitag kommt Apples neues iPad in zehn Ländern in den Handel.	Y	apples	1910	    293	0.0018	527.9091	german_at_news_2012_00041808
24568	Seit Mittwoch ist in Apples App Store auch die iPhone App von Google+ erhältlich.	Y	apples	1910	    293	0.0018	634.0769	german_at_news_2012_00799058
24569	Das sind die 10 besten Smartphones Android-Geräte und Apples iPhone sind die großen Gewinner.	Y	apples	1910	    293	0.0018	715.0833	german_at_news_2012_00195753
24570	Im Herbst 2005 erschien das Album und wurde Fiona Apples bislang größter Erfolg.	Y	apples	1910	    293	0.0018	912.4167	german_at_news_2012_00572337
24571	Er sei aber für die Erweiterung der EU: „Wir müssen erkennen, dass sie für Österreich eine ganz große historische Chance ist - weit über die positiven wirtschaftlichen Aspekte hinaus, auch politisch.	Y	aspekte	1910	    293	0.0018	450.4286	german_at_news_2012_00443511
24572	Der Bundeskanzler verwies vor allem auf zwei Aspekte: Zum einen habe Ferrero-Waldner nicht ihr ganzes Leben in der Politik gearbeitet.	Y	aspekte	1910	    293	0.0018	552.3	german_at_news_2012_00233900
24573	Durch die Technik haben sich aber auch andere Aspekte unseres Lebens geändert.	Y	aspekte	1910	    293	0.0018	635.25	german_at_news_2012_00396395
24574	Dass für beide Aspekte ein Bewusstsein vorhanden sei, mache zuversichtlich.	Y	aspekte	1910	    293	0.0018	872.5	german_at_news_2012_00195196
24575	Dabei sollen lokale, regionale, nationale und internationale künstlerische Aspekte berücksichtigt werden.	Y	aspekte	1910	    293	0.0018	1062.5455	german_at_news_2012_00134010
24576	Wenn diesem die Bildung einer Regierung nicht gelingen sollte, will sie jenen zum Zug kommen lassen, der eine Mehrheit und ein Programm bringe.	Y	bringe	1910	    293	0.0018	425.5217	german_at_news_2012_00938909
24577	Ich bringe jetzt meine ganze Erfahrung in das Amt ein.	Y	bringe	1910	    293	0.0018	514.4	german_at_news_2012_00549473
24578	Die Menschen glauben, er bringe eine bessere Leistung, aber das stimmt nicht.“	Y	bringe	1910	    293	0.0018	529.5	german_at_news_2012_00326337
24579	Die Reform bringe Verbesserungen in allen Bereichen der Sicherheit und mehr Qualität für die Bürgerinnen und Bürger.	Y	bringe	1910	    293	0.0018	672.4	german_at_news_2012_00339295
24580	Die Europäische Union bringe für die Bürger eine Reihe wichtiger Vorteile.	Y	bringe	1910	    293	0.0018	752	german_at_news_2012_00299206
24581	Entweder Italien schafft es selbst oder das war's dann mit dem Projekt Europa, so wie es sich jetzt darstellt.	Y	darstellt	1910	    293	0.0018	358.6842	german_at_news_2012_00431944
24582	Wir setzen auf die Jugend - sie ist es, die Europa darstellt.	Y	darstellt	1910	    293	0.0018	389.6	german_at_news_2012_00969371
