ORDER	SENTENCE	STATUS	WORD	RANK	COUNT	COUNT_REL	INDEX	ID
22440	Die Grünen-Vize will sich ungeachtet dessen mit der Wahl von Jörg Haider zum Landeshauptmann nicht abfinden.	Y	vize	1876	    327	0.002	549.7647	german_at_news_2012_00310258
22441	Die SPÖ und die Wiener Polizei wiesen die Aussagen zurück.	Y	wiesen	1876	    327	0.002	465.75	german_at_news_2012_00361566
22442	Eine gmahte Wiesen ist es dennoch nicht: „Ich muss ja auch Frau und Kind ernähren.	Y	wiesen	1876	    327	0.002	513	german_at_news_2012_00407621
22443	Sie wiesen in diesem Zusammenhang auf das Gusenbauer-Papier hin, das auch 163 Ortstafeln enthalten habe und für das es ein Ja seitens der Slowenenorganisationen gegeben habe.	Y	wiesen	1876	    327	0.002	570.2174	german_at_news_2012_00816659
22444	Nach einem Rückgang in den Jahren 2001 und 2002 wiesen die Bruttoanlageinvestitionen im ersten Halbjahr 2003 wieder ein kräftiges Wachstum auf.	Y	wiesen	1876	    327	0.002	591.3333	german_at_news_2012_00707865
22445	Der Preis von derzeit sieben Euro pro Kilo sei jedenfalls gerechtfertigt, sagt Maria Thier aus Wiesen: „Wenn manche behaupten, dass das zu teuer wäre, dann wissen sie nicht, welche Arbeit dahinter steckt.“	Y	wiesen	1876	    327	0.002	598.2188	german_at_news_2012_00255894
22446	Wer die weiteren zwei Österreicher sind, wird nach der Abfahrt am Montag entschieden.	Y	abfahrt	1877	    326	0.002	356.2308	german_at_news_2012_00946373
22447	Frage: Was werden Sie im Super-G anders machen als in der Abfahrt?	Y	abfahrt	1877	    326	0.002	376.3077	german_at_news_2012_00486373
22448	Das erste Mal, als geschrieben wurde, Sie würden sich nicht über eine Abfahrt wagen.	Y	abfahrt	1877	    326	0.002	382.5	german_at_news_2012_00167270
22449	Am Samstag stehen eine Abfahrt und am Sonntag ein Super G der Damen auf dem Programm.	Y	abfahrt	1877	    326	0.002	440.9333	german_at_news_2012_00044094
22450	Mit einer großen Überraschung endete am Sonntag bei den Olympischen Spielen die Herren-Abfahrt.	Y	abfahrt	1877	    326	0.002	670.4286	german_at_news_2012_00690639
22451	Das ist er aber erst in den letzten Jahren seiner Amtszeit geworden.	Y	amtszeit	1877	    326	0.002	249.5833	german_at_news_2012_00178494
22452	Ich habe in den 72 Tagen meiner Amtszeit alles gemacht, was möglich ist und lasse mir hier keine Vorwürfe machen“, so Darabos.	Y	amtszeit	1877	    326	0.002	417.5714	german_at_news_2012_00553510
22453	Wir sind zuversichtlich, dass schwarz-blau heute die letzten beiden Jahre ihrer Amtszeit in Angriff nehmen.	Y	amtszeit	1877	    326	0.002	534.1875	german_at_news_2012_00970451
22454	Ähnliche Geschichten gibt es auch aus seiner Amtszeit bei der Caritas.	Y	amtszeit	1877	    326	0.002	662	german_at_news_2012_00018656
22455	Unter seine Amtszeit fallen die Gründung der eigenen Landeshauptstadt, für die sich Alt-Landeshauptmann Ludwig mit voller Kraft eingesetzt hat.	Y	amtszeit	1877	    326	0.002	697	german_at_news_2012_00891356
22456	Das sei auch ausdrücklich in einer österreichischen Erklärung zum Ausdruck gebracht worden.	Y	ausdrücklich	1877	    326	0.002	504.0833	german_at_news_2012_00193775
22457	Eine Konkurrenz zu Facebook, Twitter oder Google+ soll der Dienst ausdrücklich nicht sein.	Y	ausdrücklich	1877	    326	0.002	539.0769	german_at_news_2012_00408891
22458	Ausdrücklich unterstrich Schüssel, dass die Bauern nicht Opfer der Erweiterung werden dürften.	Y	ausdrücklich	1877	    326	0.002	691.5	german_at_news_2012_00082708
22459	Sie leisten hervorragende Arbeit und ich wünsche ausdrücklich Weiteres zu lesen.	Y	ausdrücklich	1877	    326	0.002	745.3636	german_at_news_2012_00810636
22460	Ausdrücklich warnte Merkel vor zu hohen Erwartungen an den EU-Gipfel.	Y	ausdrücklich	1877	    326	0.002	859.5455	german_at_news_2012_00082717
22461	Nun sei es jedoch wieder an der Zeit, politisch in die Zukunft zu blicken.	Y	blicken	1877	    326	0.002	291.5714	german_at_news_2012_00732144
22462	Wir dürfen nicht nur auf den großen Nachbarn Deutschland blicken, es gibt auch die Schweiz.	Y	blicken	1877	    326	0.002	364.1333	german_at_news_2012_00963819
22463	Jetzt wird natürlich die ganze Welt auf die Präsentation des neuen iPhone 5 blicken.	Y	blicken	1877	    326	0.002	429.3333	german_at_news_2012_00626179
22464	Spindelegger: Mein Ziel ist, dass die ÖsterreicherInnen mit einem guten Gefühl in die Zukunft blicken können, weil gute Voraussetzungen geschaffen werden.	Y	blicken	1877	    326	0.002	545	german_at_news_2012_00837321
22465	Mit Rauch in die Zukunft blicken Mit Hilfe von Rauch in die Zukunft schauen.	Y	blicken	1877	    326	0.002	622.7778	german_at_news_2012_00694003
22466	Charles & Co: Liebesskandale der Royals Geben Sie hier die E-Mail-Adresse des Empfängers ein (z.B. xy@z.com). Mehrere Empfänger werden durch Kommata getrennt.	Y	charles	1877	    326	0.002	467.36	german_at_news_2012_00128408
22467	Kate, Will & Charles: Royals bei Barlow-Konzert Geben Sie hier die E-Mail-Adresse des Empfängers ein (z.B. xy@z.com). Mehrere Empfänger werden durch Kommata getrennt.	Y	charles	1877	    326	0.002	495	german_at_news_2012_00632069
22468	Denn die ging durch die Hölle, als sie nach ihrer Hochzeit mit Prinz Charles von heute auf morgen im Zentrum der öffentlichen Aufmerksamkeit stand.	Y	charles	1877	    326	0.002	518.0435	german_at_news_2012_00219513
22469	Charles Chaplin arbeitet zu dieser Zeit erst seit ein paar Wochen beim Film.	Y	charles	1877	    326	0.002	520.3846	german_at_news_2012_00128407
22470	Ein Weg, der nicht immer einfach war, zwischen den Armutsvierteln des London nach Charles Dickens und den großen internationalen Konzertarenen.	Y	charles	1877	    326	0.002	569.3684	german_at_news_2012_00426448
22471	So eröffnete Arnie sein Museum bei Thal Geben Sie hier die E-Mail-Adresse des Empfängers ein (z.B. xy@z.com). Mehrere Empfänger werden durch Kommata getrennt.	Y	eröffnete	1877	    326	0.002	427.7037	german_at_news_2012_00821813
22472	Es ist nicht nur das im März neu eröffnete „Tirol Panorama“, dem wir dieses Ergebnis zu verdanken haben.	Y	eröffnete	1877	    326	0.002	452.7778	german_at_news_2012_00462927
22473	Doch der Rückhalt seiner Familie eröffnete ihm die Möglichkeit, sich nicht nur einem Wirtschaftsstudium, sondern besonders auch der Kunst und Kultur zu widmen.	Y	eröffnete	1877	    326	0.002	502.1364	german_at_news_2012_00384151
22474	Ilgner war zehn Jahre alt als seine Mutter mit ihm und seinem Bruder nach Wien zog, wo sie einen Buchladen eröffnete.	Y	eröffnete	1877	    326	0.002	537.2857	german_at_news_2012_00566814
22475	Das vor einigen Wochen eröffnete „Persia“ in Linz macht uns aber nicht sehr froh.	Y	eröffnete	1877	    326	0.002	544.0714	german_at_news_2012_00202737
22476	Sehen Sie: Die wollen ja nicht einmal selbst Ferien machen.	Y	ferien	1877	    326	0.002	287.7	german_at_news_2012_00789979
22477	Aber warum leisten sie, oder gleich direkt an Sie die Frage, die Stunden nicht am Arbeitsplatz ab - auch in den Ferien?	Y	ferien	1877	    326	0.002	347.1053	german_at_news_2012_00010951
22478	Für mich waren die Ferien damals eine klare Sache: RAUS AUS DER STADT.	Y	ferien	1877	    326	0.002	481	german_at_news_2012_00499244
22479	Am Freitag beginnen in Wien, Niederösterreich und dem Burgenland die Ferien, außerdem in Tschechien und der Slowakei.	Y	ferien	1877	    326	0.002	540.8667	german_at_news_2012_00041689
22480	Ferien im Westen und Süden Österreichs sowie in Teilen Deutschlands.	Y	ferien	1877	    326	0.002	859.2	german_at_news_2012_00480465
22481	Wir haben in Österreich ein hohes Maß an Sicherheit“, so Schüssel.	Y	hohes	1877	    326	0.002	445.1818	german_at_news_2012_00965923
22482	Denn nur vom Ausland abhängig zu sein, ist ein hohes Risiko.“	Y	hohes	1877	    326	0.002	563.3636	german_at_news_2012_00222227
22483	Für die Designer, die in unserem Shop vertreten sind, ist Qualität weiterhin ein hohes Gut und das möchten wir unterstützen.	Y	hohes	1877	    326	0.002	616.9474	german_at_news_2012_00494046
22484	Demokratie wurde Ihnen schon als Kind als hohes Gut vermittelt.	Y	hohes	1877	    326	0.002	634	german_at_news_2012_00214610
22485	Wissenschaftler sind Menschen … die ein hohes Maß an Kreativität besitzen und eine wichtige Rolle in der Gesellschaft erfüllen.	Y	hohes	1877	    326	0.002	697.0556	german_at_news_2012_00973591
22486	Das könnte aber schon bald anders werden, denn die Zahl der Lehrlinge ist weiter rückläufig.	Y	lehrlinge	1877	    326	0.002	403.9333	german_at_news_2012_00182382
22487	Die ersten Lehrlinge werden mit Beginn des Schuljahres 2014/2015 hier ein und aus gehen werden.	Y	lehrlinge	1877	    326	0.002	404.2308	german_at_news_2012_00298075
22488	Drohszenarien gehen davon aus, dass bereits in fünf Jahren nur mehr 34.000 neue Lehrlinge pro Jahr in ganz Österreich ausgebildet werden.	Y	lehrlinge	1877	    326	0.002	408.2632	german_at_news_2012_00393821
22489	In den vergangenen 40 Jahren haben 7122 Lehrlinge ihre Ausbildung bei der Stadt Wien absolviert.	Y	lehrlinge	1877	    326	0.002	421.6154	german_at_news_2012_00588880
22490	Große Bedeutung kommt der Lehrlingsausbildung zu: In den vergangenen vier Jahren wurden 9 Lehrlinge ausgebildet, ab Herbst kommen wieder sechs neue Lehrlinge dazu.	Y	lehrlinge	1877	    326	0.002	441.9048	german_at_news_2012_00521781
22491	Denn wenn es nach dem Mond geht, gibt es heute wieder nicht viel zu tun.	Y	mond	1877	    326	0.002	209.3571	german_at_news_2012_00224461
22492	Aber sogar wenn man auf dem Mond wäre, würde dieses Paar in der Mondzeitung stehen.	Y	mond	1877	    326	0.002	372.2667	german_at_news_2012_00010271
22493	Bis zum Alter von 14 Jahren haben Sie fast nur den Mond fotografiert.	Y	mond	1877	    326	0.002	427.9167	german_at_news_2012_00119919
22494	Erst wenn der Mond im Löwen steht, ist es Zeit für den Friseur und das dauert ja nicht mehr lange.	Y	mond	1877	    326	0.002	433.35	german_at_news_2012_00448420
22495	Auch auf dem Mond eines großen Planeten wäre Leben möglich.	Y	mond	1877	    326	0.002	474.4	german_at_news_2012_00059612
22496	Was aber nicht heißt, dass man Geld nicht lieben soll, weil es ist genauso Energie wie alles auf unserem Planeten.	Y	planeten	1877	    326	0.002	402.1053	german_at_news_2012_00923106
22497	Auch auf dem Mond eines großen Planeten wäre Leben möglich.	Y	planeten	1877	    326	0.002	474.4	german_at_news_2012_00059612
22498	Er muss in Irland leben, aber es ist mir egal, ob er vom Planeten Zog stammt.	Y	planeten	1877	    326	0.002	541.1333	german_at_news_2012_00441770
22499	Doch Energie allein macht noch keinen Stern und keine Planeten.	Y	planeten	1877	    326	0.002	576	german_at_news_2012_00385335
22500	Die beiden Planeten sehen dann aus wie ein einziger großer Stern.	Y	planeten	1877	    326	0.002	612.1818	german_at_news_2012_00285352
22501	Auf den Plätzen zwei und drei liegen Deutschland und Frankreich.	Y	plätzen	1877	    326	0.002	419.3333	german_at_news_2012_00075126
22502	Auf den Plätzen nach Niederösterreich die anderen Länder: Vorarlberg (2.222), Steiermark (2.136), Kärnten (1.882), Tirol (1.879) und Burgenland (1.736).	Y	plätzen	1877	    326	0.002	437.1429	german_at_news_2012_00075116
22503	Sie hält nun bei sechs zweiten und sieben dritten Plätzen.	Y	plätzen	1877	    326	0.002	444.8	german_at_news_2012_00807484
22504	Im vergangenen Jahren seien es an die 30.000 Ausländer gewesen, die weit über der offiziellen Quote von die 8000 Plätzen nach Österreich gekommen sind.	Y	plätzen	1877	    326	0.002	454.25	german_at_news_2012_00581918
22505	Vier bzw. fünf Sitze hatte er ja schon immer, aber jetzt kann man auch dann auf allen Plätzen gut sitzen, wenn vier 1,90- Hünen reisen.	Y	plätzen	1877	    326	0.002	454.7826	german_at_news_2012_00902868
22506	In seiner ersten Geschichte ging es um das „Verbinden der Punkte“.	Y	verbinden	1877	    326	0.002	344.8182	german_at_news_2012_00607037
22507	Und wenn der ORF keine Stars findet, dann kann ich das Wort Dancing nicht mit Stars verbinden.	Y	verbinden	1877	    326	0.002	376.25	german_at_news_2012_00884106
22508	Für Mitterlehner zeigt sich einmal mehr, dass Sanierung mit Zukunft zu verbinden sei.	Y	verbinden	1877	    326	0.002	459.4615	german_at_news_2012_00499311
22509	In der Tat verbinden sich große Anliegen mit dem Fest der Heiligen Familie.	Y	verbinden	1877	    326	0.002	582.0833	german_at_news_2012_00593771
22510	Aber die Gefühle, die Österreicher mit ihrem Land verbinden, sind höchst unterschiedlich.	Y	verbinden	1877	    326	0.002	716.0909	german_at_news_2012_00004608
22511	Wie kann man der Liebe vertrauen, wenn man nicht mal sich selbst vertraut?	Y	vertraut	1877	    326	0.002	332.5833	german_at_news_2012_00956050
22512	Zum konkreten Fall könne man nichts sagen, weil man nicht damit vertraut sei.	Y	vertraut	1877	    326	0.002	428.6667	german_at_news_2012_00990190
22513	Wenn ich mir einen Vorwurf machen muss, dann diesen, gewissen Leuten zu sehr vertraut zu haben.	Y	vertraut	1877	    326	0.002	490.5333	german_at_news_2012_00941143
22514	Mit Ried habe ich einen Verein gefunden, der mir vertraut”, meinte der Wiener.	Y	vertraut	1877	    326	0.002	516.6667	german_at_news_2012_00694075
22515	Vertraut den Beteiligten oder kontrolliert sie, lässt ihnen mehr oder weniger Freiheit und fördert entweder Zusammenarbeit oder Wettbewerb.	Y	vertraut	1877	    326	0.002	782.6875	german_at_news_2012_00897657
22516	Auch am Freitag scheint von der Früh bis zum Abend vielfach die Sonne.	Y	vielfach	1877	    326	0.002	460.1538	german_at_news_2012_00059321
22517	Vielfach ist es auch die Familie, die unter diesen Veränderungen zu leiden hat.	Y	vielfach	1877	    326	0.002	466.25	german_at_news_2012_00900784
22518	Außerdem kommen diese Menschen vielfach nicht mehr oft genug ins Freie.	Y	vielfach	1877	    326	0.002	472.0909	german_at_news_2012_00086121
22519	Re: Also nach meiner Einschätzung ist es auch vielfach die Schuld der Wähler.	Y	vielfach	1877	    326	0.002	667.4615	german_at_news_2012_00767961
22520	Die Arbeit im Landtag sei „äußerst interessant, vielfach auch spannend gewesen“.	Y	vielfach	1877	    326	0.002	787.5455	german_at_news_2012_00279843
22521	Das war noch gar nichts, wenn man den Vorfall im Jahr 1994 erinnert.	Y	vorfall	1877	    326	0.002	322.6667	german_at_news_2012_00204271
22522	Warum der Vorfall vom 1. Juli erst jetzt bekannt wurde und der Polizei nicht damals schon gemeldet worden war?	Y	vorfall	1877	    326	0.002	345.6471	german_at_news_2012_00921666
22523	Die Polizei soll über den Vorfall erst Stunden später informiert worden sein.	Y	vorfall	1877	    326	0.002	389.25	german_at_news_2012_00336587
22524	Wie es zu dem Vorfall gekommen war, war noch unklar.	Y	vorfall	1877	    326	0.002	456.6667	german_at_news_2012_00954636
22525	Anzeigen bei der Polizei, beim ÖFB Der Vorfall wurde bei der Polizei zur Anzeige gebracht.	Y	vorfall	1877	    326	0.002	715.4545	german_at_news_2012_00055348
22526	Die Kosten von rund 4,3 Mio. Euro werden zu je ca.50 % von der ASFINAG und vom Land Tirol getragen.	Y	asfinag	1878	    325	0.002	373.1765	german_at_news_2012_00320312
22527	Nur sollte keine Partei auf eine andere zeigen, wenn sie selber (Asfinag, ÖBB.	Y	asfinag	1878	    325	0.002	410.0769	german_at_news_2012_00735668
22528	Die Schneeräumung kostete die ASFINAG in Tirol diesen Winter 6,2 Mio. Euro und damit um über 30 Prozent mehr als im Winter 2010/11.	Y	asfinag	1878	    325	0.002	479.3889	german_at_news_2012_00343239
22529	Bisher konnte man sie nur über das Internet und an einigen Verkaufsstellen (etwa der ASFINAG) beziehen.	Y	asfinag	1878	    325	0.002	487.125	german_at_news_2012_00118149
22530	Auf der anderen Seite seien sie nicht notwendig, argumentiert die ASFINAG.	Y	asfinag	1878	    325	0.002	492.2727	german_at_news_2012_00075416
22531	Er hat sich sogar noch gesteigert, was ich nicht erwartet habe.	Y	gesteigert	1878	    325	0.002	271.4545	german_at_news_2012_00437734
22532	Seit seinem Besuch in Österreich vor zwei Jahren konnten die österreichischen Exporte nach China um 23 Prozent gesteigert werden.	Y	gesteigert	1878	    325	0.002	371.5	german_at_news_2012_00799277
22533	Der Umsatz konnte im Vergleich zum Vorjahr um acht Prozent gesteigert werden.	Y	gesteigert	1878	    325	0.002	447	german_at_news_2012_00263685
22534	Auch der Export, vor allem nach Deutschland und Rumänien, konnte gesteigert werden.	Y	gesteigert	1878	    325	0.002	518	german_at_news_2012_00061994
22535	Es geht vielmehr darum, zu zeigen, wie das Potenzial der Organisation zu Kreativität und Innovation voll genutzt und weiter gesteigert werden kann.	Y	gesteigert	1878	    325	0.002	689.5	german_at_news_2012_00456103
22536	Ich habe dabei Menschen getroffen, die man in diese Kategorien einteilen kann, wobei oft nicht ganz klar ist, wer wer ist.	Y	kategorien	1878	    325	0.002	392.3684	german_at_news_2012_00552497
22537	Die Preise in den verschiedenen Kategorien sind mit insgesamt rund drei Millionen Euro dotiert.	Y	kategorien	1878	    325	0.002	460.8571	german_at_news_2012_00337218
22538	Mit dabei sein wollen, der Wunsch, fair behandelt zu werden und so weiter, all das sind Kategorien des Ökonomischen.	Y	kategorien	1878	    325	0.002	500.7895	german_at_news_2012_00684138
22539	Nach wie vor sind die einzelnen Kategorien sehr unterschiedlich von Fälschungen betroffen; während 52,4 % aller Fälschungen 2003 auf den 50er entfielen, waren nur 0,3 % aller Fälschungen 5er.	Y	kategorien	1878	    325	0.002	533.6	german_at_news_2012_00711752
22540	Die insgesamt 163 Einreichungen (286 % mehr als beim letzten mal!) konnten in 11 Kategorien akzeptiert werden - davon kommen 87 Produktionen aus Deutschland, 63 aus Österreich, 11 aus der Schweiz und 2 aus Südtirol.	Y	kategorien	1878	    325	0.002	540.6522	german_at_news_2012_00314909
22541	Ein Insider: „Es wird immer klarer, dass sie nicht ohne ihn sein kann.	Y	klarer	1878	    325	0.002	322.2308	german_at_news_2012_00419747
22542	Wir müssen klarer sichtbar machen, wofür wir in der EU stehen und was wir auf der Welt mit Europa erreichen wollen!	Y	klarer	1878	    325	0.002	422.1667	german_at_news_2012_00968585
22543	Machen Sie aber erst mal Ordnung, dann sehen Sie klarer.	Y	klarer	1878	    325	0.002	470.6667	german_at_news_2012_00661459
22544	Dies sei ein ganz klarer Auftrag der Wähler eine Regierung zu bilden.	Y	klarer	1878	    325	0.002	520.75	german_at_news_2012_00362063
22545	Und auf einmal war alles klarer und einfacher als vorher“.	Y	klarer	1878	    325	0.002	592.8889	german_at_news_2012_00868238
22546	Nun meldete sich die Mutter tatsächlich aus den USA per E-Mail bei mir, und wie zu erwarten war, liest sich ihre Version ganz anders.	Y	meldete	1878	    325	0.002	385.4583	german_at_news_2012_00731931
22547	Auch die SPÖ meldete sich am Samstag in einer Aussendung zu Wort.	Y	meldete	1878	    325	0.002	405.8333	german_at_news_2012_00064875
22548	Ich meldete mich zum Linz-Marathon an und ging vorher kein einziges Mal laufen.	Y	meldete	1878	    325	0.002	608.5	german_at_news_2012_00557660
22549	Mittwoch vergangener Woche erst meldete sich SPÖ-Landeshauptmann Franz Voves aus seinem Urlaub zu Wort.	Y	meldete	1878	    325	0.002	636.6	german_at_news_2012_00696659
22550	Die beiden sollen bereits Anfang Dezember ihre Beziehung beendet haben, meldete die „Los Angeles Times“.	Y	meldete	1878	    325	0.002	745.3571	german_at_news_2012_00285465
22551	Zwei davon waren Frauen, was eine Quote von acht Prozent macht.	Y	quote	1878	    325	0.002	309.6364	german_at_news_2012_00997248
22552	Wir in Österreich sind diesem Ziel bei einer Quote von über 60 Prozent bereits näher als die meisten anderen EU-Länder“, so Ferrero-Waldner.	Y	quote	1878	    325	0.002	364.1304	german_at_news_2012_00967163
22553	Außerdem gibt es keine Musik-Sendung die mehr Quote hat.“	Y	quote	1878	    325	0.002	420.4	german_at_news_2012_00085399
22554	Letztlich muss diese Quote ja auch finanziert und bezahlt werden.	Y	quote	1878	    325	0.002	634.7	german_at_news_2012_00657721
22555	Die Höhe der Quote liegt letztendlich in der Kompetenz und Verantwortung der Länder.	Y	quote	1878	    325	0.002	708.3636	german_at_news_2012_00312951
22556	Und dann sagen sich die meisten, ach die anderen räumen auch nicht weg, warum soll ich das dann machen.	Y	räumen	1878	    325	0.002	336.9412	german_at_news_2012_00869700
22557	Nur bei so vielen Räumen ist es gar nicht so leicht, den Käse zu finden.	Y	räumen	1878	    325	0.002	383.9286	german_at_news_2012_00733333
22558	Aufgabe der Politik muss es jedoch sein, einige dieser Steine aus dem Weg zu räumen.	Y	räumen	1878	    325	0.002	410.7333	german_at_news_2012_00078202
22559	Auch Wolfgang Schüssel geht offenbar davon aus, dass er sein Büro im Bundeskanzleramt nicht so bald wird räumen müssen.	Y	räumen	1878	    325	0.002	419.3684	german_at_news_2012_00073414
22560	Natürlich nur für den Fall, dass sie ihre Büros räumen müssen.	Y	räumen	1878	    325	0.002	422.8182	german_at_news_2012_00714264
22561	Sie steht immer noch unter einem sehr schweren Schock und das konnte bisher noch nicht geschehen.“	Y	schock	1878	    325	0.002	373.4	german_at_news_2012_00814486
22562	Dieser wohl größte Schock in der Geschichte der Zweiten Republik ist also genau zehn Jahre her.	Y	schock	1878	    325	0.002	415.7333	german_at_news_2012_00352742
22563	Na ja, für meine Eltern war es zuerst schon ein Schock.	Y	schock	1878	    325	0.002	510.4545	german_at_news_2012_00712751
22564	Schock kritisierte, dass die heute genannten Zahlen nicht aktuell seien, denn die Krise hätte Wien später getroffen.	Y	schock	1878	    325	0.002	605.8125	german_at_news_2012_00783986
22565	Dass Katie Holmes (33) ihn verlässt, war für Tom Cruise ein großer Schock.	Y	schock	1878	    325	0.002	890.0833	german_at_news_2012_00196486
22566	Aus meiner Sicht kann ich sagen, dass dieses Projekt sehr gelungen ist und ich es anderen Schülern empfehlen würde.	Y	schülern	1878	    325	0.002	428	german_at_news_2012_00084095
22567	Insgesamt haben wir hochgerechnet eine Zahl von rund 14.000 Schülern in Wien mit einem oder mehreren Nicht genügend“, so ein Sprecher der Wiener Stadtschulrätin.	Y	schülern	1878	    325	0.002	500.9565	german_at_news_2012_00608021
22568	Und eine satte Mehrheit aus dieser Gruppe, nämlich 58 Prozent, sind der Meinung, dass diese Leistungsbeurteilung von den betroffenen Eltern und Schülern „gemeinsam durchgeführt“ werden sollte.	Y	schülern	1878	    325	0.002	501.5	german_at_news_2012_00874611
22569	Gibt es Streit unter Schülern, machen diese den ersten Schritt auf die „Friedensstiege“ und erzählen ihre Sicht der Dinge.	Y	schülern	1878	    325	0.002	504.0526	german_at_news_2012_00515765
22570	Auch der Qualität und den Schülern wäre damit sehr gedient.	Y	schülern	1878	    325	0.002	510.5	german_at_news_2012_00062376
22571	Der Server dafür steht in den USA und ist daher dem österreichischen Recht entzogen.	Y	server	1878	    325	0.002	389.1429	german_at_news_2012_00259241
22572	Hochegger: Das ist ein Raum, in dem keine Leute vorbeigehen, es steht auch ein Server dort.	Y	server	1878	    325	0.002	470.2	german_at_news_2012_00543403
22573	Die Server sollen so aufgerüstet worden sein, dass nicht mit Problemen zu rechnen sei.	Y	server	1878	    325	0.002	518.8571	german_at_news_2012_00352458
22574	Durch den Bedarf im Freundeskreis hat sich der Server dann nach und nach zur Plattform für Musiker entwickelt.“	Y	server	1878	    325	0.002	531.3529	german_at_news_2012_00395132
22575	Fünf Server vor Ort sorgen für die beste Performance im Internet.	Y	server	1878	    325	0.002	540.6364	german_at_news_2012_00490503
22576	Das Stift ist reich an Geschichte und Tradition und es hat in den letzten Jahren viel Kraft gebraucht, um all dies zu erhalten.	Y	stift	1878	    325	0.002	430.1818	german_at_news_2012_00198659
22577	Der Landeshauptmann sagte, dass das Stift ausgebaut werde, um mehr Platz und mehr Publikum ansprechen zu können.	Y	stift	1878	    325	0.002	471.3125	german_at_news_2012_00248580
22578	Pater Georg und das Stift werden sich der Verantwortung zu stellen haben für das, was sie vielen von uns angetan haben.	Y	stift	1878	    325	0.002	476.4211	german_at_news_2012_00754364
22579	Insgesamt wendet das Stift mehr als eine Million Euro pro Jahr für sein soziales Engagement im In- und Ausland auf.	Y	stift	1878	    325	0.002	496.1	german_at_news_2012_00608962
22580	Seit kurzem präsentiert sich das Stift auch im Internet, dazu gibt es neue Infotafeln und eine Stiftsplatzbeleuchtung.	Y	stift	1878	    325	0.002	524.5882	german_at_news_2012_00798822
22581	So etwas hat es in der ganzen Geschichte von Deutschland sucht den Superstar noch nie gegeben.	Y	superstar	1878	    325	0.002	327.3125	german_at_news_2012_00821951
22582	Man mochte ihn und seine Musik ja auch so sehr, weil man bei ihm das Gefühl hatte, dass da kein „Superstar“ auf der Bühne stand sondern einer mit unser allen Stärken und Schwächen.	Y	superstar	1878	    325	0.002	400	german_at_news_2012_00667198
22583	Superstar Gabalier macht in Wels Party Geben Sie hier die E-Mail-Adresse des Empfängers ein (z.B. xy@z.com). Mehrere Empfänger werden durch Kommata getrennt.	Y	superstar	1878	    325	0.002	447.1923	german_at_news_2012_00846352
22584	Es ist Freitag, der 20. Oktober, ein Tag im Leben von Ski-Superstar Hermann Maier, eine Woche vor dem Start in die neue Weltcupsaison.	Y	superstar	1878	    325	0.002	482.3913	german_at_news_2012_00461948
22585	Die Frage, ob sie einen neuen Freund habe, verneinte der Superstar.	Y	superstar	1878	    325	0.002	506.4545	german_at_news_2012_00303692
22586	Swarovski entlässt 100 Mitarbeiter Geben Sie hier die E-Mail-Adresse des Empfängers ein (z.B. xy@z.com). Mehrere Empfänger werden durch Kommata getrennt.	Y	swarovski	1878	    325	0.002	409.2609	german_at_news_2012_00846790
