ORDER	SENTENCE	STATUS	WORD	RANK	COUNT	COUNT_REL	INDEX	ID
24001	Wir geben die Informationen nur weiter und beurteilen das nicht.	Y	beurteilen	1902	    301	0.0019	288.7	german_at_news_2012_00964426
24002	Warum diese gescheitert sind, sei für sie schwer zu beurteilen: „Für Österreich war das damals etwas ganz Neues.	Y	beurteilen	1902	    301	0.0019	335.2353	german_at_news_2012_00921729
24003	Anm.) Das kann ich nicht beurteilen, ich war erst ab Oktober 1997 für den Fall zuständig.	Y	beurteilen	1902	    301	0.0019	442.6429	german_at_news_2012_00052783
24004	Die Rahmenbedingungen haben sich so stark geändert, dass man die Lage völlig neu beurteilen muss.	Y	beurteilen	1902	    301	0.0019	532.4286	german_at_news_2012_00338526
24005	Wem der U-Ausschuss letztlich nutzen oder schaden wird, wollten die Experten nicht abschließend beurteilen.	Y	beurteilen	1902	    301	0.0019	737.6667	german_at_news_2012_00936170
24006	Dort, wo Büros betroffen waren, sei dieser bereits entfernt worden, heißt es im ORF.	Y	büros	1902	    301	0.0019	391.6429	german_at_news_2012_00391629
24007	Natürlich nur für den Fall, dass sie ihre Büros räumen müssen.	Y	büros	1902	    301	0.0019	422.8182	german_at_news_2012_00714264
24008	Als er gegen halb vier in sein Institut kommt, findet er die Büros leer vor.	Y	büros	1902	    301	0.0019	546.7143	german_at_news_2012_00030333
24009	Wenn der ORF-Generaldirektor also jemanden als Leiter seines Büros wolle, dann rede er nicht mit, so Faymann.	Y	büros	1902	    301	0.0019	561.5556	german_at_news_2012_00938205
24010	Informieren Sie sich über die Vielzahl von Veranstaltungen unter www.nachrichten.at/ticket Tickets in den OÖN-Ticket-Büros günstiger!	Y	büros	1902	    301	0.0019	825.2105	german_at_news_2012_00599984
24011	Sie hat immer einen Bezug auf etwas und einen Rahmen, der sie definiert.	Y	definiert	1902	    301	0.0019	373.8182	german_at_news_2012_00807778
24012	So haben wir uns definiert, und so etwas mögen wir auch selbst gerne.	Y	definiert	1902	    301	0.0019	433.3636	german_at_news_2012_00823711
24013	Aber ich bin eher dafür, dass die Kirche ihr Verständnis von Körper und Geist neu definiert.	Y	definiert	1902	    301	0.0019	511.8125	german_at_news_2012_00006989
24014	Schüssel: Es hat wenig Sinn, daß man das jetzt allgemein definiert.	Y	definiert	1902	    301	0.0019	572.2727	german_at_news_2012_00787568
24015	Dort ist Sache eindeutig definiert,die zuständigen Behörden müssten nur ihre Pflicht tun.	Y	definiert	1902	    301	0.0019	791.3077	german_at_news_2012_00390578
24016	Wenn nicht gibt es einen Prozess, der sich über viele, viele Jahre zieht“, sagt Eder.	Y	eder	1902	    301	0.0019	313.2143	german_at_news_2012_00943022
24017	Eder hat das nie gemacht und wird das nie tun.	Y	eder	1902	    301	0.0019	352.75	german_at_news_2012_00399652
24018	Die Voest ist nämlich nicht Herr Eder allein, das sind wir Mitarbeiter alle gemeinsam.	Y	eder	1902	    301	0.0019	464.6429	german_at_news_2012_00373661
24019	Und dennoch: Auch Wolfgang Eder hatte an diesem Mittwoch vergangener Woche allen Grund zum Feiern.	Y	eder	1902	    301	0.0019	507.9333	german_at_news_2012_00871909
24020	Eder: Du hast ja etwas geschafft, das du noch nie vorher geschafft hast.	Y	eder	1902	    301	0.0019	632.7	german_at_news_2012_00399631
24021	Sie selbst bemühe sich, den Koalitionspartner „mit im Boot“ zu haben, aber es sei noch nicht gelungen, dass alle in dieselbe Richtung rudern: „Das war nach dem Trennungsschmerz, den die ÖVP nach der Wahl erlitten hat, nicht so einfach.	Y	erlitten	1902	    301	0.0019	481.2222	german_at_news_2012_00812633
24022	Es soll eine Hirnblutung erlitten haben, wie es von der Polizei hieß.	Y	erlitten	1902	    301	0.0019	504.6364	german_at_news_2012_00468379
24023	Alle drei Mädchen machen sich Sorgen, dass sie einen Rückfall erlitten haben könnte“, gibt der Moore-Freund zu verstehen.	Y	erlitten	1902	    301	0.0019	521.7368	german_at_news_2012_00021801
24024	Sie habe vor Monaten einen Beinbruch erlitten, sei zuletzt aber schon wieder mobil gewesen.	Y	erlitten	1902	    301	0.0019	550.1429	german_at_news_2012_00807423
24025	Das und das Wirtschaftswunder der darauf folgenden Jahre haben wir der Wiederaufbaugeneration zu verdanken - einer Generation, die mehr Entbehrungen erlitten hat, als jede andere Generation, die noch am Leben ist.	Y	erlitten	1902	    301	0.0019	564.1923	german_at_news_2012_00200969
24026	Es geht um Erfolg: ob in den Finanzen, in der Liebe oder beim Sterben.	Y	finanzen	1902	    301	0.0019	368.7692	german_at_news_2012_00455974
24027	Und alle Staaten in Europa stehen vor der Aufgabe, ihre Finanzen in Ordnung zu bringen.	Y	finanzen	1902	    301	0.0019	433.5714	german_at_news_2012_00867062
24028	Im Bereich der öffentlichen Finanzen sind seit dem vergangenen Jahr Verbesserungen zu verzeichnen.	Y	finanzen	1902	    301	0.0019	544.3077	german_at_news_2012_00568141
24029	Wir im Land Tirol haben die Finanzen im Griff“, sagt Landeshauptmann Günther Platter (ÖVP) bei der Präsentation des Budgets.	Y	finanzen	1902	    301	0.0019	645.7778	german_at_news_2012_00967145
24030	Je früher es lernt, den Überblick über seine Finanzen zu behalten, desto besser.	Y	finanzen	1902	    301	0.0019	795.7692	german_at_news_2012_00621845
24031	Zwei Tage lang werden 150 Tiere zwei Tage lang unter freiem Himmel sehr zur Freude der großen und kleinen Besucher am See gezeigt.	Y	freiem	1902	    301	0.0019	523.1579	german_at_news_2012_00998428
24032	Nach Millionen-Deal auf freiem Fuß zu diesem Artikel sind keine Beiträge vorhanden Sie dürfen noch Zeichen als Text schreiben Bitte beachten Sie die Forumsregeln Für nicht registrierte Nutzer Bitte melden Sie sich an, um einen Kommentar abzuschicken.	Y	freiem	1902	    301	0.0019	591.9429	german_at_news_2012_00709999
24033	Fünf bleiben weiter in U-Haft, die restlichen wurden auf freiem Fuß angezeigt.	Y	freiem	1902	    301	0.0019	689.0769	german_at_news_2012_00490218
24034	Einer der Polizisten wurde leicht verletzt, der 30-Jährige wurde auf freiem Fuß angezeigt.	Y	freiem	1902	    301	0.0019	719	german_at_news_2012_00412130
24035	Der Großteil der rund 40 Veranstaltungen ist bei freiem Eintritt zugänglich.	Y	freiem	1902	    301	0.0019	884.5556	german_at_news_2012_00242637
24036	Und es gibt auch das eine oder andere Geschäft, das man aus gutem Grund ganz einfach nicht macht.	Y	gutem	1902	    301	0.0019	250.3529	german_at_news_2012_00875414
24037	Ich glaube, dass das mit gutem Grund so geschehen ist.	Y	gutem	1902	    301	0.0019	476.7	german_at_news_2012_00551613
24038	Die Bundesregierung ist zwar auf gutem Wege, leistet aber noch lange nicht genug.	Y	gutem	1902	    301	0.0019	556.2308	german_at_news_2012_00289810
24039	Denn die Anleger behaupten, sie in gutem Glauben erhalten zu haben.	Y	gutem	1902	    301	0.0019	622.1818	german_at_news_2012_00219296
24040	Platter wies darauf hin, dass er mit gutem Gefühl Rede und Antwort stehe.	Y	gutem	1902	    301	0.0019	779.8462	german_at_news_2012_00758303
24041	Mittlerweile befürchte ich sogar, dass es gar nicht soviele Helfer gibt oder geben würde, als wie alle immer tun.	Y	helfer	1902	    301	0.0019	435.9474	german_at_news_2012_00695876
24042	Sie haben mit Ihren Forderungen völlig recht, ich glaube sogar, dass dieses Programm Mehrheitsfähig ist und ja, mit mir hätte diese Partei auch gleich einen freiwilligen Helfer.	Y	helfer	1902	    301	0.0019	447.4615	german_at_news_2012_00807146
24043	Am 26. April findet das Fest der Helfer 2012 im Wiener Rathaus statt.	Y	helfer	1902	    301	0.0019	462.3636	german_at_news_2012_00038562
24044	Da rund um die Uhr jemand für die Frauen da sein sollte, werden dringend Helfer gesucht.	Y	helfer	1902	    301	0.0019	463.5714	german_at_news_2012_00158303
24045	Tausende Feuerwehrleute und zahlreiche weitere Helfer stehen hier bereits seit Tagen rund um die Uhr im Einsatz.	Y	helfer	1902	    301	0.0019	474.7059	german_at_news_2012_00849318
24046	ÖVP-Klubobmann Karlheinz Kopf sagte, es gibt auch in Österreich Korruption an der Schnittstelle von Wirtschaft und Politik, aber nicht mehr oder weniger als in anderen vergleichbaren Ländern.	Y	karlheinz	1902	    301	0.0019	447.7407	german_at_news_2012_00752332
24047	Daher müssen wir das Problem angehen, aber unser Land nicht schlechter machen, als es ist, sagte ÖVP-Klubobmann Karlheinz Kopf im Rahmen der Aktuellen Stunde im Nationalrat an die Adresse der Grünen.	Y	karlheinz	1902	    301	0.0019	460.0333	german_at_news_2012_00141336
24048	Geht es nach ÖVP-Klubobmann Karlheinz Kopf, soll bereits in zwei Wochen ein Grundsatzbeschluss auf dem Tisch liegen.	Y	karlheinz	1902	    301	0.0019	480.5556	german_at_news_2012_00507113
24049	Deren Klubobmann Karlheinz Kopf erklärte kürzlich in den „Vorarlberger Nachrichten“: „Obwohl das immer das Ziel sein muss, sind die Zeiten mit einem Dreier vorne für alle Parteien vorbei.“	Y	karlheinz	1902	    301	0.0019	556.2593	german_at_news_2012_00237448
24050	Karlheinz Kopf kritisiert: „Man kann zwar den ORF nicht alleine für sinkende Werbeeinahmen und sinkende Marktanteile verantwortlich machen; dennoch kann es nicht die Lösung sein, nur nach mehr Geld zu rufen.	Y	karlheinz	1902	    301	0.0019	591.3571	german_at_news_2012_00630882
24051	Nun ist der LASK fast Geschichte, zumindest einmal für längere Zeit in den oberen Regionen des österreichischen Fußballs - und das ist gut so!	Y	oberen	1902	    301	0.0019	472.4091	german_at_news_2012_00731464
24052	Das könnte auch noch länger so bleiben – denn der Eindruck drängt sich auf, dass die Agrar-Oberen gar nicht so genau wissen wollen, was die Tiere wirklich den Kopf kostet.	Y	oberen	1902	    301	0.0019	473.0357	german_at_news_2012_00182398
24053	In was für einem Land leben wir den wo es sich die oberen immer wieder richten können und die kleinen auf gut wienerisch die Krod fressen.	Y	oberen	1902	    301	0.0019	485.2917	german_at_news_2012_00612605
24054	Eines dieser Drittel gehört allein den oberen 80.000 (rund 1% der Österreicherinnen und Österreicher).	Y	oberen	1902	    301	0.0019	512.4167	german_at_news_2012_00413624
24055	Anders als an der oberen Adria gibt es hier Strände ganz für sich allein und dazu die wohl beste Wasserqualität der Adria.	Y	oberen	1902	    301	0.0019	514.1	german_at_news_2012_00047662
24056	NEWS: Wäre es für Sie eine Option, in die Politik zu gehen?	Y	option	1902	    301	0.0019	245.3333	german_at_news_2012_00722550
24057	Wäre das eine Option für Sie, würde Sie so etwas interessieren?	Y	option	1902	    301	0.0019	418	german_at_news_2012_00920564
24058	Ich denke, es war nie eine Option, reich zu werden.	Y	option	1902	    301	0.0019	518.9	german_at_news_2012_00549855
24059	Der Spanier erhielt einen Vertrag über ein Jahr mit der Option auf eine Verlängerung bis 2011.	Y	option	1902	    301	0.0019	565	german_at_news_2012_00260023
24060	Beiträge in Form eigener Aktien ist dabei eine Option von mehreren.	Y	option	1902	    301	0.0019	737.6364	german_at_news_2012_00105863
24061	Orte, an denen nicht bereits drei Nachbarn vor uns waren.	Y	orte	1902	    301	0.0019	424.9	german_at_news_2012_00748096
24062	Und für den Urlaub suchen Sie sich auch solche Orte?	Y	orte	1902	    301	0.0019	426.3	german_at_news_2012_00876141
24063	Offenbar werden Märkte als einzige Orte gesehen, an denen derzeit Geld zu holen ist.	Y	orte	1902	    301	0.0019	562.5	german_at_news_2012_00742798
24064	Gerade die Vielfalt der Werte brauche wieder Orte, wo der Mensch Entlastung finde und als Mensch ernst genommen werde, sagte er.	Y	orte	1902	    301	0.0019	651.2632	german_at_news_2012_00511568
24065	Diese „Hofburg on Tour“ begleitet Fischer auf seiner Österreich-Tour und sucht Veranstaltungen und Orte auf, an denen sich viele Jugendliche befinden.	Y	orte	1902	    301	0.0019	730.9474	german_at_news_2012_00347180
24066	Ich räume sogar ausdrücklich ein, dass ich nicht unbedingt Recht haben muss.	Y	räume	1902	    301	0.0019	521.5455	german_at_news_2012_00558528
24067	Wir sind viel gelaufen und haben die Räume eng gemacht.	Y	räume	1902	    301	0.0019	585.5	german_at_news_2012_00970390
24068	Wenn der Gegner den Ball hat, muss ich Räume schließen.	Y	räume	1902	    301	0.0019	593.4	german_at_news_2012_00938086
24069	Das Museum kann am bisherigen Standort bleiben, muss aber Räume abgeben.	Y	räume	1902	    301	0.0019	670.5455	german_at_news_2012_00186262
24070	Auf der linken Position zieht er vorne nach innen und eröffnet Räume.	Y	räume	1902	    301	0.0019	786.25	german_at_news_2012_00075947
24071	Welche Maßnahmen wurden eingeleitet und sind zur Zeit in Arbeit?	Y	eingeleitet	1903	    300	0.0019	345.2	german_at_news_2012_00935140
24072	Und ich sehe keinen Grund, warum ein solches Verfahren in diesem Fall nicht eingeleitet werden soll.	Y	eingeleitet	1903	    300	0.0019	464.5625	german_at_news_2012_00877293
24073	Vielmehr habe er den Verein nach vorne gebracht und einen guten Weg eingeleitet.	Y	eingeleitet	1903	    300	0.0019	552.6923	german_at_news_2012_00902237
24074	Für Ferrero-Waldner reichen aber die Konsequenzen der Reformen, die China seit den 80er Jahren eingeleitet hat, weit über die Wirtschaft hinaus.	Y	eingeleitet	1903	    300	0.0019	587.4	german_at_news_2012_00497312
24075	Die Türkei sieht Ferrero-Waldner als einen wichtigen Partner Europas in der Region, der in letzter Zeit wesentliche Reformen eingeleitet hat.	Y	eingeleitet	1903	    300	0.0019	740.4737	german_at_news_2012_00368831
24076	Häuser, die für zehn Millionen Euro erworben wurden, waren eine Zeit lang schon für sieben Millionen zu haben.	Y	erworben	1903	    300	0.0019	337.0625	german_at_news_2012_00531459
24077	In den beiden Ausstellungen können nicht alle Arbeiten, die in den vergangenen drei Jahren erworben wurden, gezeigt werden.	Y	erworben	1903	    300	0.0019	358.1875	german_at_news_2012_00586642
24078	Er hat sich in der Erinnerung und in den Herzen der Menschen, für die er sich eingesetzt hat, einen besonderen Platz erworben.	Y	erworben	1903	    300	0.0019	464.6471	german_at_news_2012_00437698
24079	Haider: Das BZÖ hat mit dem Kärntner Weg ein sehr gutes soziales Profil erworben.	Y	erworben	1903	    300	0.0019	520.2857	german_at_news_2012_00526808
24080	Ob das Geld ehrlich erworben wurde, interessiert nicht so sehr.	Y	erworben	1903	    300	0.0019	547.3	german_at_news_2012_00737333
24081	Geht aber nicht, weil ja auf der anderen Seite immer die Fiona steht.	Y	fiona	1903	    300	0.0019	239.5385	german_at_news_2012_00506956
24082	Fiona spricht: Mit viel Herz in die Zukunft Geben Sie hier die E-Mail-Adresse des Empfängers ein (z.B. xy@z.com). Mehrere Empfänger werden durch Kommata getrennt.	Y	fiona	1903	    300	0.0019	331.1852	german_at_news_2012_00482348
24083	Fiona kann sich vorstellen, noch einmal zu studieren: „Ich wollte eigentlich immer in die Forschung.	Y	fiona	1903	    300	0.0019	465.4	german_at_news_2012_00482328
24084	Fiona Apple scheint für sich einen guten Weg gefunden zu haben, beides zu bekommen.	Y	fiona	1903	    300	0.0019	528	german_at_news_2012_00482311
24085	Und so sind eben auch einige (Wahlkampf-)Auftritte Grassers mit seiner Fiona geplant.	Y	fiona	1903	    300	0.0019	664.1538	german_at_news_2012_00881979
24086	Bei seinem Fest zum 61er gab es Gelegenheit, den Fonds mit Geld zu füllen.	Y	füllen	1903	    300	0.0019	433.0714	german_at_news_2012_00105202
24087	Bis heute füllen sich ihre Augen mit Tränen, wenn sie davon erzählt.	Y	füllen	1903	    300	0.0019	504	german_at_news_2012_00118625
24088	Deswegen füllen sie den Raum, und die Männer stehen an der Wand.	Y	füllen	1903	    300	0.0019	525.4167	german_at_news_2012_00272787
24089	Man vertraut darauf, dass sich die Gebäude von selbst mit Sinn füllen.	Y	füllen	1903	    300	0.0019	547	german_at_news_2012_00669485
24090	Konkret: Jetzt verlangen Sie eine TU: keiner weiß warum? die bestehenden Plätze sind jetzt schon NICHT zu füllen, wie es laufend heißt?	Y	füllen	1903	    300	0.0019	659	german_at_news_2012_00641398
24091	Superstar Gabalier macht in Wels Party Geben Sie hier die E-Mail-Adresse des Empfängers ein (z.B. xy@z.com). Mehrere Empfänger werden durch Kommata getrennt.	Y	gabalier	1903	    300	0.0019	447.1923	german_at_news_2012_00846352
24092	Gabalier feierte Wörthersee-„Comeback“ Geben Sie hier die E-Mail-Adresse des Empfängers ein (z.B. xy@z.com). Mehrere Empfänger werden durch Kommata getrennt.	Y	gabalier	1903	    300	0.0019	486.2083	german_at_news_2012_00501743
24093	Gabalier: Das CD-Projekt ist eigentlich schon drei Jahre alt.	Y	gabalier	1903	    300	0.0019	522	german_at_news_2012_00501737
24094	Gabalier: Na ja, man kann es nie jedem recht machen.	Y	gabalier	1903	    300	0.0019	533.1	german_at_news_2012_00501771
24095	Gabalier legt wieder an Tempo zu - die Fans tanzen wie wild.	Y	gabalier	1903	    300	0.0019	828.6364	german_at_news_2012_00501767
24096	Auch sie sind schon gespannt, wie sich Österreich entscheiden wird.	Y	gespannt	1903	    300	0.0019	319.2	german_at_news_2012_00071418
24097	Man darf also gespannt sein, wer 2013 den deutschen Star für Schweden suchen wird.	Y	gespannt	1903	    300	0.0019	465.9231	german_at_news_2012_00664365
24098	Er sei gespannt, ob sich die FPÖ mit ihren Forderungen durchsetzen könne.	Y	gespannt	1903	    300	0.0019	517.9167	german_at_news_2012_00443711
24099	Die Welt ist darauf gespannt, was Kutcher aus seiner schwierigen Rolle macht.	Y	gespannt	1903	    300	0.0019	542.9167	german_at_news_2012_00376520
24100	Man darf gespannt sein, ob Merkel konsequent bleibt und das nicht immer einfache Verhältnis ihrer Regierung zu Obama aufs Spiel setzt.	Y	gespannt	1903	    300	0.0019	628.5238	german_at_news_2012_00664416
24101	Er erklärt ihnen auch, dass sie vor dem Hubschrauber, der über ihnen kreist, keine Angst haben müssen.	Y	hubschrauber	1903	    300	0.0019	378.375	german_at_news_2012_00433971
24102	Die Bevölkerung habe schon Angst vor den Kosten, wenn sie nur einen Hubschrauber sehen, so der Obmann entrüstet.	Y	hubschrauber	1903	    300	0.0019	421.7778	german_at_news_2012_00287508
24103	Der 82-Jährige wurde schwer verletzt und mit dem Hubschrauber ins Krankenhaus gebracht.	Y	hubschrauber	1903	    300	0.0019	438.0833	german_at_news_2012_00228181
24104	Der weitere Lieferplan sieht vor, dass Mitte November und Mitte Dezember je drei weitere Hubschrauber nach Österreich kommen.	Y	hubschrauber	1903	    300	0.0019	448	german_at_news_2012_00267290
24105	Gegen 9.15 Uhr war wegen des Schneefalls zunächst aber noch nicht klar, ob ein Hubschrauber starten konnte.	Y	hubschrauber	1903	    300	0.0019	457.4375	german_at_news_2012_00505418
24106	Stellt die Justizministerin das Verfahren - etwa aus politischen Gründen - ein, ist es ein für alle Mal beendet.	Y	justizministerin	1903	    300	0.0019	440	german_at_news_2012_00842396
24107	Doch es dürfen wohl alle froh sein, dass sie Finanz- und nicht Justizministerin ist.	Y	justizministerin	1903	    300	0.0019	457.9286	german_at_news_2012_00385453
24108	Was meint die Justizministerin, wenn sie vom Recht des Kindes auf beide Eltern spricht?	Y	justizministerin	1903	    300	0.0019	490.5	german_at_news_2012_00927007
24109	Hochegger: Die Justizministerin war damals in Kitzbühel auch zu Gast auf jener Party.	Y	justizministerin	1903	    300	0.0019	663.1538	german_at_news_2012_00543409
24110	Die FPÖ werde die Justizministerin an ihren Taten messen, kündigte Strache an.	Y	justizministerin	1903	    300	0.0019	806.8	german_at_news_2012_00303302
24111	Dennoch hält er an seiner Entscheidung fest, die On-Off-Beziehung im Frühjahr 2009 endgültig beendet zu haben: „Ich musste aus der Sache raus, weil sie keine Zukunft hatte.	Y	off	1903	    300	0.0019	523.8214	german_at_news_2012_00222616
24112	Ich sehe unsere Arbeit jetzt schon mehr als Vorbereitung auf das Play-off.	Y	off	1903	    300	0.0019	576.3077	german_at_news_2012_00559143
24113	Damit geht ihre On-Off-Beziehung in die nächste Runde.	Y	off	1903	    300	0.0019	650.6	german_at_news_2012_00145348
24114	Für das Play-off-Finale ist der 22-Jährige optimistisch: „Wir haben im Verlauf der Saison gezeigt, dass wir alle Gegner daheim schlagen können.	Y	off	1903	    300	0.0019	702.4286	german_at_news_2012_00492200
24115	Man darf gespannt sein, wie sich die Truppe im Frühjahr im Meister- Play-off schlägt.	Y	off	1903	    300	0.0019	828.7857	german_at_news_2012_00664427
24116	Öffnungszeiten am 16. November von 16:00 Uhr bis 19:00 Uhr sowie vom 17. bis 22. November jeweils von 12:00 bis 14:00 Uhr und 16:00 bis 19:00 Uhr.	Y	öffnungszeiten	1903	    300	0.0019	351.9	german_at_news_2012_00743400
24117	Öffnungszeiten: 12:00 bis 14:00 Uhr und 16:00 bis 19:00 Uhr, am Samstag von 10:00 bis 15:00 Uhr.	Y	öffnungszeiten	1903	    300	0.0019	361.7143	german_at_news_2012_00743397
24118	Die Öffnungszeiten der Ausstellung: Mittwoch von 14 bis 18 Uhr, Samstag von 14 bis 17 Uhr, Sonntag von 9.30 bis 12 Uhr.	Y	öffnungszeiten	1903	    300	0.0019	388.3	german_at_news_2012_00332039
24119	Die Öffnungszeiten der Ausstellung: Montag bis Mittwoch von 8 bis 16.30 Uhr, Donnerstag von 8 bis 18 Uhr, Freitag von 8 bis 15.30 Uhr.	Y	öffnungszeiten	1903	    300	0.0019	390.6364	german_at_news_2012_00332040
24120	Öffnungszeiten der Ausstellung bis 21. Mai Dienstag bis Samstag 15 bis 19 Uhr Browser zeigt »Iframes« nicht an.	Y	öffnungszeiten	1903	    300	0.0019	398.2308	german_at_news_2012_00743407
24121	Jetzt ist das Frühjahr bald da, aber noch kein Ende der Sperre in Sicht.	Y	sperre	1903	    300	0.0019	366.4286	german_at_news_2012_00624291
24122	Die erste Sperre erfolgt bereits in der Nacht von Mittwoch, 22.06.2005 von 22:00 Uhr auf Donnerstag, 23.06.2005 bis 06:00 Uhr Früh.	Y	sperre	1903	    300	0.0019	403.8	german_at_news_2012_00298300
24123	Den Grund für die Sperre haben wir Ihnen allerdings auch schon zuvor per E-Mail mitgeteilt.	Y	sperre	1903	    300	0.0019	420.375	german_at_news_2012_00216856
24124	FBI kann Android-Sperre nicht knacken Geben Sie hier die E-Mail-Adresse des Empfängers ein (z.B. xy@z.com). Mehrere Empfänger werden durch Kommata getrennt.	Y	sperre	1903	    300	0.0019	466.2308	german_at_news_2012_00479556
24125	A9: Felsblock gesprengt - Sperre aufgehoben Geben Sie hier die E-Mail-Adresse des Empfängers ein (z.B. xy@z.com). Mehrere Empfänger werden durch Kommata getrennt.	Y	sperre	1903	    300	0.0019	528.24	german_at_news_2012_00000321
24126	Besonders erfreulich ist der Umstand, dass heute um 31.000 mehr Frauen in den Arbeitsmarkt integriert sind als noch vor einem Jahr.	Y	umstand	1903	    300	0.0019	385.05	german_at_news_2012_00110837
24127	Dazu kommt der Umstand, dass sich viele Wähler von der Politik nichts mehr erwarten.	Y	umstand	1903	    300	0.0019	393.9231	german_at_news_2012_00210920
24128	Viele Gäste kommen mit dem Auto aus dem dritten Bezirk – da ist der Umstand, dass die letzten 300 Meter zur Praterhauptallee gehören, das größte Problem.	Y	umstand	1903	    300	0.0019	425.087	german_at_news_2012_00899274
24129	Außerdem war es ihr über Jahre gelungen, ihren Eltern und ihrem Mann den Umstand zu verheimlichen, dass sie Raucherin ist.	Y	umstand	1903	    300	0.0019	452.85	german_at_news_2012_00087403
24130	Das Wissen um diesen Umstand hilft uns bei der Entwicklung neuer Produkte.	Y	umstand	1903	    300	0.0019	473.75	german_at_news_2012_00205981
24131	Ich glaube, dass es neue Verbindungen für die Wirtschaft auch nach Deutschland geben wird, Frankfurt ist das Ziel.“	Y	verbindungen	1903	    300	0.0019	338.5	german_at_news_2012_00551677
24132	Verbindungen zu Mordfall nicht bestätigt Dass es sich bei der Tat um einen Racheakt nach einem Mordfall im Jahr 2002 gehandelt hat, wurde von der Wiener Polizei nicht bestätigt.	Y	verbindungen	1903	    300	0.0019	453.5833	german_at_news_2012_00894661
24133	Sabri befinde sich nicht in Kärnten, aber er habe „weltweit gute Verbindungen, wir müssen uns keine Sorgen machen“.	Y	verbindungen	1903	    300	0.0019	487.4444	german_at_news_2012_00776660
24134	Viele Unternehmen haben sich in Wien angesiedelt wegen der guten Verbindungen in den Osten.	Y	verbindungen	1903	    300	0.0019	500.4615	german_at_news_2012_00900523
24135	Pro Tag könnte es 16 direkte Verbindungen von Wien nach Paris geben.	Y	verbindungen	1903	    300	0.0019	501.5455	german_at_news_2012_00764551
24136	Grasser komme zwar gemeinsam mit Wirtschaftsminister Martin Bartenstein in die Stadt, dabei gehe es aber nur um die Steuerreform.	Y	wirtschaftsminister	1903	    300	0.0019	504.1111	german_at_news_2012_00520499
24137	Es kann nicht sein, dass der Norden alles und der Süden nichts tut“, betonte Wirtschaftsminister Martin Bartenstein vor österreichischen Journalisten.	Y	wirtschaftsminister	1903	    300	0.0019	566.8947	german_at_news_2012_00464350
24138	Für Wirtschaftsminister Martin Bartenstein (V) wäre offenbar ohnehin ein Gang in die Opposition der richtige Weg: Im „Standard“ erklärte er, zwei Drittel der ÖVP-Basis seien für diese Option.	Y	wirtschaftsminister	1903	    300	0.0019	624.963	german_at_news_2012_00501412
24139	Sechs Teams wurden Freitag von Wirtschaftsminister Reinhold Mitterlehner (ÖVP) in Wien ausgezeichnet.	Y	wirtschaftsminister	1903	    300	0.0019	757.25	german_at_news_2012_00789751
24140	Wirtschaftsminister Reinhold Mitterlehner (ÖVP) und Sozialminister Rudolf Hundstorfer (SPÖ) muss die Ministerin allerdings noch davon überzeugen.	Y	wirtschaftsminister	1903	    300	0.0019	899.375	german_at_news_2012_00971177
24141	Möglich ist auch der Zugriff über andere Geräte wie das iPhone.	Y	zugriff	1903	    300	0.0019	405.4545	german_at_news_2012_00698496
24142	Kunst ist nicht korrekt, und Politiker haben auf Kunst keinen Zugriff zu nehmen, weder auf gute noch auf schlechte.	Y	zugriff	1903	    300	0.0019	522.5625	german_at_news_2012_00646177
24143	Behörden anderer Länder haben somit keinen Zugriff auf die Daten.	Y	zugriff	1903	    300	0.0019	622.6	german_at_news_2012_00093390
