ORDER	SENTENCE	STATUS	WORD	RANK	COUNT	COUNT_REL	INDEX	ID
22587	Kate: Swarovski-Kleid bei 1. Auftritt Geben Sie hier die E-Mail-Adresse des Empfängers ein (z.B. xy@z.com). Mehrere Empfänger werden durch Kommata getrennt.	Y	swarovski	1878	    325	0.002	430.08	german_at_news_2012_00632040
22588	Alle Infos für den Besuch von Swarovski Wien finden Sie auf www.swarovski.com/wien. Öffnungszeiten: Montag bis Freitag 9 – 21 Uhr, Samstag 9 – 18 Uhr Es gibt keine Kommentare zu diesem Thema.	Y	swarovski	1878	    325	0.002	441.9615	german_at_news_2012_00022815
22589	Das ist der Grund, warum seine Marke dreieinhalb Mal so viel wert ist wie die Nummer 2 am Markt (Swarovski).	Y	swarovski	1878	    325	0.002	476.6667	german_at_news_2012_00177080
22590	Fiona Swarovski: So ausgelassen feiert sie in Cannes Geben Sie hier die E-Mail-Adresse des Empfängers ein (z.B. xy@z.com). Mehrere Empfänger werden durch Kommata getrennt.	Y	swarovski	1878	    325	0.002	513.1481	german_at_news_2012_00482364
22591	Im zweiten waren die Verhältnisse sehr schwer, auch von der Sicht her.	Y	verhältnisse	1878	    325	0.002	384.9167	german_at_news_2012_00584417
22592	Und diese ist angesichts der politischen Verhältnisse kaum zu bekommen.	Y	verhältnisse	1878	    325	0.002	427.9	german_at_news_2012_00873553
22593	Er zeigt die wirtschaftlichen Verhältnisse eines Landes, allerdings nur um ein, zwei Jahre nach hinten verschoben.“	Y	verhältnisse	1878	    325	0.002	509.8125	german_at_news_2012_00452250
22594	Nicht nur die Griechen haben in den vergangenen Jahrzehnten offensichtlich weit über ihre Verhältnisse gelebt.	Y	verhältnisse	1878	    325	0.002	602.2667	german_at_news_2012_00724501
22595	Es gäbe in Linz seit Jahren zwar steigende Einnahmen, aber noch stärker steigende Ausgaben: man habe in der Landeshauptstadt über seine Verhältnisse gelebt.	Y	verhältnisse	1878	    325	0.002	675.4762	german_at_news_2012_00454266
22596	Er hatte stets in all den Jahren ein großes Ziel vor Augen gehabt und allen Menschen die Möglichkeit zur Weiterentwicklung gegeben.	Y	weiterentwicklung	1878	    325	0.002	388.5238	german_at_news_2012_00438120
22597	Er hoffe, dass sich Wien auch in Zukunft an der Weiterentwicklung der Schule beteiligen werde.	Y	weiterentwicklung	1878	    325	0.002	461	german_at_news_2012_00438442
22598	Es geht aber auch um gemeinsame Diskussion, die direkte Beteiligung an der Weiterentwicklung unserer Arbeit.	Y	weiterentwicklung	1878	    325	0.002	539.6	german_at_news_2012_00455254
22599	Ist eine Weiterentwicklung von Technik und Gesellschaft in der bisherigen Beziehung eigentlich sinnvoll?	Y	weiterentwicklung	1878	    325	0.002	621.3846	german_at_news_2012_00616129
22600	Facebook wolle die Weiterentwicklung der bisherigen Nachrichten-Funktion am Montag vorstellen, berichteten US-Medien am Freitag.	Y	weiterentwicklung	1878	    325	0.002	746	german_at_news_2012_00476616
22601	Von über fünf Millionen Zuschauern zum Start, schauten dieses Mal nur noch ein wenig über drei Millionen zu.	Y	zuschauern	1878	    325	0.002	376	german_at_news_2012_00910041
22602	In der dritten Runde setzten sich die Wiener am Samstag vor 700 Zuschauern mit 34:26 durch.	Y	zuschauern	1878	    325	0.002	412.5714	german_at_news_2012_00590301
22603	Daran hatte auch eine erste große Probe vor 62.000 Zuschauern am Montag nicht viel geändert.	Y	zuschauern	1878	    325	0.002	498.0714	german_at_news_2012_00155177
22604	So gab es etliche Spiele mit 3.000 Zuschauern oder noch weniger.	Y	zuschauern	1878	    325	0.002	521.8	german_at_news_2012_00822510
22605	Anni erklärt den Zuschauern wieder einmal die Welt und warum man mit einem rosa Porsche leichter fahren kann als mit anderen Autos liegt doch auf der Hand: Ein Porsche ist kleiner und schneller.	Y	zuschauern	1878	    325	0.002	543	german_at_news_2012_00053169
22606	Ich will mich nicht so behandeln lassen, wie bei der Austria leider viele behandelt wurden.	Y	behandeln	1879	    324	0.002	329.3333	german_at_news_2012_00561827
22607	Ob sie auch ihre goldenen Eltern besser behandeln als diese die ihren, weiß man noch nicht.	Y	behandeln	1879	    324	0.002	336.625	german_at_news_2012_00739468
22608	Aber wir werden die Partie genauso behandeln wie jede andere auch.	Y	behandeln	1879	    324	0.002	471.0909	german_at_news_2012_00012082
22609	In den vergangenen Jahren ließen sich in de La Tour immer wieder Politiker behandeln.	Y	behandeln	1879	    324	0.002	576.1538	german_at_news_2012_00588982
22610	Hoffentlich können wir die Sache auf der politischen Ebene behandeln.	Y	behandeln	1879	    324	0.002	638	german_at_news_2012_00544081
22611	Die leben davon, dass es die DDR nicht mehr gibt.	Y	ddr	1879	    324	0.002	272.2222	german_at_news_2012_00322221
22612	Unverständlich“ war es auch für die DDR Politiker warum das Volk sie auf einmal nicht mehr wollte.	Y	ddr	1879	    324	0.002	395.5882	german_at_news_2012_00892084
22613	Nur lebte ich in Ostberlin, und in der DDR gab’s nicht so einen Markt für Regisseure, wie’s ihn hier gibt.	Y	ddr	1879	    324	0.002	475.5	german_at_news_2012_00735024
22614	Abgesetzt nicht, aber die Aufführung war sehr unbeliebt, und danach hatte ich keine Möglichkeit mehr, in der DDR zu arbeiten.	Y	ddr	1879	    324	0.002	496.95	german_at_news_2012_00013348
22615	Wir hatten vor dem DDR-Spiel in der Türkei 0:3 verloren, und einige Medien haben versucht, mich abzuschießen.	Y	ddr	1879	    324	0.002	502.7647	german_at_news_2012_00966999
22616	Besser gesagt: Sie haben mit dieser Wahl dokumentiert, dass die Entwicklung weit fortgeschritten ist.	Y	dokumentiert	1879	    324	0.002	458.9286	german_at_news_2012_00111938
22617	Das Programm wird schließlich mit einer live-CD dokumentiert werden.	Y	dokumentiert	1879	    324	0.002	499.3	german_at_news_2012_00189846
22618	Aber es zeigte sich, dass die Frage, welche Rolle Kunst selbst dabei spielt, eine schwierige ist: Kann und soll es eine Kunst geben, die nicht nur beobachtet, kommentiert und dokumentiert, sondern sich ganz konkret engagiert?	Y	dokumentiert	1879	    324	0.002	500.3448	german_at_news_2012_00006470
22619	Wäre das so, müsste es ja – weil die Leute nehmen sich kein Blatt vor den Mund – hier drinnen dokumentiert sein.	Y	dokumentiert	1879	    324	0.002	505.2	german_at_news_2012_00920588
22620	Die Verstöße gegen das Bankwesengesetz sind klar dokumentiert und liegen seit mehr als einem Jahr am Tisch der zuständigen Staatsanwaltschaft.	Y	dokumentiert	1879	    324	0.002	553.4	german_at_news_2012_00372807
22621	Ich habe mich aber entschlossen, einen anderen Weg zu gehen.	Y	entschlossen	1879	    324	0.002	283.6	german_at_news_2012_00553828
22622	Erst in den letzten Jahren hat er sich entschlossen, öffentlich seine Werke zu präsentieren.	Y	entschlossen	1879	    324	0.002	436.8571	german_at_news_2012_00447081
22623	Im Gegenteil: Ich bin entschlossen, die Aufmerksamkeit, die das Thema EU jetzt hat, als Chance zu verstehen und zu nützen.	Y	entschlossen	1879	    324	0.002	495.8889	german_at_news_2012_00571422
22624	Daher haben sich SPÖ und ÖVP entschlossen, diese volle Transparenz umzusetzen.“	Y	entschlossen	1879	    324	0.002	713	german_at_news_2012_00140885
22625	Abhängig von der weiteren Entwicklung sei der EZB-Rat bereit, rechtzeitig und entschlossen zu handeln.	Y	entschlossen	1879	    324	0.002	837.6429	german_at_news_2012_00013414
22626	Ihn selbst zieht es aber gar nicht an die Front, lieber berichtet der Journalist von ganz normalen Menschen und wie sie trotz Krieg leben.	Y	front	1879	    324	0.002	443.25	german_at_news_2012_00563580
22627	So lange der Verein so gut funktioniert wie in den letzten Jahren, bin ich gerne an vorderster Front.“	Y	front	1879	    324	0.002	446.2353	german_at_news_2012_00825588
22628	Die Hausherren liegen nur zwei Mal in Front - mit 1:0 und 2:1.	Y	front	1879	    324	0.002	476.1	german_at_news_2012_00311713
22629	Dornbirn lag bis zwei Minuten vor dem Ende in Front.	Y	front	1879	    324	0.002	482.9	german_at_news_2012_00389791
22630	Das meint einer der es spürt wie Politik falsch läuft,weil er an der Front steht und erlebt wie Kunden immer weniger Budget haben,wenn nicht bald was geändert wird dann sind viele in Ihrer Selbständigkeit am scheitern.	Y	front	1879	    324	0.002	486.75	german_at_news_2012_00185542
22631	Zum großen gesellschaftlichen Thema wurde er erst in den letzten Jahrzehnten.	Y	gesellschaftlichen	1879	    324	0.002	385.5455	german_at_news_2012_00989600
22632	Sie sollte mehr Rechte erhalten und verstärkt am gesellschaftlichen und politischen Leben teilnehmen.	Y	gesellschaftlichen	1879	    324	0.002	626.3333	german_at_news_2012_00814036
22633	Ich bin überzeugt davon, dass echte Reformen nur im Dialog aller gesellschaftlichen Gruppen umgesetzt werden können.	Y	gesellschaftlichen	1879	    324	0.002	685.4375	german_at_news_2012_00549170
22634	Diese können zur gesellschaftlichen Entwicklung entscheidend beitragen, wenn sie entsprechend gefördert und genutzt werden.	Y	gesellschaftlichen	1879	    324	0.002	711.7143	german_at_news_2012_00347817
22635	Darin nehmen die 14 Kirchen gemeinsam Stellung zu den sozialen und gesellschaftlichen Herausforderungen.	Y	gesellschaftlichen	1879	    324	0.002	786.6667	german_at_news_2012_00156451
22636	Vier Tipps zum neuen Betriebssystem für Mac Geben Sie hier die E-Mail-Adresse des Empfängers ein (z.B. xy@z.com). Mehrere Empfänger werden durch Kommata getrennt.	Y	mac	1879	    324	0.002	362.5926	german_at_news_2012_00903303
22637	Apple stellt neues Mac-Betriebssystem vor Geben Sie hier die E-Mail-Adresse des Empfängers ein (z.B. xy@z.com). Mehrere Empfänger werden durch Kommata getrennt.	Y	mac	1879	    324	0.002	370.2308	german_at_news_2012_00056075
22638	Wie wichtig die Software-Ausstattung ist, zeigt sich auch auf dem Mac.	Y	mac	1879	    324	0.002	442.4167	german_at_news_2012_00960808
22639	Dafür werden immer noch deutlich mehr Windows-PC als Apple Mac-Computer verkauft.	Y	mac	1879	    324	0.002	565.7692	german_at_news_2012_00139189
22640	Kein Wunder, meistens vertrauen sie bei ihrer Arbeit auf Mac-Computer.	Y	mac	1879	    324	0.002	705.0909	german_at_news_2012_00635199
22641	Unter Oberösterreichs Privatvermietern gibt es einige, die vor Jahren erstmals als Gäste ins Land gekommen sind.	Y	oberösterreichs	1879	    324	0.002	414.8125	german_at_news_2012_00891184
22642	Wir nehmen zur Kenntnis: Oberösterreichs FPÖ will zwar ein konsolidiertes Budget – wenn die EU das aber auch will, sperrt sie sich.	Y	oberösterreichs	1879	    324	0.002	515.85	german_at_news_2012_00968904
22643	Er ist so quasi eine gemeinsame Geschichte unserer beiden Länder“, sagte Oberösterreichs Landeshauptmann Josef Pühringer (ÖVP) dazu.	Y	oberösterreichs	1879	    324	0.002	533.4118	german_at_news_2012_00439823
22644	Linz (lk) - Es war, wie man so schön sagt, eine schwere Geburt, doch nun ist Oberösterreichs Tourismus endlich auf neue Schienen gestellt und mit voller Kraft in Richtung Zukunft unterwegs.	Y	oberösterreichs	1879	    324	0.002	545.8	german_at_news_2012_00659288
22645	Weniger Geburten und höhere Lebenserwartung Oberösterreichs Bevölkerung schrumpft und doch wieder nicht: Die Zahl der Geburten geht auch in den nächsten 30 Jahren zurück.	Y	oberösterreichs	1879	    324	0.002	556.8571	german_at_news_2012_00936541
22646	Nach den ersten beiden Jahren 2004 und 2005 kommt es im dritten und letzten Jahr 2006 zu einer weiteren Reduktion der freien Fahrten.	Y	reduktion	1879	    324	0.002	388.4211	german_at_news_2012_00705672
22647	Damit wird die Gesamtzuwanderung nach Österreich auf 7.500 Personen beschränkt, das ist eine Reduktion gegenüber dem Vorjahr um 550 Personen.	Y	reduktion	1879	    324	0.002	446.8824	german_at_news_2012_00148500
22648	Dobernig: „Für das Jahr 2012 ist eine Reduktion um rund 20 Millionen Euro gefragt.“	Y	reduktion	1879	    324	0.002	460.25	german_at_news_2012_00382290
22649	Wünschenswert wäre aber, dass die Männer weniger arbeiten, und sei es nur durch Reduktion der Überstunden.	Y	reduktion	1879	    324	0.002	473.375	german_at_news_2012_00977377
22650	Über die Reduktion der Arbeitslosigkeit sage diese Ziffer nichts, das sollte man am österreichischen Beispiel gelernt haben, so Einem am Montag (27. 03.) in einer Pressekonferenz.	Y	reduktion	1879	    324	0.002	489.4783	german_at_news_2012_00860031
22651	Halten Sie sich an andere und schwimmen Sie mit dem Strom, dann können Sie sich sogar neue Freunde machen.	Y	schwimmen	1879	    324	0.002	337	german_at_news_2012_00527663
22652	Auch in der Liebe brauchen Sie nur mit dem Strom zu schwimmen.	Y	schwimmen	1879	    324	0.002	374.9167	german_at_news_2012_00068551
22653	Daher das Kind beim Baden oder Schwimmen nie aus den Augen lassen!	Y	schwimmen	1879	    324	0.002	467.5833	german_at_news_2012_00140611
22654	Und so wie dort kann man hier am selben Tag Ski fahren und schwimmen gehen.	Y	schwimmen	1879	    324	0.002	496.0714	german_at_news_2012_00882080
22655	Insgesamt können durch diese Aktion 420 Grazer Kinder jährlich gratis schwimmen lernen.	Y	schwimmen	1879	    324	0.002	687.7273	german_at_news_2012_00608221
22656	Wie Westenthaler sagte, werde das Volksbegehren noch vor dem Sommer im Parlament behandelt werden und zur Abstimmung stehen.	Y	volksbegehren	1879	    324	0.002	472.5	german_at_news_2012_00960796
22657	Jedes Volksbegehren wirft eine politische Frage auf, und dazu haben die Parteien eine Meinung.	Y	volksbegehren	1879	    324	0.002	515.3846	german_at_news_2012_00621528
22658	Wir haben das zur Kenntnis genommen und nehmen dieses Volksbegehren ernst.	Y	volksbegehren	1879	    324	0.002	521	german_at_news_2012_00965055
22659	Und der Grüne Peter Pilz will dazu ein Volksbegehren im Herbst starten.	Y	volksbegehren	1879	    324	0.002	549.9167	german_at_news_2012_00872169
22660	Von einer PR-Agentur wurde er für ein Volksbegehren engagiert.	Y	volksbegehren	1879	    324	0.002	722.2	german_at_news_2012_00908467
22661	Wenn es nicht so funktioniert, bricht die Welt auch nicht zusammen.	Y	bricht	1880	    323	0.002	362.6	german_at_news_2012_00940264
22662	Eine neue Zeit bricht an, niemand weiß, wohin sie führen wird, aber er wird es nicht mehr erleben.	Y	bricht	1880	    323	0.002	410.1765	german_at_news_2012_00410358
22663	Mit Beginn seiner zweiten Amtszeit im Jahr 2012 bricht die Krise in Russland voll aus.	Y	bricht	1880	    323	0.002	545.7857	german_at_news_2012_00683763
22664	Dein Kind bricht damit eine Regel und das muss Konsequenzen haben.	Y	bricht	1880	    323	0.002	652.4545	german_at_news_2012_00212565
22665	Es bricht sich beide Beine, einen Arm – aber es lebt.	Y	bricht	1880	    323	0.002	771.4444	german_at_news_2012_00453080
22666	Auch wenn ich selten mit den Grünen einer Meinung bin, aber diesbezüglich zeigt sich das auch die Grünen auch ihren Platz in der Politik haben sollen.	Y	diesbezüglich	1880	    323	0.002	241.8261	german_at_news_2012_00072918
22667	Und in Österreich hat er diesbezüglich schon gar nichts zu verlieren.	Y	diesbezüglich	1880	    323	0.002	342.9091	german_at_news_2012_00877919
22668	Es gäbe daher keinen Grund, der Bevölkerung diesbezüglich Angst zu machen.	Y	diesbezüglich	1880	    323	0.002	537.8182	german_at_news_2012_00454201
22669	Selbst habe er in dieser Sache keine Gespräche mit Politikern geführt, er habe diesbezüglich auf den damaligen Telekom-Vorstand Rudolf Fischer vertraut.	Y	diesbezüglich	1880	    323	0.002	687.7	german_at_news_2012_00800362
22670	Die Nationalbank wollte diesbezüglich keinen Kommentar abgeben, berichtete die Austria Presse Agentur (APA).	Y	diesbezüglich	1880	    323	0.002	1037.0833	german_at_news_2012_00329145
22671	Es geht darum, ihnen eine Richtung zu zeigen, ihnen einen Weg zu eröffnen.	Y	eröffnen	1880	    323	0.002	385.2727	german_at_news_2012_00455438
22672	Gerade diese Bundesregierung habe außerordentlich viel dafür getan, um den jungen Menschen in diesem Land gute Chancen eröffnen zu können.	Y	eröffnen	1880	    323	0.002	448.35	german_at_news_2012_00511514
22673	Lassnig: Das hat man mich schon gefragt, aber damals gab es noch den Haider, das hätte der eröffnen und finanzieren müssen, und ich mochte den nicht, weil er Aussagen gemacht hatte, die alle Leute beleidigt haben.	Y	eröffnen	1880	    323	0.002	457.9091	german_at_news_2012_00650817
22674	Es geht also nicht darum Frauen mehr zu zahlen, sondern darum, Frauen alle Möglichkeiten zu eröffnen, leistungsfähig zu sein.	Y	eröffnen	1880	    323	0.002	472.6667	german_at_news_2012_00455277
22675	Die Meister der Jahre 2011 und 2012 eröffnen am Samstag um 16.00 Uhr die Fußball-Bundesliga-Saison.	Y	eröffnen	1880	    323	0.002	497.5385	german_at_news_2012_00326188
22676	Die Europäer sehen uns so, wie sie uns sehen wollen.	Y	europäer	1880	    323	0.002	313.25	german_at_news_2012_00299076
22677	Ob sie bis dahin auch überzeugt sind, Europäer zu sein, ist eine andere Frage.	Y	europäer	1880	    323	0.002	365.6429	german_at_news_2012_00739476
22678	Im Gegenteil: Meinem Vater war immer wichtig, dass man sich als Europäer fühlt.	Y	europäer	1880	    323	0.002	536.4615	german_at_news_2012_00571454
22679	Was halten Sie von Schlagzeilen wie „Die Europäer sterben aus“?	Y	europäer	1880	    323	0.002	588.9	german_at_news_2012_00925451
22680	Einerseits sind wir Europäer, andererseits haben wir Beziehungen zu Asien.	Y	europäer	1880	    323	0.002	870.1111	german_at_news_2012_00412894
22681	Wenn er mit uns die Koalition nicht fortsetzen will, will ich das wissen, dann muss er den Mut haben, es zu sagen!	Y	fortsetzen	1880	    323	0.002	284.2	german_at_news_2012_00939802
22682	In den beiden kommenden Jahren wird sich diese Dynamik in etwa fortsetzen.	Y	fortsetzen	1880	    323	0.002	435.1818	german_at_news_2012_00586653
22683	Keine Sorge: Der Lady geht’s schon besser und sie kann ihre Tour fortsetzen!	Y	fortsetzen	1880	    323	0.002	488.5	german_at_news_2012_00634159
22684	Man könne die EU-Erweiterung eines Tages fortsetzen, aber man brauche dafür das Engagement der Bürger.	Y	fortsetzen	1880	    323	0.002	553.4	german_at_news_2012_00666735
22685	Die FPÖ wird per Ende August ihre Anti-EU-Kampagne fortsetzen.	Y	fortsetzen	1880	    323	0.002	614.3636	german_at_news_2012_00303331
22686	Läuft alles rund, könnte die Regierung rotem Wunsch gemäß aber schon in zwei Wochen stehen.	Y	gemäß	1880	    323	0.002	484.2	german_at_news_2012_00651222
22687	Das Motto des Werks mit dem Titel „Musik in der Luft“ lautet gemäß einer Aussendung des ORF: „Die Stadt Wien ist schön und ihre Musik ist schön - so schön, dass es die Menschen abhebt und sie fliegen!	Y	gemäß	1880	    323	0.002	524.7	german_at_news_2012_00186134
22688	Gemäß dem Prinzip „jeder Bürger ist gleich viel Wert“ seien bereits jetzt die Bürger der Städte benachteiligt, da sie viele Leistungen tragen, von denen auch andere partizipieren.	Y	gemäß	1880	    323	0.002	546.4615	german_at_news_2012_00507923
22689	Zur Chancengleichheit und Fairness einer Gesellschaft ist es auch notwendig, dass niemand ausgeschlossen bleibt und sich jeder und jede gemäß seinen oder ihrer Fähigkeiten entwickeln kann.	Y	gemäß	1880	    323	0.002	602.5417	german_at_news_2012_00992048
22690	Profumo ist dennoch optimistisch, dass alles gemäß seinen Plänen läuft: „In rund einem Jahr soll auch dank unserer österreichischen und deutschen Kollegen alles o.k. sein.	Y	gemäß	1880	    323	0.002	615.2	german_at_news_2012_00763562
22691	Und man werde auch dafür sorgen, daß die Sicherheit des Landes gewährleistet sei.	Y	gewährleistet	1880	    323	0.002	360.3077	german_at_news_2012_00879015
22692	ÖSTERREICH: Was muss gewährleistet sein, damit wir dieses Europa erleben?	Y	gewährleistet	1880	    323	0.002	394.7	german_at_news_2012_00751327
22693	Weiters ist während der Reise auch gewährleistet, dass rund um die Uhr ein österreichischer Arzt vor Ort ist.	Y	gewährleistet	1880	    323	0.002	434.9412	german_at_news_2012_00933922
22694	Vor dem Ministerrat meinte sie, dass eine Finanzierung vom Bund aus derzeit nicht gewährleistet sei.	Y	gewährleistet	1880	    323	0.002	480.9333	german_at_news_2012_00913051
22695	Unter anderem ist nun die Trennung zwischen Jugendlichen und Erwachsenen nicht vollständig gewährleistet.	Y	gewährleistet	1880	    323	0.002	674.7692	german_at_news_2012_00889016
22696	Es geht nicht ohne Geld, aber auch nicht ohne Humor.	Y	humor	1880	    323	0.002	307.875	german_at_news_2012_00455721
22697	Wenn man seinen Humor verliert und sich selbst zu ernst nimmt, kann man nicht mehr spielen.	Y	humor	1880	    323	0.002	340.8667	german_at_news_2012_00942597
22698	Einiges fällt aber auch in den Bereich Humor und darf nicht zu ernst genommen werden.	Y	humor	1880	    323	0.002	413.2	german_at_news_2012_00419373
22699	Sein Humor könnte es sein, der ihn über die ganzen Jahre jung gehalten hat.	Y	humor	1880	    323	0.002	468.6923	german_at_news_2012_00793918
22700	Ich wünsche mir auch, stark zu bleiben, meinen Humor nicht zu verlieren.	Y	humor	1880	    323	0.002	575.5455	german_at_news_2012_00562303
22701	Etwa wenn sich in der U-Bahn die Leute nicht neben Jean Paul aus Ruanda setzen wollen, weil er Afrikaner ist.	Y	jean	1880	    323	0.002	507.0476	german_at_news_2012_00473771
22702	Juncker warnt vor Euro-Zerfall Wenn jemand wissen sollte, wie es wirklich um die Euro-Gruppe steht, dann ihr Chef Jean-Claude Juncker.	Y	jean	1880	    323	0.002	614.5238	german_at_news_2012_00628222
22703	Politiker mit langjähriger Erfahrung wie Jean-Claude Juncker, der seit 1995 Regierungschef ist, haben mir gesagt: Man hat das alles diskutiert, aber man konnte sich nicht einigen.	Y	jean	1880	    323	0.002	615.32	german_at_news_2012_00759593
22704	Ich habe mich immer als ein Anhänger der Jean Monnet-Methode bekannt.	Y	jean	1880	    323	0.002	682.8333	german_at_news_2012_00553906
22705	An ihrer Seite: Jean-Louis Trintignant, 81, der für Haneke seine erste (und wie er angedeutet hat: auch letzte) Filmhauptrolle seit 14 Jahren übernommen hatte.	Y	jean	1880	    323	0.002	684.3913	german_at_news_2012_00052178
22706	Es hat noch nie so viele Komponisten gegeben wie heute.	Y	komponisten	1880	    323	0.002	296.7	german_at_news_2012_00459526
22707	Musik, die von deutschen Komponisten geschaffen wurde, wird zu hören sein.	Y	komponisten	1880	    323	0.002	450.9091	german_at_news_2012_00701011
22708	Denn genug war dem Komponisten und Autor ja bekanntlich noch nie genug.	Y	komponisten	1880	    323	0.002	582.2727	german_at_news_2012_00220856
22709	Österreichische Komponisten und Musiker sind auch außerhalb des Landes erfolgreich.	Y	komponisten	1880	    323	0.002	616.4	german_at_news_2012_00749404
22710	Er hat den Namen des berühmten deutschen Komponisten in den 60er Jahren angenommen, weil er fand, dass er lustig klingt.	Y	komponisten	1880	    323	0.002	668.3125	german_at_news_2012_00437009
22711	Aber das Sparpaket hält -es sei denn, es kommt zur großen Krise im Euro-Raum.	Y	sparpaket	1880	    323	0.002	318.5	german_at_news_2012_00003926
22712	Weitere Ausgaben seien nur durch ein neues Sparpaket zu finanzieren, das aber die Bevölkerung so nicht mehr haben will.	Y	sparpaket	1880	    323	0.002	370.4737	german_at_news_2012_00932260
22713	Jeder zweite Österreicher fühlt sich vom Sparpaket betroffen Was man sich in den nächsten 12 Monaten zur Seite legen wird können?	Y	sparpaket	1880	    323	0.002	431.2105	german_at_news_2012_00621116
22714	Zuletzt hatte es bei der AUA Diskussionen um ein neues Sparpaket gegeben.	Y	sparpaket	1880	    323	0.002	516.25	german_at_news_2012_00987466
22715	Ich meine das Sparpaket, das ich bei seiner Vorstellung als wichtigen ersten Schritt begrüßt habe.	Y	sparpaket	1880	    323	0.002	588.6154	german_at_news_2012_00557573
22716	Auch die Kunst im öffentlichen Raum habe noch nie einen so großen Stellenwert erhalten als derzeit.	Y	stellenwert	1880	    323	0.002	318.0625	german_at_news_2012_00063962
22717	Eine Botschaft, die an Stellenwert gerade jetzt, wenige Tage vor der EU-Erweiterung ganz besonders deutlich wird.	Y	stellenwert	1880	    323	0.002	410.5294	german_at_news_2012_00405560
22718	Wallner freut sich über das große Engagement der Gemeinden: “Die Familie hat in unserer Gesellschaft einen sehr hohen Stellenwert.	Y	stellenwert	1880	    323	0.002	490.8421	german_at_news_2012_00919527
22719	Im Burgenland habe die Arbeit der Freiwilligen einen besonders hohen Stellenwert.	Y	stellenwert	1880	    323	0.002	522	german_at_news_2012_00568701
22720	Pröll unterstrich zudem den hohen Stellenwert der Vereine und Freiwilligen.	Y	stellenwert	1880	    323	0.002	879.5	german_at_news_2012_00764203
22721	Ob das Ende der Beziehung der beiden Grund für die Tat des Mannes war, sei nicht klar, teilt die Polizei mit.	Y	teilt	1880	    323	0.002	403.9474	german_at_news_2012_00737320
22722	Gestalten Sie diesen Tag ganz nach Ihren Vorstellungen, denn die teilt man heute bestimmt sehr gerne mit Ihnen.	Y	teilt	1880	    323	0.002	457.7222	german_at_news_2012_00514101
22723	Wie teilt ihr euch das mit dem Arbeiten auf, du und deine Freundin?	Y	teilt	1880	    323	0.002	517.5385	german_at_news_2012_00959866
22724	Sie ruft ihren Ehemann an, teilt ihm mit, dass sie die Stadt verlassen wird.	Y	teilt	1880	    323	0.002	533.9231	german_at_news_2012_00811928
22725	Im Schnitt sind Einkommen sogar leicht gesunken, teilt die Arbeiterkammer (AK) mit.	Y	teilt	1880	    323	0.002	895.0833	german_at_news_2012_00580314
22726	Paradox ist, dass auf der anderen Seite viele junge Menschen, die vergleichsweise wenig Zeit aber viel Geld haben, und den Älteren Geld geben könnten, den Älteren Zeit geben.	Y	vergleichsweise	1880	    323	0.002	369.9565	german_at_news_2012_00753282
22727	Im Gegensatz zu damals, steht es heute vergleichsweise gut da.	Y	vergleichsweise	1880	    323	0.002	398.6	german_at_news_2012_00570992
