ORDER	SENTENCE	STATUS	WORD	RANK	COUNT	COUNT_REL	INDEX	ID
24287	Man habe immer viel von Hans Mayr lernen können, so der Bürgermeister und vieles von seinem Wissen habe auch heute, in einer geänderten Welt, noch immer seine Gültigkeit.	Y	mayr	1906	    297	0.0018	443.08	german_at_news_2012_00665266
24288	Wo gespart wird, kann oder will Mayr derzeit noch nicht sagen.	Y	mayr	1906	    297	0.0018	444.4545	german_at_news_2012_00974898
24289	Johannes Mayr sieht aus wie ein Bäcker, er war auch einmal einer.	Y	mayr	1906	    297	0.0018	499.0833	german_at_news_2012_00626837
24290	Aber es wird derzeit in der Causa ermittelt“, so Mayr.	Y	mayr	1906	    297	0.0018	503.4	german_at_news_2012_00006430
24291	Früher auf das Thema Nachhaltigkeit zu setzen ist das einzige, das ich anders machen würde.	Y	nachhaltigkeit	1906	    297	0.0018	387.6154	german_at_news_2012_00489302
24292	Diese Regierung hat wie keine zuvor die Nachhaltigkeit in den Mittelpunkt unserer Politik gestellt.	Y	nachhaltigkeit	1906	    297	0.0018	402.4286	german_at_news_2012_00350577
24293	Somit sei sicher, dass Graz mit seiner Chance auf Nachhaltigkeit gut umgehen wird.	Y	nachhaltigkeit	1906	    297	0.0018	467	german_at_news_2012_00828390
24294	In einer zweiten Runde sollen dann im Dezember weitere Firmen auf Nachhaltigkeit überprüft werden.	Y	nachhaltigkeit	1906	    297	0.0018	500.9286	german_at_news_2012_00599003
24295	Parallel dazu finden in einigen Bundesländern Aktionen zum Thema Nachhaltigkeit statt, wobei heuer der Schwerpunkt im Osten Österreichs liegt.	Y	nachhaltigkeit	1906	    297	0.0018	686.6842	german_at_news_2012_00753321
24296	Was auch schön ist, sind die Senioren - die bekommen nämlich auch leuchtende Augen und sind froh, weil der Nikolaus so lange nicht mehr bei ihnen war.“	Y	nikolaus	1906	    297	0.0018	478.9565	german_at_news_2012_00923350
24297	Von 4. bis 7. Dezember ist Nikolaus-Hochsaison - und danach „freue ich mich, dass ich ein Jahr Pause habe“, gibt Schobesberger zu, „Ab November kommt dann wieder die Vorfreude auf den Nikolaus.“	Y	nikolaus	1906	    297	0.0018	499.4643	german_at_news_2012_00906145
24298	Kleine Kinder haben manchmal auch Angst vor Bärten - und davon hat der Nikolaus ja genug.“	Y	nikolaus	1906	    297	0.0018	505	german_at_news_2012_00638105
24299	Meine Mutter wäre heute erst 83, mein Vater 81. Mein Sohn Nikolaus war drei Monate alt, als meine Mutter starb.	Y	nikolaus	1906	    297	0.0018	530.5333	german_at_news_2012_00676632
24300	Am Freitag, dem 3. Dezember, bietet die Katholische Jungschar in der Zeit von 10 bis 17 Uhr eine Nikolaus-Hotline an.	Y	nikolaus	1906	    297	0.0018	547.8889	german_at_news_2012_00041703
24301	Microsoft stellt Windows Phone 8 vor Geben Sie hier die E-Mail-Adresse des Empfängers ein (z.B. xy@z.com). Mehrere Empfänger werden durch Kommata getrennt.	Y	phone	1906	    297	0.0018	372.76	german_at_news_2012_00680492
24302	Windows Phone 7 Handy von Samsung Geben Sie hier die E-Mail-Adresse des Empfängers ein (z.B. xy@z.com). Mehrere Empfänger werden durch Kommata getrennt.	Y	phone	1906	    297	0.0018	400.28	german_at_news_2012_00961954
24303	Windows Phone 7 für iPhone und Android Nutzer anderer Geräte können sich ein Bild von der Software machen.	Y	phone	1906	    297	0.0018	559.8824	german_at_news_2012_00961952
24304	"""Für Microsoft ist Windows das wichtigste Produkt, noch vor Office Mit dem aktuellen Handy-Betriebssystem """" Windows Phone 7 """" hat es die Software mittlerweile auch auf Smartphones geschafft."""	Y	phone	1906	    297	0.0018	651.48	german_at_news_2012_00499276
24305	HTC zwischen Android und Windows Phone 7 Smartphone-Hersteller präsentierte Top-Android- und -Windows-Handys.	Y	phone	1906	    297	0.0018	1117.3636	german_at_news_2012_00545777
24306	Jetzt führt er das BZÖ an und geht mit Schüssel in die EU-Präsidentschaft.	Y	präsidentschaft	1906	    297	0.0018	272.5714	german_at_news_2012_00623636
24307	Bundeskanzler Dr. Schüssel hat dem Europäischen Parlament vor genau vier Wochen über die Ziele der Österreichischen Präsidentschaft berichtet.	Y	präsidentschaft	1906	    297	0.0018	420.5	german_at_news_2012_00125132
24308	Österreich möchte die Zeit seiner Präsidentschaft vor allem auch dafür nützen, Europa den Bürgerinnen und Bürgern wieder näher zu bringen und das Vertrauen in das europäische Projekt zu stärken.	Y	präsidentschaft	1906	    297	0.0018	539.3846	german_at_news_2012_00750029
24309	Ich möchte daher diese Gedanken der Identität Europas mit aufnehmen und an den Beginn unserer Präsidentschaft stellen.	Y	präsidentschaft	1906	    297	0.0018	586.8824	german_at_news_2012_00557730
24310	Hinsichtlich der österreichischen Präsidentschaft gebe es allgemein hohe Erwartungen, man müsse dabei aber am Boden der Realität bleiben.	Y	präsidentschaft	1906	    297	0.0018	689.4118	german_at_news_2012_00541906
24311	Was rät er Eltern, damit ihre Kinder nicht dick werden?	Y	rät	1906	    297	0.0018	478.2	german_at_news_2012_00927434
24312	Kidman rät Travoltas Frau zur Scheidung Geben Sie hier die E-Mail-Adresse des Empfängers ein (z.B. xy@z.com). Mehrere Empfänger werden durch Kommata getrennt.	Y	rät	1906	    297	0.0018	495.1154	german_at_news_2012_00636100
24313	Dabei sollte er dreimal für fünf Minuten das Tempo so steigern, dass die Nachbarn sagen würden: „Der hat es aber heute eilig“, rät Sonntag.	Y	rät	1906	    297	0.0018	542	german_at_news_2012_00134071
24314	Kern sollte sich seiner Aufgabe als Chef der ÖBB voll annehmen, denn da gibt es genug zu tun“, rät Bartenstein dem ÖBB-Chef.	Y	rät	1906	    297	0.0018	553.8095	german_at_news_2012_00635696
24315	Fragen Sie immer genau nach, was alles im Preis enthalten ist“, rät Repl.	Y	rät	1906	    297	0.0018	557.8462	german_at_news_2012_00486286
24316	Schließlich nimmt sich „der Willi“ ja auch immer wieder Zeit für Ausflüge in seine alte Heimat.	Y	willi	1906	    297	0.0018	458.3125	german_at_news_2012_00782338
24317	Willi will in den Nationalrat, das wird aber erst bei der Bundesversammlung der Grünen im Herbst entschieden.	Y	willi	1906	    297	0.0018	496.25	german_at_news_2012_00961596
24318	Und sie alle outen sich dieser Tage als Willi-Fans.	Y	willi	1906	    297	0.0018	530.1	german_at_news_2012_00881158
24319	Zur Zukunft von Willi meinte sie, dieser habe einen hervorragenden Wahlkampf geführt, was aber mit „dieser Konkurrenz“ schwierig gewesen sei.	Y	willi	1906	    297	0.0018	539.7368	german_at_news_2012_00993683
24320	Wenn das jemand weiß in Österreich, dann ist das Willi Hemetsberger.	Y	willi	1906	    297	0.0018	542.7	german_at_news_2012_00937758
24321	Tatsächlich wird der Abgang aber bei 418 Millionen Euro liegen, und das sind schon fast 0,2 Prozent.	Y	abgang	1907	    296	0.0018	239.8	german_at_news_2012_00849138
24322	Und jetzt das: Sein Abgang im Sommer ist so gut wie beschlossen.	Y	abgang	1907	    296	0.0018	314.3333	german_at_news_2012_00878268
24323	Aber ich würde mir einen anderen Abgang, als sie ihn hatte, wünschen.	Y	abgang	1907	    296	0.0018	358.0833	german_at_news_2012_00007670
24324	Von vielen weiß man das gar nicht mehr, weil ihr Abgang nicht so spektakulär war.	Y	abgang	1907	    296	0.0018	381.8571	german_at_news_2012_00910133
24325	Derzeit gibt es einen Abgang von jährlich 436.037 Euro, der für zwei Jahre bis zur Neuregelung vom Land abgedeckt wird.	Y	abgang	1907	    296	0.0018	417.8947	german_at_news_2012_00268910
24326	Besucher der Stadt Salzburg kommen vor allem wegen der Altstadt und dort verdient die Stadt auch gutes Geld mit ihnen.	Y	altstadt	1907	    296	0.0018	363.6111	german_at_news_2012_00112765
24327	Salzburg: Fahrverbot in Altstadt Geben Sie hier die E-Mail-Adresse des Empfängers ein (z.B. xy@z.com). Mehrere Empfänger werden durch Kommata getrennt.	Y	altstadt	1907	    296	0.0018	382.75	german_at_news_2012_00777258
24328	In der Salzburger Altstadt war deutlich weniger los als im Vorjahr.	Y	altstadt	1907	    296	0.0018	422.9091	german_at_news_2012_00593195
24329	Zwischen 10.00 und 14.00 Uhr dürfen dann keine Privaten in der Altstadt fahren.	Y	altstadt	1907	    296	0.0018	443.3636	german_at_news_2012_00999246
24330	Das „Altstadt Vienna“ hatte in den letzten Jahren eine Auslastung von 88 Prozent.	Y	altstadt	1907	    296	0.0018	450.25	german_at_news_2012_00159576
24331	Und auch wir können heute sagen: Vielen Dank für die Blumen.	Y	blumen	1907	    296	0.0018	317.3636	german_at_news_2012_00868158
24332	An sich nichts Neues, denn es gibt zahlreiche Blumen, die man dafür verwenden kann.	Y	blumen	1907	    296	0.0018	365.9286	german_at_news_2012_00054034
24333	Wobei, ich hatte diese Woche einen unguten Traum darüber, dass die Blumen nicht bei der Hochzeit sein werden.	Y	blumen	1907	    296	0.0018	474.8889	german_at_news_2012_00974281
24334	Mit Blumen können wir uns ganz einfach bedanken: „Ich bin froh, dass es Dich gibt!“	Y	blumen	1907	    296	0.0018	495.9333	german_at_news_2012_00683936
24335	Es gibt also nur die Möglichkeit, die Steuer auf Mieten, Blumen und Bücher ebenfalls zu verringern, was insgesamt 2,5 Milliarden Euro kosten würde.	Y	blumen	1907	    296	0.0018	550.0476	german_at_news_2012_00456452
24336	Der neue Bond soll Ende des Jahres in die Kinos kommen.	Y	bond	1907	    296	0.0018	421.4545	german_at_news_2012_00252536
24337	Robert Pattinson will James Bond spielen Geben Sie hier die E-Mail-Adresse des Empfängers ein (z.B. xy@z.com). Mehrere Empfänger werden durch Kommata getrennt.	Y	bond	1907	    296	0.0018	442.3077	german_at_news_2012_00772553
24338	Ich weiß aber: Die Queen ist ein großer Bond-Fan.	Y	bond	1907	    296	0.0018	630.8	german_at_news_2012_00560745
24339	Das kennt man ja eigentlich schon aus den James-Bond-Filmen.	Y	bond	1907	    296	0.0018	656	german_at_news_2012_00181574
24340	Sogar der James Bond ist jetzt immer öfter schlecht drauf.	Y	bond	1907	    296	0.0018	829.1	german_at_news_2012_00822636
24341	Und wenn das bedeutet, dass ich nicht mehr in Clubs gehen kann, dann ist das eben so.	Y	clubs	1907	    296	0.0018	241.5	german_at_news_2012_00884073
24342	Vielleicht spielen wir dann nur noch in kleinen Clubs, vielleicht nur noch in großen.	Y	clubs	1907	    296	0.0018	355.3	german_at_news_2012_00901849
24343	So musste es heuer für die Tour durch die Wiener Clubs erst wieder fit gemacht werden.	Y	clubs	1907	    296	0.0018	409.4667	german_at_news_2012_00828769
24344	Natürlich betrifft das nicht nur Rapid, alle Clubs haben so einen Kern der Fans.	Y	clubs	1907	    296	0.0018	507.0714	german_at_news_2012_00713482
24345	Damit stehen alle Bundesliga-Clubs in der zweiten Cup-Runde.	Y	clubs	1907	    296	0.0018	604.1	german_at_news_2012_00147690
24346	Wie viel diese Leistung wert gewesen ist, ist bis dato allerdings nicht bekannt.	Y	dato	1907	    296	0.0018	371.8333	german_at_news_2012_00960135
24347	Gerüchte über eine Tour, die auch nach Wien führen könnte, sind bis dato noch nicht bestätigt.	Y	dato	1907	    296	0.0018	397.875	german_at_news_2012_00513212
24348	Der Preis wurde 2009 zum ersten und bis dato einzigen Mal vergeben.	Y	dato	1907	    296	0.0018	532.6364	german_at_news_2012_00255920
24349	Eine konkrete Spur zu dem Täter gibt es bis dato nicht.	Y	dato	1907	    296	0.0018	553.5455	german_at_news_2012_00408887
24350	Bis dato hat er mit seiner Musik keinen Cent verdient.	Y	dato	1907	    296	0.0018	568.8	german_at_news_2012_00117339
24351	Und zwar nicht so wie in den letzten Monaten, sondern „gänzlich.	Y	gänzlich	1907	    296	0.0018	277.1818	german_at_news_2012_00886231
24352	Interessant ist dabei, dass ihre Meinungen noch vor wenigen Monaten eine gänzlich andere war.	Y	gänzlich	1907	    296	0.0018	508.1429	german_at_news_2012_00610812
24353	Selbst eine Niederlage bei den Wahlen im kommenden Jahr scheint nicht mehr gänzlich ausgeschlossen.	Y	gänzlich	1907	    296	0.0018	544.6429	german_at_news_2012_00800246
24354	Er kenne aber auch Untersuchungen, „denen zufolge bis zu 50 Prozent der Kinder den Kontakt zum Vater gänzlich verlieren“.	Y	gänzlich	1907	    296	0.0018	547.8333	german_at_news_2012_00440245
24355	Man schätzt, dass die Mannschaft etwa zwei bis drei Wochen Zeit braucht, um die Strecke gänzlich zu räumen.	Y	gänzlich	1907	    296	0.0018	563	german_at_news_2012_00668499
24356	Wir alle wissen, dass Griechenland noch einen langen und harten Weg vor sich hat und die Probleme Europas durch diese Wahl nicht gelöst sind.	Y	harten	1907	    296	0.0018	380.5652	german_at_news_2012_00962250
24357	“Wir leben in Europa in den vergangenen Jahren in harten Zeiten.	Y	harten	1907	    296	0.0018	386.8889	german_at_news_2012_00968003
24358	Aber die finden auch, dass man in seiner harten Schule echt was lernen könne.	Y	harten	1907	    296	0.0018	451.1429	german_at_news_2012_00004580
24359	Die Welt der Politiker, die nach harten Strafen rufen, ist nicht die ihre.	Y	harten	1907	    296	0.0018	583.6364	german_at_news_2012_00376471
24360	Die harten Kriterien dürften Hochegger und Meischberger nicht ganz erfüllt haben.	Y	harten	1907	    296	0.0018	859.5455	german_at_news_2012_00311341
24361	Schließlich gibt es ja auch noch andere Kompetenzen, die zählen.	Y	kompetenzen	1907	    296	0.0018	405.1	german_at_news_2012_00781844
24362	Sie wissen ganz genau, dass jeder Minister gewisse Kompetenzen hat.	Y	kompetenzen	1907	    296	0.0018	544.2	german_at_news_2012_00817072
24363	Wesentliche politische Kompetenzen sind mit Zustimmung der österreichischen Politik an die EU abgegeben worden.	Y	kompetenzen	1907	    296	0.0018	564.7143	german_at_news_2012_00950056
24364	Österreich werde dafür Kompetenzen abgeben müsse, so Spindelegger im Ö1-Interview.	Y	kompetenzen	1907	    296	0.0018	696.0909	german_at_news_2012_00751482
24365	Man müsse zuerst über Inhalte, dann über Strukturen und Kompetenzen diskutieren, so Dörfler.	Y	kompetenzen	1907	    296	0.0018	821.6667	german_at_news_2012_00667624
24366	Dieser sagte vor Gericht, dass Haider und Kulterer ihn erst Ende März 2007 über ihre Pläne informiert hätten.	Y	kulterer	1907	    296	0.0018	431.7647	german_at_news_2012_00351892
24367	Doch auch das kann sich schnell ändern, wie der Fall Wolfgang Kulterer ja beweist.	Y	kulterer	1907	    296	0.0018	465.0714	german_at_news_2012_00382655
24368	Ich habe dann sofort gefragt, wer ihn bezahlen soll“, sagte Kulterer.	Y	kulterer	1907	    296	0.0018	515.1818	german_at_news_2012_00552573
24369	Heißt: Gegen Kulterer wird vor dem Landesgericht Klagenfurt vor einem neuen Richter neu verhandelt.	Y	kulterer	1907	    296	0.0018	667.6154	german_at_news_2012_00532778
24370	News sollte sich mal näher um den Anwalt von Herrn Kulterer kümmern.	Y	kulterer	1907	    296	0.0018	691.6667	german_at_news_2012_00722302
24371	Wir haben nur ein Motiv, das uns leitet: die beste Lösung für Salzburg zu finden.	Y	motiv	1907	    296	0.0018	400.9333	german_at_news_2012_00966222
24372	Und das Motiv für dieses Verbrechen weiß nur der Täter selbst.	Y	motiv	1907	    296	0.0018	470.7273	german_at_news_2012_00870821
24373	Zum Motiv des Mannes konnte die Polizei vorerst noch nichts sagen.	Y	motiv	1907	    296	0.0018	522.6364	german_at_news_2012_00990277
24374	Das heißt, das Motiv muss irgendwo in einem persönlichen Bereich liegen.	Y	motiv	1907	    296	0.0018	648.9	german_at_news_2012_00174239
24375	Auf Wunsch erscheint das Motiv Strich für Strich auf dem Fernseher.	Y	motiv	1907	    296	0.0018	891.6667	german_at_news_2012_00080886
24376	Musikalisch gesehen kaum etwas, die Szene ist ja eigentlich gar keine und hat daher auch keinen eigenen Namen.	Y	musikalisch	1907	    296	0.0018	367.8333	german_at_news_2012_00700915
24377	Nicht nur musikalisch, sondern vor allem auch zwischen den Szenen.“	Y	musikalisch	1907	    296	0.0018	429.5	german_at_news_2012_00724845
24378	Die 80er sind im Trend wie eh und je - zumindest musikalisch.	Y	musikalisch	1907	    296	0.0018	501.8182	german_at_news_2012_00275750
24379	Mit machen Dingen die er musikalisch tut, bin ich noch gar nicht vertraut.	Y	musikalisch	1907	    296	0.0018	567.5385	german_at_news_2012_00693210
24380	Dem Motto „Hits for Kids“ wurde dabei musikalisch voll Rechnung getragen.	Y	musikalisch	1907	    296	0.0018	1114	german_at_news_2012_00213953
24381	Dies sei heute erneut der Fall und werde auch in Zukunft so sein, schloss Prammer.	Y	prammer	1907	    296	0.0018	321.8	german_at_news_2012_00362124
24382	Es wird sich zeigen“, erklärte Prammer, „was es den Frauen bringt, dass es wieder eine Frau als Frauenministerin gibt.	Y	prammer	1907	    296	0.0018	359.6471	german_at_news_2012_00472072
24383	Die Frage einer Frau als Kanzlerkandidatin stellt sich für Prammer derzeit nicht.	Y	prammer	1907	    296	0.0018	441.25	german_at_news_2012_00303439
24384	Zu ihrem Recht, als Opfer anerkannt zu werden, und zu ihrem Recht auf Würde“, sagte Prammer.	Y	prammer	1907	    296	0.0018	465.75	german_at_news_2012_00987023
24385	Prammer: Abwahl für NR-Präsidenten Geben Sie hier die E-Mail-Adresse des Empfängers ein (z.B. xy@z.com). Mehrere Empfänger werden durch Kommata getrennt.	Y	prammer	1907	    296	0.0018	466.92	german_at_news_2012_00761164
24386	Eine Wohnung ist aber mehr als der Ort, an dem wir schlafen oder essen.	Y	schlafen	1907	    296	0.0018	301.7143	german_at_news_2012_00416176
24387	Anfangs gab der Mann noch an, nur einen Platz zum Schlafen gesucht zu haben.	Y	schlafen	1907	    296	0.0018	438.7143	german_at_news_2012_00050218
24388	Frauen ab 40 schlafen schlecht In jungen Jahren sind Männer eher betroffen.	Y	schlafen	1907	    296	0.0018	516.7273	german_at_news_2012_00487191
24389	Geht nach Hause, legt euch schlafen, kommt in sechs Monaten wieder.'	Y	schlafen	1907	    296	0.0018	594.5455	german_at_news_2012_00507173
24390	All diese Entwicklungen ließen HC keine Nacht mehr ruhig schlafen.	Y	schlafen	1907	    296	0.0018	976.8	german_at_news_2012_00020985
24391	Pools sorgten für Wasserknappheit Geben Sie hier die E-Mail-Adresse des Empfängers ein (z.B. xy@z.com). Mehrere Empfänger werden durch Kommata getrennt.	Y	sorgten	1907	    296	0.0018	465.125	german_at_news_2012_00760348
24392	Und nun sorgten zwei RIM-Mitarbeiter dafür, dass das Unternehmen auch weiterhin in keinem guten Licht steht.	Y	sorgten	1907	    296	0.0018	520.8235	german_at_news_2012_00880137
24393	Bis jetzt sorgten vor allem USA, Russland und Ungarn für diese erfreuliche Entwicklung.	Y	sorgten	1907	    296	0.0018	559.4615	german_at_news_2012_00118954
24394	Die Aussagen in dem Buch, die für Wirbel sorgten, stammten übrigens aus einem Interview, das ich einer lieben Freundin vor drei Jahren gegeben habe.	Y	sorgten	1907	    296	0.0018	562.8696	german_at_news_2012_00281808
24395	Von Beginn weg waren die Österreicherinnen ohne Chance, zu viele Fehler sorgten für die hohe Niederlage.	Y	sorgten	1907	    296	0.0018	570.6	german_at_news_2012_00906436
24396	Windows 8 setzt voll auf Tablets Geben Sie hier die E-Mail-Adresse des Empfängers ein (z.B. xy@z.com). Mehrere Empfänger werden durch Kommata getrennt.	Y	tablets	1907	    296	0.0018	369.48	german_at_news_2012_00961920
24397	Windows 8 soll aber nicht nur auf Tablets laufen, sondern wie bisher auch auf dem PC funktionieren.	Y	tablets	1907	    296	0.0018	495.4667	german_at_news_2012_00961923
24398	Allein am ersten Wochenende wurden über drei Millionen der beliebten Tablets verkauft.	Y	tablets	1907	    296	0.0018	548.8333	german_at_news_2012_00022247
24399	Eine Version für Android-Tablets ist für das erste Quartal 2012 geplant.	Y	tablets	1907	    296	0.0018	603.3	german_at_news_2012_00415364
24400	Das ergab ein AK-Test mit Apps für Smartphones und Tablets.	Y	tablets	1907	    296	0.0018	871.6364	german_at_news_2012_00166335
24401	Die Architektur der weißen Stadt Tel Aviv Geben Sie hier die E-Mail-Adresse des Empfängers ein (z.B. xy@z.com). Mehrere Empfänger werden durch Kommata getrennt.	Y	tel	1907	    296	0.0018	466.3462	german_at_news_2012_00280148
24402	Bei Interesse bitte unter der Tel. 06642251900 melden oder einfach per E-mail.	Y	tel	1907	    296	0.0018	483.9167	german_at_news_2012_00101592
24403	Auskünfte über eine Absage gibt es am Sonntag ab 5.00 Uhr unter Tel. 0676-4341008 oder 0699-10214743.	Y	tel	1907	    296	0.0018	518.4615	german_at_news_2012_00083864
24404	Von Juli bis März 2002 wird zusammen mit dem ORF, eine Euro-Hotline (Tel.: 0800/221 222) eingerichtet.	Y	tel	1907	    296	0.0018	520.7857	german_at_news_2012_00909133
24405	Auch über das Ticket-Service, Tel.: 79 999 79. Außerdem gibt es, allerdings nur für den 14. Dezember, ein sogenanntes VIP-Ticket zum Preis von 94 Euro.	Y	tel	1907	    296	0.0018	525.381	german_at_news_2012_00071922
24406	Das Programm hat einen Umfang von bis zu 200 Mrd. Dollar.	Y	umfang	1907	    296	0.0018	345.2	german_at_news_2012_00189751
24407	Es wird nichts an dem Umfang der Zeit, die wir mit ihnen verbringen, ändern.“	Y	umfang	1907	    296	0.0018	382.8571	german_at_news_2012_00471965
24408	Der große Vorteil ist, dass unser Sohn ein guter Schüler ist, sonst wäre ein Training in diesem Umfang kaum möglich.“	Y	umfang	1907	    296	0.0018	533.8889	german_at_news_2012_00242489
24409	Er fand wohl auch, dass sein hohes Ansehen im Ausland zu Hause nicht im vollen Umfang wahrgenommen wurde.	Y	umfang	1907	    296	0.0018	711.4706	german_at_news_2012_00434326
24410	Offen blieb, in welchem Umfang der IWF sich beteiligen will.	Y	umfang	1907	    296	0.0018	904.5	german_at_news_2012_00742842
24411	So schnell wie das Unwetter da war, so schnell war es auch wieder vorbei.	Y	unwetter	1907	    296	0.0018	326.8182	german_at_news_2012_00830485
24412	Die Unwetter müssen nicht sein, und ich denke an die Betroffenen.	Y	unwetter	1907	    296	0.0018	459.3	german_at_news_2012_00370607
24413	Vor allem im Osten zogen am Mittwoch immer wieder Unwetter durch.	Y	unwetter	1907	    296	0.0018	550.8182	german_at_news_2012_00911566
24414	Laut Feuerwehr gab es bei dem Unwetter zum Glück keine Verletzten.	Y	unwetter	1907	    296	0.0018	584.6364	german_at_news_2012_00652626
24415	Unwetter haben in der Nacht in Kärnten lokale Schäden verursacht.	Y	unwetter	1907	    296	0.0018	898.2222	german_at_news_2012_00892149
24416	In der Folge versuchten die Bullen zurück ins Spiel zu kommen.	Y	versuchten	1907	    296	0.0018	506.9091	german_at_news_2012_00590793
24417	Dabei wurde er auch von zwei Detektiven beobachtet, die ihn bereits in den vergangenen Tagen bei weiteren versuchten Taschendiebstählen gesehen hatten.	Y	versuchten	1907	    296	0.0018	520.7619	german_at_news_2012_00135278
24418	Die Seewiser versuchten, sie für den neuen Glauben zu gewinnen und als dies nicht gelang, drohten sie in einer Weise, besonders dem Mädchen, dass sie für ihr Leben fürchteten.”	Y	versuchten	1907	    296	0.0018	534.8846	german_at_news_2012_00346172
24419	Sie versuchten es an Ort und Stelle und auf dem Weg in die Innsbrucker Klinik zu reanimieren.	Y	versuchten	1907	    296	0.0018	544.4375	german_at_news_2012_00815530
24420	Dem Kärntner Landesschulrat sei keine Schule bekannt, an der die Lehrer oder die Direktion versuchten, den Tag für die Schülerinnen und Schüler frei zu geben.	Y	versuchten	1907	    296	0.0018	565.3913	german_at_news_2012_00213798
24421	Wenn wir nach Wien fahren und nur verteidigen, wird das nicht gut gehen.	Y	verteidigen	1907	    296	0.0018	271.1538	german_at_news_2012_00944691
24422	Die USA und Israel wollen etwas und zwar Öl, Geld und Macht - und es ist nicht falsch, sich verteidigen zu wollen.	Y	verteidigen	1907	    296	0.0018	435.8235	german_at_news_2012_00371000
24423	Vor allem zwei Gründe dürften ins Treffen geführt werden, um das österreichische System zu verteidigen.	Y	verteidigen	1907	    296	0.0018	497.8667	german_at_news_2012_00912194
24424	Da muss man den Bundespräsidenten gegen seine ehemalige eigene Partei verteidigen.	Y	verteidigen	1907	    296	0.0018	556.5455	german_at_news_2012_00149181
24425	Obama muss seinen Vorsprung in den Umfragen hier um jeden Preis verteidigen.	Y	verteidigen	1907	    296	0.0018	655.9167	german_at_news_2012_00736957
24426	Als sie 14 ist, zeigt ihr der älteste Bruder Wolfgang, dass man auch am Computer Musik machen kann.	Y	älteste	1908	    295	0.0018	338.8824	german_at_news_2012_00035436
24427	Sie ist das älteste von fünf Kindern und wurde wie ihre Geschwister in Wien geboren.	Y	älteste	1908	    295	0.0018	401.6	german_at_news_2012_00808772
24428	Musik ist unsere älteste Sprache, es gilt sie zu leben!	Y	älteste	1908	    295	0.0018	428.5	german_at_news_2012_00701086
24429	Das älteste Kind war gerade einmal zehn, das jüngste erst zwei Jahre.	Y	älteste	1908	    295	0.0018	469.2727	german_at_news_2012_00159562
24430	Vietoris ist ja fast 111 Jahre alt geworden und war damals der älteste Österreicher.	Y	älteste	1908	    295	0.0018	509.1538	german_at_news_2012_00903435
24431	“Damals hieß es, nach zehn Jahren Aufenthalt in Österreich sei das kein Problem.”	Y	aufenthalt	1908	    295	0.0018	335.6154	german_at_news_2012_00143807
24432	Beide Länder haben auch neben dem Fußball so viel zu bieten, dass der Aufenthalt zu einem Urlaub zum wohl fühlen wird.	Y	aufenthalt	1908	    295	0.0018	383.8	german_at_news_2012_00094625
24433	Trotz der vielen Highlights wird mit solchen Fotos deutlich, dass sich hin und wieder auch ein kurzer Aufenthalt im Freien bezahlt machen kann.	Y	aufenthalt	1908	    295	0.0018	499.1739	german_at_news_2012_00856852
24434	Bei ihrem jüngsten Wien-Aufenthalt vergangene Woche wurde sie entsprechend von den Leuten erkannt.	Y	aufenthalt	1908	    295	0.0018	693.2143	german_at_news_2012_00101458
24435	Patrick dürfte der Aufenthalt gefallen haben (siehe Twitter-Nachricht - Bild 2).	Y	aufenthalt	1908	    295	0.0018	1013.7	german_at_news_2012_00754453
24436	Carl Philip darf endlich Freundin mitbringen Geben Sie hier die E-Mail-Adresse des Empfängers ein (z.B. xy@z.com). Mehrere Empfänger werden durch Kommata getrennt.	Y	carl	1908	    295	0.0018	503.9231	german_at_news_2012_00127743
