ORDER	SENTENCE	STATUS	WORD	RANK	COUNT	COUNT_REL	INDEX	ID
1	Die hat er jetzt auch in Österreich.	Y	die	1	543,438	3.3769	33.8571	german_at_news_2012_00311372
2	War es auch nicht, für die anderen.	Y	die	1	543,438	3.3769	38	german_at_news_2012_00921071
3	Aber die neue Frau will das nicht.	Y	die	1	543,438	3.3769	66.1429	german_at_news_2012_00004779
4	Sie haben keine Zeit für die Kinder.	Y	die	1	543,438	3.3769	69	german_at_news_2012_00807107
5	Und vor allem: Ohne seine Frau und die drei Kinder.	Y	die	1	543,438	3.3769	100.3333	german_at_news_2012_00882960
6	Aus dem Euro oder aus der EU?	Y	der	2	503,709	3.13	46.8333	german_at_news_2012_00081502
7	Nicht mit mir und nicht mit der ÖVP.“	Y	der	2	503,709	3.13	53.5	german_at_news_2012_00724212
8	Der würde das aber auch in Wien mit der SPÖ können.	Y	der	2	503,709	3.13	54.1	german_at_news_2012_00268439
9	Das ist auch in der Politik so.	Y	der	2	503,709	3.13	54.4286	german_at_news_2012_00176598
10	Das ist bei uns in Österreich noch nicht der Fall.	Y	der	2	503,709	3.13	56.6	german_at_news_2012_00176716
11	Und das wird dann auch so sein.	Y	und	3	377,730	2.3472	30.7143	german_at_news_2012_00871586
12	Das kann und wird es nicht mehr geben.	Y	und	3	377,730	2.3472	40.375	german_at_news_2012_00181437
13	Und den hatte ich den ersten zwei Jahren auch.	Y	und	3	377,730	2.3472	55.75	german_at_news_2012_00871883
14	Und was andere Menschen können, kann er auch.	Y	und	3	377,730	2.3472	67.875	german_at_news_2012_00883228
15	Und also leben sie hier bis heute.	Y	und	3	377,730	2.3472	89.1429	german_at_news_2012_00867180
16	Nur in Wien gibt es die noch nicht.	Y	in	4	290,330	1.8041	34.25	german_at_news_2012_00734860
17	Und es wird sie auch in 20 Jahren noch geben.	Y	in	4	290,330	1.8041	39.5556	german_at_news_2012_00875866
18	So etwas gibt es nur noch in Österreich.	Y	in	4	290,330	1.8041	53.75	german_at_news_2012_00821945
19	Wir sind doch noch in Österreich oder etwa nicht?	Y	in	4	290,330	1.8041	56.1111	german_at_news_2012_00969727
20	Die beiden haben zwei Kinder und leben in Wien.	Y	in	4	290,330	1.8041	83.2222	german_at_news_2012_00285016
21	Und das geht sich nicht aus, oder?	Y	das	5	196,265	1.2196	32.5714	german_at_news_2012_00870261
22	Und das wird nicht das Ende sein.	Y	das	5	196,265	1.2196	47	german_at_news_2012_00871600
23	Das sind um zwei Millionen mehr als unter dem Jahr.	Y	das	5	196,265	1.2196	54.8	german_at_news_2012_00196289
24	Aber das war ja nicht gut für ihn.	Y	das	5	196,265	1.2196	69.375	german_at_news_2012_00004002
25	Auch so geht das Leben also weiter.	Y	das	5	196,265	1.2196	95	german_at_news_2012_00071486
26	Wir haben den Euro und werden den Euro auch weiter haben.	Y	den	6	174,864	1.0866	46.25	german_at_news_2012_00965076
27	Und den hatte ich den ersten zwei Jahren auch.	Y	den	6	174,864	1.0866	55.75	german_at_news_2012_00871883
28	Das war auch in den vergangenen zwei Jahren so.	Y	den	6	174,864	1.0866	61.1111	german_at_news_2012_00203108
29	Gibt es das in den USA nicht?	Y	den	6	174,864	1.0866	63.1429	german_at_news_2012_00515550
30	So ist es auch mit den Eltern.	Y	den	6	174,864	1.0866	79.5714	german_at_news_2012_00824413
31	So geht man mit Menschen nicht um.	Y	mit	7	161,485	1.0035	50.5714	german_at_news_2012_00823048
32	Aber was ist mit SPÖ und ÖVP?	Y	mit	7	161,485	1.0035	57.2857	german_at_news_2012_00011065
33	Aber was soll ich mit diesen Millionen?	Y	mit	7	161,485	1.0035	76.1429	german_at_news_2012_00011118
34	Das macht man mit uns nur einmal.	Y	mit	7	161,485	1.0035	81	german_at_news_2012_00184935
35	Jetzt, mit 31 Jahren, kann alles andere kommen.	Y	mit	7	161,485	1.0035	107	german_at_news_2012_00624964
36	Es kommt und geht von einem zum anderen.	Y	von	8	148,325	0.9217	68.625	german_at_news_2012_00464675
37	Von mir aus kann das schon 2010 der Fall sein.	Y	von	8	148,325	0.9217	72.8889	german_at_news_2012_00909406
38	Da hat er dann von mir lassen.	Y	von	8	148,325	0.9217	77	german_at_news_2012_00140276
39	Da kann ich doch nicht einer von denen sein!	Y	von	8	148,325	0.9217	78.4444	german_at_news_2012_00142915
40	Er war auch immer ein Teil von dem, was ich gemacht habe.	Y	von	8	148,325	0.9217	78.5833	german_at_news_2012_00449594
41	Das eine ist ohne das andere nicht zu haben!	Y	zu	9	148,096	0.9203	54.125	german_at_news_2012_00165405
42	Aber das jetzt, das war selbst ihr zu viel.	Y	zu	9	148,096	0.9203	65.875	german_at_news_2012_00003671
43	Es geht uns noch immer viel zu gut.	Y	zu	9	148,096	0.9203	76.375	german_at_news_2012_00456094
44	Dieses Mal: „Wie viel ist zu viel?	Y	zu	9	148,096	0.9203	81.6667	german_at_news_2012_00354327
45	Was macht eine Frau zu einer Frau?	Y	zu	9	148,096	0.9203	88.5	german_at_news_2012_00926842
46	Ist es nicht, kann es nicht sein.	Y	ist	10	144,867	0.9002	32	german_at_news_2012_00616345
47	Aber seit 14 Jahren ist das nicht mehr so.	Y	ist	10	144,867	0.9002	40.25	german_at_news_2012_00009895
48	Nichts ist mehr so, wie es war.	Y	ist	10	144,867	0.9002	51.4286	german_at_news_2012_00725326
49	Nichts ist mehr so, wie es einmal war.	Y	ist	10	144,867	0.9002	63.875	german_at_news_2012_00725325
50	Weil es ist ja doch sehr, sehr (.	Y	ist	10	144,867	0.9002	79.8333	german_at_news_2012_00931097
51	Das wird die Zukunft sein, wenn es im Land so weiter geht.“	Y	im	11	142,670	0.8865	77.75	german_at_news_2012_00205538
52	Das kann man nur einmal im Leben machen.“	Y	im	11	142,670	0.8865	78.125	german_at_news_2012_00181308
53	So machen wird das auch im Österreich-Haus.	Y	im	11	142,670	0.8865	88.25	german_at_news_2012_00827928
54	Das war im Mai vor drei Jahren.	Y	im	11	142,670	0.8865	89.8571	german_at_news_2012_00204075
55	Es wird ihm dabei nicht mehr viel im Weg stehen.	Y	im	11	142,670	0.8865	95.5	german_at_news_2012_00471788
56	War es auch nicht, für die anderen.	Y	für	12	134,430	0.8353	38	german_at_news_2012_00921071
57	Ich werde immer für sie da sein.	Y	für	12	134,430	0.8353	62.5714	german_at_news_2012_00561319
58	Wie war das für Sie und Ihre Familie?	Y	für	12	134,430	0.8353	63.625	german_at_news_2012_00960563
59	Was ist das nur für ein Land, in dem so etwas möglich ist?	Y	für	12	134,430	0.8353	67.75	german_at_news_2012_00926184
60	Sie haben keine Zeit für die Kinder.	Y	für	12	134,430	0.8353	69	german_at_news_2012_00807107
61	Wir haben nur ein Leben und das ist hier und jetzt!	Y	ein	13	122,103	0.7587	52.7	german_at_news_2012_00966221
62	“Das ist ein Thema, aber nicht jetzt.	Y	ein	13	122,103	0.7587	65.1429	german_at_news_2012_00178385
63	Ist das in Wien bereits ein Thema?	Y	ein	13	122,103	0.7587	67.2857	german_at_news_2012_00615604
64	Was ist das nur für ein Land, in dem so etwas möglich ist?	Y	ein	13	122,103	0.7587	67.75	german_at_news_2012_00926184
65	Und wir sind jetzt ein Jahr dort.	Y	ein	13	122,103	0.7587	67.8571	german_at_news_2012_00885609
66	Und das geht sich nicht aus, oder?	Y	sich	14	118,745	0.7379	32.5714	german_at_news_2012_00870261
67	Es geht sich alles nicht mehr aus.	Y	sich	14	118,745	0.7379	55.1429	german_at_news_2012_00455797
68	Er sagt sich „Es geht nichts mehr in Österreich“.	Y	sich	14	118,745	0.7379	73.8889	german_at_news_2012_00443033
69	Wie er sich und die Welt sieht.	Y	sich	14	118,745	0.7379	77.8571	german_at_news_2012_00954406
70	Nehmen Sie sich nur nicht zu viel vor.	Y	sich	14	118,745	0.7379	78	german_at_news_2012_00717623
71	Auf eine mehr oder weniger kommt es nicht an.“	Y	auf	15	117,092	0.7276	67.8889	german_at_news_2012_00077531
72	Ist es auch, auf der einen Seite.	Y	auf	15	117,092	0.7276	68	german_at_news_2012_00616219
73	… Wie viel Geld gibt es auf der Welt?	Y	auf	15	117,092	0.7276	85.25	german_at_news_2012_00960368
74	Wie ist das bei Ihnen auf dem Weg zur Arbeit?	Y	auf	15	117,092	0.7276	91.1	german_at_news_2012_00955739
75	Nur nicht gleich wieder zu viel auf einmal.	Y	auf	15	117,092	0.7276	91.75	german_at_news_2012_00735266
76	Das geben Sie aus, und mehr ist nicht.	Y	nicht	16	116,445	0.7236	34.25	german_at_news_2012_00169580
77	Aber das ist noch nicht das Ende, oder?	Y	nicht	16	116,445	0.7236	47.8571	german_at_news_2012_00003623
78	Dafür ist die Zeit noch nicht da.	Y	nicht	16	116,445	0.7236	62.7143	german_at_news_2012_00138469
79	Aber so was würde ich heute nicht mehr machen.	Y	nicht	16	116,445	0.7236	75.8889	german_at_news_2012_00010382
80	Das war für ihn nicht das erste Mal.	Y	nicht	16	116,445	0.7236	91.1429	german_at_news_2012_00204006
81	Aus dem Es wird man zum Ich.	Y	es	17	112,463	0.6988	32.5714	german_at_news_2012_00081500
82	Es ist auch das, was ich machen will.	Y	es	17	112,463	0.6988	50.625	german_at_news_2012_00460216
83	Aber einmal so und einmal so,dass sollte es nicht geben.	Y	es	17	112,463	0.6988	66.6667	german_at_news_2012_00005485
84	Es ist ja nichts mehr so, wie es einmal war.	Y	es	17	112,463	0.6988	71.4444	german_at_news_2012_00462350
85	Ihr geht es alles andere als gut.	Y	es	17	112,463	0.6988	100.1429	german_at_news_2012_00565694
86	Und das wird dann auch so sein.	Y	auch	18	111,088	0.6903	30.7143	german_at_news_2012_00871586
87	Die hat er jetzt auch in Österreich.	Y	auch	18	111,088	0.6903	33.8571	german_at_news_2012_00311372
88	War es auch nicht, für die anderen.	Y	auch	18	111,088	0.6903	38	german_at_news_2012_00921071
89	Und es wird sie auch in 20 Jahren noch geben.	Y	auch	18	111,088	0.6903	39.5556	german_at_news_2012_00875866
90	Aber auch das ist noch nicht alles.	Y	auch	18	111,088	0.6903	40.1429	german_at_news_2012_00001931
91	Das eine ist ohne das andere nicht zu haben!	Y	eine	19	101,642	0.6316	54.125	german_at_news_2012_00165405
92	Und dann war ich auch noch eine Frau.	Y	eine	19	101,642	0.6316	54.375	german_at_news_2012_00869791
93	Es ist eine Frage der Zeit bis das zu viel wird.	Y	eine	19	101,642	0.6316	58.1818	german_at_news_2012_00461209
94	Doch das ist nur der eine Teil.	Y	eine	19	101,642	0.6316	64.5714	german_at_news_2012_00383619
95	Das ist nur eine Frage der Zeit.	Y	eine	19	101,642	0.6316	65.5714	german_at_news_2012_00179765
96	Das geben Sie aus, und mehr ist nicht.	Y	sie	20	 96,164	0.5976	34.25	german_at_news_2012_00169580
97	Und es wird sie auch in 20 Jahren noch geben.	Y	sie	20	 96,164	0.5976	39.5556	german_at_news_2012_00875866
98	Wie sie leben und wie sie sind.	Y	sie	20	 96,164	0.5976	51.4	german_at_news_2012_00959277
99	Sie ist das, was ich nicht bin.	Y	sie	20	 96,164	0.5976	51.5714	german_at_news_2012_00808784
100	Ich werde immer für sie da sein.	Y	sie	20	 96,164	0.5976	62.5714	german_at_news_2012_00561319
101	Ist das nicht zu viel des Guten?	Y	des	21	 95,231	0.5918	107.8571	german_at_news_2012_00615698
102	Heute könnte es des Guten zu viel werden.	Y	des	21	 95,231	0.5918	133.5	german_at_news_2012_00536119
103	Die Bilder des Jahres 2005: Was für ein Jahr!	Y	des	21	 95,231	0.5918	138.875	german_at_news_2012_00288139
104	Im Juli des vergangenen Jahres waren es noch 52 Prozent.	Y	des	21	 95,231	0.5918	141.8889	german_at_news_2012_00574106
105	Des war nicht seine Idee das zu machen.	Y	des	21	 95,231	0.5918	144.25	german_at_news_2012_00272747
106	Aus dem Es wird man zum Ich.	Y	dem	22	 88,925	0.5526	32.5714	german_at_news_2012_00081500
107	Aus dem Euro oder aus der EU?	Y	dem	22	 88,925	0.5526	46.8333	german_at_news_2012_00081502
108	Das sind um zwei Millionen mehr als unter dem Jahr.	Y	dem	22	 88,925	0.5526	54.8	german_at_news_2012_00196289
109	Aus dem, was rund um mich ist.	Y	dem	22	 88,925	0.5526	61.1429	german_at_news_2012_00081696
110	Was ist das nur für ein Land, in dem so etwas möglich ist?	Y	dem	22	 88,925	0.5526	67.75	german_at_news_2012_00926184
111	Das sind um zwei Millionen mehr als unter dem Jahr.	Y	als	23	 82,110	0.5102	54.8	german_at_news_2012_00196289
112	Das macht er seit mehr als zwei Jahren.	Y	als	23	 82,110	0.5102	69	german_at_news_2012_00184892
113	Viel mehr als der 1. Mai ist da nicht mehr.	Y	als	23	 82,110	0.5102	79.125	german_at_news_2012_00902139
114	Gibt es einen, der noch besser wäre, als ich?	Y	als	23	 82,110	0.5102	80	german_at_news_2012_00515609
115	Es sollte ein Film werden, der mehr ist als ich.	Y	als	23	 82,110	0.5102	84.2	german_at_news_2012_00468575
116	Aber das ist wohl auch an der Zeit.	Y	an	24	 71,016	0.4413	62	german_at_news_2012_00003665
117	Auf eine mehr oder weniger kommt es nicht an.“	Y	an	24	 71,016	0.4413	67.8889	german_at_news_2012_00077531
118	Es war an der Zeit für die Frauen etwas zu machen.	Y	an	24	 71,016	0.4413	70.0909	german_at_news_2012_00469329
119	Doch das sieht man ihr nicht an.	Y	an	24	 71,016	0.4413	80.8571	german_at_news_2012_00383742
120	Das Geld ist zwar da, aber es kommt nicht an.	Y	an	24	 71,016	0.4413	81.3	german_at_news_2012_00170338
121	Das ist ja bei uns nicht so.	Y	bei	25	 68,995	0.4287	48.8571	german_at_news_2012_00179024
122	Das ist bei uns in Österreich noch nicht der Fall.	Y	bei	25	 68,995	0.4287	56.6	german_at_news_2012_00176716
123	Es gibt auch bei der anderen nichts.	Y	bei	25	 68,995	0.4287	65.2857	german_at_news_2012_00456475
124	Das ist aber bei uns allen so.	Y	bei	25	 68,995	0.4287	65.8571	german_at_news_2012_00176277
125	So ist das bei mir mit der Politik.	Y	bei	25	 68,995	0.4287	67.875	german_at_news_2012_00824274
126	Wir haben den Euro und werden den Euro auch weiter haben.	Y	werden	26	 68,742	0.4272	46.25	german_at_news_2012_00965076
127	In diesem Jahr werden es viel mehr sein.	Y	werden	26	 68,742	0.4272	60.375	german_at_news_2012_00595590
128	Das werden aber nicht alle gewesen sein.“	Y	werden	26	 68,742	0.4272	68.7143	german_at_news_2012_00204879
129	Vor dem, was ist, was noch kommt, was aus ihnen werden soll.	Y	werden	26	 68,742	0.4272	70.7	german_at_news_2012_00913140
130	Wie viele es sein werden, kann ich nicht sagen.	Y	werden	26	 68,742	0.4272	77.6667	german_at_news_2012_00960207
131	Er kann es, und er wird es können.	Y	er	27	 67,886	0.4218	35.6667	german_at_news_2012_00440131
132	Dieses „Was hat er, was ich nicht habe?“	Y	er	27	 67,886	0.4218	55	german_at_news_2012_00355611
133	Jetzt würde er es nicht mehr so machen.	Y	er	27	 67,886	0.4218	71.375	german_at_news_2012_00626304
134	Er kann machen, was er will, er hat seine Millionen.	Y	er	27	 67,886	0.4218	80.25	german_at_news_2012_00440147
135	Was muss er können, was muss er machen?	Y	er	27	 67,886	0.4218	83.4	german_at_news_2012_00927163
136	Aber er weiß, dass er das nicht können wird.	Y	dass	28	 67,611	0.4201	65.25	german_at_news_2012_00005754
137	Aber einmal so und einmal so,dass sollte es nicht geben.	Y	dass	28	 67,611	0.4201	66.6667	german_at_news_2012_00005485
138	Ja, es muss so gewesen sein, dass er dabei war.	Y	dass	28	 67,611	0.4201	79.8	german_at_news_2012_00617592
139	Ich weiß nur, dass man ein Leben hat.	Y	dass	28	 67,611	0.4201	82.25	german_at_news_2012_00561091
140	Heute wissen wir, dass sie nicht einmal das immer sind.	Y	dass	28	 67,611	0.4201	83	german_at_news_2012_00536972
141	Dann ist das nur mehr eine Frage der Zeit, bis wir am Ziel sind.	Y	am	29	 62,824	0.3904	75.9286	german_at_news_2012_00152808
142	Es ist nur mehr eine Frage der Zeit, bis wir am Ziel sind.	Y	am	29	 62,824	0.3904	77.4615	german_at_news_2012_00463120
143	Und wie macht man es am besten?	Y	am	29	 62,824	0.3904	84.1429	german_at_news_2012_00885241
144	Das ist auch für die Liebe am besten.	Y	am	29	 62,824	0.3904	93.125	german_at_news_2012_00176567
145	Sie will jetzt zwei Stunden am Tag Zeit für sich haben.	Y	am	29	 62,824	0.3904	101.8182	german_at_news_2012_00816737
146	Die hat er jetzt auch in Österreich.	Y	hat	30	 60,978	0.3789	33.8571	german_at_news_2012_00311372
147	Dieses „Was hat er, was ich nicht habe?“	Y	hat	30	 60,978	0.3789	55	german_at_news_2012_00355611
148	Aber es hat nicht sein sollen, und es war besser so.	Y	hat	30	 60,978	0.3789	72.5	german_at_news_2012_00006012
149	Nur hat das eine nichts mit dem anderen zu tun.	Y	hat	30	 60,978	0.3789	76.2	german_at_news_2012_00734644
150	Da hat er dann von mir lassen.	Y	hat	30	 60,978	0.3789	77	german_at_news_2012_00140276
151	Aus dem Es wird man zum Ich.	Y	aus	31	 60,502	0.376	32.5714	german_at_news_2012_00081500
152	Das geben Sie aus, und mehr ist nicht.	Y	aus	31	 60,502	0.376	34.25	german_at_news_2012_00169580
153	Aus dem Euro oder aus der EU?	Y	aus	31	 60,502	0.376	46.8333	german_at_news_2012_00081502
154	Es geht sich alles nicht mehr aus.	Y	aus	31	 60,502	0.376	55.1429	german_at_news_2012_00455797
155	Aus dem, was rund um mich ist.	Y	aus	31	 60,502	0.376	61.1429	german_at_news_2012_00081696
156	Und das wird dann auch so sein.	Y	wird	32	 59,358	0.3688	30.7143	german_at_news_2012_00871586
157	Aus dem Es wird man zum Ich.	Y	wird	32	 59,358	0.3688	32.5714	german_at_news_2012_00081500
158	Er kann es, und er wird es können.	Y	wird	32	 59,358	0.3688	35.6667	german_at_news_2012_00440131
159	Es war immer so, und es wird immer so sein.	Y	wird	32	 59,358	0.3688	38.1429	german_at_news_2012_00470597
160	Und es wird sie auch in 20 Jahren noch geben.	Y	wird	32	 59,358	0.3688	39.5556	german_at_news_2012_00875866
161	So soll es sein, so wird es sein.	Y	so	33	 57,625	0.3581	43.6	german_at_news_2012_00831368
162	In Österreich gibt es so etwas nicht.“	Y	so	33	 57,625	0.3581	50.8571	german_at_news_2012_00604894
163	Das geht und sollte auch so sein.	Y	so	33	 57,625	0.3581	56.7143	german_at_news_2012_00170208
164	Wie geht man mit so etwas um?	Y	so	33	 57,625	0.3581	57.8571	german_at_news_2012_00954891
165	“So war’s, und so kommt es nicht wieder.”	Y	so	33	 57,625	0.3581	67	german_at_news_2012_00832658
166	Wie sie leben und wie sie sind.	Y	wie	34	 57,049	0.3545	51.4	german_at_news_2012_00959277
167	Nichts ist mehr so, wie es war.	Y	wie	34	 57,049	0.3545	51.4286	german_at_news_2012_00725326
168	Wie geht man mit so etwas um?	Y	wie	34	 57,049	0.3545	57.8571	german_at_news_2012_00954891
169	Wie das mit 55 ist, weiß ich nicht.	Y	wie	34	 57,049	0.3545	58.4286	german_at_news_2012_00952664
170	Wie war das für Sie und Ihre Familie?	Y	wie	34	 57,049	0.3545	63.625	german_at_news_2012_00960563
171	Und nach fünf Jahren sind es immer noch 73 Prozent.	Y	nach	35	 55,938	0.3476	64.6667	german_at_news_2012_00879465
172	Also gehen wir dem auch nicht nach.“	Y	nach	35	 55,938	0.3476	80	german_at_news_2012_00033710
173	Von wo es aber schon heute wieder zurück nach Österreich geht.	Y	nach	35	 55,938	0.3476	83.0909	german_at_news_2012_00910271
174	Nach dem zweiten Jahr sind es bereits 70 Prozent.	Y	nach	35	 55,938	0.3476	88.5	german_at_news_2012_00705541
175	Bei mir war das aber schon nach vier Wochen.	Y	nach	35	 55,938	0.3476	98.1111	german_at_news_2012_00103379
176	Mehr kann ich nicht, aber das kann ich.	Y	ich	36	 55,604	0.3455	34.6667	german_at_news_2012_00675073
177	Mehr kann und will ich nicht machen.	Y	ich	36	 55,604	0.3455	60	german_at_news_2012_00675087
178	Diese Zeit habe ich heute nicht mehr.	Y	ich	36	 55,604	0.3455	67.1429	german_at_news_2012_00357289
179	Heute würde ich das nicht mehr machen.	Y	ich	36	 55,604	0.3455	78.5714	german_at_news_2012_00536989
180	Ich kann ja machen, was ich will.	Y	ich	36	 55,604	0.3455	91.3333	german_at_news_2012_00556291
181	Wie sie leben und wie sie sind.	Y	sind	37	 54,882	0.341	51.4	german_at_news_2012_00959277
182	Das sind um zwei Millionen mehr als unter dem Jahr.	Y	sind	37	 54,882	0.341	54.8	german_at_news_2012_00196289
183	Wir sind doch noch in Österreich oder etwa nicht?	Y	sind	37	 54,882	0.341	56.1111	german_at_news_2012_00969727
184	Heute sind es nur noch rund 50 Prozent.	Y	sind	37	 54,882	0.341	62.7143	german_at_news_2012_00536523
185	Und nach fünf Jahren sind es immer noch 73 Prozent.	Y	sind	37	 54,882	0.341	64.6667	german_at_news_2012_00879465
186	So geht man mit Menschen nicht um.	Y	um	38	 54,095	0.3361	50.5714	german_at_news_2012_00823048
187	Das sind um zwei Millionen mehr als unter dem Jahr.	Y	um	38	 54,095	0.3361	54.8	german_at_news_2012_00196289
188	Wie geht man mit so etwas um?	Y	um	38	 54,095	0.3361	57.8571	german_at_news_2012_00954891
189	Aus dem, was rund um mich ist.	Y	um	38	 54,095	0.3361	61.1429	german_at_news_2012_00081696
190	Und nicht nur, wenn es um die USA geht.	Y	um	38	 54,095	0.3361	67.3333	german_at_news_2012_00879786
191	Mehr kann ich nicht, aber das kann ich.	Y	aber	39	 51,497	0.32	34.6667	german_at_news_2012_00675073
192	Das kann und soll aber nicht sein.	Y	aber	39	 51,497	0.32	37.1429	german_at_news_2012_00181436
193	Aber auch das ist noch nicht alles.	Y	aber	39	 51,497	0.32	40.1429	german_at_news_2012_00001931
194	Aber seit 14 Jahren ist das nicht mehr so.	Y	aber	39	 51,497	0.32	40.25	german_at_news_2012_00009895
195	Aber das ist noch nicht das Ende, oder?	Y	aber	39	 51,497	0.32	47.8571	german_at_news_2012_00003623
196	Aus dem Es wird man zum Ich.	Y	man	40	 47,088	0.2926	32.5714	german_at_news_2012_00081500
197	So geht man mit Menschen nicht um.	Y	man	40	 47,088	0.2926	50.5714	german_at_news_2012_00823048
198	Wie geht man mit so etwas um?	Y	man	40	 47,088	0.2926	57.8571	german_at_news_2012_00954891
199	Das kann man nur einmal im Leben machen.“	Y	man	40	 47,088	0.2926	78.125	german_at_news_2012_00181308
200	Aber was soll man machen, wenn man nichts hat.	Y	man	40	 47,088	0.2926	78.375	german_at_news_2012_00011124
201	Vor dem, was ist, was noch kommt, was aus ihnen werden soll.	Y	vor	41	 46,191	0.287	70.7	german_at_news_2012_00913140
202	Die haben das schon vor 30 Jahren gemacht.	Y	vor	41	 46,191	0.287	75.4286	german_at_news_2012_00310747
203	Nehmen Sie sich nur nicht zu viel vor.	Y	vor	41	 46,191	0.287	78	german_at_news_2012_00717623
204	Das ist das, was vor uns liegt.	Y	vor	41	 46,191	0.287	81.8333	german_at_news_2012_00176956
205	Man wollte das wieder so machen wie schon vor 1000 Jahren.	Y	vor	41	 46,191	0.287	83.5	german_at_news_2012_00670015
206	Einer für alle oder allen für einen.	Y	einer	42	 46,061	0.2862	77.6667	german_at_news_2012_00412501
207	Da kann ich doch nicht einer von denen sein!	Y	einer	42	 46,061	0.2862	78.4444	german_at_news_2012_00142915
208	In drei bis vier Jahren ist er nur noch einer von vielen.	Y	einer	42	 46,061	0.2862	80.0833	german_at_news_2012_00597036
209	Was macht eine Frau zu einer Frau?	Y	einer	42	 46,061	0.2862	88.5	german_at_news_2012_00926842
210	Er ist einer, der zu Österreich hält.	Y	einer	42	 46,061	0.2862	92	german_at_news_2012_00439185
211	Nur in Wien gibt es die noch nicht.	Y	noch	43	 45,852	0.2849	34.25	german_at_news_2012_00734860
212	Und es wird sie auch in 20 Jahren noch geben.	Y	noch	43	 45,852	0.2849	39.5556	german_at_news_2012_00875866
213	Aber auch das ist noch nicht alles.	Y	noch	43	 45,852	0.2849	40.1429	german_at_news_2012_00001931
214	Und was nicht war, kann immer noch sein.	Y	noch	43	 45,852	0.2849	46.375	german_at_news_2012_00883504
215	Aber das ist noch nicht das Ende, oder?	Y	noch	43	 45,852	0.2849	47.8571	german_at_news_2012_00003623
216	In Wien gibt es noch genau einen, der das kann.	Y	einen	44	 45,028	0.2798	64.5	german_at_news_2012_00613023
217	Ist es auch, auf der einen Seite.	Y	einen	44	 45,028	0.2798	68	german_at_news_2012_00616219
218	Oder hatten wir nicht schon so einen?	Y	einen	44	 45,028	0.2798	77.4286	german_at_news_2012_00741490
219	Einer für alle oder allen für einen.	Y	einen	44	 45,028	0.2798	77.6667	german_at_news_2012_00412501
220	Gibt es einen, der noch besser wäre, als ich?	Y	einen	44	 45,028	0.2798	80	german_at_news_2012_00515609
221	Über ÖVP und SPÖ: Die einen sind mal weg.	Y	über	45	 43,752	0.2719	90.2222	german_at_news_2012_00861255
222	Nichts bleibt hier von dem über, was sie dort war.	Y	über	45	 43,752	0.2719	94.8	german_at_news_2012_00725126
223	Sie will mehr wissen über den Mann.	Y	über	45	 43,752	0.2719	111.4286	german_at_news_2012_00816743
224	Selbst der über zwei Jahre alte erste Teil ist noch nicht unter 40 Euro zu haben.	Y	über	45	 43,752	0.2719	116.8	german_at_news_2012_00800085
225	Die beiden sind seit über einem Jahr zusammen.	Y	über	45	 43,752	0.2719	118.875	german_at_news_2012_00285444
226	Es kommt und geht von einem zum anderen.	Y	einem	46	 42,525	0.2642	68.625	german_at_news_2012_00464675
227	Können Sie doch mit einem der zwei besser?	Y	einem	46	 42,525	0.2642	79	german_at_news_2012_00641726
228	Österreich wird sich aber nicht zu einem Fall machen lassen.	Y	einem	46	 42,525	0.2642	81.4	german_at_news_2012_00751660
229	Österreich werde sich aber nicht zu einem Fall machen lassen.	Y	einem	46	 42,525	0.2642	93.6	german_at_news_2012_00751515
230	Was macht man in so einem Fall?	Y	einem	46	 42,525	0.2642	94.4286	german_at_news_2012_00926867
231	Nur in Wien gibt es die noch nicht.	Y	nur	47	 42,491	0.264	34.25	german_at_news_2012_00734860
232	Es gibt nur uns, und wir haben nur uns.	Y	nur	47	 42,491	0.264	52.1429	german_at_news_2012_00457878
233	Wir haben nur ein Leben und das ist hier und jetzt!	Y	nur	47	 42,491	0.264	52.7	german_at_news_2012_00966221
234	So etwas gibt es nur noch in Österreich.	Y	nur	47	 42,491	0.264	53.75	german_at_news_2012_00821945
235	Heute sind es nur noch rund 50 Prozent.	Y	nur	47	 42,491	0.264	62.7143	german_at_news_2012_00536523
236	Wir haben den Euro und werden den Euro auch weiter haben.	Y	haben	48	 41,882	0.2603	46.25	german_at_news_2012_00965076
237	Es gibt nur uns, und wir haben nur uns.	Y	haben	48	 41,882	0.2603	52.1429	german_at_news_2012_00457878
238	Wir haben nur ein Leben und das ist hier und jetzt!	Y	haben	48	 41,882	0.2603	52.7	german_at_news_2012_00966221
239	Das eine ist ohne das andere nicht zu haben!	Y	haben	48	 41,882	0.2603	54.125	german_at_news_2012_00165405
240	Wenn sie ihn haben, dann ist das gut.	Y	haben	48	 41,882	0.2603	64	german_at_news_2012_00943898
241	War es auch nicht, für die anderen.	Y	war	49	 40,509	0.2517	38	german_at_news_2012_00921071
242	Es war immer so, und es wird immer so sein.	Y	war	49	 40,509	0.2517	38.1429	german_at_news_2012_00470597
243	Und was nicht war, kann immer noch sein.	Y	war	49	 40,509	0.2517	46.375	german_at_news_2012_00883504
244	Nichts ist mehr so, wie es war.	Y	war	49	 40,509	0.2517	51.4286	german_at_news_2012_00725326
245	Und dann war ich auch noch eine Frau.	Y	war	49	 40,509	0.2517	54.375	german_at_news_2012_00869791
246	Aus dem Es wird man zum Ich.	Y	zum	50	 39,998	0.2485	32.5714	german_at_news_2012_00081500
247	Es kommt und geht von einem zum anderen.	Y	zum	50	 39,998	0.2485	68.625	german_at_news_2012_00464675
