ORDER	SENTENCE	STATUS	WORD	RANK	COUNT	COUNT_REL	INDEX	ID
705	Es gibt Leute in der ÖVP, die sagen, das kann man jetzt nicht auf einmal machen.	Y	övp	141	 10,053	0.0625	95.125	german_at_news_2012_00457661
706	Jeder soll das Projekt Europa zu dem seinen machen.	Y	seinen	142	 10,030	0.0623	144	german_at_news_2012_00620795
707	Es hat alles seinen Preis im Leben.	Y	seinen	142	 10,030	0.0623	149.7143	german_at_news_2012_00459317
708	Man bekommt also immer mehr für seinen Euro.	Y	seinen	142	 10,030	0.0623	153.5	german_at_news_2012_00663057
709	Es wird unter seinen Augen zur Frau.	Y	seinen	142	 10,030	0.0623	196.1429	german_at_news_2012_00472111
710	Laut seinen Angaben musste er das aber gar nicht.	Y	seinen	142	 10,030	0.0623	197.4444	german_at_news_2012_00653789
711	Dieses „Was hat er, was ich nicht habe?“	Y	dieses	143	 10,027	0.0623	55	german_at_news_2012_00355611
712	Dieses Mal: „Wie viel ist zu viel?	Y	dieses	143	 10,027	0.0623	81.6667	german_at_news_2012_00354327
713	Es wird wohl auch dieses Mal so sein.	Y	dieses	143	 10,027	0.0623	93.375	german_at_news_2012_00472198
714	Dieses Jahr kann einfach nur gut werden.	Y	dieses	143	 10,027	0.0623	104	german_at_news_2012_00354015
715	Oder wir lassen dieses Haus auf, aber dann haben wir es nie wieder.	Y	dieses	143	 10,027	0.0623	110.8333	german_at_news_2012_00742336
716	Nur gegen sie zu sein, ist auch kein Programm.	Y	kein	144	 10,022	0.0623	88.7778	german_at_news_2012_00734560
717	Ein Ja zur EU kann kein Ja zu dieser Politik sein.	Y	kein	144	 10,022	0.0623	97.9	german_at_news_2012_00420122
718	Auch wenn er für sich selbst damit kein Problem hat.	Y	kein	144	 10,022	0.0623	101.1	german_at_news_2012_00072762
719	Und dann gibt es kein Halten mehr.	Y	kein	144	 10,022	0.0623	111.4286	german_at_news_2012_00869462
720	In der Stadt selbst ist dafür kein Platz.	Y	kein	144	 10,022	0.0623	111.625	german_at_news_2012_00593568
721	Das eine ist ohne das andere nicht zu haben!	Y	ohne	145	  9,991	0.0621	54.125	german_at_news_2012_00165405
722	Es geht aber auch ohne ihn, wie man sieht!	Y	ohne	145	  9,991	0.0621	96	german_at_news_2012_00455250
723	Und vor allem: Ohne seine Frau und die drei Kinder.	Y	ohne	145	  9,991	0.0621	100.3333	german_at_news_2012_00882960
724	Wien (bzö) - „Die ÖVP ist für eine EU ohne Wenn und Aber.	Y	ohne	145	  9,991	0.0621	101.75	german_at_news_2012_00956994
725	Man sieht schon, wir kommen einfach ohne DIE nicht aus.	Y	ohne	145	  9,991	0.0621	104.9	german_at_news_2012_00668752
726	In Österreich gibt es so etwas nicht.“	Y	etwas	146	  9,929	0.0617	50.8571	german_at_news_2012_00604894
727	So etwas gibt es nur noch in Österreich.	Y	etwas	146	  9,929	0.0617	53.75	german_at_news_2012_00821945
728	Wie geht man mit so etwas um?	Y	etwas	146	  9,929	0.0617	57.8571	german_at_news_2012_00954891
729	Was ist das nur für ein Land, in dem so etwas möglich ist?	Y	etwas	146	  9,929	0.0617	67.75	german_at_news_2012_00926184
730	Es war an der Zeit für die Frauen etwas zu machen.	Y	etwas	146	  9,929	0.0617	70.0909	german_at_news_2012_00469329
731	Es ist auch das, was ich machen will.	Y	machen	147	  9,839	0.0611	50.625	german_at_news_2012_00460216
732	Mehr kann und will ich nicht machen.	Y	machen	147	  9,839	0.0611	60	german_at_news_2012_00675087
733	Es war an der Zeit für die Frauen etwas zu machen.	Y	machen	147	  9,839	0.0611	70.0909	german_at_news_2012_00469329
734	Jetzt würde er es nicht mehr so machen.	Y	machen	147	  9,839	0.0611	71.375	german_at_news_2012_00626304
735	Aber so was würde ich heute nicht mehr machen.	Y	machen	147	  9,839	0.0611	75.8889	german_at_news_2012_00010382
736	Bisher war dies nur im Tourismus sowie in der Land- und Forstwirtschaft möglich.	Y	sowie	148	  9,811	0.061	319.4615	german_at_news_2012_00118410
737	Dies sei möglich und sinnvoll, sowie im österreichischen Interesse.	Y	sowie	148	  9,811	0.061	351.5556	german_at_news_2012_00362187
738	Dazu gehört vor allem, die Opfer- und Wiederaufbauhilfe ernst zu nehmen sowie die österreichische Rolle in Europa.	Y	sowie	148	  9,811	0.061	369	german_at_news_2012_00210123
739	In Österreich nehmen in diesem Jahr mehr als 30 Städte und Gemeinden sowie zahlreiche Unternehmen und mehrere Organisationen teil.	Y	sowie	148	  9,811	0.061	381.9375	german_at_news_2012_00605142
740	Alle Einreichungen sind ab 18. August in einer Ausstellung im Wiener Rathaus sowie im Internet zu sehen.	Y	sowie	148	  9,811	0.061	391.6667	german_at_news_2012_00021875
741	Aus dem, was rund um mich ist.	Y	mich	149	  9,793	0.0609	61.1429	german_at_news_2012_00081696
742	Das ist einfach zu viel für mich.	Y	mich	149	  9,793	0.0609	76.8571	german_at_news_2012_00178116
743	Wer ist das jetzt, frage ich mich.	Y	mich	149	  9,793	0.0609	101	german_at_news_2012_00947513
744	Und das ist es auch, was Wien für mich so besonders macht und auch anders als alles andere.	Y	mich	149	  9,793	0.0609	102.125	german_at_news_2012_00870549
745	Für mich war das Thema immer offen und das ist es nach wie vor.	Y	mich	149	  9,793	0.0609	108.6154	german_at_news_2012_00499231
746	Aber auch das ist noch nicht alles.	Y	alles	150	  9,773	0.0607	40.1429	german_at_news_2012_00001931
747	Es geht sich alles nicht mehr aus.	Y	alles	150	  9,773	0.0607	55.1429	german_at_news_2012_00455797
748	Das ist aber noch lange nicht alles!	Y	alles	150	  9,773	0.0607	75.8571	german_at_news_2012_00176338
749	Das war aber noch lange nicht alles.	Y	alles	150	  9,773	0.0607	81.4286	german_at_news_2012_00203032
750	Und das alles nicht um zehn Millionen Euro!	Y	alles	150	  9,773	0.0607	82.125	german_at_news_2012_00869960
751	Nichts ist mehr so, wie es einmal war.	Y	einmal	151	  9,754	0.0606	63.875	german_at_news_2012_00725325
752	Aber einmal so und einmal so,dass sollte es nicht geben.	Y	einmal	151	  9,754	0.0606	66.6667	german_at_news_2012_00005485
753	Es ist ja nichts mehr so, wie es einmal war.	Y	einmal	151	  9,754	0.0606	71.4444	german_at_news_2012_00462350
754	Noch drei, und dann noch einmal drei.	Y	einmal	151	  9,754	0.0606	74.8	german_at_news_2012_00727963
755	Das kann man nur einmal im Leben machen.“	Y	einmal	151	  9,754	0.0606	78.125	german_at_news_2012_00181308
756	Nicht mit mir und nicht mit der ÖVP.“	Y	mir	152	  9,735	0.0605	53.5	german_at_news_2012_00724212
757	Mir geht es nur um die Menschen.	Y	mir	152	  9,735	0.0605	67.8571	german_at_news_2012_00681746
758	So ist das bei mir mit der Politik.	Y	mir	152	  9,735	0.0605	67.875	german_at_news_2012_00824274
759	Von mir aus kann das schon 2010 der Fall sein.	Y	mir	152	  9,735	0.0605	72.8889	german_at_news_2012_00909406
760	Da hat er dann von mir lassen.	Y	mir	152	  9,735	0.0605	77	german_at_news_2012_00140276
761	War es auch nicht, für die anderen.	Y	anderen	153	  9,726	0.0604	38	german_at_news_2012_00921071
762	Es gibt auch bei der anderen nichts.	Y	anderen	153	  9,726	0.0604	65.2857	german_at_news_2012_00456475
763	Es kommt und geht von einem zum anderen.	Y	anderen	153	  9,726	0.0604	68.625	german_at_news_2012_00464675
764	Nur hat das eine nichts mit dem anderen zu tun.	Y	anderen	153	  9,726	0.0604	76.2	german_at_news_2012_00734644
765	Ich wollte nur eines: nicht so sein wie die anderen.	Y	anderen	153	  9,726	0.0604	80	german_at_news_2012_00562167
766	Ich werde immer für sie da sein.	Y	werde	154	  9,584	0.0596	62.5714	german_at_news_2012_00561319
767	Österreich werde sich aber nicht zu einem Fall machen lassen.	Y	werde	154	  9,584	0.0596	93.6	german_at_news_2012_00751515
768	Ich kann Ihnen nicht sagen, ob ich das machen werde oder nicht.	Y	werde	154	  9,584	0.0596	117.7	german_at_news_2012_00556272
769	Die Frage sei aber, was damit gemacht werde.	Y	werde	154	  9,584	0.0596	117.75	german_at_news_2012_00303700
770	Diese Bilder werde ich für immer haben.	Y	werde	154	  9,584	0.0596	126.2857	german_at_news_2012_00345188
771	Das ist es aber, was wir tun müssen.	Y	müssen	155	  9,388	0.0583	81.125	german_at_news_2012_00178518
772	Und sie müssen nicht arbeiten, wenn sie nicht wollen.	Y	müssen	155	  9,388	0.0583	114.2857	german_at_news_2012_00881372
773	Das müssen wir auf den Platz bringen.	Y	müssen	155	  9,388	0.0583	121.8571	german_at_news_2012_00186430
774	Warum wir was vielleicht - oder auch nicht - haben müssen.	Y	müssen	155	  9,388	0.0583	124.3333	german_at_news_2012_00922972
775	Allerdings müssen wir es in der Regierung besser machen als bisher.	Y	müssen	155	  9,388	0.0583	127.2727	german_at_news_2012_00024778
776	Wir haben den Euro und werden den Euro auch weiter haben.	Y	weiter	156	  9,383	0.0583	46.25	german_at_news_2012_00965076
777	Und so weiter, und so weiter, und so weiter.	Y	weiter	156	  9,383	0.0583	64	german_at_news_2012_00882059
778	Das wird die Zukunft sein, wenn es im Land so weiter geht.“	Y	weiter	156	  9,383	0.0583	77.75	german_at_news_2012_00205538
779	Die Frage ist: Wie geht das weiter?	Y	weiter	156	  9,383	0.0583	80	german_at_news_2012_00303562
780	ÖSTERREICH: Wie geht es jetzt bei Ihnen weiter?	Y	weiter	156	  9,383	0.0583	89.875	german_at_news_2012_00751548
781	Dafür ist die Zeit noch nicht da.	Y	dafür	157	  9,134	0.0568	62.7143	german_at_news_2012_00138469
782	Dafür sind sie aber fast so laut wie 60 %.	Y	dafür	157	  9,134	0.0568	90	german_at_news_2012_00138931
783	Derzeit haben wir das Geld dafür nicht.	Y	dafür	157	  9,134	0.0568	102.1429	german_at_news_2012_00268988
784	Dafür gibt es noch zu viel zu tun.	Y	dafür	157	  9,134	0.0568	103	german_at_news_2012_00138242
785	In der Stadt selbst ist dafür kein Platz.	Y	dafür	157	  9,134	0.0568	111.625	german_at_news_2012_00593568
786	Von Österreich ist bisher nichts gemacht worden.	Y	worden	158	  9,060	0.0563	135.7143	german_at_news_2012_00909588
787	Haider: Es ist noch nie die Frage gestellt worden, ob ich da nicht dabei sein werde.	Y	worden	158	  9,060	0.0563	146.0625	german_at_news_2012_00526894
788	Ist das wirklich von ihr gesagt worden?	Y	worden	158	  9,060	0.0563	175.8571	german_at_news_2012_00615766
789	Wie ist das in der Familie aufgenommen worden?	Y	worden	158	  9,060	0.0563	212.125	german_at_news_2012_00955745
790	Was sei in dieser Zeit alles (nicht) getan worden?	Y	worden	158	  9,060	0.0563	213.4444	german_at_news_2012_00927551
791	Aber selbst da gibt er immer alles”, sagte der 81-Jährige.	Y	sagte	159	  8,977	0.0558	94.9	german_at_news_2012_00009921
792	"""Eine sagte: """" die war doch mit im Spiel“."""	Y	sagte	159	  8,977	0.0558	97.875	german_at_news_2012_00413260
793	Dafür habe ich aber keine Zeit“, sagte der FPÖ-Chef.	Y	sagte	159	  8,977	0.0558	119.4	german_at_news_2012_00138286
794	Und so soll es auch bleiben“, sagte Schüssel.	Y	sagte	159	  8,977	0.0558	129.625	german_at_news_2012_00881985
795	Jetzt ist alles möglich”, sagte der 27-Jährige.	Y	sagte	159	  8,977	0.0558	130.8571	german_at_news_2012_00624257
796	Nicht bei uns und nicht erst jetzt!	Y	erst	160	  8,889	0.0552	69.6667	german_at_news_2012_00723258
797	Sie will sich erst einmal ganz viel Zeit für die Familie nehmen.	Y	erst	160	  8,889	0.0552	125.5833	german_at_news_2012_00816762
798	Aber wir sind aber erst am Anfang.	Y	erst	160	  8,889	0.0552	126.3333	german_at_news_2012_00012012
799	Das ist derzeit aber erst zum Teil möglich.	Y	erst	160	  8,889	0.0552	126.75	german_at_news_2012_00177213
800	Erst danach kann man sagen, ob sie das können oder nicht.	Y	erst	160	  8,889	0.0552	128.9091	german_at_news_2012_00445523
801	Die Frage ist, ob man das will.	Y	ob	161	  8,884	0.0552	81.4286	german_at_news_2012_00303531
802	Ob das auch in der Politik geht?	Y	ob	161	  8,884	0.0552	86.5714	german_at_news_2012_00737279
803	Ob das dann fünf Prozent sind oder auch mehr, ist eine andere Frage.	Y	ob	161	  8,884	0.0552	87.5385	german_at_news_2012_00737295
804	Ich weiß nicht, ob er so war.	Y	ob	161	  8,884	0.0552	89	german_at_news_2012_00560987
805	Wir fragen uns, ob das bei uns auch so sein wird“.	Y	ob	161	  8,884	0.0552	90.9	german_at_news_2012_00964218
806	Von wo es aber schon heute wieder zurück nach Österreich geht.	Y	wo	162	  8,868	0.0551	83.0909	german_at_news_2012_00910271
807	Mehr dazu in Wo ist dieser Mann?	Y	wo	162	  8,868	0.0551	93.7143	german_at_news_2012_00674316
808	Wo steht denn so eine in zehn Jahren?“	Y	wo	162	  8,868	0.0551	105.375	german_at_news_2012_00976954
809	Wo ist das große Thema der ÖVP?	Y	wo	162	  8,868	0.0551	114.4286	german_at_news_2012_00975473
810	“Das Problem ist aber der Grund – wie und wo man geht.	Y	wo	162	  8,868	0.0551	119	german_at_news_2012_00189495
811	Wie sie leben und wie sie sind.	Y	leben	163	  8,838	0.0549	51.4	german_at_news_2012_00959277
812	Wir haben nur ein Leben und das ist hier und jetzt!	Y	leben	163	  8,838	0.0549	52.7	german_at_news_2012_00966221
813	Das kann man nur einmal im Leben machen.“	Y	leben	163	  8,838	0.0549	78.125	german_at_news_2012_00181308
814	Ich weiß nur, dass man ein Leben hat.	Y	leben	163	  8,838	0.0549	82.25	german_at_news_2012_00561091
815	Die beiden haben zwei Kinder und leben in Wien.	Y	leben	163	  8,838	0.0549	83.2222	german_at_news_2012_00285016
816	Dafür sind sie aber fast so laut wie 60 %.	Y	laut	164	  8,803	0.0547	90	german_at_news_2012_00138931
817	Nicht, weil die Musik so laut ist.	Y	laut	164	  8,803	0.0547	106	german_at_news_2012_00725727
818	Diese ist laut Polizei aber nicht sehr schwer.	Y	laut	164	  8,803	0.0547	139.75	german_at_news_2012_00347442
819	Doch dazu sollen sie laut Polizei gar nicht mehr gekommen sein.	Y	laut	164	  8,803	0.0547	167.9091	german_at_news_2012_00383874
820	Ich bin zurück und stolz (aber nicht zu laut).	Y	laut	164	  8,803	0.0547	191.8889	german_at_news_2012_00549299
821	“So war’s, und so kommt es nicht wieder.”	Y	kommt	165	  8,784	0.0546	67	german_at_news_2012_00832658
822	Auf eine mehr oder weniger kommt es nicht an.“	Y	kommt	165	  8,784	0.0546	67.8889	german_at_news_2012_00077531
823	Es kommt und geht von einem zum anderen.	Y	kommt	165	  8,784	0.0546	68.625	german_at_news_2012_00464675
824	Vor dem, was ist, was noch kommt, was aus ihnen werden soll.	Y	kommt	165	  8,784	0.0546	70.7	german_at_news_2012_00913140
825	Das Geld ist zwar da, aber es kommt nicht an.	Y	kommt	165	  8,784	0.0546	81.3	german_at_news_2012_00170338
826	Nichts ist mehr so, wie es war.	Y	nichts	166	  8,726	0.0542	51.4286	german_at_news_2012_00725326
827	Nichts ist mehr so, wie es einmal war.	Y	nichts	166	  8,726	0.0542	63.875	german_at_news_2012_00725325
828	Es gibt auch bei der anderen nichts.	Y	nichts	166	  8,726	0.0542	65.2857	german_at_news_2012_00456475
829	Es ist ja nichts mehr so, wie es einmal war.	Y	nichts	166	  8,726	0.0542	71.4444	german_at_news_2012_00462350
830	Er sagt sich „Es geht nichts mehr in Österreich“.	Y	nichts	166	  8,726	0.0542	73.8889	german_at_news_2012_00443033
831	Und vor allem: Wer hat das Geld?	Y	wer	167	  8,695	0.054	89.4286	german_at_news_2012_00882972
832	Und wer, wenn nicht sie, muss es wissen?	Y	wer	167	  8,695	0.054	90	german_at_news_2012_00884958
833	Ich weiß nicht, wer das sein kann.	Y	wer	167	  8,695	0.054	91.7143	german_at_news_2012_00561041
834	Keine Frage: Die ÖVP ist wieder wer im Land.	Y	wer	167	  8,695	0.054	100.4444	german_at_news_2012_00633521
835	Wer ist das jetzt, frage ich mich.	Y	wer	167	  8,695	0.054	101	german_at_news_2012_00947513
836	Bei ihm werden es wohl schon bis zu 45 Jahre sein.	Y	ihm	168	  8,602	0.0535	80.1	german_at_news_2012_00101399
837	Es wird ihm dabei nicht mehr viel im Weg stehen.	Y	ihm	168	  8,602	0.0535	95.5	german_at_news_2012_00471788
838	Kann aber auch sein, dass es ihm zu jeder Zeit recht ist.	Y	ihm	168	  8,602	0.0535	96.1667	german_at_news_2012_00629832
839	Die Menschen wissen, was sie an ihm haben.	Y	ihm	168	  8,602	0.0535	96.875	german_at_news_2012_00326559
840	Ich weiß nicht, wie es ihm geht.	Y	ihm	168	  8,602	0.0535	97	german_at_news_2012_00561051
841	Und, so viel steht fest, das will er auch werden.	Y	steht	169	  8,396	0.0522	86.5	german_at_news_2012_00882038
842	Und wie steht's mit den NEWS.	Y	steht	169	  8,396	0.0522	92.4286	german_at_news_2012_00885353
843	Wo steht denn so eine in zehn Jahren?“	Y	steht	169	  8,396	0.0522	105.375	german_at_news_2012_00976954
844	Österreich steht besser da als vor zwei Jahren.	Y	steht	169	  8,396	0.0522	106	german_at_news_2012_00750884
845	Wenn man auf der Bühne steht, ist das auch so.	Y	steht	169	  8,396	0.0522	108.1	german_at_news_2012_00941831
846	Und das wird nicht das Ende sein.	Y	ende	170	  8,378	0.0521	47	german_at_news_2012_00871600
847	Aber das ist noch nicht das Ende, oder?	Y	ende	170	  8,378	0.0521	47.8571	german_at_news_2012_00003623
848	Das ist aber sicher noch nicht das Ende.	Y	ende	170	  8,378	0.0521	87	german_at_news_2012_00176360
849	Das sei aber nicht das Ende der Entwicklung.	Y	ende	170	  8,378	0.0521	91.2857	german_at_news_2012_00193752
850	Und das ist nur der Anfang vom Ende!	Y	ende	170	  8,378	0.0521	94.5	german_at_news_2012_00870622
851	Da hat er dann von mir lassen.	Y	lassen	171	  8,328	0.0517	77	german_at_news_2012_00140276
852	Österreich wird sich aber nicht zu einem Fall machen lassen.	Y	lassen	171	  8,328	0.0517	81.4	german_at_news_2012_00751660
853	Damit wollen wir es für heute gut sein lassen.	Y	lassen	171	  8,328	0.0517	90.1111	german_at_news_2012_00148692
854	Österreich werde sich aber nicht zu einem Fall machen lassen.	Y	lassen	171	  8,328	0.0517	93.6	german_at_news_2012_00751515
855	Alles andere in Linz kann man so lassen, aber das nicht.	Y	lassen	171	  8,328	0.0517	97.8182	german_at_news_2012_00025724
856	Das ist auch in seinem neuen Buch so.	Y	seinem	172	  8,239	0.0512	132	german_at_news_2012_00176601
857	Zu seinem Wort stehen das kann er nicht und wird er nie können.	Y	seinem	172	  8,239	0.0512	145.5	german_at_news_2012_00995117
858	Nach seinem Tod 2008 sollen es aber nur mehr knapp fünf Millionen Euro gewesen sein.	Y	seinem	172	  8,239	0.0512	171.5714	german_at_news_2012_00710637
859	Im Vergleich zu seinem aktuellen Stand wäre das ein Plus von mehr als sieben Prozent.	Y	seinem	172	  8,239	0.0512	205.5333	german_at_news_2012_00582405
860	Es war so Ende Juni, zwei Monate vor seinem Tod.	Y	seinem	172	  8,239	0.0512	216.8	german_at_news_2012_00470872
861	Was ist das nur für ein Land, in dem so etwas möglich ist?	Y	land	173	  8,199	0.0509	67.75	german_at_news_2012_00926184
862	Das wird die Zukunft sein, wenn es im Land so weiter geht.“	Y	land	173	  8,199	0.0509	77.75	german_at_news_2012_00205538
863	Das 'Land' waren für ihn die Menschen.	Y	land	173	  8,199	0.0509	84.8571	german_at_news_2012_00183855
864	Keine Frage: Die ÖVP ist wieder wer im Land.	Y	land	173	  8,199	0.0509	100.4444	german_at_news_2012_00633521
865	Die arbeiten ja nicht mal für das Land Österreich.	Y	land	173	  8,199	0.0509	104.7778	german_at_news_2012_00279692
866	Gibt es einen, der noch besser wäre, als ich?	Y	wäre	174	  8,138	0.0506	80	german_at_news_2012_00515609
867	Das wäre vor einem Jahr so nicht möglich gewesen, oder?	Y	wäre	174	  8,138	0.0506	99.1	german_at_news_2012_00203970
868	Wenn das nur alles so einfach wäre.	Y	wäre	174	  8,138	0.0506	100.8571	german_at_news_2012_00937824
869	Selbst wenn es das wäre: Warum denn nicht?	Y	wäre	174	  8,138	0.0506	105.375	german_at_news_2012_00800987
870	Wenn ich was gemacht hätte, wäre ich auch heute nicht mehr dort.	Y	wäre	174	  8,138	0.0506	114.0909	german_at_news_2012_00941263
871	Das geht und sollte auch so sein.	Y	sollte	175	  8,134	0.0505	56.7143	german_at_news_2012_00170208
872	Aber einmal so und einmal so,dass sollte es nicht geben.	Y	sollte	175	  8,134	0.0505	66.6667	german_at_news_2012_00005485
873	Es sollte ein Film werden, der mehr ist als ich.	Y	sollte	175	  8,134	0.0505	84.2	german_at_news_2012_00468575
874	Und, was sollte man sagen: Sie war da!	Y	sollte	175	  8,134	0.0505	94.75	german_at_news_2012_00883556
875	Warum sollte das nicht auch in Wien der Fall sein?	Y	sollte	175	  8,134	0.0505	96.1	german_at_news_2012_00922674
876	Die Frage ist nur: Kommen sie wieder?	Y	kommen	176	  8,122	0.0505	81.4286	german_at_news_2012_00303495
877	Wie um alles in der Welt kommen die nur darauf?	Y	kommen	176	  8,122	0.0505	90.8	german_at_news_2012_00959941
878	Jetzt wird er wohl nicht mehr kommen.	Y	kommen	176	  8,122	0.0505	94.8571	german_at_news_2012_00626132
879	Und sie kommen auch mit Fragen zu mir.	Y	kommen	176	  8,122	0.0505	98.75	german_at_news_2012_00881328
880	Man sieht schon, wir kommen einfach ohne DIE nicht aus.	Y	kommen	176	  8,122	0.0505	104.9	german_at_news_2012_00668752
881	Aber es hat nicht sein sollen, und es war besser so.	Y	sollen	177	  8,086	0.0502	72.5	german_at_news_2012_00006012
882	Das sollen sie auch gar nicht sein.	Y	sollen	177	  8,086	0.0502	79.7143	german_at_news_2012_00197014
883	Die beiden sollen in den 1980er Jahren ein Paar gewesen sein.	Y	sollen	177	  8,086	0.0502	107.3636	german_at_news_2012_00285469
884	Wie sollen sie das haben, wenn der Sonntag ein Tag wie jeder andere ist.	Y	sollen	177	  8,086	0.0502	107.7692	german_at_news_2012_00959521
885	Die Menschen sollen bleiben, wie sie waren.	Y	sollen	177	  8,086	0.0502	112.7143	german_at_news_2012_00326500
886	Aber was soll ich mit diesen Millionen?	Y	diesen	178	  8,014	0.0498	76.1429	german_at_news_2012_00011118
887	Wenn sie einen haben dann würde ich diesen auch gerne mal sehen!	Y	diesen	178	  8,014	0.0498	131.6667	german_at_news_2012_00943796
888	Wir wollen diesen Erfolg nicht für uns, wir wollen ihn für Europa.	Y	diesen	178	  8,014	0.0498	156.3333	german_at_news_2012_00972852
889	Es stehen hier für diesen Bereich 265 Millionen Euro zur Verfügung.	Y	diesen	178	  8,014	0.0498	159.2	german_at_news_2012_00468772
890	Diesen Weg werden vielleicht auch noch andere gehen müssen.	Y	diesen	178	  8,014	0.0498	159.2222	german_at_news_2012_00349604
891	Dieses Mal: „Wie viel ist zu viel?	Y	mal	179	  7,985	0.0496	81.6667	german_at_news_2012_00354327
892	Über ÖVP und SPÖ: Die einen sind mal weg.	Y	mal	179	  7,985	0.0496	90.2222	german_at_news_2012_00861255
893	Das war für ihn nicht das erste Mal.	Y	mal	179	  7,985	0.0496	91.1429	german_at_news_2012_00204006
894	Es wird wohl auch dieses Mal so sein.	Y	mal	179	  7,985	0.0496	93.375	german_at_news_2012_00472198
895	Die arbeiten ja nicht mal für das Land Österreich.	Y	mal	179	  7,985	0.0496	104.7778	german_at_news_2012_00279692
896	Wenn sie ihn haben, dann ist das gut.	Y	ihn	180	  7,963	0.0495	64	german_at_news_2012_00943898
897	Aber das war ja nicht gut für ihn.	Y	ihn	180	  7,963	0.0495	69.375	german_at_news_2012_00004002
898	Das 'Land' waren für ihn die Menschen.	Y	ihn	180	  7,963	0.0495	84.8571	german_at_news_2012_00183855
899	Das war für ihn nicht das erste Mal.	Y	ihn	180	  7,963	0.0495	91.1429	german_at_news_2012_00204006
900	Es geht aber auch ohne ihn, wie man sieht!	Y	ihn	180	  7,963	0.0495	96	german_at_news_2012_00455250
901	Das eine ist ohne das andere nicht zu haben!	Y	andere	181	  7,917	0.0492	54.125	german_at_news_2012_00165405
902	Und was andere Menschen können, kann er auch.	Y	andere	181	  7,917	0.0492	67.875	german_at_news_2012_00883228
903	Ob das dann fünf Prozent sind oder auch mehr, ist eine andere Frage.	Y	andere	181	  7,917	0.0492	87.5385	german_at_news_2012_00737295
904	Aber es war doch ein Tag wie viele andere.	Y	andere	181	  7,917	0.0492	89.2222	german_at_news_2012_00006356
905	Aber auch das ist eine andere Geschichte.	Y	andere	181	  7,917	0.0492	90.2857	german_at_news_2012_00001928
906	Wie er sich und die Welt sieht.	Y	welt	182	  7,876	0.0489	77.8571	german_at_news_2012_00954406
907	Ich will noch mehr von der Welt sehen!	Y	welt	182	  7,876	0.0489	82.375	german_at_news_2012_00561892
908	… Wie viel Geld gibt es auf der Welt?	Y	welt	182	  7,876	0.0489	85.25	german_at_news_2012_00960368
909	Das ist nicht seine Welt, das weiß er jetzt.	Y	welt	182	  7,876	0.0489	89	german_at_news_2012_00179679
910	Wie um alles in der Welt kommen die nur darauf?	Y	welt	182	  7,876	0.0489	90.8	german_at_news_2012_00959941
911	Also gehen wir dem auch nicht nach.“	Y	also	183	  7,821	0.0486	80	german_at_news_2012_00033710
912	Und also leben sie hier bis heute.	Y	also	183	  7,821	0.0486	89.1429	german_at_news_2012_00867180
913	Auch so geht das Leben also weiter.	Y	also	183	  7,821	0.0486	95	german_at_news_2012_00071486
914	Also wissen sie, wie das so geht.	Y	also	183	  7,821	0.0486	102.4286	german_at_news_2012_00034638
915	Also leben kann man davon nicht mehr.“	Y	also	183	  7,821	0.0486	104.7143	german_at_news_2012_00034033
916	“So war’s, und so kommt es nicht wieder.”	Y	s	184	  7,820	0.0486	67	german_at_news_2012_00832658
917	Und dann geht´s nicht mehr gut.	Y	s	184	  7,820	0.0486	78.7143	german_at_news_2012_00869441
918	Und wie steht's mit den NEWS.	Y	s	184	  7,820	0.0486	92.4286	german_at_news_2012_00885353
919	Den gibt´s heuer schon um die 4000 €.	Y	s	184	  7,820	0.0486	101.4286	german_at_news_2012_00216719
920	Das kann's ja wohl nicht sein.	Y	s	184	  7,820	0.0486	103.2857	german_at_news_2012_00181412
921	Und wir sind jetzt ein Jahr dort.	Y	dort	185	  7,802	0.0485	67.8571	german_at_news_2012_00885609
922	Nichts bleibt hier von dem über, was sie dort war.	Y	dort	185	  7,802	0.0485	94.8	german_at_news_2012_00725126
923	Aber selbst war ich noch nie dort.	Y	dort	185	  7,802	0.0485	103.8571	german_at_news_2012_00009960
924	Wenn sie dort Frauen wollen, dann machen sie es so.	Y	dort	185	  7,802	0.0485	105.5556	german_at_news_2012_00943766
925	Wenn ich was gemacht hätte, wäre ich auch heute nicht mehr dort.	Y	dort	185	  7,802	0.0485	114.0909	german_at_news_2012_00941263
926	Das wollen aber nur 17 Prozent der Frauen.	Y	wollen	186	  7,730	0.048	84.1429	german_at_news_2012_00206056
927	Damit wollen wir es für heute gut sein lassen.	Y	wollen	186	  7,730	0.048	90.1111	german_at_news_2012_00148692
928	Ein Muss für alle Fans und die, die es noch werden wollen!	Y	wollen	186	  7,730	0.048	96.6364	german_at_news_2012_00421993
929	Das ist nicht das Bild, das wir haben wollen.	Y	wollen	186	  7,730	0.048	97.5714	german_at_news_2012_00179562
930	NEWS: Was wollen Sie in der Politik noch werden?	Y	wollen	186	  7,730	0.048	100	german_at_news_2012_00722632
