ORDER	SENTENCE	STATUS	WORD	RANK	COUNT	COUNT_REL	INDEX	ID
248	Und das soll zum Wohl der Kinder sein?	Y	zum	50	 39,998	0.2485	81.625	german_at_news_2012_00871351
249	Wie das alles vor sich geht, weiß man heute nur zum Teil.	Y	zum	50	 39,998	0.2485	97.5	german_at_news_2012_00952560
250	Auf dem Weg zum ganz großen Erfolg kann er sich jetzt nur noch selbst im Weg stehen.	Y	zum	50	 39,998	0.2485	105.5625	german_at_news_2012_00074807
251	Das geben Sie aus, und mehr ist nicht.	Y	mehr	51	 38,209	0.2374	34.25	german_at_news_2012_00169580
252	Mehr kann ich nicht, aber das kann ich.	Y	mehr	51	 38,209	0.2374	34.6667	german_at_news_2012_00675073
253	Aber seit 14 Jahren ist das nicht mehr so.	Y	mehr	51	 38,209	0.2374	40.25	german_at_news_2012_00009895
254	Das kann und wird es nicht mehr geben.	Y	mehr	51	 38,209	0.2374	40.375	german_at_news_2012_00181437
255	Nichts ist mehr so, wie es war.	Y	mehr	51	 38,209	0.2374	51.4286	german_at_news_2012_00725326
256	Und das geht sich nicht aus, oder?	Y	oder	52	 37,116	0.2306	32.5714	german_at_news_2012_00870261
257	Aus dem Euro oder aus der EU?	Y	oder	52	 37,116	0.2306	46.8333	german_at_news_2012_00081502
258	Aber das ist noch nicht das Ende, oder?	Y	oder	52	 37,116	0.2306	47.8571	german_at_news_2012_00003623
259	Wir sind doch noch in Österreich oder etwa nicht?	Y	oder	52	 37,116	0.2306	56.1111	german_at_news_2012_00969727
260	Das kann ja dann doch nicht sein, oder?	Y	oder	52	 37,116	0.2306	60.75	german_at_news_2012_00181240
261	Wir haben den Euro und werden den Euro auch weiter haben.	Y	wir	53	 36,298	0.2256	46.25	german_at_news_2012_00965076
262	Es gibt nur uns, und wir haben nur uns.	Y	wir	53	 36,298	0.2256	52.1429	german_at_news_2012_00457878
263	Wir haben nur ein Leben und das ist hier und jetzt!	Y	wir	53	 36,298	0.2256	52.7	german_at_news_2012_00966221
264	Wir sind doch noch in Österreich oder etwa nicht?	Y	wir	53	 36,298	0.2256	56.1111	german_at_news_2012_00969727
265	Und wir sind jetzt ein Jahr dort.	Y	wir	53	 36,298	0.2256	67.8571	german_at_news_2012_00885609
266	Wurde auch Zeit, dass die Polizei das auch so sieht!	Y	wurde	54	 33,516	0.2083	94.2222	german_at_news_2012_00977421
267	Aber das musste sein, damit aus mir wurde, was ich bin.	Y	wurde	54	 33,516	0.2083	100.5455	german_at_news_2012_00003779
268	Das wurde nach zehn Jahren auch wirklich Zeit.	Y	wurde	54	 33,516	0.2083	106.875	german_at_news_2012_00206443
269	Nach dem großen Tag wurde es nicht besser.	Y	wurde	54	 33,516	0.2083	113	german_at_news_2012_00704329
270	Im Jänner wurde es ihm zu viel.	Y	wurde	54	 33,516	0.2083	126.5714	german_at_news_2012_00573990
271	Es ist eine Frage der Zeit bis das zu viel wird.	Y	bis	55	 33,000	0.2051	58.1818	german_at_news_2012_00461209
272	Dann ist das nur mehr eine Frage der Zeit, bis wir am Ziel sind.	Y	bis	55	 33,000	0.2051	75.9286	german_at_news_2012_00152808
273	Es ist nur mehr eine Frage der Zeit, bis wir am Ziel sind.	Y	bis	55	 33,000	0.2051	77.4615	german_at_news_2012_00463120
274	In drei bis vier Jahren ist er nur noch einer von vielen.	Y	bis	55	 33,000	0.2051	80.0833	german_at_news_2012_00597036
275	Bei ihm werden es wohl schon bis zu 45 Jahre sein.	Y	bis	55	 33,000	0.2051	80.1	german_at_news_2012_00101399
276	Und das wird dann auch so sein.	Y	sein	56	 32,072	0.1993	30.7143	german_at_news_2012_00871586
277	Ist es nicht, kann es nicht sein.	Y	sein	56	 32,072	0.1993	32	german_at_news_2012_00616345
278	Das kann und soll aber nicht sein.	Y	sein	56	 32,072	0.1993	37.1429	german_at_news_2012_00181436
279	Es war immer so, und es wird immer so sein.	Y	sein	56	 32,072	0.1993	38.1429	german_at_news_2012_00470597
280	So soll es sein, so wird es sein.	Y	sein	56	 32,072	0.1993	43.6	german_at_news_2012_00831368
281	Wie ist das bei Ihnen auf dem Weg zur Arbeit?	Y	zur	57	 30,732	0.191	91.1	german_at_news_2012_00955739
282	Ein Ja zur EU kann kein Ja zu dieser Politik sein.	Y	zur	57	 30,732	0.191	97.9	german_at_news_2012_00420122
283	Es ist aber auch die Frage, wie viel Geld man zur Verfügung hat.	Y	zur	57	 30,732	0.191	103.3846	german_at_news_2012_00459932
284	Mehr gibt’s zur Zeit nicht zu sagen.	Y	zur	57	 30,732	0.191	105.5	german_at_news_2012_00674857
285	Es hält sich zur Zeit nicht so gut.	Y	zur	57	 30,732	0.191	109.75	german_at_news_2012_00458858
286	Was sie heute wollen, bringen Sie auch durch.	Y	durch	58	 30,549	0.1898	116.1429	german_at_news_2012_00927853
287	Was geht Ihnen durch den Kopf, wenn Sie die sehen?	Y	durch	58	 30,549	0.1898	139.8	german_at_news_2012_00925160
288	Und doch halten einige von ihnen durch.	Y	durch	58	 30,549	0.1898	158.2857	german_at_news_2012_00874199
289	Und Sie meinen mit dieser Frage kommen sie durch?	Y	durch	58	 30,549	0.1898	164.375	german_at_news_2012_00881361
290	Als Landeshauptmann kommt man damit allein nicht durch.	Y	durch	58	 30,549	0.1898	165.125	german_at_news_2012_00032503
291	Wenn das aber nicht mehr der Fall ist?	Y	wenn	59	 27,914	0.1735	57.25	german_at_news_2012_00937632
292	Wenn sie ihn haben, dann ist das gut.	Y	wenn	59	 27,914	0.1735	64	german_at_news_2012_00943898
293	Und nicht nur, wenn es um die USA geht.	Y	wenn	59	 27,914	0.1735	67.3333	german_at_news_2012_00879786
294	Das wird die Zukunft sein, wenn es im Land so weiter geht.“	Y	wenn	59	 27,914	0.1735	77.75	german_at_news_2012_00205538
295	Aber was soll man machen, wenn man nichts hat.	Y	wenn	59	 27,914	0.1735	78.375	german_at_news_2012_00011124
296	Wir haben den Euro und werden den Euro auch weiter haben.	Y	euro	60	 27,622	0.1716	46.25	german_at_news_2012_00965076
297	Aus dem Euro oder aus der EU?	Y	euro	60	 27,622	0.1716	46.8333	german_at_news_2012_00081502
298	Und das alles nicht um zehn Millionen Euro!	Y	euro	60	 27,622	0.1716	82.125	german_at_news_2012_00869960
299	Das ist ein Plus von 125 Millionen Euro.	Y	euro	60	 27,622	0.1716	93.2857	german_at_news_2012_00178283
300	Das seien um 323 Euro pro Jahr mehr als noch vor fünf Jahren.	Y	euro	60	 27,622	0.1716	93.5	german_at_news_2012_00193998
301	Ist es nicht, kann es nicht sein.	Y	kann	61	 27,234	0.1692	32	german_at_news_2012_00616345
302	Mehr kann ich nicht, aber das kann ich.	Y	kann	61	 27,234	0.1692	34.6667	german_at_news_2012_00675073
303	Er kann es, und er wird es können.	Y	kann	61	 27,234	0.1692	35.6667	german_at_news_2012_00440131
304	Das kann und soll aber nicht sein.	Y	kann	61	 27,234	0.1692	37.1429	german_at_news_2012_00181436
305	Das kann und wird es nicht mehr geben.	Y	kann	61	 27,234	0.1692	40.375	german_at_news_2012_00181437
306	Die sei „in Österreich aber nicht möglich“.	Y	sei	62	 26,564	0.1651	66.8571	german_at_news_2012_00347280
307	Das sei aber nicht das Ende der Entwicklung.	Y	sei	62	 26,564	0.1651	91.2857	german_at_news_2012_00193752
308	Das sei nur möglich, „wenn man selbst nicht weiß, was man will“.	Y	sei	62	 26,564	0.1651	100	german_at_news_2012_00194235
309	Es sei richtig, es könnte von allem noch mehr sein.	Y	sei	62	 26,564	0.1651	116	german_at_news_2012_00467449
310	Die Frage sei aber, was damit gemacht werde.	Y	sei	62	 26,564	0.1651	117.75	german_at_news_2012_00303700
311	Diese Zeit habe ich heute nicht mehr.	Y	diese	63	 26,193	0.1628	67.1429	german_at_news_2012_00357289
312	Wir sind nicht gegen Europa, aber wir sind gegen diese EU.	Y	diese	63	 26,193	0.1628	80.375	german_at_news_2012_00970149
313	Und diese kommt nicht nur aus Deutschland.	Y	diese	63	 26,193	0.1628	86.5714	german_at_news_2012_00873568
314	Doch diese zu finden ist nicht immer einfach.	Y	diese	63	 26,193	0.1628	96.25	german_at_news_2012_00384941
315	Mit uns hat diese Zeit viel zu tun.	Y	diese	63	 26,193	0.1628	97.25	german_at_news_2012_00696839
316	Die hat er jetzt auch in Österreich.	Y	österreich	64	 24,235	0.1506	33.8571	german_at_news_2012_00311372
317	In Österreich gibt es so etwas nicht.“	Y	österreich	64	 24,235	0.1506	50.8571	german_at_news_2012_00604894
318	So etwas gibt es nur noch in Österreich.	Y	österreich	64	 24,235	0.1506	53.75	german_at_news_2012_00821945
319	Wir sind doch noch in Österreich oder etwa nicht?	Y	österreich	64	 24,235	0.1506	56.1111	german_at_news_2012_00969727
320	Das ist bei uns in Österreich noch nicht der Fall.	Y	österreich	64	 24,235	0.1506	56.6	german_at_news_2012_00176716
321	Von mir aus kann das schon 2010 der Fall sein.	Y	schon	65	 24,056	0.1495	72.8889	german_at_news_2012_00909406
322	Die haben das schon vor 30 Jahren gemacht.	Y	schon	65	 24,056	0.1495	75.4286	german_at_news_2012_00310747
323	Oder hatten wir nicht schon so einen?	Y	schon	65	 24,056	0.1495	77.4286	german_at_news_2012_00741490
324	Man weiß ja schon nicht, was in zwei Jahren sein wird.	Y	schon	65	 24,056	0.1495	79.5455	german_at_news_2012_00669573
325	Bei ihm werden es wohl schon bis zu 45 Jahre sein.	Y	schon	65	 24,056	0.1495	80.1	german_at_news_2012_00101399
326	Und was nicht war, kann immer noch sein.	Y	was	66	 24,047	0.1494	46.375	german_at_news_2012_00883504
327	Es ist auch das, was ich machen will.	Y	was	66	 24,047	0.1494	50.625	german_at_news_2012_00460216
328	Sie ist das, was ich nicht bin.	Y	was	66	 24,047	0.1494	51.5714	german_at_news_2012_00808784
329	Dieses „Was hat er, was ich nicht habe?“	Y	was	66	 24,047	0.1494	55	german_at_news_2012_00355611
330	Aber was ist mit SPÖ und ÖVP?	Y	was	66	 24,047	0.1494	57.2857	german_at_news_2012_00011065
331	Dieses „Was hat er, was ich nicht habe?“	Y	habe	67	 23,906	0.1486	55	german_at_news_2012_00355611
332	Diese Zeit habe ich heute nicht mehr.	Y	habe	67	 23,906	0.1486	67.1429	german_at_news_2012_00357289
333	Und das habe ich dann auch gemacht.	Y	habe	67	 23,906	0.1486	69.1429	german_at_news_2012_00870318
334	Er war auch immer ein Teil von dem, was ich gemacht habe.	Y	habe	67	 23,906	0.1486	78.5833	german_at_news_2012_00449594
335	Das habe ich nicht und das würde ich auch nie machen.	Y	habe	67	 23,906	0.1486	82	german_at_news_2012_00172578
336	Und das wird dann auch so sein.	Y	dann	68	 22,376	0.139	30.7143	german_at_news_2012_00871586
337	Und dann war ich auch noch eine Frau.	Y	dann	68	 22,376	0.139	54.375	german_at_news_2012_00869791
338	Das kann ja dann doch nicht sein, oder?	Y	dann	68	 22,376	0.139	60.75	german_at_news_2012_00181240
339	Wenn sie ihn haben, dann ist das gut.	Y	dann	68	 22,376	0.139	64	german_at_news_2012_00943898
340	Dann kam das Jahr 1968, und aus war es.	Y	dann	68	 22,376	0.139	69	german_at_news_2012_00152924
341	“So war’s, und so kommt es nicht wieder.”	Y	wieder	69	 22,368	0.139	67	german_at_news_2012_00832658
342	Aber er wird nie wieder, wie er war.	Y	wieder	69	 22,368	0.139	72.7143	german_at_news_2012_00005768
343	Das ist schon gut so, aber das allein ist es auch wieder nicht.	Y	wieder	69	 22,368	0.139	80.3636	german_at_news_2012_00179925
344	Die Frage ist nur: Kommen sie wieder?	Y	wieder	69	 22,368	0.139	81.4286	german_at_news_2012_00303495
345	Von wo es aber schon heute wieder zurück nach Österreich geht.	Y	wieder	69	 22,368	0.139	83.0909	german_at_news_2012_00910271
346	Nur in Wien gibt es die noch nicht.	Y	wien	70	 22,149	0.1376	34.25	german_at_news_2012_00734860
347	Der würde das aber auch in Wien mit der SPÖ können.	Y	wien	70	 22,149	0.1376	54.1	german_at_news_2012_00268439
348	In Wien gibt es noch genau einen, der das kann.	Y	wien	70	 22,149	0.1376	64.5	german_at_news_2012_00613023
349	Ist das in Wien bereits ein Thema?	Y	wien	70	 22,149	0.1376	67.2857	german_at_news_2012_00615604
350	Und zwar nicht nur in Wien sondern in ganz Österreich!	Y	wien	70	 22,149	0.1376	74.8889	german_at_news_2012_00886222
351	Wir sind nicht gegen Europa, aber wir sind gegen diese EU.	Y	gegen	71	 20,770	0.1291	80.375	german_at_news_2012_00970149
352	Nur gegen sie zu sein, ist auch kein Programm.	Y	gegen	71	 20,770	0.1291	88.7778	german_at_news_2012_00734560
353	Schwer zu sagen, ob sie für oder gegen ihn sind.	Y	gegen	71	 20,770	0.1291	130	german_at_news_2012_00789074
354	Nichts gegen das Alter, aber das ist einfach so.	Y	gegen	71	 20,770	0.1291	153.375	german_at_news_2012_00725268
355	Spricht das nun für oder gegen ihn?	Y	gegen	71	 20,770	0.1291	157.2857	german_at_news_2012_00838673
356	Das sind um zwei Millionen mehr als unter dem Jahr.	Y	unter	72	 20,677	0.1285	54.8	german_at_news_2012_00196289
357	Das würde es unter uns nicht geben.	Y	unter	72	 20,677	0.1285	79.4286	german_at_news_2012_00206370
358	Bis zu 50 Mal im Jahr heißt es „Land unter“.	Y	unter	72	 20,677	0.1285	106.4444	german_at_news_2012_00119675
359	Selbst der über zwei Jahre alte erste Teil ist noch nicht unter 40 Euro zu haben.	Y	unter	72	 20,677	0.1285	116.8	german_at_news_2012_00800085
360	Dann bekommen die einen anderen Namen und werden unter diesem Namen in Österreich bleiben!	Y	unter	72	 20,677	0.1285	143.3077	german_at_news_2012_00151792
361	Wie war das für Sie und Ihre Familie?	Y	ihre	73	 20,590	0.1279	63.625	german_at_news_2012_00960563
362	Wie lange geben Sie sich für Ihre Arbeit Zeit?	Y	ihre	73	 20,590	0.1279	109	german_at_news_2012_00956409
363	Aber damit war ihre Kunst auch schon zu Ende.	Y	ihre	73	 20,590	0.1279	113.8889	german_at_news_2012_00003171
364	Alles im Leben hat seine Zeit, und jede Zeit hat ihre Menschen.	Y	ihre	73	 20,590	0.1279	125.2	german_at_news_2012_00026083
365	So sehen Sie Ihre Stadt mal von einer ganz anderen Seite!	Y	ihre	73	 20,590	0.1279	130.0909	german_at_news_2012_00830606
366	Er kann es, und er wird es können.	Y	können	74	 20,247	0.1258	35.6667	german_at_news_2012_00440131
367	Der würde das aber auch in Wien mit der SPÖ können.	Y	können	74	 20,247	0.1258	54.1	german_at_news_2012_00268439
368	Aber er weiß, dass er das nicht können wird.	Y	können	74	 20,247	0.1258	65.25	german_at_news_2012_00005754
369	Und was andere Menschen können, kann er auch.	Y	können	74	 20,247	0.1258	67.875	german_at_news_2012_00883228
370	Können Sie doch mit einem der zwei besser?	Y	können	74	 20,247	0.1258	79	german_at_news_2012_00641726
371	Heute sind es nur noch rund 50 Prozent.	Y	prozent	75	 20,120	0.125	62.7143	german_at_news_2012_00536523
372	Und nach fünf Jahren sind es immer noch 73 Prozent.	Y	prozent	75	 20,120	0.125	64.6667	german_at_news_2012_00879465
373	Vor fünf Jahren waren es nur 60 Prozent.	Y	prozent	75	 20,120	0.125	83.5714	german_at_news_2012_00914058
374	Das wollen aber nur 17 Prozent der Frauen.	Y	prozent	75	 20,120	0.125	84.1429	german_at_news_2012_00206056
375	Ob das dann fünf Prozent sind oder auch mehr, ist eine andere Frage.	Y	prozent	75	 20,120	0.125	87.5385	german_at_news_2012_00737295
376	Nur in Wien gibt es die noch nicht.	Y	gibt	76	 20,099	0.1249	34.25	german_at_news_2012_00734860
377	In Österreich gibt es so etwas nicht.“	Y	gibt	76	 20,099	0.1249	50.8571	german_at_news_2012_00604894
378	Es gibt nur uns, und wir haben nur uns.	Y	gibt	76	 20,099	0.1249	52.1429	german_at_news_2012_00457878
379	So etwas gibt es nur noch in Österreich.	Y	gibt	76	 20,099	0.1249	53.75	german_at_news_2012_00821945
380	Gibt es das in den USA nicht?	Y	gibt	76	 20,099	0.1249	63.1429	german_at_news_2012_00515550
381	Es war immer so, und es wird immer so sein.	Y	immer	77	 19,967	0.1241	38.1429	german_at_news_2012_00470597
382	Und was nicht war, kann immer noch sein.	Y	immer	77	 19,967	0.1241	46.375	german_at_news_2012_00883504
383	Ich werde immer für sie da sein.	Y	immer	77	 19,967	0.1241	62.5714	german_at_news_2012_00561319
384	Ich bin auch nicht immer so wie jetzt.“	Y	immer	77	 19,967	0.1241	64.375	german_at_news_2012_00547505
385	Und nach fünf Jahren sind es immer noch 73 Prozent.	Y	immer	77	 19,967	0.1241	64.6667	german_at_news_2012_00879465
386	Er kann machen, was er will, er hat seine Millionen.	Y	seine	78	 19,689	0.1223	80.25	german_at_news_2012_00440147
387	Das ist nicht seine Welt, das weiß er jetzt.	Y	seine	78	 19,689	0.1223	89	german_at_news_2012_00179679
388	Und vor allem: Ohne seine Frau und die drei Kinder.	Y	seine	78	 19,689	0.1223	100.3333	german_at_news_2012_00882960
389	Doch dieser will seine Frau nicht zurück.	Y	seine	78	 19,689	0.1223	117	german_at_news_2012_00384906
390	Alles im Leben hat seine Zeit, und jede Zeit hat ihre Menschen.	Y	seine	78	 19,689	0.1223	125.2	german_at_news_2012_00026083
391	Und das ist nur der Anfang vom Ende!	Y	vom	79	 19,261	0.1197	94.5	german_at_news_2012_00870622
392	Das habe ich nicht gemacht vom ersten Spiel weg.	Y	vom	79	 19,261	0.1197	142.5556	german_at_news_2012_00172573
393	Vielleicht ist es der Anfang vom Ende.	Y	vom	79	 19,261	0.1197	155.7143	german_at_news_2012_00901432
394	Vom Anfang vom Ende aber sehr viele.	Y	vom	79	 19,261	0.1197	158.8333	german_at_news_2012_00904773
395	Das Geld dafür müsse vom Land kommen.	Y	vom	79	 19,261	0.1197	177.5714	german_at_news_2012_00170273
396	Das kann und soll aber nicht sein.	Y	soll	80	 19,002	0.1181	37.1429	german_at_news_2012_00181436
397	So soll es sein, so wird es sein.	Y	soll	80	 19,002	0.1181	43.6	german_at_news_2012_00831368
398	“Das ist gut und so soll es auch bleiben.”	Y	soll	80	 19,002	0.1181	69.1111	german_at_news_2012_00178820
399	Vor dem, was ist, was noch kommt, was aus ihnen werden soll.	Y	soll	80	 19,002	0.1181	70.7	german_at_news_2012_00913140
400	Aber was soll ich mit diesen Millionen?	Y	soll	80	 19,002	0.1181	76.1429	german_at_news_2012_00011118
401	Und es wird sie auch in 20 Jahren noch geben.	Y	jahren	81	 18,579	0.1154	39.5556	german_at_news_2012_00875866
402	Aber seit 14 Jahren ist das nicht mehr so.	Y	jahren	81	 18,579	0.1154	40.25	german_at_news_2012_00009895
403	Und den hatte ich den ersten zwei Jahren auch.	Y	jahren	81	 18,579	0.1154	55.75	german_at_news_2012_00871883
404	Das war auch in den vergangenen zwei Jahren so.	Y	jahren	81	 18,579	0.1154	61.1111	german_at_news_2012_00203108
405	Und nach fünf Jahren sind es immer noch 73 Prozent.	Y	jahren	81	 18,579	0.1154	64.6667	german_at_news_2012_00879465
406	Das sind um zwei Millionen mehr als unter dem Jahr.	Y	zwei	82	 18,360	0.1141	54.8	german_at_news_2012_00196289
407	Und den hatte ich den ersten zwei Jahren auch.	Y	zwei	82	 18,360	0.1141	55.75	german_at_news_2012_00871883
408	Das war auch in den vergangenen zwei Jahren so.	Y	zwei	82	 18,360	0.1141	61.1111	german_at_news_2012_00203108
409	Das macht er seit mehr als zwei Jahren.	Y	zwei	82	 18,360	0.1141	69	german_at_news_2012_00184892
410	Können Sie doch mit einem der zwei besser?	Y	zwei	82	 18,360	0.1141	79	german_at_news_2012_00641726
411	Ich werde immer für sie da sein.	Y	da	83	 18,157	0.1128	62.5714	german_at_news_2012_00561319
412	Dafür ist die Zeit noch nicht da.	Y	da	83	 18,157	0.1128	62.7143	german_at_news_2012_00138469
413	Da gibt es Menschen, für die ist das wichtig.	Y	da	83	 18,157	0.1128	76.1111	german_at_news_2012_00139865
414	Da hat er dann von mir lassen.	Y	da	83	 18,157	0.1128	77	german_at_news_2012_00140276
415	Nur bin ich heute nicht mehr da.	Y	da	83	 18,157	0.1128	78.4286	german_at_news_2012_00733355
416	Mehr dazu in Wo ist dieser Mann?	Y	dieser	84	 18,060	0.1122	93.7143	german_at_news_2012_00674316
417	Ein Ja zur EU kann kein Ja zu dieser Politik sein.	Y	dieser	84	 18,060	0.1122	97.9	german_at_news_2012_00420122
418	Nur gibt es die in dieser Form nicht.	Y	dieser	84	 18,060	0.1122	103.75	german_at_news_2012_00734588
419	Doch dieser will seine Frau nicht zurück.	Y	dieser	84	 18,060	0.1122	117	german_at_news_2012_00384906
420	Mit den beiden Menschen, die ich am meisten liebe auf dieser Welt.	Y	dieser	84	 18,060	0.1122	130.5	german_at_news_2012_00686229
421	Sie haben keine Zeit für die Kinder.	Y	keine	85	 17,965	0.1116	69	german_at_news_2012_00807107
422	Sie haben keine Wahl, so ist es“!	Y	keine	85	 17,965	0.1116	99.1429	german_at_news_2012_00807106
423	Keine Frage: Die ÖVP ist wieder wer im Land.	Y	keine	85	 17,965	0.1116	100.4444	german_at_news_2012_00633521
424	Aber wir sind auch keine kleinen Kinder mehr.	Y	keine	85	 17,965	0.1116	108.125	german_at_news_2012_00012015
425	Weil ich einfach keine Zeit mehr hatte.	Y	keine	85	 17,965	0.1116	109.1429	german_at_news_2012_00931222
426	Damit wollen wir es für heute gut sein lassen.	Y	damit	86	 17,907	0.1113	90.1111	german_at_news_2012_00148692
427	So ein Problem haben wir damit auch nicht.	Y	damit	86	 17,907	0.1113	96.5	german_at_news_2012_00821533
428	Halten Sie nur andere damit nicht zu sehr auf.	Y	damit	86	 17,907	0.1113	98.7778	german_at_news_2012_00527660
429	Aber das musste sein, damit aus mir wurde, was ich bin.	Y	damit	86	 17,907	0.1113	100.5455	german_at_news_2012_00003779
430	Auch wenn er für sich selbst damit kein Problem hat.	Y	damit	86	 17,907	0.1113	101.1	german_at_news_2012_00072762
431	Aber seit 14 Jahren ist das nicht mehr so.	Y	seit	87	 17,876	0.1111	40.25	german_at_news_2012_00009895
432	Das macht er seit mehr als zwei Jahren.	Y	seit	87	 17,876	0.1111	69	german_at_news_2012_00184892
433	UND ALLES hat mit der FPÖ-seit86 zu tun.	Y	seit	87	 17,876	0.1111	91.3333	german_at_news_2012_00867051
434	Seit etwa einer Woche allerdings nicht mehr.	Y	seit	87	 17,876	0.1111	115	german_at_news_2012_00797850
435	Auch ihr gehe es nicht gut - und das seit zwei Jahren.	Y	seit	87	 17,876	0.1111	118	german_at_news_2012_00067828
436	Das werden aber nicht alle gewesen sein.“	Y	alle	88	 17,745	0.1103	68.7143	german_at_news_2012_00204879
437	Das sind aber noch lange nicht alle.	Y	alle	88	 17,745	0.1103	70.8571	german_at_news_2012_00195683
438	Einer für alle oder allen für einen.	Y	alle	88	 17,745	0.1103	77.6667	german_at_news_2012_00412501
439	Nun wissen wir aber alle, dass das Leben viel mehr ist.	Y	alle	88	 17,745	0.1103	89.6364	german_at_news_2012_00732806
440	Ein Muss für alle Fans und die, die es noch werden wollen!	Y	alle	88	 17,745	0.1103	96.6364	german_at_news_2012_00421993
441	Ist das in Wien bereits ein Thema?	Y	bereits	89	 17,648	0.1097	67.2857	german_at_news_2012_00615604
442	Nach dem zweiten Jahr sind es bereits 70 Prozent.	Y	bereits	89	 17,648	0.1097	88.5	german_at_news_2012_00705541
443	Und das bereits in den kommenden drei Jahren.	Y	bereits	89	 17,648	0.1097	106.5	german_at_news_2012_00870053
444	Nun sind die beiden bereits bei der Gruppe.	Y	bereits	89	 17,648	0.1097	125.5	german_at_news_2012_00732189
445	NEWS: Sie sind also bereits eine Familie?	Y	bereits	89	 17,648	0.1097	129.2857	german_at_news_2012_00722235
446	Das war auch beim iPhone 4 schon so.	Y	beim	90	 17,405	0.1082	145	german_at_news_2012_00203080
447	Aber beim ersten Mal habe ich mich schon gefragt: Was ist denn das?	Y	beim	90	 17,405	0.1082	160.5385	german_at_news_2012_00002899
448	Ja, genau dann ist wieder alles beim alten.	Y	beim	90	 17,405	0.1082	175	german_at_news_2012_00617644
449	Für mich stellt sich allerdings die Frage: Was ist der Punkt, wenn es beim zweiten Mal schon keine Bedeutung mehr hat?	Y	beim	90	 17,405	0.1082	182.7143	german_at_news_2012_00499212
450	Ich würde ihr gerne beim Arbeiten zu sehen.	Y	beim	90	 17,405	0.1082	190.875	german_at_news_2012_00562514
451	Das sind um zwei Millionen mehr als unter dem Jahr.	Y	jahr	91	 17,371	0.1079	54.8	german_at_news_2012_00196289
452	In diesem Jahr werden es viel mehr sein.	Y	jahr	91	 17,371	0.1079	60.375	german_at_news_2012_00595590
453	Und wir sind jetzt ein Jahr dort.	Y	jahr	91	 17,371	0.1079	67.8571	german_at_news_2012_00885609
454	Dann kam das Jahr 1968, und aus war es.	Y	jahr	91	 17,371	0.1079	69	german_at_news_2012_00152924
455	So viel wie noch nie in diesem Jahr.	Y	jahr	91	 17,371	0.1079	87.75	german_at_news_2012_00832449
456	Wir haben nur ein Leben und das ist hier und jetzt!	Y	hier	92	 17,142	0.1065	52.7	german_at_news_2012_00966221
457	Sie ist nicht hier, weil sie muss, sondern weil sie will.	Y	hier	92	 17,142	0.1065	76.25	german_at_news_2012_00809240
458	Und also leben sie hier bis heute.	Y	hier	92	 17,142	0.1065	89.1429	german_at_news_2012_00867180
459	Hier gibt es noch viel zu tun.	Y	hier	92	 17,142	0.1065	93.7143	german_at_news_2012_00538904
460	Nichts bleibt hier von dem über, was sie dort war.	Y	hier	92	 17,142	0.1065	94.8	german_at_news_2012_00725126
461	Die hat er jetzt auch in Österreich.	Y	jetzt	93	 17,072	0.1061	33.8571	german_at_news_2012_00311372
462	Wir haben nur ein Leben und das ist hier und jetzt!	Y	jetzt	93	 17,072	0.1061	52.7	german_at_news_2012_00966221
463	Ich bin auch nicht immer so wie jetzt.“	Y	jetzt	93	 17,072	0.1061	64.375	german_at_news_2012_00547505
464	“Das ist ein Thema, aber nicht jetzt.	Y	jetzt	93	 17,072	0.1061	65.1429	german_at_news_2012_00178385
465	Aber das jetzt, das war selbst ihr zu viel.	Y	jetzt	93	 17,072	0.1061	65.875	german_at_news_2012_00003671
466	Sie wird das nicht sehr lange haben.	Y	sehr	94	 16,614	0.1032	69	german_at_news_2012_00816830
467	Ist das nicht noch immer sehr wenig?	Y	sehr	94	 16,614	0.1032	72.5714	german_at_news_2012_00615681
468	Und heute geht es uns noch sehr gut.	Y	sehr	94	 16,614	0.1032	76.875	german_at_news_2012_00876800
469	Heute ist es sehr einfach, es sich sehr einfach zu machen.	Y	sehr	94	 16,614	0.1032	79.625	german_at_news_2012_00535870
470	Weil es ist ja doch sehr, sehr (.	Y	sehr	94	 16,614	0.1032	79.8333	german_at_news_2012_00931097
471	Und den hatte ich den ersten zwei Jahren auch.	Y	hatte	95	 16,047	0.0997	55.75	german_at_news_2012_00871883
472	Das hatte es noch nie gegeben, und das wird es auch nie wieder geben.	Y	hatte	95	 16,047	0.0997	101	german_at_news_2012_00173706
473	Weil ich einfach keine Zeit mehr hatte.	Y	hatte	95	 16,047	0.0997	109.1429	german_at_news_2012_00931222
474	Nein, ist sie nicht, aber ich würde es nicht so sehen, denn er hatte noch viel vor.	Y	hatte	95	 16,047	0.0997	110.25	german_at_news_2012_00718055
475	Wer Zeit hatte, war an diesem Sonntag mit dabei.	Y	hatte	95	 16,047	0.0997	118.1111	german_at_news_2012_00949926
476	Wir sind doch noch in Österreich oder etwa nicht?	Y	doch	96	 15,973	0.0993	56.1111	german_at_news_2012_00969727
477	Das kann ja dann doch nicht sein, oder?	Y	doch	96	 15,973	0.0993	60.75	german_at_news_2012_00181240
478	Doch das ist nur der eine Teil.	Y	doch	96	 15,973	0.0993	64.5714	german_at_news_2012_00383619
479	Doch das ist nur eine Frage der Zeit.	Y	doch	96	 15,973	0.0993	69.375	german_at_news_2012_00383621
480	Das kann es doch nicht gewesen sein?	Y	doch	96	 15,973	0.0993	71.7143	german_at_news_2012_00181172
