ORDER	SENTENCE	STATUS	WORD	RANK	COUNT	COUNT_REL	INDEX	ID
481	Aber die neue Frau will das nicht.	Y	neue	97	 15,878	0.0987	66.1429	german_at_news_2012_00004779
482	Es wird viel zu tun geben für eine neue Regierung.	Y	neue	97	 15,878	0.0987	98.9	german_at_news_2012_00472147
483	Geld für eine neue Ausstellung ist aber nicht da.	Y	neue	97	 15,878	0.0987	118.6667	german_at_news_2012_00507549
484	Genau für die kommt jetzt der neue Freitag.	Y	neue	97	 15,878	0.0987	129.25	german_at_news_2012_00509558
485	Auch in der Liebe gibt es wieder eine neue Chance.	Y	neue	97	 15,878	0.0987	131.3	german_at_news_2012_00068577
486	Ab 2013 wird das dann auch der Fall sein.	Y	ab	98	 15,687	0.0975	69.375	german_at_news_2012_00000725
487	Ab da gilt sie auch in Österreich.	Y	ab	98	 15,687	0.0975	88.4286	german_at_news_2012_00000988
488	Und wer sagt, dass ab 2024 alles besser ist?	Y	ab	98	 15,687	0.0975	122	german_at_news_2012_00884881
489	Dabei kommt es auf das Ergebnis und nicht auf einige Wochen auf oder ab an.	Y	ab	98	 15,687	0.0975	126.8462	german_at_news_2012_00133152
490	Ab sofort geht es hier auch um das Leben mit Kindern in der Stadt.	Y	ab	98	 15,687	0.0975	133.8571	german_at_news_2012_00014329
491	Nicht jeder kann alles, das ist nun einmal so.	Y	nun	99	 15,399	0.0957	85.2222	german_at_news_2012_00724063
492	Nun wissen wir aber alle, dass das Leben viel mehr ist.	Y	nun	99	 15,399	0.0957	89.6364	german_at_news_2012_00732806
493	Nun ist sie selbst ein Teil davon.	Y	nun	99	 15,399	0.0957	107.1429	german_at_news_2012_00731600
494	Nun will sie es doch noch einmal wissen.	Y	nun	99	 15,399	0.0957	108.375	german_at_news_2012_00732689
495	Aber das war nun einmal Kärnten hier.	Y	nun	99	 15,399	0.0957	111.8571	german_at_news_2012_00004011
496	Sie wurden in 42 Länder verkauft und waren auch im ORF zu sehen.	Y	wurden	100	 14,786	0.0919	183.75	german_at_news_2012_00817683
497	Eine Frau und zwei Kinder wurden verletzt.	Y	wurden	100	 14,786	0.0919	191.4286	german_at_news_2012_00407173
498	Da diese nicht kritisiert wurden, sind diese noch zu sehen.	Y	wurden	100	 14,786	0.0919	205.1111	german_at_news_2012_00136402
499	Wurden Sie gefragt ob Sie auf der Welt sein wollen.	Y	wurden	100	 14,786	0.0919	206.7778	german_at_news_2012_00977786
500	Wie wurden Sie hier in Wien aufgenommen?	Y	wurden	100	 14,786	0.0919	213	german_at_news_2012_00961027
501	Aber das jetzt, das war selbst ihr zu viel.	Y	ihr	101	 14,542	0.0904	65.875	german_at_news_2012_00003671
502	Doch das sieht man ihr nicht an.	Y	ihr	101	 14,542	0.0904	80.8571	german_at_news_2012_00383742
503	Ihr geht es alles andere als gut.	Y	ihr	101	 14,542	0.0904	100.1429	german_at_news_2012_00565694
504	Gehen Sie auch in der Liebe mehr auf Ihr Gegenüber ein.	Y	ihr	101	 14,542	0.0904	101.9091	german_at_news_2012_00506723
505	Auch ihr gehe es nicht gut - und das seit zwei Jahren.	Y	ihr	101	 14,542	0.0904	118	german_at_news_2012_00067828
506	Ja, es muss so gewesen sein, dass er dabei war.	Y	dabei	102	 14,303	0.0889	79.8	german_at_news_2012_00617592
507	Es wird ihm dabei nicht mehr viel im Weg stehen.	Y	dabei	102	 14,303	0.0889	95.5	german_at_news_2012_00471788
508	Dann liegt es an uns, zu sagen: Den wollen wir dabei haben.	Y	dabei	102	 14,303	0.0889	100.3333	german_at_news_2012_00153354
509	Zwei Jahre später war es doch dabei.	Y	dabei	102	 14,303	0.0889	112.1429	german_at_news_2012_00997767
510	Und weil es ohne Michael nicht geht, ist auch er auf der Bühne mit dabei.	Y	dabei	102	 14,303	0.0889	113.5333	german_at_news_2012_00883707
511	Das kann gut gehen, muss es aber nicht.	Y	muss	103	 14,125	0.0878	74.5	german_at_news_2012_00181190
512	Sie ist nicht hier, weil sie muss, sondern weil sie will.	Y	muss	103	 14,125	0.0878	76.25	german_at_news_2012_00809240
513	Man muss die Stadt so sehen, wie sie war“.	Y	muss	103	 14,125	0.0878	78.7778	german_at_news_2012_00667402
514	Ja, es muss so gewesen sein, dass er dabei war.	Y	muss	103	 14,125	0.0878	79.8	german_at_news_2012_00617592
515	Und nicht etwas macht, weil man es muss.	Y	muss	103	 14,125	0.0878	81.375	german_at_news_2012_00879703
516	Ich wollte nur eines: nicht so sein wie die anderen.	Y	eines	104	 13,933	0.0866	80	german_at_news_2012_00562167
517	Und eines steht fest: Frauen stehen auf den 159er.	Y	eines	104	 13,933	0.0866	126.4444	german_at_news_2012_00874636
518	Aber eines sei auch klar: „Kärnten ist nicht Haider“.	Y	eines	104	 13,933	0.0866	141.6667	german_at_news_2012_00005427
519	Eines kann man von dieser Frau nicht sagen: Sie hätte keine Energie.	Y	eines	104	 13,933	0.0866	169.25	german_at_news_2012_00413869
520	Nur eines lässt sich mit Sicherheit sagen.	Y	eines	104	 13,933	0.0866	203.1429	german_at_news_2012_00734209
521	Er war auf dem Weg zu seiner Familie.	Y	seiner	105	 13,834	0.086	95.875	german_at_news_2012_00449602
522	Und dass ich immer an seiner Seite bin, ist nicht mehr ganz richtig.	Y	seiner	105	 13,834	0.086	117.4615	german_at_news_2012_00871250
523	Gerade drei Prozent waren auf seiner Seite.	Y	seiner	105	 13,834	0.086	147	german_at_news_2012_00511586
524	Er hat sieben Kinder mit seiner Frau.	Y	seiner	105	 13,834	0.086	149.1429	german_at_news_2012_00437751
525	Und es ist eine Geschichte, die Folgen für das Internet und viele seiner Nutzer haben kann.	Y	seiner	105	 13,834	0.086	169.7333	german_at_news_2012_00875548
526	Es ist auch das, was ich machen will.	Y	will	106	 13,627	0.0847	50.625	german_at_news_2012_00460216
527	Mehr kann und will ich nicht machen.	Y	will	106	 13,627	0.0847	60	german_at_news_2012_00675087
528	Aber die neue Frau will das nicht.	Y	will	106	 13,627	0.0847	66.1429	german_at_news_2012_00004779
529	Sie ist nicht hier, weil sie muss, sondern weil sie will.	Y	will	106	 13,627	0.0847	76.25	german_at_news_2012_00809240
530	Er kann machen, was er will, er hat seine Millionen.	Y	will	106	 13,627	0.0847	80.25	german_at_news_2012_00440147
531	Und das geht sich nicht aus, oder?	Y	geht	107	 13,408	0.0833	32.5714	german_at_news_2012_00870261
532	So geht man mit Menschen nicht um.	Y	geht	107	 13,408	0.0833	50.5714	german_at_news_2012_00823048
533	Es geht sich alles nicht mehr aus.	Y	geht	107	 13,408	0.0833	55.1429	german_at_news_2012_00455797
534	Das geht und sollte auch so sein.	Y	geht	107	 13,408	0.0833	56.7143	german_at_news_2012_00170208
535	Wie geht man mit so etwas um?	Y	geht	107	 13,408	0.0833	57.8571	german_at_news_2012_00954891
536	Heute sind es nur noch rund 50 Prozent.	Y	heute	108	 13,197	0.082	62.7143	german_at_news_2012_00536523
537	Das ist heute nicht mehr der Fall.	Y	heute	108	 13,197	0.082	66.8571	german_at_news_2012_00178845
538	Diese Zeit habe ich heute nicht mehr.	Y	heute	108	 13,197	0.082	67.1429	german_at_news_2012_00357289
539	Aber so was würde ich heute nicht mehr machen.	Y	heute	108	 13,197	0.082	75.8889	german_at_news_2012_00010382
540	Und heute geht es uns noch sehr gut.	Y	heute	108	 13,197	0.082	76.875	german_at_news_2012_00876800
541	Noch drei, und dann noch einmal drei.	Y	drei	109	 12,980	0.0807	74.8	german_at_news_2012_00727963
542	In drei bis vier Jahren ist er nur noch einer von vielen.	Y	drei	109	 12,980	0.0807	80.0833	german_at_news_2012_00597036
543	Das war im Mai vor drei Jahren.	Y	drei	109	 12,980	0.0807	89.8571	german_at_news_2012_00204075
544	Und vor allem: Ohne seine Frau und die drei Kinder.	Y	drei	109	 12,980	0.0807	100.3333	german_at_news_2012_00882960
545	Und das bereits in den kommenden drei Jahren.	Y	drei	109	 12,980	0.0807	106.5	german_at_news_2012_00870053
546	Vor fünf Jahren waren es nur 60 Prozent.	Y	waren	110	 12,798	0.0795	83.5714	german_at_news_2012_00914058
547	Das 'Land' waren für ihn die Menschen.	Y	waren	110	 12,798	0.0795	84.8571	german_at_news_2012_00183855
548	Mehr als 80 waren es in den letzten zwei Wochen.	Y	waren	110	 12,798	0.0795	91.4444	german_at_news_2012_00673811
549	Vor fünf Jahren waren es noch 38 Prozent gewesen.	Y	waren	110	 12,798	0.0795	104	german_at_news_2012_00914057
550	Vor rund zwei Jahren waren es noch fast 500 Millionen Euro gewesen.	Y	waren	110	 12,798	0.0795	105.4545	german_at_news_2012_00914910
551	Bei ihm werden es wohl schon bis zu 45 Jahre sein.	Y	jahre	111	 12,762	0.0793	80.1	german_at_news_2012_00101399
552	Dann hat man zwei Jahre zum Arbeiten.	Y	jahre	111	 12,762	0.0793	106	german_at_news_2012_00152632
553	Präsident hat nur noch zwei Jahre zu leben.	Y	jahre	111	 12,762	0.0793	108.125	german_at_news_2012_00761390
554	Was hat diese zwei Jahre so besonders gemacht?	Y	jahre	111	 12,762	0.0793	111.625	german_at_news_2012_00925524
555	Zwei Jahre später war es doch dabei.	Y	jahre	111	 12,762	0.0793	112.1429	german_at_news_2012_00997767
556	Aus dem, was rund um mich ist.	Y	rund	112	 12,723	0.0791	61.1429	german_at_news_2012_00081696
557	Heute sind es nur noch rund 50 Prozent.	Y	rund	112	 12,723	0.0791	62.7143	german_at_news_2012_00536523
558	Vor rund zwei Jahren waren es noch fast 500 Millionen Euro gewesen.	Y	rund	112	 12,723	0.0791	105.4545	german_at_news_2012_00914910
559	Das ist das Ziel und wir stehen jeden Tag und rund um die Uhr dafür zur Verfügung“.	Y	rund	112	 12,723	0.0791	151.3333	german_at_news_2012_00176974
560	Wir arbeiten für Ihre Sicherheit Tag für Tag - rund um die Uhr.	Y	rund	112	 12,723	0.0791	162.1	german_at_news_2012_00962317
561	So geht man mit Menschen nicht um.	Y	menschen	113	 12,662	0.0787	50.5714	german_at_news_2012_00823048
562	Mir geht es nur um die Menschen.	Y	menschen	113	 12,662	0.0787	67.8571	german_at_news_2012_00681746
563	Und was andere Menschen können, kann er auch.	Y	menschen	113	 12,662	0.0787	67.875	german_at_news_2012_00883228
564	Da gibt es Menschen, für die ist das wichtig.	Y	menschen	113	 12,662	0.0787	76.1111	german_at_news_2012_00139865
565	Das 'Land' waren für ihn die Menschen.	Y	menschen	113	 12,662	0.0787	84.8571	german_at_news_2012_00183855
566	Aus dem Euro oder aus der EU?	Y	eu	114	 12,556	0.078	46.8333	german_at_news_2012_00081502
567	Wir sind nicht gegen Europa, aber wir sind gegen diese EU.	Y	eu	114	 12,556	0.078	80.375	german_at_news_2012_00970149
568	Auf der einen Seite Österreich, auf der anderen die EU.	Y	eu	114	 12,556	0.078	95.375	german_at_news_2012_00075630
569	Ein Ja zur EU kann kein Ja zu dieser Politik sein.	Y	eu	114	 12,556	0.078	97.9	german_at_news_2012_00420122
570	Wien (bzö) - „Die ÖVP ist für eine EU ohne Wenn und Aber.	Y	eu	114	 12,556	0.078	101.75	german_at_news_2012_00956994
571	Es ist eine Frage der Zeit bis das zu viel wird.	Y	viel	115	 12,548	0.078	58.1818	german_at_news_2012_00461209
572	In diesem Jahr werden es viel mehr sein.	Y	viel	115	 12,548	0.078	60.375	german_at_news_2012_00595590
573	Das war und ist einfach zu viel.	Y	viel	115	 12,548	0.078	61.2857	german_at_news_2012_00204390
574	Aber das jetzt, das war selbst ihr zu viel.	Y	viel	115	 12,548	0.078	65.875	german_at_news_2012_00003671
575	Aber es ist noch so viel mehr zu tun.	Y	viel	115	 12,548	0.078	69	german_at_news_2012_00006170
576	Aber das jetzt, das war selbst ihr zu viel.	Y	selbst	116	 12,444	0.0773	65.875	german_at_news_2012_00003671
577	Die Frage ist, was kann man noch selbst machen.	Y	selbst	116	 12,444	0.0773	81.2222	german_at_news_2012_00303554
578	Er selbst hat sich dazu auch schon bekannt.	Y	selbst	116	 12,444	0.0773	94.625	german_at_news_2012_00444009
579	Aber selbst da gibt er immer alles”, sagte der 81-Jährige.	Y	selbst	116	 12,444	0.0773	94.9	german_at_news_2012_00009921
580	Das sei nur möglich, „wenn man selbst nicht weiß, was man will“.	Y	selbst	116	 12,444	0.0773	100	german_at_news_2012_00194235
581	Wie sieht denn die dann in 20 Jahren aus?	Y	denn	117	 12,400	0.0771	77.5	german_at_news_2012_00959219
582	Denn Österreich war schon einmal Deutschland, und das nicht so gut.	Y	denn	117	 12,400	0.0771	82.3636	german_at_news_2012_00223466
583	Wie viel davon haben Sie denn schon?	Y	denn	117	 12,400	0.0771	88.2857	german_at_news_2012_00960114
584	Was haben diese Kinder denn für eine zukunft?	Y	denn	117	 12,400	0.0771	99.5	german_at_news_2012_00925344
585	Denn es kann ja nicht sein, was nicht sein darf.	Y	denn	117	 12,400	0.0771	103.625	german_at_news_2012_00220572
586	Die Wiener machen es den Deutschen aber auch nicht leicht.	Y	wiener	118	 12,276	0.0763	132.7	german_at_news_2012_00377540
587	Die Wiener haben keine andere Sorgen oder?	Y	wiener	118	 12,276	0.0763	158.1429	german_at_news_2012_00377440
588	Unterstützung kommt nun von der Wiener ÖVP.	Y	wiener	118	 12,276	0.0763	172	german_at_news_2012_00891645
589	Die Wiener ÖVP hält bei kaum zehn Prozent.	Y	wiener	118	 12,276	0.0763	183.25	german_at_news_2012_00377560
590	So soll die Wiener ÖVP mittlerweile nur noch bei neun Prozent liegen.	Y	wiener	118	 12,276	0.0763	191.1667	german_at_news_2012_00831213
591	Das ist das Ziel und wir stehen jeden Tag und rund um die Uhr dafür zur Verfügung“.	Y	uhr	119	 12,253	0.0761	151.3333	german_at_news_2012_00176974
592	Wir arbeiten für Ihre Sicherheit Tag für Tag - rund um die Uhr.	Y	uhr	119	 12,253	0.0761	162.1	german_at_news_2012_00962317
593	In der Steiermark wäre es bereits 24 Uhr gewesen.	Y	uhr	119	 12,253	0.0761	166.125	german_at_news_2012_00593639
594	Und dann kam ich erst um 22 Uhr nach Hause.	Y	uhr	119	 12,253	0.0761	169.7778	german_at_news_2012_00869588
595	AT ist ab 10 Uhr live für Sie dabei.	Y	uhr	119	 12,253	0.0761	191.25	german_at_news_2012_00058434
596	Dann sollte dem neuen Leben nichts mehr im Weg stehen.“	Y	neuen	120	 12,158	0.0755	121.9	german_at_news_2012_00153934
597	Mehr zu diesem Thema finden Sie im neuen NEWS!	Y	neuen	120	 12,158	0.0755	124.3333	german_at_news_2012_00675823
598	Wir wollen einen neuen Weg für Europa!	Y	neuen	120	 12,158	0.0755	127.4286	german_at_news_2012_00972895
599	Das ist auch in seinem neuen Buch so.	Y	neuen	120	 12,158	0.0755	132	german_at_news_2012_00176601
600	Aber kein Problem sie hat gleich wieder einen neuen.	Y	neuen	120	 12,158	0.0755	142.5556	german_at_news_2012_00008357
601	Das ist ja bei uns nicht so.	Y	uns	121	 12,154	0.0755	48.8571	german_at_news_2012_00179024
602	Es gibt nur uns, und wir haben nur uns.	Y	uns	121	 12,154	0.0755	52.1429	german_at_news_2012_00457878
603	Das ist bei uns in Österreich noch nicht der Fall.	Y	uns	121	 12,154	0.0755	56.6	german_at_news_2012_00176716
604	Das ist aber bei uns allen so.	Y	uns	121	 12,154	0.0755	65.8571	german_at_news_2012_00176277
605	Nicht bei uns und nicht erst jetzt!	Y	uns	121	 12,154	0.0755	69.6667	german_at_news_2012_00723258
606	Wenn sie ihn haben, dann ist das gut.	Y	gut	122	 11,917	0.0741	64	german_at_news_2012_00943898
607	Österreich ist nicht Deutschland, und das ist gut so.	Y	gut	122	 11,917	0.0741	66.75	german_at_news_2012_00749771
608	“Das ist gut und so soll es auch bleiben.”	Y	gut	122	 11,917	0.0741	69.1111	german_at_news_2012_00178820
609	Aber das war ja nicht gut für ihn.	Y	gut	122	 11,917	0.0741	69.375	german_at_news_2012_00004002
610	Das kann gut gehen, muss es aber nicht.	Y	gut	122	 11,917	0.0741	74.5	german_at_news_2012_00181190
611	In diesem Jahr werden es viel mehr sein.	Y	diesem	123	 11,876	0.0738	60.375	german_at_news_2012_00595590
612	So viel wie noch nie in diesem Jahr.	Y	diesem	123	 11,876	0.0738	87.75	german_at_news_2012_00832449
613	Sie ist so gut in diesem Film“.	Y	diesem	123	 11,876	0.0738	114.4286	german_at_news_2012_00809340
614	Nun kommen sie wieder nach Österreich und damit auch zum dritten mal in diesem Jahr nach Wien.	Y	diesem	123	 11,876	0.0738	116.3125	german_at_news_2012_00731690
615	Wer Zeit hatte, war an diesem Sonntag mit dabei.	Y	diesem	123	 11,876	0.0738	118.1111	german_at_news_2012_00949926
616	Aber das ist ja auch nicht ganz einfach.	Y	ganz	124	 11,771	0.0731	72.75	german_at_news_2012_00003571
617	Und zwar nicht nur in Wien sondern in ganz Österreich!	Y	ganz	124	 11,771	0.0731	74.8889	german_at_news_2012_00886222
618	Für die FPÖ oder für ganz Österreich?	Y	ganz	124	 11,771	0.0731	80.5	german_at_news_2012_00494359
619	Wie er das gemacht hat, ist nicht ganz klar.	Y	ganz	124	 11,771	0.0731	95.2222	german_at_news_2012_00954292
620	Der ist ein Beispiel für etwas, das ganz einfach nur da ist.	Y	ganz	124	 11,771	0.0731	95.3636	german_at_news_2012_00245567
621	Und den hatte ich den ersten zwei Jahren auch.	Y	ersten	125	 11,727	0.0729	55.75	german_at_news_2012_00871883
622	Hat auf den ersten Blick was für sich.	Y	ersten	125	 11,727	0.0729	123	german_at_news_2012_00529561
623	Aber wie bei einem Kind sind auch in diesem Fall die ersten Jahre besonders wichtig.	Y	ersten	125	 11,727	0.0729	127.1333	german_at_news_2012_00011654
624	In den ersten Monaten war das nicht so leicht.	Y	ersten	125	 11,727	0.0729	141.5556	german_at_news_2012_00586945
625	Das habe ich nicht gemacht vom ersten Spiel weg.	Y	ersten	125	 11,727	0.0729	142.5556	german_at_news_2012_00172573
626	In ihrem Leben hat es noch nie etwas gegeben, das zwischen sie kommen konnte.	Y	zwischen	126	 11,568	0.0719	132.0714	german_at_news_2012_00601204
627	Wissen Sie, es ist zwischen uns ganz einfach eine ganz große Liebe.	Y	zwischen	126	 11,568	0.0719	146.4545	german_at_news_2012_00973722
628	Das hätte ich mir auch zwischen den Frauen erwartet.	Y	zwischen	126	 11,568	0.0719	157	german_at_news_2012_00173721
629	Doch in den vergangenen Monaten soll sich mehr zwischen den beiden entwickelt haben.	Y	zwischen	126	 11,568	0.0719	175.75	german_at_news_2012_00386178
630	Sie bleiben zwischen einer und drei Wochen mit ihren Familien.	Y	zwischen	126	 11,568	0.0719	201.3	german_at_news_2012_00804398
631	Das sind um zwei Millionen mehr als unter dem Jahr.	Y	millionen	127	 11,499	0.0715	54.8	german_at_news_2012_00196289
632	Aber was soll ich mit diesen Millionen?	Y	millionen	127	 11,499	0.0715	76.1429	german_at_news_2012_00011118
633	Er kann machen, was er will, er hat seine Millionen.	Y	millionen	127	 11,499	0.0715	80.25	german_at_news_2012_00440147
634	Und das alles nicht um zehn Millionen Euro!	Y	millionen	127	 11,499	0.0715	82.125	german_at_news_2012_00869960
635	Das ist ein Plus von 125 Millionen Euro.	Y	millionen	127	 11,499	0.0715	93.2857	german_at_news_2012_00178283
636	Mehr ist dazu auch nicht zu sagen.	Y	dazu	128	 11,490	0.0714	79.1429	german_at_news_2012_00675042
637	Dazu gibt es nicht mehr zu sagen.	Y	dazu	128	 11,490	0.0714	88.4286	german_at_news_2012_00210194
638	Mehr dazu in Wo ist dieser Mann?	Y	dazu	128	 11,490	0.0714	93.7143	german_at_news_2012_00674316
639	Er selbst hat sich dazu auch schon bekannt.	Y	dazu	128	 11,490	0.0714	94.625	german_at_news_2012_00444009
640	Das ist alles, was ich dazu sagen kann.	Y	dazu	128	 11,490	0.0714	97.25	german_at_news_2012_00176438
641	Es ist eine Frage der Zeit bis das zu viel wird.	Y	zeit	129	 11,422	0.071	58.1818	german_at_news_2012_00461209
642	Aber das ist wohl auch an der Zeit.	Y	zeit	129	 11,422	0.071	62	german_at_news_2012_00003665
643	Dafür ist die Zeit noch nicht da.	Y	zeit	129	 11,422	0.071	62.7143	german_at_news_2012_00138469
644	Das ist nur eine Frage der Zeit.	Y	zeit	129	 11,422	0.071	65.5714	german_at_news_2012_00179765
645	Aber es ist eine Frage der Zeit.	Y	zeit	129	 11,422	0.071	66.1429	german_at_news_2012_00006081
646	Sie ist nicht hier, weil sie muss, sondern weil sie will.	Y	weil	130	 11,404	0.0709	76.25	german_at_news_2012_00809240
647	Weil es ist ja doch sehr, sehr (.	Y	weil	130	 11,404	0.0709	79.8333	german_at_news_2012_00931097
648	Und nicht etwas macht, weil man es muss.	Y	weil	130	 11,404	0.0709	81.375	german_at_news_2012_00879703
649	Nicht, weil die Musik so laut ist.	Y	weil	130	 11,404	0.0709	106	german_at_news_2012_00725727
650	Der andere wieder ist ein Problem, weil er ist, wie er ist.	Y	weil	130	 11,404	0.0709	107.8889	german_at_news_2012_00229215
651	Wie viele es sein werden, kann ich nicht sagen.	Y	viele	131	 11,327	0.0704	77.6667	german_at_news_2012_00960207
652	Wie viele davon werden in Wien zu sehen sein?	Y	viele	131	 11,327	0.0704	86.6667	german_at_news_2012_00960187
653	Aber es war doch ein Tag wie viele andere.	Y	viele	131	 11,327	0.0704	89.2222	german_at_news_2012_00006356
654	Es gibt viele, die nur 450 Euro bekommen, und davon kann man nicht leben.“	Y	viele	131	 11,327	0.0704	94.5385	german_at_news_2012_00458143
655	Er weiß jetzt auch, dass er besser ist als viele.”	Y	viele	131	 11,327	0.0704	104	german_at_news_2012_00450389
656	Das ist ja bei uns nicht so.	Y	ja	132	 11,235	0.0698	48.8571	german_at_news_2012_00179024
657	Das kann ja dann doch nicht sein, oder?	Y	ja	132	 11,235	0.0698	60.75	german_at_news_2012_00181240
658	Aber das war ja nicht gut für ihn.	Y	ja	132	 11,235	0.0698	69.375	german_at_news_2012_00004002
659	Es ist ja nichts mehr so, wie es einmal war.	Y	ja	132	 11,235	0.0698	71.4444	german_at_news_2012_00462350
660	Aber das kann es ja nicht gewesen sein.	Y	ja	132	 11,235	0.0698	72.125	german_at_news_2012_00003674
661	Das ist jetzt nicht nur ein Fall für, sondern auch in der Polizei.	Y	sondern	133	 11,096	0.069	71.1538	german_at_news_2012_00179127
662	Und zwar nicht nur in Wien sondern in ganz Österreich!	Y	sondern	133	 11,096	0.069	74.8889	german_at_news_2012_00886222
663	Sie ist nicht hier, weil sie muss, sondern weil sie will.	Y	sondern	133	 11,096	0.069	76.25	german_at_news_2012_00809240
664	Und das alles nicht nur in Salzburg, sondern vielleicht auch in Wien.	Y	sondern	133	 11,096	0.069	97.6364	german_at_news_2012_00869959
665	Aber die meisten Menschen machen es ja nicht für die anderen, sondern für sich selbst.	Y	sondern	133	 11,096	0.069	107.3846	german_at_news_2012_00004760
666	Erst wenn Kinder ins Spiel kommen, wird das zum Thema.	Y	ins	134	 10,480	0.0651	152.5	german_at_news_2012_00448465
667	“Er kam zwei Mal zu uns ins Haus.	Y	ins	134	 10,480	0.0651	154.5	german_at_news_2012_00440075
668	Immer wieder kommt die Polizei ins Haus.	Y	ins	134	 10,480	0.0651	162.5714	german_at_news_2012_00577123
669	Sein Vater kam vor 30 Jahren ins Land, seine Mutter zehn Jahre später.	Y	ins	134	 10,480	0.0651	214.9167	german_at_news_2012_00794705
670	Wir müssen natürlich versuchen, die Austria nicht ins Spiel kommen zu lassen.	Y	ins	134	 10,480	0.0651	230.1667	german_at_news_2012_00968609
671	Der würde das aber auch in Wien mit der SPÖ können.	Y	spö	135	 10,393	0.0646	54.1	german_at_news_2012_00268439
672	Aber was ist mit SPÖ und ÖVP?	Y	spö	135	 10,393	0.0646	57.2857	german_at_news_2012_00011065
673	Wie sieht es mit der SPÖ aus?	Y	spö	135	 10,393	0.0646	72.8571	german_at_news_2012_00959252
674	Die SPÖ hat noch sehr viel Arbeit vor sich.	Y	spö	135	 10,393	0.0646	85.1111	german_at_news_2012_00361175
675	Über ÖVP und SPÖ: Die einen sind mal weg.	Y	spö	135	 10,393	0.0646	90.2222	german_at_news_2012_00861255
676	Aber diese hat natürlich auch ihren Preis.	Y	ihren	136	 10,363	0.0644	153.5714	german_at_news_2012_00004904
677	Aber viele von uns, so wie ich auch, haben ihren eigenen Job.	Y	ihren	136	 10,363	0.0644	153.5833	german_at_news_2012_00010701
678	Sie wollen nicht weg aus ihren Ländern.	Y	ihren	136	 10,363	0.0644	159.2857	german_at_news_2012_00817289
679	Einer der ihren – hat das die ÖVP schon vergessen?	Y	ihren	136	 10,363	0.0644	169.2222	german_at_news_2012_00412074
680	Gehen Sie mehr auf Ihren Partner ein.	Y	ihren	136	 10,363	0.0644	173.7143	german_at_news_2012_00506785
681	Aber ich weiß, dass es nach wie vor Millionen Menschen gibt, die an ihrer Regierung und dem, was gerade vor sich geht, Anteil nehmen.	Y	ihrer	137	 10,303	0.064	126.087	german_at_news_2012_00007580
682	Viele von ihnen in ihrer eigenen Welt.	Y	ihrer	137	 10,303	0.064	139.4286	german_at_news_2012_00900624
683	Im Jahr 2009 hat die SPÖ etwas von ihrer Würde verloren.	Y	ihrer	137	 10,303	0.064	144.7	german_at_news_2012_00573623
684	Aber in ein, zwei Wochen kommt sie sicher wieder von ihrer Mutter zurück.	Y	ihrer	137	 10,303	0.064	145.7692	german_at_news_2012_00007943
685	Aber ich werde doch nie auf ihrer Seite stehen.	Y	ihrer	137	 10,303	0.064	146.8889	german_at_news_2012_00007598
686	Das geben Sie aus, und mehr ist nicht.	Y	geben	138	 10,266	0.0638	34.25	german_at_news_2012_00169580
687	Und es wird sie auch in 20 Jahren noch geben.	Y	geben	138	 10,266	0.0638	39.5556	german_at_news_2012_00875866
688	Das kann und wird es nicht mehr geben.	Y	geben	138	 10,266	0.0638	40.375	german_at_news_2012_00181437
689	Aber einmal so und einmal so,dass sollte es nicht geben.	Y	geben	138	 10,266	0.0638	66.6667	german_at_news_2012_00005485
690	In Zukunft wird es das nicht mehr geben.	Y	geben	138	 10,266	0.0638	68.25	german_at_news_2012_00613811
691	Und vor allem: Wer hat das Geld?	Y	allem	139	 10,205	0.0634	89.4286	german_at_news_2012_00882972
692	Und vor allem: Ohne seine Frau und die drei Kinder.	Y	allem	139	 10,205	0.0634	100.3333	german_at_news_2012_00882960
693	Vor allem in der ÖVP kommen hier noch einige Millionen dazu.	Y	allem	139	 10,205	0.0634	108.3636	german_at_news_2012_00911667
694	Es ist richtig, es könnte von allem noch mehr sein.	Y	allem	139	 10,205	0.0634	110.2222	german_at_news_2012_00463183
695	Es sei richtig, es könnte von allem noch mehr sein.	Y	allem	139	 10,205	0.0634	116	german_at_news_2012_00467449
696	Wir sind doch noch in Österreich oder etwa nicht?	Y	etwa	140	 10,061	0.0625	56.1111	german_at_news_2012_00969727
697	Aber in etwa könnte das so gewesen sein.	Y	etwa	140	 10,061	0.0625	90.125	german_at_news_2012_00007949
698	Seit etwa einer Woche allerdings nicht mehr.	Y	etwa	140	 10,061	0.0625	115	german_at_news_2012_00797850
699	Also müssen wir etwa über das Internet am besten sein.	Y	etwa	140	 10,061	0.0625	130.2	german_at_news_2012_00034119
700	Dazu habe ich eine Geschichte, die das Thema auf den Punkt bringt: Es war vor etwa zwei Jahren.	Y	etwa	140	 10,061	0.0625	158.5556	german_at_news_2012_00210239
701	Nicht mit mir und nicht mit der ÖVP.“	Y	övp	141	 10,053	0.0625	53.5	german_at_news_2012_00724212
702	Aber was ist mit SPÖ und ÖVP?	Y	övp	141	 10,053	0.0625	57.2857	german_at_news_2012_00011065
703	Das ist mit der ÖVP nicht möglich.	Y	övp	141	 10,053	0.0625	66.1429	german_at_news_2012_00179449
704	Über ÖVP und SPÖ: Die einen sind mal weg.	Y	övp	141	 10,053	0.0625	90.2222	german_at_news_2012_00861255
