ORDER	SENTENCE	STATUS	WORD	RANK	COUNT	COUNT_REL	INDEX	ID
22001	Schon wieder ging ein iPhone 4 in Flammen auf Geben Sie hier die E-Mail-Adresse des Empfängers ein (z.B. xy@z.com). Mehrere Empfänger werden durch Kommata getrennt.	Y	flammen	1869	    334	0.0021	298.2593	german_at_news_2012_00786334
22002	Es würde natürlich nichts ändern, aber es ist sehr interessant, all das hier zu tun, während die Welt in Flammen steht.	Y	flammen	1869	    334	0.0021	345.65	german_at_news_2012_00472506
22003	Auch in Italien ging der Kampf gegen die Flammen weiter.	Y	flammen	1869	    334	0.0021	409.1	german_at_news_2012_00069055
22004	Natürlich geht es uns immer noch so gut, dass bei uns nicht Plätze besetzt werden oder gar Autos in Flammen aufgehen, aber: Müssen wir darauf warten?	Y	flammen	1869	    334	0.0021	447.12	german_at_news_2012_00713662
22005	Bis 29 Länder im Krieg waren, da stand die heutige EU in Flammen.	Y	flammen	1869	    334	0.0021	505.3333	german_at_news_2012_00116811
22006	Einen Monat später war das ganze Geld in Folge der Flöttl-Geschäfte weg.	Y	flöttl	1869	    334	0.0021	477.9231	german_at_news_2012_00410735
22007	Flöttl: Ich kann nur sagen: Die Geschäfte waren damals sehr erfolgreich, wurden allerdings eingestellt.	Y	flöttl	1869	    334	0.0021	493.2857	german_at_news_2012_00483588
22008	Hätte Flöttl sich an die Verträge gehalten, wäre nichts passiert.	Y	flöttl	1869	    334	0.0021	638.2	german_at_news_2012_00530227
22009	Elsner hielt dagegen: „Welche Positionen Dr. Flöttl gehalten hat, wusste die Bank nicht, das hat sie auch nicht interessiert.	Y	flöttl	1869	    334	0.0021	715.3529	german_at_news_2012_00429126
22010	Flöttl war laut Protokoll bereit, sein Vermögen der BAWAG zu übertragen.	Y	flöttl	1869	    334	0.0021	801.1818	german_at_news_2012_00483604
22011	Und sie tun es auch (laut Umfrage hat es jeder Fünfte schon einmal getan).	Y	fünfte	1869	    334	0.0021	391.2308	german_at_news_2012_00881453
22012	Im vergangenen Jahr ist jedes fünfte neue Unternehmen in Niederösterreich gegründet worden.	Y	fünfte	1869	    334	0.0021	451.9167	german_at_news_2012_00581968
22013	Mehr als zwanzig Prozent der Bevölkerung, also jeder fünfte Österreicher, sind von diesem Phänomen betroffen.	Y	fünfte	1869	    334	0.0021	533.9333	german_at_news_2012_00674093
22014	Das liebe Geld: Jeder fünfte Arbeitnehmer will Job wechseln Wiener Zeitung - ‎vor 4 Stunden‎ Wien.	Y	fünfte	1869	    334	0.0021	604.3571	german_at_news_2012_00184390
22015	Ist auch diese gleich, dann entscheidet die höhere fünfte Karte.	Y	fünfte	1869	    334	0.0021	697.5	german_at_news_2012_00615422
22016	Ich möchte dem Kleinen im ersten Lebensjahr diese Möglichkeit geben.	Y	lebensjahr	1869	    334	0.0021	368.9	german_at_news_2012_00557769
22017	Aufgenommen wurden Kinder im Alter von 14 Tagen bis zum zweiten Lebensjahr.	Y	lebensjahr	1869	    334	0.0021	455.3636	german_at_news_2012_00078326
22018	Außerdem ist die Phase zwischen dem ersten und dem dritten Lebensjahr für die Entwicklung entscheidend, die Kinder lernen beim Spielen und Tanzen.	Y	lebensjahr	1869	    334	0.0021	555.5	german_at_news_2012_00085882
22019	Ich habe zwischen meiner Geburt und meinem 18. Lebensjahr in diesem Ort gelebt.	Y	lebensjahr	1869	    334	0.0021	636.25	german_at_news_2012_00554716
22020	Achten Sie darauf, dass Ihr Kind vor dem fünften Lebensjahr einen Kindergarten besucht.	Y	lebensjahr	1869	    334	0.0021	720.3846	german_at_news_2012_00015065
22021	Da muss man darüber nachdenken, warum diese Leute nicht Teil dieser Gesellschaft sein wollen oder können.	Y	nachdenken	1869	    334	0.0021	287.875	german_at_news_2012_00149178
22022	Wenn ich nichts mehr umsetzen kann, reden wir über etwas anderes, dann werde ich über diese Frage noch einmal nachdenken.	Y	nachdenken	1869	    334	0.0021	388.0556	german_at_news_2012_00941183
22023	Privat sollten Sie nicht zu lange nachdenken, sondern schnell zur Stelle sein.	Y	nachdenken	1869	    334	0.0021	437.8333	german_at_news_2012_00762656
22024	Wir werden nun in aller Ruhe gemeinsam über eine Zusammenarbeit in anderer Form nachdenken.”	Y	nachdenken	1869	    334	0.0021	473.7692	german_at_news_2012_00972267
22025	Dabei könnte man auch über neue Formen der Präsentation nachdenken.	Y	nachdenken	1869	    334	0.0021	535.2	german_at_news_2012_00133242
22026	Wird es in nächster Zeit einen Film von oder mit Ihnen geben?	Y	nächster	1869	    334	0.0021	251	german_at_news_2012_00963522
22027	Mein Ziel ist, die Partei in nächster Zeit für junge Menschen interessant zu machen.	Y	nächster	1869	    334	0.0021	398.5	german_at_news_2012_00677657
22028	An die 1160 Wohnungen können damit in nächster Zeit gebaut werden.	Y	nächster	1869	    334	0.0021	530.3	german_at_news_2012_00048506
22029	Dazu stellte Bures die Frage: „Wer wird als nächster höhere Beiträge zahlen müssen?	Y	nächster	1869	    334	0.0021	626.1538	german_at_news_2012_00211600
22030	Als nächster Schritt ist die Errichtung eines 4-Sterne-Hotels geplant.	Y	nächster	1869	    334	0.0021	840.4	german_at_news_2012_00033043
22031	In Österreich sind es aber erst 1,3 Prozent, rechnet die OECD für 2008 vor.	Y	oecd	1869	    334	0.0021	315.0833	german_at_news_2012_00605223
22032	Der OECD Bericht zeigt, dass Österreich hier auf dem richtigen Weg ist.	Y	oecd	1869	    334	0.0021	374.9167	german_at_news_2012_00253550
22033	Für die Ausbildung der 10- bis 19-Jährigen investiert Österreich 13 % mehr, als dies im OECD-Durchschnitt der Fall ist.	Y	oecd	1869	    334	0.0021	423.0625	german_at_news_2012_00493722
22034	Keine Arbeit, aber auch nicht mehr in der Ausbildung - laut OECD-Studie gibt es in Österreich überdurchschnittlich viele Teenager, die NICHTS tun!	Y	oecd	1869	    334	0.0021	426.0476	german_at_news_2012_00633318
22035	Etwas besser sieht es bei den weiblichen Jugendlichen aus, von denen in Österreich 9,4 Prozent nicht in Ausbildung waren bzw. keinen Job hatten (OECD-Mittel: 9,2 Prozent).	Y	oecd	1869	    334	0.0021	427.7391	german_at_news_2012_00473475
22036	Von 28. Juli bis 11. Oktober 2003 wird daher der „OeNB-Bus“ unter dem Motto „Sicher mit dem Euro“ durch ganz Österreich touren“, so Dir.	Y	oenb	1869	    334	0.0021	451.7143	german_at_news_2012_00906095
22037	Der OeNB-Chef hat seinen Job gut gemacht, dennoch könnte er ihn verlieren.	Y	oenb	1869	    334	0.0021	451.8462	german_at_news_2012_00253555
22038	Tatsächlich soll bei den jüngsten Unterredungen aber nicht nur die Verfassung der österreichischen Geschäftsbanken, sondern vor allem auch die der OeNB selbst zur Sprache gekommen sein.	Y	oenb	1869	    334	0.0021	500.5417	german_at_news_2012_00849026
22039	Das teilte die OeNB am Montag in einer Aussendung mit.	Y	oenb	1869	    334	0.0021	514.9	german_at_news_2012_00199855
22040	Und nicht nur das: Die OeNB errechnete für das Folgejahr 2009 einen Gewinn in Höhe von 225 Millionen Euro.	Y	oenb	1869	    334	0.0021	544.25	german_at_news_2012_00879731
22041	Wir sollten gemeinsam an einer Perspektive für diese Menschen arbeiten“, hielt Gusenbauer fest.	Y	perspektive	1869	    334	0.0021	396	german_at_news_2012_00970521
22042	Unser Ziel ist es, diesen jungen Menschen eine Plattform bzw. Perspektive zu geben um sich zu entwickeln.	Y	perspektive	1869	    334	0.0021	421	german_at_news_2012_00888653
22043	Und das funktioniert nur, wenn man sich eng an die Perspektive der Betroffenen hält.	Y	perspektive	1869	    334	0.0021	436.0714	german_at_news_2012_00870223
22044	Wenn eine Perspektive zur Lösung in Aussicht ist, wird das kein Problem sein“, sagte Molterer.	Y	perspektive	1869	    334	0.0021	449.6667	german_at_news_2012_00939428
22045	Auch die Perspektive „moderne Arbeit/Arbeitsmarkt“ stellt einen Schwerpunkt dar.	Y	perspektive	1869	    334	0.0021	777.3	german_at_news_2012_00064401
22046	Das und viel mehr findet sich im Oberösterreich-Online-Shop.	Y	shop	1869	    334	0.0021	350.6	german_at_news_2012_00200984
22047	Das ist wie bei einer Shop-Eröffnung: Es braucht Zeit, bis die Leute wissen, dass es den neuen Shop gibt, und bis sie sich daran gewöhnt haben, dort einzukaufen.	Y	shop	1869	    334	0.0021	374.5385	german_at_news_2012_00180431
22048	Auf dem, was bisher vor allem online verkauft wurde, kann man jetzt in diesem Shop Probe liegen.	Y	shop	1869	    334	0.0021	391.7647	german_at_news_2012_00074754
22049	Schon jetzt kann das Gerät über den A1 Online-Shop (www.	Y	shop	1869	    334	0.0021	433.8182	german_at_news_2012_00785624
22050	Wir sind kein Ein-Euro-Shop“, sag' ich dann immer.	Y	shop	1869	    334	0.0021	441	german_at_news_2012_00970076
22051	Aber nicht nur bei uns ist dieses Problem weit verbreitet,auch in allen Herren Ländern dieser Welt!	Y	verbreitet	1869	    334	0.0021	317.3529	german_at_news_2012_00009249
22052	Von dort aus soll sich die Idee der Weihnachtskrippe dann über die ganze Welt verbreitet haben.	Y	verbreitet	1869	    334	0.0021	399.2667	german_at_news_2012_00908103
22053	Im Mittelalter waren sie in ganz Europa verbreitet, heute gibt es nur noch wenige Regionen, die diese Tradition am Leben erhalten.	Y	verbreitet	1869	    334	0.0021	402.3333	german_at_news_2012_00577366
22054	Es war so lange Frieden zwischen uns und dann verbreitet sie nun wieder solche Geschichten.“	Y	verbreitet	1869	    334	0.0021	433.1333	german_at_news_2012_00470875
22055	Deshalb wird es eine Zukunft geben, als eine Partei, die jene Elemente, die wir in der Steiermark entwickelt haben, auch österreichweit verbreitet.	Y	verbreitet	1869	    334	0.0021	442.3	german_at_news_2012_00272295
22056	Innerhalb von vier Tagen stehen zwei ganze schwere Spiele für den FC Raiffeisen Au auf dem Programm.	Y	au	1870	    333	0.0021	537.8235	german_at_news_2012_00603929
22057	Dabei wurde nach einem Versicherungsschutz für eine 19-jährige Studentin, die für rund ein Jahr in den USA als Au-Pair-Mädchen arbeitet, gefragt.	Y	au	1870	    333	0.0021	556.1364	german_at_news_2012_00135345
22058	Heute, so sagt er, denke er etwa über ein Kraftwerk in der Hainburger Au ganz anders.	Y	au	1870	    333	0.0021	573.6	german_at_news_2012_00536626
22059	Ich möchte mal sehen was passiert wenn man sagt ich schmeisse meine Elektrogeräre in die Au oder in die Donau.	Y	au	1870	    333	0.0021	585.0588	german_at_news_2012_00557897
22060	Die Niederösterreicher setzten sich in der „Alten Au“ gegen den Tabellenzweiten Browser zeigt »Iframes« nicht an.	Y	au	1870	    333	0.0021	605.3125	german_at_news_2012_00330674
22061	Das nehmen wir als einen der klaren Aufträge aus dieser Wahl mit.	Y	aufträge	1870	    333	0.0021	379.3333	german_at_news_2012_00186908
22062	Das bringt Aufträge für unsere Unternehmen und damit heimische Arbeitsplätze, schon jetzt.	Y	aufträge	1870	    333	0.0021	466.1667	german_at_news_2012_00163067
22063	Für den ÖVP-Generalsekretär ist es offensichtlich, dass die Aufträge direkt aus dem Ministerium gekommen seien.	Y	aufträge	1870	    333	0.0021	494.5	german_at_news_2012_00493115
22064	Dieses Thema muss sehr ernsthaft behandelt werden, schließlich machen die öffentlichen Aufträge 14 Prozent des gesamten BIP aus“, schloss die EU-Abgeordnete.	Y	aufträge	1870	    333	0.0021	583.65	german_at_news_2012_00355261
22065	Außerdem sollten Bund, Land und Gemeinden Aufträge nur an Firmen vergeben, in denen ordentlich gearbeitet werde.	Y	aufträge	1870	    333	0.0021	656.75	german_at_news_2012_00087059
22066	Bei einem Weg jedoch könne die SPÖ gewinnen, nämlich dem des „zuerst Die derzeitige Aufgabe der SPÖ sei es, sich bewusst zu sein, dass „wir jetzt schon vor der nächsten Wahl stehen“, so Einem weiter.	Y	derzeitige	1870	    333	0.0021	283.0645	german_at_news_2012_00100242
22067	Es gibt nur zwei Gründe für die derzeitige Situation der EU.	Y	derzeitige	1870	    333	0.0021	385.4545	german_at_news_2012_00457889
22068	Die derzeitige Regierung macht das nicht, also macht es die künftige.	Y	derzeitige	1870	    333	0.0021	474.3333	german_at_news_2012_00291800
22069	Denn es hat sich gezeigt, dass das derzeitige System absolut nicht funktioniert.	Y	derzeitige	1870	    333	0.0021	489.1667	german_at_news_2012_00220538
22070	Dass die ÖVP die derzeitige Koalition auf Eis legte, nimmt der Parteichef gelassen, Neuwahlen schließt er jedoch aus.	Y	derzeitige	1870	    333	0.0021	809	german_at_news_2012_00193287
22071	Aber warum werden die einen fett und die anderen nicht?	Y	fett	1870	    333	0.0021	276.7778	german_at_news_2012_00010977
22072	Zum Beispiel wenn sie nicht essen gehen will, weil „Essen fett macht“.	Y	fett	1870	    333	0.0021	352.4545	german_at_news_2012_00988745
22073	Doch nicht nur die Kandidaten müssen sich vor ihm in Acht nehmen – auch die Jury bekommt ihr Fett weg.	Y	fett	1870	    333	0.0021	385.9444	german_at_news_2012_00387085
22074	So einen Karpfen kann man nicht mehr Essen, viel zu Fett.	Y	fett	1870	    333	0.0021	475.2727	german_at_news_2012_00821417
22075	Auch seiner Frau muss man ab und zu sagen: Nein, in der Hose schaust du eh nicht fett aus.	Y	fett	1870	    333	0.0021	500.9474	german_at_news_2012_00071289
22076	Von zehn, die in Finnland Lehrer werden wollen, schafft es einer.	Y	finnland	1870	    333	0.0021	452.5455	german_at_news_2012_00910287
22077	Die Schweiz trifft am Mittwoch auf die USA, Tschechien bekommt es mit Finnland zu tun.	Y	finnland	1870	    333	0.0021	505.4286	german_at_news_2012_00344089
22078	Aber genau das macht Finnland: Da kümmern sich mehrere Lehrer in der Klasse genau darum.	Y	finnland	1870	    333	0.0021	546.3571	german_at_news_2012_00006673
22079	Mit Kanada, Finnland, Russland und den USA warten allerdings sehr starke Gegner.	Y	finnland	1870	    333	0.0021	719.6667	german_at_news_2012_00692885
22080	Auch Schweden, Finnland und Irland würden sich am Einsatz beteiligen.	Y	finnland	1870	    333	0.0021	769.1	german_at_news_2012_00071179
22081	Ich habe es genossen, die zwei Jahre, als ich weg war.	Y	genossen	1870	    333	0.0021	248.3	german_at_news_2012_00553139
22082	Ich habe dieses Rennen sehr genossen, es war eines meiner besten seit langer Zeit.	Y	genossen	1870	    333	0.0021	452.3571	german_at_news_2012_00552897
22083	Daran will sich bei den Genossen aber offenbar niemand mehr erinnern.	Y	genossen	1870	    333	0.0021	482.5455	german_at_news_2012_00155300
22084	Von da an holte sich Faymann regelmäßig bei ihm Rat oder sprach sich mit ihm ab, erzählen auch die Genossen.	Y	genossen	1870	    333	0.0021	546.3333	german_at_news_2012_00906567
22085	Sie hat Aufmerksamkeit sehr genossen und stand so gern im Mittelpunkt.	Y	genossen	1870	    333	0.0021	586.4545	german_at_news_2012_00807557
22086	Kutcher liebt Kunis: Demi bekommt Anfall Geben Sie hier die E-Mail-Adresse des Empfängers ein (z.B. xy@z.com). Mehrere Empfänger werden durch Kommata getrennt.	Y	kunis	1870	    333	0.0021	534.6154	german_at_news_2012_00647835
22087	Kutcher & Kunis: Beim intimen Lunch erwischt Geben Sie hier die E-Mail-Adresse des Empfängers ein (z.B. xy@z.com). Mehrere Empfänger werden durch Kommata getrennt.	Y	kunis	1870	    333	0.0021	548.2692	german_at_news_2012_00647799
22088	Zwischen 1998 und 2006 spielten Kutcher und Kunis Seite an Seite in der TV-Serie Die wilden 70er.	Y	kunis	1870	    333	0.0021	679.7857	german_at_news_2012_00999327
22089	Ashton Kutcher (34) und Mila Kunis wird nun schon länger eine heiße Affäre nachgesagt, doch der Sprecher der Aktrice will uns nach wie vor glauben lassen, das da nichts läuft.	Y	kunis	1870	    333	0.0021	684.8214	german_at_news_2012_00057775
22090	Denn Demis Ex verbringt immer mehr Zeit mit der schönen Kunis.	Y	kunis	1870	    333	0.0021	755.8182	german_at_news_2012_00218930
22091	Spindelegger: Das sehe ich ganz anders: Wer etwas leistet und etwas leisten will, der soll bei uns eine Heimat finden.	Y	leistet	1870	    333	0.0021	404.5263	german_at_news_2012_00837202
22092	In der Gesellschaft, so Fischer, sei eine Kirche nicht an ihrer Größe zu messen, sondern darin, „welchen Beitrag sie zur politischen Entwicklung des Landes leistet“.	Y	leistet	1870	    333	0.0021	487.32	german_at_news_2012_00591122
22093	Manche Schwierigkeiten leistet man sich eben erst, wenn man sonst keine Sorgen hat.	Y	leistet	1870	    333	0.0021	547.8333	german_at_news_2012_00663760
22094	Und verweist darauf, dass man in Dornbirn gute Arbeit leistet.	Y	leistet	1870	    333	0.0021	589	german_at_news_2012_00882732
22095	Die aktuelle Kampagne leistet hier einen wichtigen Beitrag und verdient daher – genauso wie jede Form von Liebe – Aufmerksamkeit und Respekt.	Y	leistet	1870	    333	0.0021	713	german_at_news_2012_00276944
22096	Und eine ganze Nation fragt sich plötzlich: Wird es je wieder so, wie es einmal war?	Y	nation	1870	    333	0.0021	380	german_at_news_2012_00874530
22097	Khol: Österreich ist heute ein Staat, den alle wollen Aus dem „Land, das keiner wollte“, sei „Österreich ein Staat geworden, den alle wollen“, Österreich sei „zur Nation geworden, an die seine Bürgerinnen und Bürger glauben, die sie lieben“.	Y	nation	1870	    333	0.0021	426.9286	german_at_news_2012_00635999
22098	Und da die Medien weltweit ihren Teil auch noch dazu beigetragen haben, erscheinen wir wieder einmal als Nazi-Nation.	Y	nation	1870	    333	0.0021	485.7368	german_at_news_2012_00868909
22099	Österreich sei zur Nation geworden, an die seine Bürgerinnen und Bürger glauben, die sie lieben.	Y	nation	1870	    333	0.0021	546.9286	german_at_news_2012_00750422
22100	Damals sorgte sich die ganze Nation um William und seinen jüngeren Bruder Harry.	Y	nation	1870	    333	0.0021	799.9231	german_at_news_2012_00143972
22101	Das Ergebnis nach Steuern soll über 50 Mio. Euro liegen-mehr dazu in Flughafen: Neun Prozent mehr Passagiere.	Y	passagiere	1870	    333	0.0021	434.3125	german_at_news_2012_00166642
22102	Er gehe von vier bis fünf Prozent aus, was 22 Millionen Passagiere zu Jahresende bedeuten werde.	Y	passagiere	1870	    333	0.0021	471.3333	german_at_news_2012_00435521
22103	Die Zahlen sind eindeutig - in den vergangenen sechs Jahren verlor der Flughafen Klagenfurt 27 Prozent seiner Passagiere.	Y	passagiere	1870	    333	0.0021	523.625	german_at_news_2012_00379371
22104	Elf Passagiere wurden bei dem Unfall verletzt und mussten ins Krankenhaus.	Y	passagiere	1870	    333	0.0021	636.0909	german_at_news_2012_00428671
22105	Zum dritten Mal in diesem Jahr wird das Fliegen für Passagiere der Austrian Airlines (AUA) teurer.	Y	passagiere	1870	    333	0.0021	699.125	german_at_news_2012_00988859
22106	Nach nicht einmal zwei Minuten kommt ein Polizist auf uns zu.	Y	polizist	1870	    333	0.0021	266.5455	german_at_news_2012_00710127
22107	Und schon gar nicht konnte er wissen, was der Polizist dazu sprach.	Y	polizist	1870	    333	0.0021	320	german_at_news_2012_00880785
22108	Dazu der Polizist: “M. wurde gesagt, dass er nichts mehr sagen darf.”	Y	polizist	1870	    333	0.0021	363	german_at_news_2012_00209613
22109	Wie war der Polizist der 70er-Jahre, im Vergleich zur Generation Ihres Vaters?	Y	polizist	1870	    333	0.0021	526.0833	german_at_news_2012_00960576
22110	Einer der Angeklagten sagte, dass er ursprünglich Polizist werden wollte.	Y	polizist	1870	    333	0.0021	560.6	german_at_news_2012_00411900
22111	Es ist ja nicht so, dass ich keine Verletzung hatte.	Y	verletzung	1870	    333	0.0021	232.2	german_at_news_2012_00462357
22112	Offenbar war sie nicht dabei, als es zu der Verletzung kam.	Y	verletzung	1870	    333	0.0021	272.3636	german_at_news_2012_00742795
22113	Aber an dieser Verletzung sieht man, dass so viel passieren kann.“	Y	verletzung	1870	    333	0.0021	365.8182	german_at_news_2012_00001714
22114	Bilder der schönsten Promi- Frauen Bilder der schönsten Promi- Männer „Mit acht Jahren hatte ich eine Verletzung am Kopf.	Y	verletzung	1870	    333	0.0021	485	german_at_news_2012_00115042
22115	Eine Verletzung der Haut bekommt der Körper normalerweise gut in den Griff.	Y	verletzung	1870	    333	0.0021	761.1818	german_at_news_2012_00415305
22116	Es gibt in Wien immer noch zwei Arten von Publikum.	Y	arten	1871	    332	0.0021	299.4	german_at_news_2012_00457249
22117	Dadurch würde es in Zukunft zwei Arten von Musik im Internet geben.	Y	arten	1871	    332	0.0021	325.5	german_at_news_2012_00137382
22118	Was er aber offenbar noch wisse, sei, dass er nach der Tat versucht habe, sich auf verschiedene Arten das Leben zu nehmen.	Y	arten	1871	    332	0.0021	400.7619	german_at_news_2012_00924714
22119	Ich glaube, dass es nur zwei Arten von Menschen gibt: Die, die zugeben, dass sie mit Kritik nicht umgehen können, und die, die es nicht zugeben.“	Y	arten	1871	    332	0.0021	403.1579	german_at_news_2012_00551681
22120	Es gibt nämlich nur zwei Arten von Lichtfastern: Jene, die es ernst nehmen, und die sind relativ bald tot.	Y	arten	1871	    332	0.0021	553.5882	german_at_news_2012_00457728
22121	Es ist uns gelungen, die Briten auf unsere Seite zu ziehen.	Y	briten	1871	    332	0.0021	418.5455	german_at_news_2012_00463637
22122	Damit kommt William an, vor allem bei den jungen Briten.	Y	briten	1871	    332	0.0021	435	german_at_news_2012_00146328
22123	Ganz so neu ist diese Haltung der Briten freilich nicht.	Y	briten	1871	    332	0.0021	501	german_at_news_2012_00503043
22124	Hatten die Briten bis zum Zweiten Weltkrieg entweder rechts oder links gewählt, so sehen sich die Menschen heute nach Alternativen um.	Y	briten	1871	    332	0.0021	604.4	german_at_news_2012_00530344
22125	William ist bei den Briten nicht nur beliebt, er ist extrem beliebt.	Y	briten	1871	    332	0.0021	650.5	german_at_news_2012_00961451
22126	Es war ein wenig wie bei der Pressekonferenz in Cannes.	Y	cannes	1871	    332	0.0021	359.3	german_at_news_2012_00470162
22127	I möchte sehen, was wir heute alles in Cannes nicht beschlossen haben.	Y	cannes	1871	    332	0.0021	408.1667	german_at_news_2012_00578484
22128	Ein Bild aus besseren Tagen im Frühjahr, verliebt am Strand von Cannes.	Y	cannes	1871	    332	0.0021	774.4167	german_at_news_2012_00403222
22129	Kristen Stewart gesteht Seitensprung Effenberg nahm wegen Tumor 15 Kilo zu Twilight-Traumpaar vor dem Aus Pattinson von Stewart betrogen Brad Pitt ohne Jolie in Cannes: Keine Zeit FOTOS: Brad allein in Cannes.	Y	cannes	1871	    332	0.0021	969.5357	german_at_news_2012_00644186
22130	Keine Spur: In Cannes zeigten sich Angelina Jolie und Brad Pitt Eiskalt erwischt: Starfotos des Tages Die schönsten, skurrilsten und peinlichsten Bilder.	Y	cannes	1871	    332	0.0021	1117.5238	german_at_news_2012_00634184
22131	Dieses Festival wird sicher sehr fein und die Besucher dürfen sich auf gute Musik freuen.	Y	fein	1871	    332	0.0021	435.6667	german_at_news_2012_00353519
22132	Ich bin mir jedenfalls nicht zu fein, für die Bürger zu kämpfen.	Y	fein	1871	    332	0.0021	443	german_at_news_2012_00548553
22133	Der Nachwuchs braucht schließlich alles Mögliche, da ist es fein, wenn man nicht alles selber kaufen muss.	Y	fein	1871	    332	0.0021	523.375	german_at_news_2012_00252124
22134	Sie werfen Fragen auf, das ist fein, es sind auch wesentliche Fragen darunter.	Y	fein	1871	    332	0.0021	538.9167	german_at_news_2012_00816617
22135	Und jetzt schneiden wir sie fein aus. zu diesem Artikel sind keine Beiträge vorhanden Sie dürfen noch Zeichen als Text schreiben Bitte beachten Sie die Forumsregeln Für nicht registrierte Nutzer Bitte melden Sie sich an, um einen Kommentar abzuschicken.	Y	fein	1871	    332	0.0021	554.3429	german_at_news_2012_00878400
22136	Laut Apple müssen die Käufer zwischen zwei und drei Wochen auf ihr neues iPad warten.	Y	käufer	1871	    332	0.0021	386.8667	german_at_news_2012_00651447
22137	Die war Ende Jänner zu Ende, Käufer war noch immer keiner in Sicht.	Y	käufer	1871	    332	0.0021	398.3636	german_at_news_2012_00375795
22138	Für die Käufer bleiben jetzt seit Freitag nur die Verluste.	Y	käufer	1871	    332	0.0021	506.8889	german_at_news_2012_00494770
22139	Obwohl das Geschäft erst seit wenigen Minuten geöffnet hat, wollen die iPad-Käufer auch schon wieder raus.	Y	käufer	1871	    332	0.0021	554.8235	german_at_news_2012_00739857
22140	Vom neuen Dienst werden auch Käufer des kommenden iPhone 5 profitieren.	Y	käufer	1871	    332	0.0021	595.5	german_at_news_2012_00905270
22141	Knapp 400.000 Personen bzw. fünf Prozent der Bevölkerung können sich keine neue Kleidung leisten.	Y	kleidung	1871	    332	0.0021	383.6154	german_at_news_2012_00639171
22142	Die meisten Menschen wissen genau, was zu ihnen passt und Wenn das bei der Kleidung zutrifft, warum sollte es beim Sprachenlernen anders sein?	Y	kleidung	1871	    332	0.0021	454.0435	german_at_news_2012_00325936
22143	Die Kleidung ist ein Problem, weil es die Sachen, die er gerne anziehen würde, in seiner Größe nicht gibt.	Y	kleidung	1871	    332	0.0021	468.7059	german_at_news_2012_00318468
22144	Beachten sollte man das nicht nur bei der Wahl der Wohnungseinrichtung, sondern auch bei der Wahl der Kleidung.	Y	kleidung	1871	    332	0.0021	485.2308	german_at_news_2012_00091960
22145	Und was für die Kleidung gilt, stimmt auch bei den Lippen.	Y	kleidung	1871	    332	0.0021	513	german_at_news_2012_00883340
22146	Den meisten konnte ein Angebot gemacht werden“, so Landesrätin Schmid.	Y	landesrätin	1871	    332	0.0021	543.3	german_at_news_2012_00217729
22147	Alte Menschen sollen Teil der Gesellschaft bleiben, sagt die zuständige Landesrätin Barbara Schwarz (ÖVP).	Y	landesrätin	1871	    332	0.0021	599.4286	german_at_news_2012_00037149
22148	Trotz dieser Fortschritte bleibt noch viel zu tun, stellte Landesrätin Schmid klar.	Y	landesrätin	1871	    332	0.0021	648.6667	german_at_news_2012_00857018
22149	Beide Antworten ist uns die Landesrätin bis heute schuldig geblieben.“	Y	landesrätin	1871	    332	0.0021	726.1	german_at_news_2012_00094239
22150	Dazu muss jeder Einzelne seinen Beitrag leisten“, erklärte Landesrätin Haubner abschließend.	Y	landesrätin	1871	    332	0.0021	805.5455	german_at_news_2012_00211211
