ORDER	SENTENCE	STATUS	WORD	RANK	COUNT	COUNT_REL	INDEX	ID
16699	თბილისის სახელმწიფო უნივერსიტეტში დისკუსია სახელწოდებით - საქართველო საერთაშორისო უსაფრთხოების კონტექსტშიგაიმართა.	Y	სახელწოდებით	2184	  1,027	0.004	925.7	geo_news_2019_00360522
16700	ასე რომ, ბრალდება, იმის თაობაზე, თითქოს აქცია სახელწოდებით, არა კოლაბორაციონიზმს!	Y	სახელწოდებით	2184	  1,027	0.004	944.7	geo_news_2016_00125668
16701	როგორც თავად ამბობს, ფულადი დახმარება ხუთი წლის განმავლობაში ეძლეოდა.	Y	ფულადი	2184	  1,027	0.004	827.6667	geo_news_2016_00715323
16702	ძალიან დიდი დროის, ენერგიისა და, ამავე დროს, ფულადი სახსრების ინვესტირება მოხდა ჩვენი მხრიდან ამ პროექტში და, რა თქმა უნდა, ჩვენ არ გვაქვს იმის ფუფუნება, რომ ეს პროექტი გაიწელოს ძალიან დიდხანს.	Y	ფულადი	2184	  1,027	0.004	829.3929	geo_news_2019_00957883
16703	მისი განცხადებით, დაცვის სამსახურს აქვს შესაბამისი ფულადი რესურსი, რომ შეიქმნას პრეზიდენტის დაცვის სამსახური.	Y	ფულადი	2184	  1,027	0.004	846.5	geo_news_2016_00565866
16704	პარტიამ „ქართული ოცნება-დემოკრატიული საქართველო წელს, ნახევარი მილიონი ლარის ფულადი შემოწირულობა მიიღო - news.	Y	ფულადი	2184	  1,027	0.004	870.1538	geo_news_2016_00649090
16705	განსაკუთრებით აღსანიშნავია ვ-ის, როგორც ფულადი საქონლის, გამოყენება.	Y	ფულადი	2184	  1,027	0.004	871.25	geo_news_2019_00190602
16706	ოღონდ პირველად ჩვენთან მოვიდა თუ მედიაში, ეს სხვა საკითხია, მაგრამ ამას მნიშვნელობა არ აქვს.	Y	მედიაში	2185	  1,026	0.004	595.7857	geo_news_2016_00643482
16707	მისი გარდაცვალების შესახებ ინფორმაცია მედიაში დღეს გავრცელდა.	Y	მედიაში	2185	  1,026	0.004	737.1429	geo_news_2016_00566500
16708	მოგვიანებით, 5 ნოემბერს, მედიაში გავრცელებულ ამ ინფორმაციას თავდაცვის სამინისტრო გამოეხმაურა.	Y	მედიაში	2185	  1,026	0.004	810.8889	geo_news_2019_00593664
16709	შეგახსენებთ, რომ კურსი სოციალურ მედიაში 27 აპრილს იწყება.	Y	მედიაში	2185	  1,026	0.004	863.7143	geo_news_2019_00893919
16710	“ძალიან ხშირად ხდებოდა ბავშვთა უფლებების დარღვევა მედიაში.	Y	მედიაში	2185	  1,026	0.004	1102.5714	geo_news_2019_00960647
16711	დღეს კი, მან რეალური ინფორმაცია მიაწოდა სასამართლოს.	Y	მიაწოდა	2186	  1,023	0.0039	514.4286	geo_news_2016_00268361
16712	ახლა კი, მან რეალური ინფორმაცია მიაწოდა სასამართლოს.	Y	მიაწოდა	2186	  1,023	0.0039	522.5714	geo_news_2016_00157216
16713	აშშ სახელმწიფო მდივანმა მათ მოლაპარაკებების თაობაზე პირადად მიაწოდა ინფორმაცია.	Y	მიაწოდა	2186	  1,023	0.0039	807.6667	geo_news_2016_00150335
16714	პროექტის ხელმძღვანელმა ფინანსთა მინისტრს აგრეთვე მიაწოდა ინფორმაცია ევროკავშირის მიერ ბიუჯეტის მხარდამჭერი პროექტების შესახებ.	Y	მიაწოდა	2186	  1,023	0.0039	870.0769	geo_news_2016_00673515
16715	მინისტრმა ინფორმაცია არასამთავრობო სექტორის წარმომადგენლებს კონკრეტული პროექტების შესახებაც მიაწოდა.	Y	მიაწოდა	2186	  1,023	0.0039	1043.5556	geo_news_2016_00562973
16716	ძლიერი სამოქალაქო საზოგადოების შექმნა დღეს არანაკლებ მნიშვნელოვანია, ვიდრე ძლიერი ხელისუფლების შექმნა.	Y	არანაკლებ	2187	  1,022	0.0039	542.2222	geo_news_2016_00968411
16717	ყოველივე ეს ძალიან მნიშვნელოვანია, მაგრამ საქართველოსთვის არანაკლებ მნიშვნელოვანია ის, რომ ევროპა ჩვენთვის მხოლოდ პრაგმატული არჩევანი არ არის.	Y	არანაკლებ	2187	  1,022	0.0039	751.125	geo_news_2016_00892095
16718	თუ მეტად არა, არანაკლებ მნიშვნელოვანია ისიც, როგორ შეხვდება გუნდი ამა თუ იმ მატჩს.	Y	არანაკლებ	2187	  1,022	0.0039	753.75	geo_news_2019_00376498
16719	დაბრუნება არასდროს არ არის გვიან, თუმცა ის დღეს არანაკლებ მნიშვნელოვან საქმეს აკეთებს ქვეყნისთვის.	Y	არანაკლებ	2187	  1,022	0.0039	763.3846	geo_news_2016_00231506
16720	ჩვენი სურვილი, პროგნოზი არის რომ ეკონომიკური ზრდა არანაკლებ 7% იყოს.	Y	არანაკლებ	2187	  1,022	0.0039	796.8889	geo_news_2016_00944188
16721	ჩემთვის ყოველ შემთხვევაში ეს ძალიან ბევრ რაღაცას ნიშნავს.	Y	რაღაცას	2187	  1,022	0.0039	522.875	geo_news_2016_00928053
16722	რა თქმა უნდა, ”ნაციონალურ მოძრაობა” ცდილობს, რომ რაღაცას მიაღწიოს, მაგრამ ჩვენ ვხედავთ, რომ ხალხის მხარდაჭერა არ აქვთ.	Y	რაღაცას	2187	  1,022	0.0039	705.625	geo_news_2016_00683130
16723	მე არ ვიცი, შეიძლება ვიღაც კონკრეტული ადამიანები რაღაცას აკეთებდნენ ამ მიმართულებით.	Y	რაღაცას	2187	  1,022	0.0039	736.5455	geo_news_2019_00532697
16724	არ ვიცი, შეიძლება კონკრეტული ადამიანები აკეთებდნენ რაღაცას ამ მიმართულებით,“- განაცხადა კახა კალაძემ.	Y	რაღაცას	2187	  1,022	0.0039	752.3333	geo_news_2019_00096885
16725	უბრალოდ, ვამბობ, რომ ინიციატორები უფრო ხშირად ქალები არიან ხოლმე, მით უმეტეს მაშინ, როცა კაცი რაღაცას წარმოადგენს, ანუ, პერსპექტივა და ფული აქვს.	Y	რაღაცას	2187	  1,022	0.0039	772.2381	geo_news_2019_00833269
16726	თბილისში გაზის აფეთქების შედეგად ერთი ადამიანი გარდაიცვალა - news.	Y	აფეთქების	2188	  1,021	0.0039	586.625	geo_news_2016_00361558
16727	ადგილობრივი მედიის ინფორმაციით, წინასწარი მონაცემებით, აფეთქების შედეგად ერთი ადამიანი დაიღუპა და ორი დაშავდა.	Y	აფეთქების	2188	  1,021	0.0039	689.7692	geo_news_2016_00023632
16728	გუშინ მომხდარი აფეთქების შედეგად სულ ოთხი ადამიანი დაშავდა.	Y	აფეთქების	2188	  1,021	0.0039	814.25	geo_news_2016_00228496
16729	ბრიუსელში მომხდარი აფეთქების შემდეგ საქართველოს საგარეო უწყება განცხადებას ავრცელებს - news.	Y	აფეთქების	2188	  1,021	0.0039	863.3	geo_news_2016_00179449
16730	თურქეთში აფეთქების შედეგად ათი ადამიანი დაშავდა - news.	Y	აფეთქების	2188	  1,021	0.0039	1041.2857	geo_news_2016_00388703
16731	შენ დას რომ დიდი მომავალი აქვს ეს მე ჯერ კიდევ ოთხი წლის წინ გითხარით გახსოვს?	Y	დას	2188	  1,021	0.0039	644.7333	geo_news_2019_00906602
16732	ბო­ბი დე­დას ეუბ­ნე­ბა: შენ ამით შენ თავს ეხ­მა­რე­ბი დე­და, მე კი არა.	Y	დას	2188	  1,021	0.0039	705.7647	geo_news_2016_00173435
16733	ჩემს დას რაც შეეხება, ის ძალიან კარგად მღერის.	Y	დას	2188	  1,021	0.0039	712.875	geo_news_2019_00931957
16734	და­ი­ღა­ლა და მა­ინც სხვა­ზე დას­ვე­ნე­ბუ­ლი იყო.	Y	დას	2188	  1,021	0.0039	718.0714	geo_news_2016_00238161
16735	ხოლო მის დას ჰყავს ორჯერ ნაკლები და, ვიდრე ძმა.	Y	დას	2188	  1,021	0.0039	754.3333	geo_news_2019_00986259
16736	ცოტა ხნის წინ, რუსეთის პრემიერმა დიმიტრი მედვედევმა განაცხადა, რომ უკრაინის ვალი რუსეთის მიმართ შეადგენს 16 მილიარდ აშშ დოლარს.	Y	მილიარდ	2188	  1,021	0.0039	843.375	geo_news_2016_00961185
16737	ეს არის ბიუჯეტი, რომელმაც გადააჭარბა 10 მილიარდ ლარს და ამავე დროს არის ბიუჯეტი, რომელმაც კიდევ ერთხელ ხაზი გაუსვა ჩვენი მთავრობის პრიორიტეტებს.	Y	მილიარდ	2188	  1,021	0.0039	844	geo_news_2016_00292580
16738	იმ ადამიანის წინააღმდეგ, რომელმაც ამ ქვეყანაში განახორციელა სამ მილიარდ დოლარზე მეტი ინვესტიცია.	Y	მილიარდ	2188	  1,021	0.0039	905.0833	geo_news_2019_00401771
16739	მან მხოლოდ ამ წელს დამატებით მილიარდ-ნახევარი დოლარი დახარჯა ქვეყნის ბიუჯეტიდან.	Y	მილიარდ	2188	  1,021	0.0039	906.5455	geo_news_2016_00505701
16740	როგორც ფინანსთა მინისტრმა აღნიშნა, მომავალი წლის ბიუჯეტი 10 მილიარდ ლარს გადააჭარბებს.	Y	მილიარდ	2188	  1,021	0.0039	929.1	geo_news_2016_00727141
16741	ქართველი ხალხი არის ის უზენაესი მოქმედი პირი ქვეყანაში, რომელიც განსაზღვრავს პოლიტიკურ პროცესს.	Y	განსაზღვრავს	2189	  1,020	0.0039	619.3333	geo_news_2016_00871522
16742	ამას არც სააკაშვილი განსაზღვრავს და არც სხვა ვინმე პიროვნება, ამას ქართველი ხალხი განსაზღვრავს.	Y	განსაზღვრავს	2189	  1,020	0.0039	642.3	geo_news_2016_00039772
16743	სწორედ ეს პასუხი განსაზღვრავს, რატომ მოხდა შეცდომა.	Y	განსაზღვრავს	2189	  1,020	0.0039	646.2857	geo_news_2016_00830300
16744	შეიძლება რაღაც შეცდომა მოხდა, მაგრამ ბევრი ფაქტორი განსაზღვრავს ამას.	Y	განსაზღვრავს	2189	  1,020	0.0039	725.8889	geo_news_2016_00904384
16745	განათლება, ცოდნა, გამოცდილება, პასუხისმგებლობა - აი, რა განსაზღვრავს საქმის წარმატებას და არა საერთაშორისო ექსპერტები.	Y	განსაზღვრავს	2189	  1,020	0.0039	962.1538	geo_news_2019_00188635
16746	ჩვენ რაც გაკეთებული გვაქვს, არის კანონის სრული დაცვით.	Y	დაცვით	2189	  1,020	0.0039	590.5	geo_news_2016_00947822
16747	ისეთი, როგორიც სააკაშვილის შემთხვევაში იყო, ოღონდ ამჯერად ადამიანის უფლებების დაცვით.	Y	დაცვით	2189	  1,020	0.0039	713.5	geo_news_2016_00422159
16748	ერთიანი ნაციონალური მოძრაობის ლიდერმა დღევანდელი არჩევნები შეაფასა და აღნიშნა, რომ ის დემოკრატიული პროცესების სრული დაცვით გაიმართა.	Y	დაცვით	2189	  1,020	0.0039	717.1875	geo_news_2016_00284079
16749	ყველაფერი ეს ხდება ჩვენი სახელმწიფო ინტერესების მაქსიმალური დაცვით.	Y	დაცვით	2189	  1,020	0.0039	734.125	geo_news_2016_00889481
16750	თამაშის სრული წესების დაცვით გაიტანა მატჩის ერთადერთი გოლი.	Y	დაცვით	2189	  1,020	0.0039	1160	geo_news_2019_00354255
16751	რა თქმა უნდა, ძალიან ცუდია, უარი რომ ვთქვი, მაგრამ ასე მოხდა.	Y	ვთქვი	2189	  1,020	0.0039	520	geo_news_2016_00683699
16752	”ის, რაც მე ვთქვი, არის, რომ საქართველოს ხელისუფლების პასუხი იყო აბსოლუტურად არაპროპორციული.	Y	ვთქვი	2189	  1,020	0.0039	594.3333	geo_news_2016_00429894
16753	მე ჩემი აზრი ვთქვი შენ შენი აზრი.	Y	ვთქვი	2189	  1,020	0.0039	614.6667	geo_news_2019_00555247
16754	თუმცა, როგორც ვთქვი, ჯერ-ჯერობით ეს ყველაფერი მხოლოდ სასამართლოს გადაწყვეტილების შემდეგ გამოჩნდება.	Y	ვთქვი	2189	  1,020	0.0039	672.4167	geo_news_2016_00383304
16755	როგორც ვთქვი, ის როგორც მმართველი ჯერ ახალია, თან აქვს ძალიან ბევრი ფული.	Y	ვთქვი	2189	  1,020	0.0039	677.4545	geo_news_2016_00714814
16756	ჩემი ინფორმაციით, ეს მომავალ ან მის მომდევნო კვირას მოხდება, მარტის დასაწყისში.	Y	მარტის	2189	  1,020	0.0039	618.9091	geo_news_2016_00929311
16757	საქართველოს ბანკის ინფორმაციით, ის, ვინც მიმდინარე წლის 31 მარტის ბრიუსელში ნატო-საქართველოს კომისიის სხდომა გაიმართება ბრიუსელში მუდმივი წარმომადგენლების დონეზე ნატო-საქართველოს კომისიის სხდომა გაიმართება.	Y	მარტის	2189	  1,020	0.0039	733.4375	geo_news_2016_00788311
16758	გადაწყვეტილება ამის შესახებ სასამართლომ 26 მარტის სხდომაზე გამოაცხადა.	Y	მარტის	2189	  1,020	0.0039	771.5714	geo_news_2016_00183978
16759	მარტის ბოლოს და აპრილის დასაწყისში ჩვენ საკმაოდ კარგი მაჩვენებელი გვქონდა.	Y	მარტის	2189	  1,020	0.0039	860.4	geo_news_2019_00516507
16760	მარტის ბოლოს, ოზურგეთში დასრულდება იუსტიციის სახლის მშენებლობა.	Y	მარტის	2189	  1,020	0.0039	1089.7143	geo_news_2016_00511725
16761	ასევე არ ვიცი ვინმეს აქვს თუ არა ეს კოჭები https://www.	Y	www	2190	  1,019	0.0039	876.3636	geo_news_2019_00107668
16762	ასე დაიწყო ძალიან სასარგებლო და საინტერესო ბლოგიhttp://www.	Y	www	2190	  1,019	0.0039	969.375	geo_news_2019_00107203
16763	ვინ იქნება „ქართული ოცნების“ საპრეზიდენტო კანდიდატიhttps://www.	Y	www	2190	  1,019	0.0039	983.1429	geo_news_2019_00329768
16764	ვებ-გვერდი: www.youthpalace.ge”,-ამის შესახებ ინფორმაციას “თბილისის მერია” ავრცელებს.	Y	www	2190	  1,019	0.0039	1020.6364	geo_news_2019_00322599
16765	ეს არის რუსეთის დიპლომატიური ამოცანა, აჩვენოს, რომ ამ ფორმატში არაფერი ხდება - გიორგი ბარამიძეhttps://www.	Y	www	2190	  1,019	0.0039	1054.1429	geo_news_2019_00291581
16766	შეიძლება ეს არ იყო ბრწყინვალე დებატები, მაგრამ საკმაოდ კარგი დებატები გაიმართა.	Y	ბრწყინვალე	2190	  1,019	0.0039	563.1	geo_news_2019_00899628
16767	საქართველო არ არის მარტო ლამაზი, ბრწყინვალე ქვეყანა, ამ ქვეყანაში ბრწყინვალე ხალხი ცხოვრობს”, – განაცხადა კისკამ.	Y	ბრწყინვალე	2190	  1,019	0.0039	699.7692	geo_news_2019_00772073
16768	მე დარწმუნებული ვარ, რომ ამ სამიტს ბრწყინვალე შედეგი ექნება.	Y	ბრწყინვალე	2190	  1,019	0.0039	813.3333	geo_news_2016_00526979
16769	იუსტიციის სამინისტროს ინფორმაციით, ბუტკიავიჩუსმა ვიზალიბერალიზაციის საკითხზე ისაუბრა და განაცხადა, რომ საქართველოს მთავრობამ ბრწყინვალე შედეგებს მიაღწია.	Y	ბრწყინვალე	2190	  1,019	0.0039	917.5333	geo_news_2016_00434372
16770	ის შესანიშნავი მწვრთნელი იყო და ბრწყინვალე მეგობარი.	Y	ბრწყინვალე	2190	  1,019	0.0039	921.2857	geo_news_2019_00431799
16771	ერთ-ერთი ყველაზე მთავარი პრობლემა, რაც მათ აქვთ, საცხოვრებელ ფართებს უკავშირდება.	Y	საცხოვრებელ	2190	  1,019	0.0039	649.7273	geo_news_2019_00281061
16772	პირველი, ჩვენი მთავარი მიზანი უნდა იყოს ეკონომიკური პროგრესი, რაც მთელ მსოფლიოში უკეთეს საცხოვრებელ პირობებს ნიშნავს.	Y	საცხოვრებელ	2190	  1,019	0.0039	825.3333	geo_news_2019_00658683
16773	რაც შეეხება საცხოვრებელ ბინებს, მარკეტინგის სამსახურში ამბობენ, რომ „აქ იქნება ძალიან მაღალი დონის საცხოვრებელი.	Y	საცხოვრებელ	2190	  1,019	0.0039	866.2857	geo_news_2019_00698920
16774	დაიღუპა სამი ადამიანი – ერთი უშუალოდ სამედიცინო დაწესებულების წინ, კიდევ ორი გვერდზე საცხოვრებელ სახლთან.	Y	საცხოვრებელ	2190	  1,019	0.0039	873.8462	geo_news_2016_00238207
16775	შეგახსენებთ, რომ მიხეილ სააკაშვილი გუშინ კიევში, ერთ-ერთ ქუჩაზე საცხოვრებელ ბინაში დააკავეს.	Y	საცხოვრებელ	2190	  1,019	0.0039	877.5455	geo_news_2019_00894136
16776	ცხოვრებაში არ არსებობს ძალა, რომელშიც ეს განწყობა არ იქნებოდა.	Y	განწყობა	2191	  1,018	0.0039	634.75	geo_news_2019_00956041
16777	მისი თქმით, ასეთი განწყობა აქვს, როგორც გუნდს, ისე მის პრეზიდენტობის კანდიდატს.	Y	განწყობა	2191	  1,018	0.0039	644.9091	geo_news_2016_00575365
16778	სოციალური ჯგუფის განწყობა ჩემ მიმართ არის… – ძირითადად, დადებითი.	Y	განწყობა	2191	  1,018	0.0039	798.875	geo_news_2019_00804556
16779	ჩემთვის ცნობილია ამ გუნდში მყოფი ადამიანების განწყობა.	Y	განწყობა	2191	  1,018	0.0039	823.7143	geo_news_2016_00928068
16780	ასეთ შემთხვევაში მაღალია განწყობა და გუნდის თითოეული წევრის პასუხისმგებლობა ერთმანეთის მიმართ.	Y	განწყობა	2191	  1,018	0.0039	955.1818	geo_news_2019_00116088
