ORDER	SENTENCE	STATUS	WORD	RANK	COUNT	COUNT_REL	INDEX	ID
16470	კითხვაზე, თუ ვინ იკავებს მის ადგილს ამჟამად, მერიის პრეს-სამსახურში ამაზე ინფორმაცია არ აქვთ.	Y	იკავებს	2174	  1,037	0.004	729.1429	geo_news_2019_00458241
16471	რა ვიცოდი, რომ ჩემს წინ საქართველოს მომავალი პატრიარქი იდგა!	Y	პატრიარქი	2174	  1,037	0.004	670.5556	geo_news_2019_00679314
16472	მე თითქოს არ მინდა დავიჯერო რომ ასე ფიქრობს პატრიარქი და საქართველოს ეკლესია.	Y	პატრიარქი	2174	  1,037	0.004	707.75	geo_news_2016_00530999
16473	სრულიად საქართველოს კათოლიკოს-პატრიარქი დღეს 84 წლის გახდა.	Y	პატრიარქი	2174	  1,037	0.004	714.2857	geo_news_2019_00806788
16474	მაგრამ ის, რაც უნდა გავაკეთოთ ჩვენ, იმას ვერ გააკეთებს ჩვენი პატრიარქი,”- განუცხადა მან მომიტინგეებს.	Y	პატრიარქი	2174	  1,037	0.004	730.7143	geo_news_2016_00481887
16475	რუსეთის პატრიარქი: ჩვენ დიდი იმედით შევყურებთ იმას, რაც დღეს ხდება საქართველოში - news.	Y	პატრიარქი	2174	  1,037	0.004	732.25	geo_news_2016_00740568
16476	ჩვენი მხრიდან უკვე მიმდინარეობს მოსაპირკეთებელი სამუშაოები და მალე, ქართული მხრიდან საბაჟო მზად იქნება ფუნქციონირებისთვის.	Y	საბაჟო	2174	  1,037	0.004	802.9231	geo_news_2016_00943162
16477	ერთობლივი კომიტეტის პირველი შეხვედრა 2011 წელს საქართველო-რუსეთს შორის ხელმოწერილი საბაჟო შეთანხმების ფარგლებში ხორციელდება.	Y	საბაჟო	2174	  1,037	0.004	808.2308	geo_news_2019_00285776
16478	გვაქვს სხვადასხვა საკითხი, რა თქმა უნდა, ერთერთი მათგანი გახლავთ 2011 წელს, საქართველოსა და რუსეთის მთავრობებს შორის გაფორმებული შეთანხმება საბაჟო მონიტორინგის შესახებ.	Y	საბაჟო	2174	  1,037	0.004	833.6	geo_news_2016_00213480
16479	გარდა ამისა, მისივე თქმით, შეხვედრის დროს ხელი მოაწერეს თანამშრომლობის ფარგლებში სამოქმედო გეგმის ოქმს და ასევე დეკლარაციას ორი ქვეყნის საბაჟო უწყებებს შორის არსებული თანამშრომლობის შესახებ.	Y	საბაჟო	2174	  1,037	0.004	844.4348	geo_news_2016_00202930
16480	უკრაინის პრეზიდენტის გარდა, პუტინი საბაჟო კავშირის ქვეყნებსა და ევროკავშირის წარმომადგენლებს შეხვდება, სადაც განხილვის ერთ-ერთი მთავარი თემა უკრაინის ევროკავშირთან ასოცირების თემა იქნება.	Y	საბაჟო	2174	  1,037	0.004	888	geo_news_2016_00848024
16481	ამისათვის დაცვის მხარეს სჭირდება დრო და მომზადება.	Y	ამისათვის	2175	  1,036	0.004	843.1429	geo_news_2019_00054518
16482	ამისათვის ორი გზა გვაქვს - პრემიერ ლიგა და ევროპა ლიგა.	Y	ამისათვის	2175	  1,036	0.004	874	geo_news_2019_00054616
16483	ვფიქრობ, ჩვენს გუნდს ამისათვის ყველანაირი შანსი აქვს.	Y	ამისათვის	2175	  1,036	0.004	903.2857	geo_news_2019_00337697
16484	ამისათვის მთავარია, რომ ჩვენ კარგად ვიყოთ მომზადებული.	Y	ამისათვის	2175	  1,036	0.004	955.8571	geo_news_2019_00054594
16485	ჩვენი პარტია ამისათვის ყველაფერს გააკეთებს“- აცხადებს კობახიძე.	Y	ამისათვის	2175	  1,036	0.004	995.1429	geo_news_2019_00939624
16486	მაგრამ ახლა ეს ყველაფერი რატომღაც ყველამ დაივიწყა ან საერთოდ ახალმა მთავრობამ არც კი იცის ამის შესახებ!	Y	ახალმა	2175	  1,036	0.004	658.625	geo_news_2016_00480320
16487	მათივე ინფორმაციით, არგენტინის საგარეო საქმეთა ახალმა მინისტრმა აღნიშნა, რომ მას დიდი სურვილი აქვს ორ ქვეყანას შორის ურთიერთობები უფრო ინტენსიური გახდეს.	Y	ახალმა	2175	  1,036	0.004	674.4	geo_news_2016_00489318
16488	ჩემი მთავარი მიზანი სამხრეთ ოსეთის მოსახლეობის გაერთიანება იქნება“- განაცხადა სამხრეთ ოსეთის ახალმა „პრეზიდენტმა“.	Y	ახალმა	2175	  1,036	0.004	720.0909	geo_news_2016_00929553
16489	ჯაფარიძე: ნატოს ახალმა მდივანმა პასუხი სულ სხვა მიმართულებით წაიყვანა და რა თქმა უნდა, მე ამით კმაყოფილი არ ვარ - news.	Y	ახალმა	2175	  1,036	0.004	733.7895	geo_news_2016_00993067
16490	გვინდა, რომ რაც ახლა ხდება ეს ყველაფერი იცოდეს ახალმა ხელისუფლებამ და აუცილებლად მოაგვარონ ეს საკითხი.	Y	ახალმა	2175	  1,036	0.004	739.1429	geo_news_2016_00214382
16491	ამ პროცესში, ბოლო პერიოდში, სხვადასხვა ეტაპზე საერთაშორისო ექსპერტების ჩართვა ხდება.	Y	ექსპერტების	2175	  1,036	0.004	620.3	geo_news_2016_00082393
16492	საზოგადოების, ექსპერტების და მთავრობის დამოკიდებულება ეროვნული ბანკის მიმართ არის სამართლიანი, რადგან მათი ქმედებები და მომავალი გეგმები არ არის საჯარო.	Y	ექსპერტების	2175	  1,036	0.004	667.3529	geo_news_2019_00746370
16493	თუმცა ექსპერტების მეორე ნაწილი ამ ეტაპზე ვერ საუბრობს, რეალურად რა შედეგებს მოიტანს ცვლილება.	Y	ექსპერტების	2175	  1,036	0.004	746.7692	geo_news_2019_00379982
16494	მისივე თქმით, ასევე არ ესმის რატომ არის საფრთხედ აღქმული საქართველოს და ნატო-ს ერთობლივი ნაბიჯები რუსი სამხედრო თუ პოლიტიკური ექსპერტების მიერ.	Y	ექსპერტების	2175	  1,036	0.004	754.7619	geo_news_2016_00568510
16495	ეს საკითხები არ არის დღეს საარჩევნო კოდექსში, თუმცა, თუ იქნება შესაბამისი კომუნიკაცია შემდეგ უკვე პარტიების მხრიდან, ვენეციის კომისიის ექსპერტების შეფასებები, ამის შესაბამისად იქნება კონკრეტული გადაწყვეტილებები მიღებული.”	Y	ექსპერტების	2175	  1,036	0.004	763.96	geo_news_2019_00307085
16496	'შეიძლება მსჯელობა იყოს და გუნდი საბოლოო გადაწყვეტილებას მიიღებს.	Y	მსჯელობა	2175	  1,036	0.004	554.25	geo_news_2019_00900421
16497	ამ დროისთვის კი, კონკრეტულ თემაზე მსჯელობა არ მიმდინარეობს.	Y	მსჯელობა	2175	  1,036	0.004	660.875	geo_news_2016_00052551
16498	ჩემი ინფორმაციით, ჯერ არანაირი სია არ კეთდება და მსჯელობა არ მიდის.	Y	მსჯელობა	2175	  1,036	0.004	741.4	geo_news_2016_00929354
16499	პარლამენტის პრესსამსახურის ინფორმაციით, აღნიშნულ საკითხთან დაკავშირებით მსჯელობა კვლავ გაგრძელდება.	Y	მსჯელობა	2175	  1,036	0.004	855.2222	geo_news_2016_00647811
16500	კომიტეტის სხდომაზე მსჯელობა მოჰყვა შეფასების სისტემის საკითხს.	Y	მსჯელობა	2175	  1,036	0.004	1060.7143	geo_news_2016_00460713
16501	ჩვენ ამ კვლევებს არ ვენდობით, თუმცა მასში არის რამდენიმე მუხლი, რომელსაც კვლევები არ სჭირდება, ესაა საზოგადოების დამოკიდებულება ხელისუფლების მიმართ, ან სოციალურ - ეკონომიკური მდგომარეობა..	Y	მუხლი	2175	  1,036	0.004	785.1364	geo_news_2016_00932725
16502	მოლოდინი არის სტუდენტების ერთი ჯგუფის მხრიდან, რომ ის ცვლილებები, რომელზეც არის საუბარი დიდი ხნის განმავლობაში, როგორ შეგვიძლია ამ გზაზე წავიწიოთ და რა ვერსიები არსებობს როგორ შეიძლება ჩამოყალიბდეს სხვადასხვა მუხლი.	Y	მუხლი	2175	  1,036	0.004	798.2222	geo_news_2016_00599629
16503	ამას არეგულირებს სისხლის სამართლის კოდექსის 1641 მუხლი, სადაც აღნიშნულია, რომ ფაქტი იწვევს თვითონ ფიზიკური პირის პასუხისმგებლობას და არა პარტიის.	Y	მუხლი	2175	  1,036	0.004	809.3889	geo_news_2016_00039720
16504	მისი თქმით, შესაბამისი მუხლი მას შემდეგ ამოქმედდება, რაც დევნილთა შესახებ ახალი კანონი შევა ძალაში.	Y	მუხლი	2175	  1,036	0.004	834.2143	geo_news_2016_00581956
16505	საქართველოს პირველი კონსტიტუცია:მუხლი 1.საქართველო არის თავისუფალი, დამოუკიდებელი და განუყოფელი სახელმწიფო.	Y	მუხლი	2175	  1,036	0.004	838.0909	geo_news_2019_00777397
16506	თუმცა, ამის მიუხედავად ჰაერის ტემპერატურა მაღალი იქნება.	Y	ჰაერის	2175	  1,036	0.004	700	geo_news_2019_00377539
16507	ისინი ხომ ჰაერის ნიშნის ერთ-ერთი ყველაზე მოუხელთებელი წარმომადგენლები არიან.	Y	ჰაერის	2175	  1,036	0.004	860.8	geo_news_2019_00426377
16508	საქართველოს პრემიერ-მინისტრმა, მამუკა ბახტაძემ ატმოსფერული ჰაერის დაცვის პოლიტიკის პრეზენტაციაზე სიტყვით გამოსვლისას, განაცხადა, რომ აღნიშნული პრობლემა ყველაზე მეტად თბილისს აქვს, მოსახლეობის და მანქანების რაოდენობის გამო.	Y	ჰაერის	2175	  1,036	0.004	941.08	geo_news_2019_00778253
16509	გავიგეთ, რომ ჰაერის დაბინძურების მიხედვით, საქართველო მსოფლიოში პირველ ადგილზე ყოფილა.	Y	ჰაერის	2175	  1,036	0.004	967	geo_news_2019_00178043
16510	თუმცა, ასევე ხაზი უნდა გაესვას იმას, რომ თუ ეს ფაქტორი იყო ე.წ. შენობის შიდა ჰაერის სისუფთავე, შენობის გარე სისუფთავე, გამონაბოლქვი, მართლაც ყურადღებას იმსახურებს, - აღნიშნა მინისტრმა.	Y	ჰაერის	2175	  1,036	0.004	974.1667	geo_news_2019_00378210
16511	ეს შეხვედრა ეხებოდა სულ სხვა სისხლის სამართლის საქმეს.	Y	ეხებოდა	2176	  1,035	0.004	525.375	geo_news_2016_00317605
16512	ჩემი კითხვები ეხებოდა სწორედ იმას, თუ როგორ ხდება მართლმსაჯულების ადმინისტრირება ისე, რომ მეორე მხარემ არ იცის გადაწყვეტილების შესახებ.	Y	ეხებოდა	2176	  1,035	0.004	710.8333	geo_news_2016_00929391
16513	რუსი დეპუტატის თქმით, მისი განცხადება ეხებოდა მხოლოდ “საქართველოს, სადაც არსებობს უამრავი ეროვნული კონფლიქტი, რომელსაც მოგვარება სჭირდება”.	Y	ეხებოდა	2176	  1,035	0.004	711.875	geo_news_2016_00743329
16514	შესაბამისად, პრემიერ-მინისტრის განცხადება ირაკლი ღარიბაშვილის კიდევ ერთი განცხადება საქართველოს საგარეო ვალს ეხებოდა.	Y	ეხებოდა	2176	  1,035	0.004	718.1667	geo_news_2016_00912083
16515	კითხვები იყო ერთი და იგივე, ისეთი, როგორიც ორი თვის წინ და თანხებს ეხებოდა.	Y	ეხებოდა	2176	  1,035	0.004	724.5833	geo_news_2016_00455496
16516	როგორია სამინისტროს პოზიცია და თქვენი მოთხოვნები რა იქნება?	Y	მოთხოვნები	2176	  1,035	0.004	688.5	geo_news_2016_00708011
16517	ის ბევრს ითხოვს, მაგრამ მისი მოთხოვნები მეტად კონკრეტული და გასაგებია.	Y	მოთხოვნები	2176	  1,035	0.004	709.7	geo_news_2016_00420469
16518	თქვენ თქვენ ხართ და ყველას საკუთარი ინტერესი, მოთხოვნები და შესაძლებლობები გაქვთ.	Y	მოთხოვნები	2176	  1,035	0.004	946.7778	geo_news_2019_00391673
16519	მისივე თქმით, არასამთავრობო ორგანიზაციების მოთხოვნები ძირითადად ეხება საკანონმდებლო რეფორმების დროულად განხორციელებას.	Y	მოთხოვნები	2176	  1,035	0.004	1023.7273	geo_news_2016_00568402
16520	რომელთაც სანაცვლოდ სხვა სახის მოთხოვნები ექნებათ ქვეყნიდან.	Y	მოთხოვნები	2176	  1,035	0.004	1270.4286	geo_news_2016_00734745
16521	მათ შორის, ქრისტიან-დემოკრატიული მოძრაობისთავისუფალი საქართველოს.	Y	ქრისტიან	2176	  1,035	0.004	491.8571	geo_news_2016_00495954
16522	განცხადება ამის შესახებ „ქრისტიან-დემოკრატიული“ პარტიის დეპუტატმა პრესკონფერენციაზე გააკეთა.	Y	ქრისტიან	2176	  1,035	0.004	735.3333	geo_news_2016_00199534
16523	ამ რვა პოლიტიკურ ძალას შორის არის ასევე საპარლამენტო უმცირესობის წამყვანი პარტია, ქრისტიან–დემოკრატიული მოძრაობა.	Y	ქრისტიან	2176	  1,035	0.004	792	geo_news_2016_00083904
16524	პარტიის წევრების გადაწყვეტილების შესახებ ქრისტიან-დემოკრატების ლიდერმა დღევანდელ პრესკონფერენციაზე ისაუბრა.	Y	ქრისტიან	2176	  1,035	0.004	1031	geo_news_2016_00649912
16525	ახლა თანამშრომლობის დროა, - ასეთია ქრისტიან-დემოკრატების პოზიცია.	Y	ქრისტიან	2176	  1,035	0.004	1339	geo_news_2019_00144691
16526	შეგახსენებთ, რომ საქართველოს დღეს -ს საპარლამენტო დელეგაცია ეწვია.	Y	ეწვია	2177	  1,034	0.004	601.625	geo_news_2016_00899194
16527	მეორე, რომ აღმასრულებელი ხელისუფლების ხელმძღვანელი მთავრობის თავმჯდომარე ეწვია სასამართლოს.	Y	ეწვია	2177	  1,034	0.004	639.5556	geo_news_2019_00544831
16528	საქართველოს აზერბაიჯანის რესპუბლიკის თავდაცვის მინისტრი ეწვია - news.	Y	ეწვია	2177	  1,034	0.004	746	geo_news_2016_00787916
16529	• საქართველოს ოფიციალური ვიზიტით იტალიის რესპუბლიკის საგარეო საქმეთა მინისტრი ეწვია.	Y	ეწვია	2177	  1,034	0.004	843.6667	geo_news_2016_00792072
16530	ირაკლი ღარიბაშვილი თურქეთში საქართველოს საელჩოს ეწვია - news.	Y	ეწვია	2177	  1,034	0.004	1055.8571	geo_news_2016_00417359
16531	რაც შეეხება საქართველოს, ჩვენ კმაყოფილი ვართ მდგომარეობით.	Y	მდგომარეობით	2177	  1,034	0.004	672.5714	geo_news_2016_00699275
16532	ამ წუთის მდგომარეობით კი უმრავლესობას ეს ერთი კანდიდატი ჰყავს.	Y	მდგომარეობით	2177	  1,034	0.004	799.5556	geo_news_2016_00090833
16533	რაც შეეხება არჩევნებს, ამ წუთის მდგომარეობით, ჩვენი, ხელისუფლებაში ყოფნის პირობებში ორი არჩევნები ჩატარდა.	Y	მდგომარეობით	2177	  1,034	0.004	844.2308	geo_news_2016_00694811
16534	არის ძალიან კარგი მანქანა და ძაან კაი მდგომარეობით.	Y	მდგომარეობით	2177	  1,034	0.004	917.125	geo_news_2019_00098560
16535	როგორც უწყებაში აცხადებენ, 2 წლამდე ბავშვი მძიმე მდგომარეობით, საავადმყოფოში გადაიყვანეს.	Y	მდგომარეობით	2177	  1,034	0.004	1057.6667	geo_news_2016_00726827
16536	მისივე თქმით, სამინისტროს გარეთ შეხვედრა ირაკლი ღარიბაშვილის ინიციატივა იყო.	Y	ღარიბაშვილის	2177	  1,034	0.004	589.7778	geo_news_2016_00572127
16537	ღარიბაშვილის საქმიანობას მოსახლეობის 51% კარგად, ან ძალიან კარგად აფასებს - news.	Y	ღარიბაშვილის	2177	  1,034	0.004	732.25	geo_news_2016_00880895
16538	ამ სახლში ღარიბაშვილის დედა და მამა ცხოვრობენ.	Y	ღარიბაშვილის	2177	  1,034	0.004	835	geo_news_2016_00085539
16539	ირაკლი ღარიბაშვილის კიდევ ერთი განცხადება ქვეყნის ეკონომიკურ ზრდას ეხებოდა.	Y	ღარიბაშვილის	2177	  1,034	0.004	897.8889	geo_news_2016_00417564
16540	ირაკლი ღარიბაშვილის თქმით, საქართველოს მიზანია იყოს აღმოსავლეთ პარტნიორობის რეგიონში წარმატების ნათელი მაგალითი.	Y	ღარიბაშვილის	2177	  1,034	0.004	1017.8333	geo_news_2016_00417552
16541	ამასთან, ტემპერატურა იმდენად მაღალი აღარ იქნება, როგორც დღეს და გუშინ ფიქსირდებოდა.	Y	ტემპერატურა	2178	  1,033	0.004	649.3636	geo_news_2016_00045271
16542	თუ გამომდინარე დიდი ყინვებიდან, ყოველთვის არ არის ის ტემპერატურა, რაც უნდა იყოს, ეს ალბათ ყველასთვის გასაგები უნდა იყოს, მაგრამ ყოველთვის არის ის ტემპერატურა, რომ მათ ვარჯიშში ხელი არ შეეშალოთ.	Y	ტემპერატურა	2178	  1,033	0.004	800.0909	geo_news_2016_00370476
