ORDER	SENTENCE	STATUS	WORD	RANK	COUNT	COUNT_REL	INDEX	ID
16240	ამ ეტაპზე ისე ჩანს, რომ უკრაინას საქმის მოგების მეტი იმედი აქვს, მაგრამ არბიტრაჟში საქმის გარჩევა ძალიან დიდ დროს მოითხოვს.	Y	მოგების	2161	  1,051	0.0041	758.3333	geo_news_2016_00057012
16241	გამოძიება კი სისხლის სამართლის კოდექსის 214-ე მუხლის მეორე ნაწილით მიმდინარეობს.	Y	ნაწილით	2161	  1,051	0.0041	571	geo_news_2019_00187270
16242	გამოძიება მიმდინარეობს ს.სამართლის კოდექსის 276-ე მუხლის პირველი ნაწილით.	Y	ნაწილით	2161	  1,051	0.0041	594	geo_news_2016_00194595
16243	გამოძიება სისხლის სამართლის კოდექსის 333-ე მუხლის პირველი ნაწილით მიმდინარეობს.	Y	ნაწილით	2161	  1,051	0.0041	633.1111	geo_news_2016_00194859
16244	პროკურატურის ინფორმაციით, გამოძიება სისხლის სამართლის კოდექსის 362-ე მუხლის პირველი ნაწილით არის დაწყებული.	Y	ნაწილით	2161	  1,051	0.0041	662	geo_news_2019_00672066
16245	დანაშაული გათვალისწინებული საქართველოს სისხლის სამართლის კოდექსის 223-ე მუხლის I ნაწილით.	Y	ნაწილით	2161	  1,051	0.0041	890.6	geo_news_2016_00242973
16246	ადგილობრივები აცხადებენ რომ 2008 წლის აგვისტოს ომის შემდეგ სოფელში სასმელი წყალი პრობლემა გახდა.	Y	სასმელი	2161	  1,051	0.0041	742.1667	geo_news_2019_00021214
16247	ძალიან რთული იყო ყველაფერი, საჭმელი არ გვქონდა და სასმელი.	Y	სასმელი	2161	  1,051	0.0041	754.2222	geo_news_2016_00965885
16248	რა მდგომარეობაა დღეს ამ მხრივ და არის თუ არა აუცილებელი სასმელი წყლის ადუღება?	Y	სასმელი	2161	  1,051	0.0041	775.6923	geo_news_2019_00682720
16249	მთავარი იდეა კი ის არის, რომ მასში არ გაიყიდება არც ერთი ალკოჰოლური სასმელი.	Y	სასმელი	2161	  1,051	0.0041	799	geo_news_2016_00549039
16250	მნიშვნელოვანია ის ფაქტი, რომ სასმელი იყოს კარგად გაზირებული.	Y	სასმელი	2161	  1,051	0.0041	799.875	geo_news_2019_00591309
16251	აი რა ხდება უფლის სამყაროში მათ თავს, ვინც ფიქრობს, რომ სამყარო მათ ეკუთვნის და არა ღმერთს.	Y	უფლის	2161	  1,051	0.0041	789.8	geo_news_2019_00029767
16252	უფლის წინაშე ხომ “ერთი დღე, ვითარცა ათასი წელი…”	Y	უფლის	2161	  1,051	0.0041	823.75	geo_news_2019_00844290
16253	მას, ვისაც უფლის იმედი აქვს, არ შეიძლება, რომ მიზანს ასცდეს.	Y	უფლის	2161	  1,051	0.0041	831.6	geo_news_2019_00519175
16254	იმდენად დიდი იყო მისი სიმშვიდე, რომ უფლის მეგობარი იყო.	Y	უფლის	2161	  1,051	0.0041	847.5	geo_news_2016_00405389
16255	ღმერთი კი მოწყალეა და ადამიანს ყოველთვის უნდა ჰქონდეს უფლის იმედი.	Y	უფლის	2161	  1,051	0.0041	913.8	geo_news_2019_00875716
16256	იარაღის ხელმისაწვდომობა, როგორც ცივი, ისე ცეცხლსასროლი, ბუნებრივია, იქნება ერთ-ერთი მთავარი საკითხი, რომელსაც განიხილავს სამუშაო ჯგუფი.	Y	ცეცხლსასროლი	2161	  1,051	0.0041	769.8125	geo_news_2019_00395168
16257	შინაგან საქმეთა სამინისტრომ ჩვენთან საუბრისას არ დაადასტურა ინფორმაცია იმის შესახებ, რომ გარდაცვლილი ცეცხლსასროლი იარაღით არის მოკლული.	Y	ცეცხლსასროლი	2161	  1,051	0.0041	842.6875	geo_news_2016_00921646
16258	პროკურორის ოჯახის წევრებს არც იმის შესახებ აქვს ინფორმაცია, არის თუ არა ქირია მოკლული ცეცხლსასროლი იარაღით.	Y	ცეცხლსასროლი	2161	  1,051	0.0041	922.0667	geo_news_2016_00675290
16259	დიდ ბრიტანეთში, პოლიციამ ცეცხლსასროლი იარაღი ერთი წლის განმავლობაში სულ 7-ჯერ გაისროლა - news.	Y	ცეცხლსასროლი	2161	  1,051	0.0041	926.8333	geo_news_2016_00256842
16260	მან აღნიშნა, რომ შემთხვევის ადგილზე, მათ შორის არც ავტომანქანის წინა მარჯვენა კართან, რომელიც იყო ღია და არც დაკავებულ პირებთან, ან საბარგულზე ცეცხლსასროლი იარაღი ან სხვა საბრძოლო მასალა არ არსებობდა და მისი იქ ყოფნის პერიოდში, მსგავსი რამ არ უნახავს.	Y	ცეცხლსასროლი	2161	  1,051	0.0041	957.0294	geo_news_2016_00502724
16261	იმიტომ, რომ ამ ეტაპზე აღკვეთის ღონისძიების არც ახალი გარემოება არსებობდა, აბსოლუტურად არანაირი საფუძველი არ არსებობს.	Y	აღკვეთის	2162	  1,050	0.0041	732.5333	geo_news_2016_00409103
16262	დარწმუნებული ვარ, გამოძიება გაგრძელდება და აუცილებლად დადგინდება, ვის მიერ იყო ეს დაგეგმილი“, - განაცხადა სახელმწიფო უსაფრთხოების სამსახურმა დღეს საქართველოში ტერორისტული აქტის აღკვეთის შესახებ განაცხადა.	Y	აღკვეთის	2162	  1,050	0.0041	750.3182	geo_news_2016_00245307
16263	შესაბამისად, გიორგი უგულავას მიმართ არ იქნა გამოყენებული აღკვეთის ღონისძიების არც ერთი სახე.	Y	აღკვეთის	2162	  1,050	0.0041	762.8333	geo_news_2016_00910713
16264	შსს-მ გამოძიება თავისუფლების უკანონო აღკვეთის მუხლით დაიწყო.	Y	აღკვეთის	2162	  1,050	0.0041	797.125	geo_news_2019_00922710
16265	”ქართულმა საზოგადოებამ არც თუ ისე დიდი ხნის წინ ბევრი კითხვა დასვა იმასთან დაკავშირებით, რა ხდებოდა თავისუფლების აღკვეთის დაწესებულებებში და როგორ იყო იქ ადამიანის უფლებები დაცული.	Y	აღკვეთის	2162	  1,050	0.0041	810.68	geo_news_2016_00874371
16266	მისივე თქმით, მან შესაბამისი ბრძანება უკვე მიიღო.	Y	ბრძანება	2162	  1,050	0.0041	439.4286	geo_news_2019_00575661
16267	სად არის სასამართლოს ბრძანება და ვინ აკეთებს ამას?	Y	ბრძანება	2162	  1,050	0.0041	488.5	geo_news_2016_00753036
16268	ჟურნალისტის თქმით, მან არ იცის ვინ იყო ის პირი, ვინც მათი დაკავების ბრძანება გასცა.	Y	ბრძანება	2162	  1,050	0.0041	701.0714	geo_news_2019_00675683
16269	მე ჯერ არ მინახავს ბრძანება, ან რაიმე სხვა დოკუმენტი.	Y	ბრძანება	2162	  1,050	0.0041	726	geo_news_2016_00547711
16270	ასე რომ, სავარაუდოდ, მან პოლიციის ბრძანება ვერც გაიგო.	Y	ბრძანება	2162	  1,050	0.0041	742.125	geo_news_2016_00126711
16271	ის ნამდვილად არ არის “ფრაერი” და ეს ყველაფერი ძალიან კარგად დაინახა.	Y	დაინახა	2162	  1,050	0.0041	542.3636	geo_news_2019_00428634
16272	მან ეს გაიგო და მისი მომავალი აქ დაინახა.	Y	დაინახა	2162	  1,050	0.0041	630.375	geo_news_2019_00507993
16273	ეს ნაბიჯი მას შემდეგ გადადგა, რაც ბატონი ბიძინა ივანიშვილი მოვიდა პოლიტიკაში და მისი ადგილი ამ გუნდში დაინახა.	Y	დაინახა	2162	  1,050	0.0041	666.5882	geo_news_2019_00303616
16274	მან ფინანსთა სამინისტროში საკუთარი თავი ვეღარ დაინახა..	Y	დაინახა	2162	  1,050	0.0041	691	geo_news_2016_00506850
16275	მისივე თქმით, რუსეთი საქართველოში ვერ გადმოვა, თუ მან აქ საჭირო ფონი არ დაინახა.	Y	დაინახა	2162	  1,050	0.0041	724.9231	geo_news_2016_00571889
16276	სასამართლო კი დემოკრატიულ ქვეყანაში უნდა იყოს დამოუკიდებელი.	Y	დემოკრატიულ	2162	  1,050	0.0041	532.4286	geo_news_2016_00779394
16277	ეს ის არ იყო, რაც დემოკრატიულ საზოგადოებაში უნდა ხდებოდეს.	Y	დემოკრატიულ	2162	  1,050	0.0041	704.8889	geo_news_2016_00303278
16278	რუსეთის საგარეო საქმეთა მინისტრმა უკრაინაში არეულობასთან დაკავშირებით აღნიშნა, რომ სახელმწიფო უნდა იყოს ძლიერი, თუ მას უნდა დარჩეს დემოკრატიულ სახელმწიფოდ.	Y	დემოკრატიულ	2162	  1,050	0.0041	708.6667	geo_news_2016_00740975
16279	ის დარწმუნებულია, რომ „ერთიანი საქართველო-დემოკრატიულ მოძრაობას“ მოსახლეობის ძალიან მნიშვნელოვანი მხარდაჭერა აქვს, განსაკუთრებით საქართველოში ბოლო პერიოდში განვითარებული მოვლენების ფონზე.	Y	დემოკრატიულ	2162	  1,050	0.0041	718.8947	geo_news_2019_00418505
16280	თუმცა, ჩვენ, რა თქმა უნდა, უზრუნველვყოფთ დემოკრატიულ გარემოს და ყველა ადამიანს აქვს გამოხატვის თავისუფლება, კანონის ფარგლებში.	Y	დემოკრატიულ	2162	  1,050	0.0041	721.625	geo_news_2016_00385941
16281	პროცესი ბათუმის საქალაქო სასამართლოში დღის მეორე ნახევარში გაიმართება.	Y	ნახევარში	2162	  1,050	0.0041	658	geo_news_2016_00676266
16282	ყველა პრობლემა დღის მეორე ნახევარში ბავშვებს უკავშირდება.	Y	ნახევარში	2162	  1,050	0.0041	732.2857	geo_news_2019_00882868
16283	სამუშაოები სავარაუდოდ, ოქტომბრის თვის მეორე ნახევარში დაიწყება.	Y	ნახევარში	2162	  1,050	0.0041	873.4286	geo_news_2016_00770536
16284	ადვოკატმა განცხადება უწყებაში დღის პირველ ნახევარში შეიტანა.	Y	ნახევარში	2162	  1,050	0.0041	1244.4286	geo_news_2019_00022525
16285	ვიზიტი გერმანიაში სავარაუდოდ, ივნისის პირველ ნახევარში შედგება.	Y	ნახევარში	2162	  1,050	0.0041	1312.1429	geo_news_2016_00331124
16286	პარლამენტის თავმჯდომარე ირაკლი კობახიძე, დღეს, საქართველოს ეროვნული უშიშროების საბჭოს სხდომას…	Y	სხდომას	2162	  1,050	0.0041	621.5	geo_news_2019_00649552
16287	სხდომას პარტიის თავმჯდომარე პარლამენტის თავმჯდომარე მთავრობის წევრები და მმართველი პარტიის სხვა ლიდერები ესწრებოდნენ.	Y	სხდომას	2162	  1,050	0.0041	737.3636	geo_news_2019_00819054
16288	სხდომას ესწრებოდნენ სამხრეთ ოსეთის ცენტრალური საარჩევნო კომისიის წარმომადგენლები.	Y	სხდომას	2162	  1,050	0.0041	904.375	geo_news_2016_00832018
16289	სხდომას დღეს მმართველი და ოპოზიციური პარტიების წარმომადგენლები ესწრებოდნენ.	Y	სხდომას	2162	  1,050	0.0041	1029.875	geo_news_2016_00831999
16290	კომიტეტის სხდომას კომიტეტის წევრი ეკა ბესელია ესწრებოდა.	Y	სხდომას	2162	  1,050	0.0041	1364.8333	geo_news_2016_00460730
16291	მაგრამ თუ ეს არის იმ პოლიტიკის გაგრძელება, როდესაც ცალი ხელით გეფერებიან და მეორე ხელით გჭრიან ხელს, მაშინ ეს, რა თქმა უნდა, ვერანაირად ვერ იქნება მისასალმებელი,”- განაცხადა იაკობაშვილმა, ”მე ვფიქრობ, რომ ყველაფერი ამ რამოდენიმე დღეში გაირკვევა”.	Y	ცალი	2162	  1,050	0.0041	866.3939	geo_news_2019_00487115
16292	პირველი მატჩის მოგება ყველას უნდა, მაგრამ არ ვეთანხმები მათ, ვინც ამბობს, რომ ამ თამაშის მომგები ცალი ფეხით მეოთხედფინალში იქნება.	Y	ცალი	2162	  1,050	0.0041	902.3684	geo_news_2019_00657578
16293	ვრცელდება ინფორმაცია რომ მან ცალი ხელი დაკარგა და კრიტიკულ მდგომარეობაშია“, – განაცხადეს ს თავდაცვის სამინისტროში.	Y	ცალი	2162	  1,050	0.0041	965.7857	geo_news_2019_00335427
16294	მისი ჯანმრთელობის მდგომარეობა იმ პერიოდისთვის სტაბილური იყო, თუმცა ცალი თირკმელი აღარ ჰქონდა.	Y	ცალი	2162	  1,050	0.0041	1064.9167	geo_news_2019_00582434
16295	კი ვჭამე ორი ცალი მაგრამ მაინც ვერ დავნაყრდი.	Y	ცალი	2162	  1,050	0.0041	1094.125	geo_news_2019_00458000
16296	ალბათ მართლა არსებობს სადმე ის ადგილი, სადაც ყველაფერი სხვანაირად არის.	Y	სადმე	2163	  1,049	0.004	613.1	geo_news_2019_00032371
16297	ახლა ნამდვილად არ ვიყავი მზად იმისთვის, რომ ასე მალე სადმე წავსულიყავით და, შესაბამისად, ჩემთვის მოულოდნელი იყო.	Y	სადმე	2163	  1,049	0.004	654.9375	geo_news_2019_00146327
16298	მაგრამ თუ იმავე საზოგადოებას არ სურს მსგავსი რამ აშშ-ში ან ევროპაში გაკეთდეს, ეს იმას არ ნიშნავს, რომ ასეთი ოპერაცია სადმე სხვაგან არ გაკეთდება.	Y	სადმე	2163	  1,049	0.004	717.5	geo_news_2016_00481510
16299	არ ვიცი, კონკრეტულ შემთხვევებზე თუ არის საუბარი, თუ სადმე რომელიმე რაიონში, რომელიმე სიაში აღმოჩნდა ნაციონალური მოძრაობის ყოფილი წარმომადგენელი, ამაზე მე რა კომენტარი უნდა გავაკეთო?	Y	სადმე	2163	  1,049	0.004	717.7727	geo_news_2016_00105008
16300	ის შეიძლება სადმე ძალიან ახლოს იყოს, მაგრამ რაღაც მიზეზით მაინც ვერ შევამჩნიოთ.	Y	სადმე	2163	  1,049	0.004	733.75	geo_news_2019_00431742
16301	შემდეგ ჩვენ გავემგზავრებით შენს ან ჩემს საიტზე და ერთმანეთს ჩვენ-ჩვენს ფაილებს გავუხსნით.	Y	ფაილებს	2163	  1,049	0.004	1049.5833	geo_news_2019_00904133
16302	ეროვნული ლიგა ქ 2019-ის ანგარიშები - ფეხბურთი/ახალი ზელანდია ჩვენ ვიყენებთ ქუქი-ფაილებს და სხვა ტექნოლოგიებს ხარისხის გაუმჯობესების მიზნით.	Y	ფაილებს	2163	  1,049	0.004	1206.7778	geo_news_2019_00288084
16303	სისტემა შეგეკითხებათ გადავაწეროთ თუ არა უკვე არსებულ ფაილებს?	Y	ფაილებს	2163	  1,049	0.004	1223.625	geo_news_2019_00798185
16304	მსოფლიოს საკლუბო ჩემპიონატი 2018-ის კალენდარი - ფრენბურთი/მსოფლიო ჩვენ ვიყენებთ ქუქი-ფაილებს და სხვა ტექნოლოგიებს ხარისხის გაუმჯობესების მიზნით.	Y	ფაილებს	2163	  1,049	0.004	1289.7059	geo_news_2019_00612089
16305	პრემიერ ლიგა 2001 - შედეგები, ფეხბურთი რუსეთი - ფლეშსქორიჩვენ ვიყენებთ ქუქი-ფაილებს და სხვა ტექნოლოგიებს ხარისხის გაუმჯობესების მიზნით.	Y	ფაილებს	2163	  1,049	0.004	1293.8	geo_news_2019_00666232
16306	შესაბამისად, ვფიქრობ, რომ ეს კონფლიქტი არის ხელოვნური.	Y	ხელოვნური	2163	  1,049	0.004	698.8571	geo_news_2016_00911095
16307	მისი თქმით, ის სასამართლოს გადაწყვეტილებას, რომ საქართველოში ექსტრადირებას არ მოახდენდნენ, ელოდა, რადგან მის წინააღმდეგ ორივე საქმე ხელოვნური იყო.	Y	ხელოვნური	2163	  1,049	0.004	709	geo_news_2019_00577843
16308	მისივე თქმით, ეს არის აბსოლუტურად ხელოვნური და სამარცხვინო პროცესი.	Y	ხელოვნური	2163	  1,049	0.004	713.8889	geo_news_2016_00569587
16309	არ გამოცხადდა თითქმის არავინ და კიდევ მინდა ხაზი გავუსვა, რომ ეს არის ხელოვნური პროცესი, - განაცხადა ლევან მურუსიძემ.	Y	ხელოვნური	2163	  1,049	0.004	748.7059	geo_news_2016_00103447
16310	ყველაფერ ამას ერთი ძლიერი ხელი აკავებდა და ეს ძალიან ხელოვნური იყო.	Y	ხელოვნური	2163	  1,049	0.004	831.6364	geo_news_2016_00889172
16311	არ ვიცი, როგორი უნდა იყოს ჩემთვის იდეალური ოჯახი.	Y	იდეალური	2164	  1,047	0.004	549.375	geo_news_2019_00096751
16312	ჩემი და, 22 წლის იყო, როცა შვილი გააჩინა, ეს მისი იდეალური დრო იყო.	Y	იდეალური	2164	  1,047	0.004	569.4545	geo_news_2019_00928324
16313	იმას არ ვამბობ, რომ დღეს იდეალური პირობები გვაქვს, მაგრამ მაინც მგონია, რომ მისი ეს განცხადება ცოტა გადაჭარბებული იყო.	Y	იდეალური	2164	  1,047	0.004	597.4118	geo_news_2016_00404912
16314	ეს, რა თქმა უნდა, იდეალური ვარიანტი იქნება.	Y	იდეალური	2164	  1,047	0.004	663.5714	geo_news_2016_00311603
16315	”რა თქმა უნდა, იდეალური იქნებოდა, ყველაფერი ბოლომდე კარგად დასრულებული.	Y	იდეალური	2164	  1,047	0.004	683.8889	geo_news_2016_00682765
16316	მან ასევე აღნიშნა, რომ ივანიშვილი ხელისუფლებაში დემოკრატიული, თავისუფალი არჩევნების გზით მოვა.	Y	მოვა	2164	  1,047	0.004	560.0909	geo_news_2016_00501579
