ORDER	SENTENCE	STATUS	WORD	RANK	COUNT	COUNT_REL	INDEX	ID
7433	رهبر معظم انقلاب: امام به ملت ما یاد داد چه کنیم و حرکت کردیم؛ امروز هم این راه ادامه دارد.	Y	یاد	1433	    6,545	0.0091	322.3	persian_news_2019_00530120
7434	و همکاری دستگاه های یاد شده برای ایجاد اشتغال.	Y	یاد	1433	    6,545	0.0091	359.1111	persian_news_2019_00991738
7435	پایگاه اطلاع رسانی ریاست جمهوری به موجب یاد شده..	Y	یاد	1433	    6,545	0.0091	541.3333	persian_news_2017_00368675
7436	رسانه های خارجی امروز برای مردم ايران با اهميت اند.	Y	اهميت	1434	    6,543	0.0091	257.1	persian_news_2017_00582159
7437	به باور من بايد تا آنجا که امکان دارد به اين موضوع اهميت داد.	Y	اهميت	1434	    6,543	0.0091	354.6923	persian_news_2017_00314459
7438	ابتدا جمله ای مثل اين را مطرح می کنند: «من فکر می کنم مقامات دولتی به آنچه که مردمی مثل من فکر می کنند اهميت نمی دهند.»	Y	اهميت	1434	    6,543	0.0091	403.5238	persian_news_2019_00017380
7439	با اين همه، وی بر اهميت حل موارد اختلاف ميان ژاپن و کره شمالی تاکيد کرد.	Y	اهميت	1434	    6,543	0.0091	467.25	persian_news_2016_00241963
7440	هر بازي به اندازه خودش اهميت دارد.	Y	اهميت	1434	    6,543	0.0091	691.8571	persian_news_2016_00867038
7441	در یک نظر باشد باید به آن احترام.	Y	احترام	1435	    6,539	0.0091	214	persian_news_2019_00481176
7442	به درخواست دولت قانونی انجام شده است احترام می.	Y	احترام	1435	    6,539	0.0091	305.8889	persian_news_2019_00269259
7443	و آن اینکه جامعه ای که در آن آزادی و عدالت حاکم باشد، هر فردی از احترام برخوردار است.	Y	احترام	1435	    6,539	0.0091	366.2941	persian_news_2019_00935345
7444	آقای احمدی‌نژاد را مردم انتخاب کردند و بايد به انتخاب مردم احترام گذاشت.	Y	احترام	1435	    6,539	0.0091	392.9091	persian_news_2017_00077522
7445	دوست دارم در بين تيم ملی و رسانه‌ها احترام ايجاد شود.	Y	احترام	1435	    6,539	0.0091	575.9091	persian_news_2017_00568195
7446	به گزارش ایرنا، وی این مطلب را امروز عنوان کرد.	Y	مطلب	1436	    6,537	0.0091	189	persian_news_2016_00320620
7447	چند وقت پيش هم ايشان اين مطلب را گفته بود.	Y	مطلب	1436	    6,537	0.0091	323	persian_news_2016_00432363
7448	مرکز تحقیقات راه مسکن و شهر با بیان این مطلب.	Y	مطلب	1436	    6,537	0.0091	392.3	persian_news_2019_00781256
7449	در ادامه مطلب، نتایج 64 مسابقه به همراه گزارشی کوتاه از جام جهانی ارائه شده است.	Y	مطلب	1436	    6,537	0.0091	489.4	persian_news_2016_00481319
7450	سیاست روز - ارسال اين مطلب به دوستان - پیشنهاد مذاکره با مخالفان ترامپ به چه منظور؟	Y	مطلب	1436	    6,537	0.0091	670.9286	persian_news_2019_00567642
7451	در حال صعود و رشد است اظهار داشت این.	Y	صعود	1437	    6,531	0.009	220.7778	persian_news_2019_00461946
7452	با اشاره به سقوط دو تیم از سه تیم صعود کرده فصل قبل ؛	Y	صعود	1437	    6,531	0.009	315.8333	persian_news_2019_00193963
7453	قهرمانی و صعود استقلال کمک می کند اما نتیجه.	Y	صعود	1437	    6,531	0.009	390	persian_news_2019_00682529
7454	به این ترتیب در جمع چهار تیم غرب آسیا که به مرحله بعد صعود کرده‌اند، عربستان سعودی سه نماینده دارد.	Y	صعود	1437	    6,531	0.009	449.3158	persian_news_2016_00307161
7455	سیاست روز - ارسال اين مطلب به دوستان - حکم صعود امضا مي‌شود؟	Y	صعود	1437	    6,531	0.009	695.5455	persian_news_2019_00567704
7456	قبل از دولت ما قیمت پایین بوده و بعد از دولت ما هم پایین آمده است.	Y	پایین	1438	    6,522	0.009	217.75	persian_news_2019_00671728
7457	تاکید کرد با توجه به مالی و درآمد پایین.	Y	پایین	1438	    6,522	0.009	329	persian_news_2019_00335637
7458	پایین تر از نمونه خارجی آن وارد بازار خواهد شد.	Y	پایین	1438	    6,522	0.009	385.3	persian_news_2016_00367145
7459	آزادی سرمایه‏گذاری در این شاخص در ایران بسیار پایین- 10درصد - ارزیابی شده است.	Y	پایین	1438	    6,522	0.009	442.1538	persian_news_2017_00038050
7460	برای متوسط به پایین و در شان و جایگاه.	Y	پایین	1438	    6,522	0.009	646.125	persian_news_2019_00234767
7461	نوروز امسال بیش از سه میلیون و ۵۰۰.	Y	نوروز	1439	    6,521	0.009	315.7143	persian_news_2019_00855027
7462	هفته نامه صدا در ویژه نامه نوروز 1396 به رابطه بخش خصوصی و دولت برای حل مشکلات کسب و کار پرداخت.	Y	نوروز	1439	    6,521	0.009	346.5	persian_news_2017_00876771
7463	و مشارکت کشورهای حوزه نوروز در مناطق مختلف روسیه.	Y	نوروز	1439	    6,521	0.009	390	persian_news_2019_00988044
7464	به ويژه برنامه‌های نوروز و انتخاباتی که در پيش رو داريم.	Y	نوروز	1439	    6,521	0.009	516.3636	persian_news_2017_00363114
7465	جامع خدمات گردشگری در نوروز خبر داد.	Y	نوروز	1439	    6,521	0.009	586.1429	persian_news_2019_00370682
7466	تولید می شود گفت 360 هزار هکتار از این.	Y	هکتار	1440	    6,520	0.009	215.125	persian_news_2019_00367802
7467	سطح 265 هزار هکتار و در استان هایی که ای..	Y	هکتار	1440	    6,520	0.009	315.8889	persian_news_2017_00630232
7468	اختصاص یافته است که در هر هکتار..	Y	هکتار	1440	    6,520	0.009	406.4286	persian_news_2016_00026351
7469	الله تا پایان 50 هزار هکتار زمین دیگر.	Y	هکتار	1440	    6,520	0.009	469.7143	persian_news_2019_00100730
7470	در دنیا متوسط حدود ۶ تن در هکتار.	Y	هکتار	1440	    6,520	0.009	703.6667	persian_news_2019_00467573
7471	این روند در آزمون سال 1387 نیز ادامه داشت.	Y	آزمون	1441	    6,519	0.009	250.875	persian_news_2019_00144075
7472	معاون وزیر آموزش و پرورش با بیان اینکه آزمون.	Y	آزمون	1441	    6,519	0.009	304.8889	persian_news_2019_00803783
7473	وی بیان کرد : همچنین از ابتدای سال جاری تاکنون 795 مورد آزمون از جایگاه های عرضه سوخت استان اجرا شد.	Y	آزمون	1441	    6,519	0.009	385.1111	persian_news_2017_00930772
7474	کنفرانس افغانستان می‌تواند برای آزمون اين تغيير سياست به کار گرفته شود.	Y	آزمون	1441	    6,519	0.009	470.8333	persian_news_2017_00730915
7475	امروز آزمون از ابتدا به ميدان رفت.	Y	آزمون	1441	    6,519	0.009	638.8571	persian_news_2016_00130296
7476	پس گفته ها و نوشته های من شما را به تغيير نظام می خواند.	Y	خواند	1442	    6,518	0.009	228.2857	persian_news_2016_00377221
7477	های بازار ارز و ها خواند و خاطرنشان کرد.	Y	خواند	1442	    6,518	0.009	343.75	persian_news_2019_00857218
7478	به گزارش روز شنبه خبرگزاری فارس، محمد حسین نجات که درباره انتخابات آینده مجلس شورای اسلامی و مجلس خبرگان سخن می گفت،‌ این انتخابات را آزمون بسیار مهمی برای وزارت کشور و شورای نگهبان خواند.	Y	خواند	1442	    6,518	0.009	391.8065	persian_news_2016_00337887
7479	احمد شهید گفت نتایج انتخابات در ایران را رای اعتماد به سیاست های دولت روحانی خواند.	Y	خواند	1442	    6,518	0.009	421.5	persian_news_2019_00025748
7480	خواند دفتر با صدور بیانیه ای تصریح کرد..	Y	خواند	1442	    6,518	0.009	584.5	persian_news_2017_00472939
7481	البرز را در بر های خود برای ساخت و توسعه.	Y	البرز	1443	    6,517	0.009	198.8	persian_news_2019_00098970
7482	مطرح کرد  واقع در استان البرز از نظارت شهرداری.	Y	البرز	1443	    6,517	0.009	346.3	persian_news_2019_00793460
7483	رئیس پلیس مبارزه با مواد مخدر البرز خبر داد؛	Y	البرز	1443	    6,517	0.009	440.8889	persian_news_2019_00541528
7484	کم بهره اشتغال روستایی استان البرز نیز اعلام شد.	Y	البرز	1443	    6,517	0.009	542.2222	persian_news_2019_00707332
7485	مازندران تهران البرز قزوین زنجان همدان کرمانشاه مرکزی قم.	Y	البرز	1443	    6,517	0.009	968.6667	persian_news_2019_00740248
7486	به همين دليل به نظر من، بسيار مهم است که اين مسائل با هم ديده شود.	Y	ديده	1444	    6,513	0.009	220.2667	persian_news_2016_00360568
7487	آنها بازی من را ديده و به تيم ملی آمريکا دعوت کردند.	Y	ديده	1444	    6,513	0.009	282.4167	persian_news_2016_00167677
7488	براى من آنچه اهميت دارد اين است كه فيلم ديده شود.	Y	ديده	1444	    6,513	0.009	444.0909	persian_news_2017_00282555
7489	آنچه الان ديده می‌شود دخالت دولت در اين صنعت است؟	Y	ديده	1444	    6,513	0.009	520.1	persian_news_2017_00145779
7490	‏ حالا كه متن خبر را ديده اي علت روشن است.	Y	ديده	1444	    6,513	0.009	587.4	persian_news_2017_00444371
7491	دولت عراق در تعامل با ايران ميان سياست و اقتصاد ارتباط ايجاد می کند.	Y	تعامل	1445	    6,496	0.009	261.8571	persian_news_2016_00565958
7492	​ راه های گسترش همکاری و تعامل بین دو.	Y	تعامل	1445	    6,496	0.009	341.375	persian_news_2019_00517302
7493	از وزارت اطلاعات درخواست مذاکره و تعامل دارند وی.	Y	تعامل	1445	    6,496	0.009	398.2222	persian_news_2019_00056867
7494	دعوت از شهردار برای حضور در جلسه های هیات دولت روند تازه ای از تعامل میان شهرداری و نهادهای دولتی را رقم خواهد زد.	Y	تعامل	1445	    6,496	0.009	461.5652	persian_news_2019_00498325
7495	جنوب کرمان گفت آماده تعامل برای ساخت واحدهای.	Y	تعامل	1445	    6,496	0.009	701.375	persian_news_2019_00379603
7496	نیز در این رابطه نقل می کند که محمدرضا.	Y	محمدرضا	1446	    6,491	0.009	263.8889	persian_news_2019_00837179
7497	» محمدرضا در پاسخ به این سوال که اگر.	Y	محمدرضا	1446	    6,491	0.009	319.125	persian_news_2019_00756804
7498	محمدرضا خاتمی گفت: «ما به حرکت خود تا زمان لغو نتایج انتخابات و برگزاری انتخابات جدید ادامه خواهیم داد.»	Y	محمدرضا	1446	    6,491	0.009	410.3889	persian_news_2016_00776774
7499	محمدرضا افزود ایران در حوزه صادرات کشوری جوان به.	Y	محمدرضا	1446	    6,491	0.009	435.8889	persian_news_2019_00756553
7500	با اشاره به اقدامات محمدرضا احمدی نژاد سرپرست.	Y	محمدرضا	1446	    6,491	0.009	513.375	persian_news_2019_00193806
7501	به نظر من وجود دارد و صد سال هم است که وجود دارد.	Y	صد	1447	    6,485	0.009	162.0909	persian_news_2017_00357294
7502	وی افزود: در دو سال گذشته 11 میلیون نفر از جمعیت ایران تحت پوشش بیمه قرار گرفتند و در حال حاضر صد درصد جمعیت ایران تحت پوشش بیمه قرار دارند.	Y	صد	1447	    6,485	0.009	303.5909	persian_news_2016_00913311
7503	این مسئول اضافه کرد: پیگیری و صدور رای برای ارسال پرونده ‍‌ها به کمیسیون ماده صد با سرعت خوبی در حال انجام است.	Y	صد	1447	    6,485	0.009	370.4783	persian_news_2017_00163300
7504	بيش از صد هزار نفر ورزشگاه را پر کرده بودند.	Y	صد	1447	    6,485	0.009	448.1	persian_news_2019_00312550
7505	۶ در صد در سراسر کشور تصويب شد.	Y	صد	1447	    6,485	0.009	613.6667	persian_news_2019_00010305
7506	این افراد در 21 ماه می سال گذشته دستگیر شده اند.	Y	دستگیر	1448	    6,475	0.009	192.5	persian_news_2019_00125795
7507	کسانی که به این دلیل دستگیر شده اند، باید آزاد شوند.	Y	دستگیر	1448	    6,475	0.009	287.4545	persian_news_2016_00724155
7508	این خبرگزاری آن زمان تأکید کرده بود که در جریان این بازداشت، علاوه بر این ۹ نفر، چهار زن ایرانی نیز به اتهام همکاری دستگیر شده‌اند.	Y	دستگیر	1448	    6,475	0.009	341.8261	persian_news_2017_00147861
7509	کشف شد در این زمینه یک متهم دستگیر.	Y	دستگیر	1448	    6,475	0.009	410.5	persian_news_2019_00702656
7510	داعش که برنامه هایی داشتند شناسایی و دستگیر شدند.	Y	دستگیر	1448	    6,475	0.009	599.8889	persian_news_2019_00424014
7511	وی ادامه داد: اگر مجلس آن زمان در انتخاب خود اشتباه کرد امروز نيز دولت در انتخاب خود اشتباه کرده است.	Y	اشتباه	1449	    6,473	0.009	142.5294	persian_news_2016_00897446
7512	ممکن است اشتباه کرده باشد و ممکن است من هم اشتباه کنم.	Y	اشتباه	1449	    6,473	0.009	344.5556	persian_news_2019_00812725
7513	حال به نظر می رسد مسئولان جشنواره اشتباه خود.	Y	اشتباه	1449	    6,473	0.009	378.9	persian_news_2019_00394021
7514	محمود احمدی نژاد گفته بود: «روسيه اشتباه کرد.	Y	اشتباه	1449	    6,473	0.009	521.75	persian_news_2016_00779469
7515	هیچ کدام نتیجه مثبت نداشته اما هنوز همان مسیر اشتباه را طی می‌کنیم.	Y	اشتباه	1449	    6,473	0.009	655	persian_news_2019_00862040
7516	است ادامه داد در این راستا رشته های تلاش شده که رشته ها به صورت.	Y	راستا	1450	    6,465	0.009	209.2667	persian_news_2019_00058408
7517	راستا نیز می توان به بیش از ۵۰۰ میلیارد.	Y	راستا	1450	    6,465	0.009	293.4444	persian_news_2019_00515023
7518	وی اظهار کرد: در همین راستا مشاور معاون هنری وزارت فرهنگ و ارشاد برای حضور در این جلسه به خراسان جنوبی سفر می‌کند.	Y	راستا	1450	    6,465	0.009	349.5	persian_news_2017_00910489
7519	این راستا راه حل است وزیر ارتباطات.	Y	راستا	1450	    6,465	0.009	451.2857	persian_news_2019_00142334
7520	را می‌توان در همین راستا ارزیابی کرد.	Y	راستا	1450	    6,465	0.009	578.7143	persian_news_2016_00573546
7521	راه ديگر البته اين است که مردم دولت را تامين مالی کنند.	Y	تامين	1451	    6,463	0.009	200.3333	persian_news_2016_00574528
7522	چرا که اين حکومت ها منافع آمريکا را تامين می کنند.	Y	تامين	1451	    6,463	0.009	313.7273	persian_news_2017_00431787
7523	زنان، تحت هيچ عنوان تامين اقتصادی و اجتماعی ندارند.	Y	تامين	1451	    6,463	0.009	379.1111	persian_news_2019_00559519
7524	نه تنها به آنها تامين، بلکه قول همکاری داد.	Y	تامين	1451	    6,463	0.009	425.3333	persian_news_2017_00861034
7525	يک مشکل کوچک هم داريم و آن تامين مالی توليد است.	Y	تامين	1451	    6,463	0.009	468.1818	persian_news_2017_00998829
7526	کار این است که در این بخش نیازمند همکاری.	Y	نیازمند	1452	    6,441	0.0089	241.625	persian_news_2019_00685691
7527	۵ میلیارد دلار می رسد که نیازمند توجه ویژه نمایندگان مجلس برای سیاست گذاری در این حوزه است.	Y	نیازمند	1452	    6,441	0.0089	326.1176	persian_news_2019_00009307
7528	است وزیر امور هند افزود امروز جهان نیازمند.	Y	نیازمند	1452	    6,441	0.0089	393.125	persian_news_2019_00065189
7529	رئیس فدراسیون واردات اتاق ایران افزود: ما نیازمند حمایت های بین المللی برای صادرات هستیم.	Y	نیازمند	1452	    6,441	0.0089	450.6	persian_news_2019_00548996
7530	ما نیازمند نگاه جامع به گردشگری سلامت هستیم.	Y	نیازمند	1452	    6,441	0.0089	684.75	persian_news_2019_00742535
7531	ارزش روز بازار نیز در پایان معاملات امروز با هزار میلیارد افزایش نسبت به روز گذشته به از 281 هزار میلیارد تومان است.	Y	معاملات	1453	    6,440	0.0089	181.5	persian_news_2019_00037577
7532	دولت با این اقدام بر نحوه انجام معاملات ها به..	Y	معاملات	1453	    6,440	0.0089	310.9	persian_news_2016_00564884
7533	تهران - ایرنا - قیمت نفت در معاملات امروز (چهارشنبه) با کاهش همراه شد اما همچنان بالای 71 دلار باقی ماند.	Y	معاملات	1453	    6,440	0.0089	406.1667	persian_news_2019_00361023
7534	علاوه بر ثبت معاملات بر تحویل این ها نیز نظارت..	Y	معاملات	1453	    6,440	0.0089	483.4444	persian_news_2016_00680771
7535	این ترتیب بر اساس آمار معاملات تحویل اردیبهشت ماه..	Y	معاملات	1453	    6,440	0.0089	691.1111	persian_news_2017_00142206
7536	توجه این دانشگاه به بازار استان دارد سید علی..	Y	سید	1454	    6,437	0.0089	245.1111	persian_news_2017_00411331
7537	به گزارش ایلنا از قم، سید محمدرضا هاشمی معاون سیاسی امنیتی و اجتماعی استاندار قم با حکم استاندار به عنوان رئیس ستاد انتخابات استان انتخاب شد.	Y	سید	1454	    6,437	0.0089	387.3913	persian_news_2019_00281054
7538	به گزارش پایگاه اطلاع رسانی شبکه خبر سید حسین با بیان اینکه اعتبار لازم برای اجرای این.	Y	سید	1454	    6,437	0.0089	413.7059	persian_news_2019_00285585
7539	امور خارجه سید عباس موسوی منتشر شده به نقل.	Y	سید	1454	    6,437	0.0089	529.6667	persian_news_2019_00122934
7540	داشتند در بازدید سید حسن زاده هاشمی از مناطق..	Y	سید	1454	    6,437	0.0089	656.8889	persian_news_2017_00478527
7541	وی تاکيد کرد: خود دولت بايد کار را در اين زمينه شروع کرده و روابط عمومی را زنده کند.	Y	زنده	1455	    6,436	0.0089	243.7222	persian_news_2016_00935361
7542	زنده با هدف انتقال تجربه و افزایش روش های اضافه کرد حدود دو هفته قبل نیز در.	Y	زنده	1455	    6,436	0.0089	302.7778	persian_news_2019_00560693
7543	مسئله اول ما انتخاب جنبش اصلاحات است و با هر فردی جنبش زنده می ماند بايد به آن توجه کرد.	Y	زنده	1455	    6,436	0.0089	350.5263	persian_news_2017_00799914
7544	ما زنده به ادامه ی حرکت هستيم.	Y	زنده	1455	    6,436	0.0089	509.8571	persian_news_2016_00759595
7545	صدا و در دعوت و پخش زنده اظهارات افراد.	Y	زنده	1455	    6,436	0.0089	735	persian_news_2019_00622853
7546	با این حال اصلاح‌طلبان اعلام کرده‌اند که در انتخابات مجلس همچنان حضور خواهند داشت.	Y	اصلاح‌طلبان	1456	    6,434	0.0089	233.5	persian_news_2017_00239284
7547	آقای هاشمی با این موضع نشان داد از عدم شرکت اصلاح‌طلبان در انتخابات حمایت می‌کند.»	Y	اصلاح‌طلبان	1456	    6,434	0.0089	333.6	persian_news_2016_00084675
7548	اما ما هم از اصلاح‌طلبان انتظار داریم.	Y	اصلاح‌طلبان	1456	    6,434	0.0089	398.8571	persian_news_2019_00112761
7549	سیاست روز - چرا او براي اصلاح‌طلبان قابل احترام است؟	Y	اصلاح‌طلبان	1456	    6,434	0.0089	472.6667	persian_news_2019_00568109
7550	آیا اصلاح‌طلبان می‌توانند از روحانی عبور کنند؟	Y	اصلاح‌طلبان	1456	    6,434	0.0089	785.7143	persian_news_2016_00014987
7551	دولت بايد بخش خصوصی را حمايت کند و حق خود را نيز از آن بگيرد.	Y	بگيرد	1457	    6,432	0.0089	238.2857	persian_news_2016_00564979
7552	براي همين بايد در زندان قرار بگيرد.	Y	بگيرد	1457	    6,432	0.0089	310.1429	persian_news_2016_00279526
7553	اين کار بايد در آنجا صورت بگيرد.	Y	بگيرد	1457	    6,432	0.0089	368.2857	persian_news_2017_00226155
7554	فعالان ايرانی اظهار نگرانی کرده اند که دولت ممکن است پوشش «جنگ با مواد مخدر» را برای اعدام مخالفان سياسی به کار بگيرد.	Y	بگيرد	1457	    6,432	0.0089	415	persian_news_2016_00697913
7555	اينكه پرسپوليس جام بگيرد هنر من نيست.	Y	بگيرد	1457	    6,432	0.0089	701.7143	persian_news_2017_00225722
7556	آيا اين به نظر شما موثر خواهد بود؟	Y	موثر	1458	    6,426	0.0089	274.375	persian_news_2017_00193314
7557	وی همچنین عنوان کرد: اگر خواهان سلامت باشیم، نقش رسانه ها در این زمینه بسیار موثر است.	Y	موثر	1458	    6,426	0.0089	360.7059	persian_news_2019_00991274
7558	سرپرست خانواده در موثر است و اگر نقش.	Y	موثر	1458	    6,426	0.0089	412.5	persian_news_2019_00581309
7559	اين مسئله می‌تواند در رونق بخش کشاورزی بسيار موثر باشد.	Y	موثر	1458	    6,426	0.0089	482.9	persian_news_2017_00230815
7560	یعنی تغییر سوخت می‌تواند یک درصدی موثر باشد.	Y	موثر	1458	    6,426	0.0089	659.625	persian_news_2016_00686366
7561	وی درباره تاثیر برگزاری نمایشگاه در فرهنگ سازی برای بازار سرمایه، بیان داشت: باید برای فرهنگ سازی در خارج از تهران و بخش های مختلف تلاش کرد.	Y	تاثیر	1459	    6,425	0.0089	219.8696	persian_news_2017_00942894
7562	تاثیر دانست و گفت با کمک مردم برای مبارزه..	Y	تاثیر	1459	    6,425	0.0089	314.2222	persian_news_2017_00388822
7563	همشهری آنلاین: بی بی سی اعلام کرد توافق هسته‌ای بازار نفت جهان را نیز تحت تاثیر قرار می‌دهد.	Y	تاثیر	1459	    6,425	0.0089	364.5882	persian_news_2019_00887520
7564	این نه فقط بر ایران بلکه بر کل منطقه تاثیر باقی خواهد گذاشت.	Y	تاثیر	1459	    6,425	0.0089	429.5833	persian_news_2016_00166875
7565	داد این پیش بینی روز بر معاملات تاثیر.	Y	تاثیر	1459	    6,425	0.0089	563.25	persian_news_2019_00420450
7566	این کشور در سال ۱۹۶۲ استقلال خود را از انگلیس به دست آورد.	Y	انگلیس	1460	    6,416	0.0089	224.3333	persian_news_2016_00158676
7567	و انگلیس در آمریکا در دیدار با.	Y	انگلیس	1460	    6,416	0.0089	330.8333	persian_news_2019_00935676
7568	او توانست با تیم ملی انگلیس 20 عنوان قهرمانی به دست آورد.	Y	انگلیس	1460	    6,416	0.0089	415.5455	persian_news_2016_00179000
7569	درباره زندگی شخصی خود در انگلیس با.	Y	انگلیس	1460	    6,416	0.0089	487.2857	persian_news_2019_00450070
7570	ام و سخنرانی هایی به انگلیس داشته ام کسی.	Y	انگلیس	1460	    6,416	0.0089	707.375	persian_news_2019_00123399
7571	رهبر جمهوری اسلامی اما تصور می كند با این وجود باز هم تحریم ها ادامه خواهد داشت.	Y	تصور	1461	    6,391	0.0089	235.8824	persian_news_2017_00588166
7572	او تاکید کرد که این تصور برای ایران خطر امنیتی دارد.	Y	تصور	1461	    6,391	0.0089	325.2727	persian_news_2016_00178637
7573	تصور من این است که در شرایط فعلی، تنها فردی که در صورت تحقق برخی شرایط بازی، می‌تواند وارد آن شود، آقای خاتمی است.	Y	تصور	1461	    6,391	0.0089	376.6	persian_news_2017_00400608
