ORDER	SENTENCE	STATUS	WORD	RANK	COUNT	COUNT_REL	INDEX	ID
7287	مهر ماه سال 95 در محسن تهران واقع در.	Y	محسن	1405	    6,668	0.0092	342.1429	persian_news_2019_00820800
7288	حال محسن در آستانه سال جدید خوب است و با امید درمان خود را ادامه می‌دهد.	Y	محسن	1405	    6,668	0.0092	375.375	persian_news_2019_00394414
7289	محسن حسين زاده هم رتبه ۱۵۹۲ را به خود اختصاص داده است.	Y	محسن	1405	    6,668	0.0092	529.0909	persian_news_2016_00773546
7290	در مورد اظهارات محسن قهرمانی و اینکه فیلم.	Y	محسن	1405	    6,668	0.0092	571.125	persian_news_2019_00486782
7291	با این حال، به گفته این نماینده مجلس، «پیشرفت این طرح تنها حدود پنج درصد بوده است».	Y	پیشرفت	1406	    6,663	0.0092	200.5333	persian_news_2016_00237262
7292	وی در پایان خاطر نشان کرد: هاشمی معتقد است برای تحقق و پیشرفت در بحث کار و اشتغال باید روابط خود را با کشورهای جهان بهتر از گذشته کنیم.	Y	پیشرفت	1406	    6,663	0.0092	297	persian_news_2016_00945631
7293	و پیشرفت در این منطقه به وقوع.	Y	پیشرفت	1406	    6,663	0.0092	365.2857	persian_news_2019_00947960
7294	نیروهای مسلح برای و پیشرفت کشور مورد تصریح قرار.	Y	پیشرفت	1406	    6,663	0.0092	420.5556	persian_news_2019_00836759
7295	مقام معظم رهبری براساس ایرانی پیشرفت نیز تهیه.	Y	پیشرفت	1406	    6,663	0.0092	653.375	persian_news_2019_00808773
7296	در اروپا و جهان، او به عنوان یکی از بهترین های تاریخ مطرح شده است.	Y	بهترین	1407	    6,659	0.0092	207.6	persian_news_2019_00434914
7297	ولی باز هم می‌توان این شرایط را مدیریت کرد و بهترین خرید را انجام داد.	Y	بهترین	1407	    6,659	0.0092	321.4286	persian_news_2019_00986028
7298	این تیم در این فصل توانست با ۴۸ گل زده عنوان بهترین خط حمله لیگ را به خود اختصاص دهد.	Y	بهترین	1407	    6,659	0.0092	375.5556	persian_news_2019_00133814
7299	مثل عراق بهترین رابطه را داشته باشیم » این.	Y	بهترین	1407	    6,659	0.0092	482.625	persian_news_2019_00749017
7300	داشته باشیم نمایشگاه سالانه کتاب بهترین فرصت برای عرضه.	Y	بهترین	1407	    6,659	0.0092	670.8889	persian_news_2019_00423879
7301	از جمله فعالیت‌های استان در این زمینه بوده است.	Y	فعالیت‌های	1408	    6,654	0.0092	229.5556	persian_news_2019_00046756
7302	او علاوه بر امور ورزشی، فعالیت‌های اجتماعی هم دارد.	Y	فعالیت‌های	1408	    6,654	0.0092	379.7778	persian_news_2019_00176844
7303	از جمله ،اطلاعات درباره فعالیت‌های ساخت سلاح که در سال ۲۰۰۳ تحت فشار بین‌المللی متوقف شد.	Y	فعالیت‌های	1408	    6,654	0.0092	403.6	persian_news_2017_00044833
7304	او گفت: فعالیت‌های ایران در عراق بر ضد منافع عراق و علیه نیروهای ائتلاف است.	Y	فعالیت‌های	1408	    6,654	0.0092	427.4286	persian_news_2019_00178250
7305	فعالیت‌های این سازمان باعث شد که این ورزش در سراسر دنیا گسترش یابد.	Y	فعالیت‌های	1408	    6,654	0.0092	537.4167	persian_news_2019_00665106
7306	است اطلاعاتی که درباره در داخل ایران به مردم.	Y	اطلاعاتی	1409	    6,648	0.0092	248.8889	persian_news_2019_00058886
7307	نیز از مقامات وزارت خارجه این کشور خواست اطلاعاتی.	Y	اطلاعاتی	1409	    6,648	0.0092	328.4444	persian_news_2019_00836934
7308	سازمان اطلاعاتی و امنیتی دولتی نیز بر این باور است که ایران در تلاش برای نمایش قدرت است.	Y	اطلاعاتی	1409	    6,648	0.0092	340.1176	persian_news_2019_00565061
7309	گفت با انجام چند عملیات اطلاعاتی و امنیتی محل..	Y	اطلاعاتی	1409	    6,648	0.0092	401.1111	persian_news_2016_00740769
7310	تيم پزشکی آنجا مستقل از تيم امنيتی و اطلاعاتی است.	Y	اطلاعاتی	1409	    6,648	0.0092	593.7778	persian_news_2017_00414686
7311	برخی منابع اعلام کرده اند که وی پیش از این به قتل تهديد شده بود.	Y	تهديد	1410	    6,647	0.0092	217.6	persian_news_2017_00286203
7312	کسانی که برای دوباره انتخاب شدن بر موضوع ايران و تهديد آن کشور تاکيد می کنند.	Y	تهديد	1410	    6,647	0.0092	290.375	persian_news_2016_00724142
7313	اين تهديد خود را چگونه نشان می‌دهد؟	Y	تهديد	1410	    6,647	0.0092	405	persian_news_2017_00211078
7314	تهديد به حمله كردند و بعد اقدام به حمله كردند.	Y	تهديد	1410	    6,647	0.0092	428	persian_news_2016_00407097
7315	مسئولان نبايد با آنها با زبان تهديد صحبت كنند.	Y	تهديد	1410	    6,647	0.0092	582.125	persian_news_2016_00798571
7316	انتخابات خبرگان از استان تهران ٢ نفر و در.	Y	خبرگان	1411	    6,645	0.0092	212	persian_news_2019_00131079
7317	وی پیش از این یک بار نامزد انتخابات خبرگان شده بود.	Y	خبرگان	1411	    6,645	0.0092	298.6364	persian_news_2017_00933522
7318	مالی کشور خبرگان بانکی و اقتصادی برای بررسی.	Y	خبرگان	1411	    6,645	0.0092	382	persian_news_2019_00741595
7319	همچنین هفت نفر از مجموع 99 نماینده دوره پنجم مجلس خبرگان رهبری نمایندگان مردم استان خراسان رضوی خواهند بود.	Y	خبرگان	1411	    6,645	0.0092	438.8333	persian_news_2016_00880941
7320	در جلسه عصر اجلاس خبرگان رهبری چه گذشت؟	Y	خبرگان	1411	    6,645	0.0092	723.75	persian_news_2019_00458495
7321	وی نقش در حال افزایش آذربایجان در منطقه و جهان را مهم ارزیابی کرده است.	Y	ارزیابی	1412	    6,641	0.0092	209.5	persian_news_2019_00989428
7322	ارزیابی ها در حوزه انجام ٦٠٠ مورد نظارت.	Y	ارزیابی	1412	    6,641	0.0092	310.75	persian_news_2019_00037190
7323	خود هستند به گفته کمیته ای مسئول ارزیابی.	Y	ارزیابی	1412	    6,641	0.0092	361.25	persian_news_2019_00419276
7324	جهانی نزدیک است درباره ارزیابی خود از قوانین جدید.	Y	ارزیابی	1412	    6,641	0.0092	457.5556	persian_news_2019_00380397
7325	اقتصادی تقویت سیستم ارزیابی سیاست ها ضرورت دخالت بیشتر.	Y	ارزیابی	1412	    6,641	0.0092	841.1111	persian_news_2019_00083943
7326	اما از این هزینه هایی که در این زمینه انجام شده نقش و سود آن برای رسانه‌ها است.	Y	رسانه‌ها	1413	    6,636	0.0092	271.4706	persian_news_2017_00108031
7327	مهم اين است که نام جمهوری اسلامی در رسانه‌ها مطرح گردد.	Y	رسانه‌ها	1413	    6,636	0.0092	329.9091	persian_news_2017_00831186
7328	سخنگوی دولت با اشاره به اظهارات برخی رسانه‌ها مبنی بر انتخاباتی بودن این اقدام، گفت: این اقدام دولت در راستای عدالت اقتصادی است.	Y	رسانه‌ها	1413	    6,636	0.0092	387.85	persian_news_2019_00575364
7329	بايد رسانه‌ها و احزاب را طبق قانون آزاد کنيم.	Y	رسانه‌ها	1413	    6,636	0.0092	443.4444	persian_news_2016_00258654
7330	کدام رسانه‌ها از حمایت ویژه برخوردار می‌شوند؟	Y	رسانه‌ها	1413	    6,636	0.0092	699.2857	persian_news_2019_00695376
7331	قرار است از چهره های ی که در سال گذشته..	Y	چهره	1414	    6,631	0.0092	198.8	persian_news_2017_00705632
7332	و چهره های فرهنگی در خانه ملی معرفی و از.	Y	چهره	1414	    6,631	0.0092	294.6	persian_news_2019_00953300
7333	چهره های مهم ادامه داد متاسفانه برخی از.	Y	چهره	1414	    6,631	0.0092	352.8889	persian_news_2019_00389850
7334	مهم ترين کار، تغيير چهره ايران در فضای بين المللی است.	Y	چهره	1414	    6,631	0.0092	416.8182	persian_news_2016_00830029
7335	ترین چهره این عرصه در جهان شناخته می.	Y	چهره	1414	    6,631	0.0092	603.25	persian_news_2019_00343933
7336	مسئولان مسابقه بعد از ۵۰ دقيقه با وجود اينکه اعلام شده بود بازی ادامه خواهد يافت، پايان مسابقه را اعلام کردند.	Y	دقيقه	1415	    6,619	0.0092	309.0556	persian_news_2016_00798554
7337	اين گفتگو، چند دقيقه ادامه داشته است.	Y	دقيقه	1415	    6,619	0.0092	394	persian_news_2016_00226515
7338	پس از ۱۵ دقيقه ايران يک گل زد.	Y	دقيقه	1415	    6,619	0.0092	489.5714	persian_news_2016_00371876
7339	نخستين فرصت اين ديدار را استقلال در دقيقه پنجم به دست آورد.	Y	دقيقه	1415	    6,619	0.0092	537.3333	persian_news_2016_00843942
7340	اين تجمع پس از گذشت 20 دقيقه به پايان رسيد.	Y	دقيقه	1415	    6,619	0.0092	597.2222	persian_news_2017_00209856
7341	در سال 1983 به فعالیت خود به عنوان بازیکن پایان داد.	Y	بازیکن	1416	    6,615	0.0092	248.4444	persian_news_2017_00529025
7342	او اما یک خواسته دیگر هم دارد و آن این است که اختیار خرید و فروش بازیکن تا زمانی که سرمربی این تیم است در اختیار خودش باشد.	Y	بازیکن	1416	    6,615	0.0092	313.6522	persian_news_2019_00171024
7343	همچنین قرارداد این بازیکن با حضور در هیات فوتبال استان خوزستان ثبت شد.	Y	بازیکن	1416	    6,615	0.0092	354.1538	persian_news_2017_00884258
7344	مذاکرات استقلال برای بازگشت این بازیکن شروع شده است.	Y	بازیکن	1416	    6,615	0.0092	434.3333	persian_news_2019_00774879
7345	بهترین بازیکن فوتبال معرفی شود سه نامزد سال فوتبال..	Y	بازیکن	1416	    6,615	0.0092	629	persian_news_2016_00310329
7346	که ها هم باید آن را رعایت کنند کار..	Y	رعایت	1417	    6,611	0.0092	191.5556	persian_news_2017_00732576
7347	رئیس شورای اسلامی شهر مشهد گفت: مدیریت شهری باید حقوق مردم به عنوان مصرف کنندگان خدمات شهرداری را رعایت کند.	Y	رعایت	1417	    6,611	0.0092	319.6	persian_news_2019_00548235
7348	در این ساختار حقوق مصرف کننده و تولید کننده رعایت نشده است.	Y	رعایت	1417	    6,611	0.0092	381.0909	persian_news_2019_00442170
7349	ضمن اینکه ما بسیار بیشتر از حتی دشمن حقوق بشر را رعایت می‌کنیم.	Y	رعایت	1417	    6,611	0.0092	450.3077	persian_news_2019_00626668
7350	و خوزستان می توانند با رعایت قوانین و..	Y	رعایت	1417	    6,611	0.0092	666.1429	persian_news_2017_00940575
7351	هنرمندان حوزه ایران در این برنامه حضور دارند.	Y	هنرمندان	1418	    6,608	0.0092	241.375	persian_news_2019_00908172
7352	هنرمندان بازی های ی از جمله اهداف جشنواره بود وی.	Y	هنرمندان	1418	    6,608	0.0092	348.4	persian_news_2019_00908157
7353	تصمیم گرفت که بخشی از نمایشگاه را به آثار هنرمندان خارجی اختصاص دهد.	Y	هنرمندان	1418	    6,608	0.0092	406	persian_news_2016_00397574
7354	و فروش آثار هنری در خانه هنرمندان از.	Y	هنرمندان	1418	    6,608	0.0092	476.25	persian_news_2019_00977869
7355	جنوب استان کرمان گفت هنرمندان ساز می توانند آثار..	Y	هنرمندان	1418	    6,608	0.0092	691.3333	persian_news_2016_00423479
7356	برخی از دوستان در مجلس نقش بازی می کنند.	Y	دوستان	1419	    6,605	0.0091	250.7778	persian_news_2016_00281103
7357	بخش هایی از آن اجرایی شده و بخش هایی از آن به صورت غیر رسمی منتشر شده و در اختیار دوستان ارائه شده است.	Y	دوستان	1419	    6,605	0.0091	333.8235	persian_news_2019_00223190
7358	تا ده ميليون هم از طرف دوستان شما گفته شده است.	Y	دوستان	1419	    6,605	0.0091	375.0909	persian_news_2017_00389689
7359	مسئله اساسی کسب دانش بیشتر و کسب دوستان بیشتر است.	Y	دوستان	1419	    6,605	0.0091	469.125	persian_news_2017_00799839
7360	و يا شايد دوستان فقط نگران تهديد واردات هستند؟	Y	دوستان	1419	    6,605	0.0091	710	persian_news_2016_00978929
7361	شد به گفته وی بخش بانوان نیز از امروز.	Y	بانوان	1420	    6,601	0.0091	200.7778	persian_news_2019_00605128
7362	هفته دوم لیگ برتر فوتبال بانوان با برگزاری شش دیدار جمعه انجام می شود.	Y	بانوان	1420	    6,601	0.0091	345.4286	persian_news_2019_00869526
7363	وی یادآور شد: 30 درصد اعتبار باید به بانوان اختصاص یابد، مقام هایی که بانوان خراسان جنوبی به دست آورده اند خوب بود، دولت و وزارت ورزش و جوانان بر استفاده از ظرفیت بخش بانوان تاکید دارد.	Y	بانوان	1420	    6,601	0.0091	391.8438	persian_news_2017_00905567
7364	در کاهش آسیب های اجتماعی حوزه بانوان.	Y	بانوان	1420	    6,601	0.0091	462.4286	persian_news_2019_00479952
7365	حضور بانوان پنجشنبه ۲۶ اردیبهشت در میدان امام حسین.	Y	بانوان	1420	    6,601	0.0091	768.5	persian_news_2019_00403225
7366	جريان حاکم حق رای را از مردم گرفته است و به همين خاطر امروز آنها برای گرفتن رای خود به ميدان آمده‏اند.	Y	ميدان	1421	    6,598	0.0091	296.0476	persian_news_2019_00373707
7367	آيا مجموعه اين اقدامات برای اين است که آقای کروبی را از ميدان خارج کنند؟	Y	ميدان	1421	    6,598	0.0091	338.4286	persian_news_2016_00193538
7368	ايران نيز با بهره برداری از ميدان، در طول چند سال اصل سرمايه و سود شرکت را پرداخت می کند.	Y	ميدان	1421	    6,598	0.0091	357.85	persian_news_2017_00199945
7369	ايران و عراق حداقل پنج ميدان مشترک نفتی دارند.	Y	ميدان	1421	    6,598	0.0091	466	persian_news_2016_00197710
7370	البته اگر آقای خاتمی وارد ميدان نشود.	Y	ميدان	1421	    6,598	0.0091	571.8571	persian_news_2017_00097820
7371	های همکاری هدف دار در این دانشگاه است..	Y	دار	1422	    6,594	0.0091	266	persian_news_2017_00867840
7372	ادامه دار شده است اظهار کرد حالا باید.	Y	دار	1422	    6,594	0.0091	334.875	persian_news_2019_00029262
7373	پی را در آذربایجان عهده دار می شد.	Y	دار	1422	    6,594	0.0091	409	persian_news_2016_00368450
7374	این خانه دار می شوند مشکل مسکن روستایی نیز.	Y	دار	1422	    6,594	0.0091	474.5	persian_news_2019_00137312
7375	چرا بیمه زنان خانه دار تصویب نشد؟	Y	دار	1422	    6,594	0.0091	717.5714	persian_news_2017_00430340
7376	بر اینکه این ها از موسسه های مالی آمریکا.	Y	موسسه	1423	    6,590	0.0091	242	persian_news_2019_00236670
7377	«عملکرد اتاق فکر دولت در سال جاری چه بوده که بودجه این موسسه برای سال آینده 30 درصد رشد کرده است؟»	Y	موسسه	1423	    6,590	0.0091	309.7895	persian_news_2019_00650222
7378	به گزارش پایگاه اطلاع رسانی شبکه خبر،از کشورمان 14 دانشگاه و موسسه عالی در این اجلاس شرکت کرده اند.	Y	موسسه	1423	    6,590	0.0091	399.6316	persian_news_2019_00283073
7379	از طرف موسسه ملی و تاریخ وابسته به..	Y	موسسه	1423	    6,590	0.0091	489.375	persian_news_2016_00053118
7380	برای دسترسی به این به سایت این موسسه به..	Y	موسسه	1423	    6,590	0.0091	663.8333	persian_news_2017_00271911
7381	های لازم نیز به آنها ارائه نشده است افزود به طور کلی طی یک سال..	Y	کلی	1424	    6,587	0.0091	212.7143	persian_news_2016_00864763
7382	داشته باشد اگر به صورت کلی اجرایی شود بسیاری.	Y	کلی	1424	    6,587	0.0091	316.4444	persian_news_2019_00423839
7383	باشد در سیاست های کلی برنامه ششم توسعه که.	Y	کلی	1424	    6,587	0.0091	405.1111	persian_news_2019_00211165
7384	این یک باور کلی نیست بلکه سیاست یک دولت است.	Y	کلی	1424	    6,587	0.0091	463	persian_news_2017_00159052
7385	تحقق بند 12 سیاست های کلی سلامت بهداشت درمان..	Y	کلی	1424	    6,587	0.0091	738.125	persian_news_2017_00395510
7386	در میان ای هم که با عنوان صفحه من..	Y	صفحه	1425	    6,582	0.0091	231.7778	persian_news_2017_00542307
7387	در این گزارش ۵۶ صفحه به موارد نقض حقوق بشر در ایران اختصاص داده شده است.	Y	صفحه	1425	    6,582	0.0091	313.7857	persian_news_2019_00443678
7388	گذاری خودرو شد نیز در صفحه نخست دو.	Y	صفحه	1425	    6,582	0.0091	392.25	persian_news_2019_00716462
7389	با اين كار يك صفحه جا باز مي‌شود.	Y	صفحه	1425	    6,582	0.0091	469.75	persian_news_2016_00241140
7390	جوان آنلاین محمد رضا دبیر صفحه تاریخ روزنامه جوان.	Y	صفحه	1425	    6,582	0.0091	711.125	persian_news_2019_00381249
7391	این روزنامه با اشاره به این که «تهران و اهواز و اصفهان ندارد.	Y	اهواز	1426	    6,580	0.0091	226.7273	persian_news_2016_00151417
7392	‎ بر این اساس آب شهر اهواز حتی در صورت قطع برق نیز تامین خواهد شد.	Y	اهواز	1426	    6,580	0.0091	307.5333	persian_news_2017_00279237
7393	اهواز با دعوت از همه مردم برای..	Y	اهواز	1426	    6,580	0.0091	354.1429	persian_news_2017_00173911
7394	را به خانواده آن شهید و مردم اهواز ابلاغ.	Y	اهواز	1426	    6,580	0.0091	424.2222	persian_news_2019_00513670
7395	استقلال خوزستان در جایگاه دوم است و استقلال اهواز در رده آخر.	Y	اهواز	1426	    6,580	0.0091	646.9	persian_news_2016_00062345
7396	بدون اشاره به علت این انفجار اعلام کرد بر..	Y	انفجار	1427	    6,577	0.0091	266.8889	persian_news_2017_00267651
7397	حدود ۲۶۴ نفر نیز طی این انفجار کشته شدند.	Y	انفجار	1427	    6,577	0.0091	359.625	persian_news_2019_00398733
7398	هنوز نوع انفجار و علت آن مشخص نیست.	Y	انفجار	1427	    6,577	0.0091	420.5	persian_news_2019_00909248
7399	ما جامعه ای هستيم در مرز انفجار.	Y	انفجار	1427	    6,577	0.0091	511.1429	persian_news_2016_00756300
7400	در جنوب شرقی ترکیه انفجار رخ داد - Trend.	Y	انفجار	1427	    6,577	0.0091	748.875	persian_news_2016_00509784
7401	نیز به همکاری با ایران پایان داده‌اند.	Y	داده‌اند	1428	    6,571	0.0091	290.5714	persian_news_2016_00845378
7402	۶ میلیارد تومان از بودجه را به خود اختصاص داده‌اند.	Y	داده‌اند	1428	    6,571	0.0091	310.5556	persian_news_2017_00012101
7403	به گزارش مهر، بر اساس آخرين اعلام سازمان پزشکی قانونی همدان، در سال گذشته ۳۰ نفر جان خود را در حوادث کار از دست داده‌اند.	Y	داده‌اند	1428	    6,571	0.0091	344.0435	persian_news_2016_00340668
7404	به شهروندان خود هشدار داده‌اند که سفر به ایران می‌تواند خطر بازداشت آنان را به دنبال داشته باشد.	Y	داده‌اند	1428	    6,571	0.0091	365.6875	persian_news_2016_00315102
7405	شهروندان ایرانی نزدیک به یک هفته پس از اجرای قانون انتشار و دسترسی آزاد به اطلاعات ۱۷۷درخواست اطلاعات داده‌اند.	Y	داده‌اند	1428	    6,571	0.0091	397.9412	persian_news_2019_00618139
7406	مردم تهران و که در پایتخت به سر.	Y	پایتخت	1429	    6,565	0.0091	217.25	persian_news_2019_00779364
7407	عنوان پایتخت از هر شهری که این عنوان..	Y	پایتخت	1429	    6,565	0.0091	335	persian_news_2017_00686638
7408	به همین دلیل به نظر می‌رسد امروز هم بحث انتقال پایتخت جدی نیست.	Y	پایتخت	1429	    6,565	0.0091	413.9167	persian_news_2019_00308866
7409	در حاشیه و مجموعه های پایتخت شناخته شد دو.	Y	پایتخت	1429	    6,565	0.0091	524.8889	persian_news_2019_00460273
7410	آغاز همایش بین المللی «همدان ۲۰۱۸ پایتخت گردشگری آسیا»	Y	پایتخت	1429	    6,565	0.0091	809	persian_news_2019_00076970
7411	مردم اسلام آباد غرب و در مجلس شورای اسلامی.	Y	آباد	1430	    6,556	0.0091	304.8889	persian_news_2019_00778964
7412	وي اضافه كرد: ايران نيز در اين زمينه با اسلام آباد در تماس است.	Y	آباد	1430	    6,556	0.0091	349.3846	persian_news_2017_00976191
7413	آباد کرد با اشاره به پیشرفت و تجربه ایران.	Y	آباد	1430	    6,556	0.0091	406	persian_news_2019_00017032
7414	آباد غرب در مجلس شورای ی اضافه کرد مقامات سعودی.	Y	آباد	1430	    6,556	0.0091	456	persian_news_2019_00017027
7415	هوا شاخص هوا در میدان احمد آباد با 155..	Y	آباد	1430	    6,556	0.0091	777.8571	persian_news_2017_00898749
7416	وزیر نفت تصریح کرد: هر کسی که رییس جمهور شود باید همه به آن کمک کنند زیرا رییس جمهور همه ملت ایران است.	Y	زیرا	1430	    6,556	0.0091	224.6	persian_news_2019_00973016
7417	های خارجی گرفته شود زیرا ما هم هنر و..	Y	زیرا	1430	    6,556	0.0091	328.8889	persian_news_2017_00865858
7418	تر است زیرا برنامه گردشگری سلامت خود را از.	Y	زیرا	1430	    6,556	0.0091	393.2222	persian_news_2019_00341772
7419	کمک کرد زیرا آنها نمی توانند به.	Y	زیرا	1430	    6,556	0.0091	449.8571	persian_news_2019_00709688
7420	زیرا اصول اسناد رسمی در آنها به ثبت می‌رسد.	Y	زیرا	1430	    6,556	0.0091	677	persian_news_2019_00557171
7421	مجلس در مقام اظهار نظر، بیان و رای خود کاملا آزاد است..	Y	کاملا	1431	    6,553	0.0091	237.0833	persian_news_2016_00771142
7422	در این مرحله مسئولان باید کاملا با هم وحدت داشته باشند.	Y	کاملا	1431	    6,553	0.0091	342.6364	persian_news_2016_00490099
7423	تاریخ کاملا این هنر قابل است وی اظهار داشت.	Y	کاملا	1431	    6,553	0.0091	411.6667	persian_news_2019_00334539
7424	هر چند اين روش از رژيم کاملا شناخته شده است.	Y	کاملا	1431	    6,553	0.0091	477.1	persian_news_2017_00870468
7425	سوریه را کاملا قطع کردند همچنین خودشان را..	Y	کاملا	1431	    6,553	0.0091	698.5714	persian_news_2017_00636914
7426	سال رونق در کشور است گفت از آغاز سال..	Y	رونق	1432	    6,551	0.0091	207.125	persian_news_2016_00617323
7427	درباره مسکن به رونق این بازار کمک کنند.	Y	رونق	1432	    6,551	0.0091	333.375	persian_news_2019_00450214
7428	این موضوع زمینه رونق دیگری در زمینه صادرات برق فراهم خواهد کرد.	Y	رونق	1432	    6,551	0.0091	394.9091	persian_news_2019_00160490
7429	میلیارد تومان تسهیلات برای رونق دادن به پرداخت..	Y	رونق	1432	    6,551	0.0091	442.625	persian_news_2017_00817224
7430	بنابراين ما نبايد نگران دين مردم و رونق دين خدا باشيم.	Y	رونق	1432	    6,551	0.0091	849.5	persian_news_2017_00306478
7431	از این اتفاق به عنوان یک انقلاب فرهنگی یاد شده است.	Y	یاد	1433	    6,545	0.0091	229.6364	persian_news_2016_00039768
7432	اعلام این خبر گفت در پی یاد شده..	Y	یاد	1433	    6,545	0.0091	273.125	persian_news_2016_00072465
