ORDER	SENTENCE	STATUS	WORD	RANK	COUNT	COUNT_REL	INDEX	ID
7001	که ۱۶ سال بر بیماری بوده است با این.	Y	بیماری	1355	    6,970	0.0097	190	persian_news_2019_00711919
7002	را دلیل بیماری مطرح کرد و در جلسه ۱۹.	Y	بیماری	1355	    6,970	0.0097	269.625	persian_news_2019_00514482
7003	این بیماری با شما وارد سیستم ما شد.	Y	بیماری	1355	    6,970	0.0097	382.75	persian_news_2019_00129371
7004	خروج از این استان و استان خراسان جنوبی بیماری..	Y	بیماری	1355	    6,970	0.0097	438.5	persian_news_2017_00470439
7005	و افرادی که بیماری های جدی دارند آسیب.	Y	بیماری	1355	    6,970	0.0097	556.5	persian_news_2019_00923464
7006	در اشاره به اين سنت، حق با ايشان است.	Y	سنت	1356	    6,959	0.0096	263.2222	persian_news_2016_00482478
7007	احمدی‌نژاد این سنت را به دولت نیز گسترش داد.	Y	سنت	1356	    6,959	0.0096	338.2222	persian_news_2016_00024956
7008	اينکه سنت با زن چه مي کند؟	Y	سنت	1356	    6,959	0.0096	407.1429	persian_news_2017_00227526
7009	چهارشنبه آخر سال یک سنت ملی است.	Y	سنت	1356	    6,959	0.0096	499.5714	persian_news_2019_00388921
7010	همه جای دنيا سنت خودشان را داشته اند.	Y	سنت	1356	    6,959	0.0096	548.875	persian_news_2017_00893699
7011	آقای کروبی در ادامه افزود:” آنچه که اکنون مهم است، دفاع از آزادی و حقوق بر حق مردم است.”	Y	کروبی	1357	    6,957	0.0096	207.1111	persian_news_2016_00082651
7012	کروبی تصریح کرد آنچه در این میان اهمیت ندارد مردم ایران و منافع ملی آنان است.	Y	کروبی	1357	    6,957	0.0096	333.125	persian_news_2016_00723349
7013	چرا که مردمی که به روحانی رای دادند اگر امکان داشتند به موسوی و يا کروبی رای می دادند.	Y	کروبی	1357	    6,957	0.0096	420.1333	persian_news_2017_00432478
7014	' خانواده مهدی کروبی با او دیدار کردند' - Trend.	Y	کروبی	1357	    6,957	0.0096	502.25	persian_news_2019_00409869
7015	'موافقت مقامات امنیتی ایران با انتقال کروبی به بیمارستان' - Trend.	Y	کروبی	1357	    6,957	0.0096	672.5	persian_news_2016_00831026
7016	است که در گزارش خود به این جمع بندی.	Y	بندی	1358	    6,954	0.0096	227.7	persian_news_2019_00064523
7017	بانک تجارت سال گذشته نیز در بندی شورای عالی..	Y	بندی	1358	    6,954	0.0096	354.3333	persian_news_2016_00254589
7018	بندی که چند ماه پيش، به بند امنيتی ۳۵۰ تغيير نام داد.	Y	بندی	1358	    6,954	0.0096	424.7273	persian_news_2017_00309308
7019	هنگام خرید  های بسته بندی شده به تاریخ تولید.	Y	بندی	1358	    6,954	0.0096	509.9	persian_news_2019_00908342
7020	گیری بسته بندی و صادرات این محصولات.	Y	بندی	1358	    6,954	0.0096	669.5714	persian_news_2019_00717156
7021	در متوجه بخش دولت است که هر.	Y	متوجه	1359	    6,948	0.0096	221.2857	persian_news_2019_00483742
7022	بر همین اساس هم اکنون عمده نگاه ها در این زمینه متوجه تیم ملی آلمان است.	Y	متوجه	1359	    6,948	0.0096	317.6875	persian_news_2019_00247429
7023	اما نکته این است که چرا وزارت اطلاعات تازه متوجه این مسئله شده است.	Y	متوجه	1359	    6,948	0.0096	382.8333	persian_news_2019_00114601
7024	وی افزود: یک اتهام امنیتی هم متوجه این نظامی آمریکایی است.	Y	متوجه	1359	    6,948	0.0096	438.5455	persian_news_2019_00931137
7025	در شب افتتاح هم برق قطع شد، اما هيچ کسی متوجه آن نشد!	Y	متوجه	1359	    6,948	0.0096	532.7692	persian_news_2017_00532295
7026	آيا دولت حق دخالت در اين مورد را ندارد؟	Y	دخالت	1360	    6,940	0.0096	255.3333	persian_news_2017_00195380
7027	رسانه ها برای مشخص شدن دخالت وزارت ورزش باید دست به کار شوند.	Y	دخالت	1360	    6,940	0.0096	290.3077	persian_news_2019_00520622
7028	این نمایندگان حق دخالت در امر برگزاری انتخابات را ندارند.	Y	دخالت	1360	    6,940	0.0096	354.7	persian_news_2016_00166442
7029	هیچ عنوان قصد دخالت در امور این فدراسیون را.	Y	دخالت	1360	    6,940	0.0096	412.4444	persian_news_2019_00861973
7030	منابع ديگري نيز در تعيين قيمت ارز دخالت دارند.	Y	دخالت	1360	    6,940	0.0096	638.1111	persian_news_2016_00818220
7031	از جمله این برنامه های کرد و افزود همایش.	Y	همایش	1361	    6,936	0.0096	197.5556	persian_news_2019_00046290
7032	رئیس جمهور روسیه در این شهر بوده و همایش و نشست رسانه ای در حال برگزاری بوده است، تعداد زیادی از خبرنگاران آنجا بوده اند.	Y	همایش	1361	    6,936	0.0096	305.9048	persian_news_2019_00543157
7033	همایش دانست رئیس کانون ی استان در این همایش با.	Y	همایش	1361	    6,936	0.0096	390.7778	persian_news_2019_00870568
7034	همایش و نمایشگاه و ارائه فرصت های..	Y	همایش	1361	    6,936	0.0096	483.1667	persian_news_2016_00874022
7035	گزارشی از همایش تخصصی «جنگ جهانی جمعیت»	Y	همایش	1361	    6,936	0.0096	756.8571	persian_news_2019_00721249
7036	کند وی با بیان اینکه این در میراث فرهنگی..	Y	میراث	1362	    6,934	0.0096	215.5556	persian_news_2017_00730763
7037	همکاری وزارت و شهر سازی و سازمان میراث فرهنگی..	Y	میراث	1362	    6,934	0.0096	322.25	persian_news_2017_00892193
7038	فرمانده اداره کل میراث فرهنگی استان ادامه داد.	Y	میراث	1362	    6,934	0.0096	379.25	persian_news_2019_00659940
7039	در راستای افزایش مشارکت مردم برای حفاظت از میراث فرهنگی؛	Y	میراث	1362	    6,934	0.0096	436.6	persian_news_2019_00468725
7040	ملی معاونت سرمایه گذاری اداره کل میراث فرهنگی.	Y	میراث	1362	    6,934	0.0096	582.875	persian_news_2019_00812375
7041	این اقدام قرار است در سال آینده به طور کوتاه در یک یا دو استان انجام شود و سپس به کل کشور ابلاغ شود.	Y	کوتاه	1363	    6,930	0.0096	243.6667	persian_news_2019_00126358
7042	اعتراض های اخير نخست در شبکه های اجتماعی و با انتشار يک فيلم کوتاه آغاز شد.	Y	کوتاه	1363	    6,930	0.0096	323	persian_news_2016_00070933
7043	خانه ها نیز به اندازه مصرف کوتاه مدت صورت .	Y	کوتاه	1363	    6,930	0.0096	404	persian_news_2019_00409284
7044	دست نظامی ها از فعالیت علمی ـ اتمی کوتاه!	Y	کوتاه	1363	    6,930	0.0096	467.4444	persian_news_2017_00559455
7045	و امکان تجاری سازی فضای آموزشی در اخبار کوتاه.	Y	کوتاه	1363	    6,930	0.0096	671.5556	persian_news_2019_00935189
7046	قرار خواهد گرفت کار های اولیه آن انجام شده.	Y	اولیه	1364	    6,912	0.0096	213.1	persian_news_2019_00676190
7047	طبیعی و از حقوق های اولیه است.	Y	اولیه	1364	    6,912	0.0096	352.2857	persian_news_2017_00665048
7048	قرارداد اولیه بین دو شرکت در خرداد ماه امضا شده بود.	Y	اولیه	1364	    6,912	0.0096	391.5455	persian_news_2017_00706457
7049	به گزارش پایگاه اطلاع رسانی شبکه خبر،ترامپ در دستور اولیه اش زمان خروج از سوریه را یک ماه تعیین کرده بود.	Y	اولیه	1364	    6,912	0.0096	448.1364	persian_news_2019_00284343
7050	اختصاص می یابد شامل همه اولیه و محصول نهایی.	Y	اولیه	1364	    6,912	0.0096	655.8889	persian_news_2019_00026794
7051	البته او تاکید کرد که دوست دارد در این تیم حضور داشته باشد.	Y	دوست	1365	    6,903	0.0096	176.8462	persian_news_2019_00094894
7052	او این را هم گفت که خانواده مخالف ثبت نام من بودند اما من دوست دارم در انتخابات ریاست جمهوری شرکت کنم.	Y	دوست	1365	    6,903	0.0096	305.5714	persian_news_2017_00176797
7053	وی گفت: «دوست دارم فوتبال را در خارج از ايران تجربه کنم.	Y	دوست	1365	    6,903	0.0096	389.4167	persian_news_2017_00964029
7054	شايد جوانان دوست داشته باشند اما براي خودش تجربه است.	Y	دوست	1365	    6,903	0.0096	491.9	persian_news_2017_00643210
7055	چگونه می‌توان چنين مردمی را دوست نداشت؟	Y	دوست	1365	    6,903	0.0096	806.5714	persian_news_2016_00430315
7056	به هوایی ایران اضافه می شود وی گفت این..	Y	هوایی	1366	    6,897	0.0096	208.2222	persian_news_2016_00361356
7057	می خواهد تا حملات هوایی خود را به تمامی.	Y	هوایی	1366	    6,897	0.0096	379.7778	persian_news_2019_00760424
7058	به ویژه آنکه با توجه به تحریم هوایی ایران، صنعت حمل و نقل هوایی با مشکلات بسیاری در شرایط فعلی روبرو شده است.	Y	هوایی	1366	    6,897	0.0096	451.25	persian_news_2017_00362896
7059	حملات هوایی آمریکا به منطقه ای در شمال شرق سوریه دست کم 9 غیر نظامی شهید شدند.	Y	هوایی	1366	    6,897	0.0096	526.375	persian_news_2019_00406329
7060	هوایی همکاری هسته ای محیط زیست حفاظت مدنی علوم.	Y	هوایی	1366	    6,897	0.0096	758.2222	persian_news_2019_00909952
7061	وی با اشاره به مشکلات کشور و دانشگاه ها بیان کرد: مشکلات بسیاری در دانشگاه ها کشور وجود دارد و تمام آنها به کمک رئیس دانشگاه و استاد حل نمی‌شود.	Y	نمی‌شود	1367	    6,895	0.0095	229.6818	persian_news_2019_00939194
7062	وی ادامه داد: متاسفانه در شرایط اقتصادی کشور برنامه‌های خوبی در نظر گرفته نمی‌شود.	Y	نمی‌شود	1367	    6,895	0.0095	356	persian_news_2017_00904829
7063	اين امر البته تنها به کوچک شدن خانواده مربوط نمی‌شود.	Y	نمی‌شود	1367	    6,895	0.0095	421.9	persian_news_2017_00205890
7064	و اينکه چرا به بند عمومی منتقل نمی‌شود.	Y	نمی‌شود	1367	    6,895	0.0095	523.5	persian_news_2016_00920814
7065	چرا جریان مالی قاچاق مواد مخدر قطع نمی‌شود؟	Y	نمی‌شود	1367	    6,895	0.0095	730.125	persian_news_2019_00383292
7066	روابط اقتصادی این کشور با ایران به دهه ها پیش و قبل از انقلاب بر می گردد.	Y	گردد	1368	    6,894	0.0095	190.5294	persian_news_2017_00588686
7067	نه» مردم به عملکرد احمدی نژاد در طی چهار سال گذشته بر می‏گردد.	Y	گردد	1368	    6,894	0.0095	290.6429	persian_news_2017_00861573
7068	نمی گردد صورت می گیرد خاطر نشان کرد مصرف.	Y	گردد	1368	    6,894	0.0095	379.1	persian_news_2019_00845583
7069	بازار توزیع می گردد فرماندار در پایان جلسه گفت.	Y	گردد	1368	    6,894	0.0095	482.4444	persian_news_2019_00207815
7070	اختلاف به نخستین روزهای استقلال اسرائیل باز می گردد.	Y	گردد	1368	    6,894	0.0095	635.4444	persian_news_2019_00026884
7071	نخواهد زد از سوی دیگر پس از آن که ژاپن اعلام کرد تا پایان سال ۲۰۲۰ برنامه ای.	Y	زد	1369	    6,890	0.0095	245	persian_news_2019_00835122
7072	سه بار به میدان آمد و یک گل در برابر زد.	Y	زد	1369	    6,890	0.0095	378.2727	persian_news_2017_00634800
7073	و هنر دست به اقدامات آموزشی می زد که.	Y	زد	1369	    6,890	0.0095	420	persian_news_2019_00991826
7074	گذشت یک سال از انقلاب رقم زد از همان.	Y	زد	1369	    6,890	0.0095	454.1111	persian_news_2019_00716623
7075	معتقد هستیم حرف درست را باید درست زد.	Y	زد	1369	    6,890	0.0095	693.1429	persian_news_2019_00805228
7076	ما باید موضع خود را به جامعه جهانی ارائه کرده و از آن دفاع کنیم.	Y	موضع	1370	    6,880	0.0095	177.1333	persian_news_2017_00756272
7077	به این موضوع باشد حالا که آنها از موضع.	Y	موضع	1370	    6,880	0.0095	286.3333	persian_news_2019_00266079
7078	ما انتظار داریم دولت هم موضع خود را روشن کند.»	Y	موضع	1370	    6,880	0.0095	362.9	persian_news_2016_00753882
7079	دولت عراق هميشه در موضع مخالفت و رقابت با دولت ايران بود.	Y	موضع	1370	    6,880	0.0095	412.8182	persian_news_2016_00565998
7080	تغییر جایگاه نباید موجب تغییر موضع شود.	Y	موضع	1370	    6,880	0.0095	799	persian_news_2019_00348623
7081	با صرف سرمایه های آن ها صورت می.	Y	صرف	1371	    6,876	0.0095	248.5	persian_news_2019_00212698
7082	این مسئول اضافه کرد: این دستگاه اجرایی تمام توان خود را صرف توسعه صادرات کالا به کشور عراق کرده است.	Y	صرف	1371	    6,876	0.0095	306	persian_news_2016_00162663
7083	برای بهره برداری از این طرح که طی چهار ماه مورد احداث قرار گرفته، پنج میلیارد ریال اعتبار صرف شده است.	Y	صرف	1371	    6,876	0.0095	354.2857	persian_news_2019_00226670
7084	دليل ديگر هم انتخاب صرف ما نبود یعنی دولت گذشته ما نبود.	Y	صرف	1371	    6,876	0.0095	388.1	persian_news_2019_00502657
7085	احداث همان مناطق صرف تامین مالی تسهیلات خرید..	Y	صرف	1371	    6,876	0.0095	699.875	persian_news_2016_00022862
7086	اين اقدام از نظر قوانين جمهوری اسلامی آزاد است؟	Y	قوانين	1372	    6,871	0.0095	228.1111	persian_news_2016_00202438
7087	طبق اين قوانين، شرکت ها و يا افرادی که با ايران و بانک مرکزی رابطه داشته باشند، از بازار داخلی آمريکا حذف خواهند شد.	Y	قوانين	1372	    6,871	0.0095	281.4348	persian_news_2016_00665125
7088	آيا بر اساس همين قوانين فعلی، رئيس جمهور حق تعيين معاون اول خود را دارد يا ندارد؟	Y	قوانين	1372	    6,871	0.0095	358.2941	persian_news_2017_00194044
7089	تنها در فرانسه نقش مهم مجلس در ارتباط با تصويب قوانين جديد است.	Y	قوانين	1372	    6,871	0.0095	404.4167	persian_news_2017_00409374
7090	را از ساختار قوانين کشور ‏مي خواهيم.	Y	قوانين	1372	    6,871	0.0095	590.5714	persian_news_2017_00575918
7091	بود همچنین در این برنامه از خانواده های مدافع..	Y	مدافع	1373	    6,869	0.0095	219	persian_news_2017_00363864
7092	با این حال او اکنون تبدیل به مدافع سیاست های اقتصادی احمدی نژاد در مجلس شده است».	Y	مدافع	1373	    6,869	0.0095	275.8824	persian_news_2017_00239437
7093	سازمان های مدافع حقوق بشر و رهبران مخالفان در ايران اعدام اين افراد را محکوم کرده اند.	Y	مدافع	1373	    6,869	0.0095	344.4118	persian_news_2016_00615632
7094	گروه های مدافع حقوق بشر و اتحاديه اروپا، همواره از ايران خواسته اند که مجازات اعدام را متوقف کند.	Y	مدافع	1373	    6,869	0.0095	409.4211	persian_news_2016_00737243
7095	تیم بانک سرمایه، مدافع عنوان قهرمانی نیز با کسب پیروزی سه بر صفر برابر شهرداری تبریز در جایگاه دوم جدول قرار گرفت.	Y	مدافع	1373	    6,869	0.0095	481.5455	persian_news_2016_00404194
7096	این در حالی است که او تنها ۲۰ سال سن دارد.	Y	سن	1374	    6,868	0.0095	195.9	persian_news_2019_00138914
7097	بیش از ۱۳۳ میلیون نفر در سراسر اتحادیه اروپا زندگی می‌کنند که با وجود قرار داشتن در سن کار، از نظر اقتصادی غیر فعال هستند.	Y	سن	1374	    6,868	0.0095	319.9091	persian_news_2019_00250615
7098	بدون توجه به سن متهم آيا بر اساس قوانين ايران باز هم مجازات اين فرد اعدام بوده است؟	Y	سن	1374	    6,868	0.0095	385.8333	persian_news_2017_00267891
7099	مدیرکل دفتر سلامت جمعیت، خانواده و مدارس وزارت بهداشت با بیان اینکه ‌سن امید به زندگی در ایران ‌به ۷۲.	Y	سن	1374	    6,868	0.0095	428.7222	persian_news_2019_00770906
7100	کم سن ترين نيروهای شما ،جوانان دوران انقلاب هستند.	Y	سن	1374	    6,868	0.0095	578.1111	persian_news_2017_00729649
7101	در این دوره هم ائتلاف نیست و همان حمایت است.	Y	ائتلاف	1375	    6,860	0.0095	247.2	persian_news_2017_00492476
7102	اين دو بعد ها با هم به شدت ائتلاف كردند.	Y	ائتلاف	1375	    6,860	0.0095	321.3	persian_news_2017_00217184
7103	اما همچنان پس از حضور نیروهای ائتلاف، موارد نقض حقوق بشر ادامه دارد.	Y	ائتلاف	1375	    6,860	0.0095	365.6923	persian_news_2016_00127478
7104	به باور برخی اصلاح طلبان ائتلاف های جدید برای مقابله با آقای احمدی نژاد در حال شکل گیری است.	Y	ائتلاف	1375	    6,860	0.0095	458.3684	persian_news_2016_00309251
7105	امارات گفت ائتلاف ملی مخالفان سوریه قصد دارد ارتش.	Y	ائتلاف	1375	    6,860	0.0095	727.1111	persian_news_2019_00110502
7106	کار بزرگی بود که از سوی شرکت ملی نفت ایران و شرکت ملی گاز ایران انجام شد.	Y	بزرگی	1376	    6,859	0.0095	173.7143	persian_news_2019_00685950
7107	به هر حال کار بزرگی قرار است رخ دهد.	Y	بزرگی	1376	    6,859	0.0095	286.8889	persian_news_2016_00358830
7108	است هفته گذشته نیز زمین  ای به بزرگی چهار.	Y	بزرگی	1376	    6,859	0.0095	325.1	persian_news_2019_00064972
7109	همچنین بزرگی بیش از حد بخش دولتی و نیمه دولتی دیگر مسئله است.	Y	بزرگی	1376	    6,859	0.0095	398.9167	persian_news_2016_00878065
7110	آن هم در باشگاه بزرگی همچون پرسپوليس؟	Y	بزرگی	1376	    6,859	0.0095	581.7143	persian_news_2016_00171734
7111	حسين نسل سوم تيم ملی فوتبال ايران است از خانواده ما.	Y	حسين	1376	    6,859	0.0095	356.2727	persian_news_2016_00450401
7112	برای نامزد حسين هم دو سال حکم زندان صادر می شود.	Y	حسين	1376	    6,859	0.0095	373.7273	persian_news_2016_00276530
7113	پس از دو روز خبر رسيد که حال عمومی حسين بهتر است و هم خانواده و هم پزشکان نتيجه عمل را رضايت بخش اعلام کرده اند.	Y	حسين	1376	    6,859	0.0095	444.875	persian_news_2017_00376800
7114	هدف از حمله، که در جريان آن دست کم ۱۲ غير نظامی کشته شدند، صدام حسين بود.	Y	حسين	1376	    6,859	0.0095	457.6875	persian_news_2019_00862670
7115	پس از اعدام صدام حسين خشونت ها در عراق همچنان ادامه دارد.	Y	حسين	1376	    6,859	0.0095	481	persian_news_2016_00372149
7116	کافی در استان شده است وی ادامه داد.	Y	کافی	1377	    6,856	0.0095	196.125	persian_news_2019_00691867
7117	را انجام می دهند اما کافی به نظر نمی رسد.	Y	کافی	1377	    6,856	0.0095	325.9	persian_news_2016_00571262
7118	از سوی دیگر اطلاعات کافی به مردم داده نمی‌شود.	Y	کافی	1377	    6,856	0.0095	380.8889	persian_news_2016_00049364
7119	اما پایان تحریم ها برای جذب سرمایه خارجی کافی نیست.	Y	کافی	1377	    6,856	0.0095	445.7	persian_news_2019_00107826
7120	شورا به اندازه کافی در جریان نیست.	Y	کافی	1377	    6,856	0.0095	698.1429	persian_news_2019_00619363
7121	مجلس شورای اسلامی گفت به عنوان مثال اگر خودرو در بازار خواهد شد به همین جهت مردم.	Y	مثال	1377	    6,856	0.0095	200	persian_news_2019_00750556
7122	وی ادامه داد: به طور مثال اگر در سال یک میلیون تومان هزینه سوخت برای خودرو پرداخت می‌شود، این رقم با مصرف سی.	Y	مثال	1377	    6,856	0.0095	286.3913	persian_news_2019_00914003
7123	می شود به عنوان مثال ورزش می تواند باعث.	Y	مثال	1377	    6,856	0.0095	370.5556	persian_news_2019_00735263
7124	برای مثال، سیاست تجاری کشاورزی در خدمت بخش تولید کشاورزی و سیاست تجاری صنعت در خدمت بخش تولید صنعت باشد.	Y	مثال	1377	    6,856	0.0095	423.8333	persian_news_2019_00234992
7125	به عنوان مثال است متوجه مسائل بی اهمیت.	Y	مثال	1377	    6,856	0.0095	554.1111	persian_news_2019_00274868
7126	برای ما مهم این است که صنعت ما باید از کیفیت لازم و قدرت رقابت برخوردار باشد.	Y	کیفیت	1378	    6,854	0.0095	254.1875	persian_news_2016_00275394
7127	رئیس دانشگاه تهران نیز گفت: تاکنون بسیاری از قانون گذاری های مجلس شورای اسلامی مثل افزایش ظرفیت دانشجویان ارشد مشکلات زیادی برای دانشگاه ها و کیفیت آموزش عالی در پی داشته است.	Y	کیفیت	1378	    6,854	0.0095	326.1613	persian_news_2019_00544494
7128	استاندار خراسان جنوبی تصریح کرد: خراسان جنوبی رتبه سوم کشور را در ساخت و کیفیت مسکن مهر در کشور به خود اختصاص داده است.	Y	کیفیت	1378	    6,854	0.0095	368.3	persian_news_2017_00059995
7129	با کیفیت کشورها استقبال می کند رئیس جمهور.	Y	کیفیت	1378	    6,854	0.0095	462.375	persian_news_2019_00213890
7130	شاخص کیفیت هوا در کمتر از ۵۰ پی.	Y	کیفیت	1378	    6,854	0.0095	678.5714	persian_news_2019_00600265
7131	از سوی دیگر اعلام برگزاری این مذاکرات، یک روز پس از سفر معاون وزیر خارجه روسیه به تهران صورت می‌گیرد.	Y	می‌گیرد	1379	    6,844	0.0095	220.1579	persian_news_2016_00049365
7132	موسوی اضافه کرد: این موضوع پس از تایید وزیر کشور و رییس سازمان برنامه و بودجه، در دستور کار دولت قرار می‌گیرد.	Y	می‌گیرد	1379	    6,844	0.0095	281.8571	persian_news_2019_00824659
7133	بررسی بودجه تمام شود این لایحه و طرح جامع انتخابات در دستور کار مجلس قرار می‌گیرد.	Y	می‌گیرد	1379	    6,844	0.0095	336.75	persian_news_2019_00243197
7134	این شاخص در عمل جای شاخص توسعه انسانی را می‌گیرد.	Y	می‌گیرد	1379	    6,844	0.0095	457.1111	persian_news_2017_00154587
7135	همچون سال‌های قبل، چند سخنرانی در این مراسم صورت می‌گیرد.	Y	می‌گیرد	1379	    6,844	0.0095	553.6	persian_news_2019_00882547
7136	بنزین گرفته نه و این موضوع در دست بررسی است.	Y	بنزین	1380	    6,833	0.0095	212.3	persian_news_2019_00263121
7137	ایران 40 درصد بنزین مورد نیاز خود را از طریق واردات تامین می کند.	Y	بنزین	1380	    6,833	0.0095	304.3077	persian_news_2017_00032342
7138	تحقق پیدا کرد گفت رشد مصرف بنزین از سال..	Y	بنزین	1380	    6,833	0.0095	387.3333	persian_news_2017_00395513
7139	پس از تصویب تحریم صادرات بنزین به ایران توسط دولت آمریکا، بسیاری از شرکت‌های بزرگ نفتی فروش بنزین به ایران را متوقف کردند.	Y	بنزین	1380	    6,833	0.0095	418.3684	persian_news_2016_00374289
7140	بندی بنزین تا اطلاع بعدی 110 گروه مشغول.	Y	بنزین	1380	    6,833	0.0095	860.1429	persian_news_2019_00262171
7141	وی اولين عضو هيات دولت بود که روز گذشته از جلسه خارج شد.	Y	هيات	1380	    6,833	0.0095	266.3077	persian_news_2017_00921746
7142	اين هيات در 3 مرحله وارد مشهد شد.	Y	هيات	1380	    6,833	0.0095	374.4286	persian_news_2017_00236487
