ORDER	SENTENCE	STATUS	WORD	RANK	COUNT	COUNT_REL	INDEX	ID
7574	که تصور نمی رود وجود داشته باشند.	Y	تصور	1461	    6,391	0.0089	430.7143	persian_news_2016_00731523
7575	تصور می کنم این تحول بزرگی است.	Y	تصور	1461	    6,391	0.0089	712.2857	persian_news_2019_00346675
7576	تهران - ایرنا - در آخرین هفته سال 95 نمایش هایی که پیش از این اجرای خود را در سالن های مختلف شهر تهران آغاز کرده بودند به کار خود پایان می دهند.	Y	سالن	1461	    6,391	0.0089	247.2222	persian_news_2019_00358925
7577	به گزارش ایرنا، با افتتاح این سالن تعداد سالن های ورزشی ساخته شده در آموزش و پرورش به 6 سالن افزایش پیدا کرد.	Y	سالن	1461	    6,391	0.0089	344.9474	persian_news_2016_00319830
7578	وی پیش از این در مسابقات قهرمانی آسیا و قهرمانی داخل سالن آسیا هم به مدال طلا دست پیدا کرده بود.	Y	سالن	1461	    6,391	0.0089	412.4211	persian_news_2019_00947879
7579	روز دوشنبه سالن محل برگزاری این مسابقه را اعلام می‌کنیم.»	Y	سالن	1461	    6,391	0.0089	531.9	persian_news_2019_00533316
7580	شامل اتاق کنفرانس و دو سالن است.	Y	سالن	1461	    6,391	0.0089	686	persian_news_2017_00641256
7581	۲ – وقتی استقلال و آزادی هدف شده است، محل سياسی عمل، در بيرون قدرت حاکم و قدرت خارجی قرار گرفته است.	Y	بيرون	1462	    6,387	0.0088	341.4706	persian_news_2017_00005740
7582	چه در زندان و چه در بيرون زندان.	Y	بيرون	1462	    6,387	0.0088	370	persian_news_2017_00439082
7583	آيا موسوی می تواند احمدی نژاد را از عرصه بيرون کند؟	Y	بيرون	1462	    6,387	0.0088	449.5455	persian_news_2017_00196977
7584	به همين دليل اطلاعاتی که به بيرون راه پيدا کرد، بسيار محدود بود.	Y	بيرون	1462	    6,387	0.0088	474.4167	persian_news_2016_00360411
7585	۲ – ميدان عمل بيرون رژيم و بيرون از ايران است.	Y	بيرون	1462	    6,387	0.0088	502	persian_news_2016_00005098
7586	فقط اين سه خبر نيستند که به آنها اشاره شد.	Y	نيستند	1462	    6,387	0.0088	220	persian_news_2017_00698202
7587	بنابراين اگر بی اطلاع نيستند از اين واکنش ها بايد اين سوال را مطرح کرد که چرا مطرح می شود.	Y	نيستند	1462	    6,387	0.0088	320.8333	persian_news_2016_00299378
7588	اين مردم يا ايرانی هستند يا نيستند!	Y	نيستند	1462	    6,387	0.0088	408.5	persian_news_2017_00230209
7589	اما تمام اين نسل اين افراد نيستند..	Y	نيستند	1462	    6,387	0.0088	518.8333	persian_news_2017_00115893
7590	اما اصلاح‌طلبان درون اين چارچوب کار می‌کنند و به دنبال کار و روش ديگری نيستند.	Y	نيستند	1462	    6,387	0.0088	589.5385	persian_news_2017_00108527
7591	مشکلات زيادی وجود دارد که آنها بايد آن را حل کنند.	Y	زيادی	1463	    6,385	0.0088	221	persian_news_2016_00800885
7592	غرب با عمل انجام شده روبرو است و کار زيادی نمی تواند انجام دهد.	Y	زيادی	1463	    6,385	0.0088	353.3077	persian_news_2016_00687411
7593	که البته نگرانی زيادی از آن نيست.	Y	زيادی	1463	    6,385	0.0088	411.5714	persian_news_2016_00731108
7594	از وی آثار زيادی به جا مانده است.	Y	زيادی	1463	    6,385	0.0088	499.125	persian_news_2016_00057384
7595	اما موضع تعداد زيادی از کشورها کاملا ثابت نيست.	Y	زيادی	1463	    6,385	0.0088	777.5556	persian_news_2016_00126366
7596	اعلام شده بود که یا ممنوع است یا باید.	Y	ممنوع	1464	    6,374	0.0088	227.5	persian_news_2019_00076205
7597	جهان نمی تواند مناطق “حقوق بشر ممنوع” داشته باشد.	Y	ممنوع	1464	    6,374	0.0088	345.7778	persian_news_2016_00424117
7598	پرداخت بیش از 50درصد قیمت خودرو ممنوع!	Y	ممنوع	1464	    6,374	0.0088	388	persian_news_2019_00317591
7599	وی ادامه داد: خرید و فروش سهام عدالت ممنوع و غیر قابل انجام است.	Y	ممنوع	1464	    6,374	0.0088	430.6923	persian_news_2017_00903441
7600	بنا به گزارش منابع خبری، زندانيان سياسی زيادی در زندان های سوريه هستند و فعاليت احزاب مهم و عمده مخالف ممنوع می باشد.	Y	ممنوع	1464	    6,374	0.0088	518.3182	persian_news_2016_00303811
7601	رئيس جمهوری آينده روسيه که از هفتم ماه می قدرت را به دست می گيرد، نیز در برخی از اين مذاکرات با رئيس جمهوری آمريکا حضور خواهد داشت.	Y	هفتم	1465	    6,368	0.0088	248.0417	persian_news_2016_00601621
7602	اين رقم در انتخابات دوره هفتم مجلس ۵۱.	Y	هفتم	1465	    6,368	0.0088	356.8571	persian_news_2017_00218785
7603	به گزارش ایلنا، این استاد دانشگاه قرار بود درباره انتخابات هفتم اسفند ماه جاری سخنرانی کند.	Y	هفتم	1465	    6,368	0.0088	398.8125	persian_news_2016_00321883
7604	در انتخابات مجلس پنجم و ششم و هفتم و در انتخابات رياست جمهوري در سال 1376 ثبت نام كرد.	Y	هفتم	1465	    6,368	0.0088	502.6923	persian_news_2016_00484946
7605	در رتبه هفتم جدول رده بندی لیگ برتر قرار.	Y	هفتم	1465	    6,368	0.0088	828.2222	persian_news_2019_00469013
7606	گرفته شده است رئیس بنیاد انقلاب اسلامی با اشاره.	Y	بنیاد	1466	    6,360	0.0088	221.6667	persian_news_2019_00718240
7607	های بنیاد مسکن انقلاب قرار داشته است.	Y	بنیاد	1466	    6,360	0.0088	332.5714	persian_news_2016_00863018
7608	در نشست خبری با معاون بنیاد شهید مطرح شد؛	Y	بنیاد	1466	    6,360	0.0088	391	persian_news_2019_00488451
7609	به طور کلی فرهنگ منطقه کرمان بر بنیاد دو عامل شکل گرفته است.	Y	بنیاد	1466	    6,360	0.0088	468.6154	persian_news_2017_00320683
7610	اند مدیرکل بنیاد روستایی همچنین افتتاح تعدادی از واحدهای.	Y	بنیاد	1466	    6,360	0.0088	787.1111	persian_news_2019_00141377
7611	در این تظاهرات بیش از ۳ هزار نفر شرکت کردند.	Y	تظاهرات	1467	    6,348	0.0088	230.8889	persian_news_2019_00438721
7612	در حالی که تا چند روز آینده شاهد برگزاری انتخابات در پارلمان اروپا خواهیم بود مردم فرانسه همچنان به تظاهرات علیه رئیس جمهور این کشور ادامه می‌دهند.	Y	تظاهرات	1467	    6,348	0.0088	344.5385	persian_news_2019_00462637
7613	تظاهرات مردم عراق در اعتراض به سفر «ترامپ	Y	تظاهرات	1467	    6,348	0.0088	437.125	persian_news_2019_00346961
7614	در دوران انقلاب، شعار «مرگ بر آمريکا» در تظاهرات بود.	Y	تظاهرات	1467	    6,348	0.0088	484.3333	persian_news_2016_00519026
7615	در پی شروع تظاهرات مخالفان ضد رژیم بازداشت..	Y	تظاهرات	1467	    6,348	0.0088	793.875	persian_news_2017_00511685
7616	دولت آلمان تاکید دارد که تصمیم گرفته شده برای این بوده است که افزایش بودجه تا میزان دو درصد تا سال ۲۰۲۴ باید انجام بگیرد.	Y	بگیرد	1468	    6,340	0.0088	203	persian_news_2019_00507546
7617	او گفت شورای حقوق بشر نباید مورد استفاده قرار بگیرد.	Y	بگیرد	1468	    6,340	0.0088	323.4	persian_news_2017_00186801
7618	تازه ابتدای سال هستیم و باید این موضوع مورد بررسی قرار بگیرد.	Y	بگیرد	1468	    6,340	0.0088	387.6667	persian_news_2019_00334906
7619	ترامپ گفت باید «با من تماس بگیرد» با این.	Y	بگیرد	1468	    6,340	0.0088	490.5	persian_news_2019_00342396
7620	محیط زیست نباید کار اجرایی بر عهده بگیرد.	Y	بگیرد	1468	    6,340	0.0088	712.25	persian_news_2019_00753517
7621	زيرا همه تيم ها در بازی های خود نمايش خوبی را ارائه کرده اند.	Y	نمايش	1468	    6,340	0.0088	283.7143	persian_news_2017_00612480
7622	اين نمايش گروهی در جريان اعتراض هايی انجام شد که از دو هفته پيش در اين کشور در جريان است.	Y	نمايش	1468	    6,340	0.0088	359.6875	persian_news_2016_00231993
7623	آنها در جام جهانی نمايش خوبی داشتند.	Y	نمايش	1468	    6,340	0.0088	442.5714	persian_news_2016_00169025
7624	بيش از 10 اثر به نمايش گذاشته است.	Y	نمايش	1468	    6,340	0.0088	479.7143	persian_news_2017_00365468
7625	پس از نمايش فيلم پرسش و پاسخ و گفتگو خواهيم داشت.	Y	نمايش	1468	    6,340	0.0088	594	persian_news_2016_00375612
7626	همچنین براساس این گزارش ها ، فولاد از ایران در سه سال اخیر 8 برابر شده و به یک میلیون تن در سال رسیده است.	Y	فولاد	1469	    6,338	0.0088	201.5714	persian_news_2017_00881784
7627	در پایان این رقابت ها تیم فولاد موفق شد..	Y	فولاد	1469	    6,338	0.0088	337.7778	persian_news_2016_00504052
7628	به گزارش ایسنا، دیدار استقلال و فولاد در نیمه نخست با نتیجه بدون گل به پایان رسید.	Y	فولاد	1469	    6,338	0.0088	403.5625	persian_news_2019_00278835
7629	در نخستین بازی این هفته تیم در ورزشگاه فولاد.	Y	فولاد	1469	    6,338	0.0088	488.875	persian_news_2019_00488111
7630	فشار حملات فولاد در دقيقه 66 به نتيجه رسيد.	Y	فولاد	1469	    6,338	0.0088	785.25	persian_news_2016_00697273
7631	ايران مي‌تواند در اين زمينه از تجربه هند استفاده كند.	Y	مي‌تواند	1469	    6,338	0.0088	421	persian_news_2017_00199894
7632	فقط توجه به چند نکته مي‌تواند به درمان آن کمک کند.	Y	مي‌تواند	1469	    6,338	0.0088	445.1	persian_news_2016_00698956
7633	اما آيا لبنان مي‌تواند از خود دفاع كند؟	Y	مي‌تواند	1469	    6,338	0.0088	445.125	persian_news_2017_00111092
7634	در اين چارچوب حتي مساله خروج ايران از سازمان ملل نيز مي‌تواند مطرح گردد.	Y	مي‌تواند	1469	    6,338	0.0088	536.7857	persian_news_2019_00447969
7635	آيا او مي‌تواند در بازي پنجشنبه شب به ميدان رود؟	Y	مي‌تواند	1469	    6,338	0.0088	714.6	persian_news_2016_00190238
7636	نظارت دانشگاه آزاد با ما نيست، با انقلاب فرهنگي است.	Y	فرهنگي	1470	    6,333	0.0088	287	persian_news_2016_00847584
7637	جامعه فرهنگي بيش از اين از مجلس انتظار داشت.	Y	فرهنگي	1470	    6,333	0.0088	348.25	persian_news_2016_00414760
7638	اما متاسفانه کار فرهنگي در اين زمينه انجام نشده.	Y	فرهنگي	1470	    6,333	0.0088	383.2222	persian_news_2017_00123749
7639	حتی روز گذشته مشاور فرهنگي فرمانده سپاه از آن دفاع هم كرد.	Y	فرهنگي	1470	    6,333	0.0088	418.1667	persian_news_2017_00447824
7640	نخست وزير دوران دفاع مقدس افزود؛ «ما سرمايه هاي ديگري چون سرمايه هاي اقتصادي، فرهنگي و..	Y	فرهنگي	1470	    6,333	0.0088	576.7143	persian_news_2016_00843589
7641	۱۰ درجه می شود که در برخی مناطق.	Y	درجه	1471	    6,332	0.0088	285.8571	persian_news_2019_00000464
7642	دریافت درجه از وزارت فرهنگ و ارشاد اسلامی شده.	Y	درجه	1471	    6,332	0.0088	370	persian_news_2019_00436173
7643	يعنی در درجه ی نخست بر اساس فرهنگی که در درون آن زندگی می کنيم انتخاب صورت می گيرد.	Y	درجه	1471	    6,332	0.0088	416.3529	persian_news_2017_00992234
7644	درجه دخالت دولت را در اقتصاد چگونه می توان اندازه گرفت؟	Y	درجه	1471	    6,332	0.0088	522.4545	persian_news_2016_00509896
7645	ترین ساعت به حدود 12 درجه بالای صفر.	Y	درجه	1471	    6,332	0.0088	795.8571	persian_news_2019_00343962
7646	به گزارش خبرنگار سیاسی ایلنا مستقر در ستاد انتخابات کشور، وزارت کشور نتایج انتخابات مجلس خبرگان رهبری را در حالی اعلام کرد که در حوزه تهران آیت‌الله هاشمی به عنوان نفر نخست راه یافته است.	Y	آیت‌الله	1472	    6,321	0.0088	357.5	persian_news_2017_00339574
7647	در این میان اما، یک عضو مجلس خبرگان گفته رای به موسوی، به دلیل همشهری بودن وی با آیت‌الله خامنه‌ای بوده است.	Y	آیت‌الله	1472	    6,321	0.0088	401.1905	persian_news_2017_00495141
7648	برخی نمایندگان مجلس به نقل از آیت‌الله خامنه‌ای٬ خبر از مخالفت وی با این مذاکرات داده بودند.	Y	آیت‌الله	1472	    6,321	0.0088	401.8125	persian_news_2017_00286317
7649	آیت‌الله احمد جنتی با اشاره به وجود مشکلات در کشور، تأکید کرد: مسئولان از تمامی توان خود برای خدمت به این مردم بزرگ استفاده کنند.	Y	آیت‌الله	1472	    6,321	0.0088	416.875	persian_news_2019_00019763
7650	او در اولین انتخابات مجلس شورای اسلامی،بعد از آیت‌الله طالقانی بیشترین رای مردم تهران را از آن خود کرد و وارد مجلس شد.	Y	آیت‌الله	1472	    6,321	0.0088	419.5455	persian_news_2017_00181886
7651	اين حضور نشان مي‌دهد دولت، مردم و نظام دست در دست هم دارند.	Y	مي‌دهد	1473	    6,317	0.0087	180.25	persian_news_2017_00213442
7652	دولت با تمام توان بحث نظارت را انجام مي‌دهد.	Y	مي‌دهد	1473	    6,317	0.0087	329.8889	persian_news_2017_00569655
7653	قبل از آن هم 50 درصد بود كه نشان مي‌دهد مشاركت مردم در طول زمان كمتر هم شده است.	Y	مي‌دهد	1473	    6,317	0.0087	434.2353	persian_news_2016_00704996
7654	اين نشان مي‌دهد كه اين انتخابات سالم است.	Y	مي‌دهد	1473	    6,317	0.0087	470	persian_news_2017_00233338
7655	حق پخش يكي از منابع مهم درآمد هر باشگاه است كه در دنيا 50 درصد درآمد يك باشگاه را تشكيل مي‌دهد.	Y	مي‌دهد	1473	    6,317	0.0087	486.5556	persian_news_2017_00457123
7656	این کشور برگزار شد رئیس بازرگانی استان در این..	Y	بازرگانی	1474	    6,310	0.0087	224.375	persian_news_2016_00158623
7657	او در دولت محمد خاتمی معاون وزير بازرگانی بود.	Y	بازرگانی	1474	    6,310	0.0087	370.3333	persian_news_2017_00183037
7658	رییس بازرگانی ایران با اشاره به اینکه مشهد سالانه..	Y	بازرگانی	1474	    6,310	0.0087	437.2222	persian_news_2016_00577913
7659	روحانی در نشست مشترک اتاق های بازرگانی ایران؛	Y	بازرگانی	1474	    6,310	0.0087	540.875	persian_news_2019_00531861
7660	بازرگانی خارجی خراسان رضوی در 4 ماهه ابتدای.	Y	بازرگانی	1474	    6,310	0.0087	780.8571	persian_news_2019_00209169
7661	مثل اين كه امام فكر كرده بود كه اين كار يك نفر، دو يا 5 نفر نيست.	Y	فكر	1475	    6,309	0.0087	290.3077	persian_news_2017_00773123
7662	نمی توان گفت كه دانشجويان 20 سال پيش بايد مثل ما فكر و عمل می كردند.	Y	فكر	1475	    6,309	0.0087	325.2	persian_news_2017_00858870
7663	امام با اين فكر هم مخالف بود.	Y	فكر	1475	    6,309	0.0087	384.8571	persian_news_2017_00123539
7664	تغيير زمان، تغيير فكر ايجاد مى‏كند.	Y	فكر	1475	    6,309	0.0087	521.3333	persian_news_2017_00403017
7665	آنها فكر مي كنند نماينده خدا هستند.	Y	فكر	1475	    6,309	0.0087	641.1429	persian_news_2017_00170095
7666	ماه آغاز و تا ١٠ آذر ماه ادامه خواهد داشت.	Y	آذر	1476	    6,306	0.0087	237	persian_news_2016_00763307
7667	قرار است مجمع عمومی بانک صادرات 18 آذر ماه برگزار می‌شود.	Y	آذر	1476	    6,306	0.0087	344.5	persian_news_2017_00706090
7668	شد و دومین نیز 14 آذر برگزاری خواهد شد..	Y	آذر	1476	    6,306	0.0087	438.8571	persian_news_2017_00645692
7669	از چهارم تا هفتم آذر در اصفهان برگزار شد.	Y	آذر	1476	    6,306	0.0087	509.3333	persian_news_2019_00047321
7670	در عرصه از 22 آذر در حاشیه همایش دو..	Y	آذر	1476	    6,306	0.0087	695.4286	persian_news_2017_00535717
7671	يعني قانون در اين ارتباط وجود دارد.	Y	يعني	1477	    6,299	0.0087	313	persian_news_2019_00997952
7672	اين يعني آن‌ها 80 درصد زمان را خوب عمل کردند.	Y	يعني	1477	    6,299	0.0087	352.4444	persian_news_2019_00192770
7673	يعني گام اول در اين جهت است.	Y	يعني	1477	    6,299	0.0087	444	persian_news_2016_00993657
7674	يعني انتخابات آزاد را تجربه كنند تا قدرت سياسي اعتبار جهاني پيدا كند.	Y	يعني	1477	    6,299	0.0087	511	persian_news_2017_00993016
7675	يعني مجموع اين عوامل در قالب يک بسته ديده شود.	Y	يعني	1477	    6,299	0.0087	663	persian_news_2016_00993691
7676	اين گفت و گو ها بايد که در ماه جاری انجام شود.»	Y	گو	1478	    6,289	0.0087	180.8333	persian_news_2016_00226616
7677	مسئله اين است که درباره چه بايد گفت و گو کنيم».	Y	گو	1478	    6,289	0.0087	270.2727	persian_news_2016_00797832
7678	وی دیدار و گفت و گو کرد انتظامی استان..	Y	گو	1478	    6,289	0.0087	317.375	persian_news_2017_00940713
7679	او هر چه گفت و گو بعد از اين تاريخ داشته با چند سوال محدود روبرو بوده.	Y	گو	1478	    6,289	0.0087	351.2353	persian_news_2016_00188132
7680	گو میان کارشناسان محلی فرهنگی و نماینده اعزام شده.	Y	گو	1478	    6,289	0.0087	679.8889	persian_news_2019_00729940
7681	در همه جای دنيا ليگ برای تيم ملی است اما در ايران تيم ملی برای ليگ است و برنامه های خود را بر اساس تيم ملی طراحی می کنيم.	Y	ليگ	1479	    6,288	0.0087	274.381	persian_news_2016_00547910
7682	اما از حالا به بعد سه چهار ماه اول سال را زمان دارم و بعد هم ليگ.	Y	ليگ	1479	    6,288	0.0087	288.625	persian_news_2016_00109545
7683	پرسپوليس هم اکنون تنها تيم بدون شکست ليگ برتر است.	Y	ليگ	1479	    6,288	0.0087	465.5	persian_news_2017_00371446
7684	ليگ ايران با ليگ آمريکا متفاوت است.	Y	ليگ	1479	    6,288	0.0087	482.5	persian_news_2017_00754400
7685	با اين برد پرسپوليس به رده پنجم جدول ليگ رسيد؟	Y	ليگ	1479	    6,288	0.0087	809.1	persian_news_2017_00241457
7686	مگر این همه کار در مجلس وجود ندارد؟	Y	مگر	1480	    6,282	0.0087	243.375	persian_news_2016_00815009
7687	تاريخ هيچ نيست مگر فعاليت انسانی که هدف¬های خود را دنبال می کند.»	Y	مگر	1480	    6,282	0.0087	335.5714	persian_news_2016_00387949
7688	مگر شرايط ايشان در آن زندان چگونه است؟	Y	مگر	1480	    6,282	0.0087	458.75	persian_news_2017_00816228
7689	مگر او نبود که اعتقاد داشت بهترين دفاع حمله است؟	Y	مگر	1480	    6,282	0.0087	531.7	persian_news_2016_00815018
7690	مگر اينكه به صفر برسد كه تازه ثابت مي‌شود.	Y	مگر	1480	    6,282	0.0087	761	persian_news_2016_00815043
7691	های طلب یک روز دیگر با نام و اهداف.	Y	طلب	1481	    6,270	0.0087	296.4444	persian_news_2019_00859863
7692	است که زمان زیادی را طلب می‌کند.	Y	طلب	1481	    6,270	0.0087	355.2857	persian_news_2019_00064541
7693	اصلاح طلب ها تغيير کرده اند يا آقای هاشمی تغيير کرده؟	Y	طلب	1481	    6,270	0.0087	399.8889	persian_news_2017_00068667
7694	وضعیت دیگر احزاب اصلاح طلب نیز از وضعیت حزب اعتماد ملی بهتر نیست.	Y	طلب	1481	    6,270	0.0087	458.9167	persian_news_2017_00956084
7695	عنوان نیمه ی توزیع می کنند وقتی نیمه را تحویل می گیرد پس از طلب.	Y	طلب	1481	    6,270	0.0087	545	persian_news_2019_00651747
7696	پس چه طور مي شود که آنها کار پيدا مي کنند ولي جوان ايراني نه.	Y	ايراني	1482	    6,269	0.0087	354.8571	persian_news_2016_00376664
7697	در ادامه تلاش ها براي افزايش صادرات محصولات ايراني ؛	Y	ايراني	1482	    6,269	0.0087	387.6667	persian_news_2019_00433525
7698	نزديک به 3000 ايراني از تيم ملي آلمان در تهران استقبال کردند.	Y	ايراني	1482	    6,269	0.0087	489.2727	persian_news_2017_00847635
7699	ايراني که مي خواهد خوب زندگي کند.	Y	ايراني	1482	    6,269	0.0087	507.7143	persian_news_2017_00200420
7700	‏ ‎ايراني ها دنيا را مي گرفتند اگر.	Y	ايراني	1482	    6,269	0.0087	579.4286	persian_news_2017_00200441
7701	تولید کند این در حالی است که کارخانه های.	Y	کارخانه	1483	    6,267	0.0087	235.4	persian_news_2019_00367656
7702	کارخانه ما داشتند و از شرکت در نمایشگاه بین.	Y	کارخانه	1483	    6,267	0.0087	321.8889	persian_news_2019_00686218
7703	وی افزود: اکنون این کارخانه فعال نیست.	Y	کارخانه	1483	    6,267	0.0087	371	persian_news_2019_00924422
7704	علمی است وی گفت همچنین 100 کارخانه در پایین..	Y	کارخانه	1483	    6,267	0.0087	464.375	persian_news_2016_00683438
7705	یعنی 150 کارخانه بزرگ زیر بار تولید می‌رود.	Y	کارخانه	1483	    6,267	0.0087	714.7143	persian_news_2017_00685874
7706	ی آمریکا برای بر هم زدن روابط ایران و عراق.	Y	زدن	1484	    6,260	0.0087	265.5	persian_news_2019_00117817
7707	ای با دور زدن قانون و اینکه های ساخته شده..	Y	زدن	1484	    6,260	0.0087	313.9	persian_news_2017_00016841
7708	در این میان قطر که دومین میدان بزرگ گاز جهان را دارد، به دنبال مسیر دیگری برای انتقال گاز به اروپا است، از طریق عراق و ترکیه و با دور زدن ایران و سوریه.	Y	زدن	1484	    6,260	0.0087	391.9	persian_news_2019_00444600
7709	اين جوان را به علت حرف زدن گرفته اند.	Y	زدن	1484	    6,260	0.0087	447.6667	persian_news_2017_00212577
7710	با حرف زدن که کاری انجام نمی‌شود.	Y	زدن	1484	    6,260	0.0087	675.5714	persian_news_2019_00203135
7711	سازمان از همه کالاهای ی مردم در این ماه آغاز.	Y	کالاهای	1485	    6,256	0.0087	231.7	persian_news_2019_00565029
7712	است که نظارت بیشتری بر کالاهای وارد شده با.	Y	کالاهای	1485	    6,256	0.0087	350.3333	persian_news_2019_00064622
7713	ستاد استان در خصوص تامین کالاهای اساسی مردم..	Y	کالاهای	1485	    6,256	0.0087	405.625	persian_news_2017_00620963
7714	اين اختلاف قيمت در کالاهای داخلی هم وجود دارد.	Y	کالاهای	1485	    6,256	0.0087	458	persian_news_2017_00203787
7715	کاهش شدید واردات کالاهای ی منجر به رونق و توسعه..	Y	کالاهای	1485	    6,256	0.0087	657.2	persian_news_2016_00720649
7716	را برگزار کنند و اگر لازم نباشد واحد های.	Y	نباشد	1486	    6,244	0.0086	272.7778	persian_news_2019_00513403
7717	تا پایان سال کمتر از سال گذشته نباشد.	Y	نباشد	1486	    6,244	0.0086	363.7143	persian_news_2019_00333583
7718	مرتبط نباشد پس برای چه برای خانه معرفی شده است.	Y	نباشد	1486	    6,244	0.0086	427.8889	persian_news_2019_00777572
