ORDER	SENTENCE	STATUS	WORD	RANK	COUNT	COUNT_REL	INDEX	ID
13231	ԵԽԽՎ ՀՀ պատվիրակության անդամները երեկ շտապ վերադարձել են «Հրապարակ».	Y	պատվիրակության	2267	    2,382	0.0048	1192.1111	arm_news_2017_00319021
13232	Մարզական առումով իհարկե սա լավ է ու միայն այսպես կարելի է առաջ գնալ։	Y	մարզական	2268	    2,381	0.0048	416.0833	arm_news_2015_00679838
13233	Ահա այսպիսի մարզական (և ոչ միայն) բաներ..	Y	մարզական	2268	    2,381	0.0048	690.4286	arm_news_2015_00097364
13234	Դա կլիներ ե՛ւ քաղաքական, ե՛ւ մարզական քայլ։	Y	մարզական	2268	    2,381	0.0048	778	arm_news_2013_00293395
13235	Չեմ ասում, որ մրցակիցը թույլ էր, բայց մարզական բախտը մեզ հետ չէր այսօր»։	Y	մարզական	2268	    2,381	0.0048	783.3077	arm_news_2017_00822033
13236	Ըստ նրա, այդ իրադարձությունը կարող է լինել ինչպես հոգևոր, այնպես էլ մարզական բնույթի։	Y	մարզական	2268	    2,381	0.0048	784.2308	arm_news_2013_00414886
13237	Սերժ Սարգսյանի և Ռոբերտ Քոչարյանի նոր դաշինքը.	Y	դաշինքը	2269	    2,380	0.0048	502.1429	arm_news_2017_00891910
13238	Ես կարող եմ հստակ ասել, թե ինչպես է կայացել այս դաշինքը, հասարակությունը տեղյակ չէ։	Y	դաշինքը	2269	    2,380	0.0048	585.7857	arm_news_2017_00328370
13239	Գրեթե նույն բանն, ըստ նրա, անում է նաեւ «Ծառուկյան» դաշինքը։	Y	դաշինքը	2269	    2,380	0.0048	674.7	arm_news_2017_00275304
13240	Արամ Սարգսյան«Ելք» դաշինքը՝ Տավուշի մարզում էր։	Y	դաշինքը	2269	    2,380	0.0048	1116.4286	arm_news_2017_00195150
13241	Ցանկալի կլիներ խորհրդարանի նոր կազմում տեսնել «Ելք» դաշինքը։	Y	դաշինքը	2269	    2,380	0.0048	1260.25	arm_news_2017_00956981
13242	Սակայն դա չի կարող տեղի ունենալ, հակառակը՝ մենք ուժեղ ենք, ինչպես երբեք։	Y	հակառակը	2269	    2,380	0.0048	341.25	arm_news_2017_00871148
13243	Հակառակը՝ այս հայտարարությունը որոշ առումով նաեւ օգտակար էր մեզ համար։	Y	հակառակը	2269	    2,380	0.0048	523.3	arm_news_2015_00565652
13244	Թվում է, թե հակառակը պետք է լիներ.	Y	հակառակը	2269	    2,380	0.0048	618.6667	arm_news_2013_00431531
13245	Լսում է մի բան ու սկսում պատմել ճիշտ հակառակը։	Y	հակառակը	2269	    2,380	0.0048	679.3333	arm_news_2015_00514221
13246	Մինչդեռ նկատում ենք հակառակը` մարդիկ գնում են։	Y	հակառակը	2269	    2,380	0.0048	879	arm_news_2017_00703676
13247	Այս մասին ուղղակի նշում կար նաև օրենքի 2-րդ հոդվածում։	Y	հոդվածում	2269	    2,380	0.0048	519.6667	arm_news_2015_00163077
13248	Այդ զրույցի մեջ ես ուզում եմ բռնել նոր սերնդի կողմը, գուցե նախ` այն բանի համար, որ ինքս էլ դեռ երիտասարդ եմ և ապա… Այդ «ապա»֊ն` հոդվածում։	Y	հոդվածում	2269	    2,380	0.0048	747.25	arm_news_2017_00101484
13249	Իսկ թե ի՞նչ է լինում հետո, կպատմենք հաջորդ հոդվածում։	Y	հոդվածում	2269	    2,380	0.0048	757.6	arm_news_2013_00475819
13250	Ռուսաստանի ազգային անվտանգության երաշխիքները» հոդվածում Պուտինը գրում է, որ մինչև 2022թ.	Y	հոդվածում	2269	    2,380	0.0048	775.2727	arm_news_2015_00878427
13251	Մի խոսքով, հոդվածում միակ կետը, որին համաձայն եմ՝ «Իհարկե, մենք շարունակելու ենք պայքարել հանուն մեր բոլորիս երազած Հայաստանի, եւ այդ պայքարը չի կարող վերջ ունենալ»։	Y	հոդվածում	2269	    2,380	0.0048	812.8	arm_news_2015_00713453
13252	Բայց մեր կարծիքով այն ավելի շատ սոցիալական է, քան գովազդային։	Y	գովազդային	2270	    2,379	0.0048	346	arm_news_2017_00224399
13253	Հայաստանում գովազդային շուկայի հին ու նոր խնդիրները.	Y	գովազդային	2270	    2,379	0.0048	701.8571	arm_news_2017_00561635
13254	Ու պետք է ասեմ, որ այնքան էլ բարձր չէ, հատկապես գովազդային լուսանկարչությունը։	Y	գովազդային	2270	    2,379	0.0048	721.0833	arm_news_2013_00824550
13255	Օրինակ՝ ՀԱԿ–ն ասում էր, որ արտաքին գովազդային վահանակների համար ֆինանսական միջոցներ չունի։	Y	գովազդային	2270	    2,379	0.0048	748.5385	arm_news_2013_00993225
13256	Ու ընդհանրապես, իրենք իրավունք չունեն ուղարկել ինձ որևէ գովազդային հաղորդագրություն։	Y	գովազդային	2270	    2,379	0.0048	822.2	arm_news_2013_00817266
13257	Հենց ինքը՝ Ռուսաստանը, ԱՄՆ-ի եւ Մեծ Բրիտանիայի հետ 1994թ.	Y	բրիտանիայի	2271	    2,378	0.0048	350.6	arm_news_2013_00606225
13258	Այսպես, ԱՄՆ-ի և Մեծ Բրիտանիայի միջև 1783թ.	Y	բրիտանիայի	2271	    2,378	0.0048	381.125	arm_news_2015_00167649
13259	Ոմանք ուզում են մնալ Մեծ Բրիտանիայի կազմում, իսկ ոմանք էլ ոչ»։	Y	բրիտանիայի	2271	    2,378	0.0048	539.8	arm_news_2013_00799765
13260	ԵՄ-ն պատրաստ Է քննարկել Մեծ Բրիտանիայի հետ ապագա հարաբերությունները.	Y	բրիտանիայի	2271	    2,378	0.0048	580.7	arm_news_2017_00321971
13261	Դուք այստեղ եք՝ Գլխավոր Սկիզբ Օգտակար Տեղեկություններ Քաղաքականություն Հայաստանում Մեծ Բրիտանիայի..	Y	բրիտանիայի	2271	    2,378	0.0048	731.5455	arm_news_2013_00314024
13262	Մովսիսյանը նաև նշել է, որ իրեն պետք չէ պատգամավոր դառնա..	Y	մովսիսյանը	2272	    2,377	0.0048	501.7	arm_news_2017_00718110
13263	Լավ է ուշ, քան երբեք,-ասել է Մովսիսյանը։	Y	մովսիսյանը	2272	    2,377	0.0048	540.5714	arm_news_2015_00505014
13264	Այսօր կյանքի 81-րդ տարում մահացել է Վլադիմիր Մովսիսյանը։	Y	մովսիսյանը	2272	    2,377	0.0048	677	arm_news_2015_00180118
13265	Այսօր կյանքի 81-րդ տարում մահացել է պետական, քաղաքական գործիչ Վլադիմիր Մովսիսյանը։	Y	մովսիսյանը	2272	    2,377	0.0048	703.6364	arm_news_2015_00180117
13266	Այս պահին Մովսիսյանը ունի մոտ 10 րոպե ավել ժամանակ։	Y	մովսիսյանը	2272	    2,377	0.0048	714	arm_news_2013_00148869
13267	Connection: close Vary: Accept-Encoding X-Powered-By: PleskLin Անցյալ տարի, երբ պարզ դարձավ, որ 2008թ.	Y	accept	2273	    2,376	0.0048	1015.6875	arm_news_2015_00060714
13268	Connection: close Vary: Accept-Encoding X-Powered-By: PleskLin Ընդդիմությունը միավորվել է: Դեռ մի քանի ամիս առաջ Վրաստանի քիչ թե շատ հայտնի քաղաքական ուժերի միավորումն անհնարին բան էր թվում.	Y	accept	2273	    2,376	0.0048	1035.5862	arm_news_2015_00060723
13269	Connection: close Vary: Accept-Encoding X-Powered-By: PleskLin «Ի՞նչ է կյանքը.	Y	accept	2273	    2,376	0.0048	1064.4615	arm_news_2013_00046915
13270	Connection: close Vary: Accept-Encoding X-Powered-By: PleskLin ԱԺ գործարար պատգամավորները վստահեցնում են, որ օրենսդրական գործունեության շրջանակներում իրենք շատ բան են անում տնտեսության զարգացման համար: Արմեն Բաղդասարյան.	Y	accept	2273	    2,376	0.0048	1072	arm_news_2015_00060710
13271	Connection: close Vary: Accept-Encoding X-Powered-By: PleskLin «Թուրքիայում կա հայկական 20 դպրոց։	Y	accept	2273	    2,376	0.0048	1179.7692	arm_news_2013_00046913
13272	Վարչապետի մակարդակով տեղի ունեցած վերջին այցը կայացել էր 2015թ-ին, սակայն այն կրել էր ոչ թե պաշտոնական, այլ աշխատանքային բնույթ։	Y	կրել	2273	    2,376	0.0048	603.8421	arm_news_2017_00922798
13273	Դա կարող է կրել նաև տնտեսական տեսք.	Y	կրել	2273	    2,376	0.0048	606.2857	arm_news_2013_00293296
13274	Մենք էլ 40 մլն դրամի վնաս ենք կրել նշեց նա։	Y	կրել	2273	    2,376	0.0048	676	arm_news_2013_00686870
13275	Սակայն մյուս կողմից ներկայումս իրավիճակը որոշակի փոփոխություններ է կրել։	Y	կրել	2273	    2,376	0.0048	677.2222	arm_news_2017_00873738
13276	Չնայած դրանք կայացել են, բայց ժամանակի հետ էական փոփոխություններ են կրել.	Y	կրել	2273	    2,376	0.0048	834	arm_news_2015_00846026
13277	ՀՀ վարչապետ Ես այդ պահին համարժեք պատասխան եմ տվել.	Y	համարժեք	2274	    2,374	0.0048	424.2222	arm_news_2017_00623287
13278	Ամեն մարդ իր համարժեք գործը պետք է անի»։	Y	համարժեք	2274	    2,374	0.0048	526.625	arm_news_2013_00100717
13279	Այդ գումարը համարժեք է շուրջ 2 մլն ԱՄՆ դոլարի։	Y	համարժեք	2274	    2,374	0.0048	654.25	arm_news_2015_00115098
13280	Նախ՝ պետք է տալ և ապա համարժեք խնդրել ու պահանջել։	Y	համարժեք	2274	    2,374	0.0048	684.6	arm_news_2013_00747408
13281	Արցախի ՊԲ ստիպված է համարժեք պատասխան տալ.	Y	համարժեք	2274	    2,374	0.0048	943.5714	arm_news_2017_00213517
13282	Տե՜ր, լավ է, որ մենք այստեղ ենք.	Y	տե	2275	    2,373	0.0048	352.25	arm_news_2015_00952932
13283	Լա՛վ, տե՛ս, թե ինչ եմ ասում քեզ։	Y	տե	2275	    2,373	0.0048	583.3333	arm_news_2017_00472159
13284	ՄԱԿ-ի մասին ընդհանուր տեղեկությունների համար տե’ս.	Y	տե	2275	    2,373	0.0048	687	arm_news_2017_00653232
13285	«Մի հատ լավ տե՞ղ է մնացել».	Y	տե	2275	    2,373	0.0048	725.8571	arm_news_2013_00709306
13286	“Տե՛ր, տե՛ր, բա՛ց արա”: 12 Նա պատասխան տվեց ու ասաց.	Y	տե	2275	    2,373	0.0048	779.5	arm_news_2015_00953357
13287	Հետաքրքիր է, որ նոր է գլխի ընկել։	Y	գլխի	2276	    2,372	0.0048	640.8333	arm_news_2015_00621463
13288	Կարելի է մտածել, թե շաբաթ օրը չգիտեր, որ 68 տարեկան է, և դրա մասին գլխի է ընկել միայն երեկ։	Y	գլխի	2276	    2,372	0.0048	646.5625	arm_news_2015_00544361
13289	Նշենք, որ չնայած արդարադատության նախարարը «տեղը չէր բերել», թե ու՞մ մասին է խոսքը, բայց «գլխի էր ընկել», որ խոսքը վերաբերվում է մեկ այլ քրեական հեղինակության։	Y	գլխի	2276	    2,372	0.0048	656.3478	arm_news_2015_00773047
13290	«ՉԻ» - Փաստորեն այդ հինգ ոստիկանները միայն երեք օր անց են գլխի ընկել, որ իրենք էլ են վնասվածքներ ստացել։	Y	գլխի	2276	    2,372	0.0048	674.6471	arm_news_2015_00844557
13291	Եվ վերջնականապես հստակ է եղել այն, ինչը բոլորը գլխի էին ընկել դեռ վաղուց.	Y	գլխի	2276	    2,372	0.0048	720	arm_news_2013_00361810
13292	«Ո՞վ է այն մարդը, որ դաշտում մեզ ընդառաջ է գալիս»։	Y	ընդառաջ	2277	    2,371	0.0048	471.4	arm_news_2015_00813215
13293	«Իշխանությունը ոչ մի հարցում մեզ ընդառաջ չի գալիս».	Y	ընդառաջ	2277	    2,371	0.0048	478.375	arm_news_2015_00478905
13294	Թուրքիայի կառավարությունը 2015-ին ընդառաջ հատուկ խումբ է ստեղծել.	Y	ընդառաջ	2277	    2,371	0.0048	587.875	arm_news_2013_00428893
13295	«2015 թվականին ընդառաջ մեր աշխատանքները շարունակվում են և վերջին փուլում են։	Y	ընդառաջ	2277	    2,371	0.0048	629.6667	arm_news_2015_00017289
13296	Դա շարունակվում է արդեն մի քանի ամիս, սակայն ուշադրության կենտրոնում է հայտնվել միայն այժմ՝ Վրաստանում նախագահական ընտրություններին ընդառաջ։	Y	ընդառաջ	2277	    2,371	0.0048	654.1765	arm_news_2013_00295603
13297	Ի՞նչ են տալիս Ձեզ այդ հանդիպումները։	Y	հանդիպումները	2277	    2,371	0.0048	386.4286	arm_news_2013_00449602
13298	Նա նշեց, թե բոլորին հայտնի է այն պատճառը, թե ինչո՞ւ նման հանդիպումները արդյունք չեն տալիս։	Y	հանդիպումները	2277	    2,371	0.0048	468.7333	arm_news_2015_00756696
13299	Առաջին իսկ աշխատանքային օրերին այդ հանդիպումները կայացել են։	Y	հանդիպումները	2277	    2,371	0.0048	631.625	arm_news_2013_00188482
13300	Ուստի շատ կարևոր են հենց մարզային հանդիպումները։	Y	հանդիպումները	2277	    2,371	0.0048	709.4286	arm_news_2017_00817522
13301	Օրվա բոլոր ֆուտբոլային հանդիպումները Օրվա բոլոր ֆուտբոլային հանդիպումները..	Y	հանդիպումները	2277	    2,371	0.0048	1083.75	arm_news_2013_00994302
13302	Ինձ համար էլ մի այլ անհասկանալի բան կա… Այս..	Y	անհասկանալի	2278	    2,369	0.0048	294.2222	arm_news_2013_00447524
13303	Այստեղ խնդիր է առաջ գալիս, ինձ համար դա դարձավ անհասկանալի։	Y	անհասկանալի	2278	    2,369	0.0048	395.4	arm_news_2013_00154578
13304	Մինչև հիմա անհասկանալի է մնում, թե ինչպես կարելի է այն հավաքել։	Y	անհասկանալի	2278	    2,369	0.0048	516.5	arm_news_2015_00718890
13305	Ժողովուրդը կոնկրետ ինչ է ուզում, անհասկանալի է - iLur.	Y	անհասկանալի	2278	    2,369	0.0048	757.8571	arm_news_2017_00417252
13306	Իհարկե անհասկանալի է, զարմանալի կլիներ, որ հասկանալի լիներ..	Y	անհասկանալի	2278	    2,369	0.0048	1030.625	arm_news_2013_00441320
13307	Եվ ամեն անգամ երբ ես ուզում եմ Աշխարհին հայտնել, ասում եմ.	Y	աշխարհին	2279	    2,367	0.0047	310.2	arm_news_2013_00353530
13308	Այսինքն՝ ՀՀ-ն աշխարհին բան չունի՞ տալու։	Y	աշխարհին	2279	    2,367	0.0047	544.4286	arm_news_2013_00139374
13309	«Թուրքիան աշխարհին ցանկանում է ցույց տալ, որ հայ-թուրքական հարաբերությունների գործընթացը կենդանի է պահում»: Նա համոզված է, որ Թուրքիան մինչեւ 2015թ.	Y	աշխարհին	2279	    2,367	0.0047	569.2941	arm_news_2013_00430048
13310	Հայոց ցեղասպանության փաստը հստակ է ու հայտնի ամբողջ աշխարհին։	Y	աշխարհին	2279	    2,367	0.0047	603.8889	arm_news_2017_00571067
13311	Կես մարմին ունեցող մարդն աշխարհին ցույց է տվել` ինչպես ապրել ….	Y	աշխարհին	2279	    2,367	0.0047	927.1	arm_news_2015_00553042
13312	Սարգսյանը որոշել է, ինքն էլ կազմել է այդ ցուցակը։	Y	ցուցակը	2279	    2,367	0.0047	524.625	arm_news_2017_00883236
13313	«Այդ ցուցակը վերաբերում էր լրիվ այլ հարցի: Դա լրիվ այլ հարց էր.	Y	ցուցակը	2279	    2,367	0.0047	589.3333	arm_news_2013_00117878
13314	Apple-ը կազմել է լավագույն ծրագրերի ցուցակը Apple կազմել է 2012թ.	Y	ցուցակը	2279	    2,367	0.0047	786.375	arm_news_2015_00057929
13315	ՀՅԴ-ն հրապարակել է նախընտրական ցուցակը - iLur.	Y	ցուցակը	2279	    2,367	0.0047	910	arm_news_2017_00626287
13316	«Ելք» դաշինքը հրապարակել է Երևանի ավագանու ընտրությունների իր ցուցակը..	Y	ցուցակը	2279	    2,367	0.0047	1001.4444	arm_news_2017_00318523
13317	Սերժ Սարգսյանն ինձ խոստացել է իրականացնել այդ գաղափարը, որի համար ես ծնվել եմ գուցե։	Y	գաղափարը	2280	    2,366	0.0047	560.8571	arm_news_2015_00904927
13318	Նրան հանգիստ չէր տվել մահվան գաղափարը, բայց այդպես էր թերևս նրա գրականության մեջ միայն։	Y	գաղափարը	2280	    2,366	0.0047	628.7143	arm_news_2017_00771740
13319	Դա հաստատում է այն գաղափարը, որ քաղաքականության մեջ դեր ունի ժամանակը։	Y	գաղափարը	2280	    2,366	0.0047	631.4545	arm_news_2015_00310963
13320	Ես երբեք միայնակ մայր չեմ լինի, քանի որ չեմ ընդունում այդ գաղափարը.	Y	գաղափարը	2280	    2,366	0.0047	655.4545	arm_news_2017_00326044
13321	Պարզվում է՝ գաղափարը դեռեւս մեկ տարի առաջ է եղել.«	Y	գաղափարը	2280	    2,366	0.0047	761.25	arm_news_2017_00841469
13322	Հիմա շատ ավելի լավ եմ հանդես գալիս, քան երբևէ հանդես եմ եկել։	Y	երբևէ	2280	    2,366	0.0047	348.5	arm_news_2017_00607272
13323	«Այսօր զարգացման համագործակցությունը Հայաստանի հետ ավելի ակտիվ է, քան երբևէ».	Y	երբևէ	2280	    2,366	0.0047	513.8	arm_news_2013_00161778
13324	«Ես երբեք չեմ դառնա ԱԺ պատգամավոր, որովհետև նման ցանկություն երբևէ չեմ ունեցել և չեմ ունենալու։	Y	երբևէ	2280	    2,366	0.0047	620.2308	arm_news_2017_00326067
13325	Վերջին 30 տարիներին Թուրքիան երբևէ չի եղել այսպիսի բարդ վիճակում։	Y	երբևէ	2280	    2,366	0.0047	682	arm_news_2015_00934838
13326	Երբևէ երիտասարդների համար այսքան ծրագրեր չեն իրականացվել։	Y	երբևէ	2280	    2,366	0.0047	1330.1429	arm_news_2017_00353053
13327	Ընթանում է Հայաստանի պուտինիզացիա Պուտինը դեռ որոշում չի ընդունել Ուկրաինայում զորքերի օգտագործման մասին.	Y	զորքերի	2280	    2,366	0.0047	690.2308	arm_news_2013_00407753
13328	Արդեն իսկ խոսում են, որ ռուսական զորքերի մի մասը դուրս է բերվել հայ-թուրքական սահմանից։	Y	զորքերի	2280	    2,366	0.0047	698.5333	arm_news_2015_00228990
13329	Ըստ նրա՝ ԱՄՆ-ը շարունակում է օգնություն ցույց տալ այն ուժերին, որոնք Սիրիայում պայքարում են կառավարական զորքերի դեմ։	Y	զորքերի	2280	    2,366	0.0047	725.9444	arm_news_2015_00425704
13330	Եվ դա կարող է լինել հենց նշված հայկական զորքերի դուսբերումը։	Y	զորքերի	2280	    2,366	0.0047	764.9	arm_news_2015_00370964
13331	Եվ նման մարդկանց պահում են ոստիկանությունում ու դեռ մի բան էլ՝ զորքերի հրամանատա՞ր նշանակում։	Y	զորքերի	2280	    2,366	0.0047	823.1333	arm_news_2015_00375869
13332	Ինչպես են դրանք հնչում,բայց իրականում ինչ են նշանակում..	Y	հնչում	2280	    2,366	0.0047	430.5	arm_news_2013_00457529
13333	Դե, ի՞նչ, շատ գեղեցիկ է հնչում։	Y	հնչում	2280	    2,366	0.0047	473.1429	arm_news_2013_00301229
13334	Պատասխանը պարզ է, սակայն երբեք չի հնչում.	Y	հնչում	2280	    2,366	0.0047	622.1429	arm_news_2015_00852497
13335	Ո՞վ է մեղավոր այս ամենի համար հարցն արդեն երկար ժամանակ է հնչում։	Y	հնչում	2280	    2,366	0.0047	748.0833	arm_news_2015_00813515
13336	Ընդդիմության ձայնը խորհրդարանում չի հնչում այնպես, ինչպես փողոցում.	Y	հնչում	2280	    2,366	0.0047	1092.75	arm_news_2013_00400339
13337	«Ահա թե որն է քո ֆինանսների աղբյուրը.	Y	աղբյուրը	2281	    2,365	0.0047	673.8571	arm_news_2013_00093163
13338	Հետագայում այն քաղաքի ջրի հիմնական աղբյուրը դարձավ։	Y	աղբյուրը	2281	    2,365	0.0047	751.1429	arm_news_2017_00598811
13339	Ինչպես տեղեկացնում է ադրբեջանական ԱՊԱ գործակալությունը, այդ մասին տեղեկացրել է դիվանագիտական աղբյուրը։	Y	աղբյուրը	2281	    2,365	0.0047	782	arm_news_2013_00462173
13340	Ուստի, պետությունը համարվում է քաղաքացիական հասարակության աղբյուրը»։	Y	աղբյուրը	2281	    2,365	0.0047	870.2857	arm_news_2015_00834259
13341	«Իհարկե մեր նախարարը ակնկալում է անցկացնել նման հանդիպում»,- ասել է իրանական պատվիրակության աղբյուրը։	Y	աղբյուրը	2281	    2,365	0.0047	1029.9167	arm_news_2015_00451609
13342	Մյուս ամիսներին, կարելի է ասել, գործ չկա։	Y	ամիսներին	2281	    2,365	0.0047	504.2857	arm_news_2013_00720916
13343	Հաջորդ 5 ամիսներին մենք հենց դա ենք անելու.	Y	ամիսներին	2281	    2,365	0.0047	525.7143	arm_news_2017_00581922
13344	Առաջիկա ամիսներին մենք հանգիստ չենք տալու այս իշխանություններին։	Y	ամիսներին	2281	    2,365	0.0047	869	arm_news_2013_00187004
13345	Հովհաննիսյանի խոսքով՝ այս հանգամանքը պարզվել է 2016 թվականի առաջին ամիսներին։	Y	ամիսներին	2281	    2,365	0.0047	947.7778	arm_news_2017_00633668
13346	Մարտ-հունիս ամիսներին աշխատել է Երևանի քաղաքապետարանի աշխատակազմի տրանսպորտի վարչության պետ։	Y	ամիսներին	2281	    2,365	0.0047	1108.5455	arm_news_2013_00676500
13347	Հայաստանի համար թիվ մեկ խնդիրն աշխատանքի խնդիրն է, Վարչապետ Այսօր տեղի է ունեցել ՀՀ կառավարության հերթական նիստը, որը վարել է ՀՀ վարչապետ Տիգրան Սարգսյանը։	Y	վարել	2281	    2,365	0.0047	379.4211	arm_news_2013_00568221
13348	Այսօր տեղի է ունեցել ՀՀ կառավարության նիստ, որը վարել է ՀՀ վարչապետ Տիգրան Սարգսյանը։	Y	վարել	2281	    2,365	0.0047	483.5833	arm_news_2015_00182581
13349	Տարիներ առաջ մենք միասին մի քանի մեծ ծրագրեր ենք վարել։	Y	վարել	2281	    2,365	0.0047	538.7	arm_news_2015_00946970
13350	Արտաքին քաղաքականության, պաշտպանության եւ ազգային անվտանգության հարցերով կառավարության նիստ կարող է հրավիրել եւ վարել Հանրապետության Նախագահը։	Y	վարել	2281	    2,365	0.0047	652.9333	arm_news_2017_00211903
13351	Տեր-Պետրոսյանը վարել է Կոնգրեսի Հանրապետական խորհրդի և վարչության համատեղ նիստը.	Y	վարել	2281	    2,365	0.0047	846.0909	arm_news_2013_00950033
13352	5) կազմում է համակարգի զարգացման պետական համապատասխան ծրագրեր եւ ապահովում դրանց իրականացումը.	Y	իրականացումը	2282	    2,364	0.0047	561.9091	arm_news_2017_00033071
13353	36) օրենքով սահմանված կարգով մարզի վարչական տարածքում ապահովում և կազմակերպում է քաղաքացիական պաշտպանության միջոցառումների իրականացումը.	Y	իրականացումը	2282	    2,364	0.0047	688.9286	arm_news_2017_00021977
13354	«Նախագծի իրականացումը սկսվել է երեք ամիս առաջ։	Y	իրականացումը	2282	    2,364	0.0047	738.8571	arm_news_2017_00733898
13355	12) կազմակերպում է մարզի սոցիալական աջակցության պետական ծրագրերի իրականացումը.	Y	իրականացումը	2282	    2,364	0.0047	933.75	arm_news_2017_00003035
