ORDER	SENTENCE	STATUS	WORD	RANK	COUNT	COUNT_REL	INDEX	ID
13001	Նարեկ- Ելք չկա Կայքում տեղ գտած մտքերն ու տեսակետները հեղինակի սեփականությունն են և կարող են չհամընկնել BlogNews.	Y	նարեկ	2234	    2,429	0.0049	808.6875	arm_news_2013_00755473
13002	Իսկ ինչ ենք մենք արել/անում Աստծու համար?	Y	աստծու	2235	    2,428	0.0049	368.875	arm_news_2013_00476433
13003	«Մարդու կողմից այդ անհնար է, իսկ Աստծու կողմից՝ ամեն բան հնարավոր».	Y	աստծու	2235	    2,428	0.0049	444.2	arm_news_2015_00679451
13004	Որովհետև Աստված Իր սիրով մարդկանց նման եղավ, ցույց տվեց, որ մարդիկ էլ իրենց սիրով Աստծու նման պիտի լինեն։	Y	աստծու	2235	    2,428	0.0049	543.75	arm_news_2013_00810752
13005	Աստծու սերը շատ ավելի մեծ է, քան մարդկային սերը։	Y	աստծու	2235	    2,428	0.0049	622.5	arm_news_2017_00184845
13006	Բանն Աստծու հետ էր, և Բանն Աստված էր։	Y	աստծու	2235	    2,428	0.0049	798.6667	arm_news_2015_00258652
13007	«Հարցը պետք է քննարկել ոչ միայն կրոնական, այլև քաղաքական ու համայնքային խնդիրների տեսանկյունից»: Հարությունյանը հայտնեց.	Y	համայնքային	2235	    2,428	0.0049	730.5333	arm_news_2015_00612547
13008	Մինչեւ մայրաքաղաքի համայնքային ընտրությունները դեռ բավական ժամանակ կա.	Y	համայնքային	2235	    2,428	0.0049	864.75	arm_news_2013_00712870
13009	2) Հայաստանի Հանրապետության տարածքային կառավարման նախարարության ջրային տնտեսության պետական կոմիտեի «Համայնքային զարգացման ծրագրերի» կառավարման խորհրդի անհատական կազմը շարադրել հետևյալ խմբագրությամբ.	Y	համայնքային	2235	    2,428	0.0049	907.0556	arm_news_2013_00021323
13010	Համայնքի միջոցներով հնարավոր չի համայնքային կենտրոն կառուցել, պետական աջակցություն է հարկավոր։	Y	համայնքային	2235	    2,428	0.0049	907.3636	arm_news_2017_00545432
13011	17) հաստատում է առևտրի, հասարակական սննդի և սպասարկման ոլորտի գործունեության համայնքային կանոնները` օրենքով սահմանված կարգով.	Y	համայնքային	2235	    2,428	0.0049	1031.8571	arm_news_2015_00009159
13012	«Չեմ ուզում այդ մասին խոսել, որպեսզի հետաքրքիր անակնկալ լինի: Միայն ասեմ, որ շատ գեղեցիկ բան է լինելու.	Y	անակնկալ	2236	    2,427	0.0049	329.5882	arm_news_2013_00832026
13013	Մարտի 1-ի գործով կարող է անակնկալ լինել.	Y	անակնկալ	2236	    2,427	0.0049	478.1429	arm_news_2015_00681818
13014	Այս որոշումը, պետք է նկատել, այնքան էլ անակնկալ չէ։	Y	անակնկալ	2236	    2,427	0.0049	542.4444	arm_news_2013_00148036
13015	Այ սա իսկապես անակնկալ էր ինձ համար.	Y	անակնկալ	2236	    2,427	0.0049	687.5714	arm_news_2015_00145131
13016	Հարցին, թե իշխանություններին անակնկալ սպասվում է, նա պատասխանեց.	Y	անակնկալ	2236	    2,427	0.0049	836.875	arm_news_2015_00612796
13017	Մենք անում ու ընդունում ենք այն, ինչ Ռուսաստանն է ասում.	Y	ռուսաստանն	2237	    2,426	0.0049	368.4	arm_news_2015_00690676
13018	Վլադիմիր Պուտինը նշել է, որ Հայաստանի հետ Ռուսաստանն ունի հատուկ հարաբերությունները։	Y	ռուսաստանն	2237	    2,426	0.0049	478.8182	arm_news_2015_00940425
13019	Ռուսաստանն այս ուղղությամբ հաջողության է հասել դեռ 2002թ.	Y	ռուսաստանն	2237	    2,426	0.0049	670.125	arm_news_2015_00879447
13020	Ընթանում է Հայաստանի պուտինիզացիա Ռուսաստանն առևտրային պատերազմ է սկսել ԵՄ-ի դեմ.	Y	ռուսաստանն	2237	    2,426	0.0049	728.5455	arm_news_2013_00407924
13021	«Ռուսաստանն ու Հայաստանն արդար խաղ են տանում».	Y	ռուսաստանն	2237	    2,426	0.0049	1103.4286	arm_news_2017_00865657
13022	Չկա Ադրբեջանի որևէ մի կետ, որը հասանելի չէ հայկական զենքի համար.	Y	զենքի	2238	    2,425	0.0049	583	arm_news_2017_00827143
13023	Դրանց համար փող կար, զենքի համար փող չկա՞ր։	Y	զենքի	2238	    2,425	0.0049	678.2857	arm_news_2017_00304622
13024	Նա նաև նշել է, որ սիրիական ընդդիմությունը զենքի կարիք ունի։	Y	զենքի	2238	    2,425	0.0049	701.2	arm_news_2013_00751502
13025	Եվ հետո, այս պարագայում մենք գործում ենք տնտեսակա՛ն միության դաշտում, իսկ զենքի վաճառքի հարցը ՀԱՊԿ–ի՛ շրջանակներում ավելի ճիշտ կլինի խոսել։	Y	զենքի	2238	    2,425	0.0049	707.9545	arm_news_2015_00374575
13026	Ի՞նչ է ուզում Սերժ Սարգսյանը Վազգեն Սարգսյանն ու Սերժ Սարգսյանը գաղափարի և զենքի ընկերներ են եղել «Ժողովուրդ».	Y	զենքի	2238	    2,425	0.0049	724.9375	arm_news_2017_00431904
13027	Նա նշել է, որ հայկական կողմերը բաց են բանակցային գործընթացի համար։	Y	բանակցային	2239	    2,423	0.0049	544.4545	arm_news_2017_00743015
13028	Ակնհայտ է, որ Ադրբեջանը չի ուզում բանակցային գործընթացի միջոցով լուծել Ղարաբաղի հարցը։	Y	բանակցային	2239	    2,423	0.0049	636.6667	arm_news_2013_00090823
13029	Իրականում բանակցային գործընթացի առումով ոչ մի տարբերություն չկա։	Y	բանակցային	2239	    2,423	0.0049	801.875	arm_news_2015_00497338
13030	Հանդիպման ժամանակ կողմերը քննարկել են ղարաբաղյան բանակցային գործընթացի … Հայկական ժամանակ.	Y	բանակցային	2239	    2,423	0.0049	884.5556	arm_news_2013_00585705
13031	Ղարաբաղյան խնդիրը բանակցային ճանապարհով լուծում չունի«Հրապարակ».	Y	բանակցային	2239	    2,423	0.0049	976.1429	arm_news_2017_00647919
13032	«Գազի գնի հետ կապված այս անգամ փոփոխությունները էական են»,—ասել է նա։	Y	գնի	2240	    2,422	0.0049	549.4167	arm_news_2017_00253595
13033	Հիշեցնենք, որ վարչապետ Տիգրան Սարգսյանն անցած շաբաթ խորհրդարանում հայտարարել էր, թե գազի գնի պայմանագիր չկա։	Y	գնի	2240	    2,422	0.0049	645.0667	arm_news_2013_00623206
13034	Ինչպես կարելի է նկատել, Հայաստանում գազի գնի հարցը շուտով կարող է բուն իշխանության հարց դառնալ երկրում։	Y	գնի	2240	    2,422	0.0049	653	arm_news_2013_00458665
13035	Հայաստանը դեռ համաձայնության չի եկել ռուսական կողմի հետ գազի գնի շուրջ.	Y	գնի	2240	    2,422	0.0049	681.1818	arm_news_2013_00564654
13036	Այո, այո, մեծ հաշվով նավթի գնի խնդիր չկա։	Y	գնի	2240	    2,422	0.0049	925.8571	arm_news_2017_00122613
13037	«Այսպես եմ խոսում, որովհետև, երբ արդեն ժողովուրդը հավաքվել էր ու բան էր պահանջում, այդ ընթացքում է եղել ամեն ինչ, իսկ ես այդտեղ չեմ եղել: Այնտեղ եղել է հիմնականում ընդդիմությունը, ընդդիմությունը կարող է մեծ օգուտ տալ այս գործին»,-ասաց նա։	Y	գործին	2241	    2,421	0.0049	525.0606	arm_news_2017_00139570
13038	Ամեն մարդ պետք է ծառայի իր գործին, իսկ մեզ մոտ դա այդպես չէ։	Y	գործին	2241	    2,421	0.0049	549.1538	arm_news_2015_00106940
13039	Ուրեմն, ինչ է պետք՝ միշտ լինել պատրաստ հայրենիքի պաշտպանության գործին։	Y	գործին	2241	    2,421	0.0049	572	arm_news_2013_00827626
13040	Դե ինչ գրել՝ գրել են, ես իմ գործին էի, գիտեի ինչ եմ անում և ինչու։	Y	գործին	2241	    2,421	0.0049	576.8462	arm_news_2015_00319436
13041	Այս գործին «Ժամանակ»-ն անդրադարձել է նաև նախկինում։	Y	գործին	2241	    2,421	0.0049	619.25	arm_news_2013_00135740
13042	Տիգրան Սարգսյանը մոտ մեկ շաբաթ առաջ լքել է Հայաստանը «Նախկին վարչապետ Տիգրան Սարգսյանը մոտ մեկ շաբաթ առաջ լքել է Հայաստանը։	Y	լքել	2241	    2,421	0.0049	375.8182	arm_news_2013_00951329
13043	Թուրքիան կարող է լքել ԵՄ մաքսային մ..	Y	լքել	2241	    2,421	0.0049	527.5714	arm_news_2015_00440648
13044	Ավելի վաղ ԱՄՆ-ն կոչ էր արել իր քաղաքացիներին լքել այդ երկրի տարածքը։	Y	լքել	2241	    2,421	0.0049	611.6154	arm_news_2013_00203807
13045	Առաջին խումբը Թուրքիայի տարածքը լքել է մայիսի 14-ին։	Y	լքել	2241	    2,421	0.0049	741.75	arm_news_2017_00176876
13046	Քանի երեխա է դպրոցը լքել երկրից դուրս գալու պատճառով.	Y	լքել	2241	    2,421	0.0049	944.5556	arm_news_2015_00979066
13047	Բայց երբևէ չի եղել, որ 7-րդ բանակը մեր կողմից կրակի այն կողմ։	Y	կրակի	2241	    2,421	0.0049	612.9167	arm_news_2013_00232540
13048	Ովքեր խոսում են ՆԱՏՕ-ին Ուկրաինայի անդամակցության մասին, «կրակի հետ են խաղում».	Y	կրակի	2241	    2,421	0.0049	709.2727	arm_news_2015_00814604
13049	Ուղղակի այդ ժամանակ այդպես էր պետք և վերջ: Իսկ հիմա պետք չէ կրակի հետ խաղալ, հո միամիտ չեն?..	Y	կրակի	2241	    2,421	0.0049	713.1765	arm_news_2015_00828437
13050	«Կրակի դեմ պետք է կրակի միջոցով պայքարել».	Y	կրակի	2241	    2,421	0.0049	740.6667	arm_news_2017_00535894
13051	Այնուհետև այն դնում ենք ուժեղ կրակի վրա։	Y	կրակի	2241	    2,421	0.0049	751.7143	arm_news_2017_00118328
13052	Պետք է նշել, որ ի տարբերություն եվրոպական այլ երկրների՝ այստեղ գները շատ ավելի մատչելի են.	Y	մատչելի	2242	    2,419	0.0049	444.8	arm_news_2015_00864612
13053	Գագիկ Ծառուկյանը մի քանի տարի առաջ ավելի թափանցիկ ու մատչելի է եղել, քան` այսօր «Հրապարակ».	Y	մատչելի	2242	    2,419	0.0049	524.2667	arm_news_2017_00251879
13054	Գագիկ Ծառուկյանը մի քանի տարի առաջ ավելի թափանցիկ ու մատչելի է եղել,..	Y	մատչելի	2242	    2,419	0.0049	602.6667	arm_news_2015_00283327
13055	Հայաստանում վարկերն ավելի մատչելի են դարձել / ՀՀ տնտեսական և այլ նորություններ ԿԲ-ի նախագահ. 2014թ.	Y	մատչելի	2242	    2,419	0.0049	616	arm_news_2015_00584704
13056	Իսկ միտքը պետք է պարզ և մատչելի լինի։	Y	մատչելի	2242	    2,419	0.0049	639.5	arm_news_2017_00459537
13057	1. Եթե սա ձեր առաջին այցելությունն է, ծանոթացեք Հաճախ Տրվող Հարցերին (ՀՏՀ): Գրառումներ անելու համար պետք է գրանցվել: Քննարկումներին հետևելու համար ընտրեք բաժինը: Այս դեպքը եղել է այսօր,և ուզում եմ դուք էլ իմանաք.	Y	ծանոթացեք	2243	    2,417	0.0048	923.6333	arm_news_2013_00011093
13058	Բայց ինչո՞ւ չուրախանալ այնպիսի մարդկանցով, ովքեր ոչ միայն գեղեցիկ են բնությունից, այլ նաև փորձում են ինչ-որ բանի հասնել կյանքում: Ծանոթացեք.	Y	ծանոթացեք	2243	    2,417	0.0048	965.5238	arm_news_2017_00222703
13059	1. Եթե սա ձեր առաջին այցելությունն է, ծանոթացեք Հաճախ Տրվող Հարցերին (ՀՏՀ): Գրառումներ անելու համար պետք է գրանցվել: Քննարկումներին հետևելու համար ընտրեք բաժինը: ինչ լավ ես գրել, կարճ ու բովանդակալից։	Y	ծանոթացեք	2243	    2,417	0.0048	968	arm_news_2013_00011520
13060	Երևի բոլորտ էլ տեղյակ եք Էլեկտրոնային Սիգարետներից, եթե ոչ խնդրեմ` ծանոթացեք: Ուզում եմ իմ համար գնեմ, ինչ որ մեկը տեղյակ է Հայաստանում վաճառվում է արդյոք և որտեղ?	Y	ծանոթացեք	2243	    2,417	0.0048	984.32	arm_news_2015_00393868
13061	1. Եթե սա ձեր առաջին այցելությունն է, ծանոթացեք Հաճախ Տրվող Հարցերին (ՀՏՀ): Գրառումներ անելու համար պետք է գրանցվել: Քննարկումներին հետևելու համար ընտրեք բաժինը: Թեմա: Շատ կարևոր.	Y	ծանոթացեք	2243	    2,417	0.0048	984.6087	arm_news_2013_00011514
13062	Անում եմ այն, ինչ ուզում եմ և երբ ուզում եմ, ուզում եմ խոսք եմ տալիս, ուզում եմ հետ եմ վերցնում այն։	Y	վերցնում	2244	    2,414	0.0048	370.5455	arm_news_2015_00192156
13063	Ես երբեք ոչ մի բան չեմ վերցնում.	Y	վերցնում	2244	    2,414	0.0048	407.8571	arm_news_2015_00358693
13064	ՍԵՐԸ երբեք չի վերցնում, այն միայն կարող է տալ.	Y	վերցնում	2244	    2,414	0.0048	512.3333	arm_news_2013_00893567
13065	Հասկանալի է՝ աշխատանքի է վերցնում միայն իր մարդկանց, ընդ որում՝ նրանց ընտրում է որդին։	Y	վերցնում	2244	    2,414	0.0048	661.4167	arm_news_2015_00602605
13066	Դու ես հա՞ քո վրա պատասխանատվություն վերցնում..	Y	վերցնում	2244	    2,414	0.0048	755.4286	arm_news_2013_00312406
13067	Ոչ մի վատ բան չեմ տեսնում այդ համաձայնագրի մեջ։	Y	համաձայնագրի	2245	    2,413	0.0048	370.5556	arm_news_2013_00802205
13068	Կողմերը համաձայնագրի վրա աշխատել են ավելի քան մեկ տարի։	Y	համաձայնագրի	2245	    2,413	0.0048	534.2222	arm_news_2015_00557739
13069	Ուկրաինան համաձայնագրի քաղաքական մասը ստորագրել էր մարտի 21-ին։	Y	համաձայնագրի	2245	    2,413	0.0048	818.5	arm_news_2015_00827412
13070	Համաձայնագրի իրականացման գործնական մասը մեկնարկել է հունվարի 20-ից։	Y	համաձայնագրի	2245	    2,413	0.0048	944	arm_news_2013_00558972
13071	12) տարածքային մակարդակով կազմակերպում է սոցիալական համագործակցության համաձայնագրի ընդունման գործընթացը.	Y	համաձայնագրի	2245	    2,413	0.0048	1158.8889	arm_news_2017_00003340
13072	Բայց ինչո՞ւ է մեզ մոտ՝ Հայաստանում, ամեն ինչ ճիշտ և ճիշտ նույնը։	Y	նույնը	2246	    2,412	0.0048	290.75	arm_news_2017_00222687
13073	Հասարակության համար իրականում ամեն ինչ մնում է նույնը։	Y	նույնը	2246	    2,412	0.0048	483.375	arm_news_2017_00582998
13074	Ռուսաստանն էլ է նույնը ցանկանում, և նա արդեն լուծել է այդ խնդիրը։	Y	նույնը	2246	    2,412	0.0048	596.4545	arm_news_2015_00879518
13075	Ըստ էության, նույնը կատարվում է նաեւ այսօրվա Հայաստանում։	Y	նույնը	2246	    2,412	0.0048	643.5	arm_news_2013_00413189
13076	Նույնը բնորոշ է նաեւ նախորդ օրերի համար։	Y	նույնը	2246	    2,412	0.0048	974	arm_news_2013_00773296
13077	Ավելի վաղ ԼՂՀ ՊԲ-ն հայտնել էր, որ 2015թ.	Y	պբ	2246	    2,412	0.0048	401	arm_news_2017_00190583
13078	Արցախի ՊԲ Ես իմ դեմ էլ եմ պայքարում.	Y	պբ	2246	    2,412	0.0048	500.125	arm_news_2017_00213336
13079	Արցախի ՊԲ 5 սխալ, որոնց պատճառով ձեր տղամարդը կարող է հ..	Y	պբ	2246	    2,412	0.0048	610.4	arm_news_2017_00213276
13080	Այս մասին տեղեկացնում է ԼՂՀ ՊԲ մամուլի ծառայությունը։	Y	պբ	2246	    2,412	0.0048	616.75	arm_news_2017_00136400
13081	Արցախի ՊՆ Անհրաժեշտության դեպքում ՊԲ-ը դիմում է պատասխան գործողությունների.	Y	պբ	2246	    2,412	0.0048	775.8	arm_news_2017_00213741
13082	Ծառայության ընթացքում որտեղ տեղափոխել են, ես երեք երեխաների հետ միշտ նրա կողքին եմ եղել։	Y	տեղափոխել	2246	    2,412	0.0048	356.8571	arm_news_2017_00498228
13083	Խնդրում եմ, եթե այդպիսի բաժին կա, տեղափոխել այնտեղ։	Y	տեղափոխել	2246	    2,412	0.0048	600	arm_news_2015_00519833
13084	Թույլ չի տրվում նաև մարմինը տեղափոխել Հայաստան։	Y	տեղափոխել	2246	    2,412	0.0048	683.2857	arm_news_2015_00438406
13085	«Ես չեմ հավատում, որ շենքը կարելի է տեղափոխել։	Y	տեղափոխել	2246	    2,412	0.0048	717.875	arm_news_2013_00350687
13086	Աշխատանքային կեղծ վիճակը տուն չպետք է տեղափոխել։	Y	տեղափոխել	2246	    2,412	0.0048	868	arm_news_2015_00195626
13087	Ի՞նչ խնդիրներ են առկա քաղաքում, որոնք առաջնային եք համարում։	Y	առաջնային	2247	    2,411	0.0048	432.5	arm_news_2015_00461445
13088	Ուկրաինայի դեսպան -Մեզ համար առաջնային են անվտանգության խնդիրները.	Y	առաջնային	2247	    2,411	0.0048	626.5	arm_news_2013_00818694
13089	Բայց, պետք է առաջնային լինի հենց դիվանագիտական պատասխանը։	Y	առաջնային	2247	    2,411	0.0048	680.25	arm_news_2013_00237416
13090	Տ. Սարգսյան Հայ-վրացական հարաբերությունները Վրաստանի կառավարության համար առաջնային են.	Y	առաջնային	2247	    2,411	0.0048	697.2	arm_news_2013_00956545
13091	«Նրա առողջության պահպանման հարցն ինձ համար, նաեւ մեր աշխատակիցների համար առաջնային է»։	Y	առաջնային	2247	    2,411	0.0048	873.9091	arm_news_2017_00768434
13092	Հիմա` այն մասին, թե ո՞ւր է Սերժ Սարգսյանը եւ ինչո՞ւ չի խոսում։	Y	ւր	2248	    2,409	0.0048	279.2857	arm_news_2017_00605534
13093	Ի՞նչ ենք անում, ո՞ւր ենք գնում։	Y	ւր	2248	    2,409	0.0048	444.8571	arm_news_2013_00449623
13094	ՈՒզում եմ իմանալ՝ նա ո՞ւր է, ի՞նչ եղավ։	Y	ւր	2248	    2,409	0.0048	581.1	arm_news_2017_00809221
13095	«Ո՞Ւր էր Աստված, երբ այս բանն էր կատարվում.	Y	ւր	2248	    2,409	0.0048	711.25	arm_news_2013_00828255
13096	Դիտել ողջ տարբերակը : Ո՞ւր ենք հասել..	Y	ւր	2248	    2,409	0.0048	810.2857	arm_news_2013_00310182
13097	Ընդհանրապես, ո՞վ է ում մեր հանրապետության մեջ հաշվի առնում։	Y	առնում	2249	    2,408	0.0048	397.9	arm_news_2015_00416988
13098	Կան տղամարդիկ, ովքեր ոչ թե իրենք են կին առնում, այլ կանայք են նրանց առնում։	Y	առնում	2249	    2,408	0.0048	514.4167	arm_news_2015_00536214
13099	Մենք այդ ամեն ինչն իհարկե հաշվի առնում ենք»։	Y	առնում	2249	    2,408	0.0048	537.375	arm_news_2017_00677791
13100	Ես հայկական արտադրության բան չեմ առնում, այնպես որ հաջողվել է գնել։	Y	առնում	2249	    2,408	0.0048	644.2727	arm_news_2015_00361653
13101	Այդպիսի տղամարդիկ ոչ մի իրավիճակում կնոջ կարծիքը հաշվի չեն առնում։	Y	առնում	2249	    2,408	0.0048	862	arm_news_2013_00116741
13102	Կարևոր է, ինչպես միշտ, ոչ միայն ու այնքան վայրը, որքան՝ ժամանակը։	Y	վայրը	2249	    2,408	0.0048	393.5455	arm_news_2017_00521620
13103	«Ինչո՞ւ դուք չեք կարող հայտարարություն անել դրա հետ կապված և նշել գոնե վայրը։	Y	վայրը	2249	    2,408	0.0048	501	arm_news_2017_00435366
13104	Ամենից առաջ անհրաժեշտ է ճիշտ կազմակերպել աշխատանքային վայրը։	Y	վայրը	2249	    2,408	0.0048	700.25	arm_news_2015_00106669
13105	Նախնական տվյալներով՝ արդեն ավելի քան 5000 մարդ ցանկություն է հայտնել այցելել այդ յուրօրինակ վայրը։	Y	վայրը	2249	    2,408	0.0048	767.1538	arm_news_2017_00737743
13106	Այդ վայրը թող մնա խաղաղ ու հանգիստ վայր..	Y	վայրը	2249	    2,408	0.0048	914.125	arm_news_2017_00108809
13107	Դա կրկնակի ավելի է, քան նախորդ տարի։	Y	կրկնակի	2250	    2,407	0.0048	429.1429	arm_news_2017_00279744
13108	Ըստ ոչ պաշտոնական տվյալների, այդ թիվը գրեթե կրկնակի է: Այս պահի դրությամբ, ինչպես հաղորդում են..	Y	կրկնակի	2250	    2,407	0.0048	550	arm_news_2013_00415696
13109	Ու մի բան էլ…համոզված եղեք, որ ում ուղղված են ձեր խոսքերը, շատ ավելի մեծ ու կրկնակի ցավ է ապրում…….	Y	կրկնակի	2250	    2,407	0.0048	609.4211	arm_news_2017_00813336
13110	Ցուցանիշը կրկնակի ավելի է, քան մեկ տարի առաջ։	Y	կրկնակի	2250	    2,407	0.0048	641.25	arm_news_2017_00960875
13111	Քաղաքական գործիչը մարդ չէ» «Ձեզ միայն թվում է» շարքից 20 լուսանկարներ, որ պետք է նայել կրկնակի, հետո ևս մեկ անգամ Հատուկ տղամարդկանց համար.	Y	կրկնակի	2250	    2,407	0.0048	667.3333	arm_news_2017_00970529
13112	Իհարկե, կարելի է ընկերների հետ, առանց իրենց չեմ կարծում որ հետաքրքիր կլինի։	Y	ընկերների	2251	    2,406	0.0048	304.6667	arm_news_2015_00451214
13113	Ես նախկինում Հայաստանում չեմ եղել, բայց իմ ընկերների շնորհիվ ճանաչում եմ այն։	Y	ընկերների	2251	    2,406	0.0048	454.1667	arm_news_2013_00348120
13114	Դա երբեք ավելորդ չէ անգամ ընկերների համար»,- նշեց ռուս նախագահը։	Y	ընկերների	2251	    2,406	0.0048	585.4	arm_news_2013_00291980
13115	Բայց ըստ ինձ ավելի հետաքրքիր է ժամանակն անցկացնել ընկերների հետ.	Y	ընկերների	2251	    2,406	0.0048	626.9	arm_news_2013_00233023
13116	Խաղալ լավագույն խաղը ունենք, հետ միասին, ընկերների դպրոց.	Y	ընկերների	2251	    2,406	0.0048	925.75	arm_news_2013_00505710
13117	Դ․ — Իհարկե, իրենց հնարավոր է ինչ-որ համատեքստում դիտել.	Y	համատեքստում	2251	    2,406	0.0048	485.7778	arm_news_2017_00293893
13118	Ընդհանուր իրավիճակի համատեքստում նա նշեց, որ «մենք առայժմ ապրում ենք բավականին բարդ ժամանակահատվածում»։	Y	համատեքստում	2251	    2,406	0.0048	726	arm_news_2013_00401274
13119	«Եվ կան նմանատիպ այլ հարցեր, որոնք ճիշտ կլինի քննարկել ոչ թե ուղղակի օրենսդրական դաշտում, այլ սահմանադրական բարեփոխումների համատեքստում»։	Y	համատեքստում	2251	    2,406	0.0048	743.1176	arm_news_2013_00358223
13120	Այդ համատեքստում պատերազմի արդյունքները, թերևս, պետք է դրական գնահատել։	Y	համատեքստում	2251	    2,406	0.0048	864.1111	arm_news_2013_00111482
