ORDER	SENTENCE	STATUS	WORD	RANK	COUNT	COUNT_REL	INDEX	ID
13700	Այն քննարկման ենթակա չի', բայց ենթակա է խորը ուշադրության..	Y	խորը	2325	    2,302	0.0046	796	arm_news_2015_00143699
13701	Իրականում ՀՀ էներգետիկ համակարգը խորը բարեփոխումների առաջ է կանգնած։	Y	խորը	2325	    2,302	0.0046	950.1111	arm_news_2017_00465056
13702	Պարզապես այն պատճառով, որ Ադրբեջանը հրաժարվում է ընդունել դրանք։	Y	հրաժարվում	2325	    2,302	0.0046	467.2222	arm_news_2013_00849417
13703	Ոչ, ես նրանից չեմ հրաժարվում և սիրում եմ, սակայն ավելի լավ է այդ ամենը անել հեռավորության վրա։	Y	հրաժարվում	2325	    2,302	0.0046	489.4706	arm_news_2017_00793069
13704	Դրա համար, եթե դուք ինձ այդ համատեքստով եք հարց տալիս, ես հրաժարվում եմ պատասխանել։	Y	հրաժարվում	2325	    2,302	0.0046	621.5714	arm_news_2013_00316957
13705	Եթե դրանից էլ ես հրաժարվում, ի՞նչ ես անում ընդհանրապես քաղաքական ասպարեզում»։	Y	հրաժարվում	2325	    2,302	0.0046	623.9091	arm_news_2013_00326206
13706	Իսկ երկրի իշխանությունները «օրինական կերպով» հրաժարվում են խոսել այս մասին։	Y	հրաժարվում	2325	    2,302	0.0046	661	arm_news_2013_00475192
13707	Ըստ էության, այս (և ոչ միայն այս) մասին է նյութը։	Y	նյութը	2325	    2,302	0.0046	431	arm_news_2017_00394001
13708	Ստիպված ենք նյութը ներկայացնել այնպես, ինչպես որ կա։	Y	նյութը	2325	    2,302	0.0046	539.375	arm_news_2013_00912465
13709	Մանրամասն՝ թերթի այսօրվա համարում Այս նյութը դիտել են - 360 անգամ Այս բաժնի այլ նորություններ ››› Ուկրաինայի մշակույթի նախարարը ցանկություն է հայտնել հանդիպել ՀՀ մշակույթի նախարարի հետ.	Y	նյութը	2325	    2,302	0.0046	614.3636	arm_news_2015_00672713
13710	Այս նյութը դիտել են - 132 անգամ Այս բաժնի այլ նորություններ ››› «ՀԺ».	Y	նյութը	2325	    2,302	0.0046	710.7778	arm_news_2013_00147475
13711	Տեղեկացնում ենք, որ նյութը հրապարակվել է Մամուլի խոսնակ նախագծի շրջանակներում: Ողբերգական ավտովթար՝ Լոռու մարզում.	Y	նյութը	2325	    2,302	0.0046	938.2143	arm_news_2013_00946106
13712	Եվ ոչ միայն նրան, այլ նաև նրա ընտանիքի անդամներին.	Y	անդամներին	2326	    2,300	0.0046	377.5556	arm_news_2015_00376301
13713	Սակայն ընտանիքի ոչ բոլոր անդամներին է դուր գալիս իրենց կյանքը։	Y	անդամներին	2326	    2,300	0.0046	495.2	arm_news_2017_00871847
13714	Նշված հարցերը կառավարության անդամներին է ներկայացրել ՀՀ վարչապետ Տիգրան Սարգսյանը (տե՛ս առանձին)։	Y	անդամներին	2326	    2,300	0.0046	619.3846	arm_news_2015_00774637
13715	ԵՄ ԵՄ» անդամներին (տեսանյութ) Կառավարության դիմաց քաղաքացին պահանջում էր 30 մլն.	Y	անդամներին	2326	    2,300	0.0046	686.2222	arm_news_2013_00336831
13716	Իսկ դա ենթադրում է, որ Հայաստանը չի կարող պատերազմ սկսել` առանց նախապես այդ մասին տեղյակ պահելու ՀԱՊԿ անդամներին (պարզ ասած` Ռուսաստանին)։	Y	անդամներին	2326	    2,300	0.0046	823.5714	arm_news_2015_00483985
13717	Բայց այն կարելի է ոչ միայն տեսնել, այլ նաև մտնել։	Y	մտնել	2327	    2,299	0.0046	356.2	arm_news_2017_00219577
13718	Ոչ ոք չի կարող մտնել ու գրել.	Y	մտնել	2327	    2,299	0.0046	478.1429	arm_news_2013_00802768
13719	Ոչ ոք չի խնդրում ձեզ մտնել քաղաքականություն։	Y	մտնել	2327	    2,299	0.0046	647	arm_news_2015_00810938
13720	Ի՞նչ նպատակով նա կարող է մտնել Մաքսային միություն, որի առաջնային հարցերը տնտեսական են, ինչից հետո միայն պատրաստվում է լուծել քաղաքական խնդիրներ։	Y	մտնել	2327	    2,299	0.0046	663.8571	arm_news_2013_00453453
13721	«Ադրբեջանը մտադիր չէ մտնել Եվրասիական տնտեսական միություն»։	Y	մտնել	2327	    2,299	0.0046	1115.4286	arm_news_2017_00071907
13722	Այդ մասին այսօր՝ օգոստոսի 30-ին, հայտարարել է Ուկրաինայի նախագահ Վիկտոր Յանուկովիչը լրագրողների հետ հանդիպման ժամանակ։	Y	վիկտոր	2328	    2,298	0.0046	605.9333	arm_news_2013_00112366
13723	Այս մասին այսօր իր պաշտոնական կայքում հայտարարել է Ուկրաինայի նախագահ Վիկտոր Յանուկովիչը։	Y	վիկտոր	2328	    2,298	0.0046	638.75	arm_news_2013_00143751
13724	Վիկտոր Սողոմոնյանն ասաց, որ դեռեւս այդ հարցը չի քննարկել նրա հետ, քանի որ Ռոբերտ Քոչարյանը Հայաստանում չէ։	Y	վիկտոր	2328	    2,298	0.0046	685.0625	arm_news_2015_00939315
13725	Մուտք գործել այլ-կայքերի միջոցով: Վիկտոր Յանուկովիչը մեզ մոտ չի եղել.	Y	վիկտոր	2328	    2,298	0.0046	809.2727	arm_news_2013_00728657
13726	«Չեմ կարող ասել, թե ինչ է նկատի ունեցել Վիկտոր Դալլաքյանը, թե ինչու է նման բան ասել, միգուցե ինքը կարողանա ավելի՞ ճիշտ պատասխանել և ասել, թե այդ տեսակետն ինչի վրա է հիմնված։	Y	վիկտոր	2328	    2,298	0.0046	824.8	arm_news_2015_00839388
13727	Ցույց տվեք նրան, թե ինչպես պետք է դա անել։	Y	տվեք	2329	    2,297	0.0046	343.1111	arm_news_2013_00961939
13728	Ցույց տվեք, թե նա որտեղ է ապրում,..	Y	տվեք	2329	    2,297	0.0046	460.4286	arm_news_2015_00964892
13729	Այդ հարցը տվեք նրանց, ովքեր այդ քրեական գործը տանում են։	Y	տվեք	2329	    2,297	0.0046	571.5556	arm_news_2015_00119664
13730	ԱԶԱՏՈՒԹՅԱՆ ԿԱՆՈՆ Եթե մարդուն սիրում եք, ապա ազատություն տվեք նրան։	Y	տվեք	2329	    2,297	0.0046	846	arm_news_2013_00083207
13731	Հնարավորություն տվեք կառավարությանը արդյունավետ իրականացնելու պետության խնդիրները.	Y	տվեք	2329	    2,297	0.0046	1170.4286	arm_news_2017_00628227
13732	Այս անգամ այն անցկացվում է 79-րդ անգամ։	Y	անցկացվում	2330	    2,296	0.0046	413.3333	arm_news_2017_00124704
13733	Այն անցկացվում է ոչ միայն Հայաստանում այլև Արցախում։	Y	անցկացվում	2330	    2,296	0.0046	605.75	arm_news_2017_00113352
13734	Ապրիլի 2–ին Հայաստանում անցկացվում են խորհրդարանական ընտրություններ։	Y	անցկացվում	2330	    2,296	0.0046	753.8571	arm_news_2017_00171100
13735	Ընթանում է Հայաստանի պուտինիզացիա Սիրիայում նախագահական ընտրություններ են անցկացվում.	Y	անցկացվում	2330	    2,296	0.0046	941.3333	arm_news_2013_00408080
13736	Այսինքն` ընդդիմությունը չի պահանջում արտահերթ նախագահական ընտրություններ, անցկացվում է արտահերթ խորհրդարանական ընտրություն և փոփոխություն սահմանադրության մեջ։	Y	անցկացվում	2330	    2,296	0.0046	1059.8667	arm_news_2013_00138674
13737	Նույնիսկ ոչ միայն վերջին մի քանի դարում։	Y	դարում	2330	    2,296	0.0046	402.2857	arm_news_2015_00780802
13738	Նա ապրել է մ.թ.ա. 6-րդ դարում։	Y	դարում	2330	    2,296	0.0046	443.25	arm_news_2017_00726876
13739	«Դպրոցը այսօրվա դարում չի կարող տալ ամեն ինչ մասին։	Y	դարում	2330	    2,296	0.0046	571.6667	arm_news_2013_00316009
13740	Բայց 14-րդ դարում ի՞նչ կապ կարող էր այն ունենալ Ադրբեջանի ու ադրբեջանական գորգագործության հետ.	Y	դարում	2330	    2,296	0.0046	583.4	arm_news_2013_00228962
13741	Այն կառուցվել է 20-րդ դարում, սակայն գտնվում է շատ լավ վիճակում։	Y	դարում	2330	    2,296	0.0046	588.7	arm_news_2013_00125166
13742	Ներկա դրությամբ մենք ունենք մի իրավիճակ, երբ ո՛չ քաղաքացիական դաշտի ներկայացուցիչները կարող են խնդիրներ լուծել, ո՛չ քաղաքական դաշտի ներկայացուցիչները..	Y	դաշտի	2331	    2,295	0.0046	619	arm_news_2015_00762018
13743	Եվ ես այսօր ամբողջ օրն եմ ասել, որ սա շատ բացասական է, իհարկե բացասական է։ –Իսկ ովքե՞ր են այսօր քաղաքական դաշտի ֆավորիտները։	Y	դաշտի	2331	    2,295	0.0046	667.7	arm_news_2015_00371979
13744	Ուկրաինան կարող է «մարտի դաշտի» վերածվել ԵՄ-ի և Ռուսաստանի միջև.	Y	դաշտի	2331	    2,295	0.0046	692.0909	arm_news_2015_00827397
13745	«Ժողովուրդ» Հայաստանի քաղաքական դաշտի փոքր կուսակցություններն այս օրերին փորձում են իրենց համար հասկանալ, թե ում հետ կարող են դաշինք կազմել։	Y	դաշտի	2331	    2,295	0.0046	712.7368	arm_news_2017_00417792
13746	Փաստորեն` նա մեն-մենակ է մնացել Հայաստանի հասարակության, քաղաքական դաշտի եւ անգամ սեփական կուսակցության դեմ։	Y	դաշտի	2331	    2,295	0.0046	728.4	arm_news_2015_00968505
13747	Ողջ պատերազմի ընթացքում նա միշտ եղել է առաջին գծում։	Y	գծում	2332	    2,294	0.0046	407.8889	arm_news_2015_00807196
13748	Ինչ տեղի ունեցավ Լեռնային Ղարաբաղի և Ադրբեջանի շփման գծում, պարզապես աննախադեպ էր։	Y	գծում	2332	    2,294	0.0046	723.5	arm_news_2017_00446451
13749	Գագիկ Ծառուկյան (տեսանյութ) Գիշերը շփման գծում իրավիճակը լարված է եղել.	Y	գծում	2332	    2,294	0.0046	1021.3	arm_news_2017_00252599
13750	Գիշերը շփման գծում իրավիճակը լարված է եղել.	Y	գծում	2332	    2,294	0.0046	1158.2857	arm_news_2017_00260964
13751	ԼՂՀ ՊԲ Շփման գծում գիշերը լարված է եղել.	Y	գծում	2332	    2,294	0.0046	1256.125	arm_news_2017_00478698
13752	Հատկապես,վերջին շրջանում նրանց հանգիստ չի տալիս Մանչեսթեր Յունայթեդ-ի ֆուտբոլիստ Հենրիխ Մխիթարյանը.	Y	յունայթեդ	2332	    2,294	0.0046	757.4615	arm_news_2017_00587174
13753	«Կան բոլոր պայմանները՝ արդյունավետ աշխատանք կատարելու համար» «Ռեալ»-«Մանչեսթեր Յունայթեդ».	Y	յունայթեդ	2332	    2,294	0.0046	782.9	arm_news_2015_00534762
13754	Կարդալ շարունակությունը » Շատ էի ցանկանում Մանչեսթեր Յունայթեդ տեղափոխվել.	Y	յունայթեդ	2332	    2,294	0.0046	861.25	arm_news_2013_00531318
13755	Անգլիայի չեմպիոն «Մանչեսթեր Յունայթեդ»-ը հայտնվել է 22-րդ տեղում։	Y	յունայթեդ	2332	    2,294	0.0046	872.7778	arm_news_2013_00168018
13756	Մանչեսթեր Յունայթեդ»-ի հայ կիսապաշտպան Հենրիխ Մխիթարյանի մայրը Life.	Y	յունայթեդ	2332	    2,294	0.0046	1337.4444	arm_news_2017_00658463
13757	Այդ ժամանակ մեզ ոչ ոք չէր ստուգում։	Y	ստուգում	2333	    2,293	0.0046	468.8571	arm_news_2015_00117342
13758	Ամեն օր չենք կարող ստուգում իրականացնել Վարչապետ.	Y	ստուգում	2333	    2,293	0.0046	584.1429	arm_news_2015_00108534
13759	Ամեն օր չենք կարող ստուգում իրականացնել ՌԴ դեսպան.	Y	ստուգում	2333	    2,293	0.0046	650.75	arm_news_2015_00108424
13760	Ամեն օր չենք կարող ստուգում իրականացնել ԱԳՆ.	Y	ստուգում	2333	    2,293	0.0046	713.2857	arm_news_2015_00107942
13761	Ամեն օր չենք կարող ստուգում իրականացնել ԼՂ ՊԲ.	Y	ստուգում	2333	    2,293	0.0046	900.125	arm_news_2015_00108172
13762	Ամեն մեկը հո դա չի կարող անել, ավելի ճիշտ՝ թույլ տալ..	Y	հո	2334	    2,291	0.0046	341.6364	arm_news_2017_00093247
13763	Նրանք հո ազատ մարդիկ են, այդպես չէ՞։	Y	հո	2334	    2,291	0.0046	458.1429	arm_news_2017_00776084
13764	Ու հո մարդկանց համար չե՞ն եղել։	Y	հո	2334	    2,291	0.0046	636.2857	arm_news_2015_00827963
13765	Այսինքն` ովքեր փող են ստանում, նրանք, հո, փողոցում չե՞ն ստանում։	Y	հո	2334	    2,291	0.0046	758	arm_news_2017_00130746
13766	Հո մենակ չե՞նք մասնակցում մասնակցելու համար։	Y	հո	2334	    2,291	0.0046	1252.5714	arm_news_2015_00649170
13767	Մեծ մասամբ ոչ թե ինչի մասին, այլ ինչպես։	Y	մասամբ	2334	    2,291	0.0046	357.625	arm_news_2013_00680622
13768	Դա մեծ մասամբ կապված է Եվրասիական տնտեսական միության հետ։	Y	մասամբ	2334	    2,291	0.0046	509.5556	arm_news_2017_00280540
13769	Մեծ մասամբ ամեն դպրոց մի ուսուցիչ ունի և խորհրդի համար ոչ մեկին դիմել չի կարող։	Y	մասամբ	2334	    2,291	0.0046	563.3333	arm_news_2015_00686449
13770	Ես կարող եմ գոնե մասամբ անել այն, ինչի համար առհասարակ ապրում եմ»։	Y	մասամբ	2334	    2,291	0.0046	584.0909	arm_news_2013_00345278
13771	Նա նաեւ նշել է, որ Երեւանում իշխանության որոշ ներկայացուցիչներ կողմ են ԵՄ-ի հետ տնտեսական որոշակի համաձայնագրի՝ մեծ մասամբ նաեւ այն պատճառով, որ Ռուսաստանի ֆինանսական խնդիրները Հայաստանի տնտեսության վրա իրենց ազդեցությունն են թողել։	Y	մասամբ	2334	    2,291	0.0046	595.9333	arm_news_2017_00742215
13772	«Ակնհայտ է, որ խոշոր բանկերը, նույնիսկ այժմ, սեփական ռեսուրսների հաշվին առավել արդյունավետ են աշխատում փոքր և միջին բիզնեսի հետ, քան փոքր բանկերը։	Y	ռեսուրսների	2334	    2,291	0.0046	649.3	arm_news_2015_00095718
13773	Բայց կոնկրետ համակարգի ստեղծման առումով ֆինանսական ռեսուրսների ներդրում դեռևս այս պահին չեմ կարող ասել, որ ունենք։	Y	ռեսուրսների	2334	    2,291	0.0046	649.875	arm_news_2017_00223437
13774	Այստեղ հարց է ծագում` ի՞նչ ռեսուրսների հաշվին է դա հնարավոր դառնում։	Y	ռեսուրսների	2334	    2,291	0.0046	687.4545	arm_news_2015_00174635
13775	Հայաստանում ԱՄՆ դեսպանատան Տեղեկատվական ռեսուրսների կենտրոնը բաց է Հայաստանի բոլոր քաղաքացիների համար … ՀԱՐՑ.	Y	ռեսուրսների	2334	    2,291	0.0046	727.3846	arm_news_2013_00573079
13776	Եվ դրա հետևանքով ԲՀԿ-ն իր ռեսուրսների մի մասը չի՞ կորցնի։	Y	ռեսուրսների	2334	    2,291	0.0046	741.5455	arm_news_2015_00371346
13777	Ասում է՝ մեկ անգամ խնդրել են, որ գումարը տա, բայց դրանից հետո դեռ ձայն չեն հանում։	Y	հանում	2335	    2,290	0.0046	532.75	arm_news_2015_00214389
13778	Նա ուղղակի անում է այն, ինչ ես եմ անում, ուրիշ ոչինչ չգիտի՝ ոչ խոսում է, ոչ էլ ձայն հանում։	Y	հանում	2335	    2,290	0.0046	549.3125	arm_news_2015_00757947
13779	Կարևոր է, որ այս քաղաքական գործընթացը տարբեր խմբերի չի հանում իրար դեմ.	Y	հանում	2335	    2,290	0.0046	567.1667	arm_news_2013_00538068
13780	Ընդ որում, հիմա էլ այն տնից հանում են, երբ ես տանը չեմ լինում։	Y	հանում	2335	    2,290	0.0046	632.3846	arm_news_2013_00403086
13781	Սա ցույց է տալիս, որ այս Կառավարության հետ սպասելիքներ չկան, և մարդիկ իրենց գումարները դուրս են հանում։	Y	հանում	2335	    2,290	0.0046	640.4118	arm_news_2013_00890761
13782	Ընդհանուր մակերեսը կազմում է 94 ք.մ.։ Ունի անվտանգության համակարգ։	Y	մակերեսը	2336	    2,289	0.0046	501	arm_news_2017_00387485
13783	Այն գտնվում է չորս հարկանի բնակելի շենքի առաջին հարկում, որի ընդհանուր մակերեսը կազմում է 50 քմ։	Y	մակերեսը	2336	    2,289	0.0046	782.9286	arm_news_2015_00132110
13784	Այն գտնվում է չորս հարկանի բնակելի շենքի առաջին հարկում, ընդհանուր մակերեսը կազմում է 74 քմ։	Y	մակերեսը	2336	    2,289	0.0046	833.0769	arm_news_2015_00132109
13785	Ընդհանուր մակերեսը կազմում է 45 քմ, այն տեղակայված է առաջին հարկում։	Y	մակերեսը	2336	    2,289	0.0046	886.1111	arm_news_2013_00401418
13786	Ընդհանուր մակերեսը կազմում է 22 քմ, տեղակայված է առաջին հարկում։	Y	մակերեսը	2336	    2,289	0.0046	994.875	arm_news_2013_00401396
13787	Նրանք շատ փոքր են ու թեթև: Պատասխան.	Y	թեթև	2337	    2,288	0.0046	454.7143	arm_news_2015_00792526
13788	2017-ը տնտեսական առումով ավելի թեթև է լինելու.	Y	թեթև	2337	    2,288	0.0046	465.1429	arm_news_2017_00011280
13789	Թեթև ինչ–որ բաներ կարող էին լինել.	Y	թեթև	2337	    2,288	0.0046	556.1429	arm_news_2017_00400244
13790	Ամեն ին թեթև եմ տանում կամ գոնե աշխատում եմ թեթև տանել։	Y	թեթև	2337	    2,288	0.0046	769.1111	arm_news_2013_00099679
13791	Առհասարակ, ցանկացած իրավիճակի փորձում եմ թեթև կողմից նայել։	Y	թեթև	2337	    2,288	0.0046	1102.375	arm_news_2017_00180568
13792	ՀՀ դրամ շրջանառության հարկ, իսկ մինչ 2013թ.	Y	շրջանառության	2338	    2,286	0.0046	553.8571	arm_news_2013_00626850
13793	Եվ այսպես, շրջանառության մեջ է դրված 2011թ.	Y	շրջանառության	2338	    2,286	0.0046	616.1429	arm_news_2013_00354756
13794	Իսկ ՀԱԿ-ը հրաժարվել է մասնակցել՝ նկատի ունենալով, որ ունեն շրջանառության մեջ դրված օրենքի նախագիծ։	Y	շրջանառության	2338	    2,286	0.0046	760.4667	arm_news_2015_00489283
13795	«Շրջանառության հարկի մասին» օրենքը հոկտեմբերի 1-ից ուժի մեջ է մտել։	Y	շրջանառության	2338	    2,286	0.0046	889.6	arm_news_2015_00805929
13796	Շրջանառության հարկի մասին օրենքը շարունակում է գործել Հոկտեմբերի 1-ին ընդառաջ.	Y	շրջանառության	2338	    2,286	0.0046	942	arm_news_2017_00790678
13797	Ռուսաստանի խորհրդարանի վերին պալատի նախագահը հայտարարել է նաեւ, որ Ռուսաստանի եւ Ադրբեջանի միջեւ համագործակցությունը ռազմավարական բնույթ ունի։	Y	վերին	2339	    2,285	0.0046	799.75	arm_news_2013_00870957
13798	Առանց ԿԲ-ի՝ կառավարության պարտքը կազմում է մոտավորապես 5 մլրդ դոլար կամ Սա նշանակում է, որ կառավարությունը հանգիստ կարող է հայտարարել, թե թույլատրելի վերին շեմից դեռ շատ հեռու ենք։	Y	վերին	2339	    2,285	0.0046	799.8846	arm_news_2017_00173509
13799	Եթե մարդը խախտել է ՕՐԵՆՔԸ, ապա պետք է պատասխան տա նույն ՕՐԵՆՔԻ առաջ:Անկախ այն բանից, թե այդ մարդն ով է, եթե նույնիսկ «վերին արտի ցորեն է», կամ..	Y	վերին	2339	    2,285	0.0046	907.2083	arm_news_2013_00329557
13800	Անցած մեկ տարվա ընթացքում նախագահ Պուտինն ու վարչապետ Էրդողանը տարբեր առիթներով հանդիպել են 4 անգամ, ինչը նշում է հարաբերությունների վերին աստիճանի զարգացած ու ռազմավարական լինելու մասին։	Y	վերին	2339	    2,285	0.0046	913.3333	arm_news_2015_00193927
13801	Հանուն արդարության նշենք, որ նա բոլորին էլ հավատարիմ է եղել ու ծառայել, բայց այնքան ժամանակ, քանի դեռ նրանք եղել են իշխանական բուրգի վերին հատվածում։	Y	վերին	2339	    2,285	0.0046	917.6957	arm_news_2015_00597821
13802	Բայց միայն մեր նկատմամբ չէ այդ ուշադրությունը։	Y	ուշադրությունը	2340	    2,284	0.0046	380.1429	arm_news_2013_00235544
13803	«Ես այս ուշադրությունը կարևոր ու անհրաժեշտ եմ համարում։	Y	ուշադրությունը	2340	    2,284	0.0046	381	arm_news_2013_00340055
13804	Բայց միայն դրանով չէ, որ նա իր վրա է հրավիրել բոլորի ուշադրությունը։	Y	ուշադրությունը	2340	    2,284	0.0046	548.1667	arm_news_2017_00224496
13805	Ամեն կերպ ուզում են երրորդ ուժի ուշադրությունը հրավիրել հայերի վրա։	Y	ուշադրությունը	2340	    2,284	0.0046	654.6	arm_news_2013_00100619
13806	Խորհրդարանական ընտրությունների նկատմամբ միջազգային ուշադրությունը լինելու է աննախադեպ - yerkir.	Y	ուշադրությունը	2340	    2,284	0.0046	945	arm_news_2017_00495401
13807	Ուստի ուզում եմ գեթ մի խորհուրդ տալ քեզ, որը հենց հիմա էլ կարող ես կիրառել քանի դեռ այս պահին i-pad-ով Համացանցում ես։	Y	i	2341	    2,283	0.0046	780.4783	arm_news_2013_00826281
13808	«Ժողովուրդը պետք է հասկանա վերջապես, որ ամեն ինչ իրենից է կախված» i «Ով չի գալիս ընտրության, ուրեմն` նա դժգոհելու իրավունք չունի այլեւս», - հայտարարեց Հայաստանի առաջին նախագահը: Լեւոն Տեր-Պետրոսյան.	Y	i	2341	    2,283	0.0046	926.8214	arm_news_2013_00435798
13809	ՄԱՍ I Այսօր Լեռնային Ղարաբաղի հակամարտության կարգավորմանն ուղղված բանակցություններում շատ կարեւոր եւ մեծ դեր է խաղում ԵԱՀԿ-ն, որի շրջանակներում գործում է Լեռնային Ղարաբաղի հարցով զբաղվող Մինսկի խումբը։	Y	i	2341	    2,283	0.0046	1015.36	arm_news_2015_00673510
13810	I խումբ 2014 թվականի Աշխարհի առաջնության ընտրական փուլ.	Y	i	2341	    2,283	0.0046	1016	arm_news_2013_00056508
13811	«Ինչքան բարեփոխում են, այդքան այս երկիրը կործանվում է»i «Ինչքան բարեփոխում են, այդքան այս երկիրը կործանվում է»,- ասել է Հայաստանի առաջին նախագահ, ՀԱԿ առաջնորդ Լևոն Տեր-Պետրոսյանը՝ պատասխանելով «Ազատության» հարցերին։	Y	i	2341	    2,283	0.0046	1055.6667	arm_news_2015_00475194
13812	Ուրիշ բան որ չլինի՝ ի՞նչ գործ ունի ՀՀ նախագահը մեկ այլ պետության տարածքների հետ։	Y	տարածքների	2341	    2,283	0.0046	460.4	arm_news_2013_00828384
13813	Հայաստանն ի՞նչ կապ ունի այդ տարածքների հետ։	Y	տարածքների	2341	    2,283	0.0046	523.875	arm_news_2015_00582669
