ORDER	SENTENCE	STATUS	WORD	RANK	COUNT	COUNT_REL	INDEX	ID
13467	Նա տեղեկացրեց, որ այս որոշումը շուտ էր ընդունել, բայց դիմել է ընդամենը 10 օր առաջ.	Y	տեղեկացրեց	2295	    2,346	0.0047	383.7143	arm_news_2015_00759966
13468	Այդ մասին երեկ մեզ հետ զրույցում տեղեկացրեց կառավարության աշխատակազմի ղեկավար-նախարար Դավիթ Հարությունյանը։«	Y	տեղեկացրեց	2295	    2,346	0.0047	583.5385	arm_news_2017_00104682
13469	Այս մասին այսօր լրագրողների հետ հանդիպմանը տեղեկացրեց Տեղեկատվական անվտանգության մասնագետ Տիգրան Քոչարյանը։	Y	տեղեկացրեց	2295	    2,346	0.0047	723.3333	arm_news_2017_00134205
13470	Նախարարը տեղեկացրեց, որ առաջիկայում հանդես է գալու օրենսդրական նախաձեռնությամբ, ըստ որի՝ 2014թ.	Y	տեղեկացրեց	2295	    2,346	0.0047	887.3333	arm_news_2013_00744138
13471	Մարտիրոսյանը տեղեկացրեց նաև, որ հայ գիտնականները 2012թ.	Y	տեղեկացրեց	2295	    2,346	0.0047	929.5714	arm_news_2013_00676398
13472	Իսկ ո՞ր աստիճանի վրա եք դուք մնացել։	Y	աստիճանի	2296	    2,343	0.0047	455.25	arm_news_2013_00480877
13473	Սակայն միշտ առկա է դրա աստիճանի հարցը։	Y	աստիճանի	2296	    2,343	0.0047	472	arm_news_2013_00880811
13474	Հիմա կարծես թե անցել ենք հարաբերությունների մի նոր աստիճանի։	Y	աստիճանի	2296	    2,343	0.0047	480.6667	arm_news_2015_00627476
13475	«Այն, որ պարտքը կարող էր ավելի քիչ լինել, ավելի ցածր լինել, դա այլ հարց է, բայց որ այն աստիճանի վրա է գտնվում, որ որևէ մեկը չի ցանկանում ղեկավարել նշված գերատեսչությունը, կարծում եմ` ճիշտ չէ։	Y	աստիճանի	2296	    2,343	0.0047	580.4643	arm_news_2015_00137791
13476	Ես չեմ կարող ասել՝ այդ աստիճանի վատ է։ Իհարկե, այսօր փոփոխություններ կան, իհարկե, պատժամիջոցներ են, իհարկե, բիզնեսի վրա ազդում է, բայց այդ աստիճանի վատ՝ նման բան չկա։	Y	աստիճանի	2296	    2,343	0.0047	582.619	arm_news_2015_00365233
13477	Ու նորից վերադառնում եմ, թե բան եմ գրում..	Y	վերադառնում	2297	    2,342	0.0047	471.1429	arm_news_2017_00814534
13478	Մի կես ժամ հետո վերադառնում է` արդեն Ռոբերտ Քոչարյանի հետ։	Y	վերադառնում	2297	    2,342	0.0047	523.3	arm_news_2013_00708735
13479	Սակայն կրկին վերադառնում ենք նույն Google Analytics-ին։	Y	վերադառնում	2297	    2,342	0.0047	651.875	arm_news_2013_00879755
13480	Երբ վերադառնում եք հայրենիք, ի՞նչ եք մտածում։	Y	վերադառնում	2297	    2,342	0.0047	773.2857	arm_news_2013_00372399
13481	Գագիկ Ծառուկյան (ամբողջական տեսանյութ) Գագիկ Ծառուկյանը վերադառնում է քաղաքականություն.	Y	վերադառնում	2297	    2,342	0.0047	961.625	arm_news_2017_00251604
13482	Ո՞վ է իմ հետ խոսել, որ անկախ կարծիք կազմի։	Y	կազմի	2298	    2,341	0.0047	513.2	arm_news_2017_00797829
13483	Սպասվում է ՀՅԴ ղեկավար կազմի հանդիպումը Սերժ Սարգսյանի հետ.	Y	կազմի	2298	    2,341	0.0047	605.7778	arm_news_2013_00908760
13484	«Ծանոթ եմ նրանց կազմի հետ, որը մեզ փորձ ունի։	Y	կազմի	2298	    2,341	0.0047	619.4444	arm_news_2015_00525760
13485	«Առավոտ» Սպասվում է ՀՅԴ ղեկավար կազմի հանդիպումը Ս. Սարգսյանի հետ.	Y	կազմի	2298	    2,341	0.0047	671.4	arm_news_2013_00192890
13486	Միայն ասաց, թե ԵԽԽՎ հայկական պատվիրակության կազմի փոփոխություն դեռեւս տեղի չի ունեցել.	Y	կազմի	2298	    2,341	0.0047	902.6667	arm_news_2013_00702882
13487	Նա նույնիսկ ասել է, որ «ոչ գիտեմ՝ դուրս եմ եկել ՀՀԿ-ից, ոչ գիտեմ՝ ներս եմ մտել»։	Y	ներս	2299	    2,338	0.0047	474.5	arm_news_2017_00743483
13488	Ներս ջան, եթե սխալ ես համարում, ինչի՞ ես շարունակում։	Y	ներս	2299	    2,338	0.0047	623	arm_news_2017_00750440
13489	Երբ նա գնում է ներս, հայտնվում է փակ աշխարհում։	Y	ներս	2299	    2,338	0.0047	747.375	arm_news_2017_00354805
13490	Նրանք զինված էին եւ գրեթե ոչ ոքի ներս չէին թողնում։	Y	ներս	2299	    2,338	0.0047	803.1	arm_news_2015_00790513
13491	Լրագրողներին ու մարդկանց դեռ ներս չեն թողել։	Y	ներս	2299	    2,338	0.0047	883.2857	arm_news_2015_00514886
13492	Նախորդ բանակցությունները, որ տեղի էին ունեցել 2012թ.	Y	բանակցությունները	2300	    2,337	0.0047	439.2857	arm_news_2013_00746607
13493	Այդ շրջանում էր հենց, որ Մոսկվայում ընթանում էին Ռուս-թուրքական պայմանագրի բանակցությունները։	Y	բանակցությունները	2300	    2,337	0.0047	561.1667	arm_news_2017_00106090
13494	Այս հարցի շուրջ բանակցությունները սկսվել են 2010թ.	Y	բանակցությունները	2300	    2,337	0.0047	627.1429	arm_news_2013_00142931
13495	ԶԼՄ Մոսկվայում բանակցությունները կարող են սկսվել հունվարի 22-ին.	Y	բանակցությունները	2300	    2,337	0.0047	754.75	arm_news_2015_00406277
13496	«Գազի գնի շուրջ բանակցությունները մոտենում են ավարտին».	Y	բանակցությունները	2300	    2,337	0.0047	1291.2857	arm_news_2013_00266789
13497	Հասկանում ե՞ք մարդիկ, հայեր,թե դա ի՞նչ է նշանակում..	Y	հայեր	2300	    2,337	0.0047	382.9091	arm_news_2013_00592273
13498	Բայց հայերի մեջ էլ կան տարբեր հայեր։	Y	հայեր	2300	    2,337	0.0047	483.8571	arm_news_2015_00251594
13499	Հայեր, ովքեր հայտնի են ողջ աշխարհում (լուսանկարներ.	Y	հայեր	2300	    2,337	0.0047	544.2857	arm_news_2017_00565343
13500	Չկան հայեր, հետևաբար` չկա նաև Հայկական հարց.	Y	հայեր	2300	    2,337	0.0047	799.7143	arm_news_2013_00837274
13501	Հայաստանի Սփյուռքի նախարարության տվյալներով՝ հակամարտության զոհ են դարձել 90 հայեր։	Y	հայեր	2300	    2,337	0.0047	916.4444	arm_news_2013_00571461
13502	Աշխարհը, մենք ու մեր աշխարհը Արմեն ՀԱԿՈԲՅԱՆ.	Y	հակոբյան	2301	    2,335	0.0047	622.3333	arm_news_2017_00166172
13503	Ռ.Հակոբյան (տեսանյութ) Ո՞վ կդառնա աշխարհի չեմպիոն ըստ հայերի.	Y	հակոբյան	2301	    2,335	0.0047	783.7	arm_news_2013_00866525
13504	Ծանր տնտեսական տարի է սպասվում Հակոբ Հակոբյան.	Y	հակոբյան	2301	    2,335	0.0047	826.5714	arm_news_2015_00526041
13505	Ռուբեն Հակոբյան Մենք որևէ բանից չենք վախենում.	Y	հակոբյան	2301	    2,335	0.0047	1050.7143	arm_news_2017_00862579
13506	Ռ.Հակոբյան Ընտրության ճանապարհը ժողովրդի դեմ փակել են.	Y	հակոբյան	2301	    2,335	0.0047	1118.375	arm_news_2013_00866509
13507	Սակայն, ո՞վ ասաց, որ նրանցից կազմված մեր կյանքը հնարավոր չէր ավելի գեղեցիկ փաթեթավորել..	Y	կազմված	2302	    2,334	0.0047	694.4286	arm_news_2013_00881591
13508	Սիրո գաղտնի բանաձեւը կազմված է ոչ թե նրա վրա, թե ինչ ստանալ, այլ, թե ինչ կարող եք տալ։	Y	կազմված	2302	    2,334	0.0047	696.7333	arm_news_2017_00896490
13509	Ինչպես ցանկացած մաթեմատիկական խնդիր, սա` նույնպես, եթե հարցը ճիշտ չի կազմված, անլուծելի է։ Նույն այս խնդրի ճիշտ հարցը կլինի.«	Y	կազմված	2302	    2,334	0.0047	786.8235	arm_news_2013_00462535
13510	Անընդունելի է այն, որ որոշ հարցեր կարող են ճիշտ պատասխան չպարունակել կամ ընդհանրապես սխալ կազմված լինել։	Y	կազմված	2302	    2,334	0.0047	797.75	arm_news_2015_00186749
13511	«Քանի որ մինչև այսօր կազմված դաշինքները խիստ արհեստական են եղել և մեկ խնդիր են լուծել.	Y	կազմված	2302	    2,334	0.0047	803.1429	arm_news_2015_00980069
13512	Ես այսօր ձեզ մանրամասներ հայտնել չեմ կարող։	Y	մանրամասներ	2302	    2,334	0.0047	410	arm_news_2017_00324102
13513	Մանրամասներ Քիչ առաջ արտակարգ դեպք է տեղի ունեցել Երևանում։	Y	մանրամասներ	2302	    2,334	0.0047	614.5556	arm_news_2017_00659465
13514	Ես մանրամասներ չեմ կարող ասել, որովհետև ինքս տեղյակ չեմ եղել՝ իրենք ինչ նպատակ ունեն։	Y	մանրամասներ	2302	    2,334	0.0047	641.1538	arm_news_2013_00347261
13515	Կողմերը քննարկել են ՀՀ կառավարության և Համաշխարհային բանկի միջև համագործակցության ընթացիկ մանրամասներ։	Y	մանրամասներ	2302	    2,334	0.0047	712.6667	arm_news_2015_00557890
13516	Այս առնչությամբ Գյումրու մեր աղբյուրը հետաքրքիր մանրամասներ է փոխանցում։	Y	մանրամասներ	2302	    2,334	0.0047	1127.7778	arm_news_2013_00134478
13517	«Այժմ մենք նրանց աջակցում ենք ամեն ինչ ճիշտ անելու համար։	Y	աջակցում	2303	    2,333	0.0047	377.1	arm_news_2015_00127729
13518	Շատ շնորհակալ եմ բոլոր նրանց, ովքեր աջակցում էին ինձ։	Y	աջակցում	2303	    2,333	0.0047	529.7778	arm_news_2017_00782948
13519	Չէ՞ որ նա բազմիցս հայտարարել է, որ պատասխանատվություն է կրում կառավարության կողմից իրականացվող բարեփոխումների համար և աջակցում է դրանց։	Y	աջակցում	2303	    2,333	0.0047	710.625	arm_news_2015_00842036
13520	Մեզ աջակցում է նաեւ Հայ Առաքելական եկեղեցին։	Y	աջակցում	2303	    2,333	0.0047	782.1429	arm_news_2013_00677747
13521	VIDEO Գագիկ Ծառուկյան հիմնադրամը աջակցում է արվեստի զարգացմանը.	Y	աջակցում	2303	    2,333	0.0047	1274.5	arm_news_2015_00080606
13522	Գարեգին Բ - Չէ, դա երբ անցնում ես դու-ի, դա ավելի..	Y	գարեգին	2303	    2,333	0.0047	448.1	arm_news_2017_00256231
13523	Դեռ Գարեգին Նժդեհն է ասել, որ միայն լավ մարդը կարող է հայ լինել, այսինքն՝ չի կարելի լավ հայ ու վատ մարդ լինել։	Y	գարեգին	2303	    2,333	0.0047	489.9444	arm_news_2015_00322427
13524	Ծանր տնտեսական տարի է սպասվում Գարեգին Բ-ն «Ս.	Y	գարեգին	2303	    2,333	0.0047	541.2222	arm_news_2015_00526006
13525	«Չգիտեմ՝ արդար է, թե ոչ, ես չեմ որոշում»: Հիշեցնենք, որ Գարեգին Նուշիկյանը դեռևս մեկ ամիս առաջ հայտնել էր..	Y	գարեգին	2303	    2,333	0.0047	671.2778	arm_news_2017_00821166
13526	Իսկ այն հարիցն է, թե սա Գագիկ Ծառուկյանի 7-րդ եկեղեցին է, շատ չէ՞ արդյոք, Գարեգին Բ-ն նկատեց, որ եկեղեցին երբեք շատ չի լինում։	Y	գարեգին	2303	    2,333	0.0047	707.0952	arm_news_2017_00452513
13527	Կարծում եմ՝ հայ քաղաքական մտքի համար նույնպես։	Y	մտքի	2303	    2,333	0.0047	423.1429	arm_news_2017_00518361
13528	Ասենք համաձայն ենք էս մտքի հետ, թե չէ?	Y	մտքի	2303	    2,333	0.0047	514	arm_news_2013_00196083
13529	Այս մտքի հետ անգամ ԱԺ նախագահն է համաձայն։	Y	մտքի	2303	    2,333	0.0047	561.5	arm_news_2015_00164452
13530	Ասում են, թե մեր մտքի ստեղծագործական արդյունքների նկատմամբ մենք ունենք հեղինակային իրավունք։	Y	մտքի	2303	    2,333	0.0047	755.9167	arm_news_2013_00197159
13531	Մարդը պետք է ունենա մտքի, խոսքի ազատություն։	Y	մտքի	2303	    2,333	0.0047	986.8571	arm_news_2017_00663756
13532	«Չեմ կարող հայտնել նրանց անունները, սակայն դրանք հայտնի են։	Y	անունները	2304	    2,332	0.0047	346.5556	arm_news_2015_00839483
13533	Անունները չեմ ցանկանում նշել, կարծում եմ՝ դեռեւս ճիշտ չի լինի։	Y	անունները	2304	    2,332	0.0047	518.3	arm_news_2017_00161250
13534	Երկու երեխա՝ տղա և աղջիկ, անունները որոշել եմ, բայց հիմա չեմ ուզում ասել։	Y	անունները	2304	    2,332	0.0047	603.3077	arm_news_2017_00363842
13535	Ընթանում է Հայաստանի պուտինիզացիա Հայտնի են դարձել արևմտյան «սև ցուցակում» ընդգրկված ՌԴ-ի քաղաքացիների անունները.	Y	անունները	2304	    2,332	0.0047	805.6667	arm_news_2013_00406519
13536	Խաչատրյանի անվան մրցույթի 2-րդ փուլ անցած մասնակիցների անունները հա..	Y	անունները	2304	    2,332	0.0047	1176.1111	arm_news_2017_00487975
13537	Այդ մասին հայտնի դարձավ NEWS.am Sport-ին։	Y	sport	2305	    2,330	0.0047	506	arm_news_2013_00112861
13538	«Կարևոր չէ, թե ինչպես ես հեռացել, կարևոր է, թե ով ես եղել»: sport.	Y	sport	2305	    2,330	0.0047	554.8	arm_news_2017_00522036
13539	Նախարարությունը քննարկել է այդ հարցը և որոշել, որ sport.	Y	sport	2305	    2,330	0.0047	571.8889	arm_news_2015_00748719
13540	Ես չեմ ցանկանում ձեզ՝ NEWS.am Sport-ին, մասնավորապես, քեզ հետ զրուցել որեւէ հարցի շուրջ կամ մեկնաբանություն տալ։	Y	sport	2305	    2,330	0.0047	625.6667	arm_news_2013_00350969
13541	Հիմնական կազմում տեղ գտնելու համար պետք է միշտ աշխատել - Sport.	Y	sport	2305	    2,330	0.0047	667.6	arm_news_2017_00608341
13542	Ինչպես արդեն տեղեկացրելէինք, ավելացված երկու տեղը նախատեսված են ՀՀ վարչապետ Տիգրան Սարգսյանի և Երևանի քաղաքապետ Գագիկ Բեգլարյանի համար։	Y	ավելացված	2305	    2,330	0.0047	824.3889	arm_news_2013_00457013
13543	Նախկին վարչապետն այս կարծիքը մեկնաբանել է, որ խնդիրը ոչ թե ռուսական գազի գնի մեջ է, այլ Հայաստանում դրա վրա կիրառվող ավելացված արժեքի հարկի.	Y	ավելացված	2305	    2,330	0.0047	949.3636	arm_news_2013_00745911
13544	« Ավելացված արժեքի հարկի մասին օրենքի 27 հոդվածի հետ կապված Էլեկտրոնային առևտրի հետ կապված » Աշխատավարձ, կադրեր, Հարց ու պատասխան Բարև Ձեզ: Խնդրում եմ ինձ օգնել հետևյալ հարցում.	Y	ավելացված	2305	    2,330	0.0047	986.1739	arm_news_2013_00200957
13545	Այն գտնվում է հինգ հարկանի շենքի վերջին և ավելացված հարկերում։	Y	ավելացված	2305	    2,330	0.0047	988.9	arm_news_2013_00123170
13546	«Մոտ մի քանի դոլար՝ միայն ավելացված արժեքի հարկի մասով իջնում է ինչ-որ մի բան: Սա պետք է լուրջ ուսումնասիրվի», - ասաց ԲՀԿ պատգամավորը: Հաշվել է պետք, վստահ է ԱԺ Տնտեսական հարցերի մշտական հանձնաժողովի նախագահ, հանրապետական Վարդան Այվազյանը։	Y	ավելացված	2305	    2,330	0.0047	992.0625	arm_news_2017_00718771
13547	«Շատ բան կարող է տեղի ունենալ ձեր բացակայության ժամանակ։	Y	բացակայության	2305	    2,330	0.0047	349.3333	arm_news_2015_00796436
13548	Ի՞նչ էր կատարվում, ի՞նչ էր փոխվել իմ բացակայության ընթացքում։	Y	բացակայության	2305	    2,330	0.0047	569.375	arm_news_2017_00432224
13549	Կարծում եմ, դա ճիշտ կլիներ Հայաստան պետության բացակայության պայմաններում։	Y	բացակայության	2305	    2,330	0.0047	578.6667	arm_news_2013_00534422
13550	Իմ բացակայության օրերի քանակը եթե չի համապատասխանում, ապա ես ցուցակում չեմ լինի։	Y	բացակայության	2305	    2,330	0.0047	770.5	arm_news_2017_00424253
13551	Ասել է թե՝ ՀՀԿ ղեկավարը գտել է բացակայության հարցը լուծելու տարբերակը։	Y	բացակայության	2305	    2,330	0.0047	864.6	arm_news_2017_00182293
13552	«Դա շոու չէ,–ասաց նա,–որովհետեւ ընտրություններ կան, թե՝ ոչ, ամեն օր լույս եւ գազ օգտագործում ենք։	Y	գազ	2306	    2,329	0.0047	619.8235	arm_news_2017_00282156
13553	Հայաստանում դրա համար պահանջվել է ավելի շատ գազ ու ժամանակ։	Y	գազ	2306	    2,329	0.0047	681.6	arm_news_2013_00573561
13554	Հայաստանի բնակչությունը տեղյակ չէր, որ իր երկիր ավելի թանկ գազ է գալիս։	Y	գազ	2306	    2,329	0.0047	762.75	arm_news_2015_00577719
13555	Միայն դրանից հետո հնարավոր կլինի հասկանալ, թե ինչո՞ւ Մոսկվան մեզ ավելի էժան գնով գազ չի առաջարկում.	Y	գազ	2306	    2,329	0.0047	771.2941	arm_news_2013_00703056
13556	«Թուրքիան ռուսական գազի գլխավոր գնորդն է, սակայն, եթե անհրաժեշտ լինի, նա կարող է դա (գազ) ստանալ շատ այլ տեղերից։	Y	գազ	2306	    2,329	0.0047	774.1111	arm_news_2017_00410413
13557	«Խնդիրն այն չէ, թե ռուս-թուրքական հարաբերություններում ով է ճիշտ, իսկ ով՝ սխալ, «Ժողովուրդ».	Y	հարաբերություններում	2307	    2,327	0.0047	480.3846	arm_news_2017_00490449
13558	Հարմար է նրանց, ում դրանք չեն հետաքրքրում, բայց դրա փոխարեն օգնում է այլ մարդկանց հետ հարաբերություններում։	Y	հարաբերություններում	2307	    2,327	0.0047	582.0667	arm_news_2017_00590132
13559	Մարդը պետք է մշտապես կայուն լինի իր հարաբերություններում։	Y	հարաբերություններում	2307	    2,327	0.0047	696.75	arm_news_2015_00677256
13560	Այսօրվա իրավիճակում Ադրբեջանի հետ հարաբերություններում որեւէ խնդիր չունենք»,-հայտարարել է նա։	Y	հարաբերություններում	2307	    2,327	0.0047	736.9091	arm_news_2015_00182176
13561	Փաստորեն, թուրք-ադրբեջանական հարաբերություններում ոչինչ չի փոխվել։	Y	հարաբերություններում	2307	    2,327	0.0047	930	arm_news_2013_00965059
13562	«Հայտնի է, որ գազի գինը չի փոխվել ո՛չ սահմանի վրա, ո՛չ էլ ներքին շուկայում։	Y	սահմանի	2307	    2,327	0.0047	525.5	arm_news_2015_00593221
13563	Նա նախ նշել է, որ սահմանի վրա այն դառնալու էր 270 դոլար, իսկ հետո ավելացրել.	Y	սահմանի	2307	    2,327	0.0047	598.7857	arm_news_2015_00755568
13564	Ես առիթ ունեցել եմ թե պատերազմի ժամանակ, թե պատերազմից հետո նաև որպես լրագրող լինել սահմանի վրա և համոզվել դրանում, այնպես որ որևէ մեկը չի ասել և չի էլ կարող ասել, որ բացառվում է։ Մենք պետք է պատրաստ լինենք ու իմ կարծիքով էլ մենք պատրաստ ենք։	Y	սահմանի	2307	    2,327	0.0047	644.5	arm_news_2013_00340618
13565	Բայց հարց է, թե պետությունը, որն իրեն անկախ է հայտարարում, կախված է հայ-թուրքական սահմանի՞ց։	Y	սահմանի	2307	    2,327	0.0047	649.5	arm_news_2013_00234623
13566	Վաղը մեր ԱԺ–ն կարող ա սահմանի, թե իրական հայ են նրանք, ովքեր օրը հինգ անգամ երկրպագում են գործող կառավարությանը։	Y	սահմանի	2307	    2,327	0.0047	650.4211	arm_news_2013_00917616
13567	Իր ծրագրի երկրորդ հոդվածով ասում էր՝ ո՛չ, չի կարող։	Y	հոդվածով	2308	    2,324	0.0047	362.5	arm_news_2017_00469066
13568	Մեր հիմնական օրենքի 2–րդ հոդվածով սահմանված է. «ՀՀ–ում իշխանությունը պատկանում է ժողովրդին։	Y	հոդվածով	2308	    2,324	0.0047	522.6667	arm_news_2013_00697458
13569	Բացի այդ, հատուկ միջոցներ կարող են օգտագործվել սույն օրենքի 22-րդ հոդվածով նախատեսված դեպքերում։	Y	հոդվածով	2308	    2,324	0.0047	661.6154	arm_news_2017_00236073
13570	«դ) ի հայտ են եկել «Բանկերի և բանկային գործունեության մասին» Հայաստանի Հանրապետության օրենքի 22-րդ հոդվածով սահմանված դեպքերը:».	Y	հոդվածով	2308	    2,324	0.0047	698.5294	arm_news_2013_00307852
13571	Զինված ուժերի գլխավոր շտաբի լիազորությունները սահմանված են «Պաշտպանության մասին» ՀՀ օրենքի 14-րդ հոդվածով» և այլն։	Y	հոդվածով	2308	    2,324	0.0047	726.7333	arm_news_2015_00405952
13572	Շատ մարդիկ կան, ովքեր այստեղ են եղել հենց առաջին հանդիպումից։	Y	հանդիպումից	2309	    2,323	0.0047	333.2	arm_news_2017_00782749
13573	Չնայած նույնիսկ այս հանդիպումից հետո ես չէի ցանկանում մտածել այն մասին, որ մեր միջեւ կարող են այլ հարաբերություններ սկսվել։	Y	հանդիպումից	2309	    2,323	0.0047	514	arm_news_2017_00828712
13574	Հանդիպումից հետո Սերժ Սարգսյանը, «Ազատության» հարցին ի պատասխան, «նորմալ» է գնահատել կայացած հանդիպումը։	Y	հանդիպումից	2309	    2,323	0.0047	669.3846	arm_news_2015_00596637
13575	«Հրապարակ» Նոր մանրամասներ են ի հայտ գալիս Րաֆֆի Հովհաննիսյան-Գագիկ Ծառուկյան հանդիպումից։	Y	հանդիպումից	2309	    2,323	0.0047	920.5833	arm_news_2013_00647166
13576	Նոր մանրամասներ Րաֆֆի Հովհաննիսյան-Գագիկ Ծառուկյան հանդիպումից.	Y	հանդիպումից	2309	    2,323	0.0047	1295	arm_news_2013_00771158
13577	Ու դեռ հարց է, թե ով է «ողջ» մնալու, իսկ ով՝ ոչ։	Y	մնալու	2309	    2,323	0.0047	327.9	arm_news_2015_00823987
13578	«Մենք դեռևս մնալու ենք այստեղ»,- հայտարարել է նա։	Y	մնալու	2309	    2,323	0.0047	436.125	arm_news_2015_00691978
13579	«Ես չեմ ուզում մտածել դուրս մնալու մասին։	Y	մնալու	2309	    2,323	0.0047	587.1429	arm_news_2017_00332904
13580	Հատկապես երբ առաջիկայում ունենք ընտրություններ, և նրանցից ամեն մեկը լուծելու է ապագա իշխանության մեջ լինելու կամ մնալու իր հարցը։	Y	մնալու	2309	    2,323	0.0047	670.6316	arm_news_2017_00586872
13581	Նախագահի պաշտոնում մնալու համար Սերժ Սարգսյանը բավական վտանգավոր ճանապարհ է ընտրել.	Y	մնալու	2309	    2,323	0.0047	820.6364	arm_news_2015_00745390
13582	Իսկ ինչո՞ւ է Սերժ Սարգսյանը մոտավորապես նույն վիճակում հայտնվել։	Y	մոտավորապես	2309	    2,323	0.0047	465.6	arm_news_2013_00476762
