ORDER	SENTENCE	STATUS	WORD	RANK	COUNT	COUNT_REL	INDEX	ID
21306	Sedangkan kelompok ketiga adalah belanja pegawai, yang dibayarkan untuk gaji, tunjangan serta lain-lain belanja pegawai.	Y	dibayarkan	3095	    1,263	0.0026	747.3077	ind_news_2016_00788563
21307	Sisanya dibayarkan jika barang sudah saya terima.	Y	dibayarkan	3095	    1,263	0.0026	911	ind_news_2011_00214482
21308	Nanti, insentif dibayarkan (diganti) oleh pemerintah kemudian.	Y	dibayarkan	3095	    1,263	0.0026	1262.1429	ind_news_2011_00374726
21309	Tidak akan memengaruhi tim karena kita masih memiliki pemain lain.	Y	memengaruhi	3095	    1,263	0.0026	358.9	ind_news_2012_00971753
21310	Kunjungan mereka tak akan memengaruhi keputusan hukum.	Y	memengaruhi	3095	    1,263	0.0026	666.1429	ind_news_2016_00470623
21311	Meski begitu, dengan kenaikan cukai rokok hingga 35 persen diperkirakan akan memengaruhi penjualan.	Y	memengaruhi	3095	    1,263	0.0026	813.5833	ind_news_2011_00672932
21312	“Isu itu sangat memengaruhi nilai rupiah di pasaran.	Y	memengaruhi	3095	    1,263	0.0026	989	ind_news_2011_00033996
21313	Beliau tidak ikut campur dan beliau tidak ikut memengaruhi.	Y	memengaruhi	3095	    1,263	0.0026	1419.5	ind_news_2016_00083756
21314	Namun ternyata lokasi tersebut tidak ditempati dan saat ini sudah digunakan oleh warga sekitar yang belum memiliki tempat tinggal.	Y	ditempati	3096	    1,262	0.0026	269.9474	ind_news_2016_00598166
21315	Posisi kedua ditempati oleh tim Indonesia dan Taiwan berada di posisi ketiga.	Y	ditempati	3096	    1,262	0.0026	597.8182	ind_news_2012_00046575
21316	“Kebetulan rumah ini rumah baru saya ditempati dua minggu.	Y	ditempati	3096	    1,262	0.0026	710.875	ind_news_2016_00411552
21317	Lahan yang sekarang ditempati sekolah tersebut ialah lahan milik Brimob dan perusahaan swasta.	Y	ditempati	3096	    1,262	0.0026	847.9167	ind_news_2016_00472688
21318	Sementara, jumlah terbanyak kedua ditempati oleh pekerja seks komersial atau PSK sebanyak 100 orang penderita.	Y	ditempati	3096	    1,262	0.0026	1207.8571	ind_news_2012_00122510
21319	Tidak ada orang yang tahu duel di tengah malam itu.	Y	duel	3096	    1,262	0.0026	393.8	ind_news_2011_00355944
21320	Satu-satunya kemenangan Inggris dalam duel penalti saat bertemu Spanyol di Piala Eropa 1996.	Y	duel	3096	    1,262	0.0026	722.6154	ind_news_2012_00080380
21321	Dalam duel ini, persaingan akan terjadi di dalam sektor sayap.	Y	duel	3096	    1,262	0.0026	847.6667	ind_news_2016_00121987
21322	“Duel” di Parlemen pun sepertinya bakal masih panjang.	Y	duel	3096	    1,262	0.0026	961.125	ind_news_2011_00033407
21323	Sejak awal duel final Liga Champion ini berlangsung seru.	Y	duel	3096	    1,262	0.0026	1249.8889	ind_news_2011_00323719
21324	Menurut Presiden, ia banyak menerima laporan tentang pejabat yang sering tidak berada di daerahnya untuk waktu yang lama.	Y	daerahnya	3097	    1,261	0.0026	334.7647	ind_news_2012_00228120
21325	Jika memang pemerintah mau benar-benar membangun daerahnya.	Y	daerahnya	3097	    1,261	0.0026	619.5714	ind_news_2011_00036796
21326	“Sangat jarang ada anak pejabat yang peduli terhadap daerahnya.	Y	daerahnya	3097	    1,261	0.0026	755	ind_news_2011_00478917
21327	Apalagi tidak sepenuhnya daerah 3T mampu menyediakan sarana pendidikan di daerahnya, itu sebabnya pemerintah wajib turun tangan.	Y	daerahnya	3097	    1,261	0.0026	898.4118	ind_news_2012_00168899
21328	Saya selalu memegang prinsip, seorang pemimpin layaknya seorang pejuang, punya komitmen memperjuangkan kepentingan rakyat dan daerahnya.	Y	daerahnya	3097	    1,261	0.0026	1301.8667	ind_news_2011_00871574
21329	Di tingkat nasional, kedua pemain menjadi yang terbaik di Kejurnas yang digelar bulan lalu di Jakarta.	Y	kejurnas	3097	    1,261	0.0026	393.6923	ind_news_2011_00392056
21330	“Kami harus segera melakukan persiapan, karena pelaksanaan kejurnas tidak lama lagi,” tukasnya.	Y	kejurnas	3097	    1,261	0.0026	595.75	ind_news_2016_00376359
21331	Tapi karena kendala tidak memiliki sarana yang memadai, akhirnya kejurnas tersebut batal dilaksanakan, seperti yang terjadi tahun 2007 lalu,” ujarnya.	Y	kejurnas	3097	    1,261	0.0026	706.1667	ind_news_2016_00910100
21332	Ditambahkan, kejurnas ini sekaligus dijadikan untuk bahan uji coba sebelum mereka bertanding pada babak kualifikasi akhir tahun ini.	Y	kejurnas	3097	    1,261	0.0026	845.0588	ind_news_2011_00793094
21333	Pada Kejurnas Bali, target Jateng boleh dibilang gagal.	Y	kejurnas	3097	    1,261	0.0026	1240.875	ind_news_2012_00791595
21334	Dengan kata lain, kita memang tidak bisa mengabaikan apa yang terjadi di luar sana terkait dengan kebijakan energi di dalam negeri.	Y	mengabaikan	3097	    1,261	0.0026	318.7895	ind_news_2011_00809151
21335	Selain itu, UU ini juga melarang perusahaan asuransi mengabaikan orang-orang saat sakit.	Y	mengabaikan	3097	    1,261	0.0026	664	ind_news_2011_00038355
21336	Kita lebih sering terjebak kepentingan ekonomi semata dengan mengabaikan bumi yang sebenarnya menjadi modal kehidupan kita.	Y	mengabaikan	3097	    1,261	0.0026	810.4	ind_news_2012_00301744
21337	Dalam hal ini, operator kapal tidak sekadar ingin mendapatkan keuntungan semata sehingga mengabaikan keselamatan.	Y	mengabaikan	3097	    1,261	0.0026	927.8571	ind_news_2011_00369412
21338	Sementara Indonesia mengabaikan pemikiran Soekarno tentang ekonomi Indonesia, tegasnya.	Y	mengabaikan	3097	    1,261	0.0026	1282.375	ind_news_2016_00834624
21339	Sebab hingga saat ini belum ada persepsi yang sama di kalangan anggota dewan,” ujarnya.	Y	persepsi	3097	    1,261	0.0026	345.4286	ind_news_2016_00762095
21340	Persepsi Indonesia di Mata Investor Negatif JAKARTA-Persepsi Indonesia di mata investor luar negeri masih negatif.	Y	persepsi	3097	    1,261	0.0026	657.7	ind_news_2011_00843108
21341	Kehadiran perwakilan rumah sakit tersebut untuk menyamakan persepsi tentang penanganan dan pembayaran biaya perawatan bagi korban kecelakaan lalu lintas dan angkutan umum.	Y	persepsi	3097	    1,261	0.0026	784.4762	ind_news_2016_00420444
21342	Saya enggak mau panjang lebar karena takut salah persepsi, kata dia.	Y	persepsi	3097	    1,261	0.0026	896.6364	ind_news_2011_00874010
21343	Moratorium juga bisa menimbulkan persepsi negatif terhadap kelapa sawit Indonesia, tegasnya.	Y	persepsi	3097	    1,261	0.0026	1300.3636	ind_news_2012_00451653
21344	Tetapi yang paling utama adalah membantu tim mencapai prestasi setinggi mungkin, katanya.	Y	setinggi	3097	    1,261	0.0026	492.0833	ind_news_2011_00320924
21345	Setinggi-tinggi pertumbuhan ekonomi Filipina, masih jauh dari kita.	Y	setinggi	3097	    1,261	0.0026	671.2222	ind_news_2016_00873748
21346	Harga setinggi itu merupakan rekor untuk lelang benda seni Islam selama ini.	Y	setinggi	3097	    1,261	0.0026	861.25	ind_news_2012_00536094
21347	Sebagai orangtua, mereka pasti menginginkan anaknya bisa sekolah setinggi-tingginya.	Y	setinggi	3097	    1,261	0.0026	1002.6	ind_news_2012_00333887
21348	Ia mengaku rumahnya sudah terendam banjir setinggi lutut orang dewasa.	Y	setinggi	3097	    1,261	0.0026	1332.9	ind_news_2011_00993582
21349	Hanya ada lima tim dari babak 16 besar tahun lalu yang lolos ke fase yang sama pada musim ini.	Y	fase	3098	    1,260	0.0026	327.3529	ind_news_2012_00867920
21350	Bagi dia, sebagai pelatih, pun sama, dirinya bakal memberikan yang terbaik bagi timnas Garuda agar bisa melewati fase semifinal.	Y	fase	3098	    1,260	0.0026	597.5556	ind_news_2016_00056213
21351	Kami pasti akan lolos dari fase grup.	Y	fase	3098	    1,260	0.0026	754.1429	ind_news_2012_00468285
21352	Usia 50 tahunan masuk ke dalam fase masa tua dan masa pensiun.	Y	fase	3098	    1,260	0.0026	896.3	ind_news_2011_00610619
21353	Partai panas fase grup bakal kembali terulang.	Y	fase	3098	    1,260	0.0026	1263.1429	ind_news_2012_00966448
21354	Namun, hingga kini belum kembali ke Jakarta dan belum memberikan surat pemberitahuan apakah sakit atau hal-hal lainnya.	Y	pemberitahuan	3098	    1,260	0.0026	311.375	ind_news_2011_00709111
21355	“Karena sakit sehingga tidak bisa menandatangani surat pemberitahuan itu dan akhirnya diterima oleh anaknya,” terang dia.	Y	pemberitahuan	3098	    1,260	0.0026	579.9375	ind_news_2011_00429988
21356	Pemberitahuan Rapat Umum akan dikirim ke masing-masing pemegang saham dalam waktu dekat.	Y	pemberitahuan	3098	    1,260	0.0026	721	ind_news_2012_00664699
21357	Harus tunggu pemberitahuan resmi dulu, ujarnya, menolak berkomentar lebih lanjut terkait putusan tersebut.	Y	pemberitahuan	3098	    1,260	0.0026	884.7692	ind_news_2012_00457439
21358	Dia menuturkan, pemberitahuan kunjungan memang terasa mendadak.	Y	pemberitahuan	3098	    1,260	0.0026	1319.7143	ind_news_2011_00416201
21359	Karena untuk tahun ini, dilakukan serentak di lima wilayah kota dan satu kabupaten di wilayah DKI.	Y	serentak	3098	    1,260	0.0026	321.3571	ind_news_2011_00419083
21360	Terlebih lagi penerimaan kali ini serentak di seluruh wilayah Indonesia.	Y	serentak	3098	    1,260	0.0026	595.7	ind_news_2016_00928647
21361	Putusan MA dan tujuan bersama untuk memenangi pilkada serentak menjadi alasan utama Golkar harus kembali bersatu.	Y	serentak	3098	    1,260	0.0026	758	ind_news_2016_00706483
21362	Pra Unas ini dilaksanakan secara serentak di sebanyak 20 SMP selama empat hari.	Y	serentak	3098	    1,260	0.0026	851.5	ind_news_2016_00695866
21363	Dalam sambutannya Wapres Jusuf Kalla mengapresiasi Bawaslu Award untuk penyelenggara Pemilu yang telah menjalankan tugas dengan baik sehingga Pilkada serentak dapat berjalan dengan baik.	Y	serentak	3098	    1,260	0.0026	1220.2273	ind_news_2016_00130336
21364	Namun, ternyata hal yang sama juga terjadi di travel 'wisata biasa'.	Y	travel	3098	    1,260	0.0026	430.6364	ind_news_2016_00598131
21365	Sekitar 150 pengusaha di bidang pariwisata seperti pengusaha hotel, pemilik lokasi wisata, pengusaha tur dan travel, serta lainnya dijadwalkan hadir dalam kegiatan tahunan tersebut.	Y	travel	3098	    1,260	0.0026	719.0952	ind_news_2011_00330972
21366	Sumber di Kemenag Jatim menyatakan, visa tidak keluar karena mungkin pihak travel tak punya izin operasional.	Y	travel	3098	    1,260	0.0026	898	ind_news_2011_00091422
21367	Penjelasan potensi wisata ini setidaknya menarik minat sejumlah agen travel yang datang dari Bandung, Batam, Bali, Yogyakarta, Jakarta, Balikpapan.	Y	travel	3098	    1,260	0.0026	1007.4211	ind_news_2016_00667034
21368	Paling praktis memang ikut tur lewat jasa agen tur dan travel.	Y	travel	3098	    1,260	0.0026	1233.8	ind_news_2011_00184447
21369	“Semula hanya Rp 6 juta, naik terus sampai sekarang, tetapi kita tidak ada perlindungan hukum, terkait tempat dagang kita ini,” katanya.	Y	dagang	3099	    1,259	0.0026	423.1053	ind_news_2011_00254268
21370	Wapres juga mengatakan kalau kedua negara sudah siap maka masing-masing akan mengirimkan misi dagang dan misi ekonomi demi meningkatkan perdagangan antar negara.	Y	dagang	3099	    1,259	0.0026	660.05	ind_news_2012_00769702
21371	“Saya bagian menjual, karena saya memang biasa dagang rokok, beli dari agen atau distributor besar lalu di jual lagi ke kampung-kampung.	Y	dagang	3099	    1,259	0.0026	792.4	ind_news_2011_00668777
21372	Gagasan yang diusung Kamar Dagang dan Industri Kalbar ini mendapat dukungan dari dewan dan pengusaha perbatasan.	Y	dagang	3099	    1,259	0.0026	951.2667	ind_news_2011_00976154
21373	Jika rezim sebelumnya sibuk dagang tambang mineral, maka rezim saat ini sibuk membangun infrastruktur.	Y	dagang	3099	    1,259	0.0026	1249.5	ind_news_2016_00347441
21374	Karena hingga kini umat Islam di Indonesia masih jauh dari hak-haknya sebagai warga negara untuk mendapatkan pendidikan, kesehatan, dan kesejahteraan yang layak.	Y	haknya	3099	    1,259	0.0026	369.4783	ind_news_2011_00216800
21375	Dia mengatakan, mereka yang tergolong sebagai pekerja anak harus dikembalikan ke sekolah untuk memenuhi haknya mendapatkan pendidikan.	Y	haknya	3099	    1,259	0.0026	605.4706	ind_news_2012_00642838
21376	JAKARTA: Mayoritas nasabah perbankan nasional adalah kelas menengah bawah, tetapi masih sulit mendapatkan perlindungan terhadap hak-haknya, sehingga diperlukan lembaga pengadilan sengketa bagi mereka.	Y	haknya	3099	    1,259	0.0026	749.4583	ind_news_2012_00277201
21377	“Setiap PNS akan menerima gaji 13 sesuai haknya, tanpa ada pemotongan,” tegasnya.	Y	haknya	3099	    1,259	0.0026	914.8182	ind_news_2016_00872512
21378	Tentang perizinan, Heru mengatakan bukan menjadi haknya.	Y	haknya	3099	    1,259	0.0026	1328.8571	ind_news_2016_00920680
21379	Saya telah melakukan hal yang sama dan sampai batas tertentu, saya tahu bahwa itu tidak mudah,” kata Hillary.	Y	hillary	3099	    1,259	0.0026	374.1176	ind_news_2012_00093205
21380	Akhirnya Hillary bisa melihat-lihat apartemen itu, ujar seorang sumber yang dekat dengan Hillary.	Y	hillary	3099	    1,259	0.0026	664	ind_news_2011_00719449
21381	Namun Hillary dipastikan tidak akan lama bekerja di kantornya.	Y	hillary	3099	    1,259	0.0026	847.6667	ind_news_2012_00884886
21382	Kalau Hillary memang akan ikut campur urusan Indonesia seperti Papua, tegas politisi Gerindra ini.	Y	hillary	3099	    1,259	0.0026	1006.6429	ind_news_2016_00363067
21383	Hillary Clinton tidak menanggapi isu soal suaminya tersebut.	Y	hillary	3099	    1,259	0.0026	1340.125	ind_news_2016_00268871
21384	Laporan tersebut akan kami proses berdasarkan link yang kami punya.	Y	link	3099	    1,259	0.0026	493	ind_news_2011_00261400
21385	Sebab, tanpa ada link ke pusat, sulit untuk mengembangkan organisasi.	Y	link	3099	    1,259	0.0026	611.1	ind_news_2011_00943885
21386	“Sayang kami tak punya link di kepolisian,” ujarnya berharap.	Y	link	3099	    1,259	0.0026	686.7778	ind_news_2011_00550089
21387	Dalam waktu dua minggu ke depan diharapkan perusahaan pengelola ATM Link tersebut akan terbentuk.	Y	link	3099	    1,259	0.0026	792.4286	ind_news_2016_00132394
21388	“Tahun 2015, kami akan meluncurkan produk asuransi jiwa kredit kepemilikan rumah, asuransi plus tabungan, juga produk unit link.	Y	link	3099	    1,259	0.0026	1113.9333	ind_news_2016_00895560
21389	”Saya siap memberikan lahan ini, sebab memang sudah menjadi kewajiban bagi kami,” ujar Wijaya sambil menambahkan, bahwa ada pertimbangan dan perencanaan lain sehingga hal ini belum sempat diberikan kepada pemerintah kota.	Y	wijaya	3100	    1,258	0.0026	423.2333	ind_news_2016_00755447
21390	Bu Wijaya sendiri pada akhirnya pergi dari rumah karena sudah tidak cocok dengan Pak Wijaya.	Y	wijaya	3100	    1,258	0.0026	663.2143	ind_news_2012_00673344
21391	Indah langsung melaporkan hal ini ke Pak Wijaya.	Y	wijaya	3100	    1,258	0.0026	776.5	ind_news_2012_00127361
21392	Bisa jadi banyak orang yang masih sanksi terhadap kemampuan Ibrahim Fatwa Wijaya.	Y	wijaya	3100	    1,258	0.0026	939.5833	ind_news_2012_00262959
21393	Menurut Wijaya, alokasi gas industri sebetulnya tidak harus dikurangi.	Y	wijaya	3100	    1,258	0.0026	1342.2222	ind_news_2011_00045434
21394	Tidak ada satu hari pun yang berlalu tanpa peringatan yang menyatakan bahwa kehidupan kita di bumi ini bisa berakhir setiap saat.	Y	berlalu	3101	    1,257	0.0026	395.15	ind_news_2012_00890779
21395	Dia menambahkan agenda partai politik sekarang adalah mengusung calon presiden padahal pemilihan presiden baru setahun lebih berlalu.	Y	berlalu	3101	    1,257	0.0026	664.4375	ind_news_2012_00268102
21396	Namun sudah tiga tahun berlalu, ternyata tak kunjung diserahkan.	Y	berlalu	3101	    1,257	0.0026	827.7778	ind_news_2012_00152142
21397	Setelah Lebaran berlalu, si pembantu tidak kembali bekerja.	Y	berlalu	3101	    1,257	0.0026	1007.875	ind_news_2011_00263940
21398	Saat ini beliau perlu istirahat,” kata sembari berlalu.	Y	berlalu	3101	    1,257	0.0026	1306.75	ind_news_2011_00152243
21399	Namun semua itu tidak bisa langsung direalisasikan, karena ini terkait dengan uang negara, katanya.	Y	direalisasikan	3101	    1,257	0.0026	280.4286	ind_news_2011_00207457
21400	Ia menegaskan program kerja yang sudah ada akan direalisasikan secepatnya.	Y	direalisasikan	3101	    1,257	0.0026	621.9	ind_news_2011_00936203
21401	Termasuk apakah anggaran tersebut direalisasikan secara bertahap atau tidak.	Y	direalisasikan	3101	    1,257	0.0026	736	ind_news_2016_00929668
21402	Sebab hal itu akan sangat berpengaruh untuk dapat direalisasikan dalam mengembangkan start-up, tuturnya.	Y	direalisasikan	3101	    1,257	0.0026	882.7857	ind_news_2016_00761848
21403	Pasalnya, dalam ajang lomba yang menyediakan hadiah terse-but, tak kunjung direalisasikan.	Y	direalisasikan	3101	    1,257	0.0026	1281.8333	ind_news_2012_00076936
21404	Gak ada masalah, tapi yang pasti harga tidak akan berubah sampai akhir tahun ini, mungkin baru tahun depan, katanya.	Y	gak	3101	    1,257	0.0026	331.1111	ind_news_2012_00179493
21405	Jadi saya yakin tidak ada perusahaan yang buat pesawat terbang, khusus untuk jatuh itu gak ada,” pungkasnya.	Y	gak	3101	    1,257	0.0026	669.8125	ind_news_2012_00389404
21406	Punya 3 Istri Tapi Masih Ikut Komunitas Aneh, yang Muda Gak - JPNN.	Y	gak	3101	    1,257	0.0026	865.6364	ind_news_2016_00705621
21407	“Bertanya adalah hak pers, ini sudah gak sama seperti zaman Orde Baru,” tuturnya.	Y	gak	3101	    1,257	0.0026	1020.9231	ind_news_2011_00578081
21408	Kalau gak makan daging gak sah rasanya ungkapnya.	Y	gak	3101	    1,257	0.0026	1417.1429	ind_news_2012_00320329
21409	Bagi saya cedera dalam bermain bola itu hal biasa, tidak ada dendam ke siapa pun,” katanya.	Y	dendam	3102	    1,256	0.0026	399.9375	ind_news_2016_00057795
21410	“Kami harap persoalan ini diselesaikan secara hukum, dan tak ada dendam.	Y	dendam	3102	    1,256	0.0026	724.2727	ind_news_2016_00376122
21411	Agung tak menampik, ada kemungkinan siswa senior punya rasa dendam atas perilaku yang mereka terima dari kakak kelas kala mereka menjadi murid baru.	Y	dendam	3102	    1,256	0.0026	918.4545	ind_news_2016_00014220
21412	Polisi menduga, dalam pembunuhan itu tidak ada unsur perampokan, tapi diperkirakan mengarah pada motif dendam.	Y	dendam	3102	    1,256	0.0026	1059.3333	ind_news_2011_00629978
21413	Jika kamu ingin membalas dendam, bunuh saja aku, katanya dengan nada tinggi.	Y	dendam	3102	    1,256	0.0026	1213.0833	ind_news_2016_00345374
21414	Sekarang ini, menurutnya, para caleg terlihat sudah mulai terbuka dalam memberikan informasi dirinya melalui jejaring sosial.	Y	jejaring	3102	    1,256	0.0026	518.875	ind_news_2016_00805745
21415	Menurut laporan dari jejaring sosial Twitter, para pemain Sriwijaya sudah siap bertanding, mereka sudah berada di lapangan, namun wasit dan perangkat pertandingan lainnya belum datang.	Y	jejaring	3102	    1,256	0.0026	677.875	ind_news_2012_00122362
21416	ID, JAKARTA--Tak aneh jika saat ini anggota dewan perwakilan rakyat (DPR) memiliki akun jejaring sosial semacam Facebook atau Twitter.	Y	jejaring	3102	    1,256	0.0026	874.2	ind_news_2011_00085356
21417	Dari keenam toko jejaring ilegal itu, dua toko telah mendapatkan putusan dari PN Kota Jogja.	Y	jejaring	3102	    1,256	0.0026	971.7692	ind_news_2016_00145649
21418	Tak jarang jejaring sosial menjadi tempat berbagi perasaan.	Y	jejaring	3102	    1,256	0.0026	1280.375	ind_news_2011_00337851
21419	Bukan dengan melihat kompensasi uang yang diberikan tetapi lebih pada masalah kehidupan di masa mendatang, ujarnya kepada Bisnis hari ini.	Y	kompensasi	3102	    1,256	0.0026	333.55	ind_news_2012_00758871
21420	Karena itu, kompensasi paling mungkin bagi pengguna sepeda motor adalah dengan menyediakan angkutan umum yang lebih memadai.	Y	kompensasi	3102	    1,256	0.0026	624.4118	ind_news_2012_00065966
21421	Jadi sebaiknya, kompensasi BBM daripada diberikan dalam bentuk BLT lebih baik dalam bentuk peningkatan sarana jalan atau infrastruktur lain yang mendukung aktivitas perekonomian masyarakat luas.	Y	kompensasi	3102	    1,256	0.0026	748	ind_news_2012_00474929
21422	3. Berikan kompensasi petugas keamanan yang ada di sekitar zona di tempat ATM tersebut dengan MoU ikut terlibat dalam pengamanan ATM yang ada di lokasi tersebut.	Y	kompensasi	3102	    1,256	0.0026	874	ind_news_2012_00717161
21423	Konon itu merupakan kompensasi atas perubahan sikap PKS dari semula menentang menjadi mendukung Boediono menjadi pendamping SBY.	Y	kompensasi	3102	    1,256	0.0026	1285.5	ind_news_2012_00441013
21424	’’Untuk sementara saya off dulu dari timnas sampai manajemen memenuhi hak saya.	Y	off	3103	    1,255	0.0026	594.3636	ind_news_2012_00712247
21425	Tidak ada mobil dengan roda-roda besar yang biasa digunakan untuk off-road.	Y	off	3103	    1,255	0.0026	754.1667	ind_news_2011_00857078
21426	Harga tersebut seluruhnya dalam kondisi off the road DKI Jakarta.	Y	off	3103	    1,255	0.0026	1055.6	ind_news_2011_00371999
21427	Walau tidak selalu on air, namun tawaran tampil off air terus mengalir.	Y	off	3103	    1,255	0.0026	1154.1818	ind_news_2011_00068481
21428	Lantaran para pecinta off road ini. sudah memiliki keluarga.	Y	off	3103	    1,255	0.0026	1219.2222	ind_news_2012_00430220
21429	Artinya, kini Suzuki telah bermain di semua kelas pasar mobil.	Y	suzuki	3103	    1,255	0.0026	565.4	ind_news_2011_00940654
21430	Korban terjatuh bersama kedua orang pelaku yang menggunakan motor Suzuki.	Y	suzuki	3103	    1,255	0.0026	740.6	ind_news_2016_00467222
21431	Bahkan, mantan pembalap Suzuki itu yakin Rossi masih bisa meraih kemenangan di MotoGP musim 2013 mendatang.	Y	suzuki	3103	    1,255	0.0026	900.1333	ind_news_2012_00060368
21432	Pembalap Suzuki tersebut dipastikan akan tampil di MotoGP Portugal akhir pekan ini.	Y	suzuki	3103	    1,255	0.0026	1028.75	ind_news_2011_00204983
21433	Dukungan produk dan varian baru membuatnya optimistis bisa mendongkrak penjualan Suzuki.	Y	suzuki	3103	    1,255	0.0026	1398.4545	ind_news_2011_00617371
21434	Dan beberapa warga yang rumahnya sudah tidak terendam banjir lagi mulai kembali ke rumah.	Y	terendam	3103	    1,255	0.0026	398.7857	ind_news_2011_00151046
21435	Ratusan rumah di ketiga negara bagian tersebut dikabarkan telah terendam banjir.	Y	terendam	3103	    1,255	0.0026	630.8182	ind_news_2012_00286848
21436	Kami masih melakukan pendataan jumlah rumah yang terendam banjir khususnya yang rusak.	Y	terendam	3103	    1,255	0.0026	764.3636	ind_news_2016_00378459
21437	Yang lebih panik lagi, warga AS yang rumahnya terendam.	Y	terendam	3103	    1,255	0.0026	950	ind_news_2012_00023368
21438	Tsunami, proyek pembangkit PLN terendam air laut Jakarta (Solopos.	Y	terendam	3103	    1,255	0.0026	1278.6667	ind_news_2011_00793080
21439	Ditambahkannya, kondisi atlet Sulut hingga saat ini dalam keadaan yang sehat, dan tidak ada yang sakit.	Y	ditambahkannya	3104	    1,254	0.0026	423.2667	ind_news_2012_00292678
21440	Ditambahkannya, sektor pendidikan menjadi sangat penting dalam meningkatkan kualitas Sumber Daya Manusia (SDM).	Y	ditambahkannya	3104	    1,254	0.0026	680	ind_news_2011_00896349
21441	Ditambahkannya, hasil riset bukan dirasakan satu-dua tahun, tapi untuk jangka panjang.	Y	ditambahkannya	3104	    1,254	0.0026	807.6667	ind_news_2012_00454755
21442	Ditambahkannya, dengan adanya bantuan dana dari pemprop, akan sangat mem-bantu keberhasilan petinju-nya di kejurnas nanti.	Y	ditambahkannya	3104	    1,254	0.0026	990	ind_news_2011_00164407
21443	Ditambahkannya, Dinas Perkebunan Minsel sepertinya menerapkan kebijakan pilih kasih.	Y	ditambahkannya	3104	    1,254	0.0026	1408.3333	ind_news_2016_00210504
21444	Hanya saja, tidak adanya payung hukum yang jelas membuat para pelaku tetap saja melakukan aksi yang sama setiap hari.	Y	payung	3104	    1,254	0.0026	292.5294	ind_news_2012_00540510
21445	Pemerintah harus menyiapkan payung hukum dan kebijakan tersebut agar tidak mengganggu kepastian usaha,” ujarnya.	Y	payung	3104	    1,254	0.0026	622.5714	ind_news_2012_00524855
21446	Justru dewan akan dinilai melanggar aturan bila tak menjalankan sesuatu yang jelas payung hukumnya,” ujarnya.	Y	payung	3104	    1,254	0.0026	792.4667	ind_news_2016_00356502
21447	Pemerintah juga sedang menyiapkan Peraturan Presiden untuk menjadi payung hukum satgas dalam menghentikan pungutan liar.	Y	payung	3104	    1,254	0.0026	932.5333	ind_news_2016_00653922
21448	Honorer K2 usia kritis perlu payung hukum kalau diangkat CPNS.	Y	payung	3104	    1,254	0.0026	1426	ind_news_2016_00271576
21449	Mengingat, warga yang menggunakan jasa layanan seluler tersebut saat ini mencapai 155 juta orang.	Y	seluler	3104	    1,254	0.0026	469.2308	ind_news_2011_00693474
21450	Empat telepon seluler dan satu mobil turut diamankan sebagai barang bukti yang digunakan pelaku saat beraksi.	Y	seluler	3104	    1,254	0.0026	758.875	ind_news_2012_00410920
21451	JAKARTA (Suara Karya): Jumlah pelanggan PT Telkomsel menembus angka 100 juta dan menjadikan perusahaan ini sebagai operator seluler ketujuh terbesar di dunia.	Y	seluler	3104	    1,254	0.0026	865.2857	ind_news_2012_00595447
21452	Dewasa ini semakin beragam jenis games yang dimainkan melalui jejaring sosial, media berbasis internet atau bahkan perangkat seluler lainnya.	Y	seluler	3104	    1,254	0.0026	1049.3684	ind_news_2012_00253859
21453	Ingat persaingan telepon seluler makin ketat jangan merasa paling hebat.	Y	seluler	3104	    1,254	0.0026	1351.5	ind_news_2012_00314017
21454	Usianya sama seperti saya dan dia masih menjadi pemain, sementara saya seorang pelatih.	Y	usianya	3104	    1,254	0.0026	338.8333	ind_news_2016_00976172
21455	Mereka lebih suka memilih melakukan hubungan seks pertama kali dalam hidup mereka dengan pria yang jauh lebih tua usianya dibanding mereka.	Y	usianya	3104	    1,254	0.0026	601.3333	ind_news_2011_00496148
21456	Menurutnya, pembeli yang datang kebanyakan usianya sekitar 20 tahun ke atas.	Y	usianya	3104	    1,254	0.0026	758.2	ind_news_2011_00879502
21457	Biar lebih jelas, aku tidak pernah punya cita-cita menikah dengan lelaki yang usianya lebih muda.	Y	usianya	3104	    1,254	0.0026	924.0714	ind_news_2011_00905966
21458	Cuma Demokrat relatif lebih muda usianya, paparnya.	Y	usianya	3104	    1,254	0.0026	1279.5714	ind_news_2012_00604892
21459	Tapi itu kembali kepada mekanisme serta anggaran dasar dan rumah tangga dalam proses pemilihan pimpinan partai,” kata Ketua Dekot KK ini.	Y	dekot	3105	    1,253	0.0026	501.1429	ind_news_2016_00908192
