ORDER	SENTENCE	STATUS	WORD	RANK	COUNT	COUNT_REL	INDEX	ID
21614	Produk yang juga berasal dari salah satu perusahaan ayam potong terbesar di kota Medan ini sangat peduli terhadap kualitas.	Y	potong	3119	    1,239	0.0025	509.3158	ind_news_2016_00699889
21615	Warga berharap, rumah potong bisa membantu perekonomian warga.	Y	potong	3119	    1,239	0.0025	717.1429	ind_news_2011_00474992
21616	SAPI POTONG: Jumlah peternak sapi lokal di Jawa Barat yang masih minim menyebabkan populasi sapi potong hanya cukup untuk memenuhi kebutuhan daging sapi selama 1 tahun.	Y	potong	3119	    1,239	0.0025	833.1905	ind_news_2012_00815754
21617	Padahal dampak dari kelangkaan sapi potong sangat berpengaruh pada sektor lainnya.	Y	potong	3119	    1,239	0.0025	1028.0909	ind_news_2012_00653825
21618	Soalnya, harga ayam potong di pasar menjelang R..	Y	potong	3119	    1,239	0.0025	1353.25	ind_news_2016_00881795
21619	Sebab, di satu sisi pemerintah harus hemat, dan di sisi lain tidak masalah.	Y	hemat	3120	    1,238	0.0025	381.0909	ind_news_2011_00451044
21620	Namun, secara umum Pemerintah Provinsi Sumsel telah melaksanakan hemat energi dan air terutama di ruangan kerja.	Y	hemat	3120	    1,238	0.0025	678.4375	ind_news_2012_00680643
21621	Hemat tenaga dan keuangan supaya semua tugas bisa diselesaikan.	Y	hemat	3120	    1,238	0.0025	816.2222	ind_news_2012_00950418
21622	Anton mengatakan kebanyakan hotel di Bali menggunakan AC yang memiliki kualitas bagus, ramah lingkungan, dan hemat energi.	Y	hemat	3120	    1,238	0.0025	941.5882	ind_news_2012_00162480
21623	Biar kita sama-sama hemat lah, kata JK.	Y	hemat	3120	    1,238	0.0025	1305.2857	ind_news_2016_00097542
21624	Dia menyatakan 71 persen warga negara Indonesia saat ini menggunakan smartphone.	Y	smartphone	3120	    1,238	0.0025	389.8	ind_news_2016_00176194
21625	Aplikasi baru kita ini dapat dilihat dan diikuti melalui smartphone.	Y	smartphone	3120	    1,238	0.0025	715	ind_news_2016_00044031
21626	Siap Bersaing, Smartphone ini Dibuat Sama dengan Kualitas - JPNN.	Y	smartphone	3120	    1,238	0.0025	864.4444	ind_news_2016_00875587
21627	Survei itu mengungkapkan sebanyak 66 persen responden menggunakan smartphone untuk membuka surat elektronik dan mengakses berita online.	Y	smartphone	3120	    1,238	0.0025	1032.125	ind_news_2016_00892861
21628	Produsen ponsel cerdas (smartphone) BlackBerry itu kini menawarkan sekitar 10 ribu aplikasi untuk BlackBerry.	Y	smartphone	3120	    1,238	0.0025	1288.8333	ind_news_2011_00634911
21629	Dan itu baru satu sekolah di antara ratusan sekolah lainnya yang tersebar di sejumlah wilayah di Bolmut yang membutuhkan bantuan pemerintah.	Y	bolmut	3121	    1,237	0.0025	467	ind_news_2016_00136276
21630	Apalagi Mitra, Sitaro, Bolmut, dan Kota Kotamobagu merupakan daerah baru yang kali pertama akan melaksanakan pilkada.	Y	bolmut	3121	    1,237	0.0025	696.4375	ind_news_2016_00040050
21631	Uji publik itu adalah tahapan akhir sebelum KPUD menggelar rapat pleno untuk menetapkan nama-nama anggota dewan di KK dan Bolmut.	Y	bolmut	3121	    1,237	0.0025	826.35	ind_news_2016_00959046
21632	Sementara empat pasang kandidat yang akan bertarung semuanya juga akan memilih di sejumlah TPS di Bolmut.	Y	bolmut	3121	    1,237	0.0025	990.8571	ind_news_2016_00834206
21633	Kecuali Bolmut, karena alasan jarak yang jauh, melaksanakan upacara di wilayahnya.	Y	bolmut	3121	    1,237	0.0025	1213.4545	ind_news_2016_00413068
21634	Menurut dia, upaya perbaikan secara permanen akan segera dilakukan dengan anggaran sekitar Rp 115 juta.	Y	permanen	3121	    1,237	0.0025	392.2143	ind_news_2012_00662728
21635	’’Tetapi tidak berarti belum ada perbaikan permanen.	Y	permanen	3121	    1,237	0.0025	707.8571	ind_news_2012_00164843
21636	Penanggulangan banjir permanen, boleh jadi tidak mudah karena persoalan yang kompleks.	Y	permanen	3121	    1,237	0.0025	848.1818	ind_news_2012_00727508
21637	Namun, penurunan ini biasanya tidak permanen, karena tubuh tidak kehilangan lemak apapun.	Y	permanen	3121	    1,237	0.0025	992.9091	ind_news_2011_00311261
21638	Penyebabnya otot jantung telah rusak permanen akibat serangan jantung yang terjadi.	Y	permanen	3121	    1,237	0.0025	1324.7	ind_news_2016_00669018
21639	“Secara pribadi saya tidak pernah menerima uang sebe-sar yang diberitakan, dari pe-tinggi Pemkot Manado.	Y	sebe	3121	    1,237	0.0025	667.9375	ind_news_2016_00784700
21640	Untuk Sulut sendiri rencana-nya akan dialokasikan sebe-sar Rp 10 miliar.	Y	sebe	3121	    1,237	0.0025	885.0909	ind_news_2011_00871413
21641	Karena itu, sebe-lum PP 41 diterapkan, hal ini akan kami sampaikan ke pusat,” paparnya.	Y	sebe	3121	    1,237	0.0025	956.7857	ind_news_2016_00397830
21642	Jumlahnya sebe-sar Rp 375 juta dalam kurun waktu setahun ini.	Y	sebe	3121	    1,237	0.0025	1187	ind_news_2016_00355030
21643	Dan sehari sebe-lum kegiatan dibuka, persiapan dipastikan telah rampung.	Y	sebe	3121	    1,237	0.0025	1357.1	ind_news_2016_00140311
21644	’’Kami juga telah bekerja sama dengan sekolah fashion di negara lain,’’ ungkapnya.	Y	fashion	3122	    1,236	0.0025	412.9167	ind_news_2016_00377776
21645	“Setiap tahun tren fashion berubah, tapi beberapa tahun kemudian akan muncul lagi.	Y	fashion	3122	    1,236	0.0025	696.3636	ind_news_2016_00872835
21646	Tentu saja kecepatan ini sangat dibutuhkan oleh para pecinta fashion di dunia.	Y	fashion	3122	    1,236	0.0025	841.75	ind_news_2011_00393307
21647	Potensi pasar untuk kuliner halal dan fashion Muslim sangat besar.	Y	fashion	3122	    1,236	0.0025	962.1	ind_news_2016_00694810
21648	Di sektor riil, kemajuan terlihat di wisata halal dan fashion.	Y	fashion	3122	    1,236	0.0025	1280.5556	ind_news_2016_00205336
21649	Bahkan tim robot Indonesia saat ini terbaik di dunia.	Y	robot	3122	    1,236	0.0025	447	ind_news_2012_00276974
21650	Hanya saja, robot itu dibuat dalam skala yang lebih kecil.	Y	robot	3122	    1,236	0.0025	680.8	ind_news_2012_00286087
21651	Namun, robot-robot tersebut juga dirancang untuk dunia pendidikan.	Y	robot	3122	    1,236	0.0025	831.125	ind_news_2016_00594258
21652	Pemain-pemain ini tidak seperti robot, mereka memerlukan istirahat.	Y	robot	3122	    1,236	0.0025	1025.75	ind_news_2012_00080841
21653	Bagaimana cara menjalin kasih sayang dengan robot?	Y	robot	3122	    1,236	0.0025	1250.2857	ind_news_2011_00756884
21654	Setelah sebelumnya juga sudah mendapatkan award yang sama.	Y	award	3123	    1,235	0.0025	462.75	ind_news_2016_00870616
21655	Penghargaan ini diterima Bank BTN dalam Bisnis Indonesia Award 2016, yang digelar oleh harian ekonomi itu.	Y	award	3123	    1,235	0.0025	704	ind_news_2016_00664715
21656	“Beasiswa penuh diberikan ke petani lahan kering di 7 provinsi, antara lain Papua, Papua Barat, Nusa Tenggara Timur, Nusa Tenggara Barat, yang merupakan fokus area dari program Australia Award,” jelasnya.	Y	award	3123	    1,235	0.0025	798.16	ind_news_2016_00077417
21657	”Saya mengharapkan pemberian Cipta Award 2011 mendorong para pengelola daya tarik wisata alam, daya tarik wisata budaya, dan daya tarik wisata buatan di Tanah Air.	Y	award	3123	    1,235	0.0025	1056.5556	ind_news_2012_00432458
21658	Perda ini dikenal dengan istilah Perda DPRD Award.	Y	award	3123	    1,235	0.0025	1182.8571	ind_news_2016_00672278
21659	Dibandingkan apa yang mungkin terjadi kepada negara ini, Presiden Obama telah bekerja dengan baik, ungkap Clinton.	Y	clinton	3124	    1,233	0.0025	439.1875	ind_news_2012_00807224
21660	Clinton menjadi presiden pertama perempuan yang memimpin negara adi daya itu.	Y	clinton	3124	    1,233	0.0025	726.0909	ind_news_2016_00116888
21661	Menteri Luar Negeri AS Hillary Clinton mengumumkan kunjungan itu pada akhir pekan lalu, dua hari setelah utusan nuklir Korea Utara dan Korea Selatan mengadakan pertemuan kejutan di sela-sela konferensi keamanan Asia di Bali.	Y	clinton	3124	    1,233	0.0025	891.871	ind_news_2012_00506669
21662	Trump dan Clinton dipaksa duduk sama rendah dan berdiri sama tinggi dengan para penonton yang dipilih sebelumnya.	Y	clinton	3124	    1,233	0.0025	1025.2667	ind_news_2016_00954289
21663	Clinton sebelumnya menawarkan zona tanpa terbang di Suriah.	Y	clinton	3124	    1,233	0.0025	1324.375	ind_news_2016_00116900
21664	Heru mengatakan, saat kejadian tidak ada seorang pun yang ada di rumah.	Y	heru	3125	    1,231	0.0025	362.2727	ind_news_2011_00082172
21665	Namun, sambung Heru bila kepala daerah melakukan kampanye pada hari libur Sabtu dan Minggu tidak perlu izin.	Y	heru	3125	    1,231	0.0025	653.0588	ind_news_2011_00370297
21666	Heru mengaku akan membicarakan secara internal terkait perubahan status jalan tersebut.	Y	heru	3125	    1,231	0.0025	841.8182	ind_news_2012_00199269
21667	Heru juga berharap bupati mengeluarkan kebijakan melarang sekolah menjual seragam batik atau seragam sekolah lain.	Y	heru	3125	    1,231	0.0025	1005.6154	ind_news_2011_00934625
21668	Menanggapi vonis hakim, Heru dan istrinya langsung menyatakan banding.	Y	heru	3125	    1,231	0.0025	1265.6667	ind_news_2012_00421172
21669	Kami sudah pernah buat pernyataan keras pada tahun 2012 dan tiga hari lalu kami juga sudah menyampaikan pernyataan yang lebih keras kepada kedutaan Myanmar di Indonesia atas kejadian kekerasan itu, katanya.	Y	kedutaan	3126	    1,230	0.0025	395.1538	ind_news_2016_00384933
21670	“Kami ingin menciptakan hubungan sampai di tingkat kedutaan besar,” ucapnya lebih lanjut.	Y	kedutaan	3126	    1,230	0.0025	613.6667	ind_news_2011_00618735
21671	Beberapa aktivis mengaku mendapat ancaman langsung dari pejabat kedutaan.	Y	kedutaan	3126	    1,230	0.0025	786	ind_news_2012_00786423
21672	Tidak lupa, selalu memiliki nomor telepon kedutaan Anda.	Y	kedutaan	3126	    1,230	0.0025	907	ind_news_2011_00749789
21673	Nunun menolak dibawa ke Kedutaan Besar RI di Bangkok.	Y	kedutaan	3126	    1,230	0.0025	1326.1111	ind_news_2012_00236122
21674	Hingga kemarin, polisi masih memburu pelaku yang diperkirakan lebih dari satu orang.	Y	memburu	3126	    1,230	0.0025	388.3333	ind_news_2011_00656782
21675	Ini membuat masyarakat banyak memburu motor baru,” ungkapnya.	Y	memburu	3126	    1,230	0.0025	591.875	ind_news_2011_00473752
21676	Petugas masih memburu lima pelaku lainnya yang belum tertangkap.	Y	memburu	3126	    1,230	0.0025	730.5556	ind_news_2012_00855172
21677	SLEMAN - Pemkab Sleman melalui Bidang Pertanian dan Tanaman Pangan setempat menyerahkan sejumlah peralatan untuk membantu masyarakat memburu tikus.	Y	memburu	3126	    1,230	0.0025	901.2941	ind_news_2012_00651830
21678	Meski harganya mahal, warga tetap memburu hewan kurban tersebut.	Y	memburu	3126	    1,230	0.0025	1310.4444	ind_news_2012_00209042
21679	”Tahun ini kami hanya memiliki alokasi dana sekitar Rp 35 juta untuk membuat rambu jalan itu.	Y	rambu	3126	    1,230	0.0025	390.1333	ind_news_2011_00597932
21680	Selama ini penentuan kriteria atau rambu politik uang masih sebatas pada pembagian uang kepada pemilih yang dilakukan salah satu calon atau tim sukses, katanya di Yogyakarta, pekan lalu.	Y	rambu	3126	    1,230	0.0025	703.8462	ind_news_2012_00877940
21681	Oleh warga setempat kemudian dipasang rambu peringatan agar pengguna jalan waspada saat melintas di kawasan tersebut.	Y	rambu	3126	    1,230	0.0025	841.6875	ind_news_2016_00610800
21682	Upaya yang ditempuh, lanjut dia, dengan memasang sejumlah rambu-rambu.	Y	rambu	3126	    1,230	0.0025	998.3333	ind_news_2012_00290890
21683	Pemasangan rambu petunjuk arah kiri jalan terus dibuat berupa tulisan saja, bukan berupa lampu.	Y	rambu	3126	    1,230	0.0025	1268.7692	ind_news_2011_00673350
21684	Ia menambahkan saat ini tim XL terus menyiapkan kota-kota lainnya lagi.	Y	xl	3126	    1,230	0.0025	466	ind_news_2016_00277939
21685	Hal ini sebagai bentuk apresiasi dan dukungan XL terhadap para pelanggan khususnya pengguna data untuk lebih produktif.	Y	xl	3126	    1,230	0.0025	705.8824	ind_news_2016_00247027
21686	Saat ini XL, lanjut Dedi, berada pada posisi kedua di antara operator telekomunikasi lainnya di Indonesia.	Y	xl	3126	    1,230	0.0025	828.1333	ind_news_2011_00852212
21687	Pengunjung bisa memperoleh informasi lengkap dan merasakan berbagai aplikasi terbaru dari XL.	Y	xl	3126	    1,230	0.0025	977.6667	ind_news_2012_00402907
21688	Dia mencatat hingga kini ada 74 penyedia konten yang mengantongi perjanjian kerjasama dengan XL.	Y	xl	3126	    1,230	0.0025	1320	ind_news_2012_00896902
21689	Ketiga pelaku ini sudah beraksi di beberapa daerah di Jawa Tengah.	Y	beraksi	3127	    1,229	0.0025	436.9	ind_news_2016_00442473
21690	Para pelaku beraksi mulai Agustus hingga Desember 2010.	Y	beraksi	3127	    1,229	0.0025	675.2857	ind_news_2012_00984592
21691	Pengakuan tersangka, ia beraksi hanya seorang diri.	Y	beraksi	3127	    1,229	0.0025	795.2857	ind_news_2011_00702149
21692	Padahal tugas eksekutif bukan bicara, tetapi beraksi.	Y	beraksi	3127	    1,229	0.0025	912.1429	ind_news_2012_00450839
21693	Perampok beraksi dengan cara memecahkan kaca mobil bagian kiri depan.	Y	beraksi	3127	    1,229	0.0025	1364.3	ind_news_2012_00621486
21694	Ia pun mulai yakin bahwa akan terjadi sesuatu yang baik pada dirinya sebentar lagi.	Y	sebentar	3127	    1,229	0.0025	420.7143	ind_news_2012_00417233
21695	Sebentar lagi ada penetapan tersangka dalam waktu dekat.	Y	sebentar	3127	    1,229	0.0025	678.75	ind_news_2011_00531271
21696	Ini sebentar lagi harus turun, hari ini, paling lambat besok pagi..	Y	sebentar	3127	    1,229	0.0025	819.8	ind_news_2016_00309760
21697	“Saya hanya memenangkan sebentar saja, saya tidak main,” kata Del di hadapan petugas.	Y	sebentar	3127	    1,229	0.0025	978.6667	ind_news_2011_00022212
21698	Mengingat sebentar lagi, memasuki bulan suci Ramadhan.	Y	sebentar	3127	    1,229	0.0025	1334.2857	ind_news_2011_00359697
21699	Pada bagian lain, bupati juga meminta dukungan war-ga Sulut.	Y	war	3127	    1,229	0.0025	651.5	ind_news_2012_00459123
21700	Hanya saja, menurutnya, war-ga harus memahami kondisi yang terjadi sesungguhnya.	Y	war	3127	    1,229	0.0025	860.4545	ind_news_2012_00442249
21701	“Jangan ada yang percaya,” kata Gus War.	Y	war	3127	    1,229	0.0025	960	ind_news_2011_00859802
21702	Yang menarik, war-ga Langowan yang hadir berasal dari warna politik berbeda.	Y	war	3127	    1,229	0.0025	1057	ind_news_2011_00529262
21703	Menurutnya, nasib 200 KK war-ga Talaud meskipun tinggal di Filipina secara ilegal, namun tetap diperhatikan oleh Peme-rintah Filipina.	Y	war	3127	    1,229	0.0025	1312.6667	ind_news_2011_00533864
21704	Ancaman dan ketertiban itu tidak hanya dari para teroris, tetapi bisa dari mana saja yang tidak diduga sebelumnya.	Y	ketertiban	3128	    1,228	0.0025	435	ind_news_2011_00793468
21705	Polda Metro sudah mempersiapkan tim untuk menjaga ketertiban di daerah itu.	Y	ketertiban	3128	    1,228	0.0025	683.6364	ind_news_2012_00702655
21706	Kita mengapresiasi kehadiran bapak presiden dan aparat Polri yang membantu ketertiban selama aksi berlangsung, katanya seraya berharap agar proses penegakan hukum terhadap Ahok bisa berjalan transparan dan memenuhi rasa keadilan publik.	Y	ketertiban	3128	    1,228	0.0025	813.7333	ind_news_2016_00457353
21707	Mantan Kabid Humas Polda Metro Jaya itu mengatakan, jangan sampai aksi mengganggu ketertiban.	Y	ketertiban	3128	    1,228	0.0025	965.2308	ind_news_2016_00496522
21708	“Itu kewenangan Pemda menjaga ketertiban masyarakat di wilayahnya.	Y	ketertiban	3128	    1,228	0.0025	1307.875	ind_news_2016_00320059
21709	Ia mengatakan, tak ada korban dari salah mendarat itu.	Y	mendarat	3128	    1,228	0.0025	387.6667	ind_news_2012_00927191
21710	”Dari radio komunikasi, saya dengar ada beberapa kapal yang akan mendarat lagi sore ini (kemarin-Red),” katanya.	Y	mendarat	3128	    1,228	0.0025	713.7647	ind_news_2012_00600878
21711	Menurut berita yang dikutip dari saksi mata, pesawat melakukan percobaan terbang selama 15 menit sebelum mendarat.	Y	mendarat	3128	    1,228	0.0025	822.5333	ind_news_2012_00483621
21712	Seorang juru bicara militer Israel mengatakan, beberapa roket itu mendarat di dekat perbatasan yang tidak membahayakan dengan Jalur Gaza.	Y	mendarat	3128	    1,228	0.0025	966.6842	ind_news_2012_00373713
21713	Roket itu diperkirakan akan mendarat di sebelah utara kepulauan Filipina.	Y	mendarat	3128	    1,228	0.0025	1291.6	ind_news_2012_00575074
21714	Beberapa daerah seperti PMI Jakarta mendapat bantuan dari pemerintah daerah dan PMI di beberapa daerah lain.	Y	pmi	3128	    1,228	0.0025	340.6667	ind_news_2012_00928482
21715	Dalam pertemuan ini, tim PMI rencananya akan bertemu dengan Menteri Luar Negeri, Menteri Kesehatan, Menteri Urusan Perbatasan, Mendagri dan Menteri Sosial dan Kesejahteraan Rakyat.	Y	pmi	3128	    1,228	0.0025	685.55	ind_news_2012_00107433
21716	PMI akan bekerjasama dengan lembaga lainnya yang peduli dengan nasib para korban bencana.	Y	pmi	3128	    1,228	0.0025	844.1667	ind_news_2011_00593254
21717	“Saat ini stok darah yang ada di PMI 308 kantong.	Y	pmi	3128	    1,228	0.0025	974.4444	ind_news_2011_00761163
21718	Sebab, menyumbang darah melalui PMI kepada pasien yang membutuhkan merupakan perbuatan mulia.	Y	pmi	3128	    1,228	0.0025	1170.9167	ind_news_2012_00480392
21719	Dalam pertemuan itu, Presiden juga menanyakan bagaimana makanan dan lapangan serta kondisi pemain bulutangkis yang ikut pertandingan internasional tersebut.	Y	bulutangkis	3129	    1,227	0.0025	472.4737	ind_news_2012_00145975
21720	Sama-sama tidak mengetahui perkembangan bulutangkis saat ini.	Y	bulutangkis	3129	    1,227	0.0025	688.8571	ind_news_2011_00972889
21721	Kegagalan di London bukanlah kesalahan bulutangkis yang selama ini menjadi andalan namun tidak mendapat perhatian yang lebih.	Y	bulutangkis	3129	    1,227	0.0025	826.625	ind_news_2012_00309364
21722	Banyak di antara pengurus PB PBSI yang sekarang ini tidak mengerti bulutangkis.	Y	bulutangkis	3129	    1,227	0.0025	980.25	ind_news_2011_00812400
21723	Rekan olahraga saya sempat berhenti bermain bulutangkis karena paru-paru basah.	Y	bulutangkis	3129	    1,227	0.0025	1280.6	ind_news_2012_00228915
21724	Semen-tara itu, diperoleh informasi dari sebuah sumber, Kota Tomohon saat ini banyak dijadikan investasi oleh kalangan pejabat, terutama dari luar Tomohon.	Y	tara	3129	    1,227	0.0025	542.25	ind_news_2016_00836201
21725	“Tapi itu baru laporan semen-tara yang baru saya terima.	Y	tara	3129	    1,227	0.0025	695.6667	ind_news_2016_00908087
21726	Semen-tara kegiatan ini diperkirakan akan berlangsung sampai pertengahan pekan ini.	Y	tara	3129	    1,227	0.0025	857.4	ind_news_2016_00843226
21727	Semen-tara lokasi pencairan dana peningkatan mutu pendidikan tersebut, Diknas tetap menggunakan Kantor Pos.	Y	tara	3129	    1,227	0.0025	1053.6429	ind_news_2016_00843931
21728	Semen-tara panen raya, khususnya cengkih, sudah semakin dekat.	Y	tara	3129	    1,227	0.0025	1322.8889	ind_news_2016_00844765
21729	“Hasil analisis dan kajian ini menjadi salah satu bahan evaluasi pelaksanaan Ujian Nasional 2008, baik oleh pihak guru, sekolah, maupun Dinas Kabupaten Kota yang ada di Sulut,” katanya.	Y	analisis	3130	    1,226	0.0025	392.3704	ind_news_2016_00264423
21730	Analisis sebuah organisasi guru terhadap kunci jawaban yang beredar itu menghasilkan, pada mata pelajaran Bahasa Indonesia salah tiga, 94 persen benar!	Y	analisis	3130	    1,226	0.0025	699.55	ind_news_2011_00951272
21731	Untuk selanjutnya Polda Metro Jaya akan melakukan analisis psikologis pelaku guna mengetahui apakah ada gangguan jiwa pada pelaku.	Y	analisis	3130	    1,226	0.0025	856.7647	ind_news_2012_00711737
21732	‘’Formasi yang diusulkan memang sesuai hasil analisis jabatan dan analisis beban kerja.	Y	analisis	3130	    1,226	0.0025	1011.9091	ind_news_2016_00230027
21733	Berdasarkan analisis statistik, Clinton mungkin kehilangan sekitar 30 ribu suara.	Y	analisis	3130	    1,226	0.0025	1263.1111	ind_news_2016_00089311
21734	“Kami belum bisa memastikan apakah karena bakteri atau sebab lain.	Y	bakteri	3130	    1,226	0.0025	472.4	ind_news_2012_00766013
21735	Bakteri itu ada yang berbahaya dan ada yang tidak berbahaya.	Y	bakteri	3130	    1,226	0.0025	713.7143	ind_news_2011_00133689
21736	Proses inilah yang membantu bakteri bertahan hidup.	Y	bakteri	3130	    1,226	0.0025	866	ind_news_2012_00993501
21737	Anda yakin meja kantor Anda aman dari bakteri?	Y	bakteri	3130	    1,226	0.0025	1049.4286	ind_news_2012_00320441
21738	Sebuah bisa membersihkan ponsel dari bakteri sembari mengisi daya.	Y	bakteri	3130	    1,226	0.0025	1313.6667	ind_news_2016_00782656
21739	Anda harus masuk ke ring dan mencari tahu sendiri dan itu yang akan saya lakukan, kata dia.	Y	ring	3130	    1,226	0.0025	334.25	ind_news_2011_00868645
21740	Di ring, kami harus melupakan bahwa kami teman, dan kami harus melakukan tugas masing-masing untuk menampilkan pertarungan yang bagus kepada semua orang.	Y	ring	3130	    1,226	0.0025	658.3158	ind_news_2011_00220253
21741	Penambahan ruas jalan baru di inti kota juga dapat menjadi alternatif solusi lainnya namun tampaknya masih tidak memungkinkan, karena saat ini penambahan ruas jalan yang dilakukan di Kota Medan lebih bersifat ring road.	Y	ring	3130	    1,226	0.0025	763.2857	ind_news_2012_00971932
21742	Perwira menengah kepolisian itu, menyebutkan pihaknya menempatkan 300 personel pada setiap lapisan pengamanan yang terdiri atas tiga ring di kawasan lokasi kongres.	Y	ring	3130	    1,226	0.0025	946	ind_news_2011_00313333
21743	Jalur baru adalah ring road utara Purworejo.	Y	ring	3130	    1,226	0.0025	1438.4286	ind_news_2012_00644803
21744	Kejadian tersebut terjadi saat ada seorang pencuri masuk ke lokasi mereka bekerja.	Y	pencuri	3131	    1,225	0.0025	390.25	ind_news_2011_00757256
21745	Pencuri masuk dengan merusak pintu yang terdiri dari dua bagian.	Y	pencuri	3131	    1,225	0.0025	704.1	ind_news_2011_00181912
21746	Namun saat korban mengetahui hilang langsung berteriak dan saat itu juga massa langsung mengejar dua wanita pencuri handphone tersebut.	Y	pencuri	3131	    1,225	0.0025	858.1176	ind_news_2011_00803970
21747	Sepertinya si pencuri ingin keluar dari mobil, namun malah terjebak di dalamnya.	Y	pencuri	3131	    1,225	0.0025	1023.75	ind_news_2011_00165430
21748	Dan tidak semua pencuri harus dipotong tangannya.	Y	pencuri	3131	    1,225	0.0025	1394.2857	ind_news_2011_00493402
21749	Hasil evaluasi ini membuat Anda bisa menciptakan konten yang lebih baik dari sebelumnya.	Y	konten	3132	    1,224	0.0025	502.6923	ind_news_2016_00264581
21750	Konten tersebut membantu kami, tapi saya tetap tidak bisa memprediksi masa depan, se jauh mana konsumsi konten video tersebut bergerak.	Y	konten	3132	    1,224	0.0025	668.6111	ind_news_2016_00465520
21751	Karena tanpa peran operator, SMS konten itu tidak sampai kepada konsumen.	Y	konten	3132	    1,224	0.0025	834.4545	ind_news_2012_00042977
21752	JAKARTA: PT Telkom akan meningkatkan penyerapan konten dalam negeri di bidang game yang diperkirakan dapat berkontribusi pada pertumbuhan pelanggan Internet.	Y	konten	3132	    1,224	0.0025	959.1	ind_news_2012_00186548
21753	Pengguna yang mendaftar menjadi anggota yang menjadi pembuat konten.	Y	konten	3132	    1,224	0.0025	1340.2857	ind_news_2011_00941365
21754	Dan setiap terjadi bencana di sini selalu menjadi perhatian dunia karena yang menjadi korban selalu banyak, bahkan kita berada dalam lima teratas dunia.	Y	teratas	3132	    1,224	0.0025	341.9	ind_news_2016_00140834
21755	Namun, menurut kita, isu tentang TNI dan politik mestinya tidak lagi di urutan teratas.	Y	teratas	3132	    1,224	0.0025	690.8571	ind_news_2012_00462288
21756	Kenyataan lain, Barca merupakan satu-satunya tim dalam urutan delapan besar teratas yang memenangi pertandingan minggu ini.	Y	teratas	3132	    1,224	0.0025	815.4706	ind_news_2012_00184333
21757	Hanya dua tim urutan teratas yang berhak untuk terus melaju ke putaran kedua untuk bertarung meraih tiket ke Divisi Utama.	Y	teratas	3132	    1,224	0.0025	939.5556	ind_news_2016_00256588
21758	Kasus HIV/AIDS, Kota Pontianak Teratas 50 Ribu Guru Belum Miliki Sertifikasi Pontianak.	Y	teratas	3132	    1,224	0.0025	1319.9091	ind_news_2011_00710271
21759	Presiden AS, Barack Obama, menggelar lebih dari lima kali rapat keamanan nasional yang membahas rencana serangan ke rumah tersebut.	Y	barack	3133	    1,223	0.0025	513.4737	ind_news_2011_00147489
21760	Seluruh negara bagian ini empat tahun silam telah memilih wakil Demokrat, Barack Obama.	Y	barack	3133	    1,223	0.0025	663.5385	ind_news_2016_00830942
21761	Presiden AS Barack Obama dinilai tidak ingin meluncurkan serangan terhadap Iran menjelang pemilu presiden pada 2012.	Y	barack	3133	    1,223	0.0025	808.1429	ind_news_2012_00181281
21762	Presiden AS Barack Obama secara tegas mempertahankan kesepakatan dengan Iran..	Y	barack	3133	    1,223	0.0025	931.4	ind_news_2016_00696150
21763	Sejumlah pimpinan negara, termasuk Presiden AS Barack Obama menyampaikan pandangan negaranya terkait pengurangan emisi.	Y	barack	3133	    1,223	0.0025	1242.1429	ind_news_2011_00268001
21764	Aku tak mau mengatakan apa pun karena aku tak bisa berkata apa pun yang baik tentang orang itu.	Y	berkata	3133	    1,223	0.0025	334.1429	ind_news_2016_00023795
21765	Sebagian lain bisa berkata kami kalah seperti biasanya.	Y	berkata	3133	    1,223	0.0025	632.25	ind_news_2012_00816677
21766	Mereka berkata, ”Setiap upaya untuk menyerang, bertahan, atau mundur, akan merugikan Anda.	Y	berkata	3133	    1,223	0.0025	799.25	ind_news_2011_00371472
21767	Beliau berkata, “Aku berhasil menemukan 999 cara yang gagal dalam pembuatan lampu.”	Y	berkata	3133	    1,223	0.0025	973.7273	ind_news_2016_00083396
21768	Berkata dengan perbuatan jauh lebih efektif dibanding berkata dengan ucapan.	Y	berkata	3133	    1,223	0.0025	1267.25	ind_news_2016_00093661
21769	Saat kejadian saya baru mengantar anak sekolah sehingga ibu sendiri di rumah.	Y	mengantar	3133	    1,223	0.0025	385.9167	ind_news_2011_00501478
21770	Jadi pendidikan itu tidak berhenti pada masa SMA saja, tetapi mengantar mereka menuju masa depannya.	Y	mengantar	3133	    1,223	0.0025	671	ind_news_2011_00226395
21771	Pihaknya tidak menyebutkan berapa jumlah personel yang akan diturunkan Polda Jabar saat mengantar rombongan massa ke lokasi unjuk rasa.	Y	mengantar	3133	    1,223	0.0025	825.8947	ind_news_2016_00688127
