ORDER	SENTENCE	STATUS	WORD	RANK	COUNT	COUNT_REL	INDEX	ID
21001	Menurut Johan, menuduh seseorang harus didukung oleh bukti yang lain.	Y	menuduh	3072	    1,286	0.0026	864.2	ind_news_2012_00008969
21002	Kendati demikian kata Andre, pihaknya tidak menuduh telah terjadi pungutan itu.	Y	menuduh	3072	    1,286	0.0026	968.7273	ind_news_2011_00250078
21003	Dia menuduh ketiganya yang menghabiskan minuman itu.	Y	menuduh	3072	    1,286	0.0026	1320.5714	ind_news_2011_00110168
21004	JAKARTA (Lampost): Kementerian Dalam Negeri akan membatasi kampanye oleh calon kepala daerah dan wakil kepala daerah.	Y	lampost	3073	    1,285	0.0026	592.3571	ind_news_2011_00862935
21005	Jakarta (Lampost Online) - Paling tidak ada delapan penyakit yang bisa langsung dikaitkan dengan kebiasaan seseorang di internet.	Y	lampost	3073	    1,285	0.0026	839.1765	ind_news_2011_00960310
21006	BANDAR LAMPUNG (Lampost): Bandar Lampung hingga belum memiliki perda pendidikan.	Y	lampost	3073	    1,285	0.0026	916.375	ind_news_2011_00043315
21007	Mahkamah Rakyat, Solusi Akhir Kasus Soeharto Jakarta, Lampost Online- Mahkamah rakyat akan dibentuk sebagai solusi akhir penanganan kasus Soeharto.	Y	lampost	3073	    1,285	0.0026	1055.4615	ind_news_2011_00364857
21008	Daya Saing TI Indonesia Urutan ke-14 di Asia Pasifik Jakarta, Lampost Online.	Y	lampost	3073	    1,285	0.0026	1274.9167	ind_news_2011_00546881
21009	Untuk pencari kerja di Aceh Barat sendiri hingga saat ini tercatat sebagian besar atau 60 persen lebih adalah mereka yang lulusan SMA.	Y	pencari	3073	    1,285	0.0026	427.4762	ind_news_2012_00101846
21010	Sayangnya, selama ini perusahaan sering mengalami kesulitan mencari sumber daya manusia (SDM) yang berkualitas sesuai kebutuhan perusahaan, padahal jumlah pencari kerja sangat banyak.	Y	pencari	3073	    1,285	0.0026	629.3636	ind_news_2016_00752016
21011	“Tim pencari bakat Liverpool sudah di Valencia dan berbicara dengan banyak orang dari klub itu tetapi mereka terlalu banyak pertimbangan.	Y	pencari	3073	    1,285	0.0026	814.0526	ind_news_2011_00093064
21012	Dia menjelaskan bursa kerja khusus memiliki nilai penting dan strategis untuk mempercepat penempatan tenaga kerja secara praktis, efisien dan efektif serta membantu pencari kerja agar menemukan pekerjaan yang diinginkan.	Y	pencari	3073	    1,285	0.0026	958.6923	ind_news_2012_00132936
21013	PURWOREJO - Kabar gembira bagi para pencari kerja.	Y	pencari	3073	    1,285	0.0026	1356.8571	ind_news_2012_00178500
21014	Saat Jakarta dilanda banjir besar pada 2002 lalu, tercatat ada tujuh orang korban meninggal dunia karena penyakit ini.	Y	dilanda	3074	    1,284	0.0026	431.9412	ind_news_2012_00276806
21015	Apalagi saat ini Sulut sedang dilanda krisis listrik.	Y	dilanda	3074	    1,284	0.0026	651.75	ind_news_2016_00040934
21016	Setelah dilanda berbagai bencana, seperti gempa bumi, banjir dan sebagainya justru punya dampak positif.	Y	dilanda	3074	    1,284	0.0026	790.0714	ind_news_2011_00159821
21017	Di beberapa kabupaten kerap dilanda banjir, imbuhnya.	Y	dilanda	3074	    1,284	0.0026	955.8571	ind_news_2011_00425071
21018	Ia dilanda duka dan rasa kehilangan yang mendalam.	Y	dilanda	3074	    1,284	0.0026	1298.75	ind_news_2012_00299012
21019	Salah satu hal yang menyebabkan pertumbuhan market di Indonesia yakni kenaikan harga barang per unit.	Y	market	3074	    1,284	0.0026	429.8667	ind_news_2016_00730495
21020	Market teknologi generasi muda di Indonesia juga tercatat sangat besar mencapai Rp20 triliun,” terangnya.	Y	market	3074	    1,284	0.0026	633.2143	ind_news_2012_00257222
21021	Dia tetap sering belanja ke super market yang kebetulan dekat dengan kantor kami.	Y	market	3074	    1,284	0.0026	728.8462	ind_news_2012_00262590
21022	Bahkan di gunung pun sekarang ada mini market.	Y	market	3074	    1,284	0.0026	911	ind_news_2011_00420753
21023	Sebe-lum meraih target market yang lebih besar.	Y	market	3074	    1,284	0.0026	1312.375	ind_news_2016_00777383
21024	Dia menegaskan, respons itu tidak hanya dari pemerintah, namun juga dari partai politik.	Y	respons	3074	    1,284	0.0026	350.1667	ind_news_2016_00173029
21025	Pengajuan bantuan ke Pemerintah Pusat dalam beberapa tahun terakhir belum mendapat respons.	Y	respons	3074	    1,284	0.0026	597.6667	ind_news_2012_00005662
21026	Ternyata, paket tersebut mendapat respons luar biasa.	Y	respons	3074	    1,284	0.0026	755.5714	ind_news_2011_00262232
21027	Apalagi Bupati Sambas sudah memberikan respons yang positif.	Y	respons	3074	    1,284	0.0026	938.5	ind_news_2012_00651081
21028	Terkait tuntutan dari koalisi aktivis dan akademisi tersebut, Hillary Clinton belum memberikan respons.	Y	respons	3074	    1,284	0.0026	1377.4615	ind_news_2016_00927691
21029	Menurut dia, dengan adanya dokter spesialis, pelayanan terhadap masyarakat di setiap pulau bisa lebih maksimal.	Y	spesialis	3074	    1,284	0.0026	434.0667	ind_news_2016_00523779
21030	Wartawan saja harus ada yang spesialis,tuturnya.	Y	spesialis	3074	    1,284	0.0026	664.4286	ind_news_2012_00797741
21031	Sebab, kata pemain spesialis umpan ini, dirinya sudah beberapa kali mengunjungi Cirebon.	Y	spesialis	3074	    1,284	0.0026	834.6667	ind_news_2016_00763566
21032	“Terbukti sejak pendaftaran dibuka sejauh ini dokter spesialis yang mendaftar baru 35 orang.	Y	spesialis	3074	    1,284	0.0026	955.1667	ind_news_2012_00121152
21033	Di dalam perumahan telah tersedia klub olahraga, klinik spesialis St.	Y	spesialis	3074	    1,284	0.0026	1324.1	ind_news_2011_00090322
21034	Seperti tahun lalu dengan tiga tim dari Iran mereka tampil sangat dominan, tapi tahun 2016 ini, tim dari Iran hanya ada satu.	Y	dominan	3075	    1,283	0.0026	319.1765	ind_news_2016_00860798
21035	Karena itu, si wanita akan lebih banyak bersikap dominan memutuskan berbagai hal.	Y	dominan	3075	    1,283	0.0026	645.6667	ind_news_2011_00974815
21036	Selain itu, Portugal juga sangat dominan dalam hal jumlah tembakan.	Y	dominan	3075	    1,283	0.0026	797.1	ind_news_2016_00817706
21037	Sektor perdagangan, hotel dan restoran serta sektor jasa-jasa yang cukup dominan dalam struktur perekonomian DIJ juga mampu tumbuh meyakinkan.	Y	dominan	3075	    1,283	0.0026	904.0556	ind_news_2016_00809121
21038	Kita ingat, dulu saham Grup Bakrie cukup dominan,’’ paparnya.	Y	dominan	3075	    1,283	0.0026	1302.7778	ind_news_2016_00455831
21039	Menurut dia, dengan hasil yang diraih saat ini, pihaknya dalam hal ini PBSI akan segera melakukan evaluasi kepada seluruh pemain maupun jajaran pelatih yang ada saat ini.	Y	pbsi	3075	    1,283	0.0026	410.3913	ind_news_2011_00601702
21040	Kejuaraan ini sekaligus sebagai rangkaian peringatan hari ulang tahun Pertamina yang ke-59 di samping sebagai upaya mendukung program pembinaan PP PBSI.	Y	pbsi	3075	    1,283	0.0026	742.9	ind_news_2016_00421991
21041	“Secepatnya melaporkan hasil seleksi, karena waktu yang singkat ini PBSI Sulut akan mempersiapkan tim untuk mengikuti kualifikasi Pra PON yang digelar di Gorontalo, 4 Juli nanti.	Y	pbsi	3075	    1,283	0.0026	859	ind_news_2016_00785773
21042	Melihat situasi ini, ia menilai kepengurusan PBSI tidak mengarah pada perbaikan.	Y	pbsi	3075	    1,283	0.0026	967.2727	ind_news_2016_00508121
21043	Meski merasa berat meninggalkan PBSI, Hendra merasa sudah waktunya untuk meninggalkan Pelatnas PBSI.	Y	pbsi	3075	    1,283	0.0026	1316.8	ind_news_2016_00558518
21044	Itu dilakukan karena yang terjadi di masyarakat sudah sangat mengkhawatirkan.	Y	mengkhawatirkan	3076	    1,282	0.0026	339.8	ind_news_2012_00683576
21045	Saya justru sangat mengkhawatirkan nasib siswa miskin yang diterima dengan nilai di bawah standar.	Y	mengkhawatirkan	3076	    1,282	0.0026	653.9286	ind_news_2012_00807346
21046	Pelaku industri pembiayaan tidak terlalu mengkhawatirkan langkah perbankan nasional yang akan membatasi kredit ke sektor otomotif, meskipun selama ini sumber pendanaan utama industri ini berasal dari bank.	Y	mengkhawatirkan	3076	    1,282	0.0026	782.2	ind_news_2012_00275167
21047	Organisasi itu pada Juni lalu mengecam peningkatan jumlah eksekusi di Irak yang dianggap cukup mengkhawatirkan.	Y	mengkhawatirkan	3076	    1,282	0.0026	929.6667	ind_news_2012_00832302
21048	Relatif tenang dan jauh dari gejolak yang mengkhawatirkan.	Y	mengkhawatirkan	3076	    1,282	0.0026	1280.875	ind_news_2012_00532957
21049	Namun bukan berarti program-program yang ada di TV nasional tidak dapat di re-produksi kembali.	Y	re	3076	    1,282	0.0026	483.0714	ind_news_2012_00739544
21050	Mungkin bisa siapa saja, keluarga, teman ataupun re-kan bisnis.	Y	re	3076	    1,282	0.0026	691	ind_news_2016_00572321
21051	Menurutnya hal tersebut merupakan hal penting, khususnya di era re-formasi sekarang ini.	Y	re	3076	    1,282	0.0026	733.0833	ind_news_2016_00532698
21052	Pihaknya akan menjadikan Asia sebagai prioritas tim asuransi mobil, kata Swiss Re.	Y	re	3076	    1,282	0.0026	963.5	ind_news_2011_00875472
21053	Sarundajang mengakui bah-wa Sondakh merupakan re-kan, teman dan sahabat se-perjuangan di masa sekolah.	Y	re	3076	    1,282	0.0026	1148.4375	ind_news_2016_00739660
21054	Untuk itu, sebagai pemimpin daerah dirinya akan terus mencari terobosan dan juga kerjasama dengan pihak lain agar program tersebut bisa terus berjalan di Kabupaten Indramayu.	Y	indramayu	3077	    1,281	0.0026	414.2917	ind_news_2016_00965699
21055	INDRAMAYU (Suara Karya): Partai Golkar sebagai partai peraih suara terbanyak pada pemilu lalu di Kabupaten Indramayu berpeluang meraih kemenangan pada pemilihan kepala daerah (Pilkada) kabupaten ini bulan Agustus 2010 nanti.	Y	indramayu	3077	    1,281	0.0026	668.625	ind_news_2012_00379526
21056	Saat ini, jumlah daftar tunggu calon jamaah haji asal Kabupaten Indramayu seluruhnya sekitar 23 ribu orang.	Y	indramayu	3077	    1,281	0.0026	827	ind_news_2016_00722063
21057	Jadwal beliau padat dan tidak bisa ditinggalkan karena beliau pimpinan pesantren, kata Ali, yang mengaku berangkat dari Indramayu.	Y	indramayu	3077	    1,281	0.0026	991.7059	ind_news_2011_00384317
21058	Harga BBM Naik, Banyak Nelayan Alih Profesi INDRAMAYU, (PRLM) - Para nelayan di Kab.	Y	indramayu	3077	    1,281	0.0026	1284.0833	ind_news_2011_00999207
21059	Sementara itu, selama proses pemadaman terlihat banyak warga yang melihat langsung di lokasi kejadian.	Y	pemadaman	3077	    1,281	0.0026	360.2857	ind_news_2011_00490618
21060	Tak hanya itu, kata dia, kepada pihak PLN dapat memperhatikan masih terjadinya pemadaman listrik di Talaud.	Y	pemadaman	3077	    1,281	0.0026	615.0625	ind_news_2012_00523562
21061	MEDAN - Pemadaman listrik di Sumatera Utara (Sumut) kembali terjadi.	Y	pemadaman	3077	    1,281	0.0026	750.6667	ind_news_2011_00135727
21062	Ia meminta agar PLN dapat membatalkan rencana pemadaman tersebut.	Y	pemadaman	3077	    1,281	0.0026	867	ind_news_2016_00277159
21063	Apalagi pemadaman yang akan dila-kukan bertepatan dengan hari raya keagamaan,” ujarnya.	Y	pemadaman	3077	    1,281	0.0026	1319.3333	ind_news_2016_00040333
21064	Jika dibandingkan dengan tahun lalu, kasus penyalahgunaan BBM tahun ini jauh lebih banyak.	Y	penyalahgunaan	3077	    1,281	0.0026	417.5	ind_news_2012_00111345
21065	Tindakan penyalahgunaan profesi, menurut Dewan Pers, adalah segala tindakan yang mengambil keuntungan pribadi atas informasi yang diperoleh saat bertugas sebelum informasi tersebut menjadi pengetahuan umum.	Y	penyalahgunaan	3077	    1,281	0.0026	735.3182	ind_news_2012_00614187
21066	Kedua, juga gagal dalam mengamankan warga sipil dari ancaman senjata api, tanpa kecuali penyalahgunaan senjata api diberi ancaman hukuman berat UU Darurat No.	Y	penyalahgunaan	3077	    1,281	0.0026	871.15	ind_news_2011_00215666
21067	Ribuan Remaja Rawan Narkoba JAKARTA (Suara Karya): Penyalahgunaan narkoba di kalangan remaja Ibu Kota kian memprihatinkan.	Y	penyalahgunaan	3077	    1,281	0.0026	1018.6429	ind_news_2011_00152199
21068	Dengan demikian, merokok lebih berbahaya daripada virus HIV/AIDS, penyalahgunaan obat terlarang, kecelakaan lalu-lintas, maupun kejahatan (pembunuhan).	Y	penyalahgunaan	3077	    1,281	0.0026	1355.6111	ind_news_2011_00089909
21069	Bagaimana mungkin orang yang tidak melakukan pembunuhan, tapi dituduh melakukan pembunuhan karena saat itu berada dengan mereka ujarnya.	Y	dituduh	3078	    1,280	0.0026	366.6875	ind_news_2012_00758295
21070	“Katanya di hadapan majelis hakim, saya tidak pernah bekerja di keluarga mereka, yang sidang ketiga saya malah dituntut membayar ganti-rugi karena dituduh melarikan diri dan bekerja di tempat lain,” ujarnya.	Y	dituduh	3078	    1,280	0.0026	717.963	ind_news_2011_00162768
21071	Bahkan saat dilakukan dialog, menteri agama marah karena dituduh korupsi.	Y	dituduh	3078	    1,280	0.0026	843.3	ind_news_2012_00890917
21072	Lagi-lagi, masyarakat khususnya penduduk lokal mudah dituduh sebagai kambing hitam.	Y	dituduh	3078	    1,280	0.0026	998.9	ind_news_2011_00728986
21073	Pertama, Muhaimin dituduh ingin maju menjadi capres 2009.	Y	dituduh	3078	    1,280	0.0026	1424.4286	ind_news_2012_00136600
21074	Namun menurutnya, dengan kondisi ekonomi seperti saat ini, sulit ada yang menyumbang mencapai Rp 10 miliar.	Y	menyumbang	3078	    1,280	0.0026	331.1333	ind_news_2011_00873364
21075	Meski dibangun oleh pihak swasta, proyek ini juga dibantu oleh pemerintah yang menyumbang uang sekitar US$ 229 juta.	Y	menyumbang	3078	    1,280	0.0026	588.25	ind_news_2011_00440428
21076	Padahal biaya BBM ini menyumbang 30 persen terhadap operasional pesawat.	Y	menyumbang	3078	    1,280	0.0026	724.8889	ind_news_2011_00252386
21077	“Paling tiket hanya menyumbang 20% pendapatan saja,” tambahnya.	Y	menyumbang	3078	    1,280	0.0026	971.1429	ind_news_2016_00629270
21078	“Di tengah-tengah naiknya harga obat-obatan dan biaya pengobatan, ternyata dokter spesialis mampu menyumbang inflasi,” tambahnya.	Y	menyumbang	3078	    1,280	0.0026	1251.4375	ind_news_2016_00213444
21079	Saya punya ba-nyak teman di seluruh dunia dan akan selalu melakukan-nya.	Y	nyak	3078	    1,280	0.0026	483.9231	ind_news_2016_00753524
21080	“Semakin ba-nyak calon dari partai kita, se-makin bagus.	Y	nyak	3078	    1,280	0.0026	670	ind_news_2016_00831307
21081	Pasalnya, selain masih ba-nyak penataan fisik yang belum dilakukan hingga kini, dasar hukum dalam bentuk perda Adipura juga belum dibentuk oleh pemkab.	Y	nyak	3078	    1,280	0.0026	798.5455	ind_news_2011_00193439
21082	Padahal masih banyak alternatif misalnya dengan mengurangi belanja negara un-tuk hal-hal yang tidak prioritas, menambah produktivitas mi-nyak dalam negeri juga menyita aset para koruptor.	Y	nyak	3078	    1,280	0.0026	948.5769	ind_news_2016_00619650
21083	Tidak usah ba-nyak berjanji, tetapi bukti yang masyarakat cari,” terangnya.	Y	nyak	3078	    1,280	0.0026	1280.9091	ind_news_2016_00945559
21084	Tak sampai lama, para saksi dan mobil korban dibawa ke Mapolres untuk dilakukan pemeriksaan lebih lanjut.	Y	mapolres	3079	    1,279	0.0026	394	ind_news_2011_00193697
21085	Kedua kendaraan diamankan ke Mapolres lama Kulonprogo sebagai barang bukti untuk pemeriksaan lebih lanjut.	Y	mapolres	3079	    1,279	0.0026	692.7857	ind_news_2012_00958625
21086	Sedangkan sejumlah barang bukti, kini diamankan di Mapolres Tegal untuk kepentingan pemeriksaan.	Y	mapolres	3079	    1,279	0.0026	853.1667	ind_news_2011_00010564
21087	Kini SU ditahan di Mapolres Serang untuk menjalani proses hukum.	Y	mapolres	3079	    1,279	0.0026	988.3	ind_news_2011_00088507
21088	Keduanya dimintai keterangan di Mapolres Gunungkidul, kemarin.	Y	mapolres	3079	    1,279	0.0026	1289.5714	ind_news_2016_00415720
21089	Selain merupakan peluang emas bagi Indonesia untuk memperluas kerja sama, juga untuk peningkatan investasi dari industri Jepang yang sudah ada maupun yang baru.	Y	memperluas	3079	    1,279	0.0026	349.9048	ind_news_2012_00049927
21090	Menurut dia, negara-negara di kawasan Asean terus berjuang untuk mengurangi angka kemiskinan dan memperluas lapangan pekerjaan.	Y	memperluas	3079	    1,279	0.0026	695.8125	ind_news_2012_00312921
21091	Langkah ini untuk memperluas lini produk di pasar kendaraan listrik mewah.	Y	memperluas	3079	    1,279	0.0026	829.8182	ind_news_2016_00475688
21092	Menurut dia, peran Wiranto sebagai menteri, sebetulnya juga bisa mempermudah akses ke daerah-daerah dengan tujuan memperluas pembinaan.	Y	memperluas	3079	    1,279	0.0026	1000.0588	ind_news_2016_00525037
21093	Kedua, memperluas dan mempermudah masyarakat mengakses pendidikan.	Y	memperluas	3079	    1,279	0.0026	1419.4286	ind_news_2012_00115920
21094	Dan tentu saja akan mendapatkan poin ter-sendiri dari para peserta WOC untuk di kemudian hari akan datang ke daerah ini.	Y	woc	3079	    1,279	0.0026	299.6	ind_news_2011_00397291
21095	Dia juga berharap kegiatan ini dapat menunjang pelaksanaan WOC 2009 maupun Manado Kota Pariwisata Dunia.	Y	woc	3079	    1,279	0.0026	619.0714	ind_news_2016_00168887
21096	“Apalagi tahun depan ada agenda WOC di mana banyak tamu pen-ting dari luar negeri.	Y	woc	3079	    1,279	0.0026	784.5333	ind_news_2016_00041681
21097	Rencana pelaksanaan WOC tahun 2009, merupakan salah satu impian Sarundajang untuk mengangkat citra Sulut di dunia inter-nasional.	Y	woc	3079	    1,279	0.0026	907.1176	ind_news_2012_00125811
21098	Ini dilakukan sebagai ben-tuk dukungan terhadap WOC.	Y	woc	3079	    1,279	0.0026	1066.875	ind_news_2016_00301865
21099	Sekarang aturan itu sudah dicabut atau tidak, kan masih menunggu kebijakan ketua umum,” ujarnya.	Y	dicabut	3080	    1,278	0.0026	396.8571	ind_news_2011_00197255
21100	Misalnya, Garuda yang pernah terbang ke Amerika namun saat dilakukan pemeriksaan mendadak dianggap ada ketentuan yang tidak sesuai maka izin penerbangan ke Amerika bisa dicabut.	Y	dicabut	3080	    1,278	0.0026	665.4545	ind_news_2016_00564864
21101	Saat ini, katanya, prosesnya sudah cukup mengalami kemajuan karena tuntutan pengadilan dari pemegang saham lama sudah dicabut.	Y	dicabut	3080	    1,278	0.0026	822.3125	ind_news_2012_00290287
21102	Larangan terhadap pemain ISL untuk memperkuat timnas Indonesia pun akhirnya dicabut.	Y	dicabut	3080	    1,278	0.0026	1001.8182	ind_news_2012_00751145
21103	Apabila terjadi pelanggaran, izin pemasukan hasil perikanan dicabut.	Y	dicabut	3080	    1,278	0.0026	1344	ind_news_2012_00654437
21104	Apa yang dianggap sebagian besar orang-orang hari ini belum tentu benar di mata Allah SWT.	Y	swt	3080	    1,278	0.0026	444	ind_news_2016_00043125
21105	Kita hanya bisa berharap tetapi yang menentukan adalah Allah Swt. Kita adalah manusia yang tidak punya kemampuan untuk itu, hanya doa yang bisa kita sampaikan, mudah-mudahan amal yang kita lakukan di bulan Ramadhan ini diterima-Nya.	Y	swt	3080	    1,278	0.0026	774.1071	ind_news_2012_00631910
21106	Tetapi ini kita lakukan karena Allah SWT semata,” ucapnya.	Y	swt	3080	    1,278	0.0026	947	ind_news_2016_00936402
21107	Sebab, aktivitas membaca merupakan suatu perintah dari Allah SWT melalui Alquran.	Y	swt	3080	    1,278	0.0026	1114.0909	ind_news_2011_00086112
21108	Bahkan sangat bernilai di hadapan Allah SWT.	Y	swt	3080	    1,278	0.0026	1377.1429	ind_news_2016_00065930
21109	Ini sudah ada di Jakarta sejak empat tahun lalu dan berlokasi di Jalan Sultan Agung No.	Y	berlokasi	3081	    1,277	0.0026	483.9333	ind_news_2011_00839774
21110	P4 bukan satu-satunya tempat ibadah shalat di gedung yang berlokasi di pusat kota Jakarta ini.	Y	berlokasi	3081	    1,277	0.0026	639.7333	ind_news_2016_00613778
21111	Cabang yang sudah beroperasi berlokasi a.l. di Medan, Jambi, Pekan Baru, Lampung, Bandung, Jakarta, Semarang, Surabaya.	Y	berlokasi	3081	    1,277	0.0026	782.6471	ind_news_2012_00139673
21112	Fasilitas senjata itu disebutkan berlokasi di wilayah Gaza Utara, sedangkan jembatan teror dan lokasi-lokasi aktivitas teror lainnya berlokasi di selatan di ujung wilayah Palestina.	Y	berlokasi	3081	    1,277	0.0026	966.1053	ind_news_2012_00959440
21113	Di antaranya BCA, BRI, Bank Jatim yang berlokasi di Jalan Ahmad Yani.	Y	berlokasi	3081	    1,277	0.0026	1201	ind_news_2011_00813553
21114	Pemerintah,kata dia, tidak ingin harga BBM naik dan turun atau bergerak mengikuti harga pasar secara drastis.	Y	drastis	3081	    1,277	0.0026	417.1875	ind_news_2016_00654025
21115	Dengan begitu, dinamika perekonomian masyarakat menengah dan bawah juga tak langsung mengalami penurunan yang drastis.	Y	drastis	3081	    1,277	0.0026	716.1333	ind_news_2012_00749662
21116	Hal ini menyebabkan harga cabai tidak hanya normal tetapi mengalami penurunan drastis.	Y	drastis	3081	    1,277	0.0026	816.9167	ind_news_2012_00879892
21117	Namun suatu hari hidupnya berubah drastis lantaran kesalahan orang lain.	Y	drastis	3081	    1,277	0.0026	960.3	ind_news_2012_00820788
21118	“Dukungan kepada Basuki Tjahaja Purnama (Ahok) dalam lima bulan terakhir menurun drastis.	Y	drastis	3081	    1,277	0.0026	1288.9167	ind_news_2016_00220054
21119	Namun sistem negara dan pemerintahan berbeda dengan China,” jelas Jang.	Y	jang	3081	    1,277	0.0026	559.9	ind_news_2011_00310310
21120	Namun, Nenek Jang mengingatkan bahwa hingga saat itu datang, keduanya tetap harus bekerja keras seperti biasanya supaya bisa menghargai arti uang.	Y	jang	3081	    1,277	0.0026	759.5714	ind_news_2012_00558316
21121	Tidak sedikit jang membutuhkan tempat jang dimaksud di atas.	Y	jang	3081	    1,277	0.0026	833.375	ind_news_2016_00944913
21122	Bersama-sama, keduanya masuk untuk menemui Nenek Jang demi membicarakan masalah penting.	Y	jang	3081	    1,277	0.0026	1052.8333	ind_news_2011_00329773
21123	Jadi kita tidak perlu berkomentar pan-jang lebar,” imbuhnya.	Y	jang	3081	    1,277	0.0026	1278.4444	ind_news_2016_00329585
21124	Sikap tegas itu akan dilakukan dengan tidak lagi mengirim praja - praja dari Sumatera Utara pada tahun - tahun mendatang.	Y	praja	3081	    1,277	0.0026	504.5625	ind_news_2011_00615018
21125	Pemeriksaan akan dilakukan terhadap praja tingkat I-III saja.	Y	praja	3081	    1,277	0.0026	603.5556	ind_news_2016_00652697
21126	Namun untuk segala hal terkait dengan kematian praja itu, tambahnya, pihaknya tidak berwenang lagi.	Y	praja	3081	    1,277	0.0026	706.8571	ind_news_2011_00732937
21127	Agar masing-masing praja bisa belajar kebiasaan suku lain lewat praja lainnya.	Y	praja	3081	    1,277	0.0026	826.7	ind_news_2012_00123000
21128	Bah-kan praja hanya memperoleh satu potong pakaian dinas, dari empat yang dijanjikan.	Y	praja	3081	    1,277	0.0026	1188.0769	ind_news_2016_00065343
21129	Kondisi hari ini, kata dia, keadaan dunia pendidikan di Indonesia sudah masuk skema pasar internasional atau diserahkan ke mekanisme pasar internasional.	Y	skema	3081	    1,277	0.0026	445.5263	ind_news_2012_00608399
21130	Dengan skema tersebut, tambahnya, perseroan berhasil melampaui target hasil investasi pada tahun lalu sebesar Rp713 miliar.	Y	skema	3081	    1,277	0.0026	695.75	ind_news_2012_00160538
21131	Lewat skema ini warga dapat mengakses data dari mana pun secara transparan.	Y	skema	3081	    1,277	0.0026	844.5	ind_news_2016_00483526
21132	Mereka mengklaim, skema tarif XL yang menawarkan tarif telepon, SMS, dan layanan internet murah lebih cocok untuk pasar anak muda dibanding kelompok usia yang lain.	Y	skema	3081	    1,277	0.0026	966.9565	ind_news_2012_00309003
21133	Skema yang akan diajukan diantaranya fasilitas kebijakan fiskal, moneter dan lain-lain.	Y	skema	3081	    1,277	0.0026	1249.3636	ind_news_2011_00513736
21134	“Khusus yang hanya mengunjungi kantor OJK di tahun lalu se-banyak 157 orang.	Y	ojk	3082	    1,276	0.0026	488.1667	ind_news_2016_00450717
21135	Ke depan, lanjutnya, persoalan kekurangan SDM tersebut akan menjadi salah satu fokus kerja dari OJK.	Y	ojk	3082	    1,276	0.0026	657.2667	ind_news_2012_00307563
21136	Ia menjelaskan, beberapa kali OJK juga melakukan sosialisasi dan edukasi para jurnalis di berbagai daerah.	Y	ojk	3082	    1,276	0.0026	763.6667	ind_news_2016_00282205
21137	Sementara itu, salah satu pejabat bank sentral yang enggan disebut namanya mengungkapkan dalam pembahasan RUU OJK, Bank Indonesia praktis tak dilibatkan.	Y	ojk	3082	    1,276	0.0026	958.75	ind_news_2012_00966511
21138	Karenanya OJK ingin ambil bagian di dalamnya.	Y	ojk	3082	    1,276	0.0026	1322.5714	ind_news_2016_00401663
21139	Para warga asing ini masuk ke Indonesia melalui sebuah sponsor atau perusahaan PT.	Y	sponsor	3082	    1,276	0.0026	361.4615	ind_news_2012_00707199
21140	Biasanya, lanjut dia, sponsor yang mendatangkan pemain asing ke Indonesia tersebut adalah federasi sepak bola masing-masing negara, dalam hal ini adalah PSSI.	Y	sponsor	3082	    1,276	0.0026	611.1429	ind_news_2012_00485570
21141	Juri akan memilih tiga pemenang yang masing-masing akan mendapatkan sponsor senilai Rp 30 juta untuk rencana penelitian yang diajukan, katanya.	Y	sponsor	3082	    1,276	0.0026	743.2941	ind_news_2011_00630155
21142	Bahkan beberapa peserta mendapatkan sponsor dari produk pengusaha batik di Pekalongan.	Y	sponsor	3082	    1,276	0.0026	887.3636	ind_news_2012_00592761
21143	Mal-nya pemprov apa bapak? atau pesan sponsor?	Y	sponsor	3082	    1,276	0.0026	1270.25	ind_news_2011_00868006
21144	Pihaknya masih akan menunggu hasil dari seluruh pertemuan tersebut sebelum akhirnya mengambil Seperti diketahui, selama ini banyak perusahaan negara yang membutuhkan dana besar baik untuk ekspansi maupun kegiatan operasional.	Y	ekspansi	3083	    1,275	0.0026	328.6552	ind_news_2011_00124462
21145	“Ke depan, kami akan lebih ekspansi dalam bisnis kendaraan bermotor.	Y	ekspansi	3083	    1,275	0.0026	663.7	ind_news_2012_00201552
21146	“Ini untuk meningkatkan kepercayaan global demi ekspansi bisnis perusahaan.”	Y	ekspansi	3083	    1,275	0.0026	805.7778	ind_news_2012_00837022
21147	Terkait ekspansi, perseroan sambungnya, terus menerus mencari rekan kerja dari produsen dalam negeri maupun luar negeri.	Y	ekspansi	3083	    1,275	0.0026	983.4	ind_news_2012_00551913
21148	Perbankan syariah juga sedang gencar ekspansi cabang.	Y	ekspansi	3083	    1,275	0.0026	1375.1429	ind_news_2012_00415993
21149	Sedangkan untuk memperpanjang waktu tersebut membutuhkan waktu lama, sehingga tenaga kerja beberapa hari tidak bekerja.	Y	memperpanjang	3083	    1,275	0.0026	408.6429	ind_news_2011_00827446
