ORDER	SENTENCE	STATUS	WORD	RANK	COUNT	COUNT_REL	INDEX	ID
21460	Sementara di Dewan Kota (Dekot) Manado dia menyatakan pindah ke Fraksi Partai Golkar (F-PG).	Y	dekot	3105	    1,253	0.0026	676.8667	ind_news_2016_00833610
21461	Sejauh ini belum ada penjelasan resmi dari pimpinan Dekot Manado yang belum berhasil ditemui untuk konfirmasi.	Y	dekot	3105	    1,253	0.0026	756.8667	ind_news_2016_00802092
21462	“Kami siap membawa rekaman itu kepada Dekot.	Y	dekot	3105	    1,253	0.0026	899.4286	ind_news_2016_00384100
21463	Belum masuknya draf tersebut membuat sejumlah anggota dekot angkat bicara.	Y	dekot	3105	    1,253	0.0026	1263.9	ind_news_2012_00098732
21464	Semua ini terjadi karena adanya kondisi yang secara khusus diciptakan di tempat tersebut.	Y	diciptakan	3105	    1,253	0.0026	331.6154	ind_news_2012_00065527
21465	Lagu ini bisa diciptakan berdasarkan pengalaman pribadi atau orang lain.	Y	diciptakan	3105	    1,253	0.0026	632	ind_news_2016_00472385
21466	Madura United main bagus banyak peluang, perjuangan mereka luar biasa, sayangnya peluang yang diciptakan tidak masuk, akhirnya kami kalah.	Y	diciptakan	3105	    1,253	0.0026	799.7222	ind_news_2016_00488582
21467	Ia hanya mau menjawab pertanyaan para awak media seputar lagu baru yang diciptakan oleh suaminya.	Y	diciptakan	3105	    1,253	0.0026	948.9333	ind_news_2012_00085153
21468	Efek Rumah Kaca membuktikan pasar bisa diciptakan.	Y	diciptakan	3105	    1,253	0.0026	1222.5714	ind_news_2016_00221988
21469	Karena gubernur itu adalah milik seluruh rakyat di Jatim,” terang Amin.	Y	amin	3106	    1,252	0.0026	557.2727	ind_news_2011_00111310
21470	Diakui Amin, untuk obat penyakit tersebut tidak ada.	Y	amin	3106	    1,252	0.0026	753.625	ind_news_2016_00170295
21471	Selain itu Amin menegaskan, NTB siap meningkatkan produksi pertanian dengan memperhatikan kesejahteraan para petani.	Y	amin	3106	    1,252	0.0026	849.5714	ind_news_2016_00811757
21472	Amin juga diprediksi menjadi salah satu kandidat yang bakal maju dalam Pilgub NTB 2018.	Y	amin	3106	    1,252	0.0026	1064.3077	ind_news_2016_00028433
21473	Meskipun melarang, Amin mengimbau seluruh umat Islam untuk menjaga kerukunan umat beragama.	Y	amin	3106	    1,252	0.0026	1351.3636	ind_news_2012_00845151
21474	Sementara untuk jenis BBM lainnya, seperti solar dan minyak tanah, menurut Nasution yang baru beberapa minggu bertugas di Manado ini, dalam kondisi aman.	Y	nasution	3106	    1,252	0.0026	497.4783	ind_news_2016_00847349
21475	Dalam hal ini terkait dengan seseorang yang bernama Al Amin Nasution.	Y	nasution	3106	    1,252	0.0026	822.4545	ind_news_2011_00766370
21476	Dan kurang lebih Rp 67 juta ditemukan di kendaraan AN (Amin Nasution),” kata Ketua KPK Antasari Azhar.	Y	nasution	3106	    1,252	0.0026	926.6875	ind_news_2016_00138076
21477	H Sofyan Nasution, warga sekitar mengatakan, saat kejadian korban bersama anaknya Nur Eka (32).	Y	nasution	3106	    1,252	0.0026	1074.7692	ind_news_2016_00271987
21478	Itu diakui dan ditegaskan oleh Ketua BPK Anwar Nasution.	Y	nasution	3106	    1,252	0.0026	1296.6667	ind_news_2011_00618764
21479	Lahan yang saat ini ada katanya merupakan hak dasar masing-masing yang akan diberikan pemerintah kepada transmigrasi.	Y	transmigrasi	3106	    1,252	0.0026	377.2667	ind_news_2011_00217300
21480	Hal ini bisa dilihat dari data dinas tenaga kerja dan transmigrasi Provinsi DIY 2010.	Y	transmigrasi	3106	    1,252	0.0026	614.0769	ind_news_2012_00856902
21481	“Dari zaman dulu transmigrasi adalah hal yang biasa.	Y	transmigrasi	3106	    1,252	0.0026	763.625	ind_news_2011_00320864
21482	Hutan alam berkurang karena ada keperluan pihak lain yang memerlukan lahan hutan misalnya untuk transmigrasi, perkebunan, pertambangan, pengembangan wilayah dan keperluan lain.	Y	transmigrasi	3106	    1,252	0.0026	901.4211	ind_news_2012_00228188
21483	Keterampilan tersebut diharapkan dapat berguna di lokasi transmigrasi.	Y	transmigrasi	3106	    1,252	0.0026	1273.75	ind_news_2016_00441079
21484	Menurut dia, dengan rumah sakit ini diharapkan para pekerja tidak membutuhkan waktu lama untuk mendapat akses pelayanan kesehatan, sehingga juga dapat meningkatkan produktivitas pekerja.	Y	produktivitas	3107	    1,251	0.0026	393.0435	ind_news_2012_00520824
21485	Pola seperti inilah yang membuat produktivitas sektor pertanian tidak mengalami peningkatan.	Y	produktivitas	3107	    1,251	0.0026	692.1818	ind_news_2016_00691577
21486	Program ini bertujuan untuk meningkatkan produktivitas kendaraan.	Y	produktivitas	3107	    1,251	0.0026	839.4286	ind_news_2016_00700406
21487	Tujuannya untuk meningkatkan status kesehatan gizi pekerja perempuan, demi mencapai produktivitas yang maksimal.	Y	produktivitas	3107	    1,251	0.0026	976.8462	ind_news_2012_00569077
21488	Padahal, kemerdekaan suatu bangsa harus diisi dengan produktivitas warganya!	Y	produktivitas	3107	    1,251	0.0026	1322.8889	ind_news_2011_00740628
21489	Emas yang kembali ke negara Amerika Selatan itu bernilai sekitar sembilan miliar dolar AS, kata para pejabat Senin malam.	Y	bernilai	3108	    1,250	0.0026	422.9474	ind_news_2012_00610026
21490	Berdasarkan pantauan Waspada Online tidak ada terlihat satu anggota DPRD di gedung yang bernilai Rp 185 miliar.	Y	bernilai	3108	    1,250	0.0026	637.625	ind_news_2012_00571732
21491	Diperkirakan banyak benda bernilai sejarah yang bisa diamankan dari kapal asing itu.	Y	bernilai	3108	    1,250	0.0026	804.5	ind_news_2012_00469452
21492	Proyek pelabuhan tanjung api-api tersebut bernilai Rp516 miliar.	Y	bernilai	3108	    1,250	0.0026	903.875	ind_news_2012_00241529
21493	Kawanan perampok berhasil membawa kabur sebuah mobil mewah bernilai ratusan juta rupiah.	Y	bernilai	3108	    1,250	0.0026	1314.0833	ind_news_2011_00629613
21494	Kondisi ini sangat berbeda jauh dengan pengurusan izin lokasi di sejumlah daerah lainnya di Sulut.	Y	pengurusan	3108	    1,250	0.0026	399.5714	ind_news_2012_00353856
21495	Para mahasiswa dari Mesir ini berharap pemerintah Indonesia mempermudah pengurusan visa mereka untuk kembali ke Mesir saat kondisi sudah aman.	Y	pengurusan	3108	    1,250	0.0026	715.5263	ind_news_2011_00893022
21496	Politikus PKB itu mengatakan, perlu pengawasan yang lebih efektif di Bea dan Cukai terkait ekspor impor, sebab pungli bisa dilakukan dimana-mana, mulai pengurusan kecepatan dokumen sampai menentukan nilai bea masuk atau keluar.	Y	pengurusan	3108	    1,250	0.0026	860.75	ind_news_2016_00693063
21497	Presiden menginginkan proses pengurusan sertifikat dibuat lebih sederhana, muda, murah, cepat dan pejabat BPN tidak coba-coba melakukan pelanggaran.	Y	pengurusan	3108	    1,250	0.0026	998.8333	ind_news_2016_00697077
21498	“SIM keliling ini hanya untuk pengurusan perpanjangan saja,” katanya.	Y	pengurusan	3108	    1,250	0.0026	1323.2222	ind_news_2011_00131154
21499	Yaitu di bagian tembok depan, satu lagi dekat tempat parkir kendaraan.	Y	tembok	3108	    1,250	0.0026	568	ind_news_2016_00988536
21500	Walaupun mendapat protes keras namun bangunan tembok itu akhirnya rata dengan tanah.	Y	tembok	3108	    1,250	0.0026	730.9167	ind_news_2012_00858515
21501	Padahal hanya terpisah empat tembok rumah tetangga.	Y	tembok	3108	    1,250	0.0026	957.7143	ind_news_2012_00560431
21502	Diharapkan pembuatan tembok darurat dapat menghambat air masuk kembali ke perumahan.	Y	tembok	3108	    1,250	0.0026	1049.2727	ind_news_2016_00185500
21503	Dua dunia yang hanya dibatasi tembok makam.	Y	tembok	3108	    1,250	0.0026	1307.2857	ind_news_2011_00883644
21504	Karena itu, saya mengucapkan banyak terima kasih atas dukungan yang diberikan selama ini, dan berharap kerja sama ini akan semakin erat dan luas di masa datang, katanya.	Y	erat	3109	    1,249	0.0026	437.6	ind_news_2016_00397660
21505	Lewat pameran ini, ada sebuah pesan penting tentang upaya menjaga hubungan erat dua negara lewat seni.	Y	erat	3109	    1,249	0.0026	633.2667	ind_news_2016_00483413
21506	“Dengan acara yang digelar di Perpustakaan MPR membuat hubungan kedua negara semakin erat,” ujarnya.	Y	erat	3109	    1,249	0.0026	738.2143	ind_news_2016_00155087
21507	Tampak sekali dalam struktur delegasi itu kerja sama yang erat antara mereka yang beragama Islam dan mereka yang beragama Kristen.	Y	erat	3109	    1,249	0.0026	932.5	ind_news_2016_00902969
21508	Industri otomotif berkaitan erat dengan perekonomian, katanya.	Y	erat	3109	    1,249	0.0026	1223.2857	ind_news_2012_00704982
21509	Terhadap semua itu, seperti soal ekonomi, sosial, dan politik, bahkan kebangsaan, negara sepertinya tidak bisa berbuat apa-apa, kata mantan Ketua Umum DPP Partai Golkar ini.	Y	kebangsaan	3110	    1,248	0.0026	437.6	ind_news_2012_00380375
21510	Indonesia pun menjadi nama bangsa, sedangkan Bahasa Indonesia menjadi identitas kebangsaan.	Y	kebangsaan	3110	    1,248	0.0026	753.7778	ind_news_2011_00835022
21511	Dan beliau menemukan bahwa modus itu ada dalam kebangsaan kita.	Y	kebangsaan	3110	    1,248	0.0026	861	ind_news_2012_00580377
21512	Semangat kebangsaan melemah, sehingga lebih mengutamakan kepentingan kelompok, partai dan lainnya.	Y	kebangsaan	3110	    1,248	0.0026	1052.7273	ind_news_2011_00261714
21513	Tidak ada yang boleh membakar bendera kebangsaan..	Y	kebangsaan	3110	    1,248	0.0026	1276.2857	ind_news_2016_00941241
21514	Tanpa komitmen dan kendali diri, tak ada satu cara belajar pun yang akan berhasil.	Y	kendali	3110	    1,248	0.0026	446.1429	ind_news_2011_00328196
21515	Kami mengakui jika memiliki permainan di bawah kendali.	Y	kendali	3110	    1,248	0.0026	662.125	ind_news_2016_00380238
21516	Betapa keluarga itu sudah tak punya kendali.	Y	kendali	3110	    1,248	0.0026	834	ind_news_2011_00339534
21517	Masyarakat ekonomi lemah, tetap diberikan subsidi dengan suatu mekanisme kendali.	Y	kendali	3110	    1,248	0.0026	970.5	ind_news_2012_00597477
21518	Yaitu, sistem asuransi kesehatan dan kedokteran seperti layaknya kendali mutu dan kendali biaya.	Y	kendali	3110	    1,248	0.0026	1335.5455	ind_news_2012_00369886
21519	Saya berpikir bahwa bank akan mengapresiasi jika Anda memiliki rencana yang tepat dan bisa bekerja sama secara internal.	Y	mengapresiasi	3110	    1,248	0.0026	464.6111	ind_news_2012_00100880
21520	Kami sangat mengapresiasi mereka, apa pun hasilnya.	Y	mengapresiasi	3110	    1,248	0.0026	658.8571	ind_news_2016_00383140
21521	”Berterima kasih pada semua pihak yang telah mengapresiasi karya kami.	Y	mengapresiasi	3110	    1,248	0.0026	783.2	ind_news_2016_00095627
21522	Ia mengapresiasi proses terjadinya tiga gol PSS yang berasal dari skema terbuka sejak lini tengah.	Y	mengapresiasi	3110	    1,248	0.0026	965.4667	ind_news_2016_00279591
21523	Karya Joko menggambarkan hal tersebut, mengapresiasi kehidupan dan alam lingkungan sekitarnya, sambungnya.	Y	mengapresiasi	3110	    1,248	0.0026	1218.5	ind_news_2012_00025382
21524	Akhirnya setelah membuat surat pernyataan dari para anak-anak, mereka hingga kini masih tinggal di panti tersebut.	Y	panti	3110	    1,248	0.0026	331	ind_news_2011_00285427
21525	Saat ini Pemprov DKI sendiri memiliki 27 panti sosial.	Y	panti	3110	    1,248	0.0026	712.125	ind_news_2012_00473417
21526	Kita (melakukan) rehabilitasi bekerja sama dengan panti rehabilitasi dan rumah sakit, kata Max.	Y	panti	3110	    1,248	0.0026	824.1667	ind_news_2011_00632952
21527	Ini dibuktikan oleh belum adanya panti rehabilitasi sosial di kota ini.	Y	panti	3110	    1,248	0.0026	953.5	ind_news_2016_00301547
21528	Menurut Teguh, panti itu didirikan setelah pengurus yayasan sering mendengar berita tentang bayi yang dibuang orang tuanya.	Y	panti	3110	    1,248	0.0026	1219.6471	ind_news_2012_00326633
21529	Dia mengatakan tidak tahu pasti apakah kedua orang tersebut masih melakukan komunikasi dengan Susno.	Y	susno	3110	    1,248	0.0026	397.1429	ind_news_2011_00907033
21530	Ini suatu yang jarang terjadi, tapi kasus Pak Susno harus dilihat dari dua segi.	Y	susno	3110	    1,248	0.0026	709.2143	ind_news_2012_00069068
21531	Laporan Susno patut diyakini akan mengungkap hal yang lebih besar seperti diduga Ketua Mahkamah Konstitusi (MK), yaitu akan ada kasus korupsi yang jauh lebih besar terungkap.	Y	susno	3110	    1,248	0.0026	851.2273	ind_news_2012_00050825
21532	Hakim menyatakan Susno diperlukan untuk melengkapi penyidikan termasuk menyita sejumlah barang bukti dan memeriksa saksi-saksi.	Y	susno	3110	    1,248	0.0026	987.8	ind_news_2011_00560501
21533	Kasus Gayus Tambunan dengan nilai ratusan miliar yang diungkap Susno.	Y	susno	3110	    1,248	0.0026	1288.4	ind_news_2011_00697924
21534	MU dalam waktu dekat akan melakukan Asia Tour ke empat negara yaitu Indonesia, Malaysia, China, dan Korea.	Y	tour	3111	    1,247	0.0026	516	ind_news_2011_00949355
21535	Sesuai janji dari manajemen MU bahwa mereka akan menjadikan kunjungan ke Indonesia sebagai prioritas pada MU tour Asia 2010.	Y	tour	3111	    1,247	0.0026	695.1765	ind_news_2011_00054328
21536	Banyak tour and travel operator Thailand yang menyebut, anak-anak muda Cina itu adalah Thailand, karena itu akan terus berkembang di sana.	Y	tour	3111	    1,247	0.0026	818.9474	ind_news_2016_00073900
21537	Ketiga, paket-paket wisata yang dibuat tour operator, yang sudah pasti juga punya website sendiri.	Y	tour	3111	    1,247	0.0026	923.3077	ind_news_2016_00442437
21538	Secara umum, paket tour mancanegara tidak berubah.	Y	tour	3111	    1,247	0.0026	1184.8571	ind_news_2012_00728279
21539	Tak banyak yang bicara, selain 4 ketua DPD Golkar dan seorang anggota dewan penasihat.	Y	penasihat	3112	    1,246	0.0026	472.0769	ind_news_2011_00654899
21540	Saya selalu siap jika sudah ada jadwal pemanggilan dari Polres dan pasti didampingi sama penasihat hukum saya.	Y	penasihat	3112	    1,246	0.0026	674.375	ind_news_2011_00117697
21541	Terkait putusan majelis hakim itu, jaksa dan penasihat hukum terdakwa menyatakan banding.	Y	penasihat	3112	    1,246	0.0026	803.5	ind_news_2012_00655045
21542	Selain ibunya, kedatangan korban ke Poltabes juga didampingi seorang penasihat hukum.	Y	penasihat	3112	    1,246	0.0026	1028.7273	ind_news_2011_00061820
21543	Penasihat-penasihat itu bakal menggantikan tim inti rezim sang ayah yang masih tersisa.	Y	penasihat	3112	    1,246	0.0026	1252.6667	ind_news_2016_00658304
21544	“Langkah yang dilakukan para guru TK tersebut, memang sangat bagus.	Y	tk	3113	    1,245	0.0026	476.6	ind_news_2011_00199359
21545	Kalau hanya Rp 400 ribu untuk dua bulan, uang-nya akan langsung habis untuk membeli beras dan membayar sekolah cucu yang masih duduk di bangku TK,” ujarnya.	Y	tk	3113	    1,245	0.0026	635.96	ind_news_2016_00362958
21546	Kali ini 17 siswa telah berhasil lulus TK.	Y	tk	3113	    1,245	0.0026	778.1429	ind_news_2011_00545560
21547	Mereka membutuhkan SDN untuk menampung lulusan siswa dari lima sekolah TK di kawasan perumahan itu.	Y	tk	3113	    1,245	0.0026	938.8667	ind_news_2011_00914183
21548	Sebagai contoh, TK mengaku tidak bangga dengan popularitas istrinya.	Y	tk	3113	    1,245	0.0026	1278.7778	ind_news_2012_00173929
21549	Jadi, kita akan banyak melakukan latihan di jenis lintasan seperti itu, katanya.	Y	lintasan	3114	    1,244	0.0026	408.3333	ind_news_2011_00424560
21550	Menurut dia, seharusnya tarif dasar tersebut dibuat sama di semua lintasan.	Y	lintasan	3114	    1,244	0.0026	616.5455	ind_news_2012_00617444
21551	Baik persaingan di lintasan, juga drama yang tiba-tiba muncul menjelang akhir musim.	Y	lintasan	3114	    1,244	0.0026	848.0833	ind_news_2016_00068932
21552	Sebagai raja lintasan basah, jelas berharap hujan tak lagi turun agar balapan tak sampai terganggu.	Y	lintasan	3114	    1,244	0.0026	974.6429	ind_news_2011_00957660
21553	Pembukaan kebun sawit justru dilakukan di kawasan jalur lintasan gajah.	Y	lintasan	3114	    1,244	0.0026	1305.1	ind_news_2011_00501576
21554	Dengan waktu tiga bulan, lanjutnya, ia tetap yakin perbaikan akan selesai karena pihaknya menggunakan alat-alat yang cukup mendukung untuk pengerjaan itu.	Y	pengerjaan	3114	    1,244	0.0026	417.8095	ind_news_2011_00674362
21555	Bahkan sering kali ditemui beberapa pengerjaan pembangunan tidak jelas dan terkesan hanya menghabiskan anggaran saja.	Y	pengerjaan	3114	    1,244	0.0026	616.8667	ind_news_2011_00160465
21556	Dengan demikian siapa saja pengusaha yang ingin ambil bagian dalam pengerjaan proyek tidak dibatasi.	Y	pengerjaan	3114	    1,244	0.0026	753.1429	ind_news_2016_00158854
21557	Eko menyebut banyak pengalaman yang didapat selama proses pengerjaan buku ini.	Y	pengerjaan	3114	    1,244	0.0026	912	ind_news_2016_00222317
21558	Harga ditentukan oleh tingkat kesulitan pengerjaan dan lebar kain.	Y	pengerjaan	3114	    1,244	0.0026	1256.3333	ind_news_2011_00558884
21559	Dan mereka ini sedang kami proses,” aku Rahman.	Y	rahman	3114	    1,244	0.0026	522.125	ind_news_2016_00138596
21560	Karenanya, kata Rahman, pihaknya membawa para investor menemui jajaran Pemprov Kalbar agar mereka mengetahui potensi apa saja di Kalbar langsung dari instansi terkait.	Y	rahman	3114	    1,244	0.0026	704.3636	ind_news_2011_00440117
21561	Abdul Rahman menjelaskan, setelah putusan MK ini, Kejaksaan tidak lagi dapat menuntut para tersangka koruptor meski mereka terbukti merugikan negara.	Y	rahman	3114	    1,244	0.0026	808.7	ind_news_2011_00863401
21562	Pemilik paspor bernama asli Nur Abdul Rahman, dan saat dikonfirmasi ternyata yang bersangkutan telah sampai rumah dengan selamat.	Y	rahman	3114	    1,244	0.0026	963.2778	ind_news_2016_00655570
21563	Hal senada juga diungkapkan, R.A. Rahman.	Y	rahman	3114	    1,244	0.0026	1312.4286	ind_news_2011_00347363
21564	BEI dan Bursa Malaysia akan melakukan studi bersama lebih lanjut terkait kerja sama ini.	Y	bei	3115	    1,243	0.0026	519.3571	ind_news_2016_00082384
21565	JAKARTA - PT Bursa Efek Indonesia (BEI) dipastikan tidak libur saat pemilihan kepala daerah (pilkada) DKI Jakarta 11 Juli mendatang.	Y	bei	3115	    1,243	0.0026	708.4118	ind_news_2012_00299018
21566	Hampir seluruh sektor industri di Bursa Efek Indonesia (BEI) mampu cetak poin, hanya indeks sektor properti yang masih kehilangan poin.	Y	bei	3115	    1,243	0.0026	856.1111	ind_news_2012_00876439
21567	Terkait dengan hal tersebut, BEI meminta investor untuk memperhatikan jawaban Perseroan atas permintaan konfirmasi Bursa.	Y	bei	3115	    1,243	0.0026	955.8667	ind_news_2011_00643396
21568	BEI buka perdagangan saham 16 Mei Jakarta (Solopos.	Y	bei	3115	    1,243	0.0026	1260.4286	ind_news_2011_00514936
21569	Sebagai contoh saja, terkait kematian seseorang yang keluar dari agama Islam, peristiwa itu hanya terjadi sekali pada masa Nabi Muhammad SAW.	Y	saw	3115	    1,243	0.0026	672.2857	ind_news_2012_00366750
21570	Saya juga tidak suka saat meninggalkan makam Nabi besar Muhammad SAW. yang paling aneh ialah saya suka datang, tetapi merasa tidak ingin pulang.	Y	saw	3115	    1,243	0.0026	897.1	ind_news_2016_00746902
21571	Pertama terjadi dalam mimpi sebagai persiapan bagi Nabi SAW.	Y	saw	3115	    1,243	0.0026	1055.2222	ind_news_2012_00204710
21572	Di dalam Alquran sendiri telah disebutkan, puasa bukanlah ritual yang baru muncul pada zaman Nabi Muhammad SAW.	Y	saw	3115	    1,243	0.0026	1185.7647	ind_news_2016_00182833
21573	Tempat dimana Nabi Muhammad SAW pernah berjalan-jalan disana.	Y	saw	3115	    1,243	0.0026	1341.3333	ind_news_2016_00919676
21574	Jika dua pekan lalu, tim Sulut masih sangat ketinggalan dibanding dengan daerah lain, kini mereka sudah mampu untuk bersaing.	Y	ketinggalan	3116	    1,242	0.0026	379.0526	ind_news_2016_00344493
21575	Kami sebagai guru hanya dapat berdoa semoga prestasi pendidikan di Lampung Selatan bisa mengejar ketinggalan dibanding kabupaten lain, kata dia.	Y	ketinggalan	3116	    1,242	0.0026	688.65	ind_news_2011_00485733
21576	Dunia otomotif juga tak mau ketinggalan dalam memanfaatkan keunggulan alat ini.	Y	ketinggalan	3116	    1,242	0.0026	854.5455	ind_news_2011_00374520
21577	Namun ketinggalan tiga gol tidak membuat Thailand patah semangat.	Y	ketinggalan	3116	    1,242	0.0026	989.7778	ind_news_2016_00589431
21578	Dukungan publik membuat Denmark berusaha mengejar ketinggalan.	Y	ketinggalan	3116	    1,242	0.0026	1424.5714	ind_news_2011_00725000
21579	Ia berharap ke depan proses Pilkada Banyumas dapat memberikan harapan baru dan perubahan yang lebih baik bagi rakyat Banyumas.	Y	banyumas	3117	    1,241	0.0026	358.5	ind_news_2012_00692716
21580	Dari Pulau Jawa, mereka berasal dari Malang (Jawa Timur), Banyumas (Jawa Tengah), hingga Bogor (Jawa Barat).	Y	banyumas	3117	    1,241	0.0026	629.4167	ind_news_2016_00147610
21581	”Kebetulan dari Banyumas yang terpilih hanya ada lima siswa.	Y	banyumas	3117	    1,241	0.0026	779.6667	ind_news_2012_00313258
21582	Aparat kepolisian di Banyumas, Jawa Tengah, menemukan indikasi bahwa orang Bulog terlibat dalam kasus pencurian 20 ton beras jatah warga miskin di gudang Bulog.	Y	banyumas	3117	    1,241	0.0026	934	ind_news_2011_00351645
21583	Mayat korban baru dievakuasi 4 jam kemudian oleh tim SAR Brimob Polres Banyumas.	Y	banyumas	3117	    1,241	0.0026	1247.6667	ind_news_2012_00780259
21584	Salah satu isinya: “Kami tidak menerima lagi surat izin dokter sebagai bukti bahwa Anda sakit.	Y	isinya	3117	    1,241	0.0026	435.6	ind_news_2011_00828746
21585	Setelah saya baca isinya, juga tidak jauh berbeda dengan buku yang saya tulis.	Y	isinya	3117	    1,241	0.0026	794.8333	ind_news_2011_00392421
21586	Karena itu patut diduga, isinya mestinya juga penting sekali.	Y	isinya	3117	    1,241	0.0026	983	ind_news_2011_00616785
21587	“Untuk revisi kontrak, kita akan lihat isinya dulu,” imbuhnya.	Y	isinya	3117	    1,241	0.0026	1064	ind_news_2016_00971858
21588	Namun, tak berarti bahwa puisi-puisi Anton tak memiliki makna pada isinya.	Y	isinya	3117	    1,241	0.0026	1259.8	ind_news_2011_00263782
21589	Sumber kejaksaan menyebut, ada anggota tim yang tidak tahu kalau tanah itu sudah dilepas.	Y	dilepas	3118	    1,240	0.0025	448.7143	ind_news_2011_00436842
21590	Terbukti dengan hampir semua para tahanan kasus dugaan korupsi dilepas de-ngan berbagai alasan.	Y	dilepas	3118	    1,240	0.0025	660.6429	ind_news_2016_00923996
21591	Saat sedang bermain di sawah, seorang murid Sekolah Dasar di Bogor menjadi korban peluru salah sasaran yang dilepas seorang anggota polisi.	Y	dilepas	3118	    1,240	0.0025	797.2632	ind_news_2012_00071042
21592	Apabila ternyata tidak dilaksanakan pejabat tersebut harus bersedia untuk diturunkan atau dilepas jabatannya.	Y	dilepas	3118	    1,240	0.0025	940.6923	ind_news_2012_00958863
21593	Penyerang Brasil itu kemungkinan akan dilepas Real karena transfer Ronaldo tidak kunjung menemukan kepastian.	Y	dilepas	3118	    1,240	0.0025	1275.2857	ind_news_2011_00826636
21594	Mungkin saya adalah orang yang paling senang melihat Valencia kembali ke tim.	Y	valencia	3118	    1,240	0.0025	442.5	ind_news_2011_00653413
21595	Valencia akhirnya mendapatkan peluang pada menit ke-66.	Y	valencia	3118	    1,240	0.0025	667.5714	ind_news_2012_00884358
21596	Ia akan mampu membuat Valencia semakin kuat, pungkasnya.	Y	valencia	3118	    1,240	0.0025	793.25	ind_news_2012_00991615
21597	MotoGP Valencia bakal jadi balapan yang sangat penting mengingat ini merupakan rumahnya dan tempat para penggemar setia.	Y	valencia	3118	    1,240	0.0025	959.4118	ind_news_2016_00568569
21598	Valencia melancarkan serangan-serangan balik yang cepat.	Y	valencia	3118	    1,240	0.0025	1417.3333	ind_news_2012_00263216
21599	“Yang lain dibuat dan dirancang di luar baru masuk Indonesia.	Y	dirancang	3119	    1,239	0.0025	453.6	ind_news_2016_00993324
21600	Semua program dirancang berdasarkan kebutuhan warga dalam sebuah program pemberdayaan masyarakat.	Y	dirancang	3119	    1,239	0.0025	667.1	ind_news_2011_00378944
21601	Kebijakan itu dirancang untuk memastikan tingkat suku bunga yang harus dibayar negara-negara itu wajar.	Y	dirancang	3119	    1,239	0.0025	824.8462	ind_news_2012_00721721
21602	Jalan alternatif sekarang tidak dirancang tahan gempa dan sebagian koridor badan jalan masih berada dalam zona gempa.	Y	dirancang	3119	    1,239	0.0025	983.1333	ind_news_2012_00576503
21603	Sesuai skenario latihan yang dirancang penyelenggara latihan,” katanya.	Y	dirancang	3119	    1,239	0.0025	1320.8571	ind_news_2016_00864578
21604	Federasi mengumumkan dalam pernyataan resmi bahwa pertemuan luar biasa akan dilaksanakan dalam 10 hari ke depan saat mereka memutuskan apa yang akan dilakukan selanjutnya, dan bahwa, untuk saat ini, tim nasional tidak akan punya pelatih.	Y	federasi	3119	    1,239	0.0025	372.5517	ind_news_2012_00167738
21605	Ketua Umum federasi sepak bola Indonesia itu.	Y	federasi	3119	    1,239	0.0025	687.2857	ind_news_2016_00448274
21606	Cukup banyak masalahnya, dan sepertinya tidak mungkin bisa diselesaikan oleh federasi ya, bahkan negara?	Y	federasi	3119	    1,239	0.0025	793.7857	ind_news_2016_00118897
21607	“Persatuan pemain menolak mendengarkan intervensi presiden federasi, yang termasuk isu pemain yang berada di luar tim.	Y	federasi	3119	    1,239	0.0025	934	ind_news_2011_00815705
21608	“Prinsipnya kalau federasi sudah angkat tangan, pemerintah akan bantu.	Y	federasi	3119	    1,239	0.0025	1349.6667	ind_news_2016_00699064
21609	Dia melanjutkan, “Orang-orang kami sudah masuk ke semua kota Pakistan dan kami akan melancarkan serangan seperti itu lebih banyak lagi pada waktu mendatang.”	Y	melancarkan	3119	    1,239	0.0025	381.5909	ind_news_2012_00086293
21610	Dia mengatakan pelaku bom bunuh diri dan orang-orang bersenjata berencana melancarkan serangan tersebut, dan menambahkan bahwa para penyidik akan melanjutkan penyelidikan terhadap sel-sel dan dugaan target lain.	Y	melancarkan	3119	    1,239	0.0025	738.84	ind_news_2016_00174247
21611	Jika tidak ada respon maka para buruh siap melancarkan aksi mogok nasional untuk kali kedua lantaran pemerintah lebih mengutamakan kepentingan pengusaha ketimbang buruh.	Y	melancarkan	3119	    1,239	0.0025	897.1364	ind_news_2012_00826680
21612	Kelima pencuri itu sudah melancarkan aksinya sejak bulan Maret 2011 di delapan tempat yang tersebar di Jakarta, Bogor, Banten, Tangerang, dan Bekasi.	Y	melancarkan	3119	    1,239	0.0025	1031	ind_news_2012_00714524
21613	Kedua petinju sama-sama melancarkan pukulan keras masing-masing.	Y	melancarkan	3119	    1,239	0.0025	1264.8571	ind_news_2011_00824067
