ORDER	SENTENCE	STATUS	WORD	RANK	COUNT	COUNT_REL	INDEX	ID
24641	Hogy ez a szint sok vagy kevés könnyen el lehet dönteni az értékesítési adatok alapján.	Y	értékesítési	2917	    1,024	0.002	717.6667	hun_news_2017_00628202
24642	Ezek nem jogi, hanem értékesítési és marketingszerződések - tette hozzá.	Y	értékesítési	2917	    1,024	0.002	900.5556	hun_news_2011_00395208
24643	A hétvégén már megszokott teljesítmény ezúttal sem maradt el: szombaton és vasárnap is második lett az RTL Klub után az értékesítési modell az egész napot és fõmûsoridõt vizsgálva is.	Y	értékesítési	2917	    1,024	0.002	910.56	hun_news_2017_00086607
24644	A legjobb úton haladunk egy újabb éves értékesítési rekord felé - tette hozzá.	Y	értékesítési	2917	    1,024	0.002	928.25	hun_news_2017_00147346
24645	Ez azt jelenti, hogy Európa legnagyobb gazdaságában az idei év értékesítési adatai valószínûleg a legrosszabbak lesznek a német egyesítés éve, 1990 óta.	Y	értékesítési	2917	    1,024	0.002	979.55	hun_news_2016_00542864
24646	Ugyanakkor több korabeli forrás is tud arról, hogy István megkeresztelésére valójában 995 táján került sor.	Y	korabeli	2917	    1,024	0.002	939.0714	hun_news_2017_00960807
24647	A korabeli sajtóban közzétett felhívásra jelentkező iskolák az egész Ma Kérjük jelentkezzen be, hogy a teljes cikket olvashassa Már van előfizetésem vagy korábban regisztráltam!	Y	korabeli	2917	    1,024	0.002	1046.2174	hun_news_2017_00128154
24648	A korabeli magyar kormány pl megtette ezt az USA-val.	Y	korabeli	2917	    1,024	0.002	1070.4	hun_news_2016_00132013
24649	Ezek az új menekültek sokkal jobb bánásmódban részesültek, mint a korábbi magyar emigránsok vagy a többi korabeli európai menekült.	Y	korabeli	2917	    1,024	0.002	1095.8333	hun_news_2017_00542814
24650	Egy szemtanú, Forgács Béla így emlékezett vissza a korabeli eseményekre, a pénzügy- Nem maradunk élmény nélkül az év végén sem Kérjük jelentkezzen be, hogy a teljes cikket olvashassa Már van előfizetésem vagy korábban regisztráltam!	Y	korabeli	2917	    1,024	0.002	1108.1875	hun_news_2017_00484011
24651	Az egyik vadászaton mindenki megcsodálta, ugyanis több száz méterről úgy hozott vissza egy nyulat, hogy egyszer sem tette le.	Y	méterről	2917	    1,024	0.002	899.1053	hun_news_2017_00330187
24652	Vinko aztán még a szünet előtt fordulatból szerzett egy szép gólt mintegy öt méterről.	Y	méterről	2917	    1,024	0.002	1081.2143	hun_news_2017_00992004
24653	31. perc: Tököli akár duplázhatott volna, de nem találta el a labdát egy beadás után mintegy nyolc méterről.	Y	méterről	2917	    1,024	0.002	1112.8235	hun_news_2011_00016439
24654	Csoboth adta is a labdát, majd az oroszok ellen két gólt szerző csapatkapitány 17 méterről nem sokkal lőtt a bal alsó mellé.	Y	méterről	2917	    1,024	0.002	1177.7	hun_news_2017_00442472
24655	A támadó már csak állt szemben, de tizenkét méterről nem tudott túljárni a magyar kapus eszén.	Y	méterről	2917	    1,024	0.002	1185.3333	hun_news_2017_00266232
24656	Nem én vagyok a náci, hanem te!	Y	náci	2917	    1,024	0.002	542.8571	hun_news_2016_00821196
24657	Most már csak azt mondja meg valaki,hogy ha ez a náci 15éve itt él akkor mi a fenét vártak eddig?	Y	náci	2917	    1,024	0.002	601.4	hun_news_2011_00923418
24658	Látható, hogy itt egy náci van, és az te vagy négyeske.	Y	náci	2917	    1,024	0.002	703.8182	hun_news_2011_00754285
24659	Ezek után pedig azt a kérdést tette fel Vonának, hogy akkor vannak-e náci barátai?	Y	náci	2917	    1,024	0.002	788.4667	hun_news_2016_00549073
24660	Lehet, hogy disznó vagyok, de náci nem - mondta csütörtökön.	Y	náci	2917	    1,024	0.002	827.2222	hun_news_2017_00722327
24661	Így él a magyar, ha extra gazdag!	Y	extra	2918	    1,023	0.002	730	hun_news_2017_00649788
24662	Mint mondta, hivatalos döntés még nincs erről, de szinte biztos, hogy nem kap extra felhatalmazást az államfő, mert ezt sem ő, sem Szájer József nem támogatja azt, márpedig a testület háromfős.	Y	extra	2918	    1,023	0.002	823.4138	hun_news_2011_00491767
24663	A helyiek szerint semmi extra nem történt..	Y	extra	2918	    1,023	0.002	883	hun_news_2016_00087607
24664	A csapat honlapján olvasható szerint a tavaly még NB I-es klubnál cél volt a feljutás, ám ehhez extra forrásokra lett volna szükség.	Y	extra	2918	    1,023	0.002	915.2381	hun_news_2017_00036882
24665	Ha valaki pénzügyi területen szeretne dolgozni már az egyetem alatt, jó, ha extra tevékenységekbe is beleássa magát.	Y	extra	2918	    1,023	0.002	926.125	hun_news_2017_00618552
24666	A hatályos törvények szerint ez mindig is állami feladat volt.	Y	hatályos	2918	    1,023	0.002	691.6	hun_news_2016_00083411
24667	A politikus elmondta azt is, hogy még mindig vannak olyan közmûszolgáltatók, amelyek nem tartják be az új számlaképekrõl szóló, február 19-tõl hatályos rendeletet.	Y	hatályos	2918	    1,023	0.002	848.7391	hun_news_2016_00225036
24668	Természetesen én tudom, hogy a fenti rendeletnek a hatályos szövege jó, de ezt mondjuk egy külföldi nem biztos, hogy meg tudja állapítani.	Y	hatályos	2918	    1,023	0.002	900.5	hun_news_2011_00026618
24669	Ha azonban ez nem sikerül, akkor a hatályos szabályok szerint egy hónap után szabadon engedik őket a táborból.	Y	hatályos	2918	    1,023	0.002	910.1176	hun_news_2016_00601393
24670	Nem véletlen, hogy még június közepén a jelenleg hatályos szabályok módosítása került a parlament elé.	Y	hatályos	2918	    1,023	0.002	923.2143	hun_news_2016_00833125
24671	Minden potenciális beszállító számára fontos, hogy a kormány mennyire elkötelezett egy ilyen nagy beruházás mellett.	Y	potenciális	2918	    1,023	0.002	861.8	hun_news_2016_00779279
24672	Több a bizonytalanság és a potenciális veszteség, mint a várható haszon, és egyáltalán nem véletlen, hogy 2014-ben sem ezt az utat választották.	Y	potenciális	2918	    1,023	0.002	987	hun_news_2016_00946487
24673	A potenciális tisztségviselő maga is határozatlan: dolgozik, ezt az állását is meg szeretné tartani, ami viszont nem lenne lehetséges.	Y	potenciális	2918	    1,023	0.002	1004.3889	hun_news_2011_00360512
24674	A stratégia segítségével végül 21 millió potenciális új beteg felé lehetett piacot nyitni csak az Egyesült Államokban.	Y	potenciális	2918	    1,023	0.002	1026.75	hun_news_2017_00246950
24675	Más kérdés, hogy térségi összehasonlításban a magyar potenciális növekedés a jövőben is igen alacsony marad.	Y	potenciális	2918	    1,023	0.002	1027.4286	hun_news_2017_00744128
24676	Az emberek szerint a Premier League sokkal elõrébb van, mint a skót bajnokság, és ez sok szempontból így is van.	Y	league	2919	    1,022	0.002	817.5556	hun_news_2016_00347521
24677	Az elsõ húszban egyébként nem kevesebb, mint kilenc Premier League-csapat található, négy olasz és három német követi õket az országok rangsorában.	Y	league	2919	    1,022	0.002	968.1429	hun_news_2016_00344897
24678	Brit vagyok, és imádom a Premier League-et, de el kell ismernem, hogy ez rendkívüli volt.	Y	league	2919	    1,022	0.002	995.0625	hun_news_2016_00432268
24679	Sõt, számomra az sem kérdéses, hogy jelenleg a Premier League-ben sincs nála jobb.	Y	league	2919	    1,022	0.002	1006.8571	hun_news_2016_00907064
24680	Ezzel együtt eléggé zsákbamacska lenne, Európában még nem játszott, kicsit nagy ugrás lenne számára a Premier League, és már ő sem a legfiatalabb.	Y	league	2919	    1,022	0.002	1006.9048	hun_news_2017_00566318
24681	És ahelyett, hogy valami javulna, az elmúlt évben csak csökkent(!	Y	ahelyett	2920	    1,021	0.002	820.9	hun_news_2011_00025882
24682	A helyzet tulajdonképpen már tavaly is kritikus volt, és azóta, ahelyett, hogy javult volna, tovább romlott.	Y	ahelyett	2920	    1,021	0.002	872.875	hun_news_2011_00717925
24683	Az a lényeg, hogy ki mit hallgat el, vagy mit mond ahelyett, amit gondol.	Y	ahelyett	2920	    1,021	0.002	1001.4615	hun_news_2016_00314569
24684	Ez a kisfiú ahelyett, hogy a barátaival labdázna, azt írta, úgy látja, ott tart az ország, hogy a hazának rá is szüksége van.	Y	ahelyett	2920	    1,021	0.002	1018.05	hun_news_2017_00534780
24685	Még jó, hogy vannak ezek az üzenőfalak, és így ezt mindenkinek meg is tudod mutatni, ahelyett, hogy lepleznéd.	Y	ahelyett	2920	    1,021	0.002	1024.2353	hun_news_2011_00366668
24686	Lázár János szerint az Információs Hivatal annak ellenére végzett nagyon jó munkát, hogy hatalmas létszámhiánnyal küzd.	Y	információs	2920	    1,021	0.002	840.375	hun_news_2016_00721904
24687	Hát ez az egyetlen médium/információs forrás ebben a városban?	Y	információs	2920	    1,021	0.002	914.1	hun_news_2011_00212423
24688	Az előttünk álló kérdés tehát nem az, vajon mikor és milyen módon köszönt be az információs társadalom.	Y	információs	2920	    1,021	0.002	922.5333	hun_news_2011_00001287
24689	Soha pápa annyit nem szerepelt a nyilvánosság előtt, mint ő, és ez nem csak az információs társadalom robbanásának tudható be.	Y	információs	2920	    1,021	0.002	931.3158	hun_news_2016_00901098
24690	Az új információs csatornán, az M1-en már ezen a hétvégén is megtalálhatóak lesznek a zrt.	Y	információs	2920	    1,021	0.002	981.5714	hun_news_2017_00399706
24691	A Fidesz és a KDNP jelezte, hogy továbbra sem vesz részt semmilyen, Gyurcsány Ferenc által kezdeményezett, vagy az ő részvételével tartott tárgyaláson.	Y	részvételével	2920	    1,021	0.002	767.8095	hun_news_2011_00465044
24692	A második számú európai kupa magyarországi selejtezõjében öt napon át zajlik a vetélkedés hét csapat, köztük két magyar részvételével.	Y	részvételével	2920	    1,021	0.002	943.2222	hun_news_2016_00173114
24693	Az elnök házigazdája volt annak az egészségügyi csúcstalálkozónak is, amelyet a múlt héten, több mint 40 ország vezetõinek részvételével tartottak a Fehér Házban.	Y	részvételével	2920	    1,021	0.002	979.1	hun_news_2016_00341244
24694	A helyi idõ szerint vasárnap délelõtt - 28 állam- és kormányfõ részvételével - megnyitott tanácskozáson Orbán Viktor miniszterelnök is jelen van.	Y	részvételével	2920	    1,021	0.002	997.7778	hun_news_2017_00084068
24695	A tanulmányt 1763 olyan afrikai, amerikai és ázsiai pár részvételével végezték el, ahol az egyik fél HIV-fertőzött volt, a másik viszont egészséges.	Y	részvételével	2920	    1,021	0.002	1041.619	hun_news_2017_00267476
24696	A fenti képen látható ellenőrzőkód: Nem értem ezeket a cikkeket.	Y	cikkeket	2921	    1,020	0.002	805.2222	hun_news_2011_00868138
24697	Lassan olyan ez az újság, mint egy általános iskola belső újságja, de lehet, hogy abba jobb cikkeket írnak a gyerekek.	Y	cikkeket	2921	    1,020	0.002	825.8	hun_news_2011_00881234
24698	Ha azt is hozzátesszük, hogy a felmérések szerint majdnem 1 millió ember jár vasárnap napi fogyasztási cikkeket vásárolni, akkor azt is lehet látni, hogy a pult másik oldalán is rengeteg érintett van.	Y	cikkeket	2921	    1,020	0.002	955.4615	hun_news_2017_00597672
24699	Nem csupán a baloldali sajtó vesz át azonban cikkeket a szélsőjobbtól, hanem fordítva is van erre példa.	Y	cikkeket	2921	    1,020	0.002	969.8125	hun_news_2017_00818807
24700	Ha igen, az első hír után a témában megjelenő további cikkeket nem olvasom el.	Y	cikkeket	2921	    1,020	0.002	984.4286	hun_news_2011_00789431
24701	A fenti képen látható ellenőrzőkód: Elolvastam:) Azt a 352 ezret is három év alatt hozta össze.	Y	ezret	2921	    1,020	0.002	735.8571	hun_news_2011_00991311
24702	A szászok száma sajnos már nem éri el az ezret sem.	Y	ezret	2921	    1,020	0.002	851.6364	hun_news_2017_00251613
24703	A tesztből már több ezret sikerült eladni, és nem csak az Egyesült Államokban.	Y	ezret	2921	    1,020	0.002	890.3846	hun_news_2011_00135056
24704	Egyelőre úgy tűnik, nem éri el az 50 ezret azok száma, akik a pénztáruknál maradnak.	Y	ezret	2921	    1,020	0.002	903.2143	hun_news_2011_00963783
24705	Nem ritka az olyan hét sem – elsősorban a nyári hónapokban –, amikor a zarándokok száma a 100 ezret is meghaladja.	Y	ezret	2921	    1,020	0.002	923.75	hun_news_2017_00827825
24706	Negyvenkettő nyarán még ment, ahogy ment, de jött a tél, az orosz tél, amely szerencsétlenségünkre olyan kemény volt, mint talán azóta egyik évben sem.	Y	nyarán	2921	    1,020	0.002	778.3636	hun_news_2011_00815562
24707	A felvétel persze nem most készült, hanem 2015 nyarán.	Y	nyarán	2921	    1,020	0.002	807.5	hun_news_2017_00053544
24708	A rendõrök szerint a férfi beismerte tettét Egy 2014 nyarán történt eset miatt is bíróság elé áll a férfi.	Y	nyarán	2921	    1,020	0.002	904.2	hun_news_2016_00235138
24709	A gyerek a bántalmazások következtében már 2007 nyarán kórházba került, az apa ellen pedig eljárás indult.	Y	nyarán	2921	    1,020	0.002	916.2857	hun_news_2011_00272113
24710	Ennek keretében idén, 2010 nyarán sikerült először megrendezni a Magyar Közösség Napját, ez korábban teljesen elképzelhetetlen lett volna.	Y	nyarán	2921	    1,020	0.002	950.6471	hun_news_2011_00080357
24711	Na ez az ami a legnagyobb kárt okozza!	Y	okozza	2921	    1,020	0.002	736.75	hun_news_2017_00801982
24712	Cikk megjelenítése: 858Olvasóink értékelése: Nem a víz okozza az igazi gondot..	Y	okozza	2921	    1,020	0.002	752.4545	hun_news_2017_00435221
24713	Az elemzők arra számítanak, hogy a kárt számos kisebb-nagyobb gond okozza majd.	Y	okozza	2921	    1,020	0.002	838.5385	hun_news_2017_00332779
24714	A legnagyobb problémát az okozza, hogy nincsen elég rendelkezésre álló adat.	Y	okozza	2921	    1,020	0.002	995.8182	hun_news_2016_00152824
24715	A másik felét eleve a magas nettó ár okozza.	Y	okozza	2921	    1,020	0.002	1381.5	hun_news_2011_00805779
24716	Miért jó nekünk Paks II., és miért nem?	Y	paks	2921	    1,020	0.002	641.5714	hun_news_2017_00767389
24717	Jelenleg a pártok közül egyedül a FIDESZ-KDNP támogatja a Paks2.	Y	paks	2921	    1,020	0.002	930.6667	hun_news_2017_00668279
24718	A vendég Paks az utolsó negyedben már nem tudta tartani a lépést.	Y	paks	2921	    1,020	0.002	1070.6364	hun_news_2011_00091634
24719	A címvédő Videoton a Paks otthonában lép pályára, míg a Debrecen az MTK-t fogadja.	Y	paks	2921	    1,020	0.002	1271.1538	hun_news_2017_00034805
24720	Gól nélküli döntetlent játszott a Videoton a Paks otthonában.	Y	paks	2921	    1,020	0.002	1587.125	hun_news_2017_00589169
24721	Ha az eddigi pénztárgépek mellett nem szorult ez vissza, ezután se fog!	Y	szorult	2921	    1,020	0.002	749.1667	hun_news_2016_00600930
24722	Éppen ezért az, hogy ki az igazi barát, csak akkor de­rül ki, amikor valóban szorult helyzetben vagyunk.	Y	szorult	2921	    1,020	0.002	783.3125	hun_news_2016_00519434
24723	A 60 év felettiek között viszont az MSZP mögött ismét a második helyre szorult a Fidesz, akárcsak múlt hónapban.	Y	szorult	2921	    1,020	0.002	823.625	hun_news_2011_00986769
24724	Autó alá szorult, később belehalt Kérjük jelentkezzen be, hogy a teljes cikket olvashassa Ahhoz, hogy cikkünket el tudja olvasni, kérjük, jelentkezzen be!	Y	szorult	2921	    1,020	0.002	851.6111	hun_news_2016_00291057
24725	Két éve Magyarország volt az elsõ uniós tagállam, amely a gazdasági válság miatt a valutaalap segítségére szorult.	Y	szorult	2921	    1,020	0.002	890.75	hun_news_2017_00687684
24726	Cikk megjelenítése: 1354Olvasóink értékelése: Ha hozzá szeretne szólni, jelentkezzen be Csütörtökön ünnepélyes körülmények között vette át Magyarország az unió soros elnöki tisztségét.	Y	ünnepélyes	2921	    1,020	0.002	749.6364	hun_news_2017_00432687
24727	Ám szükség volt még egy ünnepélyes beiktatásra is.	Y	ünnepélyes	2921	    1,020	0.002	912.875	hun_news_2016_00195591
24728	Az ünnepélyes megnyitón a japán miniszterelnök is részt vett.	Y	ünnepélyes	2921	    1,020	0.002	923.7778	hun_news_2016_00407995
24729	Hétfőn ünnepélyes keretek között adta át a járdát dr. Kovács Ferenc pol Kérjük jelentkezzen be, hogy a teljes cikket olvashassa Már van előfizetésem vagy korábban regisztráltam!	Y	ünnepélyes	2921	    1,020	0.002	941.72	hun_news_2017_00622512
24730	Az ünnepélyes átadáson polgármester megjegyezte: nehéz három év van a városháza és a kórház mögött.	Y	ünnepélyes	2921	    1,020	0.002	1022.6429	hun_news_2016_00407974
24731	A fiatalok hetven százaléka úgy tartja: gyerek nélkül nem lehet igazán boldog.	Y	hetven	2922	    1,019	0.002	621.6667	hun_news_2011_00451274
24732	Az ügyben hetven másik vádlott van még.	Y	hetven	2922	    1,019	0.002	791.8571	hun_news_2017_00397206
24733	A németek rég nem azok, mint hetven éve.	Y	hetven	2922	    1,019	0.002	908.5	hun_news_2017_00200606
24734	A két felvétel között hetven év telt el.	Y	hetven	2922	    1,019	0.002	964.125	hun_news_2011_00937254
24735	Itthon valami hetven körüli, van ahol ötven.	Y	hetven	2922	    1,019	0.002	1001.5714	hun_news_2017_00662862
24736	De ez már legyen egy másik cikk témája.	Y	témája	2922	    1,019	0.002	439.125	hun_news_2011_00063634
24737	A hét témája: 200 éve született Arany János.	Y	témája	2922	    1,019	0.002	728.2857	hun_news_2017_00086434
24738	Az idei tábor két fő témája a sport és a zene.	Y	témája	2922	    1,019	0.002	862.8	hun_news_2017_00359537
24739	A konferencia témája természetesen az unió volt.	Y	témája	2922	    1,019	0.002	898.2857	hun_news_2011_00018637
24740	A beszélgetés fõ témája várhatóan Oroszország lesz.	Y	témája	2922	    1,019	0.002	1322.4286	hun_news_2017_00022277
24741	De,amit a Volán csinált,az már nem volt jó.	Y	volán	2922	    1,019	0.002	589.6	hun_news_2011_00292148
24742	Budapest–Zalaegerszeg esetében már nem, mert az IC négy óra alatt teszi meg ezt az utat, míg a Volán két és fél óra alatt.	Y	volán	2922	    1,019	0.002	660	hun_news_2017_00428826
24743	Ám most a Volán nem egy, hanem két gyors góllal válaszolt.	Y	volán	2922	    1,019	0.002	743.5455	hun_news_2011_00449194
24744	Ezzel kapcsolatban felhívták a figyelmet arra, hogy jelenleg 24 Volán-vállalat működik az országban.	Y	volán	2922	    1,019	0.002	793.5385	hun_news_2011_00120815
24745	Való igaz az is, hogy járműbeszerzések területén a többi Volán cég sem tud sokat felmutatni.	Y	volán	2922	    1,019	0.002	856.6	hun_news_2017_00979283
24746	A napilap szerint azok az országok, amelyeknek ugyanez korábban sikerült, akkor sokkal kedvezőbb helyzetben voltak, mint most Magyarország.	Y	amelyeknek	2923	    1,016	0.002	715.9444	hun_news_2011_00623002
24747	A mai napon ugyanis 6 motoros baleset is történt az országban, amelyeknek a fele Budapesten következett be.	Y	amelyeknek	2923	    1,016	0.002	763.9333	hun_news_2017_00163966
24748	Magyarország a hatodik helyen áll azon Európai Uniós országok között, amelyeknek a legtöbb méhcsaládja van.	Y	amelyeknek	2923	    1,016	0.002	807.1429	hun_news_2017_00731686
24749	Ez László János szerint jelenleg jól működik, de nem elég hatékonyan, mert sok értelmetlen akció van, amelyeknek nincs hatásuk.	Y	amelyeknek	2923	    1,016	0.002	909.2632	hun_news_2017_00552916
24750	De foglalkoztatnak az egyéb pályázatok is, s nem csupán azok, amelyeknek a haszonélvezői a helyi vagy megyei hatóságok.	Y	amelyeknek	2923	    1,016	0.002	917.5882	hun_news_2011_00621051
24751	Nos, ez a félelem sem jött be.	Y	félelem	2923	    1,016	0.002	743.7143	hun_news_2017_00838685
24752	A félelem csak ezután következik, talán másnap.	Y	félelem	2923	    1,016	0.002	1057.4286	hun_news_2016_00052813
24753	Véleményem szerint azonban a fő ok a félelem.	Y	félelem	2923	    1,016	0.002	1113.2857	hun_news_2017_00987996
24754	Hiány és félelem - Hajdú-bihari NaplóDigitális és nyomtatott előfizetésekDigitális Napló olvasásKüldjön olvasói levelet!	Y	félelem	2923	    1,016	0.002	1483.9167	hun_news_2017_00623851
24755	A veszprémi gyilkosság után ez a félelem erősödött.	Y	félelem	2923	    1,016	0.002	1565.8571	hun_news_2011_00733122
24756	Az elnök szerint a törvényszék feltehetően a héten dönt ez ügyben.	Y	feltehetően	2923	    1,016	0.002	860.1	hun_news_2016_00341521
24757	A vizsgálat szerint azonban a férfi feltehetően balesetet szenvedett.	Y	feltehetően	2923	    1,016	0.002	917.875	hun_news_2011_00990949
24758	Mint feltehetően sokan e levél olvasói közül is.	Y	feltehetően	2923	    1,016	0.002	965	hun_news_2017_00784241
24759	A Szlovák Nemzeti Párt elnökének apja feltehetően öngyilkos lett.	Y	feltehetően	2923	    1,016	0.002	1222.8889	hun_news_2011_00743198
24760	Személyi sérülés feltehetően nem történt, a keletkezett kár kb.	Y	feltehetően	2923	    1,016	0.002	1301.6667	hun_news_2011_00619620
24761	Most van hús, új üzlet, csak pénz nincs!	Y	hús	2923	    1,016	0.002	748.75	hun_news_2011_00159542
24762	Tény, hogy nem ez a legolcsóbb hús, de cserébe az egyik legjobb.	Y	hús	2923	    1,016	0.002	841.1667	hun_news_2016_00940527
24763	A hús úgy-ahogy rendben lett volna, de lehetett volna nagyobb darab, és nem sütötték át rendesen.	Y	hús	2923	    1,016	0.002	843.375	hun_news_2016_00098681
24764	Ez utóbbi annyira finom volt, hogy akár hús nélkül is megállta volna a helyét.	Y	hús	2923	    1,016	0.002	851.8571	hun_news_2016_00566289
24765	Ahol hús van, ott légy is van – tette hozzá.	Y	hús	2923	    1,016	0.002	865.125	hun_news_2017_00091483
24766	Ők még jó néhány évig nem jelennek meg újra vevőként a piacon.	Y	jelennek	2923	    1,016	0.002	796.5833	hun_news_2011_00450862
24767	Annál is inkább, mert naponta jelennek meg újabb és újabb variációk ezzel kapcsolatban.	Y	jelennek	2923	    1,016	0.002	803.5	hun_news_2017_00206145
24768	Nem jelennek meg viszont pont azok – a hajléktalanok, rossz szociális körülmények között élők –, akiknek kellene.	Y	jelennek	2923	    1,016	0.002	856.2	hun_news_2011_00861417
24769	Ezért jelennek meg most újra a lezárt magyar határon.	Y	jelennek	2923	    1,016	0.002	865.5556	hun_news_2016_00552979
24770	Azt még nem tudni, hogy milyen adatok jelennek meg jövõre, de logikus lenne, ha Magyarország is az európai uniós sztenderdekhez igazodna.	Y	jelennek	2923	    1,016	0.002	875.9048	hun_news_2017_00394412
24771	Alig lát el néhány méterre az ember.	Y	méterre	2923	    1,016	0.002	795.8571	hun_news_2017_00153589
24772	A busz még mindig nem akkor jön, amikor a tábla szerint kellene, de az app méterre pontosan mutatja, hol jár éppen.	Y	méterre	2923	    1,016	0.002	798	hun_news_2017_00030869
24773	A következő szabad parkoló ugyanis öt-tíz méterre volt.	Y	méterre	2923	    1,016	0.002	815.5556	hun_news_2016_00137491
24774	Ez csupán néhány méterre van attól az ároktól, amelynek a másik oldalán már ott a kifutó.	Y	méterre	2923	    1,016	0.002	878.2667	hun_news_2011_00076103
24775	Éjszaka él, akárcsak a város, és még soha, senki nem látta enni… 1973-ban született Budapesten, nagyjából száz méterre attól a helytõl, ahol most él.	Y	méterre	2923	    1,016	0.002	882.5	hun_news_2017_00488255
24776	A színész az RTL Klub Fókusz című műsorában korábban úgy fogalmazott, soha életében nem volt még ilyen nehéz helyzetben, mint most.	Y	műsorában	2923	    1,016	0.002	666.619	hun_news_2011_00601573
24777	De volt egy nagyon normális román ember a tegnap este az RTV műsorában.	Y	műsorában	2923	    1,016	0.002	738.6923	hun_news_2016_00461237
24778	Akkor lesz 50 százalék alatt a GDP-arányos államadósság Magyarországon, ha sokáig nem lesz szocialista kormány - mondta Szijjártó Péter, a miniszterelnök szóvivője a Magyar Televízió Ma reggel című műsorában.	Y	műsorában	2923	    1,016	0.002	765.44	hun_news_2011_00552309
24779	Én biztos vagyok benne, hogy lesz idén adócsökkentés, csak az a kérdéses, hogy annak mekkora lesz a mértéke – jelentette ki Pokorni Zoltán a Magyar Televízió Ma reggel című műsorában.	Y	műsorában	2923	    1,016	0.002	849.84	hun_news_2011_00184019
24780	A lengyel–magyar barátság példa lehet az európai országok számára, de különösen a kelet- és közép-európai országoknak – mondta az Országgyűlés elnöke a Kossuth Rádió Vasárnapi Újság című műsorában.	Y	műsorában	2923	    1,016	0.002	870.68	hun_news_2016_00155783
24781	De a mai Indiában is több mint 150 millió muszlim él.	Y	muszlim	2923	    1,016	0.002	729.2	hun_news_2017_00446726
24782	Az arab szó szerint azt mondta: Nemsokára a világon mindenki muszlim lesz.	Y	muszlim	2923	    1,016	0.002	802.5	hun_news_2011_00445707
24783	Nálunk él néhány tízezer olasz és pár millió muszlim.	Y	muszlim	2923	    1,016	0.002	812.5556	hun_news_2011_00328526
24784	Orbán szerint ha így folytatódik az európai politika, szép lassan egyre több lesz a muszlim, és Európára nem fogunk ráismerni.	Y	muszlim	2923	    1,016	0.002	824.9	hun_news_2016_00852735
24785	Annak ellenére, hogy muszlim országban élek, a nõk számára nem annyira zárt világ.	Y	muszlim	2923	    1,016	0.002	852	hun_news_2017_00205677
24786	Nonprofit gazdasági társaság lesz a Kulturális Központ?	Y	nonprofit	2923	    1,016	0.002	728.5714	hun_news_2011_00943485
24787	A szakember szerint a Pécsi Sport Nonprofit Zrt.	Y	nonprofit	2923	    1,016	0.002	767.7143	hun_news_2016_00253480
24788	A nonprofit szervezetek körében 16 százalékos az egészségügyi és a szociális szervezetek aránya.	Y	nonprofit	2923	    1,016	0.002	781.8	hun_news_2017_00207985
