ORDER	SENTENCE	STATUS	WORD	RANK	COUNT	COUNT_REL	INDEX	ID
24001	A játékos több mint másfél év után léphetett pályára a válogatott színeiben.	Y	színeiben	2889	    1,052	0.0021	866.0909	hun_news_2017_00097019
24002	Tamás pont két éve, még a Lemgo színeiben is sérült volt – de az az eset jóval nagyobb ijedelmet okozott.	Y	színeiben	2889	    1,052	0.0021	880.6667	hun_news_2017_00932192
24003	Több mint tíz éve politizál az RMDSZ színeiben.	Y	színeiben	2889	    1,052	0.0021	925.875	hun_news_2011_00393868
24004	Azóta ugyanis Szalai Ádám az utolsó, aki mesterhármast ért el a nemzeti együttes színeiben.	Y	színeiben	2889	    1,052	0.0021	935.1429	hun_news_2016_00391163
24005	Iman két év alatt 293 gólt szerzett a csapat színeiben.	Y	színeiben	2889	    1,052	0.0021	941	hun_news_2016_00660683
24006	Mert egyikük sem közgazdász, hanem politikus - mondta.	Y	közgazdász	2890	    1,051	0.0021	749.2857	hun_news_2016_00765670
24007	A közgazdász azt mondja: most sem késő.	Y	közgazdász	2890	    1,051	0.0021	837.8571	hun_news_2011_00443195
24008	Baja szerint az új kormányfő ne legyen közgazdász típusú.	Y	közgazdász	2890	    1,051	0.0021	919.7778	hun_news_2011_00875651
24009	Új elnökség, új feladatok (Romániai Magyar Közgazdász Társaság) - 2012.	Y	közgazdász	2890	    1,051	0.0021	1357.2857	hun_news_2016_00968732
24010	A hozzászólás nem küldhető el. Elfogadom a fórumszabályzatot: Moderálási alapelvek – Cikkhozzászólás szabályai Közgazdász.	Y	közgazdász	2890	    1,051	0.0021	1392.5833	hun_news_2016_00097718
24011	½Persze, szerencse is kellett ahhoz, hogy minden teljes legyen.	Y	szerencse	2890	    1,051	0.0021	434.1111	hun_news_2017_00000145
24012	Még szerencse, hogy nem történt nagy baj.	Y	szerencse	2890	    1,051	0.0021	556.1429	hun_news_2017_00757793
24013	Hát jól számított, mert vele járt a szerencse.	Y	szerencse	2890	    1,051	0.0021	753	hun_news_2016_00620442
24014	Még szerencse, hogy nem Kínában volt a földrengés.	Y	szerencse	2890	    1,051	0.0021	947.125	hun_news_2016_00760189
24015	Szerencse hogy annak idején Pintér kijelentette hogy az országba..	Y	szerencse	2890	    1,051	0.0021	1218.875	hun_news_2017_00917486
24016	Mi azonban azt gondoljuk, hogy, ha jó, ha rossz, mi ezt nem akarjuk.	Y	akarjuk	2891	    1,050	0.0021	617.7273	hun_news_2017_00766145
24017	Ha jó ez, ha rossz, mi ezt nem akarjuk - szögezte le.	Y	akarjuk	2891	    1,050	0.0021	635.7	hun_news_2016_00607609
24018	Nem akarjuk, hogy a fiatalok – ott is, és itt is – ebben nõjenek fel.”	Y	akarjuk	2891	    1,050	0.0021	661.75	hun_news_2016_00817386
24019	S ami nagyon fontos: nem akarjuk, hogy ez halott város legyen, de aki menni akar innen, azt segítsék.	Y	akarjuk	2891	    1,050	0.0021	723.8333	hun_news_2011_00006550
24020	Ezért is mondom, hogy talán előbb ezt volna jobb tisztábba tenni, mint úgy nekimenni egy ilyen hatalmas vállalkozásnak, hogy közben még azt sem tudjuk, akarjuk-e igazán.	Y	akarjuk	2891	    1,050	0.0021	791.6154	hun_news_2017_00549972
24021	De persze a szenátor nem emiatt mondott le róla.	Y	szenátor	2891	    1,050	0.0021	631.5556	hun_news_2011_00729678
24022	A szenátor kifejtette: a költségvetés és más politikai döntések alapján biztos benne, hogy a lakosság élete nem lesz könnyebb a következő évben.	Y	szenátor	2891	    1,050	0.0021	750.1053	hun_news_2016_00257795
24023	A független szenátor szerint az ügyben lehet, hogy több nyilvános meghallgatást is fognak tartani.	Y	szenátor	2891	    1,050	0.0021	836.6429	hun_news_2017_00066697
24024	Arról azonban sokkal kevesebben tudnak, hogy milyen utat járt be a politikus, később szenátor addig, hogy egyáltalán jelölt, majd esélyes jelölt lehessen.	Y	szenátor	2891	    1,050	0.0021	877.05	hun_news_2011_00215409
24025	Ezt a szerepet nem csak deklarálni kell, fel is kell tölteni tartalommal – jelentette ki a szenátor.	Y	szenátor	2891	    1,050	0.0021	907.2143	hun_news_2017_00557823
24026	Úgy gondolom, ez rossz az egész emberiség, az egész világ számára” – mondta.	Y	emberiség	2892	    1,049	0.0021	485.6	hun_news_2017_00964018
24027	Mert az emberiség maga is többet tud ma.	Y	emberiség	2892	    1,049	0.0021	506.25	hun_news_2011_00868721
24028	Pécsi Újság - Egyetem - Élet az emberiség után - az egyetemen Élet az emberiség után - az egyetemen2011.	Y	emberiség	2892	    1,049	0.0021	876.25	hun_news_2017_00862922
24029	Az ügynökség közölte: ezért egyértelműen az emberiség a felelős.	Y	emberiség	2892	    1,049	0.0021	1048.375	hun_news_2011_00942278
24030	Ez az alapvető terrorizmus az emberiség ellen.	Y	emberiség	2892	    1,049	0.0021	1302.5	hun_news_2017_00537795
24031	Fõként azért õt, mert senki más nem volt akkor rajtuk kívül a lakásban.	Y	fõként	2892	    1,049	0.0021	820.3077	hun_news_2017_00578322
24032	Ezt fõként az elmúlt pár év tapasztalata hozta össze.	Y	fõként	2892	    1,049	0.0021	889.1111	hun_news_2017_00559314
24033	Persze ez nem fõként az uniós belépésnek volt köszönhetõ, de a horvát közvéleménye még kevésbé lelkes, mint volt két éve.	Y	fõként	2892	    1,049	0.0021	1035.3684	hun_news_2016_00870539
24034	Ennek esélye fõként akkor lenne nagy, ha valamilyen rendszinten is jelentõs esemény (pl.	Y	fõként	2892	    1,049	0.0021	1050.5385	hun_news_2016_00514903
24035	Az új vagyonok mögött pedig fõként a részvények állnak majd.	Y	fõként	2892	    1,049	0.0021	1056.2	hun_news_2016_00406608
24036	Habár nagyon jól tudja, hogy itt most nem ez a kérdés.	Y	habár	2892	    1,049	0.0021	346.5455	hun_news_2016_00601900
24037	Habár csak utólag derül ki mindig, hogy melyik lesz jó film.	Y	habár	2892	    1,049	0.0021	733.1818	hun_news_2017_00597945
24038	Habár lehet még ahhoz is túl okos.	Y	habár	2892	    1,049	0.0021	840.7143	hun_news_2017_00597995
24039	Habár azt nem tudom, hogy kik azok a tehetséges fiatalok.	Y	habár	2892	    1,049	0.0021	849.5	hun_news_2016_00601793
24040	Ismét nehéz mérkőzés vár ránk, habár a bajnokságban mindegyik találkozó ilyen.	Y	habár	2892	    1,049	0.0021	1151.4545	hun_news_2017_00660896
24041	Kiemelte: a FIDESZ programja arról szól, hogy hogyan lehet egy erős Magyarországot teremteni.	Y	teremteni	2892	    1,049	0.0021	781.2308	hun_news_2011_00600396
24042	Kellett, hogy legyen, hisz végül sikerült velük kapcsolatot teremteni.	Y	teremteni	2892	    1,049	0.0021	788.4444	hun_news_2017_00682629
24043	Hogyan tud magának egy külföldi otthont teremteni Magyarországon?	Y	teremteni	2892	    1,049	0.0021	919.125	hun_news_2016_00630980
24044	Ugyanakkor a megfelelő technikai eszközök és jogszabályok segítségével rendet lehet teremteni és azt fenn is lehet tartani.	Y	teremteni	2892	    1,049	0.0021	1088.4	hun_news_2016_00959251
24045	Iskola, ahová örömmel járnak a diákok Borsodban nem egyszerû dolog sikeres iskolát teremteni.	Y	teremteni	2892	    1,049	0.0021	1557.4615	hun_news_2016_00664155
24046	Ma már ezt senki sem gondolja róla, azt viszont igen, hogy nagyon erőszakos.	Y	erőszakos	2893	    1,048	0.0021	484.3846	hun_news_2017_00736378
24047	Nem vagyok már fiatal, és nagyon elfáradtam, ráadásul a világ is túl erőszakos lett.	Y	erőszakos	2893	    1,048	0.0021	588	hun_news_2017_00831133
24048	Legalább 94 újságíró halt erőszakos halált az elmúlt évben - közölte pénteken a Nemzetközi Újságíró Szövetség.	Y	erőszakos	2893	    1,048	0.0021	879.4615	hun_news_2011_00582405
24049	Megugrott a hivatalos személy elleni erőszakos esetek száma, itt a növekedés egy év alatt 8 százalék.	Y	erőszakos	2893	    1,048	0.0021	886.7857	hun_news_2017_00759001
24050	Ha az úgynevezett jobboldal nem lenne ennyire erőszakos számomra, mint többnyire itt is.	Y	erőszakos	2893	    1,048	0.0021	894.6923	hun_news_2011_00083411
24051	Már 2010-ben is a voltak a legjobbak a maguk két góljával.	Y	góljával	2893	    1,048	0.0021	857.4444	hun_news_2016_00739798
24052	Egy perccel késõbb ugyanakkor Andric góljával vezetést szerzett Horváth Ferenc együttese, de ez a találat csak a szép búcsúra volt elég, ugyanis az eredmény már nem változott.	Y	góljával	2893	    1,048	0.0021	997.1154	hun_news_2016_00486103
24053	Hafner góljával már három oda - négy perccel a vége elõtt.	Y	góljával	2893	    1,048	0.0021	1055.2	hun_news_2017_00600701
24054	A magyar játékos a 92. percben szerzett góljával állította be a végeredményt.	Y	góljával	2893	    1,048	0.0021	1090.1111	hun_news_2017_00160017
24055	A második játékrészben David Villa góljával szerzett vezetést, aztán az eredmény már nem változott.	Y	góljával	2893	    1,048	0.0021	1141.2143	hun_news_2011_00253756
24056	Az első, ami az eszébe jutott, a gyerek volt.	Y	eszébe	2894	    1,047	0.0021	525	hun_news_2011_00531064
24057	Az ám, jutott eszébe; de hát ez az állat él!	Y	eszébe	2894	    1,047	0.0021	695.2222	hun_news_2011_00081762
24058	Csoda, hogy más cégnek még nem jutott az eszébe.	Y	eszébe	2894	    1,047	0.0021	854.7778	hun_news_2016_00447314
24059	Az arab nők kapcsán miért pont ők jutottak önnek az eszébe, azt sem értem teljesen.	Y	eszébe	2894	    1,047	0.0021	858.7857	hun_news_2017_00318004
24060	Remélem ilyen eszébe se jut a kormánynak!	Y	eszébe	2894	    1,047	0.0021	1004	hun_news_2011_00605097
24061	Jelenleg nem az a fontos, hogy ki milyen futballista, hanem hogy ki milyen ember.	Y	futballista	2894	    1,047	0.0021	328.1818	hun_news_2016_00672882
24062	A 34 éves, magyar válogatott futballista kedden írta alá a megállapodást.	Y	futballista	2894	    1,047	0.0021	716.6667	hun_news_2011_00571402
24063	A futballista pontosan tudja, mikor megy neki jól, s mikor kevésbé, és igen, újabban jól megy a játék.	Y	futballista	2894	    1,047	0.0021	764.2857	hun_news_2017_00067132
24064	Régen volt már ugyanis arra példa, hogy a válogatott keretében ilyen sok trófeát begyűjtő futballista legyen, mint most.	Y	futballista	2894	    1,047	0.0021	819.3333	hun_news_2016_00881865
24065	Már két transzplantáción van túl a 36 éves korábbi futballista.	Y	futballista	2894	    1,047	0.0021	823.5556	hun_news_2017_00740766
24066	Azt mondta, tetszik a kocsi és az ajánlat is.	Y	ajánlat	2895	    1,046	0.0021	778	hun_news_2011_00609251
24067	Gyors üzlet volt, csütörtökön jött az ajánlat.	Y	ajánlat	2895	    1,046	0.0021	1026.1429	hun_news_2016_00597902
24068	Apró hiba, hogy ez volt az egyetlen benyújtott ajánlat..	Y	ajánlat	2895	    1,046	0.0021	1029	hun_news_2016_00228604
24069	Az ajánlat – többek között – találkozott az rt.	Y	ajánlat	2895	    1,046	0.0021	1047.8333	hun_news_2011_00877103
24070	Fórum moderációs elveinket itt olvashatja: http://www.napi.hu/info/adatvedelem.html Semmiféle ajánlat nincs ebben.	Y	ajánlat	2895	    1,046	0.0021	1302.875	hun_news_2016_00587071
24071	Az esetre szombat délután és hétfõ reggel között került sor.	Y	hétfõ	2895	    1,046	0.0021	850.5	hun_news_2017_00352340
24072	Giró-Szász András azt mondta, a rendszer mûködésének hétfõ az elsõ napja, s egy-két hét után meg kell majd nézni, hogy kell-e bármit is módosítani rajta.	Y	hétfõ	2895	    1,046	0.0021	901.8889	hun_news_2016_00592783
24073	Ráadásul a meteorológiai szolgálat szerint az esõ helyi idõ szerint hétfõ este 9-ig nem is fog megszûnni.	Y	hétfõ	2895	    1,046	0.0021	972.625	hun_news_2016_00877839
24074	A napirend azonban így is szokatlan, hétfõ és kedd után ugyanis pénteken is lesz egy ülésnap.	Y	hétfõ	2895	    1,046	0.0021	974.6667	hun_news_2016_00201441
24075	A személycserét Barack Obama elnök közép-európai idõ szerint hétfõ este 9 órakor jelenti be.	Y	hétfõ	2895	    1,046	0.0021	987.6429	hun_news_2017_00253553
24076	Két új miniszter tette le a hivatali eskütNemzetpolitikai lapszemle Melyik városhoz lakik a legközelebb?	Y	hivatali	2895	    1,046	0.0021	842.1538	hun_news_2017_00690334
24077	Az önkormányzat egyébként azt is bejelentette, hogy a hivatali gépkocsikat a dolgozók nem használják, csak elengedhetetlen esetben.	Y	hivatali	2895	    1,046	0.0021	952.6875	hun_news_2017_00378648
24078	Úgy teszünk, mintha hivatali költségvetés nem is lenne a világon amúgy.	Y	hivatali	2895	    1,046	0.0021	975.3636	hun_news_2011_00202236
24079	Hivatali visszaélés történhetett a NAV-ban - Napi.huEz a program emailben elküldi a cikk címét és bevezetőjét, önnek csak a címzett e-mail címét kell megadnia.	Y	hivatali	2895	    1,046	0.0021	1005.4091	hun_news_2017_00626107
24080	Hozzátették, nem szabad elfeledkezni arról, hogy az Orbán-kormány hivatali ideje alatt 600 ezer magyar hagyta el az országot, akik szintén gazdasági bevándorlókként próbálnak boldogulni egy másik országban.	Y	hivatali	2895	    1,046	0.0021	1010.5	hun_news_2016_00644914
24081	Mit tett volna a Fidesz, ha hasonló csalás történik az MSZP-kormányok alatt?	Y	kormányok	2895	    1,046	0.0021	619.4615	hun_news_2017_00789248
24082	Erre a szocialista kormányok nem voltak képesek - tette hozzá.	Y	kormányok	2895	    1,046	0.0021	642.2222	hun_news_2017_00519788
24083	Nálunk még sem azt az utat választotta a hatalom, mint a horvát, lengyel stb. kormányok.	Y	kormányok	2895	    1,046	0.0021	842.6429	hun_news_2016_00809728
24084	Ennek a kormánynak annyi dolgot kell helyére tenni, amennyit az elmúlt 100 évben tettek a kormányok!	Y	kormányok	2895	    1,046	0.0021	983.6429	hun_news_2011_00040346
24085	A nemzeti kormányok számára alapvetően két finanszírozási forma van.	Y	kormányok	2895	    1,046	0.0021	1124.7778	hun_news_2016_00206167
24086	Persze hogy nagy a kínai gazdaság, másfél milliárd ember áll mögötte.	Y	mögötte	2895	    1,046	0.0021	503.9091	hun_news_2016_00870744
24087	A hír maga is izgalmas, de az még inkább, ami mögötte van.	Y	mögötte	2895	    1,046	0.0021	521.3333	hun_news_2016_00092063
24088	A dollár azért erős mert hatalmas gazdaság áll mögötte, ilyen egyszerű.	Y	mögötte	2895	    1,046	0.0021	637.7273	hun_news_2016_00047758
24089	Mögötte meg a többi busz rá vár!”	Y	mögötte	2895	    1,046	0.0021	939.8571	hun_news_2017_00793587
24090	No meg a mögötte álló baloldali roma koalíció.	Y	mögötte	2895	    1,046	0.0021	1310.5	hun_news_2017_00837985
24091	Hát ki tegye meg ezt, ha nem mi?	Y	tegye	2895	    1,046	0.0021	444.25	hun_news_2016_00620485
24092	3.Mindenki előtt ott a lehetőség, hogy azt tegye amit akar.	Y	tegye	2895	    1,046	0.0021	486.5	hun_news_2011_00605253
24093	Hogy aki nem akar hétvégén dolgozni, az ne tegye?	Y	tegye	2895	    1,046	0.0021	624.7778	hun_news_2016_00630242
24094	Ha még nem regisztrált, kérjük, tegye meg.	Y	tegye	2895	    1,046	0.0021	929.1429	hun_news_2016_00610823
24095	Ezt tegye, ha utcán fekvő embert lát!	Y	tegye	2895	    1,046	0.0021	1317.8571	hun_news_2016_00564813
24096	Az Egyesült Államokban körülbelül még 16 millió ilyen típusú telefon van.	Y	telefon	2895	    1,046	0.0021	697.4	hun_news_2016_00331060
24097	pénz és telefon pedig nem volt nála.	Y	telefon	2895	    1,046	0.0021	759.2857	hun_news_2017_00867432
24098	Nekem nem nagyon tetszett ez a telefon.	Y	telefon	2895	    1,046	0.0021	791.2857	hun_news_2011_00672038
24099	Lett is internet, meg telefon, meg TV és meleg.	Y	telefon	2895	    1,046	0.0021	882.5	hun_news_2016_00728781
24100	Szakértői telefon - Észak-MagyarországDigitális és nyomtatott előfizetésekDigitális Észak olvasásLevél a szerkesztőségnekSpóroljon csoportos beszedéssel!	Y	telefon	2895	    1,046	0.0021	1355.4167	hun_news_2016_00911796
24101	Csütörtökön jön Cameron Budapestre - Napi.huEz a program emailben elküldi a cikk címét és bevezetőjét, önnek csak a címzett e-mail címét kell megadnia.	Y	cameron	2896	    1,045	0.0021	835	hun_news_2017_00444262
24102	Cameron nem fejtette ki részletesen, hogy ez mit jelent.	Y	cameron	2896	    1,045	0.0021	989	hun_news_2017_00430307
24103	Cameron neve a napokban egy botrány kapcsán is felmerült már.	Y	cameron	2896	    1,045	0.0021	1002	hun_news_2011_00074747
24104	Cameron 1999 óta most elõször szerepel a listán.	Y	cameron	2896	    1,045	0.0021	1027.1429	hun_news_2017_00430247
24105	Cameron szerint számos brit áldozat is lehet Párizsban - kulfold.	Y	cameron	2896	    1,045	0.0021	1084.7778	hun_news_2017_00430319
24106	A fenti képen látható ellenőrzőkód: Hol van a cikk eleje?	Y	eleje	2896	    1,045	0.0021	651.6667	hun_news_2011_00615052
24107	A dollár közel húsz százalékkal erősödött a forinttal szemben az év eleje óta.	Y	eleje	2896	    1,045	0.0021	758.4167	hun_news_2011_00739398
24108	Az eleje volt nehezebb vagy a vége?	Y	eleje	2896	    1,045	0.0021	823.2857	hun_news_2011_00629679
24109	Az euró az év eleje óta a dollárral szemben 12 százalékkal gyengült.	Y	eleje	2896	    1,045	0.0021	963.7	hun_news_2017_00354190
24110	A december vége, január eleje is komoly munkával telt a játékosok számára.	Y	eleje	2896	    1,045	0.0021	1027.3636	hun_news_2011_00147830
24111	Az ismeretlen körülmények között történt balesetben a 49 éves kerékpáros olyan súlyos sérüléseket szenvedett, hogy már nem lehetett rajta segíteni.	Y	kerékpáros	2896	    1,045	0.0021	721.6316	hun_news_2017_00367738
24112	A baleset következtében a 48 éves kerékpáros férfi a helyszínen életét vesztette.	Y	kerékpáros	2896	    1,045	0.0021	861.3333	hun_news_2017_00015734
24113	A kerékpáros olyan súlyos sérüléseket szenvedett, hogy a helyszínen életét vesztette.	Y	kerékpáros	2896	    1,045	0.0021	965.8	hun_news_2017_00109537
24114	A baleset során a kerékpáros hölgy a helyszínen életét vesztette.	Y	kerékpáros	2896	    1,045	0.0021	1093.875	hun_news_2016_00016065
24115	A balesetben a kerékpáros életét vesztette - közölte honlapján a rendõrség.	Y	kerékpáros	2896	    1,045	0.0021	1219.375	hun_news_2017_00015376
24116	Nagyon sok kihívás volt az elmúlt évben.	Y	kihívás	2896	    1,045	0.0021	488.8571	hun_news_2017_00806151
24117	Az elmúlt fél év hatalmas kihívás volt számomra.	Y	kihívás	2896	    1,045	0.0021	667.875	hun_news_2017_00336130
24118	A kihívás nagy Maros megyében” – jelentette ki.	Y	kihívás	2896	    1,045	0.0021	841.4286	hun_news_2017_00116074
24119	Izgalmas kihívás volt számomra, hiszen teljesen más típusú, mint a kanadai film volt.	Y	kihívás	2896	    1,045	0.0021	893.9167	hun_news_2016_00668362
24120	Az új kezdeményezés előtt álló kihívás nyilvánvaló.	Y	kihívás	2896	    1,045	0.0021	1225.8571	hun_news_2011_00161876
24121	Komoly lehetőséget és egyben felelősséget jelent ez.	Y	felelősséget	2897	    1,044	0.0021	788.1429	hun_news_2011_00473661
24122	Orbán Viktor kijelentette: a döntést ő és a kormány hozza, így a felelősséget is ő vállalja, és az ország sorsa szempontjából ez a lényeges.	Y	felelősséget	2897	    1,044	0.0021	884.5263	hun_news_2017_00851202
24123	Hogy a valóság mégsem ilyen, egyértelműen politikai felelősséget jelent.	Y	felelősséget	2897	    1,044	0.0021	957.7778	hun_news_2016_00631165
24124	Felelős politikus az,aki nem vállal felelősséget?	Y	felelősséget	2897	    1,044	0.0021	1076	hun_news_2011_00061635
24125	Vállalja-e a kormány a civil áldozatok miatti erkölcsi felelősséget?	Y	felelősséget	2897	    1,044	0.0021	1511.7778	hun_news_2016_00978639
24126	K. L.: Én is így gondolom, és erre jó példa, hogy az Európai Bizottság elnöke, Jean-Claude Juncker Európa legkisebb országának volt a miniszterelnöke, és senki nem tiltakozott emiatt a nagy államok közül.	Y	jean	2897	    1,044	0.0021	1002.2581	hun_news_2017_00701231
24127	Mint mondta: ezt nem sikerült elérni, Jean-Claude Juncker, az Európai Bizottság elnöke világossá tette, hogy a bizottság nem vonja vissza a javaslatot, így patthelyzet alakult ki.	Y	jean	2897	    1,044	0.0021	1059.5	hun_news_2017_00786609
24128	A katalán kormány azt is lehetségesnek tartja, hogy az új állam az Európai Unió tagja maradjon annak ellenére, hogy Jean-Claude Juncker, az Európai Bizottság elnöke szeptember 22-én ismét nyíltan kijelentette ennek ellenkezõjét.	Y	jean	2897	    1,044	0.0021	1068.3793	hun_news_2017_00105885
24129	A kelleténél is jobban élt vele, s ezzel csak tovább növelte a benső kettészakadást, mondja Jean Lacouture, de erről talán még nem mondták ki az utolsó szót.	Y	jean	2897	    1,044	0.0021	1073.2308	hun_news_2011_00759501
24130	Jean-Claude Trichet elnök még a közelmúltban is hangoztatta, hogy a vezetése alatt álló Európai Központi Bank még Görögország esetében sem tér el az eddigi gyakorlattól és nem tesz kivételt.	Y	jean	2897	    1,044	0.0021	1125.0714	hun_news_2011_00547679
24131	Nagyon nagy hiba lenne még egyszer, akár egy percre is az rmdsz től várni valami pozitívumot.	Y	percre	2897	    1,044	0.0021	808.5625	hun_news_2016_00807195
24132	Ez azt jelenti, hogy percre pontosan felveszik azt, hogy az emberek mit csinálnak egy adott napon.	Y	percre	2897	    1,044	0.0021	876.2857	hun_news_2011_00130429
24133	Mondom: felmehetek egy pár percre, mert két óra múlva jön a másik autó, s arra csak fel tudok ugrani.	Y	percre	2897	    1,044	0.0021	894.7368	hun_news_2016_00796268
24134	Csak 10 percre vagyunk az Örstől, nem a világ vége.	Y	percre	2897	    1,044	0.0021	907.5556	hun_news_2011_00035034
24135	Soha nem borultam ki ezért egy percre sem.	Y	percre	2897	    1,044	0.0021	919.375	hun_news_2016_00900863
24136	Ez az egyik legnagyobb jótékonysági projekt a világon.	Y	jótékonysági	2898	    1,043	0.0021	736.875	hun_news_2017_00538218
24137	A mostani már a 16. ilyen jótékonysági esemény.	Y	jótékonysági	2898	    1,043	0.0021	865.8333	hun_news_2017_00190511
24138	A jótékonysági akció az év végéig tart.	Y	jótékonysági	2898	    1,043	0.0021	895.4286	hun_news_2011_00771654
24139	Nyilvánvalóan ez soha nem jöhetett volna létre a jótékonysági szervezet nélkül.	Y	jótékonysági	2898	    1,043	0.0021	1004.2727	hun_news_2016_00842397
24140	A 24 éves támadó egyébként csütörtökön egy jótékonysági mérkőzésen is pályára lép hazájában.	Y	jótékonysági	2898	    1,043	0.0021	1026.25	hun_news_2017_00009781
24141	Késõbb ugyan a Twitter-oldalán jelezte, hogy jól van, egy francia újságíró viszont biztos abban, hogy nem a játékos küldte az üzenetet.	Y	küldte	2898	    1,043	0.0021	800.4	hun_news_2016_00690200
24142	Nem először küldte be a szelvényt, ám most nyert először.	Y	küldte	2898	    1,043	0.0021	859.6667	hun_news_2011_00333206
24143	A fotót az egyik utas küldte be, aki azt írja, nem ez volt az egyetlen probléma a buszon.	Y	küldte	2898	    1,043	0.0021	877.4375	hun_news_2016_00068492
24144	A határok nyitva voltak és több ezer magyar jött akkor Horvátországba, és senki sem küldte őket vissza - fűzte hozzá.	Y	küldte	2898	    1,043	0.0021	915.1111	hun_news_2016_00083517
24145	Személy szerint úgy éreztem, hogy a jó Isten küldte õket a ki nem mondott imámra.	Y	küldte	2898	    1,043	0.0021	921.7857	hun_news_2017_00915060
24146	Nincs olyan pedagógus, aki ne kapta volna meg a fizetését – tette hozzá.	Y	pedagógus	2898	    1,043	0.0021	661.1667	hun_news_2017_00836632
24147	Úgy látom, az marad csak ma a pedagógus pályán, aki szereti csinálni - vagy nem tud mást ezen kívül.	Y	pedagógus	2898	    1,043	0.0021	673.6667	hun_news_2011_00061745
24148	Nagyon jó ez az akció és a diákok is örülnek neki” – mondta a pedagógus.	Y	pedagógus	2898	    1,043	0.0021	747.0769	hun_news_2017_00804938
24149	Neve már a ’80-as években is fogalom volt – és nem csupán a pedagógus társadalom körében.	Y	pedagógus	2898	    1,043	0.0021	758.2857	hun_news_2017_00833864
24150	A fiatal pedagógus korábban egy szalagavatóról indult haza, ám oda soha nem érkezett meg és hírt sem adott magáról.	Y	pedagógus	2898	    1,043	0.0021	770.7368	hun_news_2016_00061486
24151	Kérjük röviden írja meg, hol és mikor készült a fotó.	Y	röviden	2898	    1,043	0.0021	588.3	hun_news_2011_00822615
24152	Hát ez egy olyan kérdés, amire nem lehet röviden válaszolni.	Y	röviden	2898	    1,043	0.0021	825.5	hun_news_2016_00620049
24153	A cikk röviden: hó van de az éppen nem ahhoz tartozik akit kérdeztek :D Nos igen!	Y	röviden	2898	    1,043	0.0021	853.4375	hun_news_2011_00202889
24154	Csak nagyon röviden sikerült beszélni vele, mert azt mondta, hívjuk késõbb, éppen egy megbeszélésen van.	Y	röviden	2898	    1,043	0.0021	882.6667	hun_news_2017_00439622
24155	Ez röviden azt jelenti: ha nem akarnak, nem fizetnek többet az ügyfelek.	Y	röviden	2898	    1,043	0.0021	897	hun_news_2016_00558993
24156	Nagy koncertet akkor szeretnék, ha megjelenik a lemezem, ami egyébként már készen van, de még nem döntöttük el, mikor jön ki és milyen formában.	Y	koncertet	2899	    1,042	0.0021	754.1667	hun_news_2017_00803575
24157	Egy jó koncertet sem láttam már régen, mert vagy nincs, vagy pénzem nincs amikor van.	Y	koncertet	2899	    1,042	0.0021	765.6154	hun_news_2011_00141175
24158	Az elmúlt három évben több, mint 70 koncertet tartott, egy igen széles repertoárral.	Y	koncertet	2899	    1,042	0.0021	775.5833	hun_news_2016_00340142
24159	Az elmúlt két évben egyre népszerűbbé vált együttes igen sikeres koncertet adott a Szigeten tavaly is.	Y	koncertet	2899	    1,042	0.0021	805.75	hun_news_2011_00396099
24160	Jó volt öt évvel ezelőtt is, nagyon szerettük és a mai napig nagyon szeretjük azt a koncertet.	Y	koncertet	2899	    1,042	0.0021	841.2667	hun_news_2011_00618941
24161	Vasárnap is lehet még néhol havas eső, de akkor már egyre kevesebb helyen várható csapadék.	Y	néhol	2899	    1,042	0.0021	777.8	hun_news_2016_00984627
