ORDER	SENTENCE	STATUS	WORD	RANK	COUNT	COUNT_REL	INDEX	ID
3001	Und wo ist er an die Macht gekommen?	Y	gekommen	577	  2,507	0.0156	125	german_at_news_2012_00885749
3002	Wie ist er zu diesen gekommen?	Y	gekommen	577	  2,507	0.0156	139.1667	german_at_news_2012_00955781
3003	Wie sind Sie dazu gekommen?	Y	gekommen	577	  2,507	0.0156	159.2	german_at_news_2012_00959333
3004	Wie sind wir so weit gekommen?	Y	gekommen	577	  2,507	0.0156	187.5	german_at_news_2012_00959345
3005	Vielleicht wäre alles ganz anders gekommen,.	Y	gekommen	577	  2,507	0.0156	312.8333	german_at_news_2012_00901922
3006	Denn es könne ja nicht sein, „dass in Tirol jeder machen kann was er will“.	Y	tirol	578	  2,506	0.0156	132.2	german_at_news_2012_00220580
3007	Das sind derzeit in Tirol zwei Personen.	Y	tirol	578	  2,506	0.0156	188.4286	german_at_news_2012_00195750
3008	Oder dieser Fall in Tirol.	Y	tirol	578	  2,506	0.0156	198.8	german_at_news_2012_00741109
3009	Zum Vergleich: In Niederösterreich sind es 7.400 Euro und in Tirol rund 11.300 Euro.	Y	tirol	578	  2,506	0.0156	200	german_at_news_2012_00990975
3010	Es kann doch nicht sein, dass in Tirol fast alles erlaubt ist, in Wien nichts.	Y	tirol	578	  2,506	0.0156	205.1429	german_at_news_2012_00464238
3011	Ist das nicht zu viel des Guten?	Y	guten	579	  2,504	0.0156	107.8571	german_at_news_2012_00615698
3012	Wir sind auf einem sehr guten Weg.	Y	guten	579	  2,504	0.0156	150.1429	german_at_news_2012_00969531
3013	Die guten Mitarbeiter, die schon viele Jahre bei uns sind.	Y	guten	579	  2,504	0.0156	171	german_at_news_2012_00310637
3014	Dann heißt es schnell sein, um einen guten Platz zu finden.	Y	guten	579	  2,504	0.0156	195.3636	german_at_news_2012_00152710
3015	Dies hat einen guten Grund.	Y	guten	579	  2,504	0.0156	252	german_at_news_2012_00357840
3016	Alle Welt erwartet, dass er das kann.	Y	erwartet	580	  2,501	0.0155	138.7143	german_at_news_2012_00027183
3017	Heißt das nicht, dass sich die Bevölkerung von der Politik nichts mehr erwartet?	Y	erwartet	580	  2,501	0.0155	157.0769	german_at_news_2012_00532758
3018	Was hat sie sich denn bitte erwartet?	Y	erwartet	580	  2,501	0.0155	180.2857	german_at_news_2012_00925605
3019	Aber eigentlich hätten die Grünen nicht viel mehr erwartet.	Y	erwartet	580	  2,501	0.0155	207.4444	german_at_news_2012_00005298
3020	Ich habe überhaupt nichts erwartet.	Y	erwartet	580	  2,501	0.0155	265	german_at_news_2012_00554525
3021	Adresse, Postleitzahl, Ort oder Bezirk Dabei sein ist alles!	Y	postleitzahl	581	  2,499	0.0155	196.6667	german_at_news_2012_00016055
3022	Adresse, Postleitzahl, Ort oder Bezirk E-Mail: wien.	Y	postleitzahl	581	  2,499	0.0155	254.5	german_at_news_2012_00016711
3023	Adresse, Postleitzahl, Ort oder Bezirk kinder.	Y	postleitzahl	581	  2,499	0.0155	273.3333	german_at_news_2012_00017050
3024	Adresse, Postleitzahl, Ort oder Bezirk E-Mail: wolfgang.	Y	postleitzahl	581	  2,499	0.0155	311.25	german_at_news_2012_00016714
3025	Adresse, Postleitzahl, Ort oder Bezirk bilder.	Y	postleitzahl	581	  2,499	0.0155	324.3333	german_at_news_2012_00015955
3026	Sowohl für Österreich wie auch für Europa.	Y	sowohl	582	  2,497	0.0155	160	german_at_news_2012_00834188
3027	Denn sowohl FPÖ als auch BZÖ sehen das so.	Y	sowohl	582	  2,497	0.0155	205.2222	german_at_news_2012_00223976
3028	Sowohl für mich, als auch für ihn keine gute Entscheidung.	Y	sowohl	582	  2,497	0.0155	210.8889	german_at_news_2012_00834186
3029	Das gilt sowohl für die USA als auch für Japan und Europa.	Y	sowohl	582	  2,497	0.0155	250.4545	german_at_news_2012_00171742
3030	Hier heißt es nicht entweder oder, sondern sowohl als auch.	Y	sowohl	582	  2,497	0.0155	266.9	german_at_news_2012_00539173
3031	Ihn zieht es immer hinaus und er zieht auch viele mit.	Y	hinaus	583	  2,494	0.0155	200.4	german_at_news_2012_00563594
3032	In Europa und weit darüber hinaus.	Y	hinaus	583	  2,494	0.0155	257.5	german_at_news_2012_00599448
3033	Doch Sie brauchen noch etwas darüber hinaus.	Y	hinaus	583	  2,494	0.0155	272.2857	german_at_news_2012_00387830
3034	Darüber hinaus gilt es, auch einmal „Nein“ zu sagen.	Y	hinaus	583	  2,494	0.0155	275.8889	german_at_news_2012_00157053
3035	Aber um die Zukunft der Kirche hat er keine Angst: „Vielleicht müssen wir erst wieder eine kleine Gruppe werden, um dann stärker hinaus zu wirken.	Y	hinaus	583	  2,494	0.0155	278.5	german_at_news_2012_00010564
3036	Dafür setzt sich Österreich auch im Rahmen der EU ein.	Y	setzt	583	  2,494	0.0155	136	german_at_news_2012_00138886
3037	Und genau das setzt er nun um.	Y	setzt	583	  2,494	0.0155	154	german_at_news_2012_00876400
3038	Auf das Ziel, das man sich setzt.	Y	setzt	583	  2,494	0.0155	161.3333	german_at_news_2012_00074208
3039	Denn alles, was sie sich in den Kopf setzt, erreicht sie auch.	Y	setzt	583	  2,494	0.0155	204.3636	german_at_news_2012_00217921
3040	Und wie setzt man durch, dass sie gleich bezahlt werden?	Y	setzt	583	  2,494	0.0155	237.4	german_at_news_2012_00885297
3041	D.h. doch nichts anderes als, dass mehr als 10,-- EURO wieder zurück an den Staat gehen.	Y	d	584	  2,493	0.0155	287.8667	german_at_news_2012_00274180
3042	Sehen Sie sich die Karte in 3D an.	Y	d	584	  2,493	0.0155	309.25	german_at_news_2012_00790022
3043	Ob die 3D-Funktion bereits im iPhone 5 kommt, steht nicht fest.	Y	d	584	  2,493	0.0155	309.9091	german_at_news_2012_00737593
3044	Wenn ich ein 3D Spiel spiele.	Y	d	584	  2,493	0.0155	336.3333	german_at_news_2012_00940916
3045	Er oder sie soll das Smartphone auch selbst in den Händen gehalten und damit einige (3D-)Fotos gemacht haben.	Y	d	584	  2,493	0.0155	340.0526	german_at_news_2012_00442338
3046	Nur gibt es die in dieser Form nicht.	Y	form	585	  2,489	0.0155	103.75	german_at_news_2012_00734588
3047	Aber nur, um in Form zu bleiben.	Y	form	585	  2,489	0.0155	150.8571	german_at_news_2012_00009551
3048	Das habe es in der Form bisher nicht gegeben.	Y	form	585	  2,489	0.0155	153.8889	german_at_news_2012_00172514
3049	NEWS: Wie halten Sie sich in Form?	Y	form	585	  2,489	0.0155	188.8571	german_at_news_2012_00722734
3050	Das hat es in dieser Form überhaupt noch nie gegeben.	Y	form	585	  2,489	0.0155	193.5	german_at_news_2012_00173311
3051	Sind ja nur ein paar Meter.	Y	meter	585	  2,489	0.0155	198.1667	german_at_news_2012_00818681
3052	Es war keine drei Meter lang.	Y	meter	585	  2,489	0.0155	210.6667	german_at_news_2012_00470638
3053	Vielleicht werden es auch zehn Meter.	Y	meter	585	  2,489	0.0155	212.6667	german_at_news_2012_00902035
3054	Und das können immerhin bis zu sechs Meter sein.	Y	meter	585	  2,489	0.0155	213	german_at_news_2012_00870717
3055	Diese letzten Meter hatten mit Laufen nur mehr wenig zu tun.	Y	meter	585	  2,489	0.0155	236	german_at_news_2012_00348173
3056	Und warum läuft das alles über die Isle of Man?	Y	of	586	  2,488	0.0155	406.1	german_at_news_2012_00883186
3057	Wer zählt uns denn zu den „Best of Austria“?	Y	of	586	  2,488	0.0155	418.2222	german_at_news_2012_00949922
3058	Sie ist ein großer Teil seines Lebens“, so ein Freund in der News of the World.	Y	of	586	  2,488	0.0155	441.7333	german_at_news_2012_00808978
3059	Best of Vienna 2/2008 auf Seite 33. Wer nicht unbedingt ausschließlich auf ultraneue Küchenutensilien steht, sondern auch dem einen oder anderen Stück mit Geschichte in seiner Küche Platz bietet, der ist hier mehr als richtig.	Y	of	586	  2,488	0.0155	463.1875	german_at_news_2012_00112653
3060	Hinter dem Titel „City of Design“ steht Buchmann voll und ganz, ob er auch hinter Kunst und Kultur insgesamt steht, weiß ich nicht.	Y	of	586	  2,488	0.0155	466.15	german_at_news_2012_00542047
3061	Nur die Sache mit dem Interview ließ sich nicht mehr aus der Welt schaffen, oder doch?	Y	ließ	587	  2,486	0.0154	189.75	german_at_news_2012_00733863
3062	Der Erfolg in Österreich ließ nicht lange auf sich warten.	Y	ließ	587	  2,486	0.0154	238.2	german_at_news_2012_00237846
3063	Das ließ aber nicht lange auf sich warten.	Y	ließ	587	  2,486	0.0154	243.125	german_at_news_2012_00184555
3064	Allerdings ließ er auch Karl nicht aus der Verantwortung im aktuellen Fall.	Y	ließ	587	  2,486	0.0154	256.8333	german_at_news_2012_00024687
3065	Er selbst ließ zuletzt in ÖSTERREICH wissen: „Ich habe noch nichts unterschrieben.“	Y	ließ	587	  2,486	0.0154	319.75	german_at_news_2012_00444043
3066	Es gibt bereits zahlreiche Unternehmen, die sich für unser Projekt interessieren.	Y	zahlreiche	588	  2,485	0.0154	331.6364	german_at_news_2012_00456626
3067	Auch dieses Jahr kamen wieder zahlreiche Stars.	Y	zahlreiche	588	  2,485	0.0154	339.8571	german_at_news_2012_00064725
3068	Um dieses Ziel zu erreichen, wurden bereits zahlreiche Maßnahmen gesetzt.	Y	zahlreiche	588	  2,485	0.0154	344.1	german_at_news_2012_00864132
3069	Zahlreiche weitere Menschen wurden verletzt.	Y	zahlreiche	588	  2,485	0.0154	354.4	german_at_news_2012_00979105
3070	Wir konnten innerhalb von drei Tagen zahlreiche Personen treffen, die wir schon seit Monaten treffen wollten.	Y	zahlreiche	588	  2,485	0.0154	358.2857	german_at_news_2012_00967788
3071	In der Liebe sollten Sie aber nicht zu direkt werden.	Y	direkt	589	  2,482	0.0154	144.2	german_at_news_2012_00591999
3072	Muss ja gar nicht direkt sein.	Y	direkt	589	  2,482	0.0154	193.6667	german_at_news_2012_00701342
3073	Das muss direkt nach dem Linz Fest im Mai sehr schnell gehen.“	Y	direkt	589	  2,482	0.0154	219	german_at_news_2012_00186380
3074	Damals war sie erst 23 Jahre alt und kam direkt von London.	Y	direkt	589	  2,482	0.0154	287.6364	german_at_news_2012_00144161
3075	Geht das Geld über den Staat Spanien oder geht es direkt an die Banken.	Y	direkt	589	  2,482	0.0154	294.4615	german_at_news_2012_00506975
3076	Das sind um 100 Millionen Euro mehr als im Vorjahr.	Y	vorjahr	590	  2,469	0.0153	104.6667	german_at_news_2012_00196258
3077	Dies seien über 35 Prozent mehr als im Vorjahr.	Y	vorjahr	590	  2,469	0.0153	148.625	german_at_news_2012_00362102
3078	Im Vorjahr waren es „nur“ 372 Millionen pro Jahr.	Y	vorjahr	590	  2,469	0.0153	159.875	german_at_news_2012_00583045
3079	Das ist ein Plus von fast 50 Prozent im Vergleich zum Vorjahr.	Y	vorjahr	590	  2,469	0.0153	181.0909	german_at_news_2012_00178293
3080	Allein im Vorjahr waren es mehr als 3000.	Y	vorjahr	590	  2,469	0.0153	184.5714	german_at_news_2012_00023017
3081	Wird es dazu im Herbst wieder kommen?	Y	herbst	591	  2,467	0.0153	146.2857	german_at_news_2012_00963499
3082	Dabei wäre das gerade jetzt im Herbst so wichtig.	Y	herbst	591	  2,467	0.0153	180.2222	german_at_news_2012_00134597
3083	Im Herbst vergangenen Jahres war man schon wieder dort.	Y	herbst	591	  2,467	0.0153	188.3333	german_at_news_2012_00572438
3084	Das dürfte im Herbst sein.	Y	herbst	591	  2,467	0.0153	245.6	german_at_news_2012_00165102
3085	Das Ergebnis wird für Herbst erwartet.	Y	herbst	591	  2,467	0.0153	292	german_at_news_2012_00166771
3086	Wenn, dann nicht über die Medien.	Y	medien	592	  2,465	0.0153	130.1667	german_at_news_2012_00937598
3087	Steht das auch in allen Medien?	Y	medien	592	  2,465	0.0153	169.3333	german_at_news_2012_00841827
3088	Erst 2007 kam der Fall in die Medien.	Y	medien	592	  2,465	0.0153	189	german_at_news_2012_00444964
3089	Andere sind aus den Medien bekannt.	Y	medien	592	  2,465	0.0153	201	german_at_news_2012_00047186
3090	Was macht ZEIT ONLINE anders als andere Online-Medien?	Y	medien	592	  2,465	0.0153	271.875	german_at_news_2012_00926883
3091	Zu sehen sind neue Arbeiten, die zum ersten Mal in Kärnten präsentiert werden.	Y	präsentiert	593	  2,461	0.0153	158.5385	german_at_news_2012_00995035
3092	Ob es im Juni oder im Herbst präsentiert wird, steht noch immer nicht fest.	Y	präsentiert	593	  2,461	0.0153	186.3846	german_at_news_2012_00738739
3093	Dieses soll im Juni präsentiert werden.	Y	präsentiert	593	  2,461	0.0153	191.8333	german_at_news_2012_00355018
3094	Für 2012 wurde das neue Programm präsentiert.	Y	präsentiert	593	  2,461	0.0153	197.5	german_at_news_2012_00490892
3095	Dieses wird am Freitag präsentiert.	Y	präsentiert	593	  2,461	0.0153	227.6	german_at_news_2012_00355647
3096	Nun steht vor allem Apple in der Kritik.	Y	kritik	594	  2,460	0.0153	188.625	german_at_news_2012_00732410
3097	Es gibt jedoch auch Grund zur Kritik.	Y	kritik	594	  2,460	0.0153	197.4286	german_at_news_2012_00457319
3098	Doch auch damals gab es Kritik.	Y	kritik	594	  2,460	0.0153	209.8333	german_at_news_2012_00382644
3099	Kritik kommt von den Grünen.	Y	kritik	594	  2,460	0.0153	224.4	german_at_news_2012_00644701
3100	Kritik kam von SPÖ und Grünen.	Y	kritik	594	  2,460	0.0153	229.5	german_at_news_2012_00644693
3101	Was soll ich nur werden, wenn ich einmal groß bin?	Y	groß	595	  2,458	0.0153	140.8889	german_at_news_2012_00928087
3102	Was haben sie schon groß davon?	Y	groß	595	  2,458	0.0153	168.8333	german_at_news_2012_00925385
3103	Eine Liebe, zu groß für Österreich?	Y	groß	595	  2,458	0.0153	183.1667	german_at_news_2012_00409191
3104	Vielleicht weil sie einfach zu groß sind.	Y	groß	595	  2,458	0.0153	200.1429	german_at_news_2012_00902014
3105	Außerdem sind beide gleich groß.	Y	groß	595	  2,458	0.0153	340.6	german_at_news_2012_00086787
3106	Wenn die Qualität nur so hoch wäre, aber das ist sie nicht.	Y	hoch	596	  2,456	0.0153	142.5833	german_at_news_2012_00938798
3107	Auch diese Zahl sei so hoch gewesen wie seit mehr als zehn Jahren nicht.	Y	hoch	596	  2,456	0.0153	150.2857	german_at_news_2012_00064777
3108	Es wird weiter sehr hoch sein.	Y	hoch	596	  2,456	0.0153	158.5	german_at_news_2012_00472182
3109	Wenn es hoch kommt sind es 20-25%.	Y	hoch	596	  2,456	0.0153	174.8	german_at_news_2012_00940120
3110	So hoch waren wir noch nie.“	Y	hoch	596	  2,456	0.0153	182.3333	german_at_news_2012_00824186
3111	Es war bisher nicht einfach mit mir und das wird es auch die nächsten 2 Monate nicht werden.	Y	monate	597	  2,455	0.0153	115.6667	german_at_news_2012_00469380
3112	Jetzt ist er zehn Monate.	Y	monate	597	  2,455	0.0153	197	german_at_news_2012_00624441
3113	Jetzt, knapp drei Monate später ist alles aus.	Y	monate	597	  2,455	0.0153	220.625	german_at_news_2012_00624701
3114	Es müssen drei Wochen gewesen sein, vielleicht drei Monate.	Y	monate	597	  2,455	0.0153	234.75	german_at_news_2012_00465683
3115	Aus Tagen wurden Wochen, aus Wochen Monate, aus Monaten Jahre.	Y	monate	597	  2,455	0.0153	314.4286	german_at_news_2012_00088594
3116	 Mich kann er nicht mehr treffen.	Y	treffen	598	  2,453	0.0152	150.3333	german_at_news_2012_00680224
3117	Es könnte uns alle treffen.	Y	treffen	598	  2,453	0.0152	203.4	german_at_news_2012_00464986
3118	Das war das erste Treffen.	Y	treffen	598	  2,453	0.0152	212.25	german_at_news_2012_00203188
3119	Er selbst will eine Entscheidung erst in den nächsten Tagen treffen.	Y	treffen	598	  2,453	0.0152	221.4545	german_at_news_2012_00444116
3120	Dort könnte es 1000 Leute treffen.	Y	treffen	598	  2,453	0.0152	284.8	german_at_news_2012_00390706
3121	Wie kam es zu dieser Zusammenarbeit?	Y	zusammenarbeit	598	  2,453	0.0152	171.6667	german_at_news_2012_00955955
3122	Ohne diese Zusammenarbeit wäre dieser Erfolg nicht möglich gewesen.	Y	zusammenarbeit	598	  2,453	0.0152	224.8889	german_at_news_2012_00744243
3123	Das Ergebnis ist eine Zusammenarbeit für Niederösterreich.	Y	zusammenarbeit	598	  2,453	0.0152	250.1429	german_at_news_2012_00166570
3124	Die Welt braucht unsere Zusammenarbeit.	Y	zusammenarbeit	598	  2,453	0.0152	324.8	german_at_news_2012_00376456
3125	Jede Zusammenarbeit bringt uns weiter.	Y	zusammenarbeit	598	  2,453	0.0152	375.2	german_at_news_2012_00621634
3126	Die Menschen sind so, wie sie eben sind.	Y	eben	599	  2,449	0.0152	119.5714	german_at_news_2012_00326489
3127	Ja, das ist es eben.	Y	eben	599	  2,449	0.0152	152.6	german_at_news_2012_00617413
3128	Das heißt nicht, dass es nicht gut gewesen wäre, aber jetzt ist es eben noch besser geworden.	Y	eben	599	  2,449	0.0152	168.3333	german_at_news_2012_00174500
3129	Recht hat eben der, der die Macht hat.	Y	eben	599	  2,449	0.0152	200.8333	german_at_news_2012_00768241
3130	Das ist eben das Problem.	Y	eben	599	  2,449	0.0152	279.75	german_at_news_2012_00177584
3131	Ist es aber offenbar nicht.	Y	offenbar	600	  2,448	0.0152	136.4	german_at_news_2012_00616206
3132	Die liegt aber offenbar nicht vor.	Y	offenbar	600	  2,448	0.0152	157.5	german_at_news_2012_00323429
3133	Es ist offenbar wirklich so einfach.	Y	offenbar	600	  2,448	0.0152	195.5	german_at_news_2012_00463136
3134	Offenbar hält man das für besser.	Y	offenbar	600	  2,448	0.0152	242	german_at_news_2012_00742616
3135	Offenbar musste alles sehr schnell gehen.	Y	offenbar	600	  2,448	0.0152	319	german_at_news_2012_00742695
3136	Wie geht man denn mit so einer Situation um?	Y	situation	601	  2,446	0.0152	113.2222	german_at_news_2012_00954889
3137	Das ist eine neue Situation.	Y	situation	601	  2,446	0.0152	146.4	german_at_news_2012_00177897
3138	Wie stehen Sie zu dieser Situation?	Y	situation	601	  2,446	0.0152	160.6667	german_at_news_2012_00959793
3139	So kam ich mit der Situation klar.	Y	situation	601	  2,446	0.0152	184.4286	german_at_news_2012_00824654
3140	Eine solche Situation darf es nicht mehr geben.	Y	situation	601	  2,446	0.0152	215.375	german_at_news_2012_00414014
3141	Das ist jetzt ein neuer Weg.	Y	neuer	602	  2,442	0.0152	158.3333	german_at_news_2012_00179116
3142	Heute ist ein neuer Tag.	Y	neuer	602	  2,442	0.0152	195.2	german_at_news_2012_00535810
3143	Auf jeden Fall wird sie ein neuer Ort sein.	Y	neuer	602	  2,442	0.0152	195.6667	german_at_news_2012_00079539
3144	Bei den Spielen wird die 26-Jährige in neuer Rolle zu hören sein.	Y	neuer	602	  2,442	0.0152	241.8333	german_at_news_2012_00096254
3145	Präsentiert sich uns wieder ein neuer Haider?	Y	neuer	602	  2,442	0.0152	252.2857	german_at_news_2012_00761254
3146	Aber wie stellen wir das hier in Vorarlberg an?	Y	vorarlberg	603	  2,436	0.0151	134.4444	german_at_news_2012_00011785
3147	Nach ein paar Tagen in ihrer Heimat Vorarlberg ist sie heute wieder in Wien.	Y	vorarlberg	603	  2,436	0.0151	237.5385	german_at_news_2012_00708603
3148	In Vorarlberg gibt es eine, in der Steiermark zwei, in Wien und Niederösterreich je 14, in Kärnten keine einzige.	Y	vorarlberg	603	  2,436	0.0151	245.7333	german_at_news_2012_00612391
3149	Auch dass ich Vorarlberg damit stolz machen kann.“	Y	vorarlberg	603	  2,436	0.0151	248.875	german_at_news_2012_00061396
3150	Und zwar vor Vorarlberg (51,81) und der Steiermark (62,18).	Y	vorarlberg	603	  2,436	0.0151	255.8333	german_at_news_2012_00886312
3151	In Österreich zurück hatte ich dann die Probleme, die sie hatte.	Y	probleme	604	  2,430	0.0151	125.7778	german_at_news_2012_00605501
3152	Damit hat sie allerdings keine Probleme.	Y	probleme	604	  2,430	0.0151	169.3333	german_at_news_2012_00145664
3153	Wir haben wirklich keine Probleme!	Y	probleme	604	  2,430	0.0151	213	german_at_news_2012_00966699
3154	Sonst gab es keine Probleme mit der Familie.	Y	probleme	604	  2,430	0.0151	224.625	german_at_news_2012_00829371
3155	Oder nehmen wir Österreichs Probleme.	Y	probleme	604	  2,430	0.0151	269.6	german_at_news_2012_00741807
3156	Obwohl das nicht so einfach ist.	Y	obwohl	605	  2,429	0.0151	151.1667	german_at_news_2012_00739867
3157	Obwohl das z.B. in Wien schon möglich ist.	Y	obwohl	605	  2,429	0.0151	166.2222	german_at_news_2012_00739890
3158	Obwohl man nichts kann dafür.	Y	obwohl	605	  2,429	0.0151	205.8	german_at_news_2012_00740459
3159	Obwohl: Ein paar gibt es.	Y	obwohl	605	  2,429	0.0151	217.2	german_at_news_2012_00740197
3160	Obwohl er nie alles gegeben hat.	Y	obwohl	605	  2,429	0.0151	250.5	german_at_news_2012_00740239
3161	Und ich habe eine Tochter, das geht bei mir nicht.	Y	tochter	606	  2,423	0.0151	103.6	german_at_news_2012_00877090
3162	Nie ist er für Tochter & Frau da.	Y	tochter	606	  2,423	0.0151	170.8571	german_at_news_2012_00726551
3163	Die 45-Jährige soll im Juni eine Tochter bekommen.	Y	tochter	606	  2,423	0.0151	203.75	german_at_news_2012_00275461
3164	Meine Tochter hat auch noch kein Kind.	Y	tochter	606	  2,423	0.0151	232.4286	german_at_news_2012_00676925
3165	Der Deutsche ist Vater einer Tochter.	Y	tochter	606	  2,423	0.0151	296.5	german_at_news_2012_00235353
3166	Wie groß der Erfolg von „The Producers“ auch sein sollte, die Produktion wird nur ein Jahr lang in Wien gezeigt werden können.	Y	the	607	  2,420	0.015	301.9545	german_at_news_2012_00955049
3167	The Daily“ soll zumindest dieses Jahr nur auf dem iPad zu lesen sein.	Y	the	607	  2,420	0.015	402.2308	german_at_news_2012_00851093
3168	Pink Floyd: The Wall kommt nach Österreich Geben Sie hier die E-Mail-Adresse des Empfängers ein (z.B. xy@z.com). Mehrere Empfänger werden durch Kommata getrennt.	Y	the	607	  2,420	0.015	440.3704	german_at_news_2012_00757579
3169	Sie ist ein großer Teil seines Lebens“, so ein Freund in der News of the World.	Y	the	607	  2,420	0.015	441.7333	german_at_news_2012_00808978
3170	Schwarzeneggers: The Next Generation Geben Sie hier die E-Mail-Adresse des Empfängers ein (z.B. xy@z.com). Mehrere Empfänger werden durch Kommata getrennt.	Y	the	607	  2,420	0.015	445.2917	german_at_news_2012_00788387
3171	Wien (bzö) - „Die ÖVP ist für eine EU ohne Wenn und Aber.	Y	bzö	608	  2,419	0.015	101.75	german_at_news_2012_00956994
3172	Ist der nicht beim BZÖ?	Y	bzö	608	  2,419	0.015	145.2	german_at_news_2012_00615859
3173	Kritik am ORF gibt es auch von BZÖ und ÖVP.	Y	bzö	608	  2,419	0.015	176.1	german_at_news_2012_00644459
3174	Im April 2005 hatte sich das BZÖ von der FPÖ getrennt.	Y	bzö	608	  2,419	0.015	182.7	german_at_news_2012_00567575
3175	Heute gibt BZÖ-Chef Entscheidung bekannt!	Y	bzö	608	  2,419	0.015	329	german_at_news_2012_00535474
3176	Schon zwei Jahre später steigen die Kosten aber wieder - in den nächsten drei Jahren um rund 14 Prozent und das kann auch die Salzburger Lösung nicht verhindern.	Y	salzburger	608	  2,419	0.015	226.88	german_at_news_2012_00786446
3177	Beim zweiten Lauf am Sonntag ist der Salzburger aber wieder mit dabei.	Y	salzburger	608	  2,419	0.015	265.25	german_at_news_2012_00104569
3178	Deshalb werden wir uns dafür auch besonders stark machen, ebenso wie die Kollegen in der Kärntner und Salzburger Landesregierung.	Y	salzburger	608	  2,419	0.015	285.5789	german_at_news_2012_00272239
3179	Der Salzburger kam mit den Bedingungen am besten zu Recht.	Y	salzburger	608	  2,419	0.015	293	german_at_news_2012_00257969
3180	Laut der Salzburger Polizei gibt es aber keine aktuelle Gefahr.	Y	salzburger	608	  2,419	0.015	312.2	german_at_news_2012_00652089
3181	Das war er mit Sicherheit nicht.	Y	sicherheit	609	  2,414	0.015	118.8333	german_at_news_2012_00203905
3182	Auch in der Liebe will man heute vor allem Sicherheit.	Y	sicherheit	609	  2,414	0.015	146.7	german_at_news_2012_00068744
3183	Das gilt mit Sicherheit auch für die Liebe.	Y	sicherheit	609	  2,414	0.015	173	german_at_news_2012_00171717
3184	Nur eines lässt sich mit Sicherheit sagen.	Y	sicherheit	609	  2,414	0.015	203.1429	german_at_news_2012_00734209
3185	Schüssel: „Gleichzeitig ist es wichtig, dass Sicherheit gegeben wird.	Y	sicherheit	609	  2,414	0.015	268	german_at_news_2012_00787594
3186	Das waren um 20 Prozent weniger als im Jahr zuvor.	Y	zuvor	609	  2,414	0.015	134.8889	german_at_news_2012_00203885
3187	Heute geht es mir so gut wie nie zuvor.	Y	zuvor	609	  2,414	0.015	160.1111	german_at_news_2012_00535437
3188	Kommt darauf an, was sie zuvor gemacht hat!	Y	zuvor	609	  2,414	0.015	184.375	german_at_news_2012_00640643
3189	Drei Jahre zuvor waren es noch knapp 44 Prozent.	Y	zuvor	609	  2,414	0.015	190.125	german_at_news_2012_00392560
3190	Mehr als in den acht Stunden zuvor.	Y	zuvor	609	  2,414	0.015	222.1429	german_at_news_2012_00674035
3191	Jetzt müssen wir einen Schritt nach dem anderen machen.”	Y	schritt	610	  2,411	0.015	145.7778	german_at_news_2012_00625061
3192	Erst mal einen Schritt zurück, dann kommt man auch eher auf Sie zu.	Y	schritt	610	  2,411	0.015	153.9231	german_at_news_2012_00447308
3193	Einen Schritt nach dem anderen.	Y	schritt	610	  2,411	0.015	172.8	german_at_news_2012_00410911
3194	Wir wollen, was wir tun, Schritt für Schritt machen.	Y	schritt	610	  2,411	0.015	196.8571	german_at_news_2012_00973198
3195	Niederösterreich soll der erste Schritt in dieser Richtung sein.	Y	schritt	610	  2,411	0.015	241.2222	german_at_news_2012_00726454
3196	Auch in der Liebe gibt es wieder eine neue Chance.	Y	chance	611	  2,410	0.015	131.3	german_at_news_2012_00068577
3197	Jetzt haben wir die Chance dazu.	Y	chance	611	  2,410	0.015	155.6667	german_at_news_2012_00623956
3198	Es ist, als hätte ich eine zweite Chance bekommen“, sagte die Frau.	Y	chance	611	  2,410	0.015	190.0833	german_at_news_2012_00460083
3199	Doch sie hatten keine Chance.	Y	chance	611	  2,410	0.015	218.2	german_at_news_2012_00387842
3200	Da gebe es keine Chance.	Y	chance	611	  2,410	0.015	272.8	german_at_news_2012_00139421
3201	Weltweit sind es gar nur 35 Prozent.	Y	weltweit	611	  2,410	0.015	175.5	german_at_news_2012_00936058
3202	So geht es vielen der mehr als 800 Millionen Facebook-Nutzer weltweit.	Y	weltweit	611	  2,410	0.015	232.8182	german_at_news_2012_00823044
3203	Er ist damit einer von weltweit drei Menschen, denen dies bisher gelungen ist.	Y	weltweit	611	  2,410	0.015	235.6667	german_at_news_2012_00438978
3204	3“ ist seit 2003 in Österreich präsent und hat hier mehr als 1,222 Millionen Kunden, weltweit sind es 30,2 Millionen.	Y	weltweit	611	  2,410	0.015	250.2	german_at_news_2012_00000156
3205	Weltweit hat der Dienst schon über 200 Millionen Mitglieder, in Österreich sind es über 50.000.	Y	weltweit	611	  2,410	0.015	251.8333	german_at_news_2012_00936014
3206	Für Österreich und für die Browser zeigt »Iframes« nicht an.	Y	iframes	612	  2,408	0.015	161.4444	german_at_news_2012_00499626
3207	Er kann aber Browser zeigt »Iframes« nicht an.	Y	iframes	612	  2,408	0.015	187.5	german_at_news_2012_00440081
3208	So Browser zeigt »Iframes« nicht an.	Y	iframes	612	  2,408	0.015	234.3333	german_at_news_2012_00821119
