ORDER	SENTENCE	STATUS	WORD	RANK	COUNT	COUNT_REL	INDEX	ID
3411	“Jetzt gibt es nur noch einen Titel.	Y	titel	648	  2,249	0.014	138.2857	german_at_news_2012_00623830
3412	Was hat dieser Titel mit ihrem Leben zu tun?	Y	titel	648	  2,249	0.014	170.5556	german_at_news_2012_00925522
3413	Oder ist es, wie man aus dem Titel „Übrigens!“	Y	titel	648	  2,249	0.014	190.4444	german_at_news_2012_00741617
3414	Da kann man stolz auf den Titel sein!	Y	titel	648	  2,249	0.014	240.125	german_at_news_2012_00143004
3415	Er sagt, es gehe um die Ausbildung und nicht um den Titel.	Y	titel	648	  2,249	0.014	243.2727	german_at_news_2012_00442991
3416	Gäste sind noch keine da.	Y	gäste	649	  2,237	0.0139	179.4	german_at_news_2012_00504101
3417	Nun steht alles, die Gäste können kommen.	Y	gäste	649	  2,237	0.0139	188.2857	german_at_news_2012_00732381
3418	Dann sollen drei Millionen Gäste möglich sein!	Y	gäste	649	  2,237	0.0139	209.7143	german_at_news_2012_00153910
3419	Bis zu 700 Gäste werden erwartet.	Y	gäste	649	  2,237	0.0139	263.8	german_at_news_2012_00119691
3420	Was die Gäste sonst noch alles erwartet?	Y	gäste	649	  2,237	0.0139	293	german_at_news_2012_00924291
3421	Mein Dank gilt da meiner Familie und meinen Vater, für den das alles nicht immer so einfach war, wenn er von seiner Tochter in der Zeitung lesen musste.	Y	dank	650	  2,230	0.0139	251.0357	german_at_news_2012_00676009
3422	Dank der Wirtschaftskrise ist es jetzt aber wohl nur mehr die, die es sich noch leisten kann.	Y	dank	650	  2,230	0.0139	258	german_at_news_2012_00151176
3423	Es ist Gott sei Dank noch immer so, dass ein Auftritt in Salzburg für Künstler wichtig ist.	Y	dank	650	  2,230	0.0139	281.1875	german_at_news_2012_00462080
3424	Gott sei Dank ist das nicht der Fall.	Y	dank	650	  2,230	0.0139	284.875	german_at_news_2012_00519826
3425	Aber so bin ich nicht, Gott sei Dank.	Y	dank	650	  2,230	0.0139	287.75	german_at_news_2012_00010236
3426	Ich war immer der Meinung, wir sind einfach die Besten!	Y	meinung	651	  2,226	0.0138	141.4	german_at_news_2012_00560363
3427	Meine Meinung ist, dass die Zeit es bringen wird.	Y	meinung	651	  2,226	0.0138	170.2222	german_at_news_2012_00676569
3428	Was ist Ihre Meinung dazu?	Y	meinung	651	  2,226	0.0138	185.6	german_at_news_2012_00926326
3429	Sagen Sie uns Ihre Meinung!	Y	meinung	651	  2,226	0.0138	237.4	german_at_news_2012_00776833
3430	Schreiben Sie uns ihre Meinung!	Y	meinung	651	  2,226	0.0138	297	german_at_news_2012_00786616
3431	Zunächst einmal: Nicht nur Männer, sondern auch Frauen und Kinder sind Menschen.	Y	zunächst	652	  2,225	0.0138	171.9167	german_at_news_2012_00991279
3432	Nichts ist hier, wie es zunächst scheint.	Y	zunächst	652	  2,225	0.0138	233.8571	german_at_news_2012_00725319
3433	In die Wohnung zu kommen, war deshalb zunächst nicht möglich.	Y	zunächst	652	  2,225	0.0138	241.7	german_at_news_2012_00596918
3434	Wie es zu dem Unfall gekommen ist, war zunächst nicht bekannt.	Y	zunächst	652	  2,225	0.0138	253.0909	german_at_news_2012_00954632
3435	Der Erfolg zunächst allerdings auch.	Y	zunächst	652	  2,225	0.0138	254.8	german_at_news_2012_00237929
3436	Alles liegt jetzt bei der politischen Seite, und die halten das alles zurück.	Y	politischen	653	  2,217	0.0138	184.25	german_at_news_2012_00026289
3437	Nicht bei den politischen Parteien und nicht in der Bundesregierung.	Y	politischen	653	  2,217	0.0138	255.7778	german_at_news_2012_00723252
3438	In der politischen Debatte gibt es nun kein Für und Wider mehr, sondern nur noch: Für oder Wider.	Y	politischen	653	  2,217	0.0138	277.75	german_at_news_2012_00592783
3439	Das Problem mit dem österreichischen Fußball ist: Es gibt zu viel politischen Einfluss!	Y	politischen	653	  2,217	0.0138	298.6923	german_at_news_2012_00189597
3440	Wenn Sie schon einen politischen Satz von mir hören wollen, dann diesen: Ich freue mich, wenn es diese Regierung nicht mehr gibt.	Y	politischen	653	  2,217	0.0138	299.4762	german_at_news_2012_00944083
3441	Man nimmt sich viel vor und nimmt es wieder zurück.	Y	nimmt	654	  2,216	0.0138	132.5556	german_at_news_2012_00668242
3442	Wenn er sich keine Zeit nimmt für das Kind?	Y	nimmt	654	  2,216	0.0138	162.6667	german_at_news_2012_00939846
3443	Man nimmt es heute sehr genau.	Y	nimmt	654	  2,216	0.0138	206	german_at_news_2012_00668238
3444	Wien nimmt dabei den weltweit zweiten Platz ein.	Y	nimmt	654	  2,216	0.0138	257.5	german_at_news_2012_00957803
3445	Die Kritik daran nimmt zu.	Y	nimmt	654	  2,216	0.0138	339.2	german_at_news_2012_00320740
3446	Dazu seien diese Daten einfach zu wichtig.	Y	daten	655	  2,215	0.0138	235.7143	german_at_news_2012_00211466
3447	Hier zeigen die Daten für das 1. Quartal einen Wert von 11,0% und für das 2. Quartal von 8,6%.	Y	daten	655	  2,215	0.0138	253.2727	german_at_news_2012_00541244
3448	Die Polizei braucht solche Daten für ihre Arbeit.	Y	daten	655	  2,215	0.0138	298.5	german_at_news_2012_00336244
3449	Sicher sind nur Daten die es nicht gibt (bzw. die wieder gelöscht werden).	Y	daten	655	  2,215	0.0138	302.3333	german_at_news_2012_00802855
3450	Und diese Regeln zeigen, dass es noch immer Wissenslücken gibt, zum Teil solche, für die es nie Daten gab oder nie welche geben wird.	Y	daten	655	  2,215	0.0138	308.7727	german_at_news_2012_00873638
3451	Was tun Sie heute für Ihres?	Y	ihres	656	  2,214	0.0138	194.3333	german_at_news_2012_00928340
3452	Und heute weiß sie, dass einer davon der Vater ihres Kindes ist.	Y	ihres	656	  2,214	0.0138	313.5	german_at_news_2012_00876811
3453	Die Frage ihres Beitritts stellt sich nicht in den nächsten 15 oder 20 Jahren.	Y	ihres	656	  2,214	0.0138	330.4167	german_at_news_2012_00303451
3454	Laut bild.de sagt er zu den Menschen, die sich nun alle als Zeichen ihres Respekts erhoben haben: „Jetzt sind wir unter uns.	Y	ihres	656	  2,214	0.0138	334.3043	german_at_news_2012_00651609
3455	Die US-Anwälte ihres Mannes seien in Wien gewesen und hätten noch etwas von der Stadt sehen wollen.	Y	ihres	656	  2,214	0.0138	341.9444	german_at_news_2012_00370954
3456	Ab sofort geht es hier auch um das Leben mit Kindern in der Stadt.	Y	kindern	657	  2,206	0.0137	133.8571	german_at_news_2012_00014329
3457	Und was ist mit Kindern?	Y	kindern	657	  2,206	0.0137	148.6	german_at_news_2012_00883446
3458	Nur wenn es den Eltern gut geht, kann es auch den Kindern gut gehen!	Y	kindern	657	  2,206	0.0137	163	german_at_news_2012_00736165
3459	Das ist wie bei kleinen Kindern.	Y	kindern	657	  2,206	0.0137	187.5	german_at_news_2012_00180432
3460	Er war Vater von sechs Kindern.	Y	kindern	657	  2,206	0.0137	271.8333	german_at_news_2012_00450258
3461	Für Experten ist er es ganz und gar nicht.	Y	experten	658	  2,200	0.0137	125.8889	german_at_news_2012_00497262
3462	Und das haben wir – so die Experten – zu einem großen Teil selbst in der Hand.	Y	experten	658	  2,200	0.0137	134	german_at_news_2012_00870324
3463	Und damit er dabei auch wirklich alles richtig macht, geht er einfach zu Experten.	Y	experten	658	  2,200	0.0137	180.3077	german_at_news_2012_00869172
3464	Das ist laut Experten zu wenig.	Y	experten	658	  2,200	0.0137	184.8333	german_at_news_2012_00179282
3465	Experten hatten den Schritt lange erwartet.	Y	experten	658	  2,200	0.0137	400.1667	german_at_news_2012_00475599
3466	Und dann noch, daß sich das in Wien auch so entwickelt.	Y	daß	659	  2,195	0.0136	149.8182	german_at_news_2012_00869667
3467	Ich glaube, daß es noch viel zu tun gibt, sagt der Mann.	Y	daß	659	  2,195	0.0136	208.75	german_at_news_2012_00551679
3468	Und was sein Leben betrifft: Wer kann schon von sich sagen, daß er alles richtig gemacht hat?	Y	daß	659	  2,195	0.0136	218.7647	german_at_news_2012_00883540
3469	Dann wird schnell klar, warum es ganz gut ist, daß wir sie los sind.	Y	daß	659	  2,195	0.0136	223.0714	german_at_news_2012_00154595
3470	Und wir gehen davon aus, daß Sie das auch in Zukunft mit Ihrem Koalitionspartner nicht machen werden.	Y	daß	659	  2,195	0.0136	224.0588	german_at_news_2012_00885480
3471	FPÖ-Chef Christian Strache sagte gegen ihn aus.	Y	christian	660	  2,191	0.0136	282.875	german_at_news_2012_00485544
3472	Adresse, Postleitzahl, Ort oder Bezirk E-Mail: christian.	Y	christian	660	  2,191	0.0136	328.25	german_at_news_2012_00016301
3473	Christian Browser zeigt »Iframes« nicht an.	Y	christian	660	  2,191	0.0136	338.8333	german_at_news_2012_00129150
3474	Heinz-Christian Strache: Eine gute Frage.	Y	christian	660	  2,191	0.0136	418	german_at_news_2012_00532417
3475	Nicht einmal Heinz-Christian Strache.	Y	christian	660	  2,191	0.0136	418.6	german_at_news_2012_00723654
3476	Das ist wichtig, denn die Kosten dafür, etwas nicht tun zu können, machen vielleicht den größten Teil der Softwarekosten aus.	Y	größten	661	  2,187	0.0136	266.55	german_at_news_2012_00180406
3477	Es ist jemand von uns gegangen, der für mich einer der größten Künstler der vergangenen 70 Jahre war.	Y	größten	661	  2,187	0.0136	267.4	german_at_news_2012_00462415
3478	NEWS: Wer sind für Sie die fünf größten Persönlichkeiten in der österreichischen Politik derzeit?	Y	größten	661	  2,187	0.0136	278.6429	german_at_news_2012_00722682
3479	Sie ist gleichzeitig unter den fünf größten Europas.	Y	größten	661	  2,187	0.0136	284.375	german_at_news_2012_00809077
3480	Die beiden größten Altersgruppen (13 bis 19 und 20 bis 29 Jahre) haben einen Anteil von über 60 Prozent.	Y	größten	661	  2,187	0.0136	321.5385	german_at_news_2012_00284973
3481	Aber es ist ein Beginn, mit dem man arbeiten kann.	Y	beginn	662	  2,186	0.0136	123.2	german_at_news_2012_00006078
3482	Und was für ein Beginn!	Y	beginn	662	  2,186	0.0136	151.2	german_at_news_2012_00883342
3483	Wichtig sei es deshalb, von Beginn an da zu sein.	Y	beginn	662	  2,186	0.0136	162	german_at_news_2012_00951257
3484	Und zwar von Beginn an.	Y	beginn	662	  2,186	0.0136	182	german_at_news_2012_00886304
3485	Zu Beginn muss er vielleicht bei 45 Prozent liegen.	Y	beginn	662	  2,186	0.0136	219.625	german_at_news_2012_00982217
3486	Dass man da das bekommt, was man will, ist klar.	Y	bekommt	663	  2,185	0.0136	147.2222	german_at_news_2012_00196615
3487	“Klar bekommt man mit, wer da ist.	Y	bekommt	663	  2,185	0.0136	184.8571	german_at_news_2012_00637334
3488	Hier bekommt man so etwas.	Y	bekommt	663	  2,185	0.0136	194.8	german_at_news_2012_00537392
3489	Und wer bekommt das Geld?	Y	bekommt	663	  2,185	0.0136	215.8	german_at_news_2012_00884719
3490	Bekommt er eine zweite Chance?	Y	bekommt	663	  2,185	0.0136	375.2	german_at_news_2012_00106716
3491	Fischer: Das weiß ich heute noch nicht.	Y	fischer	664	  2,183	0.0136	167.5714	german_at_news_2012_00482592
3492	Besonders in den vergangenen Wochen und Monaten sind es immer mehr geworden, so Fischer.	Y	fischer	664	  2,183	0.0136	190.6429	german_at_news_2012_00111226
3493	Fischer: Ja, was soll ich dazu sagen?	Y	fischer	664	  2,183	0.0136	204	german_at_news_2012_00482731
3494	Fischer: Da bin ich noch ganz neu.	Y	fischer	664	  2,183	0.0136	223.8571	german_at_news_2012_00482558
3495	Fischer: Bitte, nehmen Sie sie!	Y	fischer	664	  2,183	0.0136	370.25	german_at_news_2012_00482556
3496	Das konnte ich in dem Alter noch nicht.	Y	alter	665	  2,181	0.0136	124.375	german_at_news_2012_00182627
3497	Aber das können sie ja in dem Alter noch gar nicht wissen.	Y	alter	665	  2,181	0.0136	135.0833	german_at_news_2012_00003696
3498	Man sagt ja, dass man im Alter wieder zum Kind wird.	Y	alter	665	  2,181	0.0136	172.1	german_at_news_2012_00668473
3499	Mir ist auch Ihr Alter nicht bekannt.	Y	alter	665	  2,181	0.0136	188.7143	german_at_news_2012_00681837
3500	Und das für jedes Alter!	Y	alter	665	  2,181	0.0136	266	german_at_news_2012_00870229
3501	Scheint es aber doch nicht zu sein.	Y	scheint	666	  2,178	0.0135	128.4286	german_at_news_2012_00780367
3502	Das scheint ihm jetzt nicht mehr gut zu bekommen.	Y	scheint	666	  2,178	0.0135	169.4444	german_at_news_2012_00191913
3503	Das scheint auch Haider zu wissen.	Y	scheint	666	  2,178	0.0135	231.1667	german_at_news_2012_00191904
3504	Nun scheint er also eine neue Liebe gefunden haben.	Y	scheint	666	  2,178	0.0135	241.2222	german_at_news_2012_00732098
3505	Ihre Zeit scheint nun gekommen!	Y	scheint	666	  2,178	0.0135	308.8	german_at_news_2012_00565596
3506	Wer von den top Drei wird die 100.000 Euro bekommen?	Y	top	666	  2,178	0.0135	160.4444	german_at_news_2012_00949598
3507	Wir wollen unter die Top drei bis 2010.	Y	top	666	  2,178	0.0135	163.1429	german_at_news_2012_00973189
3508	Mit Erfolg: Heuer sind bereits mehr als 20 Top-Team von Juni bis August in Oberösterreich.	Y	top	666	  2,178	0.0135	229.6667	german_at_news_2012_00691154
3509	“Ich möchte Ende des Jahres Top 30 sein.	Y	top	666	  2,178	0.0135	262.2857	german_at_news_2012_00557824
3510	Hier geht´s zur »Österreich Wollen unter die Top Drei der EU kommen Bundeskanzler im Hohen Haus: „Reden wir Österreich nicht schlecht - dazu sind wir zu gut“ Wien (övp-pk) - Ziel ist es, innerhalb der nächsten Jahre unter die Top drei in der EU zu kommen.	Y	top	666	  2,178	0.0135	270.2	german_at_news_2012_00538791
3511	Für die ÖVP sei diese Wahl „nicht nur eine Europa-Wahl in Österreich, sondern es ist eine Österreich-Wahl für das europäische Parlament“, erklärte Pröll.	Y	europäische	667	  2,176	0.0135	187.25	german_at_news_2012_00495340
3512	Für die ÖVP sei diese Wahl nicht nur eine Europa-Wahl in Österreich, sondern es sei eine Österreich-Wahl für das europäische Parlament, erklärte Pröll.	Y	europäische	667	  2,176	0.0135	196.5789	german_at_news_2012_00495341
3513	Was aber auch zu sagen ist, dass für die gesamte Europäische Union Griechenland nicht so sehr das große Problem mehr ist, als es am Anfang war.	Y	europäische	667	  2,176	0.0135	213.68	german_at_news_2012_00923057
3514	Und dieses Wissen bringen wir auch in die Europäische Union ein.	Y	europäische	667	  2,176	0.0135	222.2727	german_at_news_2012_00873771
3515	Das alles sei ohne die Europäische Union nicht möglich gewesen.	Y	europäische	667	  2,176	0.0135	243	german_at_news_2012_00159415
3516	Selbst der über zwei Jahre alte erste Teil ist noch nicht unter 40 Euro zu haben.	Y	alte	668	  2,174	0.0135	116.8	german_at_news_2012_00800085
3517	“Wir sind alte Leute, was wollen die denn alle von uns?”	Y	alte	668	  2,174	0.0135	161.4545	german_at_news_2012_00969478
3518	Das ist eine alte Geschichte und ist doch immer neu.	Y	alte	668	  2,174	0.0135	183	german_at_news_2012_00177681
3519	Eine alte Frau weiß, dass ihre Zeit gekommen ist.	Y	alte	668	  2,174	0.0135	222.6667	german_at_news_2012_00404571
3520	Adresse, Postleitzahl, Ort oder Bezirk E-Mail: alte.	Y	alte	668	  2,174	0.0135	329.25	german_at_news_2012_00016238
3521	Wir sind auch am Sonntag ab ca. 14 Uhr live vor Ort!	Y	ca	669	  2,173	0.0135	228	german_at_news_2012_00969500
3522	Österreich wird für das Projekt einen Beitrag in Höhe von ca. Euro 500.000 zur Verfügung stellen.	Y	ca	669	  2,173	0.0135	245.0667	german_at_news_2012_00751635
3523	Während des ersten Jahres der Regierung seien in Österreich ca. 75.000 Kinder geboren worden.	Y	ca	669	  2,173	0.0135	248.1538	german_at_news_2012_00917311
3524	Damit würden zwei Milliarden Euro (ca.	Y	ca	669	  2,173	0.0135	260.8333	german_at_news_2012_00148914
3525	Auch wenn es nur eine ca. Rechnung ist.	Y	ca	669	  2,173	0.0135	279.625	german_at_news_2012_00072838
3526	Das war früher so und ist so bis heute.	Y	früher	669	  2,173	0.0135	116.5	german_at_news_2012_00203999
3527	Wenn es denn nicht früher so weit ist.	Y	früher	669	  2,173	0.0135	164	german_at_news_2012_00939989
3528	Meine Welt ist eine andere als früher.	Y	früher	669	  2,173	0.0135	198.7143	german_at_news_2012_00676966
3529	Das hätte es früher nicht gegeben!	Y	früher	669	  2,173	0.0135	232.3333	german_at_news_2012_00173705
3530	Ist früher wirklich alles besser gewesen?	Y	früher	669	  2,173	0.0135	276.6667	german_at_news_2012_00616428
3531	Mehr war auch M. nicht.	Y	m	670	  2,168	0.0135	160.8	german_at_news_2012_00675735
3532	Hier sind noch die letzten Bilder des M3.	Y	m	670	  2,168	0.0135	195.875	german_at_news_2012_00540364
3533	Etwa 100.000 m2 werden dafür zur Verfügung stehen.	Y	m	670	  2,168	0.0135	251.5714	german_at_news_2012_00472981
3534	Ruhe sollte Frau M. aber bis heute nicht finden.	Y	m	670	  2,168	0.0135	303.1111	german_at_news_2012_00774554
3535	Ich habe mich auf die ersten 1200m konzentriert, denn wenn ich dann vorne dabei bin, ist alles möglich!	Y	m	670	  2,168	0.0135	315.0588	german_at_news_2012_00553841
3536	Unterstützung kommt nun von der Wiener ÖVP.	Y	unterstützung	671	  2,164	0.0134	172	german_at_news_2012_00891645
3537	Doch ohne Unterstützung geht es nicht.	Y	unterstützung	671	  2,164	0.0134	175.3333	german_at_news_2012_00387439
3538	Unterstützung finden sie bei der SPÖ.	Y	unterstützung	671	  2,164	0.0134	185.6667	german_at_news_2012_00891611
3539	Hier habe Österreich bisher noch wenig Unterstützung gefunden.	Y	unterstützung	671	  2,164	0.0134	261.125	german_at_news_2012_00539035
3540	Ich habe leider keine Unterstützung dafür gefunden.	Y	unterstützung	671	  2,164	0.0134	323.8571	german_at_news_2012_00553751
3541	So stellte man sich in Graz 2010 an.	Y	stellte	672	  2,162	0.0134	167.4286	german_at_news_2012_00831708
3542	Und ich stellte mir diese Frage auch.	Y	stellte	672	  2,162	0.0134	170.1429	german_at_news_2012_00877309
3543	Aber jetzt stellte sich natürlich die Frage der Fragen.	Y	stellte	672	  2,162	0.0134	191.8889	german_at_news_2012_00008258
3544	Der Erfolg stellte sich ein.	Y	stellte	672	  2,162	0.0134	222.4	german_at_news_2012_00237901
3545	Dabei stellte er Fragen, von denen er eigentlich meinte, dass sie auf der Hand liegen: Wer war diese Frau?	Y	stellte	672	  2,162	0.0134	229.9444	german_at_news_2012_00134277
3546	In der Steiermark wäre es bereits 24 Uhr gewesen.	Y	steiermark	673	  2,161	0.0134	166.125	german_at_news_2012_00593639
3547	Was heißt das für die Steiermark?	Y	steiermark	673	  2,161	0.0134	184.6667	german_at_news_2012_00925654
3548	Das Ergebnis für die Steiermark kann sich sehen lassen.	Y	steiermark	673	  2,161	0.0134	188.8889	german_at_news_2012_00166513
3549	In der Steiermark stehen vier Millionen Euro zur Verfügung.	Y	steiermark	673	  2,161	0.0134	202.8889	german_at_news_2012_00593631
3550	So sei Kärnten gegen die Steiermark Browser zeigt »Iframes« nicht an.	Y	steiermark	673	  2,161	0.0134	232.8182	german_at_news_2012_00830825
3551	Es hat kein Angebot an uns gegeben und kein Angebot von uns an andere.	Y	angebot	674	  2,159	0.0134	163.4	german_at_news_2012_00459442
3552	Das Angebot, dies in einer dem Art.	Y	angebot	674	  2,159	0.0134	197.8571	german_at_news_2012_00159845
3553	Wie dieser nach Wien gekommen ist, hat er mir das Job-Angebot gemacht.	Y	angebot	674	  2,159	0.0134	225.6154	german_at_news_2012_00953836
3554	Wir haben aber auch um 20 Prozent mehr Karten im Angebot.	Y	angebot	674	  2,159	0.0134	230.6	german_at_news_2012_00964702
3555	Das Angebot sei in den letzten Jahren da gewesen, doch es sei auch von der Industrie nicht genutzt worden.	Y	angebot	674	  2,159	0.0134	231.3889	german_at_news_2012_00159918
3556	Und das wird alles den Menschen nicht gesagt.	Y	gesagt	674	  2,159	0.0134	124.875	german_at_news_2012_00871584
3557	Das habe sie auch ihrem Mann gesagt.	Y	gesagt	674	  2,159	0.0134	175	german_at_news_2012_00172758
3558	Wir haben gesagt: “Alle können kommen!”	Y	gesagt	674	  2,159	0.0134	185.5	german_at_news_2012_00965684
3559	Aber das hätten wir nie laut gesagt.	Y	gesagt	674	  2,159	0.0134	214.8571	german_at_news_2012_00003473
3560	Kurz gesagt: Was Ihnen gehört, bleibt auch Ihres.	Y	gesagt	674	  2,159	0.0134	349.625	german_at_news_2012_00647065
3561	Dieser Tag heute ist das Größte, was es gibt.”	Y	größte	675	  2,158	0.0134	142.6667	german_at_news_2012_00352236
3562	Der Erfolg – für ihn wäre er “das Größte”.	Y	größte	675	  2,158	0.0134	185.75	german_at_news_2012_00237823
3563	Das war in den vergangenen Spielen das größte Problem.	Y	größte	675	  2,158	0.0134	246.125	german_at_news_2012_00204092
3564	Damit sei auch die größte Sicherheit gegeben.	Y	größte	675	  2,158	0.0134	269	german_at_news_2012_00147068
3565	DAS ist das größte Problem.	Y	größte	675	  2,158	0.0134	298.75	german_at_news_2012_00176899
3566	Aber damit ist es auch genug.	Y	genug	676	  2,152	0.0134	141	german_at_news_2012_00003158
3567	Wer hat genug, wer hat immer noch nicht genug?	Y	genug	676	  2,152	0.0134	168.1667	german_at_news_2012_00947097
3568	Doch damit noch nicht genug.	Y	genug	676	  2,152	0.0134	183.4	german_at_news_2012_00383300
3569	Wir haben genug junge Menschen im Land, die auf der Straße stehen.	Y	genug	676	  2,152	0.0134	204.5833	german_at_news_2012_00965677
3570	Vielleicht war meine Arbeit damals nicht stark genug.	Y	genug	676	  2,152	0.0134	315.25	german_at_news_2012_00901982
3571	Es sollte aber nicht sein Abend werden.	Y	abend	677	  2,150	0.0134	143.7143	german_at_news_2012_00468544
3572	Aber es ist ja noch nicht aller Jahre Abend.	Y	abend	677	  2,150	0.0134	153.4444	german_at_news_2012_00006116
3573	Es ist noch nicht aller Tage Abend.	Y	abend	677	  2,150	0.0134	215.8571	german_at_news_2012_00463045
3574	Heute Abend ist jeder ein Star.	Y	abend	677	  2,150	0.0134	277.1667	german_at_news_2012_00535058
3575	Das wurde Dienstag Abend bekannt gegeben.	Y	abend	677	  2,150	0.0134	325.5	german_at_news_2012_00206340
3576	Ich will auch erfolgreich sein und ich werde alles tun, damit wir das sind.	Y	erfolgreich	678	  2,145	0.0133	129.6923	german_at_news_2012_00561579
3577	Wir waren bis jetzt nicht erfolgreich.	Y	erfolgreich	678	  2,145	0.0133	167.5	german_at_news_2012_00971688
3578	Wie erfolgreich war das erste Jahr?	Y	erfolgreich	678	  2,145	0.0133	175.6667	german_at_news_2012_00954318
3579	Der Peter war ja sehr erfolgreich.	Y	erfolgreich	678	  2,145	0.0133	218	german_at_news_2012_00255022
3580	Damit war Wolfgang Schüssel erfolgreich.	Y	erfolgreich	678	  2,145	0.0133	346	german_at_news_2012_00148189
3581	Das war auch in meiner Familie so.	Y	meiner	679	  2,139	0.0133	157.2857	german_at_news_2012_00203109
3582	Den den ich hatte, der war von Anfang an auf der Seite meiner Ex.	Y	meiner	679	  2,139	0.0133	177.5833	german_at_news_2012_00216010
3583	Ich habe es nicht unter meiner Würde gefunden.	Y	meiner	679	  2,139	0.0133	213.25	german_at_news_2012_00553166
3584	Ich bin immer mit meiner Familie zusammen.	Y	meiner	679	  2,139	0.0133	253.4286	german_at_news_2012_00548287
3585	Also meiner Meinung nach zumindest!	Y	meiner	679	  2,139	0.0133	405	german_at_news_2012_00034087
3586	So wird man nicht Bundeskanzler.	Y	bundeskanzler	680	  2,135	0.0133	160.2	german_at_news_2012_00833821
3587	Da hat sich der 3. zum bundeskanzler gemacht.	Y	bundeskanzler	680	  2,135	0.0133	163.7143	german_at_news_2012_00140345
3588	Das müssen Sie den Bundeskanzler fragen.	Y	bundeskanzler	680	  2,135	0.0133	211.8333	german_at_news_2012_00186419
3589	Und dieser Preis war uns zu hoch“, betonte der Bundeskanzler.	Y	bundeskanzler	680	  2,135	0.0133	250.2	german_at_news_2012_00873669
3590	Wolfgang Schüssel wird Bundeskanzler bleiben.	Y	bundeskanzler	680	  2,135	0.0133	392.6	german_at_news_2012_00975871
3591	Das hat er ja auch für die Gemeinde gemacht.	Y	gemeinde	680	  2,135	0.0133	132.4444	german_at_news_2012_00173286
3592	Das können Sie ab sofort auf ihrer gemeinde.	Y	gemeinde	680	  2,135	0.0133	187.125	german_at_news_2012_00182347
3593	Ganz Österreich eine Gemeinde Wien!	Y	gemeinde	680	  2,135	0.0133	191.4	german_at_news_2012_00502928
3594	Gemeinde steht hinter dem Projekt Die Gemeinde steht nach wie vor hinter dem Projekt.	Y	gemeinde	680	  2,135	0.0133	197.6667	german_at_news_2012_00508083
3595	Die ÖVP ist und bleibt damit die Bürgermeister- und Gemeinde- partei.	Y	gemeinde	680	  2,135	0.0133	245	german_at_news_2012_00334070
3596	Sie hätte dagegen sein können, aber das war sie nicht.	Y	dagegen	681	  2,134	0.0133	132.7778	german_at_news_2012_00807977
3597	Sind Sie dafür oder dagegen?	Y	dagegen	681	  2,134	0.0133	189.4	german_at_news_2012_00818766
3598	Ich hätte nichts dagegen, einen Mann zu finden.	Y	dagegen	681	  2,134	0.0133	208.625	german_at_news_2012_00555461
3599	Dagegen tun wir jetzt was.	Y	dagegen	681	  2,134	0.0133	239.4	german_at_news_2012_00139572
3600	Und die Regierung setzt keine Maßnahmen dagegen.	Y	dagegen	681	  2,134	0.0133	307.7143	german_at_news_2012_00873409
3601	Spricht es nicht für sich selbst?	Y	spricht	682	  2,132	0.0132	142.8333	german_at_news_2012_00838679
3602	Das spricht natürlich nur für sich!	Y	spricht	682	  2,132	0.0132	169	german_at_news_2012_00197785
3603	Jetzt spricht er über die Situation in den USA.	Y	spricht	682	  2,132	0.0132	197.4444	german_at_news_2012_00625658
3604	Der Erfolg spricht für sich.	Y	spricht	682	  2,132	0.0132	224.2	german_at_news_2012_00237897
3605	Was spricht dafür, was dagegen?	Y	spricht	682	  2,132	0.0132	396.5	german_at_news_2012_00928203
3606	Das kann nicht Ihr ernst sein, oder?	Y	ernst	683	  2,130	0.0132	139.1429	german_at_news_2012_00181355
3607	Das Leben ist an sich schon ernst genug.	Y	ernst	683	  2,130	0.0132	205	german_at_news_2012_00184083
3608	Er meinte, ich würde es nicht ernst nehmen.	Y	ernst	683	  2,130	0.0132	245.625	german_at_news_2012_00441455
3609	• Nehmen Sie die Sorgen Ihrer Kinder ernst!	Y	ernst	683	  2,130	0.0132	287.5714	german_at_news_2012_00717552
3610	Ernst: Der Vergleich macht sicher.	Y	ernst	683	  2,130	0.0132	354.2	german_at_news_2012_00442198
3611	Was einem wichtig wird, ob man es will oder nicht, hat in einem ja Folgen.	Y	folgen	683	  2,130	0.0132	125.2143	german_at_news_2012_00924659
3612	Das wird aber dann Folgen haben!	Y	folgen	683	  2,130	0.0132	145.8333	german_at_news_2012_00205426
3613	Sollten einige noch nicht dabei gewesen sein, würden diese mit Sicherheit noch folgen.	Y	folgen	683	  2,130	0.0132	225	german_at_news_2012_00827578
3614	Weitere folgen ein Jahr später.	Y	folgen	683	  2,130	0.0132	267.4	german_at_news_2012_00932487
