ORDER	SENTENCE	STATUS	WORD	RANK	COUNT	COUNT_REL	INDEX	ID
3209	Schließlich haben Browser zeigt »Iframes« nicht an.	Y	iframes	612	  2,408	0.015	256.1429	german_at_news_2012_00781894
3210	ORF.at Browser zeigt »Iframes« nicht an.	Y	iframes	612	  2,408	0.015	289.8571	german_at_news_2012_00747570
3211	Dann sind Sie ein Star.	Y	star	613	  2,405	0.0149	150.2	german_at_news_2012_00153849
3212	Ich wollte ja gar nicht zum Star werden.	Y	star	613	  2,405	0.0149	182.375	german_at_news_2012_00562109
3213	Mehr möchte ich nicht dazu sagen”, so der Star.	Y	star	613	  2,405	0.0149	186.1111	german_at_news_2012_00675225
3214	Oft kommen auf einen Mann aber gleich mehrere Star-Frauen.	Y	star	613	  2,405	0.0149	220.3	german_at_news_2012_00743623
3215	Ein Star im eigenen Film.	Y	star	613	  2,405	0.0149	283.4	german_at_news_2012_00424655
3216	Wir sind die erste Universität in Österreich, die das umgesetzt hat.“	Y	universität	613	  2,405	0.0149	225.5	german_at_news_2012_00969707
3217	So können auch Kinder erreicht werden, die sonst nicht in Kontakt mit der Universität kommen würden.	Y	universität	613	  2,405	0.0149	230.5625	german_at_news_2012_00825079
3218	Und bis heute gibt es keine einzige Frau an der Spitze einer öffentlichen Universität.	Y	universität	613	  2,405	0.0149	260.5	german_at_news_2012_00868703
3219	Bloß die Wiener Universität für Musik will davon nichts wissen.	Y	universität	613	  2,405	0.0149	317.3	german_at_news_2012_00121559
3220	Man sei aber durchaus bereit, mit der Universität zu reden.	Y	universität	613	  2,405	0.0149	318.7	german_at_news_2012_00668566
3221	Dies gab das Unternehmen in der Nacht auf heute bekannt.	Y	nacht	614	  2,404	0.0149	171.9	german_at_news_2012_00357494
3222	Das ist dann schon bitte, wenn man die ganze Nacht durch führt.	Y	nacht	614	  2,404	0.0149	192.1667	german_at_news_2012_00176801
3223	Alles für 2 Euro, die ganze Nacht!	Y	nacht	614	  2,404	0.0149	210.6667	german_at_news_2012_00025999
3224	Über Nacht geht das kaum.	Y	nacht	614	  2,404	0.0149	225.8	german_at_news_2012_00861201
3225	Beide arbeiten die ganze Nacht.	Y	nacht	614	  2,404	0.0149	373.6	german_at_news_2012_00094240
3226	Er werde Pröll nicht sagen, „was er im Leben nicht mehr werden kann.	Y	pröll	615	  2,400	0.0149	137.4545	german_at_news_2012_00450566
3227	ÖVP-Landeshauptmann Pröll wird auch in der Zukunft in der ÖVP das Sagen haben.	Y	pröll	615	  2,400	0.0149	173.9091	german_at_news_2012_00752361
3228	NEWS: Und was kann er besser als Josef Pröll?	Y	pröll	615	  2,400	0.0149	210.2222	german_at_news_2012_00722459
3229	Die will Pröll natürlich halten.	Y	pröll	615	  2,400	0.0149	279.4	german_at_news_2012_00377802
3230	Josef Pröll wird auf Zeit spielen.	Y	pröll	615	  2,400	0.0149	298.6667	german_at_news_2012_00627504
3231	Auch jetzt gehen dort wieder Menschen auf die Straße.	Y	straße	616	  2,399	0.0149	149.2222	german_at_news_2012_00069514
3232	Allerdings nicht auf der Straße.	Y	straße	616	  2,399	0.0149	168	german_at_news_2012_00024851
3233	Wie viele sehen Sie denn auf der Straße (wenn ich mal fragen darf)?	Y	straße	616	  2,399	0.0149	169.9231	german_at_news_2012_00960314
3234	Die Straße vor uns wird lang sein.	Y	straße	616	  2,399	0.0149	183.7143	german_at_news_2012_00364651
3235	Danach fragen mich die Leute auf der Straße.	Y	straße	616	  2,399	0.0149	265.75	german_at_news_2012_00149497
3236	Heute will alle Welt wissen, was Martin weiß.	Y	martin	617	  2,398	0.0149	225.375	german_at_news_2012_00536894
3237	Nun steht es mit der Liste Martin nicht zum Besten.	Y	martin	617	  2,398	0.0149	232	german_at_news_2012_00732398
3238	Die will Martin jetzt sehen, sofort.	Y	martin	617	  2,398	0.0149	252.6667	german_at_news_2012_00377801
3239	Das müssen Sie Dr. Martin fragen.	Y	martin	617	  2,398	0.0149	258.6667	german_at_news_2012_00186420
3240	Dafür habe er auch Stimmung gegen ihn, Martin, gemacht.	Y	martin	617	  2,398	0.0149	279.1111	german_at_news_2012_00138281
3241	Trotzdem gibt es immer noch Leute, die Macht haben wollen.“	Y	trotzdem	617	  2,398	0.0149	169.2	german_at_news_2012_00855981
3242	Trotzdem wird auf vier 90 jährige Frauen nur ein Mann kommen.	Y	trotzdem	617	  2,398	0.0149	176.4	german_at_news_2012_00856558
3243	Eine Zusammenarbeit mit dem BZÖ kommt für sie aber trotzdem nicht in Frage.	Y	trotzdem	617	  2,398	0.0149	182.6154	german_at_news_2012_00416381
3244	Wirklich leicht gemacht hat es ihm die Partei trotzdem nicht.	Y	trotzdem	617	  2,398	0.0149	240.7	german_at_news_2012_00967354
3245	Trotzdem halten Sie fest zu Ihrem Kind.	Y	trotzdem	617	  2,398	0.0149	304.7143	german_at_news_2012_00856037
3246	Je nachdem, wie man das sieht.	Y	nachdem	618	  2,395	0.0149	230.6667	german_at_news_2012_00622293
3247	Aber nachdem ich das Stück bekommen hatte, war mir klar, dass es nicht fertig ist.	Y	nachdem	618	  2,395	0.0149	258.2667	german_at_news_2012_00008995
3248	Je nachdem, wie man diese Tatsache interpretieren will, geht an diesem Tag die Welt unter - oder auch nicht.	Y	nachdem	618	  2,395	0.0149	304.4444	german_at_news_2012_00622294
3249	Nachdem ich das zum ersten Mal gesagt hatte, wunderte sich der Bundespräsident, dass man heute noch so was sagen kann.	Y	nachdem	618	  2,395	0.0149	305.4	german_at_news_2012_00704400
3250	Und nachdem sie mit 18 oder 19 Jahren den Führerschein gemacht haben, steigen sie jetzt auf so ein Gerät auf.	Y	nachdem	618	  2,395	0.0149	333.0625	german_at_news_2012_00879440
3251	Nur: Mit dem Euro und der EU hat das, leider, nichts zu tun.	Y	leider	619	  2,386	0.0148	106.7692	german_at_news_2012_00735146
3252	Für die steht es derzeit aber leider nicht gerade zum Besten.	Y	leider	619	  2,386	0.0148	148.4545	german_at_news_2012_00496044
3253	Viel mehr gibt’s leider nicht zu tun.	Y	leider	619	  2,386	0.0148	171.75	german_at_news_2012_00902224
3254	So ist leider das österreichische Recht.	Y	leider	619	  2,386	0.0148	224	german_at_news_2012_00824520
3255	Leider ist dieser Tag gekommen.	Y	leider	619	  2,386	0.0148	306.6	german_at_news_2012_00655532
3256	Wie ist das mit dem Schreiben?	Y	schreiben	620	  2,382	0.0148	116.3333	german_at_news_2012_00955750
3257	Also: Schreiben Sie uns, und machen Sie jetzt mit!	Y	schreiben	620	  2,382	0.0148	149.25	german_at_news_2012_00034309
3258	An was schreiben Sie gerade?”	Y	schreiben	620	  2,382	0.0148	195	german_at_news_2012_00055207
3259	Ganz gleich, was ich gerne hätte oder was Sie gerne schreiben würden.	Y	schreiben	620	  2,382	0.0148	223.1	german_at_news_2012_00502597
3260	Die Medien schreiben ja nichts anders!	Y	schreiben	620	  2,382	0.0148	331.8333	german_at_news_2012_00325265
3261	Und ist Profil nicht auch ein Teil davon?	Y	profil	621	  2,380	0.0148	146.625	german_at_news_2012_00878063
3262	Wie macht Ihr das nur bei „profil“?	Y	profil	621	  2,380	0.0148	147	german_at_news_2012_00956572
3263	Ich bitte das „profil“ in sich zu gehen.	Y	profil	621	  2,380	0.0148	169.625	german_at_news_2012_00549352
3264	Daher auch nur im profil zu finden.	Y	profil	621	  2,380	0.0148	170.4286	german_at_news_2012_00140515
3265	In profil liegt es derzeit auf Platz drei.	Y	profil	621	  2,380	0.0148	183.875	german_at_news_2012_00605694
3266	Wenn man Geld hat, dann hat man keine Sorgen mehr?	Y	sorgen	622	  2,377	0.0148	149.5	german_at_news_2012_00942285
3267	Wir wollen dafür sorgen, dass es so bleibt.	Y	sorgen	622	  2,377	0.0148	173.875	german_at_news_2012_00972705
3268	Sicher gibt es welche, die sich Sorgen machen.	Y	sorgen	622	  2,377	0.0148	196.75	german_at_news_2012_00802556
3269	Wir haben ganz andere Sorgen.	Y	sorgen	622	  2,377	0.0148	205.6	german_at_news_2012_00965638
3270	Müssen wir uns deshalb Sorgen machen?	Y	sorgen	622	  2,377	0.0148	238.1667	german_at_news_2012_00701307
3271	Das ist nicht gut für die Gesellschaft.	Y	gesellschaft	623	  2,373	0.0147	112.7143	german_at_news_2012_00179604
3272	Aber die Gesellschaft war noch nicht so weit.	Y	gesellschaft	623	  2,373	0.0147	149.375	german_at_news_2012_00004628
3273	Das Recht, unter uns in dieser Gesellschaft zu leben, wird uns derzeit genommen.	Y	gesellschaft	623	  2,373	0.0147	201.75	german_at_news_2012_00190566
3274	Für mich heißt das: der Mensch und sein Platz in der Gesellschaft.	Y	gesellschaft	623	  2,373	0.0147	206	german_at_news_2012_00499016
3275	Wir müssen alles tun, damit Menschen, die einmal einen Fehler gemacht haben, wieder Teil der Gesellschaft werden.“	Y	gesellschaft	623	  2,373	0.0147	207.3529	german_at_news_2012_00968295
3276	Heinz Habe wurde im vergangenen Dezember 60 Jahre.	Y	heinz	624	  2,367	0.0147	237.2857	german_at_news_2012_00532521
3277	Karl-Heinz Grasser will davon auch Jahre später nichts wissen.	Y	heinz	624	  2,367	0.0147	290.7	german_at_news_2012_00630864
3278	Adresse, Postleitzahl, Ort oder Bezirk E-Mail: heinz.	Y	heinz	624	  2,367	0.0147	323.75	german_at_news_2012_00016354
3279	Diese Woche gab Karl-Heinz Grasser NEWS ein Interview.	Y	heinz	624	  2,367	0.0147	330.1111	german_at_news_2012_00356946
3280	Karl-Heinz Grasser soll gehen.	Y	heinz	624	  2,367	0.0147	387.4	german_at_news_2012_00630842
3281	Das sei etwas, was man nicht so einfach im Raum stehen lassen könne.	Y	raum	624	  2,367	0.0147	154.9231	german_at_news_2012_00194006
3282	Wollen auch Sie mehr Raum?	Y	raum	624	  2,367	0.0147	179.8	german_at_news_2012_00976032
3283	Das stand bei Haider denn doch nicht im Raum.	Y	raum	624	  2,367	0.0147	192.6667	german_at_news_2012_00198437
3284	Es ist halt so, dass sie Kunst dort machen, wo sie den Raum und die Möglichkeit haben.	Y	raum	624	  2,367	0.0147	207.4375	german_at_news_2012_00462119
3285	Alles Fragen, die im Raum stehen.	Y	raum	624	  2,367	0.0147	234.5	german_at_news_2012_00025989
3286	Schließlich ist auch in dieser Saison noch alles möglich.	Y	saison	625	  2,361	0.0147	176.4444	german_at_news_2012_00782046
3287	Davon will man in dieser Saison nichts wissen.	Y	saison	625	  2,361	0.0147	197.375	german_at_news_2012_00208429
3288	Erst einmal müssen wir diese Saison zu Ende spielen.	Y	saison	625	  2,361	0.0147	204.3333	german_at_news_2012_00446061
3289	In dieser Saison soll alles anders werden.	Y	saison	625	  2,361	0.0147	207	german_at_news_2012_00596655
3290	Schließlich geht er heuer in seine 44. Saison.	Y	saison	625	  2,361	0.0147	221.8571	german_at_news_2012_00781800
3291	Aber es wird auch ein Leben nach Faymann und co. geben!	Y	co	626	  2,360	0.0147	169.6364	german_at_news_2012_00006423
3292	Lesen Sie mehr zu Gusenbauer und Co. im aktuellen 'profil'!	Y	co	626	  2,360	0.0147	316.1	german_at_news_2012_00656877
3293	Ob als Co-Trainer oder in einer anderen Funktion, das spielt keine Rolle.	Y	co	626	  2,360	0.0147	330.6154	german_at_news_2012_00736846
3294	Jeder 3. Österreicher nutzt Facebook & Co Geben Sie hier die E-Mail-Adresse des Empfängers ein (z.B. xy@z.com). Mehrere Empfänger werden durch Kommata getrennt.	Y	co	626	  2,360	0.0147	344.4	german_at_news_2012_00619949
3295	In Höhe von 726 Euro ·Sagen Sie uns Ihre Meinung zur Regierung Mitreden: Was halten Sie von Gusenbauer & Co?	Y	co	626	  2,360	0.0147	371.75	german_at_news_2012_00601059
3296	Was geht Ihnen durch den Kopf, wenn Sie die sehen?	Y	kopf	627	  2,353	0.0146	139.8	german_at_news_2012_00925160
3297	Er hat alles im Kopf.	Y	kopf	627	  2,353	0.0146	169	german_at_news_2012_00436832
3298	Ist das Spiel noch im Kopf?	Y	kopf	627	  2,353	0.0146	189.5	german_at_news_2012_00615728
3299	Aber die Bilder im Kopf werden bleiben.	Y	kopf	627	  2,353	0.0146	218.8571	german_at_news_2012_00004502
3300	“Wir müssen den Kopf jetzt wieder hoch nehmen.	Y	kopf	627	  2,353	0.0146	245.125	german_at_news_2012_00968387
3301	Das war für uns schon wirklich eine sehr, sehr große Hilfe.	Y	hilfe	628	  2,348	0.0146	146.9	german_at_news_2012_00204030
3302	Aber ohne Hilfe wird das nichts.	Y	hilfe	628	  2,348	0.0146	169.1667	german_at_news_2012_00009640
3303	Und das machen sie dann mit unserer Hilfe.	Y	hilfe	628	  2,348	0.0146	177.75	german_at_news_2012_00870758
3304	Selbst zwei Erste-Hilfe-Stellen gibt es bereits.	Y	hilfe	628	  2,348	0.0146	195.125	german_at_news_2012_00801106
3305	Jeder von uns kann in die Situation kommen, wo er selbst Hilfe braucht.	Y	hilfe	628	  2,348	0.0146	206.7692	german_at_news_2012_00620966
3306	Aber ich war am 11. September 2001 hier in New York.	Y	new	629	  2,345	0.0146	242.2222	german_at_news_2012_00007551
3307	New York, Amerika und auch Europa sind seit dem 11. September nicht mehr das, was sie einmal waren.	Y	new	629	  2,345	0.0146	254.2353	german_at_news_2012_00722901
3308	Natürlich kann ich mich nicht mit einem Bürgermeister messen, der so viel Macht hat wie der von New York.	Y	new	629	  2,345	0.0146	270.7778	german_at_news_2012_00714030
3309	Oder das Paris und New York der 1920er Jahre.	Y	new	629	  2,345	0.0146	291.6667	german_at_news_2012_00740965
3310	Der Film könnte auch der Grund für das Aus sein, so die New York Post.	Y	new	629	  2,345	0.0146	292.7857	german_at_news_2012_00239652
3311	Und das innerhalb von nur sechs Stunden!	Y	innerhalb	630	  2,344	0.0146	195.2857	german_at_news_2012_00870441
3312	Aus dem 6:5 wurde innerhalb weniger Minuten ein 12:5.	Y	innerhalb	630	  2,344	0.0146	208.1429	german_at_news_2012_00081392
3313	Ich war dann auch innerhalb der Mannschaft nicht mehr so laut wie früher.	Y	innerhalb	630	  2,344	0.0146	215.3077	german_at_news_2012_00560177
3314	Aber das ist keine Angelegenheit der FPÖ, sondern eine Angelegenheit, die es innerhalb der ÖVP immer schon gegeben hat.	Y	innerhalb	630	  2,344	0.0146	221.3529	german_at_news_2012_00003583
3315	Ich werde das innerhalb der nächsten beiden Monate tun.	Y	innerhalb	630	  2,344	0.0146	248.3333	german_at_news_2012_00561230
3316	So ist es immer, in all den Jahren.	Y	all	631	  2,335	0.0145	107.375	german_at_news_2012_00824439
3317	Wie viele waren es in all den Jahren?	Y	all	631	  2,335	0.0145	126.75	german_at_news_2012_00960345
3318	Aber all das ist nicht das Thema!	Y	all	631	  2,335	0.0145	163.5	german_at_news_2012_00001524
3319	Was all das sein soll?	Y	all	631	  2,335	0.0145	167.6	german_at_news_2012_00923173
3320	All das geht ab sofort ganz einfach.	Y	all	631	  2,335	0.0145	238.7143	german_at_news_2012_00020827
3321	Aber die habe ich nicht gefunden.	Y	gefunden	632	  2,326	0.0145	131.8333	german_at_news_2012_00004650
3322	Was haben Sie bis jetzt gefunden?	Y	gefunden	632	  2,326	0.0145	152.3333	german_at_news_2012_00925364
3323	Was hat man dort noch gefunden?	Y	gefunden	632	  2,326	0.0145	166	german_at_news_2012_00925564
3324	Dort hat sie ihre große Liebe gefunden.	Y	gefunden	632	  2,326	0.0145	220.1429	german_at_news_2012_00390374
3325	Der Ort war bald gefunden.	Y	gefunden	632	  2,326	0.0145	309.4	german_at_news_2012_00254187
3326	In der Stadt hingegen schon.	Y	hingegen	632	  2,326	0.0145	180.2	german_at_news_2012_00593545
3327	Die Jungen hingegen haben das nicht.	Y	hingegen	632	  2,326	0.0145	212.3333	german_at_news_2012_00316528
3328	Hingegen können 75 Prozent wieder gehen.	Y	hingegen	632	  2,326	0.0145	216.6	german_at_news_2012_00541799
3329	Wir doch nicht, scheint hingegen Österreich derzeit zu sagen.	Y	hingegen	632	  2,326	0.0145	228.1111	german_at_news_2012_00963681
3330	Bei den Grünen hingegen gibt es Probleme.	Y	hingegen	632	  2,326	0.0145	244.1429	german_at_news_2012_00095679
3331	Die Frage ist: Was machen wir in der Region?	Y	region	633	  2,320	0.0144	129.2222	german_at_news_2012_00303555
3332	Aber wir gehen wegen einer Regierung nicht weg aus dieser Region.	Y	region	633	  2,320	0.0144	164.2727	german_at_news_2012_00011864
3333	Das ist wichtig für die Wirtschaft in dieser Region.	Y	region	633	  2,320	0.0144	172.8889	german_at_news_2012_00180411
3334	Ein Fest im Schloss, ein Fest mit und für die Region!	Y	region	633	  2,320	0.0144	211.7778	german_at_news_2012_00416802
3335	Ein Fest für die ganze Region stand auf dem Programm.	Y	region	633	  2,320	0.0144	239.6	german_at_news_2012_00416798
3336	Das Alter selbst ist egal, wichtig ist, dass es einem gut geht, dass man Lebensqualität bis ins hohe Alter hat.“	Y	hohe	634	  2,319	0.0144	305.4706	german_at_news_2012_00159549
3337	Das ist bei uns in Österreich nicht der Fall, bei uns wird diese Bauweise nur dann angewandt, wenn es sich um sehr hohe Gebäude handelt.	Y	hohe	634	  2,319	0.0144	340.6957	german_at_news_2012_00176715
3338	Aber ich glaube, dass wenig Geld zu haben nicht unbedingt heißt, dass man keine hohe Lebensqualität haben kann.	Y	hohe	634	  2,319	0.0144	349.5	german_at_news_2012_00007171
3339	Die SPÖ hat aber auch eine hohe Zustimmung bei den Anhängern der Grünen.	Y	hohe	634	  2,319	0.0144	363.9231	german_at_news_2012_00361139
3340	Das Problem beim SPÖ-Antrag sieht er, wie er sagte, darin, dass alle Pensionen um 0,8 % erhöht werden sollen, auch hohe.	Y	hohe	634	  2,319	0.0144	366.3158	german_at_news_2012_00189386
3341	Und so geht es in der zweiten Folge weiter.	Y	folge	635	  2,314	0.0144	144.3333	german_at_news_2012_00881666
3342	Was sich in der Folge entwickelt hat, war nicht ganz so einfach.	Y	folge	635	  2,314	0.0144	161.8333	german_at_news_2012_00927757
3343	Sie kommen nun bereits das dritte Jahr in Folge nach Wien, und zwar immer im Mai.	Y	folge	635	  2,314	0.0144	177.6875	german_at_news_2012_00809787
3344	Das hat somit zur Folge, dass Sie ihn nicht wirklich lesen wollen.	Y	folge	635	  2,314	0.0144	231.5833	german_at_news_2012_00173661
3345	Auch das ist eine Folge des Niedergangs der FPÖ seit dem Jahr 2000.	Y	folge	635	  2,314	0.0144	278.0833	german_at_news_2012_00061113
3346	Das werden wir aber nicht schaffen.	Y	schaffen	636	  2,312	0.0144	129.1667	german_at_news_2012_00204897
3347	Für mich war immer klar, dass ich es schaffen werde.	Y	schaffen	636	  2,312	0.0144	148.2	german_at_news_2012_00499260
3348	Wird er es auch nach Kärnten schaffen?	Y	schaffen	636	  2,312	0.0144	159	german_at_news_2012_00963461
3349	Und wenn Sie das nicht schaffen, dann zahlen Sie das Geld zurück.	Y	schaffen	636	  2,312	0.0144	182.7	german_at_news_2012_00884607
3350	Wir schaffen uns unsere eigene Welt!	Y	schaffen	636	  2,312	0.0144	305.1667	german_at_news_2012_00969179
3351	Ja, das könnte was werden, meinte der, aber warten Sie mal.	Y	meinte	637	  2,309	0.0143	209.0909	german_at_news_2012_00617424
3352	Dabei stellte er Fragen, von denen er eigentlich meinte, dass sie auf der Hand liegen: Wer war diese Frau?	Y	meinte	637	  2,309	0.0143	229.9444	german_at_news_2012_00134277
3353	Meinte man zumindest in Österreich.	Y	meinte	637	  2,309	0.0143	244.4	german_at_news_2012_00677455
3354	Er meinte, ich würde es nicht ernst nehmen.	Y	meinte	637	  2,309	0.0143	245.625	german_at_news_2012_00441455
3355	Dann meinte er: Wir sehen uns am Das war es – von einer Einladung war also nie die Rede.	Y	meinte	637	  2,309	0.0143	254.7647	german_at_news_2012_00153383
3356	Fünf Euro und mehr geben die Kunden hier aus.	Y	kunden	638	  2,307	0.0143	136.4444	german_at_news_2012_00490262
3357	Denn nur, wenn unsere Kunden erfolgreich sind, dann sind es auch wir.	Y	kunden	638	  2,307	0.0143	184.9091	german_at_news_2012_00222239
3358	Das wissen nur die Kunden selbst.	Y	kunden	638	  2,307	0.0143	190.3333	german_at_news_2012_00205954
3359	Sie hat 50 Mitarbeiter und rund 200 Kunden.	Y	kunden	638	  2,307	0.0143	212	german_at_news_2012_00807517
3360	Aber natürlich ganz stark die Mitarbeiter und vor allem die Kunden.	Y	kunden	638	  2,307	0.0143	219	german_at_news_2012_00009050
3361	Ein Tag im Leben eines Stars.	Y	stars	639	  2,290	0.0142	195.5	german_at_news_2012_00425007
3362	Am Samstag, dem 19. Mai 2012 werden wieder einige Stars in Wien erwartet.	Y	stars	639	  2,290	0.0142	226	german_at_news_2012_00043935
3363	Die Bilder zeigen jedenfalls, dass auch Stars nur Menschen sind.	Y	stars	639	  2,290	0.0142	234.6	german_at_news_2012_00288227
3364	Heute sind das die Stars von morgen.	Y	stars	639	  2,290	0.0142	256.1429	german_at_news_2012_00536478
3365	Das sind die „Dancing Stars“ 2012 Geben Sie hier die E-Mail-Adresse des Empfängers ein (z.B. xy@z.com). Mehrere Empfänger werden durch Kommata getrennt.	Y	stars	639	  2,290	0.0142	299.5417	german_at_news_2012_00195786
3366	Aber ich habe mich dem nicht gestellt.	Y	gestellt	640	  2,277	0.0141	138.4286	german_at_news_2012_00007281
3367	Die Frage haben Sie mir sicher vor Jahren schon einmal gestellt.	Y	gestellt	640	  2,277	0.0141	161.0909	german_at_news_2012_00303445
3368	Er habe sich dazu zur Verfügung gestellt.	Y	gestellt	640	  2,277	0.0141	204	german_at_news_2012_00436510
3369	Trotzdem ist jeder auf sich gestellt.	Y	gestellt	640	  2,277	0.0141	256.3333	german_at_news_2012_00856148
3370	Dabei wurden insgesamt 22 Fragen gestellt.	Y	gestellt	640	  2,277	0.0141	297.2	german_at_news_2012_00135405
3371	Somit ist es wohl nur mehr eine Frage der Zeit, bis es in Österreich wieder Studiengebühren gibt.	Y	somit	641	  2,275	0.0141	214.625	german_at_news_2012_00828235
3372	Das hat somit zur Folge, dass Sie ihn nicht wirklich lesen wollen.	Y	somit	641	  2,275	0.0141	231.5833	german_at_news_2012_00173661
3373	Die tun Ihnen und somit auch der Stimmung nicht gut.	Y	somit	641	  2,275	0.0141	241.8	german_at_news_2012_00368742
3374	Somit waren an beiden Tagen sieben Österreicher unter den ersten zehn.	Y	somit	641	  2,275	0.0141	258.8182	german_at_news_2012_00828476
3375	Und es fehlen uns somit im Jahr 2012 2,5 Millionen Euro.	Y	somit	641	  2,275	0.0141	268.2222	german_at_news_2012_00875355
3376	Strache: Das wird auch in Wien der Fall sein.	Y	strache	642	  2,274	0.0141	122.7778	german_at_news_2012_00843832
3377	Da kann Strache sagen, was er will.	Y	strache	642	  2,274	0.0141	186.7143	german_at_news_2012_00143047
3378	Strache was wollen Sie nun?	Y	strache	642	  2,274	0.0141	202.6	german_at_news_2012_00844180
3379	Strache: Was tun wir hier überhaupt?	Y	strache	642	  2,274	0.0141	272.1667	german_at_news_2012_00844179
3380	FPÖ-Chef Strache stellt sich Ihren Fragen!	Y	strache	642	  2,274	0.0141	308.4286	german_at_news_2012_00485589
3381	Und das hat er auch erreicht.	Y	erreicht	643	  2,265	0.0141	121	german_at_news_2012_00870335
3382	In drei Jahren sollen 100 Prozent erreicht werden.	Y	erreicht	643	  2,265	0.0141	159.2857	german_at_news_2012_00597053
3383	Und dieses Ziel haben wir erreicht.	Y	erreicht	643	  2,265	0.0141	200.1667	german_at_news_2012_00873773
3384	Bis zum 5. November war dieses Ziel nicht erreicht.	Y	erreicht	643	  2,265	0.0141	218.125	german_at_news_2012_00119906
3385	Dieser Wert wird bereits 2005 erreicht.	Y	erreicht	643	  2,265	0.0141	271.4	german_at_news_2012_00352659
3386	Bis Mai 2006 in der Höhe von 887,6 Millionen Euro.	Y	höhe	644	  2,262	0.0141	154.125	german_at_news_2012_00119175
3387	Das Unternehmen sieht dafür in den nächsten beiden Jahren Investitionen in der Höhe von 2,5 Millionen Euro vor.	Y	höhe	644	  2,262	0.0141	203.1875	german_at_news_2012_00201342
3388	Die Höhe wird in diesem Jahr 15.000 Browser zeigt »Iframes« nicht an.	Y	höhe	644	  2,262	0.0141	206.1818	german_at_news_2012_00313117
3389	Ein Wert in dieser Höhe wurde im August in den vergangenen zehn Jahren nur einmal, nämlich 1998, erreicht.	Y	höhe	644	  2,262	0.0141	231.25	german_at_news_2012_00427130
3390	Österreich wird für das Projekt einen Beitrag in Höhe von ca. Euro 500.000 zur Verfügung stellen.	Y	höhe	644	  2,262	0.0141	245.0667	german_at_news_2012_00751635
3391	Das zeigte sich in den letzten Jahren immer wieder.	Y	zeigte	644	  2,262	0.0141	123.2222	german_at_news_2012_00206834
3392	Am Samstag zeigte sie sich zum ersten Mal wieder in der Öffentlichkeit.	Y	zeigte	644	  2,262	0.0141	198.6667	german_at_news_2012_00044175
3393	Und dass dieser Weg auch richtige ist, zeigte sich auch in den letzten Tagen.	Y	zeigte	644	  2,262	0.0141	212.4615	german_at_news_2012_00871157
3394	Wie sich in den letzten Jahren zeigte, lag er damit völlig richtig.	Y	zeigte	644	  2,262	0.0141	247.3333	german_at_news_2012_00959137
3395	Er ging einem Verdacht nach und zeigte diesen bei der Staatsanwaltschaft an.	Y	zeigte	644	  2,262	0.0141	292.75	german_at_news_2012_00435806
3396	Und es wird jedes Jahr noch mehr.	Y	jedes	645	  2,258	0.014	126	german_at_news_2012_00875848
3397	Das heißt nicht, dass es jedes Jahr dort ist.	Y	jedes	645	  2,258	0.014	149.7778	german_at_news_2012_00174499
3398	Dazu hat er jedes Recht.	Y	jedes	645	  2,258	0.014	241.4	german_at_news_2012_00210281
3399	Denn für uns ist jedes Kind gleich viel wert.	Y	jedes	645	  2,258	0.014	257.7778	german_at_news_2012_00220804
3400	So wie eben jedes Jahr.	Y	jedes	645	  2,258	0.014	280.4	german_at_news_2012_00833263
3401	Hier geht´s zur »Österreich Wollen unter die Top Drei der EU kommen Bundeskanzler im Hohen Haus: „Reden wir Österreich nicht schlecht - dazu sind wir zu gut“ Wien (övp-pk) - Ziel ist es, innerhalb der nächsten Jahre unter die Top drei in der EU zu kommen.	Y	hohen	646	  2,256	0.014	270.2	german_at_news_2012_00538791
3402	Wir haben alle in Europa einen viel zu hohen Schuldenberg, der muss weg.	Y	hohen	646	  2,256	0.014	287	german_at_news_2012_00964734
3403	Derzeit gibt es immer noch einige, die auf Grund der hohen Kosten nicht anschließen.	Y	hohen	646	  2,256	0.014	305.1429	german_at_news_2012_00268923
3404	Vielleicht liegt es aber auch nur an einer zu hohen Erwartungshaltung.	Y	hohen	646	  2,256	0.014	327.8182	german_at_news_2012_00901588
3405	Richtig glücklich sehen sie zwar nicht aus, das kann aber auch an den hohen Temperaturen liegen.	Y	hohen	646	  2,256	0.014	329.0625	german_at_news_2012_00771684
3406	Sie sagen also, wir leben in Wien in einem Museum?	Y	museum	647	  2,254	0.014	167.5556	german_at_news_2012_00811941
3407	Gilt er auch für das Museum?	Y	museum	647	  2,254	0.014	173.5	german_at_news_2012_00515931
3408	Die Menschen sollen wissen, was sie im Museum erwartet.	Y	museum	647	  2,254	0.014	216.6667	german_at_news_2012_00326507
3409	Wie geht das Leopold-Museum in der Ausstellung selbst mit dem Thema um?	Y	museum	647	  2,254	0.014	252.1538	german_at_news_2012_00954854
3410	Jetzt ist auch ein Museum geplant.	Y	museum	647	  2,254	0.014	252.1667	german_at_news_2012_00624269
