ORDER	SENTENCE	STATUS	WORD	RANK	COUNT	COUNT_REL	INDEX	ID
3615	·IHRE MEINUNG: Wien- Wahl & ihre Folgen!	Y	folgen	683	  2,130	0.0132	391.6	german_at_news_2012_00564823
3616	Das aber ist die Kultur, die gerade wieder sehr in Frage steht.	Y	kultur	684	  2,128	0.0132	142.4545	german_at_news_2012_00158895
3617	Dass es nicht um Kultur geht.	Y	kultur	684	  2,128	0.0132	148.3333	german_at_news_2012_00195009
3618	Kultur ist mehr als nur Kunst.	Y	kultur	684	  2,128	0.0132	221.8333	german_at_news_2012_00645634
3619	Kultur sei mehr als nur Kunst.	Y	kultur	684	  2,128	0.0132	230.5	german_at_news_2012_00645714
3620	Das gehört zur politischen Kultur.	Y	kultur	684	  2,128	0.0132	374.4	german_at_news_2012_00169959
3621	Aus dem Weg gehen wollen sie sich künftig nicht.	Y	künftig	684	  2,128	0.0132	159.2222	german_at_news_2012_00081699
3622	Und das werde ich auch künftig tun.	Y	künftig	684	  2,128	0.0132	172	german_at_news_2012_00871555
3623	Das soll auch künftig so bleiben.	Y	künftig	684	  2,128	0.0132	192.3333	german_at_news_2012_00196978
3624	Das scheint auch künftig nicht der Fall zu sein.	Y	künftig	684	  2,128	0.0132	192.4444	german_at_news_2012_00191906
3625	Das soll künftig anders sein.	Y	künftig	684	  2,128	0.0132	261	german_at_news_2012_00197048
3626	Und Zeit ist das, was jetzt niemand mehr hat.	Y	niemand	685	  2,126	0.0132	119.1111	german_at_news_2012_00885841
3627	Niemand aber weiß, was dort zu sehen ist.	Y	niemand	685	  2,126	0.0132	190.75	german_at_news_2012_00726618
3628	Und das will wohl niemand.	Y	niemand	685	  2,126	0.0132	213.6	german_at_news_2012_00871583
3629	Aber niemand bleibt wegen der Kinder zusammen.	Y	niemand	685	  2,126	0.0132	266.5714	german_at_news_2012_00009401
3630	Niemand hatte diese Frage zuvor gestellt.	Y	niemand	685	  2,126	0.0132	389.8333	german_at_news_2012_00726729
3631	Ich habe gesagt, wir sind nicht per Du.	Y	per	685	  2,126	0.0132	224.125	german_at_news_2012_00553305
3632	Und das per E-Mail!	Y	per	685	  2,126	0.0132	241.4	german_at_news_2012_00871034
3633	ICH kann mich aber NICHT erinnern mit IHNEN per Du zu sein.	Y	per	685	  2,126	0.0132	248.3333	german_at_news_2012_00556327
3634	Die beiden sind schon länger per Du.	Y	per	685	  2,126	0.0132	299.7143	german_at_news_2012_00285439
3635	Dies ist per 1. Oktober möglich.	Y	per	685	  2,126	0.0132	313.8	german_at_news_2012_00358739
3636	So kam es zu seiner Studie.	Y	studie	686	  2,124	0.0132	189.6667	german_at_news_2012_00824652
3637	Nur: Diese Studie hat es nie gegeben.	Y	studie	686	  2,124	0.0132	219.1429	german_at_news_2012_00733888
3638	Das ist nun im Rahmen einer Studie bestätigt worden.	Y	studie	686	  2,124	0.0132	251.3333	german_at_news_2012_00179757
3639	Hier geht eine aktuelle Studie der TU Graz davon aus, dass das bis zu 50 Prozent sein werden.“	Y	studie	686	  2,124	0.0132	256.7647	german_at_news_2012_00538146
3640	Laut der Studie wird sie rund 15,5 Milliarden Euro in den nächsten 30 Jahren betragen.	Y	studie	686	  2,124	0.0132	275	german_at_news_2012_00652104
3641	Am 10. September steht die ersten Runde auf dem Programm.	Y	runde	687	  2,118	0.0132	205.6667	german_at_news_2012_00037547
3642	Alle in der Runde haben Eltern, die nicht in Österreich geboren wurden.	Y	runde	687	  2,118	0.0132	219.3636	german_at_news_2012_00022395
3643	Ich hatte von Anfang bis zum letzten Teil der letzten Runde alles unter Kontrolle.	Y	runde	687	  2,118	0.0132	251.4615	german_at_news_2012_00555535
3644	Der Prozess soll von 25. bis 27. Juni in seine letzte Runde gehen.	Y	runde	687	  2,118	0.0132	266.5455	german_at_news_2012_00256269
3645	Mit einem 2:1 gegen Innsbruck macht Sturm Graz in der letzten Runde alles klar.	Y	runde	687	  2,118	0.0132	288.5385	german_at_news_2012_00689665
3646	Zuerst der Vater, dann Thomas – jetzt soll auch sie endlich was haben vom Leben.“	Y	thomas	687	  2,118	0.0132	245.2143	german_at_news_2012_00985750
3647	Thomas: Was sollte ich sonst tun?	Y	thomas	687	  2,118	0.0132	305	german_at_news_2012_00851807
3648	Aber wie das halt so ist: Thomas Bernhard zum ersten Mal?	Y	thomas	687	  2,118	0.0132	328.4545	german_at_news_2012_00011663
3649	Aber gegen Abend beschweren sich die beiden Frauen, dass Thomas nie mit ihnen feiern geht, sondern nur Arbeit am Programm steht.	Y	thomas	687	  2,118	0.0132	328.6667	german_at_news_2012_00006638
3650	Heißt: Thomas stehen mindestens vier Millionen US-Dollar zu.	Y	thomas	687	  2,118	0.0132	351.1111	german_at_news_2012_00532786
3651	So spielt sich das nicht ab.	Y	spielt	688	  2,114	0.0131	142.3333	german_at_news_2012_00831517
3652	Was spielt sich dort ab?	Y	spielt	688	  2,114	0.0131	210.2	german_at_news_2012_00928196
3653	Ihr Alter spielt keine, oder doch eine Rolle.	Y	spielt	688	  2,114	0.0131	271.125	german_at_news_2012_00563627
3654	Das Alter spielt in diesem Fall keine Rolle.	Y	spielt	688	  2,114	0.0131	288.625	german_at_news_2012_00159552
3655	Kunst spielt eine große Rolle.	Y	spielt	688	  2,114	0.0131	377.4	german_at_news_2012_00646328
3656	Derzeit gibt es hier keine Fotos zu diesem Thema.	Y	fotos	689	  2,113	0.0131	174	german_at_news_2012_00268921
3657	In der Ausstellung ist ein Teil seiner Fotos sehen.	Y	fotos	689	  2,113	0.0131	208.6667	german_at_news_2012_00589864
3658	Hier finden Sie die besten Fotos!	Y	fotos	689	  2,113	0.0131	222.1667	german_at_news_2012_00537874
3659	Fotos vom Abend gibt es hier zu sehen.	Y	fotos	689	  2,113	0.0131	233.75	german_at_news_2012_00485208
3660	Hier gibt es noch keine Gemeinde-Fotos.	Y	fotos	689	  2,113	0.0131	240.2857	german_at_news_2012_00538901
3661	Da musste auch er GEGEN das System sein.	Y	system	689	  2,113	0.0131	165.25	german_at_news_2012_00149236
3662	Vielleicht hat das auch mit diesem System zu tun.	Y	system	689	  2,113	0.0131	173	german_at_news_2012_00901262
3663	Das System wäre keine zwei Jahre mehr zu halten gewesen.	Y	system	689	  2,113	0.0131	187.8	german_at_news_2012_00199320
3664	Sie sagen: Das ist System.	Y	system	689	  2,113	0.0131	209.2	german_at_news_2012_00811945
3665	Leider setzt sich das System immer mehr von der Bevölkerung ab.	Y	system	689	  2,113	0.0131	241.5455	german_at_news_2012_00655715
3666	“Es wird schon gut werden”, so der Kommentar.	Y	kommentar	690	  2,105	0.0131	123.375	german_at_news_2012_00472023
3667	Das ist auch ein Kommentar.	Y	kommentar	690	  2,105	0.0131	147.2	german_at_news_2012_00176552
3668	Kommentar: Was ist Ihre MEINUNG zu dem Thema?	Y	kommentar	690	  2,105	0.0131	225.125	german_at_news_2012_00640537
3669	Ihr Kommentar war in der Zeitung - er ist mir zu alt!	Y	kommentar	690	  2,105	0.0131	236.1818	german_at_news_2012_00565920
3670	Jetzt ist er plötzlich wieder da mein Kommentar von 16:26 Uhr.	Y	kommentar	690	  2,105	0.0131	243.9	german_at_news_2012_00624426
3671	Aber man konnte sich nicht einigen.	Y	einigen	691	  2,099	0.013	167.3333	german_at_news_2012_00008626
3672	Da werden wir uns schon einigen, keine Frage.	Y	einigen	691	  2,099	0.013	171.375	german_at_news_2012_00208985
3673	Seit einigen Jahren gehört er der FPÖ.	Y	einigen	691	  2,099	0.013	227.2857	german_at_news_2012_00797517
3674	Können wir uns darauf einigen?	Y	einigen	691	  2,099	0.013	242.6	german_at_news_2012_00641813
3675	Eine Entscheidung wird erst in einigen Monaten erwartet.	Y	einigen	691	  2,099	0.013	313.75	german_at_news_2012_00406532
3676	Über was wird dann Freitag bis Sonntag berichtet?	Y	berichtet	692	  2,098	0.013	208.25	german_at_news_2012_00861729
3677	In Österreich kommt das neue iPhone wie berichtet erst im Juli.	Y	berichtet	692	  2,098	0.013	209.2727	german_at_news_2012_00605069
3678	Es wird ja auch ganz anders darüber berichtet.	Y	berichtet	692	  2,098	0.013	226.125	german_at_news_2012_00471838
3679	Haben Sie etwas dafür tun müssen, dass die Krone so gut über Sie berichtet?	Y	berichtet	692	  2,098	0.013	242.3846	german_at_news_2012_00526058
3680	Auch an dieser Stelle wurde darüber berichtet.	Y	berichtet	692	  2,098	0.013	273.5714	german_at_news_2012_00059501
3681	Auch wenn es einmal nicht so läuft.	Y	läuft	693	  2,095	0.013	141	german_at_news_2012_00072806
3682	Es läuft für mich gerade sehr gut.	Y	läuft	693	  2,095	0.013	190.2857	german_at_news_2012_00465085
3683	Wie lange läuft das Projekt noch?	Y	läuft	693	  2,095	0.013	240.3333	german_at_news_2012_00956439
3684	Innerhalb der nächsten sechs Wochen läuft die Uhr ab.	Y	läuft	693	  2,095	0.013	279	german_at_news_2012_00603738
3685	Heute Abend läuft die 150. Folge.	Y	läuft	693	  2,095	0.013	422.8	german_at_news_2012_00535062
3686	Das ist auch in seinem neuen Buch so.	Y	buch	694	  2,079	0.0129	132	german_at_news_2012_00176601
3687	Es gibt ein Buch über Deutsche in Österreich, das heißt „Wir sind gekommen, um zu bleiben“.	Y	buch	694	  2,079	0.0129	179.75	german_at_news_2012_00456780
3688	Fischer: „Das muss ein Buch sein, oder?	Y	buch	694	  2,079	0.0129	226.7143	german_at_news_2012_00482583
3689	Das war ein Grund, das Buch zu schreiben.	Y	buch	694	  2,079	0.0129	256	german_at_news_2012_00203678
3690	Strache möchte ein Buch schreiben.	Y	buch	694	  2,079	0.0129	488.6	german_at_news_2012_00844022
3691	Und es wird die letzte sein.	Y	letzte	695	  2,078	0.0129	134	german_at_news_2012_00875837
3692	Es wird nicht der letzte gewesen sein.	Y	letzte	695	  2,078	0.0129	152.7143	german_at_news_2012_00471941
3693	Es war für uns beide das letzte Mal.	Y	letzte	695	  2,078	0.0129	192.875	german_at_news_2012_00470519
3694	Dann vielleicht aber auch seine letzte.	Y	letzte	695	  2,078	0.0129	211.6667	german_at_news_2012_00154207
3695	Vor drei Wochen ging der letzte.	Y	letzte	695	  2,078	0.0129	259.6667	german_at_news_2012_00913542
3696	Österreich liegt derzeit etwa in der Mitte.	Y	mitte	696	  2,073	0.0129	192.7143	german_at_news_2012_00749977
3697	Bis Mitte März ist ja noch einige Zeit.	Y	mitte	696	  2,073	0.0129	221.75	german_at_news_2012_00119228
3698	Anfang, Mitte 30 ist das wohl so.	Y	mitte	696	  2,073	0.0129	242.1667	german_at_news_2012_00050149
3699	Er hat Ideen und ich hab welche und dann finden wir uns in der Mitte.	Y	mitte	696	  2,073	0.0129	276.1429	german_at_news_2012_00437300
3700	Aber auch diese soll nur bis Mitte des kommenden Jahres gelten.	Y	mitte	696	  2,073	0.0129	281.5455	german_at_news_2012_00002149
3701	Wir sind für Sie von Montag bis Mittwoch, jeweils von 10.30 Uhr bis 10.45 Uhr da.	Y	jeweils	697	  2,072	0.0129	178.9091	german_at_news_2012_00969862
3702	Und zwar am 14. und am 15. September 2002 jeweils von 10 bis 21 Uhr.	Y	jeweils	697	  2,072	0.0129	187.875	german_at_news_2012_00886046
3703	Am Wochenende des 12. und 13. Juli sowie am 23. und 24. August (jeweils um 11.00 und 15.00 Uhr) ist es wieder so weit.	Y	jeweils	697	  2,072	0.0129	213.7333	german_at_news_2012_00045334
3704	Was immer das genau ist und egal, ob Österreich jeweils dabei wäre.	Y	jeweils	697	  2,072	0.0129	223.0833	german_at_news_2012_00925963
3705	Jeweils zwei Millionen Euro sollten vom Bund und der Stadt Wien kommen.	Y	jeweils	697	  2,072	0.0129	237.5	german_at_news_2012_00626462
3706	Er hat gesehen: Das kann auch ich nicht mehr.“	Y	gesehen	698	  2,070	0.0129	104.6667	german_at_news_2012_00437278
3707	Wo hat man das schon gesehen!	Y	gesehen	698	  2,070	0.0129	166.6667	german_at_news_2012_00974932
3708	Aber man muss es wohl selbst gesehen/ gehört haben!	Y	gesehen	698	  2,070	0.0129	200.3333	german_at_news_2012_00008668
3709	Allerdings: Das Paar wurde schon seit einigen Wochen nicht mehr gesehen.	Y	gesehen	698	  2,070	0.0129	232.1818	german_at_news_2012_00023987
3710	Diesen Film sollte jeder gesehen haben.	Y	gesehen	698	  2,070	0.0129	305	german_at_news_2012_00349150
3711	Das ist aber, wie man sagt, Geld in der Bank für den Künstler.	Y	künstler	699	  2,068	0.0129	134.8462	german_at_news_2012_00176364
3712	Auch der Künstler selbst hält sich nicht für einen neuen Menschen.	Y	künstler	699	  2,068	0.0129	149.4545	german_at_news_2012_00062223
3713	Wie sind Sie Künstler geworden?	Y	künstler	699	  2,068	0.0129	252.4	german_at_news_2012_00959340
3714	Künstler wissen, dass sie bei uns diese Chance bekommen.	Y	künstler	699	  2,068	0.0129	255.2222	german_at_news_2012_00646286
3715	Wie Künstler eben so leben.	Y	künstler	699	  2,068	0.0129	305.6	german_at_news_2012_00956320
3716	Für mich war das Thema immer offen und das ist es nach wie vor.	Y	offen	700	  2,067	0.0128	108.6154	german_at_news_2012_00499231
3717	Wer das sein wird, ist noch völlig offen.	Y	offen	700	  2,067	0.0128	189.875	german_at_news_2012_00945649
3718	Seine Zukunft lässt sich der 15-Jährige offen.	Y	offen	700	  2,067	0.0128	230.8571	german_at_news_2012_00793642
3719	Noch sind diese Fragen offen.	Y	offen	700	  2,067	0.0128	249.6	german_at_news_2012_00729185
3720	Dennoch bleiben einige Fragen offen.	Y	offen	700	  2,067	0.0128	452.8	german_at_news_2012_00222329
3721	Im Jahr 2009 hat die SPÖ etwas von ihrer Würde verloren.	Y	verloren	701	  2,066	0.0128	144.7	german_at_news_2012_00573623
3722	Jetzt hat er ihn für immer verloren.	Y	verloren	701	  2,066	0.0128	160	german_at_news_2012_00624065
3723	Zwei Jahre nach der Mutter hatte er damit auch den Vater verloren.	Y	verloren	701	  2,066	0.0128	182.8333	german_at_news_2012_00997724
3724	Sie haben ja nur ganz knapp verloren.	Y	verloren	701	  2,066	0.0128	217	german_at_news_2012_00807081
3725	Dieser Junge hat seine Eltern verloren.	Y	verloren	701	  2,066	0.0128	315	german_at_news_2012_00351293
3726	Das hat nichts mit einem Interesse an Menschen zu tun.	Y	interesse	702	  2,065	0.0128	140.6	german_at_news_2012_00173532
3727	Könnte vielleicht von Interesse für Sie sein.	Y	interesse	702	  2,065	0.0128	194.7143	german_at_news_2012_00641980
3728	Das Interesse von anderen ist aber groß.	Y	interesse	702	  2,065	0.0128	216	german_at_news_2012_00175941
3729	Das zeigt, wie groß das Interesse ist.”	Y	interesse	702	  2,065	0.0128	256.6667	german_at_news_2012_00206884
3730	Vielen Dank für Ihr Interesse!	Y	interesse	702	  2,065	0.0128	361.6	german_at_news_2012_00899904
3731	Das Land bekommt erst im September wieder internationale Hilfe, aber schon in zwei Wochen geht das Geld aus.	Y	internationale	703	  2,060	0.0128	216.5294	german_at_news_2012_00183389
3732	Die internationale Jugendarbeitslosenquote (15 bis 24 Jahre) in Österreich liegt mit 10,3% (Mai 2005) nach wie vor deutlich unter dem europäischen Durchschnitt (EU-25) von 19,0% im April 2005.	Y	internationale	703	  2,060	0.0128	300.7273	german_at_news_2012_00315227
3733	Die internationale Jugendarbeitslosenquote (15 bis 24 Jahre) in Österreich liegt mit 10,2% (April 2005) nach wie vor deutlich unter dem europäischen Durchschnitt (EU-25) von 19,1% im März 2005.	Y	internationale	703	  2,060	0.0128	304.2273	german_at_news_2012_00315226
3734	Diese konzentrieren sich auf die österreichische und internationale Kunst der vergangenen 30 Jahre.	Y	internationale	703	  2,060	0.0128	312.9167	german_at_news_2012_00347884
3735	Die internationale Jugendarbeitslosenquote (15 bis 24 Jahre) in Österreich liegt mit 9,9% (Februar 2005) nach wie vor deutlich unter dem europäischen Durchschnitt (EU-25) von 18,7% im Jänner 2005.	Y	internationale	703	  2,060	0.0128	315.9091	german_at_news_2012_00315228
3736	Das brauchen wir in Österreich nicht.	Y	brauchen	704	  2,050	0.0127	141	german_at_news_2012_00162992
3737	Brauchen Sie die für Ihre Frau?	Y	brauchen	704	  2,050	0.0127	168.1667	german_at_news_2012_00123102
3738	Die Leute nehmen aus der Musik was immer sie wollen und brauchen.	Y	brauchen	704	  2,050	0.0127	189.25	german_at_news_2012_00323155
3739	Wir brauchen mehr Europa, nicht weniger!	Y	brauchen	704	  2,050	0.0127	221	german_at_news_2012_00963043
3740	Brauchen sie Hilfe? also Bitte!	Y	brauchen	704	  2,050	0.0127	394	german_at_news_2012_00123106
3741	Aber darum soll es hier nicht gehen.	Y	darum	705	  2,047	0.0127	168.8571	german_at_news_2012_00003317
3742	Aber darum geht es nicht.	Y	darum	705	  2,047	0.0127	176.8	german_at_news_2012_00003315
3743	Aber darum geht's gar nicht.	Y	darum	705	  2,047	0.0127	219.5	german_at_news_2012_00003316
3744	Es geht darum, 25 junge Menschen zu führen und zum Erfolg zu führen.	Y	darum	705	  2,047	0.0127	247.7	german_at_news_2012_00455379
3745	Darum wollte ich ihn haben.	Y	darum	705	  2,047	0.0127	257.8	german_at_news_2012_00158291
3746	Oder man wird das nicht lesen, und doch ist es so.	Y	lesen	706	  2,046	0.0127	91.8182	german_at_news_2012_00741751
3747	Mehr dazu lesen Sie im neuen NEWS!	Y	lesen	706	  2,046	0.0127	182.8571	german_at_news_2012_00674336
3748	Das hat somit zur Folge, dass Sie ihn nicht wirklich lesen wollen.	Y	lesen	706	  2,046	0.0127	231.5833	german_at_news_2012_00173661
3749	Das ganze Interview lesen Sie im neuen NEWS.	Y	lesen	706	  2,046	0.0127	259.375	german_at_news_2012_00169307
3750	Können Sie überhaupt gleichzeitig lesen und schreiben?	Y	lesen	706	  2,046	0.0127	346	german_at_news_2012_00641789
3751	Und das ist das Beste für Österreich.	Y	beste	707	  2,044	0.0127	133.5	german_at_news_2012_00870492
3752	Ob ich nun der Beste bin, der ich sein kann, diese Frage ist aber immer noch offen.	Y	beste	707	  2,044	0.0127	167.2667	german_at_news_2012_00738961
3753	Ich kann nur das Beste sagen.	Y	beste	707	  2,044	0.0127	196.3333	german_at_news_2012_00556522
3754	Das ist der beste Wert seit 2008.	Y	beste	707	  2,044	0.0127	220	german_at_news_2012_00177020
3755	D :D aber das beste daran.	Y	beste	707	  2,044	0.0127	354.6	german_at_news_2012_00212237
3756	Man will dieses politische Österreich nicht mehr.	Y	politische	708	  2,042	0.0127	161.1429	german_at_news_2012_00669753
3757	Das ist aber heute politische Geschichte.“	Y	politische	708	  2,042	0.0127	205	german_at_news_2012_00176293
3758	Ist das also auch politische Kunst?	Y	politische	708	  2,042	0.0127	240	german_at_news_2012_00615477
3759	Hat sie eine politische Meinung?	Y	politische	708	  2,042	0.0127	285.6	german_at_news_2012_00530059
3760	Danach kommt die politische Entscheidung.	Y	politische	708	  2,042	0.0127	382.8	german_at_news_2012_00149770
3761	Gibt es ein Leben nach dem Tod?	Y	tod	709	  2,038	0.0127	147.8571	german_at_news_2012_00515633
3762	Ob sie auch kurz vor ihrem Tod da war, ist noch nicht klar.	Y	tod	709	  2,038	0.0127	160.7692	german_at_news_2012_00739469
3763	Der Tod ist immer gleich!	Y	tod	709	  2,038	0.0127	222	german_at_news_2012_00262790
3764	NEWS: Und der Tod Ihrer Frau, seiner Mutter?	Y	tod	709	  2,038	0.0127	233.75	german_at_news_2012_00722440
3765	Nach Tod von Kind in Innsbruck.	Y	tod	709	  2,038	0.0127	298.1667	german_at_news_2012_00711222
3766	Vor allem auch für die Opfer war das wichtig.	Y	opfer	710	  2,032	0.0126	149.2222	german_at_news_2012_00910723
3767	Es ist an uns, die Geschichte der Opfer zu schreiben.	Y	opfer	710	  2,032	0.0126	187.4	german_at_news_2012_00460191
3768	Sie sagt: „Ich bin ein Opfer.	Y	opfer	710	  2,032	0.0126	200.3333	german_at_news_2012_00812019
3769	Auch er ein Opfer ohne Wissen.	Y	opfer	710	  2,032	0.0126	208	german_at_news_2012_00066113
3770	NEWS: Zurück bleiben seine vielen Opfer.	Y	opfer	710	  2,032	0.0126	324.8333	german_at_news_2012_00722890
3771	Wenn die Qualität nur so hoch wäre, aber das ist sie nicht.	Y	qualität	711	  2,029	0.0126	142.5833	german_at_news_2012_00938798
3772	Wenn wir jedoch Qualität wollen, so brauchen wir mehr Geld.	Y	qualität	711	  2,029	0.0126	250.6667	german_at_news_2012_00944672
3773	Qualität hat nun mal ihren Preis.	Y	qualität	711	  2,029	0.0126	281.6667	german_at_news_2012_00765628
3774	Diese Qualität hat ihren Preis.	Y	qualität	711	  2,029	0.0126	295	german_at_news_2012_00350015
3775	Mehr Qualität kosten eben auch mehr.	Y	qualität	711	  2,029	0.0126	361.8	german_at_news_2012_00675494
3776	Gibt es da einen Zusammenhang?	Y	zusammenhang	711	  2,029	0.0126	186.2	german_at_news_2012_00515526
3777	Steht das in einem Zusammenhang?	Y	zusammenhang	711	  2,029	0.0126	187	german_at_news_2012_00841829
3778	SCHEUCH: Aber das war ja viel später und in einem anderen Zusammenhang!	Y	zusammenhang	711	  2,029	0.0126	224.5833	german_at_news_2012_00780520
3779	Dieser Bereich sei auch im Zusammenhang mit der Integration zu sehen.	Y	zusammenhang	711	  2,029	0.0126	261.2727	german_at_news_2012_00350277
3780	Diese wird, wenn die Frauen aus dem Ausland kommen, oft mit der Schlepperei in Zusammenhang gebracht, was jedoch nicht immer der Fall ist.	Y	zusammenhang	711	  2,029	0.0126	264.7273	german_at_news_2012_00356905
3781	Es war natürlich die ÖVP, die sich vor allen anderen Sorgen machte.	Y	machte	712	  2,028	0.0126	202.9091	german_at_news_2012_00470714
3782	Es machte ihr nichts aus.	Y	machte	712	  2,028	0.0126	205.4	german_at_news_2012_00465341
3783	Und was machte die Regierung?	Y	machte	712	  2,028	0.0126	205.6	german_at_news_2012_00883484
3784	Was machte die Menschen früher als es noch kein Internet gab?	Y	machte	712	  2,028	0.0126	214.6364	german_at_news_2012_00926837
3785	Tatsächlich machte er es vielen schwer.	Y	machte	712	  2,028	0.0126	339.1667	german_at_news_2012_00848911
3786	Das ist eine wichtige Frage.	Y	wichtige	713	  2,027	0.0126	198.8	german_at_news_2012_00178080
3787	Das wichtige ist aber: man kann reden, man muss aber nicht.	Y	wichtige	713	  2,027	0.0126	210.3333	german_at_news_2012_00205074
3788	Diese Woche wird schließlich eine ganz besonders wichtige für Gusenbauer.	Y	wichtige	713	  2,027	0.0126	237.4	german_at_news_2012_00356992
3789	SPÖ und Grüne würden vergessen, dass es hier um die wichtige Frage der österreichischen Sicherheit geht.	Y	wichtige	713	  2,027	0.0126	268.1875	german_at_news_2012_00838355
3790	Jetzt tut sich aber eine extrem wichtige Frage auf: Was kommt nach den beiden?	Y	wichtige	713	  2,027	0.0126	272.2143	german_at_news_2012_00625805
3791	Am Ende war von bis zu zwei Milliarden Euro zusätzlich die Rede.	Y	zusätzlich	714	  2,025	0.0126	209.5833	german_at_news_2012_00041313
3792	Für 2005 und 2006 stehen zusätzlich insgesamt 125 Millionen EURO zur Verfügung.	Y	zusätzlich	714	  2,025	0.0126	213.6667	german_at_news_2012_00490805
3793	Zusätzlich könnte es aber auch Informationen rund um das neue Apple TV geben.	Y	zusätzlich	714	  2,025	0.0126	227	german_at_news_2012_00994386
3794	Für uns ist es zusätzlich wichtig, ob wir Platz 3 oder Platz 4 erreichen.	Y	zusätzlich	714	  2,025	0.0126	230.4545	german_at_news_2012_00500930
3795	Zusätzlich könnte es auch Informationen rund um das neue Apple TV geben.	Y	zusätzlich	714	  2,025	0.0126	242.6667	german_at_news_2012_00994387
3796	Dies gilt auch für den Bereich der EU-Kommission.	Y	kommission	715	  2,024	0.0126	193.5556	german_at_news_2012_00357674
3797	Auch die Kommission ist mit einem Vertreter dabei.	Y	kommission	715	  2,024	0.0126	247.375	german_at_news_2012_00063910
3798	Grasser: Das kann ich Ihnen nicht erklären, da ich nicht in der Kommission war.	Y	kommission	715	  2,024	0.0126	247.4167	german_at_news_2012_00520313
3799	Die Verhandlungen mit der Kommission seien alles andere als einfach gewesen, so der Finanzminister.	Y	kommission	715	  2,024	0.0126	274.3077	german_at_news_2012_00372091
3800	Eine Entscheidung der Kommission ist für Mai 2012 zu erwarten.	Y	kommission	715	  2,024	0.0126	280.3333	german_at_news_2012_00406488
3801	Hat auf den ersten Blick was für sich.	Y	blick	716	  2,019	0.0125	123	german_at_news_2012_00529561
3802	Das war keine Liebe auf den ersten Blick.	Y	blick	716	  2,019	0.0125	175.125	german_at_news_2012_00204155
3803	Auf den ersten Blick: nichts.	Y	blick	716	  2,019	0.0125	205.6	german_at_news_2012_00074934
3804	Dieses Mal: Der Blick in den Schritt.	Y	blick	716	  2,019	0.0125	237.1429	german_at_news_2012_00354248
3805	Auf den ersten Blick: niemand.	Y	blick	716	  2,019	0.0125	309.4	german_at_news_2012_00074935
3806	Das ist ein großer Erfolg für Österreich.	Y	großer	717	  2,018	0.0125	176	german_at_news_2012_00178168
3807	Er sei ein sehr großer Erfolg gewesen.	Y	großer	717	  2,018	0.0125	225	german_at_news_2012_00443652
3808	Für mich war aber gerade dieser zweite Platz ein großer Erfolg.	Y	großer	717	  2,018	0.0125	230.6364	german_at_news_2012_00499219
3809	Das ist auch unser großer Tag!	Y	großer	717	  2,018	0.0125	260.5	german_at_news_2012_00176633
3810	Mein Projekt war ein großer Erfolg!	Y	großer	717	  2,018	0.0125	339	german_at_news_2012_00677359
3811	In erster Linie habe ich es jedoch für mich selbst gemacht.	Y	erster	718	  2,017	0.0125	231.7273	german_at_news_2012_00599272
3812	Das Wohl der Kinder soll dabei an erster Stelle stehen.	Y	erster	718	  2,017	0.0125	233.3	german_at_news_2012_00206020
3813	Ein erster Schritt in diese Richtung wurde bereits gemacht.	Y	erster	718	  2,017	0.0125	266.7778	german_at_news_2012_00413023
3814	Das ist ein erster Schritt.	Y	erster	718	  2,017	0.0125	271.2	german_at_news_2012_00177963
3815	Für die meisten Kinder und Eltern ihr erster Urlaub in ihrem Leben.	Y	erster	718	  2,017	0.0125	272.5	german_at_news_2012_00495049
3816	So - und nur so muss man heute das Burgenland sehen.	Y	burgenland	719	  2,015	0.0125	143.2222	german_at_news_2012_00831958
3817	Die Steiermark, das Burgenland, Niederösterreich, Wien und Salzburg stehen zur FPÖ.	Y	burgenland	719	  2,015	0.0125	255	german_at_news_2012_00363697
3818	Mit 19 Jahren hat sie das Burgenland verlassen.	Y	burgenland	719	  2,015	0.0125	255.5714	german_at_news_2012_00682654
3819	So heiß, wie in den vergangenen Tagen, war es im April im Burgenland seit 65 Jahren nicht.	Y	burgenland	719	  2,015	0.0125	259	german_at_news_2012_00824099
3820	Es gibt kaum etwas, was der Wissenschaftler nicht über das Burgenland weiß.	Y	burgenland	719	  2,015	0.0125	280.8333	german_at_news_2012_00457355
3821	Und dann bin ich auch am Start!“	Y	start	719	  2,015	0.0125	154.4286	german_at_news_2012_00869353
3822	Jetzt heißt es wieder zurück an den Start.	Y	start	719	  2,015	0.0125	189.875	german_at_news_2012_00624171
3823	Die Österreicher sind schnell am Start.	Y	start	719	  2,015	0.0125	272.1667	german_at_news_2012_00333166
3824	Er hatte einen guten Start.	Y	start	719	  2,015	0.0125	292.8	german_at_news_2012_00437916
